body;score;nb_replies;stickied;author;id;post_title;post_id;post_link
[deleted];1;1;False;;dpcy9cs;Lily Allen turned down 200K in Bitcoins for a gig in 2009 which is worth $1,426,199,000 as of this writing;7aq0fx;https://www.independent.co.uk/arts-entertainment/music/news/lily-allen-calls-herself-an-idiot-for-declining-bitcoin-payment-now-worth-millions-9046211.html
[deleted];2;1;False;;dpd79v8;Lily Allen turned down 200K in Bitcoins for a gig in 2009 which is worth $1,426,199,000 as of this writing;7aq0fx;https://www.independent.co.uk/arts-entertainment/music/news/lily-allen-calls-herself-an-idiot-for-declining-bitcoin-payment-now-worth-millions-9046211.html
"> It's still speculation

No it is not.  By your definition all stock price acquisitions are speculation. 

Investment is understanding the market, and positioning accordingly.   Speculation is simply seeing a trend, and buying into that trend.  I am not a speculator.  I know this, because i know what bitcoin is going to do to the banking industry, which it has just started.  I'm investing in the technology that is disrupting it. ";1;1;False;Frogolocalypse;dpcyfrd;Lily Allen turned down 200K in Bitcoins for a gig in 2009 which is worth $1,426,199,000 as of this writing;7aq0fx;https://www.independent.co.uk/arts-entertainment/music/news/lily-allen-calls-herself-an-idiot-for-declining-bitcoin-payment-now-worth-millions-9046211.html
There was a guy on Reddit that random handed out Bitcoin tips of like 5BTC around 5 years ago. There was a comment section full of huge tips. Even then, that was a lot of money.;5;0;False;eyal0;dpcz318;Lily Allen turned down 200K in Bitcoins for a gig in 2009 which is worth $1,426,199,000 as of this writing;7aq0fx;https://www.independent.co.uk/arts-entertainment/music/news/lily-allen-calls-herself-an-idiot-for-declining-bitcoin-payment-now-worth-millions-9046211.html
What do you mean bit by bit? ;1;0;False;EpicWott;dpdvbdz;Lily Allen turned down 200K in Bitcoins for a gig in 2009 which is worth $1,426,199,000 as of this writing;7aq0fx;https://www.independent.co.uk/arts-entertainment/music/news/lily-allen-calls-herself-an-idiot-for-declining-bitcoin-payment-now-worth-millions-9046211.html
One billion bit by bit? Even your grandchildern won't have time to cash it out in thier life time;2;0;False;Roam-man;dpdjmxd;Lily Allen turned down 200K in Bitcoins for a gig in 2009 which is worth $1,426,199,000 as of this writing;7aq0fx;https://www.independent.co.uk/arts-entertainment/music/news/lily-allen-calls-herself-an-idiot-for-declining-bitcoin-payment-now-worth-millions-9046211.html
If only that were true. I have several 100 trillion zim dollar notes. I could pay off the US national debt and that of all EU meber states and still have shitloads of money left.;1;0;False;tinus42;dpdc0vu;Lily Allen turned down 200K in Bitcoins for a gig in 2009 which is worth $1,426,199,000 as of this writing;7aq0fx;https://www.independent.co.uk/arts-entertainment/music/news/lily-allen-calls-herself-an-idiot-for-declining-bitcoin-payment-now-worth-millions-9046211.html
That kind of proves my point. You couldn't cash out the entire daily liquidity of the bitcoin market at once without destroying the price you'd get. A long-term drawdown would probably work, over a year or so.;1;0;False;slash196;dpdnqj4;Lily Allen turned down 200K in Bitcoins for a gig in 2009 which is worth $1,426,199,000 as of this writing;7aq0fx;https://www.independent.co.uk/arts-entertainment/music/news/lily-allen-calls-herself-an-idiot-for-declining-bitcoin-payment-now-worth-millions-9046211.html
"> Do you think both people and governments will embrace bitcoin, and does it matter? 

I think it is unavoidable.  I also don't think it is going to be resisted quite as much as people think it will be.  People still need to pay their taxes, and that is not going to stop.  The main thing it is going to do is prick the bubble of consumer debt, and remove the banking middle-men from that space.  That alone is a multi-trillion dollar industry, let alone the annuities that banks own and graft from, from those assets.  Removing these people (i.e. banking debt suppliers) from positions of power, by strangling their access to capital, is a justification for bitcoin in its own right.  Imagine a world in which banks didn't control governments.  

Said [here](https://www.reddit.com/r/Bitcoin/comments/7adetn/consumers_are_wrongly_perceiving_bitcoin_as_a/dp9cwby/), mostly I think bitcoin will finally separate the good debt from the bad debt. It is my personal belief ( as in i don't know of any formal theory ) that debt should only be incurred for the use of building a productive asset. In a deflationary currency, this encourages businesses to ensure that productivity increases will have greater returns than savings. Instead, our financial system has encouraged the acquisition of debt for fixed assets. The only thing this has done is bid up the price of those fixed debts with debt, and handed over the money for supporting that system to banks and their owners. In order to stimulate growth in such a system, the only way that you can function is to tax savings. That's what inflation is.  What it forces people to do is to invest in increasingly risky assets, because of the loss of their purchasing power.  Hence bubble after bubble after bubble.  Crisis after crisis after crisis.

Bitcoin will eventually stabilize to an ever appreciating value asset. But what it will allow you to do is save for a house. If you have a business proposal that encourages people to pay you for a good or service, people will invest their savings in it and take on that risk.  Banks will instead move back to providing capital to businesses, using savings from people that are willing to invest.  Businesses will again focus on productivity increases, because that's how you get access to capital.

That's the way it is supposed to work i think.  Like I said, it is pure genius.";1;1;False;Frogolocalypse;dpd61ko;Lily Allen turned down 200K in Bitcoins for a gig in 2009 which is worth $1,426,199,000 as of this writing;7aq0fx;https://www.independent.co.uk/arts-entertainment/music/news/lily-allen-calls-herself-an-idiot-for-declining-bitcoin-payment-now-worth-millions-9046211.html
Lmao, why did you even waste time typing??;0;1;False;theorymeltfool;dpd5dy8;Lily Allen turned down 200K in Bitcoins for a gig in 2009 which is worth $1,426,199,000 as of this writing;7aq0fx;https://www.independent.co.uk/arts-entertainment/music/news/lily-allen-calls-herself-an-idiot-for-declining-bitcoin-payment-now-worth-millions-9046211.html
Few people knew how to do that back then. The layman doesn't know how to do that now. ;1;0;False;Baconlawlz;dpcwrvr;Lily Allen turned down 200K in Bitcoins for a gig in 2009 which is worth $1,426,199,000 as of this writing;7aq0fx;https://www.independent.co.uk/arts-entertainment/music/news/lily-allen-calls-herself-an-idiot-for-declining-bitcoin-payment-now-worth-millions-9046211.html
"Video linked by /u/ucandoitBFX:

Title|Channel|Published|Duration|Likes|Total Views
:----------:|:----------:|:----------:|:----------:|:----------:|:----------:
[Bitcoin for Beginners](https://youtube.com/watch?v=UlKZ83REIkA)|aantonop|2017-03-04|0:29:52|1,224+ (96%)|111,312

> This is the first part of a talk which took place on...

---

[^Info](https://np.reddit.com/r/youtubot/wiki/index) ^| [^/u/ucandoitBFX ^can ^delete](https://np.reddit.com/message/compose/?to=_youtubot_&subject=delete\%20comment&message=dpdbhtz\%0A\%0AReason\%3A\%20\%2A\%2Aplease+help+us+improve\%2A\%2A) ^| ^v2.0.0";1;0;False;_youtubot_;dpdbhtz;Lily Allen turned down 200K in Bitcoins for a gig in 2009 which is worth $1,426,199,000 as of this writing;7aq0fx;https://www.independent.co.uk/arts-entertainment/music/news/lily-allen-calls-herself-an-idiot-for-declining-bitcoin-payment-now-worth-millions-9046211.html
[deleted];1;1;False;;dpd56y3;Lily Allen turned down 200K in Bitcoins for a gig in 2009 which is worth $1,426,199,000 as of this writing;7aq0fx;https://www.independent.co.uk/arts-entertainment/music/news/lily-allen-calls-herself-an-idiot-for-declining-bitcoin-payment-now-worth-millions-9046211.html
I have a 10 trillion note if you need one;1;0;False;Imindless;dpddqdd;Lily Allen turned down 200K in Bitcoins for a gig in 2009 which is worth $1,426,199,000 as of this writing;7aq0fx;https://www.independent.co.uk/arts-entertainment/music/news/lily-allen-calls-herself-an-idiot-for-declining-bitcoin-payment-now-worth-millions-9046211.html
you cant sell more than $100k of bitcoins without moving the market. moment someone sells that much, price starts plummeting. bitcoin is illiquid as shit. DO NOT TRUST IT. also chock a block with corruption, russian  and mob money.;-1;1;False;worthytooth;dpctlvz;Lily Allen turned down 200K in Bitcoins for a gig in 2009 which is worth $1,426,199,000 as of this writing;7aq0fx;https://www.independent.co.uk/arts-entertainment/music/news/lily-allen-calls-herself-an-idiot-for-declining-bitcoin-payment-now-worth-millions-9046211.html
An article that has been debunked over and over again.;1;0;False;rydan;dpcv2uu;Lily Allen turned down 200K in Bitcoins for a gig in 2009 which is worth $1,426,199,000 as of this writing;7aq0fx;https://www.independent.co.uk/arts-entertainment/music/news/lily-allen-calls-herself-an-idiot-for-declining-bitcoin-payment-now-worth-millions-9046211.html
I think most people are okay with that. The concept has more to do with blockchain in that regard than currency. In the meantime, store of value is enough. At least, enough in the sense that people are starting to pay attention. ;1;0;False;DeusExChimera;dpd7kf0;Lily Allen turned down 200K in Bitcoins for a gig in 2009 which is worth $1,426,199,000 as of this writing;7aq0fx;https://www.independent.co.uk/arts-entertainment/music/news/lily-allen-calls-herself-an-idiot-for-declining-bitcoin-payment-now-worth-millions-9046211.html
 Yes.  But this wasnt that.  There are plenty of people  here highlighting their failure to recognize an opportunity that many have seen.   This is hindsight is 20/20.  Similar, but not the same.  Understanding the effect of the internet  isn't confirmation bias.  But it is 20/20 hindsight. ;1;1;False;Frogolocalypse;dpcyidt;Lily Allen turned down 200K in Bitcoins for a gig in 2009 which is worth $1,426,199,000 as of this writing;7aq0fx;https://www.independent.co.uk/arts-entertainment/music/news/lily-allen-calls-herself-an-idiot-for-declining-bitcoin-payment-now-worth-millions-9046211.html
No, i've made stupid returns off bitcoin but this is the sub that should know better than anyone, and instead half of these fucks go full cult mode rather than openly accepting the risks and benefits of the state of things;1;0;False;nickmarx12345678;dpdcgt6;Lily Allen turned down 200K in Bitcoins for a gig in 2009 which is worth $1,426,199,000 as of this writing;7aq0fx;https://www.independent.co.uk/arts-entertainment/music/news/lily-allen-calls-herself-an-idiot-for-declining-bitcoin-payment-now-worth-millions-9046211.html
"Not really.
Bitcoin is actually valuable because you can trace it from the first time it was mint and all the owners of it till now
Thatâ€™s how the blockchain works and why we know for certain that there will be 21 million bitcoin forever and not one more.
The value comes from the fact that you can send money everywhere in the world without permission from any government. 
No agency can stop a bitcoin transaction, they would have to bring down the internet.";1;0;False;MissTress23;dpcypd8;Lily Allen turned down 200K in Bitcoins for a gig in 2009 which is worth $1,426,199,000 as of this writing;7aq0fx;https://www.independent.co.uk/arts-entertainment/music/news/lily-allen-calls-herself-an-idiot-for-declining-bitcoin-payment-now-worth-millions-9046211.html
"The easiest way to see this is to note that Lily Allen was right to tell the guys with Linden dollars to fuck off.

Does that make her an investment genius? No. In the same way that telling someone to fuck off with bitcoin in the past doesn't say anything other than what we know - that no one can predict the future.

See? Anything you think you knew about bitcoin's price was just wishful thinking and if you decided that the price rising meant that you were right then you're deluded. Similarly anything you think you know now about the future of it is just delusion.";1;1;False;;dpcuett;Lily Allen turned down 200K in Bitcoins for a gig in 2009 which is worth $1,426,199,000 as of this writing;7aq0fx;https://www.independent.co.uk/arts-entertainment/music/news/lily-allen-calls-herself-an-idiot-for-declining-bitcoin-payment-now-worth-millions-9046211.html
[deleted];1;1;False;;dpcuc4p;Lily Allen turned down 200K in Bitcoins for a gig in 2009 which is worth $1,426,199,000 as of this writing;7aq0fx;https://www.independent.co.uk/arts-entertainment/music/news/lily-allen-calls-herself-an-idiot-for-declining-bitcoin-payment-now-worth-millions-9046211.html
"> Moneys unit value is not logarithmic. 20 dollars is double 10 dollars as much as 2000 dollars is double 1000.

This is the entire point of a logarithmic scale.  To show that a move of 10 to 20 is the same kind of move as 100 to 200 or 1000 to 2000.

> Day to day trading volatility is not what I was talking about. If I'm going to be technical what I should have said is directional movement.

Now you're just changing the goalposts because you were wrong.  Seriously, I'm don't think I'm going to bother replying to this thread after this one unless you can start making some coherent points.

> Bitcoin has no more fundamental value than any other cryptocurrency that is based on exactly the same technology.

Yes it does.  It has the most accumulated proof of work and the largest/most distributed network.  These are the fundamental aspects that make it valuable.  You can copy bitcoin and start the exact same technology from scratch and it will be worthless beside bitcoin because of this.  Don't assume that all of the value of a piece of software comes from its code and is therefore easily replicable.

> bitcoin being deflationary guarantees it will never become adopted as a mainstream currency. No one ever wants to spend deflationary currencies because they keep increasing in value.

This is such an idiotic argument that is spouted far too often, even by those who should know better.  I spend bitcoin often and other people would as well.  Why? Because I want stuff.  I need food in my belly and a roof over my head.  I want a nice car.  I want to go on interesting holidays with my wife and children.  Basically, I want to live my life.  Doing this takes money.  So yes, I could save it up longer and watch the value grow, but then I'll die rich and unhappy, having never done anything with my money.

Inflationary currencies are said to encourage spending, but what they really do is encourage *wasting* money on things that people don't really want/need because their money won't buy as much tomorrow as it does today.  Deflationary systems do indeed discourage spending, but it's not going to stop people buying the things they need and indeed the things they *really* want.";0;1;False;dalebewan;dpe4q7w;Lily Allen turned down 200K in Bitcoins for a gig in 2009 which is worth $1,426,199,000 as of this writing;7aq0fx;https://www.independent.co.uk/arts-entertainment/music/news/lily-allen-calls-herself-an-idiot-for-declining-bitcoin-payment-now-worth-millions-9046211.html
McDonald's isn't one of them. ;2;1;False;Frogolocalypse;dpctw1c;Lily Allen turned down 200K in Bitcoins for a gig in 2009 which is worth $1,426,199,000 as of this writing;7aq0fx;https://www.independent.co.uk/arts-entertainment/music/news/lily-allen-calls-herself-an-idiot-for-declining-bitcoin-payment-now-worth-millions-9046211.html
Mind explaining what fiat currencies value has been tied to since leaving the silver standard?;1;0;False;Pink_pez;dpctjlf;Lily Allen turned down 200K in Bitcoins for a gig in 2009 which is worth $1,426,199,000 as of this writing;7aq0fx;https://www.independent.co.uk/arts-entertainment/music/news/lily-allen-calls-herself-an-idiot-for-declining-bitcoin-payment-now-worth-millions-9046211.html
"It was several hundred per back then, around the time of the 1k spike. Having children tends to kill the disposable cash flow.
I was a dumbshit for not periodically checking the price after that. In my own defense though, I was preoccupied starting up several businesses & building a home. ";2;0;False;Heph333;dpdocg3;Lily Allen turned down 200K in Bitcoins for a gig in 2009 which is worth $1,426,199,000 as of this writing;7aq0fx;https://www.independent.co.uk/arts-entertainment/music/news/lily-allen-calls-herself-an-idiot-for-declining-bitcoin-payment-now-worth-millions-9046211.html
">In that sense, it's a better investment.

It's potentially more profitable, but its also potentially more ruinous. That makes it a better gamble, not an investment. It's just a different kind of investment. There is no way to get extremely high returns without high risk. If you want to invest money you need to diversify between high risk and return and low risk and return. If you want to gamble then keeping everything in high risk assets like bitcoin.

Bitcoin has sextupled in the last 6 months which is obviously not a sustainable rate of growth.

> A change will have to be made eventually (IMO removing the 21 million cap and just having a small block reward pay out indefinitely to make up for lost coins and increasing population), before it's useable as currency (or usable as more than a novelty as it is now).

Bitcoin miners are going to have no incentive to vote this through though, even though its whats best for use as a currency. They didn't invest millions in mining equipment with dreams of making a small steady income off transaction fees.

They got in because early adoption offered huge rewards in an artificially scarce asset undergoing a speculative bubble. Transaction fees are a tiny percentage of what they have made from rapid appreciation of bitcoins.

There will be a strong incentive to switch to new up and coming coins that are offering the same early-adopter rewards that bitcoin did.

It's one of the problems with Bitcoins ""decentralization"". It's still heavily reliant on a small group of people who have a huge amount of influence over the currency. Bitcoin can't work without centralized computer power, so they're held captive by the miners to a great extent. If miners move to another currency then users have no choice but to follow because you can't functionally trade bitcoin P2P.";1;1;False;suninabox;dpdoaou;Lily Allen turned down 200K in Bitcoins for a gig in 2009 which is worth $1,426,199,000 as of this writing;7aq0fx;https://www.independent.co.uk/arts-entertainment/music/news/lily-allen-calls-herself-an-idiot-for-declining-bitcoin-payment-now-worth-millions-9046211.html
Simply put - a miner is an accountant. Makes sure the transactions all agree. More about it here-  https://bitcoin.org/bitcoin.pdf;3;1;False;wanttoplayagain;dpcrzor;Lily Allen turned down 200K in Bitcoins for a gig in 2009 which is worth $1,426,199,000 as of this writing;7aq0fx;https://www.independent.co.uk/arts-entertainment/music/news/lily-allen-calls-herself-an-idiot-for-declining-bitcoin-payment-now-worth-millions-9046211.html
[deleted];1;1;False;;dpcxlsw;Lily Allen turned down 200K in Bitcoins for a gig in 2009 which is worth $1,426,199,000 as of this writing;7aq0fx;https://www.independent.co.uk/arts-entertainment/music/news/lily-allen-calls-herself-an-idiot-for-declining-bitcoin-payment-now-worth-millions-9046211.html
Not sure to be honest. All I know is I got charged 4$ on a 40$ transaction. Thatâ€™s just mad;1;0;False;AMBsFather;dpcsit3;Lily Allen turned down 200K in Bitcoins for a gig in 2009 which is worth $1,426,199,000 as of this writing;7aq0fx;https://www.independent.co.uk/arts-entertainment/music/news/lily-allen-calls-herself-an-idiot-for-declining-bitcoin-payment-now-worth-millions-9046211.html
Well I think you know the answer and I think you can distinguish between a real finite thing and a cryptocurrency ;1;1;False;fandongpai;dpcseot;Lily Allen turned down 200K in Bitcoins for a gig in 2009 which is worth $1,426,199,000 as of this writing;7aq0fx;https://www.independent.co.uk/arts-entertainment/music/news/lily-allen-calls-herself-an-idiot-for-declining-bitcoin-payment-now-worth-millions-9046211.html
"> Everyone seems to be aware that the more acceptance bitcoin gets, the greater the value

If that were true these people would all be buying dollars.

> I personally think we're already at a point where the value of bitcoin is almost (but still not quite) large enough for it to be a 'safe' investment

Oh come off it. The higher it gets the far more likely people will dump it to take their profit. At which point it's likely to drop, possibly to dive if people panic.

";2;0;False;;dpct3cv;Lily Allen turned down 200K in Bitcoins for a gig in 2009 which is worth $1,426,199,000 as of this writing;7aq0fx;https://www.independent.co.uk/arts-entertainment/music/news/lily-allen-calls-herself-an-idiot-for-declining-bitcoin-payment-now-worth-millions-9046211.html
So the total value of all BTC is worth about 1.5 Lily Allen concerts, got it.;0;0;False;jaspersgroove;dpd2thq;Lily Allen turned down 200K in Bitcoins for a gig in 2009 which is worth $1,426,199,000 as of this writing;7aq0fx;https://www.independent.co.uk/arts-entertainment/music/news/lily-allen-calls-herself-an-idiot-for-declining-bitcoin-payment-now-worth-millions-9046211.html
That sucks. Keep your head up. It happens. You can always try again!;3;1;False;Esmesqualor;dpd3xwb;Lily Allen turned down 200K in Bitcoins for a gig in 2009 which is worth $1,426,199,000 as of this writing;7aq0fx;https://www.independent.co.uk/arts-entertainment/music/news/lily-allen-calls-herself-an-idiot-for-declining-bitcoin-payment-now-worth-millions-9046211.html
"I guess by real you mean you can hold it in your hand? If you think that provides value then I can't argue against that. There are lots of worthless physical things though, so it's definitely not enough.

Bitcoin is 100% finite unless enough people agreed that it should not be. Value retention is a pretty big incentive to not change that, but maybe there will be mutually a beneficial reason to do so in the future. It would need to be beneficial to a majority of the network participants though.

It could also be an alternative to gold, but you'll disagree due to there not being a physical representation. It also may not provide value to you, living in a developed nation, as an alternative currency, but it does for those in underdeveloped nations.";1;0;False;SexyAndImSorry;dpctvvm;Lily Allen turned down 200K in Bitcoins for a gig in 2009 which is worth $1,426,199,000 as of this writing;7aq0fx;https://www.independent.co.uk/arts-entertainment/music/news/lily-allen-calls-herself-an-idiot-for-declining-bitcoin-payment-now-worth-millions-9046211.html
"Bitcoin exchanges are very difficult to trace. As long as that is true it will have utility for tax free wealth storage and illegal transactions.

No other currency offers that or stock offers that. Its not going away.";1;0;False;Trapped_SCV;dpcrr8y;Lily Allen turned down 200K in Bitcoins for a gig in 2009 which is worth $1,426,199,000 as of this writing;7aq0fx;https://www.independent.co.uk/arts-entertainment/music/news/lily-allen-calls-herself-an-idiot-for-declining-bitcoin-payment-now-worth-millions-9046211.html
[deleted];1;1;False;;dpd3255;Lily Allen turned down 200K in Bitcoins for a gig in 2009 which is worth $1,426,199,000 as of this writing;7aq0fx;https://www.independent.co.uk/arts-entertainment/music/news/lily-allen-calls-herself-an-idiot-for-declining-bitcoin-payment-now-worth-millions-9046211.html
"> You obviously donâ€™t understand why itâ€™s overvalued 

 No.  You don't understand why it is undervalued.  Because you dont actually even understand the theory behind it, nor the genius of its implementation.  And that's fine.  No one is forcing you to understand. I'm sure you will live a good life not doing so.  I mean seriously, you're commenting on a technology you don't even understand the basics of. 

But the people who do understand?  We are simply seeing the natural progression of its design being realized as planned.  Like i said, this technology is pure genius. ";1;1;False;Frogolocalypse;dpcw8sk;Lily Allen turned down 200K in Bitcoins for a gig in 2009 which is worth $1,426,199,000 as of this writing;7aq0fx;https://www.independent.co.uk/arts-entertainment/music/news/lily-allen-calls-herself-an-idiot-for-declining-bitcoin-payment-now-worth-millions-9046211.html
"Don't listen to this guy he's just trying to put you off so he makes all the profit for himself!

Sell everything you own (yes, put your grandmother on ebay)  
Buy bitcoin  
Profit!";1;0;False;;dpcstj5;Lily Allen turned down 200K in Bitcoins for a gig in 2009 which is worth $1,426,199,000 as of this writing;7aq0fx;https://www.independent.co.uk/arts-entertainment/music/news/lily-allen-calls-herself-an-idiot-for-declining-bitcoin-payment-now-worth-millions-9046211.html
