body;score;nb_replies;stickied;author;id;post_title;post_id;post_link
"Welcome /r/all!

Edit: **9000** upvotes! META.

Edit **40,000** upvotes.... MEME MAGIC IS REAL. 

The crypto currency known as Bitcoin has hit an all time high of $9000! 

Alternatively: 1 mBTC (MilliBitcoin) is over $9.


[The 9000 joke/reference.](https://www.youtube.com/watch?v=SiMHTK15Pik) 

[What is Bitcoin?](https://www.youtube.com/watch?v=Gc2en3nHxA4)

[Why is Bitcoin worth $9,000?](https://www.reddit.com/r/Bitcoin/comments/7fkqh5/its_over_9000/dqckb7f/) via /u/varigance

If you'd like to know more about Bitcoin please check out our sidebar or look around our community. 
";1;31;True;gonzobon;dqckgkk;It's over 9000!!!;7fkqh5;https://i.imgur.com/jyoZGyW.gifv
"The problem with trusting the value of Bitcoins is that there's very little difference between it and any of the competitors, other than user base. That includes traditional banking, which have a hell of a lot more resources than the developers of Bitcoin, and who will lower the cost of transactions if ever Bitcoins become a competitive threat.

I mean, bully for Bitcoin if that happens and money becomes more liquid, but isn't the energy cost of updating the blockchain on everyone's computer going to make using Bitcoin environmentally damaging? Do you really think the currency is actually valuable, or is it just propped up by other speculators, some of whom might even be buying it back and forth?";3;1;False;ryanznock;dqd69ls;It's over 9000!!!;7fkqh5;https://i.imgur.com/jyoZGyW.gifv
Did you realize your savings in another currency or do you calculate it through the current exchange rate? I’m curious. Because there is nothing that says that this could not crash instantly when people start selling, triggering an avalanche effect and effectively crashing the whole currency.;2;1;False;Farull;dqd957j;It's over 9000!!!;7fkqh5;https://i.imgur.com/jyoZGyW.gifv
Id say its even better in EU. Sepa transactions are cheaper. If you are only gonna spend usd 100 you can pay with visa (the fee is really high with visa though);7;0;False;;dqcrcbi;It's over 9000!!!;7fkqh5;https://i.imgur.com/jyoZGyW.gifv
You dont have to buy a whole coin. You can spend as much or little as you want.;3;0;False;dpistachio;dqcuhl3;It's over 9000!!!;7fkqh5;https://i.imgur.com/jyoZGyW.gifv
Kraken.com is decent exchange. And you absolutely can spend $100 to buy s fractional amount of bitcoin. I do recommend you to read the stuff in the didebar first though to get an idea about how wallets work, how to get your btc out of an exchange and why you shouldnt keep your money at exchanges all the time.;0;1;False;keymone;dqcul0o;It's over 9000!!!;7fkqh5;https://i.imgur.com/jyoZGyW.gifv
Try btcmarkets.net or plus500;3;0;False;chibstelford;dqcua1d;It's over 9000!!!;7fkqh5;https://i.imgur.com/jyoZGyW.gifv
"i regret not caring about what seemed to be a small amount of coin back in the day. 

the thing is, we can’t just continue to dwell on the past. let’s buy up some of that coin and become those rich people with hundreds of thousands in btc profit";130;1;False;hentaikushdragon;dqcn1t6;It's over 9000!!!;7fkqh5;https://i.imgur.com/jyoZGyW.gifv
[deleted];7;1;False;;dqcnqzv;It's over 9000!!!;7fkqh5;https://i.imgur.com/jyoZGyW.gifv
"Is there an easy way to transfer from Coinbase to GDAX? There also doesn't seem to be a mobile app for buying and trading through GDAX, unless I'm missing something (which I know I am)?

I really like the simplicity of the Coinbase experience, but clearly it's stupid to pay those fees if it's not necessary.";1;2;False;codq;dqd1td2;It's over 9000!!!;7fkqh5;https://i.imgur.com/jyoZGyW.gifv
just do it now and you won't have regrets in a year;3;0;False;987654321234567;dqcpg44;It's over 9000!!!;7fkqh5;https://i.imgur.com/jyoZGyW.gifv
I had a few btc last year spent around $2000 on pc parts and audio equipment from newegg. I'm a bit salty looking how much that btc would have been worth now. Only have .037 btc left. ;3;0;False;joe4553;dqcpxi3;It's over 9000!!!;7fkqh5;https://i.imgur.com/jyoZGyW.gifv
At least you didn’t buy bitcoin for a grand about 3 years ago, and put it all into light coin when it was hot. Lost so much back then. ;2;0;False;Wookie301;dqcs9ah;It's over 9000!!!;7fkqh5;https://i.imgur.com/jyoZGyW.gifv
"If you have 1 whole bitcoin you'll be very wealthy indeed.

But that club is getting harder and harder to join.";2;0;False;HasCatsFearsForLife;dqcnk24;It's over 9000!!!;7fkqh5;https://i.imgur.com/jyoZGyW.gifv
"People we're saying this exact shit after they sold for $70. At one point (2011, I think) a guy auctioned 10,000 bitcoins for $50 and nobody bought them.

 There's still room for growth, something this revolutionary doesn't just stop at $9,000.";1;0;False;faceballb4t;dqcrxtn;It's over 9000!!!;7fkqh5;https://i.imgur.com/jyoZGyW.gifv
I wouldn't invest too much into it though, China has been keen on trying to shut down it's mining operations, which are the largest of any country (I've heard that around 60% of all bitcoin is mined in China, but don't take my word for it). If that happens, the market will certainly feel the wrath of it.;9;2;False;ThatSmallFighter;dqcn7c3;It's over 9000!!!;7fkqh5;https://i.imgur.com/jyoZGyW.gifv
You people make me sick;5;1;False;idontcareforkarma;dqcnyus;It's over 9000!!!;7fkqh5;https://i.imgur.com/jyoZGyW.gifv
I wouldn't call that a dip. In 2013 BTC crashed and went bear for a while. ;4;0;False;newtonreddits;dqcpaxx;It's over 9000!!!;7fkqh5;https://i.imgur.com/jyoZGyW.gifv
Well yeah, at that point it was worth probably a million plus Bitcoin :P;2;0;False;;dqd61u3;It's over 9000!!!;7fkqh5;https://i.imgur.com/jyoZGyW.gifv
Holy shit lol didn't see that ending coming. This must be sorta like how people who didn't invest in apple felt.;3;0;False;slamdog109;dqcpvke;It's over 9000!!!;7fkqh5;https://i.imgur.com/jyoZGyW.gifv
I'm ridiculed by almost everyone i know IRL for having bitcoins. i dont even know what to say anymore... sorry for making a ton of money, want to join in like I've suggested since 2013? ;10;0;False;Mines_of_Moria;dqcmbk6;It's over 9000!!!;7fkqh5;https://i.imgur.com/jyoZGyW.gifv
Don't tell me how to live my life.;0;0;False;HubbaMaBubba;dqckdae;It's over 9000!!!;7fkqh5;https://i.imgur.com/jyoZGyW.gifv
I'd say if you were talking about 2012 when total bitcoins were worth only 10's of millions you'd be correct, but in 2017 bitcoins are worth over $140 billion, mostly from speculation and store of value.;1;0;False;Bits4Tits;dqd24pd;It's over 9000!!!;7fkqh5;https://i.imgur.com/jyoZGyW.gifv
"Not OP, but I can answer.

It's the largest and oldest. Now this may seem like a logical fallacy at first whiff, but what it means is that BTC is anti-fragile. A currency and/or store of value must be resilient and secure, above all else. 

BTC has clawed back from 5 or so major crashes in value, each time the trough was higher than the previous peak. It has also fought off several contentious hard forks that can be considered hostile takeovers for all intents and purposes. 

This also means that in the past 8 years, no major fault has been found and exploited in the software. People can count on Bitcoin. 

And in being the largest coin, Bitcoin attracts the best developers. It's always been an open source project, and development continues to grow, with exciting second-level technologies on the horizon like Lightning Network and Schnorr Signatures. These will allow Bitcoin to scale to larger and larger throughputs.";14;2;False;TJ11240;dqcl4hg;It's over 9000!!!;7fkqh5;https://i.imgur.com/jyoZGyW.gifv
"I might get downvoted for saying this on a bitcoin sub, but as of right now bitcoin isn't a great option for any use other than holding it as a 'digital gold'. The main problem with BTC atm is the amount of transactions that come with BTC getting more mainstream is far more than original system was designed to handle. The 1mb block size can contain only about 1000 tx's per block. Because of this, essentially to pay miners a fee to include your tx in their block. With larger amounts, this is less of a problem because the fee will be naturally be large. But if you try to send $5 in bitcoin to pay for a meal, you will pay $4 to the miners as a fee to include your tx in their block. in short, it is incredibly expensive to move BTC around but holding it in  one wallet is obviously paying dividends right now. 

 The main proponent that bitcoin has is first mover advantage. Essentially, the problems that bitcoin has won't matter in the long run because of how known/sought after bitcoin is right now. It is the oldest crypto and probably the most profitable to own long term. This coupled with the fact that it is the only way to buy most other cryptos means that it is here to stay.

If you are interested in learning more about other Cryptos that don't struggle with these problems, then I suggest reading up on /r/CryptoCurrency ";38;6;False;kars4kidz;dqclumx;It's over 9000!!!;7fkqh5;https://i.imgur.com/jyoZGyW.gifv
More liquidity and more security ;3;0;False;ztsmart;dqcloxv;It's over 9000!!!;7fkqh5;https://i.imgur.com/jyoZGyW.gifv
"Bitcoin has survived everything that has been thrown at it for just about a decade now. Bitcoin has pedigree, it has a proven reputation of security, and it is the premier store of wealth. Not to mention it is crypto reserve, is the most widely used and recognised globally, has a very solid road map ahead to become much cheaper and faster, more private, and flexible enough for Bitcoin powered smart contracts. It also has the biggest user and developer community by far. 

All these other competing cryptos don't stand a chance once Bitcoin undergoes a few more protocol upgrades which will be happening sooner than we think. Pay no mind to temporarily expensive transactions, they're being fully addressed in the lightning network upgrade. 

And I haven't even mentioned the secret sauce... Vires in Numeris!

";3;0;False;New_Dawn;dqcpv0e;It's over 9000!!!;7fkqh5;https://i.imgur.com/jyoZGyW.gifv
Transparency, security, developing processes, hashpower, most marketcap, proven inmmutability, most decentralized, best scaling strategy, maturity...;2;0;False;jaumenuez;dqcp2z0;It's over 9000!!!;7fkqh5;https://i.imgur.com/jyoZGyW.gifv
[removed];2;1;False;;dqcmqc6;It's over 9000!!!;7fkqh5;https://i.imgur.com/jyoZGyW.gifv
Bitcoin are the gold standard of cryptocurrency that all the rest are based on;3;2;False;nemo1080;dqcmib5;It's over 9000!!!;7fkqh5;https://i.imgur.com/jyoZGyW.gifv
"> But can you please explain to me why bitcoin is the best option out of all other crypto currencies currently?

The most robust development team combined with first mover network effects. Adam Back the creator of hashcash, credited by Satoshi in the Bitcoin white paper as the backbone for bitcoins proof of work system runs a company named blockstream that pays the salaries of open source Bitcoin developers. There are more heavy hitter cryptographers working for Bitcoin than any other crypto. These people are on the forefront of creating new technologies that will allow such a complex decentralized system to maximize it's potential.

That's not to say there is not talent elsewhere in the field, there definitely is, cryptocurrencies are a hot new industry that is attractive to developers and math academics. 

Nick Szabo, also cited in the white paper is a major Bitcoin proponent and proselytizes about the power of ethereums smart contracts. But ETH is very different from BTC, they are experimenting with a new proof of stake system to go away from mining in 2018 ...it's a risky endeavor that has large upsides if it succeeds.  The downside to eth is the massive amount of currency it has minted, making it not nearly as scarce as Bitcoin. If Bitcoin is gold, eth is copper (still quite valuable).

There are other promising cryptocurrencies like Dash Monero and zcash that offer greater privacy guarantees over what Bitcoin currently offers which means that they do have a fundamental advantage over Bitcoin in terms of fungibility. The best of these in that the system that provides the best cryptographic guarantees is Monero. The problem with Monero is in order to offer the Privacy guarantees it requires much more in terms of resources for storing it's blockchain.

The problem with all decentralized currencies is that the more resources they require the more centralizing effects that occur on the nodes that must carry the blockchain data. Monero is going to be massively larger than Bitcoin. If it takes 10 terabytes to store the data on a node then you're not going to have average people running nodes and if you don't have average people running nodes then it's not really decentralized.

The great thing about Bitcoin is that it can adopt and mold itself after all of these improvements created by other coins to a certain extent. Take rootstock for example which is launching in a few weeks which will allow ethereum style contracts on the Bitcoin Network.

And there was a new paper released by some Bitcoin developers that demonstrated a new type of proof that will allow the blinding of amounts sent on the public Ledger. Combining this now proof system with already existing coinjoin mixing technologies will allow people to increase privacy. Once the Bitcoin network is upgraded to a upcoming feature called MAST and schnorr signatures we will see these types of privacy transactions be incredibly cost and resource efficient and also look exactly like normal transaction so it is impossible to distinguish which transaction is attempting to maximize privacy.

 So the two biggest selling points of ethereum and other privacy enhanced cryptos like Montero Dash and zcash will be features integrated into Bitcoin, likely 2018. This fact combined with the most advanced development team and continued first-mover Advantage is what makes Bitcoin pretty darn Bulletproof. Also consider that Bitcoin has the strongest proof of work security by very very very far.";1;0;False;Cryptolution;dqd1ez3;It's over 9000!!!;7fkqh5;https://i.imgur.com/jyoZGyW.gifv
A competent Dev team that takes security seriously.;1;0;False;MakeTotalDestr0i;dqd3r0n;It's over 9000!!!;7fkqh5;https://i.imgur.com/jyoZGyW.gifv
It's not. It's the gatekeeper. You have to go through it to get to the other coins. That's the only reason it's still relevant. ;0;0;False;Earthboom;dqcm06z;It's over 9000!!!;7fkqh5;https://i.imgur.com/jyoZGyW.gifv
While /u/etan_ashman has a point about it's inability to effect BTC itself, there are a few strong arguments as to how harming net neutrality will also harm cryptocurrency. The most straightforward one being that if they can throttle bandwidth and charge more to allow you to access or use exchanges, or even more importantly throttle miners directly, that'd be a *huge* blow to the American crypto market, which certainly isn't an insubstantial portion of the total cryptocurrency market cap.;6;2;False;Mausoleum-Monger;dqcnooc;It's over 9000!!!;7fkqh5;https://i.imgur.com/jyoZGyW.gifv
I doubt it. Bitcoin is globally decentralised, the Net Neutrality debate we keep hearing about is only happening in one country;3;0;False;etan_ashman;dqcn18y;It's over 9000!!!;7fkqh5;https://i.imgur.com/jyoZGyW.gifv
Yes, but don't panic if it dips or even crashes in the near future. It's a long term investment. Read about it and, if you believe in it, buy as much as you can. If it succeeds 1 bitcoin will be worth way more than 10k;3;0;False;l-R3lyk-l;dqcs9xw;It's over 9000!!!;7fkqh5;https://i.imgur.com/jyoZGyW.gifv
?? Can you elaborate? I, like a lot of people viewing this on all dont know a whole lot and these points seem quite positive.;2;1;False;TargetAq;dqcn4lf;It's over 9000!!!;7fkqh5;https://i.imgur.com/jyoZGyW.gifv
It's been growing exponentially, and it's barely starting.;4;1;False;readish;dqcoe44;It's over 9000!!!;7fkqh5;https://i.imgur.com/jyoZGyW.gifv
"Part of it is probably throwaways to protect people from theft of their large gains.

Part of it is also probably bot/spam accounts drumming up hype to further increase people's gains";5;0;False;ka-is-a-wheel;dqcywm4;It's over 9000!!!;7fkqh5;https://i.imgur.com/jyoZGyW.gifv
Lightning upgrade will make Bitcoin the cheapest block chain to use. Its already on testnet.;2;0;False;basheron;dqd295h;It's over 9000!!!;7fkqh5;https://i.imgur.com/jyoZGyW.gifv
"There are better digital currencies like DASH that are faster, cheaper, and more secure than Bitcoin.

Make sure you do your own reading and definitely check out /r/btc, its not ""fake"" as OP claims. There's a lot of competition, so be careful and do your research.";0;0;False;basilmintchutney;dqcykgg;It's over 9000!!!;7fkqh5;https://i.imgur.com/jyoZGyW.gifv
"Whales manipulating the market. A wave of FUD sweeping the community. A large government banning it. A large exchange failing. Satoshi selling his stack. Simple profit-taking. 

There's plenty of reasons it could crash.";3;0;False;TJ11240;dqcoe6j;It's over 9000!!!;7fkqh5;https://i.imgur.com/jyoZGyW.gifv
You can buy fractions. Don’t have to buy a whole one ;4;1;False;;dqcn6s3;It's over 9000!!!;7fkqh5;https://i.imgur.com/jyoZGyW.gifv
You don’t have to buy whole bitcoin. You can can just convert whatever you can afford into bitcoin - even if it’s just $100, $50, whatever.;1;0;False;phantomthirteen;dqcn80q;It's over 9000!!!;7fkqh5;https://i.imgur.com/jyoZGyW.gifv
You can buy fractions of one;1;0;False;;dqcxt0h;It's over 9000!!!;7fkqh5;https://i.imgur.com/jyoZGyW.gifv
And I think that it is heavily overvalued as is on account of all the hype created by posts like this one as more and more people buy it with the intention of profiting from their bitcoins rather than using them as a currency. Each to their own I guess :p ;7;1;False;PurplePickel;dqcnpa0;It's over 9000!!!;7fkqh5;https://i.imgur.com/jyoZGyW.gifv
"What do you mean by ""they are so far behind already""?";1;1;False;damchi;dqczbcc;It's over 9000!!!;7fkqh5;https://i.imgur.com/jyoZGyW.gifv
[deleted];1;1;False;;dqdjq7o;It's over 9000!!!;7fkqh5;https://i.imgur.com/jyoZGyW.gifv
How is it an improvement? It's far harder to use than cash or card as far as I see;2;1;False;turing-complete;dqde5a3;It's over 9000!!!;7fkqh5;https://i.imgur.com/jyoZGyW.gifv
Do framed Enron shares count as sharp? Either way, not to worry, the roof over his head is safe at Fannie Mae.;35;0;False;rogervdf;dqcr0hg;It's over 9000!!!;7fkqh5;https://i.imgur.com/jyoZGyW.gifv
"Someone correct me if I'm wrong

But I believe the MT site was ran like a bank to hold bitcoins for you and the owner up and stole all the bitcoins. ";130;2;False;BigMac2151;dqcq0sy;It's over 9000!!!;7fkqh5;https://i.imgur.com/jyoZGyW.gifv
Mt.Gox is a bitcoin exchange that was hacked and millions in bitcoin were lost;30;1;False;Yumadapuma;dqcq187;It's over 9000!!!;7fkqh5;https://i.imgur.com/jyoZGyW.gifv
Google MtGox;20;1;False;1cenine;dqcq0en;It's over 9000!!!;7fkqh5;https://i.imgur.com/jyoZGyW.gifv
"https://en.m.wikipedia.org/wiki/Mt._Gox

Yeouch. How do you possibly *lose* a bitcoin? Trade it to someone on accident?";3;1;False;funnystuff97;dqcqosz;It's over 9000!!!;7fkqh5;https://i.imgur.com/jyoZGyW.gifv
┗(✿ ♥‿♥)┛;371;3;False;ToTheMoonLady;dqcl32h;It's over 9000!!!;7fkqh5;https://i.imgur.com/jyoZGyW.gifv
*Hugs the moon guy*;51;1;False;AdvancedExpert8;dqckvh0;It's over 9000!!!;7fkqh5;https://i.imgur.com/jyoZGyW.gifv
there he is;22;1;False;TheTrippyChannel;dqckxii;It's over 9000!!!;7fkqh5;https://i.imgur.com/jyoZGyW.gifv
"Everybody message this guy that he has to eat his testicle soon:

https://www.reddit.com/r/Bitcoin/comments/7dpypn/this_is_why_i_want_bitcoin_to_hit_10000/

https://www.reddit.com/user/calaber24p
";2;0;False;;dqcpef0;It's over 9000!!!;7fkqh5;https://i.imgur.com/jyoZGyW.gifv
Normally I fear your arrival, but for once I think this moment deserves you;2;0;False;messiahsk8er;dqcqcog;It's over 9000!!!;7fkqh5;https://i.imgur.com/jyoZGyW.gifv
I can now go sleep well.;1;0;False;Essexal;dqcnqqk;It's over 9000!!!;7fkqh5;https://i.imgur.com/jyoZGyW.gifv
Epic bread;1;0;False;constitutionranger;dqco7kf;It's over 9000!!!;7fkqh5;https://i.imgur.com/jyoZGyW.gifv
I love you;1;1;False;Kalin101;dqcp2na;It's over 9000!!!;7fkqh5;https://i.imgur.com/jyoZGyW.gifv
I'm looking for you! :);1;0;False;exab;dqcpjf7;It's over 9000!!!;7fkqh5;https://i.imgur.com/jyoZGyW.gifv
Get off the bong now and then dude. You’re becoming way too infrequent. ;1;0;False;Minister99;dqcrnny;It's over 9000!!!;7fkqh5;https://i.imgur.com/jyoZGyW.gifv
you're still here after all these years :^) we've really made it haven't we moon guy ;1;1;False;cryptogoon69;dqcruid;It's over 9000!!!;7fkqh5;https://i.imgur.com/jyoZGyW.gifv
[deleted];1;1;False;;dqcvlc5;It's over 9000!!!;7fkqh5;https://i.imgur.com/jyoZGyW.gifv
Proven history of resiliency and improvement stretching back past the beginning of the decade, with no attack vector successfully bringing Bitcoin down or subverting it's core values.;14;1;False;NDragon951;dqckvyu;It's over 9000!!!;7fkqh5;https://i.imgur.com/jyoZGyW.gifv
"Haha, shit. ""I'm gonna bet two years of my life that this thing famous for it's incredible and steady rise in value is going to suddenly drop _right now_!""

Like, maybe start with half?";5;0;False;yiliu;dqcm3ke;It's over 9000!!!;7fkqh5;https://i.imgur.com/jyoZGyW.gifv
Are you one of those people ;1;0;False;pulplesspulp;dqclo78;It's over 9000!!!;7fkqh5;https://i.imgur.com/jyoZGyW.gifv
Of course not. The value is dependent on supply and demand. Like the value of tulips.;-1;0;False;Cray-II;dqcrptr;It's over 9000!!!;7fkqh5;https://i.imgur.com/jyoZGyW.gifv
"Dude, you’ve literally done nothing to counter my claim. 

I, however, implore you to do even a basic google search:

“Bitcoin money laundering”
“Bitcoin vice” 
Etc etc

This isn’t big media reporting this stuff. These are crypto insiders. ";-3;0;False;;dqcnapo;It's over 9000!!!;7fkqh5;https://i.imgur.com/jyoZGyW.gifv
Haha thank. Made me laugh out loud. ;3;0;False;ducksauce88;dqcwqt3;It's over 9000!!!;7fkqh5;https://i.imgur.com/jyoZGyW.gifv
Me Too!;2;0;False;boo_radley;dqcxegu;It's over 9000!!!;7fkqh5;https://i.imgur.com/jyoZGyW.gifv
Bitcoin is a textbook case of [eternal September](https://en.wikipedia.org/wiki/Eternal_September) ever since the price broke $1000 at the beginning of 2017.;2;1;False;Exotemporal;dqd3yry;It's over 9000!!!;7fkqh5;https://i.imgur.com/jyoZGyW.gifv
That's when we just post a gif of 10 of this gif ;5;0;False;SonOfSparda304;dqcv9yy;It's over 9000!!!;7fkqh5;https://i.imgur.com/jyoZGyW.gifv
The Big Short;89;3;False;subdep;dqcn1bh;It's over 9000!!!;7fkqh5;https://i.imgur.com/jyoZGyW.gifv
Hindsight;15;0;False;nemo1080;dqcmk4t;It's over 9000!!!;7fkqh5;https://i.imgur.com/jyoZGyW.gifv
But those were financial instruments that were worthless and had no valu.... oh wait.  ;7;1;False;Pepper_Jack_Jesus;dqcqe65;It's over 9000!!!;7fkqh5;https://i.imgur.com/jyoZGyW.gifv
Those guys didn’t “short” in the traditional way...it is much more complicated. If people are simply shorting bitcoin they are beyond dumb and are risking infinite losses to get a maybe 100% return ;1;0;False;JohnSmithwastaken;dqcwspq;It's over 9000!!!;7fkqh5;https://i.imgur.com/jyoZGyW.gifv
"I just watched The Big Short last night. At least with cryptocurrency, we don't have 'mutual funds' of the worst ones being tossed around and bet upon with the same confidence that people buy into Bitcoin or even Ethereum. 

I think this run up is most similar to the emergence or Paypal, Facebook, or Twitter. But what do I know";0;1;False;TJ11240;dqcmdvv;It's over 9000!!!;7fkqh5;https://i.imgur.com/jyoZGyW.gifv
Bitcoin has crashed (popped) dozens of times. It has gone from $1 to $30 (a 30x return) and then crashes back down to $2. Bitcoin isn't going anywhere and thanks to its deflationary nature,  it will go up in value as fiat inflation pumpsnits price up. Inflation always makes things more expensive and since bitcoin is on a global scale,  people will always short and realize they jumped out of the rocket and pay a heftier price to get back in. ;1;0;False;iiJokerzace;dqcqi79;It's over 9000!!!;7fkqh5;https://i.imgur.com/jyoZGyW.gifv
"I love your levelhead and that is what I also think.

I have followed BTC since the beginning. I never really had a need for being on the Silk Road, so inherently I saw BTC as a novelty and a nifty idea.  I once thought it was cool that you could turn your PC on and make money (through mining) but at the time the electricity costs far outmeasured the gains (still relevant for average dudes).

At this point I look at BTC closing in on 10k and thinking ""this has to be to bubble bursting right?""


God damn it. I thought that same thing since 3k.  When will this madness end?  Leveraging into all crypto seems to still be ""early"". I only hope I'm right.  Fuck it. As our lord savior Drake once said ""YOLO"".";7;1;False;flub_n_rub;dqcrypu;It's over 9000!!!;7fkqh5;https://i.imgur.com/jyoZGyW.gifv
"At somepoint it will stop and correct.  Yes. But once the market realizes what the true value is, it will automatically adjust to that point.  It will happen quick.  

In the grand scheme of things, bitcoin is still only worth 1/19,000 of all coins, banknotes, and deposit accounts in the entire world.  As a global currency and store of value that has no government bounds and can be traded near instantaneously anywhere inthe world ... it may still be undervalued.  I can still realistically see it going to a money supply in USD to 300-500k in the very near future.
";6;1;False;Pepper_Jack_Jesus;dqcqgjo;It's over 9000!!!;7fkqh5;https://i.imgur.com/jyoZGyW.gifv
[deleted];10;1;False;;dqconj1;It's over 9000!!!;7fkqh5;https://i.imgur.com/jyoZGyW.gifv
[deleted];5;1;False;;dqcz0nk;It's over 9000!!!;7fkqh5;https://i.imgur.com/jyoZGyW.gifv
