body;score;nb_replies;stickied;author;id;post_title;post_id;post_link
Do whatever, it's a party!!!!;1;0;False;walloon5;dqcr9e1;It's over 9000!!!;7fkqh5;https://i.imgur.com/jyoZGyW.gifv
"I understand the hesitation, but I feel like you'll be regretting it in a few years. I thought the same thing when I put a hundred dollars in initially when it was at $2,000.

If it's just BTC that frightens you check out other coins with a much lower market cap, like STRAT, NEO, OMG, or ETH to name a few.";1;0;False;crypto-coin;dqcnek5;It's over 9000!!!;7fkqh5;https://i.imgur.com/jyoZGyW.gifv
what is nothing? i see facebook climbing up up up up.....;1;0;False;cryptocraze_0;dqcnfzu;It's over 9000!!!;7fkqh5;https://i.imgur.com/jyoZGyW.gifv
"It was Satoshi who invented Bitcoin, not Shkreli. You seem a bit confused friend.
";1;1;False;xygo;dqcup7v;It's over 9000!!!;7fkqh5;https://i.imgur.com/jyoZGyW.gifv
/r/iamverysmart;7;0;False;;dqcqmai;It's over 9000!!!;7fkqh5;https://i.imgur.com/jyoZGyW.gifv
Cringe. ;6;0;False;uacdeepfield;dqcqoqu;It's over 9000!!!;7fkqh5;https://i.imgur.com/jyoZGyW.gifv
Nice troll account.;3;0;False;_reverse_osmosis_;dqcrpz7;It's over 9000!!!;7fkqh5;https://i.imgur.com/jyoZGyW.gifv
"https://99bitcoins.com/bitcoinobituaries/

>Bitcoin has died 191 times";2;0;False;tecknikally;dqcmyb5;It's over 9000!!!;7fkqh5;https://i.imgur.com/jyoZGyW.gifv
It’s very unlikely that it would go to zero anytime soon ;2;0;False;lotterythrowaway123;dqcn2n1;It's over 9000!!!;7fkqh5;https://i.imgur.com/jyoZGyW.gifv
People started freaking out when they wanted to charge fees, so they backed off. RIP business model.;5;1;False;riplin;dqcqr47;It's over 9000!!!;7fkqh5;https://i.imgur.com/jyoZGyW.gifv
"Bitcoin.com pushes an altcoin and pretends this altcoin is bitcoin.

Being decentralized doesn't mean there can't be bad actors. We are free to have opinions about the different players in the space.

I believe that bitcoin.com is damaging to bitcoin, and is tricking many people into buying an altcoin thinking it's bitcoin. ";14;1;False;gizram84;dqcxawu;It's over 9000!!!;7fkqh5;https://i.imgur.com/jyoZGyW.gifv
/r/btc uses psychological suppression of anything not BCH related. That's OK, just recognize it's a fork and an altcoin like litecoin or vertcoin.;6;0;False;puck2;dqcud4e;It's over 9000!!!;7fkqh5;https://i.imgur.com/jyoZGyW.gifv
nice reverse psychology shill;6;0;False;varikonniemi;dqctj9e;It's over 9000!!!;7fkqh5;https://i.imgur.com/jyoZGyW.gifv
Nope;1;0;False;xithy;dqcrzzp;It's over 9000!!!;7fkqh5;https://i.imgur.com/jyoZGyW.gifv
Poor cats. ;1;0;False;;dqcqwq4;It's over 9000!!!;7fkqh5;https://i.imgur.com/jyoZGyW.gifv
It's still a brand new asset class. Just because it mimics it doesn't make it one.;7;0;False;gonzobon;dqcphd4;It's over 9000!!!;7fkqh5;https://i.imgur.com/jyoZGyW.gifv
"> even more so when lost bitcoins are lost forever.

Divisibility. We could all be fighting over (sharing in) the last `0.00000001 BTC`, simply add bits to your computer.

";3;0;False;BitAlt;dqctxzx;It's over 9000!!!;7fkqh5;https://i.imgur.com/jyoZGyW.gifv
You can buy bitcoin with credit or debit etc you don’t need to mine it to acquire bitcoin. Try Coinbase.com but send your bitcoin to a more secure wallet after that.;328;9;False;;dqcmfr8;It's over 9000!!!;7fkqh5;https://i.imgur.com/jyoZGyW.gifv
"You haven't been mining bitcoin right? You're losing more than you gain, even if electricity is free (hardware costs).

If you want to mine crypto there are other coins that are 10x more profitable than btc as a casual miner.";4;1;False;Vaztes;dqcn06a;It's over 9000!!!;7fkqh5;https://i.imgur.com/jyoZGyW.gifv
It’s so high now that people will need to display prices in really small fractions of coin. That seems weird to me. ;3;1;False;ItsACommonMistake;dqcs9zk;It's over 9000!!!;7fkqh5;https://i.imgur.com/jyoZGyW.gifv
"You can use Purse and buy things on Amazon at a slight discount. 

Steam accepts Bitcoin too";2;0;False;TJ11240;dqcnsap;It's over 9000!!!;7fkqh5;https://i.imgur.com/jyoZGyW.gifv
You can use the TenX debit Visa card to purchase Goods and services. from Cryptocurrency to Fiat in real time exchange ;1;0;False;brofi101;dqcxir8;It's over 9000!!!;7fkqh5;https://i.imgur.com/jyoZGyW.gifv
"No offense, but I think you'really missing his point.

Im not sure of the technical terms, but A 401k is an investment instrument, not a currency. And trying to time the market on your investments is pretty risky.";3;0;False;;dqcssbr;It's over 9000!!!;7fkqh5;https://i.imgur.com/jyoZGyW.gifv
You still made a crazy amount of profit by most investing standards. ;5;1;False;;dqcnvqc;It's over 9000!!!;7fkqh5;https://i.imgur.com/jyoZGyW.gifv
"the golden rule of investing (especially in hihgly speculative markets) is to never invest what you can't afford to lose. 

edit: as an additional point, while im sure the FUD would be massive if that were to happen, I think it would ultimately be a good thing. would increase scarcity for a while, and reduce centralization. plus with all the BS Bitmain has been pulling, I would be glad to be rid of them.";17;2;False;I_ate_a_milkshake;dqcnban;It's over 9000!!!;7fkqh5;https://i.imgur.com/jyoZGyW.gifv
"I would welcome such news. There will sure be a dip and perhaps a time with low hash power until difficulty adjusts, but the result would be a more decentralized mining situation for BTC.

That said, I'm 90% sure China will not shut down the miners. The parasitic and totalitarian government will more likely try to find some way to tax the miners.  As that's hard, the first step will be to threaten miners that they will be imprisoned unless they declare and tax BTC-mining-income.";3;0;False;Tiny_Frog;dqcpwf2;It's over 9000!!!;7fkqh5;https://i.imgur.com/jyoZGyW.gifv
"ahh out come the detractors. 

""it has no inherent value!""

""its a bubble!""

""tulip mania!""

we've heard it all before, man. give it a rest.";1;1;False;I_ate_a_milkshake;dqco21q;It's over 9000!!!;7fkqh5;https://i.imgur.com/jyoZGyW.gifv
i have self diagnosed OCD and its expensive now anyway. it's going to crash.;-1;2;False;Speedracer98;dqcnjuo;It's over 9000!!!;7fkqh5;https://i.imgur.com/jyoZGyW.gifv
"It may simply become a deflationary store of value like gold i still don't think that would mean the current price is overvalued. The CME group which is a huge financial institution is going to be offering bitcoin futures contracts soon, and the CEO has also said that bitcoin could become its own asset class, no matter what it becomes I think the short term is looking very good and i think there are enough of us brainwashed supporters ;) that whatever issues need to be overcome in the future we will make it happen. 

Also here is the press release from the CME Group if you are interested.

http://www.cmegroup.com/media-room/press-releases/2017/10/31/cme_group_announceslaunchofbitcoinfutures.html

 ";2;1;False;lunaislife;dqco1m0;It's over 9000!!!;7fkqh5;https://i.imgur.com/jyoZGyW.gifv
"**Eternal September**

Eternal September or the September that never ended is Usenet slang for a period beginning in September 1993, the month that Internet service provider America Online began offering Usenet access to its many users, overwhelming the existing culture for online forums. The influx in Usenet users was also indirectly caused by the aggressive direct mailing campaign by AOL Chief Marketing Officer Jan Brandt in order to beat out CompuServe and Prodigy, which most notably involved distributing millions of floppy disks and CD-ROMs with free trials of AOL.

Before then, Usenet was largely restricted to colleges and universities. Every September, a large number of incoming freshmen would acquire access to Usenet for the first time, taking time to become accustomed to Usenet's standards of conduct and ""netiquette"". After a month or so, these new users would either learn to comply with the networks' social norms or tire of using the service.

***

^[ [^PM](https://www.reddit.com/message/compose?to=kittens_from_space) ^| [^Exclude ^me](https://reddit.com/message/compose?to=WikiTextBot&message=Excludeme&subject=Excludeme) ^| [^Exclude ^from ^subreddit](https://np.reddit.com/r/Bitcoin/about/banned) ^| [^FAQ ^/ ^Information](https://np.reddit.com/r/WikiTextBot/wiki/index) ^| [^Source](https://github.com/kittenswolf/WikiTextBot) ^| [^Donate](https://www.reddit.com/r/WikiTextBot/wiki/donate)   ^]
^Downvote ^to ^remove ^| ^v0.28";2;0;False;WikiTextBot;dqd3yvr;It's over 9000!!!;7fkqh5;https://i.imgur.com/jyoZGyW.gifv
"""Only when the tide goes out do you discover who has been swimming naked.""  -  Warren Buffett  

";80;2;False;Ask_if_im_an_alien;dqcosu6;It's over 9000!!!;7fkqh5;https://i.imgur.com/jyoZGyW.gifv
"Exactly,  that person took a loss for a while,  then made huge 

You open a short position,  then you don't panic and close it if it goes up.  You wait patiently  

Of course,  only if you think it's a true bubble 

I think it's going to dip and bump,  but the bubble won't be full for a long while,  or until there's a mass exodus to another coin";6;1;False;;dqcpypx;It's over 9000!!!;7fkqh5;https://i.imgur.com/jyoZGyW.gifv
">""Truth is like poetry. 
And everybody fucking hates poetry. ""

-Overheard in a bar";1;0;False;iiJokerzace;dqcqk7h;It's over 9000!!!;7fkqh5;https://i.imgur.com/jyoZGyW.gifv
"Yeah I think there's a reason the ""hold"" meme is pushed so hard. I think if you saw some wallets, the people saying HODL the loudest would be dumping after their pump right about now.";1;0;False;;dqcu2tn;It's over 9000!!!;7fkqh5;https://i.imgur.com/jyoZGyW.gifv
[deleted];2;3;False;;dqcmlds;It's over 9000!!!;7fkqh5;https://i.imgur.com/jyoZGyW.gifv
"One thing to consider is that the more Bitcoin shoots up in value, the *less* useful it is an an alternative currency. As a currency, Bitcoin is undergoing massive, brutal deflation, which means everyone's got a real strong incentive not to purchase things with bitcoin since that bitcoin will be way more valuable in the future. 

If the US dollar quadrupled in value over 8 months, the US would be having the biggest depression of all time. ";2;0;False;Chiponyasu;dqd5c6s;It's over 9000!!!;7fkqh5;https://i.imgur.com/jyoZGyW.gifv
The market itself is warping the true value of bitcoin. It's making it something you hold on to in the hopes of the price continuing to increase, instead of something you exchange for goods and services. ;2;1;False;Chiponyasu;dqd5it3;It's over 9000!!!;7fkqh5;https://i.imgur.com/jyoZGyW.gifv
"> The only change since then that I can tell is you can no longer efficiently or quickly transfer bitcoin. 

care to elaborate to someone who only read about bitcoins and not own any? from the FAQ on top of the page https://reddit.com/r/Bitcoin/comments/6jlop4/ it says it's ""nearly instant"". is that no longer the case? or is it _still_ fast, just _inefficient_?";2;1;False;JonasBrosSuck;dqcpdls;It's over 9000!!!;7fkqh5;https://i.imgur.com/jyoZGyW.gifv
No one can make fun of me for being wrong! ;1;1;False;Chiponyasu;dqd53tl;It's over 9000!!!;7fkqh5;https://i.imgur.com/jyoZGyW.gifv
The good news is that in order to reach *moon* levels, we don't need a majority. I read that we're around 0.1% adoption/exposure right now. Getting to 25% (PayPal levels) would certainly do the trick.;4;1;False;TJ11240;dqcmi49;It's over 9000!!!;7fkqh5;https://i.imgur.com/jyoZGyW.gifv
Common people do not hold the world's wealth.   All of finance is pretty much out of ther grasp.  Now go look up what the size of the derivatives market is.;2;0;False;Pepper_Jack_Jesus;dqcqj2v;It's over 9000!!!;7fkqh5;https://i.imgur.com/jyoZGyW.gifv
we are approaching an age where everyone alive will have been born after the inception of personal computers and the internet. This kind of high-concept, high-tech stuff will be second-nature to a huge percentage of the population before long. ;0;1;False;I_ate_a_milkshake;dqcml46;It's over 9000!!!;7fkqh5;https://i.imgur.com/jyoZGyW.gifv
The way I always see it is that VERY few of those early buyers actually held onto their coins long enough to make a ton of money off of it. Those that are still holding today are few and far between, and I doubt I would have had the willpower to not sell at some point between now and then. It’s human nature. Hell I’ve bought and sold like twenty times just in the past year because I keep thinking “no way it goes higher than this” lol.  But who the hell knows at this point, I may just toss a few hundred dollars in and force myself to ignore it for a few years and hope I’m richer for it.;99;3;False;Zeyz;dqcndtw;It's over 9000!!!;7fkqh5;https://i.imgur.com/jyoZGyW.gifv
I actually just set up my first hardware wallet, which is why I said that. It is very simple and I feel should be manageable for basically anyone. I don't know about 2017 grandma level simple, but the general population is getting more and more tech-savvy as the years go by as older generations are replaced by newer ones. 2027 will look very different to 2017.;3;0;False;FlowerEmperor;dqcwwlo;It's over 9000!!!;7fkqh5;https://i.imgur.com/jyoZGyW.gifv
"Kraken is the worst :(

So many errors and downtime";5;1;False;slashfromgunsnroses;dqcxged;It's over 9000!!!;7fkqh5;https://i.imgur.com/jyoZGyW.gifv
"I'll ask this, what other cryptocurrency is becoming a household name? Sure you can rattle off 100 or more alt coins,  but this discussion wasn't about alts,  just BTC. I have a few coins in different alts.  I don't regularly  buy them anymore but I track their prices and record them from day to day in my spreadsheets. 

Sure another crypto could take the lead.  But for now there is BTC leading the pack.  How many places are accepting etherium or litecoin, or dash,  or ripple, or whatever coin you want to talk about?  Not many.  Meanwhile BTC is actively becoming a standard in places like Venezuela, for a variety of reasons, such as: their government's currency is in hyperinflation, and is unstable, and electricity is free or cheap there. BTC is now easy to mine there,  and a good alternative people are actively using every day. 

You could say that crypto is a waste of electricity, but with so many options for renewable energy, it's hard to argue is harmful to the environment. 

How harmful to the environment is actual currency?  Copper pennies?  Well you have to mine copper. Transfer the ore,  smelt the ore,  press it into usable sheets,  stamp out each coin,   distribute  the new coins. Moving tons of copper around can't be cheap or easy,  so every step of the way you're using oil or electricity to move tons of metal. How does a single penny compare in cost to the environment to a single BTC? And that's just pennies.  More metal,  nickel,  zinc,  silver,  etc,  all smelted and processed to make various coins. Paper money takes harvesting crops for the fibers, washing them with special chemicals, inks and even metals embedded into some of them,  special printing processes, man hours. Certainly sounds like even printing money is hard on the environment.

So your argument that cryptocurrency is harmful to the environment is laughable at best.  With solar, wind,  hydro or even nuclear, crypto would have the smallest footprint of all currency.";2;1;False;johnnyringo771;dqde5tn;It's over 9000!!!;7fkqh5;https://i.imgur.com/jyoZGyW.gifv
You make it sounds as if bitcoin is a commodity in a bubble, not a currency used for the exchage of goods and services.;2;2;False;;dqcvq16;It's over 9000!!!;7fkqh5;https://i.imgur.com/jyoZGyW.gifv
What's that disclaimer you always here? Past performance is no indication of future results?;1;1;False;Waterwoo;dqcpu9l;It's over 9000!!!;7fkqh5;https://i.imgur.com/jyoZGyW.gifv
How can one contribute to the Bitcoin project?;6;1;False;alaskanloops;dqclo2m;It's over 9000!!!;7fkqh5;https://i.imgur.com/jyoZGyW.gifv
"> Bitcoin attracts the best developers

You can't be serious";0;3;False;bigred198;dqcqc89;It's over 9000!!!;7fkqh5;https://i.imgur.com/jyoZGyW.gifv
We don’t need Bitcoin to be like cash just yet. We need to be our own bank first. There is no crisis with buying coffee. There is a crisis with our central banks. Kill the banks first. Then we can kill Visa and PayPal.;23;2;False;ColSandersForPrez;dqcm1ez;It's over 9000!!!;7fkqh5;https://i.imgur.com/jyoZGyW.gifv
Is that not more of a problem they won't have for the short run? Long run means that other currencies will also develop trust in being dependable and resistant to attacks. So why would another currency which comes along and provides solutions to all these problems not beat bitcoin out? When so much controversy stems around simply raising the block size to resolve some of these transaction problems. Does that not seem to point towards stifling innovation? ;5;4;False;Tyrion_Panhandler;dqcmgsg;It's over 9000!!!;7fkqh5;https://i.imgur.com/jyoZGyW.gifv
Ain't nobody care about spending Bitcoin on McDonald's or coffee. Visa and debit works just fine for that.;1;0;False;Ryan1188;dqcuqas;It's over 9000!!!;7fkqh5;https://i.imgur.com/jyoZGyW.gifv
fees of 5 to 10 sats have been going through with no problem.;1;1;False;whose_butt_hurts;dqcv73d;It's over 9000!!!;7fkqh5;https://i.imgur.com/jyoZGyW.gifv
And yet lightning is being developed to scale bitcoin to orders of magnitude higher than ANY block chain technology out there.;1;0;False;basheron;dqd1irr;It's over 9000!!!;7fkqh5;https://i.imgur.com/jyoZGyW.gifv
Dude this is a Bitcoin celebration shit post and you're trying to shill in it to alts? Seriously.;-1;0;False;;dqcnptu;It's over 9000!!!;7fkqh5;https://i.imgur.com/jyoZGyW.gifv
as a currency bitcoin is nearly entirely useless at present. I hope that in the near future the horrendous transaction speed can be addressed. ;2;1;False;;dqcogbg;It's over 9000!!!;7fkqh5;https://i.imgur.com/jyoZGyW.gifv
"Except all the coins based on the Ethereum blockchain . 

";6;3;False;Zero_Ghost24;dqcmrn9;It's over 9000!!!;7fkqh5;https://i.imgur.com/jyoZGyW.gifv
That's not really saying anything at all. Bitcoin has the highest transaction fees and the lowest utility relative to the other top five crypto currencies. First of its kind doesn't mean gold standard. It certainly paved the way though ;0;0;False;Tyrion_Panhandler;dqcmjvu;It's over 9000!!!;7fkqh5;https://i.imgur.com/jyoZGyW.gifv
"Theoretically, but game theory would say companies would face negative market consequences for trying to block services. Even IF they tried to block services, it is easy to bypass road blocks when you can use VPNs and encryption hardened communication protocols.

Not all packets are equal, net neutrality is a roadblock to innovation.";2;1;False;basheron;dqd26sc;It's over 9000!!!;7fkqh5;https://i.imgur.com/jyoZGyW.gifv
"I'm not sure why ISPs would target miners, or even if they did whether it would be all ISPs doing it together, but sure I suppose that could happen. 

On the other hand though, we've seen the effect that the Chinese government has had on the crypto market, everything tanked and then recovered to new heights, I don't see how one government's decision to deregulate internet service providers is going to be detrimental long term to cryptocurrency. But then again I'm not American so I don't know the ins and outs of the net neutrality debate. I don't think there is too much to be concerned about though ";3;1;False;etan_ashman;dqcopoi;It's over 9000!!!;7fkqh5;https://i.imgur.com/jyoZGyW.gifv
"Absolutely. The first 2 sentences are basically nonsense. It's an argument that basically just insists upon itself; ""I'm awesome because I say that I'm awesome, and that means I'm awesome.""

Second paragraph says that Bitcoin is going to go up in price because it has gone up in price... so logically it will go up in price. The first thing ANYONE learns about investment is that past results do not indicate future performance. 

Claiming that it is like email in the 90's, is a false analogy. Email in the 90's has obviously become wildly successful. Bitcoin has not. If anything, they're just pointing out that governments have tried to ban it as a ""currency"", which is not a positive.

The thing that really pissed me off, however, is that they referred to it as a deflationary currency, as if that is a positive thing. The fact that it's deflationary is what makes it so terrible as a currency. By definition, currency needs to be spent. A dollar isn't a dollar if no one will spend it. People spend dollars because they're inflationary, meaning they'll be worth more tomorrow than they are today. 

No one buys Bitcoin so they can more easily purchase things; they buy Bitcoin because they think it will go up in price. But THAT, is an investment... not a currency. Currencies are spent, investments are saved. If Bitcoin isn't a currency, then what is it worth? Nothing.";3;2;False;pr0b0ner;dqcnlmh;It's over 9000!!!;7fkqh5;https://i.imgur.com/jyoZGyW.gifv
We’ve seen ups and downs before.  Why is it $9000 now and not two years from now?  Something has to be going on.  It was $8000 like one week ago.  At this rate it’ll be $10000 on Wednesday. ;3;1;False;;dqcoqkf;It's over 9000!!!;7fkqh5;https://i.imgur.com/jyoZGyW.gifv
"If you've already purchased through coinbase then it should be listed on your gdax account too. There isn't a mobile app because (their official line - which I agree with) the mobile Web interface is designed to be just as good as an app. If you save it to your phone so it's an icon you can't event tell the difference. That said, whilst it's good to buy through gdax, if you're not trading I wouldn't leave your money on an exchange; buy through gdax then transfer your money to your own wallet - use electrum if you have a small amount of bitcoin, use a hardware wallet like trezor, or a paper wallet, if you have a large amount. If you want to trade (and keep in mind the majority of people are left worse off from trading - you really have to do a lot of homework), then you should use a better exchange like bittrex.";3;1;False;HawkinsT;dqd2te7;It's over 9000!!!;7fkqh5;https://i.imgur.com/jyoZGyW.gifv
GDAX is coinbase, you can use the same credentials for both sites :).;2;1;False;-Frankz;dqd2kam;It's over 9000!!!;7fkqh5;https://i.imgur.com/jyoZGyW.gifv
"It would be funny to see that,  but really I'm not worried.  

If my BTC only sold for 1/3rd the current price I would still just about break even. I'm really not rich.  Rich people would laugh at how little I have.  But for once I'm not scared that I have no savings.  It's so nice.";1;1;False;johnnyringo771;dqdclew;It's over 9000!!!;7fkqh5;https://i.imgur.com/jyoZGyW.gifv
Breadwallet is very good but the fees to spend/send your bitcoin from it are high, but that might change soonish. Breadwallet is very very easy to set up ;2;0;False;;dqcni00;It's over 9000!!!;7fkqh5;https://i.imgur.com/jyoZGyW.gifv
there is a scarcity factor with Gold that is hard to topple. ;0;1;False;montecarlo1;dqdd0fu;It's over 9000!!!;7fkqh5;https://i.imgur.com/jyoZGyW.gifv
Im not in the millions lost category thankfully.;1;1;False;sbeloud;dqcmqmq;It's over 9000!!!;7fkqh5;https://i.imgur.com/jyoZGyW.gifv
I mean you can look up how many new wallets have been added since last year instead of making someone do your research for you. 9m to 14m....so oh wait....the users have been increasing a crazy amount. Go eat some salt.;1;1;False;1phil2phil3phil;dqcz2h8;It's over 9000!!!;7fkqh5;https://i.imgur.com/jyoZGyW.gifv
Math is hard for some people yes;5;0;False;esoteric_plumbus;dqcm7ce;It's over 9000!!!;7fkqh5;https://i.imgur.com/jyoZGyW.gifv
I agree however it is no different than buying a fraction of a dollar. It's a cent.;3;1;False;Falcorsc2;dqclpqs;It's over 9000!!!;7fkqh5;https://i.imgur.com/jyoZGyW.gifv
Replace bit and satoshi with dollars and cents. Or even euros and euro cents. It’s literally just another currency, it’s not a hard thing to grasp;2;0;False;smashedhijack;dqctf5x;It's over 9000!!!;7fkqh5;https://i.imgur.com/jyoZGyW.gifv
"50 cent : ""bitch please""";1;0;False;Frogolocalypse;dqcnq0g;It's over 9000!!!;7fkqh5;https://i.imgur.com/jyoZGyW.gifv
"""I would like to buy 0.04 BTC.""";1;0;False;;dqcoo8c;It's over 9000!!!;7fkqh5;https://i.imgur.com/jyoZGyW.gifv
That's what people said about $8. That's what people will say about $9000 if it goes to $12000. Hindsight is 20/20. You could buy in right now, and the Chinese whale pools could decide to crash it back to $1000.;5;2;False;;dqcoudm;It's over 9000!!!;7fkqh5;https://i.imgur.com/jyoZGyW.gifv
 And whom are we to torture? ;1;0;False;kovyvok;dqco9u9;It's over 9000!!!;7fkqh5;https://i.imgur.com/jyoZGyW.gifv
Yes it has. The amount of value in Bitcoin savings accounts has increased ten times. This means it is being used ten times more to hodl Bitcoin savings.;2;0;False;Klutzkerfuffle;dqcuqgg;It's over 9000!!!;7fkqh5;https://i.imgur.com/jyoZGyW.gifv
Could you recommend one;1;1;False;zig_8;dqd666a;It's over 9000!!!;7fkqh5;https://i.imgur.com/jyoZGyW.gifv
Because if something happens to bitcoin (I'm not saying it will, but if it does) then you're going to be incredibly fucked when you lose all your savings. ;1;1;False;PurplePickel;dqcv5h0;It's over 9000!!!;7fkqh5;https://i.imgur.com/jyoZGyW.gifv
Well ultimately they are only worth as much as people are willing to pay for them and naturally people are willing to pay more when they think the price is going to rise in the future. The issue arises if everyone collectively starts to panic which could very easily happen. It's happened multiple times in the past as you've mentioned and it may or may not happen again. But obviously if someone jumps into the market and buys a few coins for 9 grand a piece, it'd be really shitty for them if the price then dropped back down to 7 grand and then that's the value where the market reached stability. ;2;0;False;PurplePickel;dqcrcbd;It's over 9000!!!;7fkqh5;https://i.imgur.com/jyoZGyW.gifv
