body;score;nb_replies;stickied;author;id;post_title;post_id;post_link
Think of it like gold. Its valuable because its valuable and impossible to make money. The word currency is misleading as its not popular because of its utility as a medium of exchange. The main appeal, like gold, is that it is a medium to store wealth.;1;0;False;Trapped_SCV;dpcrmab;Lily Allen turned down 200K in Bitcoins for a gig in 2009 which is worth $1,426,199,000 as of this writing;7aq0fx;https://www.independent.co.uk/arts-entertainment/music/news/lily-allen-calls-herself-an-idiot-for-declining-bitcoin-payment-now-worth-millions-9046211.html
are you only talking about bitcoin? Investing in other markets is definitely not gambling. Trying to predict the market is foolish;1;1;False;xddm2653;dpdlbfm;Lily Allen turned down 200K in Bitcoins for a gig in 2009 which is worth $1,426,199,000 as of this writing;7aq0fx;https://www.independent.co.uk/arts-entertainment/music/news/lily-allen-calls-herself-an-idiot-for-declining-bitcoin-payment-now-worth-millions-9046211.html
This makes much more sense, she probably just thought it was bitcoin because linden dollars are also a form of digital currency (albeit not decentralized or cryptographic, more akin to egold). Especially since the gig was in Second Life (linden labs is the game developer) and the amount of coins, given the timing, doesnt make sense. We would know who made the offer if it were that many coins, since there were only a handful of people who had that much and we mostly know who they are.;1;0;False;calaber24p;dpcs2u9;Lily Allen turned down 200K in Bitcoins for a gig in 2009 which is worth $1,426,199,000 as of this writing;7aq0fx;https://www.independent.co.uk/arts-entertainment/music/news/lily-allen-calls-herself-an-idiot-for-declining-bitcoin-payment-now-worth-millions-9046211.html
"> I call it speculation more than investment.

I don't.  I'm invested because i understand the technology.   It is pure genius. ";1;1;False;Frogolocalypse;dpcui6l;Lily Allen turned down 200K in Bitcoins for a gig in 2009 which is worth $1,426,199,000 as of this writing;7aq0fx;https://www.independent.co.uk/arts-entertainment/music/news/lily-allen-calls-herself-an-idiot-for-declining-bitcoin-payment-now-worth-millions-9046211.html
A lot of people would take that opportunity to buy.;3;0;False;Frogolocalypse;dpcuede;Lily Allen turned down 200K in Bitcoins for a gig in 2009 which is worth $1,426,199,000 as of this writing;7aq0fx;https://www.independent.co.uk/arts-entertainment/music/news/lily-allen-calls-herself-an-idiot-for-declining-bitcoin-payment-now-worth-millions-9046211.html
"trade volume at a given price is what gives and asset like this value.

If there are only 10 bitcoin in the world and everyone traded them consistently back and for that $1000, nobody would want to sell for less, giving it price stability at, $1,000.

If nobody else wants it for a long period of time you may see someone sell at a loss, but if there is consistently volume around the same price point that usually becomes a point of price support. So volume is pretty important, and that is bitcoin being traded as you stated it. ";1;0;False;fyeah;dpd21ak;Lily Allen turned down 200K in Bitcoins for a gig in 2009 which is worth $1,426,199,000 as of this writing;7aq0fx;https://www.independent.co.uk/arts-entertainment/music/news/lily-allen-calls-herself-an-idiot-for-declining-bitcoin-payment-now-worth-millions-9046211.html
"
I honestly think that forums and reddit dont react fast enough to the way crypto moves. I am a big fan of Discord and Slack to stay up to date and I like the real time interaction. [I hang out here in this discord](https://discord.gg/zze64vd). I like it because the majority of the members are crypto nerds like me who are extremely active in the market. Questions are answered quickly and TA charts are posted all the time. I always have something to read or talk about here";1;0;False;daizg;dpcy8jc;Lily Allen turned down 200K in Bitcoins for a gig in 2009 which is worth $1,426,199,000 as of this writing;7aq0fx;https://www.independent.co.uk/arts-entertainment/music/news/lily-allen-calls-herself-an-idiot-for-declining-bitcoin-payment-now-worth-millions-9046211.html
"Your comment has been flagged for removal because it's rude, vulgar and offensive. Be excellent to each other!

^^I ^^am ^^a ^^bot ^^and ^^cannot ^^respond. ^^Please ^^contact ^^/r/Bitcoin ^^moderators [^^directly ^^via ^^mod ^^mail](https://www.reddit.com/message/compose?to=%2Fr%2FBitcoin) ^^if ^^you ^^have ^^questions.";1;1;False;rBitcoinMod;dpcylow;Lily Allen turned down 200K in Bitcoins for a gig in 2009 which is worth $1,426,199,000 as of this writing;7aq0fx;https://www.independent.co.uk/arts-entertainment/music/news/lily-allen-calls-herself-an-idiot-for-declining-bitcoin-payment-now-worth-millions-9046211.html
... Wow, you apparently misunderstood every comment I made on this subject today.;3;0;False;theorymeltfool;dpcsriq;Lily Allen turned down 200K in Bitcoins for a gig in 2009 which is worth $1,426,199,000 as of this writing;7aq0fx;https://www.independent.co.uk/arts-entertainment/music/news/lily-allen-calls-herself-an-idiot-for-declining-bitcoin-payment-now-worth-millions-9046211.html
Which part of ETH is modern? The one where all the wallets lock up for days? Sorry it's a joke. Not to mention smart contracts are coming to bitcoin through side chains. Ones with less attack surface. Side chains are what you would call modern design, a modular one. Not a monolithic one which can be hacked.;2;0;False;ModerateBrainUsage;dpd2hyw;Lily Allen turned down 200K in Bitcoins for a gig in 2009 which is worth $1,426,199,000 as of this writing;7aq0fx;https://www.independent.co.uk/arts-entertainment/music/news/lily-allen-calls-herself-an-idiot-for-declining-bitcoin-payment-now-worth-millions-9046211.html
It's good in a way.  It demonstrates how early we are on the s-curve.  I know it, but it is always good to have it confirmed.  So when they're saying it's so overvalued right now, I look here and can say no, I don't think we're even close to that.;1;0;False;Frogolocalypse;dpd0gby;Lily Allen turned down 200K in Bitcoins for a gig in 2009 which is worth $1,426,199,000 as of this writing;7aq0fx;https://www.independent.co.uk/arts-entertainment/music/news/lily-allen-calls-herself-an-idiot-for-declining-bitcoin-payment-now-worth-millions-9046211.html
"How does speculating on it make it more functional?

The more people who speculate the more volatile it makes the price and the less anyone actually wants to spend it as currency because no want wants to spend a currency if it might be worth double in a week.

There is no ""investing"" in a currency other than by using it. If you bought up trillions of zimbabwean dollars it would not make it a functional currency.";1;1;False;suninabox;dpdj527;Lily Allen turned down 200K in Bitcoins for a gig in 2009 which is worth $1,426,199,000 as of this writing;7aq0fx;https://www.independent.co.uk/arts-entertainment/music/news/lily-allen-calls-herself-an-idiot-for-declining-bitcoin-payment-now-worth-millions-9046211.html
Right. Also in 2009 200k bitcoins was worth a few thousand dollars if that. It would not have been enough to pay her for a concert.;1;0;False;bitcoind3;dpd7gt9;Lily Allen turned down 200K in Bitcoins for a gig in 2009 which is worth $1,426,199,000 as of this writing;7aq0fx;https://www.independent.co.uk/arts-entertainment/music/news/lily-allen-calls-herself-an-idiot-for-declining-bitcoin-payment-now-worth-millions-9046211.html
I suggest you check the order book of gdax to see just how little liquidity there is in Bitcoin (hint, most major NASDAQ stocks individually have larger order books). So yeah, to crash the price 5% would take much less than you think.;1;0;False;JK_Business_Casual;dpcs43r;Lily Allen turned down 200K in Bitcoins for a gig in 2009 which is worth $1,426,199,000 as of this writing;7aq0fx;https://www.independent.co.uk/arts-entertainment/music/news/lily-allen-calls-herself-an-idiot-for-declining-bitcoin-payment-now-worth-millions-9046211.html
"They have USD in their accounts, you'd want to take it up with them. 

They aren't the only exchange in town either, there's bitstamp and Kraken. 

Although it sounds like you're more interested in trading bitcoin for precious metals and there are services that facilitate that too. ";1;0;False;nannal;dpd0j9t;Lily Allen turned down 200K in Bitcoins for a gig in 2009 which is worth $1,426,199,000 as of this writing;7aq0fx;https://www.independent.co.uk/arts-entertainment/music/news/lily-allen-calls-herself-an-idiot-for-declining-bitcoin-payment-now-worth-millions-9046211.html
"Your comment has been flagged for removal because it's rude, vulgar and offensive. Be excellent to each other!

^^I ^^am ^^a ^^bot ^^and ^^cannot ^^respond. ^^Please ^^contact ^^/r/Bitcoin ^^moderators [^^directly ^^via ^^mod ^^mail](https://www.reddit.com/message/compose?to=%2Fr%2FBitcoin) ^^if ^^you ^^have ^^questions.";1;0;False;rBitcoinMod;dpcylsv;Lily Allen turned down 200K in Bitcoins for a gig in 2009 which is worth $1,426,199,000 as of this writing;7aq0fx;https://www.independent.co.uk/arts-entertainment/music/news/lily-allen-calls-herself-an-idiot-for-declining-bitcoin-payment-now-worth-millions-9046211.html
"The story is sketchy because Allen doesn't declare precisely how many BTC she was offered.

Later down the page it mentions IT work James Howell who received ""7500"" Bitcoins in 2009 and ""lost the hard drive"" he ""stored them on"" (which means he lost the private key which gave him the ability to transact with the coins.)

Today, 7500 BTC is valued at US$55,875,000.";1;0;False;;dpdfmcw;Lily Allen turned down 200K in Bitcoins for a gig in 2009 which is worth $1,426,199,000 as of this writing;7aq0fx;https://www.independent.co.uk/arts-entertainment/music/news/lily-allen-calls-herself-an-idiot-for-declining-bitcoin-payment-now-worth-millions-9046211.html
This is an important point. Everyone laughing at Allen when all THEY needed to do was download and install some software on their PC...;1;0;False;;dpdhnq1;Lily Allen turned down 200K in Bitcoins for a gig in 2009 which is worth $1,426,199,000 as of this writing;7aq0fx;https://www.independent.co.uk/arts-entertainment/music/news/lily-allen-calls-herself-an-idiot-for-declining-bitcoin-payment-now-worth-millions-9046211.html
theres many bitcoin exchanges you can sell on and then wire the $ to your bank account...or sell to someone directly in person.;1;0;False;ucandoitBFX;dpdbg7z;Lily Allen turned down 200K in Bitcoins for a gig in 2009 which is worth $1,426,199,000 as of this writing;7aq0fx;https://www.independent.co.uk/arts-entertainment/music/news/lily-allen-calls-herself-an-idiot-for-declining-bitcoin-payment-now-worth-millions-9046211.html
"its here to stay. do some research :) 

https://www.youtube.com/watch?v=UlKZ83REIkA

you can start here.";1;1;False;ucandoitBFX;dpdbh8g;Lily Allen turned down 200K in Bitcoins for a gig in 2009 which is worth $1,426,199,000 as of this writing;7aq0fx;https://www.independent.co.uk/arts-entertainment/music/news/lily-allen-calls-herself-an-idiot-for-declining-bitcoin-payment-now-worth-millions-9046211.html
You should really do some reading up on the Dunning-Kruger effect, since context is something that so easily eludes you.;1;0;False;LibertyRhyme;dpdiy22;Lily Allen turned down 200K in Bitcoins for a gig in 2009 which is worth $1,426,199,000 as of this writing;7aq0fx;https://www.independent.co.uk/arts-entertainment/music/news/lily-allen-calls-herself-an-idiot-for-declining-bitcoin-payment-now-worth-millions-9046211.html
WUT;1;1;False;;dpd2ky0;Lily Allen turned down 200K in Bitcoins for a gig in 2009 which is worth $1,426,199,000 as of this writing;7aq0fx;https://www.independent.co.uk/arts-entertainment/music/news/lily-allen-calls-herself-an-idiot-for-declining-bitcoin-payment-now-worth-millions-9046211.html
"Was this intended for me?  I can't respond if you don't actually send me the message after all.

Assuming it was intended for me, it's no real secret.  Only difficult to understand.  [Here](https://www.reddit.com/r/Bitcoin/comments/7aq0fx/lily_allen_turned_down_200k_in_bitcoins_for_a_gig/dpcz65q/) I addressed it to someone else that thinks as you.  You can respond there if you have a question.";1;1;False;Frogolocalypse;dpd4u4w;Lily Allen turned down 200K in Bitcoins for a gig in 2009 which is worth $1,426,199,000 as of this writing;7aq0fx;https://www.independent.co.uk/arts-entertainment/music/news/lily-allen-calls-herself-an-idiot-for-declining-bitcoin-payment-now-worth-millions-9046211.html
"[**@lilyallen**](https://twitter.com/lilyallen/)

> [2014-01-05 21:22 UTC](https://twitter.com/lilyallen/status/419942070770741249)

> About 5 years ago someone asked me to stream a gig live on second life for hundreds of thousNds of bitcoins, ""as if"" I said. \#idiot \#idiot

----

^This ^message ^was ^created ^by ^a ^bot

[^[Contact ^creator]](http://np.reddit.com/message/compose/?to=jasie3k&amp;subject=TweetsInCommentsBot)[^[Source ^code]](https://github.com/janpetryk/reddit-bot)
";0;0;False;TweetsInCommentsBot;dpcvxul;Lily Allen turned down 200K in Bitcoins for a gig in 2009 which is worth $1,426,199,000 as of this writing;7aq0fx;https://www.independent.co.uk/arts-entertainment/music/news/lily-allen-calls-herself-an-idiot-for-declining-bitcoin-payment-now-worth-millions-9046211.html
Lol I get upvoted for being wrong. Please downvote.;1;0;False;;dpdhp8d;Lily Allen turned down 200K in Bitcoins for a gig in 2009 which is worth $1,426,199,000 as of this writing;7aq0fx;https://www.independent.co.uk/arts-entertainment/music/news/lily-allen-calls-herself-an-idiot-for-declining-bitcoin-payment-now-worth-millions-9046211.html
A 24 volume is not liquidity of 1.4 billion dollars of Bitcoin into fiat currency. They're totally different concepts.;1;0;False;EightyObselete;dpd3fps;Lily Allen turned down 200K in Bitcoins for a gig in 2009 which is worth $1,426,199,000 as of this writing;7aq0fx;https://www.independent.co.uk/arts-entertainment/music/news/lily-allen-calls-herself-an-idiot-for-declining-bitcoin-payment-now-worth-millions-9046211.html
"There weren't any cryptocurrencies before Bitcoin, Bitcoin was designed to be completely decentralized so it couldn't be shut down like egold, liberty dollar etc...

And guess what, you can't shut it down.";1;0;False;kryptomancer;dpd7bvk;Lily Allen turned down 200K in Bitcoins for a gig in 2009 which is worth $1,426,199,000 as of this writing;7aq0fx;https://www.independent.co.uk/arts-entertainment/music/news/lily-allen-calls-herself-an-idiot-for-declining-bitcoin-payment-now-worth-millions-9046211.html
That means they aren't crypto currencies.  If the crypto can be sidelined, then they aren't a crypto.  Cryptocurrencies that are controlled are that in name only.  Bitcoin is the first real one.;2;0;False;Frogolocalypse;dpcxcee;Lily Allen turned down 200K in Bitcoins for a gig in 2009 which is worth $1,426,199,000 as of this writing;7aq0fx;https://www.independent.co.uk/arts-entertainment/music/news/lily-allen-calls-herself-an-idiot-for-declining-bitcoin-payment-now-worth-millions-9046211.html
"News outlets are supposed to research their articles before publishing them, instead of just assuming that everything that a celebrity says is 100% accurate. 

In this case, the sum total of the research done appears to have been reading a single tweet and doing a google search for 'bitcoin'.";3;1;False;gordo65;dpd2qrw;Lily Allen turned down 200K in Bitcoins for a gig in 2009 which is worth $1,426,199,000 as of this writing;7aq0fx;https://www.independent.co.uk/arts-entertainment/music/news/lily-allen-calls-herself-an-idiot-for-declining-bitcoin-payment-now-worth-millions-9046211.html
"> This is all well and good but I've never seen a single business that actually takes bitcoin for anything. 

I have a bitcoin debit card.  So for me, every business accepts bitcoin.  And my available funds keep going up in value, because they are in bitcoin. ";1;0;False;Frogolocalypse;dpcxpoh;Lily Allen turned down 200K in Bitcoins for a gig in 2009 which is worth $1,426,199,000 as of this writing;7aq0fx;https://www.independent.co.uk/arts-entertainment/music/news/lily-allen-calls-herself-an-idiot-for-declining-bitcoin-payment-now-worth-millions-9046211.html
"Microsoft, Expedia, overstock.com
Itâ€™s going to take some time and many more crashes and bubbles but eventually it could work
Also in Switzerland, the Italian part, you can pay part of your taxes using bitcoin";1;0;False;MissTress23;dpcxtwq;Lily Allen turned down 200K in Bitcoins for a gig in 2009 which is worth $1,426,199,000 as of this writing;7aq0fx;https://www.independent.co.uk/arts-entertainment/music/news/lily-allen-calls-herself-an-idiot-for-declining-bitcoin-payment-now-worth-millions-9046211.html
"Itâ€™s because bitcoin is still in price discovery mode and also is still partly in development.
The base layer is ready but second layer is not ready yet.
So this means it is a usable medium of exchange but it is not ready yet.
Eventually it will stabilize and will be probably used.
In japan itâ€™s considered a legal currency and in a province of Switzerland you can pay almost all your taxes in bitcoin";1;0;False;MissTress23;dpcy1kv;Lily Allen turned down 200K in Bitcoins for a gig in 2009 which is worth $1,426,199,000 as of this writing;7aq0fx;https://www.independent.co.uk/arts-entertainment/music/news/lily-allen-calls-herself-an-idiot-for-declining-bitcoin-payment-now-worth-millions-9046211.html
"There is a finite amount of bitcoin and there will only ever exist 21 million total.
Itâ€™s also impossible to create fake bitcoin because they are tracked every time someone spends them.
So basically you can give it value because in order to trade on the bitcoin network (blockchain) which is borderless and global, you have to have bitcoin and so you have to buy them or earn them.
To buy them you usually offer dollars euros etc so by doing this kind of exchange bitcoin can be valued in usd";1;0;False;MissTress23;dpcyatv;Lily Allen turned down 200K in Bitcoins for a gig in 2009 which is worth $1,426,199,000 as of this writing;7aq0fx;https://www.independent.co.uk/arts-entertainment/music/news/lily-allen-calls-herself-an-idiot-for-declining-bitcoin-payment-now-worth-millions-9046211.html
Well she thought it was Bitcoin according to her tweet from 2014. And my point was that, if she had looked seriously at Bitcoin at that time, the increase in price was predicted by quite a lot of people who spent the time to investigate it.;1;1;False;38degrees;dpctlne;Lily Allen turned down 200K in Bitcoins for a gig in 2009 which is worth $1,426,199,000 as of this writing;7aq0fx;https://www.independent.co.uk/arts-entertainment/music/news/lily-allen-calls-herself-an-idiot-for-declining-bitcoin-payment-now-worth-millions-9046211.html
If bitcoin doesn't meet your use case, i definitely suggest not using it.  Good luck!;1;0;False;Frogolocalypse;dpcxnen;Lily Allen turned down 200K in Bitcoins for a gig in 2009 which is worth $1,426,199,000 as of this writing;7aq0fx;https://www.independent.co.uk/arts-entertainment/music/news/lily-allen-calls-herself-an-idiot-for-declining-bitcoin-payment-now-worth-millions-9046211.html
"Coinbase is one of the most easy to use but also the most expensive and slow.
You should try kraken.com";1;0;False;MissTress23;dpcyd9b;Lily Allen turned down 200K in Bitcoins for a gig in 2009 which is worth $1,426,199,000 as of this writing;7aq0fx;https://www.independent.co.uk/arts-entertainment/music/news/lily-allen-calls-herself-an-idiot-for-declining-bitcoin-payment-now-worth-millions-9046211.html
 actually, that isn't really confirmation bias. ;0;1;False;Frogolocalypse;dpcxtf7;Lily Allen turned down 200K in Bitcoins for a gig in 2009 which is worth $1,426,199,000 as of this writing;7aq0fx;https://www.independent.co.uk/arts-entertainment/music/news/lily-allen-calls-herself-an-idiot-for-declining-bitcoin-payment-now-worth-millions-9046211.html
[deleted];1;1;False;;dpd0jli;Lily Allen turned down 200K in Bitcoins for a gig in 2009 which is worth $1,426,199,000 as of this writing;7aq0fx;https://www.independent.co.uk/arts-entertainment/music/news/lily-allen-calls-herself-an-idiot-for-declining-bitcoin-payment-now-worth-millions-9046211.html
"[**@zzJTxx**](https://twitter.com/zzJTxx/)

> [2014-01-07 10:44 UTC](https://twitter.com/zzJTxx/status/420506146982481920)

> @lilyallen I've got a million \#Dogecoin here with your name on them if you'll play a gig at my birthday!

----

^This ^message ^was ^created ^by ^a ^bot

[^[Contact ^creator]](http://np.reddit.com/message/compose/?to=jasie3k&amp;subject=TweetsInCommentsBot)[^[Source ^code]](https://github.com/janpetryk/reddit-bot)
";1;0;False;TweetsInCommentsBot;dpcyptv;Lily Allen turned down 200K in Bitcoins for a gig in 2009 which is worth $1,426,199,000 as of this writing;7aq0fx;https://www.independent.co.uk/arts-entertainment/music/news/lily-allen-calls-herself-an-idiot-for-declining-bitcoin-payment-now-worth-millions-9046211.html
When it crashes you won't buy it, then it will go up even higher as it has the last 4-5 times.;1;0;False;kryptomancer;dpd7dtr;Lily Allen turned down 200K in Bitcoins for a gig in 2009 which is worth $1,426,199,000 as of this writing;7aq0fx;https://www.independent.co.uk/arts-entertainment/music/news/lily-allen-calls-herself-an-idiot-for-declining-bitcoin-payment-now-worth-millions-9046211.html
Ouch.;1;0;False;devourer09;dpctwyy;Lily Allen turned down 200K in Bitcoins for a gig in 2009 which is worth $1,426,199,000 as of this writing;7aq0fx;https://www.independent.co.uk/arts-entertainment/music/news/lily-allen-calls-herself-an-idiot-for-declining-bitcoin-payment-now-worth-millions-9046211.html
"Gladly. I'd advise you to do that same. [Google's definition is](https://www.google.com/search?source=hp&q=define%3Acommunism&oq=define%3Acommunism), ""a political theory derived from Karl Marx, advocating **class war** and leading to a society in which **all property is publicly owned** and each person works and is paid according to their abilities and needs.""

""In which all property is publicly owned"", i.e. the government steals most, if not all, of your property if someone ""needs"" it more than you. Read a history book please. Communism killed more people than Hitler. Millions died of starvation alone in Russia and China after farms were confiscated by the government, with many more dying in purges when people refused to go alone with this ""egalitarian"" redistribution of wealth. And you're seeing this now repeat in Venezuela.";1;2;False;GrabAHamLincoln;dpdzs5c;Lily Allen turned down 200K in Bitcoins for a gig in 2009 which is worth $1,426,199,000 as of this writing;7aq0fx;https://www.independent.co.uk/arts-entertainment/music/news/lily-allen-calls-herself-an-idiot-for-declining-bitcoin-payment-now-worth-millions-9046211.html
I think I actually remember that. Fuck.;1;0;False;stiell;dpcu2yl;Lily Allen turned down 200K in Bitcoins for a gig in 2009 which is worth $1,426,199,000 as of this writing;7aq0fx;https://www.independent.co.uk/arts-entertainment/music/news/lily-allen-calls-herself-an-idiot-for-declining-bitcoin-payment-now-worth-millions-9046211.html
[deleted];1;2;False;;dpd6uf9;Lily Allen turned down 200K in Bitcoins for a gig in 2009 which is worth $1,426,199,000 as of this writing;7aq0fx;https://www.independent.co.uk/arts-entertainment/music/news/lily-allen-calls-herself-an-idiot-for-declining-bitcoin-payment-now-worth-millions-9046211.html
">The plebs like you

No need for that. 

Satoshis coins have never moved, if they did it wouldn't be to an exchange, if he were to send them to an exchange it would nullify all the work he put into remaining anonymous. 

In the beginning there was no specialised hardware, just CPU mining, GPU came later and ASICS came way after that. 

You're uninformed, you're obviously angry and you've no respect for people who are talking to you politely. 

I wish you all the best man, you may need it. ";2;0;False;nannal;dpd13s7;Lily Allen turned down 200K in Bitcoins for a gig in 2009 which is worth $1,426,199,000 as of this writing;7aq0fx;https://www.independent.co.uk/arts-entertainment/music/news/lily-allen-calls-herself-an-idiot-for-declining-bitcoin-payment-now-worth-millions-9046211.html
Maybe you should... I dont know... do some research???  You really are a fool if you canâ€™t realize both good and bad things get hyped.  Good luck dismissing it based on your feelings ;1;1;False;null55;dpcsjs6;Lily Allen turned down 200K in Bitcoins for a gig in 2009 which is worth $1,426,199,000 as of this writing;7aq0fx;https://www.independent.co.uk/arts-entertainment/music/news/lily-allen-calls-herself-an-idiot-for-declining-bitcoin-payment-now-worth-millions-9046211.html
Only time I hear bitcoin is a scam is from people dont do not understand the technology. ;1;1;False;Tillhony;dpdewdj;Lily Allen turned down 200K in Bitcoins for a gig in 2009 which is worth $1,426,199,000 as of this writing;7aq0fx;https://www.independent.co.uk/arts-entertainment/music/news/lily-allen-calls-herself-an-idiot-for-declining-bitcoin-payment-now-worth-millions-9046211.html
