body;score;nb_replies;stickied;author;id;post_title;post_id;post_link
There are very well established examples of hyperinflation for fiat currency too. The assumption that the USD or EUR will never end up like the Mark (rapidly and violently), the Lira (to a much lesser extend and in a longer timespan) or the country that adopted a fiat currency for the first time in history: 1947-1948 China is more a wish than a certainty;3;1;False;The_GASK;dpcvcgc;Lily Allen turned down 200K in Bitcoins for a gig in 2009 which is worth $1,426,199,000 as of this writing;7aq0fx;https://www.independent.co.uk/arts-entertainment/music/news/lily-allen-calls-herself-an-idiot-for-declining-bitcoin-payment-now-worth-millions-9046211.html
Ha! Nice.  So glad you and many others exploring these worlds found bitcoin so early.  It's gonna' be if WoW and SL integrate their own alts via atomic swaps and all this gets rolled into VR o_O;2;0;False;smeggletoot;dpcv67p;Lily Allen turned down 200K in Bitcoins for a gig in 2009 which is worth $1,426,199,000 as of this writing;7aq0fx;https://www.independent.co.uk/arts-entertainment/music/news/lily-allen-calls-herself-an-idiot-for-declining-bitcoin-payment-now-worth-millions-9046211.html
"Woooh yeah, me too :) . The clubs were awesome.  I remember me and my mate having to console some poor fella in a ""pub"" who was beside himself in tears as he had got thrown out of ""Planet Lesbos"" which was an all female zone and he got rumbled for being a fella.

Was very very weird.  Gonna get even weirder with this stuff goes into the HTC Vive and those ATMs and clubs are 'Real'.  o_O

Make sure you have your [Totem](https://www.youtube.com/watch?v=sNrdx52SoEs) ready at all times in this new world yeah :D 


";1;0;False;smeggletoot;dpcue9q;Lily Allen turned down 200K in Bitcoins for a gig in 2009 which is worth $1,426,199,000 as of this writing;7aq0fx;https://www.independent.co.uk/arts-entertainment/music/news/lily-allen-calls-herself-an-idiot-for-declining-bitcoin-payment-now-worth-millions-9046211.html
"Yeah I don't disagree with you on most of this. Only two remarks:

As for better investment it just depends what you're after. When I go to my bank and look at what kind of packages they offer they rate them on a scale of low risk low reward to high risk high reward. If you're the kind of person who goes for for the latter than cyrpto currencies are absolutely ""good"" for you.

> Bitcoin miners are going to have no incentive to vote this through though, even though its whats best for use as a currency. They didn't invest millions in mining equipment with dreams of making a small steady income off transaction fees.

That's actually what I mean. I don't think fees are a sustainable way to incentivize mining and we'd all prefer Bitcoin to just have low or zero fees. That's one of its main original value propositions which appeals to the average user on a daily basis. Instead, the value proposition that it has a hard limit is not helpful to its adoption or utility or network sustainability and mostly just serves to give libertarians a hard on. My proposal would be to continue giving block rewards forever, even if just 1 BTC. If Bitcoin becomes globally adopted and in demand even a single BTC will be a massive reward and will only inflate the currency by 0.2% per year.";1;0;False;ianpaschal;dpdouvi;Lily Allen turned down 200K in Bitcoins for a gig in 2009 which is worth $1,426,199,000 as of this writing;7aq0fx;https://www.independent.co.uk/arts-entertainment/music/news/lily-allen-calls-herself-an-idiot-for-declining-bitcoin-payment-now-worth-millions-9046211.html
[deleted];2;1;False;;dpe79t5;Lily Allen turned down 200K in Bitcoins for a gig in 2009 which is worth $1,426,199,000 as of this writing;7aq0fx;https://www.independent.co.uk/arts-entertainment/music/news/lily-allen-calls-herself-an-idiot-for-declining-bitcoin-payment-now-worth-millions-9046211.html
"Okay I get it, you think that everything is random. Knowledge cannot give you an advantage in this world. We are all sheep. Gotcha.

**Edit:** Good idea to delete your account, in case you also look like a complete fool in hindsight in a few years.";1;0;False;38degrees;dpcvy7i;Lily Allen turned down 200K in Bitcoins for a gig in 2009 which is worth $1,426,199,000 as of this writing;7aq0fx;https://www.independent.co.uk/arts-entertainment/music/news/lily-allen-calls-herself-an-idiot-for-declining-bitcoin-payment-now-worth-millions-9046211.html
"Speculation does certainly drive the stock market to an extent, but it is not the base factor. The vast majority of stocks pay the owner dividends, and the value of the stock is based primarily on the belief that they will continue to make those payments. Bonds work the same way except with coupon payments. Speculation shifts the price of the security beyond that, but those coupon payments separate them from bitcoin. 

Speculation is buying an asset with the intention of selling it later and the belief that it will increase in value. That can be done because you saw a trend, or because you understand the market better than the other investors in the market. Speculation is a style of investment, but buying bitcoins at the moment is very different from buying a security. 

For example, a significant portion of my savings is in JP Morgan stock, because I believe they will continue to make dividend payments for the foreseeable future. That is not speculative. A few years ago, the price dropped dramatically after JPM lost a few billion dollars in a day. I thought the market overreacted to this and the price would recover in a few weeks, so I bought some and sold when the price recovered. That was speculation. Investing in Bitcoin must be speculative because thereâ€™s no chance of return outside of the price increasing. 

Also, you donâ€™t know what bitcoin is going to do. You may be smarter than everyone else and it may be undervalued, but you shouldnâ€™t treat it as a certainty ";1;1;False;;dpd22p0;Lily Allen turned down 200K in Bitcoins for a gig in 2009 which is worth $1,426,199,000 as of this writing;7aq0fx;https://www.independent.co.uk/arts-entertainment/music/news/lily-allen-calls-herself-an-idiot-for-declining-bitcoin-payment-now-worth-millions-9046211.html
"We should all have learned the lessons from music/movies/art/books content...the infinite digital realm is not a reliable store of value for anything.  The few at the top will find a way to screw the bottom half of the pyramid who will have no recourse, no matter what public ledger you think you have.   
 Computing power will certainly outgrow bitcoin in its current state.  The protections put in place on bitcoin will have to be constantly ahead of everything else out there...that's a heavy burden.  There's nothing backing it, nothing is insured...you're one large breach/heist away from a mass exodus....outside of a few billionaires manipulating the market and propping it up right now as it is.  It's far less ""decentralized"" than you think.  Part of an article from Fortune:   ""As Bitcoin Cash duplicated Bitcoin, at the time of the fork every bitcoin holder now had coins on another blockchain, and therefore skin in the game. This was a type of psychological experiment to see if people as a group could be tricked into ascribing value to something created from nothing, if they were given it as a gift. This experiment seemed to work, and it put a great deal of pressure on exchanges and wallet providers to support Bitcoin Cash, whereas a new altcoin would largely just be ignored.""  ";1;0;False;;dpd2ive;Lily Allen turned down 200K in Bitcoins for a gig in 2009 which is worth $1,426,199,000 as of this writing;7aq0fx;https://www.independent.co.uk/arts-entertainment/music/news/lily-allen-calls-herself-an-idiot-for-declining-bitcoin-payment-now-worth-millions-9046211.html
Even if she did it, she would have cashed out ASAP, which means this article would still exist but she would be lamenting how she should have not cashed out ;2;0;False;scottbuster2000;dpd4t2o;Lily Allen turned down 200K in Bitcoins for a gig in 2009 which is worth $1,426,199,000 as of this writing;7aq0fx;https://www.independent.co.uk/arts-entertainment/music/news/lily-allen-calls-herself-an-idiot-for-declining-bitcoin-payment-now-worth-millions-9046211.html
Take some meta and live your life!:);2;1;False;LucianE11;dpd9n3b;Lily Allen turned down 200K in Bitcoins for a gig in 2009 which is worth $1,426,199,000 as of this writing;7aq0fx;https://www.independent.co.uk/arts-entertainment/music/news/lily-allen-calls-herself-an-idiot-for-declining-bitcoin-payment-now-worth-millions-9046211.html
"I completely agree with what you're saying, but his point was that you 100% can use certain VISA cards to pay for at any store that accepts VISA directly from your Bitcoin wallet.  The Card Issuer buys the Bitcoin from you the second you swipe the card, but they've already paid the merchant as that card finishes swiping.

There is no ""physical Bitcoin.""  You can think of the Bitcoin blockchain as a Microsoft Excel sheet that any person on earth can run on most devices to validate every single transaction.

With all that said though...

I would never EVER want my spending ""cash"" on my debit card to be worth $500 when I get my morning coffee, but then all of a sudden be worth $100 when I go to buy my lunch.  Just seems asinine to me.  Like, why not just use physical cash like a normal person and know what it's worth because it says so on the damn cash.";1;0;False;RaginglikeaBoss;dpdhe6n;Lily Allen turned down 200K in Bitcoins for a gig in 2009 which is worth $1,426,199,000 as of this writing;7aq0fx;https://www.independent.co.uk/arts-entertainment/music/news/lily-allen-calls-herself-an-idiot-for-declining-bitcoin-payment-now-worth-millions-9046211.html
"> McDonald's does not accept Bitcoin 

 Did i pay bitcoin?  Yes.  Do i have McDonald's?  Yes.

Ever traveled?  Probably not. Use that cc of yours in another country?  Same thing. ";1;0;False;Frogolocalypse;dpcvrab;Lily Allen turned down 200K in Bitcoins for a gig in 2009 which is worth $1,426,199,000 as of this writing;7aq0fx;https://www.independent.co.uk/arts-entertainment/music/news/lily-allen-calls-herself-an-idiot-for-declining-bitcoin-payment-now-worth-millions-9046211.html
"> Speculation does certainly drive the stock market to an extent, but it is not the base factor. 

That sounds more of an opinion than anything else dude.  It sounds to me like you have a problem with market price discovery.

> Speculation is buying an asset with the intention of selling it later and the belief that it will increase in value

Every asset investment purchase is made on that premise.

> a significant portion of my savings is in JP Morgan stock, because I believe they will continue to make dividend payments for the foreseeable future

So every facebook investor is simply a speculator?  Why don't you argue the finer points of your theory of investing with them?

> Also, you donâ€™t know what bitcoin is going to do.

I'm an investor that understands the technology, and what's happening is I'm being proven right in my investment decisions, for reasons I can explain, and which were the reasons for investing in the first place.

> You may be smarter than everyone else and it may be undervalued, but you shouldnâ€™t treat it as a certainty 

I'm not smarter than everyone else.  Every person who understands this technology started as you.  I started as you.  When you finally understand what bitcoin is, and you start trying to find vulnerabilities, you realize that this is truly the greatest breakthrough in finance and money for almost a thousand years.  It's not about being smart.  To bet against that, when you understand it, isn't just ignorance, it's downright dumb.  You're not dumb for not knowing this stuff.   I'd just be dumb for not acting on the things that i know. ";1;1;False;Frogolocalypse;dpd2ej3;Lily Allen turned down 200K in Bitcoins for a gig in 2009 which is worth $1,426,199,000 as of this writing;7aq0fx;https://www.independent.co.uk/arts-entertainment/music/news/lily-allen-calls-herself-an-idiot-for-declining-bitcoin-payment-now-worth-millions-9046211.html
"im not trying to be a ""counter argument guy"" im just weary of investing any money into something that is risky. I don't have a BTC exchange here that has that kind of cash, let alone one that would allow me to cash out. I don't think its the same as an art like photography but im just a casual interest type. If its money I want to be able to use it anywhere, not special places. Its like a credit card(though not), but why would I apply for a credit card that isn't accepted at 85% of the businesses around me? bad analogy, but the point is unless I can turn it into USD/CAD as easily as I can with fiat(cash?) why risk it? I guess i could always travel to someplace that would but that costs money. im not trying to say its a bad currency its just limited. where as if i had a million USD i could use that anywhere on the planet, reasonably.";1;1;False;CalvinsCuriosity;dpdanow;Lily Allen turned down 200K in Bitcoins for a gig in 2009 which is worth $1,426,199,000 as of this writing;7aq0fx;https://www.independent.co.uk/arts-entertainment/music/news/lily-allen-calls-herself-an-idiot-for-declining-bitcoin-payment-now-worth-millions-9046211.html
exceptions aren't the point here. The point is that you could be a btc millionaire on paper but in reality have nothing close to that. ;0;1;False;CalvinsCuriosity;dpcwf2o;Lily Allen turned down 200K in Bitcoins for a gig in 2009 which is worth $1,426,199,000 as of this writing;7aq0fx;https://www.independent.co.uk/arts-entertainment/music/news/lily-allen-calls-herself-an-idiot-for-declining-bitcoin-payment-now-worth-millions-9046211.html
Maybe she thought it was an imaginary currency that had no worth? If I asked you to do whatever your job is for a full shift for me, for 100,000 dollars in monopoly money, I think you might turn me down. ;2;0;False;AmaiRose;dpd1vmw;Lily Allen turned down 200K in Bitcoins for a gig in 2009 which is worth $1,426,199,000 as of this writing;7aq0fx;https://www.independent.co.uk/arts-entertainment/music/news/lily-allen-calls-herself-an-idiot-for-declining-bitcoin-payment-now-worth-millions-9046211.html
What would you advise to somebody wants to get into this? Asking for a friend.;1;0;False;kowdermesiter;dpdg52l;Lily Allen turned down 200K in Bitcoins for a gig in 2009 which is worth $1,426,199,000 as of this writing;7aq0fx;https://www.independent.co.uk/arts-entertainment/music/news/lily-allen-calls-herself-an-idiot-for-declining-bitcoin-payment-now-worth-millions-9046211.html
That's sucks so bad. Smh hindsight's 20/20;2;0;False;EvilAbacus;dpcysds;Lily Allen turned down 200K in Bitcoins for a gig in 2009 which is worth $1,426,199,000 as of this writing;7aq0fx;https://www.independent.co.uk/arts-entertainment/music/news/lily-allen-calls-herself-an-idiot-for-declining-bitcoin-payment-now-worth-millions-9046211.html
I would never do this for fear of finding cp or other evidence of crimes.;1;0;False;DaiTaHomer;dpdcu5t;Lily Allen turned down 200K in Bitcoins for a gig in 2009 which is worth $1,426,199,000 as of this writing;7aq0fx;https://www.independent.co.uk/arts-entertainment/music/news/lily-allen-calls-herself-an-idiot-for-declining-bitcoin-payment-now-worth-millions-9046211.html
[She also turned down 1,000,000 Dogecoin for a gig in 2014](https://twitter.com/zzJTxx/status/420506146982481920), which is now worth... um... $1158.60;3;1;False;jamesdthomson;dpcypib;Lily Allen turned down 200K in Bitcoins for a gig in 2009 which is worth $1,426,199,000 as of this writing;7aq0fx;https://www.independent.co.uk/arts-entertainment/music/news/lily-allen-calls-herself-an-idiot-for-declining-bitcoin-payment-now-worth-millions-9046211.html
The ironic thing is itâ€™s the exact opposite and youâ€™re not ever going to figure it out because youâ€™re dismissing it and you have absolutely no knowledge on the subject.  You must be really smart;-4;1;False;null55;dpcsnqv;Lily Allen turned down 200K in Bitcoins for a gig in 2009 which is worth $1,426,199,000 as of this writing;7aq0fx;https://www.independent.co.uk/arts-entertainment/music/news/lily-allen-calls-herself-an-idiot-for-declining-bitcoin-payment-now-worth-millions-9046211.html
"> Do you actually spend it or do you sell it for dollars and then spend dollars?

I spend it directly.  If the places I spend it then choose to convert it to fiat themselves or through their payment processor, that's their business.  I however am definitely not converting to fiat first.

For reference, my local fiat is euro, not dollars.  Some of the places I spend it probably use dollars as their local fiat.  Either way, I don't actually need to know or really care.

> The point of a logarithmic scale is for things like decibels, or earthquakes that are exponential.  
20 decibels is not double 10 decibels, its 10x that amount. A linear scale does not effectively show the difference between 10 and 20 decibels.  
Money is linear. 20 dollars is just double 10 dollars. There's no exponential increase or decrease.

I never said money is exponential.  I said it should be shown on an logarithmic scale.  That is, a scale where the distance between 1 and 2 is the same as the distance between 1000 and 2000.  The chart you showed first was a linear scale, where the difference between 1 and 2 is one one-thousandth of the difference between 1000 and 2000.

For example, compare this [linear scale](https://imgur.com/a/nuoUv) to this [logarithmic one](https://imgur.com/a/2xUu3).  Both are the exchange rate of bitcoin to USD over the same time period on the same exchange.";2;1;False;dalebewan;dpea90p;Lily Allen turned down 200K in Bitcoins for a gig in 2009 which is worth $1,426,199,000 as of this writing;7aq0fx;https://www.independent.co.uk/arts-entertainment/music/news/lily-allen-calls-herself-an-idiot-for-declining-bitcoin-payment-now-worth-millions-9046211.html
Financial institutions are willing to make a profit off it, that doesn't mean they accept it. They are actually much more open to more modern superior blockchains like Ethereum that will eventually supersede Bitcoin. I have a little over 1 bitcoin, I have skin in this game, but it's just all hype right now and as soon as cryptocurrencies become a serious competitor to fiat currency, Governments will either ban its use as a money or people will flip to a superior blockchain (following what companies are currently doing with Ethereum).;5;1;False;salgat;dpcsgih;Lily Allen turned down 200K in Bitcoins for a gig in 2009 which is worth $1,426,199,000 as of this writing;7aq0fx;https://www.independent.co.uk/arts-entertainment/music/news/lily-allen-calls-herself-an-idiot-for-declining-bitcoin-payment-now-worth-millions-9046211.html
"Stocks offer returns based on performance, profits, and dividends. 

Bitcoin relies on being sold at a higher price.";3;0;False;theorymeltfool;dpct2f2;Lily Allen turned down 200K in Bitcoins for a gig in 2009 which is worth $1,426,199,000 as of this writing;7aq0fx;https://www.independent.co.uk/arts-entertainment/music/news/lily-allen-calls-herself-an-idiot-for-declining-bitcoin-payment-now-worth-millions-9046211.html
[deleted];2;1;False;;dpd0cda;Lily Allen turned down 200K in Bitcoins for a gig in 2009 which is worth $1,426,199,000 as of this writing;7aq0fx;https://www.independent.co.uk/arts-entertainment/music/news/lily-allen-calls-herself-an-idiot-for-declining-bitcoin-payment-now-worth-millions-9046211.html
"**Proof-of-work system**

A proof-of-work (POW) system (or protocol, or function) is an economic measure to deter denial of service attacks and other service abuses such as spam on a network by requiring some work from the service requester, usually meaning processing time by a computer. The concept was invented by Cynthia Dwork and Moni Naor as presented in a 1993 journal article. The term ""Proof of Work"" or POW was first coined and formalized in a 1999 paper by Markus Jakobsson and Ari Juels.An early example of the proof-of-work system used to give value to a currency is the Shell Money of the Solomon Islands.

A key feature of these schemes is their asymmetry: the work must be moderately hard (but feasible) on the requester side but easy to check for the service provider.

***

**Proof-of-stake**

Proof-of-stake (PoS) is a type of algorithm by which a cryptocurrency blockchain network aims to achieve distributed consensus. In PoS-based cryptocurrencies the creator of the next block is chosen via various combinations of random selection and wealth or age (i.e. the stake). In contrast, the algorithm of proof-of-work (PoW) based cryptocurrencies (such as bitcoin) rewards participants who solve complicated cryptographical puzzles in order to validate transactions and create new blocks (i.e.

***

^[ [^PM](https://www.reddit.com/message/compose?to=kittens_from_space) ^| [^Exclude ^me](https://reddit.com/message/compose?to=WikiTextBot&message=Excludeme&subject=Excludeme) ^| [^Exclude ^from ^subreddit](https://np.reddit.com/r/Bitcoin/about/banned) ^| [^FAQ ^/ ^Information](https://np.reddit.com/r/WikiTextBot/wiki/index) ^| [^Source](https://github.com/kittenswolf/WikiTextBot) ^| [^Donate](https://www.reddit.com/r/WikiTextBot/wiki/donate)   ^]
^Downvote ^to ^remove ^| ^v0.28";1;0;False;WikiTextBot;dpcz6an;Lily Allen turned down 200K in Bitcoins for a gig in 2009 which is worth $1,426,199,000 as of this writing;7aq0fx;https://www.independent.co.uk/arts-entertainment/music/news/lily-allen-calls-herself-an-idiot-for-declining-bitcoin-payment-now-worth-millions-9046211.html
Wasn't this the plot of a recent movie?;1;0;False;Cr3X1eUZ;dpdazji;Lily Allen turned down 200K in Bitcoins for a gig in 2009 which is worth $1,426,199,000 as of this writing;7aq0fx;https://www.independent.co.uk/arts-entertainment/music/news/lily-allen-calls-herself-an-idiot-for-declining-bitcoin-payment-now-worth-millions-9046211.html
[deleted];1;1;False;;dpd0ijd;Lily Allen turned down 200K in Bitcoins for a gig in 2009 which is worth $1,426,199,000 as of this writing;7aq0fx;https://www.independent.co.uk/arts-entertainment/music/news/lily-allen-calls-herself-an-idiot-for-declining-bitcoin-payment-now-worth-millions-9046211.html
Artists have managers & agents that advise them and want a cut. Itâ€™s not really ha-ha Lilly. ;1;0;False;jtferdinand;dpdd4gm;Lily Allen turned down 200K in Bitcoins for a gig in 2009 which is worth $1,426,199,000 as of this writing;7aq0fx;https://www.independent.co.uk/arts-entertainment/music/news/lily-allen-calls-herself-an-idiot-for-declining-bitcoin-payment-now-worth-millions-9046211.html
