body;score;nb_replies;stickied;author;id;post_title;post_id;post_link
"Yes, the exchange still exists: 

https://www.virwox.com

This was actually how I first learned of Bitcoin. Unfortunately Linden shut down sale of Linden Dollars for Bitcoin within maybe 6 months, iirc. Iâ€™d been making around $600/year from SL from around 2009-20011 and had tried to setup an account at VirWox, but by the time I got it ready they disabled Bitcoin. You had to create an account on the website, then go link it from in world. 

Some time later, fall of 2013, I came across Bitcoin again and went with Coinbase and then got swept up by the tech and itâ€™s been quite a ride! But, well, thatâ€™s my â€˜what ifâ€™ story. Tbh, it would be really trippy to have millions of dollars of Bitcoin from selling virtual goods in Second Life. ";3;1;False;btc_being_good_to_me;dpcu8e5;Lily Allen turned down 200K in Bitcoins for a gig in 2009 which is worth $1,426,199,000 as of this writing;7aq0fx;https://www.independent.co.uk/arts-entertainment/music/news/lily-allen-calls-herself-an-idiot-for-declining-bitcoin-payment-now-worth-millions-9046211.html
"This post actually got me to unsub from r/Bitcoin

";0;0;False;xenyz;dpcv4oh;Lily Allen turned down 200K in Bitcoins for a gig in 2009 which is worth $1,426,199,000 as of this writing;7aq0fx;https://www.independent.co.uk/arts-entertainment/music/news/lily-allen-calls-herself-an-idiot-for-declining-bitcoin-payment-now-worth-millions-9046211.html
xd;1;0;False;;dpcyzmi;Lily Allen turned down 200K in Bitcoins for a gig in 2009 which is worth $1,426,199,000 as of this writing;7aq0fx;https://www.independent.co.uk/arts-entertainment/music/news/lily-allen-calls-herself-an-idiot-for-declining-bitcoin-payment-now-worth-millions-9046211.html
"The ""game"" was ahead of its time. I used to leave it on in the background and randomly teleport to clubs with live DJs. Interactive way of listening to random music ";4;1;False;bro_b1_kenobi;dpctzqh;Lily Allen turned down 200K in Bitcoins for a gig in 2009 which is worth $1,426,199,000 as of this writing;7aq0fx;https://www.independent.co.uk/arts-entertainment/music/news/lily-allen-calls-herself-an-idiot-for-declining-bitcoin-payment-now-worth-millions-9046211.html
[deleted];1;1;False;;dpd0n5m;Lily Allen turned down 200K in Bitcoins for a gig in 2009 which is worth $1,426,199,000 as of this writing;7aq0fx;https://www.independent.co.uk/arts-entertainment/music/news/lily-allen-calls-herself-an-idiot-for-declining-bitcoin-payment-now-worth-millions-9046211.html
[deleted];1;1;False;;dpd1d7q;Lily Allen turned down 200K in Bitcoins for a gig in 2009 which is worth $1,426,199,000 as of this writing;7aq0fx;https://www.independent.co.uk/arts-entertainment/music/news/lily-allen-calls-herself-an-idiot-for-declining-bitcoin-payment-now-worth-millions-9046211.html
"What do you mean with is there a limit?
Right now there are almost 17 million bitcoin in existence for certain and few more will be mined in the next decades till we get to 21 million total bitcoin.
You canâ€™t fake them or create more because there is a public ledger copied in thousands of computes that track every bitcoin from the moment it is mined and all the transactions done with it.";1;1;False;MissTress23;dpcza2y;Lily Allen turned down 200K in Bitcoins for a gig in 2009 which is worth $1,426,199,000 as of this writing;7aq0fx;https://www.independent.co.uk/arts-entertainment/music/news/lily-allen-calls-herself-an-idiot-for-declining-bitcoin-payment-now-worth-millions-9046211.html
Also, logically it's no different than saying [person] missed out on $1,426,199,000 by not investing $200k in 2009. ;3;0;False;DysBard;dpcwjv3;Lily Allen turned down 200K in Bitcoins for a gig in 2009 which is worth $1,426,199,000 as of this writing;7aq0fx;https://www.independent.co.uk/arts-entertainment/music/news/lily-allen-calls-herself-an-idiot-for-declining-bitcoin-payment-now-worth-millions-9046211.html
you mad bro;1;1;False;;dpd2lft;Lily Allen turned down 200K in Bitcoins for a gig in 2009 which is worth $1,426,199,000 as of this writing;7aq0fx;https://www.independent.co.uk/arts-entertainment/music/news/lily-allen-calls-herself-an-idiot-for-declining-bitcoin-payment-now-worth-millions-9046211.html
I don't know man. I think its this fallacy mixed along with people's ignorance of what exactly bitcoin is or how its generated. It's not exactly like gambling. There's almost an element of mysticism to it for them. ;1;0;False;HiggsB0;dpd7i86;Lily Allen turned down 200K in Bitcoins for a gig in 2009 which is worth $1,426,199,000 as of this writing;7aq0fx;https://www.independent.co.uk/arts-entertainment/music/news/lily-allen-calls-herself-an-idiot-for-declining-bitcoin-payment-now-worth-millions-9046211.html
Fair enough, i'll delete it :);1;0;False;Oggie90;dpdiwvw;Lily Allen turned down 200K in Bitcoins for a gig in 2009 which is worth $1,426,199,000 as of this writing;7aq0fx;https://www.independent.co.uk/arts-entertainment/music/news/lily-allen-calls-herself-an-idiot-for-declining-bitcoin-payment-now-worth-millions-9046211.html
I think you have this somewhat backwards.  The value is driven by supply vs demand.  Trades are an indication that there is an imbalance in market (some people think price should be lower, some think it should be higher).  Trading is an effect, a symptom, of demand.  Trading volume dies down as price stabilizes, as both sides of the market have come to an agreement on the current price.  The price does not approach zero because trading stops, it does so due to lack of demand, which causes trading to stop.;1;1;False;keypusher;dpd0fd8;Lily Allen turned down 200K in Bitcoins for a gig in 2009 which is worth $1,426,199,000 as of this writing;7aq0fx;https://www.independent.co.uk/arts-entertainment/music/news/lily-allen-calls-herself-an-idiot-for-declining-bitcoin-payment-now-worth-millions-9046211.html
My stocks in NVDA and AMD have been doing quite well over the past few years, much more stable than bitcoin too.;2;1;False;theorymeltfool;dpcswoj;Lily Allen turned down 200K in Bitcoins for a gig in 2009 which is worth $1,426,199,000 as of this writing;7aq0fx;https://www.independent.co.uk/arts-entertainment/music/news/lily-allen-calls-herself-an-idiot-for-declining-bitcoin-payment-now-worth-millions-9046211.html
Fuck time, build a space machine ;2;0;False;bazpaul;dpd453y;Lily Allen turned down 200K in Bitcoins for a gig in 2009 which is worth $1,426,199,000 as of this writing;7aq0fx;https://www.independent.co.uk/arts-entertainment/music/news/lily-allen-calls-herself-an-idiot-for-declining-bitcoin-payment-now-worth-millions-9046211.html
[deleted];1;1;False;;dpd3c15;Lily Allen turned down 200K in Bitcoins for a gig in 2009 which is worth $1,426,199,000 as of this writing;7aq0fx;https://www.independent.co.uk/arts-entertainment/music/news/lily-allen-calls-herself-an-idiot-for-declining-bitcoin-payment-now-worth-millions-9046211.html
Aaaand you're wrong.  I have a bitcoin debit card.  I was drinking beers with it last night. ;2;1;False;Frogolocalypse;dpctiru;Lily Allen turned down 200K in Bitcoins for a gig in 2009 which is worth $1,426,199,000 as of this writing;7aq0fx;https://www.independent.co.uk/arts-entertainment/music/news/lily-allen-calls-herself-an-idiot-for-declining-bitcoin-payment-now-worth-millions-9046211.html
fake news on reddit how could this happen;0;0;False;;dpd6762;Lily Allen turned down 200K in Bitcoins for a gig in 2009 which is worth $1,426,199,000 as of this writing;7aq0fx;https://www.independent.co.uk/arts-entertainment/music/news/lily-allen-calls-herself-an-idiot-for-declining-bitcoin-payment-now-worth-millions-9046211.html
Holyâ€¦;1;0;False;Pepe-the-libertarian;dpczbzw;Lily Allen turned down 200K in Bitcoins for a gig in 2009 which is worth $1,426,199,000 as of this writing;7aq0fx;https://www.independent.co.uk/arts-entertainment/music/news/lily-allen-calls-herself-an-idiot-for-declining-bitcoin-payment-now-worth-millions-9046211.html
Hindsight is 20/20;1;0;False;booksandlattes;dpd4b1l;Lily Allen turned down 200K in Bitcoins for a gig in 2009 which is worth $1,426,199,000 as of this writing;7aq0fx;https://www.independent.co.uk/arts-entertainment/music/news/lily-allen-calls-herself-an-idiot-for-declining-bitcoin-payment-now-worth-millions-9046211.html
Wow, the gif from 2009 is worth all that money today?;1;0;False;;dpd58pf;Lily Allen turned down 200K in Bitcoins for a gig in 2009 which is worth $1,426,199,000 as of this writing;7aq0fx;https://www.independent.co.uk/arts-entertainment/music/news/lily-allen-calls-herself-an-idiot-for-declining-bitcoin-payment-now-worth-millions-9046211.html
Sounded dodgy at the outset;1;0;False;Haso_04;dpd5tbf;Lily Allen turned down 200K in Bitcoins for a gig in 2009 which is worth $1,426,199,000 as of this writing;7aq0fx;https://www.independent.co.uk/arts-entertainment/music/news/lily-allen-calls-herself-an-idiot-for-declining-bitcoin-payment-now-worth-millions-9046211.html
"It's still speculation. It provides you no return outside of the increased price unlike financial securities, so your expectation of profit is based entirely on the belief that people will believe it is more valuable in the future.

In my opinion, speculation is only smart if you're acting on information that the rest of the market does not have, which you very well may be as a pure genius. I certainly don't think I have more information than the market, so it would be foolish for me to speculate.";1;1;False;;dpcy6r1;Lily Allen turned down 200K in Bitcoins for a gig in 2009 which is worth $1,426,199,000 as of this writing;7aq0fx;https://www.independent.co.uk/arts-entertainment/music/news/lily-allen-calls-herself-an-idiot-for-declining-bitcoin-payment-now-worth-millions-9046211.html
Is this all gonna come crashing down at some point? Or is it here to stay?;1;1;False;babyProgrammer;dpd63kk;Lily Allen turned down 200K in Bitcoins for a gig in 2009 which is worth $1,426,199,000 as of this writing;7aq0fx;https://www.independent.co.uk/arts-entertainment/music/news/lily-allen-calls-herself-an-idiot-for-declining-bitcoin-payment-now-worth-millions-9046211.html
"I am another idiot same happened to me as well was about a year ago was about to buy a  5 bitcoins and the transaction was canceled due to timeout screen.#worst mistakeever.
";1;0;False;mrpuri;dpd6l1v;Lily Allen turned down 200K in Bitcoins for a gig in 2009 which is worth $1,426,199,000 as of this writing;7aq0fx;https://www.independent.co.uk/arts-entertainment/music/news/lily-allen-calls-herself-an-idiot-for-declining-bitcoin-payment-now-worth-millions-9046211.html
How does one convert bitcoin into actual cash? ;1;1;False;That_Guy_Reddits;dpd8l7u;Lily Allen turned down 200K in Bitcoins for a gig in 2009 which is worth $1,426,199,000 as of this writing;7aq0fx;https://www.independent.co.uk/arts-entertainment/music/news/lily-allen-calls-herself-an-idiot-for-declining-bitcoin-payment-now-worth-millions-9046211.html
Haha bet she feels like a right plonker;1;0;False;Keffey;dpda52o;Lily Allen turned down 200K in Bitcoins for a gig in 2009 which is worth $1,426,199,000 as of this writing;7aq0fx;https://www.independent.co.uk/arts-entertainment/music/news/lily-allen-calls-herself-an-idiot-for-declining-bitcoin-payment-now-worth-millions-9046211.html
Missed a chance to be the highest paid performer of all time...;1;0;False;Fu_Man_Chu;dpdajel;Lily Allen turned down 200K in Bitcoins for a gig in 2009 which is worth $1,426,199,000 as of this writing;7aq0fx;https://www.independent.co.uk/arts-entertainment/music/news/lily-allen-calls-herself-an-idiot-for-declining-bitcoin-payment-now-worth-millions-9046211.html
"Lily it is not too late :-> 

Bitcoin {BTC} is GREAT, glad I bought some.  ";1;0;False;Kprawn;dpdarb9;Lily Allen turned down 200K in Bitcoins for a gig in 2009 which is worth $1,426,199,000 as of this writing;7aq0fx;https://www.independent.co.uk/arts-entertainment/music/news/lily-allen-calls-herself-an-idiot-for-declining-bitcoin-payment-now-worth-millions-9046211.html
we all turned down bitcoin in 2009.;1;1;False;BakGikHung;dpdbl4t;Lily Allen turned down 200K in Bitcoins for a gig in 2009 which is worth $1,426,199,000 as of this writing;7aq0fx;https://www.independent.co.uk/arts-entertainment/music/news/lily-allen-calls-herself-an-idiot-for-declining-bitcoin-payment-now-worth-millions-9046211.html
"""hold no matter what"" isn't a strategy, its an emotion.

If you can predict the market then the best strategy is to sell just before dips and buy in at even more straight after.

If you don't know what bitcoin will be worth 2 months from now you have no idea what it will be worth 2 years from now.";3;1;False;suninabox;dpdj26c;Lily Allen turned down 200K in Bitcoins for a gig in 2009 which is worth $1,426,199,000 as of this writing;7aq0fx;https://www.independent.co.uk/arts-entertainment/music/news/lily-allen-calls-herself-an-idiot-for-declining-bitcoin-payment-now-worth-millions-9046211.html
\#REKT;1;0;False;ObieUno;dpdep18;Lily Allen turned down 200K in Bitcoins for a gig in 2009 which is worth $1,426,199,000 as of this writing;7aq0fx;https://www.independent.co.uk/arts-entertainment/music/news/lily-allen-calls-herself-an-idiot-for-declining-bitcoin-payment-now-worth-millions-9046211.html
[deleted];1;1;False;;dpdet04;Lily Allen turned down 200K in Bitcoins for a gig in 2009 which is worth $1,426,199,000 as of this writing;7aq0fx;https://www.independent.co.uk/arts-entertainment/music/news/lily-allen-calls-herself-an-idiot-for-declining-bitcoin-payment-now-worth-millions-9046211.html
Holy fuck. What a waste ;1;0;False;EpicWott;dpdv14d;Lily Allen turned down 200K in Bitcoins for a gig in 2009 which is worth $1,426,199,000 as of this writing;7aq0fx;https://www.independent.co.uk/arts-entertainment/music/news/lily-allen-calls-herself-an-idiot-for-declining-bitcoin-payment-now-worth-millions-9046211.html
"This is a separate issue. Regardless of speculation, the fact that Bitcoin is so deflationary makes it a very poor currency, as you point out. I'm buy it and as an investment, and using it, and also getting as many people as I know to use it as well.

I suppose I can make a disclaimer that as the Bitcoin protocol stands now, I do not think it will survive. As you point out, a currency that is so deflationary is not usable, but using Bitcoin and encouraging businesses to accept it and customers to spend it, only will make it even more valuable. A change will have to be made eventually (IMO removing the 21 million cap and just having a small block reward pay out indefinitely to make up for lost coins and increasing population), before it's useable as currency (or usable as more than a novelty as it is now).

But while this is going on, I'm happy that my Bitcoin holdings are slowly appreciating value much more nicely than my savings account at my bank. In that sense, it's a better investment.";1;1;False;ianpaschal;dpdldml;Lily Allen turned down 200K in Bitcoins for a gig in 2009 which is worth $1,426,199,000 as of this writing;7aq0fx;https://www.independent.co.uk/arts-entertainment/music/news/lily-allen-calls-herself-an-idiot-for-declining-bitcoin-payment-now-worth-millions-9046211.html
[deleted];1;1;False;;dpe2dmo;Lily Allen turned down 200K in Bitcoins for a gig in 2009 which is worth $1,426,199,000 as of this writing;7aq0fx;https://www.independent.co.uk/arts-entertainment/music/news/lily-allen-calls-herself-an-idiot-for-declining-bitcoin-payment-now-worth-millions-9046211.html
"And yet I can't get a cheeseburger at McDonald's with it or pay my rent with it. That's my point.

But I'll keep that in mind next time I'm paying for a space trip lol.";1;0;False;Hatewrecked;dpdgxjp;Lily Allen turned down 200K in Bitcoins for a gig in 2009 which is worth $1,426,199,000 as of this writing;7aq0fx;https://www.independent.co.uk/arts-entertainment/music/news/lily-allen-calls-herself-an-idiot-for-declining-bitcoin-payment-now-worth-millions-9046211.html
[deleted];1;1;False;;dpcybhc;Lily Allen turned down 200K in Bitcoins for a gig in 2009 which is worth $1,426,199,000 as of this writing;7aq0fx;https://www.independent.co.uk/arts-entertainment/music/news/lily-allen-calls-herself-an-idiot-for-declining-bitcoin-payment-now-worth-millions-9046211.html
"Investing in a diversified portfolio across a spectrum of risk profiles isn't gambling.

Putting all your money into an asset that has had several crashes in the last 5 years is gambling. Not cashing out a portion of your investment during an all time high and putting it into a safe investment is gambling.";2;1;False;suninabox;dpdlsf5;Lily Allen turned down 200K in Bitcoins for a gig in 2009 which is worth $1,426,199,000 as of this writing;7aq0fx;https://www.independent.co.uk/arts-entertainment/music/news/lily-allen-calls-herself-an-idiot-for-declining-bitcoin-payment-now-worth-millions-9046211.html
It was Linden dollars.;1;0;False;I-am-the-noob;dpcxff3;Lily Allen turned down 200K in Bitcoins for a gig in 2009 which is worth $1,426,199,000 as of this writing;7aq0fx;https://www.independent.co.uk/arts-entertainment/music/news/lily-allen-calls-herself-an-idiot-for-declining-bitcoin-payment-now-worth-millions-9046211.html
[removed];1;1;False;;dpcvxp1;Lily Allen turned down 200K in Bitcoins for a gig in 2009 which is worth $1,426,199,000 as of this writing;7aq0fx;https://www.independent.co.uk/arts-entertainment/music/news/lily-allen-calls-herself-an-idiot-for-declining-bitcoin-payment-now-worth-millions-9046211.html
">While that definition isn't wrong, it is extremely dumbed down and you are misunderstanding it. More precisely, socialism (or synonymously, communism) is an economic system characterised by the common ownership of the means of production.

Let me guess, ""real"" socialism has never been tried, right? Few want to give away the ""means of production"" that they spent their entire lives building. So you can't have mandatory ""common ownership"" without an authoritarian government strong enough to take away private property, which is why communism/socialism and authoritarian dictators go hand in hand. Stalin had to kill and imprison thousands of farmers who refused to give up their farms to the state. The result was ""common ownership"" of farms...that under-produced, resulting in mass starvation. It was so bad in Ukraine at the start of WWII, that some Ukrainians actually welcomed the Nazi invasion because it drove back the communists who had been killing them.

>""Means of production"" include things like natural resources and large factories.

And small factories, and mom and pop stores, and farms, and anything anyone built that makes something. Ayn Rand, famous critic of communism, fled Russia and saw her family's small drug store business stolen by communists first hand. So you're making two big false assumptions, 1) that communists only care about ""big"" factories, and that 2) it's ok to confiscate wealth and property from successful businesses of any size. The size of the enterprise is irrelevant. It's immoral to steal from anyone. Period. Venezuela nationalized all their oil fields, and their production immediately lowered and became immensely inefficient because no government bureaucrat or commissar, with no personal incentive by being rewarded with the fruits of their labor, is going to run a public enterprise as well as a private enterprise.

>Any system in which the government owns everything is generally referred to as state capitalism, and is not a form of socialism

Now it's you who needs to look up some definitions. State capitalism is, like socialism, where the government owns the means of production...but also where it runs those means of production for a profit. Therefore, communists Russia et al weren't state capitalists. The communists in Russia weren't running state farms for a profit. Venezuela isn't running state oil fields for a profit. If they were, maybe they'd be marginally more successful, if not still immoral.

>Russia, China and Venezuela are not socialist states, because trade unions or worker syndicates do not control the means of production, government does.

Well, no, Russia's not anymore because the USSR collapsed under it's centrally controlled ""common ownership"" economy. China, although they still call themselves communists, adjusted their economy to a free market capitalist model, because they didn't want to collapse like the Soviets, and because their ""common ownership"" of the means of production resulted in the deaths of millions of Chinese. Venezuela though absolutely still is a socialist state, and was heaped with praise by anarcho-communists like [Noam Chomksy](https://www.greenleft.org.au/content/chomsky-praises-venezuelas-revolution), as a brilliant example of what a true socialist revolution should look like. Now Venezuelans are resorting to eating rats to survive, and all the arm-chair socialists like you are trying to pretend like you've never heard of Venezuela. They **democratically elected** a leader to give them free stuff by confiscating the means of production from all the evil rich people, just as you claim to want. Then ran those means of production, ""for the people"" and not for a profit, just as you claim to want. And it worked...for a few years, until they finally ran out of other people's money, and the entire system collapsed, just like every socialist dystopia eventually does.

You ever wonder why communists are desperate to run away from examples of their failure, like the United Soviet **Socialist** Republics, and re-brand their ideology? Communists re-brand themselves as socialists. Then socialists re-brand themselves as democratic socialists. It's because none of it works, but there will always be political opportunists that will harness your hatred and envy of people more successful than you to ""take away the means of production"" and give it to you. It's a tempting message, but an amoral one.

Thomas Sowell said it best:

>Most people who read ""The Communist Manifesto"" probably have no idea that it was written by a couple of young men who had never worked a day in their lives, and who nevertheless spoke boldly in the name of ""the workers"".";1;1;False;GrabAHamLincoln;dpe91hc;Lily Allen turned down 200K in Bitcoins for a gig in 2009 which is worth $1,426,199,000 as of this writing;7aq0fx;https://www.independent.co.uk/arts-entertainment/music/news/lily-allen-calls-herself-an-idiot-for-declining-bitcoin-payment-now-worth-millions-9046211.html
"**Socialism**

Socialism is a range of economic and social systems characterised by social ownership and democratic control of the means of production, as well as the political theories and movements associated with them. Social ownership may refer to forms of public, collective or cooperative ownership, or to citizen ownership of equity. There are many varieties of socialism and there is no single definition encapsulating all of them, though social ownership is the common element shared by its various forms.

Socialist economic systems can be divided into non-market and market forms.

***

**Communism**

In political and social sciences, communism (from Latin communis, ""common, universal"") is the philosophical, social, political and economic ideology and movement whose ultimate goal is the establishment of the communist society, which is a socioeconomic order structured upon the common ownership of the means of production and the absence of social classes, money and the state.

Communism includes a variety of schools of thought, which broadly include Marxism, anarchism (anarchist communism) and the political ideologies grouped around both. All of these share the analysis that the current order of society stems from its economic system, capitalism; that in this system there are two major social classes: the working classâ€”who must work to survive and who make up the majority within societyâ€”and the capitalist classâ€”a minority who derives profit from employing the working class, through private ownership of the means of productionâ€”and that conflict between these two classes will trigger a revolution. The revolution will in turn establish social ownership of the means of production, which according to this analysis is the primary element in the transformation of society towards communism.

***

^[ [^PM](https://www.reddit.com/message/compose?to=kittens_from_space) ^| [^Exclude ^me](https://reddit.com/message/compose?to=WikiTextBot&message=Excludeme&subject=Excludeme) ^| [^Exclude ^from ^subreddit](https://np.reddit.com/r/Bitcoin/about/banned) ^| [^FAQ ^/ ^Information](https://np.reddit.com/r/WikiTextBot/wiki/index) ^| [^Source](https://github.com/kittenswolf/WikiTextBot) ^| [^Donate](https://www.reddit.com/r/WikiTextBot/wiki/donate)   ^]
^Downvote ^to ^remove ^| ^v0.28";1;0;False;WikiTextBot;dpe1fd5;Lily Allen turned down 200K in Bitcoins for a gig in 2009 which is worth $1,426,199,000 as of this writing;7aq0fx;https://www.independent.co.uk/arts-entertainment/music/news/lily-allen-calls-herself-an-idiot-for-declining-bitcoin-payment-now-worth-millions-9046211.html
Just like fiat. Difference being, fiat isn't scarce. It can be produced any time a little more is needed, reducing its value. That's why fiat continuously and inevitably decreases in value while gold, for example, does not.;1;0;False;The_Xsid;dpd1x7m;Lily Allen turned down 200K in Bitcoins for a gig in 2009 which is worth $1,426,199,000 as of this writing;7aq0fx;https://www.independent.co.uk/arts-entertainment/music/news/lily-allen-calls-herself-an-idiot-for-declining-bitcoin-payment-now-worth-millions-9046211.html
