body;score;nb_replies;stickied;author;id;post_title;post_id;post_link
I honestly have no idea what people pay for pizza.  I probably haven’t had one in like... a decade?  Maybe more?;1;1;False;MapleBaconCoffee;dpeg4vi;Lily Allen turned down 200K in Bitcoins for a gig in 2009 which is worth $1,426,199,000 as of this writing;7aq0fx;https://www.independent.co.uk/arts-entertainment/music/news/lily-allen-calls-herself-an-idiot-for-declining-bitcoin-payment-now-worth-millions-9046211.html
">Hold no matter what is viable strategy in any market that's not a scam

Was property in Detroit a scam? Were tulips in 17th century Holland a scam?

Hold no matter what is literally not a strategy because ""no matter what"" means ""I will do this regardless of what results it produces"". ""hold no matter what"" is just a feeling from people who are afraid to realize losses and sunk costs.
";1;0;False;suninabox;dpfakf8;Lily Allen turned down 200K in Bitcoins for a gig in 2009 which is worth $1,426,199,000 as of this writing;7aq0fx;https://www.independent.co.uk/arts-entertainment/music/news/lily-allen-calls-herself-an-idiot-for-declining-bitcoin-payment-now-worth-millions-9046211.html
"I think this needs to be promoted more. A lot of people with short attention spans would just hear ""BTC is worth $10k"" and they'd think 'oh well I don't have $10k so I cant afford to get in on that'";2;0;False;iambored123456789;dpefkzk;Lily Allen turned down 200K in Bitcoins for a gig in 2009 which is worth $1,426,199,000 as of this writing;7aq0fx;https://www.independent.co.uk/arts-entertainment/music/news/lily-allen-calls-herself-an-idiot-for-declining-bitcoin-payment-now-worth-millions-9046211.html
I miss pizza.  But my fitness routine doesn't.;1;0;False;MapleBaconCoffee;dpemj07;Lily Allen turned down 200K in Bitcoins for a gig in 2009 which is worth $1,426,199,000 as of this writing;7aq0fx;https://www.independent.co.uk/arts-entertainment/music/news/lily-allen-calls-herself-an-idiot-for-declining-bitcoin-payment-now-worth-millions-9046211.html
It's a pyramid coin lol;3;0;False;xddm2653;dpegqos;Lily Allen turned down 200K in Bitcoins for a gig in 2009 which is worth $1,426,199,000 as of this writing;7aq0fx;https://www.independent.co.uk/arts-entertainment/music/news/lily-allen-calls-herself-an-idiot-for-declining-bitcoin-payment-now-worth-millions-9046211.html
"yes I generally agree with you. However, nobody can predict any market in the world without illegal insider trading. Investing in real estate, stocks, or bitcoin might be a ""gamble"", but it's a gamble with winning odds.

Hold no matter what is viable strategy in any market that's not a scam";1;1;False;xddm2653;dpex1iu;Lily Allen turned down 200K in Bitcoins for a gig in 2009 which is worth $1,426,199,000 as of this writing;7aq0fx;https://www.independent.co.uk/arts-entertainment/music/news/lily-allen-calls-herself-an-idiot-for-declining-bitcoin-payment-now-worth-millions-9046211.html
Haha I struggle to stay away from pizza for like a week :/;1;1;False;iambored123456789;dpejg5y;Lily Allen turned down 200K in Bitcoins for a gig in 2009 which is worth $1,426,199,000 as of this writing;7aq0fx;https://www.independent.co.uk/arts-entertainment/music/news/lily-allen-calls-herself-an-idiot-for-declining-bitcoin-payment-now-worth-millions-9046211.html
$20 back then or $576k today. Either way that better be a damn good pizza.;1;1;False;iambored123456789;dpefgh4;Lily Allen turned down 200K in Bitcoins for a gig in 2009 which is worth $1,426,199,000 as of this writing;7aq0fx;https://www.independent.co.uk/arts-entertainment/music/news/lily-allen-calls-herself-an-idiot-for-declining-bitcoin-payment-now-worth-millions-9046211.html
Invest $1k in it lol even if it makes $200, you can take ya best girl out for a nice meal, basically for free;1;0;False;iambored123456789;dpefi50;Lily Allen turned down 200K in Bitcoins for a gig in 2009 which is worth $1,426,199,000 as of this writing;7aq0fx;https://www.independent.co.uk/arts-entertainment/music/news/lily-allen-calls-herself-an-idiot-for-declining-bitcoin-payment-now-worth-millions-9046211.html
"5 years ago reddit spoke about it a lot but it hasn't been getting much press recently

I assumed the whole thing either A) flopped or B) was shut down";1;0;False;ZOMBIE004;dpf61bp;Lily Allen turned down 200K in Bitcoins for a gig in 2009 which is worth $1,426,199,000 as of this writing;7aq0fx;https://www.independent.co.uk/arts-entertainment/music/news/lily-allen-calls-herself-an-idiot-for-declining-bitcoin-payment-now-worth-millions-9046211.html
"Except you're still misusing terms. The government doesn't enforce common ownership under socialism, rather, worker syndicates abduct power from the government. You're using the term ""common ownership"" loosely and informally, where I'm using it to refer to a specific technical concept.

https://en.m.wikipedia.org/wiki/Social_ownership

The reason many governments are nominally socialist is because those countries had legitimate, large-scale people's uprisings and worker movements that were ultimately crushed. You're misinformed because of cold war era propaganda, unfortunately. However it's all on Wikipedia, if you ever decide to seriously investigate the topic. To have a persuasive argument, you should fully appreciate the opposite perspective.";0;1;False;starry7;dpeqa9a;Lily Allen turned down 200K in Bitcoins for a gig in 2009 which is worth $1,426,199,000 as of this writing;7aq0fx;https://www.independent.co.uk/arts-entertainment/music/news/lily-allen-calls-herself-an-idiot-for-declining-bitcoin-payment-now-worth-millions-9046211.html
A lot of people fked up years ago.;1;0;False;Neilwy;dpg3u9s;Lily Allen turned down 200K in Bitcoins for a gig in 2009 which is worth $1,426,199,000 as of this writing;7aq0fx;https://www.independent.co.uk/arts-entertainment/music/news/lily-allen-calls-herself-an-idiot-for-declining-bitcoin-payment-now-worth-millions-9046211.html
