body;score;nb_replies;stickied;author;id;post_title;post_id;post_link
"Bitcoin isn't a stock. If it's equivalent to a penny-stock exploding, you have to explain how it's crashed and recovered like 6+ times now. And each time it crashed, people celebrated that the bubble had finally popped. They did that when it fell from $1 back to 30¢. And yet...here we are.

We're in an inflationary period, where Bitcoin is inflating to it's useful value. Then it'll be stable, slightly inflationary, and a useful currency. At least, that's one interpretation. There are others. But ""it's a penny stock, it's a bubble"" doesn't cut it IMHO. It's too simple and it's been wrong too often.";0;1;False;yiliu;dqcq8s8;It's over 9000!!!;7fkqh5;https://i.imgur.com/jyoZGyW.gifv
Dont forget to hodl like your life depends on it. ;2;1;False;G33smeagz;dqcp9d9;It's over 9000!!!;7fkqh5;https://i.imgur.com/jyoZGyW.gifv
Coinbase is a good place to start. You can buy as little as a $1 worth, you don’t have to do a full bitcoin ;11;0;False;bunnybones4lunch;dqco3jr;It's over 9000!!!;7fkqh5;https://i.imgur.com/jyoZGyW.gifv
Localbitcoins or Bitbargain if youre just starting. Its just a simple debit payment on these;1;0;False;holgenberg;dqcpqss;It's over 9000!!!;7fkqh5;https://i.imgur.com/jyoZGyW.gifv
You forgot the /s;5;1;False;craftors;dqco8oa;It's over 9000!!!;7fkqh5;https://i.imgur.com/jyoZGyW.gifv
WE ARE ALL WITNESSES ;1;1;False;kcman011;dqclr36;It's over 9000!!!;7fkqh5;https://i.imgur.com/jyoZGyW.gifv
Here ;1;0;False;togetherwem0m0;dqcmawh;It's over 9000!!!;7fkqh5;https://i.imgur.com/jyoZGyW.gifv
"Honest question though, how is bitcoin valuable at all when everyone who ""mined"" it back in the day didn't do anything to really earn it? Like in a trading sense, they didn't do create value for anyone in exchange for this value. 

Is it supposedly similar to stumbling upon a literal gold mine and just being one of the first people there to do the physical mining of gold? ";2;1;False;PitcherOnly;dqcm6gn;It's over 9000!!!;7fkqh5;https://i.imgur.com/jyoZGyW.gifv
Do you know how to buy futures once CME opens trading?;1;1;False;the_chest_lives_on;dqclfiu;It's over 9000!!!;7fkqh5;https://i.imgur.com/jyoZGyW.gifv
[deleted];2;2;False;;dqcoq4p;It's over 9000!!!;7fkqh5;https://i.imgur.com/jyoZGyW.gifv
The price per bitcoin in december 2013 ( when most receive their annual bonuses ) was 600-1000 according to wikipedia. He says he spent 10k which means he has 10-12 bitcoins. So he has made 110k.;2;2;False;eyeshirreld;dqcsj5v;It's over 9000!!!;7fkqh5;https://i.imgur.com/jyoZGyW.gifv
Tbh i'd like to let it grow until I retire. ;1;0;False;Aedeus;dqdjjfb;It's over 9000!!!;7fkqh5;https://i.imgur.com/jyoZGyW.gifv
"He's lying.

Edit: this a joke. ";-1;1;False;_reverse_osmosis_;dqcrfs5;It's over 9000!!!;7fkqh5;https://i.imgur.com/jyoZGyW.gifv
At least two of us!!!;0;1;False;;dqcnrr6;It's over 9000!!!;7fkqh5;https://i.imgur.com/jyoZGyW.gifv
Idk, this last month has been SO crazy for the bitcoin.  I have the feel that something bad and big will happen to the bitcoin soon;1;1;False;Weifinsd;dqcm5l5;It's over 9000!!!;7fkqh5;https://i.imgur.com/jyoZGyW.gifv
GDAX.com  (literally same company) if you want less fees.;8;0;False;ScumWithBoundaries;dqcm4c1;It's over 9000!!!;7fkqh5;https://i.imgur.com/jyoZGyW.gifv
[Welcome!](https://imgur.com/r/highqualitygifs/GfJNU68);2;0;False;GenghisKhanSpermShot;dqcox8p;It's over 9000!!!;7fkqh5;https://i.imgur.com/jyoZGyW.gifv
https://bitcoin.org/ is the place to go. Please let me know if you have any questions.;1;0;False;voluntaryistmitch;dqd5cqm;It's over 9000!!!;7fkqh5;https://i.imgur.com/jyoZGyW.gifv
Speculation now. Will be reality at some point obviously.;3;0;False;_reverse_osmosis_;dqcrgey;It's over 9000!!!;7fkqh5;https://i.imgur.com/jyoZGyW.gifv
It's not hard for companies to take bitcoin now that there's Square taking it, and there's BitPay since forever. They take bitcoin but give the company cash (or cash+bitcoin if the company wants to keep a fraction in bitcoin).;1;0;False;walloon5;dqcs5k0;It's over 9000!!!;7fkqh5;https://i.imgur.com/jyoZGyW.gifv
nice!!;0;0;False;asuth;dqck4f0;It's over 9000!!!;7fkqh5;https://i.imgur.com/jyoZGyW.gifv
"> in Australia

And Canada, and the UK.";2;0;False;JugglerNorbi;dqcstm5;It's over 9000!!!;7fkqh5;https://i.imgur.com/jyoZGyW.gifv
"If $500 is a lot of money to you, you could space it out into two purchases. $250 now, then $250 maybe 5-6 months from now. There's a threshold on Coinbase of about $200 to pay the lowest fee of 1.5% (instead of the minimum fee of $3), so that's a good number to use for dollar-cost averaging if you can. I highly recommend reading about dollar-cost averaging because it reduces timing risk during crazy speculative runs like Bitcoin is currently experiencing.

But also ask yourself. Should you really take investment advice from some random redditor with a clear conflict of interest like myself? I hold bitcoin and directly benefit from you putting in any amount of money. There is nothing about Bitcoin that magically guarantees it will increase in value.";7;0;False;CryptoFreek;dqcp6vs;It's over 9000!!!;7fkqh5;https://i.imgur.com/jyoZGyW.gifv
"Best to not get your financial advice on reddit but having said that, buying $500 on coinbase and leaving it for year is fine. Ideally you spend at least some time actually figuring out what this thing you bought and take possession of your bitcoin. you can read more about that [here](https://www.reddit.com/r/Bitcoin/comments/498520/why_the_bitcoin_rules_cant_change_reading_time/). I like to advocate buying small amounts (not $500 but maybe $5 or $50) gradually so you can get used to the price swings and get to understand what you just bought.


Bitcoin works like a dollars  in some ways but in other ways it is different. One way that is is different is the absolutely immutability of transactions. If you spend some money with a credit card you can do a charge back. If you pay for something with a check you can take legal means to get the money back. There is literally no way to actually reverse a bitcoin transaction and whoever holds the private keys actually owns the bitcoin. Coinbase is fine because it is a FDIC insured bank and has a great track record... but technically an insider could take a bunch of the bitcoin and there is technically no way to get them back. Or there could be some screw up and they lose the private keys. Whoops.";3;0;False;kaiser13;dqcpb09;It's over 9000!!!;7fkqh5;https://i.imgur.com/jyoZGyW.gifv
me too thanks;1;0;False;flaim;dqclg8j;It's over 9000!!!;7fkqh5;https://i.imgur.com/jyoZGyW.gifv
That is targeted harassment. Do **not** do this.;4;1;False;kaiser13;dqcpjzk;It's over 9000!!!;7fkqh5;https://i.imgur.com/jyoZGyW.gifv
!remindme 1 year;1;1;False;rexfordays;dqcktx3;It's over 9000!!!;7fkqh5;https://i.imgur.com/jyoZGyW.gifv
I, too, was here!;2;1;False;Loud_Brick_Tamland;dqckgf9;It's over 9000!!!;7fkqh5;https://i.imgur.com/jyoZGyW.gifv
I can't wait to invest in my plumber's ICO.;61;1;False;dekoze;dqcnps3;It's over 9000!!!;7fkqh5;https://i.imgur.com/jyoZGyW.gifv
"People say that cryptocurrency has the signs of a bubble and expect it to crash like the original tech bubble, but I think it's a bad comparison. That's not to say that there isn't a bubble happening right now, but it's not where skeptics say it is. 

Back in the 90's, that original tech bubble was created by a change in institutional standards for taking companies public that resulted in companies going public with no established profitability or honestly reason for existence. Those taking them public often didn't care, largely because of the proliferation of illegal market manipulation that would let them pump a stock's initial valuation and then get out.

That should sound familiar, because that is the landscape for ICOs right now. It's a minefield of fraud and half-baked ideas, many of which somehow still garner interest. Now *that* is where I think the bubble is, and where we'll see an impact once things pop. Either regulation or disaster (or both) is going to make it much harder to get interest in a new coin.

But cryptocurrency on the whole? That's the technology, like the computer. The tech bubble bursting hit tech industry businesses, not the computer itself. So this bubble will pop, the shitcoins will die, the rest will take a hit, and then it'll level out. Just like before.";3;1;False;PavementBlues;dqcrs5f;It's over 9000!!!;7fkqh5;https://i.imgur.com/jyoZGyW.gifv
The only people I knew who had BTC were using them to buy drugs on the silk road...;2;0;False;;dqcr2ss;It's over 9000!!!;7fkqh5;https://i.imgur.com/jyoZGyW.gifv
Curious if anyone knows any plumbers in China.  Ask them if they are buying Bitcoin....;1;0;False;jefdem;dqdipoa;It's over 9000!!!;7fkqh5;https://i.imgur.com/jyoZGyW.gifv
My plumber just brought some yesterday. ;-1;0;False;noknockers;dqcqnis;It's over 9000!!!;7fkqh5;https://i.imgur.com/jyoZGyW.gifv
There's a reason this sub is begging you to hold.;4;0;False;;dqcuae7;It's over 9000!!!;7fkqh5;https://i.imgur.com/jyoZGyW.gifv
"We should all be asking the following:

> Are people investing in bitcoin because they see it as the future of digital currency? Or are people buying bitcoin because two weeks ago the price was $6000 and today the price is $8000 with almost no real reason to why and they're simply betting it will continue to keep going up because it keeps going up?";13;2;False;user93849384;dqcp2bj;It's over 9000!!!;7fkqh5;https://i.imgur.com/jyoZGyW.gifv
"[(economics) A period of intense speculation in a market, causing prices to rise quickly to irrational levels as the metaphorical bubble expands, and then fall even more quickly as the bubble bursts (eg the South Sea Bubble).](https://en.wiktionary.org/wiki/bubble)

My definition would be ""something layman say when they want to look smart in hindsight."" ";1;0;False;greenrobot1988;dqd8pu4;It's over 9000!!!;7fkqh5;https://i.imgur.com/jyoZGyW.gifv
https://www.cnbc.com/2017/11/25/bitcoin-tops-8700-to-record-high-as-coinbase-adds-100000-users.html;1;0;False;jkeegan123;dqd39co;It's over 9000!!!;7fkqh5;https://i.imgur.com/jyoZGyW.gifv
I think that's what happened this Thanksgiving...;1;0;False;jkeegan123;dqd99ki;It's over 9000!!!;7fkqh5;https://i.imgur.com/jyoZGyW.gifv
Why doubling and 4x?  If you don't have a reason for your price target all you are doing is gambling.;1;0;False;pdabaker;dqctokl;It's over 9000!!!;7fkqh5;https://i.imgur.com/jyoZGyW.gifv
To be fair, he said quit and day trade, not just hobby day trade.;1;1;False;jkeegan123;dqd97u5;It's over 9000!!!;7fkqh5;https://i.imgur.com/jyoZGyW.gifv
deleted  ^^^^^^^^^^^^^^^^0.9531  [^^^What ^^^is ^^^this?](https://pastebin.com/FcrFs94k/77320);3;1;False;BecomingTheArchtype;dqconem;It's over 9000!!!;7fkqh5;https://i.imgur.com/jyoZGyW.gifv
The 'fuck all banks' sentiment is pretty funny to me recently considering all the recent forks. Banks are bad because they print money! Bitcoin fork happens - FREE MONEY!!! Like the ICOs on ETH I think this will partly drive the price this year but I don't think it's a good thing because it's going to attract unwanted attention.;4;1;False;-mjneat;dqcnbxk;It's over 9000!!!;7fkqh5;https://i.imgur.com/jyoZGyW.gifv
Japan.;1;0;False;Kill_Me_Now_World;dqd6l3i;It's over 9000!!!;7fkqh5;https://i.imgur.com/jyoZGyW.gifv
!RemindMe 1434 days;2;0;False;lnig0Montoya;dqckyp1;It's over 9000!!!;7fkqh5;https://i.imgur.com/jyoZGyW.gifv
what's the reference / reason for 1434 days? Is it McAfee?;1;0;False;GimmickNG;dqckwev;It's over 9000!!!;7fkqh5;https://i.imgur.com/jyoZGyW.gifv
The prophet;1;0;False;;dqckwp2;It's over 9000!!!;7fkqh5;https://i.imgur.com/jyoZGyW.gifv
"2017/11/26

One day we'll look back fondly and talk about how this year was the end of the beginning for Bitcoin.";20;2;False;finalhedge;dqck5hz;It's over 9000!!!;7fkqh5;https://i.imgur.com/jyoZGyW.gifv
+fucking 1;1;0;False;asuth;dqckk8h;It's over 9000!!!;7fkqh5;https://i.imgur.com/jyoZGyW.gifv
Why can't you be happy for us?;2;0;False;;dqcr6ch;It's over 9000!!!;7fkqh5;https://i.imgur.com/jyoZGyW.gifv
"Because you're worried about what you could have had instead of what you can have.

That thought process is toxic and will destroy you.

I had...key word HAD a lot of money I could have invested in it as well as a lot of other people. You aren't the only one who feels like they missed out. 

It will go much..much...much higher. Don't be kicking yourself twenty years down the road.";6;1;False;_reverse_osmosis_;dqcrj0a;It's over 9000!!!;7fkqh5;https://i.imgur.com/jyoZGyW.gifv
"OH! I member...

And member [/u/doubledickdude](https://np.reddit.com/r/IAmA/comments/1u75hh/i_am_the_guy_with_two_penises_ama)?  
 ***  
 ^^I'm&#32;a&#32;bot&#32;*bleep*&#32;*bloop*&#32;|&#32;[**Block**&#32;**me**](https://np.reddit.com/message/compose?to=memberberrybot&subject=stop&message=If%20you%20would%20like%20to%20stop%20seeing%20this%20bot%27s%20comments%2C%20send%20this%20private%20message%20with%20the%20subject%20%27stop%27.%20)&#32;|&#32;[**Contact**&#32;**my**&#32;**master**](https://np.reddit.com/message/compose?to=/u/Synapsensalat)&#32;or&#32;go&#32;[**here**](/r/memberberrybot)&#32;for&#32;suggestions&#32;and/or&#32;death&#32;threats";3;0;False;Memberberrybot;dqcnmwz;It's over 9000!!!;7fkqh5;https://i.imgur.com/jyoZGyW.gifv
"It won't replace real currency because of its deflationary nature.
Economies need inflation otherwise people are better off holding their coins, not spending anything so economies can't grow.

Not sure what the endgame is to be honest";2;3;False;WickedWicky;dqcpw7e;It's over 9000!!!;7fkqh5;https://i.imgur.com/jyoZGyW.gifv
"Bitcoin simulates gold in the virtual world, it even uses the same terminology ""mining"". It uses complex math and algorithms to simulate what is natural in the real world. But is there any tangible foundation for it's existence, other than the fact government money already exist and therefore Bitcoin can function?";1;0;False;dasooner2;dqcqdaj;It's over 9000!!!;7fkqh5;https://i.imgur.com/jyoZGyW.gifv
"> That's kind of the impetus for its creation

No it isn't.";17;2;False;Frogolocalypse;dqco7kd;It's over 9000!!!;7fkqh5;https://i.imgur.com/jyoZGyW.gifv
Wrong. As far as mass adoption goes we’re in the early adopter phase. Probably less than 1% globally have put money into Bitcoin - if that. Plenty of room to grow. ;4;0;False;Minister99;dqcrkl2;It's over 9000!!!;7fkqh5;https://i.imgur.com/jyoZGyW.gifv
Where would you say we are on the S curve of adoption?;1;0;False;Klutzkerfuffle;dqcrzbw;It's over 9000!!!;7fkqh5;https://i.imgur.com/jyoZGyW.gifv
"How is USD not better? Every transaction has been stored on the BTC block chain. It's called pseudo-anonymous for a reason.

Where is the list for USD transactions?";1;0;False;microgoatz;dqcwxqr;It's over 9000!!!;7fkqh5;https://i.imgur.com/jyoZGyW.gifv
"Steam takes bitcoin, and you can pay your Dish Network bill with bitcoin. The Gap, JCPenny, Gamestop, Subway. I guarantee some of those are near you. ""Worthless to the average consumer"" is already less than accurate and we're just getting started.";5;2;False;Zerocyde;dqcomx6;It's over 9000!!!;7fkqh5;https://i.imgur.com/jyoZGyW.gifv
Think of it like a savings account.;0;0;False;Klutzkerfuffle;dqcs2i3;It's over 9000!!!;7fkqh5;https://i.imgur.com/jyoZGyW.gifv
Look 10, 20 years into the future. Cryptocurrencies cannot be stopped. We like to live in a bubble in the west and think central banks are everywhere and everyone has a bank account. 4 billion people dont have access to central banks. 2 billion people dont have access to any banking at all. They are already using these systems, leap frogging technology of expensive central systems like banking and landlines to cellphones, power grids to off grid. Japan has 4500 stores that accept bitcoin, and its considered legal tender. ;3;0;False;e0nflux;dqcresu;It's over 9000!!!;7fkqh5;https://i.imgur.com/jyoZGyW.gifv
"\*sigh\*

You'll be shown to be very, very wrong.

Just imagine a room full of the thousands of people who worked on bitcoin in some form or another over the past 8-9 years. Their background, their expertise, their insights. The hackers, the cryptographers, the hard- and software engineers, the economists, the researches, the entrepreneurs, the investors.

Now imagine yourself with whatever level of research you know you've done on this topic entering said room, standing in front of everyone proclaiming: ""I know better! You guys are all wrong. The stuff you're working on is basically beanie babies.""";2;1;False;supermari0;dqd72ei;It's over 9000!!!;7fkqh5;https://i.imgur.com/jyoZGyW.gifv
Is a dollar worth the paper it's printed on? Or is it worth the number the bank displays?;2;1;False;Dwerg1;dqct26h;It's over 9000!!!;7fkqh5;https://i.imgur.com/jyoZGyW.gifv
"
It isn't a bubble. Imagine that only 1 million people are bought in to it.  Imagine now that you increase the amount of people buying into it at 1 million every 1-2 months.  Supply essentially is now staying the same but demand increases.  That's why the value keeps increasing over time.";2;1;False;Hugginsome;dqcx8e3;It's over 9000!!!;7fkqh5;https://i.imgur.com/jyoZGyW.gifv
It's not a bubble. It's in its infancy.;1;0;False;Klutzkerfuffle;dqcs44e;It's over 9000!!!;7fkqh5;https://i.imgur.com/jyoZGyW.gifv
"Haha ok. The idea of companies accepting it as legal tender has nothing to do with it... the point is, why would you spend ""currency"" today if you know it will be worth more tomorrow?";8;5;False;pr0b0ner;dqcn498;It's over 9000!!!;7fkqh5;https://i.imgur.com/jyoZGyW.gifv
"And if all companies think like you do, then nobody will adopt. Good thing is though, there's only 21 million bitcoins maximum. Some will lose their wallet so the money goes out of circulation. So inevitably there will be less bitcoin for each person, making the remaining bitcoin more valuable.

If every business was negative towards bitcoin then sure it could crash, but that's not what appears to be happening. The opposite appears to be happening. I'd love to buy stuff with bitcoin, but more companies need to accept it. If more people hold bitcoin and want to buy things with it, then it puts pressure on businesses to accept it as payment.";2;1;False;Dwerg1;dqct0ox;It's over 9000!!!;7fkqh5;https://i.imgur.com/jyoZGyW.gifv
It's going to find a stable base price eventually. It's important to remember that bitcoin (and crypto currencies in general) are still very new ideas. That's why the price has large fluctuations.;1;0;False;unclejarvis;dqdaarf;It's over 9000!!!;7fkqh5;https://i.imgur.com/jyoZGyW.gifv
"The fees are whatever people are willing to pay as fees. Doubling the blocksize (again) won't really change that all that much. We need a reliable base layer onto which real scalability solutions can be developed, with trade-offs that are perfectly fine for $100 transactions.

If bitcoin currently can't provide what you need, you should use something else for your payments right now.

From an efficiency stand point, Bitcoin is hopelessly outgunned by centralized, controllable, censorable payment services like Paypal, VISA or Mastercard. But know that, as we speak, people are building stuff that tackles this head-on, without compromising on the decentralization / censorship resistant aspects of bitcoin.

You will at some point be able to instantly pay for your coffee with virtually no fee. We're simply not there *yet*.";4;1;False;supermari0;dqcnzpa;It's over 9000!!!;7fkqh5;https://i.imgur.com/jyoZGyW.gifv
"> Pretty shitty that mods think how long you've been a redditor relates to how sound your statements are.

They don't. It's sadly just a fact that people create multiple accounts to either evade bans or sybil attack the subreddit.";2;0;False;supermari0;dqcuqyv;It's over 9000!!!;7fkqh5;https://i.imgur.com/jyoZGyW.gifv
I can't use beany babies to buy goods from Dell, Overstock, and Steam.;1;0;False;Dont_Think_So;dqdcito;It's over 9000!!!;7fkqh5;https://i.imgur.com/jyoZGyW.gifv
"Bitcoin mining is not profitable to do at home anymore (it has not been for a long time). This is a good thing, because it makes the chain much more secure. More mining farms are coming online soon in Japan and Russia, which will help spread the hashpower away from China.

You don't need a lot of money to ""invest"" in bitcoin. It is divisible. So you can buy, 0.0001btc for example. When you buy bitcoin from an exchange, you will have to pay fees anytime you cash out or you transfer it. Those fees are relatively expensive if you plan to only buy a small amount like $20's worth.";18;3;False;0xHUEHUE;dqcptpy;It's over 9000!!!;7fkqh5;https://i.imgur.com/jyoZGyW.gifv
"Bitcoin should never be advertised as anonymous. You don't ""need to get into it."" You just don't say bitcoin is anonymous.

Even if you are a seller, when you go to turn in all that money you made selling product on the Silk Road you subject your self to being tracked. 

The only reason bitcoin is anonomyous is because the US and world organizations haven't put into place reporting mechanisms. 

Bitcoin tumblers are often scams. In order for them to work, you have to trust the tumbler to take your money and hen give your money back. If you deal in large amounts of money, that's about the stupidest thing you could ever do. Exit strategy is an intergrated part of the bitcoin community. 

The anonymous aspect of bitcoin is a joke. It's like turning on private mode and expecting your browsing habits not to be tracked. ";2;0;False;AFuckYou;dqd4unj;It's over 9000!!!;7fkqh5;https://i.imgur.com/jyoZGyW.gifv
You can use bitcoin to pay for many things, even Steam accepts bitcoin. It would help a lot if larger companies like Amazon etc. accepted it. I think it's just a matter of time though and I think the card companies think along the same lines.;7;0;False;Dwerg1;dqct727;It's over 9000!!!;7fkqh5;https://i.imgur.com/jyoZGyW.gifv
[deleted];4;1;False;;dqclm45;It's over 9000!!!;7fkqh5;https://i.imgur.com/jyoZGyW.gifv
"And here is the butter conundrum.  
When the cost to transport your currency is valued higher than the actual  currency itself, its worthless.  

What is gold worth to me, personally?  Nothing.  Market caps and buying power are all that I care about.  You know what it takes to write a dollar transaction to a database?  Fucking nothing.  Buttcoin takes throwing random large primes across farms of servers to validate 1 transaction.  

You ever wonder what crypto would look like with a bunch of idiots trying crypto?  Bitcoin.  And thats why itll fail.  Its like claiming the square is a better wheel than a circle, as ling as we spin the wheel 1000% faster.  

Dont evem come at me with an economical perspective when you dont understand why the basics of your currency is retarded.";-1;2;False;HereForCatharsis;dqcvfgi;It's over 9000!!!;7fkqh5;https://i.imgur.com/jyoZGyW.gifv
"""Opportunity of a lifetime.""

Every.  Bubble.  Ever.

But, hey, I never, ever said don't invest in Bitcoin.  I said don't invest EVERYTHING in Bitcoin.

But that's not enthusiastic enough for this frenzied group.

I've seen dot com bubbles, I've seen housing bubbles - both up close.

If this isn't a bubble... well, I'm missing out by my insistence on having other investments.

I'm not seeing the pompous assholery, except in as much as I'm daring to post in r/bitcoin without being a member of the cult.

All done.  Y'all remind me of r/the_donald.  Cheerlead or leave seems to be the rule.  I'm leaving.  Bye!  Good luck.";-4;2;False;San_Fran_Dan;dqcnqmg;It's over 9000!!!;7fkqh5;https://i.imgur.com/jyoZGyW.gifv
I have 0 interest or stake in bch,  i just think this tribal bs is damaging btc. Take off your tinfoil hat, competition and criticism is healthy.;0;1;False;tachyarrhythmia;dqdk34d;It's over 9000!!!;7fkqh5;https://i.imgur.com/jyoZGyW.gifv
"Did you read more than the headline? To call a difference in opinion propaganda is idiotic. And to see healthy competition as ""an attack on bitcoin"" which is open source is delusional. ";-1;1;False;tachyarrhythmia;dqdiwr5;It's over 9000!!!;7fkqh5;https://i.imgur.com/jyoZGyW.gifv
This is what our community is about, thanks to everyone that has taken the time to answer questions in a positive way;62;0;False;TrollWeightlifter;dqcqe5h;It's over 9000!!!;7fkqh5;https://i.imgur.com/jyoZGyW.gifv
Is coinbase not secure? What about guaranteed like a bank?;4;2;False;slurmfactory;dqcv459;It's over 9000!!!;7fkqh5;https://i.imgur.com/jyoZGyW.gifv
Thanks for this post. Can you recommend a hardware wallet? ;3;2;False;FlyingBaratoplata;dqcyu5s;It's over 9000!!!;7fkqh5;https://i.imgur.com/jyoZGyW.gifv
What do you guys think about blockchain wallet? I’ve tried it and it seems like it’s secure and easy to use, but I never see anyone promoting it;1;1;False;barack_ogamja;dqdkjbs;It's over 9000!!!;7fkqh5;https://i.imgur.com/jyoZGyW.gifv
How do you control fees on a hardware wallet?;2;1;False;Myrmec;dqcwopn;It's over 9000!!!;7fkqh5;https://i.imgur.com/jyoZGyW.gifv
I regard it as a little better than malware...  ;-9;2;False;Packrat73;dqcptn5;It's over 9000!!!;7fkqh5;https://i.imgur.com/jyoZGyW.gifv
You all just naming wallets. Which ones are full nodes? How do I not run a full node? Whats a hot wallet vs cold?;2;1;False;datsundere;dqcv40p;It's over 9000!!!;7fkqh5;https://i.imgur.com/jyoZGyW.gifv
Not having a private key means that the one that has it (Coinbase in this case) have control over your Bitcoins, but they still let you move your coins out.;3;1;False;crypto-pig;dqcy8x4;It's over 9000!!!;7fkqh5;https://i.imgur.com/jyoZGyW.gifv
Nooo! It is user-friendly, but it's also proprietary (closed source), and uses a single address, instead of a new address for each transaction, meaning it's not private.;1;0;False;crypto-pig;dqcy5gw;It's over 9000!!!;7fkqh5;https://i.imgur.com/jyoZGyW.gifv
