body;score;nb_replies;stickied;author;id;post_title;post_id;post_link
Is it worth it to buy one at this point? ;6;2;False;albyro;dqcmbx5;It's over 9000!!!;7fkqh5;https://i.imgur.com/jyoZGyW.gifv
9100 on GDAX. WTF.;7;0;False;throaway5343511;dqcmi6v;It's over 9000!!!;7fkqh5;https://i.imgur.com/jyoZGyW.gifv
Hi r/all!;52;6;False;Bronc27;dqcjxv3;It's over 9000!!!;7fkqh5;https://i.imgur.com/jyoZGyW.gifv
Maybe one day we'll look back and laugh at this post. Not because of the reference, but because of all the fanfare for such a small amount when BTC is valued at $100k.;36;4;False;admin______;dqck1ex;It's over 9000!!!;7fkqh5;https://i.imgur.com/jyoZGyW.gifv
Every time you fuckers get to the front page I kick myself for being too poor to have invested on the last milestone;6;1;False;GODDDDD;dqco3ju;It's over 9000!!!;7fkqh5;https://i.imgur.com/jyoZGyW.gifv
Am I too late for the hype?;5;2;False;DoublePisters;dqco3nq;It's over 9000!!!;7fkqh5;https://i.imgur.com/jyoZGyW.gifv
Part of history.;4;0;False;BioluminescentAnode;dqco43w;It's over 9000!!!;7fkqh5;https://i.imgur.com/jyoZGyW.gifv
This feeling never gets old.;5;0;False;subcypher;dqco6qc;It's over 9000!!!;7fkqh5;https://i.imgur.com/jyoZGyW.gifv
Okay how can I buy bitcoin? I need to get some but I am completely clueless as to how or where to buy them. Can somebody give me a semi-detailed rundown? I’d really like to get into it.;6;4;False;RubyDubyNash;dqcoc2p;It's over 9000!!!;7fkqh5;https://i.imgur.com/jyoZGyW.gifv
START THE DAMN FOMO BEFORE I PISS MYSELF;4;1;False;robertbaretheon;dqcoe6m;It's over 9000!!!;7fkqh5;https://i.imgur.com/jyoZGyW.gifv
I just can’t wait until 1 BTC can purchase a house in the Midwest ;5;0;False;Bryanhenry;dqcpsx5;It's over 9000!!!;7fkqh5;https://i.imgur.com/jyoZGyW.gifv
NANI?!?!?!?!?!?!?!?!?!;4;0;False;Xalteox;dqcr32s;It's over 9000!!!;7fkqh5;https://i.imgur.com/jyoZGyW.gifv
I'd like to be a part of this history too. Hi. Hodling since 6k!;5;0;False;tim12321;dqcna5n;It's over 9000!!!;7fkqh5;https://i.imgur.com/jyoZGyW.gifv
Damn, it is almost 9,100 already.;4;0;False;gokaired990;dqck6bi;It's over 9000!!!;7fkqh5;https://i.imgur.com/jyoZGyW.gifv
Ah, shibal.;7;2;False;coolpeaches;dqcjzec;It's over 9000!!!;7fkqh5;https://i.imgur.com/jyoZGyW.gifv
Remember 8k anyone? Fucking forever ago.;4;1;False;scottdawg9;dqck5ud;It's over 9000!!!;7fkqh5;https://i.imgur.com/jyoZGyW.gifv
Can't wait to see the price when Amazon start accepting Bitcoin next year :);6;2;False;The_English;dqcqtvz;It's over 9000!!!;7fkqh5;https://i.imgur.com/jyoZGyW.gifv
It was at 3,700$ a piece when I started this semester ;6;1;False;isomojo;dqcrhe5;It's over 9000!!!;7fkqh5;https://i.imgur.com/jyoZGyW.gifv
I love all of you ;7;0;False;Lafret;dqck57a;It's over 9000!!!;7fkqh5;https://i.imgur.com/jyoZGyW.gifv
IT'S UNDER 9000!!!;6;0;False;TantricLasagne;dqcsdtk;It's over 9000!!!;7fkqh5;https://i.imgur.com/jyoZGyW.gifv
Note to future self: This was a good day. Also stop reading though your old reddit posts and just enjoy all the money I made you. Your welcome. ;8;0;False;Fly115;dqcsohp;It's over 9000!!!;7fkqh5;https://i.imgur.com/jyoZGyW.gifv
Guess it’s time to crack open the old PC from 2010 and see if I can remember what the hell I did with my two bitcoin. ;6;1;False;PiratedTVPro;dqcz42k;It's over 9000!!!;7fkqh5;https://i.imgur.com/jyoZGyW.gifv
WTF its over $9450 now . SERIOSULY WTF! OMG! AHAHA;7;0;False;;dqd6av5;It's over 9000!!!;7fkqh5;https://i.imgur.com/jyoZGyW.gifv
Forget the moon. We're going to Namek.;6;0;False;;dqdabhd;It's over 9000!!!;7fkqh5;https://i.imgur.com/jyoZGyW.gifv
Get the 10000 gifs ready peeps;6;0;False;juan_mairdab;dqdba57;It's over 9000!!!;7fkqh5;https://i.imgur.com/jyoZGyW.gifv
Where, I still see 8930 on coinmarketcap;12;2;False;asuth;dqcjy9o;It's over 9000!!!;7fkqh5;https://i.imgur.com/jyoZGyW.gifv
"To any newbies thinking about getting in.

1. Don't panic buy. There are more gains in the future and it will take time.
2. Get an account on coinbase or look into localbitcoins. Coinbase is like the simplest and user friendlyist method possible.
3. Buy a small amount. like $20 or something and then WAIT. The worst thing you can do is buy a lot of bitcoin all at once.
4. In the meantime familiarize yourself with bitcoin using bitcoin**.org**
5. Be especially wary of scammers! ""Bitcoin Cash"", ""Bitcoin Gold"", Bitconnect, etc are **not** bitcoin. They are literal scams.
6. The links in the sidebar are good.
7. Learn about Dollar Cost Averaging / Automatic Investing and do that after you are comfortable with your $20.
8. Realize that you, yes you, value losses far greater than gains. If you have $100 to your name and you gain $50 you value this less than losing $50. If you are not aware of this, and you only buy bitcoin because of a fear of missing out then you will inevitably sell at a loss ensuring you lose money. Better to instead get your cash and lite it on fire. At least you get to look at a pretty flame.";53;4;False;kaiser13;dqcnnmr;It's over 9000!!!;7fkqh5;https://i.imgur.com/jyoZGyW.gifv
"You think this is it? Wait till that Big Bang Theory episode hits. 

Just. Fucking. Wait.


There's a reason you won't see major networks cover it on their business sister channels. They're backed by companies that have interests against crypto. I'm actually flabbergasted they'd mention it on the show. It's like the cancer cure equivalent to money.";10;1;False;_reverse_osmosis_;dqcs9ai;It's over 9000!!!;7fkqh5;https://i.imgur.com/jyoZGyW.gifv
KAKAROT;4;0;False;thatoneguy092;dqck0vu;It's over 9000!!!;7fkqh5;https://i.imgur.com/jyoZGyW.gifv
Vegeta, I can't get a read on his power level...;5;0;False;alexander-io;dqck0zs;It's over 9000!!!;7fkqh5;https://i.imgur.com/jyoZGyW.gifv
Over 9000;3;0;False;kadub87;dqck2e9;It's over 9000!!!;7fkqh5;https://i.imgur.com/jyoZGyW.gifv
Got the price alert and am stoked!;4;0;False;Drewberr;dqck41y;It's over 9000!!!;7fkqh5;https://i.imgur.com/jyoZGyW.gifv
Haha yes;5;0;False;thisisnotapassword;dqck4oy;It's over 9000!!!;7fkqh5;https://i.imgur.com/jyoZGyW.gifv
Well, I'm happy. ;6;0;False;magpietongue;dqck5g3;It's over 9000!!!;7fkqh5;https://i.imgur.com/jyoZGyW.gifv
I got the price alert on my phone and came to reddit specifically to see this meme;8;0;False;archides;dqck197;It's over 9000!!!;7fkqh5;https://i.imgur.com/jyoZGyW.gifv
"It's over $9000!!!

...should I buy more?";4;1;False;Talador12;dqcpotd;It's over 9000!!!;7fkqh5;https://i.imgur.com/jyoZGyW.gifv
WHAT THATS IMPOSSIBLE;13;1;False;FunkyFurrar;dqck1xu;It's over 9000!!!;7fkqh5;https://i.imgur.com/jyoZGyW.gifv
Commenting for historical purposes;3;0;False;12and4;dqck4v9;It's over 9000!!!;7fkqh5;https://i.imgur.com/jyoZGyW.gifv
I bought for the first time today! I get to be wise and foolish at the same time. Welcome to the future. ;3;0;False;topbossultra;dqck8gx;It's over 9000!!!;7fkqh5;https://i.imgur.com/jyoZGyW.gifv
FED on suicide watch ;4;1;False;AtlKolsch;dqcm5d8;It's over 9000!!!;7fkqh5;https://i.imgur.com/jyoZGyW.gifv
WHY HAVENT U BUY BITCOIN YET REDDITORS???;4;0;False;ClearThug;dqcm69x;It's over 9000!!!;7fkqh5;https://i.imgur.com/jyoZGyW.gifv
"Since I'm stumbling on to this from the top of /all, a question for bitcoin people: Isn't the fact the bitcoin keeps skyrocketing in price terrible for its future as a usable currency?     

Currency must be a stable store of value, and bitcoin seems to be anything but that. The fluctuations encourage extreme hoarding or selling. This is great for speculators but bad for the currency's future. So celebratory posts like these seem strange to me. Can someone explain to me why bitcoin's rising price is a good thing for anyone but risky speculators?";4;5;False;mangoblur;dqcocwc;It's over 9000!!!;7fkqh5;https://i.imgur.com/jyoZGyW.gifv
"Congratulations to all. This is truly a historic day in Bitcoin. 

But one day we will look back on 9k as cheap. What a time to be alive. ";4;0;False;NotMyMcChicken;dqcpjv9;It's over 9000!!!;7fkqh5;https://i.imgur.com/jyoZGyW.gifv
"Awww man. 30k upvotes and 12 gold for only $5 is a pretty good deal hahaha I should have asked for more money

https://www.reddit.com/r/PhotoshopRequest/comments/7fjk9m/paid_i_want_the_bitcoin_logo_added_to_vegetas/

Congrats dude";3;0;False;Waiting_For_Backup;dqcvh0q;It's over 9000!!!;7fkqh5;https://i.imgur.com/jyoZGyW.gifv
Now if people into bitcoin would actually use it as a currency instead of a holder/speculator toy maybe more people would take it seriously...;10;2;False;wowy-lied;dqcoazz;It's over 9000!!!;7fkqh5;https://i.imgur.com/jyoZGyW.gifv
Jesus christ ;2;0;False;DamnnitBobby;dqck65k;It's over 9000!!!;7fkqh5;https://i.imgur.com/jyoZGyW.gifv
Put on all!!;2;0;False;terr547;dqck6fo;It's over 9000!!!;7fkqh5;https://i.imgur.com/jyoZGyW.gifv
My girlfriend doesn’t understand why I kept refreshing Blockfolio 60 times over 2 minutes just to see this meme. Safe to say we are breaking up now. ;3;0;False;sestrooper;dqclw0j;It's over 9000!!!;7fkqh5;https://i.imgur.com/jyoZGyW.gifv
TO THE FRONT PAGE WITH YOU!;2;0;False;Ascends;dqck766;It's over 9000!!!;7fkqh5;https://i.imgur.com/jyoZGyW.gifv
i'm not holding any btc rn but holy shit, congrats;2;0;False;Juankestein;dqckg3x;It's over 9000!!!;7fkqh5;https://i.imgur.com/jyoZGyW.gifv
we've made it to /all boys;2;0;False;asuth;dqckj3v;It's over 9000!!!;7fkqh5;https://i.imgur.com/jyoZGyW.gifv
Nearly pooped myself when I saw;2;0;False;wheelzoffortune;dqckllf;It's over 9000!!!;7fkqh5;https://i.imgur.com/jyoZGyW.gifv
[10,000 next](https://youtu.be/DTHXDtQrsvE);2;0;False;anzel2002;dqcklzs;It's over 9000!!!;7fkqh5;https://i.imgur.com/jyoZGyW.gifv
I love you Bitcoin. ❤️;2;0;False;DanknugzBlazeit420;dqcko2v;It's over 9000!!!;7fkqh5;https://i.imgur.com/jyoZGyW.gifv
"Yes 9000 is expensive. Yes you should still buy more even at 9000. 

why?
Because it going to cross 10k before December ends. ";2;0;False;the_fat_engineer;dqckptd;It's over 9000!!!;7fkqh5;https://i.imgur.com/jyoZGyW.gifv
😳 wow;2;0;False;lglg666;dqckq13;It's over 9000!!!;7fkqh5;https://i.imgur.com/jyoZGyW.gifv
Holy fucking shit!!!!  It’s over 900000000000000000!!!!!;2;0;False;American83;dqcks99;It's over 9000!!!;7fkqh5;https://i.imgur.com/jyoZGyW.gifv
I’m baked and this is insanely cool looking ;2;0;False;SiilentWalrus;dqckfd1;It's over 9000!!!;7fkqh5;https://i.imgur.com/jyoZGyW.gifv
Forget futures trading from the CME group, this meme is what will push bitcoin mainstream. ;2;1;False;lunaislife;dqcksfr;It's over 9000!!!;7fkqh5;https://i.imgur.com/jyoZGyW.gifv
I created the same post and it didn't get attention at all :D;2;1;False;innermous;dqclw09;It's over 9000!!!;7fkqh5;https://i.imgur.com/jyoZGyW.gifv
"This is the moment we all been waiting for 😂😂😂 and no I DONT mean to sell!

I’ve personally been waiting for these memes since I got into bitcoin modestly in July this year 😂 and I knew it was coming ! ☝️💰";4;0;False;SJwaxKing408;dqckdtr;It's over 9000!!!;7fkqh5;https://i.imgur.com/jyoZGyW.gifv
What are the chances it makes it to 10k today?;3;2;False;AlexHM;dqd1qwd;It's over 9000!!!;7fkqh5;https://i.imgur.com/jyoZGyW.gifv
For those newcomers, forget about this amazing increase and price and learn about the fundamentals before investing. This is a revolutionary technology that will change the world. That is why it’s valuable. https://bitcoin.org/;3;1;False;voluntaryistmitch;dqd4kpz;It's over 9000!!!;7fkqh5;https://i.imgur.com/jyoZGyW.gifv
Baby I got $33 in bitcoin now, all the way up from $23! YEEEEHHHHH;3;0;False;;dqd4zsw;It's over 9000!!!;7fkqh5;https://i.imgur.com/jyoZGyW.gifv
Just hit 7000 gbp. Not long and we can do this meme with vegeta wearing a bowler hat and monocle drinking a lovely cup of tea;3;0;False;ophqui;dqd56t6;It's over 9000!!!;7fkqh5;https://i.imgur.com/jyoZGyW.gifv
Jesus Christ, about to hit 9500!!!!! Will we see 10k today? ;3;0;False;pat1122;dqd73bh;It's over 9000!!!;7fkqh5;https://i.imgur.com/jyoZGyW.gifv
Wow this is crazy. If I'm a pleb in the sweet sweet coin department, where can I get started with learning about Bitcoin?;3;3;False;Maguichi;dqd962i;It's over 9000!!!;7fkqh5;https://i.imgur.com/jyoZGyW.gifv
Yeah... That guy is going to have to eat his nut lol;3;0;False;ITtZ_JOEDADDY20;dqdb3wt;It's over 9000!!!;7fkqh5;https://i.imgur.com/jyoZGyW.gifv
I was here when Bitcoin broke $9000.;3;0;False;HelloImRich;dqddw4i;It's over 9000!!!;7fkqh5;https://i.imgur.com/jyoZGyW.gifv
"To our friends at r/all, please consider taking a moment of your time to learn about Bitcoin on www.bitcoin.org or www.weusecoins.com.

Bitcoin is a highly disruptive technology that strips power from banks and distributes it to the people. Like me you probably use the Internet for everything - it's time for to embrace the Internet of money.

> Bitcoin is a technological tour de force. - Bill Gates";4;0;False;magpietongue;dqckj70;It's over 9000!!!;7fkqh5;https://i.imgur.com/jyoZGyW.gifv
Sex;9;2;False;PowerPort27;dqcjzcj;It's over 9000!!!;7fkqh5;https://i.imgur.com/jyoZGyW.gifv
It's rising to the moon! https://imgur.com/idzQqKc;5;1;False;Chiyo;dqck1r6;It's over 9000!!!;7fkqh5;https://i.imgur.com/jyoZGyW.gifv
/r/all within one hour? There is no way that can be right!;6;1;False;nopara73;dqcm222;It's over 9000!!!;7fkqh5;https://i.imgur.com/jyoZGyW.gifv
"Exciting time in the world guys.

Ok. So the internet brought humanity together and the first thing humanity changed altogether was Media. In a big fucking way.

Now it's finances. In a big fucking way. 

What's next? (Mr. Robot viewers, let's hear your voice. 

";4;1;False;whiterose404;dqcmcef;It's over 9000!!!;7fkqh5;https://i.imgur.com/jyoZGyW.gifv
Start marinating those balls. ;7;1;False;;dqcnwl6;It's over 9000!!!;7fkqh5;https://i.imgur.com/jyoZGyW.gifv
And the meek shall inherit the earth.  Eat it, greedy bankers. Eat it, slave driver Central Banks of the world. We coming for you, we coming for our freedom back. And we coming for our honest money. To the moon my friends. To the moon. ;3;0;False;cee604;dqcxl2v;It's over 9000!!!;7fkqh5;https://i.imgur.com/jyoZGyW.gifv
"If you are new to Bitcoin and wondering why it's so valuable, please read this:
Bitcoin’s value derives from its current real uses (mainly for money transfers and remittances) its limited supply and scarcity (store of value) and its many potential uses. Also, behind the curtains there is a huge growth in the bitcoin ecosystem development that a regular folk can't see because it's ignored by the media.
If you buy for day trading you may lose money, but if you hold long term, it has been proven you get nice ROI. And bitcoin has barely started, think of the Internet/email in the 90's. A decentralized technology that has a valuable use it's not going to disappear, even if a few tyrannical governments try to ""ban"" it.
Check out this great articles:
What Gave Bitcoin Its Value?
https://fee.org/articles/what-gave-bitcoin-its-value/
""How do Bitcoins have value?""
https://www.quora.com/How-do-Bitcoins-have-value/answer/David-Strayhorn
Bitcoin is a worldwide-distributed decentralized peer-to-peer censorship-resistant trustless and permissionless deflationary system/currency (see Blockchain technology) backed by mathematics, open source code, cryptography and the most powerful and secure decentralized computational network on the planet, orders of magnitude more powerful than Google and government combined. There is a limit of 21 million bitcoins (divisible into smaller units). ""Backed by Government"" money is not backed by anything and is infinitely printed at will by Central Banks. Bitcoin is limited and decentralized.
Receive and transfer money, from cents (micropayments) to thousands:
Very cheap regardless of amount $$$ sent (with new apps coming)
Borderless (no country can stop it from going in/out or confiscate)
Trustless (nobody needs to trust anybody for it to work)
Privacy (no need to expose personal information)
Securely (encrypted cryptographically and can’t be confiscated)
Permissionless (no approval from central powers needed)
Instantly (from seconds to a few minutes)
Open source (auditable by anybody)
Worldwide distributed (from anywhere to anywhere on the planet)
Censorship resistant (no government can stop its use)
Peer-to-peer (no intermediaries with a cut)
Portable (easier to carry/move than cash, gold and silver)
Public ledger (transparent, seen by everybody)
Scalable (each bitcoin is divisible down to 8 decimals)
Decentralized (distributed with no single point of failure)
Deflationary (its supply goes down with time until reaching 21 million ever)
Immutable global registry (can’t be altered/hacked by nobody)
No chargebacks-No fraud ('push' vs' 'pull' transactions).﻿
And that’s just as currency, Bitcoin has many more uses and applications.
";13;1;False;Ascends;dqck7l4;It's over 9000!!!;7fkqh5;https://i.imgur.com/jyoZGyW.gifv
Yeah but what about the feeling of pride and accomplishment that comes with earned money through hard and meaningful work?;13;2;False;;dqcp9j8;It's over 9000!!!;7fkqh5;https://i.imgur.com/jyoZGyW.gifv
[deleted];3;1;False;;dqckb9k;It's over 9000!!!;7fkqh5;https://i.imgur.com/jyoZGyW.gifv
Sure is a lot of propaganda in here ;6;1;False;le_maymay;dqcmcbe;It's over 9000!!!;7fkqh5;https://i.imgur.com/jyoZGyW.gifv
I’m not shocked it reached $9000 however I’m totally shocked how fast it got there. $10,000 in coming. ;2;0;False;deeznuts69;dqckssj;It's over 9000!!!;7fkqh5;https://i.imgur.com/jyoZGyW.gifv
I’ll tell my grandchildren about this day. Glorious.;2;0;False;GlockAndLoad;dqckt21;It's over 9000!!!;7fkqh5;https://i.imgur.com/jyoZGyW.gifv
Witnessed;2;0;False;;dqcktuy;It's over 9000!!!;7fkqh5;https://i.imgur.com/jyoZGyW.gifv
Wait where did that cat post go!?;2;0;False;Jsn7821;dqcliyo;It's over 9000!!!;7fkqh5;https://i.imgur.com/jyoZGyW.gifv
"I haven't been able to afford to invest since it was at 600-1200 :( 

...good luck to you all";2;3;False;maybe_just_happy_;dqcljr8;It's over 9000!!!;7fkqh5;https://i.imgur.com/jyoZGyW.gifv
Buy More!!!!!!!!;2;0;False;stup3ndo;dqclmlb;It's over 9000!!!;7fkqh5;https://i.imgur.com/jyoZGyW.gifv
"can anyone recommend a good way to trade my real money for bitcoin online? 

I guess something like bitpay , dont know who is trustworthy and safe to store them";2;2;False;User_5098213;dqclmon;It's over 9000!!!;7fkqh5;https://i.imgur.com/jyoZGyW.gifv
How do you use Bitcoin? Do most people just hold on to them?;2;1;False;Username0089;dqclo4s;It's over 9000!!!;7fkqh5;https://i.imgur.com/jyoZGyW.gifv
Vegetas time to shine.;2;0;False;MuchoCalienteMexican;dqcloav;It's over 9000!!!;7fkqh5;https://i.imgur.com/jyoZGyW.gifv
Can we reuse at $90,000?;11;2;False;voluntaryistmitch;dqclz01;It's over 9000!!!;7fkqh5;https://i.imgur.com/jyoZGyW.gifv
"If you want to know more about Bitcoin, here are a few great documentaries educating on the subject.

* [Magic Money: The Bitcoin Revolution 2017](https://youtu.be/xqq2SyNIifE)

* [Banking On Bitcoin 2017](
http://netflix.com/title/80154500)

* [The Rise and Rise of Bitcoin 2014](https://vimeo.com/187382945)";2;1;False;CaptainKyloStark;dqcloqp;It's over 9000!!!;7fkqh5;https://i.imgur.com/jyoZGyW.gifv
Top of all, let’s get more people in and bring it to 10k! 12k by year end ;2;0;False;;dqcli7x;It's over 9000!!!;7fkqh5;https://i.imgur.com/jyoZGyW.gifv
Commenting to say I was part of the r/bitcoin community for this majestic moment in history ;2;0;False;jsjarv;dqclp0f;It's over 9000!!!;7fkqh5;https://i.imgur.com/jyoZGyW.gifv
👉😎👉 zoop;2;0;False;specialk3;dqclpk5;It's over 9000!!!;7fkqh5;https://i.imgur.com/jyoZGyW.gifv
Ahhhhh!!!!!! Shit should have bought more;2;0;False;MusclesBrah24;dqclrni;It's over 9000!!!;7fkqh5;https://i.imgur.com/jyoZGyW.gifv
Wish I bought some when it was like 100$.;2;1;False;CanadianJudo;dqclrwn;It's over 9000!!!;7fkqh5;https://i.imgur.com/jyoZGyW.gifv
So is it too late to start bitcoin mining and whats the ROI on that? ;2;2;False;141_1337;dqclvqp;It's over 9000!!!;7fkqh5;https://i.imgur.com/jyoZGyW.gifv
The one time I jump to browsing the front page before diving into this subreddit first, and I'm still brought right back here.;2;0;False;PaulJP;dqclwdp;It's over 9000!!!;7fkqh5;https://i.imgur.com/jyoZGyW.gifv
I wish I invested in Bitcoin in 2009 LOL.;2;1;False;Aurify;dqcm0ch;It's over 9000!!!;7fkqh5;https://i.imgur.com/jyoZGyW.gifv
"You know what *else* is over 9000? 

10000

And 100000

And 1000000

TO MOON";2;0;False;;dqcm2kb;It's over 9000!!!;7fkqh5;https://i.imgur.com/jyoZGyW.gifv
"I can't afford it, nor have the resources to mine my own...despite having spent nearly a decade watching.

I'm here...for nothing other than having been here. 

Much like other lurkers...I can tell my offspring how different their life would be had I done even the most medial of shit.

'I WAS THERE, AND DID FUCK ALL""";2;2;False;hello_dali;dqcm2nw;It's over 9000!!!;7fkqh5;https://i.imgur.com/jyoZGyW.gifv
#Roadto10k;2;0;False;abolishpmo;dqclpf5;It's over 9000!!!;7fkqh5;https://i.imgur.com/jyoZGyW.gifv
It's over [Gram's number!](https://blogs.scientificamerican.com/roots-of-unity/grahame28099s-number-is-too-big-for-me-to-tell-you-how-big-it-is/);2;0;False;TedDallas;dqclhls;It's over 9000!!!;7fkqh5;https://i.imgur.com/jyoZGyW.gifv
This is truly incredible!;2;0;False;redd_now;dqclfhl;It's over 9000!!!;7fkqh5;https://i.imgur.com/jyoZGyW.gifv
What a moment ;2;0;False;Mulsanne;dqclff1;It's over 9000!!!;7fkqh5;https://i.imgur.com/jyoZGyW.gifv
Look ma! I'm on the front page!;2;0;False;15SecNut;dqckuy2;It's over 9000!!!;7fkqh5;https://i.imgur.com/jyoZGyW.gifv
Buying bit coin 10gp ea ;2;0;False;Qwewe6;dqckvdh;It's over 9000!!!;7fkqh5;https://i.imgur.com/jyoZGyW.gifv
We'll get to make this meme again when it hits $90k;2;0;False;dezradeath;dqckw07;It's over 9000!!!;7fkqh5;https://i.imgur.com/jyoZGyW.gifv
Sounds like fomo investing. Im new to btc, so what's is your basis for valuing at $9000? ;2;1;False;CatReviewsStuff;dqckw74;It's over 9000!!!;7fkqh5;https://i.imgur.com/jyoZGyW.gifv
We're making history here boys;2;0;False;pike1324;dqckx79;It's over 9000!!!;7fkqh5;https://i.imgur.com/jyoZGyW.gifv
People shorting the ATH. ;2;0;False;OtherSideOfThe_Coin;dqckxqy;It's over 9000!!!;7fkqh5;https://i.imgur.com/jyoZGyW.gifv
Time to ride my Lambo on the moon ;2;0;False;mxdSirty;dqckzzm;It's over 9000!!!;7fkqh5;https://i.imgur.com/jyoZGyW.gifv
**Im just here to plant my flag in this legendary moment** Got Bitcoin GO!;2;0;False;TripTryad;dqcl0ia;It's over 9000!!!;7fkqh5;https://i.imgur.com/jyoZGyW.gifv
Where were you when bitcoin hit 9k?;2;1;False;flclst3v3;dqcl4er;It's over 9000!!!;7fkqh5;https://i.imgur.com/jyoZGyW.gifv
How many Bitcoins does the Saiyan scouter style Bitcoin machine cost? ;2;0;False;AJ-Murphy;dqcl792;It's over 9000!!!;7fkqh5;https://i.imgur.com/jyoZGyW.gifv
One step closer to that guy eating his own junk;2;0;False;Emrico1;dqcl821;It's over 9000!!!;7fkqh5;https://i.imgur.com/jyoZGyW.gifv
Satoshi is a hero;2;0;False;constitutionranger;dqclaai;It's over 9000!!!;7fkqh5;https://i.imgur.com/jyoZGyW.gifv
History ;2;0;False;xangto;dqclaay;It's over 9000!!!;7fkqh5;https://i.imgur.com/jyoZGyW.gifv
I'm only here for the DBZ memes;2;0;False;highqi;dqcld27;It's over 9000!!!;7fkqh5;https://i.imgur.com/jyoZGyW.gifv
hi mom;2;0;False;WcDeckel;dqcldiu;It's over 9000!!!;7fkqh5;https://i.imgur.com/jyoZGyW.gifv
"I was here refreshing my screen! I'm in history!

I can now go to sleep peacefully =)";2;0;False;Gaspa79;dqcldp4;It's over 9000!!!;7fkqh5;https://i.imgur.com/jyoZGyW.gifv
Fuck I should really look into getting involve in the stock market.;2;2;False;kokaine21;dqclens;It's over 9000!!!;7fkqh5;https://i.imgur.com/jyoZGyW.gifv
I'm a simple man, bitcoin goes over 9000 and I upvote every post here.;27;0;False;kfull;dqckdal;It's over 9000!!!;7fkqh5;https://i.imgur.com/jyoZGyW.gifv
We finally did it!;2;0;False;ChieHasGreatLegs;dqclf3z;It's over 9000!!!;7fkqh5;https://i.imgur.com/jyoZGyW.gifv
Hi /r/all . Buy Bitcoin;87;3;False;EternalLousy;dqck073;It's over 9000!!!;7fkqh5;https://i.imgur.com/jyoZGyW.gifv
I want to get in. Anyone having bought bitcoin from localbitcoins.com? Many recommend coinbase but I read a lot of negative about'em.;3;3;False;zexx1976;dqd0qrp;It's over 9000!!!;7fkqh5;https://i.imgur.com/jyoZGyW.gifv
"14k+ before the year ends 

To the moon!!!";3;0;False;jyl5555;dqd0p4e;It's over 9000!!!;7fkqh5;https://i.imgur.com/jyoZGyW.gifv
history right here;3;0;False;Zatline;dqd0bay;It's over 9000!!!;7fkqh5;https://i.imgur.com/jyoZGyW.gifv
High five’s all around guys. I would have never thought this day would ever come. This truly feels like I’m dreaming. ;11;0;False;cryogen;dqcofaq;It's over 9000!!!;7fkqh5;https://i.imgur.com/jyoZGyW.gifv
Should I buy now;3;2;False;mastermoebius;dqcnfrj;It's over 9000!!!;7fkqh5;https://i.imgur.com/jyoZGyW.gifv
Holy cow! Top of reddit.;3;0;False;juscamarena;dqcniaw;It's over 9000!!!;7fkqh5;https://i.imgur.com/jyoZGyW.gifv
What is so amazing is that Bitcoin is still very very niche... The adoption is around .1% right now. We have so much more room for growth, it's insane. Bitcoin/cryptos WILL be accepted nearly everywhere by 2025, that is my prediction at least...;3;0;False;superslamz;dqcnifc;It's over 9000!!!;7fkqh5;https://i.imgur.com/jyoZGyW.gifv
Wtf, I'm a lurker and in wish I was into bitcoin earlier. I really dont know how to start or how to mine or buy bitcoins.;3;3;False;gotmilo11;dqcnk6s;It's over 9000!!!;7fkqh5;https://i.imgur.com/jyoZGyW.gifv
OMFG r/all! To the moon we go! ;3;0;False;BrownFat;dqcnmd6;It's over 9000!!!;7fkqh5;https://i.imgur.com/jyoZGyW.gifv
waiting for the inevitable crash (seriously though beating myself up about not buying years ago);3;0;False;IBangedYourMom69;dqcnsxl;It's over 9000!!!;7fkqh5;https://i.imgur.com/jyoZGyW.gifv
[removed];3;1;False;;dqcnt11;It's over 9000!!!;7fkqh5;https://i.imgur.com/jyoZGyW.gifv
I've never seen so much gold on one post before.;3;0;False;Kitkat_the_Merciless;dqcmznc;It's over 9000!!!;7fkqh5;https://i.imgur.com/jyoZGyW.gifv
