body;score;nb_replies;stickied;author;id;post_title;post_id;post_link
"this.  need more of this.

cf my post here, for example.  0 replies

from 

https://np.reddit.com/r/Bitcoin/comments/5snuze/an_outsiders_view_on_segwit_vs_unlimited/ddh569f/?context=10000

    
    Greg,
    
    ... as it's been explained to me (please correct if there are errors here), this is the case against in broad outlines:
    
    * you work for a venture capital funded startup called blockstream
    
    * blockstream is funded in part from money, now with controlling interest, from the Bilderberg ""club""
    
    * blockstream employs a large fraction, probably a majority of the now ""core"" bitcoin developers
    
    * the primary business of blockstream is to build an off-chain payment network called lightning network (LN), which is a for-profit service that will generate private revenue to this company, and thus pay back the VC investors. at 55M post on last round, it's a 0.5->few billion to pay back this debt.
    
    * the only effective way LN systems work is to implement segwit
    
    * increasing block size now to 2, 4 or 8mb (or at all) reduces the need for a separate payment network like LN
    
    * increasing to 2,4 or 8 mb is possible right now (many tests and data show this, I've seen them), but core has not implemented larger blocks primarily because doing so conflicts with blockstream business priorities - it would lessen any need for off-chain, for-profit transaction processing
    
    * moreover, segwit is inordinately complex, trying to solve for a problem we do not have, and will require all future implementations of bitcoin clients to carry with it the overhead of segwit implementations - which only makes sense if you buy into making off chain systems to process transactions
    
    ___
    
    please, address these concerns directly, or refute with alternate facts.  these parallel threads allow for open discussion and look forward to it!
    
    
       ";4;3;False;jmdugan;deujs5w;Gavin Andresen on Twitter - Running BU is saying 'I'm ready for bigger blocks whenever there is wide consensus for bigger blocks' | Not 'let's fork ASAP';5yz7dk;https://twitter.com/gavinandresen/status/840940621456125952
If you left bitcoin then you missed out it rising 5x in 18 months.;2;0;False;belcher_;deuoji6;Gavin Andresen on Twitter - Running BU is saying 'I'm ready for bigger blocks whenever there is wide consensus for bigger blocks' | Not 'let's fork ASAP';5yz7dk;https://twitter.com/gavinandresen/status/840940621456125952
"[They already are](https://coin.dance/blocks/historical)

And no, we're not going to fork until we know we're going to win. There's no clock, every day Core digs itself a deeper hole and bans a few more Bitcoiners from their sub so why would we stop them doing our job for us?

Your insistence we be hasty is motivated by your understandable anxiety that if done in due course the hard fork will work - which it will.

You can come to terms with this now or later. It's harder on your ego in the short term to admit you were wrong and change your opinion now, but there's always the option to stay in denial until reality makes the choice for you. Your call.";7;0;False;Shibinator;deuxbkv;Gavin Andresen on Twitter - Running BU is saying 'I'm ready for bigger blocks whenever there is wide consensus for bigger blocks' | Not 'let's fork ASAP';5yz7dk;https://twitter.com/gavinandresen/status/840940621456125952
"Absolutely. I was referring to this particular statement parent mentioned, i.e., the two ""sides"" Gavin referenced in the tweet. Both of *those* sides on this one point are Core fabrications.";6;1;False;ForkiusMaximus;dev1bxo;Gavin Andresen on Twitter - Running BU is saying 'I'm ready for bigger blocks whenever there is wide consensus for bigger blocks' | Not 'let's fork ASAP';5yz7dk;https://twitter.com/gavinandresen/status/840940621456125952
"Thank you for helping show that the ""fork it"" crowd is made up of a lot of small-blockers. Why would we fork ourselves into obscurity? ""Our"" coin WILL be bitcoin.";1;0;False;notaduckipromise;devcnha;Gavin Andresen on Twitter - Running BU is saying 'I'm ready for bigger blocks whenever there is wide consensus for bigger blocks' | Not 'let's fork ASAP';5yz7dk;https://twitter.com/gavinandresen/status/840940621456125952
I don't think you understand how BU works. ;5;0;False;knight222;deuop8h;Gavin Andresen on Twitter - Running BU is saying 'I'm ready for bigger blocks whenever there is wide consensus for bigger blocks' | Not 'let's fork ASAP';5yz7dk;https://twitter.com/gavinandresen/status/840940621456125952
"https://coin.dance/blocks/historical

Definitely looks like things are never going to change.  Never.  Like, never ever.

lol keep telling yourself that.";3;0;False;Shibinator;deuxghl;Gavin Andresen on Twitter - Running BU is saying 'I'm ready for bigger blocks whenever there is wide consensus for bigger blocks' | Not 'let's fork ASAP';5yz7dk;https://twitter.com/gavinandresen/status/840940621456125952
"Looks like it should be ""blockstream"" instead of ""blockchain"" , where did you get this from?";2;0;False;funk-it-all;deum639;Gavin Andresen on Twitter - Running BU is saying 'I'm ready for bigger blocks whenever there is wide consensus for bigger blocks' | Not 'let's fork ASAP';5yz7dk;https://twitter.com/gavinandresen/status/840940621456125952
"Is this serious? 

You got the name of the company wrong, so you didn't even bother doing basic research (https://blockstream.com/about/) and the Bilderberg ""club"" controls it! lol 

You should've just asked him to deny he is a lizard person?";2;2;False;polsymtas;deup5tr;Gavin Andresen on Twitter - Running BU is saying 'I'm ready for bigger blocks whenever there is wide consensus for bigger blocks' | Not 'let's fork ASAP';5yz7dk;https://twitter.com/gavinandresen/status/840940621456125952
"With BU, your node has whatever cap you set it to. Which might make you end up on a minority chain, but it was and is always like that. For example, if you set it to Luke-Jr's proposed 300kB now, you follow him on his small block user-activated soft-fork minority chain. (I don't know whether it exists)

So what alternative to being able to set your EB/AD/MG with BU do you want?

*Someone telling you what to do?*

There are no such authorities that can do that for you, *unless you make them your* **personal** *authorities*.

 But you are always strongly incentivized to follow the majority of the miners - and it has always been that way.";2;0;False;awemany;dev9kzn;Gavin Andresen on Twitter - Running BU is saying 'I'm ready for bigger blocks whenever there is wide consensus for bigger blocks' | Not 'let's fork ASAP';5yz7dk;https://twitter.com/gavinandresen/status/840940621456125952
Controlled? Evidence?;1;0;False;polsymtas;deuw5ym;Gavin Andresen on Twitter - Running BU is saying 'I'm ready for bigger blocks whenever there is wide consensus for bigger blocks' | Not 'let's fork ASAP';5yz7dk;https://twitter.com/gavinandresen/status/840940621456125952
