body;score;nb_replies;stickied;author;id;post_title;post_id;post_link
"Kindly note, you've supplied an article from sixth months ago that presents a hypothetical issue....that has already been addressed, because there is an alpha release of the lightning network available for further TESTING out for the last two months (see the importance real developers put on testing now?), that will ensure nothing can go wrong with it.

But again, more insults from you, as if im lazy to research. Ironic that your lack of research has meant you spent a good amount of time creating an invalid argument.  

I must have said it ten times now, so to anyone reading it must be becoming abundantly clear, the BU supporter's position is nothing more than inaccuracies and argument based tactics. 

When we come down to the facts the BU supporter is completely useless, prepared to follow a path based only on blind faith, a faith not on the merits of what they support. No. A faith based on blind ignorance, because, after all lightning will never get released...:-

https://btcmanager.com/1nd-alpha-release-lightning-network-open-to-developer-testing/

Segwit and lighting networks will add so many more features while solving the scaling problem that the BU supporters will be falling over themselves to make excuses for why they were against it.";0;1;False;;devvjfx;Bloomberg: Antpool will switch entire pool to Bitcoin Unlimited;5z3hv5;https://www.bloomberg.com/news/articles/2017-03-13/bitcoin-miners-signal-revolt-in-push-to-fix-sluggish-blockchain
"> Have you seen what the BU miners signal?

Yes

> Exactly. That attack is a non-issue. Because incentives.

ok";3;0;False;jonny1000;deva6uc;Bloomberg: Antpool will switch entire pool to Bitcoin Unlimited;5z3hv5;https://www.bloomberg.com/news/articles/2017-03-13/bitcoin-miners-signal-revolt-in-push-to-fix-sluggish-blockchain
"Well the higher the better, 

If there is a threat of UASF I actually support a currency split.. so any threshold would be good.. if a small group of individuals can change consensus rules without hash power then it is not Bitcoin anymore.";13;2;False;Ant-n;dev40d2;Bloomberg: Antpool will switch entire pool to Bitcoin Unlimited;5z3hv5;https://www.bloomberg.com/news/articles/2017-03-13/bitcoin-miners-signal-revolt-in-push-to-fix-sluggish-blockchain
Your level of absolute stupidity and lack of any sort of coherent thought whatsoever is a real marvel to behold.;5;0;False;aquahol;devqbdb;Bloomberg: Antpool will switch entire pool to Bitcoin Unlimited;5z3hv5;https://www.bloomberg.com/news/articles/2017-03-13/bitcoin-miners-signal-revolt-in-push-to-fix-sluggish-blockchain
">  I'm sure you know that already and getting paid.

I must be getting paid because I'm poking fun at your retardedness on reddit?";3;0;False;freshlysquosed;devk1h4;Bloomberg: Antpool will switch entire pool to Bitcoin Unlimited;5z3hv5;https://www.bloomberg.com/news/articles/2017-03-13/bitcoin-miners-signal-revolt-in-push-to-fix-sluggish-blockchain
The rule by intimidation is nasty. Not only does it silence dissent from the other non Blockstream core devs, it encourages them to compromise any principles they may have had for open source development or sound money. We see it everyday on Wall Street where everyone actually knows about the moral hazard of money printing but they go along with it because they just say fuck it, let me get my share. We see it in the companies and altcoins that numerous core devs have established like Bitgo and Green Address that are built to leverage the 75%discount to SW tx's over regular tx's meant to drive users to centralized LN hubs that will siphon tx fees away from miners. ;18;0;False;H0dl;dev5mcx;Bloomberg: Antpool will switch entire pool to Bitcoin Unlimited;5z3hv5;https://www.bloomberg.com/news/articles/2017-03-13/bitcoin-miners-signal-revolt-in-push-to-fix-sluggish-blockchain
They can do it with a HF as well. Recompile one line of code.;12;1;False;Shock_The_Stream;dev7i7r;Bloomberg: Antpool will switch entire pool to Bitcoin Unlimited;5z3hv5;https://www.bloomberg.com/news/articles/2017-03-13/bitcoin-miners-signal-revolt-in-push-to-fix-sluggish-blockchain
"> I think its quite difficult to implement

It's been implemented in Classic and btcd.  /u/thomaszander estimated it to be about one day of work to add it to Core.";2;1;False;Helvetian616;devqy4m;Bloomberg: Antpool will switch entire pool to Bitcoin Unlimited;5z3hv5;https://www.bloomberg.com/news/articles/2017-03-13/bitcoin-miners-signal-revolt-in-push-to-fix-sluggish-blockchain
"> Now please die fucking troll.

This is very sad, can't you see how you completely prove the entire basis of my point when you retort with this? I've said each time BU supporters can only engage with argument based tactics. You've offered nothing to this discussion......only argued with me, then resorted to insulting and swearing, which is what I said BU supporters do. This is because they have no substance to their stance, it is born from manipulation and they don't realize the facts, they are just helping a small group of millionaires achieve their personal agenda within Bitcoin.

We already covered this, I'll do it again for you:-

1.) I know, we are agreed BU criticize Core but then steal their work to base changes from. They change core principles that give miners more power, yet don't start from previous versions and even directly reference core in their code.

2.) In your first response you said.... ""because core dev dont want to participate that there is no peer review""....you acknowledgd there isn't any real peer review already, did you forget? Even worse of BU when someone points out a mistake in their code they don't even bother to fix it.

3.) On what planet is it not important to be thorough with code that billions of dollars will rely on? I know....BU shill planet.

4.) Considering this point references the mistake you ALREADY acknowledged in point 3, it is a little difficult to then pretend it never happened, considering its written for all to see.

Feel free to insult me some more I will not mind, I'm sure I am annoying to you but please know this is nothing personal against you, its personal against BU who manipulated and misled people like you into supporting them. ";-1;2;False;;devnv24;Bloomberg: Antpool will switch entire pool to Bitcoin Unlimited;5z3hv5;https://www.bloomberg.com/news/articles/2017-03-13/bitcoin-miners-signal-revolt-in-push-to-fix-sluggish-blockchain
"Have you seen what the BU miners signal?

Exactly. That attack is a non-issue. Because incentives.";4;1;False;awemany;deva0tu;Bloomberg: Antpool will switch entire pool to Bitcoin Unlimited;5z3hv5;https://www.bloomberg.com/news/articles/2017-03-13/bitcoin-miners-signal-revolt-in-push-to-fix-sluggish-blockchain
"The entire community is against the propaganda you're spreading. It's not censorship, it's organic disagreement with your misinformation.

Segwit can't bring Bitcoin to Visa levels because it doesn't allow for an adaptive blocksize. But you wouldn't know that because you're not a developer. Don't take it from me, take it from your precious Peter Todd: https://bitcoinmagazine.com/articles/here-s-how-bitcoin-s-lightning-network-could-fail-1467736127/

Core has made 54% of addresses with Bitcoin amounts unspendable due to high fees.

These users will not be able to open or close LN channels to reach those so called visa levels you're talking about. But you're good at ignoring facts so don't worry about it.

Since you don't do much independent research, I'll just paste the relevant parts here:

>“We do have a failure mode which is: Imagine a whole bunch of these [settlements] have to happen at once,” Todd explained. “There’s only so much data that can go through the bitcoin network and if we had a large number of Lightning channels get closed out very rapidly, how are we going to get them all confirmed? At some point, you run out of capacity.”

>In a scenario where a large number of people need to settle their Lightning contracts on the blockchain, the price for doing so could increase substantially as the available space in bitcoin blocks becomes sparse. “At some point some people start losing out because the cost is just higher than what they can afford,” Todd said. “If you have a very large percentage of the network using Lightning, potentially this cost is very high. **Potentially, we could get this mass outbreak of failure**.”

>The way the Lightning Network works, a user must be able to issue a breach remedy transaction in order to keep their counterparty honest. If a user is unable to make the proper transaction on the blockchain in a certain amount of time, their counterparty may be able to take control of bitcoins tied up in the smart contract between the two parties.

...

> Any situation that allows for coins to be stolen obviously needs to be avoided and according to Todd, there are some theoretical solutions available for this problem. For one, **an adaptive block size limit could allow miners to increase capacity in these sorts of failure scenarios**.

Still trust core's scaling roadmap? They don't give a shit about you.

An adaptive blocksize is exactly what BU adds.

Go ahead, put your tail between your legs and run away troll.";5;1;False;Annapurna317;devod99;Bloomberg: Antpool will switch entire pool to Bitcoin Unlimited;5z3hv5;https://www.bloomberg.com/news/articles/2017-03-13/bitcoin-miners-signal-revolt-in-push-to-fix-sluggish-blockchain
"A very common tactic of paid online shills is to say ""it's true! Look it up!"" without ever providing a source. 
Another technique is repeatedly addressing an invisible audience instead of the person you are replying to, as when you say ""this is the bullshit BU supporters believe.""

Yet another technique is using loaded weasel words and sharp language to put a negative image in the reader's mind, as when you say ""a handful of millionaires pushing an agenda."" Please explain how this is the case if so.

You're a troll, shill, and propagandist. I hope everyone else can see through your transparent schtick.";3;2;False;aquahol;devpyg8;Bloomberg: Antpool will switch entire pool to Bitcoin Unlimited;5z3hv5;https://www.bloomberg.com/news/articles/2017-03-13/bitcoin-miners-signal-revolt-in-push-to-fix-sluggish-blockchain
"If SWUAF goes live with low hashrate, a miner could just take all the anyone can spend outputs from segwit transactions and let core fork themselves out of the network. No debate which chain is ""Bitcoin"" in this scenario, as all non-segwit clients will stay on the original chain. It would be a terrible idea for BU to initiate another split before the segwit hard fork chain is dead and >1mb blocks have overwhelming consensus, i would say >75 or 80% minimum with a few months activation time to be safe, and give core a chanse to release a client which follow the new consensus rules.";2;0;False;gameyey;devd7n1;Bloomberg: Antpool will switch entire pool to Bitcoin Unlimited;5z3hv5;https://www.bloomberg.com/news/articles/2017-03-13/bitcoin-miners-signal-revolt-in-push-to-fix-sluggish-blockchain
"On the other side: if a small group of individuals can change consensus rules with hash power then it is not Bitcoin anymore.

I guess you'll argue that whatever the hash follows is bitcoin. I'm sick of arguing against that, so I'll just say if that's true Bitcoin is not interesting to me.
";1;1;False;polsymtas;dev4k6r;Bloomberg: Antpool will switch entire pool to Bitcoin Unlimited;5z3hv5;https://www.bloomberg.com/news/articles/2017-03-13/bitcoin-miners-signal-revolt-in-push-to-fix-sluggish-blockchain
"> They can do it with a HF as well. Recompile one line of code.

That would not necessarily be a successful attack on the original chain";-3;1;False;jonny1000;dev9m38;Bloomberg: Antpool will switch entire pool to Bitcoin Unlimited;5z3hv5;https://www.bloomberg.com/news/articles/2017-03-13/bitcoin-miners-signal-revolt-in-push-to-fix-sluggish-blockchain
"> /u/thomaszander estimated it to be about one day of work to add it to Core.

But BU **IS** it implemented in Core...";1;0;False;jonny1000;devr0vd;Bloomberg: Antpool will switch entire pool to Bitcoin Unlimited;5z3hv5;https://www.bloomberg.com/news/articles/2017-03-13/bitcoin-miners-signal-revolt-in-push-to-fix-sluggish-blockchain
"1) yup. That is what is open source.
2) I dont agree at all. Peer review is actively going on and even an asshole like you can participate. 
3) Yes it is not important.
4) no dont agree at all.

Now please die fucking troll.";7;1;False;FractalGlitch;devk51l;Bloomberg: Antpool will switch entire pool to Bitcoin Unlimited;5z3hv5;https://www.bloomberg.com/news/articles/2017-03-13/bitcoin-miners-signal-revolt-in-push-to-fix-sluggish-blockchain
60% on BU should hopefully be enough to force a compromise from core to develop a safer HF with a high activation threshold. Just splitting that early would be devastating, and it's not going to happen because most of those 60% wouldn't go ahead with it. Let's say just 1/8 of BU miners don't really want to split, then you would need 80% on BU to split with 70% of hashrate.;1;1;False;gameyey;devdzaa;Bloomberg: Antpool will switch entire pool to Bitcoin Unlimited;5z3hv5;https://www.bloomberg.com/news/articles/2017-03-13/bitcoin-miners-signal-revolt-in-push-to-fix-sluggish-blockchain
"Well we don't have to trust them to be ""honest"" as Satoshi unfortunately worded it. Replace the term honest with ""intelligently profit-seeking."" **Bitcoin assumes miners are intelligently profit-seeking**, meaning that they have a decent enough read on what the ecosystem wants that they can and will make any necessary changes to please the ecosystem and thus boost their own bottom line. 

Greg's [recent comments on BU](https://np.reddit.com/r/Bitcoin/comments/5yojyp/on_the_recent_bout_of_malleated_transactions/) totally discredited him, as he revealed himself to have no friggin' idea how Bitcoin works. He actually thought ""honest"" meant something like ""plays by Core rules."" That's a completely broken understanding of Bitcoin, and implies centralization. It's the kind of misconception I'd expect from a run-of-the-mill nobody on a forum, not from the mighty leader of Core/BS. I'm kinda pissed I wasted mental clock ticks trying to debate this guy without realizing he has not just a flawed understanding, but zero understanding of how Bitcoin works at all. And of course all his supporters parrot his nonsense view of how Bitcoin supposedly works.";24;0;False;ForkiusMaximus;dev7drt;Bloomberg: Antpool will switch entire pool to Bitcoin Unlimited;5z3hv5;https://www.bloomberg.com/news/articles/2017-03-13/bitcoin-miners-signal-revolt-in-push-to-fix-sluggish-blockchain
Viacoin? How's that doing these days? I can't see it on coinmarketcap.;5;0;False;redfacedquark;devfz64;Bloomberg: Antpool will switch entire pool to Bitcoin Unlimited;5z3hv5;https://www.bloomberg.com/news/articles/2017-03-13/bitcoin-miners-signal-revolt-in-push-to-fix-sluggish-blockchain
"> We need to get to 60 or 70 percent of miners on board to activate Bitcoin Unlimited,” Ver said in an interview at his office in Tokyo on Mar. 9. 

Wow so 60% is enough to hardfork? It often seems to me Ver wants BU to fail.";-14;4;False;polsymtas;dev2ekj;Bloomberg: Antpool will switch entire pool to Bitcoin Unlimited;5z3hv5;https://www.bloomberg.com/news/articles/2017-03-13/bitcoin-miners-signal-revolt-in-push-to-fix-sluggish-blockchain
Fork off lol;-2;0;False;breakup7532;dev9cnf;Bloomberg: Antpool will switch entire pool to Bitcoin Unlimited;5z3hv5;https://www.bloomberg.com/news/articles/2017-03-13/bitcoin-miners-signal-revolt-in-push-to-fix-sluggish-blockchain
[deleted];-5;1;False;;devglo7;Bloomberg: Antpool will switch entire pool to Bitcoin Unlimited;5z3hv5;https://www.bloomberg.com/news/articles/2017-03-13/bitcoin-miners-signal-revolt-in-push-to-fix-sluggish-blockchain
"Peter and others just want those AXA checks to keep rolling in as long as possible, before the investors realize they've been conned and pull the plug on Greg's entire shady operation.

None of these clowns has ever explained how larger or dynamic blocks would make the user experience worse. They just shout ""CENTRALIZATION"" and ""CHINACOIN"" and ""ROGER VER"" again and again. Fewer and fewer people care anymore.

Peter is well-placed to offer a 2MB+Segwit compromise, or even just a regular 2MB hard fork as a show of good faith to miners before they accept Segwit. He's not going to do either, because he's disingenuous and it would show hard forks aren't dangerous at all, nor is a 2MB block size for that matter.";79;3;False;thcymos;dev1t8q;Bloomberg: Antpool will switch entire pool to Bitcoin Unlimited;5z3hv5;https://www.bloomberg.com/news/articles/2017-03-13/bitcoin-miners-signal-revolt-in-push-to-fix-sluggish-blockchain
"Toddler neglects to mention that Bitcoin Core's development team is also fundamentally broken.

Worse than BU purportedly is, as the market has been slowly ditching Core for months.";67;2;False;illegaltorrents;dev1pxe;Bloomberg: Antpool will switch entire pool to Bitcoin Unlimited;5z3hv5;https://www.bloomberg.com/news/articles/2017-03-13/bitcoin-miners-signal-revolt-in-push-to-fix-sluggish-blockchain
"Then Bitcoin is fundamentally broken, because BU doesn't give anyone any tools they didn't have pretty easy access to before. If he understood what BU is he would at most be arguing, ""Certain possible configurations that BU allows for are fundamentally broken."" To point the argument at BU already shows that the person hasn't grasped the situation. If anything, he should be addressing miners and nodes, saying, ""Don't run these settings.""";22;0;False;ForkiusMaximus;dev7kmu;Bloomberg: Antpool will switch entire pool to Bitcoin Unlimited;5z3hv5;https://www.bloomberg.com/news/articles/2017-03-13/bitcoin-miners-signal-revolt-in-push-to-fix-sluggish-blockchain
Why do these articles always have some fake ass picture of a physical bitcoin?;2;2;False;jroddie4;devbuht;Bloomberg: Antpool will switch entire pool to Bitcoin Unlimited;5z3hv5;https://www.bloomberg.com/news/articles/2017-03-13/bitcoin-miners-signal-revolt-in-push-to-fix-sluggish-blockchain
Peter has talked about his opinions many times. His problem with the larger block size and the hard fork can be found [here](https://petertodd.org/2016/hardforks-after-the-segwit-blocksize-increase);19;1;False;calaber24p;dev468a;Bloomberg: Antpool will switch entire pool to Bitcoin Unlimited;5z3hv5;https://www.bloomberg.com/news/articles/2017-03-13/bitcoin-miners-signal-revolt-in-push-to-fix-sluggish-blockchain
I'm not convinced a UASF is a good idea either;10;1;False;polsymtas;dev3ftt;Bloomberg: Antpool will switch entire pool to Bitcoin Unlimited;5z3hv5;https://www.bloomberg.com/news/articles/2017-03-13/bitcoin-miners-signal-revolt-in-push-to-fix-sluggish-blockchain
"BU is a joke, so are its supporters. 

Who supports a set of developers that copy the code of something they are trying to replace, edit it badly, release their code without peer review, watch it malfunction and then CONTINUE to support them and their crap code? They are STILL MAKING MISTAKES, even their latest release has a pruning error. Someone already pointed it out and no one changed it before the release. Or didn't you know about that? I'd guess not, seeing as most of you are brainwashed simpletons in this sub.";-12;2;False;;devfk8i;Bloomberg: Antpool will switch entire pool to Bitcoin Unlimited;5z3hv5;https://www.bloomberg.com/news/articles/2017-03-13/bitcoin-miners-signal-revolt-in-push-to-fix-sluggish-blockchain
"I guess so, though it is rather ambiguous about ""consensus,"" making it seem as though BU is not a consensus solution. For it to activate, of course, consensus will be required. The real debate isn't about whether it would eventually be a consensus solution prior to activation but about what threshold constitutes consensus and which people count for consensus purposes. (At this point, no solution would achieve consensus with the high bar that seems implicit in the article.)";13;0;False;xoomish;dev4vdx;Bloomberg: Antpool will switch entire pool to Bitcoin Unlimited;5z3hv5;https://www.bloomberg.com/news/articles/2017-03-13/bitcoin-miners-signal-revolt-in-push-to-fix-sluggish-blockchain
should be 30% of miners tho, not 3%, kinda important.;7;0;False;gameyey;devauqf;Bloomberg: Antpool will switch entire pool to Bitcoin Unlimited;5z3hv5;https://www.bloomberg.com/news/articles/2017-03-13/bitcoin-miners-signal-revolt-in-push-to-fix-sluggish-blockchain
Bloomberg LP isn't exactly mainstream media when it comes to bitcoin.  They were one of the investors who backed Coinbase's largest funding round.  Their reporting ever since has been more favorable and accurate than most news sites.;2;0;False;danielravennest;devk05m;Bloomberg: Antpool will switch entire pool to Bitcoin Unlimited;5z3hv5;https://www.bloomberg.com/news/articles/2017-03-13/bitcoin-miners-signal-revolt-in-push-to-fix-sluggish-blockchain
"The really important thing is to talk to exchanges and other business who may be running Core nodes as a ""default"". The node situation is Core's last real argument against BU. They've convinced themselves that an economic majority supports Segwit because a bunch of companies said, ""Sure, if it activates we're ready"" and because 75% of Core nodes run a post-Segwit version.

But even if the Core/BU node ratio dropped to 60/40, they wouldn't really have the node argument anymore.

I also don't care for this narrative they're pushing that Jihan and Roger control/brainwash all mining pools. If they did, Core would have been dropped last year. Core doesn't like the fact that other mining pool operators can think for themselves and decide that Core not the way forward.";33;2;False;thcymos;dev2jev;Bloomberg: Antpool will switch entire pool to Bitcoin Unlimited;5z3hv5;https://www.bloomberg.com/news/articles/2017-03-13/bitcoin-miners-signal-revolt-in-push-to-fix-sluggish-blockchain
"Peter Todd basically said that the Lightning Network is broken as well.

https://bitcoinmagazine.com/articles/here-s-how-bitcoin-s-lightning-network-could-fail-1467736127/

Who to trust? /s";5;0;False;Annapurna317;devirzk;Bloomberg: Antpool will switch entire pool to Bitcoin Unlimited;5z3hv5;https://www.bloomberg.com/news/articles/2017-03-13/bitcoin-miners-signal-revolt-in-push-to-fix-sluggish-blockchain
[deleted];3;0;False;;devenly;Bloomberg: Antpool will switch entire pool to Bitcoin Unlimited;5z3hv5;https://www.bloomberg.com/news/articles/2017-03-13/bitcoin-miners-signal-revolt-in-push-to-fix-sluggish-blockchain
Wow, what a shit show over in the x-post at r/Bitcoin.;5;0;False;mohrt;devkum8;Bloomberg: Antpool will switch entire pool to Bitcoin Unlimited;5z3hv5;https://www.bloomberg.com/news/articles/2017-03-13/bitcoin-miners-signal-revolt-in-push-to-fix-sluggish-blockchain
">Last fall, the group released their own solution, called SegWit, which uses a different method to verify transactions. Todd says **adoption has been slow due to resistance from Unlimited supporters**.

-

>Ver said the lack of support is evidence that **SegWit doesn’t address the actual problem**: “Say you haven’t had any water to drink for a day and a half, and you also need a haircut. Do you drink some water or go to the barber shop? SegWit is like going to the barber shop.”

-

>Wu added that miners like him have **refused to adopt SegWit because he doesn’t see his economic interests aligning with what is proposed by the technology**.

-

>""Bitcoin Unlimited is not bitcoin because it’s rules are different,"" said [Samsung] Mow **[FACEPALM]**. ""If BU splintered, it would create an altcoin and there are hundreds of altcoins. Those altcoins have little value.""

";5;0;False;Egon_1;devdyda;Bloomberg: Antpool will switch entire pool to Bitcoin Unlimited;5z3hv5;https://www.bloomberg.com/news/articles/2017-03-13/bitcoin-miners-signal-revolt-in-push-to-fix-sluggish-blockchain
That's a long-term buy signal for me. Time to reactivate that bitstamp account.;33;0;False;goocy;dev4g0c;Bloomberg: Antpool will switch entire pool to Bitcoin Unlimited;5z3hv5;https://www.bloomberg.com/news/articles/2017-03-13/bitcoin-miners-signal-revolt-in-push-to-fix-sluggish-blockchain
Pretty accurate reporting there. Well done MSM.;53;3;False;sydwell;dev0zyz;Bloomberg: Antpool will switch entire pool to Bitcoin Unlimited;5z3hv5;https://www.bloomberg.com/news/articles/2017-03-13/bitcoin-miners-signal-revolt-in-push-to-fix-sluggish-blockchain
Good job Ver! The media and the exchanges are accepting the fact that bitcoin unlimited is de facto bitcoin (BTC). The minority hashrate UASF coin is an altcoin which nobody will want to invest in (or banks perhaps will?);38;0;False;bitdoggy;dev1vdf;Bloomberg: Antpool will switch entire pool to Bitcoin Unlimited;5z3hv5;https://www.bloomberg.com/news/articles/2017-03-13/bitcoin-miners-signal-revolt-in-push-to-fix-sluggish-blockchain
Hopefully Jihan and Ver can get other major pools on board, and to get miners to switch pools that do support BU. ;41;2;False;qs-btc;dev2hl6;Bloomberg: Antpool will switch entire pool to Bitcoin Unlimited;5z3hv5;https://www.bloomberg.com/news/articles/2017-03-13/bitcoin-miners-signal-revolt-in-push-to-fix-sluggish-blockchain
"People who do a terrible job and let the primary product of a company go to complete shit get fired/and or the company goes out of business. 

Core has let Bitcoin turn to shit... and smiled the entire time claiming it is better than ever... denying the ship is sinking. Time to fire them. The ousting is near. If they want to stick around and make a compatible client that is their choice. ";17;0;False;Yheymos;dev7tkz;Bloomberg: Antpool will switch entire pool to Bitcoin Unlimited;5z3hv5;https://www.bloomberg.com/news/articles/2017-03-13/bitcoin-miners-signal-revolt-in-push-to-fix-sluggish-blockchain
