body;score;nb_replies;stickied;author;id;post_title;post_id;post_link
"Peter Todd: ""bitcoin unlimited is fundamentally broken""

Yet he can't explain how, of course. What a dumbass.";131;8;False;aquahol;dev1hpb;Bloomberg: Antpool will switch entire pool to Bitcoin Unlimited;5z3hv5;https://www.bloomberg.com/news/articles/2017-03-13/bitcoin-miners-signal-revolt-in-push-to-fix-sluggish-blockchain
I prefer BSCore who will soon be on the BSC minority chain. ;9;0;False;H0dl;dev5p78;Bloomberg: Antpool will switch entire pool to Bitcoin Unlimited;5z3hv5;https://www.bloomberg.com/news/articles/2017-03-13/bitcoin-miners-signal-revolt-in-push-to-fix-sluggish-blockchain
"So who is BlockstreamCore?
";-4;0;False;brintal;dev428l;Bloomberg: Antpool will switch entire pool to Bitcoin Unlimited;5z3hv5;https://www.bloomberg.com/news/articles/2017-03-13/bitcoin-miners-signal-revolt-in-push-to-fix-sluggish-blockchain
"you're right, it won't be easy to recruit that additional 40%.  my pt was that if and when we do, the release of a 1.1MB blocks is ""easy"" in the sense that it could be done at any pt by a miner and i think there won't be a minority chain that lasts for long.  but that's an assumption of mine.";2;0;False;H0dl;devz78d;Bloomberg: Antpool will switch entire pool to Bitcoin Unlimited;5z3hv5;https://www.bloomberg.com/news/articles/2017-03-13/bitcoin-miners-signal-revolt-in-push-to-fix-sluggish-blockchain
If the majority of the miners want to attack/destroy Bitcoin, they can do it with core as well. You are not a Bitcoiner. You don't believe into the honesty of the majority of the miners. The majority is not as evil as the core supporting Shitclub Network and alikes.;16;2;False;Shock_The_Stream;dev6wt0;Bloomberg: Antpool will switch entire pool to Bitcoin Unlimited;5z3hv5;https://www.bloomberg.com/news/articles/2017-03-13/bitcoin-miners-signal-revolt-in-push-to-fix-sluggish-blockchain
"> implementing the whole EB mechanism

Part of my question is, is the mechanism non-trivial to implement, or can it be done with a few tweaks e.g. the sort of patch a distro may apply to a stock package? In the former case sure, you can argue BU is fundamentally broken. In the latter case, I'm not sure that's fair.";7;1;False;combatopera;dev6pfp;Bloomberg: Antpool will switch entire pool to Bitcoin Unlimited;5z3hv5;https://www.bloomberg.com/news/articles/2017-03-13/bitcoin-miners-signal-revolt-in-push-to-fix-sluggish-blockchain
"It can only succeed if >50% of the hashrate follow along long to mid-term. And that is exactly what I am saying.
More than 50% of honest miners wanting the network to function is enough for Bitcoin to operate well.";6;1;False;awemany;dev9put;Bloomberg: Antpool will switch entire pool to Bitcoin Unlimited;5z3hv5;https://www.bloomberg.com/news/articles/2017-03-13/bitcoin-miners-signal-revolt-in-push-to-fix-sluggish-blockchain
Well, the dissenters are excommunicated. Have you seen the way /r/Bitcoin talks about Gavin? ;33;1;False;optionsanarchist;dev39tq;Bloomberg: Antpool will switch entire pool to Bitcoin Unlimited;5z3hv5;https://www.bloomberg.com/news/articles/2017-03-13/bitcoin-miners-signal-revolt-in-push-to-fix-sluggish-blockchain
"1) that is pretty much the premise of open source. 
2) not really, it's not because core dev dont want to participate that there is no peer review
3) so what? The block has been orphaned as planned, get over it. It affected nobody but the miner and he is okay with it.

4) I have no idea what you are talking about. A quick Google search bring up nothing. Of course, your kind can never ever fucking back up their claims. 

There is two issue on the github regarding pruning. One is ""pruning not working when inside a docker container?"" and the other is ""pruning leaves too many blocks on disk"". Both of these issue are trivial and definitely not a reason to hold a release. 

Id even argue that *any* issue with pruning is trivial.";13;1;False;FractalGlitch;devirsk;Bloomberg: Antpool will switch entire pool to Bitcoin Unlimited;5z3hv5;https://www.bloomberg.com/news/articles/2017-03-13/bitcoin-miners-signal-revolt-in-push-to-fix-sluggish-blockchain
"The narrative seems to be now shifting to literally rigging the vote since SegWit lost the *fair vote* for all intents and purposes. The hypocrisy is palpable parroting any Core chain as the ""real Bitcoin"" while doing everything that can be done to undermine the very Nakamoto consensus and incentive mechanisms that enable Bitcoin to work the way it does. 

";10;0;False;;dev7b8b;Bloomberg: Antpool will switch entire pool to Bitcoin Unlimited;5z3hv5;https://www.bloomberg.com/news/articles/2017-03-13/bitcoin-miners-signal-revolt-in-push-to-fix-sluggish-blockchain
But you're fine with BU at 60%?;0;1;False;polsymtas;dev3o9r;Bloomberg: Antpool will switch entire pool to Bitcoin Unlimited;5z3hv5;https://www.bloomberg.com/news/articles/2017-03-13/bitcoin-miners-signal-revolt-in-push-to-fix-sluggish-blockchain
[deleted];-3;2;False;;devi1eh;Bloomberg: Antpool will switch entire pool to Bitcoin Unlimited;5z3hv5;https://www.bloomberg.com/news/articles/2017-03-13/bitcoin-miners-signal-revolt-in-push-to-fix-sluggish-blockchain
Sure. I don't hang around the IRC channel either, but is anyone from Core openly advocating for the 2MB+Segwit compromise over there? Color me surprised, if so. Wouldn't even matter anyway, as the top of their obvious hierarchy is prepared to go down with the ship rather than admit they don't always know what's best.;21;1;False;thcymos;dev3asp;Bloomberg: Antpool will switch entire pool to Bitcoin Unlimited;5z3hv5;https://www.bloomberg.com/news/articles/2017-03-13/bitcoin-miners-signal-revolt-in-push-to-fix-sluggish-blockchain
"> If the majority of the miners want to attack/destroy Bitcoin, they can do it with core as well

Yes they can.  Via a softfork....";-10;1;False;jonny1000;dev71mm;Bloomberg: Antpool will switch entire pool to Bitcoin Unlimited;5z3hv5;https://www.bloomberg.com/news/articles/2017-03-13/bitcoin-miners-signal-revolt-in-push-to-fix-sluggish-blockchain
Is this English? ;-4;0;False;MotherSuperiour;devioo8;Bloomberg: Antpool will switch entire pool to Bitcoin Unlimited;5z3hv5;https://www.bloomberg.com/news/articles/2017-03-13/bitcoin-miners-signal-revolt-in-push-to-fix-sluggish-blockchain
"Uh, Gavin has never been negligent towards Bitcoin. You're taking crazy pills or haven't been here very long if you believe that.

> it's been ready for more than a year

Segwit hasn't been ready for a year. 

> that is from BEFORE BU started spamming the network

It's called user growth, and it's precisely why Bitcoin has value.
https://blockchain.info/charts/n-transactions-per-block?scale=1&timespan=all

Core has been negligent because they've prevented on-chain user growth.

Enjoy getting downvoted.";6;1;False;Annapurna317;devmkp4;Bloomberg: Antpool will switch entire pool to Bitcoin Unlimited;5z3hv5;https://www.bloomberg.com/news/articles/2017-03-13/bitcoin-miners-signal-revolt-in-push-to-fix-sluggish-blockchain
"> Part of my question is, is the mechanism non-trivial to implement, or can it be done with a few tweaks e.g. the sort of patch a distro may apply to a stock package?

I think its quite difficult to implement.  Its essentially just BU though";-2;1;False;jonny1000;dev8tc8;Bloomberg: Antpool will switch entire pool to Bitcoin Unlimited;5z3hv5;https://www.bloomberg.com/news/articles/2017-03-13/bitcoin-miners-signal-revolt-in-push-to-fix-sluggish-blockchain
> Ture, if you're brain dead you won't see you he arguement. ;3;1;False;freshlysquosed;devhjo5;Bloomberg: Antpool will switch entire pool to Bitcoin Unlimited;5z3hv5;https://www.bloomberg.com/news/articles/2017-03-13/bitcoin-miners-signal-revolt-in-push-to-fix-sluggish-blockchain
I agree.. ;11;1;False;Ant-n;dev3ltk;Bloomberg: Antpool will switch entire pool to Bitcoin Unlimited;5z3hv5;https://www.bloomberg.com/news/articles/2017-03-13/bitcoin-miners-signal-revolt-in-push-to-fix-sluggish-blockchain
[deleted];-6;1;False;;devheem;Bloomberg: Antpool will switch entire pool to Bitcoin Unlimited;5z3hv5;https://www.bloomberg.com/news/articles/2017-03-13/bitcoin-miners-signal-revolt-in-push-to-fix-sluggish-blockchain
"He's not an official employee, but pretty sure he does contract work with them occasionally.

And frankly, the company is so sketchy that it wouldn't surprise me if they've compromised other Core developers, besides Peter, under the table. You'd think there would be, like... at least one dissenting voice in Core, against what they're doing, but no, everyone marches in lockstep for some reason.";43;1;False;thcymos;dev28qc;Bloomberg: Antpool will switch entire pool to Bitcoin Unlimited;5z3hv5;https://www.bloomberg.com/news/articles/2017-03-13/bitcoin-miners-signal-revolt-in-push-to-fix-sluggish-blockchain
that's why they didn't interview any of the other BS/Core developers. ;14;0;False;Adrian-X;dev2yd8;Bloomberg: Antpool will switch entire pool to Bitcoin Unlimited;5z3hv5;https://www.bloomberg.com/news/articles/2017-03-13/bitcoin-miners-signal-revolt-in-push-to-fix-sluggish-blockchain
This is why I prefer to call them BlockstreamCore.;12;2;False;sandakersmann;dev30ci;Bloomberg: Antpool will switch entire pool to Bitcoin Unlimited;5z3hv5;https://www.bloomberg.com/news/articles/2017-03-13/bitcoin-miners-signal-revolt-in-push-to-fix-sluggish-blockchain
But we're practically at parity with Core signalling right now? Where is the other 40% of hash power signalling for BU going to come from?;1;1;False;Anen-o-me;devy1aq;Bloomberg: Antpool will switch entire pool to Bitcoin Unlimited;5z3hv5;https://www.bloomberg.com/news/articles/2017-03-13/bitcoin-miners-signal-revolt-in-push-to-fix-sluggish-blockchain
"> Can miners use Core to do (or expose themselves to) an EB attack by recompiling?

Err...  Why is recompiling Core and implementing the whole EB mechanism any different to BU?

Or is this part of the general because it CAN be done it SHOULD be done logic of BU?

The same logic can apply to jumping off a cliff.  Just because you CAN jump off a cliff, does that mean you SHOULD?";-18;2;False;jonny1000;dev65ds;Bloomberg: Antpool will switch entire pool to Bitcoin Unlimited;5z3hv5;https://www.bloomberg.com/news/articles/2017-03-13/bitcoin-miners-signal-revolt-in-push-to-fix-sluggish-blockchain
Nice try.  If the ledger is the same, what is the difference?;3;0;False;__Cyber_Dildonics__;devat0j;Bloomberg: Antpool will switch entire pool to Bitcoin Unlimited;5z3hv5;https://www.bloomberg.com/news/articles/2017-03-13/bitcoin-miners-signal-revolt-in-push-to-fix-sluggish-blockchain
"> Good, then you admit BU is not broken, only that some miners could use it wrongly. Progress.

No.  I am saying so far as BU's EB mechanism is used at all, its broken.

";0;0;False;jonny1000;dev9n2n;Bloomberg: Antpool will switch entire pool to Bitcoin Unlimited;5z3hv5;https://www.bloomberg.com/news/articles/2017-03-13/bitcoin-miners-signal-revolt-in-push-to-fix-sluggish-blockchain
"> I think the median EB attack is a legitimate concern. However, it's fairly easy for the miners to avoid it with sensible signalling and settings

These settings need to be implemented.  Sure if its fixed, then its not broken...";1;0;False;jonny1000;dev9idx;Bloomberg: Antpool will switch entire pool to Bitcoin Unlimited;5z3hv5;https://www.bloomberg.com/news/articles/2017-03-13/bitcoin-miners-signal-revolt-in-push-to-fix-sluggish-blockchain
"Facts in my post:-

1.) BU developerss copied the core code
2.) They released their code without peer review
3.) It malfunctioned 
4.) They continue to make mistakes and have a pruning issue in their latest release that was even pointed out to them before they released their client.

Facts in your post:-
None.


To everyone reading this, this is the perfect example of how BU has any support. People like this resort to nothing more than argument tactics as though the ""winner"" of this ""debate"" is to be decided through anything other than facts. BU is gaining support (albeit very little, their hash rate increase is just themselves) through POLITICS for a TECHNICAL issue, that frankly they are not qualified to resolve. Their motivation is personal gain, pure and simple, don't unwittingly support their personal agendas. ";-10;1;False;;devh7hl;Bloomberg: Antpool will switch entire pool to Bitcoin Unlimited;5z3hv5;https://www.bloomberg.com/news/articles/2017-03-13/bitcoin-miners-signal-revolt-in-push-to-fix-sluggish-blockchain
Gavin was fired for being consistently negligent. Core made a solution for all the future of up-scaling that even improves privacy of Bitcoin, it's been ready for more than a year.....that is from BEFORE BU started spamming the network. So how have they neglected anything?;-6;1;False;;devji73;Bloomberg: Antpool will switch entire pool to Bitcoin Unlimited;5z3hv5;https://www.bloomberg.com/news/articles/2017-03-13/bitcoin-miners-signal-revolt-in-push-to-fix-sluggish-blockchain
"> I don't personally think the node count argument has any real merit. 

Of course it doesn't, it's Core's final desperate refuge now that 1MB4LIFE+SEGWIT has been firmly rejected.

Core's motto has essentially become: ""You will do things our way or you'll regret it"".";17;1;False;thcymos;dev2nx9;Bloomberg: Antpool will switch entire pool to Bitcoin Unlimited;5z3hv5;https://www.bloomberg.com/news/articles/2017-03-13/bitcoin-miners-signal-revolt-in-push-to-fix-sluggish-blockchain
Indeed I've noticed. Speaking the truth to a Core dev is a very revolutionary act.;7;0;False;eatmybitcorn;dev8gl9;Bloomberg: Antpool will switch entire pool to Bitcoin Unlimited;5z3hv5;https://www.bloomberg.com/news/articles/2017-03-13/bitcoin-miners-signal-revolt-in-push-to-fix-sluggish-blockchain
this is probably true;2;0;False;timetraveller57;devdsb0;Bloomberg: Antpool will switch entire pool to Bitcoin Unlimited;5z3hv5;https://www.bloomberg.com/news/articles/2017-03-13/bitcoin-miners-signal-revolt-in-push-to-fix-sluggish-blockchain
"> ""More than 50% of HP can undo transactions. Therefore Bitcoin is broken.""

The median EB attack can be launched by one miner finding one block once.  That is a lot easier than having 50% of the global hashrate";-1;1;False;jonny1000;dev9jdy;Bloomberg: Antpool will switch entire pool to Bitcoin Unlimited;5z3hv5;https://www.bloomberg.com/news/articles/2017-03-13/bitcoin-miners-signal-revolt-in-push-to-fix-sluggish-blockchain
Yeah, so the goal of BU is to kill Bitcoin.;-1;1;False;polsymtas;devajeg;Bloomberg: Antpool will switch entire pool to Bitcoin Unlimited;5z3hv5;https://www.bloomberg.com/news/articles/2017-03-13/bitcoin-miners-signal-revolt-in-push-to-fix-sluggish-blockchain
"I am not sure why your comment is related to the ""median EB attack"".

Having miners follow is the objective of the attack";-1;1;False;jonny1000;dev9xzp;Bloomberg: Antpool will switch entire pool to Bitcoin Unlimited;5z3hv5;https://www.bloomberg.com/news/articles/2017-03-13/bitcoin-miners-signal-revolt-in-push-to-fix-sluggish-blockchain
"I don't care about your attempt to censor with downvotes! Gavin HAS been negligent, that's why he was FIRED. Anyone interested, look it up, don't believe what these BU liars say.

Segwit has been ready for many months, is it not a year yet? Sure feels like it.

Core developed something that can bring Bitcoin on par with VISA WHILE providing improved privacy. BU will never compete with visa, even with 10gb blocks....that isn't a solution, it's a joke!";-1;2;False;;devnc6q;Bloomberg: Antpool will switch entire pool to Bitcoin Unlimited;5z3hv5;https://www.bloomberg.com/news/articles/2017-03-13/bitcoin-miners-signal-revolt-in-push-to-fix-sluggish-blockchain
You genuinely think people get paid to write on reddit? Wow.;-1;1;False;;devuntg;Bloomberg: Antpool will switch entire pool to Bitcoin Unlimited;5z3hv5;https://www.bloomberg.com/news/articles/2017-03-13/bitcoin-miners-signal-revolt-in-push-to-fix-sluggish-blockchain
">On the other side: if a small group of individuals can change consensus rules with hash power then it is not Bitcoin anymore.

It is! It literally is the way Bitcoin is meant to work are you joking?

Well we all like more decentralisation but that exactly why Bitcoin is trustless. Because of the competition for block reward!

If a small group can change Bitcoin consensus rules using their influence alone then the door is open for government to do the same things?

Then cryptocurrency is dead.

>I guess you'll argue that whatever the hash follows is bitcoin. I'm sick of arguing against that, so I'll just say if that's true Bitcoin is not interesting to me.

Sorry that the rules, if you disagree you better sell an return to FIAT, ";11;1;False;Ant-n;dev5573;Bloomberg: Antpool will switch entire pool to Bitcoin Unlimited;5z3hv5;https://www.bloomberg.com/news/articles/2017-03-13/bitcoin-miners-signal-revolt-in-push-to-fix-sluggish-blockchain
Neither is your median EB atttack, which is the equivalent of a tic tac toe game when the reality is 3D chess.;9;0;False;LovelyDay;devawom;Bloomberg: Antpool will switch entire pool to Bitcoin Unlimited;5z3hv5;https://www.bloomberg.com/news/articles/2017-03-13/bitcoin-miners-signal-revolt-in-push-to-fix-sluggish-blockchain
Have you thought that maybe BU is winning because of the disdain for core? They are unwilling to compromise making a hard fork basically inevitable. It's a shame really, now they might end up with a client with the lesser amount of nodes. If you can't unite the community large portion of the community, a split is inevitable. It's not based on technical merits at all, it's a development team that ignored a large portion of the community and that portion of the community was essentially driven to create another client leading to a split. If you wanted to know why it's happening, it's really that simple;5;1;False;czr5014;devpv83;Bloomberg: Antpool will switch entire pool to Bitcoin Unlimited;5z3hv5;https://www.bloomberg.com/news/articles/2017-03-13/bitcoin-miners-signal-revolt-in-push-to-fix-sluggish-blockchain
"Buddy, no matter what I say it will confirm what you say because you are a ""it confirms what I say troll"". You distort what other say to fit your discourse but I guess I dont have to teach you your game.

Now distort this to mean BU somehow stealed source code and somehow made it buggy by removing stuff...";1;0;False;FractalGlitch;dew21qt;Bloomberg: Antpool will switch entire pool to Bitcoin Unlimited;5z3hv5;https://www.bloomberg.com/news/articles/2017-03-13/bitcoin-miners-signal-revolt-in-push-to-fix-sluggish-blockchain
"Roger and Jihan are two of the staunchest bitcoin advocates in the space. Both estimated to hold more than 100k coins each and have been involved since 2010 or 2011. Why would they want to harm bitcoin and destroy their wealth? What would they stand to gain from having control over the network?

Is it a big deal where the devs are paid from? You say that like it's a bad thing but if you want to play that game I can talk about how bitcoin Core devs are all privately paid by banks.";2;1;False;aquahol;dew12yq;Bloomberg: Antpool will switch entire pool to Bitcoin Unlimited;5z3hv5;https://www.bloomberg.com/news/articles/2017-03-13/bitcoin-miners-signal-revolt-in-push-to-fix-sluggish-blockchain
">as when you say ""this is the bullshit BU supporters believe.""as when you say ""this is the bullshit BU supporters believe.""

Also please note i never used any bad language, i never said 'bullshit' once. Is another one of the shill's methods misquoting people? 

""Handful of millionaires"" - My points are very clear and convincing, no one reading this with an open mind will take BU seriously afterwards. Anyone that cares enough will do their own research regarding this point, look up Jihan Wu and Roger Ver, the biggest proponents. Bare in mind it gives miners total control, Jihan owns the biggest mining hardware companys...what a coincidence. Oh and their developers are paid privately and the source of funding is hidden/anonymous donations, seems legit, right?";0;1;False;;dew0dvx;Bloomberg: Antpool will switch entire pool to Bitcoin Unlimited;5z3hv5;https://www.bloomberg.com/news/articles/2017-03-13/bitcoin-miners-signal-revolt-in-push-to-fix-sluggish-blockchain
They most certainly do: https://99bitcoins.com/coin-fire-professional-bitcoin-trolls-exist/;3;1;False;aquahol;devuyyw;Bloomberg: Antpool will switch entire pool to Bitcoin Unlimited;5z3hv5;https://www.bloomberg.com/news/articles/2017-03-13/bitcoin-miners-signal-revolt-in-push-to-fix-sluggish-blockchain
There is no competition to be 'won'. BU is not taken seriously by the majority of the bitcoin economy, it can only be manipulated into effect.;0;1;False;;devuqq8;Bloomberg: Antpool will switch entire pool to Bitcoin Unlimited;5z3hv5;https://www.bloomberg.com/news/articles/2017-03-13/bitcoin-miners-signal-revolt-in-push-to-fix-sluggish-blockchain
"> https://99bitcoins.com/coin-fire-professional-bitcoin-trolls-exist/

I don't believe that at all, anonymous companies set up to pay people to 'disrupt' bitcoin conversations. That's hilarious. ";0;1;False;;devyzo6;Bloomberg: Antpool will switch entire pool to Bitcoin Unlimited;5z3hv5;https://www.bloomberg.com/news/articles/2017-03-13/bitcoin-miners-signal-revolt-in-push-to-fix-sluggish-blockchain
">&gt; It is! It literally is the way Bitcoin is meant to work are you joking?

>Not joking at all, I think you have a profound misunderstanding of bitcoin. 

It literally written in the the white paper and **in the code:**

The valid chain is the longest chain (the one with the most POW invested in it).

Bitcoin 101

>&gt; If a small group can change Bitcoin consensus rules using their influence alone then the door is open for government to do the same things?

>What you say is nonsensical, it is easier for a government to buy hashing power than influence. 

Believe it or not making law and putting people in jail buy you quite a lot of influence, ask paypal or your regular under how much under governments influence they are! 

Seriously you guys are living on another planet..

But say you are right it is cheaper to buy POW than influence.. 

**it doesn't matter because POW is not enough to break consensus rules node will always refuse an invalid chain..**

That is.. before SEGWIT.. and UASF make it even worst now big Bitcoin businesses can decide what chain is valid and what consensus rules they want to break, hey! What can go wrong?";9;1;False;Ant-n;dev6ikt;Bloomberg: Antpool will switch entire pool to Bitcoin Unlimited;5z3hv5;https://www.bloomberg.com/news/articles/2017-03-13/bitcoin-miners-signal-revolt-in-push-to-fix-sluggish-blockchain
Whatever you say.;1;0;False;aquahol;devz2v4;Bloomberg: Antpool will switch entire pool to Bitcoin Unlimited;5z3hv5;https://www.bloomberg.com/news/articles/2017-03-13/bitcoin-miners-signal-revolt-in-push-to-fix-sluggish-blockchain
"> it doesn't matter because POW is not enough to break consensus rules node will always refuse an invalid chain..

Well thanks for making my point in bold. Miners follow the nodes.";1;1;False;polsymtas;dev9s79;Bloomberg: Antpool will switch entire pool to Bitcoin Unlimited;5z3hv5;https://www.bloomberg.com/news/articles/2017-03-13/bitcoin-miners-signal-revolt-in-push-to-fix-sluggish-blockchain
"Yes and nodes follow the heaviest chain.

What happen if nodes are cheated into breaking rules? (SFSW, UASF)

Then breaking Bitcoin consensus rules get trivial.";1;0;False;Ant-n;devac7k;Bloomberg: Antpool will switch entire pool to Bitcoin Unlimited;5z3hv5;https://www.bloomberg.com/news/articles/2017-03-13/bitcoin-miners-signal-revolt-in-push-to-fix-sluggish-blockchain
"> It is! It literally is the way Bitcoin is meant to work are you joking?

Not joking at all, I think you have a profound misunderstanding of bitcoin. 

> If a small group can change Bitcoin consensus rules using their influence alone then the door is open for government to do the same things?

What you say is nonsensical, it is easier for a government to buy hashing power than influence. ";2;1;False;polsymtas;dev58ya;Bloomberg: Antpool will switch entire pool to Bitcoin Unlimited;5z3hv5;https://www.bloomberg.com/news/articles/2017-03-13/bitcoin-miners-signal-revolt-in-push-to-fix-sluggish-blockchain
"1.) So, you agree.  2.) So, you acknowledge this is true, but make an excuse. 3.) So, you agree again but play it down. 4.) Again, you agree.They made a mistake by failing to integrate a noted improvement before a release. 

...here is another perfect example of my post above folks, plain as day, BU gains support through politics only. Their support use argument based tactics to brush aside and play down the facts to gain further support from the misinformed. Don't unwittingly support personal agendas, there is already the perfect solution, fully tested that provides the basis for up-scaling forever and even improves privacy and it's ready to go and has been for a very long time.

";-9;1;False;;devjqz1;Bloomberg: Antpool will switch entire pool to Bitcoin Unlimited;5z3hv5;https://www.bloomberg.com/news/articles/2017-03-13/bitcoin-miners-signal-revolt-in-push-to-fix-sluggish-blockchain
