body;score;nb_replies;stickied;author;id;post_title;post_id;post_link
"My comment to this article (response to LukeJr) got me banned from r/bitcon. It must have touched their nerve:

*Luke Dashjr
Basically Roger, Bitmain & co are forming a new altcoin and trying to bribe Bitcoin users to switch it with a premine. It won't affect the original Bitcoin, though, and as long as you're running your own full node, you'll be immune.

*bitdoggy
By all definitions, UASF coin / minority hashrate coin is an altcoin.

*Luke Dashjr - an hour ago 
Perhaps. But we're talking about BU here, not hypothetical UASF ideas.

*bitdoggy 
Bitcoin unlimited is currently just another bitcoin implementation (the other one is bitcoin limited or bitcoin core) that does not deviate from Satoshi's whitepaper. How can that be a new altcoin in formation? The ""original chain"" does not get the right to the previously used name (ETH/ETC scenario).

I see what you're trying to say here - you are ready to go past SW activation date like nothing happened or you have hidden hashpower up your sleeve.

I wonder if Blockstream predicted such rise of interest in altcoins and did it take advantage of it.";34;1;False;bitdoggy;dev3irn;Bloomberg: Antpool will switch entire pool to Bitcoin Unlimited;5z3hv5;https://www.bloomberg.com/news/articles/2017-03-13/bitcoin-miners-signal-revolt-in-push-to-fix-sluggish-blockchain
"This is going mane stream ;-) ";14;1;False;Adrian-X;dev1mso;Bloomberg: Antpool will switch entire pool to Bitcoin Unlimited;5z3hv5;https://www.bloomberg.com/news/articles/2017-03-13/bitcoin-miners-signal-revolt-in-push-to-fix-sluggish-blockchain
"It's strange that this article says many times that running BU is somehow ""giving up"" on consensus. Running BU our any other client is part of Bitcoin's consensus-finding mechanism.";13;1;False;gotamd;devazn2;Bloomberg: Antpool will switch entire pool to Bitcoin Unlimited;5z3hv5;https://www.bloomberg.com/news/articles/2017-03-13/bitcoin-miners-signal-revolt-in-push-to-fix-sluggish-blockchain
Core doesn't, it's Core's development team is also basically broken.;12;0;False;laci227;dev3nqa;Bloomberg: Antpool will switch entire pool to Bitcoin Unlimited;5z3hv5;https://www.bloomberg.com/news/articles/2017-03-13/bitcoin-miners-signal-revolt-in-push-to-fix-sluggish-blockchain
"I hate the comparison to the ETH hard fork!

 - ETH: Hard forks to **reappropriate funds** by removing transactions
 - BTC: Hard forks for a capacity upgrade

Edit: ""I hate"", not ""A hate."" This was pre-coffee.";21;1;False;i0X;dev6g3y;Bloomberg: Antpool will switch entire pool to Bitcoin Unlimited;5z3hv5;https://www.bloomberg.com/news/articles/2017-03-13/bitcoin-miners-signal-revolt-in-push-to-fix-sluggish-blockchain
there is some serious buthurt going on in /r/northcorea.;9;1;False;gheymos;devaito;Bloomberg: Antpool will switch entire pool to Bitcoin Unlimited;5z3hv5;https://www.bloomberg.com/news/articles/2017-03-13/bitcoin-miners-signal-revolt-in-push-to-fix-sluggish-blockchain
"""todd's group"" lol";14;1;False;haroldtimmings;dev2fvn;Bloomberg: Antpool will switch entire pool to Bitcoin Unlimited;5z3hv5;https://www.bloomberg.com/news/articles/2017-03-13/bitcoin-miners-signal-revolt-in-push-to-fix-sluggish-blockchain
"This post on r/bitcoin is getting so much censorship. 

It seems like their strategy is to allow posts like this, but to control the conversation by only allowing negative comments.";8;0;False;Annapurna317;devmbnw;Bloomberg: Antpool will switch entire pool to Bitcoin Unlimited;5z3hv5;https://www.bloomberg.com/news/articles/2017-03-13/bitcoin-miners-signal-revolt-in-push-to-fix-sluggish-blockchain
How does an unemployed loud mouth like Mao get quoted by a Bloomberg article? ;14;0;False;H0dl;dev65u5;Bloomberg: Antpool will switch entire pool to Bitcoin Unlimited;5z3hv5;https://www.bloomberg.com/news/articles/2017-03-13/bitcoin-miners-signal-revolt-in-push-to-fix-sluggish-blockchain
"You get to a point (long past now) where you have to agree to disagree.

";7;0;False;Leithm;dev65cx;Bloomberg: Antpool will switch entire pool to Bitcoin Unlimited;5z3hv5;https://www.bloomberg.com/news/articles/2017-03-13/bitcoin-miners-signal-revolt-in-push-to-fix-sluggish-blockchain
It's us (the BU and r/btc forum users) who managed to get Jihan and Ver on board. ;49;2;False;Shock_The_Stream;dev2vvp;Bloomberg: Antpool will switch entire pool to Bitcoin Unlimited;5z3hv5;https://www.bloomberg.com/news/articles/2017-03-13/bitcoin-miners-signal-revolt-in-push-to-fix-sluggish-blockchain
Hehe I got banned as well. Looks like we are not alone only 131 of 197 comments showing.;21;1;False;eatmybitcorn;dev56t5;Bloomberg: Antpool will switch entire pool to Bitcoin Unlimited;5z3hv5;https://www.bloomberg.com/news/articles/2017-03-13/bitcoin-miners-signal-revolt-in-push-to-fix-sluggish-blockchain
"> Yet he can't explain how, of course. What a dumbass.

The median EB attack alone is sufficient to call BU fundamentally broken.

Note:  Please do not respond by saying that this does not matter, since BU won't be used anyway.  When saying ""BU is broken"", I am  assuming the EB mechanism in BU is used, of course if BU is never used, in a way, BU is not broken. ";-18;5;False;jonny1000;dev5int;Bloomberg: Antpool will switch entire pool to Bitcoin Unlimited;5z3hv5;https://www.bloomberg.com/news/articles/2017-03-13/bitcoin-miners-signal-revolt-in-push-to-fix-sluggish-blockchain
It's because it has been parroted by Core and their followers enough that people not in the know think it is true. Unfortunately, repetition of propaganda works extremely well.;12;0;False;singularity87;devcgq8;Bloomberg: Antpool will switch entire pool to Bitcoin Unlimited;5z3hv5;https://www.bloomberg.com/news/articles/2017-03-13/bitcoin-miners-signal-revolt-in-push-to-fix-sluggish-blockchain
"Can miners use Core to do (or expose themselves to) an EB attack by recompiling?
";9;1;False;combatopera;dev5ypp;Bloomberg: Antpool will switch entire pool to Bitcoin Unlimited;5z3hv5;https://www.bloomberg.com/news/articles/2017-03-13/bitcoin-miners-signal-revolt-in-push-to-fix-sluggish-blockchain
Good, then you admit BU is not broken, only that some miners could use it wrongly. Progress.;10;1;False;ForkiusMaximus;dev782l;Bloomberg: Antpool will switch entire pool to Bitcoin Unlimited;5z3hv5;https://www.bloomberg.com/news/articles/2017-03-13/bitcoin-miners-signal-revolt-in-push-to-fix-sluggish-blockchain
"> The median EB attack alone is sufficient to call BU fundamentally broken.

""More than 50% of HP can undo transactions. Therefore Bitcoin is broken.""

That is the idea behind you guys arguments. You simply cannot stand the idea of incentives and uncertainty.

Yet Bitcoin needs all of that to survive. It is *based* upon those ideas to find a practical-though-not-perfect solution to the BGP.";7;1;False;awemany;dev8za0;Bloomberg: Antpool will switch entire pool to Bitcoin Unlimited;5z3hv5;https://www.bloomberg.com/news/articles/2017-03-13/bitcoin-miners-signal-revolt-in-push-to-fix-sluggish-blockchain
"I think the median EB attack is a legitimate concern. However, it's fairly easy for the miners to avoid it with sensible signalling and settings. Thus, I don't think that ""attack"" rises to the level of ""fundamentally broken"".";5;1;False;groovymash;dev9gkk;Bloomberg: Antpool will switch entire pool to Bitcoin Unlimited;5z3hv5;https://www.bloomberg.com/news/articles/2017-03-13/bitcoin-miners-signal-revolt-in-push-to-fix-sluggish-blockchain
The joke is when people like yourself who very obviously do not understand things very well try and talk like they know everything;13;1;False;TanksAblazment;devgybp;Bloomberg: Antpool will switch entire pool to Bitcoin Unlimited;5z3hv5;https://www.bloomberg.com/news/articles/2017-03-13/bitcoin-miners-signal-revolt-in-push-to-fix-sluggish-blockchain
A river made of horses hair? I don't get it.;12;1;False;cryptoboy4001;dev5weu;Bloomberg: Antpool will switch entire pool to Bitcoin Unlimited;5z3hv5;https://www.bloomberg.com/news/articles/2017-03-13/bitcoin-miners-signal-revolt-in-push-to-fix-sluggish-blockchain
"> The median EB attack alone is sufficient to call BU fundamentally broken.

LOL. If anything is broken, it's your BS attack against BU. 
If you don't trust the majority of hashing power, then Bitcoin is nothing for you.
One hash - one vote. ";22;1;False;Shock_The_Stream;dev6mp7;Bloomberg: Antpool will switch entire pool to Bitcoin Unlimited;5z3hv5;https://www.bloomberg.com/news/articles/2017-03-13/bitcoin-miners-signal-revolt-in-push-to-fix-sluggish-blockchain
"I can pretty much guarantee you that most major businesses have already tested (or are in the process of testing) BU, and could start additional BU nodes if it were close to activating (most major businesses are likely running multiple nodes to protect against sybil attacks). 

I don't personally think the node count argument has any real merit. ";24;1;False;qs-btc;dev2lr1;Bloomberg: Antpool will switch entire pool to Bitcoin Unlimited;5z3hv5;https://www.bloomberg.com/news/articles/2017-03-13/bitcoin-miners-signal-revolt-in-push-to-fix-sluggish-blockchain
"Exactly. It's the community that has been speaking for years now and they are only following. BSCore's continual attacks should be considered an attack on the community itself as is evidenced by the censorship and ostracism of many former prominent early adopters from the bait and switched forums like N Corea and BCT. . 

But it's not working because all those people are continuing to work on other ways to further the cause of Satoshi's original vision. Sorry BSCore. ";22;0;False;H0dl;dev5wd8;Bloomberg: Antpool will switch entire pool to Bitcoin Unlimited;5z3hv5;https://www.bloomberg.com/news/articles/2017-03-13/bitcoin-miners-signal-revolt-in-push-to-fix-sluggish-blockchain
That's just silly. Miners want control of the future of tx's. This fight has always been between Blockstream who want to control tx's off-line and miners on-chain. We are just pawns in this battle. ;2;0;False;escapevelo;devkrbr;Bloomberg: Antpool will switch entire pool to Bitcoin Unlimited;5z3hv5;https://www.bloomberg.com/news/articles/2017-03-13/bitcoin-miners-signal-revolt-in-push-to-fix-sluggish-blockchain
"The unwritten rule is, ""Don't hassle the Core devs."" ";9;1;False;ForkiusMaximus;dev7iic;Bloomberg: Antpool will switch entire pool to Bitcoin Unlimited;5z3hv5;https://www.bloomberg.com/news/articles/2017-03-13/bitcoin-miners-signal-revolt-in-push-to-fix-sluggish-blockchain
:-) thanks for the spelling tip.;3;0;False;Adrian-X;devema8;Bloomberg: Antpool will switch entire pool to Bitcoin Unlimited;5z3hv5;https://www.bloomberg.com/news/articles/2017-03-13/bitcoin-miners-signal-revolt-in-push-to-fix-sluggish-blockchain
I don't predict a lot of dumping. It won't take much for the price to drop below the point where it's cheaper to shut off the mining rigs vs pay for the electricity. Once it hits that point it's done. Perhaps a few blocks, but there will be such a backlog of transactions there won't be many successful trades.;3;1;False;realmadmonkey;devdqo1;Bloomberg: Antpool will switch entire pool to Bitcoin Unlimited;5z3hv5;https://www.bloomberg.com/news/articles/2017-03-13/bitcoin-miners-signal-revolt-in-push-to-fix-sluggish-blockchain
Traitor. ;12;0;False;H0dl;dev5sec;Bloomberg: Antpool will switch entire pool to Bitcoin Unlimited;5z3hv5;https://www.bloomberg.com/news/articles/2017-03-13/bitcoin-miners-signal-revolt-in-push-to-fix-sluggish-blockchain
The sudden 200 or so appearance of SWSF nodes over the last 2wk since UASF appeared is highly suspicious for a corporate Sybil attack. ;11;0;False;H0dl;dev5zju;Bloomberg: Antpool will switch entire pool to Bitcoin Unlimited;5z3hv5;https://www.bloomberg.com/news/articles/2017-03-13/bitcoin-miners-signal-revolt-in-push-to-fix-sluggish-blockchain
His main argument - ethereum seems to be dead at this point with Ethereum at the $28 level;8;0;False;antb123;devarvo;Bloomberg: Antpool will switch entire pool to Bitcoin Unlimited;5z3hv5;https://www.bloomberg.com/news/articles/2017-03-13/bitcoin-miners-signal-revolt-in-push-to-fix-sluggish-blockchain
The entire network has reached a malfunctioning point under 1mb core with unconfirmed transactions. Core has been negligent to basic network operations. Nobody trusts core anymore. I've been here since late 2012 and the best core developers were purged after Blockstream started paying the other devs. Gavin Andresen, the best developer Bitcoin has ever had, supports BU.;9;1;False;Annapurna317;devj7bh;Bloomberg: Antpool will switch entire pool to Bitcoin Unlimited;5z3hv5;https://www.bloomberg.com/news/articles/2017-03-13/bitcoin-miners-signal-revolt-in-push-to-fix-sluggish-blockchain
Fundamentally bought.;3;0;False;Joloffe;devahxd;Bloomberg: Antpool will switch entire pool to Bitcoin Unlimited;5z3hv5;https://www.bloomberg.com/news/articles/2017-03-13/bitcoin-miners-signal-revolt-in-push-to-fix-sluggish-blockchain
"This.

I had a (painful) discussion with some core fanbois the other day. They think they're going to have double their bitcoins (as has been the general misunderstanding in the KoreEchoChamber).

Prediction - there will be a mass exodus of Corefanbois & unfortunate people who've brought into Corebullshit, selling their coins on the HashCashCore chain, then going ""oh fuck, why don't i have double my bitcoins??"" - this will get rid of a massive amount of idiots (and the unlucky ones who just didn't know better) and it will quite happily show how BlockstreamCore don't know wtf they are talking about.";6;1;False;timetraveller57;devb5d5;Bloomberg: Antpool will switch entire pool to Bitcoin Unlimited;5z3hv5;https://www.bloomberg.com/news/articles/2017-03-13/bitcoin-miners-signal-revolt-in-push-to-fix-sluggish-blockchain
lately i wake up smiling every morning about this :);1;0;False;timetraveller57;devb963;Bloomberg: Antpool will switch entire pool to Bitcoin Unlimited;5z3hv5;https://www.bloomberg.com/news/articles/2017-03-13/bitcoin-miners-signal-revolt-in-push-to-fix-sluggish-blockchain
"""Chief Scientist....""

http://www.coindesk.com/peter-todd-joins-viacoin-development-team-chief-scientist/";19;2;False;Shock_The_Stream;dev2sv2;Bloomberg: Antpool will switch entire pool to Bitcoin Unlimited;5z3hv5;https://www.bloomberg.com/news/articles/2017-03-13/bitcoin-miners-signal-revolt-in-push-to-fix-sluggish-blockchain
Because satoshi is anonymous.;1;0;False;yeh-nah-yeh;dew14q1;Bloomberg: Antpool will switch entire pool to Bitcoin Unlimited;5z3hv5;https://www.bloomberg.com/news/articles/2017-03-13/bitcoin-miners-signal-revolt-in-push-to-fix-sluggish-blockchain
"Luckily Ver isn't a developer, nor is he the boss of any mining pools besides his own small one.

The miners would not fork at 60%, regardless of what Roger says.

Core takes the miners for idiots. Core takes Roger as some sort of boogeyman. Both stances are absurd.";37;0;False;thcymos;dev2ps7;Bloomberg: Antpool will switch entire pool to Bitcoin Unlimited;5z3hv5;https://www.bloomberg.com/news/articles/2017-03-13/bitcoin-miners-signal-revolt-in-push-to-fix-sluggish-blockchain
"Well UASF is basically an hard fork with 20% hash rate support..

";22;1;False;Ant-n;dev2xjg;Bloomberg: Antpool will switch entire pool to Bitcoin Unlimited;5z3hv5;https://www.bloomberg.com/news/articles/2017-03-13/bitcoin-miners-signal-revolt-in-push-to-fix-sluggish-blockchain
Because there isn't anything pretty to put there instead;3;0;False;fiah84;devmk4q;Bloomberg: Antpool will switch entire pool to Bitcoin Unlimited;5z3hv5;https://www.bloomberg.com/news/articles/2017-03-13/bitcoin-miners-signal-revolt-in-push-to-fix-sluggish-blockchain
Hello;-19;0;False;ThatsSpeltWrong;dev1t95;Bloomberg: Antpool will switch entire pool to Bitcoin Unlimited;5z3hv5;https://www.bloomberg.com/news/articles/2017-03-13/bitcoin-miners-signal-revolt-in-push-to-fix-sluggish-blockchain
"It is safer to do an HF with a large enough majority, so just after the HF there is little / no risk of a reorganization of the chain and confusion.

This also allows the confirmation time between blocks to be 
";1;0;False;painlord2k;deve6qy;Bloomberg: Antpool will switch entire pool to Bitcoin Unlimited;5z3hv5;https://www.bloomberg.com/news/articles/2017-03-13/bitcoin-miners-signal-revolt-in-push-to-fix-sluggish-blockchain
not an argument;10;1;False;freshlysquosed;devha8f;Bloomberg: Antpool will switch entire pool to Bitcoin Unlimited;5z3hv5;https://www.bloomberg.com/news/articles/2017-03-13/bitcoin-miners-signal-revolt-in-push-to-fix-sluggish-blockchain
If BU gains 75% support or more it would very good going forward for Bitcoin.  Even if there ends up being two Bitcoins BU would be like ETH and Core would be like ETC.  Maybe the price would fall temporary but the market would look ahead to scaling and where the larger user base wanted to be.  Which wallet would the major exchanges run do you think?;1;0;False;TruValueCapital;devyj68;Bloomberg: Antpool will switch entire pool to Bitcoin Unlimited;5z3hv5;https://www.bloomberg.com/news/articles/2017-03-13/bitcoin-miners-signal-revolt-in-push-to-fix-sluggish-blockchain
You do realize that Peter Todd is not working for Blockstream, right?;-22;3;False;brintal;dev263p;Bloomberg: Antpool will switch entire pool to Bitcoin Unlimited;5z3hv5;https://www.bloomberg.com/news/articles/2017-03-13/bitcoin-miners-signal-revolt-in-push-to-fix-sluggish-blockchain
"60% is far more than enough.  Any decrease in hash rate now that blocks are full will cause a 1MB coin to slow down block generation.  This will cause it to accept less transactions.  This will cause fees to go up.  This will mean more and more addresses are frozen and unable to be spent.  

With less transactions and less addresses able to even be spent at all  and a parallel chain still going that has plenty of capacity and the same ledger, what will people use?  They want to transact after all.  People will stop using the 1MB chain because they can't.   Larger addresses will be able to pay high transaction fees and buy fiat or buy into the other chain.  There will be no reason to make anything except for larger and larger transactions since any address that dips under the fee minimum will be unspendable.  The larger addresses will gradually be broken up into smaller units and more value will be frozen.

While this happens the price will drop since the way to actually transact will be on the large block chain. This will cause a feedback loop of less mining power, longer block times, less transaction volume, higher fees (at least in the btc value), and more unspendable addresses.  Less transaction capacity will mean less utility, which will mean lower price etc, until the whole chain collapses and grinds to a halt.";1;2;False;__Cyber_Dildonics__;deva73y;Bloomberg: Antpool will switch entire pool to Bitcoin Unlimited;5z3hv5;https://www.bloomberg.com/news/articles/2017-03-13/bitcoin-miners-signal-revolt-in-push-to-fix-sluggish-blockchain
"The HF to BU is happening as we speak. It's a relatively slow EASY process that works fundamentally different from core's ""signaling"" mechanism. ";27;1;False;H0dl;dev5e7m;Bloomberg: Antpool will switch entire pool to Bitcoin Unlimited;5z3hv5;https://www.bloomberg.com/news/articles/2017-03-13/bitcoin-miners-signal-revolt-in-push-to-fix-sluggish-blockchain
I even saw one user argue for bitcoin holders should decide what the network does. Like, what?;1;1;False;Dzuelu;deupk5h;Gavin Andresen on Twitter - Running BU is saying 'I'm ready for bigger blocks whenever there is wide consensus for bigger blocks' | Not 'let's fork ASAP';5yz7dk;https://twitter.com/gavinandresen/status/840940621456125952
The Bilderberg connection was proven already. ;5;1;False;;deur8u9;Gavin Andresen on Twitter - Running BU is saying 'I'm ready for bigger blocks whenever there is wide consensus for bigger blocks' | Not 'let's fork ASAP';5yz7dk;https://twitter.com/gavinandresen/status/840940621456125952
Perhaps not, but I've heard emojis do 😎;6;1;False;GranAutismo;deuuwrw;Gavin Andresen on Twitter - Running BU is saying 'I'm ready for bigger blocks whenever there is wide consensus for bigger blocks' | Not 'let's fork ASAP';5yz7dk;https://twitter.com/gavinandresen/status/840940621456125952
Well the holders do decide a lot. But not exactly *decide* but incentivize miners to decide. That's the subtlety that trips up the Core side. They rebel against the idea that the miners control Bitcoin because they realize it is not quite true. But then they go the other direction and fail to realize that it is true in a certain sense. Miners have control but are incentivized not to use it for ill. Edit: That's the basic premise of Bitcoin, and they reject it, not seeing that they are actually themselves Bitcoin skeptics.;3;0;False;ForkiusMaximus;dev174l;Gavin Andresen on Twitter - Running BU is saying 'I'm ready for bigger blocks whenever there is wide consensus for bigger blocks' | Not 'let's fork ASAP';5yz7dk;https://twitter.com/gavinandresen/status/840940621456125952
"Exactly, they're talking it up like BU wants to fork ASAP. In reality, we're seeking consensus. I'm sure there's a ""fork it"" faction, but it's not the prevailing sentiment here as far as I can tell.";2;0;False;notaduckipromise;devc0sa;Gavin Andresen on Twitter - Running BU is saying 'I'm ready for bigger blocks whenever there is wide consensus for bigger blocks' | Not 'let's fork ASAP';5yz7dk;https://twitter.com/gavinandresen/status/840940621456125952
💸;2;0;False;aquahol;dev175z;Gavin Andresen on Twitter - Running BU is saying 'I'm ready for bigger blocks whenever there is wide consensus for bigger blocks' | Not 'let's fork ASAP';5yz7dk;https://twitter.com/gavinandresen/status/840940621456125952
"Sigh, yes in the same way everyone is connected to the bilderberg group http://i.imgur.com/qV3YJEX.jpg

";1;1;False;polsymtas;deurzr0;Gavin Andresen on Twitter - Running BU is saying 'I'm ready for bigger blocks whenever there is wide consensus for bigger blocks' | Not 'let's fork ASAP';5yz7dk;https://twitter.com/gavinandresen/status/840940621456125952
not everything, only what matters and needs to be controlled.;4;1;False;;deuui9v;Gavin Andresen on Twitter - Running BU is saying 'I'm ready for bigger blocks whenever there is wide consensus for bigger blocks' | Not 'let's fork ASAP';5yz7dk;https://twitter.com/gavinandresen/status/840940621456125952
yes;1;0;False;jmdugan;deuqnt6;Gavin Andresen on Twitter - Running BU is saying 'I'm ready for bigger blocks whenever there is wide consensus for bigger blocks' | Not 'let's fork ASAP';5yz7dk;https://twitter.com/gavinandresen/status/840940621456125952
The Great Clash of fanatics. ;3;0;False;knight222;deuo3re;Gavin Andresen on Twitter - Running BU is saying 'I'm ready for bigger blocks whenever there is wide consensus for bigger blocks' | Not 'let's fork ASAP';5yz7dk;https://twitter.com/gavinandresen/status/840940621456125952
"The flexcap will be whatever the majority of miners put their settings on. Then as blocks fill again, they can set them higher.

";2;0;False;notaduckipromise;devchy7;Gavin Andresen on Twitter - Running BU is saying 'I'm ready for bigger blocks whenever there is wide consensus for bigger blocks' | Not 'let's fork ASAP';5yz7dk;https://twitter.com/gavinandresen/status/840940621456125952
BU needs better/more/more effective marketing efforts - this is an exact example.  one more person that would otherwise support BU but had incorrect information.  what can the community or individuals do to help with this?;7;0;False;jmdugan;deujzhm;Gavin Andresen on Twitter - Running BU is saying 'I'm ready for bigger blocks whenever there is wide consensus for bigger blocks' | Not 'let's fork ASAP';5yz7dk;https://twitter.com/gavinandresen/status/840940621456125952
"Repeating something such as these lies a thousand times is a technique which politicians employ - some mud sticks. These things work on credulous minds - of which we can see there are many among the core supporters.

Our best course of action is maintain confidence and self belief and to carry on advocating our position and doing what we can to give BU traction. As time goes on the desperation tactics will get increasingly overt and more and more people will see certain participants for what they truly are.

While the crack in the dam appears to only let a trickle flow out such that one may feel the water will never drain, we can be sure that the structure is weakened and will inevitably give way entirely - perhaps sooner than we might expect.";3;0;False;cezecu;deuxlz8;Gavin Andresen on Twitter - Running BU is saying 'I'm ready for bigger blocks whenever there is wide consensus for bigger blocks' | Not 'let's fork ASAP';5yz7dk;https://twitter.com/gavinandresen/status/840940621456125952
Also, it's not like after 75% happens we'll all rocket into the abyss with infinitely large blocks anyway. For a *long, loooooooong* time chances are nothing will change until consensus EB size increases. That itself will take a while, as the pools sort it out over open communication or BIP100-style signaling - nobody significant will move first for fear of losing revenue, and non-consensus trolls will be discarded as they should. ;2;0;False;imaginary_username;deviwr5;Gavin Andresen on Twitter - Running BU is saying 'I'm ready for bigger blocks whenever there is wide consensus for bigger blocks' | Not 'let's fork ASAP';5yz7dk;https://twitter.com/gavinandresen/status/840940621456125952
