body;score;nb_replies;stickied;author;id;post_title;post_id;post_link
lol, it's really not that hard. ;1;1;False;Raineko;dw7li9j;Today I graduated from /r/Bitcoin University with distinction.;841ygc;https://i.redd.it/unu8hxqo1hl01.png
So why are u making it hard being vague and avoiding any explanation;1;0;False;torgy514;dw82gjk;Today I graduated from /r/Bitcoin University with distinction.;841ygc;https://i.redd.it/unu8hxqo1hl01.png
Just tells me u don’t have a clue what u meant either;1;1;False;torgy514;dw74rgi;Today I graduated from /r/Bitcoin University with distinction.;841ygc;https://i.redd.it/unu8hxqo1hl01.png
Wow that sucks! NEVER trade Crypto drunk! This type of mistake from today on will be known as DWT (Drunk While Trading). Slow down you silly basteed!;1;0;False;Crypto-Cronie;dw7ngkv;Some poor bastard just sold their BTC for $999 instead of $9999.;859rmi;https://i.redd.it/otfdqez8ygm01.jpg
[removed];0;1;False;;dw6qkfu;Crypto jocks vs. nerds?... (a do-your-homework-doodle);8612wg;https://i.redd.it/836w1ihch3n01.jpg
"***
u/peopleb4things, you've [been sent](https://explorer.bitcoin.com/bch/address/bitcoincash:qrelay20s90hhul9hz7xsszxsk34mlt3e5qmhrx9ly) `0.00331 BCH`| `~   3.32 USD` by u/jarenfeser
via [chaintip](http://www.chaintip.org).
***
";1;0;False;chaintip;dw6qmyz;Crypto jocks vs. nerds?... (a do-your-homework-doodle);8612wg;https://i.redd.it/836w1ihch3n01.jpg
"That's why I think blockchain is not the answer.  Probably something more like a distributed key-value store, where the network retains at least N copies of the data at all times.  As opposed to the blockchain's ""everyone has to have a copy"".
";1;0;False;randomqhacker;dw7vlgc;So in a timeframe of few years, Reddit is going to become a corporate shithole, going the way of Digg. Is it logical to start moving the community now, not waiting for their move ?;86fa87;https://www.reddit.com/r/btc/comments/86fa87/so_in_a_timeframe_of_few_years_reddit_is_going_to/
shills fear voat;1;0;False;IndependentSpeech8;dw84amc;So in a timeframe of few years, Reddit is going to become a corporate shithole, going the way of Digg. Is it logical to start moving the community now, not waiting for their move ?;86fa87;https://www.reddit.com/r/btc/comments/86fa87/so_in_a_timeframe_of_few_years_reddit_is_going_to/
