body;score;nb_replies;stickied;author;id;post_title;post_id;post_link
"I'm confused, is this article talking about Segwit Coin (BTC) or Bitcoin (BCH)? Because it has ""Bitcoin"" in the title but the text says stuff about gamblers and BTC.";0;1;False;feejarndyce;fe5aqco;Institutional and Retail Bitcoin Futures Demand Continues to Climb;entr8w;https://news.bitcoin.com/institutional-and-retail-bitcoin-futures-demand-continues-to-climb/
I do wonder when the Bitfinex Tether Blockstream Cartel will be taken down, but it seems the regulators are afraid and prefer to KYC small people instead (or do have other intentions) .;1;0;False;PanneKopp;fe4sjs1;TOP CRYPTO TWEETS: Blockstream CSO Still Using Sexism Card, Swiss Govt Down, Ross Ulbricht NFT;ensrj7;https://coinspice.io/topcryptotweetsoftheweek/top-crypto-tweets-blockstream-cso-still-using-sexism-card-swiss-govt-down-ross-ulbricht-nft/
OP is a troll.;12;1;False;playfulexistence;fe4a2he;Coming soon... The Battle for Bitcoin;enrrwn;https://twitter.com/petermccormack/status/1216391547387891717?s=21
Did you interview people on the other side of the debate?;11;0;False;MoonNoon;fe4a70i;Coming soon... The Battle for Bitcoin;enrrwn;https://twitter.com/petermccormack/status/1216391547387891717?s=21
A BTC shill reel?;7;0;False;mojo_jojo_mark;fe4cxsp;Coming soon... The Battle for Bitcoin;enrrwn;https://twitter.com/petermccormack/status/1216391547387891717?s=21
PSA: Warning - OP is a foolish biased youtuber who only wants to present his side of the story to push an agenda (or earn more monies for coke).;8;1;False;ShadowOfHarbringer;fe4w6jm;Coming soon... The Battle for Bitcoin;enrrwn;https://twitter.com/petermccormack/status/1216391547387891717?s=21
"LOL, is this still your ""engineer"" posting here? You worm.

For context: https://www.reddit.com/r/btc/comments/ei2uq3/bitcoin_2019_review_with_matt_odell_what_bitcoin/fcojfjp";3;1;False;Means_of_Exchange;fe4gdm0;Coming soon... The Battle for Bitcoin;enrrwn;https://twitter.com/petermccormack/status/1216391547387891717?s=21
and I did believe the battle is on since 2014;1;0;False;PanneKopp;fe4cd12;Coming soon... The Battle for Bitcoin;enrrwn;https://twitter.com/petermccormack/status/1216391547387891717?s=21
"But he's also an idiot. This ought to be good.  Only a fool would mention the NY Agreement if he's a small blocker. That NY Agreement was a Barry Silbert back-room deal to begin with, then Blockstream/Core completely welched out on the second part of the deal (Segwit2x was never released).  It was a most shameful time for Blockstream and Coretards everywhere.

Then again, pretty much everyone who understands negotiation knew that Segwit2x was a red herring. Nobody makes a deal to do A this week and then the other party will do B ""sometime in the future"", with no penalty for not doing B.  Thankfully the BCH team had already been coding for the BitcoinABC hard fork.";10;1;False;wtfCraigwtf;fe4dcvn;Coming soon... The Battle for Bitcoin;enrrwn;https://twitter.com/petermccormack/status/1216391547387891717?s=21
coke rots your teeth;-2;0;False;DrBaggypants;fe5fiel;Coming soon... The Battle for Bitcoin;enrrwn;https://twitter.com/petermccormack/status/1216391547387891717?s=21
This is me;-4;0;False;mccormack555;fe58pdv;Coming soon... The Battle for Bitcoin;enrrwn;https://twitter.com/petermccormack/status/1216391547387891717?s=21
It is possible for Hernzzzz token to get to 100% market dominance.;12;0;False;playfulexistence;fe435ql;It is impossible for Bitcoin to get back to 100% market dominance;enrfix;https://www.reddit.com/r/btc/comments/enrfix/it_is_impossible_for_bitcoin_to_get_back_to_100/
"> When it comes to transactions number, even your chart is showing that since btc got chocked ,transaction number dropped significantly.

The beauty about Bitcoin is that it is being used for speculation, but it is also being used for payments more than the other cryptos.

Transaction numbers did decline after Bitcoin hit an all time high and started to decline. This is to be expected in bear market.

I am predicting a global recession starting sometime in 2020, many reason for this, but not time now to elaborate.

Which crypto would you rather be holding in a recession?";-1;1;False;FluidAttitude;fe5hdtu;It is impossible for Bitcoin to get back to 100% market dominance;enrfix;https://www.reddit.com/r/btc/comments/enrfix/it_is_impossible_for_bitcoin_to_get_back_to_100/
"As you already noticed and agreed - btc is speculation token. That itself is a failure as btc no longer even aspire to be digital cash.

When it comes to transactions number, even your chart is showing that since btc got chocked ,transaction number dropped significantly. The only thing that you might argue with me is the ""steady"" decline, as indeed I see transaction number is more (or as) volatile than price itself.

I stand corrected:

>Since btc failure, it is in ~~steady~~ decline and capped below networks small capacity.";5;1;False;MarchewkaCzerwona;fe5fviv;It is impossible for Bitcoin to get back to 100% market dominance;enrfix;https://www.reddit.com/r/btc/comments/enrfix/it_is_impossible_for_bitcoin_to_get_back_to_100/
"> I guess you're free to go home, take a nap, and start a new hobby.

I do enjoy my sleep after a busy day, but it is not yet time.

I have plenty of hobbies, so no need for a new one.";-1;0;False;FluidAttitude;fe5ep8h;It is impossible for Bitcoin to get back to 100% market dominance;enrfix;https://www.reddit.com/r/btc/comments/enrfix/it_is_impossible_for_bitcoin_to_get_back_to_100/
"> I do guess it is OK, if I call you a noob, too

Wrong answer - call your instructor once again .

LOL";-1;0;False;FluidAttitude;fe5demn;It is impossible for Bitcoin to get back to 100% market dominance;enrfix;https://www.reddit.com/r/btc/comments/enrfix/it_is_impossible_for_bitcoin_to_get_back_to_100/
"> Since btc failure, it is in steady decline

Bitcoin daily number of transactions is in the top 20% segment of maximum daily use in its entire history.

Bear in mind that the valuation of Bitcoin is also in the top 20% segment of maximum price in its entire history.

The facts do not back up your statement of ""it is in steady decline""

https://bitinfocharts.com/comparison/bitcoin-transactions.html";-4;1;False;FluidAttitude;fe5eh45;It is impossible for Bitcoin to get back to 100% market dominance;enrfix;https://www.reddit.com/r/btc/comments/enrfix/it_is_impossible_for_bitcoin_to_get_back_to_100/
Now that you have that kind of confidence I guess you're free to go home, take a nap, and start a new hobby. Bye! Enjoy!;6;2;False;knowbodynows;fe4rf2k;It is impossible for Bitcoin to get back to 100% market dominance;enrfix;https://www.reddit.com/r/btc/comments/enrfix/it_is_impossible_for_bitcoin_to_get_back_to_100/
I do guess it is OK, if I call you a noob, too - call your instructor once again .;3;1;False;PanneKopp;fe50sp5;It is impossible for Bitcoin to get back to 100% market dominance;enrfix;https://www.reddit.com/r/btc/comments/enrfix/it_is_impossible_for_bitcoin_to_get_back_to_100/
">Speculation is at the heart of the valuation of most cryptos.


Edit: Misread it. Sorry.


~~No, it is not. Bitcoin was created to be cash. Money. Currency.~~

~~It already failed to be that and that's why fools rebranded to SOV aka speculation.~~

Edited as it is not answer to your statement. If speculation is at the heart of most crypto than unfortunately it means there is no other use for them or it is sadly secondary. Nothing to cheer for though.

>The reason why Bitcoin has survived and thrived in all this speculation is that the markets approve of its direction and security.

Bitcoin survived, but it definitely is not thriving. It is coin in decline and no purpose other than siphoning money from fools. In current manipulated market that is exactly what is happening and some of parts of ""the market"" indeed approve that. Some are simply plain, stupid and unaware they are being slowly robbed from money. Not to mention, already robbed from purpose.

>This is why Bitcoin is the most widely used crypto globally for payments.


No, it is not that reason. Bitcoin btc was first and therefore most poeple was working hard to support and use this coin. Since btc failure, it is in steady decline and capped below networks small capacity.

Btw, exchange ""use"" is mostly fake anyway.";5;1;False;MarchewkaCzerwona;fe50zjt;It is impossible for Bitcoin to get back to 100% market dominance;enrfix;https://www.reddit.com/r/btc/comments/enrfix/it_is_impossible_for_bitcoin_to_get_back_to_100/
"> keep on fighting for the hijacked narrative

I have to give you a little credit for trying to achieve something that you will never be able to achieve.";-1;1;False;FluidAttitude;fe4m34e;It is impossible for Bitcoin to get back to 100% market dominance;enrfix;https://www.reddit.com/r/btc/comments/enrfix/it_is_impossible_for_bitcoin_to_get_back_to_100/
"> Well I am a (very old) Bit Coin er too 

Age can be a hindrance, if it underestimates Bitcoin & all the battles it has won over its 10 year lifetime.";0;1;False;FluidAttitude;fe4zyy8;It is impossible for Bitcoin to get back to 100% market dominance;enrfix;https://www.reddit.com/r/btc/comments/enrfix/it_is_impossible_for_bitcoin_to_get_back_to_100/
"> you are supporting speculation token

Speculation is at the heart of the valuation of most cryptos.

The reason why Bitcoin has survived and thrived in all this speculation is that the markets approve of its direction and security. 

This is why Bitcoin is the most widely used crypto globally for payments.";-4;1;False;FluidAttitude;fe4yye7;It is impossible for Bitcoin to get back to 100% market dominance;enrfix;https://www.reddit.com/r/btc/comments/enrfix/it_is_impossible_for_bitcoin_to_get_back_to_100/
keep on fighting for the hijacked narrative;8;1;False;PanneKopp;fe4ls4f;It is impossible for Bitcoin to get back to 100% market dominance;enrfix;https://www.reddit.com/r/btc/comments/enrfix/it_is_impossible_for_bitcoin_to_get_back_to_100/
"> Not a bitcoiner. You're a money hodler.

You are implying that I only ""hodl"" Bitcoin, when in reality you do now know how I use Bitcoin.

The primary use case for most cryptos is pure speculation, including BCH and Bitcoin.

The only crypto that is being widely used for peer-to-peer payments is Bitcoin, and this applies to legitimate and illegitimate use cases.";-4;0;False;FluidAttitude;fe5d9vz;It is impossible for Bitcoin to get back to 100% market dominance;enrfix;https://www.reddit.com/r/btc/comments/enrfix/it_is_impossible_for_bitcoin_to_get_back_to_100/
"Well I am a (very old) Bit Coin er too - so what ?

I do remember you even refused to give a definition of Bitcoin - ask your instructor once again .";2;1;False;PanneKopp;fe4u9ag;It is impossible for Bitcoin to get back to 100% market dominance;enrfix;https://www.reddit.com/r/btc/comments/enrfix/it_is_impossible_for_bitcoin_to_get_back_to_100/
"I do guess it is OK, when I do call you a BlockstreamÂ® Shill .

... not worth my attention at all .";8;1;False;PanneKopp;fe4bst1;It is impossible for Bitcoin to get back to 100% market dominance;enrfix;https://www.reddit.com/r/btc/comments/enrfix/it_is_impossible_for_bitcoin_to_get_back_to_100/
At least get your facts right. Segwit Coin (BTC) currently has 68% market share. Bitcoin (BCH) has 2% market share.;0;1;False;feejarndyce;fe485wi;It is impossible for Bitcoin to get back to 100% market dominance;enrfix;https://www.reddit.com/r/btc/comments/enrfix/it_is_impossible_for_bitcoin_to_get_back_to_100/
i think it will stabilize at  80% pareto distribution;-4;1;False;FieserKiller;fe50nbd;It is impossible for Bitcoin to get back to 100% market dominance;enrfix;https://www.reddit.com/r/btc/comments/enrfix/it_is_impossible_for_bitcoin_to_get_back_to_100/
"> Segwit Coin (BTC) currently has 68% market share. Bitcoin (BCH) has 2% market share.

At least get your facts straight. Bitcoin has the ticker symbol BTC, and the name Bitcoin, on ALL exchanges.

Bitcoin has won the war for the name and brand, but there are still a few that refuse to face the facts.

The markets have also decided which is the real Bitcoin, as can be shown by the drop of BCH from being valued at 0.2 BTC at the start of the huge hype, to just 0.033 BTC now.

LOL";-4;1;False;FluidAttitude;fe4kupr;It is impossible for Bitcoin to get back to 100% market dominance;enrfix;https://www.reddit.com/r/btc/comments/enrfix/it_is_impossible_for_bitcoin_to_get_back_to_100/
"> I do guess it is OK, when I do call you a BlockstreamÂ® Shill .

It is not OK, and totally untrue, but I understand why you do this.

I am a Bitcoiner, plain and simple.";-10;3;False;FluidAttitude;fe4lr64;It is impossible for Bitcoin to get back to 100% market dominance;enrfix;https://www.reddit.com/r/btc/comments/enrfix/it_is_impossible_for_bitcoin_to_get_back_to_100/
You are plain and simple. That's why it was so easy to fool you into thinking you are supporting bitcoin, where in fact you are supporting speculation token aka ponzi scheme.;7;1;False;MarchewkaCzerwona;fe4oph7;It is impossible for Bitcoin to get back to 100% market dominance;enrfix;https://www.reddit.com/r/btc/comments/enrfix/it_is_impossible_for_bitcoin_to_get_back_to_100/
"Not a bitcoiner. You're a money hodler.

Bitcoiner implies using bitcoin but you only want people to sell bitcoin on exchanges. You only want speculation and contribution to the bitcoin hodl Ponzi.";4;1;False;curryandrice;fe538tz;It is impossible for Bitcoin to get back to 100% market dominance;enrfix;https://www.reddit.com/r/btc/comments/enrfix/it_is_impossible_for_bitcoin_to_get_back_to_100/
"WTF is a ""private youtube-wrapper""? I have my own idea of what it is, and it's not complimentary, but I'd like to hear what those of you that are ""in the know"" define as a ""youtube-wrapper"" is.";7;0;False;ShadowOrson;fe3xnlz;P.S.A.: Invidio.us, a private Youtube-wrapper with tons of FOSS community support takes BCH donations!! Scroll to the bottom of the page and make a donation in Bitcoin Cash to show we have their back!;enqykg;https://www.invidio.us/watch?v=eOVJ7eOHY2c
"I found two ""Bitcoin"" meetups in my area. One had 10 people and was sponsored by TravelByBit (very anti-BCH). The other appeared to be a front for selling people on a coin called ""Dolla"", whose website has an invalid SSL cert.

Nothing specifically for BCH. Might have to try running one at some point.

Anyone got good suggestions for things to do at a meetup? I'm thinking an ""install-fest"" to help people set up the Bitcoin.com wallet or Bitcoin Cash Register app, and learn to use them. But what else would be helpful?";7;2;False;fatalglory;fe48i0d;Merchant Device with BCH Register App, Miami Blockchain Week, 60% of Booking is Crypto on Travala;enqptb;https://youtu.be/nKNgtveC_nY
why does roger look like a crack junkie as of recently?;-4;3;False;feejarndyce;fe4binh;Merchant Device with BCH Register App, Miami Blockchain Week, 60% of Booking is Crypto on Travala;enqptb;https://youtu.be/nKNgtveC_nY
"* Teach them how to set up a merchant
* Teach them how to use [local.bitcoin.com](https://local.bitcoin.com)
* Teach them how to create an SLP token
* Get them to take a photo of their smiling face with their new installed wallet and then tweet it";6;0;False;georgedonnelly;fe4thjw;Merchant Device with BCH Register App, Miami Blockchain Week, 60% of Booking is Crypto on Travala;enqptb;https://youtu.be/nKNgtveC_nY
Because you have shit in your eyes! He's a cute man.;6;0;False;Rose-1r2o3s4e;fe4mf38;Merchant Device with BCH Register App, Miami Blockchain Week, 60% of Booking is Crypto on Travala;enqptb;https://youtu.be/nKNgtveC_nY
"Dunno, says he's training hard in jiujitsu.

Sometimes people go too far with low fat, low carb, high protein diets during training.

Note: Not saying he looks totally cracked out, just a bit thinner and tired.";5;0;False;BTC_StKN;fe4p172;Merchant Device with BCH Register App, Miami Blockchain Week, 60% of Booking is Crypto on Travala;enqptb;https://youtu.be/nKNgtveC_nY
Nice! Pretty good  watch even if the info is not new to you.;8;1;False;Remora_101;fe4lpsw;The American Dream;enqn8o;https://youtu.be/IaDt9T7BF38
God I remember this video making me an anarcho-socialist when I was 12.;9;1;False;stellarpasta;fe4hc5g;The American Dream;enqn8o;https://youtu.be/IaDt9T7BF38
Pm sent.;5;1;False;spacesticks;fe3pm6f;Attention SBS token fundraiser - problem w/ tokens not received for order;enqdov;https://www.reddit.com/r/btc/comments/enqdov/attention_sbs_token_fundraiser_problem_w_tokens/
Thanks for the quick assistance!;4;0;False;Pablo_Picasho;fe4hyub;Attention SBS token fundraiser - problem w/ tokens not received for order;enqdov;https://www.reddit.com/r/btc/comments/enqdov/attention_sbs_token_fundraiser_problem_w_tokens/
Brilliant post, thank you. You've motivated me.;10;1;False;maff1989;fe3vyjm;"On BCH v. P2P electronic cash, number go up, and how BCH equals ""motive power"". Now who will be our John Galt?";enptma;https://read.cash/@Cain/motive-power-450033ce
You've further motivated me to try and finally get around to reading Atlas Shrugged so that I get these references, lol.;6;1;False;fatalglory;fe4l4xj;"On BCH v. P2P electronic cash, number go up, and how BCH equals ""motive power"". Now who will be our John Galt?";enptma;https://read.cash/@Cain/motive-power-450033ce
Thank you for reading.;7;0;False;BCHcain;fe4bpxc;"On BCH v. P2P electronic cash, number go up, and how BCH equals ""motive power"". Now who will be our John Galt?";enptma;https://read.cash/@Cain/motive-power-450033ce
Yeah I remember trying to read it years ago and only getting halfway through. It's a long book. Audible helps. Especially towards the end there's like this 100 page monologue that I just listened to at 1.5x speed to help me power through it.;5;1;False;BCHcain;fe54c1u;"On BCH v. P2P electronic cash, number go up, and how BCH equals ""motive power"". Now who will be our John Galt?";enptma;https://read.cash/@Cain/motive-power-450033ce
Roger Ver said on reddit that the account was sold, he knows the original owner.;8;0;False;Mr-Zwets;fe3ckep;twitter bitcoin account question;enpfxu;https://www.reddit.com/r/btc/comments/enpfxu/twitter_bitcoin_account_question/
Around 4-5 months ago. Iâ€™m still worried about the wellbeing of the original owner. The Twitter owner personally has something to do with this act that was made clear by his actions and comms.;5;0;False;FlipDetector;fe38tuz;twitter bitcoin account question;enpfxu;https://www.reddit.com/r/btc/comments/enpfxu/twitter_bitcoin_account_question/
"He transferred the account to someone, the guy promised to keep it a pro-BCH account, but the guy lied and turned it into BTC.

Roger knows the guy but says it's his story to tell.

We need to be smarter than that, this guy cost us a major outlet.";9;0;False;Anen-o-me;fe3gsu9;twitter bitcoin account question;enpfxu;https://www.reddit.com/r/btc/comments/enpfxu/twitter_bitcoin_account_question/
another sad story about another hijack;3;0;False;PanneKopp;fe3e6ev;twitter bitcoin account question;enpfxu;https://www.reddit.com/r/btc/comments/enpfxu/twitter_bitcoin_account_question/
"I'm a bot, *bleep*, *bloop*. Someone has linked to this thread from another place on reddit:

- [/r/cryptoandme] [#crypto #cryptonews #bitcoin @nocroom #twitter bitcoin account question](https://www.reddit.com/r/Cryptoandme/comments/enq8n9/crypto_cryptonews_bitcoin_nocroom_twitter_bitcoin/)

&nbsp;*^(If you follow any of the above links, please respect the rules of reddit and don't vote in the other threads.) ^\([Info](/r/TotesMessenger) ^/ ^[Contact](/message/compose?to=/r/TotesMessenger))*";1;0;False;TotesMessenger;fe3jrab;twitter bitcoin account question;enpfxu;https://www.reddit.com/r/btc/comments/enpfxu/twitter_bitcoin_account_question/
Rampant political correctness, de-platforming and defunding of controversial opinions will surely escalate the coming year. If the Bitcoin Cash ecosystem offers a solution (read.cash, memo.cash) then adoption could explode.;6;1;False;SwedishSalsa;fe48whh;Read.cash just keeps on impressing me. Sign up and check it out.;enpa3n;https://read.cash/@Read.Cash/what-are-communities-on-readcash-314cdb68
"This is a really bad title. The tldr is that read.cash implemented Reddit style communities

My take: cool, but we already have Reddit. Read.cash's version is not any more decentralized, and doesn't have any new noteworthy features (that Reddit lacks)

So I'm still waiting for the ""Reddit killer"" app that we have all been dreaming about for years. So far, read.cash is another steem or uptrennd";3;1;False;hugelung;fe4a1w0;Read.cash just keeps on impressing me. Sign up and check it out.;enpa3n;https://read.cash/@Read.Cash/what-are-communities-on-readcash-314cdb68
nah;-6;1;False;kingp43x;fe482et;Read.cash just keeps on impressing me. Sign up and check it out.;enpa3n;https://read.cash/@Read.Cash/what-are-communities-on-readcash-314cdb68
I believe read.cash is moderated, FWIW;5;2;False;jessquit;fe5btf6;Read.cash just keeps on impressing me. Sign up and check it out.;enpa3n;https://read.cash/@Read.Cash/what-are-communities-on-readcash-314cdb68
"read.cash here. If you want an uncensored decentralized Reddit - there's awesome [memberapp](https://memberapp.github.io/), uncensored decentralized Twitter - there's [memo.cash](https://memo.cash). 

We aren't actually trying to kill Reddit or any other platform for that matter. We're trying to create a platform where content creators can be compensated using Bitcoin Cash. And it [kind of](https://read.cash/@unitedstatian/the-bitcoin-wars-continued-23-ed8e12c3) [works](https://read.cash/@sjbuendia/547-leaflets-were-distributed-the-town-reacts-what-is-bitcoin-cash-dd5c281b) (see the amounts donated). Frankly if steem, uptrennd or any other used Bitcoin Cash - we wouldn't even bother - they're [much bigger than read.cash](https://read.cash/@Read.Cash/size-estimation-of-readcash-7c0b1859) and it would work great! 1mln steemit users + Bitcoin Cash - that would've been nice. Alas, we have to do it ourselves.

We had a problem that our main page was getting filled with lots of topics, so we're trying to solve it with reddit-style communities, without trying to kill Reddit in the meantime, just solving our own problems. Cain felt that problem, many others too, that's why people are excited.

Other than that I don't know why would we need to kill Reddit. I like Reddit. It just doesn't use Bitcoin Cash, that's why read.cash exists. :shrug:";3;1;False;readcash;fe59mo4;Read.cash just keeps on impressing me. Sign up and check it out.;enpa3n;https://read.cash/@Read.Cash/what-are-communities-on-readcash-314cdb68
PSA - Warning: Elder Troll in parent post.;5;0;False;ShadowOfHarbringer;fe4ty5d;Read.cash just keeps on impressing me. Sign up and check it out.;enpa3n;https://read.cash/@Read.Cash/what-are-communities-on-readcash-314cdb68
"Yes.

Though the [rules](https://read.cash/@Read.Cash/what-is-readcash-7b0bfcfc#what-can-i-publish-on-readcash) are simple enough and we don't have to remove too much stuff (I can still count all the hidden articles on the fingers of one hand for all this time). We didn't even remove the articles, they're just not advertised on the main page, still available on author's pages.

Along with that I always advise people to try [memberapp](https://memberapp.github.io/) and [memo.cash](https://memo.cash). Though I personally don't use them. I like the ability to remove or edit my own stupid posts, after I realize why they're stupid. Doesn't work with the immutable storage.";7;0;False;readcash;fe5eedc;Read.cash just keeps on impressing me. Sign up and check it out.;enpa3n;https://read.cash/@Read.Cash/what-are-communities-on-readcash-314cdb68
"I'm really curious to see how member and memo end up. Will somebody start abusing it by sending something obviously illegal or really bad (child porn, doxxing, disgusting imagery)? Would they turn into unending flamewar? I think it's too early to judge whether a totally unmoderated platform is even capable staying online despite hosting something unimaginably bad (if it's really uncensored it's only a matter of time...)

So, I think we'll see in the end how it turns out, maybe I'm just too paranoid. But it's great to see that Bitcoin Cash has quite a few different experiments going on. Time will tell who was right.";2;0;False;readcash;fe5h6h5;Read.cash just keeps on impressing me. Sign up and check it out.;enpa3n;https://read.cash/@Read.Cash/what-are-communities-on-readcash-314cdb68
So now that coins can be fused it means BCH transactions are fungible, correct? That, or at least they can be made fungible?;15;2;False;SILENTSAM69;fe3rugm;Super interesting Bitcoin Cash Fusion Transaction. (Financial Privacy on BCH!);enoxal;https://explorer.bitcoin.com/bch/tx/9e288b8e38578c1f70141e5f74a788a8c6f058da2fd29af8070ee615754e1887
"What's the rule an exchange would have?  How many ""hops"" away from a fusion do you have to be?  We could then just code wallets to do that too.";10;1;False;jonald_fyookball;fe5hek1;Super interesting Bitcoin Cash Fusion Transaction. (Financial Privacy on BCH!);enoxal;https://explorer.bitcoin.com/bch/tx/9e288b8e38578c1f70141e5f74a788a8c6f058da2fd29af8070ee615754e1887
You're right. And I doubt enough will.;2;1;False;jonas_h;fe5drwq;Super interesting Bitcoin Cash Fusion Transaction. (Financial Privacy on BCH!);enoxal;https://explorer.bitcoin.com/bch/tx/9e288b8e38578c1f70141e5f74a788a8c6f058da2fd29af8070ee615754e1887
Agreed.;7;0;False;chainxor;fe4mwuu;Super interesting Bitcoin Cash Fusion Transaction. (Financial Privacy on BCH!);enoxal;https://explorer.bitcoin.com/bch/tx/9e288b8e38578c1f70141e5f74a788a8c6f058da2fd29af8070ee615754e1887
^ Abandoned novelty coin.;9;0;False;BTC_StKN;fe4m5xp;Super interesting Bitcoin Cash Fusion Transaction. (Financial Privacy on BCH!);enoxal;https://explorer.bitcoin.com/bch/tx/9e288b8e38578c1f70141e5f74a788a8c6f058da2fd29af8070ee615754e1887
