body;score;nb_replies;stickied;author;id;post_title;post_id;post_link
It becomes impractical if *enough* people shuffle / fuse.;5;1;False;jessquit;fe5bguu;Super interesting Bitcoin Cash Fusion Transaction. (Financial Privacy on BCH!);enoxal;https://explorer.bitcoin.com/bch/tx/9e288b8e38578c1f70141e5f74a788a8c6f058da2fd29af8070ee615754e1887
"> without being ""tainted"" by its past.

Won't exchanges or whoever is applying KYC simply check the past address history and see address A has received coins from tainted address B? Amount doesn't matter just that the 2 addresses are linked.";2;2;False;500239;fe5h9nj;Super interesting Bitcoin Cash Fusion Transaction. (Financial Privacy on BCH!);enoxal;https://explorer.bitcoin.com/bch/tx/9e288b8e38578c1f70141e5f74a788a8c6f058da2fd29af8070ee615754e1887
It's better than bCore;3;0;False;NewFlipPhoneWhoDis;fe581v7;Super interesting Bitcoin Cash Fusion Transaction. (Financial Privacy on BCH!);enoxal;https://explorer.bitcoin.com/bch/tx/9e288b8e38578c1f70141e5f74a788a8c6f058da2fd29af8070ee615754e1887
I'm Roger Ver unofficial fan: dogecoin is fun, but has not develop anything despite years of existence. Same for litecoin.;15;1;False;Zyoman;fe4kgyn;Super interesting Bitcoin Cash Fusion Transaction. (Financial Privacy on BCH!);enoxal;https://explorer.bitcoin.com/bch/tx/9e288b8e38578c1f70141e5f74a788a8c6f058da2fd29af8070ee615754e1887
"FUZï¿½ ï¿½nï¿½Sï¿½~ï¿½ï¿½=ï¿½ï¿½ï¿½Ziï¿½ C,ï¿½\Bï¿½yï¿½Nï¿½ï¿½1ï¿½

Or just â€œFUZâ€?";2;1;False;megability;fe56rec;Super interesting Bitcoin Cash Fusion Transaction. (Financial Privacy on BCH!);enoxal;https://explorer.bitcoin.com/bch/tx/9e288b8e38578c1f70141e5f74a788a8c6f058da2fd29af8070ee615754e1887
">What's the OP_RETURN output?

It's the hash of an internal state all the players agree on.  It prevents the server from doing a MITM attack without adding more complication to the protocol.  It's discussed in the spec.";7;0;False;jonald_fyookball;fe5gz8z;Super interesting Bitcoin Cash Fusion Transaction. (Financial Privacy on BCH!);enoxal;https://explorer.bitcoin.com/bch/tx/9e288b8e38578c1f70141e5f74a788a8c6f058da2fd29af8070ee615754e1887
Dein reddit-account name ist so geil :-);5;1;False;chainxor;fe4n1js;Super interesting Bitcoin Cash Fusion Transaction. (Financial Privacy on BCH!);enoxal;https://explorer.bitcoin.com/bch/tx/9e288b8e38578c1f70141e5f74a788a8c6f058da2fd29af8070ee615754e1887
It's the first thing I've checked too!;8;0;False;Zyoman;fe4jwiv;Super interesting Bitcoin Cash Fusion Transaction. (Financial Privacy on BCH!);enoxal;https://explorer.bitcoin.com/bch/tx/9e288b8e38578c1f70141e5f74a788a8c6f058da2fd29af8070ee615754e1887
Yeah, I am more interested in CashFusion than CashShuffle myself. I really like where this project is going. Bitcoin Cash seems to solve the important issues.;16;1;False;SILENTSAM69;fe4dtw4;Super interesting Bitcoin Cash Fusion Transaction. (Financial Privacy on BCH!);enoxal;https://explorer.bitcoin.com/bch/tx/9e288b8e38578c1f70141e5f74a788a8c6f058da2fd29af8070ee615754e1887
"Fungibility isn't really a binary thing, but the more privacy there is, the more fungible the currency is, because each coin can be substituted by any other without being ""tainted"" by its past. 

CashShuffle made BCH more fungible than it was before, and CashFusion will make it EVEN MORE fungible.";21;2;False;AD1AD;fe4beas;Super interesting Bitcoin Cash Fusion Transaction. (Financial Privacy on BCH!);enoxal;https://explorer.bitcoin.com/bch/tx/9e288b8e38578c1f70141e5f74a788a8c6f058da2fd29af8070ee615754e1887
Great;7;0;False;paulemmanuelng;fe3xviq;Super interesting Bitcoin Cash Fusion Transaction. (Financial Privacy on BCH!);enoxal;https://explorer.bitcoin.com/bch/tx/9e288b8e38578c1f70141e5f74a788a8c6f058da2fd29af8070ee615754e1887
"> That, or at least they can be made fungible?

Can you detect if a transaction has been shuffled? If so, exchanges can demand KYC or block them. So no.

In theory **if** everyone shuffled transactions, this wouldn't be practical. But unfortunately that will never be the case.";3;3;False;jonas_h;fe5auj5;Super interesting Bitcoin Cash Fusion Transaction. (Financial Privacy on BCH!);enoxal;https://explorer.bitcoin.com/bch/tx/9e288b8e38578c1f70141e5f74a788a8c6f058da2fd29af8070ee615754e1887
"111 inputs

18 outputs


I'm so excited for it ðŸ˜";21;2;False;Arschfick20Rand;fe3j7uz;Super interesting Bitcoin Cash Fusion Transaction. (Financial Privacy on BCH!);enoxal;https://explorer.bitcoin.com/bch/tx/9e288b8e38578c1f70141e5f74a788a8c6f058da2fd29af8070ee615754e1887
What's the OP\_RETURN output?;10;2;False;Chris_Pacia;fe51aml;Super interesting Bitcoin Cash Fusion Transaction. (Financial Privacy on BCH!);enoxal;https://explorer.bitcoin.com/bch/tx/9e288b8e38578c1f70141e5f74a788a8c6f058da2fd29af8070ee615754e1887
"When CashFusion?

ElectronCash first?

Bitcoin.com next, or are they ever going to add CAshSHuffle even?...

Ive been CAshSHuffleâ€™n for months, canâ€™t wait to Fusion some back together now ;)";8;0;False;megability;fe55gqq;Super interesting Bitcoin Cash Fusion Transaction. (Financial Privacy on BCH!);enoxal;https://explorer.bitcoin.com/bch/tx/9e288b8e38578c1f70141e5f74a788a8c6f058da2fd29af8070ee615754e1887
Censoring transactions like Luke Jr tried to do just got a heck of a lot harder :);8;0;False;OsrsNeedsF2P;fe4ilnr;Super interesting Bitcoin Cash Fusion Transaction. (Financial Privacy on BCH!);enoxal;https://explorer.bitcoin.com/bch/tx/9e288b8e38578c1f70141e5f74a788a8c6f058da2fd29af8070ee615754e1887
at least it seems we are on track :);9;0;False;PanneKopp;fe3bzgh;Super interesting Bitcoin Cash Fusion Transaction. (Financial Privacy on BCH!);enoxal;https://explorer.bitcoin.com/bch/tx/9e288b8e38578c1f70141e5f74a788a8c6f058da2fd29af8070ee615754e1887
Roger whats your opinion on dogecoin?;-21;2;False;SoiledCold5;fe3pt2r;Super interesting Bitcoin Cash Fusion Transaction. (Financial Privacy on BCH!);enoxal;https://explorer.bitcoin.com/bch/tx/9e288b8e38578c1f70141e5f74a788a8c6f058da2fd29af8070ee615754e1887
Awesomely Awesome;12;0;False;spee111;fe3mx6z;Super interesting Bitcoin Cash Fusion Transaction. (Financial Privacy on BCH!);enoxal;https://explorer.bitcoin.com/bch/tx/9e288b8e38578c1f70141e5f74a788a8c6f058da2fd29af8070ee615754e1887
I do always ask questions - is this the right sub to post ?;1;1;False;PanneKopp;fe2rs7t;Be in Revolt;enoi1f;https://youtu.be/ctMFr1YJ1yM
Asking questions and expecting an answer, or is more important to enquire why you are asking that question, in that you might find the answer.;2;1;False;spee111;fe2s6ua;Be in Revolt;enoi1f;https://youtu.be/ctMFr1YJ1yM
"as Albert said: ""Think !""";0;1;False;PanneKopp;fe2v6gb;Be in Revolt;enoi1f;https://youtu.be/ctMFr1YJ1yM
Albert said, spooky action at a distance :);2;2;False;spee111;fe2wami;Be in Revolt;enoi1f;https://youtu.be/ctMFr1YJ1yM
[http://images2.minutemediacdn.com/image/upload/c\_fit,f\_auto,fl\_lossy,q\_auto,w\_728/v1555927468/shape/mentalfloss/einstein11.jpg](http://images2.minutemediacdn.com/image/upload/c_fit,f_auto,fl_lossy,q_auto,w_728/v1555927468/shape/mentalfloss/einstein11.jpg);1;0;False;PanneKopp;fe2x91r;Be in Revolt;enoi1f;https://youtu.be/ctMFr1YJ1yM
u/cryptochecker;0;1;False;PanneKopp;fe2x5jj;Be in Revolt;enoi1f;https://youtu.be/ctMFr1YJ1yM
"Of [u/spee111](https://www.reddit.com/u/spee111)'s last **747** posts (**112** submissions + **635** comments), I found **698** in cryptocurrency-related subreddits. This user is most active in these subreddits:

Subreddit|No. of posts|Total karma|Average|[Sentiment](https://nlpforhackers.io/sentiment-analysis-intro/)
:--|:--|:--|:--|:--|:--|:--
r/Bitcoincash|22|93|4.2|Neutral|
r/btc|666|3497|5.3|Neutral|

See [here](https://reddit.com/r/cryptochecker/enoxqe) for more detailed results, including less active cryptocurrency subreddits.
***

^(Bleep, bloop, I'm a bot trying to help inform cryptocurrency discussion on Reddit.) ^| [^Usage](https://www.reddit.com/user/cryptochecker/comments/atbifk/how_to_use_ucryptochecker/) ^| [^FAQs](https://www.reddit.com/user/cryptochecker/comments/ascogw/faq_about_ucryptochecker_2019/) ^| [^Feedback](https://www.reddit.com/message/compose?to=jamcowl&subject=cryptochecker%20bot) ^| [^Tips](https://www.reddit.com/user/cryptochecker/comments/ataajr/tipping_ucryptochecker/)";0;0;False;cryptochecker;fe2x6pj;Be in Revolt;enoi1f;https://youtu.be/ctMFr1YJ1yM
"Take a look at  [https://support.coinbase.com/customer/portal/articles/2109597](https://support.coinbase.com/customer/portal/articles/2109597) \- there are variable Fees depending on Location and Payment Method.

Seems like you hit the 3.99% charged, for example, for Credit / Debit Card Buys:

\~240â‚¬ \* 2 \* 0.0399 = \~19.15â‚¬";15;1;False;oezibla;fe23rcb;19.19â‚¬ as Coinbase fee for buying 2 BCH?;enn4sb;https://www.reddit.com/r/btc/comments/enn4sb/1919_as_coinbase_fee_for_buying_2_bch/
Thx sir! ðŸ¤ž i will do that to. So much help from so many people i never saw a community like this. Thank you!!;1;0;False;controllerofplanetx;fe5dh3p;19.19â‚¬ as Coinbase fee for buying 2 BCH?;enn4sb;https://www.reddit.com/r/btc/comments/enn4sb/1919_as_coinbase_fee_for_buying_2_bch/
"Thank you too i will take the time tmr and set up properly my account on CBPro!
Thank you for your time! I really appreciate!";2;0;False;controllerofplanetx;fe5d7lm;19.19â‚¬ as Coinbase fee for buying 2 BCH?;enn4sb;https://www.reddit.com/r/btc/comments/enn4sb/1919_as_coinbase_fee_for_buying_2_bch/
"I really appreciate your answer!
This makes sense and i will do that of course!
Already downloaded CBpro but i had issues with the account somehow my phone doesn't remember i made the verification and everything. Anyways thank you man!";1;1;False;controllerofplanetx;fe5c72t;19.19â‚¬ as Coinbase fee for buying 2 BCH?;enn4sb;https://www.reddit.com/r/btc/comments/enn4sb/1919_as_coinbase_fee_for_buying_2_bch/
"To add to this excellent advice. 

If youâ€™re in the U.K. faster payments is near instant (few minutes) for bank transfers to CB or CBPro. Check the reference number for the two, the latter is the same as the former but with 3 extra letters at the end so itâ€™s easy to be specific which one youâ€™re sending to. Not that it matters much given transfers between the two are instant.";4;0;False;Mooks79;fe4e3v7;19.19â‚¬ as Coinbase fee for buying 2 BCH?;enn4sb;https://www.reddit.com/r/btc/comments/enn4sb/1919_as_coinbase_fee_for_buying_2_bch/
Yeah it is! For next level cool, add on a Shrimpy account and gain automatic rebalancing capabilities.;3;0;False;yebyen;fe2ps72;19.19â‚¬ as Coinbase fee for buying 2 BCH?;enn4sb;https://www.reddit.com/r/btc/comments/enn4sb/1919_as_coinbase_fee_for_buying_2_bch/
Robinhood may not charge fees;-1;1;False;doctorblumpkin;fe3bz6v;19.19â‚¬ as Coinbase fee for buying 2 BCH?;enn4sb;https://www.reddit.com/r/btc/comments/enn4sb/1919_as_coinbase_fee_for_buying_2_bch/
Ive never used it;1;1;False;doctorblumpkin;fe3bxhs;19.19â‚¬ as Coinbase fee for buying 2 BCH?;enn4sb;https://www.reddit.com/r/btc/comments/enn4sb/1919_as_coinbase_fee_for_buying_2_bch/
"I looked into Kraken recently (Iâ€™m U.K.). Although trading fees are lower than Coinbase, the fiat deposit fee is higher and the BTC price is higher, so you actually get less BTC for your money (at least for the amounts I typically purchase). 

Personally Iâ€™ve been very happy with CB, although like other people here you should definitely do your purchasing/selling via Coinbase Pro due to significantly lower fees. Itâ€™s pretty easy now they both have an app you can do it all from your phone (and both websites work well on phones anyway).";3;1;False;Mooks79;fe4g9eb;19.19â‚¬ as Coinbase fee for buying 2 BCH?;enn4sb;https://www.reddit.com/r/btc/comments/enn4sb/1919_as_coinbase_fee_for_buying_2_bch/
"Yes it is. You can transfer your deposit from Coinbase to Coinbase Pro for free (no fees) and instantly.

[https://pro.coinbase.com](https://pro.coinbase.com)

If you already have a Coinbase account, it is very easy to set up Coinbase Pro. You already have an account.

Personally, I still use Coinbase consumer frontend, or ""customer portal,"" for deposits and withdrawals, as well as the Vault functionality, and I transfer assets to Coinbase Pro for instant trading with much lower fees.  If you are doing trades regularly, it is going to be to your benefit to identify all of the points where fees can be assessed, and find ways to minimize them, but this strategy by itself is a good start without too much hassle.

You may find outdated advice that says there are 0% fees for limit orders (""maker"") on Coinbase Pro or GDAX (they are the same, GDAX went through a name change, but it has always been a facet of Coinbase Inc.) â€“Â there are fees for both limit and market orders today (""maker"" and ""taker""), they are about equal, but they are comparatively very low when compared to the fees on [Coinbase.com](https://Coinbase.com) simplified frontend interface for consumers.

Here is the fee schedule for Coinbase Pro: [https://support.pro.coinbase.com/customer/en/portal/articles/2945310-what-are-the-fees-on-coinbase-pro-](https://support.pro.coinbase.com/customer/en/portal/articles/2945310-what-are-the-fees-on-coinbase-pro-)

Others have already linked the fee schedule for Coinbase Customer Portal, this should look favorable by comparison. If you are doing low volume transactions (less than $50,000 per trade), then there is no difference between the fee you will pay as a maker or a taker, it's going to be about a half percent, with volume discounts that favor makers if'n you are a baller.";4;1;False;yebyen;fe31yra;19.19â‚¬ as Coinbase fee for buying 2 BCH?;enn4sb;https://www.reddit.com/r/btc/comments/enn4sb/1919_as_coinbase_fee_for_buying_2_bch/
"Robin hood doesnt sell actual crypto, it's more like a virtual certificate tied to the price of the crypto. You cant send or receive actual crypto. 

So it's really just a site to help people gamble on the price of things.";8;0;False;HappyHammyPie;fe3nki6;19.19â‚¬ as Coinbase fee for buying 2 BCH?;enn4sb;https://www.reddit.com/r/btc/comments/enn4sb/1919_as_coinbase_fee_for_buying_2_bch/
It's an account you use just to check on your funds and nothing else;-2;0;False;Pickle086;fe4bvmh;19.19â‚¬ as Coinbase fee for buying 2 BCH?;enn4sb;https://www.reddit.com/r/btc/comments/enn4sb/1919_as_coinbase_fee_for_buying_2_bch/
"Yes. On Coinbase Pro the fee for small buyers is 0.5 %. On Coinbase, the fee is 1.5 %. On top of that comes the credit card fees on Coinbase. Coinbase Pro is the exchange of Coinbase, Coinbase is basically the app and backend.

The preferred way is to wire transfer your euros to Coinbase Pro and then you could do a market buy to keep it the most simple. That way your fee for buying 2 BCH at the price of 240â‚¬/each is 240\*2\*0.005= 2.40 â‚¬. I live in the eurozone as well and my wire transfers have always depositted by the next office day to CB pro.";6;2;False;koohavumaki;fe30x9w;19.19â‚¬ as Coinbase fee for buying 2 BCH?;enn4sb;https://www.reddit.com/r/btc/comments/enn4sb/1919_as_coinbase_fee_for_buying_2_bch/
Pro is awesome!;6;1;False;0321Reddit;fe2kgn2;19.19â‚¬ as Coinbase fee for buying 2 BCH?;enn4sb;https://www.reddit.com/r/btc/comments/enn4sb/1919_as_coinbase_fee_for_buying_2_bch/
What is your opinion on kraken?;1;3;False;controllerofplanetx;fe2zmlf;19.19â‚¬ as Coinbase fee for buying 2 BCH?;enn4sb;https://www.reddit.com/r/btc/comments/enn4sb/1919_as_coinbase_fee_for_buying_2_bch/
Is coinbase pro the same company?;3;2;False;controllerofplanetx;fe2z9db;19.19â‚¬ as Coinbase fee for buying 2 BCH?;enn4sb;https://www.reddit.com/r/btc/comments/enn4sb/1919_as_coinbase_fee_for_buying_2_bch/
Thank you for tour time! What is an checking account?;3;2;False;controllerofplanetx;fe2z51e;19.19â‚¬ as Coinbase fee for buying 2 BCH?;enn4sb;https://www.reddit.com/r/btc/comments/enn4sb/1919_as_coinbase_fee_for_buying_2_bch/
"Yes, this is possible if you transfer your deposit to Coinbase Pro.  I stopped using the retail consumer frontend long ago.  I store some coins there, but any trading happens on the other side of Coinbase.

In fact it's no longer even necessary to mess around with limit orders, as the fees on Pro have been normalized so makers and takers pay about the same fees. Something like half a percentage point?";9;1;False;yebyen;fe2k2po;19.19â‚¬ as Coinbase fee for buying 2 BCH?;enn4sb;https://www.reddit.com/r/btc/comments/enn4sb/1919_as_coinbase_fee_for_buying_2_bch/
"I'll do that thank you for your effort! ;)
And you are right!";4;0;False;controllerofplanetx;fe2ypwg;19.19â‚¬ as Coinbase fee for buying 2 BCH?;enn4sb;https://www.reddit.com/r/btc/comments/enn4sb/1919_as_coinbase_fee_for_buying_2_bch/
"I'm a bot, *bleep*, *bloop*. Someone has linked to this thread from another place on reddit:

- [/r/cryptoandme] [#crypto #cryptonews #bitcoin @nocroom #19.19â‚¬ as Coinbase fee for buying 2 BCH?](https://www.reddit.com/r/Cryptoandme/comments/enndn3/crypto_cryptonews_bitcoin_nocroom_1919_as/)

&nbsp;*^(If you follow any of the above links, please respect the rules of reddit and don't vote in the other threads.) ^\([Info](/r/TotesMessenger) ^/ ^[Contact](/message/compose?to=/r/TotesMessenger))*";0;0;False;TotesMessenger;fe28d10;19.19â‚¬ as Coinbase fee for buying 2 BCH?;enn4sb;https://www.reddit.com/r/btc/comments/enn4sb/1919_as_coinbase_fee_for_buying_2_bch/
Coinbase sucks. There are other ones that don't charge fees;-1;1;False;doctorblumpkin;fe2t9bd;19.19â‚¬ as Coinbase fee for buying 2 BCH?;enn4sb;https://www.reddit.com/r/btc/comments/enn4sb/1919_as_coinbase_fee_for_buying_2_bch/
Use Coinbase Pro, not Coinbase.;8;1;False;koohavumaki;fe2ul3u;19.19â‚¬ as Coinbase fee for buying 2 BCH?;enn4sb;https://www.reddit.com/r/btc/comments/enn4sb/1919_as_coinbase_fee_for_buying_2_bch/
Don't use a card, use a checking account or some other way to transfer money...then put a Limit Order in for a certain price, and don't pay all those fees!!!;9;2;False;0321Reddit;fe2ahru;19.19â‚¬ as Coinbase fee for buying 2 BCH?;enn4sb;https://www.reddit.com/r/btc/comments/enn4sb/1919_as_coinbase_fee_for_buying_2_bch/
"What's really going on in the minds of Bitcoin Maximalists: ""I need to help destroy all 'shitcoins' as fast as possible so my BTC tokens will be worth more.""

The social costs of BTCs inability to fulfill Satoshi's original vision--to create a P2P, decentralized currency that bypasses the financial system--are increasingly obvious.";17;1;False;gatmac5;fe2iho7;We need to hurry up and build the infrastructure so this kind of threat is impossible.;enmkbk;https://twitter.com/paulwsj/status/1216034452037611520?s=21
ask Gaddafi, yes. Or Saddam for that matter.;7;0;False;moleccc;fe2k47f;We need to hurry up and build the infrastructure so this kind of threat is impossible.;enmkbk;https://twitter.com/paulwsj/status/1216034452037611520?s=21
It is anyways;1;0;False;svw05062009;fe4il9k;We need to hurry up and build the infrastructure so this kind of threat is impossible.;enmkbk;https://twitter.com/paulwsj/status/1216034452037611520?s=21
Yes, the American foreign policy can be labeled as such.;17;1;False;koohavumaki;fe2tujg;We need to hurry up and build the infrastructure so this kind of threat is impossible.;enmkbk;https://twitter.com/paulwsj/status/1216034452037611520?s=21
"Ask Khaddafi what happens if you challenge the petrodollar. 

This is why they made BTC a plantation.";22;1;False;NewFlipPhoneWhoDis;fe26kdx;We need to hurry up and build the infrastructure so this kind of threat is impossible.;enmkbk;https://twitter.com/paulwsj/status/1216034452037611520?s=21
"> the social costs [...] are increasingly obvious.

and huuuuge. Imagine they wouldn't have succeeded... what a different world we could already live in *today*.";11;0;False;moleccc;fe2kbvh;We need to hurry up and build the infrastructure so this kind of threat is impossible.;enmkbk;https://twitter.com/paulwsj/status/1216034452037611520?s=21
Roger whats your opinion on dogecoin?;-9;2;False;SoiledCold5;fe2kcgv;We need to hurry up and build the infrastructure so this kind of threat is impossible.;enmkbk;https://twitter.com/paulwsj/status/1216034452037611520?s=21
My opinion: 1 dogecoin = 1 dogecoin;5;1;False;Buhdumtssss;fe2o2ho;We need to hurry up and build the infrastructure so this kind of threat is impossible.;enmkbk;https://twitter.com/paulwsj/status/1216034452037611520?s=21
[deleted];-3;1;False;;fe2urtv;We need to hurry up and build the infrastructure so this kind of threat is impossible.;enmkbk;https://twitter.com/paulwsj/status/1216034452037611520?s=21
OWO;-2;0;False;SoiledCold5;fe3kf1p;We need to hurry up and build the infrastructure so this kind of threat is impossible.;enmkbk;https://twitter.com/paulwsj/status/1216034452037611520?s=21
sad reflection on BTC developers;3;0;False;Pablo_Picasho;fe3xuge;We need to hurry up and build the infrastructure so this kind of threat is impossible.;enmkbk;https://twitter.com/paulwsj/status/1216034452037611520?s=21
Petrodollar defines US foreign policy. If you don't understand this, you don't understand the dynamics of the Bitcoin mind-share war.;1;1;False;braclayrab;fe5ics6;We need to hurry up and build the infrastructure so this kind of threat is impossible.;enmkbk;https://twitter.com/paulwsj/status/1216034452037611520?s=21
Isn't this basically international terrorism?;12;2;False;Buhdumtssss;fe2npvv;We need to hurry up and build the infrastructure so this kind of threat is impossible.;enmkbk;https://twitter.com/paulwsj/status/1216034452037611520?s=21
This is great advertisement for real peer to peer cash. No wonder they are doing all they can to destroy Bitcoin.;30;1;False;SwedishSalsa;fe1xw8e;We need to hurry up and build the infrastructure so this kind of threat is impossible.;enmkbk;https://twitter.com/paulwsj/status/1216034452037611520?s=21
Dogecoin is a better payment tool than bitcoin by far lmfao;6;2;False;Buhdumtssss;fe2ny2i;We need to hurry up and build the infrastructure so this kind of threat is impossible.;enmkbk;https://twitter.com/paulwsj/status/1216034452037611520?s=21
Mine: It doesnâ€™t need to exist as it provides no benefits to anybody.;4;1;False;gatmac5;fe2kv04;We need to hurry up and build the infrastructure so this kind of threat is impossible.;enmkbk;https://twitter.com/paulwsj/status/1216034452037611520?s=21
