body;score;nb_replies;stickied;author;id;post_title;post_id;post_link
"> I think we can agree that you all would benefit from being funded. 

Did you not read the post you replied to?

Bitcoin Cash is money. Increase its value and your net-worth goes up. Its like stock, just better.";7;1;False;ThomasZander;ffd9w0x;The Infrastructure Funding Plan for Bitcoin Cash is a great idea. However, it is severely lacking in its implementation. Here is my recommendation on how to fix it:;esvun5;https://twitter.com/Justin_Bons/status/1220386819432484864?s=19
I agree with you here... not attempting to be for or against, just stating the reality.;1;0;False;c3vin;ffcrsgd;The Infrastructure Funding Plan for Bitcoin Cash is a great idea. However, it is severely lacking in its implementation. Here is my recommendation on how to fix it:;esvun5;https://twitter.com/Justin_Bons/status/1220386819432484864?s=19
"\> the majority of all SHA256 miners favor Bitcoin Cash

Am I missing something here? [coin.dance](https://coin.dance) is showing me 95.7% of SHA256 hashrate is mining BTC, with 2.5% on BCH and 1.4% on BSV.";0;2;False;jackshaftoe23;ffd31fd;The Infrastructure Funding Plan for Bitcoin Cash is a great idea. However, it is severely lacking in its implementation. Here is my recommendation on how to fix it:;esvun5;https://twitter.com/Justin_Bons/status/1220386819432484864?s=19
surely developers are the people pushing for development funding?;-1;0;False;awless;ffcnul3;The Infrastructure Funding Plan for Bitcoin Cash is a great idea. However, it is severely lacking in its implementation. Here is my recommendation on how to fix it:;esvun5;https://twitter.com/Justin_Bons/status/1220386819432484864?s=19
The freerider problem reduces the amount of effort/funds expended on development;-1;1;False;throwawayo12345;ffck6ul;The Infrastructure Funding Plan for Bitcoin Cash is a great idea. However, it is severely lacking in its implementation. Here is my recommendation on how to fix it:;esvun5;https://twitter.com/Justin_Bons/status/1220386819432484864?s=19
I think we can agree that you all would benefit from being funded. What about this way of distribution? If I mine with flowee, my dev contribution goes to you, the flowee dev. So by picking the client I decide who I fund as well. Makes sense to me as a miner, what do you think?;3;1;False;grmpfpff;ffd98wn;The Infrastructure Funding Plan for Bitcoin Cash is a great idea. However, it is severely lacking in its implementation. Here is my recommendation on how to fix it:;esvun5;https://twitter.com/Justin_Bons/status/1220386819432484864?s=19
There's really no point being for or against the miners' decision. They **will do** what they want, this is what the system entailed from the beginning.;4;1;False;J-Stodd;ffcn9wb;The Infrastructure Funding Plan for Bitcoin Cash is a great idea. However, it is severely lacking in its implementation. Here is my recommendation on how to fix it:;esvun5;https://twitter.com/Justin_Bons/status/1220386819432484864?s=19
"Yes it does have this side effect. But if we are honest, our security is that the majority of all SHA256 miners favor Bitcoin Cash (because they realize the long term business/security model of BTC was broken).
The interesting question is if they will do the same on BTC after it was a success on BCH. I doubt it and believe they have given up on BTC and they no longer want most of their ASICs working for it.";3;1;False;unknown_miner;ffcuzsk;The Infrastructure Funding Plan for Bitcoin Cash is a great idea. However, it is severely lacking in its implementation. Here is my recommendation on how to fix it:;esvun5;https://twitter.com/Justin_Bons/status/1220386819432484864?s=19
How can it be a sf blocks are final after depth of 11. Nothing can be implemented easily as a SF in bch due to Automatic reorg protection;2;0;False;Spartan3123;ffcsl3k;The Infrastructure Funding Plan for Bitcoin Cash is a great idea. However, it is severely lacking in its implementation. Here is my recommendation on how to fix it:;esvun5;https://twitter.com/Justin_Bons/status/1220386819432484864?s=19
"I like your idea of miners voting on the addresses to receive the funds directly. But it would still require the ""51% attack"" with orphaning non-payers. The benefit would be that you dont need a HK company and that you could be sure every miners voice/vote is counted.

The problem I see is that this comes years too late already and I am not sure how long the implementation of such a vote system would take.
I see this as a reaction to Blockstream corrupting on-chain scaling. The BCH network needed an answer to the question how we can believe there will be no Blockstream 2.0 on BCH.
This is the only reasonable way other than every big miner/pool developing their own implementations.";1;0;False;unknown_miner;ffcsad7;The Infrastructure Funding Plan for Bitcoin Cash is a great idea. However, it is severely lacking in its implementation. Here is my recommendation on how to fix it:;esvun5;https://twitter.com/Justin_Bons/status/1220386819432484864?s=19
"> nobody really cares whether or you or others without commitment to mining think about it.

You sound like a BSV troll.

If miners do not care about users/holders, then the price will drop therefore their revenue will decrease. I don't understand how this isn't obvious to everyone.";2;0;False;265;ffd2gzh;The Infrastructure Funding Plan for Bitcoin Cash is a great idea. However, it is severely lacking in its implementation. Here is my recommendation on how to fix it:;esvun5;https://twitter.com/Justin_Bons/status/1220386819432484864?s=19
"Best analysis since the news came out. Thank you.

> Once approved this ""smart contract"" should distribute funds proportionally directly to addresses according to miner vote over a certain pre-determined amount of blocks.

> I will only support a self funding mechanism over BCH if it is accompanied by such a voting mechanism.

> The proposal as it stands now should be rejected, to force miners to give their coinbase award to a private company through what is effectively a 51% attack is beyond perverse.";2;0;False;Neutral_User_Name;ffcn55s;The Infrastructure Funding Plan for Bitcoin Cash is a great idea. However, it is severely lacking in its implementation. Here is my recommendation on how to fix it:;esvun5;https://twitter.com/Justin_Bons/status/1220386819432484864?s=19
"> what every good self funding mechanism needs is a decentralized voting mechanism to determine how these funds get spend

The last dev fundraiser broke projects out separately. Full-node implementations had their own category, and there was a ""general fund"" as well. The entire ecosystem could then donate to any section. This WAS an effective vote. We can use that as a template for this new $6M injection. Just distribute funds proportionally. View it as an extension of the last dev fundraiser because not much has changed.

People need to stop over complicating things which are not so complex.";3;0;False;cryptos4pz;ffcjazp;The Infrastructure Funding Plan for Bitcoin Cash is a great idea. However, it is severely lacking in its implementation. Here is my recommendation on how to fix it:;esvun5;https://twitter.com/Justin_Bons/status/1220386819432484864?s=19
"Look into Gitcoin grant matching done on Ethereum.

BCH users vote with their money into funding proposals created by the Devs.  These voluntary donations then get matched (quadratically or linearly) by the Dev fund.

The advantages of this include imposing an economic opportunity cost for voting where the dev funds go, so it somewhat reduces sybil attacks whilst allowing full community participation.";4;0;False;SpacePirateM;ffd65ew;The Infrastructure Funding Plan for Bitcoin Cash is a great idea. However, it is severely lacking in its implementation. Here is my recommendation on how to fix it:;esvun5;https://twitter.com/Justin_Bons/status/1220386819432484864?s=19
"> Once approved this ""smart contract"" should distribute funds proportionally directly to addresses according to miner vote over a certain pre-determined amount of blocks.

If this ends up as 100 miners collectively distributing 100 coinbases with a proportional voting system, then we might as well stick to the status quo and have each miner decide individually for their own coinbase.";6;0;False;BigBlockIfTrue;ffcj18z;The Infrastructure Funding Plan for Bitcoin Cash is a great idea. However, it is severely lacking in its implementation. Here is my recommendation on how to fix it:;esvun5;https://twitter.com/Justin_Bons/status/1220386819432484864?s=19
"Flowee [replied](https://twitter.com/FloweeTheHub/status/1220397882064408576)

> Bitcoin Cash is money, it is self-funding by design. Everyone that increases its value gets the reward. In the shape of the value of the coin itself rising.

> Why do you think that infrastructure funding is wanted?  
> Flowee builds more infrastructure software than most, no funding.";24;3;False;ThomasZander;ffcjhuf;The Infrastructure Funding Plan for Bitcoin Cash is a great idea. However, it is severely lacking in its implementation. Here is my recommendation on how to fix it:;esvun5;https://twitter.com/Justin_Bons/status/1220386819432484864?s=19
"I mean this is great and all, but nobody really cares whether or you or others without commitment to mining think about it.  If you want to stop it, you need to begin forming your own coalition of miners to stop it, or fund the mining rigs yourself.  

The votes are with CPU.";0;2;False;c3vin;ffcj6mx;The Infrastructure Funding Plan for Bitcoin Cash is a great idea. However, it is severely lacking in its implementation. Here is my recommendation on how to fix it:;esvun5;https://twitter.com/Justin_Bons/status/1220386819432484864?s=19
They should just change it to a voluntary process, not mandatory.;1;1;False;squarepush3r;ffd0bv5;The Infrastructure Funding Plan for Bitcoin Cash is a great idea. However, it is severely lacking in its implementation. Here is my recommendation on how to fix it:;esvun5;https://twitter.com/Justin_Bons/status/1220386819432484864?s=19
"I love self funding mechanisms and what every good self funding mechanism needs is a decentralized voting mechanism to determine how these funds get spend.

My recommendation is that we take more time to do this properly & create a voting mechanism for the distribution of these funds.

Specifically we need some sort of ""smart contract"", implemented as a hard fork which will require a super majority of miners for initial approval.

Once approved this ""smart contract"" should distribute funds proportionally directly to addresses according to miner vote over a certain pre-determined amount of blocks.

I will only support a self funding mechanism over BCH if it is accompanied by such a voting mechanism.

The proposal as it stands now should be rejected, to force miners to give their coinbase award to a private company through what is effectively a 51% attack is beyond perverse.

It also did not help to quote Deng Xiao Ping, a notourous tyrant, as a positive example of non-debate.

We absolutly need to debate this ad-nauseum, this might very well be our moment of truth, let us show the world how good blockchain governance is done.";17;8;False;VeritasSapere;ffcfvi2;The Infrastructure Funding Plan for Bitcoin Cash is a great idea. However, it is severely lacking in its implementation. Here is my recommendation on how to fix it:;esvun5;https://twitter.com/Justin_Bons/status/1220386819432484864?s=19
Dash seems to have figured this out.;2;0;False;DrGarbinsky;ffd0zmu;The Infrastructure Funding Plan for Bitcoin Cash is a great idea. However, it is severely lacking in its implementation. Here is my recommendation on how to fix it:;esvun5;https://twitter.com/Justin_Bons/status/1220386819432484864?s=19
I think funding hard working BCH devs is a great idea, but will this mechanism not have the side effect of reducing BCH mining profitability, which will reduce total network hashrate, and as a result the security of the whole network?;2;1;False;jackshaftoe23;ffcsxr9;The Infrastructure Funding Plan for Bitcoin Cash is a great idea. However, it is severely lacking in its implementation. Here is my recommendation on how to fix it:;esvun5;https://twitter.com/Justin_Bons/status/1220386819432484864?s=19
its bad idea and controversial soft fork aint way to do it!;5;1;False;ultimatehub24;ffck0o0;The Infrastructure Funding Plan for Bitcoin Cash is a great idea. However, it is severely lacking in its implementation. Here is my recommendation on how to fix it:;esvun5;https://twitter.com/Justin_Bons/status/1220386819432484864?s=19
Obvious troll is obvious.;7;0;False;J-Stodd;ffced6z;Why only 12.5% mining cartel tax?;esvam1;https://www.reddit.com/r/btc/comments/esvam1/why_only_125_mining_cartel_tax/
More money doesnâ€™t always solve all the problems.;4;0;False;ftoole;ffcco8x;Why only 12.5% mining cartel tax?;esvam1;https://www.reddit.com/r/btc/comments/esvam1/why_only_125_mining_cartel_tax/
You think they are going to stop at 12.5%?  LMAO!;3;0;False;EnglishBulldog;ffckif2;Why only 12.5% mining cartel tax?;esvam1;https://www.reddit.com/r/btc/comments/esvam1/why_only_125_mining_cartel_tax/
We need money in order to copy/paste code from Core!;1;0;False;araicher;ffchmrq;Why only 12.5% mining cartel tax?;esvam1;https://www.reddit.com/r/btc/comments/esvam1/why_only_125_mining_cartel_tax/
"I have seen this type of thing too many times to count. Legal cannabis operators cannot work with certain banks or payment providers since it is still federally illegal. 

This is exactly why crypto was invented. Prevent government interference on commerce.";5;1;False;bahkins313;ffcb824;The cannabis industry is a huge opportunity to implement crypto payments;esv5i2;/r/weedbiz/comments/esfkxw/online_payment_processors_for_cannabis_related/
Yes, but why are they so slow to embrace cryptomoney? There must be a reason;4;2;False;ErdoganTalk;ffcins5;The cannabis industry is a huge opportunity to implement crypto payments;esv5i2;/r/weedbiz/comments/esfkxw/online_payment_processors_for_cannabis_related/
Lot of people have thought of this and spun up dozens of coins dedicated to the idea....yet the same problem always exists. They need to pay suppliers and workers in USD. Using banks is problematic, so cash is really the only option. If it was easier to legally convert large amounts of crypto to USD cash, without using a bank, they could really jump on crypto.;2;1;False;logicordie;ffd0h9e;The cannabis industry is a huge opportunity to implement crypto payments;esv5i2;/r/weedbiz/comments/esfkxw/online_payment_processors_for_cannabis_related/
I've been saying for years. People are too stupid to understand this. Most people do not even know what money is. They literally have no idea or care. We are dealing with morons.;3;0;False;BooksAndBooksAnd;ffcsrfh;The cannabis industry is a huge opportunity to implement crypto payments;esv5i2;/r/weedbiz/comments/esfkxw/online_payment_processors_for_cannabis_related/
My guess is they are already operating in a legal gray area so they don't want to take on more risk. I would accept crypto if i had a business.;3;0;False;No1indahoodg;ffcu1gx;The cannabis industry is a huge opportunity to implement crypto payments;esv5i2;/r/weedbiz/comments/esfkxw/online_payment_processors_for_cannabis_related/
"They are scared it is risky. Or they donâ€™t really understand it and how easy BCH can be. Maybe the got scared by the BTC boom and crash and donâ€™t want to rely on something not stable.

Iâ€™m not sure, but thatâ€™s a good question to be asking";2;0;False;bahkins313;ffckirp;The cannabis industry is a huge opportunity to implement crypto payments;esv5i2;/r/weedbiz/comments/esfkxw/online_payment_processors_for_cannabis_related/
"> How else might we find funding for infrastructure development?

Flowee has been building an immense amount of infrastructure software and services. Donations are used for hosting this infrastructure.

What we want is not money, what we want is people writing code / docs and other such things. Contributions where you share your knowledge are infinitely more valuable than some funds.

Nobody is asking for funding (well, one guy is), so what makes you think we need 'alternatives' ?

Maybe the problem doesn't actually exist.";5;1;False;ThomasZander;ffccj0e;Let's discuss alternatives to the controversial mining cartel proposal;esuwqx;https://www.reddit.com/r/btc/comments/esuwqx/lets_discuss_alternatives_to_the_controversial/
"When a miner pays from coinbase it's not really going out of their pockets. It comes out of the hash rate. If I'm a minor that makes $1,000 a day from the coinbase and fees, I might put $600 of that into electricity and hash rate. If there is a development fee added of say $100, now I'm going to put $500 back into the electricity. The money that I might make by the end of the day after all the bills are paid might not change at all.


I think it's kind of similar to how we have the halving. The coinbase used to be 50 coins now it's 12... Where is the 38 other coins go? Is it coming out of the pocket of the miners? No. Mostly it's the hashtag that's down.";1;0;False;fromsmart;ffcatbv;Let's discuss alternatives to the controversial mining cartel proposal;esuwqx;https://www.reddit.com/r/btc/comments/esuwqx/lets_discuss_alternatives_to_the_controversial/
If Amaury wasn't speaking for ALL of ABC I'm sure the other members would have said something. It's obvious that ABC and BU would rather not work for free.;3;1;False;steeevemadden;ffci51n;Let's discuss alternatives to the controversial mining cartel proposal;esuwqx;https://www.reddit.com/r/btc/comments/esuwqx/lets_discuss_alternatives_to_the_controversial/
"BU gives various developers a good salary. They are not working for free.

ABC got 800 BCH last fundraising, I don't think they are working for free either. Although nobody has given any indication what that money is being used for. But that hardly is a reason to raise more money, is it?";4;0;False;ThomasZander;ffcig4h;Let's discuss alternatives to the controversial mining cartel proposal;esuwqx;https://www.reddit.com/r/btc/comments/esuwqx/lets_discuss_alternatives_to_the_controversial/
The road to hell is paved with good intentions.;9;0;False;BigBlockIfTrue;ffcdwbu;Prepare for another split. It's the only governance mechanism that defines what will become Bitcoin.;esumzr;https://www.reddit.com/r/btc/comments/esumzr/prepare_for_another_split_its_the_only_governance/
"No doubt that people that want to hurt Bitcoin cash will absolutely uses opportunity to split Bitcoin cash. 

Just because this mechanism can in the future theoretically be used to do evil doesn't mean that you throw the baby out with the bathwater. Is THIS proposal bad for Bitcoin cash I don't think it is because it's funding development. If in the future a similar mechanism is used to do something that I think is wrong then I will support the fork, this is not the case today so we shouldn't go down the slippery slope.";6;0;False;fromsmart;ffcb8bu;Prepare for another split. It's the only governance mechanism that defines what will become Bitcoin.;esumzr;https://www.reddit.com/r/btc/comments/esumzr/prepare_for_another_split_its_the_only_governance/
And if no chain split is created in May then...?;2;1;False;TyMyShoes;ffc8i6p;Prepare for another split. It's the only governance mechanism that defines what will become Bitcoin.;esumzr;https://www.reddit.com/r/btc/comments/esumzr/prepare_for_another_split_its_the_only_governance/
There's a lot of trolls coming out of the woodworks, trying to sow division for the sake of division.;1;0;False;J-Stodd;ffcek6a;Prepare for another split. It's the only governance mechanism that defines what will become Bitcoin.;esumzr;https://www.reddit.com/r/btc/comments/esumzr/prepare_for_another_split_its_the_only_governance/
"\> Never ever skip a good and healthy debate!!!

We have 113 days, haven't we?";0;0;False;spe59436-bcaoo;ffce5fz;Prepare for another split. It's the only governance mechanism that defines what will become Bitcoin.;esumzr;https://www.reddit.com/r/btc/comments/esumzr/prepare_for_another_split_its_the_only_governance/
u/cryptochecker;-8;1;False;J-Stodd;ffceoar;Prepare for another split. It's the only governance mechanism that defines what will become Bitcoin.;esumzr;https://www.reddit.com/r/btc/comments/esumzr/prepare_for_another_split_its_the_only_governance/
I assume people will rebalance appropriately.;1;1;False;chalbersma;ffc9lwg;Prepare for another split. It's the only governance mechanism that defines what will become Bitcoin.;esumzr;https://www.reddit.com/r/btc/comments/esumzr/prepare_for_another_split_its_the_only_governance/
"Of [u/gr8ful4](https://www.reddit.com/u/gr8ful4)'s last **398** posts (**24** submissions + **374** comments), I found **392** in cryptocurrency-related subreddits. This user is most active in these subreddits:

Subreddit|No. of posts|Total karma|Average|[Sentiment](https://nlpforhackers.io/sentiment-analysis-intro/)
:--|:--|:--|:--|:--|:--|:--
r/BitcoinMarkets|275|824|3.0|Neutral|
r/btc|51|1150|22.5|Neutral|
r/Monero|24|179|7.5|Neutral|
r/xmrtrader|36|207|5.8|Neutral|

See [here](https://reddit.com/r/cryptochecker/esvop2) for more detailed results, including less active cryptocurrency subreddits.
***

^(Bleep, bloop, I'm a bot trying to help inform cryptocurrency discussion on Reddit.) ^| [^Usage](https://www.reddit.com/user/cryptochecker/comments/atbifk/how_to_use_ucryptochecker/) ^| [^FAQs](https://www.reddit.com/user/cryptochecker/comments/ascogw/faq_about_ucryptochecker_2019/) ^| [^Feedback](https://www.reddit.com/message/compose?to=jamcowl&subject=cryptochecker%20bot) ^| [^Tips](https://www.reddit.com/user/cryptochecker/comments/ataajr/tipping_ucryptochecker/)";-2;0;False;cryptochecker;ffceoxt;Prepare for another split. It's the only governance mechanism that defines what will become Bitcoin.;esumzr;https://www.reddit.com/r/btc/comments/esumzr/prepare_for_another_split_its_the_only_governance/
If there is consensus around this plan and no split happens in May... then surely this will be a huge bullish event for BCH. 6m is more than double what bitcoin.com has helped provide since BCH was created. So much was done with bitcoin.com funds, imagine triple that.;-1;1;False;TyMyShoes;ffcagxe;Prepare for another split. It's the only governance mechanism that defines what will become Bitcoin.;esumzr;https://www.reddit.com/r/btc/comments/esumzr/prepare_for_another_split_its_the_only_governance/
Other currencies have better, more well funded, more mature develoent foundations and mechanisms. Ours would be juvinile in comparison.;0;1;False;chalbersma;ffchg1n;Prepare for another split. It's the only governance mechanism that defines what will become Bitcoin.;esumzr;https://www.reddit.com/r/btc/comments/esumzr/prepare_for_another_split_its_the_only_governance/
Comparing the 6m to any other coin is wrong. Compare the 6m to the bitcoin.com funds from the past. If it's a significant increase then I would expect a price appreciation.;1;0;False;TyMyShoes;ffcnxeh;Prepare for another split. It's the only governance mechanism that defines what will become Bitcoin.;esumzr;https://www.reddit.com/r/btc/comments/esumzr/prepare_for_another_split_its_the_only_governance/
Properly funded development will increase the value of BCH, which is actually good for miners in the long run.;7;0;False;Uttfttufftcytfcctf;ffcqhtk;Game Theory of the Dev Tax;esu25r;https://www.reddit.com/r/btc/comments/esu25r/game_theory_of_the_dev_tax/
I'm speculating on how changes to incentives will impact the future, which is what Game Theory is all about. Sorry if that was unclear.;2;1;False;mrxsdcuqr7x284k6;ffcihz6;Game Theory of the Dev Tax;esu25r;https://www.reddit.com/r/btc/comments/esu25r/game_theory_of_the_dev_tax/
The outside force that would be attacking here is your anti-BCH mining hash moving from BTC-Mining to BCH-chain attacking.;1;0;False;Big_Bubbler;ffd9214;Game Theory of the Dev Tax;esu25r;https://www.reddit.com/r/btc/comments/esu25r/game_theory_of_the_dev_tax/
Civil war? It's been a day.;3;1;False;TyMyShoes;ffcelo6;Game Theory of the Dev Tax;esu25r;https://www.reddit.com/r/btc/comments/esu25r/game_theory_of_the_dev_tax/
"Sure, when BCH was threatened by an outside force (BSV), the interests of BCH miners were aligned. This time we're talking about a civil war between BCH factions. Cartel miners will redirect some hash to support the Dev Tax fork, and other pools will support No Dev Tax to avoid having BTC value redirected to BCH development. That inevitably leads to a hash war where only one outcome is certain: everyone mining BCH will be losing money.

This whole thing feels like the conflict in Syria... a proxy war.

* Jiang representing the ruling government
* No Dev Tax BCH pools are the rebels
* Redirected hash supporting Dev Tax is Russian interference
* Redirected hash supporting No Dev Tax is US interference";1;2;False;mrxsdcuqr7x284k6;ffcedco;Game Theory of the Dev Tax;esu25r;https://www.reddit.com/r/btc/comments/esu25r/game_theory_of_the_dev_tax/
I think you underestimate the BCH support in SHA256 miners. In the BSV split how many exa hashes moved over to support BCH? Miners also got together to save those 'stolen Segregated Witness' coins. Jiang Zhuo'er himself said in the AMA they will move BTC has over to support this plan.;8;1;False;TyMyShoes;ffcanqr;Game Theory of the Dev Tax;esu25r;https://www.reddit.com/r/btc/comments/esu25r/game_theory_of_the_dev_tax/
I think you overestimate the willingness of miners to mine at a loss, but we'll have to wait and see.;2;1;False;mrxsdcuqr7x284k6;ffcagc9;Game Theory of the Dev Tax;esu25r;https://www.reddit.com/r/btc/comments/esu25r/game_theory_of_the_dev_tax/
