body;score;nb_replies;stickied;author;id;post_title;post_id;post_link
"Of [u/Life-Observer](https://www.reddit.com/u/Life-Observer)'s last **12** posts (**1** submissions + **11** comments), I found **3** in cryptocurrency-related subreddits. This user is most active in these subreddits:

Subreddit|No. of posts|Total karma|Average|[Sentiment](https://nlpforhackers.io/sentiment-analysis-intro/)
:--|:--|:--|:--|:--|:--|:--
r/Bitcoin|1|2|2.0|Neutral|
r/btc|2|5|2.5|Neutral|

See [here](https://reddit.com/r/cryptochecker/esuszc) for more detailed results, including less active cryptocurrency subreddits.
***

^(Bleep, bloop, I'm a bot trying to help inform cryptocurrency discussion on Reddit.) ^| [^Usage](https://www.reddit.com/user/cryptochecker/comments/atbifk/how_to_use_ucryptochecker/) ^| [^FAQs](https://www.reddit.com/user/cryptochecker/comments/ascogw/faq_about_ucryptochecker_2019/) ^| [^Feedback](https://www.reddit.com/message/compose?to=jamcowl&subject=cryptochecker%20bot) ^| [^Tips](https://www.reddit.com/user/cryptochecker/comments/ataajr/tipping_ucryptochecker/)";2;0;False;cryptochecker;ffc8sxe;Store of Value Update: Bitcoin Core (BTC) Dropped from $9,200 t0 $8,300 in 3 Days;estk4h;https://i.redd.it/vej6kipybjc41.png
"No-Debate may work in some cultural environments, but open source projects are build on transparency. The current approach left some questions that needs to be addressed. 

Those who made the proposal are aware about the issues and nothing is finalized. It depends who they deal with the feedback.";3;1;False;Egon_1;ffc2peb;Store of Value Update: Bitcoin Core (BTC) Dropped from $9,200 t0 $8,300 in 3 Days;estk4h;https://i.redd.it/vej6kipybjc41.png
because they have not decided?;1;1;False;Egon_1;ffc2r7y;Store of Value Update: Bitcoin Core (BTC) Dropped from $9,200 t0 $8,300 in 3 Days;estk4h;https://i.redd.it/vej6kipybjc41.png
This post has nothing to do with your concerns, there's about 9 other threads for that. You're trolling.;1;0;False;J-Stodd;ffcmwcr;Store of Value Update: Bitcoin Core (BTC) Dropped from $9,200 t0 $8,300 in 3 Days;estk4h;https://i.redd.it/vej6kipybjc41.png
Sounds like your opposed to the change as brought forward (but convincible I'd certain fundamental changes were made). Is that a fair summary of your position?;1;0;False;chalbersma;ffc3h0c;Store of Value Update: Bitcoin Core (BTC) Dropped from $9,200 t0 $8,300 in 3 Days;estk4h;https://i.redd.it/vej6kipybjc41.png
Or they didn't want to go on the record saying no.;1;0;False;chalbersma;ffc3lbb;Store of Value Update: Bitcoin Core (BTC) Dropped from $9,200 t0 $8,300 in 3 Days;estk4h;https://i.redd.it/vej6kipybjc41.png
developer funding mechanism sucks;2;0;False;ultimatehub24;ffcka54;Thoughts on Developers Funding;est0t5;https://read.cash/@SharkySharkdog/thoughts-on-developer-funding-25e811b2
"If we won't get a chance to upgrade to a client without this change, we will have another hash war. AGAIN. I hope everyone is aware of this.

u/memorydealers I'm sorry but as a small BCH miner I'm not ready for another hash war yet. I hope you have a shit load of transparent information for us in the following days.";34;4;False;grmpfpff;ffbxog7;About the proposed Dev fund change from the perspective of a small BCH miner;esswk0;https://www.reddit.com/r/btc/comments/esswk0/about_the_proposed_dev_fund_change_from_the/
"The flaw in your speculation is that the hash rate that might switch to BTC is so small we wont even be able to measure it. BTC hash rate varies between 95Ehash and 125 Ehash. a 50% reduction in BCH hash rate would make BTC hash rate grow 2Ehash.

BCH wonÂ´t gain anything from losing hash rate except literally losing hash rate. Miners will still switch to BCH with their auto switches whenever its more profitable.";1;1;False;grmpfpff;ffd7giz;About the proposed Dev fund change from the perspective of a small BCH miner;esswk0;https://www.reddit.com/r/btc/comments/esswk0/about_the_proposed_dev_fund_change_from_the/
"A majority in Bitcoin or Monero or any other PoW coin is only a majority because they have miners backing their choices. No entity can do anything without miner support. Hong Kong Agreement? Failed because miners pussied out. Asics on Monero? Failed because the majority of the miners went with the devs. Stealing Segwit funds? Failed because the majority of the hash rate orphaned the blocks.

Sure, I get your point though, if Exchanges throw themselves on one side and the reddit fanboys start shouting out loud, that side will have it easier in the media and on the market. But look at BSV. Why did it survive? Because miners are backing it. And as long as the hash rate is this high, the price will stay this high.

If exchanges and businesses, and the community could do shit though without miners being involved, then we wouldnÂ´t be discussing Bitcoin Cash now, but Bitcoin Segwit2X.";2;1;False;grmpfpff;ffcu19i;About the proposed Dev fund change from the perspective of a small BCH miner;esswk0;https://www.reddit.com/r/btc/comments/esswk0/about_the_proposed_dev_fund_change_from_the/
I googled this topic by now and found out that multiple outputs are possible. Sorry, my mistake.;2;1;False;grmpfpff;ffcx0ea;About the proposed Dev fund change from the perspective of a small BCH miner;esswk0;https://www.reddit.com/r/btc/comments/esswk0/about_the_proposed_dev_fund_change_from_the/
"Ok, I just found an old bitcointalk discussion about this. I wasnÂ´t aware of this.

Ok, so we are going to see another hash war between supporters and miners who donÂ´t... because we can I guess....";1;1;False;grmpfpff;ffcv6mq;About the proposed Dev fund change from the perspective of a small BCH miner;esswk0;https://www.reddit.com/r/btc/comments/esswk0/about_the_proposed_dev_fund_change_from_the/
"A soft fork happens any time there's a rule change (a fork) and the new rules are exclusively more restrictive than the old rules. This means that people that only knew the old rules (older clients) will still find blocks following the new rules valid, making a soft fork backwards compatible. So if there's a new, even unwritten, rule restricting block validity even further, it's the definition of a soft fork. The problem of a soft fork is that it can get messy unless you have wide consensus. 51% of the hashrate is obviously enough, but is messy due to the number of reorgs happening.

As Amaury once said, [""If they do something that you like, then it's a soft fork; if they do something that you do not like, then it's a 51% attack.""](https://np.reddit.com/r/Bitcoincash/comments/btoxnr/if_they_do_something_that_you_like_then_its_a/)";1;1;False;rinexc;ffcylz6;About the proposed Dev fund change from the perspective of a small BCH miner;esswk0;https://www.reddit.com/r/btc/comments/esswk0/about_the_proposed_dev_fund_change_from_the/
^ This;4;0;False;BTC_StKN;ffcwbtf;About the proposed Dev fund change from the perspective of a small BCH miner;esswk0;https://www.reddit.com/r/btc/comments/esswk0/about_the_proposed_dev_fund_change_from_the/
Sticking fingers in your ears and closing your eyes is what you do best huh?;-2;1;False;psychedelicbart;ffcqfkq;About the proposed Dev fund change from the perspective of a small BCH miner;esswk0;https://www.reddit.com/r/btc/comments/esswk0/about_the_proposed_dev_fund_change_from_the/
"A miner controlled coin is a nightmare. It's like letting police make laws, like letting aircraft manufacturers self certify.

Cryptocurrency is supposed to be a consensus and that's very different from an oligarchy which is where this is going.";-4;1;False;Pretagonist;ffcsepr;About the proposed Dev fund change from the perspective of a small BCH miner;esswk0;https://www.reddit.com/r/btc/comments/esswk0/about_the_proposed_dev_fund_change_from_the/
"Indeed, bad information on my part, sorry! For simplicity, assume the reward is 12.5BCH all the way through. The ""tax"" or whatever they want to call it is $500 per block. $6M would take 3-4 months.";1;1;False;luminairex;ffdg4mt;About the proposed Dev fund change from the perspective of a small BCH miner;esswk0;https://www.reddit.com/r/btc/comments/esswk0/about_the_proposed_dev_fund_change_from_the/
"The current strategy of the BCH Majority miner's has been to purposely keep the lowest possible hash without being easily attacked. They've been maximizing profitability for a while now.

With this protocol change we can expect profit seeking miner's to drop  BCH. This encourages more mining on BTC in turn so it strengths BCH war chests at the expense of BTC.";1;1;False;curryandrice;ffd64ol;About the proposed Dev fund change from the perspective of a small BCH miner;esswk0;https://www.reddit.com/r/btc/comments/esswk0/about_the_proposed_dev_fund_change_from_the/
"This is not true. The economic majority can change the pow algo with a hardfork.

A practical example is when monero changed the pow algo when jihan tried to release asics for it.";2;1;False;WippleDippleDoo;ffcp40w;About the proposed Dev fund change from the perspective of a small BCH miner;esswk0;https://www.reddit.com/r/btc/comments/esswk0/about_the_proposed_dev_fund_change_from_the/
">  I don't think you can just divert part of that to another address without a protocol change

I believe you are incorrect.

The validation (see GetValueOut() method in primitives/transaction.cpp and ""bad-cb-amount"" check in validation.cpp in ABC code) iterates over outputs and checks that they don't sum up to more than the expected subsidy.

Also, in Bitcoin's history there have been pools like Eligius which outputt from coinbase inputs directly to multiple recipients.

Whether current pool software is set up to handle it conveniently is another matter, but from a protocol standpoint it certainly seems allowed as long as you're not outputting an amount that doesn't add up right.";2;1;False;LovelyDay;ffcwswl;About the proposed Dev fund change from the perspective of a small BCH miner;esswk0;https://www.reddit.com/r/btc/comments/esswk0/about_the_proposed_dev_fund_change_from_the/
Sure, why not?;1;1;False;tcrypt;ffcuuz5;About the proposed Dev fund change from the perspective of a small BCH miner;esswk0;https://www.reddit.com/r/btc/comments/esswk0/about_the_proposed_dev_fund_change_from_the/
look like i don't want to have this in history of bitcoin...;1;0;False;bchtrue;ffcslwe;About the proposed Dev fund change from the perspective of a small BCH miner;esswk0;https://www.reddit.com/r/btc/comments/esswk0/about_the_proposed_dev_fund_change_from_the/
"I just googled and found that multiple outputs are possible. Ok. But why do you call it soft fork. Its simply a collaboration of pools picking which blocks they will accept and which they wonÂ´t and orphan them. 

Segwit was a soft fork. Since the pools wont accept blocks that are not ""compatible"" with their proposal, but orphan them, its not a soft fork, but an attack on the network.";1;1;False;grmpfpff;ffcwlrq;About the proposed Dev fund change from the perspective of a small BCH miner;esswk0;https://www.reddit.com/r/btc/comments/esswk0/about_the_proposed_dev_fund_change_from_the/
"> Do you know anything I don't know or are you just pulling all these assumptions out of your ass?

He's a known BSV troll, he pulls shit out of his ass all the time. Your time is better spent elsewhere.";8;2;False;jonas_h;ffcfpxh;About the proposed Dev fund change from the perspective of a small BCH miner;esswk0;https://www.reddit.com/r/btc/comments/esswk0/about_the_proposed_dev_fund_change_from_the/
I know. I'm getting pretty haggard too. Get some rest. I think I need some too.;1;0;False;curryandrice;ffdf9j5;About the proposed Dev fund change from the perspective of a small BCH miner;esswk0;https://www.reddit.com/r/btc/comments/esswk0/about_the_proposed_dev_fund_change_from_the/
"Ok, let's take a quick look:

We have applications limited by BTC little OP RETURN, like OMNI or timestamps. 
Coin join: we have far better implementations in BCH.
Schnorr? Keep waiting. Bulletproofs? Keep waiting. Taproot? Keep waiting. Or don't, anyway Taproot is something with limited use cases. The same with many improvements in BTC that will come in 18 months (TM).
Lightning? Irrelevant, use Liquid.";3;1;False;libertarian0x0;ffcq8jh;About the proposed Dev fund change from the perspective of a small BCH miner;esswk0;https://www.reddit.com/r/btc/comments/esswk0/about_the_proposed_dev_fund_change_from_the/
You should have told me that in 2017 and I would have gone the BU foundation route until I converted all to BCH at 0.025 and have ten times as much BCH today....;2;0;False;grmpfpff;ffd84fo;About the proposed Dev fund change from the perspective of a small BCH miner;esswk0;https://www.reddit.com/r/btc/comments/esswk0/about_the_proposed_dev_fund_change_from_the/
"Dead, no. It still works too well to die and there is too much development happening that is beneficial for the entire crypto space, like cash fusion.

But some miners would leave and it would leave a very sour aftertaste if this doesn't go smooth.

It might also have positive effects. Like a very clear signal that miners control Bitcoin Cash, if enough hash rate gets behind it, and that they care about development. in contrast to Bitcoin where miners are whimpy protestors that still bow down and lick the shoes of Blockstream.";4;1;False;grmpfpff;ffc79iw;About the proposed Dev fund change from the perspective of a small BCH miner;esswk0;https://www.reddit.com/r/btc/comments/esswk0/about_the_proposed_dev_fund_change_from_the/
Feel free to explain it to me, I am all ears.;4;1;False;grmpfpff;ffcus55;About the proposed Dev fund change from the perspective of a small BCH miner;esswk0;https://www.reddit.com/r/btc/comments/esswk0/about_the_proposed_dev_fund_change_from_the/
CanÂ´t mine solo anymore and have been keeping my mining operation small so I wouldnt be pressured on selling coins at specific times, especially in times like this, to keep my mining operation running. Cashing out some coins at the peak did the job to keep me running for a while more without worrying.;3;0;False;grmpfpff;ffcsy2e;About the proposed Dev fund change from the perspective of a small BCH miner;esswk0;https://www.reddit.com/r/btc/comments/esswk0/about_the_proposed_dev_fund_change_from_the/
"I think you have missed the halvening of the block reward for your calculation that is going to happen in around 75 days, and the current block reward is 12.5 BCH, not 25BCH anymore. It started with 50BCH in 2009 and this is going to be the third halvening event.

And to your other question: BCH is the best of the Bitcoin forks in my opinion.  I donÂ´t want to have more BTC that I canÂ´t move in time when I want to sell it at the end of the next bull run. I donÂ´t want to have anything to do with CSW and his fork. So I am sticking to Bitcoin Cash, maybe until a better fork comes along, maybe until I canÂ´t afford mining anymore.

&#x200B;

Oh, and collecting money to fund our devs is actually a good thing I believe.";2;1;False;grmpfpff;ffdf9va;About the proposed Dev fund change from the perspective of a small BCH miner;esswk0;https://www.reddit.com/r/btc/comments/esswk0/about_the_proposed_dev_fund_change_from_the/
"i guess with ""we"" you mean the entire BCH network.

48% of BCH hash rate of the last weeks and months has been provided by unknown miners. Unless there is something we dont know, the 4 pools barely have enough hash rate combined to enforce their proposal on the entire network.

We dont know what the unkown miners think of this proposal. We dont know what the other pools think. We dont know how much hash rate will step in to disrupt the enforcement of the proposal.

Claiming that we have more than enough hash rate to ensure control, when just half of the entire BCH hash rate has announced this proposal today, is just wrong.";1;1;False;grmpfpff;ffd3d17;About the proposed Dev fund change from the perspective of a small BCH miner;esswk0;https://www.reddit.com/r/btc/comments/esswk0/about_the_proposed_dev_fund_change_from_the/
">would make the community kick them out by a pow change.

The ""community"" can't do anything, only miners can. A PoW change is irrational.

All that needs to happen to drown this proposal is to redirect hash power to the pools that don't support it. This will either result in a fork if there is a client available that doesn't support it. Or it will result in a hash war with those four pools having all their blocks orphaned by the pools that don't support it. The longer chain wins.";5;1;False;grmpfpff;ffckxu6;About the proposed Dev fund change from the perspective of a small BCH miner;esswk0;https://www.reddit.com/r/btc/comments/esswk0/about_the_proposed_dev_fund_change_from_the/
"That's what I was thinking but I believe that newly minted climbs could not be moved for 100 blocks.

So well they wait till the miner mines 101 blocks to start orphaning?";1;0;False;seanthenry;ffckvtu;About the proposed Dev fund change from the perspective of a small BCH miner;esswk0;https://www.reddit.com/r/btc/comments/esswk0/about_the_proposed_dev_fund_change_from_the/
"The block reward goes to one single address, the address of the miner. I don't think you can just divert part of that to another address without a protocol change.....

Edit: I am wrong here, multiple outputs are possible.";1;1;False;grmpfpff;ffck5vn;About the proposed Dev fund change from the perspective of a small BCH miner;esswk0;https://www.reddit.com/r/btc/comments/esswk0/about_the_proposed_dev_fund_change_from_the/
So you mean the coinbase can contain a tx to the designated dev fund?;1;1;False;grmpfpff;ffcubn9;About the proposed Dev fund change from the perspective of a small BCH miner;esswk0;https://www.reddit.com/r/btc/comments/esswk0/about_the_proposed_dev_fund_change_from_the/
"I'm not sure yet what I should think about this. There is far too many things still unanswered to draw conclusive opinions.

Just one thing is clear: it's yet another fucked up announcement that is not helping.";3;1;False;grmpfpff;ffca5om;About the proposed Dev fund change from the perspective of a small BCH miner;esswk0;https://www.reddit.com/r/btc/comments/esswk0/about_the_proposed_dev_fund_change_from_the/
Do you even understand how Bitcoin works?;9;1;False;grmpfpff;ffct2w7;About the proposed Dev fund change from the perspective of a small BCH miner;esswk0;https://www.reddit.com/r/btc/comments/esswk0/about_the_proposed_dev_fund_change_from_the/
"So that's all your counterargument? Most of the developments stated in that image are nothing new: many maximalists keep waiting for them even before Segwit implementation. And there's no due date. 

And the one that are already working, are in BCH. But in BCH they work better. Even Lightning works better because we now have bidirectional private channels.";4;1;False;libertarian0x0;ffcye0f;About the proposed Dev fund change from the perspective of a small BCH miner;esswk0;https://www.reddit.com/r/btc/comments/esswk0/about_the_proposed_dev_fund_change_from_the/
">people that only knew the old rules (older clients) will still find  blocks following the new rules valid, making a soft fork backwards  compatible. 

And miners who know the new rules still accept blocks found by miners who dont know the new rules.

But this is not the case here. Miners who know the new rules intent to orphan blocks by those who dont know them. Thats not a soft fork. That IS an attack.";2;1;False;grmpfpff;ffcz0qe;About the proposed Dev fund change from the perspective of a small BCH miner;esswk0;https://www.reddit.com/r/btc/comments/esswk0/about_the_proposed_dev_fund_change_from_the/
"Orphaning blocks is not a ""hash war"", it's how all soft forks work.";1;2;False;tcrypt;ffcvgqb;About the proposed Dev fund change from the perspective of a small BCH miner;esswk0;https://www.reddit.com/r/btc/comments/esswk0/about_the_proposed_dev_fund_change_from_the/
"If there will be a change on protocol level with the next hard fork, this will be a hard fork. If this will be a change on protocol level in a ""soft fork"" after the hard fork, **and** blocks that donÂ´t contain the funding will be orphaned, then its not a soft fork because it wont be backward compatible at all. It will cause a hash war, so it is an attack on the network.";1;1;False;grmpfpff;ffd5ool;About the proposed Dev fund change from the perspective of a small BCH miner;esswk0;https://www.reddit.com/r/btc/comments/esswk0/about_the_proposed_dev_fund_change_from_the/
"> I think you are failing to follow my logic. 

Yeah, I think that is actually the case. I will reread your comments tomorrow, my inbox today was a bit too full to follow everything you said properly enough I guess.";1;1;False;grmpfpff;ffdemb1;About the proposed Dev fund change from the perspective of a small BCH miner;esswk0;https://www.reddit.com/r/btc/comments/esswk0/about_the_proposed_dev_fund_change_from_the/
Yes. Even if they don't and only these 4 pools use a modified client enforcing this rule, it's still a soft fork. Note that I'm only expressing facts here, not my opinion. I have a mixed feeling about this idea. I'm a former p2pool miner myself, and this will kill p2pool...;1;1;False;rinexc;ffd53eh;About the proposed Dev fund change from the perspective of a small BCH miner;esswk0;https://www.reddit.com/r/btc/comments/esswk0/about_the_proposed_dev_fund_change_from_the/
I think you are failing to follow my logic. It was never about exodus or damage to BTC. It's about keeping funds in the BCH community and ousting outside actors like Calvin Ayre from mining on BCH for profitability at the expense of BCH. Effectively it turns BCH into an attack chain.;1;1;False;curryandrice;ffde695;About the proposed Dev fund change from the perspective of a small BCH miner;esswk0;https://www.reddit.com/r/btc/comments/esswk0/about_the_proposed_dev_fund_change_from_the/
"> Is it not a hardfork if it's at a protocol level and updated in all nodes?

No. It would be a HF if it allowed blocks that were not valid before, e.g. if the fund payment was from inflated coins vs coming from the existing block rewards. 

> Wouldn't a soft fork mean that nodes are allowed to not update while still being compatible? If they all get orphaned would it still be a softfork?

Yes, unupgraded nodes would accept the blocks but they'd also accept non tax blocks leaving them open to double spends. The goal for the proposers is to have this change in the standard May upgrade so nodes will have to update for other changes anyways and this will enable them to reject non paying blocks.";1;0;False;tcrypt;ffd5ve1;About the proposed Dev fund change from the perspective of a small BCH miner;esswk0;https://www.reddit.com/r/btc/comments/esswk0/about_the_proposed_dev_fund_change_from_the/
Alright, thanks for the citations. So we have to wait for responses from all devs if they plan to include this verification into their node clients.;1;1;False;grmpfpff;ffd4ctf;About the proposed Dev fund change from the perspective of a small BCH miner;esswk0;https://www.reddit.com/r/btc/comments/esswk0/about_the_proposed_dev_fund_change_from_the/
You are overexagerating the effect that an exodus of BCH miners would have on the other forks, especially BTC.;1;1;False;grmpfpff;ffdbvgl;About the proposed Dev fund change from the perspective of a small BCH miner;esswk0;https://www.reddit.com/r/btc/comments/esswk0/about_the_proposed_dev_fund_change_from_the/
"Is it not a hardfork if it's at a protocol level and updated in all nodes?

Wouldn't a soft fork mean that nodes are allowed to not update while still being compatible? If they all get orphaned would it still be a softfork?

Please pardon my confusion here.";1;1;False;curryandrice;ffd3k2l;About the proposed Dev fund change from the perspective of a small BCH miner;esswk0;https://www.reddit.com/r/btc/comments/esswk0/about_the_proposed_dev_fund_change_from_the/
"Item 6 on the proposal:
> This means the code will need to be ready soon for testing and deployment.

> We will work with the various Bitcoin Cash node implementations to include code to implement verification of this miner funding as part of the May 2020 protocol upgrade.";1;1;False;rinexc;ffd45tm;About the proposed Dev fund change from the perspective of a small BCH miner;esswk0;https://www.reddit.com/r/btc/comments/esswk0/about_the_proposed_dev_fund_change_from_the/
"Less hash rate does not result in a lower price. That's correlation without causation. This time is different because even though we could have the same Hash as BSV we could end up with a 12.5% difference in price due to selling pressure from the dev fund. OTOH, a developer fund could trigger more investors and that could offset this but I'll stop speculating price for now as neither of us knows how price will play out.

The signed miners want more ideological miners on BCH and less profit-seeking miners on the chain. This way profit-seeking miners will end up moving to BTC and BSV to intensify dumping those assets. This incentive system is basically an attack on BTC/BSV. However, this also means that devs will have a defined fund to pull from which is all they really want. Just ask Amaury. This is independent of the BCH price.";1;1;False;curryandrice;ffdbl0c;About the proposed Dev fund change from the perspective of a small BCH miner;esswk0;https://www.reddit.com/r/btc/comments/esswk0/about_the_proposed_dev_fund_change_from_the/
Yes, that is what I just said, and that is a soft fork.;1;1;False;tcrypt;ffczwge;About the proposed Dev fund change from the perspective of a small BCH miner;esswk0;https://www.reddit.com/r/btc/comments/esswk0/about_the_proposed_dev_fund_change_from_the/
