body;score;nb_replies;stickied;author;id;post_title;post_id;post_link
"Seems like a dumb idea and unnecessary. Development has never stopped and it seems to still be continuing forward without any of this. Bitcoin itself was developed without millions in funding (as far as we know). The system already works pretty well with decent scaling that isn't even close to being utilized. Sure there are always more improvements and optimizations to work on. But $6 million worth? I don't know man. How many extra developers are going to be hired with that? Or are the existing teams just lining their own pockets big time, while doing mostly the same shit they were already doing anyway? Not to mention the questions of control and who decides how the money is spent and to who. Being a developer working on a project for a long time doesn't mean you are automatically qualified to manage funds responsibly either.

Why not just find another way to make money instead of causing more drama and another potential fork? Are blockchain devs really that strapped for cash and work opportunities these days?";6;0;False;cryptonaut420;ffdargd;On the infrastructure funding plan for Bitcoin Cash (deadalnix);esxgzj;https://read.cash/@deadalnix/on-the-infrastructure-funding-plan-for-bitcoin-cash-bd372a10
ðŸ¤¦â€â™‚ï¸;12;0;False;Bagatell_;ffcxwq9;On the infrastructure funding plan for Bitcoin Cash (deadalnix);esxgzj;https://read.cash/@deadalnix/on-the-infrastructure-funding-plan-for-bitcoin-cash-bd372a10
THIS is exactly what I wanted. Thank you, /u/deadalnix. As always, youâ€™re the man. ðŸ˜Ž;-5;0;False;tjmac;ffdflb8;On the infrastructure funding plan for Bitcoin Cash (deadalnix);esxgzj;https://read.cash/@deadalnix/on-the-infrastructure-funding-plan-for-bitcoin-cash-bd372a10
"tldr; i want a part of the $6 million, no matter the damage it does";16;1;False;feejarndyce;ffd0sp1;On the infrastructure funding plan for Bitcoin Cash (deadalnix);esxgzj;https://read.cash/@deadalnix/on-the-infrastructure-funding-plan-for-bitcoin-cash-bd372a10
"> The miners have set up this proposal in this way is because of the tragedy of commons. If there is no coercion to pay the fee, nobody will pay it.

The miners obviously want to spend 6 million USD on BCH infrastructure. But they couldn't resist the temptation to simultaneously do an unacceptable power grab that will destroy BCH in the medium to long term. Human greed has destroyed the Bitcoin invention and its currency variants. You people just don't see it yet. 

The Bitcoin invention is eleven years old now and what has the Bitcoin community accomplished? Constant political conflicts and short sighted greedy egotistical disagreements, hostile takeovers and power grabs, stagnating user adoption and market cap growth to irrelevantly small sizes. The central bankers must be observing us and laughing their asses off. They don't need to destroy us when we keep destroying ourselves. 

I really should stop commenting now because what's the point. It's a bad and futile habit to try to correct people on the internet who will never change their opinions anyway. Your personal greed is blinding you people from the big picture and how great things could be for us all if people would be just slightly less greedy and short term egotistical. 

I understand Mike Hearn's frustration and rage quitting much better now. He missed a bit of profits but seems to have been fundamentally correct: People are simply too stupid for the Bitcoin invention to work and replace fiat currencies, so Bitcoin (and its variants) is essentially a failed currency.";7;3;False;todu;ffdcer8;On the infrastructure funding plan for Bitcoin Cash (deadalnix);esxgzj;https://read.cash/@deadalnix/on-the-infrastructure-funding-plan-for-bitcoin-cash-bd372a10
"Interests align

Nakamoto Consensus

Amaury gets paid";0;0;False;curryandrice;ffdc66o;On the infrastructure funding plan for Bitcoin Cash (deadalnix);esxgzj;https://read.cash/@deadalnix/on-the-infrastructure-funding-plan-for-bitcoin-cash-bd372a10
"I have minor disagreements with some of his points, but they're not worth covering. The one relevant point, though, is control over funding address. I'm fine with the proposal setting up a corporation, because that was just proven to work with the Bitcoin.com dev fundraiser. However, I'm not against entertaining an alternative, just as simple, and which may be an improvement. 

First, on the issue of fund distribution I feel the best way to handle that is using the most recent fundraiser as a template. For those unaware projects were broken out separately where, for example, someone could donate only to BitcoinABC, or BCHD etc. There was also a ""general dev fund"". In this way we saw an effective vote from the whole ecosystem for what infrastructure should get what. Since not much has changed since that fundraiser we can reuse the awarded percentages applied proportionally to the $6M; a sort of *amplified* extension.

Next, I do think it's a good, probably better, idea to make the funding address an m of n multi-sig address. We just need some odd number, like 3 or 5 (to ensure no deadlocks) where the majority can move funds. The names he proposes don't work well because they're all obviously pro BitcoinABC. I like JF as a signer definitely. I'd add Roger Ver, then probably Chris Pacia, Jihan Wu would be great, and then maybe Amaury and Andrew Stone, plus Jiang Zhuo'er. That's a very broad ecosystem sample covering business, miners and devs with nobody 100% in favor of any single other entity. Then we just need any 4 to agree to move funds.";5;1;False;cryptos4pz;ffd33hj;On the infrastructure funding plan for Bitcoin Cash (deadalnix);esxgzj;https://read.cash/@deadalnix/on-the-infrastructure-funding-plan-for-bitcoin-cash-bd372a10
I think Roger Ver should be in charge of the fund;3;2;False;gregisanasshat;ffdcdus;On the infrastructure funding plan for Bitcoin Cash (deadalnix);esxgzj;https://read.cash/@deadalnix/on-the-infrastructure-funding-plan-for-bitcoin-cash-bd372a10
"> The miners who decided to propose the plan all have proven that they care about the success of Bitcoin Cash. I cannot think of a better source of funding.

Could you think of a better recipient of that funding, besides yourself?";10;1;False;FullBase;ffcwuxv;On the infrastructure funding plan for Bitcoin Cash (deadalnix);esxgzj;https://read.cash/@deadalnix/on-the-infrastructure-funding-plan-for-bitcoin-cash-bd372a10
This might work very well actually. We need to think bit more about distribution of funds. I really appreciate what ABC has done for us but developers must not control the funds. That just doesn't work I afraid.;1;0;False;xjunda;ffd806i;On the infrastructure funding plan for Bitcoin Cash (deadalnix);esxgzj;https://read.cash/@deadalnix/on-the-infrastructure-funding-plan-for-bitcoin-cash-bd372a10
"The miners have set up this proposal in this way is because of the tragedy of commons. If there is no coercion to pay the fee, nobody will pay it.

We may whine that it takes so few miners to make a majority decision in BCH (and BTC for the matter), but this has been the case for years. Yet for the whole lifetime of BCH, miners have proven that they have the best interests of BCH at heart.

It also makes a sense from a game theory POV. On the BTC chain, the Lightning Network, if successful, would severely cap the role and earnings of miners. Not so in BCH. If the chain is a massive success, miners stand to benefit directly from it.

So I think people need to relax a bit, miners are not in it to destroy the BCH chain, quite to the contrary.";7;2;False;taipalag;ffdas59;On the infrastructure funding plan for Bitcoin Cash (deadalnix);esxgzj;https://read.cash/@deadalnix/on-the-infrastructure-funding-plan-for-bitcoin-cash-bd372a10
"""Give me the authority to pay myself.""";39;2;False;derykmakgill;ffd6nsb;On the infrastructure funding plan for Bitcoin Cash (deadalnix);esxgzj;https://read.cash/@deadalnix/on-the-infrastructure-funding-plan-for-bitcoin-cash-bd372a10
" I  think this funding proposal is hated by the anti-p2p-cash movement.  They have brought out all hands to fight this with lies and deceptions  and real concerns we need to be careful about. I believe there is a  massive (troll?) campaign to try to vilify the 'unknown HK corporation'  planned for receiving the funds. I believe their are many liars claiming  it is just a scam to steal the funds. I assume the big players have a  clue about how to handle these funds they are collecting for us and can  be trusted to do what they think is good for BCH. The anti-BCH forces  hate that this proposal may succeed in supporting accelerated BCH  development. They fear we will be able to fully scale for worldwide  adoption before they can stop us.

I was totally with you until you ended with 'let me control who gets  the money'. I think your team should get most of the money, but, you  cannot be one of 3 friends who has the job of determining the  distribution of funding. The conflict of interest is mind boggling.  Suggesting it makes me concerned since I can't imagine you are not aware  of how terrible that idea is. Of course you and all those you mentioned  should be advising the decisionmaker(s). 

Edit: Personally, I would prefer the funding distribution be  determined before the funds become available and have an automated  payment system to the recipients so the funds never sit in an HK  corporate wallet or bank since that would be a single point of failure  located in a dangerous location. Also, I think having a donation address for supporters that would add to  the funding and get instantly divided and distributed in the same  proportions would be a nice touch.";0;2;False;Big_Bubbler;ffd6vgc;On the infrastructure funding plan for Bitcoin Cash (deadalnix);esxgzj;https://read.cash/@deadalnix/on-the-infrastructure-funding-plan-for-bitcoin-cash-bd372a10
/u/deadalnix could you please confirm that https://read.cash/@deadalnix is your account? We'd like to place a blue confirmation badge on your account.;31;1;False;readcash;ffcr94v;On the infrastructure funding plan for Bitcoin Cash (deadalnix);esxgzj;https://read.cash/@deadalnix/on-the-infrastructure-funding-plan-for-bitcoin-cash-bd372a10
Yep. Not a tax;-3;0;False;spe59436-bcaoo;ffd0pl2;On the infrastructure funding plan for Bitcoin Cash (deadalnix);esxgzj;https://read.cash/@deadalnix/on-the-infrastructure-funding-plan-for-bitcoin-cash-bd372a10
A group of competitors in an industry setting aside their differences to  partake in actions for the benefit of ~~the industry~~  Aumary is called a cartel,  and cartels tend to be unstable.;1;0;False;capistor;ffd94ld;On the infrastructure funding plan for Bitcoin Cash (deadalnix);esxgzj;https://read.cash/@deadalnix/on-the-infrastructure-funding-plan-for-bitcoin-cash-bd372a10
"No one should be surprised by this. BCH was 51% attacked back in May, and the Bitcoin ABC team almost all abruptly quit back in May due to lack of funding before - guess who! - Roger Ver stepped in and provided funds. You think Roger wants he and his businesses to continually be the sole provider of funding for Bitcoin ABC? Nope. He knows keeping them funded is vital to BCH though so he has/had no choice.

So, I can almost guarantee this is a plot hatched by Roger Ver to save himself money while fundamentally changing what BCH is. It's devious but brilliant, and no one here will call him out on it and he knows it. He's changing the protocol to save himself money.

Keep in mind: Roger Ver ONLY acts in his own self interest, and ONLY cares about making money. Everything can be traced back to those two things. He's the shadow leader of BCH and can literally do whatever he wants with the BCH protocol. And, even if people woke up to that reality it wouldn't matter because without Roger, BCH collapses. Not because it can't stand on it's own merits, but because he is almost single-handedly propping up BCH with hash rate and money that otherwise would be non-existent and BCH would be constantly attacked and manipulated, making it basically worthless.

For those curious about the backstory on the Bitcoin ABC team almost quitting that would've effectively ended BCH back in May:

https://coinspice.io/news/coinspice-show-3-bitcoin-abcs-amaury-sechet-addresses-bch-51-attack-rumors/";-6;1;False;chazley;ffd9rdo;On the infrastructure funding plan for Bitcoin Cash (deadalnix);esxgzj;https://read.cash/@deadalnix/on-the-infrastructure-funding-plan-for-bitcoin-cash-bd372a10
"The funding plan is genius, unless BTC implements an equal tax this is a big win for BCH, and this would be a really hard sell for BTC imo.

But whatever the distribution-mechanism is, surely noone believes ""just let me and two of my friends decide based on whatever we feel like, because ... uhhh ... efficiency"" is a good idea. The arrogance in just flat out demanding that...

Also I am enjoying the cognitive dissonance being in favor of something that has similarities with a tax brings to some parts of this community.";-3;0;False;random043;ffd9hpd;On the infrastructure funding plan for Bitcoin Cash (deadalnix);esxgzj;https://read.cash/@deadalnix/on-the-infrastructure-funding-plan-for-bitcoin-cash-bd372a10
"I do not support either side yet, I am merely gathering information so I can make an informed decision. Whatever decision is made there will be those that disagree, there will be those that use that disagreement as a wedge to cause more drama, strife, and division.

You know who I would like to hear from? An individual that most of us here respected before he voluntarily gave up his keys.";6;1;False;ShadowOrson;ffd5lb0;On the infrastructure funding plan for Bitcoin Cash (deadalnix);esxgzj;https://read.cash/@deadalnix/on-the-infrastructure-funding-plan-for-bitcoin-cash-bd372a10
What a mess;1;0;False;mahmonies;ffd405p;On the infrastructure funding plan for Bitcoin Cash (deadalnix);esxgzj;https://read.cash/@deadalnix/on-the-infrastructure-funding-plan-for-bitcoin-cash-bd372a10
pathetic.;3;1;False;usrn;ffcxmta;On the infrastructure funding plan for Bitcoin Cash (deadalnix);esxgzj;https://read.cash/@deadalnix/on-the-infrastructure-funding-plan-for-bitcoin-cash-bd372a10
"""Bitcoin Cash community (who aren't miners): ""BCH miners should be funding node developers.""

*Group of major miners announces plan to fund node developers*

Bitcoin Cash community (who aren't miners): ""I don't like THAT plan! That's not MY plan! I want you miners to use MY plan!""""";19;5;False;TyMyShoes;ffcquuz;Vin Armani on the infrastructure plan;esxfs7;https://twitter.com/vinarmani/status/1220396953227255813
"\> BTC is well funded with blockstream

Only at first glance. Does success of Blockstream depend on the success of BTC to scale or on inability to do so?";2;1;False;spe59436-bcaoo;ffdc0b0;Vin Armani on the infrastructure plan;esxfs7;https://twitter.com/vinarmani/status/1220396953227255813
"Well, compare BTC and BCH.

BTC is well funded with blockstream. BCH has an open development model.

Which model do you prefer?";5;2;False;ThomasZander;ffdatzt;Vin Armani on the infrastructure plan;esxfs7;https://twitter.com/vinarmani/status/1220396953227255813
CashFusion was just 1 example, how many other projects are underfunded or stuck in the idea phase because devs know no one will pay for it? Surely all the devs aren't working full time on BCH. More money could allow them to at least work full time. Having extra money around could also attract NEW developers with NEW ideas.;2;1;False;TyMyShoes;ffdanwj;Vin Armani on the infrastructure plan;esxfs7;https://twitter.com/vinarmani/status/1220396953227255813
But the issue isnâ€™t development. BCH already has enough to be wildly more successful than BTC ever was.;3;0;False;Odbdb;ffdd0mf;Vin Armani on the infrastructure plan;esxfs7;https://twitter.com/vinarmani/status/1220396953227255813
"Those that work on cashfusion have funding. The development work takes time as it is not trivial stuff. To imply that it would somehow go faster is making the classic mistake to think that 9 woman can make a baby in one month.

Cashfusion is happening. Like many other such innovations have been happening  on BCH. Exclusively on BCH.

Doesn't seem like there is an issue to me.";7;1;False;ThomasZander;ffd9ogu;Vin Armani on the infrastructure plan;esxfs7;https://twitter.com/vinarmani/status/1220396953227255813
"lol BULLSHIT.

Cashfusion would def be out sooner if we had more money. Pretty sure all the money for Cashfusion also came from a single person (or 3 max). Why is it always on those same 3 to give away their money? More money = faster growth dunno how someone can't see that.";9;2;False;TyMyShoes;ffd8mld;Vin Armani on the infrastructure plan;esxfs7;https://twitter.com/vinarmani/status/1220396953227255813
At its birth blockstream was great. It was just going to make an L2 protocol, like colored coins. We all know where that ended up.;1;1;False;Odbdb;ffdcq90;Vin Armani on the infrastructure plan;esxfs7;https://twitter.com/vinarmani/status/1220396953227255813
It's not going to bankrupt anyone. 12.5% of 3-5% is insignificant for the miners.;0;1;False;TNoD;ffdgf25;Vin Armani on the infrastructure plan;esxfs7;https://twitter.com/vinarmani/status/1220396953227255813
If Blockstream would have been funded by miners we would never had BCH in the first place, we would have $30k+ unified Bitcoin instead with subcent fees and regular 1.5-2.5MB+ blocks at the moment with hard 8MB cap or without cap at all. And with much bigger share of currency use in Venezuela, where it really matters right now;3;1;False;spe59436-bcaoo;ffdd2hy;Vin Armani on the infrastructure plan;esxfs7;https://twitter.com/vinarmani/status/1220396953227255813
"No.

The incentives align with the network incentives. Even Emin Sirer agreed that this plan is beneficial for development.

As long as incentives align we won't get a Blockstream that makes nothing from improving the network.";11;0;False;curryandrice;ffd1sc9;Vin Armani on the infrastructure plan;esxfs7;https://twitter.com/vinarmani/status/1220396953227255813
Nobody has an issue with funding. Well, Amaury wants millions. That's an issue;-10;1;False;RedWetUmbrella;ffd4qzz;Vin Armani on the infrastructure plan;esxfs7;https://twitter.com/vinarmani/status/1220396953227255813
"Strawman. Bringing up an irrelevant point to the discussion.

But to answer your point: Flowee can already today mine consistently 250MB blocks. Is that enough scaling for you?";2;0;False;ThomasZander;ffdccyq;Vin Armani on the infrastructure plan;esxfs7;https://twitter.com/vinarmani/status/1220396953227255813
">Group of major miners announces plan to fund node developers

But that's not the whole story, it's actually ""**group of miners announces that they call the shots where all block rewards will go and pledges to bankrupt any miners not agreeing to their scheme**""";2;1;False;wtfCraigwtf;ffdb2bf;Vin Armani on the infrastructure plan;esxfs7;https://twitter.com/vinarmani/status/1220396953227255813
"Also Vin

https://mobile.twitter.com/gubatron/status/1220401254477643776";5;0;False;RedWetUmbrella;ffd4g2x;Vin Armani on the infrastructure plan;esxfs7;https://twitter.com/vinarmani/status/1220396953227255813
Exactly. Also in 2015 everybody agreed that miners not funding devs resulted in blockstream taking control. Now that miners have learnt their lesson and want to fund development... but but BlOcKstReAm 2.0!!!1;5;0;False;jungans;ffdb8qo;Vin Armani on the infrastructure plan;esxfs7;https://twitter.com/vinarmani/status/1220396953227255813
This whole thing smells like the birth of blockstream 2.0.;-6;3;False;Odbdb;ffcxc1s;Vin Armani on the infrastructure plan;esxfs7;https://twitter.com/vinarmani/status/1220396953227255813
"Sigh.

Vin is right again.

I'd rather we do something and make a temporary mistake rather than debate endlessly. We've had over 2 years to fund development and it's still an issue.";17;1;False;curryandrice;ffd2276;Vin Armani on the infrastructure plan;esxfs7;https://twitter.com/vinarmani/status/1220396953227255813
If this plan does nothing but send the 6m in coins to a burn address then still it would have a better effect on BCH than Blockstream had on BTC. Realistically it just needs to turn out 1 or 2 things to be more useful than Blockstream has ever been. I suspect they will do much much more than 1-2 things.;8;1;False;TyMyShoes;ffd903j;Vin Armani on the infrastructure plan;esxfs7;https://twitter.com/vinarmani/status/1220396953227255813
"Ok technically not a tax but it is most certainly a compulsory payment or fee.  Maybe more akin to a bridge or highway toll...but the main point is that it is ""compulsory""!.  Amazing how the thought of getting access to money can mold the way we think and act and to, perhaps  unconsciously, downplay what is most obvious...I have no doubt that most people in this community have their idealism in the right place, but lets not forget why decentralization is so important; It's because people are in the end fallible...even good people find themselves doing or saying the wrong thing at some point in their lives. We are human and we have weaknesses, particularly when money is involved...think on that.";31;2;False;BitsenBytes;ffd4ztb;Lead Dev Amaury SÃ©chet on Bitcoin Cash 12.5% Coinbase Fund: Sound Game Theory, Not a Tax;esxcio;https://coinspice.io/news/lead-dev-amaury-sechet-on-bitcoin-cash-12-5-coinbase-fund-sound-game-theory-not-a-tax/
Elaborate please?;4;1;False;xjunda;ffd6wua;Lead Dev Amaury SÃ©chet on Bitcoin Cash 12.5% Coinbase Fund: Sound Game Theory, Not a Tax;esxcio;https://coinspice.io/news/lead-dev-amaury-sechet-on-bitcoin-cash-12-5-coinbase-fund-sound-game-theory-not-a-tax/
He gets money thats why he likes it.;2;1;False;freshandsticky;ffd7g42;Lead Dev Amaury SÃ©chet on Bitcoin Cash 12.5% Coinbase Fund: Sound Game Theory, Not a Tax;esxcio;https://coinspice.io/news/lead-dev-amaury-sechet-on-bitcoin-cash-12-5-coinbase-fund-sound-game-theory-not-a-tax/
I disagree. Accepting funds from miners is best scenario because of same incentives. Making BCH work is shared goal unlike Blockstream.;4;0;False;xjunda;ffd9lts;Lead Dev Amaury SÃ©chet on Bitcoin Cash 12.5% Coinbase Fund: Sound Game Theory, Not a Tax;esxcio;https://coinspice.io/news/lead-dev-amaury-sechet-on-bitcoin-cash-12-5-coinbase-fund-sound-game-theory-not-a-tax/
"I remember scrolling through the forums early on and seeing mentions of a â€œdeveloper fundâ€ being a scam project. It was seemingly akin to pre-mined project, but I could be wrong. 

Not to say these people are right or wrong, but I thought they were saying this stuff in order to protect the spirit of decentralization.

I'm curious how we create that accountability. Do you happen to have an idea of what that looks like?";1;0;False;brows1ng;ffd9e75;Lead Dev Amaury SÃ©chet on Bitcoin Cash 12.5% Coinbase Fund: Sound Game Theory, Not a Tax;esxcio;https://coinspice.io/news/lead-dev-amaury-sechet-on-bitcoin-cash-12-5-coinbase-fund-sound-game-theory-not-a-tax/
Accountability is the key here.;4;0;False;xjunda;ffd6z3k;Lead Dev Amaury SÃ©chet on Bitcoin Cash 12.5% Coinbase Fund: Sound Game Theory, Not a Tax;esxcio;https://coinspice.io/news/lead-dev-amaury-sechet-on-bitcoin-cash-12-5-coinbase-fund-sound-game-theory-not-a-tax/
"> decentralization is so important

But this is a difficult task because we do not want to transform the whole thing into a bureaucratic process that would be both slow and inefficient. In a free market, the most efficient system wins. 

Therefor I suggest that I and 2 other guys get to decide what to do with all the funds. Like I guess some people can ""advise"" us too, that would work.

Also, not a tax. Taxes are theft.";1;1;False;random043;ffd9yju;Lead Dev Amaury SÃ©chet on Bitcoin Cash 12.5% Coinbase Fund: Sound Game Theory, Not a Tax;esxcio;https://coinspice.io/news/lead-dev-amaury-sechet-on-bitcoin-cash-12-5-coinbase-fund-sound-game-theory-not-a-tax/
"No one should be surprised by this. BCH was 51% attacked back in May, and the Bitcoin ABC team almost all abruptly quit back in May due to lack of funding before - guess who! - Roger Ver stepped in and provided funds. You think Roger wants he and his businesses to continually be the sole provider of funding for Bitcoin ABC? Nope. He knows keeping them funded is vital to BCH though so he has/had no choice.

So, I can almost guarantee this is a plot hatched by Roger Ver to save himself money while fundamentally changing what BCH is. It's devious but brilliant, and no one here will call him out on it and he knows it. He's changing the protocol to save himself money.

Keep in mind: Roger Ver ONLY acts in his own self interest, and ONLY cares about making money. Everything can be traced back to those two things. He's the shadow leader of BCH and can literally do whatever he wants with the BCH protocol. And, even if people woke up to that reality it wouldn't matter because without Roger, BCH collapses. Not because it can't stand on it's own merits, but because he is almost single-handedly propping up BCH with hash rate and money that otherwise would be non-existent and BCH would be constantly attacked and manipulated, making it basically worthless.

For those curious about the backstory on the Bitcoin ABC team almost quitting that would've effectively ended BCH back in May:

https://coinspice.io/news/coinspice-show-3-bitcoin-abcs-amaury-sechet-addresses-bch-51-attack-rumors/";-4;0;False;chazley;ffdarnd;Lead Dev Amaury SÃ©chet on Bitcoin Cash 12.5% Coinbase Fund: Sound Game Theory, Not a Tax;esxcio;https://coinspice.io/news/lead-dev-amaury-sechet-on-bitcoin-cash-12-5-coinbase-fund-sound-game-theory-not-a-tax/
lazy dev tax;-3;0;False;ultimatehub24;ffcvo0z;Lead Dev Amaury SÃ©chet on Bitcoin Cash 12.5% Coinbase Fund: Sound Game Theory, Not a Tax;esxcio;https://coinspice.io/news/lead-dev-amaury-sechet-on-bitcoin-cash-12-5-coinbase-fund-sound-game-theory-not-a-tax/
