body;score;nb_replies;stickied;author;id;post_title;post_id;post_link
This article attacks BCH development-funding ideas. Suggests alternatives that have not worked for BCH and have destroyed BTC-Bitcoin's ability to implement it's original primary use case of peer-to-peer electronic cash for the world's people.;0;1;False;Big_Bubbler;ffdbua6;Regardless of how smart and how benign these people are, resulting developments are always worse than allowing a market place where ideas compete and where mistakes will not hurt the market as a whole. The open market has a much better track record.;et08xq;https://read.cash/@TomZ/mythbusting-we-need-a-developer-fund-3e0d7f20
"> Suggests alternatives that [] have destroyed BTC-Bitcoin's ability to

Those alternatives have worked for decades to make Open source the force that it is today. Impossible to ignore by even the biggest and most private companies.

BTC has never tried this in any way. There is nothing open source about Blockstream.";14;1;False;ThomasZander;ffddakz;Regardless of how smart and how benign these people are, resulting developments are always worse than allowing a market place where ideas compete and where mistakes will not hurt the market as a whole. The open market has a much better track record.;et08xq;https://read.cash/@TomZ/mythbusting-we-need-a-developer-fund-3e0d7f20
"I support ""open source"" and believe you use that great thing to distract from what alternative funding mechanism you are proposing:  ""Companies could contribute in ways that make sense for them, sharing knowledge or developer time for instance.""

That is what Blockstream and other companies did to take over and centralize BTC development.";-2;1;False;Big_Bubbler;ffdfloe;Regardless of how smart and how benign these people are, resulting developments are always worse than allowing a market place where ideas compete and where mistakes will not hurt the market as a whole. The open market has a much better track record.;et08xq;https://read.cash/@TomZ/mythbusting-we-need-a-developer-fund-3e0d7f20
"I called it cartel pretty early on. I don't think we should sugarcoat it as Nakamoto Consensus is definitely ruled by a voluntary cooperative cartel that doesn't force anyone to use it's non-coercive product. A drug cartel OTOH can consist of membership threatened into cooperation via violent means and can impose their will on people outside the cartel via more violence. However, unlike other cartels, miners aren't violent and the most aggressive thing they can do is ignore your blocks. They're RADICALLY different.

I don't really want to explain this every time there's a ""controversial"" change.";7;1;False;curryandrice;ffdf4rk;"Reminder: Do not adopt Core lingo : Core minions introduced the negatively loaded word ""cartel"". You can also call it an alliance!";et06u9;https://twitter.com/egon_01/status/1220465395125096448?s=21
"> Suggesting that he is a Core minion, he who created the ABC client, is bit far fetched. Please don't be hasty with your emotionally loaded conclusion.

LOL.

You truly did not manage to understand the intent of that message?

The point is that you called him a core minion by implication, and I was just pointing out how silly **you** are by doing so.  Notice the questionmark at the end of the opening sentence. It was a question, questioning why you called him a core minion...

I don't think he is one, for the record.";8;1;False;ThomasZander;ffdcotc;"Reminder: Do not adopt Core lingo : Core minions introduced the negatively loaded word ""cartel"". You can also call it an alliance!";et06u9;https://twitter.com/egon_01/status/1220465395125096448?s=21
He is French, so itâ€™s understandable. I have no Core techniques, I have only true story techniques ðŸ¤·â€â™‚ï¸;-5;1;False;Egon_1;ffdb9p9;"Reminder: Do not adopt Core lingo : Core minions introduced the negatively loaded word ""cartel"". You can also call it an alliance!";et06u9;https://twitter.com/egon_01/status/1220465395125096448?s=21
"He adopted your ""core lingo"" after it was added to the discussion to cause toxicity and division.  Both terms are accurate.";1;0;False;Big_Bubbler;ffdcor3;"Reminder: Do not adopt Core lingo : Core minions introduced the negatively loaded word ""cartel"". You can also call it an alliance!";et06u9;https://twitter.com/egon_01/status/1220465395125096448?s=21
"You are arguing against using the word ""alliance"" ? Even if we agree ""cartel"" is technically correct, why not ""alliance"" ?

""cartel"" does have a negative connotation to the average person.";1;1;False;mrcrypto2;ffddsl3;"Reminder: Do not adopt Core lingo : Core minions introduced the negatively loaded word ""cartel"". You can also call it an alliance!";et06u9;https://twitter.com/egon_01/status/1220465395125096448?s=21
I haven't read his article, I was referring to Core minions. Suggesting that he is a Core minion, he who created the ABC client, is bit far fetched. Please don't be hasty with your emotionally loaded conclusion.;-6;1;False;Egon_1;ffdbv3o;"Reminder: Do not adopt Core lingo : Core minions introduced the negatively loaded word ""cartel"". You can also call it an alliance!";et06u9;https://twitter.com/egon_01/status/1220465395125096448?s=21
Well said. Both terms are true. One was added to cause toxicity and division.;1;2;False;Big_Bubbler;ffdceyx;"Reminder: Do not adopt Core lingo : Core minions introduced the negatively loaded word ""cartel"". You can also call it an alliance!";et06u9;https://twitter.com/egon_01/status/1220465395125096448?s=21
"Deadalnix is a core minion when he called it a ""good cartel"" in his read.cash post?

It **is** a cartel, you are pulling Core techniques if you want to call it something different.";24;4;False;ThomasZander;ffdb1n9;"Reminder: Do not adopt Core lingo : Core minions introduced the negatively loaded word ""cartel"". You can also call it an alliance!";et06u9;https://twitter.com/egon_01/status/1220465395125096448?s=21
"But it IS a cartel. It's the very definition of it. Why shy away from the truth?

For fuck sake, Nakamoto Consensus is a cartel.";15;0;False;Hakametal;ffdduz8;"Reminder: Do not adopt Core lingo : Core minions introduced the negatively loaded word ""cartel"". You can also call it an alliance!";et06u9;https://twitter.com/egon_01/status/1220465395125096448?s=21
"Well, notice that ""cartel"" is one of the game theory basics. Regardless of nationality.

As he talks about game theory a lot, maybe you can take his word for it.";8;1;False;ThomasZander;ffdbjnr;"Reminder: Do not adopt Core lingo : Core minions introduced the negatively loaded word ""cartel"". You can also call it an alliance!";et06u9;https://twitter.com/egon_01/status/1220465395125096448?s=21
"> I think it's a valid point that node implementations should have a steady flow of income so they don't have to work for free and are less corructable.

Bitcoin Cash is money, by building infrastructure, by adding websites like read.cash and simply by introducing it to more people, we can all increase the value of Bitcoin Cash. Bitcoin Cash is money and as such its increase in usefulness is an increase of your holdings.

A steady income already happens every year with the increase of the value of Bitcoin Cash.";6;1;False;ThomasZander;ffdbcy7;A less bureaucratic funding mechanism using SLP tokens;eszme3;https://www.reddit.com/r/btc/comments/eszme3/a_less_bureaucratic_funding_mechanism_using_slp/
What exactly would make such SLP tokens worth something comparable to 6 million USD?;0;1;False;_EuroTrash_;ffd72ek;A less bureaucratic funding mechanism using SLP tokens;eszme3;https://www.reddit.com/r/btc/comments/eszme3/a_less_bureaucratic_funding_mechanism_using_slp/
No the node implementations would receive BCH. The token would just be a way for donors to prove that they donated giving them an incentive to participate in funding if they want certain changes to the software to be made;1;0;False;saddit42;ffd7eml;A less bureaucratic funding mechanism using SLP tokens;eszme3;https://www.reddit.com/r/btc/comments/eszme3/a_less_bureaucratic_funding_mechanism_using_slp/
u/cryptochecker;2;1;False;J-Stodd;ffd26tg;Wow, looks like BCH might be starting a trend;esz0ra;https://twitter.com/W0wn3r0/status/1220203525545680897
"> If your pool doesn't participate your children get orphaned.

LOOOOOL! A Tax, a Cartel, and Threats to life.";1;0;False;FullBase;ffdgaap;Wow, looks like BCH might be starting a trend;esz0ra;https://twitter.com/W0wn3r0/status/1220203525545680897
"Of [u/jwinterm](https://www.reddit.com/u/jwinterm)'s last **1454** posts (**461** submissions + **993** comments), I found **1230** in cryptocurrency-related subreddits. This user is most active in these subreddits:

Subreddit|No. of posts|Total karma|Average|[Sentiment](https://nlpforhackers.io/sentiment-analysis-intro/)
:--|:--|:--|:--|:--|:--|:--
r/Bitcoin|8|119|14.9|Neutral|
r/BitcoinMarkets|60|343|5.7|Neutral|
r/btc|23|-125|-5.4|Neutral|
r/CryptoMarkets|6|53|8.8|Neutral|
r/decred|6|5|0.8|Neutral|
r/Iota|7|-29|-4.1|Neutral|
r/Monero|73|2658|36.4|Neutral|
r/myriadcoin|41|375|9.1|Neutral|
r/nyancoins|16|53|3.3|Neutral|
r/vertcoin|27|386|14.3|Neutral|
r/CryptoCurrency|945|8043|8.5|Neutral|

See [here](https://reddit.com/r/cryptochecker/esz1q0) for more detailed results, including less active cryptocurrency subreddits.
***

^(Bleep, bloop, I'm a bot trying to help inform cryptocurrency discussion on Reddit.) ^| [^Usage](https://www.reddit.com/user/cryptochecker/comments/atbifk/how_to_use_ucryptochecker/) ^| [^FAQs](https://www.reddit.com/user/cryptochecker/comments/ascogw/faq_about_ucryptochecker_2019/) ^| [^Feedback](https://www.reddit.com/message/compose?to=jamcowl&subject=cryptochecker%20bot) ^| [^Tips](https://www.reddit.com/user/cryptochecker/comments/ataajr/tipping_ucryptochecker/)";1;0;False;cryptochecker;ffd280m;Wow, looks like BCH might be starting a trend;esz0ra;https://twitter.com/W0wn3r0/status/1220203525545680897
"I don't have issue with the proposition itself. It is pretty sound.

The only thing I have a problem with is that the company that will be receiving the funds is based in HK.

HK is a politically unstable jurisdiction. It is asking for trouble. Why not Iran while we are at it?

But seriously, smart contract would be best. 

If it has to be a physical company, then probably Switzerland, Malta, Cyprus or some tax heaven islands would be a better bet for the localization.";9;1;False;ShadowOfHarbringer;ffd5r2p;Hot Take: BCH Funding Proposal is a tempest in a teapot.;esyla1;https://www.reddit.com/r/btc/comments/esyla1/hot_take_bch_funding_proposal_is_a_tempest_in_a/
"BSV was never going to die. It was going to limp along exactly like it's been doing. It's hard to kill a chain completely. If Bitcoin Gold and Bitcoin Diamond are still around pretending like they matter why would anyone think BSV would die?

A hashwar requires two sides. Who is on the other side?";5;2;False;Twoehy;ffd5qhk;Hot Take: BCH Funding Proposal is a tempest in a teapot.;esyla1;https://www.reddit.com/r/btc/comments/esyla1/hot_take_bch_funding_proposal_is_a_tempest_in_a/
Sounds like you need to read the proposal. Counterintuitively, it's BTC miners that will end up (mostly) paying for it through the relative differences in difficulty, barring a flippening.;2;2;False;Twoehy;ffd5tue;Hot Take: BCH Funding Proposal is a tempest in a teapot.;esyla1;https://www.reddit.com/r/btc/comments/esyla1/hot_take_bch_funding_proposal_is_a_tempest_in_a/
Its a new debate now, maybe some figures will back the non tax option. We will see, dont say its going to happen but it clearly splits the bch community (again);1;0;False;BitSoMi;ffd5z8o;Hot Take: BCH Funding Proposal is a tempest in a teapot.;esyla1;https://www.reddit.com/r/btc/comments/esyla1/hot_take_bch_funding_proposal_is_a_tempest_in_a/
"I don't think so. I think if you don't like it you'd just mine something else at this point. In order for a chain split there would need to be an organized force on the other side that was willing to support and maintain a minority fork that would likely diminish the value of both chains.
Alternatively it's the majority position, in which case I would expect the announced plan to be abandoned when it becomes clear there's massive opposition.

TL;DR - The only way you'd get chain split is if people wanted to support both sides of the fork, and I don't see that happening.";9;2;False;Twoehy;ffczzhb;Hot Take: BCH Funding Proposal is a tempest in a teapot.;esyla1;https://www.reddit.com/r/btc/comments/esyla1/hot_take_bch_funding_proposal_is_a_tempest_in_a/
"> Counterintuitively, it's BTC miners that will end up (mostly) paying for it

There are no ""BTC"" vs ""BCH"" miners. They use the same hardware and the same electricity.

And you make it sound like some miners would pay this and others won't This is absolutely not the case. Your ""BCH miners"" would pay the same 12.5% of their income.";2;2;False;ThomasZander;ffdc6kw;Hot Take: BCH Funding Proposal is a tempest in a teapot.;esyla1;https://www.reddit.com/r/btc/comments/esyla1/hot_take_bch_funding_proposal_is_a_tempest_in_a/
"Hashwar 2.0, simple as that. I would argue a ""i dont see that happening"". No one thought BSV is going to survive....";2;1;False;BitSoMi;ffd1rgc;Hot Take: BCH Funding Proposal is a tempest in a teapot.;esyla1;https://www.reddit.com/r/btc/comments/esyla1/hot_take_bch_funding_proposal_is_a_tempest_in_a/
perhaps;1;0;False;ultimatehub24;ffd62r3;Hot Take: BCH Funding Proposal is a tempest in a teapot.;esyla1;https://www.reddit.com/r/btc/comments/esyla1/hot_take_bch_funding_proposal_is_a_tempest_in_a/
"> there's no reason to freak out until the philosophy of Bitcoin gets destroyed as a result of it's mechanisms.

You may be interested in this writing that explains how that happens;

https://read.cash/@TomZ/mythbusting-we-need-a-developer-fund-3e0d7f20";4;0;False;ThomasZander;ffdboh1;Hot Take: BCH Funding Proposal is a tempest in a teapot.;esyla1;https://www.reddit.com/r/btc/comments/esyla1/hot_take_bch_funding_proposal_is_a_tempest_in_a/
"You left out at least one very important reservation which has been mentioned numerous times.

There is the claim that this proposal is no problem with > 50% and that's how Bitcoin works. And maybe that would be technically acceptable if the consortium have the hash.

But the 4-5 miners in question don't seem to have those 50% of total SHA256. People have put numbers in other threads. None of these numbers have been > 50% of total. What I've seen has been more around 30%.

The question then is how is the activation of this supposed to go smoothly?

What is the required percentage of total for safe activation and further execution, to avoid e.g. the serious scenario that Mark B. Lundeberg raised:

https://www.reddit.com/r/btc/comments/esebco/infrastructure_funding_plan_for_bitcoin_cash_by/ffapqej/

So far I don't see it addressed with a solution by anyone from the proposers or from any development team (not that I think they easily could - it's about hashrate).

One the one hand this is about unaddressed risks of chain forks due to hostile actions during activation or later.

On the other it is about currency split risks due to predictable disagreement with how this is being rolled out, and due to potentially disagreeable disbanding of the cartel at a later stage.

Just to point out that there are more issues, and they are not being mentioned simply because ""people don't like any idea that isn't theirs"".";1;2;False;LovelyDay;ffd7sb2;Hot Take: BCH Funding Proposal is a tempest in a teapot.;esyla1;https://www.reddit.com/r/btc/comments/esyla1/hot_take_bch_funding_proposal_is_a_tempest_in_a/
"well new chain split incoming

bch

bnx - bitcoin no tax";1;1;False;ultimatehub24;ffczc0d;Hot Take: BCH Funding Proposal is a tempest in a teapot.;esyla1;https://www.reddit.com/r/btc/comments/esyla1/hot_take_bch_funding_proposal_is_a_tempest_in_a/
"I disagree. Seems to me that most people agree with the funding idea but bashing the original proposal of piping it into a privately controlled legal entity in a potentially problematic jurisdiction. I would expect nothing less from a healthy community.

It is important to distinguish the fact that the sum is not coming out of miners' pockets, so the control of funds calls for a tempest. This is a part of the regular issuance that is not paid for in the form of hash work, so *it still belongs to all the stakeholders who bear the cost of inflation*.

I hope the community favors the sensible route of doing this transparently through an on-chain contract.";1;1;False;fatoshi;ffd8e9e;Hot Take: BCH Funding Proposal is a tempest in a teapot.;esyla1;https://www.reddit.com/r/btc/comments/esyla1/hot_take_bch_funding_proposal_is_a_tempest_in_a/
12.5% is a bit over the top for a cartel though, the temptation for insiders to cheat is great, and it increases the profit for outsiders. This is how cartels are kept in check in the market by the way.;2;0;False;ErdoganTalk;ffd1p0b;Hot Take: BCH Funding Proposal is a tempest in a teapot.;esyla1;https://www.reddit.com/r/btc/comments/esyla1/hot_take_bch_funding_proposal_is_a_tempest_in_a/
well said. Bitcoin is ran by miners and majority gets to call the shots. This is how Satoshi intended it, and not 1 Bitcoin Core overrides everyone.;4;1;False;500239;ffd629z;Hot Take: BCH Funding Proposal is a tempest in a teapot.;esyla1;https://www.reddit.com/r/btc/comments/esyla1/hot_take_bch_funding_proposal_is_a_tempest_in_a/
"Yeah, i agree with your assessment here. If it turns out this is a problem, then it would be systemic. It would mean we would have to completely redesign Bitcoin, we might even have to go to proof of stake or something. But there's clear advantages to proof of work, so there's no reason to freak out until the philosophy of Bitcoin gets destroyed as a result of it's mechanisms.

You can't really be against the miners being able to make executive decisions, if you truly like Bitcoin Cash.";5;1;False;J-Stodd;ffd0c2y;Hot Take: BCH Funding Proposal is a tempest in a teapot.;esyla1;https://www.reddit.com/r/btc/comments/esyla1/hot_take_bch_funding_proposal_is_a_tempest_in_a/
"> They use the same hardware and the same electricity.

But they mine different chains. This only applies to miners that are purely chain agnostic. That might be most of them, but certainly not all.";1;0;False;Twoehy;ffdfwbq;Hot Take: BCH Funding Proposal is a tempest in a teapot.;esyla1;https://www.reddit.com/r/btc/comments/esyla1/hot_take_bch_funding_proposal_is_a_tempest_in_a/
"I want to support bch, but not this compulsory mining rule.
mining is business, and every cent count for them, cheaper electricity is an edge. what about -12% of your profit?";0;1;False;ultimatehub24;ffd0eyr;Hot Take: BCH Funding Proposal is a tempest in a teapot.;esyla1;https://www.reddit.com/r/btc/comments/esyla1/hot_take_bch_funding_proposal_is_a_tempest_in_a/
Investing Tip: Past performance is not an indicator of future results.;11;0;False;addiscoin;ffcy5kq;Why BTC is about to rise up again above 9000!;esyfb1;https://www.reddit.com/r/btc/comments/esyfb1/why_btc_is_about_to_rise_up_again_above_9000/
Speculator's are the worst;3;0;False;DCdek;ffdbw58;Why BTC is about to rise up again above 9000!;esyfb1;https://www.reddit.com/r/btc/comments/esyfb1/why_btc_is_about_to_rise_up_again_above_9000/
that this dev funding proposal instantly triggered the anti-Ver BCH trolls makes me think  it will be a good thing.;11;1;False;spukkin;ffcxkqf;look at me;esy44t;https://imgflip.com/i/3mzy9s
"looks like a tax, if you want to mine bch

i rather buy bch than mine it

advice for all miners, dont mine it, buy it, you get 12.5 % premium";4;0;False;ultimatehub24;ffcyopt;look at me;esy44t;https://imgflip.com/i/3mzy9s
"I'm a fan of Roger, but still think this is funny. Maybe people need to lighten up a little.

Saying that a miner ""must"" accept a block they don't want to is no different saying a miner mustn't accept a block they want to. If you have the hash to back it up, then do what you want. Maybe this is a bad idea, but it's not against the philosophy of Bitcoin as far as I can tell.";2;0;False;RireBaton;ffdcfsu;look at me;esy44t;https://imgflip.com/i/3mzy9s
"Nice one! Someone should make another one that says ""Taxation is theft... except when I'm the taxman!""";-3;1;False;feejarndyce;ffcwuj7;look at me;esy44t;https://imgflip.com/i/3mzy9s
if you don't conceptualize voluntarism good and the first thought move is a troll army then ...  good luck in this space.  look back on my history I was pro-ver years back.  with this move roger is either ignorant of a part of the protocol, ignorant of a part of economics, nefarious, or coerced.  idk which.;-1;1;False;capistor;ffd6tct;look at me;esy44t;https://imgflip.com/i/3mzy9s
"That's actually a great idea.  


/u/memorydealers why are you hiding?";0;1;False;usrn;ffcxj8x;look at me;esy44t;https://imgflip.com/i/3mzy9s
i get that some people are seeing this proposal as having a coercive element, but that seems to be a matter of opinion. if you're trying to make a convincing argument, you'll have to do better than using the same puerile tactics of garden-variety trolls.;1;1;False;spukkin;ffd8oky;look at me;esy44t;https://imgflip.com/i/3mzy9s
u/cryptochecker;-1;2;False;J-Stodd;ffcxlk9;look at me;esy44t;https://imgflip.com/i/3mzy9s
yes it's arguable not a tax because can switch coins or fork.  it's also arguably a tax at least in the spirit of  taking block rewards by brute force.;-1;0;False;capistor;ffdasg7;look at me;esy44t;https://imgflip.com/i/3mzy9s
"Of [u/usrn](https://www.reddit.com/u/usrn)'s last **1583** posts (**584** submissions + **999** comments), I found **524** in cryptocurrency-related subreddits. This user is most active in these subreddits:

Subreddit|No. of posts|Total karma|Average|[Sentiment](https://nlpforhackers.io/sentiment-analysis-intro/)
:--|:--|:--|:--|:--|:--|:--
r/Bitcoin|86|2518|29.3|Neutral|
r/bitcoin_uncensored|55|594|10.8|Neutral|
r/BitcoinMining|7|53|7.6|Neutral|
r/bitcoinxt|35|536|15.3|Neutral|
r/btc|287|4366|15.2|Neutral|
r/Buttcoin|7|125|17.9|Neutral|
r/ethereum|6|8|1.3|Neutral|
r/ethtrader|5|22|4.4|Neutral|
r/Monero|19|388|20.4|Neutral|

See [here](https://reddit.com/r/cryptochecker/esyf39) for more detailed results, including less active cryptocurrency subreddits.
***

^(Bleep, bloop, I'm a bot trying to help inform cryptocurrency discussion on Reddit.) ^| [^Usage](https://www.reddit.com/user/cryptochecker/comments/atbifk/how_to_use_ucryptochecker/) ^| [^FAQs](https://www.reddit.com/user/cryptochecker/comments/ascogw/faq_about_ucryptochecker_2019/) ^| [^Feedback](https://www.reddit.com/message/compose?to=jamcowl&subject=cryptochecker%20bot) ^| [^Tips](https://www.reddit.com/user/cryptochecker/comments/ataajr/tipping_ucryptochecker/)";1;0;False;cryptochecker;ffcxn31;look at me;esy44t;https://imgflip.com/i/3mzy9s
"I've been mining bitcoin long before it had any value and I was among the first who called out blockstream and got banned for it.

It's funny that you called the cryptochecker on me. :)";1;1;False;usrn;ffcxyjd;look at me;esy44t;https://imgflip.com/i/3mzy9s
maybe you should compose a thoughtful and informed article laying out your argument rathr than spamming every single thread with hysterical shrieking.;0;1;False;spukkin;ffd5fzk;look at me;esy44t;https://imgflip.com/i/3mzy9s
"> I propose that the control of the key needs to be in the hands of people who have proven they work in the best interest of Bitcoin Cash, even during rough times, have a commitment to infrastructure and a proven track record, such as Jonald Fyookball, Mengerian and myself.

I think it's fair to note that the announcement said that the Corporation would be in control of the funds and not your proposal.

It does seem interesting that everyone who expresses support for this proposal has to express it with *some sort of condition not in the proposal.*";31;1;False;chalbersma;ffcwiyk;On the infrastructure funding plan for Bitcoin Cash (deadalnix);esxgzj;https://read.cash/@deadalnix/on-the-infrastructure-funding-plan-for-bitcoin-cash-bd372a10
Thank you! Added a confirmation badge.;23;0;False;readcash;ffcrnz7;On the infrastructure funding plan for Bitcoin Cash (deadalnix);esxgzj;https://read.cash/@deadalnix/on-the-infrastructure-funding-plan-for-bitcoin-cash-bd372a10
PSA - Warning: Extreme Shill and Enemy of P2P Money /u/chazley in parent comment.;5;1;False;ShadowOfHarbringer;ffdbtkt;On the infrastructure funding plan for Bitcoin Cash (deadalnix);esxgzj;https://read.cash/@deadalnix/on-the-infrastructure-funding-plan-for-bitcoin-cash-bd372a10
">The anti-BCH forces hate that this proposal may succeed in supporting accelerated BCH development. They fear we will be able to fully scale for worldwide adoption before they can stop us.

BCH blocks are 0.1 MB, I think we're pretty close to worldwide adoption.";2;1;False;feejarndyce;ffdbybr;On the infrastructure funding plan for Bitcoin Cash (deadalnix);esxgzj;https://read.cash/@deadalnix/on-the-infrastructure-funding-plan-for-bitcoin-cash-bd372a10
This is a good response. No need to waste time on elaborating on your opinion, just leave a drive by complaint.;3;1;False;tcrypt;ffd0db9;On the infrastructure funding plan for Bitcoin Cash (deadalnix);esxgzj;https://read.cash/@deadalnix/on-the-infrastructure-funding-plan-for-bitcoin-cash-bd372a10
