 Bitcoin Market Academy Teaching, Analysis, and Analysis in the Field of Excellence, Blockachine, Mining, Throat Beat Kevin, Ethereum, Market Analysis Ramzars (Cursive Currencies), Wallet in [bazarbtc.com](https://www.bazarbtc.com/)
Nice username.  How do you remember that?
Buy high, sell low. That's the true secret.
I think my phone is upside down
To the fucking moon! LAMBO! lol
I need some btc please donate some bitcoin in this address 33BQsNPLPTt4brpZhs8HVm4GeKW4Zfcd7d
Got it from the News Reel 🌠
It will just be his dick pics but with the names of senators drawn on him in ballpoint pen.
This post was brought to my attention because it just showed up in my Google feed. The rise continues!
Wow bitcoin sub actually made it to my top reddit news feed page
It's a tipping robot that dispenses Bitcoin via the lightning network 😁
What is lntip?
