body;score;nb_replies;stickied;author;id;post_title;post_id;post_link
"Harriet Tubman helped people who's lives were directly in danger.  I don't think all laws are just but come on if you want me to cry over Ross Ulbricht being a victim of the war on drugs.  

>I'm also against harsh drug sentencing but at the same time I'm not going to try to prop up everyone who attempts to circumvent drug law as a saint. ";1;0;False;Jorge_ElChinche;dl6dgdi;Hi, my name is Ross Ulbricht;6cp2ql;https://i.redd.it/djb8i3hoh3zy.jpg
How so? Some laws are bad and harmful to people. Would you have had Harriet Tubman just obey the law? Do you think the war on drugs is a good thing?;1;1;False;naomibrockwell;dl6b6e0;Hi, my name is Ross Ulbricht;6cp2ql;https://i.redd.it/djb8i3hoh3zy.jpg
[deleted];402;5;False;;dl5jqhd;Two biggest Bitcoin subs according to their counterparts (posted on both subs);6rjzu2;https://i.redd.it/hl4l7joqnpdz.png
[deleted];1;1;False;;dl66qwp;Two biggest Bitcoin subs according to their counterparts (posted on both subs);6rjzu2;https://i.redd.it/hl4l7joqnpdz.png
"I'm not sure that's exactly how the many-worlds interpretation works?

~~*throws a kaleidostick at you and runs*~~";2;1;False;Lyndis_Caelin;dl5qavo;Two biggest Bitcoin subs according to their counterparts (posted on both subs);6rjzu2;https://i.redd.it/hl4l7joqnpdz.png
"> is guaranteed to get you banned assuming the many-worlds interpretation is true.

FTFY.";10;0;False;supermari0;dl5qrob;Two biggest Bitcoin subs according to their counterparts (posted on both subs);6rjzu2;https://i.redd.it/hl4l7joqnpdz.png
"> Assuming the admins enforce rules

FTFY";35;1;False;Insxnity;dl5pzku;Two biggest Bitcoin subs according to their counterparts (posted on both subs);6rjzu2;https://i.redd.it/hl4l7joqnpdz.png
Here I was racking my brain trying to think of whether or not it was intended as a slight, and if so, how it was insulting. My brain hurts now.;3;1;False;SharpMud;dl67k2u;Two biggest Bitcoin subs according to their counterparts (posted on both subs);6rjzu2;https://i.redd.it/hl4l7joqnpdz.png
I'm not disagreeing, but a lot of people make a mistake thinking what the community wants with what vocal minority wants.;3;1;False;ModerateBrainUsage;dl64jbj;Two biggest Bitcoin subs according to their counterparts (posted on both subs);6rjzu2;https://i.redd.it/hl4l7joqnpdz.png
"sounds reasonable.

>Reddit Enhancement Suite

is this a browser plugin?
";9;3;False;Amichateur;dl5zd9e;Two biggest Bitcoin subs according to their counterparts (posted on both subs);6rjzu2;https://i.redd.it/hl4l7joqnpdz.png
"Me and my best friend dispute over what to do in scenarios like that. He takes more of your approach, the ""he won't actually change his mind, it's not worth the time"" approach.


Personally, I'm a fan of educating. Talking politely, acknowledge both sides and be the bigger person. My goal isn't to change the other persons mind, but instead to be informational so when an outsider who hasn't made up their mind comes along, they have a more neutral informational comment to read instead of being force fed the vocal minorities opinion";11;1;False;SunliMin;dl68ga3;Two biggest Bitcoin subs according to their counterparts (posted on both subs);6rjzu2;https://i.redd.it/hl4l7joqnpdz.png
You're about 4 years late. Nice of you to finally join us.;1;0;False;albinopotato;dl6dq13;Two biggest Bitcoin subs according to their counterparts (posted on both subs);6rjzu2;https://i.redd.it/hl4l7joqnpdz.png
no problem with that;3;1;False;oliverlikes;dl664xw;Two biggest Bitcoin subs according to their counterparts (posted on both subs);6rjzu2;https://i.redd.it/hl4l7joqnpdz.png
I want it done before the need becomes immediate.;1;1;False;Natanael_L;dl6dslk;Two biggest Bitcoin subs according to their counterparts (posted on both subs);6rjzu2;https://i.redd.it/hl4l7joqnpdz.png
"If transaction fees are cheaper, whats stopping a spammer from filling up 8MB blocks with spammy transactions?

Sure, they will have to make more transactions, but each transaction will have a lower fee. if the tx fee is at least 8x lower then it is cheaper to spam attack bcash than Bitcoin.

Bcash users would then have to outbid the spammer, which will cause rising tx fees and txes to get stuck and would make 0 confirmation txes unsafe, once again.";2;0;False;cowardlyalien;dl5rv0o;Two biggest Bitcoin subs according to their counterparts (posted on both subs);6rjzu2;https://i.redd.it/hl4l7joqnpdz.png
"The thing that gets me about ethereum is all the accusations of centralization while the ""good news"" posted about its development being picked up usually links back to Russia's oligarchy,ie tests by Russian banks, Russian industry, butters meeting with Putin.";1;2;False;Spacetard5000;dl5p5np;Two biggest Bitcoin subs according to their counterparts (posted on both subs);6rjzu2;https://i.redd.it/hl4l7joqnpdz.png
*Most* ICOs are scams. Some are legit ways to fund development. Regardless, Ethereum can do many things. Many cryptos could benefit from being Ethereum based. Some decided to go with Ethereum (think Golem). That means that the Ethereum team can focus on scaling the chain, researching things like PoS, etc, while the Golem team can focus on Golem. Ethereum's main purpose is not store of value, value is just a necessity for it to function.;4;0;False;25isthesquareof5;dl5q89f;Two biggest Bitcoin subs according to their counterparts (posted on both subs);6rjzu2;https://i.redd.it/hl4l7joqnpdz.png
"I deliberately wrote ""How many"" instead of ""Do you see any"", thinking of that one :-D";3;1;False;25isthesquareof5;dl5wzzw;Two biggest Bitcoin subs according to their counterparts (posted on both subs);6rjzu2;https://i.redd.it/hl4l7joqnpdz.png
"Litecoin is a nice attempt to ""reboot"" bitcoin, deleting the history, changing the block time, etc. I like Litecoin and it certainly has it's place in the crypto space. It just doesn't have any new technology. Bcash is the same in many respects. It changed parameters, just like Litecoin, but it didn't erase history. It doesn't have the adoption of Bitcoin, the cleanness of Litecoin, or the technology of Ethereum. It really doesn't have a lot going for it, but hey, it put an end to *The Bitcoin Scaling War*.";1;3;False;25isthesquareof5;dl5twba;Two biggest Bitcoin subs according to their counterparts (posted on both subs);6rjzu2;https://i.redd.it/hl4l7joqnpdz.png
"Woah, woah, hold on there, friend.  Check your facts.

Adam Jones doesn't play bass.  Justin Chancellor is Tool's bassist.";1;1;False;merreborn;dl63mit;Two biggest Bitcoin subs according to their counterparts (posted on both subs);6rjzu2;https://i.redd.it/hl4l7joqnpdz.png
By lizard he means Jews.;2;2;False;BaggaTroubleGG;dl5nqoj;Two biggest Bitcoin subs according to their counterparts (posted on both subs);6rjzu2;https://i.redd.it/hl4l7joqnpdz.png
[deleted];1;1;False;;dl5qvmd;Two biggest Bitcoin subs according to their counterparts (posted on both subs);6rjzu2;https://i.redd.it/hl4l7joqnpdz.png
Only if they care about the split;3;0;False;Natanael_L;dl5vptk;Two biggest Bitcoin subs according to their counterparts (posted on both subs);6rjzu2;https://i.redd.it/hl4l7joqnpdz.png
He's actually serious. I know because I've tried to discuss with him before.;8;2;False;Natanael_L;dl5vthp;Two biggest Bitcoin subs according to their counterparts (posted on both subs);6rjzu2;https://i.redd.it/hl4l7joqnpdz.png
"The nicest way I can put it is this: miners see a short term profit to BCH, and they're trying to obfuscate the discussion around the blockchain for their advantage.

The reason I claim this is because there is no technical advantage or inherent value proposition to BCH over BTC. That's why it's a bubble as opposed to a legitimate competitor. But there are those with vested interest to make it seem like there is more to it.";3;1;False;Protossoario;dl62gqt;Two biggest Bitcoin subs according to their counterparts (posted on both subs);6rjzu2;https://i.redd.it/hl4l7joqnpdz.png
"It's like a company spin-off (one part of a company becoming independent). Except created by some of the users, instead of created by the management. It's a separate thing now. 

Like another altcoin, except built on a snapshot of the existing Bitcoin including its blockchain.";1;0;False;Natanael_L;dl6c6lw;Two biggest Bitcoin subs according to their counterparts (posted on both subs);6rjzu2;https://i.redd.it/hl4l7joqnpdz.png
BCash = free money;2;0;False;Idiocracyis4real;dl6ajpu;Two biggest Bitcoin subs according to their counterparts (posted on both subs);6rjzu2;https://i.redd.it/hl4l7joqnpdz.png
">Assuming the MODS aren't 

FTFY";8;2;False;betsyforhope;dl5udd6;Two biggest Bitcoin subs according to their counterparts (posted on both subs);6rjzu2;https://i.redd.it/hl4l7joqnpdz.png
"Lol same here, ""I was like man, he really doesn't like those guys"" ";4;0;False;asthekushburns;dl6c95k;Two biggest Bitcoin subs according to their counterparts (posted on both subs);6rjzu2;https://i.redd.it/hl4l7joqnpdz.png
That's right. We can imagine a war between a community B1 and a community B2. At some point, a part of community B1 is heated so much they decided to form a sub-community (B1sub) and begin an actual fight (after specific day in the future). A lot of members of parent community don't want the conflict, though they can't do anything about it. They can stand still and watch how that fight will turn, but if B1sub will lose, the whole B1 will lose. That said, it's always better to do the best to prevent the conflict, but if the battle began, it's better to cooperate as a whole. Unfortunately, that was not the case in BIP148. Hopefully, we will win. Though, the battle is not over, there is a possibility of huge manipulation from the B2 until the end of the year.;1;0;False;;dl65mh3;Two biggest Bitcoin subs according to their counterparts (posted on both subs);6rjzu2;https://i.redd.it/hl4l7joqnpdz.png
Yes, and it lets you read and modify tags directly in json form so one could conceivably share or analyze tags with some additional work.;2;1;False;dsterry;dl615rl;Two biggest Bitcoin subs according to their counterparts (posted on both subs);6rjzu2;https://i.redd.it/hl4l7joqnpdz.png
">is this a browser plugin?

Yes, and it's too bad it's *just* that. A lot of its features would be really nice in vanilla Reddit.";6;2;False;anothga;dl659eo;Two biggest Bitcoin subs according to their counterparts (posted on both subs);6rjzu2;https://i.redd.it/hl4l7joqnpdz.png
Yes.;9;1;False;-Badger2-;dl5zm9i;Two biggest Bitcoin subs according to their counterparts (posted on both subs);6rjzu2;https://i.redd.it/hl4l7joqnpdz.png
The purpose of debate isn't to change the mind of those debating, it's to help third party observers make up their mind.;13;1;False;;dl6cus9;Two biggest Bitcoin subs according to their counterparts (posted on both subs);6rjzu2;https://i.redd.it/hl4l7joqnpdz.png
Sure, lmao. Head to target and trying paying in bitcoin. What a joke. ;-1;1;False;TheKingoftheBlind;dl672tx;Two biggest Bitcoin subs according to their counterparts (posted on both subs);6rjzu2;https://i.redd.it/hl4l7joqnpdz.png
"He's not. I've heard this accusation before, then was told to check his twitter for proof, nothing indicated he was a socialist. Do you have any proof? 

Edit: Woopsies, I thought the above comment was calling andreas a socialist, for some reason. ";2;1;False;ToTheMewn;dl5x8et;Two biggest Bitcoin subs according to their counterparts (posted on both subs);6rjzu2;https://i.redd.it/hl4l7joqnpdz.png
"This too.... Also, as if the ""Ethereum Alliance"" is a good thing... lol";0;1;False;finitemaz;dl5s6t8;Two biggest Bitcoin subs according to their counterparts (posted on both subs);6rjzu2;https://i.redd.it/hl4l7joqnpdz.png
"> It just doesn't have any new technology.

Uh, like segwit?";1;1;False;b734e851dfa70ae64c7f;dl6e8gp;Two biggest Bitcoin subs according to their counterparts (posted on both subs);6rjzu2;https://i.redd.it/hl4l7joqnpdz.png
Fuck it, I can never see them when they are playing anyway and they both hold guitar looking things when in silhouette.;2;0;False;2daMooon;dl63r2y;Two biggest Bitcoin subs according to their counterparts (posted on both subs);6rjzu2;https://i.redd.it/hl4l7joqnpdz.png
No. He GENUINELY means lizards. It's the ADL that insist he means Jews. ;1;0;False;SuIIy;dl66qwi;Two biggest Bitcoin subs according to their counterparts (posted on both subs);6rjzu2;https://i.redd.it/hl4l7joqnpdz.png
Is that so? I thought it's a funny joke, but if that's an implicit antisemitism, I stay away.;2;3;False;LamboMoonwalker;dl5otwd;Two biggest Bitcoin subs according to their counterparts (posted on both subs);6rjzu2;https://i.redd.it/hl4l7joqnpdz.png
"Oh yes, bearwhale...kudos to you guys, I watched in awe the eating up the 10,000 coin wall in a matter of hours.

Would love for bearwhale to do an AMA here. I guess we will never discover who it was though.";1;1;False;xygo;dl5upcb;Two biggest Bitcoin subs according to their counterparts (posted on both subs);6rjzu2;https://i.redd.it/hl4l7joqnpdz.png
"> nothing indicated he was a socialist

l2reed

He's the polar opposite of a socialist, hence why they think he's evil.";1;1;False;BaggaTroubleGG;dl5xo1e;Two biggest Bitcoin subs according to their counterparts (posted on both subs);6rjzu2;https://i.redd.it/hl4l7joqnpdz.png
^ ditto;1;0;False;ErisianBuddhist;dl5p8fy;Two biggest Bitcoin subs according to their counterparts (posted on both subs);6rjzu2;https://i.redd.it/hl4l7joqnpdz.png
"If you are a socialist you either don't understand socialism or Bitcoin (happy to get convinced that I'm wrong on this).

Unless you are an anarcho-socialist that agrees with the NAP (which I haven't found many).";1;4;False;lclc_;dl5pcfw;Two biggest Bitcoin subs according to their counterparts (posted on both subs);6rjzu2;https://i.redd.it/hl4l7joqnpdz.png
"You yourself didn't justify why segwit is so much better. Segwit (it adopted by most wallets) mostly just reduces validation cost for transactions with many signatures. Meanwhile it actually increases the total raw size of blocks with the same transactions as a non-segwit block, because the segwit commitments adds overhead.

To small miners, a segwit block with 2 MB of raw data (transaction data + signatures / witness) is close to equal to a plain 2 MB block.";2;1;False;Natanael_L;dl64c8q;Two biggest Bitcoin subs according to their counterparts (posted on both subs);6rjzu2;https://i.redd.it/hl4l7joqnpdz.png
"> about its development being picked up usually links back to Russia's oligarchy,ie tests by Russian banks, Russian industry, butters meeting with Putin.

Look at the Ethereum Alliance, not many Russian companies in there. Or forks like Quorum by JP morgan (one of the most ""American"" companies there is). Not quite sure what news you are reading if you think everything happening in Ethereum is related to Russia..";4;1;False;askmike;dl5qfg8;Two biggest Bitcoin subs according to their counterparts (posted on both subs);6rjzu2;https://i.redd.it/hl4l7joqnpdz.png
"And he's totally right, too. What all of those ""alt-coins"" have in common is their lack of real market value due to the fact that they propose no unique technical advantages or trade-offs over Bitcoin. This makes them essentially useless since they offer no alternative or improved applications of the original tech. If they did, they'd each find their individual use and gain some adoption, much like LTC or ETH. But because they don't, and the people defending them typically resort to vacuous arguments and conspiracy theories, it's clear that these currencies are only a scheme to gain an edge in the crypto market.";-1;3;False;Protossoario;dl5x6fs;Two biggest Bitcoin subs according to their counterparts (posted on both subs);6rjzu2;https://i.redd.it/hl4l7joqnpdz.png
As a socialist, let me say I think he's awesome. ;6;2;False;dalebewan;dl5oxm7;Two biggest Bitcoin subs according to their counterparts (posted on both subs);6rjzu2;https://i.redd.it/hl4l7joqnpdz.png
"OTOH nullc simultaneously opposed UASF for being unsafe

https://lists.linuxfoundation.org/pipermail/bitcoin-dev/2017-April/014152.html";6;0;False;Natanael_L;dl5rwes;Two biggest Bitcoin subs according to their counterparts (posted on both subs);6rjzu2;https://i.redd.it/hl4l7joqnpdz.png
">  How many ICOs do you see on Bitcoin? 

Let's not forget that ethereum itself was launched with a bitcoin ICO.";1;1;False;boldra;dl5wmc8;Two biggest Bitcoin subs according to their counterparts (posted on both subs);6rjzu2;https://i.redd.it/hl4l7joqnpdz.png
"Litecoin is not trying to pass itself off as an already established project.  

Litecoin is a legitimate altcoin, with its own name and blockchain. 

Bcach is just another in a long line of Jihan, Ver & CO's hostile takeover attempts. 

There is no comparison. ";3;1;False;Terminal-Psychosis;dl5t1nm;Two biggest Bitcoin subs according to their counterparts (posted on both subs);6rjzu2;https://i.redd.it/hl4l7joqnpdz.png
:-);1;0;False;PinochetIsMyHero;dl68z20;Two biggest Bitcoin subs according to their counterparts (posted on both subs);6rjzu2;https://i.redd.it/hl4l7joqnpdz.png
Based 'Adam Jones';1;0;False;;dl5lucc;Two biggest Bitcoin subs according to their counterparts (posted on both subs);6rjzu2;https://i.redd.it/hl4l7joqnpdz.png
Guitarist for Tool is the lead proponent of the lizard men theory? That actually doesn't sound wrong, though I think you mean Alex. :);1;1;False;2daMooon;dl5oa8k;Two biggest Bitcoin subs according to their counterparts (posted on both subs);6rjzu2;https://i.redd.it/hl4l7joqnpdz.png
[deleted];6;1;False;;dl5mya6;Two biggest Bitcoin subs according to their counterparts (posted on both subs);6rjzu2;https://i.redd.it/hl4l7joqnpdz.png
lol, OP has to go register somewhere to collect that sixty eight cents you're trying to tip?;2;1;False;Sovereign_Curtis;dl5z96x;Two biggest Bitcoin subs according to their counterparts (posted on both subs);6rjzu2;https://i.redd.it/hl4l7joqnpdz.png
thanks! t-shirt would've been great.  I'd buy a couple for sure.;1;0;False;teksimian;dl666wv;Two biggest Bitcoin subs according to their counterparts (posted on both subs);6rjzu2;https://i.redd.it/hl4l7joqnpdz.png
millibitcoin = 0,001 BTC = or 1 mBTC = ~$2.8;1;0;False;oliverlikes;dl65fqw;Two biggest Bitcoin subs according to their counterparts (posted on both subs);6rjzu2;https://i.redd.it/hl4l7joqnpdz.png
Catastroshi.;14;0;False;Schrodingers_tombola;dl5mbqy;Two biggest Bitcoin subs according to their counterparts (posted on both subs);6rjzu2;https://i.redd.it/hl4l7joqnpdz.png
ðŸ™;1;0;False;cgminer;dl5mjhi;Two biggest Bitcoin subs according to their counterparts (posted on both subs);6rjzu2;https://i.redd.it/hl4l7joqnpdz.png
Because he invested in r/btc;17;0;False;siccoblue;dl5vlqu;Two biggest Bitcoin subs according to their counterparts (posted on both subs);6rjzu2;https://i.redd.it/hl4l7joqnpdz.png
Dibs on Reptile-Man;6;0;False;timmy12688;dl5rbca;Two biggest Bitcoin subs according to their counterparts (posted on both subs);6rjzu2;https://i.redd.it/hl4l7joqnpdz.png
Socialists;5;3;False;BaggaTroubleGG;dl5nppn;Two biggest Bitcoin subs according to their counterparts (posted on both subs);6rjzu2;https://i.redd.it/hl4l7joqnpdz.png
"he's pretty pro segwit so I'm sure the anti-segwit camp thinks of him as ""the other side"".";11;3;False;bradlbauer;dl5oemt;Two biggest Bitcoin subs according to their counterparts (posted on both subs);6rjzu2;https://i.redd.it/hl4l7joqnpdz.png
"I didn't realize there were such strong opinions on crypto currency on here. I mostly have just sort of though ""it's a cool idea, but I don't really want to get involved when I see it sometimes double or half in value over night"" 

It does make sense that there'd be argument now that I think of it. Nerdy people are typically obsessive and it causes a lot of arguments. ";2;1;False;just_comments;dl6e290;Two biggest Bitcoin subs according to their counterparts (posted on both subs);6rjzu2;https://i.redd.it/hl4l7joqnpdz.png
"It requires more storage space and processing power and bandwidth by miners, exactly the same way as a simple block size increase would (with some tradeoffs). 

Segwit mostly just allows you to prune more data when storing the blockchain, and allows non-verifying nodes to save bandwidth.";4;1;False;Natanael_L;dl5z26y;Two biggest Bitcoin subs according to their counterparts (posted on both subs);6rjzu2;https://i.redd.it/hl4l7joqnpdz.png
"> theory

And now we get to test the theory...";3;0;False;Sovereign_Curtis;dl5y0dy;Two biggest Bitcoin subs according to their counterparts (posted on both subs);6rjzu2;https://i.redd.it/hl4l7joqnpdz.png
Yeah, well that's just your opinion man.;8;0;False;misfortunecat;dl5x33q;Two biggest Bitcoin subs according to their counterparts (posted on both subs);6rjzu2;https://i.redd.it/hl4l7joqnpdz.png
anything that is seen as a threat is bad.;1;0;False;kharlos;dl62l9k;Two biggest Bitcoin subs according to their counterparts (posted on both subs);6rjzu2;https://i.redd.it/hl4l7joqnpdz.png
"Just opinions here... ICOs are scams.  Ethereum's only utility is for scams.  Bloated chain.  Never meant to be a store of value / or good ""money"".  Massive 72 million ETH premine. 

Litecoin has already won scaling and has Segwit.  LN development, tumblebit, rsk, etc...

Just my opinion of course...";-1;2;False;finitemaz;dl5nksz;Two biggest Bitcoin subs according to their counterparts (posted on both subs);6rjzu2;https://i.redd.it/hl4l7joqnpdz.png
"The minor chain should be cheaper, but not faster - with two caveats ...

* on the minor chain, a transaction won't be ""stuck unconfirmed"", any transaction with any insignificant amount of fee paid will almost certainly be processed within some few blocks.

* If one can trust zero-conf transactions on the minor chain (one is supposed to), transactions can be considered ""instant"" (in the current climate, I wouldn't trust zero-conf transactions from anonymous sources on any of the chains)

The minor chain currently has too few miners compared to the difficulty, hence the block frequency is fairly low.  This was expected and predicted, and will probably sort itself out in due time.

Since there isn't that much security on the minor chain, the exchanges will demand more confirmations before the deposit is accepted.
";1;1;False;tobixen;dl5rck5;Two biggest Bitcoin subs according to their counterparts (posted on both subs);6rjzu2;https://i.redd.it/hl4l7joqnpdz.png
"I agree with many of the core devs who think a larger block size may be a good thing in the future if necessary, but ""Show them we really need big blocks"" implies that we immediately need big blocks. ";1;1;False;ToTheMewn;dl616fl;Two biggest Bitcoin subs according to their counterparts (posted on both subs);6rjzu2;https://i.redd.it/hl4l7joqnpdz.png
Yeah, so please explain to me how that increases centralization? Or for that matter, how increasing the block size is even remotely a competitive alternative? Because to me, it seems like that is just a workaround that won't help in the long term, while also having the side effect of dramatically reducing competitiveness of smaller miners.;1;1;False;Protossoario;dl639qg;Two biggest Bitcoin subs according to their counterparts (posted on both subs);6rjzu2;https://i.redd.it/hl4l7joqnpdz.png
Still dont get it;3;1;False;BrowsesATon;dl635dv;Two biggest Bitcoin subs according to their counterparts (posted on both subs);6rjzu2;https://i.redd.it/hl4l7joqnpdz.png
Please, let us behave. For once.;4;1;False;PehrGGyllenpenis;dl61647;Two biggest Bitcoin subs according to their counterparts (posted on both subs);6rjzu2;https://i.redd.it/hl4l7joqnpdz.png
I can't tell if this comment is serious or not.;12;1;False;hiver;dl5trro;Two biggest Bitcoin subs according to their counterparts (posted on both subs);6rjzu2;https://i.redd.it/hl4l7joqnpdz.png
"But how do we identify a compromised crypto? Is BTC compromised or is BCH compromised? Both? If so what evidence is there? How can we trust the evidence?

This whole thing reminds me of an article I read about what a sophisticated state sponsored social engineering attack would look like. ";3;0;False;liberated_u;dl60vze;Two biggest Bitcoin subs according to their counterparts (posted on both subs);6rjzu2;https://i.redd.it/hl4l7joqnpdz.png
Doesnt constant splitting devalue the currencies though? If people don't feel a currency will stick around they will not invest in it.;8;1;False;Jables237;dl5uib5;Two biggest Bitcoin subs according to their counterparts (posted on both subs);6rjzu2;https://i.redd.it/hl4l7joqnpdz.png
"I have to disagree. There has been a concerted effort to disrupt the Bitcoin community for a very long time. 

There have been people who have been flipped to attack us from the inside out. A massive smear campaign in the media lasting years. 

Bitcoin has been under attack for a long time. As Bitcoin has resisted these attacks and continued to prosper; the attacks are ramping up in scale.";2;0;False;45sbvad;dl6ccjs;Two biggest Bitcoin subs according to their counterparts (posted on both subs);6rjzu2;https://i.redd.it/hl4l7joqnpdz.png
"> If only that passion could be channeled, instead of dispersing in a cloud of rhetoric and vitriol.


So very true. The amount of energy wasted fighting silly semantics is ridiculous sometimes.";7;0;False;SunliMin;dl68lru;Two biggest Bitcoin subs according to their counterparts (posted on both subs);6rjzu2;https://i.redd.it/hl4l7joqnpdz.png
[deleted];0;1;False;;dl66xik;Two biggest Bitcoin subs according to their counterparts (posted on both subs);6rjzu2;https://i.redd.it/hl4l7joqnpdz.png
