body;score;nb_replies;stickied;author;id;post_title;post_id;post_link
This is so spot on that my first thought was: what the hell did I invest in!? ;1;0;False;Erulian;dl5vzce;Two biggest Bitcoin subs according to their counterparts (posted on both subs);6rjzu2;https://i.redd.it/hl4l7joqnpdz.png
Correct;1;0;False;Ajegwu;dl5vejl;Two biggest Bitcoin subs according to their counterparts (posted on both subs);6rjzu2;https://i.redd.it/hl4l7joqnpdz.png
Brilliant. Well done.;1;0;False;guysir;dl5unrb;Two biggest Bitcoin subs according to their counterparts (posted on both subs);6rjzu2;https://i.redd.it/hl4l7joqnpdz.png
Shit, I've been identified.;1;0;False;Scryptk;dl5tl31;Two biggest Bitcoin subs according to their counterparts (posted on both subs);6rjzu2;https://i.redd.it/hl4l7joqnpdz.png
Only one question: why is Dash listed instead of Monero? Market cap should not determine how much better a coin is.... Source:  r/monero;0;1;False;haelansoul;dl5p9a6;Two biggest Bitcoin subs according to their counterparts (posted on both subs);6rjzu2;https://i.redd.it/hl4l7joqnpdz.png
"Its pretty funny, technically though... we all know the correct side ;)";0;0;False;MaxSan;dl5ocyn;Two biggest Bitcoin subs according to their counterparts (posted on both subs);6rjzu2;https://i.redd.it/hl4l7joqnpdz.png
Guess who gonna survive :);0;0;False;bele11;dl5l7mq;Two biggest Bitcoin subs according to their counterparts (posted on both subs);6rjzu2;https://i.redd.it/hl4l7joqnpdz.png
Anti Bitcoin propaganda. Take it back to /bch where it belongs. ;0;1;False;Terminal-Psychosis;dl5s4ny;Two biggest Bitcoin subs according to their counterparts (posted on both subs);6rjzu2;https://i.redd.it/hl4l7joqnpdz.png
the other sub is alt holders who don't want to be called alt holders;0;0;False;yogibreakdance;dl5o6yc;Two biggest Bitcoin subs according to their counterparts (posted on both subs);6rjzu2;https://i.redd.it/hl4l7joqnpdz.png
When somebody asks me to explain the split, I will show them this. Well done, OP. :);1;0;False;professor_bitcon;dl5m4z0;Two biggest Bitcoin subs according to their counterparts (posted on both subs);6rjzu2;https://i.redd.it/hl4l7joqnpdz.png
I think we need bigger blocks... ;1;1;False;clicked121;dl5u0es;Two biggest Bitcoin subs according to their counterparts (posted on both subs);6rjzu2;https://i.redd.it/hl4l7joqnpdz.png
Unfortunately very accurate...;0;0;False;ThePiachu;dl5uaoq;Two biggest Bitcoin subs according to their counterparts (posted on both subs);6rjzu2;https://i.redd.it/hl4l7joqnpdz.png
"and now let us count the lies from

Adam and Andreas vs Roger and Craig Wright. We should add that result to the picture.

";1;0;False;Bitcoin_Bug;dl5rrnj;Two biggest Bitcoin subs according to their counterparts (posted on both subs);6rjzu2;https://i.redd.it/hl4l7joqnpdz.png
"""How to make them suffer?""
""Spam the mem**e**pool to sho that we really need big blocks""

Memepool made me laugh more, than it should ;D";1;0;False;ViennaBTC;dl5ocj7;Two biggest Bitcoin subs according to their counterparts (posted on both subs);6rjzu2;https://i.redd.it/hl4l7joqnpdz.png
Comedy perfection!;1;0;False;jtschroder;dl5q4bb;Two biggest Bitcoin subs according to their counterparts (posted on both subs);6rjzu2;https://i.redd.it/hl4l7joqnpdz.png
You mixed it up.;1;0;False;Maxout2;dl5qapq;Two biggest Bitcoin subs according to their counterparts (posted on both subs);6rjzu2;https://i.redd.it/hl4l7joqnpdz.png
Not really, the information is all there, it's just that it requires a significant amount of research to discern what's real, and what's just a bunch of meaningless buzzwords jumbled together. Current case in point: the arguments in favor of BCH.;3;1;False;Protossoario;dl5xckg;Two biggest Bitcoin subs according to their counterparts (posted on both subs);6rjzu2;https://i.redd.it/hl4l7joqnpdz.png
THIS!! :D;1;1;False;terr547;dl5rd2e;Two biggest Bitcoin subs according to their counterparts (posted on both subs);6rjzu2;https://i.redd.it/hl4l7joqnpdz.png
Top Kek;1;0;False;jQiNoBi;dl5rxmj;Two biggest Bitcoin subs according to their counterparts (posted on both subs);6rjzu2;https://i.redd.it/hl4l7joqnpdz.png
Missed a chance to have opposite exponential graphs for the predicted future price of BCH;1;0;False;Snoopey;dl5rz6i;Two biggest Bitcoin subs according to their counterparts (posted on both subs);6rjzu2;https://i.redd.it/hl4l7joqnpdz.png
"Are we just going to ignore the ""memepool""?";1;0;False;horsenickels;dl5phmh;Two biggest Bitcoin subs according to their counterparts (posted on both subs);6rjzu2;https://i.redd.it/hl4l7joqnpdz.png
"Or some bitcoin?

What is a coffee sized bitcoin unit referred to these days?";6;2;False;CanotCamping;dl5lmfm;Two biggest Bitcoin subs according to their counterparts (posted on both subs);6rjzu2;https://i.redd.it/hl4l7joqnpdz.png
It's money and it's code. That means a ton of nerds (me included) involved, with strong opinions in all directions.;10;1;False;Natanael_L;dl6duxz;Two biggest Bitcoin subs according to their counterparts (posted on both subs);6rjzu2;https://i.redd.it/hl4l7joqnpdz.png
How about BCash instead?;-2;0;False;Idiocracyis4real;dl5miql;Two biggest Bitcoin subs according to their counterparts (posted on both subs);6rjzu2;https://i.redd.it/hl4l7joqnpdz.png
Accurate;6;0;False;BitcoinCitadel;dl5loy9;Two biggest Bitcoin subs according to their counterparts (posted on both subs);6rjzu2;https://i.redd.it/hl4l7joqnpdz.png
Bcash = Fools digital gold;24;1;False;ToTheMewn;dl5so6j;Two biggest Bitcoin subs according to their counterparts (posted on both subs);6rjzu2;https://i.redd.it/hl4l7joqnpdz.png
Best post ever;3;0;False;Impetusin;dl5r7w7;Two biggest Bitcoin subs according to their counterparts (posted on both subs);6rjzu2;https://i.redd.it/hl4l7joqnpdz.png
"Monero is actually good; so wouldn't fit the joke.
";5;1;False;phillipsjk;dl5qbff;Two biggest Bitcoin subs according to their counterparts (posted on both subs);6rjzu2;https://i.redd.it/hl4l7joqnpdz.png
"Currently 4:2 gildings

Edit: now 6:2. Edit 2: up to 7:3";5;0;False;Natanael_L;dl5rkbo;Two biggest Bitcoin subs according to their counterparts (posted on both subs);6rjzu2;https://i.redd.it/hl4l7joqnpdz.png
Username checks out. ;5;0;False;gerikson;dl5x8a1;Two biggest Bitcoin subs according to their counterparts (posted on both subs);6rjzu2;https://i.redd.it/hl4l7joqnpdz.png
"Today is August 4, 2017.


1 bitcoin is currently worth $2,828.50";5;1;False;bathroomstalin;dl68wui;Two biggest Bitcoin subs according to their counterparts (posted on both subs);6rjzu2;https://i.redd.it/hl4l7joqnpdz.png
I gilded you on both subs. A+++ would gild this shitpost again.;4;0;False;Mandrik0;dl5wlkz;Two biggest Bitcoin subs according to their counterparts (posted on both subs);6rjzu2;https://i.redd.it/hl4l7joqnpdz.png
it at least shines a light, kind of, on what the motivation for the split is;12;1;False;xor2g;dl5r01l;Two biggest Bitcoin subs according to their counterparts (posted on both subs);6rjzu2;https://i.redd.it/hl4l7joqnpdz.png
"I miss you, guys :')
/r/btc";26;0;False;-Hegemon-;dl5o2s1;Two biggest Bitcoin subs according to their counterparts (posted on both subs);6rjzu2;https://i.redd.it/hl4l7joqnpdz.png
Can anyone link that image of the controlling entities playing risk?;4;0;False;;dl5x1gr;Two biggest Bitcoin subs according to their counterparts (posted on both subs);6rjzu2;https://i.redd.it/hl4l7joqnpdz.png
"Love it.  A work of genius. 

And strangely accurate.";78;0;False;ismith23;dl5jvr6;Two biggest Bitcoin subs according to their counterparts (posted on both subs);6rjzu2;https://i.redd.it/hl4l7joqnpdz.png
"""Hey, you guys all have the same complaints about each other, maybe there's less disagreement here than you think?""

""STOP TRYING TO DIVIDE US!""";3;0;False;obscuredread;dl6d8v3;Two biggest Bitcoin subs according to their counterparts (posted on both subs);6rjzu2;https://i.redd.it/hl4l7joqnpdz.png
It's also vote brigading and will get you banned. ;86;2;False;DanDarden;dl5p1sd;Two biggest Bitcoin subs according to their counterparts (posted on both subs);6rjzu2;https://i.redd.it/hl4l7joqnpdz.png
I went from checking the new queue here daily to just checking out the threads that ends up on my frontpage sometime in 2015. Too much hostility at that point.;1;0;False;Natanael_L;dl6dyba;Two biggest Bitcoin subs according to their counterparts (posted on both subs);6rjzu2;https://i.redd.it/hl4l7joqnpdz.png
It comes down mainly to a lack of technical understanding, which leads to a lot of petty arguments over moot ideological points. Combine that with the millions of dollar market cap of Bitcoin, and you get a lot of people with vested interest in making more money out of cryptocurrencies manipulating opinions from people that can't be bothered to do the research, so that they can get enough support to move the needle their own way.;34;3;False;Protossoario;dl5wx2m;Two biggest Bitcoin subs according to their counterparts (posted on both subs);6rjzu2;https://i.redd.it/hl4l7joqnpdz.png
+/u/sodogetip 400 doge verify;6;1;False;NiFNi;dl5kr92;Two biggest Bitcoin subs according to their counterparts (posted on both subs);6rjzu2;https://i.redd.it/hl4l7joqnpdz.png
Just pay your taxes and your all good. ;1;0;False;Bitcoin_Acolyte;dl62hp7;Two biggest Bitcoin subs according to their counterparts (posted on both subs);6rjzu2;https://i.redd.it/hl4l7joqnpdz.png
deleted  ^^^^^^^^^^^^^^^^0.7394  [^^^What ^^^is ^^^this?](https://pastebin.com/FcrFs94k/78218);1;0;False;;dl5q0cl;Two biggest Bitcoin subs according to their counterparts (posted on both subs);6rjzu2;https://i.redd.it/hl4l7joqnpdz.png
Many assholes in Bitcoin. More forks coming. ;0;0;False;PetersOdd;dl68zil;Two biggest Bitcoin subs according to their counterparts (posted on both subs);6rjzu2;https://i.redd.it/hl4l7joqnpdz.png
Coming from /r/popular I had no idea that there were two major bitcoin subs on Reddit and that they don't like each other for some reason. ;20;3;False;just_comments;dl66udi;Two biggest Bitcoin subs according to their counterparts (posted on both subs);6rjzu2;https://i.redd.it/hl4l7joqnpdz.png
A tale of two opposing subreddits, laughing together as one.;14;0;False;BitcoinMadeMeDoIt;dl5p6uw;Two biggest Bitcoin subs according to their counterparts (posted on both subs);6rjzu2;https://i.redd.it/hl4l7joqnpdz.png
"Need to reverse the ""How to make them suffer"" info and put nullc instead of Andreas lol";23;2;False;notsobusyguyatwork;dl5mqok;Two biggest Bitcoin subs according to their counterparts (posted on both subs);6rjzu2;https://i.redd.it/hl4l7joqnpdz.png
This is exactly what I learned from frequenting both subs. ;12;0;False;notandxorry;dl5mqzk;Two biggest Bitcoin subs according to their counterparts (posted on both subs);6rjzu2;https://i.redd.it/hl4l7joqnpdz.png
bitcoin is legal;3;1;False;wolfwolfz;dl619xp;Two biggest Bitcoin subs according to their counterparts (posted on both subs);6rjzu2;https://i.redd.it/hl4l7joqnpdz.png
"r/btc and r/bitcoin two sides of the same coin ;)";9;0;False;kaibakker;dl5m3oh;Two biggest Bitcoin subs according to their counterparts (posted on both subs);6rjzu2;https://i.redd.it/hl4l7joqnpdz.png
/r/bitcoin representative image looks much more fun, I'm staying here.;34;1;False;killerstorm;dl5la7b;Two biggest Bitcoin subs according to their counterparts (posted on both subs);6rjzu2;https://i.redd.it/hl4l7joqnpdz.png
Beautiful!!! :);7;0;False;kattbilder;dl5kdcc;Two biggest Bitcoin subs according to their counterparts (posted on both subs);6rjzu2;https://i.redd.it/hl4l7joqnpdz.png
"Yup...that's a pretty good summary!  ; )";6;0;False;PGerbil;dl5li31;Two biggest Bitcoin subs according to their counterparts (posted on both subs);6rjzu2;https://i.redd.it/hl4l7joqnpdz.png
Someone... please... give this gentlemoon gold!;29;5;False;cgminer;dl5jsio;Two biggest Bitcoin subs according to their counterparts (posted on both subs);6rjzu2;https://i.redd.it/hl4l7joqnpdz.png
[deleted];14;1;False;;dl607ll;Two biggest Bitcoin subs according to their counterparts (posted on both subs);6rjzu2;https://i.redd.it/hl4l7joqnpdz.png
"The minority is very vocal and it fools a lot of people into thinking they are a major force. But if you look at the names, it's always the same people being very loud.

Even the latest UASF campaign. Seems like everyone supports it. But looking at the node numbers, its minor. It's also mostly new nodes, same with the hash support. The old ones haven't migrated away from core.

Next time when you are reading comments, pay attention to the usernames.";68;7;False;ModerateBrainUsage;dl5wmct;Two biggest Bitcoin subs according to their counterparts (posted on both subs);6rjzu2;https://i.redd.it/hl4l7joqnpdz.png
To the moon! (:;8;0;False;exo762;dl5kpzc;Two biggest Bitcoin subs according to their counterparts (posted on both subs);6rjzu2;https://i.redd.it/hl4l7joqnpdz.png
Makes me frustrated with bitcoin, I remember when we were a tight knit group.;4;1;False;f_bastiat;dl5yja6;Two biggest Bitcoin subs according to their counterparts (posted on both subs);6rjzu2;https://i.redd.it/hl4l7joqnpdz.png
What if I visit both reddits? Damn.;39;2;False;jerguismi;dl5oe2h;Two biggest Bitcoin subs according to their counterparts (posted on both subs);6rjzu2;https://i.redd.it/hl4l7joqnpdz.png
#;2;0;False;FuckinStopSayingThis;dl5sp5c;Two biggest Bitcoin subs according to their counterparts (posted on both subs);6rjzu2;https://i.redd.it/hl4l7joqnpdz.png
"The only accusations flying come from Jihan, Ver & CO's long line of scams, and their supporters. 

XT, Classic, Unlimited, btc1, x2, now BCH...  All hostile takeover attempts with no value of their own. 

Minus value in fact. Such unscrupulous behavior is discouraged with extreme prejudice in all of Open Source, not just Cryptocurrency. ";0;1;False;Terminal-Psychosis;dl5sp4f;Two biggest Bitcoin subs according to their counterparts (posted on both subs);6rjzu2;https://i.redd.it/hl4l7joqnpdz.png
Now we are 2 tight knit groups! Twice as good as before /s ;3;0;False;Bitcoin_Acolyte;dl62iqy;Two biggest Bitcoin subs according to their counterparts (posted on both subs);6rjzu2;https://i.redd.it/hl4l7joqnpdz.png
[Here ya go](http://i.imgur.com/luGdsiC.png). Sadly looks like it didn't get enough love to get made into a shirt when the author posted it a few years ago [here](https://www.threadless.com/designs/plotting-the-risky-agenda);2;2;False;triplegerms;dl64q0z;Two biggest Bitcoin subs according to their counterparts (posted on both subs);6rjzu2;https://i.redd.it/hl4l7joqnpdz.png
[deleted];553;4;False;;dl5jvil;Two biggest Bitcoin subs according to their counterparts (posted on both subs);6rjzu2;https://i.redd.it/hl4l7joqnpdz.png
"LOL @ ""memepool"" if it's a typo it couldn't turn out better and if it's intentional it's a work of genius.";162;5;False;ZergShotgunAndYou;dl5k54r;Two biggest Bitcoin subs according to their counterparts (posted on both subs);6rjzu2;https://i.redd.it/hl4l7joqnpdz.png
Looks like it's from [here](https://www.threadless.com/designs/plotting-the-risky-agenda), may have to try and get that on a t-shirt.  That's just an awesome picture.;3;0;False;warbiscuit;dl5t3tb;Two biggest Bitcoin subs according to their counterparts (posted on both subs);6rjzu2;https://i.redd.it/hl4l7joqnpdz.png
Wish I knew what was truly going on.;112;5;False;cannuckgamer;dl5m47x;Two biggest Bitcoin subs according to their counterparts (posted on both subs);6rjzu2;https://i.redd.it/hl4l7joqnpdz.png
register here: https://www.reddit.com/message/compose?to=sodogetip&subject=%2Bregister&message=%2Bregister;1;1;False;NiFNi;dl5kscz;Two biggest Bitcoin subs according to their counterparts (posted on both subs);6rjzu2;https://i.redd.it/hl4l7joqnpdz.png
"there's a weird lizard men conspiracy theory out there. They can control the banks etc

Adam Jones is the leader of this conspiracy? If conspiracies have leaders...

Edit Alex* Jones";6;3;False;throwawaytaxconsulta;dl5lm0i;Two biggest Bitcoin subs according to their counterparts (posted on both subs);6rjzu2;https://i.redd.it/hl4l7joqnpdz.png
At least we can still laugh at ourselves, I think... ;3;0;False;atoMsnaKe;dl63o4a;Two biggest Bitcoin subs according to their counterparts (posted on both subs);6rjzu2;https://i.redd.it/hl4l7joqnpdz.png
Pay no attention to that, it refersss to a baseless conspirassssy theory.;6;1;False;theymos;dl5vnn2;Two biggest Bitcoin subs according to their counterparts (posted on both subs);6rjzu2;https://i.redd.it/hl4l7joqnpdz.png
Speaking as a Lizard person, I rarely if ever wear turtle necks.... I've said too much.;3;0;False;Ontopourmama;dl6317m;Two biggest Bitcoin subs according to their counterparts (posted on both subs);6rjzu2;https://i.redd.it/hl4l7joqnpdz.png
Do you imagine that will be sufficient forever? Because even with them both, Bitcoin can't handle one country's usage (too many commitment transactions required to fit).;1;1;False;Natanael_L;dl601th;Two biggest Bitcoin subs according to their counterparts (posted on both subs);6rjzu2;https://i.redd.it/hl4l7joqnpdz.png
Source on that bottom left meme;3;1;False;eaglessoar;dl5rbx2;Two biggest Bitcoin subs according to their counterparts (posted on both subs);6rjzu2;https://i.redd.it/hl4l7joqnpdz.png
"Why so much hate on Ethereum and Dash? Litecoin and Bcash are similar (and might be considered ""bad"") because they're basically Bitcoin with a few parameter tweaks. Bcash shares blockchain with Bitcoin, Litecoin doesn't.

Dash and Ethereum, however, have features which Bitcoin doesn't and are completely different things. How many ICOs do you see on Bitcoin? Significantly fewer than on Ethereum because Ethereum has an architecture and feature set that's very ideal for ICOs. 

How many people do you see using Ethereum on a day to day basis? Not nearly as many as Bitcoin because Ethereum is hard to understand, hard to use, and hard to set up. I haven't come across a good Ethereum mobile wallet yet. However, with Bitcoin there are plenty of wallets, because it's a simpler protocol and it's been around for longer.

So please stop ranking them in a 1-dimensional Good-Bad scheme. Thank you.";18;5;False;25isthesquareof5;dl5mvtg;Two biggest Bitcoin subs according to their counterparts (posted on both subs);6rjzu2;https://i.redd.it/hl4l7joqnpdz.png
"""spam the mem**e**pool"" :D";3;0;False;;dl5wa96;Two biggest Bitcoin subs according to their counterparts (posted on both subs);6rjzu2;https://i.redd.it/hl4l7joqnpdz.png
">opposing powers

I would say they are likely not opposing powers, but one power playing both sides. You fund both sides, then you win no matter the outcome. The thing with crypto is if one iteration is compromised, informed users can move to the next as it splits like a hydra, and the powers that be have a game of whack-a-mole.";8;2;False;Paul_McCuckney;dl5qfkh;Two biggest Bitcoin subs according to their counterparts (posted on both subs);6rjzu2;https://i.redd.it/hl4l7joqnpdz.png
"> Are both subs manipulated by shills of opposing powers operating from the shadows? 

There are no evil superpowers in the background pulling the strings.

It's just a bunch of crypto-enthusiasts flaming each other in forums.  Everyone likes to pretend they're fighting an army of ""paid shills"", but no.  You're just being shitty to fellow crypto nerds -- people who are just as passionate about this technology as you are.  There's no ""man behind the curtain"".  No covert government/wallstreet establishment influence.

Just a bunch of people arguing about the value of a single variable: `static const unsigned int MAX_BLOCK_SIZE`

If only that passion could be channeled, instead of dispersing in a cloud of rhetoric and vitriol.";23;5;False;merreborn;dl633i0;Two biggest Bitcoin subs according to their counterparts (posted on both subs);6rjzu2;https://i.redd.it/hl4l7joqnpdz.png
And people wonder why bitcoin is confusing.;5;0;False;TheTurnipKnight;dl5qnrn;Two biggest Bitcoin subs according to their counterparts (posted on both subs);6rjzu2;https://i.redd.it/hl4l7joqnpdz.png
G E N I U S;3;0;False;ReverendBlue;dl5mhr3;Two biggest Bitcoin subs according to their counterparts (posted on both subs);6rjzu2;https://i.redd.it/hl4l7joqnpdz.png
/r/coolguides;3;0;False;zverkalt;dl5n98z;Two biggest Bitcoin subs according to their counterparts (posted on both subs);6rjzu2;https://i.redd.it/hl4l7joqnpdz.png
"*Some men just want to see the world burn*

Bravo sir.";3;0;False;BigBlackHungGuy;dl5owib;Two biggest Bitcoin subs according to their counterparts (posted on both subs);6rjzu2;https://i.redd.it/hl4l7joqnpdz.png
this is the most non biased post in this sub;232;4;False;wikes82;dl5mxjy;Two biggest Bitcoin subs according to their counterparts (posted on both subs);6rjzu2;https://i.redd.it/hl4l7joqnpdz.png
It looks like some sort of disinformation war is going on. By who or whom is just a matter of finding out who would benefit from either strategy. ;1;0;False;cannuckgamer;dl6adwi;Two biggest Bitcoin subs according to their counterparts (posted on both subs);6rjzu2;https://i.redd.it/hl4l7joqnpdz.png
That representative image is awesome... Link to high res?;3;1;False;teksimian;dl5qkyr;Two biggest Bitcoin subs according to their counterparts (posted on both subs);6rjzu2;https://i.redd.it/hl4l7joqnpdz.png
It's comments like these that hurt this sub.;11;0;False;Dustydust1234;dl5v58u;Two biggest Bitcoin subs according to their counterparts (posted on both subs);6rjzu2;https://i.redd.it/hl4l7joqnpdz.png
r/BitcoinBeginners ;2;0;False;boldra;dl5wqom;Two biggest Bitcoin subs according to their counterparts (posted on both subs);6rjzu2;https://i.redd.it/hl4l7joqnpdz.png
Yeah, I mean, take an open source project, have it's only charismatic leaders leave the project, and make the network it runs worth $40 billion dollars, remove all regulation, mix in some corporate conflicts of interest.... this is pretty much what you get. ;12;0;False;bradfordmaster;dl5tlfh;Two biggest Bitcoin subs according to their counterparts (posted on both subs);6rjzu2;https://i.redd.it/hl4l7joqnpdz.png
"I'm not too pleased with bcash seeing as I've been waiting a day and a half for my deposit to bittrex to go through, and I was told that bcash would be faster and cheaper than ""legacy bitcoin"".";2;1;False;cowardlyalien;dl5ly7s;Two biggest Bitcoin subs according to their counterparts (posted on both subs);6rjzu2;https://i.redd.it/hl4l7joqnpdz.png
