body;score;nb_replies;stickied;author;id;post_title;post_id;post_link
Maybe, maybe not, but it's great banter. Icke is a fucking loonatic.;1;0;False;BaggaTroubleGG;dl5pc5o;Two biggest Bitcoin subs according to their counterparts (posted on both subs);6rjzu2;https://i.redd.it/hl4l7joqnpdz.png
Icke is so completely crazy that he almost certainly means real alien lizard people.;3;0;False;chinnybob;dl5qh59;Two biggest Bitcoin subs according to their counterparts (posted on both subs);6rjzu2;https://i.redd.it/hl4l7joqnpdz.png
Oh I'm sorry, I misread, I thought you called Andreas a socialist. My bad. ;2;0;False;ToTheMewn;dl5yiox;Two biggest Bitcoin subs according to their counterparts (posted on both subs);6rjzu2;https://i.redd.it/hl4l7joqnpdz.png
[deleted];-4;2;False;;dl5qm4w;Two biggest Bitcoin subs according to their counterparts (posted on both subs);6rjzu2;https://i.redd.it/hl4l7joqnpdz.png
http://www.reddit.com/r/Anarcho_Capitalism/comments/3ucp8y/i_was_beat_up_by_left_anarchists_in_greece/;1;2;False;egads-5194;dl5taq7;Two biggest Bitcoin subs according to their counterparts (posted on both subs);6rjzu2;https://i.redd.it/hl4l7joqnpdz.png
"Only if you're using definitions of words made up by libertarian/ancaps, who are already prone to re-defining words as they see fit.

Libertarian, Socialist, and Bitcoin can be very compatible if you've actually read anything any of them actually said without devolving into base insults based on what your own propaganda says about them.";3;1;False;GI_X_JACK;dl5uhfg;Two biggest Bitcoin subs according to their counterparts (posted on both subs);6rjzu2;https://i.redd.it/hl4l7joqnpdz.png
"Well, there are no Targets anywhere near me because I live in central Europe. I can assure you, everything I need to buy I can buy with bitcoin. 

There are also companies which will issue a Mastercard/Visa pre-paid card which you fund with Bitcoins and the card itself converts everything when you use it. That way, you can go pay literally everywhere you can find a CC terminal

ref. : bitpay, xapo, spectrocoin, cryptopay, uquid, bitwala";4;1;False;oliverlikes;dl67lms;Two biggest Bitcoin subs according to their counterparts (posted on both subs);6rjzu2;https://i.redd.it/hl4l7joqnpdz.png
Yes;1;0;False;TiagoTiagoT;dl6cfmh;Two biggest Bitcoin subs according to their counterparts (posted on both subs);6rjzu2;https://i.redd.it/hl4l7joqnpdz.png
"You prove with your manners that you must be a socialist.

I was talking about the social impact of Bitcoin, not the technology. Taking power from the government.";2;1;False;lclc_;dl5qw0z;Two biggest Bitcoin subs according to their counterparts (posted on both subs);6rjzu2;https://i.redd.it/hl4l7joqnpdz.png
"I'm fascinated about what you have said. From memory I found 'The Protocols of the Elders of Zion' was written with poor language finesse, and I thought how and why would a book like this be written like this? I thought something was fishy.

What did hitler say about it?";1;0;False;camraid;dl6bmkd;Two biggest Bitcoin subs according to their counterparts (posted on both subs);6rjzu2;https://i.redd.it/hl4l7joqnpdz.png
Lmao. Keeeeeep deluding yourselves into thinking it's not fucking monoply money.;0;2;False;TheKingoftheBlind;dl695v7;Two biggest Bitcoin subs according to their counterparts (posted on both subs);6rjzu2;https://i.redd.it/hl4l7joqnpdz.png
[deleted];-1;1;False;;dl5v4yc;Two biggest Bitcoin subs according to their counterparts (posted on both subs);6rjzu2;https://i.redd.it/hl4l7joqnpdz.png
He literally only implied that Bitcoin and socialist ideology are incompatible. There was no judgement in his post. Your posts certainly doesn't improve the image of socialists though.;9;1;False;Maegfaer;dl5ro5u;Two biggest Bitcoin subs according to their counterparts (posted on both subs);6rjzu2;https://i.redd.it/hl4l7joqnpdz.png
"You're not doing ancaps any favors by trying to make this argument. Anarchism means ""no hierarchy"" which is a impossible, impractical ideal with dire consequences. Capitalism necessitates hierarchy, and that's a good thing. Rothbard was being provocative at which he was so effective, but historically and linguistically this person is correct. The anarcho part of ancap is just to suggest an absence of rulers, not the wholesale absence of hierarchy.";0;0;False;hot_rats_;dl5yq7f;Two biggest Bitcoin subs according to their counterparts (posted on both subs);6rjzu2;https://i.redd.it/hl4l7joqnpdz.png
">Anarchism has one clear and well-defined meaning: ""no government""

CONTEXT. CONTEXT IS EVERYTHING.

When talking about Anarchist with a capital A as in a proper noun to describe a political ideology, it has always been understood this to mean socialist. All Anarchist groups in history have been socialist.

When Murray Rothbard coined ""Anarcho-Capitalist"", he did so knowing full well that Anarchism meant socialism, and he just wanted to fuck with the socialists.";1;1;False;GI_X_JACK;dl5waso;Two biggest Bitcoin subs according to their counterparts (posted on both subs);6rjzu2;https://i.redd.it/hl4l7joqnpdz.png
"> Anarchism has one clear and well-defined meaning: ""no government"".

Close.

An = No

Archos = Ruler

AnArchos = No Ruler

So no government save self-governance.";1;1;False;Sovereign_Curtis;dl5ymnv;Two biggest Bitcoin subs according to their counterparts (posted on both subs);6rjzu2;https://i.redd.it/hl4l7joqnpdz.png
[deleted];1;1;False;;dl5vrdm;Two biggest Bitcoin subs according to their counterparts (posted on both subs);6rjzu2;https://i.redd.it/hl4l7joqnpdz.png
"I'm not defending BCH, just so you know. Back before XT I was hoping that ""mainline BTC"" would one day agree to a roadmap where bigger blocks will eventually be adopted, because without it Bitcoin will forever be stuck in obscurity. Although maybe that's what some people here want...";1;2;False;Natanael_L;dl6478b;Two biggest Bitcoin subs according to their counterparts (posted on both subs);6rjzu2;https://i.redd.it/hl4l7joqnpdz.png
"That's not what I'm saying and I'm sorry if it's what you take from this exchange. Where does this resentment come from? 

If you have millions in Bitcoin, you probably stop thinking about it as ""electronic cash"", even though you're still able to pay with it. Many people regard Bitcoin as Gold 2.0, or an asset similar to bonds in which case you'd only use it for big purchases (a car, house, company shares or whatnot) and otherwise leave it in cold storage, hoping it will be a an effective hedge against turmoil on financial markets. 

This is after all, what drives all of this controversy about scaling issues. People don't get to agree on what Bitcoin should be primarily used for and how to categorize it but it doesn't undermine its usefulness";1;0;False;oliverlikes;dl69t40;Two biggest Bitcoin subs according to their counterparts (posted on both subs);6rjzu2;https://i.redd.it/hl4l7joqnpdz.png
[deleted];1;1;False;;dl5tqqr;Two biggest Bitcoin subs according to their counterparts (posted on both subs);6rjzu2;https://i.redd.it/hl4l7joqnpdz.png
Same thing with houses dumbass.;5;1;False;EonShiKeno;dl68wiz;Two biggest Bitcoin subs according to their counterparts (posted on both subs);6rjzu2;https://i.redd.it/hl4l7joqnpdz.png
[deleted];-4;1;False;;dl5r6an;Two biggest Bitcoin subs according to their counterparts (posted on both subs);6rjzu2;https://i.redd.it/hl4l7joqnpdz.png
"> even if they knew that Anarchism was always a socialist movement, and that they're attempt to steal the word is a purposeful thing to dis that community.

Screw you. Anarchism has one clear and well-defined meaning: ""no government"". Anarcho-capitalism wants no governments so it's anarchism.";1;3;False;user_48217;dl5vzwv;Two biggest Bitcoin subs according to their counterparts (posted on both subs);6rjzu2;https://i.redd.it/hl4l7joqnpdz.png
I don't understand how bitcoin is related to the NAP;1;0;False;GI_X_JACK;dl5w6um;Two biggest Bitcoin subs according to their counterparts (posted on both subs);6rjzu2;https://i.redd.it/hl4l7joqnpdz.png
"Socialism didn't kill anyone. People that followed political parties that had some socialist ideas did. 

Technically the nazis were socialist. It's right there in the name *National Sozialisten*. But there's definitely not a lot I would agree with them on. 

Just the first paragraph of the definition on Wikipedia (highlights mine):

**Socialism is a range of economic and social systems characterised by social ownership and democratic control of the means of production**, as well as the political theories, and movements associated with them. Social ownership may refer to forms of public, collective, or cooperative ownership, or to citizen ownership of equity. **There are many varieties of socialism and there is no single definition encapsulating all of them. Social ownership is the common element shared by its various forms.**

As a believer in the idea that social ownership and democratic control of the means of production is the best way to achieve a prosperous and successful society with the highest level of general happiness for all, what should I call myself if not socialist?

The term may be associated with some pretty horrendous people, but that doesn't make the concept any less valid in my view.";6;1;False;dalebewan;dl5uiyo;Two biggest Bitcoin subs according to their counterparts (posted on both subs);6rjzu2;https://i.redd.it/hl4l7joqnpdz.png
Yeah but people aren't making false equivalence comparisons between Zcash and Bitcoin, like they are with BCH.;2;0;False;Protossoario;dl61w54;Two biggest Bitcoin subs according to their counterparts (posted on both subs);6rjzu2;https://i.redd.it/hl4l7joqnpdz.png
Just because you don't trust the devs doesn't make their approach less sound. If you disagree that's fine, and if you can provide a compelling argument on why BCH provides a better solution, that'd be great.;1;1;False;Protossoario;dl63fki;Two biggest Bitcoin subs according to their counterparts (posted on both subs);6rjzu2;https://i.redd.it/hl4l7joqnpdz.png
Yeah, and Dogecoin was worth a couple bucks for a while, too. That's called speculative value. But until you can actually trade BCash for goods, it has no real market value. That makes it really good if you want to make a quick buck while the bubble lasts, but unless it can attract genuine investment, it's no better than any of those other worthless coins that came before.;2;0;False;Protossoario;dl6104e;Two biggest Bitcoin subs according to their counterparts (posted on both subs);6rjzu2;https://i.redd.it/hl4l7joqnpdz.png
So what you are saying is, bitcoin is only worth money when converted to...actual money lol.;1;2;False;TheKingoftheBlind;dl67xlz;Two biggest Bitcoin subs according to their counterparts (posted on both subs);6rjzu2;https://i.redd.it/hl4l7joqnpdz.png
">  Google Russia Ethereum.

Obviously if you google that you get links to what you were searching for.

> Haven't really payed as much attention

I am paying attention, in fact I have been working on Ethereum projects for a long time now (for a big European firm, not a russian company).";3;0;False;askmike;dl5u13j;Two biggest Bitcoin subs according to their counterparts (posted on both subs);6rjzu2;https://i.redd.it/hl4l7joqnpdz.png
[deleted];-1;1;False;;dl5uaab;Two biggest Bitcoin subs according to their counterparts (posted on both subs);6rjzu2;https://i.redd.it/hl4l7joqnpdz.png
Kind of, in the same way there are two Ethereums.;3;1;False;liberated_u;dl60yu1;Two biggest Bitcoin subs according to their counterparts (posted on both subs);6rjzu2;https://i.redd.it/hl4l7joqnpdz.png
"My best guess is that it isn't *one* shady organization pulling the strings, but rather a few dozen independent organizations with various hidden agendas with various degrees of maliciousness / carelessness, and half this mess is a sideeffect from that. Lots of organizations could benefit from guiding Bitcoin development,  and not all would necessarily be open about it. 

We already know that *some* actual shills exist (just look at all the astroturfed altcoins), but I have no idea what the real ratio is. And some people are just trolls or crazy. The worst are as usual the militant extremists that will attack you just for mentioning an idea they associate with their enemy. Shills stop when the paycheck runs dry, extremists don't.";2;0;False;Natanael_L;dl6btfn;Two biggest Bitcoin subs according to their counterparts (posted on both subs);6rjzu2;https://i.redd.it/hl4l7joqnpdz.png
Somebody gives too much credit to the conspiracy forum. But hey, now it looks like two equal groups.;1;0;False;;dl5lvfo;Two biggest Bitcoin subs according to their counterparts (posted on both subs);6rjzu2;https://i.redd.it/hl4l7joqnpdz.png
Yeah, I feel like this a lot. So many accusations on both sides, I don't know how to judge it all. Are both subs manipulated by shills of opposing powers operating from the shadows? Or is this just the usual par for the course when an open source project can't reach consensus and the differing views fork from each other (plus added bitterness because money is involved)?;89;10;False;liberated_u;dl5p9mp;Two biggest Bitcoin subs according to their counterparts (posted on both subs);6rjzu2;https://i.redd.it/hl4l7joqnpdz.png
"""Sorry, you can't post that gif right now, because the memepool is full. Try again later.""";1;0;False;albuminvasion;dl66kxd;Two biggest Bitcoin subs according to their counterparts (posted on both subs);6rjzu2;https://i.redd.it/hl4l7joqnpdz.png
Aww man I missed that the first time around. ty haha.;2;0;False;ensignlee;dl64y2o;Two biggest Bitcoin subs according to their counterparts (posted on both subs);6rjzu2;https://i.redd.it/hl4l7joqnpdz.png
"the term *memepool* is already long-established in the insider circles `;)`";7;0;False;herzmeister;dl5p24u;Two biggest Bitcoin subs according to their counterparts (posted on both subs);6rjzu2;https://i.redd.it/hl4l7joqnpdz.png
Totally missed that myself.;6;0;False;phillipsjk;dl5q1o7;Two biggest Bitcoin subs according to their counterparts (posted on both subs);6rjzu2;https://i.redd.it/hl4l7joqnpdz.png
Yeah, that's a good one. ;15;0;False;davvblack;dl5mm2i;Two biggest Bitcoin subs according to their counterparts (posted on both subs);6rjzu2;https://i.redd.it/hl4l7joqnpdz.png
*Good, good,... let the* **Divide & Conquer** *flow through you.* ;34;2;False;BitderbergGroup;dl5qlqm;Two biggest Bitcoin subs according to their counterparts (posted on both subs);6rjzu2;https://i.redd.it/hl4l7joqnpdz.png
[deleted];11;1;False;;dl5qrcl;Two biggest Bitcoin subs according to their counterparts (posted on both subs);6rjzu2;https://i.redd.it/hl4l7joqnpdz.png
U mean bcash /s;167;1;False;ispshadow;dl5n1oa;Two biggest Bitcoin subs according to their counterparts (posted on both subs);6rjzu2;https://i.redd.it/hl4l7joqnpdz.png
"both sides are guilty of the same things, but via different approaches.  Each has a unique vision of bitcoin's next step(s), and noone is willing to agree on what should be the first step implemented.

IMO A.A. is not a henchman of r/bitcoin. Much of what he says is fairly neutral, and IIRC he supported both segwit and larger blocks

Also, I like ""Bcash"" its clearer than BCH and is much easier to type and read than ""Bitcoin cash"".

The real truth is in the hashrate. right now, those mining the Bcash chain are only ~half as profitable as if they switched to bitcoin, but that could change, or at least approach an equilibrium as the difficulty is adjusted";0;0;False;klondike_barz;dl68ofj;Two biggest Bitcoin subs according to their counterparts (posted on both subs);6rjzu2;https://i.redd.it/hl4l7joqnpdz.png
Best post in a long time.;3;0;False;sph44;dl6088w;Two biggest Bitcoin subs according to their counterparts (posted on both subs);6rjzu2;https://i.redd.it/hl4l7joqnpdz.png
[removed];109;3;False;;dl5mqzb;Two biggest Bitcoin subs according to their counterparts (posted on both subs);6rjzu2;https://i.redd.it/hl4l7joqnpdz.png
"Currently 1517/91% on /r/bitcoin, 729/87% on r-slash-btc.  

This is Interesting, it suggests that there is a majority of users on both subs who at least acknowledge the other sub's viewpoint (and I might suggest that they are open to productive discussions), while a minority of users are effectively causing hostility and shutting down any discussions which might otherwise be productive.

Conclusion: Downvote the trolls in your preferred sub.";253;9;False;dmdeemer;dl5rfhs;Two biggest Bitcoin subs according to their counterparts (posted on both subs);6rjzu2;https://i.redd.it/hl4l7joqnpdz.png
"These bitcoins folks are going to feel ridiculous in 10 years when they have ""millions"" of dollars and no legal way to spend it ðŸ˜‚";-1;2;False;TheKingoftheBlind;dl5wy59;Two biggest Bitcoin subs according to their counterparts (posted on both subs);6rjzu2;https://i.redd.it/hl4l7joqnpdz.png
"""Call their altcoin ""Bcash"", ask them how it's better than Dash or Ethereum.""

You missed Litecoin. https://twitter.com/FedericoTenga/status/892352508852613121

Honestly, Bcash is better than Dash and Ethereum lol";6;2;False;finitemaz;dl5kql0;Two biggest Bitcoin subs according to their counterparts (posted on both subs);6rjzu2;https://i.redd.it/hl4l7joqnpdz.png
Once upon a time, someone wanted to raise the block size limit like the original Bitcoin paper said we should, but a mod in this sub said that would be considered an altcoin and therefore any mentioning that possibility was strictly forbidden in the sub, and if he had to ban 95% of the users then so be it.;22;0;False;user_48217;dl5vwv9;Two biggest Bitcoin subs according to their counterparts (posted on both subs);6rjzu2;https://i.redd.it/hl4l7joqnpdz.png
Come to /r/buttcoin if you want to view all the various propaganda from a safe distance. :-);18;1;False;tpgreyknight;dl5qfcv;Two biggest Bitcoin subs according to their counterparts (posted on both subs);6rjzu2;https://i.redd.it/hl4l7joqnpdz.png
Agreed, it's very hard to get unbiased information on the scaling debate.;4;1;False;izhikevich;dl5s9sf;Two biggest Bitcoin subs according to their counterparts (posted on both subs);6rjzu2;https://i.redd.it/hl4l7joqnpdz.png
I don't even know what this is all about. Are there two bitcoins now?;2;2;False;Tripanes;dl5z3np;Two biggest Bitcoin subs according to their counterparts (posted on both subs);6rjzu2;https://i.redd.it/hl4l7joqnpdz.png
Done. Bought with good old AXA controlled Core coins.;11;1;False;Mirobitio;dl5m0ks;Two biggest Bitcoin subs according to their counterparts (posted on both subs);6rjzu2;https://i.redd.it/hl4l7joqnpdz.png
Why not you?;19;1;False;zippy9002;dl5lkhe;Two biggest Bitcoin subs according to their counterparts (posted on both subs);6rjzu2;https://i.redd.it/hl4l7joqnpdz.png
That's exactly what I thought!;9;1;False;EricJuggles;dl5lwfg;Two biggest Bitcoin subs according to their counterparts (posted on both subs);6rjzu2;https://i.redd.it/hl4l7joqnpdz.png
At least he has been trying to be apolitical;1;0;False;LamboMoonwalker;dl5of6s;Two biggest Bitcoin subs according to their counterparts (posted on both subs);6rjzu2;https://i.redd.it/hl4l7joqnpdz.png
Yeah, who thinks Andreas is evil?;20;2;False;Apatomoose;dl5ngeo;Two biggest Bitcoin subs according to their counterparts (posted on both subs);6rjzu2;https://i.redd.it/hl4l7joqnpdz.png
And then you have /r/buildapc who think you're both dicks for causing AMD GPUs to sell out;2;1;False;B-Shek;dl65kf9;Two biggest Bitcoin subs according to their counterparts (posted on both subs);6rjzu2;https://i.redd.it/hl4l7joqnpdz.png
I thought it was Bitcoin that was supposed to be North Korea.;2;1;False;Dunning_Krugerrands;dl66kxy;Two biggest Bitcoin subs according to their counterparts (posted on both subs);6rjzu2;https://i.redd.it/hl4l7joqnpdz.png
Much fun;2;0;False;skandicek;dl5kr5c;Two biggest Bitcoin subs according to their counterparts (posted on both subs);6rjzu2;https://i.redd.it/hl4l7joqnpdz.png
If they liked each other, then there''d probably still be just one major one.;1;0;False;b734e851dfa70ae64c7f;dl6e6qp;Two biggest Bitcoin subs according to their counterparts (posted on both subs);6rjzu2;https://i.redd.it/hl4l7joqnpdz.png
That makes you worse than either.;1;0;False;perladdict;dl6akpl;Two biggest Bitcoin subs according to their counterparts (posted on both subs);6rjzu2;https://i.redd.it/hl4l7joqnpdz.png
Worst of both or best of both?;3;0;False;nowTHATScomedy;dl68fa7;Two biggest Bitcoin subs according to their counterparts (posted on both subs);6rjzu2;https://i.redd.it/hl4l7joqnpdz.png
This is just more anti Bitcoin spam. Trying to compare the two is absurd. ;-7;0;False;Terminal-Psychosis;dl5s9go;Two biggest Bitcoin subs according to their counterparts (posted on both subs);6rjzu2;https://i.redd.it/hl4l7joqnpdz.png
That meme picture is so freaking good, USA conspiracy in a nutshell, is there a HD of it? I want it. If i was a mod of conspiracy, instant lock in my sidebar  ;2;0;False;zaturama015;dl68bo8;Two biggest Bitcoin subs according to their counterparts (posted on both subs);6rjzu2;https://i.redd.it/hl4l7joqnpdz.png
Maybe, but it's also inaccurate. There's no reasonable way Segwit could make Bitcoin any more centralized than bigger block chains. That's just a conspiracy theory to push bigger block chains, which would mainly benefit the miners.;-1;4;False;Protossoario;dl5wqkj;Two biggest Bitcoin subs according to their counterparts (posted on both subs);6rjzu2;https://i.redd.it/hl4l7joqnpdz.png
*both;27;0;False;CptNemo56;dl5nw1q;Two biggest Bitcoin subs according to their counterparts (posted on both subs);6rjzu2;https://i.redd.it/hl4l7joqnpdz.png
This but unironcally;51;0;False;eaglessoar;dl5rchl;Two biggest Bitcoin subs according to their counterparts (posted on both subs);6rjzu2;https://i.redd.it/hl4l7joqnpdz.png
Brilliant!;1;0;False;Africa7;dl5xsi9;Two biggest Bitcoin subs according to their counterparts (posted on both subs);6rjzu2;https://i.redd.it/hl4l7joqnpdz.png
Who's the lizard guy?  I thought he was Pepe until I opened the thumbnail.;5;2;False;PinochetIsMyHero;dl5ldxk;Two biggest Bitcoin subs according to their counterparts (posted on both subs);6rjzu2;https://i.redd.it/hl4l7joqnpdz.png
I don't understand bitcoin at all....;2;2;False;HellaBrainCells;dl5q0gd;Two biggest Bitcoin subs according to their counterparts (posted on both subs);6rjzu2;https://i.redd.it/hl4l7joqnpdz.png
Is this supposed to be funny ;0;1;False;Senor_Platano;dl5tqk3;Two biggest Bitcoin subs according to their counterparts (posted on both subs);6rjzu2;https://i.redd.it/hl4l7joqnpdz.png
Thanks!   Now someone make a pic for my friend who thinks the Rothchild family is behind all of the above;1;0;False;taptapper;dl6cnam;Two biggest Bitcoin subs according to their counterparts (posted on both subs);6rjzu2;https://i.redd.it/hl4l7joqnpdz.png
So when did this sub go from informative to a rivalry against another sub that's meant to be for the exact same thing?;1;1;False;;dl68hod;Two biggest Bitcoin subs according to their counterparts (posted on both subs);6rjzu2;https://i.redd.it/hl4l7joqnpdz.png
"""memepool"" is great :)";1;0;False;Eirenarch;dl650jc;Two biggest Bitcoin subs according to their counterparts (posted on both subs);6rjzu2;https://i.redd.it/hl4l7joqnpdz.png
*nice*;1;0;False;acidrainn23;dl5xaur;Two biggest Bitcoin subs according to their counterparts (posted on both subs);6rjzu2;https://i.redd.it/hl4l7joqnpdz.png
"I chuckled quietly to myself until I got to the ""how do they want to destroy Bitcoin from the inside"" row.

Then I laughed my ass off. ";1;0;False;CaptainOuzo;dl64y3r;Two biggest Bitcoin subs according to their counterparts (posted on both subs);6rjzu2;https://i.redd.it/hl4l7joqnpdz.png
Hah, that's pretty funny;1;0;False;ensignlee;dl64w3y;Two biggest Bitcoin subs according to their counterparts (posted on both subs);6rjzu2;https://i.redd.it/hl4l7joqnpdz.png
"Well this is clearly biased in /bitcoin's favour merely by virtue of being accurate. (except that we all know segwit doesn't make bitcoin unsafe/centralised).

legit quality meme though.";1;0;False;violencequalsbad;dl64mlb;Two biggest Bitcoin subs according to their counterparts (posted on both subs);6rjzu2;https://i.redd.it/hl4l7joqnpdz.png
"checks out.

I always suspected bitcoin was created by aliens";1;0;False;stevev916;dl63fdq;Two biggest Bitcoin subs according to their counterparts (posted on both subs);6rjzu2;https://i.redd.it/hl4l7joqnpdz.png
I'm glad we're on the team that has the Argonian on it.;1;0;False;xxc3ncoredxx;dl62t11;Two biggest Bitcoin subs according to their counterparts (posted on both subs);6rjzu2;https://i.redd.it/hl4l7joqnpdz.png
Uh oh.. Bitcoin Cash reversing. CLOSE THOSE SHORT POSITIONS RIGHT NOW!!! bch bcash bcc xbc xbt btc;1;0;False;caQ1Kn2VqBK3bwxq9jLJ;dl601t3;Two biggest Bitcoin subs according to their counterparts (posted on both subs);6rjzu2;https://i.redd.it/hl4l7joqnpdz.png
"You had me until ""Show them we really need big blocks."" We don't, we have segwit and will have the lightning network soon. ";1;1;False;ToTheMewn;dl5xfgw;Two biggest Bitcoin subs according to their counterparts (posted on both subs);6rjzu2;https://i.redd.it/hl4l7joqnpdz.png
....;1;0;False;caQ1Kn2VqBK3bwxq9jLJ;dl600bn;Two biggest Bitcoin subs according to their counterparts (posted on both subs);6rjzu2;https://i.redd.it/hl4l7joqnpdz.png
The witness is Safe...;1;0;False;;dl5xm2r;Two biggest Bitcoin subs according to their counterparts (posted on both subs);6rjzu2;https://i.redd.it/hl4l7joqnpdz.png
lol, awesome;1;0;False;sreaka;dl5yhlq;Two biggest Bitcoin subs according to their counterparts (posted on both subs);6rjzu2;https://i.redd.it/hl4l7joqnpdz.png
haha, Love it.;1;0;False;CareNotDude;dl5xo1u;Two biggest Bitcoin subs according to their counterparts (posted on both subs);6rjzu2;https://i.redd.it/hl4l7joqnpdz.png
