body;score;nb_replies;stickied;author;id;post_title;post_id;post_link
But..... but..... it’s 2018!;583;8;False;Black_RL;dy9yapx;What a time to be alive!;8g8vqu;https://i.redd.it/rbt35cjw89v01.jpg
*normies ;2;0;False;SupremeLad666;dya8y9v;What a time to be alive!;8g8vqu;https://i.redd.it/rbt35cjw89v01.jpg
That's when most people started to get the Internet in their house.  I had computers since the 80's.;1;0;False;puppiadog;dyae3a3;What a time to be alive!;8g8vqu;https://i.redd.it/rbt35cjw89v01.jpg
Well yeah after his wife continuously cheats on him.;2;1;False;forsayken;dy9u52r;What a time to be alive!;8g8vqu;https://i.redd.it/rbt35cjw89v01.jpg
What?;1;1;False;PatrikPatrik;dya8nua;What a time to be alive!;8g8vqu;https://i.redd.it/rbt35cjw89v01.jpg
I'm not here to debate that (though I don't think they're worried at the moment). My comment pertains only to the use of this meme in this specific case.;1;0;False;forsayken;dya03f4;What a time to be alive!;8g8vqu;https://i.redd.it/rbt35cjw89v01.jpg
Get off my lawn.;5;0;False;SuperGoxxer;dya0eez;What a time to be alive!;8g8vqu;https://i.redd.it/rbt35cjw89v01.jpg
"> Implying this is is my first reddit account

lmao";16;1;False;wooftooth;dy9xj5d;What a time to be alive!;8g8vqu;https://i.redd.it/rbt35cjw89v01.jpg
Most people learn everything about Bitcoin in the first month or two. Then over the next year, they learn everything else. Then after about 5 years you'll realize that you've learned everything about Bitcoin.;3;1;False;Explodicle;dya3v2z;What a time to be alive!;8g8vqu;https://i.redd.it/rbt35cjw89v01.jpg
I forgot, accounts are tied to your Social Security Number and you can only have one account. ;4;1;False;;dya0vqo;What a time to be alive!;8g8vqu;https://i.redd.it/rbt35cjw89v01.jpg
*Eats popcorn*;1;1;False;PizzaLover_82;dya9k62;What a time to be alive!;8g8vqu;https://i.redd.it/rbt35cjw89v01.jpg
Emm.... you forgot the /s  ;6;1;False;wake_iw;dy9xmpd;What a time to be alive!;8g8vqu;https://i.redd.it/rbt35cjw89v01.jpg
">entirely optional 

Dumb";0;0;False;bjenaan_reborn;dya8x4x;What a time to be alive!;8g8vqu;https://i.redd.it/rbt35cjw89v01.jpg
Ahhh r/bitcoin where everything that's not bit coin is a shit coin. ;0;2;False;ClarkEbarZ;dy9vvdy;What a time to be alive!;8g8vqu;https://i.redd.it/rbt35cjw89v01.jpg
"Hahah. I reckon 95% of the projects are shit. 

Demand = perceived value";0;0;False;TheSilverCipher;dy9s712;What a time to be alive!;8g8vqu;https://i.redd.it/rbt35cjw89v01.jpg
"'Withdraw'. The part its trying to replace, lol.

Wallet to wallet, f\*\*\* third\-party accounts.";40;1;False;iPLEOMAX;dyacx4m;What a time to be alive!;8g8vqu;https://i.redd.it/rbt35cjw89v01.jpg
"These large banks control the world.  Fund both sides of every war.  And charge interest on them.  War = money to them.  I’d say I can do without the convenience.  Bitcoin is far
More convenient anyway.  ";39;6;False;Mimic5757;dyadpz0;What a time to be alive!;8g8vqu;https://i.redd.it/rbt35cjw89v01.jpg
Can you send it to any card?;4;0;False;Emrico1;dyacxpg;What a time to be alive!;8g8vqu;https://i.redd.it/rbt35cjw89v01.jpg
I just noticed is says 3 months next to my name...that’s odd;8;1;False;peterjmazza;dyac6h3;What a time to be alive!;8g8vqu;https://i.redd.it/rbt35cjw89v01.jpg
If something major to were go down and a ton of people lost that insured amount, you think they're really all getting it back? Fat chance. ;-1;2;False;KingDas;dya66oo;What a time to be alive!;8g8vqu;https://i.redd.it/rbt35cjw89v01.jpg
How would a crypto bank be insured? By the federal reserve?😂;0;2;False;_greatwell;dya2b79;What a time to be alive!;8g8vqu;https://i.redd.it/rbt35cjw89v01.jpg
what i mean is, wont banks have no capital because people wont need to store their money in them. The banks might buy crypto with the dollars they have, but people wont give them their capital anymore to hold and invest because theyll be holding it themselves. and will only need to seek private brokers to invest their crypto;5;3;False;C3D2;dya27rj;What a time to be alive!;8g8vqu;https://i.redd.it/rbt35cjw89v01.jpg
I got my first computer in 2000 when I was 13... and been masturbating regularly ever since 😬 - the real miracle of technology. ;18;2;False;sreyes1325;dya7ax0;What a time to be alive!;8g8vqu;https://i.redd.it/rbt35cjw89v01.jpg
The source already says US which is probably where you copied it from ;17;1;False;K_owar_D;dya7hj9;What a time to be alive!;8g8vqu;https://i.redd.it/rbt35cjw89v01.jpg
We got our first computer in 1984 it was Texas instruments. ;4;2;False;sshevie;dya6g14;What a time to be alive!;8g8vqu;https://i.redd.it/rbt35cjw89v01.jpg
you were rich.;10;2;False;elpee47;dya502h;What a time to be alive!;8g8vqu;https://i.redd.it/rbt35cjw89v01.jpg
Slap in that 19k memory expander!;3;0;False;test_tickles;dya3dur;What a time to be alive!;8g8vqu;https://i.redd.it/rbt35cjw89v01.jpg
i got mine in 1995 i was around 7 years old. i never knew there was a cassette type hdd :D;3;1;False;xexcutionerx;dyact9q;What a time to be alive!;8g8vqu;https://i.redd.it/rbt35cjw89v01.jpg
"Oh please do some research if you're not old enough to remember how things were.  In the 80's even many normal everyday people had computers in their home whether it was a Commodore 64, Apple II, IBM PC or IBM clone, or some other lesser known thing like a TI 99.  

In the early 90's   many more people had some sort of DOS machine with Windows 3.0 running and once Windows 3.1 came out, it became absolutely mainstream for any household who could afford $1200. I remember in 1992 we got a 386 SX2/20mhz IBM PS/1 from Sam's for $800.  

";14;5;False;coogie;dya4zk3;What a time to be alive!;8g8vqu;https://i.redd.it/rbt35cjw89v01.jpg
ITT: kids who don't remember last century.;8;1;False;cosmicr;dyadl0p;What a time to be alive!;8g8vqu;https://i.redd.it/rbt35cjw89v01.jpg
Got my first Vic-20 8 bit system in 1980. Cassette tape hdd.....lol;8;2;False;Rjones125;dya30q0;What a time to be alive!;8g8vqu;https://i.redd.it/rbt35cjw89v01.jpg
[Or in other words](http://www.philly.com/philly/news/How_American_families_are_changing.html?mobi=true), more households had a computer in 1993, than have a nuclear family today.;4;0;False;ten24;dya9mfy;What a time to be alive!;8g8vqu;https://i.redd.it/rbt35cjw89v01.jpg
it gona happen ;0;0;False;satoshinakacrypto;dy9uvbp;What a time to be alive!;8g8vqu;https://i.redd.it/rbt35cjw89v01.jpg
"Or you know, when the image has been compressed 7 times already, and the text is literally outdated.

And sorry to sound like r/gatekeeping but redditor for 5 weeks talking about being senior member lmao";43;2;False;empire314;dy9x91r;What a time to be alive!;8g8vqu;https://i.redd.it/rbt35cjw89v01.jpg
Doesn’t take long to become a senior then. I’ve seen memes reposted within a month or two of each other.;3;1;False;Raster_Eyes;dy9xyy2;What a time to be alive!;8g8vqu;https://i.redd.it/rbt35cjw89v01.jpg
"""redditor for 5 weeks""";8;1;False;ebaley;dy9zd6c;What a time to be alive!;8g8vqu;https://i.redd.it/rbt35cjw89v01.jpg
Or, you know, have stuck around for about two days.;2;0;False;ScatmanDosh;dy9zgfc;What a time to be alive!;8g8vqu;https://i.redd.it/rbt35cjw89v01.jpg
*redditor for 5 weeks* ;2;0;False;lyciann;dya2sf4;What a time to be alive!;8g8vqu;https://i.redd.it/rbt35cjw89v01.jpg
I'm not even a senior member and I remember this one;1;0;False;zarraza2k;dyab944;What a time to be alive!;8g8vqu;https://i.redd.it/rbt35cjw89v01.jpg
">redditor for 5 weeks

bah, no respect for the elders, give me 20 pushups kiddo";1;1;False;bitbat99;dy9ziky;What a time to be alive!;8g8vqu;https://i.redd.it/rbt35cjw89v01.jpg
Bitcoin was invented in 2017 newbie;9;1;False;empire314;dy9x5tf;What a time to be alive!;8g8vqu;https://i.redd.it/rbt35cjw89v01.jpg
J/k guise the CME/CBOE will suppress the price in coordination with many state actors and alphabet agencies. ;3;0;False;PepePanna2016;dy9p3e8;What a time to be alive!;8g8vqu;https://i.redd.it/rbt35cjw89v01.jpg
"""It was fun while it lasted.""";4;0;False;SignHereCo;dy9qg0l;What a time to be alive!;8g8vqu;https://i.redd.it/rbt35cjw89v01.jpg
"**WorldWideWeb**

WorldWideWeb (later renamed to Nexus to avoid confusion between the software and the World Wide Web) was the first web browser and editor. It was discontinued in 1994. At the time it was written, it was the sole web browser in existence, as well as the first WYSIWYG HTML editor.

The source code was released into the public domain on April 30, 1993.

***

^[ [^PM](https://www.reddit.com/message/compose?to=kittens_from_space) ^| [^Exclude ^me](https://reddit.com/message/compose?to=WikiTextBot&message=Excludeme&subject=Excludeme) ^| [^Exclude ^from ^subreddit](https://np.reddit.com/r/Bitcoin/about/banned) ^| [^FAQ ^/ ^Information](https://np.reddit.com/r/WikiTextBot/wiki/index) ^| [^Source](https://github.com/kittenswolf/WikiTextBot)   ^]
^Downvote ^to ^remove ^| ^v0.28";1;0;False;WikiTextBot;dya5fit;What a time to be alive!;8g8vqu;https://i.redd.it/rbt35cjw89v01.jpg
idc if they make money with crypto. this makes it even more established.;1;1;False;Hanspanzer;dyaf7i3;What a time to be alive!;8g8vqu;https://i.redd.it/rbt35cjw89v01.jpg
yeah loans are bad haha! The entirely optional debt that has drastically accelerate economic growth! Terrible!;2;1;False;oneoneoneking;dya8j1g;What a time to be alive!;8g8vqu;https://i.redd.it/rbt35cjw89v01.jpg
">Just a few years ago i was like, are we ever gonna get rid of the banking system based on debt and interest. I can't stop smiling now :)

There's nothing wrong with banks. You're problem is with the Federal Reserve, and fractional lending. Look into it.
";1;1;False;davidcwilliams;dyafgae;What a time to be alive!;8g8vqu;https://i.redd.it/rbt35cjw89v01.jpg
Keep holding those shitcoin bags lol.;3;2;False;PuckFoloniex;dy9ryiv;What a time to be alive!;8g8vqu;https://i.redd.it/rbt35cjw89v01.jpg
Helicopters;3;0;False;bjenaan_reborn;dya96ks;What a time to be alive!;8g8vqu;https://i.redd.it/rbt35cjw89v01.jpg
Yeh, I can withdraw money from anywhere on the planet with a single card. The bastards!;53;6;False;;dyabn7i;What a time to be alive!;8g8vqu;https://i.redd.it/rbt35cjw89v01.jpg
yes;19;0;False;TrymWS;dyaeo7p;What a time to be alive!;8g8vqu;https://i.redd.it/rbt35cjw89v01.jpg
You've been a redditor for 5 months;5;1;False;tehngand;dyac26f;What a time to be alive!;8g8vqu;https://i.redd.it/rbt35cjw89v01.jpg
You're assuming that everyone would want to store in a digital wallet.  Digital wallets aren't FDIC-insured.  Banks are able to offer that peace of mind, which I think many/most people would still take advantage of if cryptocurrencies replace local currencies.  It's much easier for most people to have their banks convert things for them and have the banks be liable for any mistakes.;18;2;False;coinzRfun;dya2738;What a time to be alive!;8g8vqu;https://i.redd.it/rbt35cjw89v01.jpg
brokers will have anywhere as near as much capital as banks do now though, loans could take a serious hit if crypto does become the norm.;6;1;False;Gorzoid;dya1xfg;What a time to be alive!;8g8vqu;https://i.redd.it/rbt35cjw89v01.jpg
"> the job of dispensing saved capital

Banks actually loan out about 10 times the amount of capital they have on hand.

> be fulfilled by private brokers

A bank is a private broker.  An organized one sure, but they private entities.  Perhaps it might take a lending club type model.

> storing their money in their digital wallets

If everyone were to store their money in digital wallets then it just wouldn't get loaned out.  There would be a corresponding lack of availability for borrowing and whatever consequences that would cause.";6;0;False;enfier;dya51gt;What a time to be alive!;8g8vqu;https://i.redd.it/rbt35cjw89v01.jpg
people could have called it a miracle before that;7;1;False;maz-o;dya56ka;What a time to be alive!;8g8vqu;https://i.redd.it/rbt35cjw89v01.jpg
"> In the US

I'm pretty sure the majority of households in the world still doesn't have a PC.";29;3;False;Howlyhusky;dya6lwj;What a time to be alive!;8g8vqu;https://i.redd.it/rbt35cjw89v01.jpg
So you're saying I had a PC before the majority? Nice!;3;1;False;TrymWS;dyaerhw;What a time to be alive!;8g8vqu;https://i.redd.it/rbt35cjw89v01.jpg
Well, *technically* according to this graph the exact year could have been any year before 2000 as well, excluding 1984, 1989, 1993, and 1997. And there could have even been massive (50%+) fluctuation in between those years!;4;0;False;ultimate_zigzag;dyabbgs;What a time to be alive!;8g8vqu;https://i.redd.it/rbt35cjw89v01.jpg
Had a computer in my house in 1988. An 8088 with VGA graphics and dual floppies. My dad wrote on it and we played games. ;11;2;False;cy2k;dya3dw5;What a time to be alive!;8g8vqu;https://i.redd.it/rbt35cjw89v01.jpg
Shh, how else can cryptocurrency investors feel superior despite their losses?;0;0;False;;dyaagxb;What a time to be alive!;8g8vqu;https://i.redd.it/rbt35cjw89v01.jpg
"I think we have different definitions of ""most people"".";8;1;False;;dyadxy0;What a time to be alive!;8g8vqu;https://i.redd.it/rbt35cjw89v01.jpg
Yes, we had a 386 as early as 1992.  A commodore 128 before then. Got into computers and learned a ton in 1994 or so, when we purchased an IBM Aptiva 486dx2.  ;2;0;False;SannySen;dya5oin;What a time to be alive!;8g8vqu;https://i.redd.it/rbt35cjw89v01.jpg
But bro! We're getting .01% interest on this cash! Lmfao ;0;1;False;KingDas;dya7bxj;What a time to be alive!;8g8vqu;https://i.redd.it/rbt35cjw89v01.jpg
How? The fed cant just print unlimited crypto ;0;2;False;_greatwell;dya3uqy;What a time to be alive!;8g8vqu;https://i.redd.it/rbt35cjw89v01.jpg
"Oh man, I forgot about ISA.

I remember how sick it was once I had a PCI graphics card. 

Thanks for this trip down memory lane. ";3;0;False;cy2k;dya8m46;What a time to be alive!;8g8vqu;https://i.redd.it/rbt35cjw89v01.jpg
Ha! Try working 300 baud!!!;3;1;False;FL21SeaCat;dya7uj6;What a time to be alive!;8g8vqu;https://i.redd.it/rbt35cjw89v01.jpg
Not you obviously. Man up and use your real account - if you have one.;-5;1;False;ebaley;dyaf3ek;What a time to be alive!;8g8vqu;https://i.redd.it/rbt35cjw89v01.jpg
Relevant username.;2;0;False;PM_ME_YOUR_PROFANITY;dy9zg89;What a time to be alive!;8g8vqu;https://i.redd.it/rbt35cjw89v01.jpg
Cause muh' lightning network!!!;1;1;False;SubsequentDownfall;dy9ykoq;What a time to be alive!;8g8vqu;https://i.redd.it/rbt35cjw89v01.jpg
Little that Bitcoin or a sidechain can't take on board though.;1;1;False;ebaley;dya5wzt;What a time to be alive!;8g8vqu;https://i.redd.it/rbt35cjw89v01.jpg
No not really;1;1;False;tehngand;dyachtr;What a time to be alive!;8g8vqu;https://i.redd.it/rbt35cjw89v01.jpg
FDIC is not banks, FDIC is the federal government;11;1;False;oneoneoneking;dya8m7x;What a time to be alive!;8g8vqu;https://i.redd.it/rbt35cjw89v01.jpg
Haha, true!  I don't keep anything beyond an emergency fund in the bank for that reason.  A cryptocurrency like Bitcoin that is deflationary in nature with lost coins and a growing world population is better than any interest a bank could give.  I think in this scenario banks would forgo giving interest altogether and may even CHARGE you a percentage of your holdings to keep them with the bank.  I know at least BOA would be charging.  Fuckers.;2;1;False;coinzRfun;dya861j;What a time to be alive!;8g8vqu;https://i.redd.it/rbt35cjw89v01.jpg
print money to buy crypto L 0 L;1;0;False;mrdoge6969;dyac3s8;What a time to be alive!;8g8vqu;https://i.redd.it/rbt35cjw89v01.jpg
The FDIC is mostly funded by the insurance dues of banks that are members.  So if banks are replacing local currencies with cryptocurrencies, then that would flow through to the FDIC as well.  Unless the FDIC wouldn't accept cryptocurrencies as payment, but that would then require banks to keep some local currency on-hand.  I really can't imagine the FDIC would require something like that if there's a clear trend of things shifting to cryptocurrencies.;0;0;False;coinzRfun;dya758u;What a time to be alive!;8g8vqu;https://i.redd.it/rbt35cjw89v01.jpg
yikes! no ANSI graphics for you!;2;0;False;coogie;dya7w2y;What a time to be alive!;8g8vqu;https://i.redd.it/rbt35cjw89v01.jpg
I forgot that's the cure to cancer. Selling all my alts for btc asap.;0;0;False;ClarkEbarZ;dya01rb;What a time to be alive!;8g8vqu;https://i.redd.it/rbt35cjw89v01.jpg
wut?;1;0;False;ClarkEbarZ;dyaae6m;What a time to be alive!;8g8vqu;https://i.redd.it/rbt35cjw89v01.jpg
Oh lol 😂 ;2;2;False;peterjmazza;dyacik3;What a time to be alive!;8g8vqu;https://i.redd.it/rbt35cjw89v01.jpg
Even worse place to put your trust lol;-4;1;False;KingDas;dya8t9p;What a time to be alive!;8g8vqu;https://i.redd.it/rbt35cjw89v01.jpg
Yeah man. I'm not a financial expert, so I can't really say anything with certainty. I put a little in btc, but I think with the tax regulations and more to come from the government it may just remain stagnant. They know it could be a feasible way to stop banks, and that's a problem for them. Have to shut that down as fast as they can. ;0;1;False;KingDas;dya8qvs;What a time to be alive!;8g8vqu;https://i.redd.it/rbt35cjw89v01.jpg
Grow some years! You can be stronk. ;3;0;False;mozzribo;dyadqpb;What a time to be alive!;8g8vqu;https://i.redd.it/rbt35cjw89v01.jpg
There's a lot that you don't understand, Peter. But you will. You will... ;3;0;False;Eofbfkkwbdb;dyaedsh;What a time to be alive!;8g8vqu;https://i.redd.it/rbt35cjw89v01.jpg
Yeah lol what has the federal government ever done for you lol;10;1;False;Fredulus;dyaajib;What a time to be alive!;8g8vqu;https://i.redd.it/rbt35cjw89v01.jpg
You bring up a great point.  For the scenario of cryptocurrencies replacing local currencies to even happen, cryptocurrencies would have to be seen as actual currencies as opposed to commodities (how the US currently classifies them).  Right now with all of the tax complications, it could never feasibly happen.;0;1;False;coinzRfun;dya952a;What a time to be alive!;8g8vqu;https://i.redd.it/rbt35cjw89v01.jpg
Absolutely nothing unfortunately. I've tried to get something out of them, but they only seem to want my taxes!;-3;1;False;KingDas;dyabsot;What a time to be alive!;8g8vqu;https://i.redd.it/rbt35cjw89v01.jpg
Conspiracy side of me wonders about the massive inflation and then drop, and then regulations. Feel like a lot of people got richer off that! ;1;0;False;KingDas;dya9e5l;What a time to be alive!;8g8vqu;https://i.redd.it/rbt35cjw89v01.jpg
That's a shame. If only they built roads or provided law enforcement or something 🤔;1;1;False;Fredulus;dyadyz7;What a time to be alive!;8g8vqu;https://i.redd.it/rbt35cjw89v01.jpg
Hahaha. So many cities have the shittiest infrastructure and terrible police forces. Pretty much everything the government does is trash, and the very minimum. Whilst they pocket money and spend more on defense. Come on bro. Government spending is atrocious. It's like they have an autistic 5th grader doing their budget. ;0;2;False;KingDas;dyaeqzy;What a time to be alive!;8g8vqu;https://i.redd.it/rbt35cjw89v01.jpg
Im Not defending btc in this instance. More so attacking people who think the banks are fool proof. ;0;1;False;KingDas;dya8jl9;What a time to be alive!;8g8vqu;https://i.redd.it/rbt35cjw89v01.jpg
Man, in the mid 90s I built the sickest 286s and 386s in high school with my buddy who had tons of spare parts. Learned so much. It set the course for my career in IT, for sure. ;5;2;False;cy2k;dya6j8z;What a time to be alive!;8g8vqu;https://i.redd.it/rbt35cjw89v01.jpg
What are you implying? Is there something to this that I’m not understanding ;4;1;False;peterjmazza;dyacbf3;What a time to be alive!;8g8vqu;https://i.redd.it/rbt35cjw89v01.jpg
Why is nano shit? ;4;1;False;ClarkEbarZ;dy9w7b9;What a time to be alive!;8g8vqu;https://i.redd.it/rbt35cjw89v01.jpg
He is, shall I say, forsayken I guess;2;0;False;altair222;dy9u64j;What a time to be alive!;8g8vqu;https://i.redd.it/rbt35cjw89v01.jpg
There's 400 billion dollars in crypto that is not being stored in bank accounts instead.;4;1;False;ebaley;dyaey4e;What a time to be alive!;8g8vqu;https://i.redd.it/rbt35cjw89v01.jpg
Well from the context of your post it very much seems like it. Atleast you got the 4chan memes covered.;13;1;False;empire314;dy9xy3g;What a time to be alive!;8g8vqu;https://i.redd.it/rbt35cjw89v01.jpg
Then he should have the sense to use his regular account for posts like this.;-2;1;False;ebaley;dya5slk;What a time to be alive!;8g8vqu;https://i.redd.it/rbt35cjw89v01.jpg
you youngster with your hippity hop, rap and your blockchain, bahh;2;1;False;bitbat99;dyaafyn;What a time to be alive!;8g8vqu;https://i.redd.it/rbt35cjw89v01.jpg
I feel like typing it ruins the joke;7;1;False;empire314;dy9xulb;What a time to be alive!;8g8vqu;https://i.redd.it/rbt35cjw89v01.jpg
Ethereum is not a shitcoin, monero is not a shitcoin, waves is not a shitcoin, nano is a shitcoin.;-1;1;False;PuckFoloniex;dy9w36s;What a time to be alive!;8g8vqu;https://i.redd.it/rbt35cjw89v01.jpg
"Because very few have a reason to exist except to enrich their ""creators"".";-1;1;False;ebaley;dy9zjq4;What a time to be alive!;8g8vqu;https://i.redd.it/rbt35cjw89v01.jpg
Ferengi Rule of Aquisition number 43: War is good for Business;27;1;False;jediminer543;dyagl8s;What a time to be alive!;8g8vqu;https://i.redd.it/rbt35cjw89v01.jpg
"""just noticed"" when youve been using Reddit for 5 months oooooookkkkkkkkaaaaaayyyyyyyy";-1;1;False;tehngand;dyacacr;What a time to be alive!;8g8vqu;https://i.redd.it/rbt35cjw89v01.jpg
If the United States government and banks simultaneously fail to such a degree then you have more problems to worry about than your bitcoin wallet. ;16;1;False;oneoneoneking;dya8ddl;What a time to be alive!;8g8vqu;https://i.redd.it/rbt35cjw89v01.jpg
Totally agree if something affected all of America, but it would help prevent things when you control it yourself such as losing your seed, fire/water damage, etc. that would only affect one person.  I think of it like why don't people have a bunch of cash in a safe in their home as opposed to a bank.  It's just an extra sense of security.;2;1;False;coinzRfun;dya6uyh;What a time to be alive!;8g8vqu;https://i.redd.it/rbt35cjw89v01.jpg
Yeah!  I would assume in such an extreme example of banks completely dropping local currencies for cryptocurrencies, the Federal Reserve would already have been doing the same thing.  Perhaps not at the same exact time, but I think there'd be a shift in all agencies.  That's totally my opinion though.;5;1;False;coinzRfun;dya2tz5;What a time to be alive!;8g8vqu;https://i.redd.it/rbt35cjw89v01.jpg
">what i mean is, wont banks have no capital because people wont need to store their money in them. 

People can **currently** store cash themselves. They've been able to do it for millennia. They don't need banks. Most don't go it alone because they don't want the responsibility and liability to store and protect it.

I don't know why people expect that to change. The average person practices horrific IT security and is not responsible enough to be perfect protecting their wallets for a lifetime. Most will still likely opt to use professional services to secure wealth. ";6;0;False;hio__State;dyaeada;What a time to be alive!;8g8vqu;https://i.redd.it/rbt35cjw89v01.jpg
"they do loans too though. and get money that way. it's like getting free crypto up front and giving more than you borrowed back over time. banks still dole out money like this and make tons doing that

i do realize it'd be interesting though how much money they could give out if no one puts money in";5;0;False;starogre;dya4omb;What a time to be alive!;8g8vqu;https://i.redd.it/rbt35cjw89v01.jpg
/r/evenwithcontext;5;0;False;;dyaft35;What a time to be alive!;8g8vqu;https://i.redd.it/rbt35cjw89v01.jpg
"Yes, the source said that, but your comment did not.
";-2;1;False;Name-of_User;dyahdoh;What a time to be alive!;8g8vqu;https://i.redd.it/rbt35cjw89v01.jpg
I had a TI-99/4A with an external 5-1/4 floppy disk drive. My parents weren't rich so I copied BASIC games from the back pages of computer magazines.;2;1;False;ZenAdm1n;dyabcia;What a time to be alive!;8g8vqu;https://i.redd.it/rbt35cjw89v01.jpg
Speak and Spell!;1;0;False;randomusername974631;dyaa87r;What a time to be alive!;8g8vqu;https://i.redd.it/rbt35cjw89v01.jpg
I had a commodore 128 growing up. Did some basic basic and played some games. We were decidedly not rich. ;9;0;False;SannySen;dya5gon;What a time to be alive!;8g8vqu;https://i.redd.it/rbt35cjw89v01.jpg
FAR from it, actually. It was just something we legitimately needed at the time. But I suspect a family member might have helped my parents pay for it.;3;0;False;cy2k;dya6asc;What a time to be alive!;8g8vqu;https://i.redd.it/rbt35cjw89v01.jpg
Same here... thought it was the best then 486 color graphics set me back 4,000 back in the early 90’s that was big money 💰 ;3;1;False;Starman1947;dyad147;What a time to be alive!;8g8vqu;https://i.redd.it/rbt35cjw89v01.jpg
