body;score;nb_replies;stickied;author;id;post_title;post_id;post_link
"Whatever you get paid for this week, you put that USD conversion into BTC.

Or whatever % your finances can handle.";1;1;False;FoodieAdvice;dumft1t;Bitcoin Doesn't Give a Fuck.;7yaaz2;https://v.redd.it/ty2y74gawug01
1. It did go above the number you said it needed and 2. Let's see if it goes all the way to 6.5k and ;0;1;False;;dunoe2v;Bitcoin Doesn't Give a Fuck.;7yaaz2;https://v.redd.it/ty2y74gawug01
And yet you pay exchange fees... While I can withdraw cash from any ATM for $0 thanks to Schwab not having physical banks. Do you know banks' main source of revenue? Interest on loans that are based on minimum reserves. They use those reserves as a basis to borrow money from the fed at the fed funds rate and loan that money out to consumers at a marginally higher rate. It's aritrage. The fees are a drop in the bucket for bank business.;1;0;False;lewdite;dunnn86;Bitcoin Doesn't Give a Fuck.;7yaaz2;https://v.redd.it/ty2y74gawug01
/u/cryptochecker ;1;0;False;rapsody7;duo8rz1;Bitcoin Doesn't Give a Fuck.;7yaaz2;https://v.redd.it/ty2y74gawug01
"Consider for a moment that maybe you're wrong. What do you know about macroeconomics and the various testified fiat currency over the last 50 years? What can your tell me about the Sterling crash of '92? Maybe you should be educating yourself on the economy at large before making assumptions based on obviously little knowledge. Being an ""expert"" in Bitcoin isn't saying much at all.";1;1;False;lewdite;dunniad;Bitcoin Doesn't Give a Fuck.;7yaaz2;https://v.redd.it/ty2y74gawug01
And yet by natural design it doesn't scale well. Not only does scale increase the difficulty and power requirements for mining (upon which the entire blockchain relies) but a network with more and more nodes becomes slower as sychronization time must increase as a matter of physics. Information transfer does not happen instantaneously or even at the speed of light.;1;0;False;lewdite;dunnrs5;Bitcoin Doesn't Give a Fuck.;7yaaz2;https://v.redd.it/ty2y74gawug01
"First around $8,500 in the short term, then the low of ~$6,900 but I believe $6,500 to be a psychologically important level and the most likely level of resistance should the downtrend continue. 

It could easily break below that very quickly given the momentum and volatility. ";1;0;False;lewdite;dunt6wp;Bitcoin Doesn't Give a Fuck.;7yaaz2;https://v.redd.it/ty2y74gawug01
"Oh yeah, so unpredictable right? Who could have seen this recent move downward after testing resistance...


Oh wait, it's doing exactly what I said to would. 

How do you feel about technical analysis now? Maybe it's time you researched how an economy works so you have a better understanding of how assets are traded.";1;1;False;lewdite;duno2m1;Bitcoin Doesn't Give a Fuck.;7yaaz2;https://v.redd.it/ty2y74gawug01
See why I drew that line?;0;2;False;lewdite;dunnc0z;Bitcoin Doesn't Give a Fuck.;7yaaz2;https://v.redd.it/ty2y74gawug01
Ok, and it should fall till the next support like at about 6.5k;1;1;False;;dunsm84;Bitcoin Doesn't Give a Fuck.;7yaaz2;https://v.redd.it/ty2y74gawug01
> Consider for a moment that maybe you're wrong. ;0;0;False;rapsody7;dunq1tg;Bitcoin Doesn't Give a Fuck.;7yaaz2;https://v.redd.it/ty2y74gawug01
I mean it's still around 10k, and to claim a 1.5k swing on btc as proof of your claim is arrogant IMO ;1;0;False;brndnlltt;dunwfl1;Bitcoin Doesn't Give a Fuck.;7yaaz2;https://v.redd.it/ty2y74gawug01
"I made a post a week or two ago that was completely ignored... The fact that I made it later at night probably didn't help. Here it is:
https://www.reddit.com/r/Bitcoin/comments/7wqwuo/why_nobody_should_be_in_a_hurry_to_buy_bitcoin/

Edit: the $11,694 peak is where I pegged resistance and it seems to have held for now ";1;0;False;lewdite;dunn1m7;Bitcoin Doesn't Give a Fuck.;7yaaz2;https://v.redd.it/ty2y74gawug01
"It was actually $11,694 but there's some variance to be expected during intra-day trading. The key is that it didn't break out above that level and thus failed an important test of investor resolve.

People saw the price reach the last peak and decided to sell rather than buy more... That's the main point to take away from this. In the investing world this called a ""double top""";1;1;False;lewdite;dunsfap;Bitcoin Doesn't Give a Fuck.;7yaaz2;https://v.redd.it/ty2y74gawug01
https://blockchain.info/payment_request?address=1542J1e5XRTc32umAhgxisRGjJFkqZwmRy&amount_local=47.10002153316107&currency=USD&nosavecurrency=true&message=Donation%20to%20help%20children%20in%20need;1;0;False;Helpthechildren909sb;dumzj6r;I'm donating 5057 BTC to charitable causes! Introducing The Pineapple Fund;7jj0oa;https://www.reddit.com/r/Bitcoin/comments/7jj0oa/im_donating_5057_btc_to_charitable_causes/
"This one:

# #endthevirus, DRACO research:

https://www.reddit.com/r/Bitcoin/comments/7jj0oa/im_donating_5057_btc_to_charitable_causes/#dr6vvsd";1;0;False;feelosofee;dumzc2g;I'm donating 5057 BTC to charitable causes! Introducing The Pineapple Fund;7jj0oa;https://www.reddit.com/r/Bitcoin/comments/7jj0oa/im_donating_5057_btc_to_charitable_causes/
mrsangosan, I hope your project goes well. There is an app called Stop Smoke Stock, you might be interested in. The point of the app is that you can virtually trade with different cryptocurrencies and stocks with the money you saved from quitting.  ;1;0;False;CatfishMustachEe;dunyhr8;I will buy 10$ of bitcoin everyday instead of my daily cigarettes !;6y1hx4;https://www.reddit.com/r/Bitcoin/comments/6y1hx4/i_will_buy_10_of_bitcoin_everyday_instead_of_my/
True bear whale styles!!!;3;0;False;TechBiZard;dumupod;Very accurate representation of how my portfolio is doing;7z6q3j;https://v.redd.it/nm6eley0dlh01
Actually... ;3;1;False;WatNxt;dunczsj;Very accurate representation of how my portfolio is doing;7z6q3j;https://v.redd.it/nm6eley0dlh01
Or eatin' a dick.  Amirite ?  McAfee I'm lookin' at you !  :D  :D;1;0;False;Crypto_To_The_Core;dumg276;Very accurate representation of how my portfolio is doing;7z6q3j;https://v.redd.it/nm6eley0dlh01
[removed];2;1;False;;dumfqas;Very accurate representation of how my portfolio is doing;7z6q3j;https://v.redd.it/nm6eley0dlh01
"> If only I could reverse three decisions in my life

Try [this](https://bitcoinregret.club/), they can help you. Or maybe not.";2;0;False;HighInLowOut;dun32iq;Very accurate representation of how my portfolio is doing;7z6q3j;https://v.redd.it/nm6eley0dlh01
Remember that 1 dollar in 1950 is the same as 10 dollars today. What do you think 1 dollar will be worth in 10 years?;1;0;False;olenbarus12;dunat2u;Very accurate representation of how my portfolio is doing;7z6q3j;https://v.redd.it/nm6eley0dlh01
lol;1;0;False;inthevibe;dund4a1;Very accurate representation of how my portfolio is doing;7z6q3j;https://v.redd.it/nm6eley0dlh01
Doesn't make sense to invest in anything you are ashamed of or don't agree with really, there are plenty of good growing companies that need investments out there.;2;0;False;livingin-sin;dun6jz7;Very accurate representation of how my portfolio is doing;7z6q3j;https://v.redd.it/nm6eley0dlh01
"Money has no ethics or morals. Do not feel bad its called capitalism for a reason ;-)  I'd buy Perdue if I could.";2;0;False;adafrank;dumhw0a;Very accurate representation of how my portfolio is doing;7z6q3j;https://v.redd.it/nm6eley0dlh01
"> I don't want to be someone who, when the music stops, doesn't own Bitcoin.


What ??  When the music stops, Bitcoin goes to zero.  You do NOT want to be holding any BTC when the music stops.
Oh, and if you don't have 1,000's of BTC, you might still get lucky and make it to the citadel, but you will be the toilet cleaner and ass wiper for all the early adopters.";3;1;False;Crypto_To_The_Core;dumge0a;Very accurate representation of how my portfolio is doing;7z6q3j;https://v.redd.it/nm6eley0dlh01
You think the bitcoin market is worth more than the entire US dollar market even though it has no real world usage?  How could that be anything other than a bubble?;2;1;False;FrenchFryCattaneo;dumutei;Very accurate representation of how my portfolio is doing;7z6q3j;https://v.redd.it/nm6eley0dlh01
Bitcoin will be 10mill in 10 years. Of course 10mill wont be worth the same as 10mill know because money creation is going to start increasing exponentially. Its literally the only way to keep the system going;2;0;False;olenbarus12;dunapy8;Very accurate representation of how my portfolio is doing;7z6q3j;https://v.redd.it/nm6eley0dlh01
It will be considered a wonder of the world that you can own. ;1;0;False;Sulack;dumkrk9;Very accurate representation of how my portfolio is doing;7z6q3j;https://v.redd.it/nm6eley0dlh01
">>So you think 10x the current price is a upper bound?

>I’m not dumb enough to make that prediction.

But plenty around here are dumb enough to make that prediction.  Idiots making insane predictions are dime a dozen round here.  :/";1;1;False;Crypto_To_The_Core;dumgnzh;Very accurate representation of how my portfolio is doing;7z6q3j;https://v.redd.it/nm6eley0dlh01
[deleted];4;0;False;;dumnzc9;Very accurate representation of how my portfolio is doing;7z6q3j;https://v.redd.it/nm6eley0dlh01
:] touche;2;1;False;HighEnlightenment;dumftr1;Very accurate representation of how my portfolio is doing;7z6q3j;https://v.redd.it/nm6eley0dlh01
My rule is to buy more omg when it dips below $10 (probably won't happen again). I am certain omg will shoot up to over $100 at some point this year. I am also trying to accumulate 10 neo since it's better than ether in many ways and has a lower supply;1;0;False;arseniy1234555;dun3lme;Very accurate representation of how my portfolio is doing;7z6q3j;https://v.redd.it/nm6eley0dlh01
"I have finally broken my habit of checking the Bitcoin price and have ascended to a true holder. It;s been 4 months since I last looked up the price. ";14;2;False;Bitcoin_Acolyte;dumjw8o;Very accurate representation of how my portfolio is doing;7z6q3j;https://v.redd.it/nm6eley0dlh01
Or if the hash rate goes down that just means people are not as interested in trying to earn the block reward and fees. That could have a correlation to the value of the digital, deflationary, decentralized asset, or it could not. We have no clue since it is not the case and has never been seen before. The hash rate just needs to be high enough to protect against a hard fork attack. Higher than that really doesn't do anything other than force folks to have higher electric bills.;0;0;False;jmblock2;dumorun;Very accurate representation of how my portfolio is doing;7z6q3j;https://v.redd.it/nm6eley0dlh01
"good one lol
";1;0;False;SameNegotiation;dun7u1m;Very accurate representation of how my portfolio is doing;7z6q3j;https://v.redd.it/nm6eley0dlh01
We need an Italian to translate please;1;0;False;ta6514;dun7f1f;Very accurate representation of how my portfolio is doing;7z6q3j;https://v.redd.it/nm6eley0dlh01
torilla tavataan;1;0;False;fastboi1337;dun5o7b;Very accurate representation of how my portfolio is doing;7z6q3j;https://v.redd.it/nm6eley0dlh01
What's the original video source for this GIF?;1;0;False;PhantomMod;dun2rws;Very accurate representation of how my portfolio is doing;7z6q3j;https://v.redd.it/nm6eley0dlh01
Short term traders be watching the chart every second no wonder that illustration😂;1;0;False;moka_G;dumxfqd;Very accurate representation of how my portfolio is doing;7z6q3j;https://v.redd.it/nm6eley0dlh01
I believe I'm not alone, that's why we see so many swings. As soon as impatient people see that they can get out without a loss, they sell.;1;0;False;Zacis;dumsx2a;Very accurate representation of how my portfolio is doing;7z6q3j;https://v.redd.it/nm6eley0dlh01
Plant many types of seeds.;1;0;False;SAWarriorDad;dums4ps;Very accurate representation of how my portfolio is doing;7z6q3j;https://v.redd.it/nm6eley0dlh01
Exactly! ;1;0;False;nagnoib38;dump3sq;Very accurate representation of how my portfolio is doing;7z6q3j;https://v.redd.it/nm6eley0dlh01
Just as a daily dogecoin chart.;1;0;False;codescloud;dumkk09;Very accurate representation of how my portfolio is doing;7z6q3j;https://v.redd.it/nm6eley0dlh01
i bet that guy smells like really good pasta sauce ;1;0;False;smashingintoyourdm;dumk1pg;Very accurate representation of how my portfolio is doing;7z6q3j;https://v.redd.it/nm6eley0dlh01
Mine too end of the day today was ugly;1;0;False;stan93;dumivrd;Very accurate representation of how my portfolio is doing;7z6q3j;https://v.redd.it/nm6eley0dlh01
now you can hand jive baby!;1;0;False;BroadwayBully;dumgcyj;Very accurate representation of how my portfolio is doing;7z6q3j;https://v.redd.it/nm6eley0dlh01
"That's because we're confused about when we're going to dip to a new low after the ATH.

https://imgur.com/a/tObLd

History doesn't repeat, but it rhymes.";1;0;False;xamboozi;dumfqks;Very accurate representation of how my portfolio is doing;7z6q3j;https://v.redd.it/nm6eley0dlh01
this is funny hahaha shit;2;0;False;SaveMandela;dunhb9d;Very accurate representation of how my portfolio is doing;7z6q3j;https://v.redd.it/nm6eley0dlh01
You'll notice he ended with thumbs up!!!;2;0;False;Zafriti;dungtox;Very accurate representation of how my portfolio is doing;7z6q3j;https://v.redd.it/nm6eley0dlh01
Lol yep! I mean it’s always going to be volatile especially in such early stages! ;2;1;False;Nazariy1995;dundwdu;Very accurate representation of how my portfolio is doing;7z6q3j;https://v.redd.it/nm6eley0dlh01
How do I save this video? ;2;0;False;Alen_C137;dumstqc;Very accurate representation of how my portfolio is doing;7z6q3j;https://v.redd.it/nm6eley0dlh01
Sooo volatile. Emotional rollercoaster.;2;0;False;chimob;dumhcs4;Very accurate representation of how my portfolio is doing;7z6q3j;https://v.redd.it/nm6eley0dlh01
I wish I could say the same. Mine is going in just one direction...;3;0;False;tht333;dunaqhw;Very accurate representation of how my portfolio is doing;7z6q3j;https://v.redd.it/nm6eley0dlh01
totally relevant hahaha;1;0;False;BTCMONSTER;dun9vdm;Very accurate representation of how my portfolio is doing;7z6q3j;https://v.redd.it/nm6eley0dlh01
Everyone was. If only I could reverse three decisions in my life I'd hold enough omg to make you weep. ;4;1;False;henryguy;duml2jq;Very accurate representation of how my portfolio is doing;7z6q3j;https://v.redd.it/nm6eley0dlh01
Cash me outta the mattress.;1;0;False;LutherMcDuff;duna8or;Very accurate representation of how my portfolio is doing;7z6q3j;https://v.redd.it/nm6eley0dlh01
Most accurate of all time. ;1;0;False;ChaoticCrypto;dundgiw;Very accurate representation of how my portfolio is doing;7z6q3j;https://v.redd.it/nm6eley0dlh01
First of all, hash rate is one part of the underlying tech: it's to build and maintain a permissionless ledger. And as others already pointed out: mining reward + tx fee and hash rate are in correlation. And secondly, price is in correlation to demand which is adoption. These  3 pillars are interdependent and that's the reason why it took several years for bitcoin to take off and why it will take years to stabilize towards equilibrium. ;1;0;False;CryptoHanzo;dunvwbo;Very accurate representation of how my portfolio is doing;7z6q3j;https://v.redd.it/nm6eley0dlh01
lolz;1;0;False;Uvas23;dumlqb2;Very accurate representation of how my portfolio is doing;7z6q3j;https://v.redd.it/nm6eley0dlh01
pls be 10,000;3;1;False;Bitcoin_Acolyte;dumzqja;Very accurate representation of how my portfolio is doing;7z6q3j;https://v.redd.it/nm6eley0dlh01
Holding omg for 6 months and vechain since 1.50.   So I think I'm good for now still too.  But i was better in Dec;4;2;False;pm_me_ur_cryptoz;dumi7ax;Very accurate representation of how my portfolio is doing;7z6q3j;https://v.redd.it/nm6eley0dlh01
Yep. Eth holder;5;0;False;shotty293;dumgdtx;Very accurate representation of how my portfolio is doing;7z6q3j;https://v.redd.it/nm6eley0dlh01
Anal sex?;5;0;False;cafeumlaut;dumr0jf;Very accurate representation of how my portfolio is doing;7z6q3j;https://v.redd.it/nm6eley0dlh01
I only keep checking so I know when to buy more!;3;0;False;ArsLankier;dumya7d;Very accurate representation of how my portfolio is doing;7z6q3j;https://v.redd.it/nm6eley0dlh01
Is it $10 or $10,000? You don't even know!;6;1;False;bitbotbitbot;dumu63s;Very accurate representation of how my portfolio is doing;7z6q3j;https://v.redd.it/nm6eley0dlh01
Kyllä kansa tietää. ;3;0;False;kalofkaus;dun6te6;Very accurate representation of how my portfolio is doing;7z6q3j;https://v.redd.it/nm6eley0dlh01
Yes, of course. We are on the beginning stage. On the genesis stage only, genesis of something bigger.;1;0;False;Bitcheke_ENG;dunfkhz;Very accurate representation of how my portfolio is doing;7z6q3j;https://v.redd.it/nm6eley0dlh01
If your a shit day trader you loose money, if your a good day trader you gain satoshi and don't give a fuck about the cost of btc/usd.;3;0;False;24_UK;dumh3z0;Very accurate representation of how my portfolio is doing;7z6q3j;https://v.redd.it/nm6eley0dlh01
Timo Soini talking about something that involves a lot of thumbs;5;1;False;T3m;dumpfz2;Very accurate representation of how my portfolio is doing;7z6q3j;https://v.redd.it/nm6eley0dlh01
[removed];1;1;False;;dumfuwc;Very accurate representation of how my portfolio is doing;7z6q3j;https://v.redd.it/nm6eley0dlh01
Nyt kyllä perkele;2;0;False;Noxime;dun3hy9;Very accurate representation of how my portfolio is doing;7z6q3j;https://v.redd.it/nm6eley0dlh01
who gives a fuck??;0;0;False;cryptonut;dun8buw;Very accurate representation of how my portfolio is doing;7z6q3j;https://v.redd.it/nm6eley0dlh01
The millennials investment;0;0;False;logic_ist;duml92f;Very accurate representation of how my portfolio is doing;7z6q3j;https://v.redd.it/nm6eley0dlh01
Torilla tavataan jätkät;1;0;False;nande_fish;dumn3wv;Very accurate representation of how my portfolio is doing;7z6q3j;https://v.redd.it/nm6eley0dlh01
You must of got in too late;1;0;False;one_giant_nostril2;dunjrt2;Very accurate representation of how my portfolio is doing;7z6q3j;https://v.redd.it/nm6eley0dlh01
Haha, so accurate. ;1;0;False;e-crypto92;dunhhn6;Very accurate representation of how my portfolio is doing;7z6q3j;https://v.redd.it/nm6eley0dlh01
Ahahahahhaah;1;0;False;wazJey;dunbwx6;Very accurate representation of how my portfolio is doing;7z6q3j;https://v.redd.it/nm6eley0dlh01
Investors will always win!;2;0;False;HighEnlightenment;dumfz2d;Very accurate representation of how my portfolio is doing;7z6q3j;https://v.redd.it/nm6eley0dlh01
going down again but hopefully will be back to 20k by April;1;0;False;bbhampton;dumhn77;New to Bitcoin? Here's how to spot a correction..;7ilgc9;https://www.reddit.com/r/Bitcoin/comments/7ilgc9/new_to_bitcoin_heres_how_to_spot_a_correction/
Hmm I'm an average Joe and I couldn't explain how electricity works any better than I could explain how bitcoin works. I get the basic principles and I can regurgitate facts that I know but I still don't understand the working mechanics of either electricity or bitcoin. I mean I go onto coinbase and click buy BTC, which is the equivalent of me flicking the light switch on and off at home. Just saying. ;1;0;False;Lurker_9-1;dumruyc;Thought I might share this in here. No way Bitcoin is going to survive folks...;7wvhj2;https://i.redd.it/bhifm8cmcnf01.jpg
why did you make r/2b2t;1;0;False;Camper125;duny9vg;Polish Youtuber was paid ~30 000$ By Polish Bank to create FUD video about cryptocurrencies for his viewers;7ykxex;http://www.cryptovibes.com/crypto-news/youtuber-was-paid-by-polish-bank-to-slander-crpytocurrencies/
