body;score;nb_replies;stickied;author;id;post_title;post_id;post_link
Bigger caveat is its centralized. ;1;0;False;eagreeyes;dy94wly;I took a trip with some friends to a sleepy rural town in Japan, hours outside of Tokyo. We entered a cafe and were surprised to see that they accepted bitcoin. Here is my friend buying a chocolate cake.;8fz2iz;https://v.redd.it/6ptl0ma9h1v01
In short trustless is a problem that no one had.;1;0;False;section_sign;dy99zxf;I took a trip with some friends to a sleepy rural town in Japan, hours outside of Tokyo. We entered a cafe and were surprised to see that they accepted bitcoin. Here is my friend buying a chocolate cake.;8fz2iz;https://v.redd.it/6ptl0ma9h1v01
So why even have blockchain at all? You can do the same thing with just paper money.;2;1;False;downquark5;dy8q7ra;I took a trip with some friends to a sleepy rural town in Japan, hours outside of Tokyo. We entered a cafe and were surprised to see that they accepted bitcoin. Here is my friend buying a chocolate cake.;8fz2iz;https://v.redd.it/6ptl0ma9h1v01
"Japan's FSA is watching all of the exchanges' balances like a hawk...

If the total deposits goes above the total reserves in cold storage, FSA calls you up and you're in trouble.

And since the coincheck thing, they are getting strict on hot/warm wallet reserves too...

A Japanese exchange getting goxxed to the point of bankruptcy will not happen again in Japan. We won't let it.

BUT

You always have the option to move your coins to cold storage, hot wallets, or the ""Satoshi Nakamoto"" key if you want. That freedom is the value proposition here.

Think of Bitflyer like a hot wallet with insurance (if you have 2FA enabled) on it but in exchange for that you don't control the private keys. Only put pocket change on there. (Whatever pocket change is for you can vary)";3;0;False;kinoshitajona;dy8l8ep;I took a trip with some friends to a sleepy rural town in Japan, hours outside of Tokyo. We entered a cafe and were surprised to see that they accepted bitcoin. Here is my friend buying a chocolate cake.;8fz2iz;https://v.redd.it/6ptl0ma9h1v01
"All spending is not shorting, its just spending.  You are so wrapped up in legacy mindset you aren't seeing the real picture here.

It doesn't matter if any fiat is used at all here: this is a payment rail that will work just fine even if the JPY ceased to exist entirely. It will work for a tourist who has never seen or touched a single yen. 

Your bleak cynicism is missing the whole point.";2;0;False;shanita10;dy94lv8;I took a trip with some friends to a sleepy rural town in Japan, hours outside of Tokyo. We entered a cafe and were surprised to see that they accepted bitcoin. Here is my friend buying a chocolate cake.;8fz2iz;https://v.redd.it/6ptl0ma9h1v01
That's great. I didn't see it anywhere. Do you have a link?;1;0;False;maxbjaevermose;dy9gg2z;I took a trip with some friends to a sleepy rural town in Japan, hours outside of Tokyo. We entered a cafe and were surprised to see that they accepted bitcoin. Here is my friend buying a chocolate cake.;8fz2iz;https://v.redd.it/6ptl0ma9h1v01
"i upwoted him for your second upvote of your ""twice""";19;1;False;batmanoflove;dy8j49j;I took a trip with some friends to a sleepy rural town in Japan, hours outside of Tokyo. We entered a cafe and were surprised to see that they accepted bitcoin. Here is my friend buying a chocolate cake.;8fz2iz;https://v.redd.it/6ptl0ma9h1v01
"That's why there is so much effort put into making lightning network, rather than a copy of our current Banks/Pay-Pal.  

I personally wouldn't call a solution like Bitflyer to Bitflyer payments a bad interim solution while people are still in the process of adopting Bitcoin/crypto.  
  
The main idea is to move from a trust system to a trust-less one.   We live in a world where everything is setup around trust systems, so we have to transition from one setup and mindset to another.  
This doesn't go equally easy for everyone.  

So in my opinion while we are making trust-less transactions be as ""convenient"" as the ones everyone is currently used to through 3rd parties like Pay-Pal/Visa.  
There should be ways that let people go about their crypto in the same way as those 3rd parties let them do it even though that means using these ""trusted"" 3rd parties for now.  

If people are already using crypto even before we can transact as conveniently in trust-less ways as we do through 3rd parties, then they will have much easier time transitioning to the trust-less solutions without having to get used to handling crypto first.  

I guess what I'm trying to say is that these kind of solutions help the adoption for the general public as simply owning (a little bit of) crytpo even if it is on an exchange gives reason to learn more about what it is you own and spark questions and conversations about crypto.  

While the general public still learns more about crypto, in the meantime the crypto developers can move things forward into making real trust-less solutions equally convenient.  ";7;2;False;Snowaeth;dy93uzg;I took a trip with some friends to a sleepy rural town in Japan, hours outside of Tokyo. We entered a cafe and were surprised to see that they accepted bitcoin. Here is my friend buying a chocolate cake.;8fz2iz;https://v.redd.it/6ptl0ma9h1v01
"The difference would depend on which off-chain/2nd layer methods you are using.  

So in the case of Bitflyer to Bitflyer/Coinbase to Coinbase off-chain crypto transactions it is not different than Pay-Pal/(Visa).  
In case of something like lightning it is quite different as lightning strives to do the same with a trust-less setup (which requires the underlying blockchain to work).  

The previous is easier to set-up while the later keeps you in control of your crypto but requires more effort to set up.";11;1;False;Snowaeth;dy8rgda;I took a trip with some friends to a sleepy rural town in Japan, hours outside of Tokyo. We entered a cafe and were surprised to see that they accepted bitcoin. Here is my friend buying a chocolate cake.;8fz2iz;https://v.redd.it/6ptl0ma9h1v01
no difference except that huge difference;4;0;False;sexyama;dy9aa5t;I took a trip with some friends to a sleepy rural town in Japan, hours outside of Tokyo. We entered a cafe and were surprised to see that they accepted bitcoin. Here is my friend buying a chocolate cake.;8fz2iz;https://v.redd.it/6ptl0ma9h1v01
"That the currency being used is bitcoin is a huge difference. While visa has 2 trusted parties (visa and government), this transaction only requires 1.

Some people will require/desire custodianship and that's fine too. ";1;0;False;grinnersaok;dy9bwny;I took a trip with some friends to a sleepy rural town in Japan, hours outside of Tokyo. We entered a cafe and were surprised to see that they accepted bitcoin. Here is my friend buying a chocolate cake.;8fz2iz;https://v.redd.it/6ptl0ma9h1v01
I don't know, because metal coins are obnoxious. because cash is literally coated in disease. because banks close after a certain hour of the day. because atms put you in a vulnerable situation and increasingly insecure. because credit cards get frozen when traveling. because banks in japan are paying negative interest rates. little things like that.;1;0;False;ChampramBenjaporn;dy94w99;I took a trip with some friends to a sleepy rural town in Japan, hours outside of Tokyo. We entered a cafe and were surprised to see that they accepted bitcoin. Here is my friend buying a chocolate cake.;8fz2iz;https://v.redd.it/6ptl0ma9h1v01
Me too;1;1;False;houzemuzik;dy97vl0;I took a trip with some friends to a sleepy rural town in Japan, hours outside of Tokyo. We entered a cafe and were surprised to see that they accepted bitcoin. Here is my friend buying a chocolate cake.;8fz2iz;https://v.redd.it/6ptl0ma9h1v01
"Were a long way from global adoption. Problem is, there’s a lot of friction, especially just to get started (get your first cryptos). So I get that for now we have to compromise just to gain some traction, and let go of lofty ideals. The real issue is that the current banking and credit card system comes with little apparent downside from most common use. People don’t “see” the 3% price increase across the board and only think they get a free 1% cashback assuming they pay right away. Point is, there has to be a benefit to justify using cryptos, and right now it’s a ton of friction in order to bypass the ease of use of banks/credit cards. Right now, if something goes wrong with the bank/credit card, you know you can go just about to the street corner or call the credit card company and get help right away. With cryptos, odds are you just lost everything and that’s that. I don’t believe cryptos need that level of infrastructure; I’m simply illustrating how pervasive the friction is comparatively. If cryptos were easier to use than Apple Pay, then who knows, there’s maybe real potential. From regulation, to price instability, to many things, to even simple things like being able to pay without electricity or internet access, it’s just really lacking in terms of using cryptos as a currency.

So yeah, it might be a step in the good direction seemingly for now, and it does help lower friction, but it doesn’t inherently give a strong reason for anyone to ditch credit cards. Maybe for inter-country transfer that’s where it shines, I’m not entirely sure where else it is clearly better than alternatives. My real worry with this is that as we will creep closer towards adoption, it’s likely those existing services that have done us good to gain adoption, will just end up making it bad to use anything else besides them. Kind of like, they’d make it hard to leave their systems, so people end up just using their service and the momentum is too big to stop at this point. Kind of like Facebook (although it never had any benevolent intention at any point).

I’d say that, somewhat sadly, we’d probably be best of waiting until the tech is mature enough that it’s ready to scale to global adoption, and then we build on top of that. If we just compromise at any point, the path of least resistance is likely to take over and we’ll be fighting an uphill battle to maintain a trustless system.";3;1;False;manly_;dy94ym7;I took a trip with some friends to a sleepy rural town in Japan, hours outside of Tokyo. We entered a cafe and were surprised to see that they accepted bitcoin. Here is my friend buying a chocolate cake.;8fz2iz;https://v.redd.it/6ptl0ma9h1v01
Totally agree.;1;0;False;LouisOfTokyo;dy9awri;I took a trip with some friends to a sleepy rural town in Japan, hours outside of Tokyo. We entered a cafe and were surprised to see that they accepted bitcoin. Here is my friend buying a chocolate cake.;8fz2iz;https://v.redd.it/6ptl0ma9h1v01
So LN works on chain by pooling transactions and sending them in bunches or groups?;1;1;False;downquark5;dy8s526;I took a trip with some friends to a sleepy rural town in Japan, hours outside of Tokyo. We entered a cafe and were surprised to see that they accepted bitcoin. Here is my friend buying a chocolate cake.;8fz2iz;https://v.redd.it/6ptl0ma9h1v01
#me2;1;0;False;kashmirbtc;dy9cya1;I took a trip with some friends to a sleepy rural town in Japan, hours outside of Tokyo. We entered a cafe and were surprised to see that they accepted bitcoin. Here is my friend buying a chocolate cake.;8fz2iz;https://v.redd.it/6ptl0ma9h1v01
"Absolutely agree with your fears and I think it's on everyone that understands the importance of trust-less systems to educate others on why we should be switching over to those from the current trusted systems (short summary: you can't trust people).  

I personally don't think that crypto can delay its adoption to wait on tech to be on par with current systems before we push for mass adoption.  
I think that adoption is needed to drive the development and get it sped up enough to catch up and overtake the current systems that we have.  

I think that adoption and tech push each other.  
More adoption, means more minds will tune into the crypto space, means faster progress, means more adoption means more progress, etc.  
As long as out of all the people that join the space there are enough people that understand the importance and necessity of trust-less solutions over trusted ones the progress on the trust-less front will speed up in tandem with the increased adoption.  

But yes the scary part is if the ""trusted"" parties will start to fight that progression to hang on to their power, but luckily that in itself can cause progress to be made on the trust-less front which would have to find ways to bypass whatever was come up with to stop them.";1;0;False;Snowaeth;dyahesf;I took a trip with some friends to a sleepy rural town in Japan, hours outside of Tokyo. We entered a cafe and were surprised to see that they accepted bitcoin. Here is my friend buying a chocolate cake.;8fz2iz;https://v.redd.it/6ptl0ma9h1v01
This is quite informative.Thank you for this.;1;0;False;robinwindy;dy940bi;I took a trip with some friends to a sleepy rural town in Japan, hours outside of Tokyo. We entered a cafe and were surprised to see that they accepted bitcoin. Here is my friend buying a chocolate cake.;8fz2iz;https://v.redd.it/6ptl0ma9h1v01
It’s exactly like an exchange, trading two cryptos between eachother, nothing happens onchain until you withdraw/deposit into the exchange, the exchange themselves hold all the private keys and just shuffle IOUs around;1;0;False;8A8;dy8y8nw;I took a trip with some friends to a sleepy rural town in Japan, hours outside of Tokyo. We entered a cafe and were surprised to see that they accepted bitcoin. Here is my friend buying a chocolate cake.;8fz2iz;https://v.redd.it/6ptl0ma9h1v01
How popular are cheques these days ???;2;0;False;GaryHarrisEsquire;dy9adj8;I took a trip with some friends to a sleepy rural town in Japan, hours outside of Tokyo. We entered a cafe and were surprised to see that they accepted bitcoin. Here is my friend buying a chocolate cake.;8fz2iz;https://v.redd.it/6ptl0ma9h1v01
So there is literally no difference between off-chain transactions and Visa other than the currency being used is bitcoin instead of fiat. ;8;3;False;downquark5;dy8qmo8;I took a trip with some friends to a sleepy rural town in Japan, hours outside of Tokyo. We entered a cafe and were surprised to see that they accepted bitcoin. Here is my friend buying a chocolate cake.;8fz2iz;https://v.redd.it/6ptl0ma9h1v01
You can see the amount of btc sent. There didn't have to be any fiat involved in the transaction at all.;1;1;False;shanita10;dy92hnt;I took a trip with some friends to a sleepy rural town in Japan, hours outside of Tokyo. We entered a cafe and were surprised to see that they accepted bitcoin. Here is my friend buying a chocolate cake.;8fz2iz;https://v.redd.it/6ptl0ma9h1v01
it's good to see that now people are accepting cryptocurrencies as a payment ;3;0;False;luciebeckova;dy94b4k;I took a trip with some friends to a sleepy rural town in Japan, hours outside of Tokyo. We entered a cafe and were surprised to see that they accepted bitcoin. Here is my friend buying a chocolate cake.;8fz2iz;https://v.redd.it/6ptl0ma9h1v01
"> One time, many years ago, there was an orphaned chain with like 26 blocks on it.
> 
> 

Yikes. How'd that happen? ";1;1;False;benjaminikuta;dy8k88x;I took a trip with some friends to a sleepy rural town in Japan, hours outside of Tokyo. We entered a cafe and were surprised to see that they accepted bitcoin. Here is my friend buying a chocolate cake.;8fz2iz;https://v.redd.it/6ptl0ma9h1v01
"It is possible. 

You contradict yourself saying that it's impossible and then going on to tell me how a double spend transaction occurs... Maybe it's not easy? But it's possible. Anyhow miners don't give a shit about the transactions that make it into the block. They're going to put the highest fee transactions in the block. 

LOL ok buddy. Mempool is empty, and no one is sending you bitcoin. Nice try tho. ";1;2;False;Chowdahhhh;dy8m45y;I took a trip with some friends to a sleepy rural town in Japan, hours outside of Tokyo. We entered a cafe and were surprised to see that they accepted bitcoin. Here is my friend buying a chocolate cake.;8fz2iz;https://v.redd.it/6ptl0ma9h1v01
Pretty sure they don't support LN.;1;1;False;maxbjaevermose;dy8xnkk;I took a trip with some friends to a sleepy rural town in Japan, hours outside of Tokyo. We entered a cafe and were surprised to see that they accepted bitcoin. Here is my friend buying a chocolate cake.;8fz2iz;https://v.redd.it/6ptl0ma9h1v01
thanks for the info .I'll try it later;1;0;False;robinwindy;dy94m2h;I took a trip with some friends to a sleepy rural town in Japan, hours outside of Tokyo. We entered a cafe and were surprised to see that they accepted bitcoin. Here is my friend buying a chocolate cake.;8fz2iz;https://v.redd.it/6ptl0ma9h1v01
"In this specific case the point of blockchain is the fact that it secures the bitcoin which makes bitcoin a trusted source of money which in turn becomes accepted money for other payment methods such as this.  
Also in this specific case when accepted in its bitcoin form the sender does not need to convert their bitcoin to the local currency.  

Just like with any other kind of money you can spend bitcoin in more than one way so in this specific case off-chain, for something that doesn't require an on-chain transaction doesn't mean the blockchain securing the whole currency becomes useless while this specific payment itself does not need to be trustless (trusting Bitflyer in this case).  

So this doesn't diminish bitcoins use-case of being usable as trust-less on-chain payment options when it's needed directly from your own private wallet owned by you instead of an exchange if you need that layer of security for your transaction which would come at the cost of transaction/confirmation speed.";197;7;False;Snowaeth;dy8hsw5;I took a trip with some friends to a sleepy rural town in Japan, hours outside of Tokyo. We entered a cafe and were surprised to see that they accepted bitcoin. Here is my friend buying a chocolate cake.;8fz2iz;https://v.redd.it/6ptl0ma9h1v01
"Blockchain is the trustless infrastructure. In many merchant cases, the ability to have instant authorization is a bigger priority for ease of use by customers while trusting a third party than to have trustless payment. 
Also why Lightning is important, so we can have the ability to trustlessly pay instantly so we don't need to sacrifice trustlessness to have instant authorization. ";5;1;False;LunaGuardian;dy8n6k1;I took a trip with some friends to a sleepy rural town in Japan, hours outside of Tokyo. We entered a cafe and were surprised to see that they accepted bitcoin. Here is my friend buying a chocolate cake.;8fz2iz;https://v.redd.it/6ptl0ma9h1v01
To collect money from people on this sub who think that this is “adoption” and provide free advertisement to them for no reason.  Lol.;3;0;False;newprofile15;dy8jiv5;I took a trip with some friends to a sleepy rural town in Japan, hours outside of Tokyo. We entered a cafe and were surprised to see that they accepted bitcoin. Here is my friend buying a chocolate cake.;8fz2iz;https://v.redd.it/6ptl0ma9h1v01
Transfer fees are determined by size of cake?;1;2;False;mronosa;dy8p4mm;I took a trip with some friends to a sleepy rural town in Japan, hours outside of Tokyo. We entered a cafe and were surprised to see that they accepted bitcoin. Here is my friend buying a chocolate cake.;8fz2iz;https://v.redd.it/6ptl0ma9h1v01
"But there is, and there does.  A coffee shop isn’t holding bitcoin on their books.  They pay the middleman to accept the bitcoin and give them the spot price in fiat.  This cafe isn’t receiving crypto, they are receiving Yen.

It’s actually the bitcoin which is completely irrelevant here.  The consumer didn’t buy the bitcoin with the intent to use it in transactions, he bought it for the purpose of speculation.  By “spending it” he is effectively shorting the currency and saying “I think this will be worth less tomorrow so I will spend it instead of fiat.”";0;1;False;newprofile15;dy92sso;I took a trip with some friends to a sleepy rural town in Japan, hours outside of Tokyo. We entered a cafe and were surprised to see that they accepted bitcoin. Here is my friend buying a chocolate cake.;8fz2iz;https://v.redd.it/6ptl0ma9h1v01
"Amusingly, a bug in the database software used by old versions of core, which did not allow a block to have more than 1000 transactions in it at once.  It had nothing to do with Bitcoin itself.

Andreas has a video on it on his channel.";2;0;False;enigmapulse;dy8kop3;I took a trip with some friends to a sleepy rural town in Japan, hours outside of Tokyo. We entered a cafe and were surprised to see that they accepted bitcoin. Here is my friend buying a chocolate cake.;8fz2iz;https://v.redd.it/6ptl0ma9h1v01
"I never said it was impossible.  I said you can't cancel a transaction, and that is true.  Once a transaction is in the mempool, the only way to get it out of the mempool is to invalidate it, and to invalidate it you would need to attempt something like a double spend, which both you and I agree is technically possible, but difficult to do.  Because it's difficult to do, it is both unlikely that the average Joe would attempt it, and unlikely that it's ""worth doing"" for a would-be attacker for small transactions.";2;0;False;enigmapulse;dy8mg4u;I took a trip with some friends to a sleepy rural town in Japan, hours outside of Tokyo. We entered a cafe and were surprised to see that they accepted bitcoin. Here is my friend buying a chocolate cake.;8fz2iz;https://v.redd.it/6ptl0ma9h1v01
I agree, this does seem possible.;1;0;False;agree-with-you;dy8m4c8;I took a trip with some friends to a sleepy rural town in Japan, hours outside of Tokyo. We entered a cafe and were surprised to see that they accepted bitcoin. Here is my friend buying a chocolate cake.;8fz2iz;https://v.redd.it/6ptl0ma9h1v01
100% sure they do;1;1;False;daken15;dy98xiv;I took a trip with some friends to a sleepy rural town in Japan, hours outside of Tokyo. We entered a cafe and were surprised to see that they accepted bitcoin. Here is my friend buying a chocolate cake.;8fz2iz;https://v.redd.it/6ptl0ma9h1v01
I wish I could upvote you twice for such a DIRECT and CONCISE explanation, given the circumstances.  Well said.;29;1;False;TyronePost801;dy8iidb;I took a trip with some friends to a sleepy rural town in Japan, hours outside of Tokyo. We entered a cafe and were surprised to see that they accepted bitcoin. Here is my friend buying a chocolate cake.;8fz2iz;https://v.redd.it/6ptl0ma9h1v01
"Problem is, this design is trusting bitflyer to not act like a bank. As long as nobody cashes out too much, they can “pay” using bitcoins they don’t have. And if there’s ever a lot of deposit, they can also just vanish into thin air with everyone’s bitcoin.

Put simply, if bitcoin was meant to avoid banking, we sure did everything to make sure it behaves exactly like it.";14;1;False;manly_;dy90dbs;I took a trip with some friends to a sleepy rural town in Japan, hours outside of Tokyo. We entered a cafe and were surprised to see that they accepted bitcoin. Here is my friend buying a chocolate cake.;8fz2iz;https://v.redd.it/6ptl0ma9h1v01
"Excellent reply.

> In this specific case the point of blockchain is the fact that it secures the bitcoin which makes bitcoin a trusted source of money which in turn becomes accepted money for other payment methods such as this.

I'd just like to add that if bitcoin becomes a highly trusted, widely accepted money and object of value there isn't much between it and gold, and, from there, there isn't much preventing banks doing exactly what they did with gold; creating a IOU system complete with fractional reserves.

As, er, a retort to my own comment this might not happen the same as it happened with gold because bitcoin is so, so much easier to store and transfer and divide. It is a better *form* of money than gold (albeit it requires all the infrastructure of the internet to work).";3;0;False;WalksOnLego;dy8s9v8;I took a trip with some friends to a sleepy rural town in Japan, hours outside of Tokyo. We entered a cafe and were surprised to see that they accepted bitcoin. Here is my friend buying a chocolate cake.;8fz2iz;https://v.redd.it/6ptl0ma9h1v01
It doesn't go by the amount. You still need a miner to pick up your transaction even if it is small.;1;0;False;Siecje1;dy8okt5;I took a trip with some friends to a sleepy rural town in Japan, hours outside of Tokyo. We entered a cafe and were surprised to see that they accepted bitcoin. Here is my friend buying a chocolate cake.;8fz2iz;https://v.redd.it/6ptl0ma9h1v01
Use other coins like Nano, LTC, or BCH if you are concerned about fees. ;1;0;False;darksoulflame;dy8ywvg;I took a trip with some friends to a sleepy rural town in Japan, hours outside of Tokyo. We entered a cafe and were surprised to see that they accepted bitcoin. Here is my friend buying a chocolate cake.;8fz2iz;https://v.redd.it/6ptl0ma9h1v01
Or rather centralized system is more convenient to use then decentralized. ;17;0;False;rockyrainy;dy8jplc;I took a trip with some friends to a sleepy rural town in Japan, hours outside of Tokyo. We entered a cafe and were surprised to see that they accepted bitcoin. Here is my friend buying a chocolate cake.;8fz2iz;https://v.redd.it/6ptl0ma9h1v01
informed comment of the day. /s;1;0;False;woojung;dy9jf2g;I took a trip with some friends to a sleepy rural town in Japan, hours outside of Tokyo. We entered a cafe and were surprised to see that they accepted bitcoin. Here is my friend buying a chocolate cake.;8fz2iz;https://v.redd.it/6ptl0ma9h1v01
