body;score;nb_replies;stickied;author;id;post_title;post_id;post_link
"It's hard to fathom not receiving a nice bump from bakkt. This is just over a month away.
Sellers regret incoming.";0;0;False;mercistheman;ebx2fv0;Last Year & Today;a6o4sp;https://i.redd.it/vdeafl7obm421.jpg
"Why does everybody talk about lambos? 

Bitcoin is already heating up parts of our planet by farming. And almost every BTC owner I know wants to own a lambo, which is actually one of the least environment friendly cars out there... 

I dream of a Tesla model s or some synthesizers/music gear... 
Or anything else that doesn't destroy our world with carbon dioxide emissions...

I just don't get the lambo hype...";-33;9;False;Breadynator;ebwmxgp;Last Year & Today;a6o4sp;https://i.redd.it/vdeafl7obm421.jpg
They bought in *during* the presentation?;149;2;False;_Long_Story_Short_;ebwwsi1;Last Year & Today;a6o4sp;https://i.redd.it/vdeafl7obm421.jpg
[deleted];0;2;False;;ebwqser;Last Year & Today;a6o4sp;https://i.redd.it/vdeafl7obm421.jpg
lol great timing;28;0;False;slashfromgunsnroses;ebx3qif;Last Year & Today;a6o4sp;https://i.redd.it/vdeafl7obm421.jpg
The reality of purely speculative investment;67;1;False;DifferentThrows;ebwwk62;Last Year & Today;a6o4sp;https://i.redd.it/vdeafl7obm421.jpg
Great first lesson;14;0;False;kempiedempie;ebxf0jb;Last Year & Today;a6o4sp;https://i.redd.it/vdeafl7obm421.jpg
So tell me Mr. Bernanke.. how is BTC going to hit 20K again???;4;1;False;CumiasTheBeesKnees;ebxvu2j;Last Year & Today;a6o4sp;https://i.redd.it/vdeafl7obm421.jpg
Oh fuck thanks for the laugh this morning;29;0;False;johnmarstonsleftnut;ebxdy6h;Last Year & Today;a6o4sp;https://i.redd.it/vdeafl7obm421.jpg
“Uniformed”;14;0;False;Dyslexic_Wizard;ebxpc7l;Last Year & Today;a6o4sp;https://i.redd.it/vdeafl7obm421.jpg
Lol;26;0;False;101415;ebxc8oj;Last Year & Today;a6o4sp;https://i.redd.it/vdeafl7obm421.jpg
I have fond memories of coinbase crashing multiple times a day/week for most of December and into January, saved my ass a few times to be honest. It’s just part of the cycle;6;0;False;pat1122;ebwy4v5;Last Year & Today;a6o4sp;https://i.redd.it/vdeafl7obm421.jpg
If we keep that trend, December 2019 will be huge. ;12;0;False;Beepboopcomrad;ebx7cc0;Last Year & Today;a6o4sp;https://i.redd.it/vdeafl7obm421.jpg
Yes thats right  ;6;1;False;JD-007;ebwkd6l;Last Year & Today;a6o4sp;https://i.redd.it/vdeafl7obm421.jpg
RIP to those who stayed on the boat instead of jumping ship while their money was still in profit.;41;3;False;;ebwly4k;Last Year & Today;a6o4sp;https://i.redd.it/vdeafl7obm421.jpg
Cryptosleep?;48;2;False;Breadynator;ebwmxtz;Last Year & Today;a6o4sp;https://i.redd.it/vdeafl7obm421.jpg
You fuckin dumbass lol;25;0;False;;ebxo6ne;Last Year & Today;a6o4sp;https://i.redd.it/vdeafl7obm421.jpg
https://i.redd.it/32woob2j4r401.jpg;1;0;False;Explodicle;ebwvvd2;Last Year & Today;a6o4sp;https://i.redd.it/vdeafl7obm421.jpg
If it makes you feel better you probably would have sold at $100. ;48;1;False;darkjedisa;ebx3i6z;Last Year & Today;a6o4sp;https://i.redd.it/vdeafl7obm421.jpg
Honestly, its much worse for us who bought in and sold too soon.;12;2;False;UnpredictedArrival;ebx5oh7;Last Year & Today;a6o4sp;https://i.redd.it/vdeafl7obm421.jpg
"Its ok ...  you can buy bitcoin for  your kids  and  for sure  your  Grand sons  too   haha !!!   Think  this  like as  you are in early  1900's  and  you are  investing in Real Estate.  I think  that makes  sense  .. just be an EARLY ADOPTER-  This is our  Generation  only  we are the owners of this  E-Cash  system 

Think Long Term and HODL BITCOIN  ! ";3;1;False;JD-007;ebx0bh9;Last Year & Today;a6o4sp;https://i.redd.it/vdeafl7obm421.jpg
Dollar is shit.;0;2;False;Polak_Potrafi;ebwpc31;Last Year & Today;a6o4sp;https://i.redd.it/vdeafl7obm421.jpg
Hahaha   you  lucky  bastard .. Good though ;10;1;False;JD-007;ebx6h3c;Last Year & Today;a6o4sp;https://i.redd.it/vdeafl7obm421.jpg
That's because it's Chinese New Year in advance bruh!;3;0;False;morpheuz69;ebxsbto;Last Year & Today;a6o4sp;https://i.redd.it/vdeafl7obm421.jpg
"https://www.cointimemachine.com/what-if-i-had-invested-1000-Euro-in-bitcoin-on-12-15-2017/

-81% according to the site";17;0;False;1jons;ebwozrd;Last Year & Today;a6o4sp;https://i.redd.it/vdeafl7obm421.jpg
The good news is you could educate yourself and stop being an idiot but we both know you won't ;-7;0;False;ztsmart;ebx61dx;Last Year & Today;a6o4sp;https://i.redd.it/vdeafl7obm421.jpg
I remember getting $25,000 richer in one day, naively thinking every day from now on would be the same;28;0;False;;ebx67hw;Last Year & Today;a6o4sp;https://i.redd.it/vdeafl7obm421.jpg
[deleted];56;5;False;;ebwwhwe;Last Year & Today;a6o4sp;https://i.redd.it/vdeafl7obm421.jpg
Well it’s not. It already penetrated the publics interest...new entrants will have to come more internationally (I’m in US);3;0;False;Sil5286;ebxcrdb;Last Year & Today;a6o4sp;https://i.redd.it/vdeafl7obm421.jpg
Huh? Did bitcoin start 12 months ago? No, of course not. You still with me? Right, good boy. Anyone who invested before that is likely still in profit, ya get me now bruv? Thinking outside the box and all that shizzle, who'd have thought bitcoin was lower than what it is today or 12 months ago. Amazing hey?;5;2;False;pjf72;ebwo6fr;Last Year & Today;a6o4sp;https://i.redd.it/vdeafl7obm421.jpg
I agree. So many bullshit stories here. Bought a house but don't remember the cash out price? People just want to look smart. ;5;0;False;BonaFidee;ebxunr0;Last Year & Today;a6o4sp;https://i.redd.it/vdeafl7obm421.jpg
"Same as it ever was  https://media.cryptocurrencyfacts.com/2018/06/Bitcoin-chart-2014-and-2018-compared-markup.jpg

Adoption curve right on track  Its right on track https://cdn.technologyreview.com/i/images/mecalfs-law.png?sw=1032";0;0;False;Waswasz;ebxsh8f;Last Year & Today;a6o4sp;https://i.redd.it/vdeafl7obm421.jpg
I think it was sarcasm...;1;0;False;andre_is_my_name;ebwzj8f;Last Year & Today;a6o4sp;https://i.redd.it/vdeafl7obm421.jpg
The biggest waste of the earth is actually borderless, tariff free, world wide trading Globalism. Plastic products, shipping goods around the world. Nationalism, regional production is where the world has to go. Tariffs. Just 1 giant container ship destroys the environment more then 750.000 cars.;-5;2;False;Geoku11;ebwty3o;Last Year & Today;a6o4sp;https://i.redd.it/vdeafl7obm421.jpg
The ATH was 16k. No one ever completed a transaction at 19k. It was only a rumour 19k;0;1;False;Quick_Stick;ebxaxg2;Last Year & Today;a6o4sp;https://i.redd.it/vdeafl7obm421.jpg
Say you guys bought in at 3k a coin and in the next bull run it shoots to 40k a coin in 2020.  Who here would sell or who would HODL? ;-2;2;False;lew-yy;ebx6s4e;Last Year & Today;a6o4sp;https://i.redd.it/vdeafl7obm421.jpg
YNWA!;0;0;False;vincentcryptoo;ebx5z4w;Last Year & Today;a6o4sp;https://i.redd.it/vdeafl7obm421.jpg
So tell us how much you got and what was the exit price dude ? ;90;1;False;JD-007;ebwp0wk;Last Year & Today;a6o4sp;https://i.redd.it/vdeafl7obm421.jpg
There is mass theft ocurring, they dont take it your money in front of you, you find out later, at least in airports that is, in the borders they look in your bags in front of you and can take anything they want, and who is going to stop them? ;1;0;False;VnzlaGG;ebwuvzf;A friend who escaped venezuela . . .;9v972w;https://i.redd.it/gxkoic4od3x11.png
"It's a question of whether the fees are significant for your transaction I guess.
On Lightning, not sure if current but I heard 40 transactions cost about $0.04 total.
This shits the future.";1;1;False;agent_kaleido;ebvgx0f;My reaction to the price vs. everyone else's;a6gca5;https://i.imgur.com/aocjx.gif
Except bitcoin in particular (along with closely related crypto’s) have no real place in the market. I have no doubts it will be implemented correctly in the future without risk and all, but at the current moment crypto is like the smartphone market right now. The more and more saturated the market becomes, the less there is a need at all. Adoption has stopped almost completely, and it’s not looking good whatsoever. Any more success is from people buying back in en mass, not from its actual success.;2;1;False;Basshead404;ebvtjr8;My reaction to the price vs. everyone else's;a6gca5;https://i.imgur.com/aocjx.gif
"So your whole argument is because less people heard about ethereum losing 95% of it's price, and more people heard about bitcoin losing 85% of it's price,ethereum will be the winner in the end?

State run cryptocurrencies are going to fail for the same reason state fiat currencies fail. It is because the monetary policy is subject to the whims of the state. Decentralized cryptocurrencies are neutral, that is why they are valuable.";1;1;False;nolohagacompi;ebxf6uh;My reaction to the price vs. everyone else's;a6gca5;https://i.imgur.com/aocjx.gif
Stop being deliberately difficult... you know damn well what a currency is, and the difference of that versus a good or service. I know what gives money value. Do you know what gives bitcoin its value? It’s USD or other currency exchange rate. In other words, it’s a virtual commodity for exchange. It CAN be considered a currency, but can’t for many more reasons. You can consider potatoes currency, but nobody will accept potatoes for a car or anything of the sort.;0;0;False;Basshead404;ebvmwc5;My reaction to the price vs. everyone else's;a6gca5;https://i.imgur.com/aocjx.gif
Mom's spaghetti;3;1;False;Breadynator;ebwm903;My reaction to the price vs. everyone else's;a6gca5;https://i.imgur.com/aocjx.gif
sure thing pal, its called the fucking obvious future returns;1;0;False;stanman51;ebvp63c;My reaction to the price vs. everyone else's;a6gca5;https://i.imgur.com/aocjx.gif
10x in 20 is very conservative, imo. But 10x in 6 months now - not gonna happen either;1;0;False;michwill;ebvwwbc;My reaction to the price vs. everyone else's;a6gca5;https://i.imgur.com/aocjx.gif
Good luck explaining that difference to the average Joe.;1;0;False;SupaSlide;ebxnni8;My reaction to the price vs. everyone else's;a6gca5;https://i.imgur.com/aocjx.gif
"BTC is not a stock; it is an ultra-, super-rare commodity, that will never, ever cease to exist; those is some ballsy promises.";1;1;False;gammabum;ebw2sg6;My reaction to the price vs. everyone else's;a6gca5;https://i.imgur.com/aocjx.gif
If bitcoin hits 2k, it will eventually hit 1k and lower. People that buy will be buying from those who lost enough already, and will eventually either wait an eternity for a return or sell back as well.;1;1;False;Basshead404;ebvmjsh;My reaction to the price vs. everyone else's;a6gca5;https://i.imgur.com/aocjx.gif
">he price isn't going to go up if people don't buy, and the difference this time is that people actually know about Bitcoin *and it's become synonymous with a bubble that cost people thousands of dollars*.

&#x200B;

Just like Apple, Amazon, Microsoft, right?

&#x200B;

Bitcoin is valuable not because of idiots fomoing in, but because it is the reinvention of money in a sound, permissionless, censorship resistant form. Every time a country fucks up their monetary policy, Bitcoin is going to be there sucking in the value from people exiting the currency wars. These bubbles are just the massive redistribution of wealth from the first world middle class with get-rich-quick-mindset to the few people around the world who understand why to hodl.";-1;1;False;nolohagacompi;ebwejcb;My reaction to the price vs. everyone else's;a6gca5;https://i.imgur.com/aocjx.gif
Of course the yare bitter because they bought in at a very stupid time to do so. Just like the last 6 times the exact same thing happened. Tell me, what could take the place of bitcoin, other than another cryptocurrency? And can you name one that is not volatile and subject to manipulation, and fomo bubbles?;1;1;False;nolohagacompi;ebx1elf;My reaction to the price vs. everyone else's;a6gca5;https://i.imgur.com/aocjx.gif
Im not sure why it says that. Ive been on here for a couple of years.;1;0;False;EverlastingEmus;ebw6l68;My reaction to the price vs. everyone else's;a6gca5;https://i.imgur.com/aocjx.gif
Farms hashing ;1;1;False;fitch2711;ebwdxk1;My reaction to the price vs. everyone else's;a6gca5;https://i.imgur.com/aocjx.gif
oof;1;0;False;;ebwdjsn;My reaction to the price vs. everyone else's;a6gca5;https://i.imgur.com/aocjx.gif
Well, the price could be exactly the same, too. Better not to send that resume just yet... ;6;0;False;jemm;ebwc4u5;My reaction to the price vs. everyone else's;a6gca5;https://i.imgur.com/aocjx.gif
"Independent thought is good, distraction is bad. But there is a difference between followers and leaders. Ver is a follower.

Vitalik is a leader, and he always says, ""Ethereum is developing, and Bitcoin is dealing with 1,000 social issues."" He act like he cares, but he's playing up foreigner drama.

The Fluffy Pony guy does similar, ""OMG Bitcoin Forks suck (why?)!!! But Bitcoin is COOL, Bitcoin and Monero, buddies."" Leads in with faux concern, follows up with buy my alt coin.

WhalePanda is likewise, ""THIS JUST IN - Bitcoin and socket puppet show going on in Taiwan, Ver is a douche, XXXX is going to jail, and just what the hell is with these cheetos?"" While his profession is trading and marketing for traders. These distractions are job related, not 'because this is who he is'. He's focused on trading, or influencing the public regarding trading.

Cobra is obvious, but these others are better.

Now you hopefully see the difference. Roger says I am your enemy. Fluff, Whale, Vitalik say I am your friend, just curious, or a bottle of funnies. You follow the others off a cliff, you attack Roger.";2;0;False;Bitcoin1776;ebvrscs;My reaction to the price vs. everyone else's;a6gca5;https://i.imgur.com/aocjx.gif
You can say that it isn’t legitimate all you want...and I’ll keep paying for things with it.🤷🏼‍♂️;1;0;False;Reelmo;ebvgxdl;My reaction to the price vs. everyone else's;a6gca5;https://i.imgur.com/aocjx.gif
BTC is easily a stock, have you not seen the comparisons to literal stock trends? There is nothing controlling its value, and you are investing in its future by buying it.;1;0;False;Basshead404;ebw988j;My reaction to the price vs. everyone else's;a6gca5;https://i.imgur.com/aocjx.gif
Not necessarily true when the tech will only become more and more niche. Not all stocks bounce back up.;1;1;False;Basshead404;ebvtc1g;My reaction to the price vs. everyone else's;a6gca5;https://i.imgur.com/aocjx.gif
Yeah sure thing, redditor for 5 weeks and redditor for 2 weeks.;1;1;False;entropywins9;ebw3whe;My reaction to the price vs. everyone else's;a6gca5;https://i.imgur.com/aocjx.gif
Yes but not all sexual acts are fungible... BELIEVE ME...;1;1;False;EverlastingEmus;ebvr5a9;My reaction to the price vs. everyone else's;a6gca5;https://i.imgur.com/aocjx.gif
I think crypto as a currency is a long way off, but crypto that offers blockchain solutions to other real world problems will start to appreciate in value  in 3 to 5 years. Imo;0;2;False;EverlastingEmus;ebvwlzm;My reaction to the price vs. everyone else's;a6gca5;https://i.imgur.com/aocjx.gif
Cryptos backed by anything will be adopted. Besides that, they’re all pretty much stocks. Nobody wants to be paid in stocks or trade stocks for that matter.;1;0;False;Basshead404;ebwarxa;My reaction to the price vs. everyone else's;a6gca5;https://i.imgur.com/aocjx.gif
"I think Bitcoin is valuable, but I don't think it'll be very successful anymore. Something else will probably take it's place that didn't drop from $19k+ to under $4k in a year.

Why go from one bad country's currency to one that plummeted like a rock?

I could be wrong, but all the people I know who were raving about Bitcoin this time last year (and there were a lot) are very bitter about it now.";1;1;False;SupaSlide;ebwtzv6;My reaction to the price vs. everyone else's;a6gca5;https://i.imgur.com/aocjx.gif
"The price isn't going to go up if people don't buy, and the difference this time is that people actually know about Bitcoin _and it's become synonymous with a bubble that cost people thousands of dollars_.

I'd be surprised if the price rises significantly. I hope that it'll become stable enough to use as currency, and that it'll catch on because of all the companies that started accepting it during the rise, but I'm not sure the public will trust it enough.";9;1;False;SupaSlide;ebvledj;My reaction to the price vs. everyone else's;a6gca5;https://i.imgur.com/aocjx.gif
Fair enough hahah, I put myself up to that one.;1;0;False;Basshead404;ebvtkpc;My reaction to the price vs. everyone else's;a6gca5;https://i.imgur.com/aocjx.gif
Elaborate.;1;0;False;c0rrectmeth0ds;ebw9uch;My reaction to the price vs. everyone else's;a6gca5;https://i.imgur.com/aocjx.gif
"So I've been day trading EA from $140 all the way to $80 on calls and puts and making good money doing it

Even if bitcoin will be $0 in 2 years itl spike all the way down and the bigger the drop the bigger the bounce";2;1;False;ObviousRecession;ebvorp1;My reaction to the price vs. everyone else's;a6gca5;https://i.imgur.com/aocjx.gif
Head scratching ;3;1;False;ElShadoWarrior;ebw52ep;My reaction to the price vs. everyone else's;a6gca5;https://i.imgur.com/aocjx.gif
There's certainly cars you can trade for Labour.  Stop being deliberatly obtuse.  And i can't be bothered to explain what gives money value to you but i suggest Google. ;0;1;False;Scopae;ebvgv5r;My reaction to the price vs. everyone else's;a6gca5;https://i.imgur.com/aocjx.gif
"I never said cryptocurrency will go away. I just don't think it will be Bitcoin. Ethereum is the most likely currently existing one that could replace it. It's no less volatile, but the difference is that the average Joe only heard of Bitcoin.

Although I think the more likely scenario is that the general population will just end up using state-run cryptocurrency because they don't actually care about the decentralized nature of cryptocurrency.";1;1;False;SupaSlide;ebx38ci;My reaction to the price vs. everyone else's;a6gca5;https://i.imgur.com/aocjx.gif
Yes. This happens constantly. There's also the question of the roughly ~20-30% of coins which are assumed to be Satoshi Nakomoto's, and which haven't moved in years and are presumed lost. That's also why market cap is a useless metric for cryptocurrencies;11;0;False;anti09;ebvq2qm;My reaction to the price vs. everyone else's;a6gca5;https://i.imgur.com/aocjx.gif
"Simple.

Make it or break it principle. At least for me.

You either lose all your invested money, or you'd have a huge gain.

Hence, don't invest the amount of money you're not willing to lose.";3;0;False;fuadiansyah;ebvx1ab;My reaction to the price vs. everyone else's;a6gca5;https://i.imgur.com/aocjx.gif
Holy fuck get this kid a job at Goldman Sachs;43;1;False;isenorcj;ebvscx6;My reaction to the price vs. everyone else's;a6gca5;https://i.imgur.com/aocjx.gif
so that means this bitcat's got at least 2 lives left in me. I can handle 2 more mega bubbles.;1;1;False;mabezard;ebwe17j;My reaction to the price vs. everyone else's;a6gca5;https://i.imgur.com/aocjx.gif
Dude, that's like a year in crypto time.;69;3;False;CryptoNoob-17;ebvgys3;My reaction to the price vs. everyone else's;a6gca5;https://i.imgur.com/aocjx.gif
Finger snapping;4;1;False;k-e-y-s;ebvyfsk;My reaction to the price vs. everyone else's;a6gca5;https://i.imgur.com/aocjx.gif
You missed out for a good minute ;1;0;False;RKFtw;ebvjh3g;My reaction to the price vs. everyone else's;a6gca5;https://i.imgur.com/aocjx.gif
You think that's shocking?  It also went up to over $18k during that same time.;1;0;False;rydan;ebw20c7;My reaction to the price vs. everyone else's;a6gca5;https://i.imgur.com/aocjx.gif
Have you been on planet Earth for the past month!? ;1;0;False;zeroknowledgeproofs;ebw3erd;My reaction to the price vs. everyone else's;a6gca5;https://i.imgur.com/aocjx.gif
If you invested any over a year ago for a long term, not checking every day is the right choice.;1;0;False;podgoorsky;ebwo079;My reaction to the price vs. everyone else's;a6gca5;https://i.imgur.com/aocjx.gif
"The dude abides. 

This is the same smile when your favorite ice cream is 50% off. You buy as much as you can while you can before you run out of dollars or freezer space.
";5;0;False;Dude-Lebowski;ebvjd0c;My reaction to the price vs. everyone else's;a6gca5;https://i.imgur.com/aocjx.gif
Short short short;2;0;False;;ebvgzvw;My reaction to the price vs. everyone else's;a6gca5;https://i.imgur.com/aocjx.gif
r/WallStreetBets ;2;0;False;ThoughtlessUphill;ebvu71m;My reaction to the price vs. everyone else's;a6gca5;https://i.imgur.com/aocjx.gif
Yeah, those people that are actually happy when the prices plummet must have unlimited money and can invest every single time there is a dip, they probably also have a magic crystal ball where they can see the market behaviour, so, they know exactly when there will be a rise and a fall (he didn't have any money invested right now, he must have cashed out in september, when it was the last time bitcoin rose, close 9k as I recall, or probably since April when it almost reached 10k), he's happy he will invest with the low prices now because he's 100% certain the market won't dip further, and if it does, who cares? He still has unlimited money... 🤔;0;1;False;dek018;ebvkq43;My reaction to the price vs. everyone else's;a6gca5;https://i.imgur.com/aocjx.gif
Both.;1;0;False;fuadiansyah;ebvwvgm;My reaction to the price vs. everyone else's;a6gca5;https://i.imgur.com/aocjx.gif
"Heres the problem. If people keep celebrating btc is lower so they can buy more, then the price WILL just drop more. When they day comes and everyone is truly afraid, is when the price will start to go back up. If everyone could just pretend to be pissed off, selling, done with crypto, then the market would probably start to reverse. BUT NO, we still have dumb posts like this.

&#x200B;";1;0;False;tranceology3;ebwec7a;My reaction to the price vs. everyone else's;a6gca5;https://i.imgur.com/aocjx.gif
"I am planning on buying so I want it to go low during this dip. And this is what traders want; ups and downs that they can ride. ";1;0;False;thricegayest;ebwgvx6;My reaction to the price vs. everyone else's;a6gca5;https://i.imgur.com/aocjx.gif
Bitcoin value hasn't dropped. It's still worth 1 BTC. What value are you talking about? The dollar?! It's worth negative.;0;0;False;greeniscolor;ebvmrhv;My reaction to the price vs. everyone else's;a6gca5;https://i.imgur.com/aocjx.gif
What season is this? I can’t remember ;1;0;False;EtherLost101;ebxkww1;My reaction to the price vs. everyone else's;a6gca5;https://i.imgur.com/aocjx.gif
Girl on the right looks like she has a “survivor” bandana on. So chances are it’s from the TV show survivor and they’re reacting to some type of challenge or whatever was going on that episode. I think there are like 30 seasons so who knows when it was. ;1;0;False;shrimponabiscuit;ebwnk0w;My reaction to the price vs. everyone else's;a6gca5;https://i.imgur.com/aocjx.gif
No;1;1;False;qfor;ebwcf28;My reaction to the price vs. everyone else's;a6gca5;https://i.imgur.com/aocjx.gif
Same. Bitcoin is on sale right now! ;0;0;False;RedditKon;ebvk2wq;My reaction to the price vs. everyone else's;a6gca5;https://i.imgur.com/aocjx.gif
*clapping*;5;0;False;notsuppostocomnt;ebvpepf;My reaction to the price vs. everyone else's;a6gca5;https://i.imgur.com/aocjx.gif
💯💯😉😉💯;0;0;False;cryptotee1;ebvox9q;My reaction to the price vs. everyone else's;a6gca5;https://i.imgur.com/aocjx.gif
OP is a broke moron 😂;1;0;False;GolfIsWhyImBroke;ebw5rfi;My reaction to the price vs. everyone else's;a6gca5;https://i.imgur.com/aocjx.gif
Ah the ol I'm losing money but my cognitive dissonance is telling me that i'm actually winning. ;9;0;False;;ebvl7h0;My reaction to the price vs. everyone else's;a6gca5;https://i.imgur.com/aocjx.gif
"Are you guys all gambling? Is it price you're betting on? 

Is it not the historically right way to invest in the future VALUE of assets? 

Should we not be focusing on businesses that are showing good metrics? Companies that are doing the right things, and things that people do want and will be more valuable in the future? 

Let's say you buy an investment property, a 3BR house. And you're solely counting on selling it in 5 years for more than you bought it for, because you believe that that particular house is the kind of house people want, in an area people want to live. You think even more people Will want houses like yours in the coming years. Supply/demand says the price of your house goes up.

In the meantime, the market shifts downward, lowering the price of your house. Do you give a shit? No. Because you believe in the future value of your asset. You hadn't planned on selling this year. You said a few years from now. You make long term bets on expensive and risky investments. 

Price of your house goes down this year, you don't care. 

Long term bets. 

You don't gamble.

You evaluate assets and believe in their long term value. 

Sell when you feel you've profited enough that you value the cash more than the asset. When you'd rather have the money than future money it could produce.

Stop caring if it went up today";3;0;False;samep04;ebwa08k;My reaction to the price vs. everyone else's;a6gca5;https://i.imgur.com/aocjx.gif
What are these people in the original gif reacting to? I've seen this so many times and every time I see it I want to know more badly. I have finally reached my boiling point. I must know, and one of you must have the answer. Help a desperate man find peace. ;3;1;False;LordHelmet69;ebwl08t;My reaction to the price vs. everyone else's;a6gca5;https://i.imgur.com/aocjx.gif
