body;score;nb_replies;stickied;author;id;post_title;post_id;post_link
I need to stay away from reddit, I swear sometimes I have to be one of the only people on the planet that doesn't hate coming in to work and putting in 8 hours.;20;2;False;n33d_kaffeen;ds8anh4;Warren Buffet:;7o9zo1;https://i.redd.it/epko0verp7801.jpg
"> parasite off the productivity of people 

Implying holding onto your bitcoin until you can sell it to some sucker at the top after you pump it for 4 years isn't parasitic.";5;0;False;forevercountingbeans;ds8o06c;Warren Buffet:;7o9zo1;https://i.redd.it/epko0verp7801.jpg
Property taxes will assure that you never own it free and clear.;1;1;False;askme2b;ds903n5;Warren Buffet:;7o9zo1;https://i.redd.it/epko0verp7801.jpg
Forgive my ignorance, but isn't his specialty hostile takeovers, restructuring, then GTFO?;1;0;False;Zergom;ds86rbh;Warren Buffet:;7o9zo1;https://i.redd.it/epko0verp7801.jpg
"Gambling and speculation?

Buffet buys business and never sells them.

The man is anything but a gambler and speculator.";8;1;False;ep1939;ds82q71;Warren Buffet:;7o9zo1;https://i.redd.it/epko0verp7801.jpg
He dont speculate  ;6;0;False;nemo1080;ds823au;Warren Buffet:;7o9zo1;https://i.redd.it/epko0verp7801.jpg
That's why I try to trade... To increase my BTC holdings.;1;1;False;PM_ME_BrusselSprouts;ds836r9;Warren Buffet:;7o9zo1;https://i.redd.it/epko0verp7801.jpg
You mean - Frugal investor. Trendsetter.  =);2;1;False;locotxwork;ds8dxa5;Warren Buffet:;7o9zo1;https://i.redd.it/epko0verp7801.jpg
not always;1;0;False;K1ngN0thing;ds89w5s;Warren Buffet:;7o9zo1;https://i.redd.it/epko0verp7801.jpg
I’ll bet he works a lot less than an 88 year old trying to make ends meet greeting at Walmart ;1;1;False;travellingbrickbuild;ds8uh9p;Warren Buffet:;7o9zo1;https://i.redd.it/epko0verp7801.jpg
That guy didn't know what he was talking about. ;1;0;False;;ds8bdkf;Warren Buffet:;7o9zo1;https://i.redd.it/epko0verp7801.jpg
"Which fulfills the advice given. 

Far too many people don’t realise the power of beginning investing early. Most people can afford to take 5% of their pay and throw it into a retirement account; way too few do. ";2;0;False;travellingbrickbuild;ds8udgr;Warren Buffet:;7o9zo1;https://i.redd.it/epko0verp7801.jpg
"Correct.

Investors can make profits. Traders always lose in the end.

";3;2;False;;ds850s9;Warren Buffet:;7o9zo1;https://i.redd.it/epko0verp7801.jpg
[deleted];1;1;False;;ds8bbxl;Warren Buffet:;7o9zo1;https://i.redd.it/epko0verp7801.jpg
"Correct. I've read a couple of his books, and he is very big on making this emphasis. He's very, very traditional and fundamental in his approach. A brilliant investor (long-term wealth), but he makes no claims to be a short-term trader, and while I don't want to put words in his mouth, I got the distinct impression that he doesn't approve of or have a lot of respect for ""trading.""";94;2;False;Missourimedic;ds81m7x;Warren Buffet:;7o9zo1;https://i.redd.it/epko0verp7801.jpg
[deleted];1;2;False;;ds84y4n;Warren Buffet:;7o9zo1;https://i.redd.it/epko0verp7801.jpg
Pretty sure minimum wage here in eastern PA is ~$7.25;8;1;False;B3nAll3n;ds85fmf;Warren Buffet:;7o9zo1;https://i.redd.it/epko0verp7801.jpg
US federal minimum is $7.25. A lot of states have higher mins in their state, but 16 states do not. So yes, $7.50 is higher than minimum in a lot of areas of the United States.;15;0;False;boilerkunze;ds865b8;Warren Buffet:;7o9zo1;https://i.redd.it/epko0verp7801.jpg
"The moral is to do your own work first, and then lend them the money you earned so that they can build more. They don't _have_ to accept your investment money - it's a mutually beneficial arrangement.

(Edit: typo)";2;0;False;Explodicle;ds8d7dl;Warren Buffet:;7o9zo1;https://i.redd.it/epko0verp7801.jpg
"If you think the people who invest their time, energy, and money in building the enterprise that supports you are ""parasites"", then 

EITHER A) you should quit immediately and work for yourself

OR B) you are a whiny hypocrite.

(There is no option C)
";3;0;False;pictogasm;ds8dke5;Warren Buffet:;7o9zo1;https://i.redd.it/epko0verp7801.jpg
He likes his job though ;3;0;False;donald_duck223;ds841zl;Warren Buffet:;7o9zo1;https://i.redd.it/epko0verp7801.jpg
And that's the problem.;2;2;False;sts816;ds850do;Warren Buffet:;7o9zo1;https://i.redd.it/epko0verp7801.jpg
"It's not a store of value because it's in no way connected to anything of value or any economic principles that make it a good hedge.

The whole point of a value store is that it'll predictably hold it's value in the face of unexpected events. That's the opposite of bitcoin. Bitcoin shits the bed or spikes it's value every time someone sneezes.";2;2;False;TheSecretMe;ds8wmmk;Warren Buffet:;7o9zo1;https://i.redd.it/epko0verp7801.jpg
who doesn't? I don't even own BTC anymore;0;1;False;_alright_then_;ds888kv;Warren Buffet:;7o9zo1;https://i.redd.it/epko0verp7801.jpg
Gold has excellent conductive properties which is why many cables etc. are gold plated. So it certainly does have intrinsic value, more than fiat for sure, although I would argue not much.;185;8;False;Carrierhasarrived7;ds83atk;Warren Buffet:;7o9zo1;https://i.redd.it/epko0verp7801.jpg
"> Hell, even gold does not have intrinsic value.

Sure it does. Gold has always been relatively rare and difficult to amass, and it's easy to turn into beautiful status symbols. Setting yourself apart through ornamentation has a significant evolutionary value. So much so that it's not all that rare for non-human animals to do it too.";17;0;False;Chambellan;ds86y77;Warren Buffet:;7o9zo1;https://i.redd.it/epko0verp7801.jpg
"Money has no value... except for the tax base that the government controls who backs it...

Imagine that the US had some kind of economic fallout. It is entirely possible that the government can raise taxes to pay for such a fallout. Those taxes can be as high as it can withstand. This occurred in Greece in the last decade or so. The government had to raise taxes and start austerity to pay for it's debts. Guess what? Greece's government isn't large enough to pay for it's debt and it's economy is nowhere near strong enough to deal with the costs. Without the EU the old Greek currency would have plummeted in value. The Euro got hit from this arrangement.

Suggesting that a fiat currency by the government is backed by nothing shows a deep misunderstanding in basic economics.";3;0;False;kriegercontainers;ds8eyy5;Warren Buffet:;7o9zo1;https://i.redd.it/epko0verp7801.jpg
"Intrinsic value is arbitrary and you can easily argue that nothing exists with it.  Most people mean ""practical application"" when they say intrinsic value.  Bitcoin's value in practical terms is essentially nonexistent, as anyone can make bitcoin 2.0 and have it be completely identical.  Nothing about bitcoin makes it more valuable than bitcoin 2.0 other than the fact that people have faith in the price of bitcoin.

Consider gold, which has many practical applications and is scarce in nature.  No one can create a gold substitute and gold can be easily used for all the same things regardless of how others value it.  Unless a more useful and abundant gold 2.0 is found, gold will always have value.  In comparison, dollars and bitcoin are worth only what people are willing to trade for them and have no value or utility beyond being exchanged for goods and services.";11;2;False;Disbfjskf;ds85sjv;Warren Buffet:;7o9zo1;https://i.redd.it/epko0verp7801.jpg
"> Money has no intrinsic value.

I pay my taxes with USD.

If I don't pay my taxes with USD then men with guns will come, shoot my dog and lock me up.

ERGO USD has intrinsic value.";2;0;False;trowdit;ds88kro;Warren Buffet:;7o9zo1;https://i.redd.it/epko0verp7801.jpg
"Gold became popular long ago because it has great properties.

However, I understand your point. You could argue nothing, including everything in the universe has any intrinsic value. ";1;0;False;SnarkLobster;ds89o1o;Warren Buffet:;7o9zo1;https://i.redd.it/epko0verp7801.jpg
You can burn money I guess.;1;0;False;;ds89see;Warren Buffet:;7o9zo1;https://i.redd.it/epko0verp7801.jpg
Buffets on record saying he loves that investing is a zero strike game. He can let countless good investments sail by him and only grab a few of them and still get rich.;3;0;False;LeftHandedLeshen;ds8oveb;Warren Buffet:;7o9zo1;https://i.redd.it/epko0verp7801.jpg
That’s not true. It is decentralized in a way that is useful for some purposes.;-2;1;False;GayloRen;ds90977;Warren Buffet:;7o9zo1;https://i.redd.it/epko0verp7801.jpg
Well, we all certainly hope he is wrong on this one. Lol.;5;0;False;gone11gone11;ds857i4;Warren Buffet:;7o9zo1;https://i.redd.it/epko0verp7801.jpg
However both Gold and Silver are not great investments as they don't provide a return for just holding them and, like Bitcoin, are speculative. Buffett wouldn't invest in Gold, Silver or Bitcoin.;6;1;False;thekiwifish;ds870j7;Warren Buffet:;7o9zo1;https://i.redd.it/epko0verp7801.jpg
Agreed. His repeated promotion of just investing in Index funds has probably done more good for the everyday investor than anything else spouted on investment shows or financial institutions. Let your money work for you, not hand over 2% to someone else over 50 years. ;11;1;False;Lazarous86;ds88u6m;Warren Buffet:;7o9zo1;https://i.redd.it/epko0verp7801.jpg
"Ehm Intrinsic value for coins is the value of the material to make the coin. Like a dollar coin is worth $0.40 in metal or whatever.

You don't have that with bitcoins. ";6;1;False;El_Giganto;ds85wt6;Warren Buffet:;7o9zo1;https://i.redd.it/epko0verp7801.jpg
"Lmao he’s also one of the greatest investors of all time. He’s not some senile old man who screams at computers. 

Edit-quit downvoting this guy, he raises some good points ";10;2;False;Justanotherjustin;ds87txh;Warren Buffet:;7o9zo1;https://i.redd.it/epko0verp7801.jpg
"Thats the worst argument against an experts opinion. Your argument makes it seem like a gamble. 

Warren buffet in his many years of investing has seen things as unstable/iffy as bitcoin and been smart enough to pick and choose what is good enough to warrant an investment.

";31;1;False;;ds8add0;Warren Buffet:;7o9zo1;https://i.redd.it/epko0verp7801.jpg
Yes, that's true and I didn't consider that. I was more trying to emphasize that just buying or trading is not equivalent to the quote.;27;2;False;peacefulrevolushon;ds88r0g;Warren Buffet:;7o9zo1;https://i.redd.it/epko0verp7801.jpg
"> . He’s done well

lol yeah hes done ""well"" 
";53;2;False;HHughes12;ds87prw;Warren Buffet:;7o9zo1;https://i.redd.it/epko0verp7801.jpg
Passive income is money going into your pocket. Unless you sell bitcoin it doesn’t matter how much it increases in terms of passive income. ;1;0;False;TheShearerComplex;ds8an5t;Warren Buffet:;7o9zo1;https://i.redd.it/epko0verp7801.jpg
His crux is that there is a finite amount of gold whether humans like it or not. The same cannot be said for bitcoin.;0;1;False;;ds85c4f;Warren Buffet:;7o9zo1;https://i.redd.it/epko0verp7801.jpg
"The vast majority of people here are young and have minimal if any external income, other than their paper profits from speculative rises. 

There's literally posts here talking about that's what they do for a living, or that they made more doing this than they ever would in a day job, as if the returns we've seen to date are sustainable beyond a few more years at most. 

All of this short sightedness and unrealistic expectations is a recipe for disaster when the hype wears off, and it will, with time it always does. At which point, paper profits will disappear and the market cap of the entire space will evaporate as people see just how little speculative pressure it takes to make a price rise or fall. ";1;0;False;Auwardamn;ds8gb7w;Warren Buffet:;7o9zo1;https://i.redd.it/epko0verp7801.jpg
But Bitcoin isn't an unbacked currency. It's backed by the energy poured into mining it.;-1;1;False;CosmosisQ;ds8mxtf;Warren Buffet:;7o9zo1;https://i.redd.it/epko0verp7801.jpg
"People only shifted to the ""store of value"" argument one it was clear Bitcoin would never become a real currency. What makes it a store of value, other than speculation on price? 

Limited supply means nothing, especially since it's artificially limited - if a large enough proportion of Bitcoin miners agreed, the limit could be changed or removed entirely. 

The only reason people can even claim that it's a store of value is because a consistent influx of new speculators has kept pumping the price up. If, or rather when, the number of new people entering drops off and demand decreases, the price of Bitcoin will fall. And then it will be a destroyer of value, not a store of value.

Any currency could be a ""store of value"". If that's all Bitcoin is then it's useless. ";207;4;False;72_hairy_virgins;ds84z99;Warren Buffet:;7o9zo1;https://i.redd.it/epko0verp7801.jpg
betting against bitcoin with bitcoin futures /s;12;1;False;Utoko;ds84sfq;Warren Buffet:;7o9zo1;https://i.redd.it/epko0verp7801.jpg
ETH was $1005 when I went to bed and $978 when I woke up...maybe he’s just really heavy into eth.;4;2;False;Gbiknel;ds8aamx;Warren Buffet:;7o9zo1;https://i.redd.it/epko0verp7801.jpg
If you are heavily invested in alts this will happen. When BTC goes up, people scramble to sell their alts for BTC so the alt market goes down. Unfortunately, the converse is not true, since when BTC goes down, people scramble to sell their alts to cash out their BTC so the whole market comes down with it.;4;1;False;malmatate;ds8g123;Warren Buffet:;7o9zo1;https://i.redd.it/epko0verp7801.jpg
I'm playing with a small amount of bitcoin and a trading bot. It made a few trades based on btc/eth price. I just started working on it, and last night was the first night it was running. I didn't lose much, but still negative.;2;0;False;1Bitcoinco;ds8i1fl;Warren Buffet:;7o9zo1;https://i.redd.it/epko0verp7801.jpg
That's because people keep talking about bitcoin when the talk is about blockchain;2;0;False;Cheewy;ds8gae7;Warren Buffet:;7o9zo1;https://i.redd.it/epko0verp7801.jpg
almost all alts are dipping;1;0;False;tm2443;ds8opfj;Warren Buffet:;7o9zo1;https://i.redd.it/epko0verp7801.jpg
[deleted];-1;1;False;;ds8qlgv;Warren Buffet:;7o9zo1;https://i.redd.it/epko0verp7801.jpg
Impossible to lose over a few days but I fluctuate quite a bit within 24hr. But for everyday I’m down I’m up 6 days lol;1;1;False;Gbiknel;ds8adb5;Warren Buffet:;7o9zo1;https://i.redd.it/epko0verp7801.jpg
To me it sounds like a classic case of something taken out of context to make it sound like a criticism, when really it's just stating that cryptocurrency works like unbacked currency.;-1;1;False;llehsadam;ds8eblm;Warren Buffet:;7o9zo1;https://i.redd.it/epko0verp7801.jpg
[deleted];21;3;False;;ds8aw4s;Warren Buffet:;7o9zo1;https://i.redd.it/epko0verp7801.jpg
Technically it’s still a great payment method for international transfers for large quantities over normal fiat transfers;12;2;False;andrew_bao;ds84qns;Warren Buffet:;7o9zo1;https://i.redd.it/epko0verp7801.jpg
[deleted];152;8;False;;ds861cn;Warren Buffet:;7o9zo1;https://i.redd.it/epko0verp7801.jpg
"I store my value in the most volatile commodity known to man zoop ;) zoop";13;0;False;eaglessoar;ds86sfv;Warren Buffet:;7o9zo1;https://i.redd.it/epko0verp7801.jpg
It’s funny that you can’t tell this is a criticism. ;27;1;False;reallythough11;ds86n2p;Warren Buffet:;7o9zo1;https://i.redd.it/epko0verp7801.jpg
I trade only in heavily branded fidget spinners.  Basically equivalent to a gold reserve.;6;0;False;readonlyuser;ds8en8s;Warren Buffet:;7o9zo1;https://i.redd.it/epko0verp7801.jpg
"It's a criticism. He has also said to ""stay away from it""";3;0;False;BigEd781;ds8tx65;Warren Buffet:;7o9zo1;https://i.redd.it/epko0verp7801.jpg
He is very critical of bitcoin.;1;0;False;murree;ds8ukh9;Warren Buffet:;7o9zo1;https://i.redd.it/epko0verp7801.jpg
Well if you study the fathers of value investing, “intrinsic value” *is* value;0;0;False;nowTHATScomedy;ds8gsqf;Warren Buffet:;7o9zo1;https://i.redd.it/epko0verp7801.jpg
[deleted];146;5;False;;ds88jvb;Warren Buffet:;7o9zo1;https://i.redd.it/epko0verp7801.jpg
This sounds a lot like the .com bubble.;2;0;False;Troy64;ds8g13f;Warren Buffet:;7o9zo1;https://i.redd.it/epko0verp7801.jpg
I'm quite content with the increase in BTC, but am not under any illusion that it's passive income, or will increase indefinitely. I'm not an expert by any means, but do understand the fundamentals well enough to know that it's real value lies in its potential to radically change global finance, not some delusion that it's going to keep giving me a reliable increase in wealth year after year. Also, I can't do anything to influence it's monthly return. If I have a rental property or an online store front I can do all kinds of things to ensure that keeps creating a stable income for years.;2;0;False;peacefulrevolushon;ds89c4q;Warren Buffet:;7o9zo1;https://i.redd.it/epko0verp7801.jpg
Or a robot/computer is working for you.;-1;0;False;evoorhees;ds8arbc;Warren Buffet:;7o9zo1;https://i.redd.it/epko0verp7801.jpg
Why would you invest in any currency over a company?;23;3;False;0987654231;ds810w2;Warren Buffet:;7o9zo1;https://i.redd.it/epko0verp7801.jpg
"I'm sure people in the .com bubble said the same.  

I'm not arguing bitcoin is a bubble, I'm arguing it's impossible to say. ";15;2;False;graphitenexus;ds81nfv;Warren Buffet:;7o9zo1;https://i.redd.it/epko0verp7801.jpg
He said he never invests in anything he doesn't understand.  Just because he didn't invest in something doesn't mean it's not worth investing in.  I mean, he is pretty old, so it's understandable he wouldn't understand tech.;3;1;False;puppiadog;ds832s9;Warren Buffet:;7o9zo1;https://i.redd.it/epko0verp7801.jpg
He only needs to be right about his investments.;11;1;False;somethingtrulyepic;ds7zrc4;Warren Buffet:;7o9zo1;https://i.redd.it/epko0verp7801.jpg
"I only made $72 working a 7 hour day. So hey, almost more than my ""real job"" lol";13;0;False;devonthed00d;ds84nu3;Warren Buffet:;7o9zo1;https://i.redd.it/epko0verp7801.jpg
[deleted];11;3;False;;ds84rsl;Warren Buffet:;7o9zo1;https://i.redd.it/epko0verp7801.jpg
"But it's also probably going to fall.

I've made several times my weekly pay overnight a couple of times, put it fell afterwards, so... Yeah. 

Would be great if I could predict the future and see when it would dip. ";4;0;False;MrHaxx1;ds87dr5;Warren Buffet:;7o9zo1;https://i.redd.it/epko0verp7801.jpg
"did he need to compare bitcoin to a bubble ?

Everyone is master of his own space just dont bother/influence others";-4;1;False;sagar6191;ds7xpio;Warren Buffet:;7o9zo1;https://i.redd.it/epko0verp7801.jpg
What's in that sausage?;1;0;False;askme2b;ds906ql;Warren Buffet:;7o9zo1;https://i.redd.it/epko0verp7801.jpg
But you could just as easily have lost $60. If you had some stock, you would keep your capital, and receive a dividend.;1;1;False;thekiwifish;ds88mfq;Warren Buffet:;7o9zo1;https://i.redd.it/epko0verp7801.jpg
"Warren Buffet ist not a ""trader"", he is a investor. Big difference.";338;4;False;Komodor123;ds7zmor;Warren Buffet:;7o9zo1;https://i.redd.it/epko0verp7801.jpg
[deleted];91;1;False;;ds80jui;Warren Buffet:;7o9zo1;https://i.redd.it/epko0verp7801.jpg
">He is a fantastic trader who is just not good with tech


He didn't invest in the .com bubble and look what happened there. People were saying he was out of touch then

";9;0;False;CodedLikenessUnit;ds83l1z;Warren Buffet:;7o9zo1;https://i.redd.it/epko0verp7801.jpg
"He plays safe, in software you can easily pretend to have a product when you don't.

Putting money in Bitcoin is putting money into a research project, that still has ongoing research, hard-math-cryptography papers still published, engineering for solutions in those papers still to be done and needs thorough testing when implemented.

It took almost 3 years to get to the testing stage of lightning network and this still does not mean that the engineering part is done.";24;3;False;;ds7xj00;Warren Buffet:;7o9zo1;https://i.redd.it/epko0verp7801.jpg
"Like it or not, the man has been steadily making money for the last 60 years and is the richest man on the planet.

All of that while giving away gazzilions of his fortunes.

He isn't the Micheal Jordan of investment, he's the Super Sayian God fusion of all Sayians of investment.

If Buffet says something we should think 1000 times about our preconceived opinions rather than marking him as ""old"".

Him being old and looking at a business fundamentals is a reason why he's always going up and why he consistently makes money for his investors, year after year. Instead of losing them.";25;2;False;ep1939;ds82p2q;Warren Buffet:;7o9zo1;https://i.redd.it/epko0verp7801.jpg
Had to throw in ‘white man’ didn’t you you twat;0;1;False;;ds8uqjd;Warren Buffet:;7o9zo1;https://i.redd.it/epko0verp7801.jpg
"Considering he's one of, if not the most successful investors of all time, it's a bit crazy to think any one on here knows more than him about how to make money through investments. 

Warren Buffet has seen many ""Bitcoins"" in the past, and sure, maybe this time it might be different, but brushing off anything he says probably isn't the best idea...";36;1;False;AlayneKr;ds87n25;Warren Buffet:;7o9zo1;https://i.redd.it/epko0verp7801.jpg
"He made a solid argument behind it.

Bitcoin isn't a business, it doesn't generate nor produce anything, so to his school of thinking, it's a bubble. How can you mathematically value something that doesn't generate money?

Buffet invests mostly in companies with a business. Bitcoin isn't a business. The only reason Bitcoin has a value is because we give it a value.

That's different from a company with tangible assets, liquidity and market.

To add to this, crypto, and especially Bitcoin, adoption has been shrinking from years while value increased steadily.

The alarms for a bubble are all there.";14;4;False;ep1939;ds82l3i;Warren Buffet:;7o9zo1;https://i.redd.it/epko0verp7801.jpg
he's just very old and stuck in his own thought-bubble. that's the reason he missed to increase Berkshire by another 10000%;-6;2;False;btsfav;ds7yvfp;Warren Buffet:;7o9zo1;https://i.redd.it/epko0verp7801.jpg
What makes you think anything about bitcoins success will be unpleasant for him? He is old enough and rich enough that it would probably take something like a nuclear war for him to not die wealthy.;2;0;False;fmfwpill;ds8529b;Warren Buffet:;7o9zo1;https://i.redd.it/epko0verp7801.jpg
This is his investment strategy in a nutshell.;3;0;False;PM_ME_BrusselSprouts;ds82xbo;Warren Buffet:;7o9zo1;https://i.redd.it/epko0verp7801.jpg
"Key word is potential. He’s seen incredible tech come about throughout his lifetime, and I’m sure he thinks it’s amazing. He’s an investor though, and tech companies don’t tend to really make much money for a very long time. 

His method of value investing is to invest in companies you know will make money since they have a track record of doing it, not throwing tons of money at a company because it has potential. ";3;0;False;AlayneKr;ds843b1;Warren Buffet:;7o9zo1;https://i.redd.it/epko0verp7801.jpg
He should stick to investing in sugar water and leave crypto/fintech for the younger generation.;1;0;False;AssteroidDriller69;ds82sdi;Warren Buffet:;7o9zo1;https://i.redd.it/epko0verp7801.jpg
"Indeed. I used to like him, but smart man would not comment on stuff he doesn't understand. Kinda lost some respect for him after the ill-informed comments about bitcoin few years back. 

He won't be the first old, rich, white man that is unpleasantly surprised by technology and it's potential though. ";-1;3;False;Ethearnal;ds809gr;Warren Buffet:;7o9zo1;https://i.redd.it/epko0verp7801.jpg
"Yeah, this guy is so old, he'll be dead before anything of this pops.

And moreover he talks about something he admits he don't understand violating his own rules. If he made a few more mistakes, made the wrong friend, did not get the correct inside information he wouldn't be the billionaire he is right now.

People should stop listening to 'rich successful old guys in suits'.";2;1;False;ABTTh;ds84cbc;Warren Buffet:;7o9zo1;https://i.redd.it/epko0verp7801.jpg
"its because hes 90000 years old.

Its interesting he said its a bubble. Surely one of his pearls of wisdom gifs is ""Do not mock what you do not understand""";1;0;False;mister2014;ds81mtt;Warren Buffet:;7o9zo1;https://i.redd.it/epko0verp7801.jpg
"And just because he doesn't invest in something doesn't mean he doesn't understand it. He may understand it very well and based on his risk appetite, realise it's a bad ""investment"". (I say ""investment"" because it's all speculative, and not investing when it comes to Bitcoin).";4;0;False;thekiwifish;ds87oul;Warren Buffet:;7o9zo1;https://i.redd.it/epko0verp7801.jpg
If you find what you love, *and* youre good at it why would you stop?;10;1;False;Pokehunter217;ds8joo7;Warren Buffet:;7o9zo1;https://i.redd.it/epko0verp7801.jpg
"guessing which tech company is gonna boom is the same a guessing which crypto currency is gonna boom. 

its a guess.";1;0;False;Boozeberry2017;ds85mwk;Warren Buffet:;7o9zo1;https://i.redd.it/epko0verp7801.jpg
"That's why he should avoid commenting on tech before calling it a bubble.

Bitcoin is a bubble for anyone who doesn't understand Bitcoin.";-2;3;False;prelsidente;ds7xgee;Warren Buffet:;7o9zo1;https://i.redd.it/epko0verp7801.jpg
"RENT.  And Dividends.

And yes, you can make money, and you can lose money (volatility) but over the long run you should *average* 5% to 10% returns.";1;0;False;pictogasm;ds8dr3y;Warren Buffet:;7o9zo1;https://i.redd.it/epko0verp7801.jpg
That means you found a way. ;1;1;False;kynek99;ds8bogk;Warren Buffet:;7o9zo1;https://i.redd.it/epko0verp7801.jpg
">I do make money while sleeping with crypto

You don't have to turn on the red light.";1;0;False;intertubeluber;ds846io;Warren Buffet:;7o9zo1;https://i.redd.it/epko0verp7801.jpg
