body;score;nb_replies;stickied;author;id;post_title;post_id;post_link
"Yes ""small piece"" as in insignificant compared to the wastefulness around us which could potentially be addressed using this technology as is.

You're being a willing pawn of the elites with this rhetoric. Bitcoin isn't the problem we need to be worried about. Bitcoin will give us the leverage we need to address the problems we should be worried about.";1;0;False;;e84tlp5;Anti-crypto propaganda... promoted by American Express;9ophqs;https://i.redd.it/1ecxehgvvks11.png
He's saying his bitcoin is worth less now than when he bought it. He's tired of waiting for a jump (rise in value) so he's cashing in now and taking a loss (getting less money back than he put in) so at least he'll have some cash. It wasn't that complicated.;1;0;False;pondribertion;e854gap;Bitcoin has stabilized?;95upw4;https://i.redd.it/0hfg960i61f11.jpg
So I'm guessing that doesn't include data mining,mass surveilence, cyberwar, malware, and a bunch of other goodies?;250;4;False;AllSeeingGoatsee;e83uq8u;Trust the nerds;9pqxea;https://i.redd.it/0f88vogzi9t11.jpg
you think the top 0.1% of crypto holders who can make or break the crypto market overnight are nerds? ;4;1;False;constantin_md;e83zy6d;Trust the nerds;9pqxea;https://i.redd.it/0f88vogzi9t11.jpg
"We made those corporations as powerful as they are today.

Mozilla released an open source OS for smartphones. Pretty sure there was also an open hardware phone that could run the OS.

No one gave a fuck.";27;2;False;mbrochh;e841ksi;Trust the nerds;9pqxea;https://i.redd.it/0f88vogzi9t11.jpg
All we have to do is create alternatives.;9;1;False;natehenderson;e83zq7p;Trust the nerds;9pqxea;https://i.redd.it/0f88vogzi9t11.jpg
">what was intended to be a free space

Those things happen in part because it is a free space.";3;1;False;Juanfro;e845e18;Trust the nerds;9pqxea;https://i.redd.it/0f88vogzi9t11.jpg
corporations also hire nerds;2;1;False;pinchitony;e84ofl2;Trust the nerds;9pqxea;https://i.redd.it/0f88vogzi9t11.jpg
Internet ain’t never hurt nobody ;2;0;False;MaroonHawk27;e84kuyp;Trust the nerds;9pqxea;https://i.redd.it/0f88vogzi9t11.jpg
You do know financial services firms with trillions in assets are deeper in crypto than nerds ever will and can pump it and dump it as they wish?;3;0;False;AMZN3000C;e842c8x;Trust the nerds;9pqxea;https://i.redd.it/0f88vogzi9t11.jpg
[deleted];-28;2;False;;e846lob;Trust the nerds;9pqxea;https://i.redd.it/0f88vogzi9t11.jpg
"That’s not true.  People can gamble in online casinos in countries that have made it illegal (United States).  And can buy illegal drugs online thanks to crypto.  

Also, arguably you can move money across borders more easily with crypto, though everyone I’ve talked to that does that kind of thing still uses $100 bills.

These are much smaller use cases than everyone wants to hear in the crypto world but they are real use cases for people with real problems 

It blows my mind how many people have forgotten the entire purpose of crypto which is censorship resistance (hint: it’s in the name...crypto).  So the only people that need to use it are the ones getting censored by their government or mega corps.  No one else needs this shit. (Looking at you ethereum fans).  ";3;1;False;CalvinsStuffedTiger;e84ktwa;Trust the nerds;9pqxea;https://i.redd.it/0f88vogzi9t11.jpg
Real history will get you down votes in reddit. If they only knew what truly happened...;4;0;False;Placebo17;e84cq5e;Trust the nerds;9pqxea;https://i.redd.it/0f88vogzi9t11.jpg
[deleted];0;1;False;;e841lmn;Trust the nerds;9pqxea;https://i.redd.it/0f88vogzi9t11.jpg
Where was the first nodes of what we today call the internet located?;3;0;False;hsjoberg;e844sip;Trust the nerds;9pqxea;https://i.redd.it/0f88vogzi9t11.jpg
"I wonder who they hired to do such a thing. Mustve been the soldiers, not the people who studied math and physics which would be considered ""nerds"".";1;0;False;;e84d15r;Trust the nerds;9pqxea;https://i.redd.it/0f88vogzi9t11.jpg
I know, but this wouldn't have fit here. ;1;0;False;;e840anq;Trust the nerds;9pqxea;https://i.redd.it/0f88vogzi9t11.jpg
Saying that banks caused the great depression  is, (if we're being  charitable) a gross oversimplification, and defining the term 'nerd' so narrowly that it includes computer engineers but not economists seems arbitrary. ;90;2;False;;e83y54b;Trust the nerds;9pqxea;https://i.redd.it/0f88vogzi9t11.jpg
There's obviously no way that people could disagree with you without being paid to do so.;3;1;False;sos_1;e842lgm;Trust the nerds;9pqxea;https://i.redd.it/0f88vogzi9t11.jpg
they may try. in the end the conventional bank business will shrink to small fraction of what it is today, freeing up ressources for useful people/work.;-2;0;False;Hanspanzer;e83xlkd;Trust the nerds;9pqxea;https://i.redd.it/0f88vogzi9t11.jpg
"> In all honesty the internet is a cesspool of shit.

It mostly is, but we need that parts that are not.";1;0;False;metalzip;e848zb6;Trust the nerds;9pqxea;https://i.redd.it/0f88vogzi9t11.jpg
Care to elaborate or is calling ideas stupid where your argument ends?;0;2;False;dudedustin;e84jhb1;Trust the nerds;9pqxea;https://i.redd.it/0f88vogzi9t11.jpg
"> Yes, because no money or banks were needed to fund the development of the internet. Sigh

You think Antrop is against money? Please.";0;0;False;metalzip;e848ybz;Trust the nerds;9pqxea;https://i.redd.it/0f88vogzi9t11.jpg
Bitcoin thrives exactly due to greed.;8;0;False;AltruisticBreadfruit;e84pk3q;Trust the nerds;9pqxea;https://i.redd.it/0f88vogzi9t11.jpg
Actually it was the federal reserve detracting a third of the money supply from circulation via deflation that caused the great depression after the crash of 29.;2;0;False;;e84wtl7;Trust the nerds;9pqxea;https://i.redd.it/0f88vogzi9t11.jpg
Lmfao do people still think greed caused it? Ot was the Federal Reserve that was guilty, not business owners.;4;2;False;Benramin567;e841ay4;Trust the nerds;9pqxea;https://i.redd.it/0f88vogzi9t11.jpg
"> Greed brought the Great Depression. Banks are not the problem, people are.

There is plenty of greed in Bitcoin, and yet long term value goes up, not down.

Printing money is the problem. Govs/FED(s) can cheat you. Math can not.";2;0;False;metalzip;e848w49;Trust the nerds;9pqxea;https://i.redd.it/0f88vogzi9t11.jpg
Pretty dumb picture of text, but banks are shit though and I would rather live in a crypto based version of reality.;1;0;False;Tall_computer;e843voi;Trust the nerds;9pqxea;https://i.redd.it/0f88vogzi9t11.jpg
Get your facts straight. Nerds didn't create the internet. It was created by the American army who needed a network that would continue working even if multiple nodes/lines where destroyed by the enemy. Hence they made Arpanet, what has later morphed into the internet we know today.;15;3;False;Paillote;e8409je;Trust the nerds;9pqxea;https://i.redd.it/0f88vogzi9t11.jpg
Can you explain. ;-1;1;False;MadBanker01;e8496c1;Trust the nerds;9pqxea;https://i.redd.it/0f88vogzi9t11.jpg
The Federal Reserve was created in 1913, long before the Great Depression.;9;1;False;Aejones124;e83ujds;Trust the nerds;9pqxea;https://i.redd.it/0f88vogzi9t11.jpg
Yeah but.... in the Pentagon also work nerds, so.... :);1;0;False;ultra_reader;e848ee2;Trust the nerds;9pqxea;https://i.redd.it/0f88vogzi9t11.jpg
Yeah man just a stupid network that interconnects every human being in the world and source of almost all information known to humankind.;34;3;False;;e83qp31;Trust the nerds;9pqxea;https://i.redd.it/0f88vogzi9t11.jpg
The corporate Internet, Web 2.0, is a cesspool of shit.  The blockchain Internet, Web 3.0 will be a heavenly Jacuzzi filled with babes and champagne.;11;3;False;diydude2;e83ram7;Trust the nerds;9pqxea;https://i.redd.it/0f88vogzi9t11.jpg
You sounds like Nouriel.;2;0;False;fuadiansyah;e83uy0r;Trust the nerds;9pqxea;https://i.redd.it/0f88vogzi9t11.jpg
It has it all, you must like swimming in it too long though. ;1;0;False;iiJokerzace;e83sv20;Trust the nerds;9pqxea;https://i.redd.it/0f88vogzi9t11.jpg
Its just a really silly argument, i think its just a joke so i made another joke;5;1;False;rand0m0mg;e8497yh;Trust the nerds;9pqxea;https://i.redd.it/0f88vogzi9t11.jpg
[deleted];6;1;False;;e83vkfx;Trust the nerds;9pqxea;https://i.redd.it/0f88vogzi9t11.jpg
It's funny because parent post defends in an overly sarcastic way that basically calls out grandparent as a shit post... on the internet.;11;0;False;CaptainPatent;e83qzuj;Trust the nerds;9pqxea;https://i.redd.it/0f88vogzi9t11.jpg
The best of both worlds?;7;0;False;speedo-burrito;e83qxqv;Trust the nerds;9pqxea;https://i.redd.it/0f88vogzi9t11.jpg
"It's not really anyones life purpose, it's more of a group of people working for profits that push this. People are all about incentives and free spaces are nothing more than tragedy of the commons to them. Where there's a free resource to exploit and possibly get profit, people will inevitably exploit it for profit.



Fighting profits is the most dangerous thing any person can do";5;1;False;Forgotloginn;e84tnh5;Trust the nerds;9pqxea;https://i.redd.it/0f88vogzi9t11.jpg
[deleted];-10;2;False;;e84eqae;Trust the nerds;9pqxea;https://i.redd.it/0f88vogzi9t11.jpg
Thank you for thanking him in response.;5;1;False;;e8469cf;Trust the nerds;9pqxea;https://i.redd.it/0f88vogzi9t11.jpg
Stop thinking about you situation where you have perfect access to banks and multiple payment systems. Think of other people that don't have valid papers, live in underdeveloped corrupt countries that don't allow or have banks, etc. Also you don't see a problem with banking hours that close in friday after 2 or 3 pm?;2;1;False;shure_slo;e84m356;Trust the nerds;9pqxea;https://i.redd.it/0f88vogzi9t11.jpg
"Yeah for sure, at least currently.  I think there might be a use case for micro transactions online as well via bitcoins lightning network.  Like right now the merchants just eat the credit card processing fee of $2.7 + 25 cents.  So if you had a small digital product you wanted to sell for less than $5-$10 it’s probably not worth it 

I’m not exactly sure if there are any products that fit in that category or if the masses would be willing to give up their awesome buyer protection where they can charge back for any reason and are almost completely protected from fraud.

I do however, think that adding micro transactions to digital platforms may be the best way to combat bots and brigading 

Like if it cost you some fraction of a penny to upvote or comment and it got less expensive the better your reputation was and more expensive the newer your account was and the amount of times you got flagged for trolling or being a racist asshole.  Then it would become much more expensive to socially engineer panic, hysteria, and violence.

Obviously there are a ton of problems with this idea and it’s not a cure all 
But if we continue to rely on advertising as a revenue generator the only logical conclusion is clickbait and polarizing brigading ";1;0;False;CalvinsStuffedTiger;e84osx5;Trust the nerds;9pqxea;https://i.redd.it/0f88vogzi9t11.jpg
Other countries used the US dollar as a reserve (instead of gold) so when the dollar inflated their currencies subsequently did as well.;3;0;False;dudedustin;e84juo0;Trust the nerds;9pqxea;https://i.redd.it/0f88vogzi9t11.jpg
[deleted];0;1;False;;e841ppe;Trust the nerds;9pqxea;https://i.redd.it/0f88vogzi9t11.jpg
Brave is;1;1;False;Askk8;e84g9z2;Trust the nerds;9pqxea;https://i.redd.it/0f88vogzi9t11.jpg
You are correct, kind of makes me uncertain about what the future holds... it's probably best to try and live in the moment as much as possible.;2;1;False;xRigorMortisx;e84vscw;Trust the nerds;9pqxea;https://i.redd.it/0f88vogzi9t11.jpg
Well don’t put them on equal footing. Not even medicine is on equal footing with physics. You still need to use whatever imperfect theoretical understanding we have to cure people. Same with economics.;2;0;False;qagg;e84ry2w;Trust the nerds;9pqxea;https://i.redd.it/0f88vogzi9t11.jpg
Nonsense, that’s how science progresses. ;2;1;False;CautiousToaster;e84iw4w;Trust the nerds;9pqxea;https://i.redd.it/0f88vogzi9t11.jpg
"Umm, many people in underdeveloped countries and with no valid papers have no access to the internet, thus to crypto.
And no, i don't see a problem with banks be closing at 3pm on Friday - you credit/debit card or bankomats/atms don't close at 3pm so you always have access to your money. ";1;0;False;Redditridder;e84nwoj;Trust the nerds;9pqxea;https://i.redd.it/0f88vogzi9t11.jpg
They still had central banks. Also, small depressions are unavoidable, it usually happens after big technologic breakthroughs.;2;0;False;Benramin567;e841udw;Trust the nerds;9pqxea;https://i.redd.it/0f88vogzi9t11.jpg
Corporations or any kind of conglomerate is cancer in society and economies;3;0;False;Forgotloginn;e84xu3y;Trust the nerds;9pqxea;https://i.redd.it/0f88vogzi9t11.jpg
[deleted];-1;1;False;;e84lm4q;Trust the nerds;9pqxea;https://i.redd.it/0f88vogzi9t11.jpg
That's why decentralization is important.;8;0;False;AltruisticBreadfruit;e84peh1;Trust the nerds;9pqxea;https://i.redd.it/0f88vogzi9t11.jpg
You obviously don't read the msm then.;-1;1;False;MadBanker01;e849520;Trust the nerds;9pqxea;https://i.redd.it/0f88vogzi9t11.jpg
"Firefox is the fastest browser at the moment, I think, and the dev tools are just as good as Chrome's, so there is really no reason not to use FF.

I love Chrome's new design, though, but I'll stick to FF anyways.";5;1;False;mbrochh;e84dtie;Trust the nerds;9pqxea;https://i.redd.it/0f88vogzi9t11.jpg
"Do you think all countries got greedy at the same time or what? 

The US economy had effect on countries they traded with.";5;2;False;Benramin567;e841npu;Trust the nerds;9pqxea;https://i.redd.it/0f88vogzi9t11.jpg
the problem is people like you can use it too.;-1;0;False;penguingspe;e83rlz4;Trust the nerds;9pqxea;https://i.redd.it/0f88vogzi9t11.jpg
It's all sunshine and roses until a used condom floats and and sticks to your arm.;4;0;False;Kernel32Sanders;e83rfo9;Trust the nerds;9pqxea;https://i.redd.it/0f88vogzi9t11.jpg
i can dig it.;2;0;False;penguingspe;e83rlb8;Trust the nerds;9pqxea;https://i.redd.it/0f88vogzi9t11.jpg
Web 3.0 is full of Facebook memes and 9gag jokes.;1;0;False;i_have_seen_it_all;e83yuk7;Trust the nerds;9pqxea;https://i.redd.it/0f88vogzi9t11.jpg
so you think Trump isn't colluding with AIG to make a business from  a timed crash?;1;0;False;Hanspanzer;e84r3oh;Trust the nerds;9pqxea;https://i.redd.it/0f88vogzi9t11.jpg
Really? I would totally use that, I just switched back over to Mozilla broswer because I never realized it was open source. To me, having any remnants of corporate fingerprints on my stuff is like an insidious cancer just slowly building up in the back ground.;12;1;False;xRigorMortisx;e8428zp;Trust the nerds;9pqxea;https://i.redd.it/0f88vogzi9t11.jpg
Guess where “Safari” started...;1;0;False;Alh84OO1;e84ckru;Trust the nerds;9pqxea;https://i.redd.it/0f88vogzi9t11.jpg
"And wait 4 years for those alternatives to be co-opted / weaponized by corporate interest. 

...while everyone pins their hopes to being saved by literally the only thing that could save them: benevolent non-Bond-villain multi-billionaires. 

If only they existed. 

";4;1;False;BigBankHank;e845y1s;Trust the nerds;9pqxea;https://i.redd.it/0f88vogzi9t11.jpg
That's true, the massive efforts to increase freedom seem to be largely negated by those who make it their absolute life purpose to dominate others and spread further chaos.;3;1;False;xRigorMortisx;e847ozx;Trust the nerds;9pqxea;https://i.redd.it/0f88vogzi9t11.jpg
And some nerds will do dirty work that ONLY they could do, just for a larger paycheck...;3;0;False;xRigorMortisx;e84pnuc;Trust the nerds;9pqxea;https://i.redd.it/0f88vogzi9t11.jpg
Look there is lots of bullshit in those fields, but it’s not *all* bullshit.;9;1;False;qagg;e84c940;Trust the nerds;9pqxea;https://i.redd.it/0f88vogzi9t11.jpg
Yikes. ;17;0;False;TobiasDrundridge;e847let;Trust the nerds;9pqxea;https://i.redd.it/0f88vogzi9t11.jpg
Thank you for the response.;4;1;False;notsuppostocomnt;e845h8y;Trust the nerds;9pqxea;https://i.redd.it/0f88vogzi9t11.jpg
[deleted];1;0;False;;e84ch2i;Trust the nerds;9pqxea;https://i.redd.it/0f88vogzi9t11.jpg
"I'm talking about use cases for mass adoption - there are none. But I think you meant the same ;)";0;2;False;Redditridder;e84lcjn;Trust the nerds;9pqxea;https://i.redd.it/0f88vogzi9t11.jpg
It’s long enough for the bank to have been well-established by the time the depression hit.;1;0;False;Aejones124;e84khug;Trust the nerds;9pqxea;https://i.redd.it/0f88vogzi9t11.jpg
Once Bitcoin or another currency saturated the market for money it will become stable.;4;0;False;dudedustin;e84jqdf;Trust the nerds;9pqxea;https://i.redd.it/0f88vogzi9t11.jpg
"Exactly. knowing the maker has enough to tank the market to nothing at any moment isn't ""security or stability"" ";1;0;False;destrukkt;e844xdy;Trust the nerds;9pqxea;https://i.redd.it/0f88vogzi9t11.jpg
">Why can't we just use crypto and enjoy it for what it is instead of listening to and praise stupid hype of big whales bag holders like this one?


Because outside of the small community nobody wants or needs crypto - there is no economic use case for it, as much as ya'll want to believe the opposite. And this community will always stay small and fringe because, again, crypto doesn't solve any problems.
";0;1;False;Redditridder;e84k6m7;Trust the nerds;9pqxea;https://i.redd.it/0f88vogzi9t11.jpg
Actually the US Military brought us the Internet. ;2;0;False;gulfbitcoin;e84fjvb;Trust the nerds;9pqxea;https://i.redd.it/0f88vogzi9t11.jpg
Can’t help but read that in his voice;3;0;False;yesoknowhymayb;e83x80j;Trust the nerds;9pqxea;https://i.redd.it/0f88vogzi9t11.jpg
In all honesty the internet is a cesspool of shit.;1;5;False;penguingspe;e83phos;Trust the nerds;9pqxea;https://i.redd.it/0f88vogzi9t11.jpg
"Ehh because the maker nerd piled away enough to tank it to 0 at any time.

&#x200B;

let the down votes come but it is true, satoshi or whatever the spelling is owns so many he is the market. ";1;0;False;destrukkt;e844w3d;Trust the nerds;9pqxea;https://i.redd.it/0f88vogzi9t11.jpg
Agreed!;1;0;False;FriendlyJohnie;e846je4;Trust the nerds;9pqxea;https://i.redd.it/0f88vogzi9t11.jpg
Banks are also run by nerds... dumb quote;1;0;False;NewCommonSensei;e846pqy;Trust the nerds;9pqxea;https://i.redd.it/0f88vogzi9t11.jpg
https://www.reddit.com/r/Bitcoin/comments/95a2hm/10_reasons_why_bitcoin_is_better_than/?st=JNHH1MIK&sh=4ca23a99;1;0;False;raftoni;e8490z1;Trust the nerds;9pqxea;https://i.redd.it/0f88vogzi9t11.jpg
Only if you sold;1;0;False;CoffeeShots;e849ipt;Trust the nerds;9pqxea;https://i.redd.it/0f88vogzi9t11.jpg
So the nerds didn't creating banking lol? Pretty sure the idiot's didn't come up with that system either.;1;0;False;bsktbll;e849ji7;Trust the nerds;9pqxea;https://i.redd.it/0f88vogzi9t11.jpg
It wasn’t monetary policy that caused the Great Depression, it was fiscal policy. ;1;0;False;UsernameIWontRegret;e84a6nd;Trust the nerds;9pqxea;https://i.redd.it/0f88vogzi9t11.jpg
Can anyone link to where he actually said this? I sincerely doubt this highly intelligent man would utter this sort of cringy crap.;1;0;False;globalistas;e84b6au;Trust the nerds;9pqxea;https://i.redd.it/0f88vogzi9t11.jpg
Without funding from the banks none of those internet companies would have existed.;1;0;False;cafeitalia;e84bsrp;Trust the nerds;9pqxea;https://i.redd.it/0f88vogzi9t11.jpg
Banks weren’t directly responsible for creating the Great Depression. The banks were used as a tool. Read up.;1;0;False;Deeze_Rmuh_Nudds;e84btdu;Trust the nerds;9pqxea;https://i.redd.it/0f88vogzi9t11.jpg
"Bitcoin is a scam. Climate change is a hoax. 

Jk";1;0;False;joq83755;e84k6fd;Trust the nerds;9pqxea;https://i.redd.it/0f88vogzi9t11.jpg
Can't lose any money in a depression if you lost it all due to volatility!;12;0;False;TheHeretic;e844f7s;Trust the nerds;9pqxea;https://i.redd.it/0f88vogzi9t11.jpg
"I believe this is an accurate summary when comparing the history of each. What often motivates  data mining, mass surveillance, cyberwar, malware?

You can split the asshairs of an ant all day long. Is the current financial system fair? If not, how can we make it better?";1;0;False;CASHXXII;e84mgvb;Trust the nerds;9pqxea;https://i.redd.it/0f88vogzi9t11.jpg
Yeah, I’m sure it’s that simple;1;0;False;ProgrammaticProgram;e84muhi;Trust the nerds;9pqxea;https://i.redd.it/0f88vogzi9t11.jpg
Because clearly a nerd has never worked for a bank.;2;0;False;YouNeverReallyKnow2;e84e1t6;Trust the nerds;9pqxea;https://i.redd.it/0f88vogzi9t11.jpg
*Cringe*;1;0;False;snoop_Odin;e84n5y6;Trust the nerds;9pqxea;https://i.redd.it/0f88vogzi9t11.jpg
Nerds brought you chemical weapons and atomic bombs :D;2;0;False;;e84cz9t;Trust the nerds;9pqxea;https://i.redd.it/0f88vogzi9t11.jpg
Nerds? It was the Pentagon;2;1;False;Beilsteiner;e8472a8;Trust the nerds;9pqxea;https://i.redd.it/0f88vogzi9t11.jpg
Holy shit this is cringe. ;402;4;False;;e83u07g;Trust the nerds;9pqxea;https://i.redd.it/0f88vogzi9t11.jpg
I'm really bothered that there's an open quote, but no close. ;54;4;False;clarinetJWD;e83svb5;Trust the nerds;9pqxea;https://i.redd.it/0f88vogzi9t11.jpg
That's dumb.;112;1;False;;e83urlp;Trust the nerds;9pqxea;https://i.redd.it/0f88vogzi9t11.jpg
"That's a foolish statement. Crypto is not nerd money since about 2011. Didn't IPOs, false hype and promises of 2013 and 2017, regular inside job ""hacks"" on exchanges not teach people anything? The greed and corruption in crypto supersedes the banks by far if we take into consideration the ratio of use. 
Why can't we just use crypto and enjoy it for what it is instead of listening to and praise stupid hype of big whales bag holders like this one?";25;1;False;constantin_md;e83zsv2;Trust the nerds;9pqxea;https://i.redd.it/0f88vogzi9t11.jpg
Banks bring the great depression each ~100 years. Cryptos crash twice in 4-5 years.;48;2;False;symta;e840hbn;Trust the nerds;9pqxea;https://i.redd.it/0f88vogzi9t11.jpg
Literally the stupidest thing I've ever read;55;2;False;GrandmaTaco;e841vpx;Trust the nerds;9pqxea;https://i.redd.it/0f88vogzi9t11.jpg
Yes, because no money or banks were needed to fund the development of the internet. Sigh;5;1;False;danesflyhigh;e843mc4;Trust the nerds;9pqxea;https://i.redd.it/0f88vogzi9t11.jpg
"Greed brought the Great Depression.
Banks are not the problem, people are.
If you think Bitcoin will eliminate Greed, you are in for a rude awakening.
";45;7;False;proficy;e83x4qa;Trust the nerds;9pqxea;https://i.redd.it/0f88vogzi9t11.jpg
Why does this sub upvote the stupidest shit;31;1;False;AnonHideaki;e83zg9a;Trust the nerds;9pqxea;https://i.redd.it/0f88vogzi9t11.jpg
cringe;18;0;False;;e83wz6u;Trust the nerds;9pqxea;https://i.redd.it/0f88vogzi9t11.jpg
"The nerds created the Internet and left it to Facebook, Google and Amazon who now are the true dictators, they make their own laws and earn shit loads of money with it, oppressing and squeezing out everybody else.
";13;1;False;;e83vni8;Trust the nerds;9pqxea;https://i.redd.it/0f88vogzi9t11.jpg
Check mate, atheists;7;1;False;rand0m0mg;e83yu32;Trust the nerds;9pqxea;https://i.redd.it/0f88vogzi9t11.jpg
Jesus christ OP just jerk yourself off a little harder why dont ya;5;0;False;l_SmeII_Like_Beef;e8464uq;Trust the nerds;9pqxea;https://i.redd.it/0f88vogzi9t11.jpg
[deleted];2;1;False;;e83u67d;Trust the nerds;9pqxea;https://i.redd.it/0f88vogzi9t11.jpg
classic lulz;2;0;False;flunderbossanova;e83wddl;Trust the nerds;9pqxea;https://i.redd.it/0f88vogzi9t11.jpg
Good point, just bought 100k nerd money;2;0;False;capoony147;e843jf1;Trust the nerds;9pqxea;https://i.redd.it/0f88vogzi9t11.jpg
"full blown aids - kudos on circlejerk re: fallacious content  + also the ability to override the benefit [to me] of being here for any meaningful content from worthwhile contributors.  

seeing this at the top of r/Bitcoin when i check in this morning is as strong a motivator as i need to not check back here again for some time

(edited: typo/grammar)";2;0;False;;e844eal;Trust the nerds;9pqxea;https://i.redd.it/0f88vogzi9t11.jpg
"Is this our champion? With cliche shit like this?

We’re fucked.";2;0;False;Black_RL;e847n2k;Trust the nerds;9pqxea;https://i.redd.it/0f88vogzi9t11.jpg
Cringe;1;0;False;spicymangoslice;e84nptx;Trust the nerds;9pqxea;https://i.redd.it/0f88vogzi9t11.jpg
Bitcoin = Big banks ;1;0;False;i_win_u_know;e84krcb;Trust the nerds;9pqxea;https://i.redd.it/0f88vogzi9t11.jpg
Nerds gave us anime, banks brought us to the moon.;1;0;False;YoohooWithaLittleRum;e84q6fx;Trust the nerds;9pqxea;https://i.redd.it/0f88vogzi9t11.jpg
No room for discussion! Makes perfect sense ;0;0;False;Qwert5288;e8421x0;Trust the nerds;9pqxea;https://i.redd.it/0f88vogzi9t11.jpg
Nerds also brought you the Atom Bomb, but meh.;1;0;False;Monoshade;e84os2a;Trust the nerds;9pqxea;https://i.redd.it/0f88vogzi9t11.jpg
no matter what nerds are in it for the tech. that's why you can trust them.;-1;2;False;Hanspanzer;e83xcs1;Trust the nerds;9pqxea;https://i.redd.it/0f88vogzi9t11.jpg
All of which, the larger consumer base has not only allowed, but encouraged to encroach upon what was intended to be a free space. This is what happens when all power and authority is handed over to corporations who seek to enslave us all. We can't have freedom as a larger group, because not enough people truly value freedom, and instead just give it up freely.;43;4;False;xRigorMortisx;e83yaz9;Trust the nerds;9pqxea;https://i.redd.it/0f88vogzi9t11.jpg
And the Dot Com Crash.;6;1;False;VikingCoder;e844830;Trust the nerds;9pqxea;https://i.redd.it/0f88vogzi9t11.jpg
That’s been going on forever. ;2;0;False;KalEll66;e84gy3y;Trust the nerds;9pqxea;https://i.redd.it/0f88vogzi9t11.jpg
