body;score;nb_replies;stickied;author;id;post_title;post_id;post_link
the only way it'd go straight to zero is if it were an exit scam, this was a bubble plain and simple, and some think it's still popping;0;2;False;stanman51;ebxk940;Those mountains;a1d0ze;https://i.redd.it/vq1mjluii6121.png
what? a swift 85% value drop after such a quick rise isn't a bubble?;1;1;False;stanman51;ebvozm5;Those mountains;a1d0ze;https://i.redd.it/vq1mjluii6121.png
No it most deffo isn't. Even if it was over now, it still wouldn't be a bubble. Zero is a lot less than 3 grand is it not. Anyway that's all by the by - because it isn't over (despite the efforts of sock puppets representing the banksters).;1;1;False;thesws;ebwgknv;Those mountains;a1d0ze;https://i.redd.it/vq1mjluii6121.png
I have fond memories of the days preceding this time last year. I work in an office full of tech-orientated people, at least half of the room were holding some quantity of Bitcoin. We had one of those little serving bells in the room, which someone would ring every time Bitcoin broke another $1000 dollar interval as the price climbed. I swear we must have rang the bell at least three times on on one particular day, all laughing as we dreamt of Lambos.;349;7;False;mhj360;ebwm7wv;Last Year & Today;a6o4sp;https://i.redd.it/vdeafl7obm421.jpg
Herp derp I am an idiot who doesn't understand what a currency is and what it is used for;-9;1;False;ztsmart;ebx5813;Last Year & Today;a6o4sp;https://i.redd.it/vdeafl7obm421.jpg
"The lambo is a joke on a man who was going to buy a house in bitcoin, and by the time he closed the deal, Bitcoin had gone up by a lot, allowing him to buy a lambo with the extra money he got in that small frame of time.

Edit: Also, Lamborghini was the first car manufacturer to accept bitcoin as a payment.";40;2;False;BrunoNFL;ebwntuy;Last Year & Today;a6o4sp;https://i.redd.it/vdeafl7obm421.jpg
Do you think people really want to take a trip to the moon as well?;8;1;False;barthsidious;ebwn4db;Last Year & Today;a6o4sp;https://i.redd.it/vdeafl7obm421.jpg
"It's a meme...

Anyway, I am glad the BTC price falling back down from that ATH hasn't scuppered your dream of having your very own high horse, good for you dude. ";4;0;False;OBOSOB;ebwq397;Last Year & Today;a6o4sp;https://i.redd.it/vdeafl7obm421.jpg
Have you heard the sound of a V10 engine? Who cares about destroying the world, I’ll be dead before anything serious happens anyway;2;2;False;xXReddiTpRoXx;ebwptbk;Last Year & Today;a6o4sp;https://i.redd.it/vdeafl7obm421.jpg
[removed];0;1;False;;ebwup0x;Last Year & Today;a6o4sp;https://i.redd.it/vdeafl7obm421.jpg
"Its a joke. A meme.

And bitcoin is NOT heating up the planet lol.
Fucking christmas lights use more electricity

";1;1;False;R_u_having_fun_yet;ebwvk3g;Last Year & Today;a6o4sp;https://i.redd.it/vdeafl7obm421.jpg
"> synthesizers/music gear

Spent 90% of my crypto on that and associated gear around January.  ";1;0;False;skelly890;ebxaety;Last Year & Today;a6o4sp;https://i.redd.it/vdeafl7obm421.jpg
You come out with some shite you. Fiat uses more energy by about 1000x;1;1;False;pjf72;ebwn3pa;Last Year & Today;a6o4sp;https://i.redd.it/vdeafl7obm421.jpg
So true;2;0;False;Thanamite;ebx6mf4;Last Year & Today;a6o4sp;https://i.redd.it/vdeafl7obm421.jpg
[deleted];2;1;False;;ebx2tsh;Last Year & Today;a6o4sp;https://i.redd.it/vdeafl7obm421.jpg
"You also believe everything the gas lobby propaganda tells you, right?

If we keep using fossil fuel we will probably run out in 50-100 years. ";4;1;False;Breadynator;ebwspn2;Last Year & Today;a6o4sp;https://i.redd.it/vdeafl7obm421.jpg
Beautiful;2;0;False;Motor-boat;ebwkzei;Last Year & Today;a6o4sp;https://i.redd.it/vdeafl7obm421.jpg
RIP to people who invested back then. ;26;1;False;filss;ebwme3t;Last Year & Today;a6o4sp;https://i.redd.it/vdeafl7obm421.jpg
How do you know it's still not in profit?;5;1;False;pjf72;ebwn1oy;Last Year & Today;a6o4sp;https://i.redd.it/vdeafl7obm421.jpg
Hahaha  yes  ;1;0;False;JD-007;ebwm4sd;Last Year & Today;a6o4sp;https://i.redd.it/vdeafl7obm421.jpg
New startup idea!;13;1;False;Aaeder;ebwobqf;Last Year & Today;a6o4sp;https://i.redd.it/vdeafl7obm421.jpg
Crytilasleep;1;0;False;sweaty-pajamas;ebwt7xy;Last Year & Today;a6o4sp;https://i.redd.it/vdeafl7obm421.jpg
Yes they should accept Bitcoin instead which lost 85% of its value since the purchase date. You sound reasonable.;9;1;False;Jonath198;ebwq22p;Last Year & Today;a6o4sp;https://i.redd.it/vdeafl7obm421.jpg
And they don't accept Bitcoin.;2;0;False;MLSHomeBets;ebxgeup;Last Year & Today;a6o4sp;https://i.redd.it/vdeafl7obm421.jpg
He said they could buy their very own bitcoin right now by downloading coin base on their phones;73;1;False;GREENBANANAS99999;ebx834r;Last Year & Today;a6o4sp;https://i.redd.it/vdeafl7obm421.jpg
I believe it ;4;0;False;diamondcuts17765;ebxphit;Last Year & Today;a6o4sp;https://i.redd.it/vdeafl7obm421.jpg
And a hell of a lot of those using it as a currency were using it for illicit purchases.;10;2;False;UnpredictedArrival;ebx5c7f;Last Year & Today;a6o4sp;https://i.redd.it/vdeafl7obm421.jpg
If I wasn't broke from btc I would give gold for this comment ;25;1;False;_noIdentity;ebx0vzg;Last Year & Today;a6o4sp;https://i.redd.it/vdeafl7obm421.jpg
Why did I not sell back then?  I sold before that.;12;1;False;rydan;ebwn33o;Last Year & Today;a6o4sp;https://i.redd.it/vdeafl7obm421.jpg
I wasn't planning to sell anything until 2020 at a minimum, so this has been just one big crazy show. Japan Olympics 2020 should really put crypto on the map, most shops accept it;19;3;False;Tinseltopia;ebwnbgo;Last Year & Today;a6o4sp;https://i.redd.it/vdeafl7obm421.jpg
Its right on track  https://cdn.technologyreview.com/i/images/mecalfs-law.png?sw=1032;1;1;False;Waswasz;ebxrzge;Last Year & Today;a6o4sp;https://i.redd.it/vdeafl7obm421.jpg
It's greed when you sell. In 20 years when world will be driven by crypto you'll be ashamed that you sold bitcoin at $20K;-12;4;False;0x8000;ebwo9jm;Last Year & Today;a6o4sp;https://i.redd.it/vdeafl7obm421.jpg
Yep the bitcoin I've bought recently has been for probably a few hundred dollars or more lower than the actual price. Since some are trying to get it they're discounting;1;0;False;Sonicon2;ebwv1pe;Last Year & Today;a6o4sp;https://i.redd.it/vdeafl7obm421.jpg
You had a life changing transaction and can't remember the price within $2k?  I'm calling bullshit;13;3;False;512lostinthesauce;ebxt7mm;Last Year & Today;a6o4sp;https://i.redd.it/vdeafl7obm421.jpg
Profit taking? Too much supply, no more buyers? Bad news? Mt gox thingy?;3;1;False;;ebxkahu;Last Year & Today;a6o4sp;https://i.redd.it/vdeafl7obm421.jpg
Hahah you got that ;4;0;False;JD-007;ebwtn9m;Last Year & Today;a6o4sp;https://i.redd.it/vdeafl7obm421.jpg
"""Satoshi"" ";1;0;False;Thrgd456;ebx9cxo;Last Year & Today;a6o4sp;https://i.redd.it/vdeafl7obm421.jpg
But everyone was in at the last ATH. ;1;0;False;teknic111;ebx5w59;Last Year & Today;a6o4sp;https://i.redd.it/vdeafl7obm421.jpg
Seems like ;-1;0;False;JD-007;ebx16hw;Last Year & Today;a6o4sp;https://i.redd.it/vdeafl7obm421.jpg
">Exactly the time I've finished reading the book  Extraordinary Popular Delusions and the Madness of Crowds.  
>  
>Shortly after I started shorting it. Good times.

 

Exactly the time I've finished reading the book  Extraordinary Popular Delusions and the Madness of Crowds.

Shortly after I started shorting it. Good times.";-4;0;False;Citworker;ebwwqvr;Last Year & Today;a6o4sp;https://i.redd.it/vdeafl7obm421.jpg
Its because some of us are  exausted haha ! ;1;0;False;JD-007;ebx192j;Last Year & Today;a6o4sp;https://i.redd.it/vdeafl7obm421.jpg
k;0;0;False;;ebwnbgb;Last Year & Today;a6o4sp;https://i.redd.it/vdeafl7obm421.jpg
how did this take you so long?;3;1;False;allseeingike;ebwr4ds;Last Year & Today;a6o4sp;https://i.redd.it/vdeafl7obm421.jpg
Shut the fuck up and it’s spelled “Ethereum” you inbred piece of shit.;1;0;False;Starkgaryen69;ebwr2un;Last Year & Today;a6o4sp;https://i.redd.it/vdeafl7obm421.jpg
You sound bitter, please share your story with the group;2;1;False;plznokek;ebwnpwz;Last Year & Today;a6o4sp;https://i.redd.it/vdeafl7obm421.jpg
Lol hodl nothing. I even sniff getting back to break even I'm out forever. Eff bitcoin ;5;0;False;xxPOOTYxx;ebxu0c6;Last Year & Today;a6o4sp;https://i.redd.it/vdeafl7obm421.jpg
"IMO if you sell at 40k, you are probably missing out on the biggest gains, but a win is a win.  

If BTC ever manages to get to 20k (I’m betting it will, but maybe 5 years from now), then it will reach close to 500k once the fomo and hysteria sets in, and then crash back down to 50k or so, but that’s years and years in the future if it happens at all ";0;1;False;schwagnificent;ebxreo6;Last Year & Today;a6o4sp;https://i.redd.it/vdeafl7obm421.jpg
Oh, no. I didn't exit at this point. Like so many others, I got suckered in by FOMO a week or so earlier, after weeks of shaking my head in disbelief at the way the price was skyrocketing. I only invested what I was willing to lose, so I'm down something like 76%. That's why I said fond memories, lol.;151;3;False;mhj360;ebwqekr;Last Year & Today;a6o4sp;https://i.redd.it/vdeafl7obm421.jpg
They think the cycle ends with them because ego.;6;0;False;Explodicle;ebww7jc;Last Year & Today;a6o4sp;https://i.redd.it/vdeafl7obm421.jpg
How has the dollar performed against gold over the past year? How has bitcoin? Asking for science. ;18;1;False;;ebwxuku;Last Year & Today;a6o4sp;https://i.redd.it/vdeafl7obm421.jpg
It only looks like hope to the uninformed.  If you accurately understand monetary economics you would see it as an absolute certainty ;-34;6;False;ztsmart;ebx88vf;Last Year & Today;a6o4sp;https://i.redd.it/vdeafl7obm421.jpg
"Hell yeah. Really glad I pulled when I did. I would not be happy about the current state. I profited by a huge margin because I sold when I felt it peaked. (Bought in at 3k. Sold when I think it was around 21k(?) on coinbase)

I know HODL is life. But hey, I'm happy with my choice!";8;1;False;Mickeystix;ebx6p10;Last Year & Today;a6o4sp;https://i.redd.it/vdeafl7obm421.jpg
Say that to the dude who's using his miners instead of his radiators to heat up his house...;1;0;False;Breadynator;ebwx5j9;Last Year & Today;a6o4sp;https://i.redd.it/vdeafl7obm421.jpg
"I have never said that fiat is better than BTC or crypto in general.

You're completely missing the point of my comment.";0;1;False;Breadynator;ebwnjd1;Last Year & Today;a6o4sp;https://i.redd.it/vdeafl7obm421.jpg
Every new ATH bring a lot more new people to bitcoin. They don't know the cycles.;15;2;False;HammahHead;ebx2cvt;Last Year & Today;a6o4sp;https://i.redd.it/vdeafl7obm421.jpg
[deleted];26;1;False;;ebwo27c;Last Year & Today;a6o4sp;https://i.redd.it/vdeafl7obm421.jpg
@pjf, \*sighs\*;-2;1;False;;ebwn3fq;Last Year & Today;a6o4sp;https://i.redd.it/vdeafl7obm421.jpg
should we ICO?;6;1;False;sreaka;ebx64n9;Last Year & Today;a6o4sp;https://i.redd.it/vdeafl7obm421.jpg
Electric cars use more waste and energy to be produced then a regular car, electricity is beeing made by burning up coal most of all, and the giant batteries of electric cars cannot be recycled, are poison and a environmental disaster. Dont fall for the electric cars and batteries lobby propaganda.;-5;1;False;Geoku11;ebwr8q4;Last Year & Today;a6o4sp;https://i.redd.it/vdeafl7obm421.jpg
That papa ain't nothing but paypa;5;0;False;Fecalityy;ebx3ne5;Last Year & Today;a6o4sp;https://i.redd.it/vdeafl7obm421.jpg
it never hit 21k on coinbase;11;1;False;proggi1g;ebxohpg;Last Year & Today;a6o4sp;https://i.redd.it/vdeafl7obm421.jpg
[removed];1;0;False;;ebx0qo9;Last Year & Today;a6o4sp;https://i.redd.it/vdeafl7obm421.jpg
Shit if I made enough money off the ride up I'd buy one of those trips to to moon ;1;0;False;Hodl2Moon;ebww6up;Last Year & Today;a6o4sp;https://i.redd.it/vdeafl7obm421.jpg
"I paddled in the ocean and didn't see any fish, that must mean there are no fish in the ocean.

Do some research, Japan is the most progressive crypto accepting countries in the world. Moreso as time goes on";-3;1;False;Tinseltopia;ebx2nq3;Last Year & Today;a6o4sp;https://i.redd.it/vdeafl7obm421.jpg
"Is bitcoin the “gold standard”?

That’s not saying it’s the best, because neither is actual gold. But if that’s just the accepted standard, it takes a lot to convince everyone it doesn’t have the value they want it to. ";3;1;False;03Titanium;ebwtgzp;Last Year & Today;a6o4sp;https://i.redd.it/vdeafl7obm421.jpg
Tesla is a manufacturer ;2;1;False;ztsmart;ebx5ekv;Last Year & Today;a6o4sp;https://i.redd.it/vdeafl7obm421.jpg
Well you did;0;0;False;JD-007;ebwss4j;Last Year & Today;a6o4sp;https://i.redd.it/vdeafl7obm421.jpg
hahaha :'(;22;0;False;veryhornyretard;ebwx5ly;Last Year & Today;a6o4sp;https://i.redd.it/vdeafl7obm421.jpg
Thanks, that’s what I meant haha;4;0;False;BrunoNFL;ebwpg61;Last Year & Today;a6o4sp;https://i.redd.it/vdeafl7obm421.jpg
Uh... tell that to the Holy Roman Empire;31;0;False;XTC-FTW;ebx8ekd;Last Year & Today;a6o4sp;https://i.redd.it/vdeafl7obm421.jpg
Problem is, these predictions are based on just hope.;27;1;False;Thanamite;ebx6cnr;Last Year & Today;a6o4sp;https://i.redd.it/vdeafl7obm421.jpg
Cool! Nice bit of trivia I missed, thanks!;1;0;False;BrunoNFL;ebwpham;Last Year & Today;a6o4sp;https://i.redd.it/vdeafl7obm421.jpg
Anyone accepting dollars must be really dumb.;-5;1;False;Polak_Potrafi;ebwpaet;Last Year & Today;a6o4sp;https://i.redd.it/vdeafl7obm421.jpg
This kind of mentality is what keeps destroying our world;3;1;False;Breadynator;ebwss0j;Last Year & Today;a6o4sp;https://i.redd.it/vdeafl7obm421.jpg
"> Have you heard the sound of a V10 engine? 

😂";2;0;False;WolfOfFusion;ebx2ygk;Last Year & Today;a6o4sp;https://i.redd.it/vdeafl7obm421.jpg
I think so, yeah. I would love a trip to the moon.;4;1;False;Breadynator;ebwni5l;Last Year & Today;a6o4sp;https://i.redd.it/vdeafl7obm421.jpg
Yea I think pretty much only the US uses that format. ;5;2;False;BonaFidee;ebxuw8a;Last Year & Today;a6o4sp;https://i.redd.it/vdeafl7obm421.jpg
Proud;2;0;False;iHicham;ebx2hcm;Last Year & Today;a6o4sp;https://i.redd.it/vdeafl7obm421.jpg
Obviously there is no such thing as standard in crypto world.;0;0;False;thelazarusledd;ebwxl0x;Last Year & Today;a6o4sp;https://i.redd.it/vdeafl7obm421.jpg
Japanese Olympics the new Chinese New Year.;37;0;False;Geoku11;ebwrcb5;Last Year & Today;a6o4sp;https://i.redd.it/vdeafl7obm421.jpg
That's not true at all I didn't see one shop accepting bitcoin in Japan.;13;1;False;lonmoer;ebx1y3b;Last Year & Today;a6o4sp;https://i.redd.it/vdeafl7obm421.jpg
If most shops accepted it then i would've seen it at least once and i was actively looking for it. Reals before feels.;19;0;False;lonmoer;ebx3isb;Last Year & Today;a6o4sp;https://i.redd.it/vdeafl7obm421.jpg
Correct !;3;0;False;JD-007;ebwp2bc;Last Year & Today;a6o4sp;https://i.redd.it/vdeafl7obm421.jpg
Why are you so sure that even if crypto becomes future that bitcoin will survive? So many people are sure crypto is future and thats why they own bitcoin but they never think about is bitcoin in cryptos future or already in cryptos past.;8;1;False;thelazarusledd;ebwpa1t;Last Year & Today;a6o4sp;https://i.redd.it/vdeafl7obm421.jpg
"Hence the ? 

I pulled out and never looked back. (there's a joke in that sentence somewhere)";3;1;False;Mickeystix;ebxojfy;Last Year & Today;a6o4sp;https://i.redd.it/vdeafl7obm421.jpg
Possibly true, but some of us will not be around in 20 years time. So I exchanged 1.5 BTC for 50 sovs at ~8500 GBP per BTC. Well and truly covered my initial investment and there are plenty of BTC left, just in case it doesn't all go to zero!;3;0;False;GREY_SOX;ebwp5ch;Last Year & Today;a6o4sp;https://i.redd.it/vdeafl7obm421.jpg
[deleted];-1;1;False;;ebwrflu;Last Year & Today;a6o4sp;https://i.redd.it/vdeafl7obm421.jpg
Yeah true I’m hoping it’s in the next 10 years lol;1;0;False;lew-yy;ebxsytp;Last Year & Today;a6o4sp;https://i.redd.it/vdeafl7obm421.jpg
"Well...  let me tell you one thing

You are still in a list of  EARLY ADOPTERS  some where ...  HODL  my Friend ";39;2;False;JD-007;ebwtplu;Last Year & Today;a6o4sp;https://i.redd.it/vdeafl7obm421.jpg
What once was will be again ;17;5;False;ztsmart;ebx55cn;Last Year & Today;a6o4sp;https://i.redd.it/vdeafl7obm421.jpg
"God damn talk about that FOMO huh?

My older brother convinced me to finally bite the bullet. He had been making serious gains with ETH and BTC so I followed suit and sunk.in a few hundred bones. That next week my BTC cleared and the value has dropped ever since";4;0;False;Starshiee;ebx3fbs;Last Year & Today;a6o4sp;https://i.redd.it/vdeafl7obm421.jpg
">	should we ICO?

Nah. Nobody uses ICQ anymore :)";2;1;False;NotSoGreatGonzo;ebxc30g;Last Year & Today;a6o4sp;https://i.redd.it/vdeafl7obm421.jpg
You only got to do a bit of research instead of FUD ing your way round shitting the place up;6;2;False;pjf72;ebwn5c5;Last Year & Today;a6o4sp;https://i.redd.it/vdeafl7obm421.jpg
The horror 🙄;1;0;False;Atlas_84;ebxpr2k;Last Year & Today;a6o4sp;https://i.redd.it/vdeafl7obm421.jpg
[deleted];10;1;False;;ebx5p7v;Last Year & Today;a6o4sp;https://i.redd.it/vdeafl7obm421.jpg
[deleted];3;1;False;;ebwpeeu;Last Year & Today;a6o4sp;https://i.redd.it/vdeafl7obm421.jpg
"I think you mean the first dealership—no car manufacturer would accept Bitcoin as payment. They're not dumb.

And the dealerships don't expose themselves to the market, they use a payment processor like BitPay who sends them dollars.";8;3;False;Jonath198;ebwp22r;Last Year & Today;a6o4sp;https://i.redd.it/vdeafl7obm421.jpg
Stick to the plan, rather than go mental.;16;0;False;Polak_Potrafi;ebwp4n6;Last Year & Today;a6o4sp;https://i.redd.it/vdeafl7obm421.jpg
Good;3;1;False;JD-007;ebwup5z;Last Year & Today;a6o4sp;https://i.redd.it/vdeafl7obm421.jpg
Mine got stolen in a shitty exchange.;6;0;False;homeworld;ebwnpkh;Last Year & Today;a6o4sp;https://i.redd.it/vdeafl7obm421.jpg
It’s all gone;1;0;False;Sil5286;ebxcu60;Last Year & Today;a6o4sp;https://i.redd.it/vdeafl7obm421.jpg
So now that we are certain Bitcoin isn't going up long term, I'm sure every one of you is still going to hold and buy more right? After all, you're supposed to buy low and sell high, according to the armchair hedge fund traders here on the BTC subreddit.;3;2;False;WRCREX;ebwv6kg;Last Year & Today;a6o4sp;https://i.redd.it/vdeafl7obm421.jpg
*jolly christmas songs playing in the background**;1;0;False;Starkgaryen69;ebwr11t;Last Year & Today;a6o4sp;https://i.redd.it/vdeafl7obm421.jpg
Jean!!!! Scott!!! Jean!!! Scott!!!;1;0;False;slaiyfer;ebwseo1;Last Year & Today;a6o4sp;https://i.redd.it/vdeafl7obm421.jpg
"Should have sold somewhere between $15k and then

Greed costed you at least triple the amount of coins in the obviously approaching bubble popping";1;0;False;Tehmaxx;ebwxtoj;Last Year & Today;a6o4sp;https://i.redd.it/vdeafl7obm421.jpg
I remember.;1;0;False;BlkMoneyDOTcom;ebx1xuo;Last Year & Today;a6o4sp;https://i.redd.it/vdeafl7obm421.jpg
I love you Wolverine, never forget.;1;0;False;sreaka;ebx5v8z;Last Year & Today;a6o4sp;https://i.redd.it/vdeafl7obm421.jpg
F;1;0;False;Meat__Stick;ebx96h8;Last Year & Today;a6o4sp;https://i.redd.it/vdeafl7obm421.jpg
I can't believe it's been a year!;1;0;False;justhodlit_net;ebxs0s1;Last Year & Today;a6o4sp;https://i.redd.it/vdeafl7obm421.jpg
"I remember watching the price skip through 2k like nothing in class and losing my shit


$5 to like 50 was cool
";1;0;False;Vladamirski;ebxsteg;Last Year & Today;a6o4sp;https://i.redd.it/vdeafl7obm421.jpg
Second birthday here... Sure is been a ride... ;1;0;False;loloknight;ebxvznd;Last Year & Today;a6o4sp;https://i.redd.it/vdeafl7obm421.jpg
"still in profit compared to the start, sure

&#x200B;

75% down since its peak this time last year.";3;0;False;forallmyfans2;ebx3te8;Last Year & Today;a6o4sp;https://i.redd.it/vdeafl7obm421.jpg
Still in profit here.;5;0;False;TrymWS;ebwtje8;Last Year & Today;a6o4sp;https://i.redd.it/vdeafl7obm421.jpg
The correct format is 12/17 *runs away*;0;1;False;sreaka;ebx60za;Last Year & Today;a6o4sp;https://i.redd.it/vdeafl7obm421.jpg
Lol, regional markets. Autarky. What is this ? 19th century? It is vexing that religions like autarky on one hand and communism on the other are still en vogue. Granted only uneducated or stupid people can believe that inefficiency is a good thing that we should strive for, but apparently there is a lot of you...;1;1;False;Steven81;ebx7okg;Last Year & Today;a6o4sp;https://i.redd.it/vdeafl7obm421.jpg
This is good for bitcoin. ;1;0;False;;ebwx43s;Last Year & Today;a6o4sp;https://i.redd.it/vdeafl7obm421.jpg
"What’s up with people putting the $ after the number lately? I’ve been seeing it a lot for some reason.

Edit: stupid autocorrect";1;2;False;TwoTinyTrees;ebx1375;Last Year & Today;a6o4sp;https://i.redd.it/vdeafl7obm421.jpg
"A) why would I lie? That seems like a really stupid and tedious thing to lie about. 
B) that's cool, I don't need your belief. I have my house and my wedding was essentially free. 

Best of luck!";-3;2;False;Mickeystix;ebxtrqc;Last Year & Today;a6o4sp;https://i.redd.it/vdeafl7obm421.jpg
[deleted];3;3;False;;ebwwhjk;Last Year & Today;a6o4sp;https://i.redd.it/vdeafl7obm421.jpg
[deleted];2;1;False;;ebwtl7e;Last Year & Today;a6o4sp;https://i.redd.it/vdeafl7obm421.jpg
His expression accurately describes the whole range of emotions that overwhelms me. It’s my favorite character as well lol;2;0;False;IllustriousRace;ebxqfd4;Last Year & Today;a6o4sp;https://i.redd.it/vdeafl7obm421.jpg
One year already! Happy rektiversary!;2;0;False;sQtWLgK;ebx9khj;Last Year & Today;a6o4sp;https://i.redd.it/vdeafl7obm421.jpg
I had a friend doing a presentation on bitcoin while it was peaking. He ran a counter in the background so people could watch it shoot up while he was talking. Many people were impressed and a few bought in during the presentation. It started crashing minutes after he finished. ;367;8;False;GREENBANANAS99999;ebwss2v;Last Year & Today;a6o4sp;https://i.redd.it/vdeafl7obm421.jpg
This year is a complete opposite of the scenario last year. ;39;2;False;sleepycryup;ebwob0e;Last Year & Today;a6o4sp;https://i.redd.it/vdeafl7obm421.jpg
is today the anniversary of the ATH?;58;2;False;Motor-boat;ebwjhaq;Last Year & Today;a6o4sp;https://i.redd.it/vdeafl7obm421.jpg
Can I just hibernate until the next bull run ? Or be put in cryosleep ?;37;3;False;romjpn;ebwmhcy;Last Year & Today;a6o4sp;https://i.redd.it/vdeafl7obm421.jpg
[deleted];39;3;False;;ebwxaiq;Last Year & Today;a6o4sp;https://i.redd.it/vdeafl7obm421.jpg
"RIP Bitcoin you will be missed......

&#x200B;

\*two to three years later\*

&#x200B;

&#x200B;

LAMBO MOON, INSTITUTIONAL INVESTORS PUMP BTC TO ATH. 1 million dollar lambo Bitcoin.

&#x200B;

&#x200B;

\*starts daydreaming\*    sigh....";46;1;False;;ebwlwo5;Last Year & Today;a6o4sp;https://i.redd.it/vdeafl7obm421.jpg
I bought 2k worth of coin on that day. Thanks but I’d rather forget. ;12;0;False;ftwin;ebwxj1v;Last Year & Today;a6o4sp;https://i.redd.it/vdeafl7obm421.jpg
"Last year, I sold at the ATH and paid for my wedding on the 22nd of December and a home. 

For those still in the trenches...god speed, and good luck. ";27;1;False;Mickeystix;ebx6dyx;Last Year & Today;a6o4sp;https://i.redd.it/vdeafl7obm421.jpg
"don't worry buddy. it will go up again, and hopefully even higher ;-)";0;0;False;truadr;ebwuhr2;Last Year & Today;a6o4sp;https://i.redd.it/vdeafl7obm421.jpg
......aaaaaaanndd its gone.;17;1;False;Geoku11;ebwrgvx;Last Year & Today;a6o4sp;https://i.redd.it/vdeafl7obm421.jpg
ah yeah that price bought me a living room set;6;1;False;notyourbrah;ebwufoo;Last Year & Today;a6o4sp;https://i.redd.it/vdeafl7obm421.jpg
"Why i did not sell back then??! 
Human greed...
How many of you guys feel the bad taste when thinking of this ?";52;5;False;alynaE11;ebwl9gj;Last Year & Today;a6o4sp;https://i.redd.it/vdeafl7obm421.jpg
"It's worse, actually.

On the long-run charts the top looks like $19,821 but plenty of Bitcoin were bought and sold over $20,000.  The long-run graphs have to compress the data down to fit, and the peaks and troughs are taken out. ";20;1;False;TomasTTEngin;ebwnj6c;Last Year & Today;a6o4sp;https://i.redd.it/vdeafl7obm421.jpg
"Remember that Bitcoin drop to 16k in January, and thought ""looks like a good idea to sell like 1.5k, just in case of emergency"", sadly was on vacation so when have to chance to sell the dump was already happening(first fall to 6k). 

But only regret on not buying a trezor at 20k and avoid using my own money :(";8;0;False;relgueta;ebwwtqd;Last Year & Today;a6o4sp;https://i.redd.it/vdeafl7obm421.jpg
I’m out of the loop. Why did Bitcoin tank?;3;1;False;piclemaniscool;ebwvusx;Last Year & Today;a6o4sp;https://i.redd.it/vdeafl7obm421.jpg
The price dropped this year? No shit.;3;0;False;ebaley;ebww0v2;Last Year & Today;a6o4sp;https://i.redd.it/vdeafl7obm421.jpg
Just made my own snapshot of the 1-year graph. Going to print it up on the color printer at work tomorrow and frame it. ;3;0;False;ivebeenhereallsummer;ebx4jct;Last Year & Today;a6o4sp;https://i.redd.it/vdeafl7obm421.jpg
And IIIIIIIIIIeIIIIIIIIIIIIeIIIIIIIIIIII willll allways Loooooooooooooovve yooouuuuuUuuuuuuuuuuUUuUuuuu!;8;0;False;;ebwpcym;Last Year & Today;a6o4sp;https://i.redd.it/vdeafl7obm421.jpg
17/12 never forget;8;1;False;AmazingShivansh;ebwswa3;Last Year & Today;a6o4sp;https://i.redd.it/vdeafl7obm421.jpg
"Exactly the time I've finished reading the book  Extraordinary Popular Delusions and the Madness of Crowds.

Shortly after I started shorting it. Good times.";-1;0;False;Citworker;ebwwpf1;Last Year & Today;a6o4sp;https://i.redd.it/vdeafl7obm421.jpg
Ah yes, nationalism! That totally aligns with crypto becoming viable a viable currency accepted around the world... Not. T_D is leaking and the Nationalists want you back!;0;1;False;ElasticSpeakers;ebx3qoi;Last Year & Today;a6o4sp;https://i.redd.it/vdeafl7obm421.jpg
