body;score;nb_replies;stickied;author;id;post_title;post_id;post_link
How much BTC did the cake cost? Did the cake's taste hodl for long?;1;0;False;Tracy_93;dya9n8o;I took a trip with some friends to a sleepy rural town in Japan, hours outside of Tokyo. We entered a cafe and were surprised to see that they accepted bitcoin. Here is my friend buying a chocolate cake.;8fz2iz;https://v.redd.it/6ptl0ma9h1v01
"just be careful and not pay with replace by fee transaction. They will not accept the payment.
I am two months now with dozen of email with bitflyer and i not get until now my Bitcoin from a failed payment to Bic Camera akihabara store.";1;1;False;chek2fire;dy9x4ui;I took a trip with some friends to a sleepy rural town in Japan, hours outside of Tokyo. We entered a cafe and were surprised to see that they accepted bitcoin. Here is my friend buying a chocolate cake.;8fz2iz;https://v.redd.it/6ptl0ma9h1v01
That's awesome. I can't wait to see more of this stuff, especially in the UK.;1;0;False;papalazarou914;dy9jckf;I took a trip with some friends to a sleepy rural town in Japan, hours outside of Tokyo. We entered a cafe and were surprised to see that they accepted bitcoin. Here is my friend buying a chocolate cake.;8fz2iz;https://v.redd.it/6ptl0ma9h1v01
Eat it quick before Roger turns up and swaps the chocolate in the cake for cyanide or rat poison. The man is on a mission to trick Japan at the minute.;1;0;False;danielgoudie;dy9jcj2;I took a trip with some friends to a sleepy rural town in Japan, hours outside of Tokyo. We entered a cafe and were surprised to see that they accepted bitcoin. Here is my friend buying a chocolate cake.;8fz2iz;https://v.redd.it/6ptl0ma9h1v01
"No, lightning network itself works off chain.  

However to get on the lightning network you first have to open a lightning channel which is done on chain.  
Your lightning network channel will have a certain amount of bitcoin (the amount you put on there) on it and you can keep trading back and forth with other linked channels, including the ones the people you'r connected to are connected to and even the ones those people are connected to, etc.  
(So if you are connected to a well connected node you don't have to open other channels).  

The other time that lightning network comes back to being on-chain again is when you or the person/entity you'r connected to close the channel, this is when all the bitcoin in those channels goes to their respective owners on chain instead of off chain.";3;1;False;Snowaeth;dy8t2po;I took a trip with some friends to a sleepy rural town in Japan, hours outside of Tokyo. We entered a cafe and were surprised to see that they accepted bitcoin. Here is my friend buying a chocolate cake.;8fz2iz;https://v.redd.it/6ptl0ma9h1v01
That's about 6 € for a chocolate cake... a bit expensive, but probably normal price in Japan...;1;0;False;redd_tech;dy9dvt6;I took a trip with some friends to a sleepy rural town in Japan, hours outside of Tokyo. We entered a cafe and were surprised to see that they accepted bitcoin. Here is my friend buying a chocolate cake.;8fz2iz;https://v.redd.it/6ptl0ma9h1v01
"I saw many comments says that it’s not really paid with bitcoin because it’s off chain. However, I’d rather think that it’s like a metro card, people use cash to charge the card, it does not mean the payment by metro card is not using JPY. 
You made a small deposit to the exchange which is still on chain, then use the system built by the exchange, in order to smooth the whole process. ";1;0;False;Bitoyi;dy99tj3;I took a trip with some friends to a sleepy rural town in Japan, hours outside of Tokyo. We entered a cafe and were surprised to see that they accepted bitcoin. Here is my friend buying a chocolate cake.;8fz2iz;https://v.redd.it/6ptl0ma9h1v01
Transaction fees;1;0;False;wortath;dy97edv;I took a trip with some friends to a sleepy rural town in Japan, hours outside of Tokyo. We entered a cafe and were surprised to see that they accepted bitcoin. Here is my friend buying a chocolate cake.;8fz2iz;https://v.redd.it/6ptl0ma9h1v01
I really want to visit Japan ;1;0;False;Siegelman;dy96je7;I took a trip with some friends to a sleepy rural town in Japan, hours outside of Tokyo. We entered a cafe and were surprised to see that they accepted bitcoin. Here is my friend buying a chocolate cake.;8fz2iz;https://v.redd.it/6ptl0ma9h1v01
Ok so this transaction happened because of BitFlyer, not Bitcoin ... ;0;0;False;choose_your_own-;dy8stfi;I took a trip with some friends to a sleepy rural town in Japan, hours outside of Tokyo. We entered a cafe and were surprised to see that they accepted bitcoin. Here is my friend buying a chocolate cake.;8fz2iz;https://v.redd.it/6ptl0ma9h1v01
Those fees tho ;1;2;False;ThisGoldAintFree;dy94kk5;I took a trip with some friends to a sleepy rural town in Japan, hours outside of Tokyo. We entered a cafe and were surprised to see that they accepted bitcoin. Here is my friend buying a chocolate cake.;8fz2iz;https://v.redd.it/6ptl0ma9h1v01
That's great. i think the merchants on that place has the positive views how cryptocurrency is very important in the future. ;1;0;False;robinwindy;dy93tdk;I took a trip with some friends to a sleepy rural town in Japan, hours outside of Tokyo. We entered a cafe and were surprised to see that they accepted bitcoin. Here is my friend buying a chocolate cake.;8fz2iz;https://v.redd.it/6ptl0ma9h1v01
Why would someone accept something thats value is so unstable? Why would u pay for something with it when its so unstable? What if the bitcoin he spent on the  cake is worth 10 times as much next week what if its worth 10 times as less?;1;0;False;;dy90fri;I took a trip with some friends to a sleepy rural town in Japan, hours outside of Tokyo. We entered a cafe and were surprised to see that they accepted bitcoin. Here is my friend buying a chocolate cake.;8fz2iz;https://v.redd.it/6ptl0ma9h1v01
aaaanf a paper receipt....;1;0;False;cryptoradiologist;dy8zl9v;I took a trip with some friends to a sleepy rural town in Japan, hours outside of Tokyo. We entered a cafe and were surprised to see that they accepted bitcoin. Here is my friend buying a chocolate cake.;8fz2iz;https://v.redd.it/6ptl0ma9h1v01
"> likely

No";4;0;False;;dy8i86w;I took a trip with some friends to a sleepy rural town in Japan, hours outside of Tokyo. We entered a cafe and were surprised to see that they accepted bitcoin. Here is my friend buying a chocolate cake.;8fz2iz;https://v.redd.it/6ptl0ma9h1v01
Around 23 JPY. ;1;0;False;Bitoyi;dy99uj7;I took a trip with some friends to a sleepy rural town in Japan, hours outside of Tokyo. We entered a cafe and were surprised to see that they accepted bitcoin. Here is my friend buying a chocolate cake.;8fz2iz;https://v.redd.it/6ptl0ma9h1v01
Fees are cuurently 5-10 cents to get into the next block.;1;0;False;LouisOfTokyo;dy9doig;I took a trip with some friends to a sleepy rural town in Japan, hours outside of Tokyo. We entered a cafe and were surprised to see that they accepted bitcoin. Here is my friend buying a chocolate cake.;8fz2iz;https://v.redd.it/6ptl0ma9h1v01
"https://bitcoinfees.earn.com

1sat/byte **next** block = about 2cents
11sat/byte this block = about 22 cents";1;0;False;BlondFaith;dy980ua;I took a trip with some friends to a sleepy rural town in Japan, hours outside of Tokyo. We entered a cafe and were surprised to see that they accepted bitcoin. Here is my friend buying a chocolate cake.;8fz2iz;https://v.redd.it/6ptl0ma9h1v01
Only 130 bucks in that wallet? Come with me baby and I'll show you the way;-1;0;False;monkijuan;dy91r4u;I took a trip with some friends to a sleepy rural town in Japan, hours outside of Tokyo. We entered a cafe and were surprised to see that they accepted bitcoin. Here is my friend buying a chocolate cake.;8fz2iz;https://v.redd.it/6ptl0ma9h1v01
"And bitcoin she spent on that chocolate cake would now be worth $2500USD.  Shoulda hodled! Expensive cake! 
/jk ppl";0;0;False;ProgrammaticProgram;dy93uja;I took a trip with some friends to a sleepy rural town in Japan, hours outside of Tokyo. We entered a cafe and were surprised to see that they accepted bitcoin. Here is my friend buying a chocolate cake.;8fz2iz;https://v.redd.it/6ptl0ma9h1v01
Not bcash? 😂;0;0;False;HenryK81;dy8yh2s;I took a trip with some friends to a sleepy rural town in Japan, hours outside of Tokyo. We entered a cafe and were surprised to see that they accepted bitcoin. Here is my friend buying a chocolate cake.;8fz2iz;https://v.redd.it/6ptl0ma9h1v01
In Portugal we have MBWay, it's the same principle but it's associated with your credit or debit card.;0;0;False;NukeWifeGuy;dy8pohn;I took a trip with some friends to a sleepy rural town in Japan, hours outside of Tokyo. We entered a cafe and were surprised to see that they accepted bitcoin. Here is my friend buying a chocolate cake.;8fz2iz;https://v.redd.it/6ptl0ma9h1v01
Probably had a transaction fee equal to the price of the cake;0;0;False;gars_inside;dy8miwx;I took a trip with some friends to a sleepy rural town in Japan, hours outside of Tokyo. We entered a cafe and were surprised to see that they accepted bitcoin. Here is my friend buying a chocolate cake.;8fz2iz;https://v.redd.it/6ptl0ma9h1v01
Read that out loud with the Bitconnect guy's voice, fun guaranteed.;1;0;False;Dataeum;dy9d71a;I took a trip with some friends to a sleepy rural town in Japan, hours outside of Tokyo. We entered a cafe and were surprised to see that they accepted bitcoin. Here is my friend buying a chocolate cake.;8fz2iz;https://v.redd.it/6ptl0ma9h1v01
And what a steal! A $6 slice of cake that'll end up costing him 22¢!;1;0;False;yourbrotherrex;dy9zwpc;I took a trip with some friends to a sleepy rural town in Japan, hours outside of Tokyo. We entered a cafe and were surprised to see that they accepted bitcoin. Here is my friend buying a chocolate cake.;8fz2iz;https://v.redd.it/6ptl0ma9h1v01
You can do that but Bitflyer merchants accept 0 conf payments. I've done it on a number of occasions. Once I accidentally sent an rbf enabled transaction though they did not like that one bit.;1;0;False;Bitcoin_Acolyte;dy9bq7n;I took a trip with some friends to a sleepy rural town in Japan, hours outside of Tokyo. We entered a cafe and were surprised to see that they accepted bitcoin. Here is my friend buying a chocolate cake.;8fz2iz;https://v.redd.it/6ptl0ma9h1v01
Tbh I think it is quite reasonable that confirmations aren't needed to buy a piece of cake, as long as there is some sensibility check of the fee added.;1;0;False;eothred;dy8mzgq;I took a trip with some friends to a sleepy rural town in Japan, hours outside of Tokyo. We entered a cafe and were surprised to see that they accepted bitcoin. Here is my friend buying a chocolate cake.;8fz2iz;https://v.redd.it/6ptl0ma9h1v01
Why do you think it is a lie?;1;0;False;robinwindy;dy94oeq;I took a trip with some friends to a sleepy rural town in Japan, hours outside of Tokyo. We entered a cafe and were surprised to see that they accepted bitcoin. Here is my friend buying a chocolate cake.;8fz2iz;https://v.redd.it/6ptl0ma9h1v01
Checking the GPS on the photos I took and retracing my steps on Google Street View, I figured out that it was [Mahollo Cafe](http://www.chichibu-lab.jp/index.php/shop/mahollo-cafe/),  inside a place called [Chichibu Omotesando Lab](http://www.chichibu-lab.jp), in the town of Chichibu.;3;1;False;LouisOfTokyo;dy8pdru;I took a trip with some friends to a sleepy rural town in Japan, hours outside of Tokyo. We entered a cafe and were surprised to see that they accepted bitcoin. Here is my friend buying a chocolate cake.;8fz2iz;https://v.redd.it/6ptl0ma9h1v01
"Maybe You need further studies how bitcoin works in the market and how adoption will bring to his ATH sooner or later
";-2;0;False;robinwindy;dy94qkh;I took a trip with some friends to a sleepy rural town in Japan, hours outside of Tokyo. We entered a cafe and were surprised to see that they accepted bitcoin. Here is my friend buying a chocolate cake.;8fz2iz;https://v.redd.it/6ptl0ma9h1v01
"http://www.chichibu-lab.jp/index.php/shop/mahollo-cafe/

Ctrl+F for ガトーショコラ";2;1;False;LouisOfTokyo;dy8pgph;I took a trip with some friends to a sleepy rural town in Japan, hours outside of Tokyo. We entered a cafe and were surprised to see that they accepted bitcoin. Here is my friend buying a chocolate cake.;8fz2iz;https://v.redd.it/6ptl0ma9h1v01
You're right. They say it's huge in Japan, but I live in Tokyo and there's only a handful of places you can pay with crypto. ;2;1;False;deselby_III;dy8vvph;I took a trip with some friends to a sleepy rural town in Japan, hours outside of Tokyo. We entered a cafe and were surprised to see that they accepted bitcoin. Here is my friend buying a chocolate cake.;8fz2iz;https://v.redd.it/6ptl0ma9h1v01
Nothing, as far as I'm aware, because it's not on-chain. But I made an on-chain transaction later that day with a 7 cent fee which confirmed in 2 minutes.;1;1;False;LouisOfTokyo;dy9dn1j;I took a trip with some friends to a sleepy rural town in Japan, hours outside of Tokyo. We entered a cafe and were surprised to see that they accepted bitcoin. Here is my friend buying a chocolate cake.;8fz2iz;https://v.redd.it/6ptl0ma9h1v01
https://www.reddit.com/r/Bitcoin/comments/8fz2iz/i_took_a_trip_with_some_friends_to_a_sleepy_rural/dy8pdru/;1;1;False;LouisOfTokyo;dy8pjid;I took a trip with some friends to a sleepy rural town in Japan, hours outside of Tokyo. We entered a cafe and were surprised to see that they accepted bitcoin. Here is my friend buying a chocolate cake.;8fz2iz;https://v.redd.it/6ptl0ma9h1v01
In rural Australia, you’d be hard pressed to find a place that would even take $50’s without giving you a dirty look. (Context: Aus has a problem with counterfeits and is behind in tech.);1;0;False;Mavreck;dy8sgj5;I took a trip with some friends to a sleepy rural town in Japan, hours outside of Tokyo. We entered a cafe and were surprised to see that they accepted bitcoin. Here is my friend buying a chocolate cake.;8fz2iz;https://v.redd.it/6ptl0ma9h1v01
In *some* parts of the world. Us that are privileged often forget that.;6;0;False;maxbjaevermose;dy8vvk2;I took a trip with some friends to a sleepy rural town in Japan, hours outside of Tokyo. We entered a cafe and were surprised to see that they accepted bitcoin. Here is my friend buying a chocolate cake.;8fz2iz;https://v.redd.it/6ptl0ma9h1v01
Hmm, so if I go to this coffee shop tomorrow will I be able to pay with a regular mobile wallet not affiliated with BitFlyer?;1;0;False;deselby_III;dy8vqb2;I took a trip with some friends to a sleepy rural town in Japan, hours outside of Tokyo. We entered a cafe and were surprised to see that they accepted bitcoin. Here is my friend buying a chocolate cake.;8fz2iz;https://v.redd.it/6ptl0ma9h1v01
"Or you send the BTC you sent to the store to yourself. This is called a double spend and has always been possible and is now an official feature of Bitcoin, so that you can change the miner fees associated with the transaction in the case that no miner is picking it up.
";2;0;False;Siecje1;dy8oze1;I took a trip with some friends to a sleepy rural town in Japan, hours outside of Tokyo. We entered a cafe and were surprised to see that they accepted bitcoin. Here is my friend buying a chocolate cake.;8fz2iz;https://v.redd.it/6ptl0ma9h1v01
No, like paying with Bitcoin with Bitflyer. ;1;0;False;grinnersaok;dy9c2bd;I took a trip with some friends to a sleepy rural town in Japan, hours outside of Tokyo. We entered a cafe and were surprised to see that they accepted bitcoin. Here is my friend buying a chocolate cake.;8fz2iz;https://v.redd.it/6ptl0ma9h1v01
All of those legal transactions added to the invalid block just go back into the mempool and will be picked up in the next block.  They're not lost at all;2;1;False;enigmapulse;dy8jr3h;I took a trip with some friends to a sleepy rural town in Japan, hours outside of Tokyo. We entered a cafe and were surprised to see that they accepted bitcoin. Here is my friend buying a chocolate cake.;8fz2iz;https://v.redd.it/6ptl0ma9h1v01
I think that was quite less. I like the innovator to this process;1;0;False;robinwindy;dy94n81;I took a trip with some friends to a sleepy rural town in Japan, hours outside of Tokyo. We entered a cafe and were surprised to see that they accepted bitcoin. Here is my friend buying a chocolate cake.;8fz2iz;https://v.redd.it/6ptl0ma9h1v01
Chichibu.;1;1;False;LouisOfTokyo;dy8ssvq;I took a trip with some friends to a sleepy rural town in Japan, hours outside of Tokyo. We entered a cafe and were surprised to see that they accepted bitcoin. Here is my friend buying a chocolate cake.;8fz2iz;https://v.redd.it/6ptl0ma9h1v01
"How much did that transaction cost you?

";2;1;False;btcftw1;dy9d89v;I took a trip with some friends to a sleepy rural town in Japan, hours outside of Tokyo. We entered a cafe and were surprised to see that they accepted bitcoin. Here is my friend buying a chocolate cake.;8fz2iz;https://v.redd.it/6ptl0ma9h1v01
"Yup.

There's a pic going around of some dude who spent thousands or hundreds of BTC on weed and another one on wine when BTC was cheap.

Must hurt to go back and see those transactions.";3;0;False;BlackCamaro;dy8nkab;I took a trip with some friends to a sleepy rural town in Japan, hours outside of Tokyo. We entered a cafe and were surprised to see that they accepted bitcoin. Here is my friend buying a chocolate cake.;8fz2iz;https://v.redd.it/6ptl0ma9h1v01
Just, buy back $3 of btc on the dip. If we just hodl and not spend, then it’ll be worthless one day.;1;0;False;HenryK81;dy8yld6;I took a trip with some friends to a sleepy rural town in Japan, hours outside of Tokyo. We entered a cafe and were surprised to see that they accepted bitcoin. Here is my friend buying a chocolate cake.;8fz2iz;https://v.redd.it/6ptl0ma9h1v01
No. Writing a cheque ;1;0;False;GaryHarrisEsquire;dy9ae0i;I took a trip with some friends to a sleepy rural town in Japan, hours outside of Tokyo. We entered a cafe and were surprised to see that they accepted bitcoin. Here is my friend buying a chocolate cake.;8fz2iz;https://v.redd.it/6ptl0ma9h1v01
This is called the progressive society ;2;0;False;imrgoyal;dy96osz;I took a trip with some friends to a sleepy rural town in Japan, hours outside of Tokyo. We entered a cafe and were surprised to see that they accepted bitcoin. Here is my friend buying a chocolate cake.;8fz2iz;https://v.redd.it/6ptl0ma9h1v01
sugoiii!;2;0;False;daijorobu;dy8ps49;I took a trip with some friends to a sleepy rural town in Japan, hours outside of Tokyo. We entered a cafe and were surprised to see that they accepted bitcoin. Here is my friend buying a chocolate cake.;8fz2iz;https://v.redd.it/6ptl0ma9h1v01
I have been in Japan and seen only one billboard with bitcoin on it. People saying it is huge in Asia - there is no visible effect of it. Never saw a restaurant or a sign or a poster beyond the one billboard. Just so people know.;2;1;False;Keats_in_rome;dy8l9eh;I took a trip with some friends to a sleepy rural town in Japan, hours outside of Tokyo. We entered a cafe and were surprised to see that they accepted bitcoin. Here is my friend buying a chocolate cake.;8fz2iz;https://v.redd.it/6ptl0ma9h1v01
So basically they didn’t pay with bitcoin at all.;2;1;False;newprofile15;dy8jgva;I took a trip with some friends to a sleepy rural town in Japan, hours outside of Tokyo. We entered a cafe and were surprised to see that they accepted bitcoin. Here is my friend buying a chocolate cake.;8fz2iz;https://v.redd.it/6ptl0ma9h1v01
What does hopefully mean? It's not 100% confirmed?;1;0;False;abedfilms;dy8x4bm;I took a trip with some friends to a sleepy rural town in Japan, hours outside of Tokyo. We entered a cafe and were surprised to see that they accepted bitcoin. Here is my friend buying a chocolate cake.;8fz2iz;https://v.redd.it/6ptl0ma9h1v01
How about using LN. Are they there yet? ;1;0;False;cyborgene;dy9b6u5;I took a trip with some friends to a sleepy rural town in Japan, hours outside of Tokyo. We entered a cafe and were surprised to see that they accepted bitcoin. Here is my friend buying a chocolate cake.;8fz2iz;https://v.redd.it/6ptl0ma9h1v01
But she did, she gave up on a claim of a certain amount of bitcoin and gave this claim to the shop.;4;1;False;xithy;dy8jqpb;I took a trip with some friends to a sleepy rural town in Japan, hours outside of Tokyo. We entered a cafe and were surprised to see that they accepted bitcoin. Here is my friend buying a chocolate cake.;8fz2iz;https://v.redd.it/6ptl0ma9h1v01
The idea is to just replace what you spent in btc. That way more btc transactions for everyone;5;1;False;;dy8oely;I took a trip with some friends to a sleepy rural town in Japan, hours outside of Tokyo. We entered a cafe and were surprised to see that they accepted bitcoin. Here is my friend buying a chocolate cake.;8fz2iz;https://v.redd.it/6ptl0ma9h1v01
The reason why this transaction happened is because both people used bitFly. So this is really not different from Visa or any other payments processor then. Sorry to be a downer.;2;0;False;choose_your_own-;dy8srir;I took a trip with some friends to a sleepy rural town in Japan, hours outside of Tokyo. We entered a cafe and were surprised to see that they accepted bitcoin. Here is my friend buying a chocolate cake.;8fz2iz;https://v.redd.it/6ptl0ma9h1v01
thats awesome lol soon it'll be everywhere!!;1;0;False;Coffeeandice88;dy8vcjh;I took a trip with some friends to a sleepy rural town in Japan, hours outside of Tokyo. We entered a cafe and were surprised to see that they accepted bitcoin. Here is my friend buying a chocolate cake.;8fz2iz;https://v.redd.it/6ptl0ma9h1v01
Thank you;1;0;False;downquark5;dy8ttvl;I took a trip with some friends to a sleepy rural town in Japan, hours outside of Tokyo. We entered a cafe and were surprised to see that they accepted bitcoin. Here is my friend buying a chocolate cake.;8fz2iz;https://v.redd.it/6ptl0ma9h1v01
is that a free transaction?;1;0;False;sexyama;dy9a8bs;I took a trip with some friends to a sleepy rural town in Japan, hours outside of Tokyo. We entered a cafe and were surprised to see that they accepted bitcoin. Here is my friend buying a chocolate cake.;8fz2iz;https://v.redd.it/6ptl0ma9h1v01
Last time I bought with bitcoin was November. I was charged the equivalent of $20 miner fees to move bitcoin to anotjer wallet and then for the purchase. Is the fees still high or did they lower them?;1;0;False;ThugExplainBot;dy8u3vt;I took a trip with some friends to a sleepy rural town in Japan, hours outside of Tokyo. We entered a cafe and were surprised to see that they accepted bitcoin. Here is my friend buying a chocolate cake.;8fz2iz;https://v.redd.it/6ptl0ma9h1v01
We just added several ATMs to the small city in the Midwest I'm from;1;0;False;Esoterimix;dy8p02k;I took a trip with some friends to a sleepy rural town in Japan, hours outside of Tokyo. We entered a cafe and were surprised to see that they accepted bitcoin. Here is my friend buying a chocolate cake.;8fz2iz;https://v.redd.it/6ptl0ma9h1v01
Times, they are a changing....;1;0;False;bitmora;dy8o0uz;I took a trip with some friends to a sleepy rural town in Japan, hours outside of Tokyo. We entered a cafe and were surprised to see that they accepted bitcoin. Here is my friend buying a chocolate cake.;8fz2iz;https://v.redd.it/6ptl0ma9h1v01
This comment combined with the current meme on the fp about bitcoin overthrowing legit banking systems in this year crack me up. ;1;0;False;Trumpisagoldengod;dy9v3o3;I took a trip with some friends to a sleepy rural town in Japan, hours outside of Tokyo. We entered a cafe and were surprised to see that they accepted bitcoin. Here is my friend buying a chocolate cake.;8fz2iz;https://v.redd.it/6ptl0ma9h1v01
this will be the start of greater adoption of bitcoin in the market;1;0;False;robinwindy;dy94p9u;I took a trip with some friends to a sleepy rural town in Japan, hours outside of Tokyo. We entered a cafe and were surprised to see that they accepted bitcoin. Here is my friend buying a chocolate cake.;8fz2iz;https://v.redd.it/6ptl0ma9h1v01
Good to see that. #Crypto is the future. Don't ever let anyone convince you otherwise.;1;0;False;CreateCrypto;dy8nh0b;I took a trip with some friends to a sleepy rural town in Japan, hours outside of Tokyo. We entered a cafe and were surprised to see that they accepted bitcoin. Here is my friend buying a chocolate cake.;8fz2iz;https://v.redd.it/6ptl0ma9h1v01
Thank you!;1;0;False;bitcoinbanana;dy9bj7q;I took a trip with some friends to a sleepy rural town in Japan, hours outside of Tokyo. We entered a cafe and were surprised to see that they accepted bitcoin. Here is my friend buying a chocolate cake.;8fz2iz;https://v.redd.it/6ptl0ma9h1v01
Thx!;1;0;False;insertmadeupnamehere;dy8q7g7;I took a trip with some friends to a sleepy rural town in Japan, hours outside of Tokyo. We entered a cafe and were surprised to see that they accepted bitcoin. Here is my friend buying a chocolate cake.;8fz2iz;https://v.redd.it/6ptl0ma9h1v01
"AHAHHAHAHAHA

“Paid with bitcoin” = didn’t actually pay with bitcoin";0;1;False;newprofile15;dy8jfjz;I took a trip with some friends to a sleepy rural town in Japan, hours outside of Tokyo. We entered a cafe and were surprised to see that they accepted bitcoin. Here is my friend buying a chocolate cake.;8fz2iz;https://v.redd.it/6ptl0ma9h1v01
