body;score;nb_replies;stickied;author;id;post_title;post_id;post_link
Worst. Market. Ever. You must have steel guts to bear this kind of things, I don't want everything to moon or to reach new heights, I would only like the market to go 2x to recover my money, cash out and forget all of this ever happened. ;3;0;False;dek018;ebvlbev;My reaction to the price vs. everyone else's;a6gca5;https://i.imgur.com/aocjx.gif
That’s 4chan;1;0;False;showcdp;ebvtxjl;My reaction to the price vs. everyone else's;a6gca5;https://i.imgur.com/aocjx.gif
Why do women cover their mouths when surprised/sad in western culture? ;1;0;False;Supes_man;ebvw2bh;My reaction to the price vs. everyone else's;a6gca5;https://i.imgur.com/aocjx.gif
Good ol December 15th, 2017. How far we’ve come within a year;1;0;False;Zak_Light;ebw0rzl;My reaction to the price vs. everyone else's;a6gca5;https://i.imgur.com/aocjx.gif
"Well tbh im one of the ""everyone else"" lol";1;0;False;AggravatingLychee;ebw3j3y;My reaction to the price vs. everyone else's;a6gca5;https://i.imgur.com/aocjx.gif
This is so me!!;1;0;False;fasttowel;ebw559a;My reaction to the price vs. everyone else's;a6gca5;https://i.imgur.com/aocjx.gif
Hahah when ever one says it’s crashed but I’m still up 10k;1;0;False;SyntacticSugars;ebwbls2;My reaction to the price vs. everyone else's;a6gca5;https://i.imgur.com/aocjx.gif
kek I feel like a psychopath salivating over this drop;1;0;False;;ebwk405;My reaction to the price vs. everyone else's;a6gca5;https://i.imgur.com/aocjx.gif
The hodlers smile.;1;0;False;Rattlesnake_Mullet;ebwknvq;My reaction to the price vs. everyone else's;a6gca5;https://i.imgur.com/aocjx.gif
Price should rise now.....i cant wait again;1;0;False;gabchuks;ebwp1ac;My reaction to the price vs. everyone else's;a6gca5;https://i.imgur.com/aocjx.gif
Bargain is all I can think of...;1;0;False;CampQs;ebxkh26;My reaction to the price vs. everyone else's;a6gca5;https://i.imgur.com/aocjx.gif
Is it sane to feel FOMO during the last weeks?;1;1;False;Hanspanzer;ebvhb6n;My reaction to the price vs. everyone else's;a6gca5;https://i.imgur.com/aocjx.gif
But Its not a currency though. You hodl idiots are the the only thing keeping it worth anything at all... but you don't spend it on goods or services therefore it isn't worth anything it's just worthless nerd dick measuring and boy are you guys gonna need the microscopes soon...;1;0;False;marokyle87;ebweoq6;My reaction to the price vs. everyone else's;a6gca5;https://i.imgur.com/aocjx.gif
Can I be part of it? Please I want to be cool too;1;0;False;Failed_to_Lunch;ebwefub;My reaction to the price vs. everyone else's;a6gca5;https://i.imgur.com/aocjx.gif
"Lol: I tethered out at $7300 and thought I was SO smart when I didn't jump back in until the ""bottom"" @ $5900. 

Me now: 
Har-de-har-fucking-har. 😒 ";3;0;False;yourbrotherrex;ebw37ki;My reaction to the price vs. everyone else's;a6gca5;https://i.imgur.com/aocjx.gif
Not many people here will even recognize that reference, Grandpa.;3;0;False;geoburke;ebwcj32;My reaction to the price vs. everyone else's;a6gca5;https://i.imgur.com/aocjx.gif
Curious how much in blocks time) 🤔;1;0;False;cyborgene;ebwthaq;My reaction to the price vs. everyone else's;a6gca5;https://i.imgur.com/aocjx.gif
Cause a week is a month and an hour a day, when your reaching just pushes it further away ;1;0;False;HereIsSomeoneElse;ebxjpq9;My reaction to the price vs. everyone else's;a6gca5;https://i.imgur.com/aocjx.gif
Maybe so, but I overinvested at the time.  I lost a couple hundred dollars, but if I had held I would be down several thousand.  Considering the value has dropped by about 80% since then and never returned to a point higher than where I sold, I absolutely made the right call at the time.;2;0;False;Harbingerx81;ebwuc0k;My reaction to the price vs. everyone else's;a6gca5;https://i.imgur.com/aocjx.gif
"Haha, i really hope not... My best guess would be 10x in 20 years. If it happens fast again itd just cause another big crash, and another that soon could sour people forever. Once we are free from the toxic, ""get rich quick"" culture then crypto can start to prosper in a normal healthy way.";0;1;False;EverlastingEmus;ebvqe17;My reaction to the price vs. everyone else's;a6gca5;https://i.imgur.com/aocjx.gif
10x? You high? More like to the fucking moon.;0;0;False;MarvelousWhale;ebvr11v;My reaction to the price vs. everyone else's;a6gca5;https://i.imgur.com/aocjx.gif
"depends

&#x200B;

If the stock market crashes hard before then im all in on spy leap calls with everything I own fuck Ill take out loans if it hits down 40% for the year. I dont see bitcoin rising in a global recession 

&#x200B;

If the market rebounds and bitcoin is still under 2\~2.5k ill buy in a decent amount";5;0;False;ObviousRecession;ebw2tzt;My reaction to the price vs. everyone else's;a6gca5;https://i.imgur.com/aocjx.gif
"if bitcoin hits 2k I as an ""Anti"" bitcoiner who sold out last year will buy back in heavy";1;1;False;ObviousRecession;ebvhec0;My reaction to the price vs. everyone else's;a6gca5;https://i.imgur.com/aocjx.gif
That was precisely the situation in the 90s with the .com boom. 95% of all crypto projects will disapear over the next 5 years then the remaining few will begin to follow the pattern they followed in 2017 except stretched out over a decade instead of a year. ;1;1;False;EverlastingEmus;ebvqzwi;My reaction to the price vs. everyone else's;a6gca5;https://i.imgur.com/aocjx.gif
Which may be higher or lower than the current price;25;2;False;karma911;ebvl0gj;My reaction to the price vs. everyone else's;a6gca5;https://i.imgur.com/aocjx.gif
Oh, yeah, I forgot that past performance doth guarantee future returns. ;3;0;False;terryfrombronx;ebwc03d;My reaction to the price vs. everyone else's;a6gca5;https://i.imgur.com/aocjx.gif
There isn't an incentive to mine until enough people stop mining and the incentive comes back;3;0;False;;ebvht8h;My reaction to the price vs. everyone else's;a6gca5;https://i.imgur.com/aocjx.gif
"> you can't destroy them,

What happens to coins that are in wallets that people lose the keys to? Is it possible to permanently lose your key? 
";5;1;False;RexJupiter;ebvo6fo;My reaction to the price vs. everyone else's;a6gca5;https://i.imgur.com/aocjx.gif
"Price is never irrelevant. If you spent $20,000 a year ago you could get about 1 bitcoin. If you bought it at today’s price you could get 6 bitcoin. Say it drops to $1k in a year and you could get 20 of them. 

In 10 years if price goes up, the 6 bitcoin would be 6x more valuable than 1 bitcoin. And the 20 bitcoin would be about 3x more valuable than 6 bitcoin. 

Price is never irrelevant. ";1;0;False;DonnaHuee;ebvk4jl;My reaction to the price vs. everyone else's;a6gca5;https://i.imgur.com/aocjx.gif
could still be high based on the utility and demand for btc.  Low to me is when it dips into three figure territory.;0;0;False;bbcatlady;ebwcbrd;My reaction to the price vs. everyone else's;a6gca5;https://i.imgur.com/aocjx.gif
All of those are dead. Shitcoiners are the biggest suckers.. it's too bad you guys don't have competent engineers to clue you in.;1;0;False;shanita10;ebvubqh;My reaction to the price vs. everyone else's;a6gca5;https://i.imgur.com/aocjx.gif
TBH I sold out all of my coin last year and because I didnt like the instability but I might actually buy back in because im pretty sure its going to bounce at this low;4;1;False;ObviousRecession;ebvgsqq;My reaction to the price vs. everyone else's;a6gca5;https://i.imgur.com/aocjx.gif
"A day is a week  
A week is a month  
A month is a year  
A Year is a lifetime  
A life in crypto is a life well spent

; )  
";35;3;False;SovietUchiha;ebvj7ir;My reaction to the price vs. everyone else's;a6gca5;https://i.imgur.com/aocjx.gif
"It's definately waaaay early but Lightning is taking off you know, like Lightning which is the right direction.

I'm starting to learn to zoom out, to see the benefits of Bitcoin. Having unconfiscatable, divisible, censorship resistant asset with a fixed/limited supply schedule that you can manage as an individual human being is empowering and has never before been possible. 

When you have events like 2008 and compare it to the way the ""legitimate"" fiat currencies are managed, I am glad we have Bitcoin.";1;0;False;agent_kaleido;ebviakk;My reaction to the price vs. everyone else's;a6gca5;https://i.imgur.com/aocjx.gif
"Because it shakes off all the douche token boys

Bitcoin is a revolution, not speculation";-2;0;False;stevev916;ebw8vrv;My reaction to the price vs. everyone else's;a6gca5;https://i.imgur.com/aocjx.gif
And to sell high it needs to be high? Wow;7;0;False;brandansmite;ebvgzlo;My reaction to the price vs. everyone else's;a6gca5;https://i.imgur.com/aocjx.gif
We have these things called jobs where we get new money at periodic intervals so we buy a bit each paycheck;4;0;False;Sargos;ebw5ng1;My reaction to the price vs. everyone else's;a6gca5;https://i.imgur.com/aocjx.gif
"Where/how can you short bitcoin?

Sounds like free money.";1;1;False;fahrenheitisretarded;ebwlg39;My reaction to the price vs. everyone else's;a6gca5;https://i.imgur.com/aocjx.gif
I mean the value is completely based on demand. Cant really say its overvalued when everyone wanted it. The value isnt linked to technology, other than the premise that without the technology there is no value in the first place. You can argue that mining determines the price as well, but you can just as easily say that mining is more of a reaction based on the demand.;3;0;False;tallboybrews;ebvy0wi;My reaction to the price vs. everyone else's;a6gca5;https://i.imgur.com/aocjx.gif
"Which you can actually do, essentially with any crypto, by swing trading it down. 
 
So, yeah, you *can* make money in a falling market. 

(I managed to tread water for a good while by doing this, but suddenly the ""fairly calm bay I was swimming in"" quickly became a ""huge fucking wave-pool,"" and there was no way in hell I wasn't going under...)

Cryptotrading, 2018^^^";2;0;False;yourbrotherrex;ebw3ml6;My reaction to the price vs. everyone else's;a6gca5;https://i.imgur.com/aocjx.gif
It’s a risk, true. play what you can ;0;0;False;chelefr;ebvl07l;My reaction to the price vs. everyone else's;a6gca5;https://i.imgur.com/aocjx.gif
"A video game character had some wise words for me though: ""It's only total insanity you can rely on.""";1;0;False;Hanspanzer;ebwdpw4;My reaction to the price vs. everyone else's;a6gca5;https://i.imgur.com/aocjx.gif
This would only be if everywhere adopted it, until then it’s a cat and mouse game of spending money to move money. I’m not shitting in bitcoins future, but it can hardly be classified as a currency yet.;1;1;False;Cpear805;ebvh2zi;My reaction to the price vs. everyone else's;a6gca5;https://i.imgur.com/aocjx.gif
He's actually been away for more than a year.  Missed the whole bubble too.;4;1;False;rydan;ebw21py;My reaction to the price vs. everyone else's;a6gca5;https://i.imgur.com/aocjx.gif
"Isn't that kind of reaction what makes the price drop like crazy?
Everyone sees the price drop, everyone sells, price goes even further down.";1;1;False;Breadynator;ebwmaxx;My reaction to the price vs. everyone else's;a6gca5;https://i.imgur.com/aocjx.gif
dumb. Price will go 10x within 6 months.;-2;2;False;mummyfromcrypto;ebvlin3;My reaction to the price vs. everyone else's;a6gca5;https://i.imgur.com/aocjx.gif
Lol, periods of high volatility.;3;0;False;recycle4science;ebvwbcd;My reaction to the price vs. everyone else's;a6gca5;https://i.imgur.com/aocjx.gif
"you better buy back  soon, fool.  we're about to go on another big daddy bitcoin ""alpha fucks, no-coiner cucks"" run.";1;1;False;diydude2;ebw1ual;My reaction to the price vs. everyone else's;a6gca5;https://i.imgur.com/aocjx.gif
But you can sell at Dec 2019 prices;23;2;False;absonudely;ebvgiyd;My reaction to the price vs. everyone else's;a6gca5;https://i.imgur.com/aocjx.gif
"The way btc works is people accumulate when people like you are saying ""if it ever comes back"".

Then once it's at some crazy number and all over the news, people like you say it's a ""bubble and tulips"" and then the price crashes to a lower high. 

We are still talking 3k  for a magical internet money, that either says the btc is a worthwhile investment, or dollars are just so worthless that's what they'll buy you. 

If dollars were so powerful, 1 dollar would buy you 100 bitcoins. They don't.

Watch the game of btc musical chairs. We all accumulate quietly for 10 -14 months after a crash and let it rip. ";1;0;False;swaggyrabbit;ebvuk4f;My reaction to the price vs. everyone else's;a6gca5;https://i.imgur.com/aocjx.gif
