body;score;nb_replies;stickied;author;id;post_title;post_id;post_link
This is going to turn into a Bank Shill show soon. These idiots never know when they are beaten. ;1;1;False;Kprawn;e83w1jq;Trust the nerds;9pqxea;https://i.redd.it/0f88vogzi9t11.jpg
Nigerian prince: *yes, trust internet dudes who promise you that you will get rich fast* ;1;0;False;;e84awif;Trust the nerds;9pqxea;https://i.redd.it/0f88vogzi9t11.jpg
It combines ignorance of economics and the way society works in general with us VS them mentality. The more you read up about the history of technology the more cringey it sounds;62;1;False;qagg;e8433px;Trust the nerds;9pqxea;https://i.redd.it/0f88vogzi9t11.jpg
Welcome to the sub.;19;0;False;rsn_e_o;e841mt2;Trust the nerds;9pqxea;https://i.redd.it/0f88vogzi9t11.jpg
Because it’s not a quote;20;0;False;ekhasm88;e83u16l;Trust the nerds;9pqxea;https://i.redd.it/0f88vogzi9t11.jpg
asking the real questions;1;0;False;vjeuss;e849sx0;Trust the nerds;9pqxea;https://i.redd.it/0f88vogzi9t11.jpg
Me too. I think that concern should be used as an entry requirement to /r/bitcoin.  Those who are not bothered by such things should not be allowed in here.;1;0;False;MadBanker01;e84929p;Trust the nerds;9pqxea;https://i.redd.it/0f88vogzi9t11.jpg
Can you elaborate? Noob here.;1;1;False;notsuppostocomnt;e83xj2v;Trust the nerds;9pqxea;https://i.redd.it/0f88vogzi9t11.jpg
/r/im14andthisisdeep ;107;1;False;teachmegerman;e8405up;Trust the nerds;9pqxea;https://i.redd.it/0f88vogzi9t11.jpg
The banks won't allow a fair game tho. Crypto is deeply manipulated 24/7;1;1;False;Kvitar;e83vria;Trust the nerds;9pqxea;https://i.redd.it/0f88vogzi9t11.jpg
Deep!;0;0;False;hetang96;e843xmd;Trust the nerds;9pqxea;https://i.redd.it/0f88vogzi9t11.jpg
In science you don't learn truths, you learn correlations and behavior. Scientists and engineers interpret these correlations and behaviors into something we can understand. They don't just instantly know what something is when they first see it. It's not that black and white.;3;0;False;colonial_dan;e84vai9;Trust the nerds;9pqxea;https://i.redd.it/0f88vogzi9t11.jpg
Super cringy.;1;0;False;Nertez;e84t6qh;Trust the nerds;9pqxea;https://i.redd.it/0f88vogzi9t11.jpg
This is so stupid. Nerds also brought you long term capital management. ;1;0;False;CurrentCredit;e84yk84;Trust the nerds;9pqxea;https://i.redd.it/0f88vogzi9t11.jpg
The military brought us the internet . ;1;0;False;YouDontKnoMeBitch;e84u1ks;Trust the nerds;9pqxea;https://i.redd.it/0f88vogzi9t11.jpg
TFW the government's military brought you through internet.;1;0;False;awwwtist;e84y0ih;Trust the nerds;9pqxea;https://i.redd.it/0f88vogzi9t11.jpg
Is he still talking? There’s no closed quote. Why are we only catching the first part of his talk ;1;0;False;KalEll66;e84v78y;Trust the nerds;9pqxea;https://i.redd.it/0f88vogzi9t11.jpg
