body;score;nb_replies;stickied;author;id;post_title;post_id;post_link
How's it going;1;0;False;;ds8pzd7;"Danish Bitcoin billionaire new sponsor of professional Danish ice hockey team. Stadium to be renamed ""Bitcoin Arena"" and get a huge Bitcoin logo in the middle of the ice!";7jri98;https://www.business.dk/virksomheder/dansk-bitcoin-milliardaer-ny-sponsor-i-seiers-ishockeyklub-topspiller
"Thanks for bringing up the ""politics"" part.";1;0;False;stultitia;ds8x820;I'm donating 5057 BTC to charitable causes! Introducing The Pineapple Fund;7jj0oa;https://www.reddit.com/r/Bitcoin/comments/7jj0oa/im_donating_5057_btc_to_charitable_causes/
I lost money while I was sleeping... what does that mean? Will I be working past death?;3358;16;False;1Bitcoinco;ds7y3or;Warren Buffet:;7o9zo1;https://i.redd.it/epko0verp7801.jpg
I was just saying to sum up him as doing “well” would be like to some up Muhammad Ali  as being a guy who “boxed well”. It’s true but it doesn’t really do it justice. ;3;0;False;HHughes12;ds8g7on;Warren Buffet:;7o9zo1;https://i.redd.it/epko0verp7801.jpg
He bought shares in Apple in 2016 that made him the largest shareholder in the company.;5;5;False;thepresentisagift;ds8dg5g;Warren Buffet:;7o9zo1;https://i.redd.it/epko0verp7801.jpg
Very much for them. Index funds traditionally charge around 0.0#% for ownership and outperform 99.5% of money managers. The reality is, unless you are insanely rich and well connected, you aren't going to ever have someone manage your money that falls into the 0.5% that can outperform the market in addition to covering their 1-2% commission. ;1;0;False;Lazarous86;ds8uspc;Warren Buffet:;7o9zo1;https://i.redd.it/epko0verp7801.jpg
You realize the issue of fees and transfer times is a new problem right? even just a year ago Bitcoin was basically free and instant.;31;2;False;Raster_Eyes;ds888w7;Warren Buffet:;7o9zo1;https://i.redd.it/epko0verp7801.jpg
"""It's digital gold"" they say. While they would also never store their capital in gold....";5;1;False;thekiwifish;ds88gwq;Warren Buffet:;7o9zo1;https://i.redd.it/epko0verp7801.jpg
"This thread gives me hope. I feel the same man. When it was supposed to be a currency I liked it, but now it soefully inadequate for that purpose and it's pretty much a bubble.

More power to anyone who got rich, but i wouldn't want to be the one holding the bag when this crumbles.";29;2;False;;ds878kg;Warren Buffet:;7o9zo1;https://i.redd.it/epko0verp7801.jpg
">Lightning Network

Ahhh yes, I'm sure that one will come out around the same time as Halflife 3";11;1;False;indorock;ds870l5;Warren Buffet:;7o9zo1;https://i.redd.it/epko0verp7801.jpg
Gold has real world usage. It's a precious **metal** for a reason.;8;1;False;;ds87ahs;Warren Buffet:;7o9zo1;https://i.redd.it/epko0verp7801.jpg
"Stocks are far less volatile than Bitcoin lmao. 

And most secure? In the last several years more exchanges have fallen due to people running off with millions of dollars worth of coins than have survived without having been compromised. Name one exchange that has been around for 9 years... 

Lightning network doesn't matter until/unless it is actually implemented and actually results in fast and cheap transactions.";1;1;False;72_hairy_virgins;ds8kfo1;Warren Buffet:;7o9zo1;https://i.redd.it/epko0verp7801.jpg
"Which has intrinsically limited supply, as well as significant actual uses, and a tangible value as a unique metal (soft, shiny, yellow, and doesn't corrode).

Gold is also not used as a currency anymore, due to deflationary nature (encourages hoarding), limited divisibility, etc. It also has a much greater likelihood of retaining value in the future than crypto. I'm fairly certain gold will be valued at similar levels to current $/ounce in 2118 as it is now (accounting for inflation), while crypto could very easily drop to $0. ";13;1;False;72_hairy_virgins;ds8606b;Warren Buffet:;7o9zo1;https://i.redd.it/epko0verp7801.jpg
You can always buy bitcoins locally, then transfer them internationally (and the receiver can sell them locally if they want).;-1;0;False;ITwitchToo;ds8dahh;Warren Buffet:;7o9zo1;https://i.redd.it/epko0verp7801.jpg
True, but i guess it’s immediate within the hour so the % change in day doesn’t really matter and the % change within hour is negligible usually. ;-2;1;False;andrew_bao;ds86mpw;Warren Buffet:;7o9zo1;https://i.redd.it/epko0verp7801.jpg
Also true;2;0;False;andrew_bao;ds86ezj;Warren Buffet:;7o9zo1;https://i.redd.it/epko0verp7801.jpg
"That is some bizarre reasoning. You think your bread is valuable because the grain farmer owns a lot of tractors?

Gold doesn’t have value because someone put effort into mining it. That just increases cost.";-1;1;False;TheSecretMe;ds8xfso;Warren Buffet:;7o9zo1;https://i.redd.it/epko0verp7801.jpg
The only thing driving up the price of bitcoin right now is speculation. If people roll over and accept that it'll never be a useful currency, then it'll collapse. The only thing even keeping it this high right now is everyone's belief that it'll eventually go up higher. ;7;1;False;sts816;ds865w6;Warren Buffet:;7o9zo1;https://i.redd.it/epko0verp7801.jpg
I was thinking when people realise the days of 500% ROI in a matter of months are gone, they will start going back to traditional investments with less risk, and ultimately someone will be left holding a bucket of shit.;1;1;False;thepresentisagift;ds8fof6;Warren Buffet:;7o9zo1;https://i.redd.it/epko0verp7801.jpg
Why did those hard working laborers need the investor then?;0;1;False;bobbymcpresscot;ds8flu3;Warren Buffet:;7o9zo1;https://i.redd.it/epko0verp7801.jpg
Maybe;1;1;False;LacklusterMeh;ds86if8;Warren Buffet:;7o9zo1;https://i.redd.it/epko0verp7801.jpg
He's said before that short term capital gains (less than 1 yr) should be taxed at 100% essentially wiping out speculators and traders, and make the markets for long term investing only. Of course this is only a joke of sorts, because he makes most his money off the short-term-ism of Wall Street. ;21;1;False;13utthole;ds84svl;Warren Buffet:;7o9zo1;https://i.redd.it/epko0verp7801.jpg
This is not correct. He made a $1m bet with a hedge fund manager that simply investing in a market index fund would outperform the return of investors in hedge funds, in 2017. He got paid out after nine months because he was so far ahead.;2;0;False;TezzMuffins;ds8al6s;Warren Buffet:;7o9zo1;https://i.redd.it/epko0verp7801.jpg
"Wall Street acts as the casino, not the gambler. Wall Street traders don't typically 'trade' to take bets on companies, they facilitate trades on their clients behalf, much like a dealer at a card game. Like the croupier who earns a few chips by dealing hands, they take on little risk. That's why wall Street and casinos are so profitable.

I've also worked at a bulge bracket wall Street bank in sales & trading (fortunately only an internship a while ago). It sucked for this reason. I took the job thinking it was about putting on carefully researched bets, but in reality, you only facilitate other people's trades to earn a vig.";5;1;False;occupybourbonst;ds8b4n2;Warren Buffet:;7o9zo1;https://i.redd.it/epko0verp7801.jpg
Source: am wall-street active trader;2;1;False;;ds85xbk;Warren Buffet:;7o9zo1;https://i.redd.it/epko0verp7801.jpg
"Wallstreet gets paid whether their trades pan out or not. They're trading other people's money while taking a fee.

They'll laud individual traders who make big gains while forgetting them tomorrow when they fail. The big gains make good advertising but it's the fees that come in win or lose.";1;0;False;TheSecretMe;ds8wzft;Warren Buffet:;7o9zo1;https://i.redd.it/epko0verp7801.jpg
I mean he could have done better, he didn't invest in tech companies like facebook because he didn't understand it. Apply this to a lot of tech industries he probably ignored because he didnt understand tech he could probably be a lot richer, not that the dude would ever need to.;3;2;False;bobbymcpresscot;ds8f8mn;Warren Buffet:;7o9zo1;https://i.redd.it/epko0verp7801.jpg
"probably not, bitcoin is meant as a medium of exchange. it was never meant as an investment tool. while its good to have short term assets in a deflationary currency instead of an inflationary currency, its terrible to have your assets in both long term. 

buying bitcoin is just like buying gold, over time there is some mined, at one point in the future all of it will be mined and there will be none left. this scarcity produces ridiculous volatility because people think that they will miss out on the huge returns of owning something that cant be produced anymore. this leads to huge spikes in price and then crashes when people become scared when the price drops. you might think you'll become super rich holding .025 bitcoin, but that's only because you are focusing on the short term picture and not the long term picture of bitcoin. bitcoin doesn't have much of a price history because its inception was in 2010. but the rules are the exact same as gold (with the exception of storage and transaction costs). gold appreciates slowly over time. it has spikes, but the spikes always crash. gold from 1985 to 2005 only appreciated 3% annually. that's  conservative pricing. gold bought during the 1980 gold boom and sold at 2005 actually depreciated around 1% annually. if you didn't put your money anywhere you would get 2-3% deflation. so gold was still technically better than nowhere.

the reason why warren buffet is a billionaire is because he makes money on compound interest. if you have one bitcoin it appreciates in price over time. if you need food, you have to sell bitcoin in order to feed yourself. if you own part of a business with operating revenue, you can use its distributed dividends to feed yourself as your share value appreciates over time. if there is some money left over, you can then reinvest the money back into the business and your share of the pie increases. I think that bitcoin should be the medium of exchange that these businesses use to transact business for libertarian reasons. but to think that one day bitcoin will replace these businesses is absolutely fucking retarded. to think that bitcoin is worth more than these businesses is absolutely fucking retarded. and if you think that a medium of exchange is a better investment than the people transacting the medium of exchange, then essentially you are saying there is no point to do business because the bitcoin they are using to do business is worth more than the business itself, and the people exchanging bitcoin are stupid because not doing anything at all and holding the bitcoin will produce more to the economy than actually doing something; and that would make you absolutely fucking retarded. 

tldr; 
bitcoin is the future of EXCHANGE, not of investment";15;4;False;;ds8f78w;Warren Buffet:;7o9zo1;https://i.redd.it/epko0verp7801.jpg
Neo pays dividends. ;2;0;False;birdperson_c137;ds8rz99;Warren Buffet:;7o9zo1;https://i.redd.it/epko0verp7801.jpg
Some alts do if you know where to look.  I'm making $80-150 a day in one certain coin by staking it and it has been relatively stable even when btc was going way up.  I think those types of coins are where people should be looking if they have a large portfolio because if crypto takes off and becomes the future, you can retire on staking rewards and dividend like coins.  And I fully realize it's a complete gamble at this point in time since we are in the biggest bull market crypto has ever seen.;7;2;False;cratos333;ds8bs01;Warren Buffet:;7o9zo1;https://i.redd.it/epko0verp7801.jpg
Literally none of that matters if it's not generally accepted for goods and services. If you can't buy stuff with it, it's not a currency. ;2;0;False;anti09;ds8d8v7;Warren Buffet:;7o9zo1;https://i.redd.it/epko0verp7801.jpg
Acceptance where? There aren't a lot of retailers that take Bitcoin seriously;1;0;False;redvblue23;ds8munp;Warren Buffet:;7o9zo1;https://i.redd.it/epko0verp7801.jpg
"Worth adding that even when Bitcoin is viewed as a currency, it has become a pretty terrible one at that, due to the terrible handling of the lead developers to ensure Bitcoin is scalable in a mass market. 

As things stand, fees to transact Bitcoin are obscenely high, as are transaction times. There was all this talk about progress, yet much of it has fallen flat. Stage one of Segwit did little to improve Bitcoin as a currency, and stage two was flat-out cancelled. Now they're talking about the Lightning network, yet that has seen multiple delays too. 

It's almost as if the high fees are making the elite of Bitcoin so much money, they don't want such problems fixed. Never underestimate the power and influence of greed. It's as prevalent in crypto as anywhere else.";1;0;False;sbowesuk;ds8rf03;Warren Buffet:;7o9zo1;https://i.redd.it/epko0verp7801.jpg
">acceptance

Barely anywhere";0;0;False;anosmiasucks;ds8fxnz;Warren Buffet:;7o9zo1;https://i.redd.it/epko0verp7801.jpg
"The difference is that gold has intrinsic value due to its applications in jewelry and electronics.  All things used as stores of value have stable demand for the underlying asset be it gold, oil, copper, real estate, etc.  

Bitcoin's only intrinsic value is its use as a currency.  If that part fails then it can't succeed as a store of value either.";4;0;False;nekura99;ds8cff6;Warren Buffet:;7o9zo1;https://i.redd.it/epko0verp7801.jpg
[deleted];2;2;False;;ds8e7aj;Warren Buffet:;7o9zo1;https://i.redd.it/epko0verp7801.jpg
"The claim wasn't that ""currency isn't an asset"", it was that ""Bitcoin isn't a currency"".";4;0;False;mygamedevaccount;ds88dnp;Warren Buffet:;7o9zo1;https://i.redd.it/epko0verp7801.jpg
Do you count most of the things you own that lose value year-after-year as assets?;3;0;False;acepincter;ds86uu2;Warren Buffet:;7o9zo1;https://i.redd.it/epko0verp7801.jpg
[deleted];1;1;False;;ds8gqax;Warren Buffet:;7o9zo1;https://i.redd.it/epko0verp7801.jpg
There are people who want to own bitcoin for the same reason you might own a rare penny.  It's cool and interesting I guess;2;1;False;omegapopcorn;ds8j2cb;Warren Buffet:;7o9zo1;https://i.redd.it/epko0verp7801.jpg
It's kind of like how if you have a pile of locks and a pile of unmatched keys, they have little value until paired up with the lock- then it has function.  [Tally Sticks](http://www.bbc.com/news/business-40189959) were medieval currency that symbolized debt, and were made of two halves of willow of which the lender would keep one half (it would only ever match up with the other half)  Bitcoin's cryptography and mathematical basis is not far from the way a natural wood-grain's uniqueness was used to produce a token symbolizing a deposit.;1;0;False;acepincter;ds87n0t;Warren Buffet:;7o9zo1;https://i.redd.it/epko0verp7801.jpg
"Lmao everyone has their success stories breh

I took a guy from 5k to 3.5m on Sirius.

Wanna know how much he has left? Lol";3;2;False;;ds86kvk;Warren Buffet:;7o9zo1;https://i.redd.it/epko0verp7801.jpg
A lot of people argue that its usability as currency is actually one of the intrinsic values of gold. It's rare enough, can be easily melted over fire and made into coins, it can be split (due to its relative softness), doesn't corrode and has a unique color.;63;0;False;iauo;ds84gl5;Warren Buffet:;7o9zo1;https://i.redd.it/epko0verp7801.jpg
"Stop making valuable counterarguments dammit! 

Of course gold has intrinsic value, cause i can like hold it and look at how shiny it is, but bitcoin is just some 0s and 1s written somewhere in China.

/s  ";2;1;False;kodaplays;ds84kuo;Warren Buffet:;7o9zo1;https://i.redd.it/epko0verp7801.jpg
Gold has excellent properties for store of value in the old times. It doesn't oxidize to start with. Is malleable and hard to replicate in the old times ( since it has high atomic number and tungsten is the only other metal in abundance available. );1;0;False;jdjdndheii8ri;ds86tiv;Warren Buffet:;7o9zo1;https://i.redd.it/epko0verp7801.jpg
Gold has had intrinsic value for jewelry for thousands of years.  There is a predictable persistent demand from skilled craftsman to obtain gold which is a rock solid definition as having value.;1;0;False;nekura99;ds8cp4o;Warren Buffet:;7o9zo1;https://i.redd.it/epko0verp7801.jpg
they made jewels out of it?;0;0;False;;ds85nhi;Warren Buffet:;7o9zo1;https://i.redd.it/epko0verp7801.jpg
Yeah, gold plating isn't done for conductivity, it's done to avoid oxidation and rust, because it doesn't happen to gold. ;16;1;False;ric2b;ds84vt8;Warren Buffet:;7o9zo1;https://i.redd.it/epko0verp7801.jpg
gold is still used for electroplating conductors in electronics and microelectronics, not just cables.;2;0;False;acepincter;ds87qxq;Warren Buffet:;7o9zo1;https://i.redd.it/epko0verp7801.jpg
What if I told you all that value the internet has is derived from practical applications it possesses which cryptocurrencies do not? ;10;1;False;Murgie;ds875ae;Warren Buffet:;7o9zo1;https://i.redd.it/epko0verp7801.jpg
Why is that certain? Just because it is written on a white paper? What makes you so sure that when enough number of people want it, more bitcoin won't be mined?;5;3;False;;ds85l72;Warren Buffet:;7o9zo1;https://i.redd.it/epko0verp7801.jpg
Gold & Silver are a store of value. An investment pays you something for holding it. As for being able to buy stuff on APMEX.... unless something is priced in Bitcoin, so what. I don't know about them but I bet they give you a quote at the time of purchase, and a time limit to finish the transaction. So they are accepting bitcoin and then converting it into their local currency asap. That leads no additional legitimacy to Bitcoin.;3;0;False;thekiwifish;ds89fev;Warren Buffet:;7o9zo1;https://i.redd.it/epko0verp7801.jpg
"Ah okay I'll just use my bitcoins to power my house then... 

I don't mean to be rude, I apologize. It's just... So many people here talk about economics but I don't really think people know what they're talking about. Especially the ones calling Buffett an idiot. 

What you're describing isn't *Intrinsic* value. ";10;1;False;El_Giganto;ds888m8;Warren Buffet:;7o9zo1;https://i.redd.it/epko0verp7801.jpg
He’s not an idiot. In that same interview he says his assistant does it. ;3;1;False;Justanotherjustin;ds8aib2;Warren Buffet:;7o9zo1;https://i.redd.it/epko0verp7801.jpg
Water has intrinsic value;10;1;False;Romeo_the_Dog;ds84ea4;Warren Buffet:;7o9zo1;https://i.redd.it/epko0verp7801.jpg
"Its unstable, 

Its not. Currency its an investment. 

I invest in bitcoin. I dont treat it like a currency. 

People on this hub saying converting your life savings to bitcoin is stupid,  because its not a viable currency. 

Im gettinf out of bitcoin this month to a 300% ROI. 

I didnt make millions. Or even thousands but i got my beak wet. ";25;3;False;;ds87qq0;Warren Buffet:;7o9zo1;https://i.redd.it/epko0verp7801.jpg
I mean, bitcoin is already taxed. And regulation is actually a good thing, since it gives it legitimacy. Any business will be more likely to adopt a regulated currency rather than unregulated.;2;1;False;tashtrac;ds85aa8;Warren Buffet:;7o9zo1;https://i.redd.it/epko0verp7801.jpg
I wonder how many people would own bitcoin if it was limited to only people who understand the mathematics behind blockchain technology.;6;0;False;FEED_ME_YOUR_EYES;ds83pew;Warren Buffet:;7o9zo1;https://i.redd.it/epko0verp7801.jpg
"> The last one doesn't work in the USA

It works. You've just never tried it.";2;1;False;NoMoreNicksLeft;ds8opvl;Warren Buffet:;7o9zo1;https://i.redd.it/epko0verp7801.jpg
*head explodes*;5;0;False;Joplinpicasso;ds8fck3;Warren Buffet:;7o9zo1;https://i.redd.it/epko0verp7801.jpg
No, that is not true. For idiots like you there is a huge warning on alexa that the numbers are estimates. A more credible source is similarweb, which says 39%.;7;1;False;ezpc510;ds8cl9z;Warren Buffet:;7o9zo1;https://i.redd.it/epko0verp7801.jpg
Fact-rekt;19;1;False;KindImpatientSavage;ds86ywh;Warren Buffet:;7o9zo1;https://i.redd.it/epko0verp7801.jpg
[deleted];13;1;False;;ds87b4n;Warren Buffet:;7o9zo1;https://i.redd.it/epko0verp7801.jpg
that is not exactly a global representative sample. Alexa users could be skewed to USA.;1;2;False;tbjfi;ds86x1t;Warren Buffet:;7o9zo1;https://i.redd.it/epko0verp7801.jpg
Still that's not even close to 100%;-2;1;False;_alright_then_;ds88fp8;Warren Buffet:;7o9zo1;https://i.redd.it/epko0verp7801.jpg
tfw I made a correct assumption based on data;1;0;False;ezpc510;ds8cqcr;Warren Buffet:;7o9zo1;https://i.redd.it/epko0verp7801.jpg
But if you'd been in since 2009-10 you'd have made most from Bitcoin. And it's not just about short term anyway. A lot of those alts won't be around in 10 years.;5;1;False;ebaley;ds894y8;Warren Buffet:;7o9zo1;https://i.redd.it/epko0verp7801.jpg
Thanks;6;0;False;PurcyVillin;ds8cssi;Warren Buffet:;7o9zo1;https://i.redd.it/epko0verp7801.jpg
Because that's what it is ;86;1;False;anti09;ds8d4sj;Warren Buffet:;7o9zo1;https://i.redd.it/epko0verp7801.jpg
Yeah, BTC is like... the antithesis of what Buffett is about.;19;1;False;NotClever;ds8ix9l;Warren Buffet:;7o9zo1;https://i.redd.it/epko0verp7801.jpg
"I misinterpreted 

>through the eyes of a  traditional investors, this is a game of timing the market. 


I thought you were implying that’s a game they’ll play but I see now you’re saying the opposite. ";3;0;False;PureRandomness529;ds8mkww;Warren Buffet:;7o9zo1;https://i.redd.it/epko0verp7801.jpg
"Except you do.

You disagree on whether or not you are disagreeing. :O";2;0;False;UpTheVotesDown;ds87l8w;Warren Buffet:;7o9zo1;https://i.redd.it/epko0verp7801.jpg
Transactions are broadcast to the network in a matter of seconds. You're right that confirmation can take over an hour though. That being said, credit cards work the same way. Credit card settlement takes days, the vendors just trust that the payment will be confirmed by Visa, MasterCard, etc in the mean time. Credit card charge backs are probably far more common and easy to perform than spoofing a transaction on the Bitcoin network (e.g. broadcasting a transaction knowing it will never be confirmed).;1;0;False;efadd;ds8ilgp;Warren Buffet:;7o9zo1;https://i.redd.it/epko0verp7801.jpg
Jesus Christ. Think about the logic of this for one second: if it's not a currency, what is it an investment in? An investment in the willingness of someone else to buy it off of you? That my friend is a pyramid scheme.;111;10;False;limes336;ds88k4q;Warren Buffet:;7o9zo1;https://i.redd.it/epko0verp7801.jpg
Yes, gambling can be exhilarating when you win. Investments are measured in years and decades.;9;1;False;elchhhha;ds89kai;Warren Buffet:;7o9zo1;https://i.redd.it/epko0verp7801.jpg
Jus because you are using it that way, doesn't make it right. I can use a crowbar as a back scratcher, it doesn't mean its the intended or most practical use for it. ;1;0;False;DecoyPancake;ds89px1;Warren Buffet:;7o9zo1;https://i.redd.it/epko0verp7801.jpg
The latest bubble has popped.  Where have you been? ;1;1;False;emanking;ds8hv3u;Warren Buffet:;7o9zo1;https://i.redd.it/epko0verp7801.jpg
Well I can trade my rare penny without burning tons of coal to power the transaction.  I hope Bitcoin has a plan to lower the power need for the network.;0;2;False;Solkre;ds8m7qo;Warren Buffet:;7o9zo1;https://i.redd.it/epko0verp7801.jpg
Yeah but no one uses it as a currency. Not sure what your point is ;17;2;False;RichardShermanator;ds84qjg;Warren Buffet:;7o9zo1;https://i.redd.it/epko0verp7801.jpg
"Japan.
If ""Satoshi Nakamoto"" is even japanese...";3;0;False;BadChoicez;ds869e5;Warren Buffet:;7o9zo1;https://i.redd.it/epko0verp7801.jpg
TIL;1;0;False;gotanewusername;ds86z4t;Warren Buffet:;7o9zo1;https://i.redd.it/epko0verp7801.jpg
"until the neckbeard marries said 'gorgeous woman' and then the ratio will be firmly in favor of the 'charming good looking guy.' 

eventually neckbeard will get done in by charming good looking guy and gorgeous woman who will then go on to squander the stacks of bitcoin on piles of cocaine and trips to the French Riviera. 

";4;1;False;;ds8aa5o;Warren Buffet:;7o9zo1;https://i.redd.it/epko0verp7801.jpg
Ew.;7;0;False;ayevee21;ds89edu;Warren Buffet:;7o9zo1;https://i.redd.it/epko0verp7801.jpg
You don't have to be a feminista to respect wamen.;9;0;False;Sobsz;ds8gfbf;Warren Buffet:;7o9zo1;https://i.redd.it/epko0verp7801.jpg
"“If you find a way to make money while you sleep, you will never sleep peacefully” ;)";4;0;False;nominehorremus;ds8q5ra;Warren Buffet:;7o9zo1;https://i.redd.it/epko0verp7801.jpg
Some of the tech is reeeeally hard to understand with zero background. And if it is to become actual currency and not a commodity then you need the vast majority of laymen to adopt it.;2;0;False;Bombingofdresden;ds86e8z;Warren Buffet:;7o9zo1;https://i.redd.it/epko0verp7801.jpg
"as a trader I learned that there are 2 primary emotions behind stock market, and maybe its amplified with crypto: Fear and greed.  
greed that BTC will go 600k in a year, or fear that it will burst. and that explains the wild swings, compared to a company like aapl or msft or ATVI, which have fundamentals such as income, profit, sales, etc, that keep it grounded.    
.  
second thing I learned was NEVER EVER get personally vesting in anything. Thats synonymous with hype.  
I had a friend, who was a techie,  tell me that the microsoft surface was gonna be the next big thing, and he listed off all its technical specs, told me it was gonna replace the ipad, and to dump all my aapl stock for MSFT stock, and of couse history has dictated that he was wrong when it comes to market and stocks. Was it better technically, maybe. was it better from a global consumer standpoint, no.  
but the thing was that he was so sure of himself, no doubt in his mind that it was gonna be successful and that MSFT stock would skyrocket";2;0;False;Stompedyourhousewith;ds86ipf;Warren Buffet:;7o9zo1;https://i.redd.it/epko0verp7801.jpg
