body;score;nb_replies;stickied;author;id;post_title;post_id;post_link
"If I may sound like an old fart for a moment, this is what pains me about kids today and their computing experience. Sure they have in their pockets a computer far more powerful than what we had as a desktop but many of them have no idea of even the basics of what's going on inside and even if they did, they can't really modify things as manufactures keep sealing them.  My current Dell laptop is completely sealed up so if I ever need to change a battery on that thing even, I'll have to google the hell out of it.  

But yeah, I learned so much back then! For instance, The [IBM PS/1 Model 2121 G42](https://www.tietokonemuseo.net/tietokoneita/ibm-ps1-model-2011/) we got from Sam's had a slow ass 2400 baud modem which was enough for me to get on BBSes but we decided to get a 14.4k modem for it and had no idea where it went...nothing inside looked like the modem's connectors.  It turned out, the damn thing wasn't an ISA architecture like every other PC, but Microchannel bus - essentially the Betamax of computer buses where it was technically better, but nobody used it.   

After that, every other desktop I ever got except for one HP (huge mistake) was home assembled from junk parts initially and later the best parts I could afford. ";1;2;False;coogie;dya7jx2;What a time to be alive!;8g8vqu;https://i.redd.it/rbt35cjw89v01.jpg
Not that I agree with the douchery of the OP, but if I was in Bitcoin a few years ago I'd def delete my account and start fresh too (instead of someone potentially doxxing me knowing I had lots of Bitcoin) ;6;0;False;WrangledViking;dyahlwz;What a time to be alive!;8g8vqu;https://i.redd.it/rbt35cjw89v01.jpg
who gives a shit?;10;1;False;wooftooth;dya8fi5;What a time to be alive!;8g8vqu;https://i.redd.it/rbt35cjw89v01.jpg
Profound thoughts, by Mr bitbat99...;1;0;False;PizzaLover_82;dyaao7d;What a time to be alive!;8g8vqu;https://i.redd.it/rbt35cjw89v01.jpg
Hey, you're right!;3;1;False;Agrees_withyou;dy9xuss;What a time to be alive!;8g8vqu;https://i.redd.it/rbt35cjw89v01.jpg
I agree that all these amateur hour blockchain companies are toxic and need to go. I agree most alt coins are a scam or worthless. But there are a ton of great projects out there that are doing big things. You should look into some.;1;1;False;ClarkEbarZ;dy9zzyt;What a time to be alive!;8g8vqu;https://i.redd.it/rbt35cjw89v01.jpg
You honestly don't think they're bothered all that value is being stored out of their hands?;2;2;False;ebaley;dy9zgq5;What a time to be alive!;8g8vqu;https://i.redd.it/rbt35cjw89v01.jpg
"Well, you can withdraw your paycheck except on Sundays because it's blocked for about 2 days before it's finally in your account and depending on what currency and what country you can garner fees, but still, I guess withdrawing absolutely anywhere is a fine thing...

And then there's bitcoin, an international decentralized currency not owned by any entity with fast, non-hindered transactions anywhere you have internet with moderate fees, but you can still purchase anything anywhere as long as someone is willing to take bitcoin.";1;0;False;DawnPhantom;dyaclll;What a time to be alive!;8g8vqu;https://i.redd.it/rbt35cjw89v01.jpg
Implying there where ovens;3;0;False;bjenaan_reborn;dya91l6;What a time to be alive!;8g8vqu;https://i.redd.it/rbt35cjw89v01.jpg
What will we say in 2028?! ;1;0;False;teb1rek;dya8633;What a time to be alive!;8g8vqu;https://i.redd.it/rbt35cjw89v01.jpg
Semitic banking system;1;0;False;bjenaan_reborn;dya8sm6;What a time to be alive!;8g8vqu;https://i.redd.it/rbt35cjw89v01.jpg
Yes, and central banks are buying bitcoin.  If ya can't beat em, join em I guess..;8;1;False;happinessmachine;dyahjwo;What a time to be alive!;8g8vqu;https://i.redd.it/rbt35cjw89v01.jpg
shameless repost ;2;0;False;HodlingOnForLife;dyaduyi;What a time to be alive!;8g8vqu;https://i.redd.it/rbt35cjw89v01.jpg
bank is kill;104;1;False;rdkN_;dya84n7;What a time to be alive!;8g8vqu;https://i.redd.it/rbt35cjw89v01.jpg
Hi (sorry for bad English);56;3;False;ishibaunot;dyagyiv;What a time to be alive!;8g8vqu;https://i.redd.it/rbt35cjw89v01.jpg
And the banking system is still not overthrown... ghh;253;4;False;wortelus;dyabgf0;What a time to be alive!;8g8vqu;https://i.redd.it/rbt35cjw89v01.jpg
He is speaking like a real modern miner. ;2;0;False;Jazz_Ressox;dya0nyb;What a time to be alive!;8g8vqu;https://i.redd.it/rbt35cjw89v01.jpg
2000? lol these Fucking kids.;1;0;False;spin_kick;dyaclwy;What a time to be alive!;8g8vqu;https://i.redd.it/rbt35cjw89v01.jpg
Now this..... This deserves to be trending!;2;0;False;XzHoneyCrums;dya8ezy;What a time to be alive!;8g8vqu;https://i.redd.it/rbt35cjw89v01.jpg
Pretty good English for Indian tech support ;22;2;False;peterjmazza;dyaa36c;What a time to be alive!;8g8vqu;https://i.redd.it/rbt35cjw89v01.jpg
Yeah, cos nobody thought of overthrowing the banking system in every decade since the 12th Century at all.;4;2;False;ChuckStone;dya6w00;What a time to be alive!;8g8vqu;https://i.redd.it/rbt35cjw89v01.jpg
"I would consider it a victory if transfers between banks would happen 24/7. Currently it is 5 times a day (SEPA - europe). I mean what the actual fuck, last i checked it was 2018. No human is involved in the operation. Servers don't need to sleep. I give zero fucks that it will cost billions to change to a new system.

And what is up with 9-5 opening hours. I need to be at work you lazy fucks.

I hope they lose trillions of dollars and pitchforks are involved.";7;3;False;MTIII;dyadgvg;What a time to be alive!;8g8vqu;https://i.redd.it/rbt35cjw89v01.jpg
 bitcoin can overthrow the banks. They are scared. They influence the political system ;1;0;False;Ccstriker77;dyad0tz;What a time to be alive!;8g8vqu;https://i.redd.it/rbt35cjw89v01.jpg
Lol I love it;2;0;False;mkultrahigh;dya0bhw;What a time to be alive!;8g8vqu;https://i.redd.it/rbt35cjw89v01.jpg
It's all mapped out. We're just following the timeline.;1;0;False;TheJamMaster;dyaddhk;What a time to be alive!;8g8vqu;https://i.redd.it/rbt35cjw89v01.jpg
2018: And done.;1;0;False;;dy9y8wo;What a time to be alive!;8g8vqu;https://i.redd.it/rbt35cjw89v01.jpg
Let's overthrow banking system and replace it with what? Who will be giving you mortgage loans? Where will you store your pension? Why is there even a problem with the banks?;-1;0;False;PipeTrance;dyahk76;What a time to be alive!;8g8vqu;https://i.redd.it/rbt35cjw89v01.jpg
"2018: let's overthrow governments, the pyramidal system, end wars, end taxes, decentralize society, etc.

Exit the corrupt system, the choice is yours, the revolution will not be violent.

#buybitcoin";1;0;False;cosminn777;dy9r6o4;What a time to be alive!;8g8vqu;https://i.redd.it/rbt35cjw89v01.jpg
"Hahah. Here’s comes Nano!

I know I know, had to pick one to shill";-3;1;False;TheSilverCipher;dy9rm53;What a time to be alive!;8g8vqu;https://i.redd.it/rbt35cjw89v01.jpg
"then the state ;)";1;0;False;AncapGhxst;dya2wi2;What a time to be alive!;8g8vqu;https://i.redd.it/rbt35cjw89v01.jpg
"Just a few years ago i was like, are we ever gonna get rid of the banking system based on debt and interest.  I can't stop smiling now :)

in bitcoin we trust.";-1;3;False;siglawoo;dy9xyr5;What a time to be alive!;8g8vqu;https://i.redd.it/rbt35cjw89v01.jpg
let's overthrow currency! fuck capitalism;-4;3;False;morreamanha;dya2q2m;What a time to be alive!;8g8vqu;https://i.redd.it/rbt35cjw89v01.jpg
I literally see nothing about Bitcoin outside of this sub. I don't think you manage... anything, really.;0;0;False;Ferocetis;dya9snk;What a time to be alive!;8g8vqu;https://i.redd.it/rbt35cjw89v01.jpg
There's plenty of room for both private/public centralized banks and decentralized public ledgers with privately held no safety net keys. We may even see private companies who's sole purpose is to insure assets on certain chains. There may even be chains that can allow 100% anonymous value transfer. It's a big universe ladies and gentlemen.;1;0;False;eliteturbo;dya5vib;What a time to be alive!;8g8vqu;https://i.redd.it/rbt35cjw89v01.jpg
It's a party ma brousephs!;1;0;False;Siralexwhoo;dya4goo;What a time to be alive!;8g8vqu;https://i.redd.it/rbt35cjw89v01.jpg
[deleted];1;1;False;;dya5fai;What a time to be alive!;8g8vqu;https://i.redd.it/rbt35cjw89v01.jpg
2018: Let’s burn enough fuel generating bitcoin to melt the icecaps.;0;1;False;Th30r14n;dyahjpj;What a time to be alive!;8g8vqu;https://i.redd.it/rbt35cjw89v01.jpg
"Too many young people posting memes. 

1980: Computers are a miracle (about 4 years after Apple formed)

1990: Recession sucks, but this internet thing is pretty interesting. Look, a browser. https://en.wikipedia.org/wiki/WorldWideWeb

2000: Let's overthrow the old economy, everything will go online!!!!!!!!

2010: Capitalism is dead.

2017: Let's over throw the old economy, Bitcoin is going over $100K!!!!!!!!!!!

2020: Capitalism is dead";4;1;False;;dya5qpw;What a time to be alive!;8g8vqu;https://i.redd.it/rbt35cjw89v01.jpg
Youre fucking stupid if you think the people in power will bend over to get fucked by the limp dick of retard reddit crypto aficianados. If it will get them money, theyll still take all the money.;0;1;False;stats_commenter;dyadgl6;What a time to be alive!;8g8vqu;https://i.redd.it/rbt35cjw89v01.jpg
Never thought there'd be anything worse than bankers, but if bitcoiners replace them God help us all. Psychos across the world burning electricity for neopoints.;-1;0;False;Khanstant;dya3ykm;What a time to be alive!;8g8vqu;https://i.redd.it/rbt35cjw89v01.jpg
Tell this to anyone who bought in at $19,000 during the pump-and-dump scam. Their lives were overthrown, and it´s a pretty good bet they don´t even watch this subreddit anymore.;-1;0;False;casapulapula;dyahdic;What a time to be alive!;8g8vqu;https://i.redd.it/rbt35cjw89v01.jpg
I fear that the banks will buy all the bitcoin just to destroy it ;0;1;False;Takes4tobangbro;dyac19e;What a time to be alive!;8g8vqu;https://i.redd.it/rbt35cjw89v01.jpg
First caption would have been my dad in the 80's or me just without the beard and grey hair. ;1;0;False;Oldy1Kenobi;dyadspg;What a time to be alive!;8g8vqu;https://i.redd.it/rbt35cjw89v01.jpg
2018?;3;3;False;wake_iw;dy9owof;What a time to be alive!;8g8vqu;https://i.redd.it/rbt35cjw89v01.jpg
Uh, computers have been out for decades before 2000. Most all schools/universities had computers in the 90s- they weren't using typewriters, lol.;1;0;False;electroze;dyah9nb;What a time to be alive!;8g8vqu;https://i.redd.it/rbt35cjw89v01.jpg
You know that you are a senior member of this subreddit when you recognize memes being reposted.;75;8;False;wooftooth;dy9wfln;What a time to be alive!;8g8vqu;https://i.redd.it/rbt35cjw89v01.jpg
But wouldn't the job of dispensing saved capital be able to be fulfilled by private brokers at that point since everyone will be storing their money in their digital wallets rather than at banks?;0;3;False;C3D2;dya1jsr;What a time to be alive!;8g8vqu;https://i.redd.it/rbt35cjw89v01.jpg
"computers have replaced telephones, tvs, cameras, watches, traditional graphic design tools, cell animation

and now they're replacing ovens.";9;1;False;not_shadowbanned_yet;dya49qt;What a time to be alive!;8g8vqu;https://i.redd.it/rbt35cjw89v01.jpg
You’re never going to completely get rid of banks though.  Their role in the modern day society is to allocate capital to the best projects.  All that’s going to happen is banks with convert their regional government currencies to crypto and start loaning crypto.  Yes it’s a fundamental shift but you’re not eradicating banks.  ;93;9;False;;dy9zynp;What a time to be alive!;8g8vqu;https://i.redd.it/rbt35cjw89v01.jpg
"Sorry for bad english

When where u where bitcon overcome banks?

I was in toilet taking the shit, then redit call me

Bitcoin nice banks bad

Yes.";255;12;False;Indian_Tech_Support;dya5npv;What a time to be alive!;8g8vqu;https://i.redd.it/rbt35cjw89v01.jpg
Looking for a gutenberg press for sale, can pay in Bcash. Find me on xanga and write on my wall.;1;0;False;;dyah4qh;What a time to be alive!;8g8vqu;https://i.redd.it/rbt35cjw89v01.jpg
"But...I don't think this meme was used quite right. He's hiding the pain. Does he realize that he can't overthrow the banking systems but is saying it anyways even though he knows deep down it's not going to happen?

I think this fits better over at /r/buttcoin.";43;5;False;forsayken;dy9thdx;What a time to be alive!;8g8vqu;https://i.redd.it/rbt35cjw89v01.jpg
Just noticed laptop logo is a 4 leaf clover uhm 4 Chan maybe?;3;0;False;StefanWelleweerd;dyabbf2;What a time to be alive!;8g8vqu;https://i.redd.it/rbt35cjw89v01.jpg
2000 was like 2017 also.  The movie Fight Club had a lot of people thinking that.;1;0;False;chuiu;dyagbbm;What a time to be alive!;8g8vqu;https://i.redd.it/rbt35cjw89v01.jpg
love this meme fundament. the guy is priceless.;5;1;False;Hanspanzer;dya3xwc;What a time to be alive!;8g8vqu;https://i.redd.it/rbt35cjw89v01.jpg
"https://smoke.network

best ico of year 2018!

social network for cannabis users!";1;0;False;fernandorogar;dyai1k4;What a time to be alive!;8g8vqu;https://i.redd.it/rbt35cjw89v01.jpg
"Bank is dead    
    
And then what?";2;1;False;magicpear;dyaf844;What a time to be alive!;8g8vqu;https://i.redd.it/rbt35cjw89v01.jpg
">Their role in the modern day society is to allocate capital to the best projects.

They don't allocate to the ""best"".. they allocate to the highest perceived financial risk/reward.. So if a risk or reward doesn't easily lend itself to being translated into a balance sheet, it is ignored. 

In practice this means banks give money to those who already have it because they can put money into giving off a perception of reduced risk and increased reward.  And financially this is the right thing to do.  The best predictor of success is how much money some entity already has.  This isn't because of some greater inherent value, but because of the exact point that I just made--it's a positive feedback loop.  (money/investments/assets/revenue) <-> (perception of success/advertising budget/time spent on pitch deck/time to polish presentation/etc.)

But don't act like banks are doing us a favor.  There's already a tendency for people with money to get more money thrown at them.  Banks are just another entity trying to ride those coattails. 

/end rant

But yes, you're probably right, the basic idea of a bank will still be around in some form or another



";0;0;False;;dya2wfq;What a time to be alive!;8g8vqu;https://i.redd.it/rbt35cjw89v01.jpg
"2000 is the exact year where the majority of households owned a PC.

 [Source](https://i.imgur.com/NufrQH5.jpg)";103;5;False;K_owar_D;dya4jt4;What a time to be alive!;8g8vqu;https://i.redd.it/rbt35cjw89v01.jpg
year 2000? you mean 1970s;182;2;False;gettothachopa;dy9smq2;What a time to be alive!;8g8vqu;https://i.redd.it/rbt35cjw89v01.jpg
Never gets old. ;1;0;False;Nelsono9;dyafclc;What a time to be alive!;8g8vqu;https://i.redd.it/rbt35cjw89v01.jpg
It's important to notice that it took 30 years from the first PC before half of the population owned a PC. 😊;1;0;False;patrickbislev;dyaevg0;What a time to be alive!;8g8vqu;https://i.redd.it/rbt35cjw89v01.jpg
that's when most people started to get them in their house;21;5;False;;dya0cwu;What a time to be alive!;8g8vqu;https://i.redd.it/rbt35cjw89v01.jpg
He feels...lonely;4;1;False;altair222;dy9twtp;What a time to be alive!;8g8vqu;https://i.redd.it/rbt35cjw89v01.jpg
Gold. ;1;0;False;;dyae1uu;What a time to be alive!;8g8vqu;https://i.redd.it/rbt35cjw89v01.jpg
[bitcoin banking](https://bitcoin-ed.com/blog/f/bitcoin-is-a-bank) ;1;0;False;Trinow123-;dy91gtw;Value is always in the eyes of the beholder;8fmasd;https://i.redd.it/y6n54dyjfpu01.jpg
I kindly suggest you reread what i wrote.  You left on a wrong track. ;1;0;False;GLPReddit;dy8kk9a;Value is always in the eyes of the beholder;8fmasd;https://i.redd.it/y6n54dyjfpu01.jpg
The same concept: consensus base. What change is the form,  the design, the implementations... The equivalent with flat are the physical or digital qualities that complicate counterfeiting of banknotes / bills/ balances, and there is hundred of them.  The history of wars has examples of currency attacks by massively counterfeiting them which makes them suddenly unusable.;1;1;False;GLPReddit;dy8lgpb;Value is always in the eyes of the beholder;8fmasd;https://i.redd.it/y6n54dyjfpu01.jpg
Finally... something is be done about this blatant fraud in a new market.;1;1;False;KalEll66;dy8t2sg;This is NOT OK. Upvote for visibility;8ek5c0;https://i.redd.it/w8sjxhnnsut01.png
"Roger has since changed his mind.

It's not Bitcoin Cash and ""Bitcoin Core"". Not ideal but at least it's not fully misleading. ""Bitcoin Core"" should just be Bitcoin though";1;0;False;InteractiveLedger;dy98c0z;This is NOT OK. Upvote for visibility;8ek5c0;https://i.redd.it/w8sjxhnnsut01.png
"The blocks are always contiguous, along consensus-lines, that's what PoW dictates. What do you mean by ""no longer operate""?";1;0;False;gypsytoy;dyai5jb;Sir this seat is reserved for people with disabilities...;8fdy3y;https://i.imgur.com/gynXbKh.jpg
Twitter has been a shit storm. You forget there are plenty of other social media sites. ;1;0;False;wooksarepeople2;dy8rpin;Sir this seat is reserved for people with disabilities...;8fdy3y;https://i.imgur.com/gynXbKh.jpg
Are they continuous after they no longer operate?;1;1;False;zefy_zef;dyahy6l;Sir this seat is reserved for people with disabilities...;8fdy3y;https://i.imgur.com/gynXbKh.jpg
):;1;0;False;hauntedbyspaghetti;dy8sio8;I took a trip with some friends to a sleepy rural town in Japan, hours outside of Tokyo. We entered a cafe and were surprised to see that they accepted bitcoin. Here is my friend buying a chocolate cake.;8fz2iz;https://v.redd.it/6ptl0ma9h1v01
We need this in /r/all;2;0;False;ayanamirs;dy8jnaw;I took a trip with some friends to a sleepy rural town in Japan, hours outside of Tokyo. We entered a cafe and were surprised to see that they accepted bitcoin. Here is my friend buying a chocolate cake.;8fz2iz;https://v.redd.it/6ptl0ma9h1v01
Woman in the back: mfw fiat slowly being dismantled from the inside out.;2;0;False;zbawse;dy8iivm;I took a trip with some friends to a sleepy rural town in Japan, hours outside of Tokyo. We entered a cafe and were surprised to see that they accepted bitcoin. Here is my friend buying a chocolate cake.;8fz2iz;https://v.redd.it/6ptl0ma9h1v01
"You can't cancel a transaction once it's in the mempool.  You could ATTEMPT to submit a different transaction using the same inputs as a higher fee, but MOST nodes won't propagate it, so you'd need to communicate closely with one or more miners, then that miner (or miners, or pool) would need to be the one which successfully finds the next block, and that block would need to be accepted by the network.

Edit:  In fact, if you think it's so easy to cancel a transaction that's in the mempool before it's added to a block, I encourage you to send $5 to this address and then attempt to cancel and/or double spend it.  3JyxK7MxdKRWMfUSoAPfRGvWdZYJGvnhoY";2;1;False;enigmapulse;dy8kvyo;I took a trip with some friends to a sleepy rural town in Japan, hours outside of Tokyo. We entered a cafe and were surprised to see that they accepted bitcoin. Here is my friend buying a chocolate cake.;8fz2iz;https://v.redd.it/6ptl0ma9h1v01
Possibly never. Either it’s not often attempted or the incentive to try is not there. It’s unlikely anyone trading considerable amounts of coin would consider a trade complete with only 0 or 1 confirmation.;2;0;False;robamichael;dy8jewy;I took a trip with some friends to a sleepy rural town in Japan, hours outside of Tokyo. We entered a cafe and were surprised to see that they accepted bitcoin. Here is my friend buying a chocolate cake.;8fz2iz;https://v.redd.it/6ptl0ma9h1v01
"One time, many years ago, there was an orphaned chain with like 26 blocks on it.


Other than that, probably never.  But 6 blocks is I think around the most a single pool ever mined in a row, and I think the number factors this into it.";3;1;False;enigmapulse;dy8jf72;I took a trip with some friends to a sleepy rural town in Japan, hours outside of Tokyo. We entered a cafe and were surprised to see that they accepted bitcoin. Here is my friend buying a chocolate cake.;8fz2iz;https://v.redd.it/6ptl0ma9h1v01
But as long as the transaction has not been recorded in the blockchain, the cake buying individual is free to cancel the transaction in the mempool after he eats the cake. So yes, not waiting for a transactions to be confirmed by subsequent blocks is a problem. ;1;1;False;Chowdahhhh;dy8kl4j;I took a trip with some friends to a sleepy rural town in Japan, hours outside of Tokyo. We entered a cafe and were surprised to see that they accepted bitcoin. Here is my friend buying a chocolate cake.;8fz2iz;https://v.redd.it/6ptl0ma9h1v01
But it was quite amazing, bitcoin are now use as a medium of payment;1;0;False;robinwindy;dy9433m;I took a trip with some friends to a sleepy rural town in Japan, hours outside of Tokyo. We entered a cafe and were surprised to see that they accepted bitcoin. Here is my friend buying a chocolate cake.;8fz2iz;https://v.redd.it/6ptl0ma9h1v01
Err... was talking about the size of the transaction. Didnt think I had to explain it, guess I was wrong!;2;0;False;SerentiveCapital;dy9cxu0;I took a trip with some friends to a sleepy rural town in Japan, hours outside of Tokyo. We entered a cafe and were surprised to see that they accepted bitcoin. Here is my friend buying a chocolate cake.;8fz2iz;https://v.redd.it/6ptl0ma9h1v01
"If you're paying for goods from an account owned by the same entity as the payment processor, you're still paying with Bitcoin. It's just that the transaction doesn't have to be made on chain, because the trustlessness of the blockchain is not required because there is no second entity to trust.

It's like if you go into the shop owned by your parents on pocket money day. They have custody of ""your"" pocket money (let's say $5). It is by all accounts your money, it's just that they have possession of it. You want a $1 chocolate bar. What happens here? Well there's no point in them giving you $5 only for you to return $1. So you take the chocolate bar, and they now hold $4 of your pocket money. The fact that no money changes hands is analogous to the fact that no on chain transaction is necessary.

This analogy is accurate because technically if you're money is in a hot wallet, you don't own it. So money can be rerouted without fees by the wallet and payment processor (if they are the same entity, as in this case).

The lightning network essentially does exactly the same thing, but in a trustless manner using time locked multisignature payment channels.";4;0;False;spinsilo;dy8p255;I took a trip with some friends to a sleepy rural town in Japan, hours outside of Tokyo. We entered a cafe and were surprised to see that they accepted bitcoin. Here is my friend buying a chocolate cake.;8fz2iz;https://v.redd.it/6ptl0ma9h1v01
She gave the product because bitflyer confirmed “we will send you X fiat amount.”  This only increased the total amount of middlemen.;3;1;False;newprofile15;dy8kqdz;I took a trip with some friends to a sleepy rural town in Japan, hours outside of Tokyo. We entered a cafe and were surprised to see that they accepted bitcoin. Here is my friend buying a chocolate cake.;8fz2iz;https://v.redd.it/6ptl0ma9h1v01
"It's just a temporary in place substitute for the lightning network that helps adoption in the meanwhile.

Most of final users (merchants also) don't care about the actual underlining system. Just the final effect.";6;0;False;ZioTron;dy8sms0;I took a trip with some friends to a sleepy rural town in Japan, hours outside of Tokyo. We entered a cafe and were surprised to see that they accepted bitcoin. Here is my friend buying a chocolate cake.;8fz2iz;https://v.redd.it/6ptl0ma9h1v01
legit;1;0;False;dirty_owl;dy9410r;I took a trip with some friends to a sleepy rural town in Japan, hours outside of Tokyo. We entered a cafe and were surprised to see that they accepted bitcoin. Here is my friend buying a chocolate cake.;8fz2iz;https://v.redd.it/6ptl0ma9h1v01
"This is a layer 2 solution, lightning network is basically a decentralized, trustless form of this type of payment.

There will most likely always be custodial wallets which offer services such as this.  Despite what many people here think, this is not intrinsically a bad thing.";11;0;False;enigmapulse;dy8j3ac;I took a trip with some friends to a sleepy rural town in Japan, hours outside of Tokyo. We entered a cafe and were surprised to see that they accepted bitcoin. Here is my friend buying a chocolate cake.;8fz2iz;https://v.redd.it/6ptl0ma9h1v01
The LN is a layer 2 solution. ;2;0;False;stuntycunty;dy8j6uz;I took a trip with some friends to a sleepy rural town in Japan, hours outside of Tokyo. We entered a cafe and were surprised to see that they accepted bitcoin. Here is my friend buying a chocolate cake.;8fz2iz;https://v.redd.it/6ptl0ma9h1v01
what haha...the size of the cake is the basis of transaction fees?;1;0;False;robinwindy;dy94imk;I took a trip with some friends to a sleepy rural town in Japan, hours outside of Tokyo. We entered a cafe and were surprised to see that they accepted bitcoin. Here is my friend buying a chocolate cake.;8fz2iz;https://v.redd.it/6ptl0ma9h1v01
"There is no point 

";1;0;False;vbgtjoj;dy9dpjy;I took a trip with some friends to a sleepy rural town in Japan, hours outside of Tokyo. We entered a cafe and were surprised to see that they accepted bitcoin. Here is my friend buying a chocolate cake.;8fz2iz;https://v.redd.it/6ptl0ma9h1v01
