body;score;nb_replies;stickied;author;id;post_title;post_id;post_link
"Hope my comment goes thru as this comment is old. 


However there is a site that rates the bang for buck of charities. 

Also watch the YouTube video https://youtu.be/rvskMHn0sqQ . Essentially saying that the most good comes from helping the people worst off at the bottom as they have the most upward mobility. ";1;0;False;Flowonbyboats;e1puoam;Investing Tips from a Pro;8982l3;https://i.redd.it/un9mdgl9dlp01.jpg
Dad you really had 1 Bitcoin and sold at 6K. ;388;8;False;rootbeerspin;e1owfsb;Sometime in the late 21st century;8vn0vi;https://i.redd.it/vy5f2boa5m711.jpg
Exactly. Easier target for a decent payout, little risk = prime target ;3;0;False;Youwishh;e1p1wqx;Sometime in the late 21st century;8vn0vi;https://i.redd.it/vy5f2boa5m711.jpg
My mom ;1;1;False;gerrickgerrick;e1p76u0;Sometime in the late 21st century;8vn0vi;https://i.redd.it/vy5f2boa5m711.jpg
Memes have been on here for years.;4;0;False;ebaley;e1q1gl6;Sometime in the late 21st century;8vn0vi;https://i.redd.it/vy5f2boa5m711.jpg
"> doing things

Doing things IS always better than doing nothing.";7;1;False;rockingBit;e1pzsv2;Sometime in the late 21st century;8vn0vi;https://i.redd.it/vy5f2boa5m711.jpg
what's a computer? ;6;0;False;AJaxe1313;e1pu8xt;Sometime in the late 21st century;8vn0vi;https://i.redd.it/vy5f2boa5m711.jpg
Dad what's an altcoin?;7;1;False;HackaB321;e1pv3z9;Sometime in the late 21st century;8vn0vi;https://i.redd.it/vy5f2boa5m711.jpg
'dad you should#ve listened to this guy called john?' he said it all;1;0;False;Felibubele;e1qe0nf;Sometime in the late 21st century;8vn0vi;https://i.redd.it/vy5f2boa5m711.jpg
What was?;3;1;False;mowza;e1pdugo;Sometime in the late 21st century;8vn0vi;https://i.redd.it/vy5f2boa5m711.jpg
What was legal?;1;0;False;;e1putl3;Sometime in the late 21st century;8vn0vi;https://i.redd.it/vy5f2boa5m711.jpg
*Psssst.* He's talking about weed, and he probably lives in a recreationally legal state. ;4;0;False;ISNT_A_ROBOT;e1prha5;Sometime in the late 21st century;8vn0vi;https://i.redd.it/vy5f2boa5m711.jpg
None of us really know what it’s called. That’s because we are in a retail investor chat with a bunch of people pretending to be pros and pretending that their advice is educated. They are all trying to convince themselves that charts don’t matter unless it’s up trending and will throw out literally any explanation to justify their decision to hang tight and pray ;50;2;False;HGTV-Addict;e1p57rf;Sometime in the late 21st century;8vn0vi;https://i.redd.it/vy5f2boa5m711.jpg
Shut up son...shut up *kiss*;3;0;False;nowTHATScomedy;e1pev95;Sometime in the late 21st century;8vn0vi;https://i.redd.it/vy5f2boa5m711.jpg
Although I only bought a small portion of my overall BTC at that level (about $1,300 worth at $19,200 level), I am one of those fucks :(  I literally have no real choice but to HODL;13;2;False;0therSyde;e1pafhc;Sometime in the late 21st century;8vn0vi;https://i.redd.it/vy5f2boa5m711.jpg
Let's not call me a fuck please :(;12;0;False;MuffinMan12347;e1pasag;Sometime in the late 21st century;8vn0vi;https://i.redd.it/vy5f2boa5m711.jpg
"They only lost if they sodled. 

Not if they hodled. ";7;1;False;DailyCloserToDeath;e1pldmn;Sometime in the late 21st century;8vn0vi;https://i.redd.it/vy5f2boa5m711.jpg
.;3;2;False;lunaoreomiel;e1p41o6;Sometime in the late 21st century;8vn0vi;https://i.redd.it/vy5f2boa5m711.jpg
Day one miner.  Satoshi is here!   ^^;7;0;False;Bayminer;e1pn0cn;Sometime in the late 21st century;8vn0vi;https://i.redd.it/vy5f2boa5m711.jpg
"I feel you man.   
All those things we throw thinking of it in vain, and then after some time the stone turns into diamonds hits us pretty hard";3;0;False;haraami_shakaal;e1pc9tt;Sometime in the late 21st century;8vn0vi;https://i.redd.it/vy5f2boa5m711.jpg
I have ~.46 in alts. Can't wait until you'll be able to buy lemonade from the kids down the street for 250 msats ;15;1;False;dylantherabbit2016;e1p0zbs;Sometime in the late 21st century;8vn0vi;https://i.redd.it/vy5f2boa5m711.jpg
"> fan of a bitcoin cashless .

Get out of here with your BCH shilling

^(/s)";2;1;False;gl00pp;e1qpegk;Sometime in the late 21st century;8vn0vi;https://i.redd.it/vy5f2boa5m711.jpg
[removed];2;1;False;;e1pazwz;Sometime in the late 21st century;8vn0vi;https://i.redd.it/vy5f2boa5m711.jpg
back to the future;4;0;False;simjanes2k;e1p7lv4;Sometime in the late 21st century;8vn0vi;https://i.redd.it/vy5f2boa5m711.jpg
It’s a must see sci-fi/comedy movie. Stop what you’re doing and check it out. ;5;1;False;Prismagraphist;e1pqfqr;Sometime in the late 21st century;8vn0vi;https://i.redd.it/vy5f2boa5m711.jpg
"*inner child surfaces to 1up you*


Well i have .111. Beat that loser";1;1;False;masonthursday;e1pbfvw;Sometime in the late 21st century;8vn0vi;https://i.redd.it/vy5f2boa5m711.jpg
Lol sorry. It really is going over my head. I honestly don't get it. ;1;1;False;Deridex3101;e1po53l;Sometime in the late 21st century;8vn0vi;https://i.redd.it/vy5f2boa5m711.jpg
Woohoo!!! I’m number 210,000,000!! I’m number 210,000,000!!!;6;1;False;grippin;e1p1ttv;Sometime in the late 21st century;8vn0vi;https://i.redd.it/vy5f2boa5m711.jpg
*9;6;0;False;;e1p7wuw;Sometime in the late 21st century;8vn0vi;https://i.redd.it/vy5f2boa5m711.jpg
My theft was outside the applicable window to submit a claim in the MtGox group case thing.  It happened a couple months prior to the BIG theft.  Just woke up one morning and there was a transaction I never made... and they were gone... and MtGox just told me 'tough luck' essentially...;25;2;False;midnightflamex;e1pbijw;Sometime in the late 21st century;8vn0vi;https://i.redd.it/vy5f2boa5m711.jpg
LOL;1;0;False;midnightflamex;e1qbgo3;Sometime in the late 21st century;8vn0vi;https://i.redd.it/vy5f2boa5m711.jpg
No szkoda ale i tak na tym zarobiłem 😂;5;0;False;AdamBera;e1q9wzu;Sometime in the late 21st century;8vn0vi;https://i.redd.it/vy5f2boa5m711.jpg
If you send me the dat file from your wallet, if I can crack it I'll split them with you. ;12;1;False;AmNotSatan;e1pfub0;Sometime in the late 21st century;8vn0vi;https://i.redd.it/vy5f2boa5m711.jpg
He thinks he’s exactly as anonymous as he thinks.;80;1;False;Blactory;e1or75i;Sometime in the late 21st century;8vn0vi;https://i.redd.it/vy5f2boa5m711.jpg
r/creepyitalics;2;0;False;aepler315;e1pqetk;Sometime in the late 21st century;8vn0vi;https://i.redd.it/vy5f2boa5m711.jpg
if you don't then you should be saying you do, that way we make a forest for those to hide amongst us. ;2;0;False;cypher437;e1p0z74;Sometime in the late 21st century;8vn0vi;https://i.redd.it/vy5f2boa5m711.jpg
Bitcoin is neither anonymous nor untraceable.;28;1;False;KnifeOfPi2;e1p27b4;Sometime in the late 21st century;8vn0vi;https://i.redd.it/vy5f2boa5m711.jpg
"It is traceable. It is probably the most traceable currency, as every transaction is recorded forever.

What it relies on is anonymity. ";11;0;False;You_Gullible_Sheep2;e1p57gy;Sometime in the late 21st century;8vn0vi;https://i.redd.it/vy5f2boa5m711.jpg
It’s traceable ;14;0;False;patrikb2014;e1oxd9t;Sometime in the late 21st century;8vn0vi;https://i.redd.it/vy5f2boa5m711.jpg
Sinaloans have been dispatched and are on route, gringos. ;4;0;False;KriptoKeeper;e1oulft;Sometime in the late 21st century;8vn0vi;https://i.redd.it/vy5f2boa5m711.jpg
Well if you think about it most of us coming here day in day out hold some coins. If this guy claiming he has 10 btc will make him a target in the next 10 years well sorry to tell you that we are all sitting ducks;1;1;False;miharbidaddah;e1pzov0;Sometime in the late 21st century;8vn0vi;https://i.redd.it/vy5f2boa5m711.jpg
Yeah but you do get mad karma in the now tho;1;0;False;nowTHATScomedy;e1ozi63;Sometime in the late 21st century;8vn0vi;https://i.redd.it/vy5f2boa5m711.jpg
Considering kids routinly are killed over sneakers. Alot of people;19;2;False;Spaceneedle420;e1oykgf;Sometime in the late 21st century;8vn0vi;https://i.redd.it/vy5f2boa5m711.jpg
People kill in armed robberies for a few hundred dollars. ;7;1;False;Youwishh;e1p1v8l;Sometime in the late 21st century;8vn0vi;https://i.redd.it/vy5f2boa5m711.jpg
That’s the thing. I’m a piker. They better off going after the likes of Peter Thiel or Tim Draper. ;-1;1;False;billtae;e1ozgbc;Sometime in the late 21st century;8vn0vi;https://i.redd.it/vy5f2boa5m711.jpg
Was looking for this. Thanks!;3;0;False;B4RF;e1pd218;Sometime in the late 21st century;8vn0vi;https://i.redd.it/vy5f2boa5m711.jpg
[deleted];3;1;False;;e1powws;Sometime in the late 21st century;8vn0vi;https://i.redd.it/vy5f2boa5m711.jpg
The number of the Beast!;5;1;False;NightKnight_CZ;e1p3e9e;Sometime in the late 21st century;8vn0vi;https://i.redd.it/vy5f2boa5m711.jpg
This happened to me too :(;15;0;False;poisenloaf;e1pbq2k;Sometime in the late 21st century;8vn0vi;https://i.redd.it/vy5f2boa5m711.jpg
Pseudonymous in that case.;7;1;False;KnifeOfPi2;e1p76ei;Sometime in the late 21st century;8vn0vi;https://i.redd.it/vy5f2boa5m711.jpg
.... untraceable....the thing that records every single transaction until the end of time....okay.  ;5;0;False;pirateninjamonkey;e1pb6bk;Sometime in the late 21st century;8vn0vi;https://i.redd.it/vy5f2boa5m711.jpg
Well I wouldn’t expect the hacker to be the type of person to do the kidnap anyway. I’d assume if it happens it’s gonna be a hacker hiring a street thug to do it. Or better yet, OP publicly tells someone and no need for the hacker even! ;3;0;False;DimeBagJoe2;e1pfqc1;Sometime in the late 21st century;8vn0vi;https://i.redd.it/vy5f2boa5m711.jpg
What is more professional than leaving no witnesses alive?;2;0;False;gl00pp;e1qp5lb;Sometime in the late 21st century;8vn0vi;https://i.redd.it/vy5f2boa5m711.jpg
Dude satoshi got no gender. So both works;1;1;False;gerrickgerrick;e1phmfb;Sometime in the late 21st century;8vn0vi;https://i.redd.it/vy5f2boa5m711.jpg
Miss Hoover, which one, is one?;3;0;False;unchima;e1px7gs;Sometime in the late 21st century;8vn0vi;https://i.redd.it/vy5f2boa5m711.jpg
Hmm. I've been hanging on in the hopes that BTC will go back up at some point (I don't really _need_ the money and have kind of written it off at this point TBH), and it's sitting in a Nano Ledger in my safety deposit box. You think I should just sell and invest elsewhere? You think BTC isn't going to go back up to any significant level towards the end of the year, or in the next few years? I'm not really in a hurry about it, really. I could let it sit and marinate for another 3-5 years and be fine.;3;0;False;0therSyde;e1qadsy;Sometime in the late 21st century;8vn0vi;https://i.redd.it/vy5f2boa5m711.jpg
"Does the ""Wash Rule"" apply to BTC like it does to stocks? Would I have to sell all my BTC, then wait 31 days, and then buy back in at a lower price point? Also, I've never messed with BTC and taxation; does Coinbase send you some sort of formalized tax reporting form?";1;1;False;0therSyde;e1q7wlj;Sometime in the late 21st century;8vn0vi;https://i.redd.it/vy5f2boa5m711.jpg
“You haven’t lost money until you’ve sold.” is what he’s getting at.;11;0;False;sirquistalot;e1p9kk2;Sometime in the late 21st century;8vn0vi;https://i.redd.it/vy5f2boa5m711.jpg
He thinks, therefore he is;15;1;False;Webfarer;e1owuky;Sometime in the late 21st century;8vn0vi;https://i.redd.it/vy5f2boa5m711.jpg
Nevermind your grandchildren, Lightning payments on NFC are around the corner;4;0;False;AussieBitcoiner;e1pgxzt;Sometime in the late 21st century;8vn0vi;https://i.redd.it/vy5f2boa5m711.jpg
"Iron Maiden - The number of the beast

Got it?";0;1;False;NightKnight_CZ;e1pg1be;Sometime in the late 21st century;8vn0vi;https://i.redd.it/vy5f2boa5m711.jpg
"He thinks he’s anonymous; therefore he’s not. ";4;2;False;kilaju;e1oxpu2;Sometime in the late 21st century;8vn0vi;https://i.redd.it/vy5f2boa5m711.jpg
I think that's the term yes.;3;0;False;kayleepop;e1p87sa;Sometime in the late 21st century;8vn0vi;https://i.redd.it/vy5f2boa5m711.jpg
Wash rule only applies to stocks or securities which should not apply to bitcoin.  But I'm not a tax professional. You can export your coinbase transaction records for tax purposes. I used bitcoin.tax to do this automatically. ;3;0;False;AnusBeer;e1qat5r;Sometime in the late 21st century;8vn0vi;https://i.redd.it/vy5f2boa5m711.jpg
No because that is 666. What does 200,000,000 have to do with it? I think we are missing the joke. ;2;1;False;Deridex3101;e1pih6o;Sometime in the late 21st century;8vn0vi;https://i.redd.it/vy5f2boa5m711.jpg
"    An on NY mo US.
nvm that. at least you're not pussyAF...
";1;0;False;hellABunk;e1oz0fn;Sometime in the late 21st century;8vn0vi;https://i.redd.it/vy5f2boa5m711.jpg
He post about his wealth therefore he will lose it ;1;0;False;joner888;e1pi2bj;Sometime in the late 21st century;8vn0vi;https://i.redd.it/vy5f2boa5m711.jpg
"Oh my does anyone got the joke??? 

Seriously...


Please.


";2;2;False;NightKnight_CZ;e1pk6tu;Sometime in the late 21st century;8vn0vi;https://i.redd.it/vy5f2boa5m711.jpg
Tell us the fuckin' joke!!;2;0;False;davidcwilliams;e1pq6vg;Sometime in the late 21st century;8vn0vi;https://i.redd.it/vy5f2boa5m711.jpg
NFC is a similar thing somewhat, but that’d be pretty neat!;4;0;False;Hmung;e1pay7a;Sometime in the late 21st century;8vn0vi;https://i.redd.it/vy5f2boa5m711.jpg
You guys are making me feel good about my position. ;2;0;False;genius_retard;e1psgo8;Sometime in the late 21st century;8vn0vi;https://i.redd.it/vy5f2boa5m711.jpg
You can trust this guy he’s an... an anus beer. ;3;0;False;OldThymeyRadio;e1q7bgz;Sometime in the late 21st century;8vn0vi;https://i.redd.it/vy5f2boa5m711.jpg
What makes you say that?;1;1;False;kr0ut;e1pevkt;Sometime in the late 21st century;8vn0vi;https://i.redd.it/vy5f2boa5m711.jpg
You can still sign up for civil rehabilitiation, maybe.;10;1;False;Cthulhooo;e1pidch;Sometime in the late 21st century;8vn0vi;https://i.redd.it/vy5f2boa5m711.jpg
You can trust this guy he definitely isn't Satan;6;1;False;AnusBeer;e1q2obh;Sometime in the late 21st century;8vn0vi;https://i.redd.it/vy5f2boa5m711.jpg
He thinks he's exactly as anonymous as he;1;1;False;mathenym22;e1osid1;Sometime in the late 21st century;8vn0vi;https://i.redd.it/vy5f2boa5m711.jpg
It's anonymous assuming you don't link your identity to the randomly generated key that you use. (that's often hard, but never impossible);6;2;False;kayleepop;e1p5wvw;Sometime in the late 21st century;8vn0vi;https://i.redd.it/vy5f2boa5m711.jpg
I come from a different experience and have spent a lot of time in India.  $60,000 usd there is a lot of money. Like, a LOT of money.  There are hundreds of millions of people - literally - that do not earn that in 20 years wages.  It is very frightening to imagine what it could be like with a bounty on your head when nearly every person on the street may consider assaulting you to earn the equivalent of $1,000,000 here! ;1;0;False;McBurger;e1q0e81;Sometime in the late 21st century;8vn0vi;https://i.redd.it/vy5f2boa5m711.jpg
Now you are talking street thugs. No way they have the brains to hack or track down someone on the Internet. Lol;15;1;False;billtae;e1oziw5;Sometime in the late 21st century;8vn0vi;https://i.redd.it/vy5f2boa5m711.jpg
Not professionals.;5;2;False;;e1pa848;Sometime in the late 21st century;8vn0vi;https://i.redd.it/vy5f2boa5m711.jpg
I've seen it but like 7,8 years ago ... Couldn't place this scene, that's why i asked;1;0;False;wampzi;e1qaqjw;Sometime in the late 21st century;8vn0vi;https://i.redd.it/vy5f2boa5m711.jpg
I see...If the future goes there, I think that makes sense. What’s your opinion?;1;0;False;;e1pbbpe;Sometime in the late 21st century;8vn0vi;https://i.redd.it/vy5f2boa5m711.jpg
I hear the dill dozer is getting rebuilt;7;0;False;gammaradiation;e1pj7v5;Sometime in the late 21st century;8vn0vi;https://i.redd.it/vy5f2boa5m711.jpg
Your mom's a dude? How's that work?;1;1;False;Ontopourmama;e1pctrv;Sometime in the late 21st century;8vn0vi;https://i.redd.it/vy5f2boa5m711.jpg
Eating ass ;16;0;False;drunkunsniper;e1pegwi;Sometime in the late 21st century;8vn0vi;https://i.redd.it/vy5f2boa5m711.jpg
Oh sweet jeebus in heaven make my space bucks worth it in the end!;8;0;False;Weigh13;e1pbxhb;Sometime in the late 21st century;8vn0vi;https://i.redd.it/vy5f2boa5m711.jpg
Retail and institutional perspectives are reconciled on the current price.;1;0;False;kgNP8Aht;e1pq8dt;Sometime in the late 21st century;8vn0vi;https://i.redd.it/vy5f2boa5m711.jpg
Ever heard of opportunity cost?;8;1;False;KevinCostNerf;e1pmc6h;Sometime in the late 21st century;8vn0vi;https://i.redd.it/vy5f2boa5m711.jpg
Dude..you're allowed to realize losses can even write them off on your taxes;4;1;False;AnusBeer;e1q20qs;Sometime in the late 21st century;8vn0vi;https://i.redd.it/vy5f2boa5m711.jpg
What?;9;0;False;Hesticles;e1p70rk;Sometime in the late 21st century;8vn0vi;https://i.redd.it/vy5f2boa5m711.jpg
What?;6;1;False;BudgetMenu;e1p81hg;Sometime in the late 21st century;8vn0vi;https://i.redd.it/vy5f2boa5m711.jpg
"I can just imagine that now when I get older and I have grandchildren I'll be telling them stories about how in my day we used to have to take a picture of the QR code now you guys just walk by it and it picks it up.

Did I just invent something? ";4;2;False;TheLastCig;e1pa38q;Sometime in the late 21st century;8vn0vi;https://i.redd.it/vy5f2boa5m711.jpg
We will see you when you get here.;3;0;False;grippin;e1prsi3;Sometime in the late 21st century;8vn0vi;https://i.redd.it/vy5f2boa5m711.jpg
Dad, what's a coin?;6;1;False;whitslack;e1pwa1c;Sometime in the late 21st century;8vn0vi;https://i.redd.it/vy5f2boa5m711.jpg
One day I’ll be that rich.;27;1;False;grippin;e1oya7n;Sometime in the late 21st century;8vn0vi;https://i.redd.it/vy5f2boa5m711.jpg
Nah you should be good. What’s your address so I can make sure it’s not on the hit list....;12;1;False;grippin;e1pbtor;Sometime in the late 21st century;8vn0vi;https://i.redd.it/vy5f2boa5m711.jpg
F#%k you dad.;4;0;False;Haso_04;e1p96w4;Sometime in the late 21st century;8vn0vi;https://i.redd.it/vy5f2boa5m711.jpg
...except Satoshi's grandchildren and a couple of hundred other oligarchs.;1;0;False;Ano_Nymos;e1pli7g;Sometime in the late 21st century;8vn0vi;https://i.redd.it/vy5f2boa5m711.jpg
He's sold one lol. easyyy;1;0;False;BTCMONSTER;e1prcm5;Sometime in the late 21st century;8vn0vi;https://i.redd.it/vy5f2boa5m711.jpg
The halving takes place after how many years? ;1;1;False;tycooperaow;e1q7pik;Sometime in the late 21st century;8vn0vi;https://i.redd.it/vy5f2boa5m711.jpg
[removed];-1;2;False;;e1pkeu4;Sometime in the late 21st century;8vn0vi;https://i.redd.it/vy5f2boa5m711.jpg
HAHA;1;0;False;caspertheghost100;e1ozjnw;Sometime in the late 21st century;8vn0vi;https://i.redd.it/vy5f2boa5m711.jpg
"Zero here!!!!! ;)";1;0;False;bitcoins;e1p54nn;Sometime in the late 21st century;8vn0vi;https://i.redd.it/vy5f2boa5m711.jpg
I sort of have an idea for sci-novel or short story where treasure hunters/spacers from the 23rd century look for the lost wallets since BTC can buy entire planets by then. Would be a neat idea.;1;0;False;writer_boy;e1pviv5;Sometime in the late 21st century;8vn0vi;https://i.redd.it/vy5f2boa5m711.jpg
Because early in the 21st century people realised it was an elaborate Ponzi scheme and now they are worth less than buttons;-1;0;False;Jamie1410;e1pj4w8;Sometime in the late 21st century;8vn0vi;https://i.redd.it/vy5f2boa5m711.jpg
Ok ok. Thanks for your concern. Seriously, thank you. Peace;0;0;False;billtae;e1ozl7i;Sometime in the late 21st century;8vn0vi;https://i.redd.it/vy5f2boa5m711.jpg
I feel like it's the Zeno's race paradox for me. I'll buy $100 when I can but I will never quite reach 1 btc.;1;0;False;thisdoyoucanbut;e1phggo;Sometime in the late 21st century;8vn0vi;https://i.redd.it/vy5f2boa5m711.jpg
What about: Dad did you really piss our inheritance away on some electronic coin? WTF man?;-1;0;False;Gherkinhopper;e1ppm6n;Sometime in the late 21st century;8vn0vi;https://i.redd.it/vy5f2boa5m711.jpg
Dad you really had 30 bitcoins for $300 and used them for weird things on Silk Road!?!?;141;6;False;mowza;e1p4dz2;Sometime in the late 21st century;8vn0vi;https://i.redd.it/vy5f2boa5m711.jpg
Yes son. Because back then a teenager posing as a news host on YouTube said it was definitely going down to $1k because of a downtrend channel. ;183;1;False;nowTHATScomedy;e1ozm4y;Sometime in the late 21st century;8vn0vi;https://i.redd.it/vy5f2boa5m711.jpg
"No son. I sold many bitcoins at $20 ""true story. Lmfao ";17;4;False;Youwishh;e1p1sm2;Sometime in the late 21st century;8vn0vi;https://i.redd.it/vy5f2boa5m711.jpg
"The past, the present, and the future walk into a bar…

It was tense";3;0;False;roguepony;e1pvs4a;Sometime in the late 21st century;8vn0vi;https://i.redd.it/vy5f2boa5m711.jpg
"""wow that was the best sale ever. Bitcoin is not even a penny now""";5;0;False;logical_idiot_III;e1phsmz;Sometime in the late 21st century;8vn0vi;https://i.redd.it/vy5f2boa5m711.jpg
No, son. $6.;2;0;False;ebaley;e1q15dp;Sometime in the late 21st century;8vn0vi;https://i.redd.it/vy5f2boa5m711.jpg
Oh dad.....BTW, when is mommy coming back from that trip she took with the neighbor, George? Ya know, that guy that first told you about bitcoin and to never sell.;4;0;False;tranceology3;e1pac6t;Sometime in the late 21st century;8vn0vi;https://i.redd.it/vy5f2boa5m711.jpg
I just sold 1.6 to buy a car.  =(;2;0;False;BlueberryRush;e1q2hsl;Sometime in the late 21st century;8vn0vi;https://i.redd.it/vy5f2boa5m711.jpg
That's cute, 0.11 baby. ;66;4;False;JCP1377;e1ox9ex;Sometime in the late 21st century;8vn0vi;https://i.redd.it/vy5f2boa5m711.jpg
I have 8, am I cool yet? ;-1;0;False;Mrmitch65;e1phjji;Sometime in the late 21st century;8vn0vi;https://i.redd.it/vy5f2boa5m711.jpg
Haha. What’s a bitcoin?;2;1;False;balognavolt;e1pi01r;Sometime in the late 21st century;8vn0vi;https://i.redd.it/vy5f2boa5m711.jpg
What if at some point having two bitcoins becomes equivalent to ruling the world LMAO;2;0;False;blinkssb;e1p5qmy;Sometime in the late 21st century;8vn0vi;https://i.redd.it/vy5f2boa5m711.jpg
I especially love this;2;1;False;joesmithcq493;e1p2ydf;Sometime in the late 21st century;8vn0vi;https://i.redd.it/vy5f2boa5m711.jpg
Haha .101 here! Bring on the kidnappers!!  ;155;5;False;grippin;e1owbwf;Sometime in the late 21st century;8vn0vi;https://i.redd.it/vy5f2boa5m711.jpg
Nobody has 5 all stars starting either ;55;2;False;nehi99;e1p511o;Sometime in the late 21st century;8vn0vi;https://i.redd.it/vy5f2boa5m711.jpg
I HAD literally 2 bitcoins... bought at 70 bucks a piece in 2013. Kept them on mtGox. You can probably guess what happened next... ;71;4;False;midnightflamex;e1pa178;Sometime in the late 21st century;8vn0vi;https://i.redd.it/vy5f2boa5m711.jpg
This is funny and all but shouldn't this picture be a picture from when Marty is in the future? The joke implies Bitcoin is worth so much no one has two of them any more. In the past people would have more because it was cheaper.;19;3;False;JohnnyRingo84;e1pbscz;Sometime in the late 21st century;8vn0vi;https://i.redd.it/vy5f2boa5m711.jpg
I had 2 bitcoins back in the days, sold them for 920 PLN (Polish Zloty), that's about 244 American Dollars 😉;11;1;False;AdamBera;e1pg2qb;Sometime in the late 21st century;8vn0vi;https://i.redd.it/vy5f2boa5m711.jpg
"i got 200. Satoshis. Maybe. I just need a few more referals.
";24;0;False;RicardoPino;e1owvvs;Sometime in the late 21st century;8vn0vi;https://i.redd.it/vy5f2boa5m711.jpg
Lolz, I have 7 I can't figure out my wallet encryption password ;7;1;False;veul;e1pdz2r;Sometime in the late 21st century;8vn0vi;https://i.redd.it/vy5f2boa5m711.jpg
[deleted];6;2;False;;e1p9yut;Sometime in the late 21st century;8vn0vi;https://i.redd.it/vy5f2boa5m711.jpg
Well I’ve got 10!;53;9;False;billtae;e1opi3v;Sometime in the late 21st century;8vn0vi;https://i.redd.it/vy5f2boa5m711.jpg
"i never understood that scene

marty's mom gives him fuck-me eyes so loud the neighbors can hear it, and the parents dont say shit

this smacked the 4th wall for me harder than time travel stuff";11;1;False;simjanes2k;e1p65j1;Sometime in the late 21st century;8vn0vi;https://i.redd.it/vy5f2boa5m711.jpg
Dad, you really had 10,000BTC and bought 2 pizza's?;4;0;False;g703227;e1q1rp1;Sometime in the late 21st century;8vn0vi;https://i.redd.it/vy5f2boa5m711.jpg
[removed];3;1;False;;e1pacin;Sometime in the late 21st century;8vn0vi;https://i.redd.it/vy5f2boa5m711.jpg
Now that I think about it, if I made underwear branded as 'satoshi nakamoto' would the ladies fall for it and think it's me?;3;0;False;Sirsmokealotx;e1pdeie;Sometime in the late 21st century;8vn0vi;https://i.redd.it/vy5f2boa5m711.jpg
hahah I hope I own a part of one;3;0;False;quietInertia;e1pqfto;Sometime in the late 21st century;8vn0vi;https://i.redd.it/vy5f2boa5m711.jpg
This is good for bitcoin.;5;0;False;RadRandy;e1p2hvh;Sometime in the late 21st century;8vn0vi;https://i.redd.it/vy5f2boa5m711.jpg
Oh please, be real. I’m peanuts with 10 Bitcoins. Target the WinkervossTwins! Not me ;13;3;False;billtae;e1osuuz;Sometime in the late 21st century;8vn0vi;https://i.redd.it/vy5f2boa5m711.jpg
who has two bitcoins today?;5;1;False;cypher437;e1p0ups;Sometime in the late 21st century;8vn0vi;https://i.redd.it/vy5f2boa5m711.jpg
lol;2;0;False;calkob;e1pkhy0;Sometime in the late 21st century;8vn0vi;https://i.redd.it/vy5f2boa5m711.jpg
Back in 2013 i bought 30BTC at 70$ per coin. Sold it later that year at 200+$ 😀;2;0;False;gameoverwatcher;e1pkmyo;Sometime in the late 21st century;8vn0vi;https://i.redd.it/vy5f2boa5m711.jpg
Because the disgusting concentration of Bitcoin wealth was somehow magically alleviated? Or because Bitcoin doesn't exist in the late 21st century?;2;0;False;sukitrebek;e1pmkok;Sometime in the late 21st century;8vn0vi;https://i.redd.it/vy5f2boa5m711.jpg
Ah the joy of being caught off-guard by a hearty BTTF meme!;2;0;False;;e1qkydv;Sometime in the late 21st century;8vn0vi;https://i.redd.it/vy5f2boa5m711.jpg
