body;score;nb_replies;stickied;author;id;post_title;post_id;post_link
"So tell you what.

Let's make that impossible and see how fast the capital ceases to be put at risk.

Lets see how long it takes for the big sucking sound of all of the capital leaving economy to demonstrate the degree to which the alternative is far far worse.
";0;0;False;pictogasm;ds8vbmh;Warren Buffet:;7o9zo1;https://i.redd.it/epko0verp7801.jpg
Updoots;1;0;False;MarcBago;ds8pa42;Warren Buffet:;7o9zo1;https://i.redd.it/epko0verp7801.jpg
Doesn't matter - had sex;3;1;False;ChipAyten;ds8b234;Warren Buffet:;7o9zo1;https://i.redd.it/epko0verp7801.jpg
All of them are estimates, and I point out the number varies almost immediately below. And no need to be a cunt about it, then again, you are the kind of person who seems to be offended by the fact redditors tend to be American, so...;0;1;False;the_loneliest_noodle;ds8dwt6;Warren Buffet:;7o9zo1;https://i.redd.it/epko0verp7801.jpg
Not Fact-rekt, because alexa is an estimation, which means it could vary by as much as 20%.;2;0;False;ezpc510;ds8cczi;Warren Buffet:;7o9zo1;https://i.redd.it/epko0verp7801.jpg
*boom roasted;-2;0;False;voxamps2290;ds88z0e;Warren Buffet:;7o9zo1;https://i.redd.it/epko0verp7801.jpg
i choose to believe the all seeing eye;1;0;False;radiantyellow;ds8737t;Warren Buffet:;7o9zo1;https://i.redd.it/epko0verp7801.jpg
"bitcoin is only ""taxed"" by brokers' fees. But what about the transparency that governments want to implement ?
I have serious doubts about people adopting bitcoin as a real currency one day, except for a search of extreme privacy, who wants to own a very volatile currency ? You can't get up tomorrow with a 25% loss of your funds, unlike ""real"" currencies ";2;1;False;nocoloscopia;ds8604d;Warren Buffet:;7o9zo1;https://i.redd.it/epko0verp7801.jpg
a good trader isn't greedy and will sell.;0;1;False;pag_el;ds87mck;Warren Buffet:;7o9zo1;https://i.redd.it/epko0verp7801.jpg
[deleted];1;1;False;;ds87n7q;Warren Buffet:;7o9zo1;https://i.redd.it/epko0verp7801.jpg
[deleted];4;3;False;;ds864gy;Warren Buffet:;7o9zo1;https://i.redd.it/epko0verp7801.jpg
"He is not an idiot? Who knew. You should tell CNN so the whole world knows!

Now I'll take a wild guess and say you are not an idiot either. Yet if someone would be talking to you about some technological field you have no clue about or you'd know very little about you might have a bit of a difficulty judging correctly any new development in that field.";1;1;False;Bloody_Ozran;ds8e71t;Warren Buffet:;7o9zo1;https://i.redd.it/epko0verp7801.jpg
That's a good point, and I really think that stocks may start to be replaced by company run crytos, since they can probably provide some benefits over the current system with brokerages and all. I'm not sure what you invested in and whether or not if functions like that, though. If what you're talking about moves in value based on an underlying asset, like the value of a company that produces goods, or provides a service, then it's value will be tied to the success of that company, just like stocks. On the other hand, if the only thing making the value go up is new buyers to a cryptocoin, I see it presenting the same problem as BTC. ;3;1;False;peacefulrevolushon;ds8kikl;Warren Buffet:;7o9zo1;https://i.redd.it/epko0verp7801.jpg
"Hi, can you recommend any good passive income coins? The only one I know if kucoin shares, which can give up to 100,000 in yearly dividends but thy have to reach 3 trillion in daily volume, and with new exchanges coming up daily I’m not sure if they will be able to reach that. I saw there was a binance token but I thought that was for a discount on fees and no dividend. Aside from that I’m not sure which other tokens offer dividends. Any help would
Be appreciated, thank you";1;1;False;ElCapitannn;ds8x0mb;Warren Buffet:;7o9zo1;https://i.redd.it/epko0verp7801.jpg
Well said, I'm still gonna hodl but I'm sobering up to the fact that hodling won't make me rich 10 years down the line. ;1;0;False;;ds8zumn;Warren Buffet:;7o9zo1;https://i.redd.it/epko0verp7801.jpg
upvoted.;0;0;False;AnkhUzaSeneb;ds8fddb;Warren Buffet:;7o9zo1;https://i.redd.it/epko0verp7801.jpg
I guess he was lying for all that time. ;3;1;False;AnkhUzaSeneb;ds8dnn4;Warren Buffet:;7o9zo1;https://i.redd.it/epko0verp7801.jpg
IIRC he wasn't the decision maker on that investment. This conversation isn't worth my time beyond making that statement but I encourage you to dig into it.;1;0;False;;ds8k650;Warren Buffet:;7o9zo1;https://i.redd.it/epko0verp7801.jpg
To be fair apple is less of a tech company and more of a marketing company. Apple rarely invents new tech they instead find a market for tech that already exists. A true tech company would be amd, Intel, or Nvidia. Those are the companies that invent and those companies operate very differently than apple.;1;0;False;DaLegendaryNewb;ds8sluf;Warren Buffet:;7o9zo1;https://i.redd.it/epko0verp7801.jpg
 He sees Apple as a retail company rather than a tech company.;1;0;False;KitchenBomber;ds8x1lq;Warren Buffet:;7o9zo1;https://i.redd.it/epko0verp7801.jpg
Seriously.  I've only been in btc for a little over 4 years and i used to send it around and buy shit all the time and it was cheap and quick.  This is a mass adoption problem and the network is too clogged up now.;17;1;False;cratos333;ds8bjk1;Warren Buffet:;7o9zo1;https://i.redd.it/epko0verp7801.jpg
That's what I'm saying. At the best it took 10 mins which is took long to be used anywhere really. People had dreams of using it at the store while shopping.;2;1;False;TheThankUMan66;ds8cyb9;Warren Buffet:;7o9zo1;https://i.redd.it/epko0verp7801.jpg
Alexa was the first link I found that seemed trustworthy. Though the numbers do vary pretty widely between about 40% up to about 60%. Even on the low side, that's a huge majority when you consider the next highest ranking is the UK at less than 10%. ;1;0;False;the_loneliest_noodle;ds87oh7;Warren Buffet:;7o9zo1;https://i.redd.it/epko0verp7801.jpg
It's impractical. I'd sure love having gold compared to centralized inflationary shitcoins like USD or EUR. ;1;1;False;birdperson_c137;ds8sfjh;Warren Buffet:;7o9zo1;https://i.redd.it/epko0verp7801.jpg
"Why did you like it as a currency? I feel the opposite. When it was supposed to be a currency, I saw some theoretical value (not controlled by banks or govts) but it wasn’t going to be useful in my life in a western country where I don’t have any problems with my own use of currency, credit cards, debit cards etc. I don’t need a new way to buy a cup of coffee. Even in developing countries I don’t think people need a new way to buy everyday things, they have things like mpesa.

As a store of value and an alternative to things like gold, which often holds its value when other assets dip/crash globally (which still remains to be seen for btc obviously) as well as for transferring relatively large amounts of money anywhere in the world is where I see the most promise.";0;0;False;poolontheroof;ds88yfm;Warren Buffet:;7o9zo1;https://i.redd.it/epko0verp7801.jpg
"I mean it's already here on the mainnet and it's being implemented as we speak. 

It's not like somebody's going to press the Lightning Network button and every transaction will magically be perfect. 

It's being developed for use today, it will be a slow gain. ";3;0;False;Bag_Full_Of_Snakes;ds87dil;Warren Buffet:;7o9zo1;https://i.redd.it/epko0verp7801.jpg
Yeah and gold's intrinsic value is way lower than its market value, most people aren't buying gold for their fucking transistors. ;3;1;False;Bag_Full_Of_Snakes;ds87evw;Warren Buffet:;7o9zo1;https://i.redd.it/epko0verp7801.jpg
"> Stocks are far less volatile than Bitcoin lmao.

Yeah they're also not cryptos and they have an ROI of 5% after inflation. 

> And most secure? In the last several years more exchanges have fallen due to people running off with millions of dollars worth of coins than have survived without having been compromised. Name one exchange that has been around for 9 years...

Exchanges literally have nothing to do with Bitcoin. What a terrible argument. 

> Lightning network doesn't matter until/unless it is actually implemented and actually results in fast and cheap transactions.

Cool";1;1;False;Bag_Full_Of_Snakes;ds8nu8j;Warren Buffet:;7o9zo1;https://i.redd.it/epko0verp7801.jpg
Why do all world Banks hoard gold? It is a store of value.;0;1;False;Lego_My_Alter_Eggo;ds88x6k;Warren Buffet:;7o9zo1;https://i.redd.it/epko0verp7801.jpg
Well it can still be around 2-3% on a bad day. If sometimes margins do not exceed 5%, so you lose a lot of money.;5;1;False;jazzycoin;ds86xvw;Warren Buffet:;7o9zo1;https://i.redd.it/epko0verp7801.jpg
You didn't listen to what I said. I'm not going  to  repeat myself. Go search  up andreas antonopoulos reasoning for why Bitcoin has value.;2;1;False;Lego_My_Alter_Eggo;ds8xu14;Warren Buffet:;7o9zo1;https://i.redd.it/epko0verp7801.jpg
People who want a store of value are not today's investors. ;1;0;False;Lego_My_Alter_Eggo;ds8fxm7;Warren Buffet:;7o9zo1;https://i.redd.it/epko0verp7801.jpg
Because they aren't smart enough to be three one in charge ;3;0;False;;ds8lc3v;Warren Buffet:;7o9zo1;https://i.redd.it/epko0verp7801.jpg
No he doesn't. What give you the impression that a man who has significant stakes in a number of companies that he has held over the course of decades makes most of his money off short-term-ism of Wall Street and what does that even mean? ;11;2;False;;ds8aybz;Warren Buffet:;7o9zo1;https://i.redd.it/epko0verp7801.jpg
This. ;1;0;False;;ds8lk1l;Warren Buffet:;7o9zo1;https://i.redd.it/epko0verp7801.jpg
"Ironically you will be the one holding the bag when fiat crumbles.  Bitcoin was always a store of value.  It will be a medium of exchnage as well, but not directly.  It will be the foundation on which transnational exchanges are built on.

The world doesn't need a better way to buy things, the world needs a better currency and the most critical function of a currency is to securely store value.";3;3;False;ztsmart;ds8f7ck;Warren Buffet:;7o9zo1;https://i.redd.it/epko0verp7801.jpg
"> meanwhile not even half of the users are from the US

";3;1;False;the_loneliest_noodle;ds88mph;Warren Buffet:;7o9zo1;https://i.redd.it/epko0verp7801.jpg
"Of course, but if i'd been in some of the alts 2 years earlier i could've retired aswell. 

And I think the alts i'm invested in have much higher potential than Bitcoin. I'm not saying they'll ever be 10k a coin, but they have much better tech behind it.

Bitcoin's technology is old and bad compared to some alt coins, and i think it'll fall off the ladder quite quick once people realise this";0;2;False;_alright_then_;ds89hxu;Warren Buffet:;7o9zo1;https://i.redd.it/epko0verp7801.jpg
"This whole thing reminds me of the dot com companies. They were a new technology based investment back then, and people were pouring $$$ into them. Some  investors were lucky and made bazillions. Others went belly up and lost.
";10;2;False;Obibirdkenobi;ds8gyyf;Warren Buffet:;7o9zo1;https://i.redd.it/epko0verp7801.jpg
Unlike crypto. They also hoard a number of other commodities, because they will continue to have value in the future irrespective of currency swings. Crypto has no value other than what is assigned to it by those buying into it.;1;1;False;72_hairy_virgins;ds8k860;Warren Buffet:;7o9zo1;https://i.redd.it/epko0verp7801.jpg
Compared to the fee for transferring the larger amounts of money it’s still negligible I reckon, bitcoin it’s just a flat fee for any amount. So the amount of fees you’d be saving as the amount of money that is being moved increased, the proportional decrease in fees should cover that percentage loss if it is downward trend. ;-1;0;False;andrew_bao;ds8725g;Warren Buffet:;7o9zo1;https://i.redd.it/epko0verp7801.jpg
Yeah didn’t care for that argument either.;0;0;False;TheSecretMe;ds8xz3x;Warren Buffet:;7o9zo1;https://i.redd.it/epko0verp7801.jpg
That sounds like something a trader would say tbh. They aren’t holier than thou monks. ;19;1;False;;ds868ns;Warren Buffet:;7o9zo1;https://i.redd.it/epko0verp7801.jpg
That seems like exactly what a wall street trader would post;2;0;False;GG4;ds8jbew;Warren Buffet:;7o9zo1;https://i.redd.it/epko0verp7801.jpg
[deleted];3;1;False;;ds86awp;Warren Buffet:;7o9zo1;https://i.redd.it/epko0verp7801.jpg
[deleted];1;1;False;;ds8lp75;Warren Buffet:;7o9zo1;https://i.redd.it/epko0verp7801.jpg
"And will rebuy something else until they are wrong and lose it all.

It's addicting, so I get it. It's just sad. ";2;0;False;;ds87q4j;Warren Buffet:;7o9zo1;https://i.redd.it/epko0verp7801.jpg
"Bitcoin is very much taxed in form of capital gains in most countries I've heard of (including USA). Now there's a lot of problems with this interpretation, nevertheless if you e.g. sell bitcoin on an exchange and make a profit and don't include this in your tax form then you've basically commited tax fraud.

And as far as the volatility goes it's still very early in the adoption phase. The more people are using it, the bigger the market cap and the bigger the swings. We're still not there yet, but that doesn't mean we can't get there at all. I mean, you could easily say the same to Wright brothers when they made their first flight. ""LOL, how is this going to be useful transport device, it barely lifted one person for a few seconds"". If bitcoin is to achieve all that it's supposed to be, then we have a long way to go and we're still very early in the process.
";2;0;False;tashtrac;ds8osly;Warren Buffet:;7o9zo1;https://i.redd.it/epko0verp7801.jpg
"> You're talking about currencies in the pre-internet days. Now that we have programmable money, this is no longer the case.

can you point at a single example of this?";1;0;False;0987654231;ds86e97;Warren Buffet:;7o9zo1;https://i.redd.it/epko0verp7801.jpg
"> If bitcoin gest big and you invest in a wrong company you'll be left with nothing

If bitcoin gets big and you invest in the wrong company you are still left with a share of a company with assets, work product and employees, there's the potential for them to re-target a different market. If bitcoin does not become big you are actually left with nothing, the only thing you can do with bitcoin is transact it.

> Also you don't need a company to ""facilitate bitcoin transactions"" really, so I'm not sure what you mean by that.

Transactions aren't magic, they require miners and there's tens of millions of dollars in mining revenue per day.";1;1;False;0987654231;ds87h98;Warren Buffet:;7o9zo1;https://i.redd.it/epko0verp7801.jpg
Still has value. It's a thing that actually exists in the real world.;5;1;False;;ds87he8;Warren Buffet:;7o9zo1;https://i.redd.it/epko0verp7801.jpg
"
I skimmed the whitepaper, that's definately not a share of a company, 

> After the realisation of the project, Bananacoin tokens will be exchangeable
for a certain amount of Lady Finger bananas or equivalent monetary
compensation. Because the token is backed by the market value of 1 kilogram
of bananas, participants can be certain of the success of the project, as the
demand for bananas is constant.


";7;1;False;0987654231;ds83v6f;Warren Buffet:;7o9zo1;https://i.redd.it/epko0verp7801.jpg
"Go and check how many shops accepted bitcoins in 2014, and check how many accepts them now.

We didn't just lose Steam and Newegg. Those are just the biggest names.";4;1;False;ep1939;ds85nwh;Warren Buffet:;7o9zo1;https://i.redd.it/epko0verp7801.jpg
The bitcoin is an incentive to secure the blockchain but it is not necessary for securing it. That is what will happen after all the bitcoins have been mined.;2;1;False;grandalf2017;ds863oq;Warren Buffet:;7o9zo1;https://i.redd.it/epko0verp7801.jpg
"> You can by mining it. Same with bitcoin.

We mined basically almost all the accessible gold there is on this planet. Which is why asteroid mining is getting to be more realistic than gold mining.

> Yes, we can make as many blockchains as we want but there is only one bitcoin, and bitcoin is scarce (21m).

What Bitcoin is tho, is only based on consensus, not intrinsic values.";1;1;False;ep1939;ds8aznm;Warren Buffet:;7o9zo1;https://i.redd.it/epko0verp7801.jpg
"Secure progeny.  DNA - ""Purpose fulfilled""";1;0;False;ruptured_pomposity;ds8ng0m;Warren Buffet:;7o9zo1;https://i.redd.it/epko0verp7801.jpg
Alexa is counting pageviews, meanwhile similarweb is counting unique views, which I was talking about originally. Just because someone replies to you it doesn't mean they are butthurt. But judging by the fact that you called another person in this thread butthurt, it means that ad hominem is your way of arguing.;3;1;False;ezpc510;ds8ec9g;Warren Buffet:;7o9zo1;https://i.redd.it/epko0verp7801.jpg
"I know, I'm just saying that it's not all american in here.

I'm also not the person who said that";0;1;False;_alright_then_;ds88qgv;Warren Buffet:;7o9zo1;https://i.redd.it/epko0verp7801.jpg
"Bitcoin is updated you know. It's not using 2009 tech only.

A lot of these claims of superior tech from alts is spurious.";3;1;False;ebaley;ds8aqqc;Warren Buffet:;7o9zo1;https://i.redd.it/epko0verp7801.jpg
Which ones interest you? ;1;0;False;__phoenix13;ds89s6i;Warren Buffet:;7o9zo1;https://i.redd.it/epko0verp7801.jpg
"I think the argument is that while the dot-com bust blew up a lot of money, it still produced a batch of winners that *did* have value and those survived to become giants. 

The selection process will eventually produce the Amazon of the Crypto world while the pets.com of the crypto world blow up.

Trying to figure out which is which is the challenge.";8;0;False;Faceh;ds8pq69;Warren Buffet:;7o9zo1;https://i.redd.it/epko0verp7801.jpg
Speculation markets have existed a lot longer than Warren Buffett, I'm pretty sure.;2;1;False;NotClever;ds8ung6;Warren Buffet:;7o9zo1;https://i.redd.it/epko0verp7801.jpg
[deleted];-22;1;False;;ds8eqdv;Warren Buffet:;7o9zo1;https://i.redd.it/epko0verp7801.jpg
The point is that that is what people in every other bubble ever would also say, things are only ever a bubble after they fail. Before then it's impossible to say they aren't but entirely plausible to say they are or will turn out to be. That's the nature of bubbles, it has nothing to do with bitcoin, don't take it personally;6;0;False;Fuzzleton;ds85tix;Warren Buffet:;7o9zo1;https://i.redd.it/epko0verp7801.jpg
"If you believe the stock market isn't a ponzi scheme because stocks have ""intrinsic value"" after a market crash as the underlying stock still has a business/products/revenue etc, then cryptos have intrinsic value in the form of feeless/borderless/anonymous/immutable/near instant payments and smart contracts.";0;0;False;due_dilligence;ds8zm4y;Warren Buffet:;7o9zo1;https://i.redd.it/epko0verp7801.jpg
Yep this is what new people in cryptos don't get. Buying shit with CC is pretty easy and fast. But this is not what Bitcoin or crypto should be solving. Fiat money, fractional reserve and central banking are bubbles going to burst. ;4;0;False;birdperson_c137;ds8sb8v;Warren Buffet:;7o9zo1;https://i.redd.it/epko0verp7801.jpg
You can buy gold that is held by an agent. Transaction times are quicker too. ;1;1;False;thekiwifish;ds8ulou;Warren Buffet:;7o9zo1;https://i.redd.it/epko0verp7801.jpg
he's super successful but times change;0;1;False;DeserveDonuts;ds8t3zz;Warren Buffet:;7o9zo1;https://i.redd.it/epko0verp7801.jpg
Ding ding ding. You’ve just figured out bitcoin. Will you be able to Time the market correctly?;76;1;False;rsfc;ds8adqc;Warren Buffet:;7o9zo1;https://i.redd.it/epko0verp7801.jpg
"The entire crypto market is a Ponzi scheme in the *hope* that one of the coins will have long term value. people who are in now make gains when other people decide to put money into the market. This pumps the prices and people want to put more because of the insane gains. Then more people join in and throw in money which keeps pumping the prices. Its a market growing only because the base is growing and the amount of money going in is growing. Not because additional value is being created. 

What happens if everyone at the same time decides to pull their money? The entire market crashes. You might try to liken this to the stock market, but if everyone pulls out money from the stock market the companies still have intrinsic value such as property, products or services, brand names, and a market share to sell those products and services to. 

Now maybe you're agreeing with me in how ridiculous this is and you're going ""Why the hell are people putting money into this?"" And the simple answer is if you put in 3k 3 months ago you might be sitting at 30k right now. And that isn't rare. That's actually kind of common.";25;2;False;Roflllobster;ds8fb6l;Warren Buffet:;7o9zo1;https://i.redd.it/epko0verp7801.jpg
That's called The Bigger Fool Theory...;7;0;False;Oldjamesdean;ds8c55y;Warren Buffet:;7o9zo1;https://i.redd.it/epko0verp7801.jpg
"That's correct. And the world-at-large treats bitcoin as a pyramid scheme while people who truly understand it back it as a currency. That's why the ""value"" of bitcoin is currently measured by how much fiat someone is willing to pay for it.

Bitcoin is currently a pyramid, bubble, jenga tower, whatever the fuck you wanna call it. Keyword = currently. The bubble will pop eventually, there will be mass exodus. But the coin will survive.";18;2;False;crooks4hire;ds89oh7;Warren Buffet:;7o9zo1;https://i.redd.it/epko0verp7801.jpg
Right. Which is literally what it is. Well maybe minus the pyramid scheme name calling, that has some intentional negative connotations.;4;1;False;embeddedGuy;ds89g25;Warren Buffet:;7o9zo1;https://i.redd.it/epko0verp7801.jpg
Exactly;1;0;False;The_Cheezman;ds8je7f;Warren Buffet:;7o9zo1;https://i.redd.it/epko0verp7801.jpg
"Cryptocoins are such a new category of asset, no prior concept really maps cleanly. One might as well ask what kind of boat the Saturn V is. Blockchains are:

- A peer-to-peer bank (but not really)
- An economic community (but not really)
- A distributed government (but not really)
- A networked operating system (but not really)
- A cloud software infrastructure (but not really)
- A reliable [history book](https://www.ribbonfarm.com/2017/05/25/blockchains-never-forget/) (but not really)

It's not exactly true that coins are backed by nothing; they're backed by a worldwide network of hardware, software, and developers. But it's true that the network is deeply unproven in real-world economics (at least proportionally to its market cap), and its value could evaporate at any moment.

Crypto is about as absurd of a long-shot investment as the average tech startup with no revenue and no business model. Whether that qualifies as a pyramid scheme depends on who you ask. :)";1;0;False;Lukifer;ds8ytvj;Warren Buffet:;7o9zo1;https://i.redd.it/epko0verp7801.jpg
[deleted];-1;1;False;;ds8bjmz;Warren Buffet:;7o9zo1;https://i.redd.it/epko0verp7801.jpg
Oh, okay. So, just like any other security. Got it.;-1;1;False;davidcwilliams;ds8gxh6;Warren Buffet:;7o9zo1;https://i.redd.it/epko0verp7801.jpg
"I think there may be some money to make in bitcoin but people better figure out it will collapse soon. Bitcoin is clunky and makes it really difficult to purchase or sell. Crypto currency will succeed but bitcoin will not be the flagship. It will collapse like MySpace when something better and easier to obtain/use matures. Something you can download an app on your iPhone for and buy with Apple Pay. Something you can text someone payment with. 

The crypto currency that is the easiest to use will win. Bitcoin isn’t that currency. Congrats to everyone who made a killing on it. Cash in a chunk before it’s ZERO. ";5;1;False;The_Confederate;ds8au4q;Warren Buffet:;7o9zo1;https://i.redd.it/epko0verp7801.jpg
"How long do you think before ""fiat"" crumbles?";7;1;False;pmstr;ds8qr8g;Warren Buffet:;7o9zo1;https://i.redd.it/epko0verp7801.jpg
[deleted];1;1;False;;ds8i6zq;Warren Buffet:;7o9zo1;https://i.redd.it/epko0verp7801.jpg
[deleted];12;3;False;;ds8567p;Warren Buffet:;7o9zo1;https://i.redd.it/epko0verp7801.jpg
"Point is, people who say money should have intrinsic value have no idea what they’re talking about. I was agreeing with the above comment when he said gold has no intrinsic value.

Ie- gold bugs argument is that gold has “intrinsic” value";1;0;False;Romeo_the_Dog;ds89lle;Warren Buffet:;7o9zo1;https://i.redd.it/epko0verp7801.jpg
"No, trustless decentralized ledgers have no practical value which cant be easily replicated or replaced by a virtually identical competitor, and the same can't be said about the internet.



Honestly, *you're* the one who made this comparison to begin with, /u/psycholioben. Do you really think anyone is going to buy that you suddenly forgot about the entire replicability aspect of *your* analogy within the span of forty minutes? 

You're not making yourself look smarter by disarming a laughably transparent strawman that nobody would ever fall for, man. ";4;1;False;Murgie;ds8arep;Warren Buffet:;7o9zo1;https://i.redd.it/epko0verp7801.jpg
"The currency isn't the ledger.  And even if it was, anyone can make a new ledger for free instantly.

Bitcoin and ledgers are useful.  However, they're entirely replicable and replaceable.  Bitcoin's monetary value is completely determined by what people think other people will pay for it, rather than actual value produced through use of the resource.";6;1;False;Disbfjskf;ds88z9c;Warren Buffet:;7o9zo1;https://i.redd.it/epko0verp7801.jpg
"That would be the physical laws of nature. 

We can call plastic whatever we want, but that's not going to turn it into a group 11 period 6 transition metal. ";9;0;False;Murgie;ds871s3;Warren Buffet:;7o9zo1;https://i.redd.it/epko0verp7801.jpg
