body;score;nb_replies;stickied;author;id;post_title;post_id;post_link
#####*screeeech*;22;1;False;BadChoicez;ds8626q;Warren Buffet:;7o9zo1;https://i.redd.it/epko0verp7801.jpg
Hey! Its me a heretic!;1;0;False;SilverslawPOG;ds8tuhj;Warren Buffet:;7o9zo1;https://i.redd.it/epko0verp7801.jpg
"https://www.alexa.com/siteinfo/reddit.com

57.3% of reddit traffic is US.";53;5;False;the_loneliest_noodle;ds86ksh;Warren Buffet:;7o9zo1;https://i.redd.it/epko0verp7801.jpg
tfw when you criticize others for making false assumptions but inadvertently make a false assumption ;-1;1;False;WeightedPaper;ds89g5i;Warren Buffet:;7o9zo1;https://i.redd.it/epko0verp7801.jpg
i've made more money in altcoins in the last 2 weeks than i have in the year that i was invested in bitcoin;1;1;False;_alright_then_;ds88hjr;Warren Buffet:;7o9zo1;https://i.redd.it/epko0verp7801.jpg
http://cfe.cboe.com/cfe-products/xbt-cboe-bitcoin-futures;4;1;False;Explodicle;ds8cm65;Warren Buffet:;7o9zo1;https://i.redd.it/epko0verp7801.jpg
But that definitely doesn’t mean young people should go wild on bitcoin with half their investable assets. 10% of your investable monies, go for it. You won’t notice it a whole lot in 10 years if it busts.;16;1;False;;ds8qp17;Warren Buffet:;7o9zo1;https://i.redd.it/epko0verp7801.jpg
He's compounded his money since he was 11 and he's been a value investor since he was 19. By the age of 26, he had enough to retire.;13;1;False;genjimain44;ds8t9fw;Warren Buffet:;7o9zo1;https://i.redd.it/epko0verp7801.jpg
I have heard tales of a mythical NAWALT.;2;0;False;0d35dee;ds8khgs;Warren Buffet:;7o9zo1;https://i.redd.it/epko0verp7801.jpg
What a revelation.  Trustless decentralized ledgers have no practical value?  Whelp I’m convinced. ;-2;2;False;psycholioben;ds87w3e;Warren Buffet:;7o9zo1;https://i.redd.it/epko0verp7801.jpg
Metcalfs tho;1;0;False;thepeka;ds833qe;Warren Buffet:;7o9zo1;https://i.redd.it/epko0verp7801.jpg
"> Bitcoin isn't a business, it doesn't generate nor produce anything,

Not true. The bitcoin blockchain produces the means to store unalterable records on a public ledger at a cheap cost. To use the blockchain for smart contracts and and asset tracking all the world's business will need to pay for it in Bitcoin. 

Therefor investing in Bitcoin is like investing in real estate, the real estate being future recording space on the blockchain.

";1;3;False;Bitdigester;ds835d5;Warren Buffet:;7o9zo1;https://i.redd.it/epko0verp7801.jpg
Except if you have a large amount of money that you need to transfer internationally, you're probably not the kind of guy who wants a currency that can change by 20% in a few hours.;32;2;False;jazzycoin;ds86iq9;Warren Buffet:;7o9zo1;https://i.redd.it/epko0verp7801.jpg
Which is true, but some altcoins are much faster and much cheaper for that purpose.;16;1;False;ezpc510;ds85o47;Warren Buffet:;7o9zo1;https://i.redd.it/epko0verp7801.jpg
Are you really trying to argue that Bitcoin has no basis for value? The Reas n bitcoin is valuable is because of the intense computational power that is invested into the system, which produces an immutable, 100% trustworthy ledger. That is incredibly valuable in an age where computers can copy any information it can get it's hands on.  The work done to mine Bitcoin is akin to mining gold, and the reward is similar in both cases aswell, the acquisition of a token of verifiable value.;1;1;False;Lego_My_Alter_Eggo;ds8x1go;Warren Buffet:;7o9zo1;https://i.redd.it/epko0verp7801.jpg
Why? Let other coins be the value transfer coins.;1;1;False;Lego_My_Alter_Eggo;ds855v8;Warren Buffet:;7o9zo1;https://i.redd.it/epko0verp7801.jpg
Bitcoin is actually realively involatile, compared to other altcoins. The larger the market cap becomes, the less volatile it will be. Therefore, in the future, if adoption continues, it can indeed be an effective store of value;0;1;False;Lego_My_Alter_Eggo;ds8f2ml;Warren Buffet:;7o9zo1;https://i.redd.it/epko0verp7801.jpg
Warren Buffet was probably talking about typical investments here, not bitcoin, given his view on bitcoin. The quote was a little misused.;31;1;False;2rustled;ds87bc9;Warren Buffet:;7o9zo1;https://i.redd.it/epko0verp7801.jpg
"I don't think the above commenter is saying work is awful.

They're just pointing out that those investors at the top are there on the backs of a lot of people laboring hard below them.";7;1;False;Burnafterposting;ds8buxr;Warren Buffet:;7o9zo1;https://i.redd.it/epko0verp7801.jpg
You are not alone.;1;0;False;FrenchFranck;ds8bb0q;Warren Buffet:;7o9zo1;https://i.redd.it/epko0verp7801.jpg
Whattt it’s 9.25 up here in RI;3;0;False;ErikTheDon;ds85iyg;Warren Buffet:;7o9zo1;https://i.redd.it/epko0verp7801.jpg
[deleted];2;1;False;;ds855sa;Warren Buffet:;7o9zo1;https://i.redd.it/epko0verp7801.jpg
I get the same impression. I believe he made an open bet with any Wall Street trader that the overall market would outperform a high end stock broker over 10 years. One firm took up his bet, happened to be over 2008.... ;53;2;False;thetechnocraticmum;ds83p8d;Warren Buffet:;7o9zo1;https://i.redd.it/epko0verp7801.jpg
Something doesn't have to be a business generating profit to have value. Otherwise why would gold, silver, platinum, and copper have value? Why do many paintings have value? ;1;2;False;tramselbiso;ds83ghc;Warren Buffet:;7o9zo1;https://i.redd.it/epko0verp7801.jpg
There's a back story to Everything, and part of it is this, Buffets traditional Investments would have been clubbed like a baby seal if the US Government would not have used taxpayer promise to restore the Crisis of Confidence back in 2008. How soon People forget.;1;0;False;askme2b;ds8w4bh;Warren Buffet:;7o9zo1;https://i.redd.it/epko0verp7801.jpg
oh yeah I've turned a $300 investment in an altcoin and turned it into $6200 since last wednesday by trading, i lost so much...;0;1;False;pag_el;ds86gj2;Warren Buffet:;7o9zo1;https://i.redd.it/epko0verp7801.jpg
I do not agree. Who knows what will happen if governments start to regulate the market and apply taxes. On top of that, don't forget that only 1,000 people own 40% of world's total bitcoin mass : the market can move very fast;10;1;False;nocoloscopia;ds84xwl;Warren Buffet:;7o9zo1;https://i.redd.it/epko0verp7801.jpg
I think he means a lot of people investing in Crypto don't understand the technology behind the various Coins they're hoping go to the moon.;39;5;False;citricacidx;ds83fsd;Warren Buffet:;7o9zo1;https://i.redd.it/epko0verp7801.jpg
If the currency has massive adoption, it may be worth much more than a company. ;3;3;False;tramselbiso;ds83dkd;Warren Buffet:;7o9zo1;https://i.redd.it/epko0verp7801.jpg
"You're really investing in the tech/protocol that the currency is based on. And the answer to ""why should I invest in bitcoin tech"" is that if it will gain mainstream adoption, the currency is bound to be worth much more than currently.";1;1;False;tashtrac;ds85mtk;Warren Buffet:;7o9zo1;https://i.redd.it/epko0verp7801.jpg
with cryptos many actually functions as shares of a company.;1;2;False;Senryu_91;ds82jfs;Warren Buffet:;7o9zo1;https://i.redd.it/epko0verp7801.jpg
its true, there are so many fiats: punto, stilo, tipo, panda, 500...;16;1;False;apocalypse912;ds80mgx;Warren Buffet:;7o9zo1;https://i.redd.it/epko0verp7801.jpg
"don't bother or influence others? why not?  
...i don't think he gives a damn about crypto--or needs to.  

and i think Warren Buffet knows much better than you or i what a bubble looks like. he didn't invest in Microsoft or Facebook...but did he say *they* were bubbles?";13;1;False;HelenMiserlou;ds7yrff;Warren Buffet:;7o9zo1;https://i.redd.it/epko0verp7801.jpg
".com bubble happened because people threw lots of money on shitty companies. Just like right now people are throwing lots of money on shippy cryptocurrencies. That doesn't mean that e.g. Amazon was a bubble, just like it doesn't mean that bitcoin is a bubble. And bitcoin is has really competent people behind it, with a really reasonable approach, unlike many alts.

A lot of crypto will pop since there's a shitload of them and realistically only a few can gain mainstream adoption. The fun thing is that the easiest way to liquidate altcoins is to sell them for bitcoin so it's possible that death of altcoins will actually give more value to bitcoin. 

It's also possible that many people will lose faith in crypto in general though, so who knows. ";0;0;False;tashtrac;ds869cv;Warren Buffet:;7o9zo1;https://i.redd.it/epko0verp7801.jpg
"> I'm arguing it's impossible to say

You're right, it's impossible to say Bitcoin is a bubble, because it's not.

The bubble posts come up whenever people want to make a bit more money by selling it and buy lower from shaky new people.";-13;2;False;prelsidente;ds8216h;Warren Buffet:;7o9zo1;https://i.redd.it/epko0verp7801.jpg
"Bitcoin adoption has been shrinking?

[transactions over time](https://blockchain.info/charts/n-transactions?timespan=all)

[blockchain users over time](https://blockchain.info/charts/my-wallet-n-users?timespan=all)";2;1;False;stop_runs;ds83ksz;Warren Buffet:;7o9zo1;https://i.redd.it/epko0verp7801.jpg
[deleted];8;3;False;;ds85rs7;Warren Buffet:;7o9zo1;https://i.redd.it/epko0verp7801.jpg
Because it's cryptographically, mathematically, as of yet, not possible.;2;0;False;methoxeta;ds88n78;Warren Buffet:;7o9zo1;https://i.redd.it/epko0verp7801.jpg
"Whose to say that people wont all get together and decide that the definition of gold now includes plastics and all plastic byproducts?

Then gold will be worthless.";2;2;False;Risingashes;ds866ti;Warren Buffet:;7o9zo1;https://i.redd.it/epko0verp7801.jpg
What you're doing is moving the goal posts. Logical fallacy.  Someone proved you wrong and now you don't like where you put your goals at so you move them to make it harder to make another point even though their example was practically the exact same as yours.;-3;1;False;emanking;ds8iegu;Warren Buffet:;7o9zo1;https://i.redd.it/epko0verp7801.jpg
"of course; i'm just saying that his opinions may or may not apply to this kind of weird market";1;0;False;DeserveDonuts;ds8w47p;Warren Buffet:;7o9zo1;https://i.redd.it/epko0verp7801.jpg
stupid fake money and all them profits! /s;0;1;False;oohehmgee;ds8ioqv;Warren Buffet:;7o9zo1;https://i.redd.it/epko0verp7801.jpg
"Thats different. Because banks normally have their money in non-liquid assets such as loans. The issue there isn't that there isn't value in what they have. The issue is that their value isn't instantly accessible. These assets are based on contracts and unless gross negligence has happened, should absolutely pan out. If one bank were to do it what they would do is likely put a hold on accounts, sell some assets, take a loan in order to keep other assets. 

With cryptocurrencies the ""future value"" is 1 of 2 things. 1) other people put money into the currency which raises the price or 2) it gets largely adopted and used for something making have some sort of usable value. However at this point 2) is pretty much just a hope because it doesn't really happen yet. ";9;1;False;Roflllobster;ds8l65v;Warren Buffet:;7o9zo1;https://i.redd.it/epko0verp7801.jpg
[deleted];4;2;False;;ds8mcvf;Warren Buffet:;7o9zo1;https://i.redd.it/epko0verp7801.jpg
the federal government steps in;1;1;False;tm2443;ds8owk9;Warren Buffet:;7o9zo1;https://i.redd.it/epko0verp7801.jpg
You don't have to withdraw any cash to buy stuff with your money.;0;1;False;Jawbone316;ds8qxaf;Warren Buffet:;7o9zo1;https://i.redd.it/epko0verp7801.jpg
[deleted];4;2;False;;ds8bwlc;Warren Buffet:;7o9zo1;https://i.redd.it/epko0verp7801.jpg
"What is gold backed by? It's only value is extrinsic, barring the relatively low price it would otherwise fetch for industrial uses.

Crypto on the other hand is backed by useful technology and community. Immutable, trustless, uncensorable storage and exchange of information is immensely valuable. 

Bitcoin has a community, a brand, and a large market cap, which makes it especially valuable compared to other cryptocurrencies. Why do you think bankrupt companies are often purchased? Because their legacy and brand name has intrinsic value. ";0;1;False;jazzfruit;ds8e8yi;Warren Buffet:;7o9zo1;https://i.redd.it/epko0verp7801.jpg
Because not everyone understands that keyword. That's why crypto is so volatile: the price is 5% below your buy-in...currently. The typical move is to sell. That's why you see flash sales happen.;1;0;False;crooks4hire;ds8uish;Warren Buffet:;7o9zo1;https://i.redd.it/epko0verp7801.jpg
[deleted];-2;3;False;;ds8djk2;Warren Buffet:;7o9zo1;https://i.redd.it/epko0verp7801.jpg
But that's not how the *stock* is traded. It's traded based on supply and demand. People buy, so they can sell to someone else. Well, except for Warren Buffet.;-2;1;False;davidcwilliams;ds8ju0d;Warren Buffet:;7o9zo1;https://i.redd.it/epko0verp7801.jpg
[deleted];1;1;False;;ds8jp41;Warren Buffet:;7o9zo1;https://i.redd.it/epko0verp7801.jpg
bitcoin, at its most basic, costs what it cost the miner to generate in electricity, or otherwise what he's willing to accept in return for his mining investment. it's essentially commoditized computing power (including cost of electricity, cost of infrastructure & machines, and cost to convince the miner to give it up).;2;2;False;methoxeta;ds873gq;Warren Buffet:;7o9zo1;https://i.redd.it/epko0verp7801.jpg
It sure adds a lot to the discussion, you just missed it;0;1;False;Romeo_the_Dog;ds89wit;Warren Buffet:;7o9zo1;https://i.redd.it/epko0verp7801.jpg
"By all means, specify *exactly* where the flaw or inaccuracy in what I just said is. 

It's really fucking obvious, so you should have no trouble at all. ";2;1;False;Murgie;ds8ig2v;Warren Buffet:;7o9zo1;https://i.redd.it/epko0verp7801.jpg
"Yes, when you try and dispute a point based on incorrect or irrelevant claims, the discussion tends to return to said point after the inaccuracy or irrelevance of your claim has been established.

That's very observant of you to notice. ";4;1;False;Murgie;ds8aapy;Warren Buffet:;7o9zo1;https://i.redd.it/epko0verp7801.jpg
"But then is it differentiated enough to be called something else? Gold and plastic are way different. 22 carat and 18 carat gold versions are differentiated based on the percentage of gold, but still the overall gold on earth is limited.

What makes bitcoin limited other than trust that no one will increase their number? THAT is Buffett and Munger's basis for skepticism.";2;2;False;;ds894kb;Warren Buffet:;7o9zo1;https://i.redd.it/epko0verp7801.jpg
Haha wow you're dumb. ;3;0;False;El_Giganto;ds901zx;Warren Buffet:;7o9zo1;https://i.redd.it/epko0verp7801.jpg
No seriously. Look up what intrinsic value means. It's not what you seem to think it is. Maybe try googling a definition next time before arguing? ;2;0;False;El_Giganto;ds90f6t;Warren Buffet:;7o9zo1;https://i.redd.it/epko0verp7801.jpg
"His assistant does it for him. Why would he do it? 

Bitcoin behaves a good bit like a stock, right? Now let’s see who’s probably the best at understanding investing ever. His advice on how this stock will perform is more reliable (although still not reliable) than literally every single member of the sub. ";2;0;False;Justanotherjustin;ds8g4yo;Warren Buffet:;7o9zo1;https://i.redd.it/epko0verp7801.jpg
"Never getting into tech and not investing in start-ups are different things. He's not a venture capitalist.  

While not as risky as investing in coins or start-ups, Apple was tipped to have peaked and a downward trend was expected, so there was risk involved. And I don't see not taking on risk as a sign that he is not into tech.";3;0;False;thepresentisagift;ds8fi6c;Warren Buffet:;7o9zo1;https://i.redd.it/epko0verp7801.jpg
What's the point of someone with $700 Billion+ in assets buying small-cap tech? lol;1;0;False;forevercountingbeans;ds8nwp5;Warren Buffet:;7o9zo1;https://i.redd.it/epko0verp7801.jpg
"The block limit was reached. There are more transactions being made than can fit into a 1MB block. A backlog started forming. Fees rose to compete for block space. 0 fee payments don't get confirmed anymore. Payments with low fees now regularly get stuck. 0 conf transfers can therefore no longer be trusted as they might never confirm. Transfers with even reasonable fees often take several blocks to confirm. These things combined mean that a payment could take 10-120 minutes or longer instead of the previous 2-3 seconds. This is the problem lightning network is attempting to solve. It's also the reason the ""other coin"" forked away.";4;0;False;ideit;ds8mqjg;Warren Buffet:;7o9zo1;https://i.redd.it/epko0verp7801.jpg
I know, i'm aware of all of it. But you can't deny that waiting hours and paying immensly high fees for BTC is just ridiculous;1;1;False;_alright_then_;ds8ax75;Warren Buffet:;7o9zo1;https://i.redd.it/epko0verp7801.jpg
"I was just replying to that comment. It may be dumb to say ""but it doesn't make sense because it's morning!"", but it's not wrong to assume if you're talking to someone on reddit, odds are higher they're Americans, on an US run website, so getting offended by it also seems silly to me.";1;1;False;the_loneliest_noodle;ds89hf8;Warren Buffet:;7o9zo1;https://i.redd.it/epko0verp7801.jpg
"http://reddit.com.hypestat.com/

Pageviews is 61%, users is 57.3%

Also, I didn't call you butthurt, I called you a cunt because you're the type of person who unprovoked calls other people idiots and make sweeping comments about ""Americans"", aka, a cunt. ";-2;1;False;the_loneliest_noodle;ds8emlr;Warren Buffet:;7o9zo1;https://i.redd.it/epko0verp7801.jpg
"Bitcoin is absolutely indispensable to secure the blockchain since miners will not operate their costly equipment without compensation.  When all the bitcoins have been mined the miners will demand transaction fees in bitcoin to secure the blocks. Do really think that miners will work for free? 
";1;1;False;Bitdigester;ds89wwv;Warren Buffet:;7o9zo1;https://i.redd.it/epko0verp7801.jpg
It's not a pyramid, it's obviously an inverted funnel syatem;4;0;False;SexyGoatOnline;ds8jy3u;Warren Buffet:;7o9zo1;https://i.redd.it/epko0verp7801.jpg
[removed];1;1;False;;ds8cnkj;Warren Buffet:;7o9zo1;https://i.redd.it/epko0verp7801.jpg
Just like stakes in actual productive companies, except nothing at all like that. ;5;1;False;no_frills;ds8i7f0;Warren Buffet:;7o9zo1;https://i.redd.it/epko0verp7801.jpg
I’m surprised people haven’t figured this out yet. I started using BTC about 5 years ago for its intended purpose (as an anonymous digital currency for activities on Tor). Now everyone seems to have a boner for it and it fucking exploded in value and can’t perform its intended purpose. I love the idea of crypto currency but BTC is functionally ruined because every dipshit and their mom bought some when they heard a few people made a million bucks. ;1;0;False;TheBetaBridgeBandit;ds8cxio;Warren Buffet:;7o9zo1;https://i.redd.it/epko0verp7801.jpg
I mean I would call Bitcoin losing almost half its value in a few weeks popping.;1;1;False;emanking;ds8iwu9;Warren Buffet:;7o9zo1;https://i.redd.it/epko0verp7801.jpg
">maybe a currency isn't made from intrinsic value alone 

Ya it's absolutely not, that's the point of the thread. Then the guy above me pointed out, for seemingly no reason, that water has intrinsic value. While true, it adds absolutely zero to the discussion. 

Fiat currency does not have intrinsic value. Commodity currency does. ";6;2;False;RichardShermanator;ds85inq;Warren Buffet:;7o9zo1;https://i.redd.it/epko0verp7801.jpg
I think you're right - intrinsic value is a *hindrance* i.e. a barter system vs a recognized value in a fiat currency. ;2;0;False;Anubis4574;ds86nrz;Warren Buffet:;7o9zo1;https://i.redd.it/epko0verp7801.jpg
"Money gets its value from the network effect.

The more participants you have who use it and believe in it, the more value it has.

I’m going to go off the deep end here but ever wonder why governments charge an income tax? 

It’s to force participation in the fiat economy. 

Strange isn’t it how the federal reserve, income tax and removal of gold standard happened around the same period.";1;0;False;Romeo_the_Dog;ds89rrz;Warren Buffet:;7o9zo1;https://i.redd.it/epko0verp7801.jpg
It's really fucking obvious you haven't the slightest clue about Bitcoin or how cyrptos work at all.  ;0;1;False;emanking;ds8i204;Warren Buffet:;7o9zo1;https://i.redd.it/epko0verp7801.jpg
Annnnd...full circle;-2;1;False;psycholioben;ds895rb;Warren Buffet:;7o9zo1;https://i.redd.it/epko0verp7801.jpg
That is no longer bitcoin.;0;1;False;methoxeta;ds88o32;Warren Buffet:;7o9zo1;https://i.redd.it/epko0verp7801.jpg
Hes probably hoarding fiat and telling people around how the government is backing this so its cool. ;2;1;False;birdperson_c137;ds8smmh;Warren Buffet:;7o9zo1;https://i.redd.it/epko0verp7801.jpg
"No.

Bitcoin has intrinsic value because of the energy put into it. Energy has MORE intrinsic value than a piece of metal since metal is like impure energy in a more stable state.  The fact that we as a species don't understand and can't harness energy from matter better doesn't mean it doesn't have value.  Kind of like how gold wasn't as useful to the Romans because they didn't have electricity but it had other uses besides currency still.  

You've already been caught using plenty of logical fallacies so your points (or lack of) have absolutely no meaning. You do not have the ability to use logic it seems.

Go home, you're wrong. You're done. Shut up already.";-1;3;False;emanking;ds8zm0h;Warren Buffet:;7o9zo1;https://i.redd.it/epko0verp7801.jpg
Find me a small cap tech stock he got into. I'll eat my hat. Investing in Apple in 2016 is hardly risky.;4;2;False;AnkhUzaSeneb;ds8e6p9;Warren Buffet:;7o9zo1;https://i.redd.it/epko0verp7801.jpg
What happened? ;2;1;False;TheThankUMan66;ds8l04n;Warren Buffet:;7o9zo1;https://i.redd.it/epko0verp7801.jpg
hence CENTRALIZED shitcoin in my comment. If you don't realize the benefits of bitcoin as a truly trustless and decentralized, without a central monetary authority, why are you even into crypto? But, why am I casting pearls... Do your own research, believe in whatever asset you see fit;1;0;False;birdperson_c137;ds8uu2p;Warren Buffet:;7o9zo1;https://i.redd.it/epko0verp7801.jpg
It crumbles about 3% a year;1;0;False;ztsmart;ds8zl4a;Warren Buffet:;7o9zo1;https://i.redd.it/epko0verp7801.jpg
Okay gran, why are you on the virtual Internet that doesn't exist again? ;2;0;False;birdperson_c137;ds8siio;Warren Buffet:;7o9zo1;https://i.redd.it/epko0verp7801.jpg
">Crypto has no value other than what is assigned to it by those buying into it. 

This describes literally every asset in the world

";1;2;False;Lego_My_Alter_Eggo;ds8kjxc;Warren Buffet:;7o9zo1;https://i.redd.it/epko0verp7801.jpg
[deleted];2;1;False;;ds87v4m;Warren Buffet:;7o9zo1;https://i.redd.it/epko0verp7801.jpg
[deleted];3;0;False;;ds8800q;Warren Buffet:;7o9zo1;https://i.redd.it/epko0verp7801.jpg
"> If bitcoin gets big and you invest in the wrong company you are still left with a share of a company with assets, work product and employees, there's the potential for them to re-target a different market.

How many companies do you know, that backed a failed technology, switched to something else, recovered and managed to be a good investment? To each their own though. I've done a ton of reasearch (I'm constantly doing more), and it led me to believe that bitcoin is a good bet. If you think betting on companies is better then go bet on companies. I personally see them as bigger risk. I'm not trying to convince you to change your mind, just sharing my perspective, answering your original question.

> Transactions aren't magic, they require miners and there's tens of millions of dollars in mining revenue per day.

Yes, and the miners are doing it currently. I don't see where you'd insert a publicly traded company into the picture though?";1;1;False;tashtrac;ds8p7ul;Warren Buffet:;7o9zo1;https://i.redd.it/epko0verp7801.jpg
This seems as if it's almost the textbook example for unnecessary use of blockchain/crypto technology.;1;0;False;;ds8bmra;Warren Buffet:;7o9zo1;https://i.redd.it/epko0verp7801.jpg
Ill do.;1;0;False;RedditTooAddictive;ds89rha;Warren Buffet:;7o9zo1;https://i.redd.it/epko0verp7801.jpg
"Oh god...

He is old means he is not used to that technology as younger people are. Hence him using a fkin landline and sending one e-mail in his life. I kinda envy him tbh with that. :D

Imagine someone talking to you about biomedical or nuclear physics new technology and you trying to judge how it will do in the future. Assuming you are not expert in both, you might have a hard time judging that shit even if someone tells you and you ""understand"" how it works.";2;1;False;Bloody_Ozran;ds8fwk3;Warren Buffet:;7o9zo1;https://i.redd.it/epko0verp7801.jpg
