body;score;nb_replies;stickied;author;id;post_title;post_id;post_link
"Investors force exchanges to increase capacity.According to statistics Globo, in Brazil the number of traders Bitcoin twice exceeds the number of traditional fund investors. 
Author: https://freedman.club/en/brazilskie-investori-vkladivayutsya-v-bitcoin/";1;0;False;seniorlancelot;dt48hl8;It's official! 1 Bitcoin = $10,000 USD;7g9cd3;https://v.redd.it/e7io27rdgt001
Bitcoin is similar to gold. It can be a currency and also an investment. It is finite as well, unlike fiat currency.;1;0;False;the-peoplesbadger;dt4c8x2;Everyone who's trading BTC right now;7olruz;http://cdn.mutually.com/wp-content/uploads/2017/06/08-19.jpg
https://imgur.com/a/x1srd;1;0;False;tvdor;dt3wtuz;BTC dropping due to lack of quality 11k memes. Closest support line is at 9k Vegeta memes.;7gg0j2;https://www.reddit.com/r/Bitcoin/comments/7gg0j2/btc_dropping_due_to_lack_of_quality_11k_memes/
"I'm broke, will be thankful for any donation!
BTC Address: 1AxK1akSRX2uqRwDJDeTxNaR2PhSYoh8g3";1;0;False;ackuteco;dt3jade;I'm donating 5057 BTC to charitable causes! Introducing The Pineapple Fund;7jj0oa;https://www.reddit.com/r/Bitcoin/comments/7jj0oa/im_donating_5057_btc_to_charitable_causes/
