body;score;nb_replies;stickied;author;id;post_title;post_id;post_link
Yea, I know.  Sucks when people call you out for childish whining )-:;0;0;False;errydaymf0;d2u2y7m;"WikiLeaks on Twitter: ""We'd like to thank #Satoshi hoaxer Dr Craig Wright for showing how bankrupt the fact-checking standards are at the BBC, LRB & Economist.""";4hozs5;https://twitter.com/wikileaks/status/727562945840975872
I agree with everything you are saying.;1;0;False;Ilogy;d2tnn4f;"WikiLeaks on Twitter: ""We'd like to thank #Satoshi hoaxer Dr Craig Wright for showing how bankrupt the fact-checking standards are at the BBC, LRB & Economist.""";4hozs5;https://twitter.com/wikileaks/status/727562945840975872
Eh, I'm done engaging with someone that should have been born into a condom.;1;1;False;cynoclast;d2u2p74;"WikiLeaks on Twitter: ""We'd like to thank #Satoshi hoaxer Dr Craig Wright for showing how bankrupt the fact-checking standards are at the BBC, LRB & Economist.""";4hozs5;https://twitter.com/wikileaks/status/727562945840975872
"You were whining about having to pay for an education.  I pointed out that you were doing that...and you tell me to grow up?  Lol.

When kids mature into adults, they generally stop whining about having to pay people for goods/services.";0;1;False;errydaymf0;d2tz8k1;"WikiLeaks on Twitter: ""We'd like to thank #Satoshi hoaxer Dr Craig Wright for showing how bankrupt the fact-checking standards are at the BBC, LRB & Economist.""";4hozs5;https://twitter.com/wikileaks/status/727562945840975872
Grow up, kid.;1;1;False;cynoclast;d2ty6do;"WikiLeaks on Twitter: ""We'd like to thank #Satoshi hoaxer Dr Craig Wright for showing how bankrupt the fact-checking standards are at the BBC, LRB & Economist.""";4hozs5;https://twitter.com/wikileaks/status/727562945840975872
"> Today, all of human knowledge is available for free in various forms (wikipedia, library of congress, khan academy, MIT open courseware.) No debt necessary.

Not so much when I was getting my degree 12 years ago. But fuck everybody from the last two decades, right?";1;1;False;cynoclast;d2t8twl;"WikiLeaks on Twitter: ""We'd like to thank #Satoshi hoaxer Dr Craig Wright for showing how bankrupt the fact-checking standards are at the BBC, LRB & Economist.""";4hozs5;https://twitter.com/wikileaks/status/727562945840975872
You chose to pay people to educate you?  Poor, poor child.;0;1;False;errydaymf0;d2tt10b;"WikiLeaks on Twitter: ""We'd like to thank #Satoshi hoaxer Dr Craig Wright for showing how bankrupt the fact-checking standards are at the BBC, LRB & Economist.""";4hozs5;https://twitter.com/wikileaks/status/727562945840975872
private companies build roads.  Now, as always.;1;0;False;object_oriented_cash;d2tflrg;"WikiLeaks on Twitter: ""We'd like to thank #Satoshi hoaxer Dr Craig Wright for showing how bankrupt the fact-checking standards are at the BBC, LRB & Economist.""";4hozs5;https://twitter.com/wikileaks/status/727562945840975872
Just because some people think taxes are value for money, or other people think that we need the public services that taxes provide.. It doesn't justify forcing people to pay under threat of incarceration. Morally and ethically taxation is indistinguishable from armed robbery, if you want to defend people who do it to you that's your business but I personally think that happy taxpayers are clearly suffering from a form of Stockholm syndrome.;1;0;False;BitcoinFuturist;d2t203d;"WikiLeaks on Twitter: ""We'd like to thank #Satoshi hoaxer Dr Craig Wright for showing how bankrupt the fact-checking standards are at the BBC, LRB & Economist.""";4hozs5;https://twitter.com/wikileaks/status/727562945840975872
