body;score;nb_replies;stickied;author;id;post_title;post_id;post_link
Still enough characters to pin it down to a unique transaction. Plus, even if you had greened out the entire destination address, I suspect the value of the payment and fee are enough to find it anyway.;28;1;False;CaptainOuzo;dlz0mpu;:/ That was an expensive coffee I just bought to show a demo transaction.;6vbfip;https://i.redd.it/6axrx39awahz.jpg
"Haha doesn't **deserve** a high market cap? My, my, but we seem to have a high opinion of ourselves, don't we? Did Exxon Mobil ask your permission before reaching a +$400 billion market cap? Did gold double check with you before rising to $7 trillion in global supply?  

Bitcoin doesn't give a fuck what **you** think merits a high market cap. Adoption is growing every day at unprecedented rates. The markets speak for themselves, and you don't know what the fuck you're talking about.";1;0;False;EveryRedditorSucks;dlz9w61;:/ That was an expensive coffee I just bought to show a demo transaction.;6vbfip;https://i.redd.it/6axrx39awahz.jpg
I'm with you. All this nonsense about Bitcoin not being good for retail payments is depressing. It wouldn't be the end of Bitcoin but if it can't handle all kinds of payments it is not nearly as interesting. I for one think lightning is going to get us a long way when it comes to retail. ;24;2;False;Bitcoin_Acolyte;dlzan3d;:/ That was an expensive coffee I just bought to show a demo transaction.;6vbfip;https://i.redd.it/6axrx39awahz.jpg
It really is. You're just missing it. ;150;4;False;arcrad;dlz3dat;:/ That was an expensive coffee I just bought to show a demo transaction.;6vbfip;https://i.redd.it/6axrx39awahz.jpg
"It's entirely the point. The only reason for Bitcoin to exist is for censorship resistance. It's about monetary sovereignty, not cheap payments. 

The people who've promoted Bitcoin as a competitor to PayPal or Visa never understood why Bitcoin was valuable in the first place. 

If you want cheap payments, wait for 2nd layer solutions such as lightning. The base layer must have its censorship resistance preserved at all costs, and that requires decentralization, and that is bloody expensive.";25;6;False;hairy_unicorn;dlz6gjl;:/ That was an expensive coffee I just bought to show a demo transaction.;6vbfip;https://i.redd.it/6axrx39awahz.jpg
"By a few percent...

http://fork.lol/pow/hashrate";1;0;False;Phayzon;dlzk5r1;:/ That was an expensive coffee I just bought to show a demo transaction.;6vbfip;https://i.redd.it/6axrx39awahz.jpg
[removed];1;1;False;;dlz4z4g;:/ That was an expensive coffee I just bought to show a demo transaction.;6vbfip;https://i.redd.it/6axrx39awahz.jpg
"> Hell, even BTC had negligible transaction fees not that long ago.

Actually it had no fees at all, at first. Ah the good old days. ";1;0;False;maydaylenny;dlzdmrc;:/ That was an expensive coffee I just bought to show a demo transaction.;6vbfip;https://i.redd.it/6axrx39awahz.jpg
10 times the tx, 40 times the fees.. nice;77;5;False;absolute-black;dlyyxf4;:/ That was an expensive coffee I just bought to show a demo transaction.;6vbfip;https://i.redd.it/6axrx39awahz.jpg
That entirely misses the point, which is that if BCH had the transaction volume of BTC, it could support many more transactions.;17;1;False;drewshaver;dlz3fww;:/ That was an expensive coffee I just bought to show a demo transaction.;6vbfip;https://i.redd.it/6axrx39awahz.jpg
"Dogecoin got me into crypto. I wish people would adopt it as the standard to send small amounts of money. It's fun, it's quirky, it's cheap and it's Doge!

The transaction times are also insanely quick.

I guess litecoin kind of fulfils that though.";1;0;False;Darthfuzzy;dlz94t6;:/ That was an expensive coffee I just bought to show a demo transaction.;6vbfip;https://i.redd.it/6axrx39awahz.jpg
"dogecoin is also more widely accepted than BCH.

shots fired.";79;1;False;drleephd;dlz87p1;:/ That was an expensive coffee I just bought to show a demo transaction.;6vbfip;https://i.redd.it/6axrx39awahz.jpg
Such future prospects. Very cash. Wow!;85;1;False;albuminvasion;dlz542c;:/ That was an expensive coffee I just bought to show a demo transaction.;6vbfip;https://i.redd.it/6axrx39awahz.jpg
" - Because it's a source of revenue?
 - Because they are part of the big block camp that doesn't understand the engineering reasons behind the roadmap that most core devs are in support of?
";3;0;False;earonesty;dlz441c;:/ That was an expensive coffee I just bought to show a demo transaction.;6vbfip;https://i.redd.it/6axrx39awahz.jpg
Because you don't control your private keys and therefore your Bitcoin there.;10;0;False;Leaky_gland;dlz239v;:/ That was an expensive coffee I just bought to show a demo transaction.;6vbfip;https://i.redd.it/6axrx39awahz.jpg
Because coinbase regroup transactions in large numbers and pay only one (larger) fee...;26;1;False;sucrenoir;dlz097c;:/ That was an expensive coffee I just bought to show a demo transaction.;6vbfip;https://i.redd.it/6axrx39awahz.jpg
"I think he/she was being sarcastic, as in: don't buy coffee with bitcoin (it's not a payment instrument quite yet).  If you need it to secure your assets in Venezuela, however, well that's a different story...

This is not news to those who actually *understand* massive engineering projects of this type take TIME to evolve when they finally need to scale (because they've proven viable and *need* to scale). 

In the meantime, if you must use bitcoin to solve your 1st world caffeine problems, grab yourself a bitcoin debit card and piggyback mastercard / visa.  Can't be bothered to apply for a bitcoin debit card?  Why not help yourself to a big mug of Patience Venti instead as we await sidechain solutions that will scale to billions of transactions...

Still not convinced?

For those who need actual 'experts' with technical merit to help them to figure all this out, here's FB Executive Chamath Palihapitiya explaining the above in simple terms:

https://www.youtube.com/watch?v=G6iIhooV8UY

> ""I personally own Bitcoin in my hedge fun, I own Bitcoin in my fund, I own Bitcoin in my private account. It is a huge deal. It's a huge, huge, huge deal. Because what you're talking about right now is, for the next three to five years, an unbelievably better stored value. **It is gold 2.0. Right.** The value of gold that hedges the world economy, about $9 trillion, right? Thirteen hundred an ounce, of which only a hundred to a hundred and fifty dollars is the actual production value. So all the rest is imputed.... Well, guess what? I can do the same thing with Bitcoin only I can do it outside the purview of every single government. **[Bitcoin is] being used everywhere you would think it would be used**. Russia, Iran, Iraq, Egypt, Venezuela, Argentina. **Everywhere you have currency pressure.** Everywhere you want to basically shield your assets. **And then, after that, it will probably become a payment mechanism.**"" - Chamath

Hope that all makes sense, I'm off to put the kettle on (and make my own coffee) :)";68;7;False;smeggletoot;dlz0sld;:/ That was an expensive coffee I just bought to show a demo transaction.;6vbfip;https://i.redd.it/6axrx39awahz.jpg
"LN is good, but you will need to open a channel, and close a channel. Either count as 1 SegWit transaction.

You better buy coffee regularly, or it won't be worth it. Think of it as a subscription fee you have to pay to use Bitcoin.";6;1;False;HanC0190;dlzacin;:/ That was an expensive coffee I just bought to show a demo transaction.;6vbfip;https://i.redd.it/6axrx39awahz.jpg
Paypal refuses to work with weed4bitcoin.com (selling vape stuff) yet it allows [and accepts that ebay can do the same and will accept paypal](http://www.ebay.com/itm/4-in-1-Vape-Kit-Juice-Dab-wax-Oil-concentrate-pen-Dual-Quartz-1100-Mah-/112530755351);4;0;False;frankenmint;dlzgwnn;:/ That was an expensive coffee I just bought to show a demo transaction.;6vbfip;https://i.redd.it/6axrx39awahz.jpg
also just makes it a quasi-money wire service instead of a currency if you can't reasonably buy everyday items with it;1;0;False;cypherreddit;dlzg3t4;:/ That was an expensive coffee I just bought to show a demo transaction.;6vbfip;https://i.redd.it/6axrx39awahz.jpg
right, more like a trillion dollar market cap.;1;0;False;ozme;dlz39fb;:/ That was an expensive coffee I just bought to show a demo transaction.;6vbfip;https://i.redd.it/6axrx39awahz.jpg
"Sais who? Reality seems to be disagreeing with you.
";2;1;False;lpqtr;dlz3a7z;:/ That was an expensive coffee I just bought to show a demo transaction.;6vbfip;https://i.redd.it/6axrx39awahz.jpg
You're missing the point. It, by definition, justified whatever market cap the market wants. Should bitcoin justify it's price by asking really nicely? Get you're head out of the clouds! ;9;2;False;arcrad;dlz3gjt;:/ That was an expensive coffee I just bought to show a demo transaction.;6vbfip;https://i.redd.it/6axrx39awahz.jpg
The market is always right.;8;3;False;bitsteiner;dlz5pj5;:/ That was an expensive coffee I just bought to show a demo transaction.;6vbfip;https://i.redd.it/6axrx39awahz.jpg
How big is gold's market cap?;20;4;False;Sugar_Daddy_Peter;dlz3mcn;:/ That was an expensive coffee I just bought to show a demo transaction.;6vbfip;https://i.redd.it/6axrx39awahz.jpg
"**Quantitative easing**

Quantitative easing (QE), alternatively known as Large Scale Assets Purchases, is a monetary policy in which a central bank creates new electronic money in order to buy government bonds or other financial assets to stimulate the economy (i.e., to increase private-sector spending and return inflation to its target). An unconventional form of monetary policy, it is usually used when standard monetary policy has become ineffective at combating a falling money supply. A central bank implements quantitative easing by buying specified amounts of financial assets from commercial banks and other financial institutions, thus raising the prices of those financial assets and lowering their yield, while simultaneously increasing the money supply. This differs from the more usual policy of buying or selling short-term government bonds to keep interbank interest rates at a specified target value.

***

^[ [^PM](https://www.reddit.com/message/compose?to=kittens_from_space) ^| [^Exclude ^me](https://reddit.com/message/compose?to=WikiTextBot&message=Excludeme&subject=Excludeme) ^| [^Exclude ^from ^subreddit](https://np.reddit.com/r/Bitcoin/about/banned) ^| [^FAQ ^/ ^Information](https://np.reddit.com/r/WikiTextBot/wiki/index) ^| [^Source](https://github.com/kittenswolf/WikiTextBot)   ^]
^Downvote ^to ^remove ^| ^v0.26";1;0;False;WikiTextBot;dlz50i7;:/ That was an expensive coffee I just bought to show a demo transaction.;6vbfip;https://i.redd.it/6axrx39awahz.jpg
Best comment in the entire (shill) thread.;5;0;False;jimmajamma;dlz7u5x;:/ That was an expensive coffee I just bought to show a demo transaction.;6vbfip;https://i.redd.it/6axrx39awahz.jpg
"Bitcoin was not intended for money laundring with ridiculous fees. 


It was ment for cheap, fast and decentralised transactions between two peers without a middle man. 

There are other far more viable coins for the applications you describe than bitcoin. ";32;3;False;dementperson;dlz6i17;:/ That was an expensive coffee I just bought to show a demo transaction.;6vbfip;https://i.redd.it/6axrx39awahz.jpg
Shut up Jerry.;0;0;False;DevilsAdvertiser;dlz47x5;:/ That was an expensive coffee I just bought to show a demo transaction.;6vbfip;https://i.redd.it/6axrx39awahz.jpg
Wasn't that always the point?  Bitcoin is about becoming your own bank.  Banks don't like dealing with tiny transactions so neither should Bitcoin.  I once walked into the bank with a check for something like $0.60 and the teller laughed at me.  She still cashed it but she definitely laughed.;1;0;False;rydan;dlzj504;:/ That was an expensive coffee I just bought to show a demo transaction.;6vbfip;https://i.redd.it/6axrx39awahz.jpg
"The point is really not up to you to decide. Markets bla bla....

Nobody could have predicted was BTC turned out to be, but now that is what it is. ";1;0;False;maydaylenny;dlzdgd9;:/ That was an expensive coffee I just bought to show a demo transaction.;6vbfip;https://i.redd.it/6axrx39awahz.jpg
So clearly you think bitcoin is overvalued. Go ahead. Sell, short bitcoin, and then buy into whatever coin you think is undervalued. There's a killing to be made if you are right. ;1;1;False;Auwardamn;dlzc7bd;:/ That was an expensive coffee I just bought to show a demo transaction.;6vbfip;https://i.redd.it/6axrx39awahz.jpg
"Cant you see that a currency with high transaction overhead, is a badly designed currency? One of the major tenets of bitcoin is ""cut the middleman, you dont need banks to give money to someone else"". ";1;0;False;xNIBx;dlzigxf;:/ That was an expensive coffee I just bought to show a demo transaction.;6vbfip;https://i.redd.it/6axrx39awahz.jpg
"You are confusing the terms money and value. If you want to have value outside of anyone's control or ability to view records of it you can just as easily, perhaps more, buy gold coins.  You can redeem gold for cash anywhere in the world, literally.  Bitcoin isn't there yet. 
 
Bitcoins advantage is the ability to conduct transactions, at a distance, quickly, anonymously.  That isn't about holding them.  That they happen to gain value is merely a nice current side effect of a currency that isn't inflated at a crazy rate.  Deflation is a wonderful thing. 
";1;0;False;Quicksilver;dlzivdx;:/ That was an expensive coffee I just bought to show a demo transaction.;6vbfip;https://i.redd.it/6axrx39awahz.jpg
Well I am definitely missing the point;6;1;False;Paranoid__Android;dlz58hp;:/ That was an expensive coffee I just bought to show a demo transaction.;6vbfip;https://i.redd.it/6axrx39awahz.jpg
Lightning will;1;1;False;Hodl_it;dlyzc2t;:/ That was an expensive coffee I just bought to show a demo transaction.;6vbfip;https://i.redd.it/6axrx39awahz.jpg
">I can see less than 1% of BTC tx count on http://fork.lol/tx/txs
>Fees are 4x though due to hashrate shift. 

That's ""average transactions per block"" and BCC has just burned through 2016 blocks in a few days at a rate of almost a block per minute at times. In real terms it's at more like 5% of BTC's transaction rate.";3;1;False;SpeedflyChris;dlzh6yq;:/ That was an expensive coffee I just bought to show a demo transaction.;6vbfip;https://i.redd.it/6axrx39awahz.jpg
Part of the problem is that most wallets suggest fees isnâ€™t it? If users set manual fees I think on both chains, BTC and BCH perhaps the fee average would be lower. ;1;0;False;bitcoinhodler89;dlz460r;:/ That was an expensive coffee I just bought to show a demo transaction.;6vbfip;https://i.redd.it/6axrx39awahz.jpg
that isn't even a response to my comment lol. A high demand would create higher tx numbers, yes, but why would it effect the tx/fee ratio? You could have mentioned the price difference (which literally accounts for said ratio), or the recent large shift in hashrate, or plenty of other things... but instead you dropped this condescending, incorrect, dismissive bullshit lol. ;1;0;False;absolute-black;dlz3q8c;:/ That was an expensive coffee I just bought to show a demo transaction.;6vbfip;https://i.redd.it/6axrx39awahz.jpg
I was mostly joking but I do find it funny how instead of pointing out the real reasons (price difference, recent hash rate changes, etc) you just immediately completely dismiss everything with 'b-b-but no one uses shitcoin cash anyway!!';1;1;False;absolute-black;dlzbiaf;:/ That was an expensive coffee I just bought to show a demo transaction.;6vbfip;https://i.redd.it/6axrx39awahz.jpg
"With Bitcoinâ€™s value seemingly skyrocketing, wouldnâ€™t it be better to hold on to it and pay your Chinese vendors through traditional methods?

Edit: not sure why I got downvoted for asking a legitimate question. Thatâ€™s part of the problem here on Reddit. I donâ€™t need upvotes but to downvote a question seems antithetical to the purpose of this website. ";0;2;False;ronimal;dlz6ti9;:/ That was an expensive coffee I just bought to show a demo transaction.;6vbfip;https://i.redd.it/6axrx39awahz.jpg
If you're transferring money to the Philippines regularly, can I ask a question? Do you know how the party in the Philippines turns that Bitcoin back into Fiat?;1;0;False;kn100;dlzib2g;:/ That was an expensive coffee I just bought to show a demo transaction.;6vbfip;https://i.redd.it/6axrx39awahz.jpg
It used to, and still should be able to do both;1;0;False;tjathf;dlzgn48;:/ That was an expensive coffee I just bought to show a demo transaction.;6vbfip;https://i.redd.it/6axrx39awahz.jpg
I agree but what if you don't know the other party too well? It's gone!;1;0;False;;dlzgi11;:/ That was an expensive coffee I just bought to show a demo transaction.;6vbfip;https://i.redd.it/6axrx39awahz.jpg
"> But when you need to pay a vendor in China for a shipment, Bitcoin is simply the best way to do it.

Sounds good for small business, but what about the big dogs? They aren't paying retail bank fees like us. When Pepsi pays a supplier they aren't hurting from fees.";1;0;False;Xearoii;dlz731v;:/ That was an expensive coffee I just bought to show a demo transaction.;6vbfip;https://i.redd.it/6axrx39awahz.jpg
I think transferwise might be cheaper for that amount of money? Worth checking as things fluctuate...;5;1;False;Free__Will;dlz4ndc;:/ That was an expensive coffee I just bought to show a demo transaction.;6vbfip;https://i.redd.it/6axrx39awahz.jpg
"Unless that vendor accepts altcoins which only cost a fraction Bitcoin's TX fees.

And if that vendor doesn't accept altcoins yet it will sooner than later.

And if Bitcoin doesn't take competition from altcoins more serious it will soon become one.";84;6;False;RavenDothKnow;dlz4zcm;:/ That was an expensive coffee I just bought to show a demo transaction.;6vbfip;https://i.redd.it/6axrx39awahz.jpg
Your point is fair, but I don't think that this view is going to help spread Bitcoin adoption. The vast majority of daily transactions have small values, and traditionally, Bitcoin has been sold as a means to bring freedom and autonomy to the people. It's fine if Bitcoin changes to be something for larger stores of value and transactions, but for cryptocurrency to be adopted worldwide, these small transactions must be supported.;26;5;False;theocarina;dlz5guu;:/ That was an expensive coffee I just bought to show a demo transaction.;6vbfip;https://i.redd.it/6axrx39awahz.jpg
"Lets break down their comment.  

> then bitcoin doesn't deserve a high market cap  

What does deserve mean in this context? The value of bitcoin is found naturally by the market. In that sense I would say it ""deserves"" whatever market cap it is at.  

>if it's just going to be used by a small number of users to send money around.  

Should gold be less valuable by the same virtue? No, probably not. 

The whole comment is just malignant.  

It's like saying at the advent of electricity: ""then electricity doesn't deserve a high market value because it's only used by a few people currently"" because it is a new technology that is rapidly developing. Pure inanity. 


";1;0;False;arcrad;dlzjxwe;:/ That was an expensive coffee I just bought to show a demo transaction.;6vbfip;https://i.redd.it/6axrx39awahz.jpg
Actually, everyone will use lightning that's why it's being developed...wealthy people aren't going to pay $5 more than everyone else for coffee just because they can.;1;0;False;AxiomBTC;dlzaqku;:/ That was an expensive coffee I just bought to show a demo transaction.;6vbfip;https://i.redd.it/6axrx39awahz.jpg
It can be both things ;1;0;False;The_Symbiotic_Boy;dlzi24r;:/ That was an expensive coffee I just bought to show a demo transaction.;6vbfip;https://i.redd.it/6axrx39awahz.jpg
You can send bitcoins, it's just that sending small amounts is impractical.;-3;3;False;killerstorm;dlzgpl1;:/ That was an expensive coffee I just bought to show a demo transaction.;6vbfip;https://i.redd.it/6axrx39awahz.jpg
"Anybody who's into Bitcoin for reasons beyond hype over the latest USD exchange rate probably understands this already - one of the attractions of Bitcoin is the so-called ""pseudonymity"" it provides. People like to maintain their privacy, even while every Bitcoin transaction is part of a public ledger.";1;0;False;BlackDeath3;dlzhswc;:/ That was an expensive coffee I just bought to show a demo transaction.;6vbfip;https://i.redd.it/6axrx39awahz.jpg
So the CIA knows i ordered tabs on the silky road?;0;1;False;DevilsAdvertiser;dlz3zfz;:/ That was an expensive coffee I just bought to show a demo transaction.;6vbfip;https://i.redd.it/6axrx39awahz.jpg
kewl;1;0;False;earonesty;dlz42x7;:/ That was an expensive coffee I just bought to show a demo transaction.;6vbfip;https://i.redd.it/6axrx39awahz.jpg
"Which says something about the current lifespan of Bitcoin. What amount of USD do you think is the lowest you could manually find a transaction for in a day with no automation? My bet is 500K~

And before anyone downvote me into oblivion, I'm just saying Bitcoin is still in its infancy, not that it is a failure.";13;4;False;Put_It_All_On_Blck;dlz50tv;:/ That was an expensive coffee I just bought to show a demo transaction.;6vbfip;https://i.redd.it/6axrx39awahz.jpg
There are some blockchain query services already. You don't need to code it.;1;1;False;crptdv;dlzd2ai;:/ That was an expensive coffee I just bought to show a demo transaction.;6vbfip;https://i.redd.it/6axrx39awahz.jpg
Nah, you just don't get it.;14;0;False;queen_fucko;dlz32fb;:/ That was an expensive coffee I just bought to show a demo transaction.;6vbfip;https://i.redd.it/6axrx39awahz.jpg
You're looking at half of the problem. ;129;2;False;Frogolocalypse;dlz60em;:/ That was an expensive coffee I just bought to show a demo transaction.;6vbfip;https://i.redd.it/6axrx39awahz.jpg
"Use a block explorer to search for the first or last parts of the address that are still visible?

You may also be able to find it using the spend amount(s).";0;0;False;paleh0rse;dlz3ioo;:/ That was an expensive coffee I just bought to show a demo transaction.;6vbfip;https://i.redd.it/6axrx39awahz.jpg
">Bitcoin cannot scale right now because adding new nodes does not improve TPS. Hopefully by one way or another this problem is solved.  

When you're spreading nonsense like this I'm not sure how to respond... 

And yes, I am clearly here just to fuck with people. ";-4;1;False;arcrad;dlz8n8u;:/ That was an expensive coffee I just bought to show a demo transaction.;6vbfip;https://i.redd.it/6axrx39awahz.jpg
Behind the scenes, yes it does.;1;0;False;ebaley;dlz77pk;:/ That was an expensive coffee I just bought to show a demo transaction.;6vbfip;https://i.redd.it/6axrx39awahz.jpg
Are you saying Coinbase pays some of the transaction fee cost itself?;38;2;False;wildmaiden;dlzjnw8;:/ That was an expensive coffee I just bought to show a demo transaction.;6vbfip;https://i.redd.it/6axrx39awahz.jpg
yep, coinbase is subsidizing the crazy fees.;54;0;False;planetary_pelt;dlzl1xu;:/ That was an expensive coffee I just bought to show a demo transaction.;6vbfip;https://i.redd.it/6axrx39awahz.jpg
ðŸ‘;1;0;False;;dlzjpjw;:/ That was an expensive coffee I just bought to show a demo transaction.;6vbfip;https://i.redd.it/6axrx39awahz.jpg
