body;score;nb_replies;stickied;author;id;post_title;post_id;post_link
"Remind Me! 5 years

How much did that coffee really cost? ";400;9;False;lgats;dlz0v9h;:/ That was an expensive coffee I just bought to show a demo transaction.;6vbfip;https://i.redd.it/6axrx39awahz.jpg
Maybe testnet is the solution.;0;0;False;lonely_guy0;dlz31ec;:/ That was an expensive coffee I just bought to show a demo transaction.;6vbfip;https://i.redd.it/6axrx39awahz.jpg
Use a Bitcoin debit card. There is no Bitcoin credit card, afaik.;-1;1;False;ebaley;dlz0gks;:/ That was an expensive coffee I just bought to show a demo transaction.;6vbfip;https://i.redd.it/6axrx39awahz.jpg
TenX;0;1;False;PorterAndSlydell;dlyy09d;:/ That was an expensive coffee I just bought to show a demo transaction.;6vbfip;https://i.redd.it/6axrx39awahz.jpg
 The title of the whitepaper said free hookers and blow.  But economics  doesn't work that way. ;-5;0;False;Frogolocalypse;dlz6blc;:/ That was an expensive coffee I just bought to show a demo transaction.;6vbfip;https://i.redd.it/6axrx39awahz.jpg
"Yet he modelled it on gold. The white paper is not the holy bible anyway and Satoshi gave up. 

Bitcoin should play to its strengths. Censorship-resistance, limited supply etc.

It will have a fight on its hands to usurp Visa and Mastercard.";-3;1;False;ebaley;dlz0dqp;:/ That was an expensive coffee I just bought to show a demo transaction.;6vbfip;https://i.redd.it/6axrx39awahz.jpg
"well, why i would I pay huge fees when I can get something WITHOUT any fee? 
I pay by using a card and i have zero fee. BTC is not made for every day use.";0;0;False;kroter;dlz0hnc;:/ That was an expensive coffee I just bought to show a demo transaction.;6vbfip;https://i.redd.it/6axrx39awahz.jpg
Despite the cash blurb Satoshi used he obviously based it on gold.;-1;2;False;ebaley;dlz0i9p;:/ That was an expensive coffee I just bought to show a demo transaction.;6vbfip;https://i.redd.it/6axrx39awahz.jpg
Development stagnation.;1;0;False;shitpersonality;dlzb6sv;:/ That was an expensive coffee I just bought to show a demo transaction.;6vbfip;https://i.redd.it/6axrx39awahz.jpg
Maybe LN will help us to get back there. I really do.;2;1;False;drlsd;dlyyuut;:/ That was an expensive coffee I just bought to show a demo transaction.;6vbfip;https://i.redd.it/6axrx39awahz.jpg
Once I establish a Moonbeam, LN or any other payment channel with my local starbucks I can purchase coffee at pretty much 0USD fees. ;4;1;False;lpqtr;dlz3gsf;:/ That was an expensive coffee I just bought to show a demo transaction.;6vbfip;https://i.redd.it/6axrx39awahz.jpg
Bitcoin hasn't solved the problem of 3% cash back, travel points, universal acceptance, plus cash flow management that credit cards bring, even with unlimited blocks.  So it's kind of dishonest to say larger blocks isnall you need to compete ;3;1;False;CONTROLurKEYS;dlzbpxu;:/ That was an expensive coffee I just bought to show a demo transaction.;6vbfip;https://i.redd.it/6axrx39awahz.jpg
don't forget banking the poor. Now they can get wiped out by paying a fee. ;3;1;False;Bitcoin_TPS_Report;dlz00wo;:/ That was an expensive coffee I just bought to show a demo transaction.;6vbfip;https://i.redd.it/6axrx39awahz.jpg
Exactly. I made a $30 transaction three days ago and payed $2 in fees. IT HAS ZERO CONFIRMATIONS AFTER THREE DAYS.;21;5;False;846671933029;dlyyzsc;:/ That was an expensive coffee I just bought to show a demo transaction.;6vbfip;https://i.redd.it/6axrx39awahz.jpg
If a spam attack and render your network too expensive to use, maybe you should come up with a solution for it?;1;0;False;HanC0190;dlzgcgo;:/ That was an expensive coffee I just bought to show a demo transaction.;6vbfip;https://i.redd.it/6axrx39awahz.jpg
When will a network not be attacked? If a network cannot handle being attacked, it needs to be fixed or ditched.;1;0;False;dynosan;dlz8vpx;:/ That was an expensive coffee I just bought to show a demo transaction.;6vbfip;https://i.redd.it/6axrx39awahz.jpg
Source? Explain which group of these fee-paying transactions are spam: https://core.jochen-hoenicke.de/queue/#2w;3;2;False;ekerstein;dlz9ioc;:/ That was an expensive coffee I just bought to show a demo transaction.;6vbfip;https://i.redd.it/6axrx39awahz.jpg
It doesent scale;-1;2;False;;dlzhdot;:/ That was an expensive coffee I just bought to show a demo transaction.;6vbfip;https://i.redd.it/6axrx39awahz.jpg
Name them;7;4;False;Ornolfr;dlz9nr8;:/ That was an expensive coffee I just bought to show a demo transaction.;6vbfip;https://i.redd.it/6axrx39awahz.jpg
Also in the early days, someone paid 10k BTC for some pizza. You really want to go back to the early days? ;-2;2;False;arcrad;dlz3rhx;:/ That was an expensive coffee I just bought to show a demo transaction.;6vbfip;https://i.redd.it/6axrx39awahz.jpg
">Actually, the way it worked was that Bitcoin in the very early stage of the game was actually completely reasonable for coffee purchases. Fees used to be optional.  

Yes. When no one used it!  

Are you really surprised that the fees increased as demand increased?  

Get your head out of the clouds! ";-5;1;False;arcrad;dlz3ozn;:/ That was an expensive coffee I just bought to show a demo transaction.;6vbfip;https://i.redd.it/6axrx39awahz.jpg
">Actually, the way it worked was that Bitcoin in the very early stage of the game was actually completely reasonable for coffee purchases. Fees used to be optional.

An unintended consequence of launching a new product/service that no one knows about. But that wasn't and never will be the reason for Bitcoin's existence. The killer feature of Bitcoin is a censorship resistance. Only decentralization can guarantee that. ***If all you want is a cheap, efficient database and don't care about anything else, a centralized platform such as Visa and Paypal will always outperform a blockchain***.";1;0;False;SkyNTP;dlzgcvl;:/ That was an expensive coffee I just bought to show a demo transaction.;6vbfip;https://i.redd.it/6axrx39awahz.jpg
"> in the very early stage of the game was actually completely reasonable for coffee purchases.

By way of example, this post about a coffee shop accepting bitcoin is one of the all-time most upvoted posts in r/bitcoin:

https://www.reddit.com/r/Bitcoin/comments/3b2m9v/bitcoffee_buenos_aires_argentina_these_guys/

r/bitcoin enthusiastically celebrated merchants accepting small bitcoin transactions just a couple of years ago.";0;0;False;merreborn;dlzdmr5;:/ That was an expensive coffee I just bought to show a demo transaction.;6vbfip;https://i.redd.it/6axrx39awahz.jpg
When was fees added? ;1;1;False;bobleplask;dlz1d10;:/ That was an expensive coffee I just bought to show a demo transaction.;6vbfip;https://i.redd.it/6axrx39awahz.jpg
"It was not doomed to happen . It was completely intentional.  The network cannot exist in the long run without tx fees.  As the block reward shrinks you need 1 of 2 things to happen.  Fee per byte needs to increase or numbers of txs in a block needs to increase.  Both result in total fees per block increasing.  

 Without one of those happening then miner's revenue makes it not as worthwhile for them.  There must be fees and those fees need to cover their their operating and capital costs.";2;2;False;Syde80;dlz5ato;:/ That was an expensive coffee I just bought to show a demo transaction.;6vbfip;https://i.redd.it/6axrx39awahz.jpg
You used sPayPal, what did you expect? ;-1;0;False;arcrad;dlz3n7o;:/ That was an expensive coffee I just bought to show a demo transaction.;6vbfip;https://i.redd.it/6axrx39awahz.jpg
Why does it say the fees as 0.00144684 BTC whereas in the screenshot it is 0.00087429 BTC?;119;3;False;lonely_guy0;dlz3hqb;:/ That was an expensive coffee I just bought to show a demo transaction.;6vbfip;https://i.redd.it/6axrx39awahz.jpg
"    Transaction: c4ef948a7ac0e6cbe3585ac57b15a5a2261ded0e73ab42812de0131d73ee1ff3
    Included in block: 481613
    Confirmation time: 2017-08-22 13:42:00 UTC
    Size: 373 bytes
    Relayed by IP: 185.52.2.69
    Double spend: false

    Previous outputs (addresses)
    19Rd7juDAvMqxe6ajWLfiX21ZRC2CWzTfz --> 0.00087573 btc
    1Kdc6yowU5voQSih3cBoAZ8nqL1Y5pkFE5 --> 0.00086987 btc

    Redeemed outputs (addresses):
    4.719e-05 btc --> 1KQkaPYK3W4WWQnnCdVxSpxJwY9tiDXMDT
    0.00025157 btc --> 115EytJ2XXeJ4WM4hempadVmcVDsb4Ysvr


^View ^on ^block ^explorers:

^^*[Blockchain.info](https://blockchain.info/tx/c4ef948a7ac0e6cbe3585ac57b15a5a2261ded0e73ab42812de0131d73ee1ff3)* ^^**|** ^^*[BlockTrail.com](https://blocktrail.com/BTC/tx/c4ef948a7ac0e6cbe3585ac57b15a5a2261ded0e73ab42812de0131d73ee1ff3)* ^^**|** ^^*[Blockr.io](https://btc.blockr.io/tx/info/c4ef948a7ac0e6cbe3585ac57b15a5a2261ded0e73ab42812de0131d73ee1ff3)* ^^**|** ^^*[BitPay.com](https://insight.bitpay.com/tx/c4ef948a7ac0e6cbe3585ac57b15a5a2261ded0e73ab42812de0131d73ee1ff3)* ^^**|** ^^*[Smartbit.com.au](https://www.smartbit.com.au/tx/c4ef948a7ac0e6cbe3585ac57b15a5a2261ded0e73ab42812de0131d73ee1ff3)*

*****

^^I ^^am ^^a ^^bot. ^^*/r/crypto_bot* ^^| [^^Message ^^my ^^creator](http://www.reddit.com/message/compose?to=busterroni)";157;2;False;crypto_bot;dlyy2ef;:/ That was an expensive coffee I just bought to show a demo transaction.;6vbfip;https://i.redd.it/6axrx39awahz.jpg
im just curious how you did it;25;8;False;Juankestein;dlz1iy2;:/ That was an expensive coffee I just bought to show a demo transaction.;6vbfip;https://i.redd.it/6axrx39awahz.jpg
You are smart :);17;2;False;Hodl_it;dlyz8um;:/ That was an expensive coffee I just bought to show a demo transaction.;6vbfip;https://i.redd.it/6axrx39awahz.jpg
"Got [this](http://www.businessinsider.com/the-combined-wealth-of-everyone-in-the-entire-world-2016-9) figure of total wealth to be 241 trillion USD. Generalizing the percentage of wealth owned by the top 1% to match what's in the US, 1% owns 35% of total wealth [(cite)](https://en.wikipedia.org/wiki/Wealth_inequality_in_the_United_States). 

35% of 241 trillion ==  84.35 trillion

1% of 84.35 == 0.8435 trillion == 843 billion 500 million

Market cap of BTC right now is 66 billion 800 million. 

I don't do a lot of math but if anything I""d like to see how my estimation fares to something that's a bit more accurate by someone who knows more than I do. :)";1;0;False;mattisb;dlz92nu;:/ That was an expensive coffee I just bought to show a demo transaction.;6vbfip;https://i.redd.it/6axrx39awahz.jpg
I don't believe that buying coffees alone makes a currency strong, but I do think that being virtually unusable for everyday purchases makes a currency fairly weak. I don't have the best understanding, so feel free to convince me otherwise. What are you proposing for daily use?;1;0;False;purtymouth;dlz7x9o;:/ That was an expensive coffee I just bought to show a demo transaction.;6vbfip;https://i.redd.it/6axrx39awahz.jpg
"> all of world's millionaires/billionaires will put 1% of their wealth into Bitcoin

So about $100bil";2;0;False;BlueOak777;dlzhqkh;:/ That was an expensive coffee I just bought to show a demo transaction.;6vbfip;https://i.redd.it/6axrx39awahz.jpg
If the total user base is the top 1 million wealthiest people, that represents 80% of global wealth.   The other 20% can use the lightning network.;8;2;False;earonesty;dlz4b5n;:/ That was an expensive coffee I just bought to show a demo transaction.;6vbfip;https://i.redd.it/6axrx39awahz.jpg
">If you believe that buying coffees makes currency powerful, you're delusional.

It doesn't make it ""powerful"" (whatever that means), it makes it a currency. It's not a currency unless its generally accepted for goods and services, and it will never become generally accepted if nobody uses it because it's too slow and expensive. ";72;1;False;anti09;dlz4mid;:/ That was an expensive coffee I just bought to show a demo transaction.;6vbfip;https://i.redd.it/6axrx39awahz.jpg
[deleted];136;2;False;;dlz9kzd;:/ That was an expensive coffee I just bought to show a demo transaction.;6vbfip;https://i.redd.it/6axrx39awahz.jpg
Having money is about having the option to send it.;48;2;False;BigBlockIfTrue;dlz9ia4;:/ That was an expensive coffee I just bought to show a demo transaction.;6vbfip;https://i.redd.it/6axrx39awahz.jpg
"> mempool 

I googled and found [this](https://blockchain.info/charts/mempool-size?timespan=1year&daysAverageString=7). I don't know a lot of technical knowledge with bitcoin but it's cool to have a measure of its general popularity. TIL, thanks.";1;0;False;mattisb;dlz7tpz;:/ That was an expensive coffee I just bought to show a demo transaction.;6vbfip;https://i.redd.it/6axrx39awahz.jpg
r/darknetmarkets;1;0;False;zakdendy;dlzgyrm;:/ That was an expensive coffee I just bought to show a demo transaction.;6vbfip;https://i.redd.it/6axrx39awahz.jpg
Probably more fun to just travel to Colombia with these cheap flight prices and enjoy it there. Plus, it is a fantastic country...;1;0;False;dreamingawake09;dlz9bpb;:/ That was an expensive coffee I just bought to show a demo transaction.;6vbfip;https://i.redd.it/6axrx39awahz.jpg
Lmao;10;0;False;Luminatii;dlz83r4;:/ That was an expensive coffee I just bought to show a demo transaction.;6vbfip;https://i.redd.it/6axrx39awahz.jpg
deleted  ^^^^^^^^^^^^^^^^0.7904  [^^^What ^^^is ^^^this?](https://pastebin.com/FcrFs94k/15292);23;1;False;janoshik;dlz6nbt;:/ That was an expensive coffee I just bought to show a demo transaction.;6vbfip;https://i.redd.it/6axrx39awahz.jpg
"you didnt just buy coffee. You bought coffee and recorded it across thousands of nodes for the rest of human history. Coffee just doesn't need that level of security. It doesn't need to be remembered for all of time.

Payments like this which its ok for the world to forget about are for layer 2 solutions like the lightning network or even a regular old payment service provider until layer 2 solutions make them redundant. ";9;2;False;JonnyLatte;dlzcz90;:/ That was an expensive coffee I just bought to show a demo transaction.;6vbfip;https://i.redd.it/6axrx39awahz.jpg
*Colombia, and they hate it when you do that;-1;0;False;all_is_all_to_all;dlzgbb4;:/ That was an expensive coffee I just bought to show a demo transaction.;6vbfip;https://i.redd.it/6axrx39awahz.jpg
deleted  ^^^^^^^^^^^^^^^^0.1408  [^^^What ^^^is ^^^this?](https://pastebin.com/FcrFs94k/72369);1;0;False;janoshik;dlzfz6n;:/ That was an expensive coffee I just bought to show a demo transaction.;6vbfip;https://i.redd.it/6axrx39awahz.jpg
Definitely not considering it's not in his personal wallet, it's in coinbase;1;0;False;mrdotkom;dlz94ml;:/ That was an expensive coffee I just bought to show a demo transaction.;6vbfip;https://i.redd.it/6axrx39awahz.jpg
It's not that, I think it has to do with others being able to profile you or what you have...when its immutable and forever verifiable on a protocol level - it's like having private emails that someone, one day, could link to you (maybe not with the technology of today, but someday);15;1;False;frankenmint;dlz9bwz;:/ That was an expensive coffee I just bought to show a demo transaction.;6vbfip;https://i.redd.it/6axrx39awahz.jpg
"from what? He's posting publically that he bought coffee.

Not to mention it's from coinbase, not even a personal wallet ";3;0;False;mrdotkom;dlz942b;:/ That was an expensive coffee I just bought to show a demo transaction.;6vbfip;https://i.redd.it/6axrx39awahz.jpg
It's a coinbase wallet.;0;0;False;mrdotkom;dlzhhrq;:/ That was an expensive coffee I just bought to show a demo transaction.;6vbfip;https://i.redd.it/6axrx39awahz.jpg
How does this compromise his coins? ;3;2;False;quantum_entanglement;dlzhhpv;:/ That was an expensive coffee I just bought to show a demo transaction.;6vbfip;https://i.redd.it/6axrx39awahz.jpg
Yup, value and timing would probably suffice;14;1;False;PaulCapestany;dlz1pkj;:/ That was an expensive coffee I just bought to show a demo transaction.;6vbfip;https://i.redd.it/6axrx39awahz.jpg
I found by the sent amount actually, then verified with the address;43;2;False;crptdv;dlyzdu5;:/ That was an expensive coffee I just bought to show a demo transaction.;6vbfip;https://i.redd.it/6axrx39awahz.jpg
The difference of computer vs you is insignificant realistically. It's not like the 30 seconds gives you time to react to it lol;0;0;False;cosmicrush;dlz6uec;:/ That was an expensive coffee I just bought to show a demo transaction.;6vbfip;https://i.redd.it/6axrx39awahz.jpg
Wow.;1;0;False;unknownstranger2;dlzeaaf;:/ That was an expensive coffee I just bought to show a demo transaction.;6vbfip;https://i.redd.it/6axrx39awahz.jpg
"> ps edit: took me ~30s to find it manually. Now imagine a computer

With computer, 3 hours to code the script to look for the addresses, 1 milliseconds to actually do the search...";1;1;False;jerguismi;dlz9qpd;:/ That was an expensive coffee I just bought to show a demo transaction.;6vbfip;https://i.redd.it/6axrx39awahz.jpg
With great power comes great responsibility ;1;0;False;ThatGuyIam123;dlz4lvn;:/ That was an expensive coffee I just bought to show a demo transaction.;6vbfip;https://i.redd.it/6axrx39awahz.jpg
Yes, I'll take one cocaine please, gift wrapped if possible. ;1;0;False;IDontHuffPaint;dlzii38;:/ That was an expensive coffee I just bought to show a demo transaction.;6vbfip;https://i.redd.it/6axrx39awahz.jpg
"Who the hell are you to decide what it's about? half of the worlds population should be priced out of the market? is that what you think?

I must have read the wrong whitepaper because I thought it said something about being a peer-to-peer electronic cash system and not only a wealth storage system for the top 1%

If the point of bitcoin is to be a currency, it needs to be usable. Yes, also for buying coffees.";1;0;False;khunrob;dlzhj6c;:/ That was an expensive coffee I just bought to show a demo transaction.;6vbfip;https://i.redd.it/6axrx39awahz.jpg
I don't think segwit help with the fees, but speed. Core understanding is that a fee structure is necessary to support offchain solutions IMHO. ;4;4;False;dd32x;dlyx2kl;:/ That was an expensive coffee I just bought to show a demo transaction.;6vbfip;https://i.redd.it/6axrx39awahz.jpg
"199 blocks left.  The shills will be out in force until then.

https://www.xbt.eu/";12;1;False;jimmajamma;dlz7zo1;:/ That was an expensive coffee I just bought to show a demo transaction.;6vbfip;https://i.redd.it/6axrx39awahz.jpg
Welp, roll back the price of bitcoin guys... This guy doesn't agree with the forces of a free market, clearly we are doing something wrong....;2;0;False;Auwardamn;dlzc0zz;:/ That was an expensive coffee I just bought to show a demo transaction.;6vbfip;https://i.redd.it/6axrx39awahz.jpg
You're missing the point. ;7;1;False;arcrad;dlz3dvb;:/ That was an expensive coffee I just bought to show a demo transaction.;6vbfip;https://i.redd.it/6axrx39awahz.jpg
"Bitcoin isn't about sending money, it's about having money. It allows you to have money outside of anyone's control, that's a point.

If you believe that buying coffees makes currency powerful, you're delusional.

Now suppose that all of world's millionaires/billionaires will put 1% of their wealth into Bitcoin because they don't completely trust banks/government/stocks. What will be the market cap?";38;15;False;killerstorm;dlz3b9o;:/ That was an expensive coffee I just bought to show a demo transaction.;6vbfip;https://i.redd.it/6axrx39awahz.jpg
As you can see from the mempool the number of users is not small but growing. And as you can see from the premium users willing to pay the fees, it indicates a high market cap.;9;1;False;bitsteiner;dlz5lp3;:/ That was an expensive coffee I just bought to show a demo transaction.;6vbfip;https://i.redd.it/6axrx39awahz.jpg
"A large number of users are holding the tokens because they're sound money. For instance, I only need to make a transaction 2-3 times per year, and I wouldn't care if the fees were $50.

 I'm willing to pay the fees because Bitcoin is censorship-resistant and inflation-resistant. Those properties are expensive to maintain because they require decentralization. The need for decentralization favors small blocks. Small blocks drive up fees. 

In effect, high fees are the necessary cost of maintaining a censorship-resistant value storage and transfer system on the Internet. ";8;0;False;hairy_unicorn;dlz6va1;:/ That was an expensive coffee I just bought to show a demo transaction.;6vbfip;https://i.redd.it/6axrx39awahz.jpg
You do realize that the vast majority of the worlds money is owned by the top 5% and they are desperately looking for places to put their money.  ;5;3;False;calaber24p;dlz3jk3;:/ That was an expensive coffee I just bought to show a demo transaction.;6vbfip;https://i.redd.it/6axrx39awahz.jpg
"store of value.  that someone could leave a country anytime and not worry about banking and surveillance.  how much is that worth? the value is immense.   that same amount of transaction fee can be used to move hundreds of thousands of dollars worth. I did it during the BCH dump.

seriously.";7;0;False;Dotabjj;dlz4p45;:/ That was an expensive coffee I just bought to show a demo transaction.;6vbfip;https://i.redd.it/6axrx39awahz.jpg
Bitcoin has the market cap because of the provided security and the expected utility. Consider LN, side chains and so on.;5;1;False;einalex;dlz3663;:/ That was an expensive coffee I just bought to show a demo transaction.;6vbfip;https://i.redd.it/6axrx39awahz.jpg
Oh no, I'm not falling for that one again.;1;0;False;BlueOak777;dlzhkj4;:/ That was an expensive coffee I just bought to show a demo transaction.;6vbfip;https://i.redd.it/6axrx39awahz.jpg
Silk road  Round 2;1;0;False;Im_Here_To_Fuck;dlzdc1t;:/ That was an expensive coffee I just bought to show a demo transaction.;6vbfip;https://i.redd.it/6axrx39awahz.jpg
"If you have a connection, PM me. ;)

";26;4;False;earonesty;dlz4ein;:/ That was an expensive coffee I just bought to show a demo transaction.;6vbfip;https://i.redd.it/6axrx39awahz.jpg
Rule #1 about buying large amounts of cocaine: don't tell anyone you have large amounts of cocaine;21;4;False;Stoned-Capone;dlz2f9q;:/ That was an expensive coffee I just bought to show a demo transaction.;6vbfip;https://i.redd.it/6axrx39awahz.jpg
hey its me columbia;111;3;False;;dlz69nt;:/ That was an expensive coffee I just bought to show a demo transaction.;6vbfip;https://i.redd.it/6axrx39awahz.jpg
"Crypto accounts are pseudo anonymous. Everything is transparent but  the accounts don't come with a name attached.

If you want to maintain your pseudo anonymity - you try to hide your txid so people can't link your reddit account to your account. Also if anyone who personally knows OP and knows his/her account id now knows their reddit account?

Plenty of reasons to hide txid. Although even without the txid, transaction values alone are enough to find the txid. Cryptocurrency is meant for transparency, its does little help you hide transactions. ";1;0;False;PrecariousClicker;dlz92x4;:/ That was an expensive coffee I just bought to show a demo transaction.;6vbfip;https://i.redd.it/6axrx39awahz.jpg
Guess he didn't want his reddit account to be associated with that bitcoin wallet?;1;0;False;Freact;dlz7dfs;:/ That was an expensive coffee I just bought to show a demo transaction.;6vbfip;https://i.redd.it/6axrx39awahz.jpg
Yeah kinda new but why even hide it. Cant get into his wallet from that. Right;6;2;False;Mrussell82;dlz329q;:/ That was an expensive coffee I just bought to show a demo transaction.;6vbfip;https://i.redd.it/6axrx39awahz.jpg
Privacy?;9;2;False;crptdv;dlz2doy;:/ That was an expensive coffee I just bought to show a demo transaction.;6vbfip;https://i.redd.it/6axrx39awahz.jpg
Because now the whole Internet knows an address that corresponds to the OP, and we can all trace back where he got his coins from, and maybe even figure out how much other bitcoin he still has...;28;4;False;maaku7;dlzc8i0;:/ That was an expensive coffee I just bought to show a demo transaction.;6vbfip;https://i.redd.it/6axrx39awahz.jpg
you didn't cover the whole thing;1;0;False;kodemage;dlzib14;:/ That was an expensive coffee I just bought to show a demo transaction.;6vbfip;https://i.redd.it/6axrx39awahz.jpg
"Imagine having a 7 digit phone number system with only 5 people having any phone numbers.

123 4567  
246 8024  
369 2581  
482 6048  
505 0505

If someone wrote down --- ---1 you could identify the entire phone number in a directory.";1;0;False;JackBond1234;dlz7mlh;:/ That was an expensive coffee I just bought to show a demo transaction.;6vbfip;https://i.redd.it/6axrx39awahz.jpg
There are so many possibilities for BTC addresses relative to how many that've been created that even a few known characters and their positions will give the entire address string away. ;1;0;False;IAmNotWizwazzle;dlz3arf;:/ That was an expensive coffee I just bought to show a demo transaction.;6vbfip;https://i.redd.it/6axrx39awahz.jpg
Even if you hide the entire address, it's still trivial to find given the time range and transaction/fee amount is pretty limited to search for. But not hiding the entire address just make it much easier :);2;0;False;6to23;dlz4mfj;:/ That was an expensive coffee I just bought to show a demo transaction.;6vbfip;https://i.redd.it/6axrx39awahz.jpg
There aren't that many addresses in the blockchain that start and end with the characters you left visible. In fact, it's probably just yours. ;6;1;False;futilerebel;dlz2d87;:/ That was an expensive coffee I just bought to show a demo transaction.;6vbfip;https://i.redd.it/6axrx39awahz.jpg
Why would you even cover part of it and not all of it?;9;1;False;Mangalz;dlz2sze;:/ That was an expensive coffee I just bought to show a demo transaction.;6vbfip;https://i.redd.it/6axrx39awahz.jpg
