body;score;nb_replies;stickied;author;id;post_title;post_id;post_link
ssssh we are trying to propagandize here dude. Don't inject reality or simple logic into my well planned smear campaign.;5;0;False;all_is_all_to_all;dlzgf0f;:/ That was an expensive coffee I just bought to show a demo transaction.;6vbfip;https://i.redd.it/6axrx39awahz.jpg
"Imagine how people feel about the demo transactions they did during the last few years.

Don't look at those wallets with current $ conversation on. ";10;2;False;nyaaaa;dlz1s3z;:/ That was an expensive coffee I just bought to show a demo transaction.;6vbfip;https://i.redd.it/6axrx39awahz.jpg
There is no way to adjust fees in Coinbase. I wonder why.. ;14;3;False;Hodl_it;dlywvb0;:/ That was an expensive coffee I just bought to show a demo transaction.;6vbfip;https://i.redd.it/6axrx39awahz.jpg
The fees!!!! Wow! ;23;1;False;dd32x;dlywrke;:/ That was an expensive coffee I just bought to show a demo transaction.;6vbfip;https://i.redd.it/6axrx39awahz.jpg
May I know why? :) Curious...;208;11;False;Hodl_it;dlyxsz2;:/ That was an expensive coffee I just bought to show a demo transaction.;6vbfip;https://i.redd.it/6axrx39awahz.jpg
"With these fees and all the infighting, the real USABILITY of bitcoin has gone to shit. Yes sure, it still works for bigger amount but who actually is willing to may 2%+ in fees themselves, instead of just using PayPal. VISA may be charging 3% transaction fees, but that is not something I as a user sees.

So what is the real value of bitcoin then? Just to be free from banks? Because not a lot of people actually have problems with their banks. So if we wanna reach massive adoption, we are gonna need some other thing to get people interested. 

Can we please just get the NYA through, get some USABILITY back quick, and then continue with all the other scaling solutions. ";9;2;False;Timbo925;dlz5hn6;:/ That was an expensive coffee I just bought to show a demo transaction.;6vbfip;https://i.redd.it/6axrx39awahz.jpg
Bitcoin is not for coffee. Don't clog up my enforcing node with your coffee transactions.;-11;0;False;BubblePopperX;dlz7a1p;:/ That was an expensive coffee I just bought to show a demo transaction.;6vbfip;https://i.redd.it/6axrx39awahz.jpg
You are part of the problem. Such transaction clog up the mempool. Please keep unnecssary TXs to a minimum, there are far more important TXs to be handled. We have limited space, please use it wisely. ;-9;3;False;gemeinsam;dlzib6s;:/ That was an expensive coffee I just bought to show a demo transaction.;6vbfip;https://i.redd.it/6axrx39awahz.jpg
"We've already argued about coffee purchases on bitcoins ultra secure layer for years now and nothing has changed, it's still dumb. We do not need to store censorship-proof transactions of coffee on the bitcoin blockchain.

This is exactly why LN has been created. So that you and the other billions of people can purchase their day to day crap that doesn't need to be recorded permanently forever on a public ledger.

If you really want fee's to go down, why dont you have a chat with Antpool [since they got caught red handed in activity related to spamming the blockchain](https://www.reddit.com/r/Bitcoin/comments/6s526x/antpool_mining_block_with_low_fee_spamtxs_while/) ?

Maybe if those who wish to profit off BCH would stop attacking the main chain we could have reasonable fee's. ";14;0;False;Cryptolution;dlz5tj4;:/ That was an expensive coffee I just bought to show a demo transaction.;6vbfip;https://i.redd.it/6axrx39awahz.jpg
"If you are demoing Bitcoin transactions, why not use testnet?

Failing that, why not use a wallet where you control the transaction fees instead instead of Coinbase where you cannot? Or why not withdraw from GDAX where they don't charge tx fees?";51;3;False;Brizon;dlziavw;:/ That was an expensive coffee I just bought to show a demo transaction.;6vbfip;https://i.redd.it/6axrx39awahz.jpg
Sight... I can use cash or my credit card for a coffee, bitcoin is not for that. ;-4;0;False;-Hegemon-;dlz976l;:/ That was an expensive coffee I just bought to show a demo transaction.;6vbfip;https://i.redd.it/6axrx39awahz.jpg
This is how we coffee. ;2;0;False;JonnyLatte;dlzclg8;:/ That was an expensive coffee I just bought to show a demo transaction.;6vbfip;https://i.redd.it/6axrx39awahz.jpg
"Stupidity is expensive. 

Your novelty transaction for something that bitcoin is very poorly suited for cost more than the many established payments methods that work very well for coffee? Shocking...

Hell, you didn't even include the 1.5%+ fee from coinbase to purchase those bitcoins in the first place nor did you include the cash back bonus many credit cards would offer you.

Oh, and ultimately you just spent fiat. Don't blame bitcoin for being a poor choice of how to spend fiat on coffee.";-10;2;False;Bitcoin-FTW;dlz48yg;:/ That was an expensive coffee I just bought to show a demo transaction.;6vbfip;https://i.redd.it/6axrx39awahz.jpg
You're simply wrong dude. Bitcoin is not meant to act only in that capacity.;1;1;False;blitzik;dlz4lek;:/ That was an expensive coffee I just bought to show a demo transaction.;6vbfip;https://i.redd.it/6axrx39awahz.jpg
"Interestingly the $3.46 appears to be subsidized by coinbase. The transaction itself was made using $5.70 in fees. 

The future is pretty bright: In a couple hours a lot of the bitcoin miners will return to bitcoin (after the BCC difficulty drop), and segwit fully activated and safe to use within a couple of days and then segwit2x to look foward to.";2;2;False;RHavar;dlzd8il;:/ That was an expensive coffee I just bought to show a demo transaction.;6vbfip;https://i.redd.it/6axrx39awahz.jpg
"I hate every single wallet provider who does not offer customisable network fee.. that's why I run core full node as I can choose my own fee that's based on circumstances if I need the coins to be available asap or I can wait a few days...


Breadwallet is as bad as coinbase in this.. Jaxx offer some customization (slow/normal/fast) which is better than nothing.. but really just why not give me a full control about the fee? I know what I am doing.. -_- ... we need a mobile/online wallet where I can choose the fee! Somebody.. make one :)";1;1;False;Killerko;dlzaamk;:/ That was an expensive coffee I just bought to show a demo transaction.;6vbfip;https://i.redd.it/6axrx39awahz.jpg
"Thinking about this aspect I find it strange that Bitcoin at this point is only a benefit to ""high rollers"" in this regard. But at the same time, I could see how financial intermediaries, who are already making a killing on transaction fees right now, aren't the biggest fans of the tech. On the other-other hand the potential for ROI for institutional asset managers might outweigh the negatives. Shitty for Western Union, not so much for deep-pocketed investors looking to get in on some of the action. Do you know if there are steps that Bitcoin is taking to correct this disparity between small and large transactions?";2;1;False;video_dhara;dlz4wzi;:/ That was an expensive coffee I just bought to show a demo transaction.;6vbfip;https://i.redd.it/6axrx39awahz.jpg
I am a huge crypto fan, and love bitcoin the most, but honestly for small purchases it sucks. Litecoin, dash, ripple are better for that. Hopefully once the lightning network and atomic swap is enabled, we can enjoy sending money around for close to nothing.;1;0;False;aaron0791;dlz8yug;:/ That was an expensive coffee I just bought to show a demo transaction.;6vbfip;https://i.redd.it/6axrx39awahz.jpg
No problem here at all Tovarich, the promised land of ~~socialism~~ lightning will solve all problems, btw dont even think about escaping over that big wall over there or you will be shot /s;1;0;False;cpt_ballsack;dlz8yci;:/ That was an expensive coffee I just bought to show a demo transaction.;6vbfip;https://i.redd.it/6axrx39awahz.jpg
Cheaper than a Starbucks Frappuccino... If you want to call that coffee.;1;0;False;jumpiz;dlz2b5z;:/ That was an expensive coffee I just bought to show a demo transaction.;6vbfip;https://i.redd.it/6axrx39awahz.jpg
This is a great feature, no doubt about it. But if that was all Bitcoin is good for, it doesn't justify a 65 billion dollar marketcap.;22;8;False;Haatschii;dlyz6ap;:/ That was an expensive coffee I just bought to show a demo transaction.;6vbfip;https://i.redd.it/6axrx39awahz.jpg
Use a credit card. Bitcoin is for storing your hard earned money. ;-8;4;False;ebaley;dlyxqym;:/ That was an expensive coffee I just bought to show a demo transaction.;6vbfip;https://i.redd.it/6axrx39awahz.jpg
Haven't you heard? You're not suppose to actually use bitcoin! /s;75;1;False;chalbersma;dlz27s5;:/ That was an expensive coffee I just bought to show a demo transaction.;6vbfip;https://i.redd.it/6axrx39awahz.jpg
"> You should have used PayPal. If you want to demonstrate the power of Bitcoin send $100,000 to the Philippines with no paperwork.


This is a solid use case. In my case I use it as a hedge against government monetary policy of running the money printing press at [full tilt](https://en.wikipedia.org/wiki/Quantitative_easing), causing some of the highest inflation rates I've seen in my lifetime, along with attempts to [ban cash](https://www.forbes.com/sites/markhendrickson/2015/05/28/farewell-to-cash/), [ZIRP](https://en.wikipedia.org/wiki/Zero_interest-rate_policy), [NIRP](https://www.forbes.com/sites/patrickwwatson/2016/05/23/three-weird-consequences-of-nirp/) and 'competitive devaluation' a.k.a. [currency wars](https://en.wikipedia.org/wiki/Currency_war).


With government-issued currencies going down in value, stocks at [all-time high P/E ratios](http://www.businessinsider.com/sp-500-forward-12-month-price-to-earnings-most-expensive-since-2004-2017-2) and [bonds](http://money.cnn.com/2016/07/05/investing/us-10-year-bond-yield-record-low/index.html) near the zero-bound, fixed-supply assets like [gold](https://static.seekingalpha.com/uploads/2016/6/6/saupload_Gold_20_year_chart6-6-16.png) and Bitcoin are going up. I just find it more convenient to store a hardware wallet than a safe full of gold coins. 


Bitcoin is 100% opt-in. A fully open, permissionless protocol, and people can use it for whatever use cases they want. If your *absolutely critical* use case is spending $3.46 to send $1 somewhere and then complain about high fees on Reddit, I'm going to go out on a limb here and say Bitcoin may not be for you. ";67;4;False;paperraincoat;dlz50fp;:/ That was an expensive coffee I just bought to show a demo transaction.;6vbfip;https://i.redd.it/6axrx39awahz.jpg
Wait for LN;1;0;False;graingert;dlz92cv;:/ That was an expensive coffee I just bought to show a demo transaction.;6vbfip;https://i.redd.it/6axrx39awahz.jpg
Expensive coffee, but pretty cheap lesson on how to find bitcoin txs on the blockchain via partial addresses.;21;0;False;mikeyvegas17;dlzi6ms;:/ That was an expensive coffee I just bought to show a demo transaction.;6vbfip;https://i.redd.it/6axrx39awahz.jpg
You should have used PayPal. If you want to demonstrate the power of Bitcoin send $100,000 to the Philippines with no paperwork. ;840;24;False;Sugar_Daddy_Peter;dlyxg5d;:/ That was an expensive coffee I just bought to show a demo transaction.;6vbfip;https://i.redd.it/6axrx39awahz.jpg
Because I was explaining to my friend how bitcoin transactions are done.;6;0;False;Hodl_it;dlz5n3m;:/ That was an expensive coffee I just bought to show a demo transaction.;6vbfip;https://i.redd.it/6axrx39awahz.jpg
Oh here we go...so now we are keeping FIAT for small purchases...lol;5;0;False;Vericoinium;dlz7rwz;:/ That was an expensive coffee I just bought to show a demo transaction.;6vbfip;https://i.redd.it/6axrx39awahz.jpg
"Coffee costs a dollar, plus tax is $1.25.

Cash:

I hand them a $5. Now I have stupid coins to deal with. If I brought the wrong currency, the vendor won't accept it. If it turns out the coffee is amazing and I want to buy a giant bag of the beans, unless I thought to bring enough currency with me, I'm out of luck. The more currency I bring with me, the greater the loss if I lose my wallet, get mugged, etc ..

Digital: 

My VISA is linked to my phone's NFC. I always carry my phone. I tap to pay for the exact amount of the coffee, I get a 2% bonus, and my transaction is logged so I can easily see now much I spend on coffee a year, if I care. If I lose my phone, I don't lose my money.




So: why pay with cash????


";1;0;False;yes_literally;dlz9lwz;:/ That was an expensive coffee I just bought to show a demo transaction.;6vbfip;https://i.redd.it/6axrx39awahz.jpg
I can go months without touching cash. Normal bloke in England. ;1;0;False;Viral_Spiral;dlz9c78;:/ That was an expensive coffee I just bought to show a demo transaction.;6vbfip;https://i.redd.it/6axrx39awahz.jpg
"I think you're probably trolling but... The credit card is the far superior transaction method for purchases. 
1) You have an effectively unlimited purchasing power in something the size of a business card. $1 or $10 or $10 - it's all the same.
2) If you lose it or if its stolen - you don't lose any money. 
3) Since everyone takes CC's and CC's charge fees to give their customers no liability and things like cashback and points if you pay with cash you are paying for those boons but not receiving them (unless the place gives a cash discount). 
4) It's more difficult to track purchases and expenditures with cash as compared to a CC that has a digital log - much easier for budgeting and expense management. 
5) No change. Coins suck. 
6) Cash is fabric/paper/weak plastics/etc. Credit Cards are more durable. You can take them in the ocean or to a concert and don't have to worry about them being destroyed/gross/etc. 
7) You never run out. You don't need to ""hit the ATM"". Or ""break a bill"". Or any physical management of your money. You don't need a money clip or a wallet. Just a place to stick your card. And since you probably have your ID on you, which conveniently is the same size, just stick it with that. 

The only thing cash has is no transaction fees and anonymity. ";-1;0;False;conception;dlz7xt0;:/ That was an expensive coffee I just bought to show a demo transaction.;6vbfip;https://i.redd.it/6axrx39awahz.jpg
Because the CC is just as fast, if not faster than a barista fumbling around for change. The CC allows you to track these little purchases with no effort. You get rewards using most CC. Actually, using cash is absolutely idiotic these days, unless you have self-control issues. Unless you're one of those weirdos worried about the NSA knowing you drink a Venti with one shot of espresso 3 times a week, it makes zero sense to use cash. ;-1;0;False;;dlz6qw3;:/ That was an expensive coffee I just bought to show a demo transaction.;6vbfip;https://i.redd.it/6axrx39awahz.jpg
Do you realize that your green paint attempt to hide your transaction detail failed hard? Just saying it's totally traceable.;779;7;False;crptdv;dlyxol9;:/ That was an expensive coffee I just bought to show a demo transaction.;6vbfip;https://i.redd.it/6axrx39awahz.jpg
Using BTC for coffee, something that doesn't need censorship resistance AT ALL, is quite silly. And if you really want to buy coffee with BTC then very soon LN will answer your prayers more than Bcash or Jeffcoin ever could.;2;1;False;steuer2teuer;dlz2duw;:/ That was an expensive coffee I just bought to show a demo transaction.;6vbfip;https://i.redd.it/6axrx39awahz.jpg
"So use a wallet with custom fees...

I regularly get confirmations at <100/satoshi/byte...

FUD...";-3;1;False;dragger2k;dlz24ck;:/ That was an expensive coffee I just bought to show a demo transaction.;6vbfip;https://i.redd.it/6axrx39awahz.jpg
Bitcoin hashrate have dropped thanks to BCH, plus on top of that there might be a spam attack. So fees are crazy.;2;0;False;killerstorm;dlz3dzh;:/ That was an expensive coffee I just bought to show a demo transaction.;6vbfip;https://i.redd.it/6axrx39awahz.jpg
PayPal? Have you fallen off your rocker? This is crypto we're talking about. ;16;0;False;;dlz3woi;:/ That was an expensive coffee I just bought to show a demo transaction.;6vbfip;https://i.redd.it/6axrx39awahz.jpg
If Bitcoin isn't working for an average Joe, then Bitcoin isn't working at all.;45;2;False;HanC0190;dlz9oe7;:/ That was an expensive coffee I just bought to show a demo transaction.;6vbfip;https://i.redd.it/6axrx39awahz.jpg
"I don't see why you cant do both, keep $1,000,000+ safe from governments and fiat devaluation as well as pay for a cup of coffee.  Thats what I thought Bitcoin was supposed to be but now small transactions are being priced out it seems--some in the community have adopted the ""we didnt want those transactions anyway"" attitude wtf?  We're giving up on international remittance markets too by all accounts, which is a huge ""industry"".  Lets concentrate on going for international bank settlements then eh, all global oil settled in Bitcoin? $1mil per bitcoin, why not?  Except its 99% probably never going to happen.";41;3;False;MANISHERE;dlz4mle;:/ That was an expensive coffee I just bought to show a demo transaction.;6vbfip;https://i.redd.it/6axrx39awahz.jpg
then bitcoin doesn't deserve a high market cap if it's just going to be used by a small number of users to send money around.;153;10;False;Bitcoin_TPS_Report;dlyzond;:/ That was an expensive coffee I just bought to show a demo transaction.;6vbfip;https://i.redd.it/6axrx39awahz.jpg
That's the reality. The title of the whitepaper suggests it was intended to replace the use cases of cash :-(;29;2;False;drlsd;dlyysh1;:/ That was an expensive coffee I just bought to show a demo transaction.;6vbfip;https://i.redd.it/6axrx39awahz.jpg
core should just support 2x;7;6;False;bitcoin991;dlyx2ak;:/ That was an expensive coffee I just bought to show a demo transaction.;6vbfip;https://i.redd.it/6axrx39awahz.jpg
How can I use a credit card to show someone how Bitcoin works :/;1;3;False;Hodl_it;dlyxw3i;:/ That was an expensive coffee I just bought to show a demo transaction.;6vbfip;https://i.redd.it/6axrx39awahz.jpg
Your doing it wrong. Bitcoin in this early stage of the game is not useful for coffee purchases.  Buying coffee today with bitcoin would be like watching video on the internet in 1995. Possible but far better option available. ;10;6;False;qm2abraham;dlyyuoh;:/ That was an expensive coffee I just bought to show a demo transaction.;6vbfip;https://i.redd.it/6axrx39awahz.jpg
"if you watch bitcoin videos from 2015 or earlier you'd probably be under the impression sending money on the bitcoin network was ""virtually free""";21;0;False;chillingniples;dlz5lrb;:/ That was an expensive coffee I just bought to show a demo transaction.;6vbfip;https://i.redd.it/6axrx39awahz.jpg
"I didn't tell them that actually :) 
The guy wanted to know how transactions are made. Unfortunately I had only my Coinbase wallet with me at that time so used it to show a demo.";8;0;False;Hodl_it;dlz00km;:/ That was an expensive coffee I just bought to show a demo transaction.;6vbfip;https://i.redd.it/6axrx39awahz.jpg
Why shouldn't they?;7;2;False;Amnestic;dlz5w57;:/ That was an expensive coffee I just bought to show a demo transaction.;6vbfip;https://i.redd.it/6axrx39awahz.jpg
Big spam attack right now.   Bitcoin is under a major onslaught.;-3;3;False;earonesty;dlz4v96;:/ That was an expensive coffee I just bought to show a demo transaction.;6vbfip;https://i.redd.it/6axrx39awahz.jpg
I mean... why anyone would try to hide a txid is beyond me.;15;5;False;mrdotkom;dlyzprd;:/ That was an expensive coffee I just bought to show a demo transaction.;6vbfip;https://i.redd.it/6axrx39awahz.jpg
Sorry for the noobish question, but what can you do with that information? All it tells you is where to find it in the blockchain, right?;1;0;False;DrDerpberg;dlzcpn0;:/ That was an expensive coffee I just bought to show a demo transaction.;6vbfip;https://i.redd.it/6axrx39awahz.jpg
Good thing segwit activates soon and lightning network will solve  this problem.  AND if bitcoin does go mainstream we wont have to have 50000 coffee purchases a day stored on the blockchain. instead they can be taken care of off chain!;1;1;False;sweeptheleg55;dlz1mmp;:/ That was an expensive coffee I just bought to show a demo transaction.;6vbfip;https://i.redd.it/6axrx39awahz.jpg
Well, that's not a good way to demonstrate that it is for everyone;1;0;False;aykcak;dlzghe0;:/ That was an expensive coffee I just bought to show a demo transaction.;6vbfip;https://i.redd.it/6axrx39awahz.jpg
Haha. Dang. I have 23,500 bits in a wallet right now and I can't sent it out because of the high transaction fee. I can't adjust the fee amount and it won't tell me how much the fee is so I was playing with different amounts to see if the wallet would take it. I guess I need to come back to this after BTC is worth a few times more. ;2;0;False;phattestman;dlzehsg;:/ That was an expensive coffee I just bought to show a demo transaction.;6vbfip;https://i.redd.it/6axrx39awahz.jpg
deleted  ^^^^^^^^^^^^^^^^0.8505  [^^^What ^^^is ^^^this?](https://pastebin.com/FcrFs94k/45555);188;8;False;janoshik;dlyzqp7;:/ That was an expensive coffee I just bought to show a demo transaction.;6vbfip;https://i.redd.it/6axrx39awahz.jpg
Even better, send me $5 million USD for minimal fee's.;1;0;False;mccoyster;dlza8zh;:/ That was an expensive coffee I just bought to show a demo transaction.;6vbfip;https://i.redd.it/6axrx39awahz.jpg
[deleted];5;1;False;;dlzbobl;:/ That was an expensive coffee I just bought to show a demo transaction.;6vbfip;https://i.redd.it/6axrx39awahz.jpg
The idea of Bitcoin was to replace cash, credit cards and banks. Now people try to look at it like 'virtual gold' and 'storing'. Ffs, what happened to you guys?;64;9;False;Vlyn;dlyyn2s;:/ That was an expensive coffee I just bought to show a demo transaction.;6vbfip;https://i.redd.it/6axrx39awahz.jpg
[deleted];6;1;False;;dlywlv9;:/ That was an expensive coffee I just bought to show a demo transaction.;6vbfip;https://i.redd.it/6axrx39awahz.jpg
That's very shortsighted. Mass adoption requires the ability to use it for ALL types of transactions, not just remittance. ;1;0;False;superradguy;dlz7yy3;:/ That was an expensive coffee I just bought to show a demo transaction.;6vbfip;https://i.redd.it/6axrx39awahz.jpg
bro you dont need to hide the PUBLIC key its the other one you should be worried about ;1;1;False;ziondelta;dlzkk5b;:/ That was an expensive coffee I just bought to show a demo transaction.;6vbfip;https://i.redd.it/6axrx39awahz.jpg
[deleted];118;6;False;;dlz3xo3;:/ That was an expensive coffee I just bought to show a demo transaction.;6vbfip;https://i.redd.it/6axrx39awahz.jpg
If you want to demonstrate the power of Bitcoin, you should buy one, and wait 5 years.;2;0;False;ztsmart;dlzb2t7;:/ That was an expensive coffee I just bought to show a demo transaction.;6vbfip;https://i.redd.it/6axrx39awahz.jpg
How can I use PayPal to show how bitcoin works. :);5;0;False;Hodl_it;dlyzakl;:/ That was an expensive coffee I just bought to show a demo transaction.;6vbfip;https://i.redd.it/6axrx39awahz.jpg
"
A very expensive coffee indeed.

Still a ways to go before mass adoption due to common sense. Situations like this can strike fear into the mainstream public out of lack of knowledge. 

The idea behind being your own bank also entails being your own security, this is not stressed enough to newcomers. Remember the private key that was shown on tv and btc community took it before it could get actually thieved. Those days are slowly being numbered and awareness is key moving forward. ";1;0;False;L0ckeandDemosthenes;dlzcaqj;:/ That was an expensive coffee I just bought to show a demo transaction.;6vbfip;https://i.redd.it/6axrx39awahz.jpg
buy this man gold, all the cool comments have gold today ;1;0;False;tragamin;dlz4chf;:/ That was an expensive coffee I just bought to show a demo transaction.;6vbfip;https://i.redd.it/6axrx39awahz.jpg
jeez dude even when I sent $1k I only paid like $3 in fees, that's b.s.;126;3;False;ILikeToSayHi;dlywroy;:/ That was an expensive coffee I just bought to show a demo transaction.;6vbfip;https://i.redd.it/6axrx39awahz.jpg
Personally, i sent a transaction from one of my wallets to another, with a 1sat/b fee, and still waiting 12 days on. Just a little test. Was expecting a couple days. Now I feel like this year would be lucky honestly...;1;0;False;SpuddyA7X;dlzehkb;:/ That was an expensive coffee I just bought to show a demo transaction.;6vbfip;https://i.redd.it/6axrx39awahz.jpg
"The funniest part about this thread is how it proves the NNG report true.

I mean, people come to this sub for information about cryptocurrency but most of them cannot intelligently use the search feature of a website.

Report for those interested:
https://www.nngroup.com/articles/computer-skill-levels/

Regardless, this should be used as an example. If /r/Bitcoin is pumping a technology they likely have no fucking clue what it does. Since most of you cannot even look up a fucking partial address on blockchain.info";1;2;False;WeaponizedMath;dlzjuyl;:/ That was an expensive coffee I just bought to show a demo transaction.;6vbfip;https://i.redd.it/6axrx39awahz.jpg
"Paypal is 2.9% plus $0.30. Sending any amount of money in Bitcoin is $5 (and increasing) plus exchange fees on both sides (3% at minimum). 

At one point the goal of bitcoin was to create a self-contained ecosystem where people just spent bitcoin directly for what they wanted. That way there would be no need to pay the 3% for exchanging in and out of fiat. 

But you guys have more or less ruined that vision. Now bitcoin is worse than Paypal. ";2;2;False;Chris_Pacia;dlz6yo5;:/ That was an expensive coffee I just bought to show a demo transaction.;6vbfip;https://i.redd.it/6axrx39awahz.jpg
