body;score;nb_replies;stickied;author;id;post_title;post_id;post_link
"We can only guess.. bitcoin hasn't been around for a recession before.

Its either gonna go down then up, sideways then up or up then up.. at the end of the day after all is said and done bitcoin will be higher just a mystery what path it will take to get there.

Personally I plan for the worst so im expecting the price to fall for the next 10 months into the halving then explode and see new highs late 2020..";1;0;False;slvbtc;ewvxggp;Reminder;cpb6co;https://i.redd.it/rrk1ulea80g31.jpg
Greg looks like someone how cries before bed. But all kidding aside yeah he does cry before bed.;1;0;False;baileychoe;ewtj04x;Reminder;cpb6co;https://i.redd.it/rrk1ulea80g31.jpg
okey dokey;1;0;False;loan_wolf;ewt1uuc;Reminder;cpb6co;https://i.redd.it/rrk1ulea80g31.jpg
Greg Schoen you had a lot of chances to redeem yourself. How many Bitcoin do you have today?;1;0;False;supergrass77;ewu5std;Reminder;cpb6co;https://i.redd.it/rrk1ulea80g31.jpg
Who’s Craig ? Craig’s dead baby;1;0;False;mrsurfalot;ewtetcb;Reminder;cpb6co;https://i.redd.it/rrk1ulea80g31.jpg
You’re wrong. It won’t happen in the next couple of years but it will surely happen and every transaction will NOT be on chain.;1;1;False;bjman22;ewst8ep;Reminder;cpb6co;https://i.redd.it/rrk1ulea80g31.jpg
so how will this affect bitcoin ?;1;1;False;yungelonmusk;ewvwjlp;Reminder;cpb6co;https://i.redd.it/rrk1ulea80g31.jpg
