body;score;nb_replies;stickied;author;id;post_title;post_link
">The reasons you mentioned have nothing to do with blocksize increases killing the chain,

No. This is exactly what BCH's sustainability plan is: Increase blocksize indefinitely to keep fees perpetually low.";2;1;False;vU5Zh3fJNzHrn52YYha;drsv95r;"WSJ: ""[bitcoin core] fees have reached an average cost of about $30 per transaction. That makes bitcoin virtually unusable for all but very large transactions. The Bitcoin Cash crowd is just trying to offer a solution to that problem.""";https://www.wsj.com/articles/bitcoin-cash-litecoin-ether-oh-my-whats-with-all-the-bitcoin-clones-1514037600?reflink=e2twmkts
"Your system results in centralized transactions. Which is not what Satoshi created when he created a **peer to peer** currency. The current implementation of bitcoin is not keeping up with demand. That is fact. However, to sell out the entire goal of bitcoin to create something that works now, but sacrifices why it was created is pointless. You end up with Visa 2.0. Not currency 2.0.

Sure, feel free to have BCH head in its own direction, but it isn't the direction BTC was created for. So calling it bitcoin anything is just an attempt to ride coat tails.

Bitcoin was created to fight against centralized banks and fractional reserve banking.  A nod to this is inscribed in the first block. If you turn the blockchain into something that disregards this, it is no longer bitcoin. It would just be another payment processor, rather than a new form of currency that helps free people from central banking.

Once you give up the peer to peer decentralization of bitcoin, what advantage does BCH have? None. Since Visa can do it cheaper, faster, is accepted more places, and has ""first mover"" advantage.";0;1;False;You_Gullible_Sheep2;drt4fho;"WSJ: ""[bitcoin core] fees have reached an average cost of about $30 per transaction. That makes bitcoin virtually unusable for all but very large transactions. The Bitcoin Cash crowd is just trying to offer a solution to that problem.""";https://www.wsj.com/articles/bitcoin-cash-litecoin-ether-oh-my-whats-with-all-the-bitcoin-clones-1514037600?reflink=e2twmkts
Oh no, I lost credibility in the eyes of Zectro......My point was all of them are better than the current status of affairs that is Bitcoin. (At least on paper they are better. I don't know which coins would hold up with certainty (besides eth) with that level of attention, transaction level etc). Shit on iota all you want, I don't shill for them. I think its an interesting product, but not the game changers it wants/claims to be. My understanding of blockchain tech is beginner.  I have alot to learn. ;1;1;False;Rickard403;drsp02h;"WSJ: ""[bitcoin core] fees have reached an average cost of about $30 per transaction. That makes bitcoin virtually unusable for all but very large transactions. The Bitcoin Cash crowd is just trying to offer a solution to that problem.""";https://www.wsj.com/articles/bitcoin-cash-litecoin-ether-oh-my-whats-with-all-the-bitcoin-clones-1514037600?reflink=e2twmkts
"I apologise for my tone and manner. Let me respond in a manner that is less trollish since you obviously are not yet another brainwashed IOTA shill. Here are my problems with the coins you named:

LTC - All the baggage of BTC with Segwit, only it has slightly faster blocks. Like BTC it is depending heavily on Lightning being a success, and there's no chance that LN is going to be timely or nearly as good as the Core devs have claimed because they are completely overpromising on what it is and what it can do, just like they did with Segwit. Additionally, and tellingly, the creator of LTC does not believe in LTC enough to keep holding it.

VTC - As I understand it, this is basically LTC but ASIC resistant. I do not see ASIC resistance as a particularly good thing. An ASIC resistant coin means your miners are less invested in the future of your coin, and thus can break consensus rules or 51% attack the coin then move on to the next coin when the value plummets after the attack. Additionally, ASIC-resistance opens up your coin to botnet attack vectors.

IOTA - The most centralized coin on the market. A closed-source coordinator node decides which transactions get added to the DAG. The creators routinely confiscate users coins ""for security"" and you have to contact them to retrieve your coin. The coin's marketing team appears to be massive and they constantly claim partnerships with large companies and when they come under scrutiny they double-talk and double-down on their aggression to convince people who are invested in the coin that they are competent and capable, as opposed to liars and charlatans. They have no path-forward for dropping the coordinator node and there is neither theoretical nor empirical evidence that what IOTA claims their system can do is possible without it. You would be better off investing in a team that runs their own MySQL database for processing Cryptocurrency transactions. That at least would be simpler and more efficient than what IOTA has done to create their centralized token.

ETH - Actually I like ETH too so I don't really have that big a problem with the notion that ETH could replace Bitcoin. I will say though that the main problem with ETH is that it is quite complicated, and by virtue of its complexity is open to more attack vectors than Bitcoin.";2;1;False;Zectro;drsps67;"WSJ: ""[bitcoin core] fees have reached an average cost of about $30 per transaction. That makes bitcoin virtually unusable for all but very large transactions. The Bitcoin Cash crowd is just trying to offer a solution to that problem.""";https://www.wsj.com/articles/bitcoin-cash-litecoin-ether-oh-my-whats-with-all-the-bitcoin-clones-1514037600?reflink=e2twmkts
"Big block on chain scaling would result in a blockchain so large that it could only be hosted on server farms, full nodes would not be able to individuals to run, like they are today. Full nodes are required to have a vote in the future of the block chain.

So please explain how big block on chain scaling results in more decentralization, when it forces individuals out of running full nodes?";1;1;False;You_Gullible_Sheep2;drsvgcz;"WSJ: ""[bitcoin core] fees have reached an average cost of about $30 per transaction. That makes bitcoin virtually unusable for all but very large transactions. The Bitcoin Cash crowd is just trying to offer a solution to that problem.""";https://www.wsj.com/articles/bitcoin-cash-litecoin-ether-oh-my-whats-with-all-the-bitcoin-clones-1514037600?reflink=e2twmkts
No, it was written from scratch in that case.;1;0;False;Pxzib;drt7uly;"WSJ: ""[bitcoin core] fees have reached an average cost of about $30 per transaction. That makes bitcoin virtually unusable for all but very large transactions. The Bitcoin Cash crowd is just trying to offer a solution to that problem.""";https://www.wsj.com/articles/bitcoin-cash-litecoin-ether-oh-my-whats-with-all-the-bitcoin-clones-1514037600?reflink=e2twmkts
"Tl;dr Why? Because  all I did was mention a few coins, I didn't reveal my position in relation to these coins. Personally I don't think ltc, vert or that newer one groestlcoin? Will get the attention BTC is getting. They are all too similar to BTC. The only coin I mentioned that I would promote is Ethereum. Don't take me mentioning a coin as me shilling. There is a huge difference. On a side note it has become clear that you want to talk crypto currency. If that is what we are doing then let's chat. I'm holding BTC only, the tech is garbage I don't believe in it 1 bit. Lol.  I'll be jumping ship soon. I like OMG, Ethereum and monero the most. The have application and use. (The heavy marketing from OMG got me, I hear stratis is better) ";1;0;False;Rickard403;drsqfad;"WSJ: ""[bitcoin core] fees have reached an average cost of about $30 per transaction. That makes bitcoin virtually unusable for all but very large transactions. The Bitcoin Cash crowd is just trying to offer a solution to that problem.""";https://www.wsj.com/articles/bitcoin-cash-litecoin-ether-oh-my-whats-with-all-the-bitcoin-clones-1514037600?reflink=e2twmkts
"You lost a lot of credibility when you mentioned IOTA. IOTA is a MySQL database trading at a $10B market cap. It's exactly the sort of coin made possible by Bitcoin Core's weak and incompetent vision for their own product. If transaction fees did not cost $37 or whatever BTC is pricing at right now the idea of a vaporware coin run by highly aggressive con-artists wouldn't be trading at such a premium partly on the basis of ""free transactions.""";2;1;False;Zectro;drso3du;"WSJ: ""[bitcoin core] fees have reached an average cost of about $30 per transaction. That makes bitcoin virtually unusable for all but very large transactions. The Bitcoin Cash crowd is just trying to offer a solution to that problem.""";https://www.wsj.com/articles/bitcoin-cash-litecoin-ether-oh-my-whats-with-all-the-bitcoin-clones-1514037600?reflink=e2twmkts
NEM is build from scratch.;1;0;False;orcvs;drsr0n9;"WSJ: ""[bitcoin core] fees have reached an average cost of about $30 per transaction. That makes bitcoin virtually unusable for all but very large transactions. The Bitcoin Cash crowd is just trying to offer a solution to that problem.""";https://www.wsj.com/articles/bitcoin-cash-litecoin-ether-oh-my-whats-with-all-the-bitcoin-clones-1514037600?reflink=e2twmkts
"Because more scaling means more users and businesses can use Bitcoin and develop things on top of it. This will result in more mining nodes to secure the network and validate its rules, and more R&D into the Bitcoin blockchain to further improve it.

Full non-mining nodes do not contribute anything to the network. We cannot trust the motivations of an army of volunteers. We can trust miners only because of the incentive structure of Bitcoin. Miners want to mine a profitable coin, and if they break the rules the integrity of the coin becomes suspect and the price tanks.

All that said, yeah you're right, we should cripple Bitcoin with high fees and slow transaction times so that the 1 in a 1000 Bitcoin users who want to run a full node can do it inexpensively.";1;1;False;Zectro;drsvw0l;"WSJ: ""[bitcoin core] fees have reached an average cost of about $30 per transaction. That makes bitcoin virtually unusable for all but very large transactions. The Bitcoin Cash crowd is just trying to offer a solution to that problem.""";https://www.wsj.com/articles/bitcoin-cash-litecoin-ether-oh-my-whats-with-all-the-bitcoin-clones-1514037600?reflink=e2twmkts
">Full non mining nodes keep the network ""honest""(read the whitepaper).

The whitepaper only discusses mining nodes, not non-mining nodes.

>If there was no full nodes, or they were centralized, then they could be manipulated to authenticate forged nodes. Creating a blockchain big enough that only a few people could host full nodes, then they could easily use that to their advantage if they also controlled the mining. They could force forged blocks, and the whole system becomes no better than modern fiat.

Validate your transactions with SPV. Don't just blindly trust nodes if they're ""forging blocks."" Just the fact that you're describing an attack-vector that uses non-mining nodes describes why they're a problem. We can't trust the motivations of an army of vigilantes regardless of how decentralized they are, as they have no incentive to behave honestly the way that miners do.";1;0;False;Zectro;drsyz4d;"WSJ: ""[bitcoin core] fees have reached an average cost of about $30 per transaction. That makes bitcoin virtually unusable for all but very large transactions. The Bitcoin Cash crowd is just trying to offer a solution to that problem.""";https://www.wsj.com/articles/bitcoin-cash-litecoin-ether-oh-my-whats-with-all-the-bitcoin-clones-1514037600?reflink=e2twmkts
What is the point of creating another Visa?;1;1;False;You_Gullible_Sheep2;drsx6cu;"WSJ: ""[bitcoin core] fees have reached an average cost of about $30 per transaction. That makes bitcoin virtually unusable for all but very large transactions. The Bitcoin Cash crowd is just trying to offer a solution to that problem.""";https://www.wsj.com/articles/bitcoin-cash-litecoin-ether-oh-my-whats-with-all-the-bitcoin-clones-1514037600?reflink=e2twmkts
"Full non mining nodes keep the network ""honest""(read the whitepaper).

If there was no full nodes, or they were centralized, then they could be manipulated to authenticate forged nodes. Creating a blockchain big enough that only a few people could host full nodes, then they could easily use that to their advantage if they also controlled the mining. They could force forged blocks, and the whole system becomes no better than modern fiat.

Oh, and the whole loss of peer to peer which was why Satoshi created the blockchain and bitcoin.";1;1;False;You_Gullible_Sheep2;drsyjj0;"WSJ: ""[bitcoin core] fees have reached an average cost of about $30 per transaction. That makes bitcoin virtually unusable for all but very large transactions. The Bitcoin Cash crowd is just trying to offer a solution to that problem.""";https://www.wsj.com/articles/bitcoin-cash-litecoin-ether-oh-my-whats-with-all-the-bitcoin-clones-1514037600?reflink=e2twmkts
Answer my question and I'll disbunk yours.;1;1;False;Sovereign_Curtis;drt38xp;"WSJ: ""[bitcoin core] fees have reached an average cost of about $30 per transaction. That makes bitcoin virtually unusable for all but very large transactions. The Bitcoin Cash crowd is just trying to offer a solution to that problem.""";https://www.wsj.com/articles/bitcoin-cash-litecoin-ether-oh-my-whats-with-all-the-bitcoin-clones-1514037600?reflink=e2twmkts
"You don't even seem to realize what is necessary to run a full node.

Also, just so you know, bitcoin was written when moore's law was strong. If you were paying attention at all to the tech industry in the last 5 years or so, you would realize moore's law is dead. This has been thoroughly gone through by industry heads as well as academics. Processor speeds aren't doubling in 18 months, storage capacity isn't doubling in 18 months. Network access speeds isn't doubling in 18 months. RAM capacities aren't doubling in 18 months.

You know the only thing that doubled in the last 18 months? Ram prices. 

We are hitting some pretty hard physical limits of what our manufacturing nodes can give us. Moore's law no longer applies.


From MIT
https://www.technologyreview.com/s/601441/moores-law-is-dead-now-what/";1;1;False;You_Gullible_Sheep2;drswkvj;"WSJ: ""[bitcoin core] fees have reached an average cost of about $30 per transaction. That makes bitcoin virtually unusable for all but very large transactions. The Bitcoin Cash crowd is just trying to offer a solution to that problem.""";https://www.wsj.com/articles/bitcoin-cash-litecoin-ether-oh-my-whats-with-all-the-bitcoin-clones-1514037600?reflink=e2twmkts
"Decentralization is in the white paper. It is what it is about, or do you not understand what peer to peer means?

The first block even carries an inscription that is a jab centralized banking and fractional reserves that caused the 2008 crash and led Satoshi to create bitcoin.";0;0;False;You_Gullible_Sheep2;drsw1pm;"WSJ: ""[bitcoin core] fees have reached an average cost of about $30 per transaction. That makes bitcoin virtually unusable for all but very large transactions. The Bitcoin Cash crowd is just trying to offer a solution to that problem.""";https://www.wsj.com/articles/bitcoin-cash-litecoin-ether-oh-my-whats-with-all-the-bitcoin-clones-1514037600?reflink=e2twmkts
body;score;nb_replies;stickied;author;id;post_title;post_link
"I hold both BTC and BCH, and I think a lot of people here do as well.  Let's be honest, BTC has a lot of momentum behind it from the brand name alone, so the price will continue to go up even though it is completely broken. I don't hate BTC, I just hate what Blockstream has done to it.  We're free to talk about either coin here, it's just that people frustrated with it tend to come here to vent, and people that hate BCH come here to troll, so you get a mixed bag of BS.

At least you do get both sides of the arguments here though, I've seen a lot of well thought out posts about why small blocks are better, or why LN is good.  People may not agree with them, but they don't get deleted, and the users don't get banned.";221;7;False;stevoli;drtvlln;Honest Opinion: I hate both subs;https://www.reddit.com/r/btc/comments/7mh1wm/honest_opinion_i_hate_both_subs/
"Selective perception is what causes your discomfort... but be sure, you are not alone :p atleast 51 people with you!

Selective perception is the process by which individuals perceive what they want to in media messages while ignoring opposing viewpoints. 

It is a broad term to identify the behavior all people exhibit to tend to ""see things"" based on their particular frame of reference.";1;0;False;bitcornio;dru4tml;Honest Opinion: I hate both subs;https://www.reddit.com/r/btc/comments/7mh1wm/honest_opinion_i_hate_both_subs/
Your free to leave at any time.  ;-2;1;False;TacoTuesdayTime;dru09nn;Honest Opinion: I hate both subs;https://www.reddit.com/r/btc/comments/7mh1wm/honest_opinion_i_hate_both_subs/
Why do you assume it's the same people?;1;1;False;Itilvte;dru615o;Honest Opinion: I hate both subs;https://www.reddit.com/r/btc/comments/7mh1wm/honest_opinion_i_hate_both_subs/
"My post was removed from r/bitcoin (silently, didnt get notified)

So for that I definitely give points to this place ";228;8;False;Dainathon;drtvwvr;Honest Opinion: I hate both subs;https://www.reddit.com/r/btc/comments/7mh1wm/honest_opinion_i_hate_both_subs/
For BTC to make another 100% it has to reach $30,000, and people seem skeptical it will reach that soon.;9;1;False;unitedstatian;dru5jw7;Honest Opinion: I hate both subs;https://www.reddit.com/r/btc/comments/7mh1wm/honest_opinion_i_hate_both_subs/
Now those are quality memes there on r/dogecoin;26;1;False;qkb3ll;dru0s1x;Honest Opinion: I hate both subs;https://www.reddit.com/r/btc/comments/7mh1wm/honest_opinion_i_hate_both_subs/
Ether is not short for ethereum, ether is the currency of the ethereum network;19;1;False;fiah84;dru39zx;Honest Opinion: I hate both subs;https://www.reddit.com/r/btc/comments/7mh1wm/honest_opinion_i_hate_both_subs/
god dammit, i just checked. Yes! It has!;34;2;False;Dainathon;drtv48l;Honest Opinion: I hate both subs;https://www.reddit.com/r/btc/comments/7mh1wm/honest_opinion_i_hate_both_subs/
"lol already 

[removed] 

";10;1;False;homopit;drtv2k0;Honest Opinion: I hate both subs;https://www.reddit.com/r/btc/comments/7mh1wm/honest_opinion_i_hate_both_subs/
Also, in some aspects, r/btc could take notes from the Monero community, which has divided their discussion into different subreddits, such as r/monero for civilized discussion about all the major dimensions of XMR, r/moonero for memes and the like, r/xmrtrader for traders, etc.;9;0;False;;dru5nyt;Honest Opinion: I hate both subs;https://www.reddit.com/r/btc/comments/7mh1wm/honest_opinion_i_hate_both_subs/
"Lol @ ""crotch fruit."" Never heard that one before.";8;1;False;WorldsMostDad;dru56wp;Honest Opinion: I hate both subs;https://www.reddit.com/r/btc/comments/7mh1wm/honest_opinion_i_hate_both_subs/
This is all exactly what blockstream wanted to happen;11;0;False;highintensitycanada;drtvxzc;Honest Opinion: I hate both subs;https://www.reddit.com/r/btc/comments/7mh1wm/honest_opinion_i_hate_both_subs/
[deleted];-1;2;False;;dru5fo3;Honest Opinion: I hate both subs;https://www.reddit.com/r/btc/comments/7mh1wm/honest_opinion_i_hate_both_subs/
"My favourite is how many people say ""bcash"" like it's supposed to infuriate anyone that likes BCH but now it just seems like childish name calling ";29;5;False;Dainathon;drtv77e;Honest Opinion: I hate both subs;https://www.reddit.com/r/btc/comments/7mh1wm/honest_opinion_i_hate_both_subs/
"
>Two echo chambers. I do not mind what they over at rBitcoin do, but I do not understand why so many of Core trolls come here regularly, not to debate, but to mock and troll on us? Are they paid? Afraid?

I see a lot of pro BCH posts ridiculing BTC on new on rBitcoin, that get deleted moments after.     
I'm guessing both parties have trolls, it's just that they're visible on one side, and removed on the other.";5;0;False;-Cubie-;drtycxc;Honest Opinion: I hate both subs;https://www.reddit.com/r/btc/comments/7mh1wm/honest_opinion_i_hate_both_subs/
"u/Dainathon, you've received `0.00035095 BCH ($1 USD)`!
***
[^^How to use](https://np.reddit.com/r/tippr/wiki/index) ^^| [^^What is Bitcoin Cash?](https://learnbitcoin.cash/) ^^| [^^Who accepts it?](https://acceptbitcoin.cash) ^^| ^^Powered ^^by ^^[Rocketr](https://rocketr.net) ^^| ^^r/tippr  
^(Bitcoin Cash is what Bitcoin should be. Ask about it on r/btc)";2;0;False;tippr;drtv07d;Honest Opinion: I hate both subs;https://www.reddit.com/r/btc/comments/7mh1wm/honest_opinion_i_hate_both_subs/
also oops forgot to say, thank you!;1;0;False;Dainathon;drtyf8q;Honest Opinion: I hate both subs;https://www.reddit.com/r/btc/comments/7mh1wm/honest_opinion_i_hate_both_subs/
oh shucks :$ (thank you, kind stranger);2;0;False;Dainathon;drtuxb2;Honest Opinion: I hate both subs;https://www.reddit.com/r/btc/comments/7mh1wm/honest_opinion_i_hate_both_subs/
"u/Dainathon, you've received `0.00008773 BCH ($0.25 USD)`!
***
[^^How to use](https://np.reddit.com/r/tippr/wiki/index) ^^| [^^What is Bitcoin Cash?](https://learnbitcoin.cash/) ^^| [^^Who accepts it?](https://acceptbitcoin.cash) ^^| ^^Powered ^^by ^^[Rocketr](https://rocketr.net) ^^| ^^r/tippr  
^(Bitcoin Cash is what Bitcoin should be. Ask about it on r/btc)";2;0;False;tippr;drtuyg3;Honest Opinion: I hate both subs;https://www.reddit.com/r/btc/comments/7mh1wm/honest_opinion_i_hate_both_subs/
People are allowed to voice negative opinions;5;5;False;Dainathon;dru0bm9;Honest Opinion: I hate both subs;https://www.reddit.com/r/btc/comments/7mh1wm/honest_opinion_i_hate_both_subs/
Exactly, so did /u/TacoTuesdayTime, he voiced his opinion and got downvoted by the same people who upvoted you... that is Schizophrenia... or trolling...;6;1;False;bitcornio;dru50hx;Honest Opinion: I hate both subs;https://www.reddit.com/r/btc/comments/7mh1wm/honest_opinion_i_hate_both_subs/
Absolutely;7;0;False;TacoTuesdayTime;dru2v91;Honest Opinion: I hate both subs;https://www.reddit.com/r/btc/comments/7mh1wm/honest_opinion_i_hate_both_subs/
In this sub yes;11;0;False;Inthewirelain;dru35ft;Honest Opinion: I hate both subs;https://www.reddit.com/r/btc/comments/7mh1wm/honest_opinion_i_hate_both_subs/
Meh, I'd argue 80%+ of the people there don't even know that Bcash isn't just a normal abbreviation of BCH, like ether is short for Ethereum.     ;6;1;False;-Cubie-;drtyf7d;Honest Opinion: I hate both subs;https://www.reddit.com/r/btc/comments/7mh1wm/honest_opinion_i_hate_both_subs/
"Here's a sneak peek of /r/dogecoin using the [top posts](https://np.reddit.com/r/dogecoin/top/?sort=top&t=year) of the year!

\#1: [Dogecoin is now worth $0.01!](https://i.redd.it/4gc0mwfbez501.png) | [636 comments](https://np.reddit.com/r/dogecoin/comments/7lz346/dogecoin_is_now_worth_001/)  
\#2: [HERE WE GO 🚀🚀🚀](https://imgur.com/ANCygix) | [320 comments](https://np.reddit.com/r/dogecoin/comments/7k7ghx/here_we_go/)  
\#3: [So I did a remake of an old Internet-explorer comic...](https://i.redd.it/3kezdwfvdh501.jpg) | [69 comments](https://np.reddit.com/r/dogecoin/comments/7lhmf9/so_i_did_a_remake_of_an_old_internetexplorer_comic/)

----
^^I'm ^^a ^^bot, ^^beep ^^boop ^^| ^^Downvote ^^to ^^remove ^^| [^^Contact ^^me](https://www.reddit.com/message/compose/?to=sneakpeekbot) ^^| [^^Info](https://np.reddit.com/r/sneakpeekbot/) ^^| [^^Opt-out](https://np.reddit.com/r/sneakpeekbot/comments/6l7i0m/blacklist/)";11;0;False;sneakpeekbot;dru0scz;Honest Opinion: I hate both subs;https://www.reddit.com/r/btc/comments/7mh1wm/honest_opinion_i_hate_both_subs/
"no need for hate.

Once you have insight you can use the knowledge to your benefit, stay open.

www.youtube.com/watch?v=rE3j_RHkqJc&t";2;0;False;Adrian-X;drtyhbc;Honest Opinion: I hate both subs;https://www.reddit.com/r/btc/comments/7mh1wm/honest_opinion_i_hate_both_subs/
"It's just super primitive, it's sad we find a way to divide in any way we can. Rather than focusing on the positive changes we can make we spend half of our time arguing and claiming we have the better x.

This sounds rather sanctimonious but again just feelings.

Sorry the op feels this way 🐡";2;0;False;Garfty;drtv9yx;Honest Opinion: I hate both subs;https://www.reddit.com/r/btc/comments/7mh1wm/honest_opinion_i_hate_both_subs/
"I hate you too :) 

/u/tippr $0.25";2;2;False;KrakenPipe;drtuwba;Honest Opinion: I hate both subs;https://www.reddit.com/r/btc/comments/7mh1wm/honest_opinion_i_hate_both_subs/
This sub is way better than the other, that’s for sure. It’s an uncensored discussion even if most people are like-minded about BCH. There is r/cryptocurrency for more general discussion which I find refreshing. ;4;0;False;morli;dru2l0r;Honest Opinion: I hate both subs;https://www.reddit.com/r/btc/comments/7mh1wm/honest_opinion_i_hate_both_subs/
"Another is ""crotch spawn""";3;1;False;Sovereign_Curtis;dru62py;Honest Opinion: I hate both subs;https://www.reddit.com/r/btc/comments/7mh1wm/honest_opinion_i_hate_both_subs/
I've found /r/bitcoincash and /r/cryptocurrency are more balanced, informative forums with less flamewar. ;7;1;False;tevert;dru4raz;Honest Opinion: I hate both subs;https://www.reddit.com/r/btc/comments/7mh1wm/honest_opinion_i_hate_both_subs/
Whenever I get burnt out with the drama on these 2 subs I head over to r/dogecoin They're very happy people over there.;78;4;False;bigkahuna1986;dru03to;Honest Opinion: I hate both subs;https://www.reddit.com/r/btc/comments/7mh1wm/honest_opinion_i_hate_both_subs/
