body;score;nb_replies;stickied;author;id;post_title;post_link
"> Just because you disagree with his opinion, doesn't mean you should be downvoting him.

Perhaps because it's a low effort dig at the community here?  

And yeah, I'm thinking about downvoting your comment as well because it adds no value to the discussion.  That's my opinion and my prerogative.  It's the power bestowed upon me by the devs of this software.  But I bet you'll call that censorship, anyway.

But here in the world of reality, that's a far cry from mods actively deleting comments with dissenting PoVs.";1;0;False;skarphace;drtqhxd;rBitcoin logic: Cashing out? You should kill yourself instead;https://imgur.com/Fo8rZQi
We can all still see your comments;2;0;False;highintensitycanada;drt39m4;rBitcoin logic: Cashing out? You should kill yourself instead;https://imgur.com/Fo8rZQi
"Disagree with his opinion? His comment was completely arbitrary and with no substance.

Ok /u/TubeScreamers comment:

> Yeah it is so much worse than the r/btc circlejerk

*NO WAY* that was downvoted!!

Am I missing something here, /u/Timmarus? Why write me such an empty reply on such nonsense?";5;1;False;PsyRev_;drt2p9q;rBitcoin logic: Cashing out? You should kill yourself instead;https://imgur.com/Fo8rZQi
"We're here, reading and responding.

Come on. There's blatant censorship and then there's downvoting. They aren't comparable.

One is a privileged action done by a central authority in a way that prevents access to information. The other is still publicly viewable...";14;1;False;Ranguvar;drt2nhu;rBitcoin logic: Cashing out? You should kill yourself instead;https://imgur.com/Fo8rZQi
"I agree. That's why I used the phrase ""close to solving"".";2;0;False;yoyoyodayoyo;drta70e;rBitcoin logic: Cashing out? You should kill yourself instead;https://imgur.com/Fo8rZQi
"You're welcome!
Yeap to me, we should start thinking in non-fiat currency. I'm tipping BCH not dollars and you're getting BCH. If I say I tip $5, 5 minutes later it is not going to still be $5.";3;0;False;artwell;drt6fj0;rBitcoin logic: Cashing out? You should kill yourself instead;https://imgur.com/Fo8rZQi
Bravo. This is some /r/bestof content right here. ;2;0;False;knowhatimsayin;drtg4dt;rBitcoin logic: Cashing out? You should kill yourself instead;https://imgur.com/Fo8rZQi
It's still better than being 100% memes about holding or about the price;3;0;False;yoyoyodayoyo;drt7up9;rBitcoin logic: Cashing out? You should kill yourself instead;https://imgur.com/Fo8rZQi
"I agree on your points about this sub's degradation but not about tech. But to even make a comparison between this sub and r/bitcoin is trying too hard to be neutral imo. While it's true that stupid memes are getting on to front page, there is still a lot of quality posts and discussions here. Something that is very rare to see on the other side.

It's also worth noting that while the majority of this sub despises LN, they're not against it the same way that r/Bitcoin is against ""Bcash"". A lot of people are either frustrated with LN's ""soon to be implemented in 18 months™"" schedule or they think it's gonna lead to even more centralization. Compare that to r/bitcoin trolls who come here to only say ""btrash""...

Regardless of all these things, this was a quality analysis and a crticism that we much needed. Don't think I'm too happy how this sub is going at the moment.";3;0;False;BloodForTheSkyGod;drtj3cl;rBitcoin logic: Cashing out? You should kill yourself instead;https://imgur.com/Fo8rZQi
"Basically you're saying this sub leans strongly toward BCH. Does that make it a cult, or just rational? Depends on your point of view. 

Attacking BTC? Make no mistake, this is a battle for supremacy. It can't be otherwise. BCH's *raison d'etre* is rooted deeply in how BTC has corrupted the Bitcoin vision, and the name itself means a lot to the market. Bitcoin has always been bloody. We should strive to accentuate the positive, but if it becomes just a friendly fun-fest that will be my cue to leave, either because it's gone off the rails or because we reached full mainstream success and I can move on to something else. 

And moderation to keep discussion ""objective""? Now I know you haven't been around for long. /r/science is horribly censored, by the way. All heavy moderation does is keep the mainstream view going, and keep the celebrity scientists with their silly moats in power, as if they needed any help. We saw the same thing in /r/Bitcoin. Not allowed to question ""settled"" matters. Incense must be waved in front of Core devs. Team Science. Team Cypherpunk. ""I fucking love science!"" ""PieterWuilleFacts.com."" Exact same BS. Hero worship masquerading as objectivity.";12;1;False;ForkiusMaximus;drt7qh8;rBitcoin logic: Cashing out? You should kill yourself instead;https://imgur.com/Fo8rZQi
haha you might be right. I'll try be ready when it corrects (and people leave with their profits);1;0;False;magkruppe;drtdp1b;rBitcoin logic: Cashing out? You should kill yourself instead;https://imgur.com/Fo8rZQi
"I've only read the whitepaper, but it was really, really bad. It can basically be summarized as ""we're running a Bitcoin wallet over Tor"". Woo!";2;0;False;Poromenos;drted6k;rBitcoin logic: Cashing out? You should kill yourself instead;https://imgur.com/Fo8rZQi
Ripple foundation has partnerships with banks looking to use their technology.  The XRP coin itself will see none of that action. Those banks will likely just make their own crytpo they use based on the ripple foundations technology. People need to be weary there is a big difference there.  XRP is just a way for the ripple foundation to fund itself.  ;-4;0;False;maxpainpays;drtc7kk;rBitcoin logic: Cashing out? You should kill yourself instead;https://imgur.com/Fo8rZQi
"Making money is the result of the right actions, can not be an objective in itself.

You think its the right action to support the banking system and that this system has an as glory future as something innovative like BCH?

I say any penny you invest in XRP could be better invested in BCH, because it will grow muuuuuuuuch faster, in the long run to full market adoption

XRP is just another bank product, its outdated, banks are outdated, banks are a scam, doesnt matter if you might make some profit, they are cruel institutions which sell their soul for money, you want to take part in that?

If you want to take part in the banking scam, you have to keep in mind that the money you will earn is stolen from the poor which were working their whole life for the only house they want to live in, until in the last moment they couldnt pay the mortgage anymore... because things just happen, like you loose your job or you get divorced or you get seriously ill... BANKS KNOW THAT, banks know that a percentage will not be able to pay of the mortgge and in the end they will have a huuuuuuuge chunk of extra scam money instead of insuring the people for these sidecases when they can not pay the mortgage anymore... I have many many friends, who are really fucked because they believed the shit banks are talking when they want to convince you to buy a house with their money, so you are enslaved for the rest of your life.

Banks are evil and if you support them, you act evil as well >just gettting rich from scamming the poor<";-12;4;False;bitcornio;drtbhpn;rBitcoin logic: Cashing out? You should kill yourself instead;https://imgur.com/Fo8rZQi
XRP isn't really a crypto. It shouldn't be on coinmarketcap. ;5;1;False;Vibr8gKiwi;drtic2x;rBitcoin logic: Cashing out? You should kill yourself instead;https://imgur.com/Fo8rZQi
Well said. ;13;1;False;thatguitarist;drtamgn;rBitcoin logic: Cashing out? You should kill yourself instead;https://imgur.com/Fo8rZQi
[deleted];0;1;False;;drti1lm;rBitcoin logic: Cashing out? You should kill yourself instead;https://imgur.com/Fo8rZQi
It's spelled 'Ethereum'.;3;1;False;etherium_bot;drtq2uy;rBitcoin logic: Cashing out? You should kill yourself instead;https://imgur.com/Fo8rZQi
Bch has a CEO that's a big difference for me that bitcoin doesn't have bit I personally see uses for both and here comes the hate mail.;0;2;False;AreallyMadTurtle;drtnyvq;rBitcoin logic: Cashing out? You should kill yourself instead;https://imgur.com/Fo8rZQi
I agree. Telling people to kill themselves for cashing out of Bitcoin is a bad idea. Toxic, really.;1;1;False;tjmac;drtnyos;rBitcoin logic: Cashing out? You should kill yourself instead;https://imgur.com/Fo8rZQi
Haha cheers mate! ;1;0;False;DrunkPanda;drt41et;rBitcoin logic: Cashing out? You should kill yourself instead;https://imgur.com/Fo8rZQi
"u/DrunkPanda, your post was gilded in exchange for `0.00082534 BCH ($2.50 USD)`! Congratulations!
***
[^^How to use](https://np.reddit.com/r/tippr/wiki/index) ^^| [^^What is Bitcoin Cash?](https://learnbitcoin.cash/) ^^| [^^Who accepts it?](https://acceptbitcoin.cash) ^^| ^^Powered ^^by ^^[Rocketr](https://rocketr.net) ^^| ^^r/tippr  
^(Bitcoin Cash is what Bitcoin should be. Ask about it on r/btc)";1;0;False;tippr;drt3weq;rBitcoin logic: Cashing out? You should kill yourself instead;https://imgur.com/Fo8rZQi
I can help, for a fee;6;1;False;threesixzero;drt427c;rBitcoin logic: Cashing out? You should kill yourself instead;https://imgur.com/Fo8rZQi
"Carvalho interview, near the end when he gets pissed and gets thrown off his typical talking points and starts ranting. Something about he didn't want ""his projects"" being insulted by being called bcash.";-1;0;False;chazley;drsyka9;rBitcoin logic: Cashing out? You should kill yourself instead;https://imgur.com/Fo8rZQi
[deleted];1;5;False;;drt2g7i;rBitcoin logic: Cashing out? You should kill yourself instead;https://imgur.com/Fo8rZQi
"u/farsightxr20, you've received `0.0001 BCH ($0.295434 USD)`!
***
[^^How to use](https://np.reddit.com/r/tippr/wiki/index) ^^| [^^What is Bitcoin Cash?](https://learnbitcoin.cash/) ^^| [^^Who accepts it?](https://acceptbitcoin.cash) ^^| ^^Powered ^^by ^^[Rocketr](https://rocketr.net) ^^| ^^r/tippr  
^(Bitcoin Cash is what Bitcoin should be. Ask about it on r/btc)";1;0;False;tippr;drtem32;rBitcoin logic: Cashing out? You should kill yourself instead;https://imgur.com/Fo8rZQi
Until altcoins actually reach/surpass Bitcoin's scale while continuing to run smoothly, you can't say they've solved the scaling problem. While they might make design choices that appear to alleviate bottlenecks present in Bitcoin, there are always unforeseen issues and attack vectors that only materialize when the system sees real-world testing.;7;1;False;farsightxr20;drt8qmu;rBitcoin logic: Cashing out? You should kill yourself instead;https://imgur.com/Fo8rZQi
"Thanks! And +1 for using ""bits"" :)";3;1;False;farsightxr20;drt690z;rBitcoin logic: Cashing out? You should kill yourself instead;https://imgur.com/Fo8rZQi
OK but reddit pms aren't part of history, and you'd think something like death threats you'd hold onto;1;0;False;DrunkPanda;drtrrmf;rBitcoin logic: Cashing out? You should kill yourself instead;https://imgur.com/Fo8rZQi
"How do you know where the downvotes come from? It might also be partially people that agree with you but downvote you to make /r/btc look bad. 

Not saying that is true but it's possible. And no /r/btc is not a cult, if anything it's a counter movement against a cult or .... a place for excult members to share stories about the cult. That's what /r/btc is, it became that BECAUSE of /r/bitcoin and not the other way around. The main reason that /r/btc suddenly started growing in subscribers was because so many people got banned. Man there was time in ./r/bitcoin when  like 80% of the people there wanted /u/theymos to be removed as moderator. Then the purge started and now /r/btc is full of exciles and we like to sing sob stories and hope to maybe one day return to our motherland. I don't know, I am kind of rambling right now. But it's true, what /r/btc has become is cause and effect.

/r/btc is not the cause, but the effect. So it's all the fault of /u/theymos at /r/bitcoin who literally said: if 90% of the users here don't agree then I want 90% to leave. Now that is dictatorship. Consensus my ass. Power hungry bunch of people that are rotten to the core. /u/theymos is Master Manipulator ";2;1;False;Kain_niaK;drtrti9;rBitcoin logic: Cashing out? You should kill yourself instead;https://imgur.com/Fo8rZQi
"What's funny is that this guy gets attacked by /r/Bitcoin, and then the top comment in /r/BTC puts the same guy down for being ""clueless.""

If you don't see the hypocrisy in that, I don't know what to tell you.";40;2;False;variable42;drt52eu;rBitcoin logic: Cashing out? You should kill yourself instead;https://imgur.com/Fo8rZQi
this subreddit is kind of a cult too tho lol;1;0;False;3th0s;drtutoo;rBitcoin logic: Cashing out? You should kill yourself instead;https://imgur.com/Fo8rZQi
/r/bitcointology;4;0;False;Kain_niaK;drt0hrs;rBitcoin logic: Cashing out? You should kill yourself instead;https://imgur.com/Fo8rZQi
Sadly so is /r/btc;103;12;False;Harucifer;drszsi5;rBitcoin logic: Cashing out? You should kill yourself instead;https://imgur.com/Fo8rZQi
">/r/bitcoin is a cult

They believe in the LN that will fall from the sky and save them like the second coming.";9;1;False;unitedstatian;drt7rhp;rBitcoin logic: Cashing out? You should kill yourself instead;https://imgur.com/Fo8rZQi
It's crazy how they try so hard to manipulate and control, but give themselves only black eyes and drive everyone away.;116;2;False;BTC_StKN;drsv51m;rBitcoin logic: Cashing out? You should kill yourself instead;https://imgur.com/Fo8rZQi
That sounds insane.;0;1;False;GayloRen;drtad6u;rBitcoin logic: Cashing out? You should kill yourself instead;https://imgur.com/Fo8rZQi
"That was an obvious fake post with the intention of spreading FUD. I wonder how would this sub react to a similar post saying ""I'm cashing out. I'm obviously sad I didn't sell my bch at $4000, but it seems everybody else is also selling now""";-10;2;False;Cecinestpasunnomme;drt6pek;rBitcoin logic: Cashing out? You should kill yourself instead;https://imgur.com/Fo8rZQi
"Most of the people, even if they have been in it for years (which is a minority) Have bought and sold, and bought more at higher prices. That is what makes the price go up, people buying.

We sometimes imagine that each person invested in a crypto bought at one particular time, and that whatever they bought at that time has doubled, tripled, or 15Xed. Actually they probably bought 0.000001 btc at that time and sold it at 1k only to buy back in 4k and sell most at 3.9k and so on.";1;0;False;Spokesface;drtsfl2;rBitcoin logic: Cashing out? You should kill yourself instead;https://imgur.com/Fo8rZQi
"It's also about losing that rush. They come to reddit everyday and see everyone in their community celebrating over rising value. They get to have fun shitposting and speculating and celebrating. It's a nice positive outlet for them. It gives them something to look forward to. Seeing people pull out en masse means the party is over and that's very disappointing to them. It's a reality check. So they get upset because they know the end is near and they'll have to go back to their boring lives. 

Imagine a lottery where your ticket is ""good"" for multiple drawings. Everyday you and thousands of others check the numbers. You talk about what you'll do with the money. And everyday that you don't win, the pot size increases. Then one day you find out your ticket is about to expire so you won't be part of any more drawings. And the pot is shrinking quickly. ";11;0;False;galacticengine;drtg1sf;rBitcoin logic: Cashing out? You should kill yourself instead;https://imgur.com/Fo8rZQi
"Most have probably made very little, and they're bitter someone else has ""enough"" to say ""ok I'm done.""

If people start realizing their profits the people holding 0.1 BTC will never cash out for $100k-$1M -- they want the ""nothing to mega wealthy"" story of their own.";217;4;False;LightShadow;drt5p5x;rBitcoin logic: Cashing out? You should kill yourself instead;https://imgur.com/Fo8rZQi
[deleted];-3;1;False;;drtr5ct;rBitcoin logic: Cashing out? You should kill yourself instead;https://imgur.com/Fo8rZQi
I think , i can keep his coin & sale it when the prices get higher..m;-3;0;False;Airsent;drt0cc1;rBitcoin logic: Cashing out? You should kill yourself instead;https://imgur.com/Fo8rZQi
[deleted];-2;3;False;;drtdq4y;rBitcoin logic: Cashing out? You should kill yourself instead;https://imgur.com/Fo8rZQi
r/btc is a cult of hating the real bitcoin, most of people here are salty as hell cause they didn't hop on earlier & now cant afford a whole coin. reason why 99% of people here promote shit coins lul;-5;2;False;Nikooohz;drtbr26;rBitcoin logic: Cashing out? You should kill yourself instead;https://imgur.com/Fo8rZQi
This is photoshopped;-1;1;False;thsijlokn;drtn4n1;rBitcoin logic: Cashing out? You should kill yourself instead;https://imgur.com/Fo8rZQi
"I would never attack someone like this, but I see where the attackers are coming from. By leaving messages like ""I'm out, it's been a good run.."" yada yada, people start thinking some ""thing"" is dying (I've seen this a lot on various gaming related subreddits).  

I think it's called ""[Poisoning the well](https://en.wikipedia.org/wiki/Poisoning_the_well)"", right?";-1;0;False;RedSnt;drtdmv8;rBitcoin logic: Cashing out? You should kill yourself instead;https://imgur.com/Fo8rZQi
Literally the strongest asset to double , tripple , quadruple plus more times your money is XRP. Many don’t like it because of it being for banks etc , you don’t have to like it once you realise it’s worth and full potential value after using real maths from facts for the use case it’s looking to solve, then you’ll realise banks involved shouldn’t hold you back from making money ! ;-1;0;False;Rippling-XRP;drtadjg;rBitcoin logic: Cashing out? You should kill yourself instead;https://imgur.com/Fo8rZQi
it’s the retarded post. OP deserves to be flamed. ;-4;0;False;GeneralSchittlord;drtbivn;rBitcoin logic: Cashing out? You should kill yourself instead;https://imgur.com/Fo8rZQi
Honestly, if you are selling, sell and stfu about. ;-6;0;False;b0utch;drt2svy;rBitcoin logic: Cashing out? You should kill yourself instead;https://imgur.com/Fo8rZQi
most likely fake;-2;1;False;Tekglow;drt6o9s;rBitcoin logic: Cashing out? You should kill yourself instead;https://imgur.com/Fo8rZQi
This is almost 100% fake;0;0;False;TidyMosquito245;dru68zv;rBitcoin logic: Cashing out? You should kill yourself instead;https://imgur.com/Fo8rZQi
"The problem with BTH supporters is they don't realize that trying to take down BTC is likely to take down the whole market with it.

BTH is the only currency where it's supporters are so toxic towards other currencies and we are seeing him this is scaring investors across the board.";0;0;False;GiveMe_TreeFiddy;drtzh0c;rBitcoin logic: Cashing out? You should kill yourself instead;https://imgur.com/Fo8rZQi
You know how easy it is to fake stuff like this. Let's get back to the stuff that matters.;0;0;False;Pixels3D;drtq54i;rBitcoin logic: Cashing out? You should kill yourself instead;https://imgur.com/Fo8rZQi
You guys are funny! ;0;0;False;hroman324;drtkj2u;rBitcoin logic: Cashing out? You should kill yourself instead;https://imgur.com/Fo8rZQi
"Chances that the poster was getting actual death threats, and/or said death threats weren't perpetrated by this sub to further the propaganda? Very slim.

But hey, someone said something unverifiable on the internet that confirms our pre-existing bias, UPVOTE!";0;0;False;mccoyster;drtioka;rBitcoin logic: Cashing out? You should kill yourself instead;https://imgur.com/Fo8rZQi
"""It seems everyone else is also selling their bitcoins""

This should be the highlited part XD

And next time, please post the actual threats, not claims to have been threatened. Thanks.

I can believe that someone tries to manipulate the market for their own benefit (via manipulating you, dear redditors and readers), but it stuns me every time I see how many of you are so naive.";0;0;False;obx400;drtgy5v;rBitcoin logic: Cashing out? You should kill yourself instead;https://imgur.com/Fo8rZQi
Our sub is like the mafia, once youre in you dont just quit...  #btcmafia ;0;0;False;aprizm;drtdjva;rBitcoin logic: Cashing out? You should kill yourself instead;https://imgur.com/Fo8rZQi
Screenshot of the PMs or it didn't happen.;0;0;False;Who_Decided;drtdbkw;rBitcoin logic: Cashing out? You should kill yourself instead;https://imgur.com/Fo8rZQi
"https://i.imgur.com/m07PDIU.png

Good bait.
Really makes you think";0;1;False;natty_p;drtcfc5;rBitcoin logic: Cashing out? You should kill yourself instead;https://imgur.com/Fo8rZQi
Lmao and BTC isn’t? You morons run around with your heads cut off while the damn sub name is literally btc not bch. Talk about delusional. ;1;0;False;ItsEvan23;drtj1zn;rBitcoin logic: Cashing out? You should kill yourself instead;https://imgur.com/Fo8rZQi
Saaem as r/btc please tell me you see that?;0;0;False;pabbseven;drt7aok;rBitcoin logic: Cashing out? You should kill yourself instead;https://imgur.com/Fo8rZQi
http://np.reddit.com/r/Bitcoin/comments/7m3bv8/trump_knows_whats_up/drrm5cx cult indeed.;0;0;False;MairusuPawa;drt8xqc;rBitcoin logic: Cashing out? You should kill yourself instead;https://imgur.com/Fo8rZQi
So is r/btc. Roger Ver is like a god in here.;-45;6;False;chazley;drsw1xx;rBitcoin logic: Cashing out? You should kill yourself instead;https://imgur.com/Fo8rZQi
But Bitcoin Core is an open blockchain, not some PayPal clone, miners can mine it or abandon it, users can overload it or abandon it. **Salt overflow**;3;1;False;LexGrom;drt3hqx;rBitcoin logic: Cashing out? You should kill yourself instead;https://imgur.com/Fo8rZQi
"That's how most people in crypto behave sadly. 

If you publicly say that you cashed out because you already made a lot of money all the people will get automatically jealous which results into toxicity in the end.

Someone recently cashed out a lot of ETH over at their sub and a some people became really toxic in the comments as well and got a lot of up votes to the point he deleted every post he made regarding cashing out. 


Why can't people just be happy for other people...?

I mean of you have to cash out at some point. Either because you want actually to use your gained wealth on things instead of staring at it all the time and get a boner of it. Or you have to cash out because you are losing money.


I mean remember what happened last time everyone was dead sure and heavily invested into something? 

2007: The Real Estate bubble everyone heavily invest into burst.

And before that? 

2000: The Tech bubble everyone was dead sure is going to make them super rich.

Before that?

1990 Japanese Stock bubble bursts everyone with considerable money invested into.

In the end what I want to tell everyone is: Not everybody can get rich. As you can see in the past a few will get super rich and many will lose their savings to pay the profits of the super rich. That's how bubble markets work. Just think about how many people lost the majority of their retirement savings in 2008.

Yes Crypto currencies will likely take over the world at some point. But it would take many years maybe even another century or more till we see this really happening on a larger scale. Maybe it won't happen. Maybe it will be something completely different to Bitcoin or Ethereum. For now it's just gambling and speculation which is fine. But as always said: only put the money you are willing to lose into it. If you don't have any money to spare, find a way to earn it. Don't destroy your future because of greed.";3;0;False;Coinzillaa;drt48h1;rBitcoin logic: Cashing out? You should kill yourself instead;https://imgur.com/Fo8rZQi
If you want to! ;1;0;False;DrunkPanda;drtk4y7;rBitcoin logic: Cashing out? You should kill yourself instead;https://imgur.com/Fo8rZQi
"> they banned me

Welcome to the [club](https://www.reddit.com/r/rbitcoinbanned/).";2;0;False;Scott_WWS;drt9erv;rBitcoin logic: Cashing out? You should kill yourself instead;https://imgur.com/Fo8rZQi
There are none so blind as he who will not see.;2;0;False;WeaversReply;drt9fwp;rBitcoin logic: Cashing out? You should kill yourself instead;https://imgur.com/Fo8rZQi
Nah. r/the_donald is;4;1;False;FratricideV2;drtezi5;rBitcoin logic: Cashing out? You should kill yourself instead;https://imgur.com/Fo8rZQi
i lolled at this 😂😂🤙🏽;0;1;False;danktimetobealive;drte7qs;rBitcoin logic: Cashing out? You should kill yourself instead;https://imgur.com/Fo8rZQi
"Well... the ""humor"" of butters seems different everytime I happen to drop there.";5;0;False;EnayVovin;drstq0s;rBitcoin logic: Cashing out? You should kill yourself instead;https://imgur.com/Fo8rZQi
"yeah that's the Very Roadmap of Bitcoin Cash..
we need more Adaptation in the Market..in order that to achieve.. ";1;0;False;BitcoinCashIsFreedom;drt2qhb;rBitcoin logic: Cashing out? You should kill yourself instead;https://imgur.com/Fo8rZQi
Yeah I looked up his reddit username and it wasn't among his submissions anymore. Screenshot is from Dec 23;15;1;False;DrunkPanda;drst6f5;rBitcoin logic: Cashing out? You should kill yourself instead;https://imgur.com/Fo8rZQi
Perhaps you should hang around for a couple of months, reading posts and doing some fact checking, before you make more posts.;-1;1;False;tl121;drtf1nt;rBitcoin logic: Cashing out? You should kill yourself instead;https://imgur.com/Fo8rZQi
Eh... it’s money with radically different ethics on each side.;-2;2;False;tjmac;drt3et9;rBitcoin logic: Cashing out? You should kill yourself instead;https://imgur.com/Fo8rZQi
