body;score;nb_replies;stickied;author;id;post_title;post_link
Thx for news!;1;0;False;LucianE11;drt4tdn;"Rick Falkvinge:""Fun fact: I am aware of a truckload of companies currently in the process of converting from Bitcoin Legacy to #Bitcoin Cash. I am aware of zero (0) companies going the other direction.""";https://twitter.com/Falkvinge/status/945711005606252544
"You do a good job signalling competence like oh so many bottom-tier upstart devs, but unfortunately it backfires: if you liked the answer, you wouldn't be wriggling like that.   
I'll humor you, though: what is the current maximum number for transactions from BCH mempool that can get their first confirmation per second, averaged over, say, an hour? You may continue wriggling.";-3;1;False;Ilforte;drsmw3w;"Rick Falkvinge:""Fun fact: I am aware of a truckload of companies currently in the process of converting from Bitcoin Legacy to #Bitcoin Cash. I am aware of zero (0) companies going the other direction.""";https://twitter.com/Falkvinge/status/945711005606252544
Sorry, Bitcoin went back up $2000 in two days. What did scam coin cash do?;-1;1;False;;drt0n3e;"Rick Falkvinge:""Fun fact: I am aware of a truckload of companies currently in the process of converting from Bitcoin Legacy to #Bitcoin Cash. I am aware of zero (0) companies going the other direction.""";https://twitter.com/Falkvinge/status/945711005606252544
"My first ""gild,"" thanks!";1;0;False;Scott_WWS;drt8lsm;"Rick Falkvinge:""Fun fact: I am aware of a truckload of companies currently in the process of converting from Bitcoin Legacy to #Bitcoin Cash. I am aware of zero (0) companies going the other direction.""";https://twitter.com/Falkvinge/status/945711005606252544
"Ok, you don't know.

The answer is a segwit transaction takes up 4 times the block space to get twice the number of transactions. So a Segwit 'blocksize' increase is a ruse. 
> I'll humor you, though: what is the current maximum number for transactions from BCH mempool that can get their first confirmation per second, averaged over, say, an hour? You may continue wriggling.

The rest of your post does not even make sense. The answer to your question is 8Mib / ~250 bytes per block per hour.  

Also, you're a complete idiot.
";5;1;False;WeaponizedMath;drsmz98;"Rick Falkvinge:""Fun fact: I am aware of a truckload of companies currently in the process of converting from Bitcoin Legacy to #Bitcoin Cash. I am aware of zero (0) companies going the other direction.""";https://twitter.com/Falkvinge/status/945711005606252544
Well, if you have 0 how shall any go in direction BTC, eh? It's only natural that some switch from BTC to BCH. Although I'd say more switch to Dash and others.;0;1;False;JustBatman;drt7lrt;"Rick Falkvinge:""Fun fact: I am aware of a truckload of companies currently in the process of converting from Bitcoin Legacy to #Bitcoin Cash. I am aware of zero (0) companies going the other direction.""";https://twitter.com/Falkvinge/status/945711005606252544
"Man, you're terribly insecure, half of what you write is r/iamverysmart material. But whatever. 
> The answer is  

I did allow you to continue wrigging, so I won't object to this joke and this weak attempt to change the topic. But you do realize that it's a good way to show that you don't want to admit that BCH is actually worse in its throughput than LTC, right? Just admit it. You could throw around some impressive numbers, like ""56? haha BCH can do 100 tps"" but you're afraid to get called out on your bullshit.";-1;1;False;Ilforte;drsnfrv;"Rick Falkvinge:""Fun fact: I am aware of a truckload of companies currently in the process of converting from Bitcoin Legacy to #Bitcoin Cash. I am aware of zero (0) companies going the other direction.""";https://twitter.com/Falkvinge/status/945711005606252544
"Can't both BCH and LTC do about 56 transactions per second?

Considering you got the blocksize wrong by a factor of 4, I'm not sure about trusting your judgement about LTC having more throughput.";1;1;False;zackline;drtbnn1;"Rick Falkvinge:""Fun fact: I am aware of a truckload of companies currently in the process of converting from Bitcoin Legacy to #Bitcoin Cash. I am aware of zero (0) companies going the other direction.""";https://twitter.com/Falkvinge/status/945711005606252544
Honestly, I don't understand what you are trying to ask here. ;3;1;False;midipoet;drsp8xl;"Rick Falkvinge:""Fun fact: I am aware of a truckload of companies currently in the process of converting from Bitcoin Legacy to #Bitcoin Cash. I am aware of zero (0) companies going the other direction.""";https://twitter.com/Falkvinge/status/945711005606252544
[deleted];-8;2;False;;drsq0r9;"Rick Falkvinge:""Fun fact: I am aware of a truckload of companies currently in the process of converting from Bitcoin Legacy to #Bitcoin Cash. I am aware of zero (0) companies going the other direction.""";https://twitter.com/Falkvinge/status/945711005606252544
What about thepiratebay?;-3;1;False;negative_comments_;drspj3d;"Rick Falkvinge:""Fun fact: I am aware of a truckload of companies currently in the process of converting from Bitcoin Legacy to #Bitcoin Cash. I am aware of zero (0) companies going the other direction.""";https://twitter.com/Falkvinge/status/945711005606252544
No but it'll keep ypu from being retarded;4;0;False;highintensitycanada;drsoukz;"Rick Falkvinge:""Fun fact: I am aware of a truckload of companies currently in the process of converting from Bitcoin Legacy to #Bitcoin Cash. I am aware of zero (0) companies going the other direction.""";https://twitter.com/Falkvinge/status/945711005606252544
I'm aware of one Ass Hat named Roger Ver who's causing unneeded confusion and disruption in the crypto market by stealing the bitcoin name and tricking people into thinking they own bitcoin when they actually own bitcoin cash. ;-11;1;False;smick;drsmqa1;"Rick Falkvinge:""Fun fact: I am aware of a truckload of companies currently in the process of converting from Bitcoin Legacy to #Bitcoin Cash. I am aware of zero (0) companies going the other direction.""";https://twitter.com/Falkvinge/status/945711005606252544
There’s also very few vendors going from accepting only dogecoin and deciding now to accept bitcoin. ;16;1;False;Sugar_Daddy_Peter;drsu89x;"Rick Falkvinge:""Fun fact: I am aware of a truckload of companies currently in the process of converting from Bitcoin Legacy to #Bitcoin Cash. I am aware of zero (0) companies going the other direction.""";https://twitter.com/Falkvinge/status/945711005606252544
"So many morons and trolls on twitter. My gawd..some of them actually think segwit and lightning will work. 
";1;1;False;jonald_fyookball;drte0ww;"Rick Falkvinge:""Fun fact: I am aware of a truckload of companies currently in the process of converting from Bitcoin Legacy to #Bitcoin Cash. I am aware of zero (0) companies going the other direction.""";https://twitter.com/Falkvinge/status/945711005606252544
who would invest in a centralized shitcoin mined in china..lmao bcash btrash;-35;4;False;soul5tice;drswe46;"Rick Falkvinge:""Fun fact: I am aware of a truckload of companies currently in the process of converting from Bitcoin Legacy to #Bitcoin Cash. I am aware of zero (0) companies going the other direction.""";https://twitter.com/Falkvinge/status/945711005606252544
"I don't care about blocksize in BCH really, because it's subject to change (considering money at stake, Jihan may as well move to 64 Mb blocks right now purely for PR), but okay, I messed up. I'm yet to see any evidence that BCH can do even 40 tps. Theoretically it should cap at 28 on average. Pointing out my mistake isn't such evidence; if you have any, post link. 

LTC's figure of 56 comes from fully adopted segwit and a block every 2.5 minutes, in essense it just amps up bitcoin's base rate of 3.5 tx/s (for median transactions) by a factor of 16. You don't have to trust me, you can do your own research. ";1;1;False;Ilforte;drtc918;"Rick Falkvinge:""Fun fact: I am aware of a truckload of companies currently in the process of converting from Bitcoin Legacy to #Bitcoin Cash. I am aware of zero (0) companies going the other direction.""";https://twitter.com/Falkvinge/status/945711005606252544
"Low fees, with BCH you can donate $0.1

With BTC now if you donate less than $70 with the network pay by you and by the person you donated there is nearly nothing left.. ($20 fees, $70-40= $30!!)";1;0;False;Ant-n;drt68tq;"Rick Falkvinge:""Fun fact: I am aware of a truckload of companies currently in the process of converting from Bitcoin Legacy to #Bitcoin Cash. I am aware of zero (0) companies going the other direction.""";https://twitter.com/Falkvinge/status/945711005606252544
">""I am aware of zero (0) companies going the other direction.""

Dude just be patient, you will get your (1) confirmation it just take time. ";1;0;False;TetherTreasuryWallet;drsmnyp;"Rick Falkvinge:""Fun fact: I am aware of a truckload of companies currently in the process of converting from Bitcoin Legacy to #Bitcoin Cash. I am aware of zero (0) companies going the other direction.""";https://twitter.com/Falkvinge/status/945711005606252544
Bitpay will change that. Peer-To-Peer Electronic Cash will be usable again. ;2;0;False;Shock_The_Stream;drt5ias;"Rick Falkvinge:""Fun fact: I am aware of a truckload of companies currently in the process of converting from Bitcoin Legacy to #Bitcoin Cash. I am aware of zero (0) companies going the other direction.""";https://twitter.com/Falkvinge/status/945711005606252544
More interestingly, you could probably say the same about all major cryptos. Bitcoin is hemorrhaging users. No one is clamoring to use Bitcoin, cuz you can't use it.;2;0;False;dogbunny;drt8slk;"Rick Falkvinge:""Fun fact: I am aware of a truckload of companies currently in the process of converting from Bitcoin Legacy to #Bitcoin Cash. I am aware of zero (0) companies going the other direction.""";https://twitter.com/Falkvinge/status/945711005606252544
[deleted];1;1;False;;drt7z9d;"Rick Falkvinge:""Fun fact: I am aware of a truckload of companies currently in the process of converting from Bitcoin Legacy to #Bitcoin Cash. I am aware of zero (0) companies going the other direction.""";https://twitter.com/Falkvinge/status/945711005606252544
"> Plus among the main cryptocurrency BCH got the lowest fees.

When I commented, it was in the negatives. So you all upvoted him and downvoted me for pointing that out. How mature.

Also, BCH doesn't have lower fees than XRP or LTC. So, no.";1;2;False;veggie_sorry;drt6jk1;"Rick Falkvinge:""Fun fact: I am aware of a truckload of companies currently in the process of converting from Bitcoin Legacy to #Bitcoin Cash. I am aware of zero (0) companies going the other direction.""";https://twitter.com/Falkvinge/status/945711005606252544
iv been paying rent & purchasing groceries (until recently, the fee's are unsustainable now) for a good 5 years, no other crypto can replace that since none are accepted.. so end of the day credit card has won me back over.. ;1;2;False;Steelofhatori;drt4nhl;"Rick Falkvinge:""Fun fact: I am aware of a truckload of companies currently in the process of converting from Bitcoin Legacy to #Bitcoin Cash. I am aware of zero (0) companies going the other direction.""";https://twitter.com/Falkvinge/status/945711005606252544
What's the current sustainable tps number for BCH, smarty pants? Answer this. ;-4;1;False;Ilforte;drsmeiv;"Rick Falkvinge:""Fun fact: I am aware of a truckload of companies currently in the process of converting from Bitcoin Legacy to #Bitcoin Cash. I am aware of zero (0) companies going the other direction.""";https://twitter.com/Falkvinge/status/945711005606252544
"It's the MiB's.
Here come the MiB's.";-1;1;False;SchwarzerKaffee;drsoz5k;"Rick Falkvinge:""Fun fact: I am aware of a truckload of companies currently in the process of converting from Bitcoin Legacy to #Bitcoin Cash. I am aware of zero (0) companies going the other direction.""";https://twitter.com/Falkvinge/status/945711005606252544
This doesn't make any sense, are you talking to yourself?;-2;1;False;Ilforte;drsnwrs;"Rick Falkvinge:""Fun fact: I am aware of a truckload of companies currently in the process of converting from Bitcoin Legacy to #Bitcoin Cash. I am aware of zero (0) companies going the other direction.""";https://twitter.com/Falkvinge/status/945711005606252544
"I understand BCH is much more useful than BTC, but do investors really care? Pretty much every other crypto out there already works better than BTC. If that doesn't slow down investment into BTC, I'm having a tough time seeing how the flippening plays out.

I hope it happens, but the market doesn't always choose the superior product.";8;2;False;soloburrito;drssgnb;"Rick Falkvinge:""Fun fact: I am aware of a truckload of companies currently in the process of converting from Bitcoin Legacy to #Bitcoin Cash. I am aware of zero (0) companies going the other direction.""";https://twitter.com/Falkvinge/status/945711005606252544
"Your comment got +3

Plus among the main cryptocurrency BCH got the lowest fees.";0;1;False;Ant-n;drt6bdq;"Rick Falkvinge:""Fun fact: I am aware of a truckload of companies currently in the process of converting from Bitcoin Legacy to #Bitcoin Cash. I am aware of zero (0) companies going the other direction.""";https://twitter.com/Falkvinge/status/945711005606252544
"That's interesting. How many small value purchases can be made in stores in South Africa for $20 fees?

Blockstream removed the features from Bitcoin that made it useful as a currency. Adoption no longer matters for Bticoin. It's about how much money gets pumped in. You have one user who fulfills that use case - Banks

What's the reason to use Bitcoin Cash? The same reason we used Bitcoin for 8 years while everyone thought we were crazy. Because we're right. We've been right and we'll continue to be right. Because we just keep believing the same thing. Your camp brings the broken code. Not ours";6;1;False;WeaponizedMath;drt4kio;"Rick Falkvinge:""Fun fact: I am aware of a truckload of companies currently in the process of converting from Bitcoin Legacy to #Bitcoin Cash. I am aware of zero (0) companies going the other direction.""";https://twitter.com/Falkvinge/status/945711005606252544
This is always an interesting time of year in crypto land. People mix with their families (normal folk), get a feel for the lay of the mainstream perspective on cryptos and have time to reflect and meditate. The change of the year also tends to be an ideal time to bring new or different ideas to the fore. I think we'll be seeing some very bullish announcements in the beginning of January.;7;0;False;Richy_T;drsn980;"Rick Falkvinge:""Fun fact: I am aware of a truckload of companies currently in the process of converting from Bitcoin Legacy to #Bitcoin Cash. I am aware of zero (0) companies going the other direction.""";https://twitter.com/Falkvinge/status/945711005606252544
"Are you referring to total network throughput or are you referring to the total number of txs that can be broadcast, stored in mempool etc?

Because it's a shitty question but gives you multiple outs depending on my interpretation of 'sustainable TPS""

Because they answer depends on lots of things. How about you clean up your question and I'll give you a more specific answer.

Edit: Oh and also RBF is not in BCH anymore so there is that much less risk with 0 conf. So like I said, clean up your question and I can give you an answer. Until then, ask a sophmoric question get a sophmoric answer

Edit: Oh and this is fun - How about you tell me the tx to blocksize ratio of a segwit tx! (Don't worry, I'll answer this one for you when you can't)";8;1;False;WeaponizedMath;drsmjdf;"Rick Falkvinge:""Fun fact: I am aware of a truckload of companies currently in the process of converting from Bitcoin Legacy to #Bitcoin Cash. I am aware of zero (0) companies going the other direction.""";https://twitter.com/Falkvinge/status/945711005606252544
"I found the median tx fees lower on Dash.

Recently with dash Ive paid between 1/10th of a cent to 1 cent.";1;0;False;PrinceKael;drt5si4;"Rick Falkvinge:""Fun fact: I am aware of a truckload of companies currently in the process of converting from Bitcoin Legacy to #Bitcoin Cash. I am aware of zero (0) companies going the other direction.""";https://twitter.com/Falkvinge/status/945711005606252544
Absolute horseshit.;1;0;False;;drt0pec;"Rick Falkvinge:""Fun fact: I am aware of a truckload of companies currently in the process of converting from Bitcoin Legacy to #Bitcoin Cash. I am aware of zero (0) companies going the other direction.""";https://twitter.com/Falkvinge/status/945711005606252544
If they hardforked to Litecoin Cash, then Bitcoin Cash has won.;8;1;False;VKAllen;drsnt0e;"Rick Falkvinge:""Fun fact: I am aware of a truckload of companies currently in the process of converting from Bitcoin Legacy to #Bitcoin Cash. I am aware of zero (0) companies going the other direction.""";https://twitter.com/Falkvinge/status/945711005606252544
He should have left the last sentence off - it loses him some credibility IMO.  There are no companies switching from BCH > BTC because BTC is the incumbent.  Companies were already integrated with BTC before the fork.  ;10;0;False;an_albino_rhino;drsqw6b;"Rick Falkvinge:""Fun fact: I am aware of a truckload of companies currently in the process of converting from Bitcoin Legacy to #Bitcoin Cash. I am aware of zero (0) companies going the other direction.""";https://twitter.com/Falkvinge/status/945711005606252544
What are these things that you disagree with? And do you have sources to support your case? Are they opinions or facts that you disagree with?;1;1;False;IamSOFAkingRETARD;drsx406;"Rick Falkvinge:""Fun fact: I am aware of a truckload of companies currently in the process of converting from Bitcoin Legacy to #Bitcoin Cash. I am aware of zero (0) companies going the other direction.""";https://twitter.com/Falkvinge/status/945711005606252544
You'd have to ask him for the specifics of why. He suggested it on Twitter so he didn't go into details.;1;0;False;chalbersma;drtaqma;"Rick Falkvinge:""Fun fact: I am aware of a truckload of companies currently in the process of converting from Bitcoin Legacy to #Bitcoin Cash. I am aware of zero (0) companies going the other direction.""";https://twitter.com/Falkvinge/status/945711005606252544
Is that #2 from Austin Powers?;5;0;False;Growchacho;drsvljv;"Rick Falkvinge:""Fun fact: I am aware of a truckload of companies currently in the process of converting from Bitcoin Legacy to #Bitcoin Cash. I am aware of zero (0) companies going the other direction.""";https://twitter.com/Falkvinge/status/945711005606252544
There are very little facts offered in r/btc and those that are, are skewed to suit an overarching narrative. The truth is often found in the middle. ;1;0;False;midipoet;drta6tz;"Rick Falkvinge:""Fun fact: I am aware of a truckload of companies currently in the process of converting from Bitcoin Legacy to #Bitcoin Cash. I am aware of zero (0) companies going the other direction.""";https://twitter.com/Falkvinge/status/945711005606252544
">Plenty of cryptos have lower fees than BCH.

Why did you get downvoted? This sub is just as bad as r/bitcoin";-6;1;False;veggie_sorry;drspzsz;"Rick Falkvinge:""Fun fact: I am aware of a truckload of companies currently in the process of converting from Bitcoin Legacy to #Bitcoin Cash. I am aware of zero (0) companies going the other direction.""";https://twitter.com/Falkvinge/status/945711005606252544
Does it matter at that point, when fees are less than a penny?;1;0;False;;drth898;"Rick Falkvinge:""Fun fact: I am aware of a truckload of companies currently in the process of converting from Bitcoin Legacy to #Bitcoin Cash. I am aware of zero (0) companies going the other direction.""";https://twitter.com/Falkvinge/status/945711005606252544
">Plenty of cryptos have lower fees than BCH.

Then you have to use shapeshift to convert to BCH and then cash out..";2;0;False;Ant-n;drt6aml;"Rick Falkvinge:""Fun fact: I am aware of a truckload of companies currently in the process of converting from Bitcoin Legacy to #Bitcoin Cash. I am aware of zero (0) companies going the other direction.""";https://twitter.com/Falkvinge/status/945711005606252544
"Don't underestimate the air-drop. For many, when it comes time to use a crypto, they'll find they already have ~~BTC~~ **BCH**.

Hmm. Perhaps an update of that Neo meme is in order.

Edit: whoops.";6;0;False;Richy_T;drsnn9a;"Rick Falkvinge:""Fun fact: I am aware of a truckload of companies currently in the process of converting from Bitcoin Legacy to #Bitcoin Cash. I am aware of zero (0) companies going the other direction.""";https://twitter.com/Falkvinge/status/945711005606252544
except bitcoin can be used to purchase from many places, even here in south africa most if not all online stores take bitcoin.. 0 take bitcoin cash.. so whats the point of having low fee's if there is no reason to transact? iv asked many.. many bitcashers this question and none can answer.;-1;1;False;Steelofhatori;drt4in4;"Rick Falkvinge:""Fun fact: I am aware of a truckload of companies currently in the process of converting from Bitcoin Legacy to #Bitcoin Cash. I am aware of zero (0) companies going the other direction.""";https://twitter.com/Falkvinge/status/945711005606252544
"lol honestly, only Bitcoin holders will need the pirate bay once this is all said and done.

Bitcoin Cash group will not mind paying for whatever we need.";2;1;False;inherently_silly;drst3jl;"Rick Falkvinge:""Fun fact: I am aware of a truckload of companies currently in the process of converting from Bitcoin Legacy to #Bitcoin Cash. I am aware of zero (0) companies going the other direction.""";https://twitter.com/Falkvinge/status/945711005606252544
And why not?;2;1;False;rbatra91;drt17s5;"Rick Falkvinge:""Fun fact: I am aware of a truckload of companies currently in the process of converting from Bitcoin Legacy to #Bitcoin Cash. I am aware of zero (0) companies going the other direction.""";https://twitter.com/Falkvinge/status/945711005606252544
"Your inability to simply type out two words shows what a pathetic troll cunt you really are. It's a great litmus test for dumb fucking retards like you. If you simply refuse to call it Bitcoin Cash, your a piece of shit troll. No rational person would call it Bcash still unless they had an agenda.

Now suck my dick you piece of shit troll.";3;1;False;offthewalruschain;drsnffd;"Rick Falkvinge:""Fun fact: I am aware of a truckload of companies currently in the process of converting from Bitcoin Legacy to #Bitcoin Cash. I am aware of zero (0) companies going the other direction.""";https://twitter.com/Falkvinge/status/945711005606252544
So a pump n dump incoming?;2;0;False;highintensitycanada;drt3e0s;"Rick Falkvinge:""Fun fact: I am aware of a truckload of companies currently in the process of converting from Bitcoin Legacy to #Bitcoin Cash. I am aware of zero (0) companies going the other direction.""";https://twitter.com/Falkvinge/status/945711005606252544
"Bitcoin: LN is coming and will revolutionize the game.

r/btc : 18 months lolz?

Random twitter user: Mass merchant adoption coming

r/btc: Moon!";2;0;False;chazley;drszie7;"Rick Falkvinge:""Fun fact: I am aware of a truckload of companies currently in the process of converting from Bitcoin Legacy to #Bitcoin Cash. I am aware of zero (0) companies going the other direction.""";https://twitter.com/Falkvinge/status/945711005606252544
[deleted];2;1;False;;drt6k6s;"Rick Falkvinge:""Fun fact: I am aware of a truckload of companies currently in the process of converting from Bitcoin Legacy to #Bitcoin Cash. I am aware of zero (0) companies going the other direction.""";https://twitter.com/Falkvinge/status/945711005606252544
Why would anyone switch from BCH to BTC? It would be utterly pointless.;2;0;False;gone11gone11;drt8ocf;"Rick Falkvinge:""Fun fact: I am aware of a truckload of companies currently in the process of converting from Bitcoin Legacy to #Bitcoin Cash. I am aware of zero (0) companies going the other direction.""";https://twitter.com/Falkvinge/status/945711005606252544
"> Your inability to simply type out two words

It's worse than that. The inability to *leave out two letters* in order to refer to something correctly in baffling.";2;0;False;Phayzon;drsvhy0;"Rick Falkvinge:""Fun fact: I am aware of a truckload of companies currently in the process of converting from Bitcoin Legacy to #Bitcoin Cash. I am aware of zero (0) companies going the other direction.""";https://twitter.com/Falkvinge/status/945711005606252544
Do you mean legacy bitcoin?;1;1;False;highintensitycanada;drt3cdd;"Rick Falkvinge:""Fun fact: I am aware of a truckload of companies currently in the process of converting from Bitcoin Legacy to #Bitcoin Cash. I am aware of zero (0) companies going the other direction.""";https://twitter.com/Falkvinge/status/945711005606252544
"Today?  TODAY?

Glad to see you're a visionary who can't look towards the future.  It makes it a lot easier for builders to grow the community.

Bitcoin Cash is coming, and coming fast.";1;1;False;Vincents_keyboard;drsynmc;"Rick Falkvinge:""Fun fact: I am aware of a truckload of companies currently in the process of converting from Bitcoin Legacy to #Bitcoin Cash. I am aware of zero (0) companies going the other direction.""";https://twitter.com/Falkvinge/status/945711005606252544
Mark this post - Pirate Bay will be taking BCH in the next 18 months.;1;0;False;Scott_WWS;drt90q7;"Rick Falkvinge:""Fun fact: I am aware of a truckload of companies currently in the process of converting from Bitcoin Legacy to #Bitcoin Cash. I am aware of zero (0) companies going the other direction.""";https://twitter.com/Falkvinge/status/945711005606252544
