body;score;nb_replies;stickied;author;id;post_title;post_link
They’re mad that they’re being publicly shamed into not realizing the hundreds of thousands of dollars they’ve made. If they go down in flames, they need *everyone* else to go with them. ;518;5;False;Dipsneek742;drssx6u;rBitcoin logic: Cashing out? You should kill yourself instead;https://imgur.com/Fo8rZQi
"u/FaceDeer, you've received `0.00000349 BCH ($0.01 USD)`!
***
[^^How to use](https://np.reddit.com/r/tippr/wiki/index) ^^| [^^What is Bitcoin Cash?](https://learnbitcoin.cash/) ^^| [^^Who accepts it?](https://acceptbitcoin.cash) ^^| ^^Powered ^^by ^^[Rocketr](https://rocketr.net) ^^| ^^r/tippr  
^(Bitcoin Cash is what Bitcoin should be. Ask about it on r/btc)";1;0;False;tippr;dru55ao;rBitcoin logic: Cashing out? You should kill yourself instead;https://imgur.com/Fo8rZQi
"u/FaceDeer, you've received `0.0005 BCH ($1.52 USD)`!
***
[^^How to use](https://np.reddit.com/r/tippr/wiki/index) ^^| [^^What is Bitcoin Cash?](https://learnbitcoin.cash/) ^^| [^^Who accepts it?](https://acceptbitcoin.cash) ^^| ^^Powered ^^by ^^[Rocketr](https://rocketr.net) ^^| ^^r/tippr  
^(Bitcoin Cash is what Bitcoin should be. Ask about it on r/btc)";2;0;False;tippr;drt2tng;rBitcoin logic: Cashing out? You should kill yourself instead;https://imgur.com/Fo8rZQi
Lol wrong guy? ;21;1;False;DrunkPanda;drt3522;rBitcoin logic: Cashing out? You should kill yourself instead;https://imgur.com/Fo8rZQi
I said the two statements were INcompatible, and I said bitcoin has changed. I didn't say his vision was impossible. But first off, nobody knows exactly how Satoshi would have reacted to either the BCH fork or the current-day state of Bitcoin. Would he have supported bigger blocks? There's evidence he would've. Would he support Roger Ver's vision of an unlimited blocksize? I doubt it. There's too many arguments against it from a centralization standpoint which was Satoshi's entire point of creating Bitcoin. But, things like Segwit, Schnorr signatures, Lightning Network... didn't exist back then. Who knows if Satoshi would've supported them as solutions to the scaling problem over bigger blocks.  It's like trying to predict if George Washington would've supported same-sex marriage. If you had asked him in 1776, he likely wouldn't have. If you transported him to today, he might change his point of view after having time to study from a current-day point of view.;1;1;False;chazley;drtbh9v;rBitcoin logic: Cashing out? You should kill yourself instead;https://imgur.com/Fo8rZQi
And I believe you are brainwashed into following an ideology and narrative cooked up by Roger Ver and other rich people making bank from BCH to continue supporting and promoting their coin. But hey, who is there to say who is right or wrong?;1;0;False;chazley;drt9gsz;rBitcoin logic: Cashing out? You should kill yourself instead;https://imgur.com/Fo8rZQi
"You are helping spread a conspiracy theory about LN being subject to AML and KYC laws, and then trying to put the burden of proof that it isn't on those who disagree with you. It doesn't work like that. I don't get to say Dark Matter is God and then say ""you can't disprove me"". No. Some things are not fully understood yet because it's not deployed yet on the mainnet and is subject to to changes and fixes. I'll also say that while I am pretty confident in my knowledge of LN to dispute that privacy/encryption of LN will be sufficient to have almost zero fears of centralization, I will digress because I don't want to claim to be an expert on the subject and I've only seen Andreas videos and interviews with LN developers. I personally am highly skeptical of the fears regarding hub centralization anyways. You will have millions, then billions of channels open eventually... finding routes is not going to be a problem.";1;1;False;chazley;drt4mgm;rBitcoin logic: Cashing out? You should kill yourself instead;https://imgur.com/Fo8rZQi
"Well, he calls it ""my project"" so I'm just taking his word for it. Unless you think the man is a liar?";-12;1;False;chazley;drsy5ek;rBitcoin logic: Cashing out? You should kill yourself instead;https://imgur.com/Fo8rZQi
"+1

He has that whole paragraph of gibberish, yet with only a few words his position is compromised.  Nice.

Lets hold the fort, and keeping accepting new community members.  We need to grow Bitcoin Cash, and rapidly, constructively!

/u/tippr 0.0002888";10;0;False;Vincents_keyboard;drsyxjv;rBitcoin logic: Cashing out? You should kill yourself instead;https://imgur.com/Fo8rZQi
Huh? I don't believe BCH is doing anything interesting but am hopeful about LN. Are you saying that having that opinion makes me a troll?;2;1;False;HawkinsT;drt5uex;rBitcoin logic: Cashing out? You should kill yourself instead;https://imgur.com/Fo8rZQi
Yep. I’m on both trains. I wanted BTC to raise the blocksize limit. I was bummed for literally years on how Core handled the blocksize debate. I’m now glad to have BCH to follow the vision that got me excited about Bitcoin in the first place. Some newer people to Bitcoin don’t get that Bitcoin Cash is the fork following the vision a lot of us are interested in. ;6;1;False;themgp;drt2lae;rBitcoin logic: Cashing out? You should kill yourself instead;https://imgur.com/Fo8rZQi
[deleted];0;1;False;;drt2ae9;rBitcoin logic: Cashing out? You should kill yourself instead;https://imgur.com/Fo8rZQi
"> Want to discuss?

Sure, not sure how long I'll be online for. To start, here are a few points that I think we can both agree on:

- Bitcoin's success is due in part to the fact that it is decentralized. Other crypto-based currencies existed before Bitcoin, but they failed because they were centralized.
- Scaling is a real problem that Bitcoin is facing today.
- When it comes to scaling any system, the simple solution isn't always the best one.

Now, the fundamental areas where I think the two subs disagree:

* Solving scaling is an urgent concern.
  * Core supporters are generally of the mindset that preserving fundamentals (i.e. decentralization) is more important than scaling to meet the current demand.
  * BCH supporters feel that with fees at their current level, Bitcoin has become functionally useless, and will be replaced unless it fixes the problem soon.
* Block size increases are a viable means of scaling Bitcoin while preserving sufficient decentralization.
  * Most core supporters acknowledge that 1 MB is too small, especially in the long term, but also recognize that identifying the exact number at which centralization becomes problematic is hard.
  * BCH supporters feel that the amount of decentralization sacrificed by scaling the block size is not enough to undermine decentralization of the entire system.
* Bitcoin's value proposition is, in part, its use as a payment processor.
  * Core supporters feel that this is a ""nice to have"", and that the true value lies in its auditability, immutability, and the ability for people to control their own wealth.
  * BCH supporters feel that this use case is a critical use case, and the only way to accomplish the goal of ""banking the unbaked"" since the fees make the network completely inaccessible to many of the unbanked.
* Satoshi's whitepaper set out a vision for the evolution of Bitcoin.
  * Core supports see the whitepaper as a description of the system as it existed in 2009, along with suggestions as to how it might scale if it grew at a rate similar to Moore's law.
  * Bitcoin Cash supporters see the whitepaper as a vision for scaling Bitcoin.

If you agree with the above points, it should follow that each respective coin has made choices that best serve the priorities of each group.

* BCH has opted to focus on the ""simple"" scaling solution, while acknowledging that it will lead to some degree of centralization. Core has chosen to wait on second- and third-layer scaling solutions to mature before attempting to scale the base layer.
* BCH has chosen to scale immediately to enable payments-related use cases (fix the fee situation). Core has decided to wait until the full effects of Segwit, LN, sidechains are realized.

Now, some of my own arguments in favor of Bitcoin:

- No decentralized cryptocurrencies have solved scaling yet. Ethereum can handle roughly 5x the throughput, but that's not significant in the big picture. As a result, I feel BCH supporters tend to overstate the sense of urgency.
- Decentralization seems easier to lose than to reacquire, and so I think we should avoid making changes which we acknowledge could lead to greater centralization while there are still other options.
- Re: use as a payment processor, I used to think this was critical, but now feel like it is less important than preserving fundamentals. Centralized Bitcoin is inferior to VISA and PayPal.
- As a software engineer, my personal experience has taught me that vertical scaling (i.e. block size increases) sounds easy, but in practice there are always emergent issues which require rearchitecting the system to some degree. 2 MB blocks might work fine without any fundamental changes, but the same isn't yet known for capacities beyond this.
- I feel scaling based on Moore's law is impractical, since Bitcoin's adoption has been happening at a much faster rate than Moore's law. And in any case, Moore's law does not apply equally to the different areas in which Bitcoin needs to scale (processing power, memory capacity, network bandwidth). Furthermore, there's no guarantee that Moore's law will continue indefinitely. We are already nearing the theoretical limits on transistor size, for example.
- Bitcoin still has the majority of developer talent and interest.

And finally, my own arguments in favor of BCH:

- ASICs already make mining inaccessible to most users of the system; requiring more expensive hardware to mine likely isn't going to be a significant barrier to entry beyond this.
- Clearly BCH is better for the payments use case today; if this property, along with improving network effects, enables it to overtake Bitcoin, then it's possible it'll attain majority market share and developer interest could follow.

It's probably clear from this that I personally feel Bitcoin's approach is more viable. However, I continue to hold equal amounts of BTC and BCH because I think there's a good chance I'll be wrong.";65;7;False;farsightxr20;drt4qfu;rBitcoin logic: Cashing out? You should kill yourself instead;https://imgur.com/Fo8rZQi
I've posted stuff in the last 3 days would have gotten me banned.  But nothing yet.  Weirder still, I've gotten upvotes and people agreeing with me.;1;1;False;plazman30;drtj6o6;rBitcoin logic: Cashing out? You should kill yourself instead;https://imgur.com/Fo8rZQi
LOL !  Really you think if I say something pro bitcoin the /bitocoin crowd will come and downvote me, just to show /btc bad. Listen to what you're saying. Both the groups are just plain cults trying to pump the coin they have invested in. In the whole noise, the people trying to maintain decency of technical debate is just muted. ;1;0;False;dagreatdanton99;drtt9r1;rBitcoin logic: Cashing out? You should kill yourself instead;https://imgur.com/Fo8rZQi
No its literally in every post. ;-2;1;False;pabbseven;drtchsg;rBitcoin logic: Cashing out? You should kill yourself instead;https://imgur.com/Fo8rZQi
lol;1;0;False;taipalag;drtc648;rBitcoin logic: Cashing out? You should kill yourself instead;https://imgur.com/Fo8rZQi
This thread is a day old, the only downvote you're getting is mine because you aren't contributing to discussion lol;0;1;False;TheVineyard00;drty5wr;rBitcoin logic: Cashing out? You should kill yourself instead;https://imgur.com/Fo8rZQi
/r/Ethereum is its own cultish echo chamber. You get downvoted like crazy if you discuss other coins or even Cryptokitties.;1;1;False;taipalag;drt85b9;rBitcoin logic: Cashing out? You should kill yourself instead;https://imgur.com/Fo8rZQi
I just found myself subscribing and becoming a butter. It seems like a good thing to keep an eye on, because /r/btc has a bad signal-to-noise ratio and /r/bitcoin has NO signal-to-noise ratio.;1;1;False;Dekker3D;drtnhwj;rBitcoin logic: Cashing out? You should kill yourself instead;https://imgur.com/Fo8rZQi
Yeah /r/Ethereum just makes me feel like an idiot, still subbed anyway though lol. Didn't realize /r/buttcoin was so great now, will check it out haha;1;0;False;TheVineyard00;drt7fz1;rBitcoin logic: Cashing out? You should kill yourself instead;https://imgur.com/Fo8rZQi
"> In fact the best place for a good talk about the ins and outs of bitcoin right now is oddly /r/buttcoin

I like that sub, not only for it's hilarious digs on crypto, but because the people there look at everything from a cynical PoV.  I think all of crypto needs a good dose of cynicism right now.  There's almost no introspection going on, just a lot of Kool-Aid drinking.";2;1;False;skarphace;drtq62m;rBitcoin logic: Cashing out? You should kill yourself instead;https://imgur.com/Fo8rZQi
"Here's a sneak peek of /r/Buttcoin using the [top posts](https://np.reddit.com/r/Buttcoin/top/?sort=top&t=year) of the year!

\#1: [TIL bitcoin is called the currency of the future because all currency transactions are confirmed in the distant future.](https://np.reddit.com/r/Buttcoin/comments/7lfnjd/til_bitcoin_is_called_the_currency_of_the_future/)  
\#2: [Coinbase disables trading, the sign of a healthy currency of the future](https://www.cnbc.com/2017/12/22/coinbase-one-of-the-biggest-bitcoin-marketplaces-says-buying-and-selling-temporarily-disabled-amid-price-rout.html) | [121 comments](https://np.reddit.com/r/Buttcoin/comments/7lihnv/coinbase_disables_trading_the_sign_of_a_healthy/)  
\#3: [Steam is no longer accepting the currency of the future](https://steamcommunity.com/games/593110/announcements/detail/1464096684955433613) | [148 comments](https://np.reddit.com/r/Buttcoin/comments/7hzmbq/steam_is_no_longer_accepting_the_currency_of_the/)

----
^^I'm ^^a ^^bot, ^^beep ^^boop ^^| ^^Downvote ^^to ^^remove ^^| [^^Contact ^^me](https://www.reddit.com/message/compose/?to=sneakpeekbot) ^^| [^^Info](https://np.reddit.com/r/sneakpeekbot/) ^^| [^^Opt-out](https://np.reddit.com/r/sneakpeekbot/comments/6l7i0m/blacklist/)";6;0;False;sneakpeekbot;drt6t1s;rBitcoin logic: Cashing out? You should kill yourself instead;https://imgur.com/Fo8rZQi
[deleted];0;1;False;;drt7gm3;rBitcoin logic: Cashing out? You should kill yourself instead;https://imgur.com/Fo8rZQi
"> I'm an etherian

Do people really say this?";1;1;False;skarphace;drtq230;rBitcoin logic: Cashing out? You should kill yourself instead;https://imgur.com/Fo8rZQi
"Yeah I support the proposed solutions to Bitcoin more than I support the ones implemented in BCH, but at least BCH is actually implemented, LN has been a dangling carrot for years and I don't think it's happening any time soon.

As I said somewhere else in this thread /r/ethereum makes me feel like an idiot, it gets really technical around there, but I'm still subscribed and pretend to understand the conversation haha";7;1;False;TheVineyard00;drt7h8a;rBitcoin logic: Cashing out? You should kill yourself instead;https://imgur.com/Fo8rZQi
No, you invented an insane sounding narrative of assumptions about the motivations of others, and then spoke as if that was evidence of *their* insanity.;0;1;False;GayloRen;drtice6;rBitcoin logic: Cashing out? You should kill yourself instead;https://imgur.com/Fo8rZQi
And each level has to get other schmucks to invest to then sell it to them;1;0;False;theivoryserf;drtkguo;rBitcoin logic: Cashing out? You should kill yourself instead;https://imgur.com/Fo8rZQi
I agree about everything except for the pyramid. People sell as time goes on when they reach their moon. It's a zero some game much like most investments.;1;0;False;GetrichonIMP;dru2viu;rBitcoin logic: Cashing out? You should kill yourself instead;https://imgur.com/Fo8rZQi
"I said stack, not construct for a reason, towers require vast amounts of organization and maintenance to not fall down. And no, you will never stack a tower of stone bigger than the grand pyramid, it would crush under it's own weight. The pyramid was the solution to not being able to build bigger towers without them falling down on themselves. 

https://en.wikipedia.org/wiki/Pyramid";1;2;False;Forlarren;drtqhds;rBitcoin logic: Cashing out? You should kill yourself instead;https://imgur.com/Fo8rZQi
"we're both welcome to our opinions...

¯\\\_(ツ)_/¯";0;0;False;honestbleeps;drt8rkm;rBitcoin logic: Cashing out? You should kill yourself instead;https://imgur.com/Fo8rZQi
"First off, I was talking about the present market cap. So what it just did is entirely irrelevant. Also, we were talking about doubling in a week. 

Secondly, before proving how ignorant you are to the whole internet world, maybe do some research: RaiBlocks came before IOTA, so if there's a copycat here it's IOTA.";1;1;False;yoyoyodayoyo;dru0l7j;rBitcoin logic: Cashing out? You should kill yourself instead;https://imgur.com/Fo8rZQi
"**Tu quoque**

Tu quoque (, also ; Latin for, ""you also"") or the appeal to hypocrisy is an informal logical fallacy that intends to discredit the opponent's argument by asserting the opponent's failure to act consistently in accordance with its conclusion(s).

Tu quoque ""argument"" follows the pattern:

Person A makes claim X.

Person B asserts that A's actions or past claims are inconsistent with the truth of claim X.

Therefore X is false.

An example would be

Peter: ""Based on the arguments I have presented, it is evident that it is morally wrong to use animals for food or clothing.""

Bill: ""But you are wearing a leather jacket and you have a roast beef sandwich in your hand! How can you say that using animals for food and clothing is wrong?""

It is a fallacy because the moral character or past actions of the opponent are generally irrelevant to the logic of the argument.

***

^[ [^PM](https://www.reddit.com/message/compose?to=kittens_from_space) ^| [^Exclude ^me](https://reddit.com/message/compose?to=WikiTextBot&message=Excludeme&subject=Excludeme) ^| [^Exclude ^from ^subreddit](https://np.reddit.com/r/btc/about/banned) ^| [^FAQ ^/ ^Information](https://np.reddit.com/r/WikiTextBot/wiki/index) ^| [^Source](https://github.com/kittenswolf/WikiTextBot) ^| [^Donate](https://www.reddit.com/r/WikiTextBot/wiki/donate)   ^]
^Downvote ^to ^remove ^| ^v0.28";2;0;False;WikiTextBot;drt9wnl;rBitcoin logic: Cashing out? You should kill yourself instead;https://imgur.com/Fo8rZQi
That’s how it reads to you. There’s like three other people in this thread who have commented the exact opposite.;1;0;False;tjmac;drtnekt;rBitcoin logic: Cashing out? You should kill yourself instead;https://imgur.com/Fo8rZQi
Thank you please post this on bitcoin aswell;4;1;False;clicking_xhosa;drt534b;rBitcoin logic: Cashing out? You should kill yourself instead;https://imgur.com/Fo8rZQi
"Couple of things: the Core narrative has created problems that don't exist and magnified small problems that do exist. Worrying about the viability of a fee market before 2140, for example, when the block reward has continued to keep mining viable throughout many difficulty changes and halvenings. The reason for creating a fee market 120-odd years early is purely to create a financial incentive for the second layer.

Scaling is being worked on, and again isn't the problem that has been shouted about. Processing power is capable of handling Visa scale on current hardware. Storage is already more than keeping pace with adoption and again can handle much more demand than we're currently putting on it. Bandwidth is more of an issue, but it's also increasing so there's no point in not at least keeping up with the hardware. Innovations like Xthin and Graphene are happening outside of Core's purview to make maximum use of that bandwidth.";5;1;False;nolo_me;drtjz0g;rBitcoin logic: Cashing out? You should kill yourself instead;https://imgur.com/Fo8rZQi
"> No decentralized cryptocurrencies have solved scaling yet. Ethereum can handle roughly 5x the throughput, but that's not significant in the big picture. As a result, I feel BCH supporters tend to overstate the sense of urgency.

For a crypto currency to be taken seriously as the main currency for the whole planet fees must be as low as possible, especially since there are poorer people who can't afford to pay 50c in fees (and absolutely not 30USD). Congestion must not happen. I feel this is very important to get more people onboard. Even 50c fees are way too much. We need to show the world that it is possible with <1c fees.

> Decentralization seems easier to lose than to reacquire, and so I think we should avoid making changes which we acknowledge could lead to greater centralization while there are still other options.

> Re: use as a payment processor, I used to think this was critical, but now feel like it is less important than preserving fundamentals. Centralized Bitcoin is inferior to VISA and PayPal.

The only thing that really matters is *miner* decentralization. I don't believe on chain scaling causes any issues here. Non mining nodes are irrelevant.

> As a software engineer, my personal experience has taught me that vertical scaling (i.e. block size increases) sounds easy, but in practice there are always emergent issues which require rearchitecting the system to some degree. 2 MB blocks might work fine without any fundamental changes, but the same isn't yet known for capacities beyond this.

Which is why there is a 1GB block testnet running for a couple of months already. Issues in the software, like threading issues are actively taken care of. Other bottlenecks will be identified before there is any demand for 1GB blocks.

> I feel scaling based on Moore's law is impractical, since Bitcoin's adoption has been happening at a much faster rate than Moore's law. And in any case, Moore's law does not apply equally to the different areas in which Bitcoin needs to scale (processing power, memory capacity, network bandwidth). Furthermore, there's no guarantee that Moore's law will continue indefinitely. We are already nearing the theoretical limits on transistor size, for example.

There is no guarantee that Moore's law will hold up, that is true. But at the same time it is theoretically already possible to scale to 1TB blocks [today](http://blog.vermorel.com/journal/2017/12/17/terabyte-blocks-for-bitcoin-cash.html), after fixing potential software issues. 1GB really shouldn't be too much of an issue, once demand has risen.

> Bitcoin still has the majority of developer talent and interest.

I disagree. Bitcoin Cash has multiple independent development teams (decentralized development, yay) and in these teams highly talented people. Many other developers in the Bitcoin space are porting their BTC functionality to BCH, there really is no reason for BTC [ecosystem] developers to not develop for BCH, as the chains are obviously very compatible. Even more so, Segwit adds a ton of technical debt. Not having it makes the base protocol more robust and easy to work with. BCH is free of it.";7;0;False;Kakifrucht;drtkvzl;rBitcoin logic: Cashing out? You should kill yourself instead;https://imgur.com/Fo8rZQi
Ah well it's bitcoin core, it takes some time to clear the comment pool I guess. ;2;0;False;Kain_niaK;drtj88f;rBitcoin logic: Cashing out? You should kill yourself instead;https://imgur.com/Fo8rZQi
Whoosh.;1;1;False;nolo_me;drtivfp;rBitcoin logic: Cashing out? You should kill yourself instead;https://imgur.com/Fo8rZQi
Ditto.;1;0;False;fullheap;drtzzfp;rBitcoin logic: Cashing out? You should kill yourself instead;https://imgur.com/Fo8rZQi
Whatever you do don't mention neo there.;1;1;False;Spacetard5000;drt9ol9;rBitcoin logic: Cashing out? You should kill yourself instead;https://imgur.com/Fo8rZQi
/r/btc is getting better and let's see what happens when bitcoin core adoptation continues to go down + the big price crash of all crypto that is come, probably soon because a lot of exchanges right now don't allow new registrations and that is very very suspicious. They all disabled new accounts in the same week. ;1;1;False;Kain_niaK;drtovqw;rBitcoin logic: Cashing out? You should kill yourself instead;https://imgur.com/Fo8rZQi
"Preach it brother! 

$0.2 /u/tippr";1;1;False;Kain_niaK;drtr15o;rBitcoin logic: Cashing out? You should kill yourself instead;https://imgur.com/Fo8rZQi
"I'm not sure, but I think RaiBlocks is quite interesting. 

I may be wrong here: they use a linked list, but there are not any blocks being linked, but the very transactions. Have a looksee.

Edit: each transaction is its own 400 bytes block.";3;0;False;arthurlanher;drtbkyw;rBitcoin logic: Cashing out? You should kill yourself instead;https://imgur.com/Fo8rZQi
"No, but it sounds awesome so maybe they should?

My favorite coin right now is BURST, but it sounds weird no matter how I say it.  BURSTer?  BURSTling?  BURSTed?  Meh. ";2;0;False;Valridagan;drtvadh;rBitcoin logic: Cashing out? You should kill yourself instead;https://imgur.com/Fo8rZQi
An implemented solution is always better than a proposed solution.;11;1;False;Gazing_Into_The_Void;drt8l63;rBitcoin logic: Cashing out? You should kill yourself instead;https://imgur.com/Fo8rZQi
Literally only one person called anyone insane and it was you, to me. Keep digging. You’re inexplicable need to be contrarian on the internet is going well. ;1;1;False;Dipsneek742;drtwiab;rBitcoin logic: Cashing out? You should kill yourself instead;https://imgur.com/Fo8rZQi
