body;score;nb_replies;stickied;author;id;post_title;post_link
No I'm saying that this is far from optimal load for a single pole.;1;1;False;SpiritofJames;eobua4f;Blockchain?;https://i.redd.it/7v8dqcdqsyy21.jpg
Im sorry you seem to think I asked you for your self-righteous bullshit opinion, I didn't, so fuck off;1;1;False;redmoonrises;eoblv7p;Blockchain?;https://i.redd.it/7v8dqcdqsyy21.jpg
So you're saying that the town, or telephone company, whoever paid for all of those lines, deliberately spent more money than they needed to?;1;1;False;IWasABitcoinNoobToo;eobu4jy;Blockchain?;https://i.redd.it/7v8dqcdqsyy21.jpg
Why, though? What's the incentive? Each of those lines is an expense. A surplus of lines means a surplus of expenses. What's the incentive for the phone company to spend the time and money to install unnecessary lines?;1;0;False;IWasABitcoinNoobToo;eobxzzl;Blockchain?;https://i.redd.it/7v8dqcdqsyy21.jpg
"Yeah you're just here to troll.   It's got nothing to do with you or me.   Big picture is the more people fight among themselves, the less the big banks have to do to slow crypto adoption.   

Stop working for big money.  They're not even paying you.";0;1;False;ScionoicS;eoc7vzj;Blockchain?;https://i.redd.it/7v8dqcdqsyy21.jpg
Ok.  Make it about you.   Miss the whole point.;1;1;False;ScionoicS;eoa1eax;Blockchain?;https://i.redd.it/7v8dqcdqsyy21.jpg
