body;score;nb_replies;stickied;author;id;post_title;post_id;post_link
I am from Vanuatu in the south west pacific, tiny islands state, we needs charitable funds because we are vulnerable to category 5 cyclone, also we need fund to  eradicate poverty, build homes with proper toilets, improve sanitation, access to drinking water  etc...;1;0;False;plouiz;dvargce;I'm donating 5057 BTC to charitable causes! Introducing The Pineapple Fund;7jj0oa;https://www.reddit.com/r/Bitcoin/comments/7jj0oa/im_donating_5057_btc_to_charitable_causes/
"Wow.  I know you're a UBQ fan. I will def look into it !
So I can keep UBQ in an exchange and I still get the ESCH?
Like Bittrex?  That's ok?  THANK YOU RICHARD !!!!   
I take your advice and appreciate you !

";1;1;False;jza30000;dvc3j7w;When you are trying to buy the dip;81qkxp;https://v.redd.it/14187bzhakj01
No ones commenting that ETH is at  $201,121 per coin Freaking sell that shit!!!!!!!!!! Fuck the dip!!!!;1;0;False;Coxxxy;dvby490;When you are trying to buy the dip;81qkxp;https://v.redd.it/14187bzhakj01
And the Oscar goes to...;1;0;False;coinchitect;dvbo6h6;When you are trying to buy the dip;81qkxp;https://v.redd.it/14187bzhakj01
"Richard is my name. I would recommend your UBQ. Large airdrop is coming April 25th. Hype has not started yet. nobody is still talking about it. All registered addresses with a UBQ balance will receive 12 ESCH tokens for every 1 UBQ
Buy and Hold makes you rich. I expect x10 maybe x20 gain. Because coinsupply is low 39,882,419 UBQ";1;1;False;oapieNL;dvbzqaf;When you are trying to buy the dip;81qkxp;https://v.redd.it/14187bzhakj01
your post is gold;2;0;False;thib2016;dvc7fd1;When you are trying to buy the dip;81qkxp;https://v.redd.it/14187bzhakj01
I died.;1;0;False;ShatterDae;dvb70v1;When you are trying to buy the dip;81qkxp;https://v.redd.it/14187bzhakj01
"I think this is real :)
";1;0;False;Crypt0mason;dvaswv7;When you are trying to buy the dip;81qkxp;https://v.redd.it/14187bzhakj01
You forgot the last part. Where you think you've made it and then decide to take some profits. The exchange locks up and offline. Agents watch and wait until you can't stay awake any longer and then immediately go back online and dump it.;1;0;False;RemarkableSnowflake;dvb9he3;When you are trying to buy the dip;81qkxp;https://v.redd.it/14187bzhakj01
