body;score;nb_replies;stickied;author;id;post_title;post_id;post_link
I support Classic, and while I agree with the substance of what you've written here, it does seem a bit to me like celebrating a victory when you have a lead at the beginning of the fourth quarter -- just a bit hasty, in terms of where the process seems to be currently.;3;0;False;grendalor;cz2t6rq;Some advice for everybody at this point in time;41ipkd;https://www.reddit.com/r/btc/comments/41ipkd/some_advice_for_everybody_at_this_point_in_time/
What is use case #3?;7;1;False;jimmajamma;cz2quvv;Some advice for everybody at this point in time;41ipkd;https://www.reddit.com/r/btc/comments/41ipkd/some_advice_for_everybody_at_this_point_in_time/
Thanks for this - a refreshing, well thought out piece. I agree with others, this should make its way to Medium.;1;0;False;buzzdron;cz37ycm;Some advice for everybody at this point in time;41ipkd;https://www.reddit.com/r/btc/comments/41ipkd/some_advice_for_everybody_at_this_point_in_time/
"Just one comment. You say that segwit is Core's solution to scaling and that it is probably bad to use this instead of a one-liner to increase the capacity. But remember that segwit is mainly a fix for transaction malleability, which has been a thorn in the eye of bitcoin for far too long. So it should be implemented regardless. If so, it is actually the fork that introduced the most new code: Both should implement segwit sooner or later but classic is proposing a hardforked block limit *in addition* to that.

";1;1;False;GrixM;cz2znjw;Some advice for everybody at this point in time;41ipkd;https://www.reddit.com/r/btc/comments/41ipkd/some_advice_for_everybody_at_this_point_in_time/
"*Falkvinge* received a tip for 1 beer (9,126 bits/$3.50).




--

[^^what ^^is ^^ChangeTip?](https://www.reddit.com/r/changetip/wiki/tipping-on-reddit)";1;0;False;changetip;cz2mw74;Some advice for everybody at this point in time;41ipkd;https://www.reddit.com/r/btc/comments/41ipkd/some_advice_for_everybody_at_this_point_in_time/
I intended the merchant and payer experience of the credit card replacement to be two different use cases. They sometimes have competing interests, after all.;5;2;False;Falkvinge;cz2qxpf;Some advice for everybody at this point in time;41ipkd;https://www.reddit.com/r/btc/comments/41ipkd/some_advice_for_everybody_at_this_point_in_time/
"Thank you! It seems to be getting upvotes in both subreddits, and I see tweets about it, so I think it's getting some attention.

As for what I did in the Pirate Party, I founded it (the Swedish and first party) and led it into the European Parliament.";20;1;False;Falkvinge;cz2pxsu;Some advice for everybody at this point in time;41ipkd;https://www.reddit.com/r/btc/comments/41ipkd/some_advice_for_everybody_at_this_point_in_time/
"Fair enough; I can only go on what I know. Then let's use the media-fabricated image as a good example to follow, and not what actually happened.";15;1;False;Falkvinge;cz2n51d;Some advice for everybody at this point in time;41ipkd;https://www.reddit.com/r/btc/comments/41ipkd/some_advice_for_everybody_at_this_point_in_time/
Core has a different vision for Bitcoin. They shouldn't feel forced to use a scalable blockchain. Let them keep a 1mb limited chain if they want to. Let's divorce peacefully.;1;1;False;caveden;cz31xei;Some advice for everybody at this point in time;41ipkd;https://www.reddit.com/r/btc/comments/41ipkd/some_advice_for_everybody_at_this_point_in_time/
"Thanks!

I agree that it would be both great and interesting if different distributions could share code and consensus, but I'm not sure if we're quite there yet? Maybe we are.";9;1;False;Falkvinge;cz2o8lc;Some advice for everybody at this point in time;41ipkd;https://www.reddit.com/r/btc/comments/41ipkd/some_advice_for_everybody_at_this_point_in_time/
Agreed. Core devs seem unreasonably upset over competition in this supposedly 'decentralised' space. ;13;2;False;nanoakron;cz2q9cf;Some advice for everybody at this point in time;41ipkd;https://www.reddit.com/r/btc/comments/41ipkd/some_advice_for_everybody_at_this_point_in_time/
Words of wisdom!;1;0;False;pointbiz;cz38tp3;Some advice for everybody at this point in time;41ipkd;https://www.reddit.com/r/btc/comments/41ipkd/some_advice_for_everybody_at_this_point_in_time/
Thank you! <3;6;0;False;Falkvinge;cz2my36;Some advice for everybody at this point in time;41ipkd;https://www.reddit.com/r/btc/comments/41ipkd/some_advice_for_everybody_at_this_point_in_time/
"'what they thino it's best for them"". ftfy.";2;0;False;trancephorm;cz2tnvc;Some advice for everybody at this point in time;41ipkd;https://www.reddit.com/r/btc/comments/41ipkd/some_advice_for_everybody_at_this_point_in_time/
Yup, please do this. Medium reaches main stream users. A few of my friends who haven't seen Bitcoin have sent me Mike's post on medium. No one main stream will read or forward this.;14;0;False;itsgremlin;cz32tq5;Some advice for everybody at this point in time;41ipkd;https://www.reddit.com/r/btc/comments/41ipkd/some_advice_for_everybody_at_this_point_in_time/
"> Also noticed you posted in r/bitcoin but seems to have been deleted. lol

Wow.. just wow.";1;0;False;Acidyo;cz2wxut;Some advice for everybody at this point in time;41ipkd;https://www.reddit.com/r/btc/comments/41ipkd/some_advice_for_everybody_at_this_point_in_time/
"Look at how Mandela did not put the leaders and supporters of apartheid up against the wall (or in cages) after he was elected. The ""Truth and Reconciliation Commission"" was a pretty peaceful gesture when one considers the alternatives of how Mandela's power *could* have been used - especially someone who might have been embittered had been imprisoned for so long. Using crime and other things that he cannot be held directly responsible for complete misses the point.";5;0;False;Huntred;cz2u5j9;Some advice for everybody at this point in time;41ipkd;https://www.reddit.com/r/btc/comments/41ipkd/some_advice_for_everybody_at_this_point_in_time/
"O come on.... Where would South Africa be without Mandela's leadership........
We (South African's) are going through a new ""Blocksize"" debate. Progress is incremental, two steps forward one back.  We (Bitcoin) will have future issues to navigate though. ";3;0;False;sydwell;cz2oq8d;Some advice for everybody at this point in time;41ipkd;https://www.reddit.com/r/btc/comments/41ipkd/some_advice_for_everybody_at_this_point_in_time/
"> In the end, Bitcoin is a representative form of government with each codebase serving as a political platform for its constituency. A Bitcoin hard fork is a ""no confidence"" vote in leadership.

Yes, an attempt at hardforking is _precisely_ a vote of no confidence. This is not technical, this is entirely social.

> However I think you raise an interesting point: if multiple parties create compatible implementations they can form a coalition government

Isn't this an interesting scenario? Bitcoin Unlimited, for example, has an excellent selling point that it will cooperate with anything and anybody. That idea hadn't even occurred before.

> I think it's important for us older dudes (like you I've been a programmer for over 30 years) to bring political level-headedness to the discussion.

Maybe we're just reacting with a ""yeah, I've seen this play out before, like a hundred or so times"" :D and can keep our cool in a way that people who have Bitcoin as their first project just can't relate to. If that's the case, then as you say, it's almost a responsibility to be the slow and thoughtful speaker in the room.
";7;0;False;Falkvinge;cz31bvq;Some advice for everybody at this point in time;41ipkd;https://www.reddit.com/r/btc/comments/41ipkd/some_advice_for_everybody_at_this_point_in_time/
Mandela is death. If an exemption from slavery turns into chaos, you can not declare the liberators responsible.;2;1;False;Zarathustra_III;cz2nfj5;Some advice for everybody at this point in time;41ipkd;https://www.reddit.com/r/btc/comments/41ipkd/some_advice_for_everybody_at_this_point_in_time/
#2 is a double.  Read the parenthetical.  This got me too.;4;0;False;killswitch;cz2u1p6;Some advice for everybody at this point in time;41ipkd;https://www.reddit.com/r/btc/comments/41ipkd/some_advice_for_everybody_at_this_point_in_time/
It was undeleted by a moderator there around 10 minutes ago, probably after viewing your post and anticipating massive backlash if word got out.;40;3;False;ChairmanOfBitcoin;cz2ou08;Some advice for everybody at this point in time;41ipkd;https://www.reddit.com/r/btc/comments/41ipkd/some_advice_for_everybody_at_this_point_in_time/
"Thank you! And yes, I posted in both subreddits, though the sections were switched. I didn't notice my crosspost to the other subreddit get deleted; that would be kind of a sad state (exactly what I describe we must get through after this is resolved).

EDIT: As described by /u/110101002 below, it was spamflagged on automatic but de-spammed manually almost immediately. No harm no foul.";84;2;False;Falkvinge;cz2mu9u;Some advice for everybody at this point in time;41ipkd;https://www.reddit.com/r/btc/comments/41ipkd/some_advice_for_everybody_at_this_point_in_time/
[deleted];-15;4;False;;cz2nbix;Some advice for everybody at this point in time;41ipkd;https://www.reddit.com/r/btc/comments/41ipkd/some_advice_for_everybody_at_this_point_in_time/
http://i.imgur.com/w9klqDF.gif;-2;0;False;Liquid00;cz2q72v;Some advice for everybody at this point in time;41ipkd;https://www.reddit.com/r/btc/comments/41ipkd/some_advice_for_everybody_at_this_point_in_time/
South Africa is a bad counter-example. Unless we are supposed to rape Core devs.;-4;0;False;Not_Pictured;cz2pbkm;Some advice for everybody at this point in time;41ipkd;https://www.reddit.com/r/btc/comments/41ipkd/some_advice_for_everybody_at_this_point_in_time/
"OHNOE. How can we ever trust Bitcoin without such glorious leaders like /u/theymos and /u/luke-jr (god bless him :) :) ..) in charge?

I mean I for one would NOT be comfortable holding any Bitcoin without this guy in charge of things: http://www.kclug.org/wiki/images/thumb/Luke_Jr0.jpg/450px-Luke_Jr0.jpg

Bitcoin is dead. :( :( :( :(


.....OK, well, seriously; I love the idea of multiple implementations and things are looking really well for Bitcoin now. Freedom, anarchy, diversity and peace; onward! :)";-3;2;False;btc_ceo_is_hitler;cz2ryse;Some advice for everybody at this point in time;41ipkd;https://www.reddit.com/r/btc/comments/41ipkd/some_advice_for_everybody_at_this_point_in_time/
"First of all, can we please move away from the crazy idea that consensus rules are somehow voted on and determined by the longest chain? Users choose some set of consensus rules (based on what they personally like and the sets of rules others are using) and then follow the transaction history with the most amount of work.


> When proponents of Core's scaling tell me that Option Two here is the better because it's safer, and I try to comprehend that statement, I am either utterly insane or the statement is the equivalent of ""black is white and up is down"".

You missed the third option, that you don't understand the major risk of people losing their money during a hardfork where both sides have a significant amount of hashing power. 

> When I try to understand more and challenge the assertion that option two is safer - on what I must say are very good grounds - I'm told that I should be leaving design to the experts and that I don't understand enough of the complex machine that is bitcoin.

This is in sharp contrast with my personal experience, but might be more true in the current aggressive climate. There has been so much discussion on all of these topics that you should at least be able to understand the arguments of your personal ""the other side"". 

> What I see is instead engineering for the sake of engineering.

Oh come on. Calling a ~5x speedup on signature validation, one of the major bottlenecks of actually scaling bitcoin, engineering for the sake of engineering is borderline insulting. 
";0;1;False;hahanee;cz2seaf;Some advice for everybody at this point in time;41ipkd;https://www.reddit.com/r/btc/comments/41ipkd/some_advice_for_everybody_at_this_point_in_time/
"Thank you!

I intended the merchant and payer experiences of the credit card replacement to be two different use cases, even if they're part of the same transaction.
";3;1;False;Falkvinge;cz2q9ul;Some advice for everybody at this point in time;41ipkd;https://www.reddit.com/r/btc/comments/41ipkd/some_advice_for_everybody_at_this_point_in_time/
"I've tried and they don't want money (/u/jtoomim :-), at least not now for this initial burst of energy to get the 2MB fork done. They don't need it and don't want to be influenced by a donation, which I respect.

I think there will be lots of opportunity after the fork takes to fund various things, mostly block torrent and IBLT set reconcilation coding, I believe.";1;0;False;sandball;cz2y5wl;Some advice for everybody at this point in time;41ipkd;https://www.reddit.com/r/btc/comments/41ipkd/some_advice_for_everybody_at_this_point_in_time/
[deleted];-2;1;False;;cz2qsrq;Some advice for everybody at this point in time;41ipkd;https://www.reddit.com/r/btc/comments/41ipkd/some_advice_for_everybody_at_this_point_in_time/
