body;score;nb_replies;stickied;author;id;post_title;post_id;post_link
[deleted];120;4;False;;cz2ms6x;Some advice for everybody at this point in time;41ipkd;https://www.reddit.com/r/btc/comments/41ipkd/some_advice_for_everybody_at_this_point_in_time/
Ask the tribal native South Africans about Mandela you will get a very different picture than what you see on television.;2;1;False;Bitcoinopoly;cz2np6z;Some advice for everybody at this point in time;41ipkd;https://www.reddit.com/r/btc/comments/41ipkd/some_advice_for_everybody_at_this_point_in_time/
"You're welcome. 

Given your experiences of real world politics and running difficult organisations under adversarial conditions, would you be able to offer Classic some advice on creating their new governance structures?

Unfortunately I'm not in a position to connect you to the right people but if I page /u/jtoomim and he reads this and agrees, maybe the two of you could begin that conversation?";3;1;False;nanoakron;cz2qcdg;Some advice for everybody at this point in time;41ipkd;https://www.reddit.com/r/btc/comments/41ipkd/some_advice_for_everybody_at_this_point_in_time/
"It's not much, but a little more than a ""this is a well written post"" message. I'm just part of the masses that want Bitcoin to work well and scale nicely. And the name calling gets old, especially when users say, [""your father smells of elder berries...""](https://youtu.be/S3I5XcsReT0) lol.";1;0;False;ILikeGreenit;cz30lzu;Some advice for everybody at this point in time;41ipkd;https://www.reddit.com/r/btc/comments/41ipkd/some_advice_for_everybody_at_this_point_in_time/
It's actually his good twin.;1;0;False;btc_ceo_is_hitler;cz32at8;Some advice for everybody at this point in time;41ipkd;https://www.reddit.com/r/btc/comments/41ipkd/some_advice_for_everybody_at_this_point_in_time/
You missed the point of this post entirely. We must extend goodwill, be gracious victors, and rebuild the community.;22;3;False;Thorbinator;cz2xjcr;Some advice for everybody at this point in time;41ipkd;https://www.reddit.com/r/btc/comments/41ipkd/some_advice_for_everybody_at_this_point_in_time/
cool;8;0;False;asymmetric_bet;cz2r1rr;Some advice for everybody at this point in time;41ipkd;https://www.reddit.com/r/btc/comments/41ipkd/some_advice_for_everybody_at_this_point_in_time/
"Yeah, it got caught in the ""spam filter"" because it included a reference to /r/btc.

>There's a highly-upvoted thread already about keeping the moral high ground in /r/btc, which makes me happy.

Now that the above offensive line has been excised from the original post, it is suitable for consumption by the unwashed masses, I guess.

Why do you have your spam filter set to remove all references to /r/btc? To my knowledge references to /r/bitcoin are not censored here. What are you afraid of? ";21;2;False;KoKansei;cz2t0kp;Some advice for everybody at this point in time;41ipkd;https://www.reddit.com/r/btc/comments/41ipkd/some_advice_for_everybody_at_this_point_in_time/
At the end you mentioned three main use cases but only wrote about two of them. Was there a third, and, if so, can you please add that into your original post?;10;1;False;Bitcoinopoly;cz2nkjn;Some advice for everybody at this point in time;41ipkd;https://www.reddit.com/r/btc/comments/41ipkd/some_advice_for_everybody_at_this_point_in_time/
except that will be 'brigading' and it will be deleted again as such.;16;4;False;_supert_;cz2q6bz;Some advice for everybody at this point in time;41ipkd;https://www.reddit.com/r/btc/comments/41ipkd/some_advice_for_everybody_at_this_point_in_time/
It'll then be deleted as that's against there rules;1;0;False;Adrian-X;cz301zu;Some advice for everybody at this point in time;41ipkd;https://www.reddit.com/r/btc/comments/41ipkd/some_advice_for_everybody_at_this_point_in_time/
inviting rotten core to party is wrong. they showed us who they are;0;1;False;trancephorm;cz2tm78;Some advice for everybody at this point in time;41ipkd;https://www.reddit.com/r/btc/comments/41ipkd/some_advice_for_everybody_at_this_point_in_time/
"> perhaps to an extent lacks the maturity to interpret the code

Sorry but honestly, this is such bullshit. The arguments are not about some arcane details of the code that only Jedi masters can understand.

It's about whether you believe enough hobbyists with low bandwidth connections and no budget for a few disks can prevent a government attack on bitcoin. The entire core dev position derives from the claim that even slightly increasing node cost will cause an unacceptable security risk, and that it's worth refusing new customers wanting to use the service in order to protect this. Most people just don't support this view, and in fact find it ludicrous.

I think it derives from a deep distrust of corporations, the fear that if any corporation gets involved the whole thing will get corrupted. My guess is people who have worked in responsible companies have a more balanced view that yes there are some Enrons but mostly corporations are not so mysterious. And furthermore, when put into a competitive ecosystem, like airlines or automobiles or internet search engines or whatever (bitcoin mining! or bitcoin node operation!) that the result is quite robust and stable on the whole. And delivers much value to people.";5;1;False;sandball;cz307sw;Some advice for everybody at this point in time;41ipkd;https://www.reddit.com/r/btc/comments/41ipkd/some_advice_for_everybody_at_this_point_in_time/
"Yup, hardforks are an attack vector.  If we fork for 2mb, then what's next?  Who's gonna drive the next so called community consensus to fork to destroy satoshis coins, increase the mining reward or allow better coin tracking?    I've heard tons of bad ideas floated around that could be twisted as a good thing from the myopic masses.

The stupidest thing about forking for 2mb is the risk/reward.   All we get is twice the capacity.  That's it.  We risk the entire network fracturing over a small capacity boost.   We'll probably fill that capacity within 6 months and then what?   Another fork?  The easier these things are, the easier the network can be compromised.  If this fork succeeds without a hitch, then we're proving the attack vector and it is only a matter of time before the 21m coin limit will be lifted.    We all know that  'common knowledge' says deflationary currencies can't work.   

There is a tiny fraction of people who believe deflationary currency is the best feature of bitcoin, just wait until the masses decide they want to change that.";-2;3;False;pizzaface18;cz2tn78;Some advice for everybody at this point in time;41ipkd;https://www.reddit.com/r/btc/comments/41ipkd/some_advice_for_everybody_at_this_point_in_time/
[deleted];-1;1;False;;cz2thrn;Some advice for everybody at this point in time;41ipkd;https://www.reddit.com/r/btc/comments/41ipkd/some_advice_for_everybody_at_this_point_in_time/
"The three use cases I referred to were;

* remittance,
* credit card replacement, from the merchant's PoV,
* credit card replacement, from the payer's PoV.
";11;1;False;Falkvinge;cz2nl9t;Some advice for everybody at this point in time;41ipkd;https://www.reddit.com/r/btc/comments/41ipkd/some_advice_for_everybody_at_this_point_in_time/
Ask the tribal native of different tribes you will get very different answers. ;4;0;False;Zarathustra_III;cz2nudi;Some advice for everybody at this point in time;41ipkd;https://www.reddit.com/r/btc/comments/41ipkd/some_advice_for_everybody_at_this_point_in_time/
done;7;1;False;sydwell;cz2px3c;Some advice for everybody at this point in time;41ipkd;https://www.reddit.com/r/btc/comments/41ipkd/some_advice_for_everybody_at_this_point_in_time/
Absolutely, if I have some experience to contribute! I've even written a book dealing with the social leadership aspects of building a large scale movement - it's available for [free download](https://falkvinge.net/books/), of course.;1;0;False;Falkvinge;cz31h7r;Some advice for everybody at this point in time;41ipkd;https://www.reddit.com/r/btc/comments/41ipkd/some_advice_for_everybody_at_this_point_in_time/
"The majority at /r/bitcoin ? That doesn't surprise me. Probably with comments sorted by ""controversial"".

The names in support of Classic were taken directly from the Bitcoin Classic website, with the exception of F2Pool.";3;1;False;;cz2t17w;Some advice for everybody at this point in time;41ipkd;https://www.reddit.com/r/btc/comments/41ipkd/some_advice_for_everybody_at_this_point_in_time/
"Thanks for the clarification.

I respect what you've accomplished and there is much to like about your post.  I worry though that this latest development in the block size ""debate"" is a mostly an ill informed revolt based on a community that has seen too much censorship (inexcusable) and perhaps to an extent lacks the maturity to interpret the code, the dynamism of this system and the forces at play.

I have seen this same group claim that an opt-in feature meant primarily to be used by programs will ""break instant transactions"" that never were secure in the first place.  I've seen issues similarly propagandized and misrepresented to drive this revolution.

A few days ago Mike Hearn left [blaming the low block size on a majority of miners being behind the great firewall of China and them being at capacity, yet his solution was to dramatically increase the block size and therefore the bandwidth requirements](https://www.reddit.com/r/Bitcoin/comments/41fn73/mike_hearns_inconsistencies_with_respect_to_block/) and a hard fork.  Despite his defection to work with a group of central bankers, I'm pretty sure you'd agree these are the people this system is meant to disrupt and who would gladly see it's demise, within just a few days the same group of XT supporters are now backing another hard fork only this time with a mere 2x multiplier instead of 8x.  So safer but safer is not necessarily safe.  No acknowledgement that your former leader is now working for the competition?  Imagine the uproar if he simply switched to working on litecoin.

As I understand it though and I don't claim to speak for them, core's philosophy for scale is to ensure the base is solid, like TCP/IP, then to build on top of that.  This seems prudent as ""redefining the protocol"" so to speak poses more risk.  This philosophy respects and appreciates that this is a first of it's kind system and takes nothing for granted.  This seems prudent IMO.

Also, what about continuity?  Who is qualified to continue to develop the code if the core developers don't want to clean up the mess that may result?  Anyone can change a few lines of code, but can they safely maintain very complex code that is constantly being probed for security holes, DDoSed and has it's own very complex game mechanics?  Core has been doing this for many years already and has a proven track record.  Are the ""classic"" developers up to the task?

This seems like a very risky approach.

I also think that even if there is a degree of success, doing a contentious hard fork like this sets a template for future attack.  Scenario: Governments demands black listing and forces known regulated players to comply.  Without a contentious hard fork in history the claim can be made that it may destroy the system and the full economics of all the players can and likely would push back.  If this ""succeeds"" as in doesn't destroy bitcoin, that hand is effectively folded. Governments would quite happily exert their control if the only price to pay was a half collapse of this system and the plausible deniability of their culpability already had precedent. ""It didn't destroy bitcoin before...""

Finally, a failure of bitcoin like this would also make it hard for a future improved version to succeed as it would have to overcome the negative perceptions.  It would be far better for bitcoin to be competed out of existence than for it to fail and then another to emerge.

Are you focusing on the election and not on the aftermath?  I don't want to be right about this, I want to be wrong that ""bitcoin"" whatever it becomes after this ""vote"" will be anti-fragile enough to survive, but I can't help but think that this is a big mistake that will be clear in hindsight.

Edit: compare this to the drumbeat of ""2MB now!"", ""change the constant"": [The scaling announcement bitcoin core should have made](https://medium.com/@ryanshea/the-scaling-announcement-bitcoin-core-should-have-made-146790f755df#.siuth18ip).

This IMO is the difference in the ideas space.  Fortunately this clarity of communication has emerged.  I'm in agreement with the author that this sort of clarity was needed sooner.";5;3;False;jimmajamma;cz2rz2l;Some advice for everybody at this point in time;41ipkd;https://www.reddit.com/r/btc/comments/41ipkd/some_advice_for_everybody_at_this_point_in_time/
"That would be something like ""Be excellent to each other"".";8;0;False;Falkvinge;cz35f3g;Some advice for everybody at this point in time;41ipkd;https://www.reddit.com/r/btc/comments/41ipkd/some_advice_for_everybody_at_this_point_in_time/
[deleted];-9;1;False;;cz2wipe;Some advice for everybody at this point in time;41ipkd;https://www.reddit.com/r/btc/comments/41ipkd/some_advice_for_everybody_at_this_point_in_time/
"cool ad-hominem. but thanks ;)";3;0;False;trancephorm;cz2tu3o;Some advice for everybody at this point in time;41ipkd;https://www.reddit.com/r/btc/comments/41ipkd/some_advice_for_everybody_at_this_point_in_time/
"Is that actually luke-jr?  If not who is it?
";1;1;False;NilacTheGrim;cz30yk4;Some advice for everybody at this point in time;41ipkd;https://www.reddit.com/r/btc/comments/41ipkd/some_advice_for_everybody_at_this_point_in_time/
That picture looks like it was made by a troll to suggest that Bitcoin Classic should be flushed down the toilet.;4;0;False;Bitcoinopoly;cz2o00q;Some advice for everybody at this point in time;41ipkd;https://www.reddit.com/r/btc/comments/41ipkd/some_advice_for_everybody_at_this_point_in_time/
At times it is really hard to assume good faith.;4;0;False;spkrdt;cz2pmte;Some advice for everybody at this point in time;41ipkd;https://www.reddit.com/r/btc/comments/41ipkd/some_advice_for_everybody_at_this_point_in_time/
"[**@Yingsena**](https://twitter.com/Yingsena/)

> [2016-01-18 05:43 UTC](https://twitter.com/Yingsena/status/688959880904835072)

> @rogerkver bitcoinclassic use case @jbaksht @ohiobitcoin @saiichihashi

> @iamthatone @luismoflo @saiichihashi 

>[[Attached pic]](http://pbs.twimg.com/media/CY-tXB1UwAA0RjD.jpg) [[Imgur rehost]](http://i.imgur.com/6mHxRL4.jpg)

----

^This ^message ^was ^created ^by ^a ^bot

[^[Contact ^creator]](http://np.reddit.com/message/compose/?to=jasie3k&amp;subject=TweetsInCommentsBot)[^[Source ^code]](https://github.com/janpetryk/reddit-bot)
";1;0;False;TweetsInCommentsBot;cz2nbnw;Some advice for everybody at this point in time;41ipkd;https://www.reddit.com/r/btc/comments/41ipkd/some_advice_for_everybody_at_this_point_in_time/
"> There's a highly-upvoted [thread](https://www.reddit.com/r/btc/comments/41gwu6/suggestion_lets_not_bash_core_else_we_are_as/) already about keeping the moral high ground in /r/btc, which makes me happy. However, an effort like the one I'm describing goes beyond not behaving badly. The winning side must actively take responsibility for reconciliation.

Btw, have you read the [thread](https://www.reddit.com/r/btc/comments/41gwu6/suggestion_lets_not_bash_core_else_we_are_as/) you linked? 

The quality of the posts in there, starting with it's title ""Suggestion: Let's not bash Core, else we are as **childish as them**. Let's recognize the continuing role and contributions of good code they well make."", is a great example of the dialog that is driving this revolution.  Just emotions and bashing, very little actual discussion of the facts and issues.";3;0;False;jimmajamma;cz2tn77;Some advice for everybody at this point in time;41ipkd;https://www.reddit.com/r/btc/comments/41ipkd/some_advice_for_everybody_at_this_point_in_time/
I think you make some good observations, it's concerning that what is supposed to be a censorship resistant community, is being censored from within.;2;0;False;Mathias-g;cz2yukn;Some advice for everybody at this point in time;41ipkd;https://www.reddit.com/r/btc/comments/41ipkd/some_advice_for_everybody_at_this_point_in_time/
It was caught by the spam filter and I approved it.;24;2;False;110101002;cz2qqzq;Some advice for everybody at this point in time;41ipkd;https://www.reddit.com/r/btc/comments/41ipkd/some_advice_for_everybody_at_this_point_in_time/
LOL;2;0;False;Adrian-X;cz2y1to;Some advice for everybody at this point in time;41ipkd;https://www.reddit.com/r/btc/comments/41ipkd/some_advice_for_everybody_at_this_point_in_time/
[removed];3;3;False;;cz2pu0y;Some advice for everybody at this point in time;41ipkd;https://www.reddit.com/r/btc/comments/41ipkd/some_advice_for_everybody_at_this_point_in_time/
"You should though understand that bitcoin core is ""their"" baby. Especially if you play politics for years to get a leadership position with commit access.

That does not excuse the behavior - if I were a commit-level project leader on something intentionally sabotaging the open source process, I'd be the first to fork it. But then I'm burdening myself with trying to establish an entirely new development community with the added downside of having to attract them from an already established one. It is not something many developers would accept as a burden, and when they aren't the ones doing it it means they are then the ones starting from ground zero in someone elses community.";4;0;False;Xanny;cz32xzs;Some advice for everybody at this point in time;41ipkd;https://www.reddit.com/r/btc/comments/41ipkd/some_advice_for_everybody_at_this_point_in_time/
"Well, all three are based on Core, and Unlimited can support any blocksize cap because it is set by the user, so as long as Core goes along with the change they can be invited to the party.

Probably it'll start to be a division of labor, more like Classic is run by miners, Unlimited by nodes/businesses, and Core by researchers or ???.";10;1;False;ForkiusMaximus;cz2p52c;Some advice for everybody at this point in time;41ipkd;https://www.reddit.com/r/btc/comments/41ipkd/some_advice_for_everybody_at_this_point_in_time/
If that's what they want, sure. But I doubt most of the Core devs actually want that, even if a few of the key ones do.;3;0;False;ForkiusMaximus;cz38sn5;Some advice for everybody at this point in time;41ipkd;https://www.reddit.com/r/btc/comments/41ipkd/some_advice_for_everybody_at_this_point_in_time/
Wow! Awesome to be talking to you mate. I am a big supporter of the Pirate Party.;17;0;False;singularity87;cz2q8zt;Some advice for everybody at this point in time;41ipkd;https://www.reddit.com/r/btc/comments/41ipkd/some_advice_for_everybody_at_this_point_in_time/
Yeah, you should have known better Falkvinge. Glorious leader Theymos and bible thumping Lukejr does not approve of sheep that have thoughts, ideas and (worst of all) source code of their own. OBEY all under one reich.;5;1;False;btc_ceo_is_hitler;cz2s1gt;Some advice for everybody at this point in time;41ipkd;https://www.reddit.com/r/btc/comments/41ipkd/some_advice_for_everybody_at_this_point_in_time/
"I agree that Segwit doesn't look like it's supposed to be solving scaling, even if I can see it adding some scaling capacity as a nice side effect to its primary purpose.

Therefore, I don't think it should have been presented as ""this is the solution to scaling"" to begin with. But that's how it's been sold toward the bigger-blocklimit part of the community.";2;0;False;Falkvinge;cz2zwqy;Some advice for everybody at this point in time;41ipkd;https://www.reddit.com/r/btc/comments/41ipkd/some_advice_for_everybody_at_this_point_in_time/
"I extend goodwill to the ""small block"" proponents, whomever they are, no matter how extreme their opinions. I do not extend goodwill to the actors responsible for using censorship in turning this debate into a battle for social platforms and ideological mindshare.";6;0;False;gigitrix;cz33cbd;Some advice for everybody at this point in time;41ipkd;https://www.reddit.com/r/btc/comments/41ipkd/some_advice_for_everybody_at_this_point_in_time/
Yes, we and everyone except theymos etc. will do and are doing this.;1;0;False;btc_ceo_is_hitler;cz2xnno;Some advice for everybody at this point in time;41ipkd;https://www.reddit.com/r/btc/comments/41ipkd/some_advice_for_everybody_at_this_point_in_time/
strongly disagree, the more people post and comment on both subreddits, the more newcomers see that bitcoiners have two subreddits they visit - must be for a reason right?;3;2;False;;cz2sh0m;Some advice for everybody at this point in time;41ipkd;https://www.reddit.com/r/btc/comments/41ipkd/some_advice_for_everybody_at_this_point_in_time/
[deleted];-4;2;False;;cz2vb6s;Some advice for everybody at this point in time;41ipkd;https://www.reddit.com/r/btc/comments/41ipkd/some_advice_for_everybody_at_this_point_in_time/
Thanks, I clarified it a little.;5;0;False;Falkvinge;cz2nqvl;Some advice for everybody at this point in time;41ipkd;https://www.reddit.com/r/btc/comments/41ipkd/some_advice_for_everybody_at_this_point_in_time/
I'd say it's too long.;-1;0;False;jarfil;cz31idz;Some advice for everybody at this point in time;41ipkd;https://www.reddit.com/r/btc/comments/41ipkd/some_advice_for_everybody_at_this_point_in_time/
reddit-classic with overwhelming consensus by May 4th!;1;0;False;Xanny;cz32t5j;Some advice for everybody at this point in time;41ipkd;https://www.reddit.com/r/btc/comments/41ipkd/some_advice_for_everybody_at_this_point_in_time/
"Badge of honor. Wear it proud.

<insert secret handshake here>";5;1;False;ButtcoinButterButts;cz2riv9;Some advice for everybody at this point in time;41ipkd;https://www.reddit.com/r/btc/comments/41ipkd/some_advice_for_everybody_at_this_point_in_time/
/u/changetip 1 badge of honor;1;1;False;bitsko;cz30b3k;Some advice for everybody at this point in time;41ipkd;https://www.reddit.com/r/btc/comments/41ipkd/some_advice_for_everybody_at_this_point_in_time/
Good job man, what a good little Theymos lapdog, you caught me good! Bask in the power! The power! Off to create a new account and continue the fight on r/bitcoin. Already done it like four times! I won't be brigading, just making a new account as I'm welcome to! ;7;2;False;TheHumanityHater;cz2t3bp;Some advice for everybody at this point in time;41ipkd;https://www.reddit.com/r/btc/comments/41ipkd/some_advice_for_everybody_at_this_point_in_time/
fyi working around bans like that is against the rules of reddit;3;1;False;keis;cz2u6og;Some advice for everybody at this point in time;41ipkd;https://www.reddit.com/r/btc/comments/41ipkd/some_advice_for_everybody_at_this_point_in_time/
I agree with this. They keep more people trapped inside the echochamber when we don't make a ruskus about the censorship. ;3;0;False;fheymos;cz30q78;Some advice for everybody at this point in time;41ipkd;https://www.reddit.com/r/btc/comments/41ipkd/some_advice_for_everybody_at_this_point_in_time/
Your questions are worded in a hostile fashion. I already answered your question. Take it or leave it.;7;1;False;;cz2vsh0;Some advice for everybody at this point in time;41ipkd;https://www.reddit.com/r/btc/comments/41ipkd/some_advice_for_everybody_at_this_point_in_time/
"I shall indeed wear it proud! 

<secret handshake> ";2;0;False;TheHumanityHater;cz2rm1w;Some advice for everybody at this point in time;41ipkd;https://www.reddit.com/r/btc/comments/41ipkd/some_advice_for_everybody_at_this_point_in_time/
"/u/TheHumanityHater, bitsko wants to send you a tip for 1 badge of honor (2,585 bits/$1.00). Follow me to **[collect it](https://www.changetip.com/collect/935568)**.

--

[^^what ^^is ^^ChangeTip?](https://www.reddit.com/r/changetip/wiki/tipping-on-reddit)";1;0;False;changetip;cz30bjp;Some advice for everybody at this point in time;41ipkd;https://www.reddit.com/r/btc/comments/41ipkd/some_advice_for_everybody_at_this_point_in_time/
https://www.youtube.com/watch?v=6sJqTDaOrTg;1;0;False;BrainSlurper;cz2zobu;Some advice for everybody at this point in time;41ipkd;https://www.reddit.com/r/btc/comments/41ipkd/some_advice_for_everybody_at_this_point_in_time/
[deleted];-4;1;False;;cz2w27o;Some advice for everybody at this point in time;41ipkd;https://www.reddit.com/r/btc/comments/41ipkd/some_advice_for_everybody_at_this_point_in_time/
"You can do whatever you want. You can use the image from the previous day if you want. The only difference was F2Pool was not included in yesterday's image. So the work is done for you.

http://i.imgur.com/XNDvuzy.gif";2;1;False;;cz2wdl8;Some advice for everybody at this point in time;41ipkd;https://www.reddit.com/r/btc/comments/41ipkd/some_advice_for_everybody_at_this_point_in_time/
Exactly as it should be! They ban us, and we keep coming back. BitcoinClassic has consensus, and r/btc has momentum as well.;0;0;False;fheymos;cz308vv;Some advice for everybody at this point in time;41ipkd;https://www.reddit.com/r/btc/comments/41ipkd/some_advice_for_everybody_at_this_point_in_time/
We start rebuilding the community by kicking Theymos out of it. That man is toxic.;3;0;False;Minthos;cz31z9w;Some advice for everybody at this point in time;41ipkd;https://www.reddit.com/r/btc/comments/41ipkd/some_advice_for_everybody_at_this_point_in_time/
classy.;4;0;False;_supert_;cz2t68h;Some advice for everybody at this point in time;41ipkd;https://www.reddit.com/r/btc/comments/41ipkd/some_advice_for_everybody_at_this_point_in_time/
Not what /u/Theymos says people have to believe = bridading.;1;0;False;1s44c;cz35dd6;Some advice for everybody at this point in time;41ipkd;https://www.reddit.com/r/btc/comments/41ipkd/some_advice_for_everybody_at_this_point_in_time/
