body;score;nb_replies;stickied;author;id;post_title;post_id;post_link
"> Yeah, it got caught in the ""spam filter"" because it included a reference to /r/btc.

Actually, it didn't. I removed that particular paragraph from the submission to the other sub just to avoid such flagging.";14;2;False;Falkvinge;cz2txcs;Some advice for everybody at this point in time;41ipkd;https://www.reddit.com/r/btc/comments/41ipkd/some_advice_for_everybody_at_this_point_in_time/
Crickets..;6;0;False;ProchronistiC;cz2tixo;Some advice for everybody at this point in time;41ipkd;https://www.reddit.com/r/btc/comments/41ipkd/some_advice_for_everybody_at_this_point_in_time/
"Majority of votes = consensus = brigading

Sad state of affairs when reddit voting is seen as a bad thing ";11;2;False;klondike_barz;cz2qscm;Some advice for everybody at this point in time;41ipkd;https://www.reddit.com/r/btc/comments/41ipkd/some_advice_for_everybody_at_this_point_in_time/
">  it will be deleted again as su

Oh true! Never mind! LOL. Perhaps then people should go over to that reddit, have a pleasant read, and upvote or downvote threads as they wish. ";6;1;False;TheHumanityHater;cz2q7zz;Some advice for everybody at this point in time;41ipkd;https://www.reddit.com/r/btc/comments/41ipkd/some_advice_for_everybody_at_this_point_in_time/
Just go through the normal links, it's only brigading if you link from here and then vote.;2;0;False;shadowofashadow;cz2t7bm;Some advice for everybody at this point in time;41ipkd;https://www.reddit.com/r/btc/comments/41ipkd/some_advice_for_everybody_at_this_point_in_time/
Nah, I would only delete it if it was OP brigading. In this case I reported the account to the admins.;-9;2;False;110101002;cz2rgix;Some advice for everybody at this point in time;41ipkd;https://www.reddit.com/r/btc/comments/41ipkd/some_advice_for_everybody_at_this_point_in_time/
[deleted];10;1;False;;cz2re8w;Some advice for everybody at this point in time;41ipkd;https://www.reddit.com/r/btc/comments/41ipkd/some_advice_for_everybody_at_this_point_in_time/
And I was banned. 40 minutes from post to banning. People working overtime! ;7;2;False;TheHumanityHater;cz2r55t;Some advice for everybody at this point in time;41ipkd;https://www.reddit.com/r/btc/comments/41ipkd/some_advice_for_everybody_at_this_point_in_time/
I'm ok with core being around as long as they have a minority market share. They can't do too much damage that way. It would keep classic on its toes.;3;0;False;Apatomoose;cz2w22v;Some advice for everybody at this point in time;41ipkd;https://www.reddit.com/r/btc/comments/41ipkd/some_advice_for_everybody_at_this_point_in_time/
">We'll probably fill that capacity within 6 months and then what? 

And then segwit and LN are probably complete. Core scaling plan's main flaw is using segwit instead of a hard fork blocksize increase. I'm still excited for LN.";1;0;False;Thorbinator;cz2xqfd;Some advice for everybody at this point in time;41ipkd;https://www.reddit.com/r/btc/comments/41ipkd/some_advice_for_everybody_at_this_point_in_time/
"> If we fork for 2mb, then what's next? 

What ever the network decides

> I've heard tons of bad ideas floated around that could be twisted as a good thing from the myopic masses.

If you want ivory-tower control of a currency, there are plenty of ones to choose from.  Bitcoin is in control of the people.

>The stupidest thing about forking for 2mb is the risk/reward. All we get is twice the capacity. That's it. We risk the entire network fracturing over a small capacity boost. We'll probably fill that capacity within 6 months and then what? Another fork?

Ahh, so you are in favor of a larger increase!  The irony in your confused statement is that 2MB was chosen as something that could find widespread agreement - and not fracture the network.  Yeah, 8MB would have been nicer, but there wasn't consent for it.

> If this fork succeeds without a hitch, then we're proving the attack vector and it is only a matter of time before the 21m coin limit will be lifted. We all know that 'common knowledge' says deflationary currencies can't work. 

Yes, only a matter of time, we all agree.  /s";1;0;False;CubicEarth;cz31lom;Some advice for everybody at this point in time;41ipkd;https://www.reddit.com/r/btc/comments/41ipkd/some_advice_for_everybody_at_this_point_in_time/
"There was no mistake. F2Pool stated they welcomed Classic.

>Policy change announcement: We support the hard fork effort to increase the max block size to 2MB. Seg-wit may be deployed together in this hard fork if it can be ready in time, or it can be merged later. Non-controversial features in the hard fork wishlist, if it does not delay the hard fork process, can be deployed at the same time. The hard fork should be implemented in Core, eventually. **Bitcoin Classic, which despite was born on the same day that XT dies, is an attempt that could make the hard fork happen sooner. We welcome Classic.** We are going to cease support for FSS-RBF after upgrading to version 0.12, some time in the next few weeks. We may not implement the opt-in RBF feature. We believe that we should do everything we can do to make 0-conf transactions as secure as possible. We do not believe the concept of fee market.

https://bitcointalk.org/index.php?topic=700411.msg13571787#msg13571787";4;1;False;;cz2v4qg;Some advice for everybody at this point in time;41ipkd;https://www.reddit.com/r/btc/comments/41ipkd/some_advice_for_everybody_at_this_point_in_time/
The bold text being only two items made this unclear when I read it, but thanks for explaining.;9;1;False;Bitcoinopoly;cz2nn7d;Some advice for everybody at this point in time;41ipkd;https://www.reddit.com/r/btc/comments/41ipkd/some_advice_for_everybody_at_this_point_in_time/
Okay, interesting. Then why was it caught in the spam filter?;9;1;False;KoKansei;cz2u2wd;Some advice for everybody at this point in time;41ipkd;https://www.reddit.com/r/btc/comments/41ipkd/some_advice_for_everybody_at_this_point_in_time/
So you are actually supporting the censorship there...;-8;0;False;coin-master;cz2wnph;Some advice for everybody at this point in time;41ipkd;https://www.reddit.com/r/btc/comments/41ipkd/some_advice_for_everybody_at_this_point_in_time/
Subreddit forking will not be tolerated;4;1;False;BrainSlurper;cz2yaei;Some advice for everybody at this point in time;41ipkd;https://www.reddit.com/r/btc/comments/41ipkd/some_advice_for_everybody_at_this_point_in_time/
"> It's about whether you believe enough hobbyists with low bandwidth connections and no budget for a few disks can prevent a government attack on bitcoin. 

Hobbyists?

From Mike Hearn's now famous ""T[he resolution of the Bitcoin experiment"" post:](https://medium.com/@octskyward/the-resolution-of-the-bitcoin-experiment-dabb30201f7#.b92939ia9)

""The reason the true limit seems to be 700 kilobytes instead of the theoretical 1000 is that sometimes miners produce blocks smaller than allowed and even empty blocks, despite that there are lots of transactions waiting to confirm — this seems to be most frequently caused by interference from the Chinese “Great Firewall” censorship system. More on that in a second.""

""Because the block chain is controlled by Chinese miners, just two of whom control more than 50% of the hash power. At a recent conference over 95% of hashing power was controlled by a handful of guys sitting on a single stage. The miners are not allowing the block chain to grow.""

""And the final reason is that the Chinese internet is so broken by their government’s firewall that moving data across the border barely works at all, with speeds routinely worse than what mobile phones provide.""

""Right now, the Chinese miners are able to — just about — maintain their connection to the global internet""
So, established by Mike: Chinese miners are currently the largest players, at least 50% of the mining power and they have limited bandwidth which is barely able to operate at current capacity. What is his solution?:

""In August 2015 it became clear that due to severe mismanagement, the “Bitcoin Core” project that maintains the program that runs the peer-to-peer network wasn’t going to release a version that raised the block size limit. The reasons for this are complicated and discussed below. But obviously, the community needed the ability to keep adding new users. So some long-term developers (including me) got together and developed the necessary code to raise the limit. That code was called BIP 101 and we released it in a modified version of the software that we branded Bitcoin XT.""

[BIP101](https://github.com/bitcoin/bips/blob/master/bip-0101.mediawiki): ""The maximum size shall be 8,000,000 bytes at a timestamp of 2016-01-11 00:00:00 UTC""";1;0;False;jimmajamma;cz32axg;Some advice for everybody at this point in time;41ipkd;https://www.reddit.com/r/btc/comments/41ipkd/some_advice_for_everybody_at_this_point_in_time/
Whoa, thanks! <3;1;1;False;Falkvinge;cz2zx10;Some advice for everybody at this point in time;41ipkd;https://www.reddit.com/r/btc/comments/41ipkd/some_advice_for_everybody_at_this_point_in_time/
"He's saying he's given up hope of convincing you because you started a semantics fight over ""welcome"" and ""support"".";5;0;False;Thorbinator;cz2xub0;Some advice for everybody at this point in time;41ipkd;https://www.reddit.com/r/btc/comments/41ipkd/some_advice_for_everybody_at_this_point_in_time/
"From OP's post:
>This assumes, of course, that the hard fork happens. We're not there yet. Do not take success for granted; many projects have fallen on taking success for granted.";4;0;False;uxgpf;cz2tknj;Some advice for everybody at this point in time;41ipkd;https://www.reddit.com/r/btc/comments/41ipkd/some_advice_for_everybody_at_this_point_in_time/
"Brilliantly stated. 

What was the third use case you had in mind? Your post unfortunately only lists two. ";2;1;False;nanoakron;cz2q5ii;Some advice for everybody at this point in time;41ipkd;https://www.reddit.com/r/btc/comments/41ipkd/some_advice_for_everybody_at_this_point_in_time/
falvinge... my man, my man. always on the right track!;2;0;False;trancephorm;cz2tfot;Some advice for everybody at this point in time;41ipkd;https://www.reddit.com/r/btc/comments/41ipkd/some_advice_for_everybody_at_this_point_in_time/
How do I donate to those who are coding classic? ;2;1;False;;cz2uwbs;Some advice for everybody at this point in time;41ipkd;https://www.reddit.com/r/btc/comments/41ipkd/some_advice_for_everybody_at_this_point_in_time/
I don't see the need to associate what's going on to a democracy. It doesn't need to be. There are two visions for Bitcoin, and technically they can coexist. Let's divorce peacefully and each side follows its path. If Core wants to keep working on their SWIFT 2.0 project, let them be.;2;0;False;caveden;cz31sdw;Some advice for everybody at this point in time;41ipkd;https://www.reddit.com/r/btc/comments/41ipkd/some_advice_for_everybody_at_this_point_in_time/
Isn't it a tad premature to be celebrating?;2;1;False;scotty321;cz2rpkd;Some advice for everybody at this point in time;41ipkd;https://www.reddit.com/r/btc/comments/41ipkd/some_advice_for_everybody_at_this_point_in_time/
"I'm a bot, *bleep*, *bloop*. Someone has linked to this thread from another place on reddit:

- [/r/ethereum] [Rick Falkvinge - Some advice for everybody at this point in time : btc](https://np.reddit.com/r/ethereum/comments/41j7bc/rick_falkvinge_some_advice_for_everybody_at_this/)

[](#footer)*^(If you follow any of the above links, please respect the rules of reddit and don't vote in the other threads.) ^\([Info](/r/TotesMessenger) ^/ ^[Contact](/message/compose?to=/r/TotesMessenger))*

[](#bot)";1;0;False;TotesMessenger;cz2ptt8;Some advice for everybody at this point in time;41ipkd;https://www.reddit.com/r/btc/comments/41ipkd/some_advice_for_everybody_at_this_point_in_time/
"Wonderful post!  

I wonder if people like /u/jimmywales1 and risk manager and precautionary principle advocate /u/nntaleb would like to chime in this latest bitcoin crisis. ";1;0;False;asymmetric_bet;cz2qum2;Some advice for everybody at this point in time;41ipkd;https://www.reddit.com/r/btc/comments/41ipkd/some_advice_for_everybody_at_this_point_in_time/
"Thank you. You said my thought better than I can :)
";1;0;False;xd1gital;cz2sirk;Some advice for everybody at this point in time;41ipkd;https://www.reddit.com/r/btc/comments/41ipkd/some_advice_for_everybody_at_this_point_in_time/
Bravo.;1;0;False;TonesNotes;cz2sudc;Some advice for everybody at this point in time;41ipkd;https://www.reddit.com/r/btc/comments/41ipkd/some_advice_for_everybody_at_this_point_in_time/
"What will happen with funds collected on exchanges? 
";1;0;False;doker0;cz2szye;Some advice for everybody at this point in time;41ipkd;https://www.reddit.com/r/btc/comments/41ipkd/some_advice_for_everybody_at_this_point_in_time/
"> It is the responsibility of the winner in any rift to end a toxic animosity culture of hostilities and personal adversarialism. I cannot stress this enough.

Bravo, well said.

The fact is most of us don't really care who has the most correct answer, we just want to see development move forward in a non-confrontational way.

";1;0;False;johnnycryptocoin;cz2t9i6;Some advice for everybody at this point in time;41ipkd;https://www.reddit.com/r/btc/comments/41ipkd/some_advice_for_everybody_at_this_point_in_time/
"    That's how bitcoin's democracy works, right there.
Oh boy, it's not democracy, it's survival of the fittest.";1;0;False;prudgin;cz2tcw7;Some advice for everybody at this point in time;41ipkd;https://www.reddit.com/r/btc/comments/41ipkd/some_advice_for_everybody_at_this_point_in_time/
Very nice read, thank you. /u/changetip 2000 bits;1;2;False;ILikeGreenit;cz2zl2f;Some advice for everybody at this point in time;41ipkd;https://www.reddit.com/r/btc/comments/41ipkd/some_advice_for_everybody_at_this_point_in_time/
"*Falkvinge* received a tip for 2000 bits ($0.77).




--

[^^what ^^is ^^ChangeTip?](https://www.reddit.com/r/changetip/wiki/tipping-on-reddit)";1;0;False;changetip;cz2zlbm;Some advice for everybody at this point in time;41ipkd;https://www.reddit.com/r/btc/comments/41ipkd/some_advice_for_everybody_at_this_point_in_time/
"How about a tl;dr version?
";1;1;False;1s44c;cz35ajb;Some advice for everybody at this point in time;41ipkd;https://www.reddit.com/r/btc/comments/41ipkd/some_advice_for_everybody_at_this_point_in_time/
"Thank you for your wise words.
It's always nice to hear your objections and reflections on this matter.

It's also good to know that you didn't sell your bitcoin and moved to R3 as well... ;)";3;0;False;CoinTrade;cz2ozh8;Some advice for everybody at this point in time;41ipkd;https://www.reddit.com/r/btc/comments/41ipkd/some_advice_for_everybody_at_this_point_in_time/
WHAT AN EXCITING TIME TO BE ALIVE! :D thanks for writing this, mwah! :*;3;0;False;artichokess;cz32pj9;Some advice for everybody at this point in time;41ipkd;https://www.reddit.com/r/btc/comments/41ipkd/some_advice_for_everybody_at_this_point_in_time/
">This is not a selection of features. It's much bigger than that. It's an election of governance and stewardship into the future.

This. Hit the nail on the head.";3;0;False;HarcourtFMudd;cz31vy2;Some advice for everybody at this point in time;41ipkd;https://www.reddit.com/r/btc/comments/41ipkd/some_advice_for_everybody_at_this_point_in_time/
"The question of ""who's the customer?""

I'm the costumer! I don't want to buy coffee at the mall, I want to be able to control my wealth in times of crisis and repression, I want digital Gold ";3;1;False;javierehb;cz2uiyb;Some advice for everybody at this point in time;41ipkd;https://www.reddit.com/r/btc/comments/41ipkd/some_advice_for_everybody_at_this_point_in_time/
"CLAP! CLAP! CLAP!

Maybe consider making it a medium post.";28;1;False;Mark0Sky;cz2odhd;Some advice for everybody at this point in time;41ipkd;https://www.reddit.com/r/btc/comments/41ipkd/some_advice_for_everybody_at_this_point_in_time/
"Thanks Rick, for being a voice of reason. 

I must admit to be among those who, once or twice, have been so astounded by the actions of the ""core"" team that I have thought that they must be actively trying to hurt Bitcoin. But I suspect that you are right - everyone is simply doing what they think is best. (The road to a hell is paved with good intentions.) In any case, pointing fingers is a bad idea. We should rise above that and simply vote via longest chain, as you quote Satoshi.";21;1;False;minorman;cz2pxo7;Some advice for everybody at this point in time;41ipkd;https://www.reddit.com/r/btc/comments/41ipkd/some_advice_for_everybody_at_this_point_in_time/
"Wow. Probably the best thing I've read all year about Bitcoin scaling and priorities.

Not surprising I guess - coming from a guy who invented the Pirate Party, plus has lots of coding experience.

Focusing on the ""customers"" and the major ""use cases"" is one of the most important points.

And something which Core has been totally neglecting - which is why people are abandoning them.

Also sad that /r/Bitcoin initially *deleted* this post. Will they never learn? Maybe some clueless mod over there had never heard of Rick Falkvinge (LOL!) - one of Bitcoin's biggest supporters.

By the way, speaking of ""customers"" and the major ""use cases"", notice that the top-voted Proposal for Bitcoin Classic is ""Revert Opt-In RBF"":

https://bitcoinclassic.consider.it/

(You may have to scroll down a bit to get to the Proposal section.)

This is one big reason why people are abandoning Core and flocking to Classic. 

Classic gives the users what *the user* want. 

Core gives the users what *the Core devs* want.





";17;0;False;ydtm;cz2t8r3;Some advice for everybody at this point in time;41ipkd;https://www.reddit.com/r/btc/comments/41ipkd/some_advice_for_everybody_at_this_point_in_time/
/u/changetip beer;15;2;False;Demotruk;cz2mvxv;Some advice for everybody at this point in time;41ipkd;https://www.reddit.com/r/btc/comments/41ipkd/some_advice_for_everybody_at_this_point_in_time/
"I for one don't want developers to disappear, and I certainly don't want Classic to be the new incumbent. What I really want is for the developers that work on Bitcoin to realise that they don't get the final say. Instead they treat users as something that they can play with and exploit for their own ends and people are very rightly sick of being treated like they are dumb and have no say. Often the devs response is some kind of my-way-or-the-highway reaction which completely undermines Bitcoin's foundations and the confidence in Bitcoin as a network. Bitcoin isn't built on devs backs, it's built on the users that *use Bitcoin*, Bitcoin could still run with 10 good devs and service 100,000,000 users, but it wouldn't matter how many devs you have if the user base shinks to a couple hundred.

The developers that have positions of influence in Bitcoin development have gone to great effort to gain that influence and it has utterly corrupted their understanding of where they stand in the Bitcoin community. They are not judges or referees that get to make the final call. That's the miners', and the community's job. This is the true definition of a decentralised network that devs like Greg, btcdrak, Adam, et al. harp on about (which is incredibly ironic considering how they are trying so hard to force everyone to stick with Core BTW).

The sooner they come to realise this, the happier and healthier the Bitcoin ecosystems will become.";23;1;False;ferretinjapan;cz2q47a;Some advice for everybody at this point in time;41ipkd;https://www.reddit.com/r/btc/comments/41ipkd/some_advice_for_everybody_at_this_point_in_time/
"Extremely well said and on point! Note that egos and ""assumed power"" are powerful things. Putting the future of Bitcoin into the hands of a ""select few"" (no matter who they are) is no better than the current banking system and offers no forward progress, only turmoil - which is what we've been seeing.";10;0;False;Heisenminer_42;cz2otnv;Some advice for everybody at this point in time;41ipkd;https://www.reddit.com/r/btc/comments/41ipkd/some_advice_for_everybody_at_this_point_in_time/
"Great post, Rick! 

One small note: this isn't really an election of a team, but of multiple teams. The ideal would be something like Core, Classic, and Unlimited all having about 1/3 the nodes and 1/3 the mining power. Or maybe Core should have less, but that's for the market to decide (and indeed if Core doesn't switch to 2MB it will have ~0% of the nodes).

Here's a [diagram](http://i.imgur.com/4mGHe7t.gif) by Peter Rizun illustrating this.";16;2;False;ForkiusMaximus;cz2o6j6;Some advice for everybody at this point in time;41ipkd;https://www.reddit.com/r/btc/comments/41ipkd/some_advice_for_everybody_at_this_point_in_time/
"Hear, hear!
Another use case would be preventing money from being stolen thru bail-ins and other well-known mechanisms, in other words, being able to do anonymous payments.";1;0;False;HolyBits;cz36bcs;Some advice for everybody at this point in time;41ipkd;https://www.reddit.com/r/btc/comments/41ipkd/some_advice_for_everybody_at_this_point_in_time/
"Brilliant post. I fear that it may fall on deaf ears though (or censored ears).

I'm interested what you job was in the Pirate Party?";15;1;False;singularity87;cz2ow4r;Some advice for everybody at this point in time;41ipkd;https://www.reddit.com/r/btc/comments/41ipkd/some_advice_for_everybody_at_this_point_in_time/
"Great post Rick. 

In the end, [Bitcoin is a representative form of government](https://medium.com/@riprowan/bitcoin-is-government-a7fd3d93e8aa) with each codebase serving as a political platform for its constituency. A Bitcoin hard fork is a ""no confidence"" vote in leadership.

The linked article makes the claim that Bitcoin produces a winner-take-all outcome which makes it a First Past the Post election. However I think you raise an interesting point: if multiple parties create compatible implementations they can form a coalition government (ie if one party accepts 2MB and another has no limit, they can create a coalition government up to 2MB - their code produces an emergent coalition bound by a smart contract to dissolve if the 2MB limit is hit).

Once we start to view the entire process through the lens of representative government then a lot of things become clear, most importantly the vitriol. Partisans always use hyperbole ""if the other guys win the election the whole country is going to collapse"" and yet elections happen all over the world and representative governments seem quite stable overall.  ""If the other guy wins that's it for me, I'm leaving the country!"" but the partisans never leave. Etc. 

I think it's important for us older dudes (like you I've been a programmer for over 30 years) to bring political level-headedness to the discussion. The sky is NOT going to fall if the other party gets elected. In fact elections and change of leadership make the whole system far more robust than a fixed leadership. Change is messy but ~~healthy~~ essential for a healthy system. A Bitcoin that can't hard fork is doomed. 

I look forward to the world post fork. I'm very optimistic that after Bitcoin has demonstrated its ability to fork in the best interests of the economic majority this will be understood as a major victory for Bitcoin - arguably the most important victory to date and a great reason to invest in money that is controlled by the economic majority, not special interests. ";11;1;False;tsontar;cz2pqem;Some advice for everybody at this point in time;41ipkd;https://www.reddit.com/r/btc/comments/41ipkd/some_advice_for_everybody_at_this_point_in_time/
"Incredibly succinct and to the point, even though it looked like an enormous wall to begin with. I've argued that Core lost sight of the main goal for a long while. They just didn't seem to care about everyday usage and competing with legacy systems, rather having their own vision and creating what would see them hunkering down, protecting themselves with long winded resolutions, only allowing Bitcoin to move forward at their pace.

We have been stifled too long by inneffectual leadership. It's time we pushed to make Bitcoin what it can and should be; A quick and easy, truly global currency for all use cases.";6;0;False;Mbizzle135;cz2ronx;Some advice for everybody at this point in time;41ipkd;https://www.reddit.com/r/btc/comments/41ipkd/some_advice_for_everybody_at_this_point_in_time/
Very well written, sir.;3;1;False;;cz2q46d;Some advice for everybody at this point in time;41ipkd;https://www.reddit.com/r/btc/comments/41ipkd/some_advice_for_everybody_at_this_point_in_time/
I agree with everything you said except for using Mandela as an example of a peaceful leader. Look at the murder and crime rates in South Africa right after Mandela ended apartheid. His image is a fabrication of the mainstream media and the corporations that own them in order to further dig their claws into the continent by installing a government which they control in its richest country. Today the country is in absolute tatters, and even  Zwelithini, the king of the Zulu tribe, recently said things were much better for his people before Mandela.;21;4;False;Bitcoinopoly;cz2n3cq;Some advice for everybody at this point in time;41ipkd;https://www.reddit.com/r/btc/comments/41ipkd/some_advice_for_everybody_at_this_point_in_time/
Thank you for writing this. It's a very insightful piece, I agree with it completely.;3;0;False;Ender985;cz2r54l;Some advice for everybody at this point in time;41ipkd;https://www.reddit.com/r/btc/comments/41ipkd/some_advice_for_everybody_at_this_point_in_time/
[deleted];3;1;False;;cz2rwsm;Some advice for everybody at this point in time;41ipkd;https://www.reddit.com/r/btc/comments/41ipkd/some_advice_for_everybody_at_this_point_in_time/
