body;score;nb_replies;stickied;author;id;post_title;post_id;post_link
Btc historically goes through correction periods and always ends up higher than before (just look at it's charts). Sad to say, there has been zero upward movement since Rogers manipulation couple weeks back, 🤔;-5;2;False;ThereAintNoOther;dr118ln;Official Endorsement: Luke (core dev) prefers BCH over LTC for exchange;7iq51j;https://i.redd.it/7av4xf7taz201.jpg
Except this is blatantly false since Blockstream doesn’t comprise a large percentage of Core and Chaincode Labs employs more Core devs than Blockstream. It’s fine if you support a different coin or scaling solution but there’s no need to lie to support your position.;-6;3;False;TheBTC-G;dr0w3w1;Official Endorsement: Luke (core dev) prefers BCH over LTC for exchange;7iq51j;https://i.redd.it/7av4xf7taz201.jpg
So why are you writing in bold that we shouldn't let anyone siding with Core or Blockstream contribute to Bitcoin Cash? They already wrote 99% of the code.;1;1;False;Lunarghini;dr18uok;Official Endorsement: Luke (core dev) prefers BCH over LTC for exchange;7iq51j;https://i.redd.it/7av4xf7taz201.jpg
ViaBTC;3;0;False;thesteamybox;dr0qibv;Official Endorsement: Luke (core dev) prefers BCH over LTC for exchange;7iq51j;https://i.redd.it/7av4xf7taz201.jpg
He's so regarded, too. You never go full regard.;6;0;False;morzinbo;dr0sxwo;Official Endorsement: Luke (core dev) prefers BCH over LTC for exchange;7iq51j;https://i.redd.it/7av4xf7taz201.jpg
The day that a big enough number of people will ask themselves that question, will be the day of a bubble popping. It will be a day that will be in the history books.;17;0;False;tequila13;dr0vgi1;Official Endorsement: Luke (core dev) prefers BCH over LTC for exchange;7iq51j;https://i.redd.it/7av4xf7taz201.jpg
DOGE all the way.;3;0;False;zsaleeba;dr12hy7;Official Endorsement: Luke (core dev) prefers BCH over LTC for exchange;7iq51j;https://i.redd.it/7av4xf7taz201.jpg
"Its been better than btc for years and is 2nd oldest coin with a track record

 Btc cash is free coin most of u got as if ";3;1;False;Libertymark;dr1112g;Official Endorsement: Luke (core dev) prefers BCH over LTC for exchange;7iq51j;https://i.redd.it/7av4xf7taz201.jpg
Everything you said applies also to BCH though.;1;1;False;brintal;dr1bct5;Official Endorsement: Luke (core dev) prefers BCH over LTC for exchange;7iq51j;https://i.redd.it/7av4xf7taz201.jpg
Literally a tenth of Bitcoin's volume.;1;2;False;flyingfences;dr135k4;Official Endorsement: Luke (core dev) prefers BCH over LTC for exchange;7iq51j;https://i.redd.it/7av4xf7taz201.jpg
Hard fork is just a strange word for a certain kind of upgrade. In only results in a chain split it some miners don't upgrade.;8;2;False;dskloet;dr149qp;Official Endorsement: Luke (core dev) prefers BCH over LTC for exchange;7iq51j;https://i.redd.it/7av4xf7taz201.jpg
If one considers the genesis block and/or the Satoshi coins a premine.. yes.;3;1;False;cheaplightning;dr14rps;Official Endorsement: Luke (core dev) prefers BCH over LTC for exchange;7iq51j;https://i.redd.it/7av4xf7taz201.jpg
Both coins are doing fine. I like and own the same amount of both;1;2;False;intimacygel;dr0x4mr;Official Endorsement: Luke (core dev) prefers BCH over LTC for exchange;7iq51j;https://i.redd.it/7av4xf7taz201.jpg
">The most common geocentric view deals with the relationship of the Earth and the Sun, not other planets. Other planets obviously orbit the Sun.

How can these possibly be consistent? I knew he was wacko, but not a total idiot...";3;1;False;logosophos;dr0w0ub;Official Endorsement: Luke (core dev) prefers BCH over LTC for exchange;7iq51j;https://i.redd.it/7av4xf7taz201.jpg
Wut?;3;2;False;MajorThird;dr0xa6t;Official Endorsement: Luke (core dev) prefers BCH over LTC for exchange;7iq51j;https://i.redd.it/7av4xf7taz201.jpg
Over $1 Billion in volume last 24 hrs;4;1;False;Redanditchy;dr12f30;Official Endorsement: Luke (core dev) prefers BCH over LTC for exchange;7iq51j;https://i.redd.it/7av4xf7taz201.jpg
But nowhere near the number of people who use Bitcoin, which is the point I was making. If Bitcoin only had 1/10th the trade volume, it's fees would be negligible, too.;1;0;False;flyingfences;dr1gbe9;Official Endorsement: Luke (core dev) prefers BCH over LTC for exchange;7iq51j;https://i.redd.it/7av4xf7taz201.jpg
I meant price dingleberry;1;0;False;intimacygel;dr1b4ya;Official Endorsement: Luke (core dev) prefers BCH over LTC for exchange;7iq51j;https://i.redd.it/7av4xf7taz201.jpg
"I see what you're saying and it is wrong - allow me to explain. According to relativity, you can think of object in the universe as being stationary and everything else moving around it. Relativity can actually be debunked with ease, here is a youtube video where the uploader debunks it in 1 minute (watch from the 2min mark to the 3min mark): https://www.youtube.com/watch?v=PolFadm-lgU&t=2m

The evidences I provided prove that Earth is actually motionless. Look at Airy's Failure, for instance - it proved that it is actually the starlight moving and not the observer moving, meaning the Earth is motionless and the stars are actually moving around us.";1;1;False;threesixzero;dr18e46;Official Endorsement: Luke (core dev) prefers BCH over LTC for exchange;7iq51j;https://i.redd.it/7av4xf7taz201.jpg
"> It is possible for a large group of people to be wrong

LOL, yes, of course, the scientists are wrong and your bullshit is evidence. ";0;1;False;Shock_The_Stream;dr1dejk;Official Endorsement: Luke (core dev) prefers BCH over LTC for exchange;7iq51j;https://i.redd.it/7av4xf7taz201.jpg
"First of all, since you speak of relativity so much, I have to confirm. You do realize that relativity works with regard to a frame of reference, right? One frame of reference is the earth is stationary, and everything moves around it. The other frame is its inverse.

The clock thing in the video you linked, if you take the earth as the frame of reference, it's the rocket's time that is off. If you take the rocket as your frame of reference, it's the earth's time that is off. I don't see a problem here. Consider this,

> According to the theory of relativity, time dilation is a difference in the elapsed time measured by two observers, either due to a velocity difference relative to each other, or by being differently situated relative to a gravitational field. As a result of the nature of spacetime,[2] a clock that is moving relative to an observer will be measured to tick slower than a clock that is at rest in the observer's own frame of reference. A clock that is under the influence of a stronger gravitational field than an observer's will also be measured to tick slower than the observer's own clock.

That was from wikipedia. **velocity difference relative to each other, or by being differently situated relative to a gravitational field...** The video says that relativity does not take into account acceleration. How else can there be a velocity difference, without acceleration?  In the rocket and earth problem, you have to consider which object is leaving which other object's gravity well. The masses of the two objects matter here. 

I googled Airy's failure, and for that to work, we need an ""aether"". I'm not sure what your aether refers to... the [luminiferous aether](https://en.wikipedia.org/wiki/Luminiferous_aether)? That was disproved a while ago... [This](https://www.youtube.com/watch?v=87M2i61N1cU) was my source, so correct me if i'm mistaken, but in 2.43 he seems to have completely forgotten about refraction for some reason :|";1;2;False;Techguy10110;dr18v4u;Official Endorsement: Luke (core dev) prefers BCH over LTC for exchange;7iq51j;https://i.redd.it/7av4xf7taz201.jpg
"Mmm hmm those SCIENTIFIC STUDIES are bullshit yep for sure. Btw there are a lot of scientists who agree with me, so that throws your point out the window too.

Maybe you should try to debunk the SCIENTIFIC PROOF instead of talking shit? It would be a lot more productive and would make you look like less of a tool.";1;1;False;threesixzero;dr1dmpu;Official Endorsement: Luke (core dev) prefers BCH over LTC for exchange;7iq51j;https://i.redd.it/7av4xf7taz201.jpg
"**Luminiferous aether**

In the late 19th century, luminiferous aether, aether, or ether, meaning light-bearing aether, was the postulated medium for the propagation of light. It was invoked to explain the ability of the apparently wave-based light to propagate through empty space, something that waves should not be able to do. The assumption of a spatial plenum of luminiferous aether, rather than a spatial vacuum, provided the theoretical medium that was required by wave theories of light.

The concept was the topic of considerable debate throughout its history, as it required the existence of an invisible and infinite material with no interaction with physical objects.

***

^[ [^PM](https://www.reddit.com/message/compose?to=kittens_from_space) ^| [^Exclude ^me](https://reddit.com/message/compose?to=WikiTextBot&message=Excludeme&subject=Excludeme) ^| [^Exclude ^from ^subreddit](https://np.reddit.com/r/btc/about/banned) ^| [^FAQ ^/ ^Information](https://np.reddit.com/r/WikiTextBot/wiki/index) ^| [^Source](https://github.com/kittenswolf/WikiTextBot) ^| [^Donate](https://www.reddit.com/r/WikiTextBot/wiki/donate)   ^]
^Downvote ^to ^remove ^| ^v0.28";1;0;False;WikiTextBot;dr18vc2;Official Endorsement: Luke (core dev) prefers BCH over LTC for exchange;7iq51j;https://i.redd.it/7av4xf7taz201.jpg
">if you take the earth as the frame of reference, it's the rocket's time that is off. If you take the rocket as your frame of reference, it's the earth's time that is off. I don't see a problem here. 

See, if the rocket was moving away from Earth, time would move slower for the rocket meaning it's relatively faster on Earth. If the Earth was moving away from the rocket, time on Earth would move slower and it would be relatively faster on the rocket. This destroys relativity because **it can't be both** (but according to relativity, it IS both).

>I googled Airy's failure, and for that to work, we need an ""aether"".

This is the go-to dismissal that people always reach for. Instead of trying to understand Airy's Failure, they Google why it's wrong and repeat the same ""Airy's Failure depends on the aether"". Why do you think it requires the aether to work? The aberration of light is a real phenomenon that exists, whether the aether is true or not.";1;1;False;threesixzero;dr191af;Official Endorsement: Luke (core dev) prefers BCH over LTC for exchange;7iq51j;https://i.redd.it/7av4xf7taz201.jpg
Esoterics is not science. ;0;1;False;Shock_The_Stream;dr1dzqr;Official Endorsement: Luke (core dev) prefers BCH over LTC for exchange;7iq51j;https://i.redd.it/7av4xf7taz201.jpg
"https://en.wikipedia.org/wiki/Twin_paradox Here's your clock paradox. And also your answer.

> they look up why it's wrong and repeat the same shit.

uh huh, tell me [more](https://i.imgur.com/doI7Eqv.png)

I'm not trying to say aberration does not exist.

[Illustration](https://upload.wikimedia.org/wikipedia/commons/6/6d/Aberrationlighttimebeaming.gif)

>Aberration, light-time correction, and relativistic beaming can be considered the same phenomenon depending on the frame of reference.

Frame. Of. Reference. They are both correct, depending on your frame of reference. I can say that the entire universe except... pluto is moving. Does that make pluto special? 

Aberration can be explained just fine without an aether and other complications. So what's the point?

";1;2;False;Techguy10110;dr19edl;Official Endorsement: Luke (core dev) prefers BCH over LTC for exchange;7iq51j;https://i.redd.it/7av4xf7taz201.jpg
So those studies done by scientists aren't scientific studies? Cool, got it.;1;1;False;threesixzero;dr1e0e0;Official Endorsement: Luke (core dev) prefers BCH over LTC for exchange;7iq51j;https://i.redd.it/7av4xf7taz201.jpg
"**Twin paradox**

In physics, the twin paradox is a thought experiment in special relativity involving identical twins, one of whom makes a journey into space in a high-speed rocket and returns home to find that the twin who remained on Earth has aged more. This result appears puzzling because each twin sees the other twin as moving, and so, according to an incorrect and naive application of time dilation and the principle of relativity, each should paradoxically find the other to have aged less. However, this scenario can be resolved within the standard framework of special relativity: the travelling twin's trajectory involves two different inertial frames, one for the outbound journey and one for the inbound journey, and so there is no symmetry between the spacetime paths of the twins. Therefore, the twin paradox is not a paradox in the sense of a logical contradiction.

***

^[ [^PM](https://www.reddit.com/message/compose?to=kittens_from_space) ^| [^Exclude ^me](https://reddit.com/message/compose?to=WikiTextBot&message=Excludeme&subject=Excludeme) ^| [^Exclude ^from ^subreddit](https://np.reddit.com/r/btc/about/banned) ^| [^FAQ ^/ ^Information](https://np.reddit.com/r/WikiTextBot/wiki/index) ^| [^Source](https://github.com/kittenswolf/WikiTextBot) ^| [^Donate](https://www.reddit.com/r/WikiTextBot/wiki/donate)   ^]
^Downvote ^to ^remove ^| ^v0.28";1;0;False;WikiTextBot;dr19egu;Official Endorsement: Luke (core dev) prefers BCH over LTC for exchange;7iq51j;https://i.redd.it/7av4xf7taz201.jpg
"How does the twin paradox disprove my point? Lol. Think about it dude, it's really quite simple: if the rocket moves away and Earth is still, time is *slower* for the rocket; but if the earth moves away and the rocket is still, time is *faster* for the rocket (relatively) and slower for Earth. Relativity = debunked.

>Aberration can be explained just fine without an aether and other complications. So what's the point?

You tried debunking Airy's Failure by saying it depends on the ether, but that is simply not true.";1;1;False;threesixzero;dr19yp7;Official Endorsement: Luke (core dev) prefers BCH over LTC for exchange;7iq51j;https://i.redd.it/7av4xf7taz201.jpg
Crank science.;1;1;False;Shock_The_Stream;dr1e5y9;Official Endorsement: Luke (core dev) prefers BCH over LTC for exchange;7iq51j;https://i.redd.it/7av4xf7taz201.jpg
">In physics, the twin paradox is a thought experiment in special relativity involving identical twins, one of whom makes a journey into space in a high-speed rocket and returns home to find that the twin who remained on Earth has aged more. This result appears puzzling because each twin sees the other twin as moving, and so, according to an incorrect and naive application of time dilation and the principle of relativity, each should paradoxically find the other to have aged less.

This is literally the same as the clocks. The space twin finds that the earth twin has aged more. but according to relativity, the space twin must have aged more, since the earth is moving and the rocket is still. PARADOX!

>the travelling twin's trajectory involves two different inertial frames, one for the outbound journey and one for the inbound journey, and so there is no symmetry between the spacetime paths of the twins. Therefore, the twin paradox is not a paradox in the sense of a logical contradiction.

Other solutions are given on that page, so please do read it. If you have already, um... again, perhaps?

c'mon, you're the one proposing Airy's failure here. I did my research, and found that for the theory to work it needs the aether. Almost all the sites i visited have some reference to the aether, without describing what it is or its properties... I assumed it is the luminiferous aether, which WAS debunked. According to the video from my previous post. If that video is wrong about Airy's failure, please, please say what and where, and guide me towards a more accurate source. At around the 2.37 mark on that video, he completely disregards refraction in his model.

>but that is simply not true.

An explanation, please!";1;1;False;Techguy10110;dr1ai1g;Official Endorsement: Luke (core dev) prefers BCH over LTC for exchange;7iq51j;https://i.redd.it/7av4xf7taz201.jpg
Sure thing.;1;0;False;threesixzero;dr1e7tj;Official Endorsement: Luke (core dev) prefers BCH over LTC for exchange;7iq51j;https://i.redd.it/7av4xf7taz201.jpg
"Again, your twin paradox doesn't disprove my point. According to that wiki, the person who stayed on Earth would have aged more - **but, according to relativity, if you considered the rocket being still and the Earth moving away from the rocket, then the person on the rocket would have aged more**. This is the 3rd time I'm saying this now, I hope you get it. This disproves relativity because it obviously can't be both.

>I did my research, and found that for the theory to work it needs the aether.

Lol what research? You're claiming it needs the ether but not explaining why. Anyone can make a claim without backing it up. Airy's failure has absolutely nothing to do with the ether and the findings of the experiment are true *whether or not the ether exists*.

>he completely disregards refraction 

Refraction was taken into account. Here is the original paper by [George Airy](http://rspl.royalsocietypublishing.org/content/20/130-138/35.full.pdf+html).

>An explanation, please!

I'm done trying to show you something you don't want to see. Already wasted too much time talking to a brick wall. It's easy making assertions without backing them up, you should focus more on showing why the experiment was wrong. I have looked into it quite a bit and it has never been debunked, and there are other experiments too...";1;1;False;threesixzero;dr1aroy;Official Endorsement: Luke (core dev) prefers BCH over LTC for exchange;7iq51j;https://i.redd.it/7av4xf7taz201.jpg
"It can be both because it is Different. Inertial. Frames. It's kinda hard to wrap your mind around, but c'mon.

Thanks for the paper. I'll have to go through it. Weird how I didn't find it earlier.";1;1;False;Techguy10110;dr1bknk;Official Endorsement: Luke (core dev) prefers BCH over LTC for exchange;7iq51j;https://i.redd.it/7av4xf7taz201.jpg
">It can be both because it is Different. Inertial. Frames.

Ok, so you're saying that the twin on Earth would be younger than the twin on the rocket and the twin on the rocket would be younger than the twin on Earth? Both would be younger than each other? And both would also be older than each other?

Cool, got it. Relativity totally DOES make sense and has not been debunked at all.";1;1;False;threesixzero;dr1bouq;Official Endorsement: Luke (core dev) prefers BCH over LTC for exchange;7iq51j;https://i.redd.it/7av4xf7taz201.jpg
Dude. Just read that wikipedia article. I say it can be both, depending on which frame of reference you are talking about. YOU HAVE TO APPLY RELATIVITY SEPERATELY FOR THE TWO FRAMES OF REFERENCES. So it's not as simple as saying the twin on Earth would be younger than the twin on the rocket and the twin on the rocket would be younger than the twin on Earth. Math's a bit too complicated for me, but. You haven't debunked a single thing from that page.;1;1;False;Techguy10110;dr1bysp;Official Endorsement: Luke (core dev) prefers BCH over LTC for exchange;7iq51j;https://i.redd.it/7av4xf7taz201.jpg
">Math's a bit too complicated for me

Yeah, that's quite an easy way to cop out of giving an actual explanation. If you say that one wouldn't be younger than the other, *you are denying time dilation*. If you can accept that one would be younger than the other, *you are denying relativity*. It's quite simple really, doesn't need to be as complicated as you are making it. If you can actually explain the ""paradox"", please, do so.

In many cases, [scientists will find all sorts of weird ways to explain away problems of their faulty theories](http://izquotes.com/quotes-pictures/quote-today-s-scientists-have-substituted-mathematics-for-experiments-and-they-wander-off-through-nikola-tesla-183687.jpg) just so they don't have to admit the stuff they were working on for so long was all wrong. This seems to be one of those cases.";1;1;False;threesixzero;dr1c9lk;Official Endorsement: Luke (core dev) prefers BCH over LTC for exchange;7iq51j;https://i.redd.it/7av4xf7taz201.jpg
"One would be younger than the other when computed from frame of reference A. one would be still younger than the other when computed from f.o.r B. If you compute twice from the same frame of reference it gives you a nonsense answer, a paradox. That's why you need frames of reference in the first place!

>just so they don't have to admit the stuff they were working on for so long was all wrong

Mate you prove Einstein was wrong and the next nobel prize is yours. No question. Science is built upon proving others wrong. What is relativity in the first place? It was formed because newton's laws were not enough. Quantum physics? Same deal. Chemistry. everyone worked to prove J.J.Thompson and his plum pudding model of the atom wrong. Electron shells and hybridization and bonds and..... Everyone is out to prove the other wrong. That's how you get famous.

If you think it's a copout, i'm sorry. There's nothing I can do. Modern physics really is math heavy because experimentation is not really feasible. Going to lightspeed? not feasible.

But if you truly believe that you have a better theory, PUBLISH IT.

In any case, thanks for that paper. It's interesting, and I need time to process it.";1;1;False;Techguy10110;dr1ciyo;Official Endorsement: Luke (core dev) prefers BCH over LTC for exchange;7iq51j;https://i.redd.it/7av4xf7taz201.jpg
">If you compute twice from the same frame of reference it gives you a nonsense answer

Ok, so when the rocket comes back to Earth and they are in the same frame of reference - which one is older? 

>Mate you prove Einstein was wrong and the next nobel prize is yours. No question.

Look at my original big reply where I talk about what happened to Halton Arp after he disproved the foundation of the big bang theory. Scientists who go against the narrative are ostracized and their papers do not get peer-reviewed or published in journals. Science is supposed to be the pursuit for truth wherever it leads but it is definitely corrupted (or else Arp wouldn't have had to flee to Europe to continue work). There is an establishment in science as much as there is an establishment in politics.

In any case, not even one of the proofs I provided have been debunked.";1;1;False;threesixzero;dr1cmzg;Official Endorsement: Luke (core dev) prefers BCH over LTC for exchange;7iq51j;https://i.redd.it/7av4xf7taz201.jpg
"The one on earth is older.

Prove it, you say.

I can't, the math is beyond me.

That's a copout, you say.

I'm aware of it, and there's nothing I can do, unfortunately. Sorry.

Halton Arp... I read about him.. He proposed redshift quantization as an explanation for redshifting of galaxies, based on quasars being often found near closer spiral galaxies. There seems to have been a debate between him and John Bahcall, it's in the book The Red Limit, which I can't seem to find online... maybe you'll have better luck? The [NY Times](https://www.nytimes.com/2014/01/07/science/space/halton-c-arp-astronomer-who-challenged-big-bang-theory-dies-at-86.html) says that Arp was demolished in the debate, but I won't take that position since I haven't read the book.

It is strange how nobody talks about him and his research..

Can't say I disagree with there being an establishment in science... For example newton's laws are the establishment!";1;1;False;Techguy10110;dr1djtr;Official Endorsement: Luke (core dev) prefers BCH over LTC for exchange;7iq51j;https://i.redd.it/7av4xf7taz201.jpg
">That's a copout, you say.

You gave me an answer and that is not a cop-out, but here's the thing: if you consider the rocket being still and the Earth moving away from the rocket and back towards the rocket, the man on the rocket would be the older one. According to relativity, we can look at it both ways, so how could either one be older than the other? How would the one on Earth be older? There is no math required, relativity can be debunked without math.

>The NY Times says that Arp was demolished in the debate

Mainstream media also said Iraq had weapons of mass destruction and Osama did 9/11. Mainstream sources have a bias.

>It is strange how nobody talks about him and his research..

Not all that strange when you start seeing how much they are wrong about. I would go so far as to say it is an actual deception. What they do isn't real science. There are scientists who have started going their own route apart from the core group because the mainstream scientists are so obviously corrupted and biased, unable to let go of their older faulty theories.

In case you didn't see it, I linked to [this webpage](http://electric-cosmos.org/arp.htm) that gives a quick summary of what Arp discovered. Also, there is an excellent YouTube channel called ""ThunderboltsProject"" - the dude who runs the channel is very knowledgeable and he does an excellent job of pointing out all the faults with the accepted narrative as well as offering alternative theories. [Here is one good video](https://www.youtube.com/watch?v=ykOa2Kfyej0) they put out recently talking about how wrong the mainstream science is when it comes to comets and asteroids. It can get kinda complicated and I often find myself rewinding it cuz it sometimes flies right over my head but it is super interesting. Not sure if the guy is a geocentrist but I wouldn't be surprised if he is.";1;1;False;threesixzero;dr1dz3e;Official Endorsement: Luke (core dev) prefers BCH over LTC for exchange;7iq51j;https://i.redd.it/7av4xf7taz201.jpg
