body;score;nb_replies;stickied;author;id;post_title;post_id;post_link
Thanks this helped;1;0;False;Ogthugbonee;dr17nzc;As of today, Steam will no longer support Bitcoin as a payment method;7hzklb;https://twitter.com/SteamDB/status/938459631449493504
When will it pop. Will we see 1k before  100k;1;0;False;Xearoii;dr1l4ss;As of today, Steam will no longer support Bitcoin as a payment method;7hzklb;https://twitter.com/SteamDB/status/938459631449493504
stocks and bonds is betting fiat has a better risk profile than bitcoin...;1;0;False;HappyMoneyMan;dr13tm4;As of today, Steam will no longer support Bitcoin as a payment method;7hzklb;https://twitter.com/SteamDB/status/938459631449493504
There’s no such thing as converting bitcoin to USD. If you have bitcoin and you want USD you have to find someone that wants bitcoin and has USD, and then you trade. There are exchanges that do this for you. The same amount of bitcoin and USD existed at the beginning and end of the transaction, nothing was destroyed or created. Likewise if you have fake USDT and you want bitcoin, you have to find someone that has bitcoin and wants USDT, and you trade. You recieve someone else’s bit coin and some else gets the fake USDT, so now there’s more USDT than their used to be. This scam would never increase the amount of bitcoin or USD, only the USDT.;3;0;False;cleverusername10;dr0uzil;Guess who controls over half a billion Tethers across 3 exchanges—over 73% of USDT currently in circulation.;7ih0hd;https://www.reddit.com/r/btc/comments/7ih0hd/guess_who_controls_over_half_a_billion_tethers/
"Ok I don't think you're getting what I'm saying. 

Somebody prints as much USDT as they want, which is worth nothing. They then use it to buy Bitcoin, which is worth something. They then send Bitcoin to an exchange that has real dollars and convert it to real USD. Boom, they just turned fake money into real money.";1;1;False;whatsausername90;dr0u8g7;Guess who controls over half a billion Tethers across 3 exchanges—over 73% of USDT currently in circulation.;7ih0hd;https://www.reddit.com/r/btc/comments/7ih0hd/guess_who_controls_over_half_a_billion_tethers/
Crush it, profit off it, ban it, use it for yourself. Makes sense to me.;2;0;False;StillDontHaveAReddit;dr0o7jm;Guess who controls over half a billion Tethers across 3 exchanges—over 73% of USDT currently in circulation.;7ih0hd;https://www.reddit.com/r/btc/comments/7ih0hd/guess_who_controls_over_half_a_billion_tethers/
There’s no way that random people outside of the federal reserve can make more USD. It just isn’t possible. They can scam others out of their USD but only the federal reserve can make new ones. You guys are on witch hunts with no idea how anything works. USDT is something that some guy made up. Making fake USDT doesn’t change anything on the Federal Reserve’s books and cannot create USD. USD has nothing to do with USDT outside of what some random guy says about it.;3;1;False;cleverusername10;dr0svsm;Guess who controls over half a billion Tethers across 3 exchanges—over 73% of USDT currently in circulation.;7ih0hd;https://www.reddit.com/r/btc/comments/7ih0hd/guess_who_controls_over_half_a_billion_tethers/
"Haha no at all. The tether hack is very sketchy and I don't buy any of the company line. I watch Tether closely because I am a trader and I think it is important to understand. All I am trying to do is present plausible answers to questions. As the saying goes  ""Never attribute to malice that which is adequately explained by stupidity.""

In this case I don't think it is stupidity but I believe that the default assumption about Tether is ""Tether is shady"" when many tether questions can be explained without conspiracy theories.";2;1;False;phd-oak;dr0v55m;Guess who controls over half a billion Tethers across 3 exchanges—over 73% of USDT currently in circulation.;7ih0hd;https://www.reddit.com/r/btc/comments/7ih0hd/guess_who_controls_over_half_a_billion_tethers/
Shitty and possibly malicious.;1;0;False;Tooluka;dr17og4;Guess who controls over half a billion Tethers across 3 exchanges—over 73% of USDT currently in circulation.;7ih0hd;https://www.reddit.com/r/btc/comments/7ih0hd/guess_who_controls_over_half_a_billion_tethers/
"I was thinking about this more and I also wonder if the recovery will be slower than it otherwise would be because some % of would-be investors are going to stay out of it because it's unregulated. ""Don't bother investing in crypto - they can take your money and nobody can do anything about it.""

Or governments push for regulation which keeps legit exchanges from getting involved, which would also push the price down.

I don't think this is a long-term problem, but it's not hard to imagine a scenario where it significantly inhibits the recovery in the short- and intermediate-term. But it's obviously super to predict what's going to happen with so many different factors. ";2;0;False;zbeg;dr0lli6;Guess who controls over half a billion Tethers across 3 exchanges—over 73% of USDT currently in circulation.;7ih0hd;https://www.reddit.com/r/btc/comments/7ih0hd/guess_who_controls_over_half_a_billion_tethers/
"I should be careful branding it as a ""call option"", given we're talking about futures. It will be made available on the Chicago mercantile exchange, as a means of locking in the future price of the asset. 

Step number one is opening a brokerage account. You may want to use Fidelity, as their fees are more acceptable in my opinion. Then you will need to wait until these derivatives are actually listed there. With your money in fiat, you can expect to pay a premium of anywhere between 5-10 % for a 2-3 months futures contract.

Btw. You can also purchase this at OKex.com, but you will need a VPN as they do not accept traders from the US and will ban you based on your IP address. Tether poses a systemic risk to the Bitcoin economy, and you're being very wise in exploring ways of mitigating that risk. 

Best of luck. 
";3;0;False;llindstad;dr0psel;Guess who controls over half a billion Tethers across 3 exchanges—over 73% of USDT currently in circulation.;7ih0hd;https://www.reddit.com/r/btc/comments/7ih0hd/guess_who_controls_over_half_a_billion_tethers/
"I don't know which country you're based in, but you will need a brokerage account to access the US capital market. The new futures contracts will be traded on the Chicago mercantile exchange. 

There's a difference between call options and futures, which you should read up on. See this article for an approximate timeline and more information. 
http://www.abc.net.au/news/2017-11-07/bitcoin-is-going-mainstream/9125364";3;0;False;llindstad;dr0plgn;Guess who controls over half a billion Tethers across 3 exchanges—over 73% of USDT currently in circulation.;7ih0hd;https://www.reddit.com/r/btc/comments/7ih0hd/guess_who_controls_over_half_a_billion_tethers/
Successfully transferred 3 mBCH ($4.24) to /u/peptocurrency.;1;0;False;FairlayTip;dr0jub3;Guess who controls over half a billion Tethers across 3 exchanges—over 73% of USDT currently in circulation.;7ih0hd;https://www.reddit.com/r/btc/comments/7ih0hd/guess_who_controls_over_half_a_billion_tethers/
"You do realize that when the shit hits the fan, you're famous.
";1;0;False;StillDontHaveAReddit;dr0nnfw;Guess who controls over half a billion Tethers across 3 exchanges—over 73% of USDT currently in circulation.;7ih0hd;https://www.reddit.com/r/btc/comments/7ih0hd/guess_who_controls_over_half_a_billion_tethers/
Thank you for that, friend! :);1;0;False;peptocurrency;dr1zb7l;Guess who controls over half a billion Tethers across 3 exchanges—over 73% of USDT currently in circulation.;7ih0hd;https://www.reddit.com/r/btc/comments/7ih0hd/guess_who_controls_over_half_a_billion_tethers/
What about Poloniex? Are they in on this scam ?;2;1;False;Thavash;dr1at7g;Guess who controls over half a billion Tethers across 3 exchanges—over 73% of USDT currently in circulation.;7ih0hd;https://www.reddit.com/r/btc/comments/7ih0hd/guess_who_controls_over_half_a_billion_tethers/
">Alright, so if Bitfinex-B belongs to a miner, what are they mining? They are receiving Tether to this address, which isn't a coin that's mined. Also, why does it receive hundreds of millions of Tether from Bitfinex-A?

No idea what they are mining but if you mine any coin transfer it to finex and then sell it for USD then choose to transfer it to another exchange, my understanding is that is done through tether.

>Except I've used Bittrex and any time I've deposited anything there, I can view it on the blockchain existing inside the address, having never been ""forwarded"" to another central wallet. If they're moving the coin after I deposit, how do they make it look like my deposit address still contains coin on the blockchain?

Are you talking about depositing USDT to Bittrex or some other coin?";4;1;False;phd-oak;dr0uz67;Guess who controls over half a billion Tethers across 3 exchanges—over 73% of USDT currently in circulation.;7ih0hd;https://www.reddit.com/r/btc/comments/7ih0hd/guess_who_controls_over_half_a_billion_tethers/
"If you have usdt tether, you are in a good position if prices fall further. If prices crash it will be a fire sale for those who have usdt. It's kind of ironic that those who have been listening to this tether crash nonsense, are the one's losing money, and those holding usdt are the ones making money.

If you worried and have usdt on an exchange, just move it. ";1;0;False;cid42;dr0tc30;Guess who controls over half a billion Tethers across 3 exchanges—over 73% of USDT currently in circulation.;7ih0hd;https://www.reddit.com/r/btc/comments/7ih0hd/guess_who_controls_over_half_a_billion_tethers/
"It might not be miners, but the reason I think it is because its serialized, repetitive, and occurs on a somewhat regular schedule regardless of market conditions. If it was miners I would imagine that the main benefit they would get from sending their coins to Bitfinex as opposed to Bittrex would be Finex's lending market which would allow them to lend out whatever they were mining and earn a return on it before selling or while they were waiting to sell.

I don't know a lot of specifics of on how Bittrex handles deposits of other currencies, but if it is as you described then yes I am saying that they handle USDT deposits differently. It seems that way to me at lesat, but this could be easily cleared up by someone that works at Bittrex. As for why? I think it makes sense from a security perspective for the exchanges to hold all tether in their own wallets because Tether is essentially a centralized private service. It doesn't really matter if the exchange wallet gets hacked because they can just blaklist/freeze all the tether from the hack like they did with the recent Treasury ""hack"". If you figured out some exploit that allowed you to steal 100M out of the Bittrex hot wallet there is 0% chance you would ever see a dime of that money because you have to be fully verified to deposit or withdraw tether. Even if you could ""hack"" and exchange transfer it to another exchange fast enough to buy some other crypto before they catch on they could always go back and easily trace it down.";4;0;False;phd-oak;dr20lgg;Guess who controls over half a billion Tethers across 3 exchanges—over 73% of USDT currently in circulation.;7ih0hd;https://www.reddit.com/r/btc/comments/7ih0hd/guess_who_controls_over_half_a_billion_tethers/
Who knows? Maybe they are just happy to collect fees from Tether trading. To be safe, better don't leave too many coins on exchanges that deal with Teather.;1;0;False;earthmoonsun;dr1bg6c;Guess who controls over half a billion Tethers across 3 exchanges—over 73% of USDT currently in circulation.;7ih0hd;https://www.reddit.com/r/btc/comments/7ih0hd/guess_who_controls_over_half_a_billion_tethers/
"So are you saying someone is mining hundreds of millions worth of some cryptocurrency, transferring it to Bitfinex and selling it for Tether, to transfer to their Bittrex account? If your plan is to mine cryptocurrency and send it to Bittrex, why don't you just send it to Bittrex? Either way you have to wait for confirmations. Why go through Bitfinex first? 

I've only ever transferred non-USDT cryptocurrency to Bittrex, so that's what I'm talking about. Why would they treat USDT differently? Doesn't that add an extra layer of unnecessary complication to have a pool of Tether instead of allowing each user control their own portion?";7;1;False;peptocurrency;dr1z79w;Guess who controls over half a billion Tethers across 3 exchanges—over 73% of USDT currently in circulation.;7ih0hd;https://www.reddit.com/r/btc/comments/7ih0hd/guess_who_controls_over_half_a_billion_tethers/
Everything is a sea of red. There must have been a lot of Tethers purchased. Let's see what happens when everyone tries to convert them back to more BTC than they put in. I guess it depends how deep this dip is.;1;0;False;drzood;dr18l9r;Guess who controls over half a billion Tethers across 3 exchanges—over 73% of USDT currently in circulation.;7ih0hd;https://www.reddit.com/r/btc/comments/7ih0hd/guess_who_controls_over_half_a_billion_tethers/
SO, how does Binance's over $200 mil trading volume play into all of this?  All of this smells of fish...;1;0;False;funzanoon;dr11iwx;Guess who controls over half a billion Tethers across 3 exchanges—over 73% of USDT currently in circulation.;7ih0hd;https://www.reddit.com/r/btc/comments/7ih0hd/guess_who_controls_over_half_a_billion_tethers/
Ahhh, I love the guy. Set up the shittiest of exchanges that ever existed and had a 50BTC sign-up fee. Bet he still laughs about his customers.;2;0;False;ABoutDeSouffle;dr23ibs;Two biggest Bitcoin subs according to their counterparts (posted on both subs);6rjzqz;https://i.redd.it/lkxqrbydnpdz.png
"> Blockstream is funded by a banking group, this is an actual fact 

Wow, so you say (((they))) set up Core to destroy bitcoin?";1;0;False;ABoutDeSouffle;dr24282;Two biggest Bitcoin subs according to their counterparts (posted on both subs);6rjzqz;https://i.redd.it/lkxqrbydnpdz.png
I see what they're trying to do :D;19;3;False;Node011;dr1a0v7;"President of SBI Holdings: ""The vision of the original Bitcoin white paper written by Satoshi Nakamoto calls for a peer-to-peer electronic cash system. That is a powerful vision, and SBI Group will devote resources to enable a future world where Bitcoin Cash is used globally for daily payments.""";7itd1k;https://www.prnewswire.com/news-releases/sbi-bits-and-nchain-announce-strategic-partnership-to-support-cryptocurrency-security-and-bitcoin-cash-300567948.html
Seeing the groupthink here against your reasonable comment is sad. How do people not know that free markets lead to Nestle killing babies and Coca Cola murdering union leaders? Also, people stop downvoting comments you disagree with.;24;1;False;Poromenos;dr1dqnp;"President of SBI Holdings: ""The vision of the original Bitcoin white paper written by Satoshi Nakamoto calls for a peer-to-peer electronic cash system. That is a powerful vision, and SBI Group will devote resources to enable a future world where Bitcoin Cash is used globally for daily payments.""";7itd1k;https://www.prnewswire.com/news-releases/sbi-bits-and-nchain-announce-strategic-partnership-to-support-cryptocurrency-security-and-bitcoin-cash-300567948.html
Can we please get a Supreme Court ruling on this heinous, unjust act??;1;0;False;Herculix;dr21dt6;"President of SBI Holdings: ""The vision of the original Bitcoin white paper written by Satoshi Nakamoto calls for a peer-to-peer electronic cash system. That is a powerful vision, and SBI Group will devote resources to enable a future world where Bitcoin Cash is used globally for daily payments.""";7itd1k;https://www.prnewswire.com/news-releases/sbi-bits-and-nchain-announce-strategic-partnership-to-support-cryptocurrency-security-and-bitcoin-cash-300567948.html
Temporarily ;-1;0;False;H0dl;dr1crza;"President of SBI Holdings: ""The vision of the original Bitcoin white paper written by Satoshi Nakamoto calls for a peer-to-peer electronic cash system. That is a powerful vision, and SBI Group will devote resources to enable a future world where Bitcoin Cash is used globally for daily payments.""";7itd1k;https://www.prnewswire.com/news-releases/sbi-bits-and-nchain-announce-strategic-partnership-to-support-cryptocurrency-security-and-bitcoin-cash-300567948.html
"He said that markets will 'always and forever arrive at the correct decision'

That implies that the market does not make a bad decision.";6;3;False;midipoet;dr1crxz;"President of SBI Holdings: ""The vision of the original Bitcoin white paper written by Satoshi Nakamoto calls for a peer-to-peer electronic cash system. That is a powerful vision, and SBI Group will devote resources to enable a future world where Bitcoin Cash is used globally for daily payments.""";7itd1k;https://www.prnewswire.com/news-releases/sbi-bits-and-nchain-announce-strategic-partnership-to-support-cryptocurrency-security-and-bitcoin-cash-300567948.html
Please show me a free market then, one free of any macro influence. Get real. This isn't perfect economics playing out here.;23;3;False;midipoet;dr1cu5o;"President of SBI Holdings: ""The vision of the original Bitcoin white paper written by Satoshi Nakamoto calls for a peer-to-peer electronic cash system. That is a powerful vision, and SBI Group will devote resources to enable a future world where Bitcoin Cash is used globally for daily payments.""";7itd1k;https://www.prnewswire.com/news-releases/sbi-bits-and-nchain-announce-strategic-partnership-to-support-cryptocurrency-security-and-bitcoin-cash-300567948.html
I dunno man... They get bought, bred, sold, separated from their family, and forgotten about for days.;2;1;False;Nephyst;dr1yrms;"President of SBI Holdings: ""The vision of the original Bitcoin white paper written by Satoshi Nakamoto calls for a peer-to-peer electronic cash system. That is a powerful vision, and SBI Group will devote resources to enable a future world where Bitcoin Cash is used globally for daily payments.""";7itd1k;https://www.prnewswire.com/news-releases/sbi-bits-and-nchain-announce-strategic-partnership-to-support-cryptocurrency-security-and-bitcoin-cash-300567948.html
They have limited supply, and there is huge wealth inequality;-2;1;False;WeranioRacker;dr21kxm;"President of SBI Holdings: ""The vision of the original Bitcoin white paper written by Satoshi Nakamoto calls for a peer-to-peer electronic cash system. That is a powerful vision, and SBI Group will devote resources to enable a future world where Bitcoin Cash is used globally for daily payments.""";7itd1k;https://www.prnewswire.com/news-releases/sbi-bits-and-nchain-announce-strategic-partnership-to-support-cryptocurrency-security-and-bitcoin-cash-300567948.html
Zcash fork;9;0;False;KrakenPipe;dr1ojou;"President of SBI Holdings: ""The vision of the original Bitcoin white paper written by Satoshi Nakamoto calls for a peer-to-peer electronic cash system. That is a powerful vision, and SBI Group will devote resources to enable a future world where Bitcoin Cash is used globally for daily payments.""";7itd1k;https://www.prnewswire.com/news-releases/sbi-bits-and-nchain-announce-strategic-partnership-to-support-cryptocurrency-security-and-bitcoin-cash-300567948.html
"Whash.

***

^(Bleep-bloop, I'm a bot. This )^[portmanteau](https://en.wikipedia.org/wiki/Portmanteau) ^( was created from the phrase 'Whats bcash?'. To learn more about me, check out this )^[FAQ](https://www.reddit.com/78ilq0).";2;0;False;PORTMANTEAU-BOT;dr22dbw;"President of SBI Holdings: ""The vision of the original Bitcoin white paper written by Satoshi Nakamoto calls for a peer-to-peer electronic cash system. That is a powerful vision, and SBI Group will devote resources to enable a future world where Bitcoin Cash is used globally for daily payments.""";7itd1k;https://www.prnewswire.com/news-releases/sbi-bits-and-nchain-announce-strategic-partnership-to-support-cryptocurrency-security-and-bitcoin-cash-300567948.html
"He did not say markets don't make bad decisions.
";4;2;False;Rawbert;dr1ca0n;"President of SBI Holdings: ""The vision of the original Bitcoin white paper written by Satoshi Nakamoto calls for a peer-to-peer electronic cash system. That is a powerful vision, and SBI Group will devote resources to enable a future world where Bitcoin Cash is used globally for daily payments.""";7itd1k;https://www.prnewswire.com/news-releases/sbi-bits-and-nchain-announce-strategic-partnership-to-support-cryptocurrency-security-and-bitcoin-cash-300567948.html
"Free markets =/= markets.
And ""Arrive at the correct decision"" probably means that bad/incorrect decisions have to be made to know the right decisions.";7;1;False;-uncle-jimbo-;dr1c1i9;"President of SBI Holdings: ""The vision of the original Bitcoin white paper written by Satoshi Nakamoto calls for a peer-to-peer electronic cash system. That is a powerful vision, and SBI Group will devote resources to enable a future world where Bitcoin Cash is used globally for daily payments.""";7itd1k;https://www.prnewswire.com/news-releases/sbi-bits-and-nchain-announce-strategic-partnership-to-support-cryptocurrency-security-and-bitcoin-cash-300567948.html
"I am so with you on this.

Decisions are relatively isolated, but impacts are widespread, and not easily predicted.

It's so easy to make a decision which seems like the correct one, but in the grand scheme of things is a *horrible* idea.";6;0;False;laskdfe;dr1g779;"President of SBI Holdings: ""The vision of the original Bitcoin white paper written by Satoshi Nakamoto calls for a peer-to-peer electronic cash system. That is a powerful vision, and SBI Group will devote resources to enable a future world where Bitcoin Cash is used globally for daily payments.""";7itd1k;https://www.prnewswire.com/news-releases/sbi-bits-and-nchain-announce-strategic-partnership-to-support-cryptocurrency-security-and-bitcoin-cash-300567948.html
Monitoring, sure. And enforcing, sometimes, a little bit. But it is mostly a free market. So is crypto but crypto is even closer to free. I don't feel like arguing about it either. ;0;0;False;poorbrokebastard;dr1r9as;"President of SBI Holdings: ""The vision of the original Bitcoin white paper written by Satoshi Nakamoto calls for a peer-to-peer electronic cash system. That is a powerful vision, and SBI Group will devote resources to enable a future world where Bitcoin Cash is used globally for daily payments.""";7itd1k;https://www.prnewswire.com/news-releases/sbi-bits-and-nchain-announce-strategic-partnership-to-support-cryptocurrency-security-and-bitcoin-cash-300567948.html
[deleted];7;1;False;;dr1mc4r;"President of SBI Holdings: ""The vision of the original Bitcoin white paper written by Satoshi Nakamoto calls for a peer-to-peer electronic cash system. That is a powerful vision, and SBI Group will devote resources to enable a future world where Bitcoin Cash is used globally for daily payments.""";7itd1k;https://www.prnewswire.com/news-releases/sbi-bits-and-nchain-announce-strategic-partnership-to-support-cryptocurrency-security-and-bitcoin-cash-300567948.html
shill bch on r/btc 💁;-7;1;False;SamSlate;dr1vx3f;"President of SBI Holdings: ""The vision of the original Bitcoin white paper written by Satoshi Nakamoto calls for a peer-to-peer electronic cash system. That is a powerful vision, and SBI Group will devote resources to enable a future world where Bitcoin Cash is used globally for daily payments.""";7itd1k;https://www.prnewswire.com/news-releases/sbi-bits-and-nchain-announce-strategic-partnership-to-support-cryptocurrency-security-and-bitcoin-cash-300567948.html
The cannabis industry in a lot of states, crypto is still relatively free market ;4;1;False;poorbrokebastard;dr1l3zx;"President of SBI Holdings: ""The vision of the original Bitcoin white paper written by Satoshi Nakamoto calls for a peer-to-peer electronic cash system. That is a powerful vision, and SBI Group will devote resources to enable a future world where Bitcoin Cash is used globally for daily payments.""";7itd1k;https://www.prnewswire.com/news-releases/sbi-bits-and-nchain-announce-strategic-partnership-to-support-cryptocurrency-security-and-bitcoin-cash-300567948.html
it’s not? what is that;2;0;False;wsjwong;dr1e13z;"President of SBI Holdings: ""The vision of the original Bitcoin white paper written by Satoshi Nakamoto calls for a peer-to-peer electronic cash system. That is a powerful vision, and SBI Group will devote resources to enable a future world where Bitcoin Cash is used globally for daily payments.""";7itd1k;https://www.prnewswire.com/news-releases/sbi-bits-and-nchain-announce-strategic-partnership-to-support-cryptocurrency-security-and-bitcoin-cash-300567948.html
You're witnessing one with cryptocurrencies.;0;1;False;BlenderdickCockletit;dr1mnab;"President of SBI Holdings: ""The vision of the original Bitcoin white paper written by Satoshi Nakamoto calls for a peer-to-peer electronic cash system. That is a powerful vision, and SBI Group will devote resources to enable a future world where Bitcoin Cash is used globally for daily payments.""";7itd1k;https://www.prnewswire.com/news-releases/sbi-bits-and-nchain-announce-strategic-partnership-to-support-cryptocurrency-security-and-bitcoin-cash-300567948.html
