body;score;nb_replies;stickied;author;id;post_title;post_id;post_link
"> Free markets will always and forever arrive at the correct decision.

What are you on about? Are you saying that markets have not made bad/incorrect decisions? 

Seriously?";34;3;False;midipoet;dr1bslc;"President of SBI Holdings: ""The vision of the original Bitcoin white paper written by Satoshi Nakamoto calls for a peer-to-peer electronic cash system. That is a powerful vision, and SBI Group will devote resources to enable a future world where Bitcoin Cash is used globally for daily payments.""";7itd1k;https://www.prnewswire.com/news-releases/sbi-bits-and-nchain-announce-strategic-partnership-to-support-cryptocurrency-security-and-bitcoin-cash-300567948.html
Yuge!;0;0;False;silverminers;dr1ww5z;"President of SBI Holdings: ""The vision of the original Bitcoin white paper written by Satoshi Nakamoto calls for a peer-to-peer electronic cash system. That is a powerful vision, and SBI Group will devote resources to enable a future world where Bitcoin Cash is used globally for daily payments.""";7itd1k;https://www.prnewswire.com/news-releases/sbi-bits-and-nchain-announce-strategic-partnership-to-support-cryptocurrency-security-and-bitcoin-cash-300567948.html
ok;0;0;False;;dr1vlwz;"President of SBI Holdings: ""The vision of the original Bitcoin white paper written by Satoshi Nakamoto calls for a peer-to-peer electronic cash system. That is a powerful vision, and SBI Group will devote resources to enable a future world where Bitcoin Cash is used globally for daily payments.""";7itd1k;https://www.prnewswire.com/news-releases/sbi-bits-and-nchain-announce-strategic-partnership-to-support-cryptocurrency-security-and-bitcoin-cash-300567948.html
uh oh! better downvote this guy for pointing out a flaw in the marketing message!;0;0;False;SamSlate;dr1w1f9;"President of SBI Holdings: ""The vision of the original Bitcoin white paper written by Satoshi Nakamoto calls for a peer-to-peer electronic cash system. That is a powerful vision, and SBI Group will devote resources to enable a future world where Bitcoin Cash is used globally for daily payments.""";7itd1k;https://www.prnewswire.com/news-releases/sbi-bits-and-nchain-announce-strategic-partnership-to-support-cryptocurrency-security-and-bitcoin-cash-300567948.html
No, we have to say it because of propaganda and censorship, lies, and dirty tricks have swayed the political climate, and brainwashed many people and newbs.;4;0;False;cryptorebel;dr1yby7;"President of SBI Holdings: ""The vision of the original Bitcoin white paper written by Satoshi Nakamoto calls for a peer-to-peer electronic cash system. That is a powerful vision, and SBI Group will devote resources to enable a future world where Bitcoin Cash is used globally for daily payments.""";7itd1k;https://www.prnewswire.com/news-releases/sbi-bits-and-nchain-announce-strategic-partnership-to-support-cryptocurrency-security-and-bitcoin-cash-300567948.html
it's because there is so much censorship for newcomers that they have no idea why their bitcoin isn't anything like what htye were told bitocin was supposed to be like;11;0;False;siir;dr1vfgz;"President of SBI Holdings: ""The vision of the original Bitcoin white paper written by Satoshi Nakamoto calls for a peer-to-peer electronic cash system. That is a powerful vision, and SBI Group will devote resources to enable a future world where Bitcoin Cash is used globally for daily payments.""";7itd1k;https://www.prnewswire.com/news-releases/sbi-bits-and-nchain-announce-strategic-partnership-to-support-cryptocurrency-security-and-bitcoin-cash-300567948.html
This argument goes both ways. If Bitcoin ends up winning, that’s simply market action. ;0;0;False;AfroKona;dr1p8h9;"President of SBI Holdings: ""The vision of the original Bitcoin white paper written by Satoshi Nakamoto calls for a peer-to-peer electronic cash system. That is a powerful vision, and SBI Group will devote resources to enable a future world where Bitcoin Cash is used globally for daily payments.""";7itd1k;https://www.prnewswire.com/news-releases/sbi-bits-and-nchain-announce-strategic-partnership-to-support-cryptocurrency-security-and-bitcoin-cash-300567948.html
Desperate and delusional;0;0;False;dovahkid;dr1nup2;"President of SBI Holdings: ""The vision of the original Bitcoin white paper written by Satoshi Nakamoto calls for a peer-to-peer electronic cash system. That is a powerful vision, and SBI Group will devote resources to enable a future world where Bitcoin Cash is used globally for daily payments.""";7itd1k;https://www.prnewswire.com/news-releases/sbi-bits-and-nchain-announce-strategic-partnership-to-support-cryptocurrency-security-and-bitcoin-cash-300567948.html
Do it, no one's stopping you. ;21;0;False;infraspace;dr1j2cw;"President of SBI Holdings: ""The vision of the original Bitcoin white paper written by Satoshi Nakamoto calls for a peer-to-peer electronic cash system. That is a powerful vision, and SBI Group will devote resources to enable a future world where Bitcoin Cash is used globally for daily payments.""";7itd1k;https://www.prnewswire.com/news-releases/sbi-bits-and-nchain-announce-strategic-partnership-to-support-cryptocurrency-security-and-bitcoin-cash-300567948.html
if you followed the other concepts in the whitepaper and explained here: nakamotoinstitute.org then it would be considered a valid chain from when you split and then you would need to compete for hashpower for the longest valid chain;3;0;False;siir;dr1viuh;"President of SBI Holdings: ""The vision of the original Bitcoin white paper written by Satoshi Nakamoto calls for a peer-to-peer electronic cash system. That is a powerful vision, and SBI Group will devote resources to enable a future world where Bitcoin Cash is used globally for daily payments.""";7itd1k;https://www.prnewswire.com/news-releases/sbi-bits-and-nchain-announce-strategic-partnership-to-support-cryptocurrency-security-and-bitcoin-cash-300567948.html
Whats bcash?;3;1;False;Habulahabula;dr22clv;"President of SBI Holdings: ""The vision of the original Bitcoin white paper written by Satoshi Nakamoto calls for a peer-to-peer electronic cash system. That is a powerful vision, and SBI Group will devote resources to enable a future world where Bitcoin Cash is used globally for daily payments.""";7itd1k;https://www.prnewswire.com/news-releases/sbi-bits-and-nchain-announce-strategic-partnership-to-support-cryptocurrency-security-and-bitcoin-cash-300567948.html
">Bitcoin Cash will soar from the ashes of the post-realization crash, 
like the Phoenix Satoshi designed it to be.

Bwahaha, suuure. I've seen so many delusional subs/post over the years and this one is near the top.";-1;0;False;bathrobehero;dr1f2tg;"President of SBI Holdings: ""The vision of the original Bitcoin white paper written by Satoshi Nakamoto calls for a peer-to-peer electronic cash system. That is a powerful vision, and SBI Group will devote resources to enable a future world where Bitcoin Cash is used globally for daily payments.""";7itd1k;https://www.prnewswire.com/news-releases/sbi-bits-and-nchain-announce-strategic-partnership-to-support-cryptocurrency-security-and-bitcoin-cash-300567948.html
Good luck;1;0;False;gunpun33;dr1mzun;"President of SBI Holdings: ""The vision of the original Bitcoin white paper written by Satoshi Nakamoto calls for a peer-to-peer electronic cash system. That is a powerful vision, and SBI Group will devote resources to enable a future world where Bitcoin Cash is used globally for daily payments.""";7itd1k;https://www.prnewswire.com/news-releases/sbi-bits-and-nchain-announce-strategic-partnership-to-support-cryptocurrency-security-and-bitcoin-cash-300567948.html
What is Phoenix satoshi?;1;0;False;shiva8888888888;dr1gl6t;"President of SBI Holdings: ""The vision of the original Bitcoin white paper written by Satoshi Nakamoto calls for a peer-to-peer electronic cash system. That is a powerful vision, and SBI Group will devote resources to enable a future world where Bitcoin Cash is used globally for daily payments.""";7itd1k;https://www.prnewswire.com/news-releases/sbi-bits-and-nchain-announce-strategic-partnership-to-support-cryptocurrency-security-and-bitcoin-cash-300567948.html
I wouldn't be surprised if Satoshi was still around, programming for Bitcoin Cash under a different name. Seems like his style.;3;0;False;bitbubbly;dr1svwh;"President of SBI Holdings: ""The vision of the original Bitcoin white paper written by Satoshi Nakamoto calls for a peer-to-peer electronic cash system. That is a powerful vision, and SBI Group will devote resources to enable a future world where Bitcoin Cash is used globally for daily payments.""";7itd1k;https://www.prnewswire.com/news-releases/sbi-bits-and-nchain-announce-strategic-partnership-to-support-cryptocurrency-security-and-bitcoin-cash-300567948.html
Bitcoin Cash already has a 32MB limit, which does not require a hard fork but just a mining configuration change to lift the current 8MB soft cap.  To go beyond 32MB we will need a further hard fork.  Bitcoin Cash is the true Bitcoin and eventually we will hard fork beyond 32MB and to the global world wide adoption.;3;1;False;cryptorebel;dr1y9oi;"President of SBI Holdings: ""The vision of the original Bitcoin white paper written by Satoshi Nakamoto calls for a peer-to-peer electronic cash system. That is a powerful vision, and SBI Group will devote resources to enable a future world where Bitcoin Cash is used globally for daily payments.""";7itd1k;https://www.prnewswire.com/news-releases/sbi-bits-and-nchain-announce-strategic-partnership-to-support-cryptocurrency-security-and-bitcoin-cash-300567948.html
if i was sitting with both, i would spend my inflationary fiat until i had no more left, then i would spend the deflationary crypto, but not with the same incentivized rabid consumerism that i would spend the inflationary fiat with.;1;1;False;felderosa;dr2400c;I'm giving away $100 each of BCH and BTC on live TV tomorrow by displaying the private key. Guess why?;7hutps;https://www.reddit.com/r/btc/comments/7hutps/im_giving_away_100_each_of_bch_and_btc_on_live_tv/
Actually I would love the ability to purchase just fee revenue from a miner's group. Yes, that's how fucked btc fee situation is right now.;1;0;False;User72733;dr20413;I'm giving away $100 each of BCH and BTC on live TV tomorrow by displaying the private key. Guess why?;7hutps;https://www.reddit.com/r/btc/comments/7hutps/im_giving_away_100_each_of_bch_and_btc_on_live_tv/
Western Union is now cheaper than bitcoin.;196;3;False;nothingduploading;dr1qtj0;Samson Mow says Bitcoin isn't for people earning less than $2 a day. With average transaction fees now at $27.20, is Bitcoin even for people earning less than $100 a day?;7ivvd7;https://twitter.com/beijingbitcoins/status/939924790625804288
">Leave $100 paper wallet at coffee shop

>Coffee shop can't steal coins because mempool

>Open tabs with coffee shop for each coffee

Lightning Network is already here and it's super low tech, even lower tech than our beloved /u/tippr. Checkmate, big-blockers!";40;3;False;imaginary_username;dr20rns;Samson Mow says Bitcoin isn't for people earning less than $2 a day. With average transaction fees now at $27.20, is Bitcoin even for people earning less than $100 a day?;7ivvd7;https://twitter.com/beijingbitcoins/status/939924790625804288
It's probably ok if you pay for a house or something >10 000$;4;3;False;slbbb;dr1x5wn;Samson Mow says Bitcoin isn't for people earning less than $2 a day. With average transaction fees now at $27.20, is Bitcoin even for people earning less than $100 a day?;7ivvd7;https://twitter.com/beijingbitcoins/status/939924790625804288
"This whole ""fees are too expensive for coffee"" argument is terrible. They can send a low fee and it can confirm later. You can give them the coffee after the broadcast is complete which is usually seconds. Theres not going to be an elaborate web of bitcoiners that go around scamming coffee shops lmfao.

71% of coffee shop customers are repeat customers. Scam them for $5 to lose access to your favorite coffee shop? Great idea.";-21;2;False;scamazon89;dr22pgp;Samson Mow says Bitcoin isn't for people earning less than $2 a day. With average transaction fees now at $27.20, is Bitcoin even for people earning less than $100 a day?;7ivvd7;https://twitter.com/beijingbitcoins/status/939924790625804288
You are underestimating the ideological urges of certain people who really, really wants to be their own bank, 20% fee is cheap for the libertarian privilege. ;-21;3;False;laforet;dr22hye;Samson Mow says Bitcoin isn't for people earning less than $2 a day. With average transaction fees now at $27.20, is Bitcoin even for people earning less than $100 a day?;7ivvd7;https://twitter.com/beijingbitcoins/status/939924790625804288
"Inside his world, people will wait indefinitely for their LN solution to be ready and not jump on the next thing that will fill the gap.

Andreas said it best (2015 vidéo). `The best tech doesn't win. The first tech that acheive network scale does`. 
https://www.youtube.com/watch?v=sE7998qfjgk&feature=youtu.be&t=1h16m37s

Bitcoin Core failed to achieve network scale, Eth seems to be cripple too... Bitcoin Cash is the next on the line.";12;3;False;Zyoman;dr1wc46;Samson Mow says Bitcoin isn't for people earning less than $2 a day. With average transaction fees now at $27.20, is Bitcoin even for people earning less than $100 a day?;7ivvd7;https://twitter.com/beijingbitcoins/status/939924790625804288
"You can send $0-5K on the Visa network through VISA Direct to anyone in the world instantly for a fee of around 0.5%. 

BTC is useless";15;2;False;v5F0210;dr1yhla;Samson Mow says Bitcoin isn't for people earning less than $2 a day. With average transaction fees now at $27.20, is Bitcoin even for people earning less than $100 a day?;7ivvd7;https://twitter.com/beijingbitcoins/status/939924790625804288
ahahaha;12;0;False;H0dl;dr21c7u;Samson Mow says Bitcoin isn't for people earning less than $2 a day. With average transaction fees now at $27.20, is Bitcoin even for people earning less than $100 a day?;7ivvd7;https://twitter.com/beijingbitcoins/status/939924790625804288
"u/BeijingBitcoins, your post was gilded in exchange for `0.00189531 BCH ($2.50 USD)`! Congratulations!
***
[^^How to use](https://np.reddit.com/r/tippr/wiki/index) ^^| [^^What is Bitcoin Cash?](https://learnbitcoin.cash/) ^^| [^^Who accepts it?](https://acceptbitcoin.cash) ^^| ^^Powered ^^by ^^[Rocketr](https://rocketr.net) ^^| ^^r/tippr  
^(Bitcoin Cash is what Bitcoin should be. Ask about it on r/btc)";2;0;False;tippr;dr1z2d1;Samson Mow says Bitcoin isn't for people earning less than $2 a day. With average transaction fees now at $27.20, is Bitcoin even for people earning less than $100 a day?;7ivvd7;https://twitter.com/beijingbitcoins/status/939924790625804288
Why would anyone, rich or poor, want to use a slower and expensive means of financial service? Imagine if a bank would boast about being slow and expensive, just for that Luxurious Feel™©.;13;1;False;Pxzib;dr208ab;Samson Mow says Bitcoin isn't for people earning less than $2 a day. With average transaction fees now at $27.20, is Bitcoin even for people earning less than $100 a day?;7ivvd7;https://twitter.com/beijingbitcoins/status/939924790625804288
Yes some people will get cheap transaction but most people will not. Here's the median fee chart https://bitinfocharts.com/comparison/bitcoin-median_transaction_fee.html#3m;7;3;False;HarambeAnInsideJob;dr235g7;Samson Mow says Bitcoin isn't for people earning less than $2 a day. With average transaction fees now at $27.20, is Bitcoin even for people earning less than $100 a day?;7ivvd7;https://twitter.com/beijingbitcoins/status/939924790625804288
"But you have the benefit of having your tx included on this *holy bitcoin ledger of worship*, you should consider yourself **LUCKY** that the bitcoin network even accepts your tx.

edit: /s if it wasn't obvious";57;2;False;TNoD;dr1wtot;Samson Mow says Bitcoin isn't for people earning less than $2 a day. With average transaction fees now at $27.20, is Bitcoin even for people earning less than $100 a day?;7ivvd7;https://twitter.com/beijingbitcoins/status/939924790625804288
Wires cost $30 at the banks I’ve used so Bitcoin fees could still go up more and be cheaper than a wire. But really, fees should be 10,000x cheaper or better than that if cryptocurrency wants to succeed long term;18;1;False;nynjawitay;dr24v4y;Samson Mow says Bitcoin isn't for people earning less than $2 a day. With average transaction fees now at $27.20, is Bitcoin even for people earning less than $100 a day?;7ivvd7;https://twitter.com/beijingbitcoins/status/939924790625804288
"if i just want a ""safe"" haven for my 10k i can easily pay $200 to speed up the tx";-14;3;False;alfonumeric;dr20elu;Samson Mow says Bitcoin isn't for people earning less than $2 a day. With average transaction fees now at $27.20, is Bitcoin even for people earning less than $100 a day?;7ivvd7;https://twitter.com/beijingbitcoins/status/939924790625804288
It's funny because they lowered their fees in direct response to Bitcoin.  Wonder what will happen now.;6;0;False;MalcolmTurdball;dr24e59;Samson Mow says Bitcoin isn't for people earning less than $2 a day. With average transaction fees now at $27.20, is Bitcoin even for people earning less than $100 a day?;7ivvd7;https://twitter.com/beijingbitcoins/status/939924790625804288
"seems that btc and ltc have decided to co-operate and each specialize in their respective strengths...
...
btc for big hodelers who can afford $100 fees

btc can point their smaller customers to LTC

if Charlie is prototying segwit for Adam , don't u think Charlie deserves something in return? ";-13;8;False;alfonumeric;dr1rye9;Samson Mow says Bitcoin isn't for people earning less than $2 a day. With average transaction fees now at $27.20, is Bitcoin even for people earning less than $100 a day?;7ivvd7;https://twitter.com/beijingbitcoins/status/939924790625804288
/r/murderedbywords;1;0;False;nothingduploading;dr1r0pm;Samson Mow says Bitcoin isn't for people earning less than $2 a day. With average transaction fees now at $27.20, is Bitcoin even for people earning less than $100 a day?;7ivvd7;https://twitter.com/beijingbitcoins/status/939924790625804288
Pure genuis.  Submitting a pull request right now.;12;0;False;MalcolmTurdball;dr245gz;Samson Mow says Bitcoin isn't for people earning less than $2 a day. With average transaction fees now at $27.20, is Bitcoin even for people earning less than $100 a day?;7ivvd7;https://twitter.com/beijingbitcoins/status/939924790625804288
Not everyone is an early adopter whale. When those run out who is going to go USD > Bitcoin > House when you could just go USD > House without eating fees?;31;1;False;phro;dr210bz;Samson Mow says Bitcoin isn't for people earning less than $2 a day. With average transaction fees now at $27.20, is Bitcoin even for people earning less than $100 a day?;7ivvd7;https://twitter.com/beijingbitcoins/status/939924790625804288
Not if you need that money quickly;2;0;False;roflcopter44444;dr1ykrv;Samson Mow says Bitcoin isn't for people earning less than $2 a day. With average transaction fees now at $27.20, is Bitcoin even for people earning less than $100 a day?;7ivvd7;https://twitter.com/beijingbitcoins/status/939924790625804288
"So...tabs? Tabs.

Edit: Also if you broadcast a ten cent fee tx now at BTC, it's overwhelmingly likely that it'll fall off the mempool before it gets confirmed. Please at least take a peek at the fee distribution.";16;1;False;imaginary_username;dr234oi;Samson Mow says Bitcoin isn't for people earning less than $2 a day. With average transaction fees now at $27.20, is Bitcoin even for people earning less than $100 a day?;7ivvd7;https://twitter.com/beijingbitcoins/status/939924790625804288
">They can send a low fee and it can confirm later. 

*Maybe* it will confirm eventually. At what fee level does a coffee payment become uneconomical? 5 cents? Are you telling me that such a transaction made today is likely to confirm eventually rather than time out of the mempool? But even if that is the case *today*, that can't always be true. Have you really not considered the implications of keeping in place an arbitrary capacity limit on a network that's undergoing exponential growth in terms of adoption and total number of users? Obviously if we had one billion Bitcoin users attempting to make the occasional low-fee coffee transaction, and we continued to limit Bitcoin's capacity to, at most, a few hundred thousand transactions per day, then no, those payments won't just confirm ""later."" ";12;0;False;Capt_Roger_Murdock;dr23u1c;Samson Mow says Bitcoin isn't for people earning less than $2 a day. With average transaction fees now at $27.20, is Bitcoin even for people earning less than $100 a day?;7ivvd7;https://twitter.com/beijingbitcoins/status/939924790625804288
"> Eth seems to be cripple too

Nope.  Agree with the rest of your post but.... Eth is doing more TPS than any other crypto.  Transactions are still under a minute at the most.  BCH is barely used (sorry, it's just a fact, I like BCH but it's got low usage atm). Of course it will scale better than BTC, but ETH has already scaled better than both (min tx cost is still higher than BCH though).";9;0;False;MalcolmTurdball;dr24okq;Samson Mow says Bitcoin isn't for people earning less than $2 a day. With average transaction fees now at $27.20, is Bitcoin even for people earning less than $100 a day?;7ivvd7;https://twitter.com/beijingbitcoins/status/939924790625804288
"Only because no one uses Bcash. Sure it can handle more transaction and its cheaper now but it won't last forever. That is why LN is important to future proof it or at least have  a long-term solution. I think it sucks that we did not do the 2X to be honest cause it was badly needed but we also do need a better alternative than doubling the block size every year or so. 
I don't know who wins in the end but i agree that the better solution will prevail. I cant say which it will be right now. Personally i'm hoping for Bitcoin and Litecoin to be a good pair with LN. One mainly store of value and LTC for micro transactions. ";-8;1;False;vampyren;dr22sxc;Samson Mow says Bitcoin isn't for people earning less than $2 a day. With average transaction fees now at $27.20, is Bitcoin even for people earning less than $100 a day?;7ivvd7;https://twitter.com/beijingbitcoins/status/939924790625804288
I recently transferred $13k (Trezor to Gemini) for 0.07%;3;0;False;gulfbitcoin;dr20z47;Samson Mow says Bitcoin isn't for people earning less than $2 a day. With average transaction fees now at $27.20, is Bitcoin even for people earning less than $100 a day?;7ivvd7;https://twitter.com/beijingbitcoins/status/939924790625804288
I was going to say money launderers but they'd be better off using Monero.;15;0;False;MalcolmTurdball;dr247q1;Samson Mow says Bitcoin isn't for people earning less than $2 a day. With average transaction fees now at $27.20, is Bitcoin even for people earning less than $100 a day?;7ivvd7;https://twitter.com/beijingbitcoins/status/939924790625804288
"LTC runs big blocks. Are they safe now?
";1;1;False;phro;dr20qg6;Samson Mow says Bitcoin isn't for people earning less than $2 a day. With average transaction fees now at $27.20, is Bitcoin even for people earning less than $100 a day?;7ivvd7;https://twitter.com/beijingbitcoins/status/939924790625804288
what a preposterous arrangement;2;0;False;H0dl;dr21bc6;Samson Mow says Bitcoin isn't for people earning less than $2 a day. With average transaction fees now at $27.20, is Bitcoin even for people earning less than $100 a day?;7ivvd7;https://twitter.com/beijingbitcoins/status/939924790625804288
Rackets gonna racket.;17;0;False;flamingboard;dr1wwh7;Samson Mow says Bitcoin isn't for people earning less than $2 a day. With average transaction fees now at $27.20, is Bitcoin even for people earning less than $100 a day?;7ivvd7;https://twitter.com/beijingbitcoins/status/939924790625804288
With Western Unions's money in minutes I can tell someone to go to a western union location, send the transaction # and they can walk out of there with cash in hand in less than 5 min or instantly deposit in their bank account. ;10;1;False;roflcopter44444;dr1yhkg;Samson Mow says Bitcoin isn't for people earning less than $2 a day. With average transaction fees now at $27.20, is Bitcoin even for people earning less than $100 a day?;7ivvd7;https://twitter.com/beijingbitcoins/status/939924790625804288
Soon enough they'll be faster too;20;2;False;KrakenPipe;dr1qyuk;Samson Mow says Bitcoin isn't for people earning less than $2 a day. With average transaction fees now at $27.20, is Bitcoin even for people earning less than $100 a day?;7ivvd7;https://twitter.com/beijingbitcoins/status/939924790625804288
"You misspelled ""bag holders"". ";3;0;False;drippingupside;dr24wow;Samson Mow says Bitcoin isn't for people earning less than $2 a day. With average transaction fees now at $27.20, is Bitcoin even for people earning less than $100 a day?;7ivvd7;https://twitter.com/beijingbitcoins/status/939924790625804288
Samson lives in his own world. Inside his world, financially-poor people doesn't exist.;18;1;False;Epipow;dr1uplr;Samson Mow says Bitcoin isn't for people earning less than $2 a day. With average transaction fees now at $27.20, is Bitcoin even for people earning less than $100 a day?;7ivvd7;https://twitter.com/beijingbitcoins/status/939924790625804288
At the very least you need a smartphone and working internet.;1;0;False;Harucifer;dr21nce;Samson Mow says Bitcoin isn't for people earning less than $2 a day. With average transaction fees now at $27.20, is Bitcoin even for people earning less than $100 a day?;7ivvd7;https://twitter.com/beijingbitcoins/status/939924790625804288
