body;score;nb_replies;stickied;author;id;post_title;post_id;post_link
">That's not how science works

Lmao. What's not how science works? Be more specific - do you think it's a consensus? Do you think scientific fact is decided by popular vote of scientists?

>it would already have been accepted by a majority of the scientists.

I provided a lot of evidence (which you couldn't debunk), and you give me this empty statement which ultimately proves nothing. It is possible for a large group of people to be wrong. There are reasons the majority of scientists agree that the universe isn't geocentric, for example: many scientists have careers built on the work of Einstein, so no one dares criticize his theories; scientists don't want to deviate too far from the accepted narrative in fear of being ostracized (look at what happened to Halton Arp, as I mentioned in my big comment); and a lot of scientists haven't been exposed to the proofs I brought up - like I said, they aren't taught in school. The biggest reason for this coverup is pretty crazy, too crazy for me to share but you will realize it if you think about it enough and watch that documentary I mentioned.";1;1;False;threesixzero;dr18aqd;Official Endorsement: Luke (core dev) prefers BCH over LTC for exchange;7iq51j;https://i.redd.it/7av4xf7taz201.jpg
"They totally are, there's effectively no difference.  Satoshi has around a million BTC most likely.  It's a ""pre-mine"" in practicality since basically no one was using it back then,";1;1;False;3thaddict;dr190sk;Official Endorsement: Luke (core dev) prefers BCH over LTC for exchange;7iq51j;https://i.redd.it/7av4xf7taz201.jpg
"I'm saying, the universe is similar. Any point is the center of the universe, considering the speed of light and the observable universe and all that. So, it makes no sense to talk about the ""center"" of the universe.

For the solar system, any any other system for that matter, any point can be taken as the center. Even a random point beyond pluto for all anyone cares. But the math is stupidly complicated and helps nothing. It's simpler and easier to just say planets orbit a star, and that's the center of any planetary system. It's universal for all star systems, the math is easier, and it makes sense. If we compare all the points in space, to take as the center of the solar system, the sun comes out as king for many more reasons than any other point. ";1;1;False;Techguy10110;dr183ww;Official Endorsement: Luke (core dev) prefers BCH over LTC for exchange;7iq51j;https://i.redd.it/7av4xf7taz201.jpg
Who said the surface of a sphere has a center? :/;1;1;False;threesixzero;dr180l7;Official Endorsement: Luke (core dev) prefers BCH over LTC for exchange;7iq51j;https://i.redd.it/7av4xf7taz201.jpg
"The discovery of stellar aberration in the early 18th century by James Bradley proved that the Earth did in fact move around the Sun and Tycho's system fell out of use among scientists.[30] In the modern era, some of the modern geocentrists use a modified Tychonic system with elliptical orbits, **while rejecting the concept of relativity**.[31][32]

lel";2;1;False;3thaddict;dr193kj;Official Endorsement: Luke (core dev) prefers BCH over LTC for exchange;7iq51j;https://i.redd.it/7av4xf7taz201.jpg
"**Tychonic system**

The Tychonic system (or Tychonian system) is a model of the Solar system published by Tycho Brahe in the late 16th century which combines what he saw as the mathematical benefits of the Copernican system with the philosophical and ""physical"" benefits of the Ptolemaic system. The model may have been inspired by Valentin Naboth and Paul Wittich, a Silesian mathematician and astronomer. A similar yet mathematically more efficient geoheliocentric model was also proposed a century earlier by Nilakantha Somayaji of the Kerala school of astronomy and mathematics.

It is conceptually a geocentric model: the Earth is at the center of the universe, the Sun and Moon and the stars revolve around the Earth, and the other five planets revolve around the Sun.

***

^[ [^PM](https://www.reddit.com/message/compose?to=kittens_from_space) ^| [^Exclude ^me](https://reddit.com/message/compose?to=WikiTextBot&message=Excludeme&subject=Excludeme) ^| [^Exclude ^from ^subreddit](https://np.reddit.com/r/btc/about/banned) ^| [^FAQ ^/ ^Information](https://np.reddit.com/r/WikiTextBot/wiki/index) ^| [^Source](https://github.com/kittenswolf/WikiTextBot) ^| [^Donate](https://www.reddit.com/r/WikiTextBot/wiki/donate)   ^]
^Downvote ^to ^remove ^| ^v0.28";1;0;False;WikiTextBot;dr0xbss;Official Endorsement: Luke (core dev) prefers BCH over LTC for exchange;7iq51j;https://i.redd.it/7av4xf7taz201.jpg
But when you think of a system the center is the center of mass.;1;1;False;;dr16369;Official Endorsement: Luke (core dev) prefers BCH over LTC for exchange;7iq51j;https://i.redd.it/7av4xf7taz201.jpg
I mean, sure, you can definitely have a mathematically consistent model of the solar system that puts the Earth at the center. But if you put the Sun at the center the model still makes accurate predictions and the math is way easier.;1;1;False;Veltan;dr1glpx;Official Endorsement: Luke (core dev) prefers BCH over LTC for exchange;7iq51j;https://i.redd.it/7av4xf7taz201.jpg
Nah he literally believes it http://forums3.armagetronad.net/viewtopic.php?t=19038;1;0;False;3thaddict;dr195gl;Official Endorsement: Luke (core dev) prefers BCH over LTC for exchange;7iq51j;https://i.redd.it/7av4xf7taz201.jpg
https://www.reddit.com/r/btc/comments/7iq51j/official_endorsement_luke_core_dev_prefers_bch/dr0x1c5/;0;0;False;threesixzero;dr0x7wt;Official Endorsement: Luke (core dev) prefers BCH over LTC for exchange;7iq51j;https://i.redd.it/7av4xf7taz201.jpg
The chance that the Earth is the center of the gazillion stars and planets is 1:gazillions.;1;1;False;Shock_The_Stream;dr0yghw;Official Endorsement: Luke (core dev) prefers BCH over LTC for exchange;7iq51j;https://i.redd.it/7av4xf7taz201.jpg
This is extremely off-topic for a bitcoin sub. Right or wrong it's the wrong place to pitch these ideas and you will downvoted to hell.;0;1;False;1s44c;dr17e0y;Official Endorsement: Luke (core dev) prefers BCH over LTC for exchange;7iq51j;https://i.redd.it/7av4xf7taz201.jpg
stickler comment following 1s44c: there's a bug or something in genesis block tx that makes them unspendable. 50 btc only.;3;1;False;EnayVovin;dr1ases;Official Endorsement: Luke (core dev) prefers BCH over LTC for exchange;7iq51j;https://i.redd.it/7av4xf7taz201.jpg
"Relativity can actually be debunked with ease, here is a youtube video where the uploader debunks it in 1 minute (watch from the 2min mark to the 3min mark): https://www.youtube.com/watch?v=PolFadm-lgU&t=2m

You shouldn't trust Wikipedia as much as you are trusting it right now.

Also, the aberration of starlight proved geocentricity ([Airy's Failure](https://www.youtube.com/watch?v=87M2i61N1cU)).";-1;1;False;threesixzero;dr194za;Official Endorsement: Luke (core dev) prefers BCH over LTC for exchange;7iq51j;https://i.redd.it/7av4xf7taz201.jpg
Mass of the sun is unproven/indefinite and in fact, the masses of **ALL** cosmic bodies (even Earth) are nothing more than speculation. There are many proofs that the Earth is the center, and I touch on a few of them in that post of mine I linked to - when it comes to identifying the center of the solar system or the universe, those evidences are worth a lot more than the supposed mass of anything.;-2;0;False;threesixzero;dr16f51;Official Endorsement: Luke (core dev) prefers BCH over LTC for exchange;7iq51j;https://i.redd.it/7av4xf7taz201.jpg
That's the thing - you can put Earth in the center and it makes just as much sense. Whether or not the calculations are easier or not don't really matter. We can think of all planets orbiting the sun and sun orbiting Earth and it is same case geometrically. It is only when you start looking at other proofs like CMB radiation, Sloan Survey, and Airy's Failure (all of which I mentioned in the comment I linked) where it starts to become apparent that we are actually in the center of the universe.;1;1;False;threesixzero;dr1gsez;Official Endorsement: Luke (core dev) prefers BCH over LTC for exchange;7iq51j;https://i.redd.it/7av4xf7taz201.jpg
It only seems ridiculous if you accept the implications of heliocentrism and the big bang theory and then try to understand geocentrism through *that* lens. Instead, look strictly at the available empirical evidence and make a judgment from that. There is considerable evidence that Earth is literally the focus of the universe.;-3;1;False;threesixzero;dr0yowf;Official Endorsement: Luke (core dev) prefers BCH over LTC for exchange;7iq51j;https://i.redd.it/7av4xf7taz201.jpg
"I don't care about being downvoted, I only bring it up because people were calling Luke Jr crazy for believing in geocentricity when there is overwhelming evidence to support it.

The fact is that although I was downvoted a lot, no one was able to debunk even one of my proofs - that doesn't necessarily mean I'm right, but it shows that everyone is simply believing what they were told and they are not being skeptical and critical of their beliefs.";-1;0;False;threesixzero;dr182sy;Official Endorsement: Luke (core dev) prefers BCH over LTC for exchange;7iq51j;https://i.redd.it/7av4xf7taz201.jpg
"The gentleman in the video makes several errors in the first minute you linked. First, special relativity not only accounts for acceleration, but solves this paradox handily. The two clocks don't take symmetrical paths- the clock on the planet experiences the same, stationary frame of reference for the duration of the experiment while the clock on the rocket experiences acceleration to change its velocity vector from outbound to inbound.

As for Airy's Failure, that experiment is insufficient to prove that the Earth is stationary. It failed to detect aether drag, yes, but that can be explained by either a stationary aether (and presumably therefore a stationary globe) or by the nonexistence of aether. I'm presuming you also believe the luminiferous aether exists? Because that's a claim that requires support.";1;1;False;Veltan;dr1gci8;Official Endorsement: Luke (core dev) prefers BCH over LTC for exchange;7iq51j;https://i.redd.it/7av4xf7taz201.jpg
"It matters because the point of the models is for them to describe the phenomena accurately and to allow accurate predictions of future states of the system.

Halton Arp didn't ""debunk"" the big bang theory. It takes more than proposing an alternative theory, especially one that doesn't seem to be based on more than anecdotal observations selected with nothing resembling statistical rigor.

Look, I don't mean to be rude, but I'm not sure you're clear on how to distinguish a rigorous, sound study from wild, unsupported suppositions stemming from layman's intuition and preconceived notions. Honestly it doesn't matter to me if you think the Earth is the center of the universe. I'm mostly wishing we were better at training folks on how to think critically and account for their own biases.";1;1;False;Veltan;dr1t7r6;Official Endorsement: Luke (core dev) prefers BCH over LTC for exchange;7iq51j;https://i.redd.it/7av4xf7taz201.jpg
Peak idiocy. No, not yet. Peak is reached when you believe *you* are the center of the universe. ;3;1;False;Shock_The_Stream;dr0zbpy;Official Endorsement: Luke (core dev) prefers BCH over LTC for exchange;7iq51j;https://i.redd.it/7av4xf7taz201.jpg
"But according to relativity, can't we consider the rocket as being stationary and the Earth accelerating away? That's the whole point of relativity, isn't it?

And Airy's Failure wasn't detecting ether drag or doing anything related to the ether. It tested if the apparent motion of starlight is due to the stars moving or the observer moving. Whether the ether exists or not is irrelevant to that experiment. The experiment found it is actually the starlight moving rather than the Earth moving.";0;1;False;threesixzero;dr1gl2s;Official Endorsement: Luke (core dev) prefers BCH over LTC for exchange;7iq51j;https://i.redd.it/7av4xf7taz201.jpg
"Mm hmm just another person unable to debunk any of the scientific evidence. You must be one of those ""science-deniers"".";-2;2;False;threesixzero;dr11arj;Official Endorsement: Luke (core dev) prefers BCH over LTC for exchange;7iq51j;https://i.redd.it/7av4xf7taz201.jpg
"It's asymmetrical because the force that caused the acceleration was only imparted on one of the parties. Someone on Earth can notice that the relative velocity between them and the rocket has changed and deduce that acceleration has occurred, but we know that the cause of the acceleration was the rocket engine. Relativity doesn't allow you to imagine the Earth fired its engines instead. 

You can imagine that the rocket firing pushed on the fabric of reality and dragged the Earth closer instead of pushing the rocket closer to the Earth, but the force still only occured in once place and not both places. The fact that force acted on one reference frame and not the other means that even with relativity, their experiences were different and the respective outcomes will therefore also be different.

As for Airy's failure, it does not follow that filling a telescope with water would alter the aberration enough that there would be a detectable difference on a stationary world vs a planet in motion.";1;1;False;Veltan;dr1rlrp;Official Endorsement: Luke (core dev) prefers BCH over LTC for exchange;7iq51j;https://i.redd.it/7av4xf7taz201.jpg
More than 99 percent of scientists claim that the Earth isn't the center of the universe. ;1;1;False;Shock_The_Stream;dr15ctm;Official Endorsement: Luke (core dev) prefers BCH over LTC for exchange;7iq51j;https://i.redd.it/7av4xf7taz201.jpg
Find me the center of the surface of a sphere and then we'll talk.;1;1;False;Techguy10110;dr17ulu;Official Endorsement: Luke (core dev) prefers BCH over LTC for exchange;7iq51j;https://i.redd.it/7av4xf7taz201.jpg
"Yeah but that is absolutely irrelevant - science is not a vote. Look at my proof and do yourself a favor by trying to debunk it. See if your preconceptions hold up to this new information that they won't teach you in school.

EDIT: Watch that documentary I mentioned, it will leave no doubt that the modern narrative is incorrect.";1;1;False;threesixzero;dr15hfh;Official Endorsement: Luke (core dev) prefers BCH over LTC for exchange;7iq51j;https://i.redd.it/7av4xf7taz201.jpg
That's not how science works. If your BS was real, it would already have been accepted by a majority of the scientists. ;1;1;False;Shock_The_Stream;dr182l3;Official Endorsement: Luke (core dev) prefers BCH over LTC for exchange;7iq51j;https://i.redd.it/7av4xf7taz201.jpg
Ya;1;0;False;;dr1332c;Official Endorsement: Luke (core dev) prefers BCH over LTC for exchange;7iq51j;https://i.redd.it/7av4xf7taz201.jpg
So bitcoin core is perpetually premined, haha.;1;1;False;PsyRev_;dr0vfjr;Official Endorsement: Luke (core dev) prefers BCH over LTC for exchange;7iq51j;https://i.redd.it/7av4xf7taz201.jpg
"Btc core is  scam run from
Any opinion he has";0;0;False;Libertymark;dr10zpj;Official Endorsement: Luke (core dev) prefers BCH over LTC for exchange;7iq51j;https://i.redd.it/7av4xf7taz201.jpg
did he endorse bitcoin cash as an altcoin?;1;0;False;kenchikka;dr0wnxl;Official Endorsement: Luke (core dev) prefers BCH over LTC for exchange;7iq51j;https://i.redd.it/7av4xf7taz201.jpg
who the hell is him? ;1;0;False;nicholascds;dr0z4q1;Official Endorsement: Luke (core dev) prefers BCH over LTC for exchange;7iq51j;https://i.redd.it/7av4xf7taz201.jpg
Maybe so only time will tell. What other coins do you consider to be quality?;1;0;False;ThereAintNoOther;dr11pna;Official Endorsement: Luke (core dev) prefers BCH over LTC for exchange;7iq51j;https://i.redd.it/7av4xf7taz201.jpg
Finally, a rare, sane moment from Luke.;1;0;False;earthmoonsun;dr160ys;Official Endorsement: Luke (core dev) prefers BCH over LTC for exchange;7iq51j;https://i.redd.it/7av4xf7taz201.jpg
because the only altcoin he has is BCH;1;0;False;OracularTitaness;dr166s1;Official Endorsement: Luke (core dev) prefers BCH over LTC for exchange;7iq51j;https://i.redd.it/7av4xf7taz201.jpg
obviously what we need is a litecoin on the BCH omni protocol, lol. ;1;0;False;SamSlate;dr17ydf;Official Endorsement: Luke (core dev) prefers BCH over LTC for exchange;7iq51j;https://i.redd.it/7av4xf7taz201.jpg
I don't care what he prefers;1;0;False;HurlSly;dr18bx7;Official Endorsement: Luke (core dev) prefers BCH over LTC for exchange;7iq51j;https://i.redd.it/7av4xf7taz201.jpg
Sweet, Luke is exactly what the Bitcoin CASH, community needs! He is a hero in my mind! ;1;0;False;Jhynn;dr197du;Official Endorsement: Luke (core dev) prefers BCH over LTC for exchange;7iq51j;https://i.redd.it/7av4xf7taz201.jpg
Whoopeedoo!   A moron's approval!;1;0;False;karljt;dr1d9cd;Official Endorsement: Luke (core dev) prefers BCH over LTC for exchange;7iq51j;https://i.redd.it/7av4xf7taz201.jpg
"Has he been banned from /r/bitcoin yet?

It's clear to me that /r/bitcoin is doing whatever it takes to increase the value of bitcoin.

And Bitcoin cash is doing whatever it takes to make Bitcoin cash a viable currency.

In the end, both will survive, with different purposes.

But Bitcoin as an investment kind of scares me.  There is NOTHING backing it in any way.  If you own stock, at least the company has a revenue stream and usually pays you a dividend of some kind.  Same with corporate bonds.  And government securities are backed by tax dollars.  Bitcoin is 100% backed by faith.  It's more prone to a huge bubble burst than any other investment.  And if you lose a ton of money on Bitcoin. you can't even declare the loss on your taxes.  Definitely shaky ground for investment.  I wish them all the luck in the world.

Now with Bitcoin Cash actually trying to be currency, it has one major advantage.  If any commodity decides to use Bitcoin for it's buying and selling (oil, wheat, etc.) that will help stabilize the price and legitimize it as a currency.  Heck even in BCH becomes the preferred currency for ""illegal"" activities such as prostitution, then that will also help legitimize it as a currency.";1;0;False;plazman30;dr1dq1g;Official Endorsement: Luke (core dev) prefers BCH over LTC for exchange;7iq51j;https://i.redd.it/7av4xf7taz201.jpg
What timeline is this?;1;0;False;BlackRockAndRoll;dr0win4;Official Endorsement: Luke (core dev) prefers BCH over LTC for exchange;7iq51j;https://i.redd.it/7av4xf7taz201.jpg
Technically Dogecoin has the cheaper fees overall, just saying.;1;0;False;FizzlePopBerryTwist;dr0ybrw;Official Endorsement: Luke (core dev) prefers BCH over LTC for exchange;7iq51j;https://i.redd.it/7av4xf7taz201.jpg
Nonsense. That was in the hypothetical scenario we needed an altcoin for that purpose. We don't - Bitcoin can do it.;-2;3;False;luke-jr;dr0wyrj;Official Endorsement: Luke (core dev) prefers BCH over LTC for exchange;7iq51j;https://i.redd.it/7av4xf7taz201.jpg
That is not really much of a shining endorsement - but I guess beggars can't be choosers. ;0;0;False;Xenomoly;dr0v18o;Official Endorsement: Luke (core dev) prefers BCH over LTC for exchange;7iq51j;https://i.redd.it/7av4xf7taz201.jpg
Wow, a Core Dev acknowledging Bitcoin Cash being a legit contender in the free market of ideas.  And its Luke Jr no less.  I did not see that coming.;0;1;False;nimrand;dr0oqe0;Official Endorsement: Luke (core dev) prefers BCH over LTC for exchange;7iq51j;https://i.redd.it/7av4xf7taz201.jpg
">Is this because ltc is fundamentally/technically better than btc? 

No, it's a copy-/paste coin, so the same technology.

>Can ltc process more TX than btc or bch? 

No. LTC can in theory process 3 times more than btc, but less than half of BCH.

750 Kb block size / 0.25 blocks / 10 min = 3MB/10 min";3;0;False;physalisx;dr176h8;Official Endorsement: Luke (core dev) prefers BCH over LTC for exchange;7iq51j;https://i.redd.it/7av4xf7taz201.jpg
[deleted];18;1;False;;dr0ltr2;Official Endorsement: Luke (core dev) prefers BCH over LTC for exchange;7iq51j;https://i.redd.it/7av4xf7taz201.jpg
deleted  ^^^^^^^^^^^^^^^^0.6351  [^^^What ^^^is ^^^this?](https://pastebin.com/FcrFs94k/80014);1;0;False;;dr0w0um;Official Endorsement: Luke (core dev) prefers BCH over LTC for exchange;7iq51j;https://i.redd.it/7av4xf7taz201.jpg
He is a complete gong show re his personal opinions. But this is a good thing for bch. ;1;0;False;frazeman;dr13nio;Official Endorsement: Luke (core dev) prefers BCH over LTC for exchange;7iq51j;https://i.redd.it/7av4xf7taz201.jpg
I always said  he was hired by bankers to kill BTC.;1;0;False;unitedstatian;dr17tto;Official Endorsement: Luke (core dev) prefers BCH over LTC for exchange;7iq51j;https://i.redd.it/7av4xf7taz201.jpg
"This is so odd, and now Jihan now supports core and blockstream in recent visit to the united states-

https://pbs.twimg.com/media/DQqrDYmWsAAOBtY.jpg

https://www.weibo.com/2083258595/FyV6yyWup?from=page_1005052083258595_profile&wvr=6&mod=weibotime&type=comment";1;0;False;Salmondish;dr1axhz;Official Endorsement: Luke (core dev) prefers BCH over LTC for exchange;7iq51j;https://i.redd.it/7av4xf7taz201.jpg
It's just part of the smear campaign to equate BCH with other crappy projects.;1;0;False;bchbtch;dr1m2yw;Official Endorsement: Luke (core dev) prefers BCH over LTC for exchange;7iq51j;https://i.redd.it/7av4xf7taz201.jpg
"Lukejr hates only one thing more than bitcoin cash that is litecoin, he actively tried to destroy the chain a few years ago and ran a smear campaign for a time when he controlled the litecoin wiki. 

Litecoin and Bitcoin cash hodlers rest easy in the knowledge lukejr will never be directly involved with either. ";1;0;False;cryptovessel;dr16x1r;Official Endorsement: Luke (core dev) prefers BCH over LTC for exchange;7iq51j;https://i.redd.it/7av4xf7taz201.jpg
TBH this probably works against BCH;1;0;False;SpliffZombie;dr0uak6;Official Endorsement: Luke (core dev) prefers BCH over LTC for exchange;7iq51j;https://i.redd.it/7av4xf7taz201.jpg
"Luke thinks BCH better for exchange . Jihan thinks we should support core on BTC chain development (https://www.reddit.com/r/btc/comments/7irbke/jihan_wu_says_i_think_we_should_support_core_and/?ref=share&ref_source=link)

What the hell, peace deal?";1;1;False;bbhgreb;dr0u7fd;Official Endorsement: Luke (core dev) prefers BCH over LTC for exchange;7iq51j;https://i.redd.it/7av4xf7taz201.jpg
The infiltration begins.;1;0;False;Deiquime;dr0rlf3;Official Endorsement: Luke (core dev) prefers BCH over LTC for exchange;7iq51j;https://i.redd.it/7av4xf7taz201.jpg
"WARNING: **Do not ever make a same mistake and accept anyone that was siding with Core and Blockstream to get into Bitcoin Cash coding... if you do you will make exact same mistake and allow another Trojan Horse into Bitcoin Cash.**

LEARN FROM YOUR MISTAKE AND DON'T EVER REPEAT IT!";107;8;False;;dr0q21t;Official Endorsement: Luke (core dev) prefers BCH over LTC for exchange;7iq51j;https://i.redd.it/7av4xf7taz201.jpg
"That's not an endorsement. This makes bitcoin cash look bad. 

Luke-jr is a fucking retard. ";72;2;False;bitcoinballer23;dr0moxi;Official Endorsement: Luke (core dev) prefers BCH over LTC for exchange;7iq51j;https://i.redd.it/7av4xf7taz201.jpg
What's all this I'm hearing about Core promoting LTC for payments? I'm ootl;9;2;False;DeleteMyOldAccount;dr0mb14;Official Endorsement: Luke (core dev) prefers BCH over LTC for exchange;7iq51j;https://i.redd.it/7av4xf7taz201.jpg
His opinion means nothing. He lost any credibility with his view that internet cannot handle blocks larger than 1MB, which are also too big. Ideal size is 300kB. ;9;0;False;mWo12;dr0stkc;Official Endorsement: Luke (core dev) prefers BCH over LTC for exchange;7iq51j;https://i.redd.it/7av4xf7taz201.jpg
The usual sneaky manner, he pisses the Litecoin for that reason to title BCH as an altcoin.;18;0;False;kbtakbta;dr0mt8s;Official Endorsement: Luke (core dev) prefers BCH over LTC for exchange;7iq51j;https://i.redd.it/7av4xf7taz201.jpg
He just hates charlie. That's all.;16;1;False;Epipow;dr0o37j;Official Endorsement: Luke (core dev) prefers BCH over LTC for exchange;7iq51j;https://i.redd.it/7av4xf7taz201.jpg
I voted this down because I don't care what anybody associated with Blockchain says.  Their actions make them irrelevant.  Also voted this down because its an ugly Twitter screenshot.;3;0;False;--_-_o_-_--;dr0tlwq;Official Endorsement: Luke (core dev) prefers BCH over LTC for exchange;7iq51j;https://i.redd.it/7av4xf7taz201.jpg
What is really sad is just how useless jratcliff has become.;4;0;False;jcrew77;dr0pmu9;Official Endorsement: Luke (core dev) prefers BCH over LTC for exchange;7iq51j;https://i.redd.it/7av4xf7taz201.jpg
Isn't that guy who was bitching BCH just last week? ;3;0;False;Elidan456;dr0tfxj;Official Endorsement: Luke (core dev) prefers BCH over LTC for exchange;7iq51j;https://i.redd.it/7av4xf7taz201.jpg
When Luke makes sense you know BlockstreamCore is totally off the deep end.;3;0;False;flamingboard;dr0x54f;Official Endorsement: Luke (core dev) prefers BCH over LTC for exchange;7iq51j;https://i.redd.it/7av4xf7taz201.jpg
This dude is a moron.  Better off deleting this post.  More harm then good.;5;0;False;Channel9nine;dr0mtfq;Official Endorsement: Luke (core dev) prefers BCH over LTC for exchange;7iq51j;https://i.redd.it/7av4xf7taz201.jpg
"> Litecoin is no better suited for low value payments than Bitcoin is.

LOL, what?  Right now you can send $0.01 in LTC with zero fee and it will likely confirm in 2 minutes in the next block.  The last time that was true for Bitcoin was years ago.";6;3;False;Exeunter;dr0u4cb;Official Endorsement: Luke (core dev) prefers BCH over LTC for exchange;7iq51j;https://i.redd.it/7av4xf7taz201.jpg
