body;score;nb_replies;stickied;author;id;post_title;post_id;post_link
"Not so, it's a scam. 

Take California. They got the state lottery passed by making a law saying that all proceeds from the lottery would be spent on the schools. Everyone thought this was a great idea.

About $300 million was generated for schools the next year. And all of it went to the schools. So technically they weren't lying.

What actually happened is that the state reduced state funding to schools by $300 million and allowed lottery money to plug the gap. Total school funding did not increase at all, and the legislators got $300m in play money for free to spend on w/e they wanted, and it was all technically legal.

The large print giveth, and the fine print taketh away.";1;1;False;Anenome5;dtst2cn;"Government: ""Cryptocurrencies are too risky."" Also government: ""Buy lottery tickets.""";7vctu9;https://www.reddit.com/r/btc/comments/7vctu9/government_cryptocurrencies_are_too_risky_also/
This is about a comparison of risk. Compared to your odds of losing the lottery, buying any cryptocurrency isn't even close to as risky. Especially given nearly a decade long history of value increase long-term.;1;0;False;Anenome5;dtta1uu;"Government: ""Cryptocurrencies are too risky."" Also government: ""Buy lottery tickets.""";7vctu9;https://www.reddit.com/r/btc/comments/7vctu9/government_cryptocurrencies_are_too_risky_also/
Satoshi dice?;1;0;False;Anenome5;dtta5w2;"Government: ""Cryptocurrencies are too risky."" Also government: ""Buy lottery tickets.""";7vctu9;https://www.reddit.com/r/btc/comments/7vctu9/government_cryptocurrencies_are_too_risky_also/
"To store your money in a place where ordinary theives off the street can't get to it. When banks first came around, they also served as currency exchanges.

It's quite outdated in this day and age, IMO, unless you live in a high crime area. ";1;0;False;heyitsdross;dttbzqk;"Government: ""Cryptocurrencies are too risky."" Also government: ""Buy lottery tickets.""";7vctu9;https://www.reddit.com/r/btc/comments/7vctu9/government_cryptocurrencies_are_too_risky_also/
I mean if we're talking life savings then why aren't we putting our life savings in lottery tickets too? ;1;2;False;RustyToddRoy;dtsyeh1;"Government: ""Cryptocurrencies are too risky."" Also government: ""Buy lottery tickets.""";7vctu9;https://www.reddit.com/r/btc/comments/7vctu9/government_cryptocurrencies_are_too_risky_also/
"Except that government is full of pedos it seems, or have you not been paying attention. Jimmy Saville? Anthony Weiner. 

http://lmgtfy.com/?q=pedos+in+government

https://www.corbettreport.com/pedophiles-in-politics-an-open-source-investigation/";1;0;False;Anenome5;dtta4sb;"Government: ""Cryptocurrencies are too risky."" Also government: ""Buy lottery tickets.""";7vctu9;https://www.reddit.com/r/btc/comments/7vctu9/government_cryptocurrencies_are_too_risky_also/
Tether will bail us out! ;2;0;False;Kain_niaK;dtsn4zt;"Government: ""Cryptocurrencies are too risky."" Also government: ""Buy lottery tickets.""";7vctu9;https://www.reddit.com/r/btc/comments/7vctu9/government_cryptocurrencies_are_too_risky_also/
I don't get this narrative at all, since when did the people give governments or banks the mandate to decide what risk you decide to take?;2;0;False;Fount4inhead;dtsugpu;"Government: ""Cryptocurrencies are too risky."" Also government: ""Buy lottery tickets.""";7vctu9;https://www.reddit.com/r/btc/comments/7vctu9/government_cryptocurrencies_are_too_risky_also/
Makes sense bro, thanks for clarification.;1;0;False;denizuk;dtufeid;"Government: ""Cryptocurrencies are too risky."" Also government: ""Buy lottery tickets.""";7vctu9;https://www.reddit.com/r/btc/comments/7vctu9/government_cryptocurrencies_are_too_risky_also/
Right but if you never transact (sell for fiat or use it) it’s not a very good currency;1;1;False;milhouseisa_meme;dtsyppl;"Government: ""Cryptocurrencies are too risky."" Also government: ""Buy lottery tickets.""";7vctu9;https://www.reddit.com/r/btc/comments/7vctu9/government_cryptocurrencies_are_too_risky_also/
If you have losses, then yes.;2;0;False;Anenome5;dtst556;"Government: ""Cryptocurrencies are too risky."" Also government: ""Buy lottery tickets.""";7vctu9;https://www.reddit.com/r/btc/comments/7vctu9/government_cryptocurrencies_are_too_risky_also/
Because that is very diificult to do;1;0;False;Dunedune;dtsystq;"Government: ""Cryptocurrencies are too risky."" Also government: ""Buy lottery tickets.""";7vctu9;https://www.reddit.com/r/btc/comments/7vctu9/government_cryptocurrencies_are_too_risky_also/
Wow that’s fucked, honestly not surprised with the state of politics now a days, thanks for that. I’m gonna look into it further.;2;0;False;Blake404;dtt1g00;"Government: ""Cryptocurrencies are too risky."" Also government: ""Buy lottery tickets.""";7vctu9;https://www.reddit.com/r/btc/comments/7vctu9/government_cryptocurrencies_are_too_risky_also/
But lottery don't cost u much hahaha, and for fun mostly;1;0;False;BTCMONSTER;dttn90b;"Government: ""Cryptocurrencies are too risky."" Also government: ""Buy lottery tickets.""";7vctu9;https://www.reddit.com/r/btc/comments/7vctu9/government_cryptocurrencies_are_too_risky_also/
"what govt recommended investing in lottery tickets?  lol

sounds like a false analogy...";1;0;False;TCDWarrior;dtt89i4;"Government: ""Cryptocurrencies are too risky."" Also government: ""Buy lottery tickets.""";7vctu9;https://www.reddit.com/r/btc/comments/7vctu9/government_cryptocurrencies_are_too_risky_also/
Get back to me when transactions fall to zero.;1;0;False;Anenome5;dtt7ct9;"Government: ""Cryptocurrencies are too risky."" Also government: ""Buy lottery tickets.""";7vctu9;https://www.reddit.com/r/btc/comments/7vctu9/government_cryptocurrencies_are_too_risky_also/
"I don't know if you're memeing or being serious.

With crypto, the players are just other people in the world. Go up, go down, its a 0 sum game. People are buying and selling with no way of enforcing transactions or ensuring that people actually get paid and are secure (I'm looking at you Mt. Gox). In this way, it is the wild fucking west and its gambling.

""But bewilderment, muh block chain."" Yeah, you know how block chain works? Its a global ledger of every transaction ever made and transactions are validated and added to the ledger by validating hashes (reversing them) which can take half an hour. So imagine waiting half an hour at a supermarket register to buy a pack of gum. 

Or in the case of buying and selling crypto, imagine you're trading Litecoin for Bit or cashing out. Now, you submit a transaction. When does the buy or sell order go through? When the exchange is validated or when its initiated? At the end of the day, the ledger only records a transaction between 1 wallet and another on the same coin. How you cash out is an entirely different system NOT enforced by blockchain (but durr we can build more block chains. Yeah fuck not gonna even discuss that.)

With a lottery, the players are the people and the government where the government is giving away the money and the people are buying into the game. At least in this way, the game is regulated and there are multiple safeguards for playing (age restriction, guarentee of payment, spelling out what it means to buy a lottery ticket, and gambling addiction help ) and at the end of the day, the lottery is used as essentially a tax on people who are bad at math and just want an emotional adrenaline kick. At least the money goes to a public cause.

Its the difference between riding a bicycle with training wheels and a motorcycle at a grand prix, both without prior training.

You actually think a majority of the people buying crypto know what the fuck they're doing? No. Absolutely not. If you ask them what the value of any particular crypto is, they couldn't fucking distinguish Eth from Bitcoin. All they know is ""durr it goes up I must buy and watch the investment go up because it goes up.""

And when these idiots spend lose their life savings in the bubble, who's gonna pick up the tab? The government. These idiots spend the rest of their lives on welfare and the government needs to support them. So how about they just fucking not let people ruin their own lives to begin with?";1;0;False;bewilderment_;dtt9at4;"Government: ""Cryptocurrencies are too risky."" Also government: ""Buy lottery tickets.""";7vctu9;https://www.reddit.com/r/btc/comments/7vctu9/government_cryptocurrencies_are_too_risky_also/
Well lottery money apparently is given to local governments for schools and things of the like, at least in the state (USA) I live... so there’s that. ;1;1;False;Blake404;dtsmfev;"Government: ""Cryptocurrencies are too risky."" Also government: ""Buy lottery tickets.""";7vctu9;https://www.reddit.com/r/btc/comments/7vctu9/government_cryptocurrencies_are_too_risky_also/
At least with lottery tickets, I know exactly what my chances are. ;1;0;False;Woolbrick;dtsx0cq;"Government: ""Cryptocurrencies are too risky."" Also government: ""Buy lottery tickets.""";7vctu9;https://www.reddit.com/r/btc/comments/7vctu9/government_cryptocurrencies_are_too_risky_also/
BTC and BCH have been hovering around the same values down and up, again, what are you on about?;1;1;False;-Seirei-;dtu90yf;Bitcoin Cash - Life's a BCH!;7uhy0o;https://i.redd.it/4nzysvukzkd01.jpg
"I love being right!!
";0;1;False;joeyballard;dtu4xhq;Bitcoin Cash - Life's a BCH!;7uhy0o;https://i.redd.it/4nzysvukzkd01.jpg
Wow, you are going as far as completely ignoring reality. Have you not looked at the btc/bch trading pairs?;1;1;False;joeyballard;dtubcbm;Bitcoin Cash - Life's a BCH!;7uhy0o;https://i.redd.it/4nzysvukzkd01.jpg
Honestly I don't care. I'm not interested in the performance of BCH against BTC. I wanna see BCH thrive no matter what it's relative value to BTC is. I couldn't give a flying fuck about BTC anymore.;1;1;False;-Seirei-;dtudlym;Bitcoin Cash - Life's a BCH!;7uhy0o;https://i.redd.it/4nzysvukzkd01.jpg
Thats a better excuse than Craig Wright has. He claims to be Satoshi but he forgot his private key.;2;1;False;;dtt9gx4;Explanation of BTC crash...;7vgj26;https://gfycat.com/ConcernedZestyGrayfox
"Of course they have and you are completely correct.

 That was my point, I guess. Everyone in this space should be supporting each other but maddeningly, people keep shiposting each other as the walls are crumbling upon us. I don't own bch anymore, but there is nothing wrong with it. Nor is there much wrong with btc.  Nobody needs a fight to the death as there is ample room for both.

But if a fight to the death is insisted upon, well so be it. ";2;3;False;noobhodler;dtsn1zl;Explanation of BTC crash...;7vgj26;https://gfycat.com/ConcernedZestyGrayfox
Which movie ?;1;1;False;nu1x;dttj9hb;Explanation of BTC crash...;7vgj26;https://gfycat.com/ConcernedZestyGrayfox
Oh I dunno? I didn't think so but I could be wrong. Not sure if I even watched the movie!;1;0;False;CryptoWithFries;dttacum;Explanation of BTC crash...;7vgj26;https://gfycat.com/ConcernedZestyGrayfox
[deleted];0;2;False;;dtsmily;Explanation of BTC crash...;7vgj26;https://gfycat.com/ConcernedZestyGrayfox
Perhaps you mean worse?;1;0;False;Azraelalpha;dttyocp;Explanation of BTC crash...;7vgj26;https://gfycat.com/ConcernedZestyGrayfox
I’m down if we all laughing at the prices falling but let’s not sit around and laugh at other coins when we’re also losing like them, if not more. ;7;1;False;blackwaterbayhero;dtsryuo;Explanation of BTC crash...;7vgj26;https://gfycat.com/ConcernedZestyGrayfox
Thank you;1;0;False;blackwaterbayhero;dtt321e;Explanation of BTC crash...;7vgj26;https://gfycat.com/ConcernedZestyGrayfox
"u/blackwaterbayhero, you've received `0.00165297 BCH ($1.337 USD)`!
***
[^^How to use](https://np.reddit.com/r/tippr/wiki/index) ^^| [^^What is Bitcoin Cash?](https://learnbitcoin.cash/) ^^| [^^Who accepts it?](https://acceptbitcoin.cash) ^^| ^^Powered ^^by ^^[Rocketr](https://rocketr.net) ^^| ^^r/tippr  
^(Bitcoin Cash is what Bitcoin should be. Ask about it on r/btc)";1;0;False;tippr;dtt0bd3;Explanation of BTC crash...;7vgj26;https://gfycat.com/ConcernedZestyGrayfox
"I want my two memes ([tom cruise](https://i.imgur.com/1RtoakS.gifv) and [star trek](https://i.imgur.com/ZQZcVim.gifv))  also to become successful.

Do you have any tips ? ";3;1;False;Kain_niaK;dtsn9vm;Explanation of BTC crash...;7vgj26;https://gfycat.com/ConcernedZestyGrayfox
Same here.  Missed the first five.  People who obsess on stupid shit like hating memes totally confuse me.  There are better things to complain about. ;2;1;False;BitttBurger;dttg11c;Explanation of BTC crash...;7vgj26;https://gfycat.com/ConcernedZestyGrayfox
That I am Satoshi but because of a split personality I don't know it. ;12;1;False;Kain_niaK;dtsnb9u;Explanation of BTC crash...;7vgj26;https://gfycat.com/ConcernedZestyGrayfox
When things “horrify” you, you’re supposed to walk away from them.  Not stick around and complain.  The door is that way —->;0;1;False;BitttBurger;dttg3lh;Explanation of BTC crash...;7vgj26;https://gfycat.com/ConcernedZestyGrayfox
You only call it such because you dumped it at $300.;1;1;False;nu1x;dttizey;Explanation of BTC crash...;7vgj26;https://gfycat.com/ConcernedZestyGrayfox
Totally irresponsible laughter there, I agree. Jokes must be correct!;-1;0;False;CluelessTwat;dtssckn;Explanation of BTC crash...;7vgj26;https://gfycat.com/ConcernedZestyGrayfox
Another important issue that is highly relevant to this cartoon. You're on a streak.;2;0;False;CluelessTwat;dtst4ct;Explanation of BTC crash...;7vgj26;https://gfycat.com/ConcernedZestyGrayfox
Not as bad as r/autopaizuri;1;0;False;kane49;dtt9gaj;Explanation of BTC crash...;7vgj26;https://gfycat.com/ConcernedZestyGrayfox
This meme was a total provocation! You had to go full 'bcash' in self-defence. Funny cartoons are srs bsns.;2;1;False;CluelessTwat;dtss0tf;Explanation of BTC crash...;7vgj26;https://gfycat.com/ConcernedZestyGrayfox
"r/autofellatio

Ahhh on second thoughts, I'm gonna guess that *does* exist. Risky click of the day, NSFW and whatnot...";-1;2;False;CryptoWithFries;dtsmics;Explanation of BTC crash...;7vgj26;https://gfycat.com/ConcernedZestyGrayfox
I'm not rich, if that's what you are asking? ;3;0;False;noobhodler;dtsr1nv;Explanation of BTC crash...;7vgj26;https://gfycat.com/ConcernedZestyGrayfox
Good post. ;1;0;False;noobhodler;dttf4c1;Explanation of BTC crash...;7vgj26;https://gfycat.com/ConcernedZestyGrayfox
"I like your opinion. 

In truth, if bch were to come out on top (both sides dropping the drama) I wouldn't mind. Evolution is evolution, after all.

My opinion is that neither coin will be dominate in the far off future. Perhaps a new tech not yet developed?

In the meantime, imagine if both coins stood side-by-side and fought of the FUD together. You know, maximising our common strengths instead of screaming about our individual differences?

We probably wouldn't both have trashed our brands to the extent that we have. ";1;0;False;noobhodler;dtt4lm8;Explanation of BTC crash...;7vgj26;https://gfycat.com/ConcernedZestyGrayfox
In direct response to a shit post. Context is everything. ;1;1;False;noobhodler;dtsr31e;Explanation of BTC crash...;7vgj26;https://gfycat.com/ConcernedZestyGrayfox
Haha OH NO;2;0;False;CryptoWithFries;dtsmn3n;Explanation of BTC crash...;7vgj26;https://gfycat.com/ConcernedZestyGrayfox
"You're not making then obvious enough. Could use more facts/nostalgia sprinkled and making the point easier to see.

They're still good though. =)";3;0;False;fruitsofknowledge;dtsoc4l;Explanation of BTC crash...;7vgj26;https://gfycat.com/ConcernedZestyGrayfox
Good Bot;1;1;False;bedla;dtsn6f5;Explanation of BTC crash...;7vgj26;https://gfycat.com/ConcernedZestyGrayfox
I applaud your wit. Totally rectum, as the kids say.;-1;0;False;CluelessTwat;dtst8o1;Explanation of BTC crash...;7vgj26;https://gfycat.com/ConcernedZestyGrayfox
[deleted];-1;1;False;;dtsqogt;Explanation of BTC crash...;7vgj26;https://gfycat.com/ConcernedZestyGrayfox
"I feel like crypto could fall to $100 BTC levels and this sub would still be fighting the same war to be recognize BCH as ‘true’ bitcoin. 

It’s like watching the Lannisters continue playing their power games while the army of the dead is laying waste to all creation. Nobody cares about this fight anymore. There’s bigger problems.";0;1;False;AdamJensensCoat;dttdclc;Explanation of BTC crash...;7vgj26;https://gfycat.com/ConcernedZestyGrayfox
"I agree, the community needs to be less hostile to each other. I feel as if personal holdings are a great influence to that. I hold a small amount of btc, but I can see where it has its faults. I’m not one to sprinkle my comments with ad hominem and meaningless fluff when talking with peoples who’s view differ to my own. 

With that being said, I believe btc will rise again due to speculation of course, but I think what all btc holders should really be betting on is the adoption of lightening network for continuing long term growth. I have my own opinions about how that’ll work out, but that’s not really important. 

What’s important, is that LN could make or break bitcoin, IMO. We’ll just have to see if the devs are able to pull it off, adoption and all. If that doesn’t happen, maybe a completely separate coin will beat btc and bch. That’d be the ultimate end, while both sides were up in arms with each other, the underdog (maybe ethereum) will come take the top spot. 

Who know what’ll happen, this is all *my opinion*
";1;1;False;Blake404;dtt274h;Explanation of BTC crash...;7vgj26;https://gfycat.com/ConcernedZestyGrayfox
"> Everyone in this space should be supporting each other

Refers to BCH as bcash.  ¯\\\_(ツ)_/¯";4;1;False;cravenj1;dtsp6bw;Explanation of BTC crash...;7vgj26;https://gfycat.com/ConcernedZestyGrayfox
The Simpsons movie;1;0;False;Theclash160;dttjj6s;Explanation of BTC crash...;7vgj26;https://gfycat.com/ConcernedZestyGrayfox
I'm glad you know which way the door is. It might come handy soon.;2;0;False;blackwaterbayhero;dtu1n2f;Explanation of BTC crash...;7vgj26;https://gfycat.com/ConcernedZestyGrayfox
"Yeah. You are right. I was a bit childish, and should have resisted.

But let's get things straight. This community gets to call our coin ""core"" because it suits an agenda, but apparently ""bcash"" is not permitted?

You need to pick a position if you are going to be precious. Either drop the core bullshit or accept bcash.  I don't mind either way. 

I can live with core And bcash. Or neither? ";2;2;False;noobhodler;dtssw57;Explanation of BTC crash...;7vgj26;https://gfycat.com/ConcernedZestyGrayfox
[Have a relevant song.](https://youtu.be/STUFbDdEnsY);1;0;False;lilfruini;dttfdst;Explanation of BTC crash...;7vgj26;https://gfycat.com/ConcernedZestyGrayfox
I always said that Brainwallets are stupid, even Satoshi agrees ¯\\\_(ツ)\_/¯;2;0;False;TheDailyToast;dtt9z40;Explanation of BTC crash...;7vgj26;https://gfycat.com/ConcernedZestyGrayfox
Yeah you tell em. Such memes are irresponsible! Laughter needs to be carefully vetted for correctness.;-3;1;False;CluelessTwat;dtsrwlr;Explanation of BTC crash...;7vgj26;https://gfycat.com/ConcernedZestyGrayfox
What about the BCH crash?;1;0;False;;dtt0129;Explanation of BTC crash...;7vgj26;https://gfycat.com/ConcernedZestyGrayfox
That's the explanation? ;1;0;False;avisioncame;dtsy0p4;Explanation of BTC crash...;7vgj26;https://gfycat.com/ConcernedZestyGrayfox
it's sad when a repost has a worse title than when it was previously posted;1;0;False;nutseed;dtswh0m;Explanation of BTC crash...;7vgj26;https://gfycat.com/ConcernedZestyGrayfox
"Meme ripped from /r/bitcoin

REEEEEEEEEEE";1;0;False;Arszilla;dtst1ti;Explanation of BTC crash...;7vgj26;https://gfycat.com/ConcernedZestyGrayfox
Way to steal a meme and make a headline that doesn’t even make sense. There’s no explanation. This is more of a depiction of the crash.   ;2;0;False;CryptoDanny22;dtssgdw;Explanation of BTC crash...;7vgj26;https://gfycat.com/ConcernedZestyGrayfox
This's popped up everywhere.;2;0;False;BTCMONSTER;dttjcze;Explanation of BTC crash...;7vgj26;https://gfycat.com/ConcernedZestyGrayfox
splendid TA;2;0;False;agumonkey;dttgkvq;Explanation of BTC crash...;7vgj26;https://gfycat.com/ConcernedZestyGrayfox
Bitcoin crash;2;0;False;jeriho;dttdh6j;Explanation of BTC crash...;7vgj26;https://gfycat.com/ConcernedZestyGrayfox
This should be updated as it’s been roughly a full day and now at ~6k;2;0;False;b_rad_c;dtt9uih;Explanation of BTC crash...;7vgj26;https://gfycat.com/ConcernedZestyGrayfox
You missed the part were the whole cliff collapsed and the onlookers fell too.;2;0;False;Boraas;dtt7wbu;Explanation of BTC crash...;7vgj26;https://gfycat.com/ConcernedZestyGrayfox
"The night is darkest just before the dawn.
We will rise.";2;0;False;throwawayfirstimer;dtt3iow;Explanation of BTC crash...;7vgj26;https://gfycat.com/ConcernedZestyGrayfox
You forgot about BCH...?;2;0;False;TheSwag777;dtt2ny4;Explanation of BTC crash...;7vgj26;https://gfycat.com/ConcernedZestyGrayfox
"Hey all, first time providing a post. Fairly new to the crypto world. We are on a heck of a roller coaster ride, it's scary and fun, but looking forward to a good green landing. Hang on...
";2;0;False;Rizgiant;dtt2lso;Explanation of BTC crash...;7vgj26;https://gfycat.com/ConcernedZestyGrayfox
Makes perfect sense. Good news is Homer still lives on and the years have been good to him. HODL!;2;0;False;mrsofreshh;dtstwvw;Explanation of BTC crash...;7vgj26;https://gfycat.com/ConcernedZestyGrayfox
"will it ever stop falling ?
";2;0;False;thisisnotreale;dtstljf;Explanation of BTC crash...;7vgj26;https://gfycat.com/ConcernedZestyGrayfox
Haha one of the best episodes, fucking perfectly aligned with Bitcoin ;2;1;False;CryptoWithFries;dtsmjqk;Explanation of BTC crash...;7vgj26;https://gfycat.com/ConcernedZestyGrayfox
Doh;3;0;False;;dtsrtg4;Explanation of BTC crash...;7vgj26;https://gfycat.com/ConcernedZestyGrayfox
Everyone in BCH subreddits is talking as if BCH didn't also crash down from 3k to below 1k. not trying to stir shit here but hey, we're all in this thing together, whether you want to identify with one side of the bch/btc argument or you don't want to pick a side.;18;4;False;blackwaterbayhero;dtsqsxh;Explanation of BTC crash...;7vgj26;https://gfycat.com/ConcernedZestyGrayfox
Gas usually leaves a bloated corpse.;1;0;False;happythots;dtsts6y;Explanation of BTC crash...;7vgj26;https://gfycat.com/ConcernedZestyGrayfox
It's fucking 6k now, wtf is going on?;1;0;False;TCDWarrior;dtt0wwa;Explanation of BTC crash...;7vgj26;https://gfycat.com/ConcernedZestyGrayfox
No, I can't remember the exact figure now, but I dumped bch about  the end of November. In any case, the real reason I got out of bch was this very community. It sounded then, and still does, like a weird cult. ;1;0;False;noobhodler;dtu5z7k;Explanation of BTC crash...;7vgj26;https://gfycat.com/ConcernedZestyGrayfox
Funny thing is that everytime I look, BCH is falling relative to BTC.;1;0;False;mdw;dttf2aj;Explanation of BTC crash...;7vgj26;https://gfycat.com/ConcernedZestyGrayfox
Thanks for dumping you BCH even below this price !;1;0;False;nu1x;dttiwlk;Explanation of BTC crash...;7vgj26;https://gfycat.com/ConcernedZestyGrayfox
BCH is crashing faster than BTC, in case you haven't noticed.;1;0;False;mdw;dttfcdw;Explanation of BTC crash...;7vgj26;https://gfycat.com/ConcernedZestyGrayfox
BCH just dropped below 1000...;2;0;False;TheSwag777;dtt2oot;Explanation of BTC crash...;7vgj26;https://gfycat.com/ConcernedZestyGrayfox
"The new investors are dumping dude, the old ones are buying at every step.

And the new investors are all who bought BTC over 1 K mostly (and other cryptos after that date).";1;0;False;nu1x;dttirzr;Explanation of BTC crash...;7vgj26;https://gfycat.com/ConcernedZestyGrayfox
Wasn't this from the movie?;0;2;False;Theclash160;dtsvtsv;Explanation of BTC crash...;7vgj26;https://gfycat.com/ConcernedZestyGrayfox
It was horrible to see r/bitcoin adopt a win/lose mentality. It’s horrifying to see this sub adopt a lose/lose mentality.;-4;1;False;blackwaterbayhero;dtt34rv;Explanation of BTC crash...;7vgj26;https://gfycat.com/ConcernedZestyGrayfox
"Thank you bedla for voting on sneakpeekbot.  

This bot wants to find the best and worst bots on Reddit. [You can view results here](https://goodbot-badbot.herokuapp.com/).  

 ***  

^^Even ^^if ^^I ^^don't ^^reply ^^to ^^your ^^comment, ^^I'm ^^still ^^listening ^^for ^^votes. ^^Check ^^the ^^webpage ^^to ^^see ^^if ^^your ^^vote ^^registered!";1;0;False;GoodBot_BadBot;dtsn6iz;Explanation of BTC crash...;7vgj26;https://gfycat.com/ConcernedZestyGrayfox
/u/tippr $1.337;1;2;False;sethky;dtt0b3r;Explanation of BTC crash...;7vgj26;https://gfycat.com/ConcernedZestyGrayfox
Dumb;1;0;False;russianheat;dtt9baa;Explanation of BTC crash...;7vgj26;https://gfycat.com/ConcernedZestyGrayfox
"Except one side did correctly identify the bubble economy, while the other went all ""hodl"" and ""buy the dips""...";6;0;False;PKXsteveq;dttctcm;Explanation of BTC crash...;7vgj26;https://gfycat.com/ConcernedZestyGrayfox
For stock market price does matter. Not the same for Crypto though. In fact using fiat to gauge the value of Crypto is against the basic principles of Crypto. 1 BTC is still 1 BTC & that's the important thing that many people tend to ignore.;1;1;False;;dtt9p2q;Explanation of BTC crash...;7vgj26;https://gfycat.com/ConcernedZestyGrayfox
I swear to god me too ;1;0;False;unfurledwarrior5150;dtsqq0e;Explanation of BTC crash...;7vgj26;https://gfycat.com/ConcernedZestyGrayfox
That's great!, I am glad I got to see this on the sixth time!;13;1;False;Esai_9;dtsnf6o;Explanation of BTC crash...;7vgj26;https://gfycat.com/ConcernedZestyGrayfox
*Cold.*;14;0;False;vernaculunar;dtt4w1c;Explanation of BTC crash...;7vgj26;https://gfycat.com/ConcernedZestyGrayfox
