body;score;nb_replies;stickied;author;id;post_title;post_id;post_link
I’m not an expert on dinosaurs. But they are highly suspicious.  Often the paleontologist constructs a whole gigantic dinosaur out of a couple teeth and one bone. It’s called using their imagination.  Look into it. It’s fascinating. So many conspiracies, so little time.  I’ll admit dinosaurs are not in my wheelhouse. Maybe one day. ;0;0;False;NachoKong;dtt8m68;As requested, a picture of a dinosaur holding Bitcoin, while mammals are poised to adapt for the future;7v6hhb;https://i.redd.it/72qgbct2x6e01.jpg
Wow! Thank you so much!;1;1;False;davegutteridge;dtss9gr;As requested, a picture of a dinosaur holding Bitcoin, while mammals are poised to adapt for the future;7v6hhb;https://i.redd.it/72qgbct2x6e01.jpg
Thank you!;1;0;False;davegutteridge;dtssc2y;As requested, a picture of a dinosaur holding Bitcoin, while mammals are poised to adapt for the future;7v6hhb;https://i.redd.it/72qgbct2x6e01.jpg
"> So basically you're saying that BCH is a short term solution correct? It doesn't solve the problem but it reduces it without much effort. 

No, I think BCH is a long-term solution. There is no going back from that fork. BTC shed community and developers and they coalesced around BCH.

We can scale on-chain using BCH for a very long time before we would absolutely need to use secondary layers, that fact is why so many are upset with Core for trying to force everyone onto layer-2 solutions prematurely.

I.E.:

https://www.youtube.com/watch?v=5SJm2ep3X_M

http://blog.vermorel.com/journal/2017/12/17/terabyte-blocks-for-bitcoin-cash.html";1;0;False;Anenome5;dtstgb1;As requested, a picture of a dinosaur holding Bitcoin, while mammals are poised to adapt for the future;7v6hhb;https://i.redd.it/72qgbct2x6e01.jpg
Lmao. So rare and expensive that they’re not safe in a museum right?  And not to mention where is the market for these things?  Is there any?  Give me a break. Absolute hoax. ;1;1;False;NachoKong;dtsodrb;As requested, a picture of a dinosaur holding Bitcoin, while mammals are poised to adapt for the future;7v6hhb;https://i.redd.it/72qgbct2x6e01.jpg
"Your chart is showing transaction price in USD overlaid on transaction volume, but you're using it to draw conclusions for transaction price in sat/byte relative to transaction volume.  

If you look at a [chart showing the transaction fee in sat/byte](https://bitcoinfees.info/) (second on the page), you can actually see it almost mirror the transaction volume chart 1:1, with the dips in transaction volume corresponding to a dip in transaction fee, and a spike in transaction volume corresponding to a spike in transaction fee.  


";1;1;False;NeverComments;dtso8i0;As requested, a picture of a dinosaur holding Bitcoin, while mammals are poised to adapt for the future;7v6hhb;https://i.redd.it/72qgbct2x6e01.jpg
I really do not believe in dinosaurs. In fact. I believe that many ‘dinosaur’ bones are not only regular mammal animal bones, but often the bones of real life human giants as described in the Bible - giants once roamed the earth. The evidence of Giants is covered up swiftly and never taught since it helps verify the claims of the Bible.  ;2;1;False;NachoKong;dtssv83;As requested, a picture of a dinosaur holding Bitcoin, while mammals are poised to adapt for the future;7v6hhb;https://i.redd.it/72qgbct2x6e01.jpg
I got drunk, we continue later;1;0;False;gecikopter;dtt0w6i;As requested, a picture of a dinosaur holding Bitcoin, while mammals are poised to adapt for the future;7v6hhb;https://i.redd.it/72qgbct2x6e01.jpg
[deleted];116;9;False;;dttn3qi;Cointext: Send and receive BCH onchain via SMS. This is a game changer.;7vnoee;https://imgur.com/gDGpSXE
See... second layer, off chain solutions do work and are useful! Who woulda though? Oh wait.... ;2;1;False;ryanisflying;dtu684a;Cointext: Send and receive BCH onchain via SMS. This is a game changer.;7vnoee;https://imgur.com/gDGpSXE
"> Show me a phone that you can buy today that doesn't receive SMS

Mine. It is proprietary and is hard coded at the kernel level to not work if you do not pay the bill.";-3;1;False;;dtu4pfb;Cointext: Send and receive BCH onchain via SMS. This is a game changer.;7vnoee;https://imgur.com/gDGpSXE
that is not spoofing your number;2;1;False;midipoet;dtty56r;Cointext: Send and receive BCH onchain via SMS. This is a game changer.;7vnoee;https://imgur.com/gDGpSXE
Oh them! Thanks a lot for posting the screenshot, it makes it easier to visualize. ;3;0;False;btcnewsupdates;dttqjbs;Cointext: Send and receive BCH onchain via SMS. This is a game changer.;7vnoee;https://imgur.com/gDGpSXE
Fault may lie with the spoof a text idea ...;2;0;False;;dtu2w3e;Cointext: Send and receive BCH onchain via SMS. This is a game changer.;7vnoee;https://imgur.com/gDGpSXE
This can't be spoofed. You can spoof what shows up on the recipient's phone, but not what the API sees and or what the bot does. Already been tested, but thanks for confirming!;11;1;False;Coinivore;dttzltw;Cointext: Send and receive BCH onchain via SMS. This is a game changer.;7vnoee;https://imgur.com/gDGpSXE
Actually you don't even need to clone the SIM. It is quite easy to sign up for API access with any number of SMS companies (e.g. Nexmo) and send SMS with whatever sender number you want.;2;1;False;_jstanley;dtu6sy5;Cointext: Send and receive BCH onchain via SMS. This is a game changer.;7vnoee;https://imgur.com/gDGpSXE
"How can every transaction possibly occur on-chain without you giving your private keys to Cointext?

If you receive money using Cointext you presumably want to spend it using Cointext. If they send it to your on-chain address then they must also know the private key to that address in order for you to be able to spend it.

So even if it's ""on-chain"" it's still putting your coins under Cointext's control.";6;2;False;_jstanley;dttry8g;Cointext: Send and receive BCH onchain via SMS. This is a game changer.;7vnoee;https://imgur.com/gDGpSXE
"This will be fine for the 5 billion unbanked where an entire village might share one flip-phone. With this tech, they can send and receive payments, it means access to the global economy at last, without the gatekeeping money-leeching banks.

It may not be perfect, but it's a start. Later, they can add in enhanced security features. I can easily imagine encrypting texts using the the rolling seed of a 2FA authenticator. By this means, even texting can be made relatively secure, and it just has to be setup in person once.";10;1;False;Anenome5;dtudah4;Cointext: Send and receive BCH onchain via SMS. This is a game changer.;7vnoee;https://imgur.com/gDGpSXE
"u/evantbyrne, you've received `0.00002 BCH ($0.01777212 USD)`!
***
[^^How to use](https://np.reddit.com/r/tippr/wiki/index) ^^| [^^What is Bitcoin Cash?](https://learnbitcoin.cash/) ^^| [^^Who accepts it?](https://acceptbitcoin.cash) ^^| ^^Powered ^^by ^^[Rocketr](https://rocketr.net) ^^| ^^r/tippr  
^(Bitcoin Cash is what Bitcoin should be. Ask about it on r/btc)";2;0;False;tippr;dtu1qxy;Cointext: Send and receive BCH onchain via SMS. This is a game changer.;7vnoee;https://imgur.com/gDGpSXE
You mean $0..? if someone has the resources, its a viable attack vector ;2;0;False;andybfmv96;dtue194;Cointext: Send and receive BCH onchain via SMS. This is a game changer.;7vnoee;https://imgur.com/gDGpSXE
Why are you being such a Debbie downer?;6;0;False;superhash;dttscjh;Cointext: Send and receive BCH onchain via SMS. This is a game changer.;7vnoee;https://imgur.com/gDGpSXE
"It may not be ""luxury"" but they are not as commonplace as in the us or eu.

Also, picture this: you can send BCH to anyone in the world who owns a mobile phone, even without installing a wallet, even without knowing how cryptos work, even without having anything to do to receive.

Yes, this is a game changer.";4;0;False;mtrycz;dtu07zv;Cointext: Send and receive BCH onchain via SMS. This is a game changer.;7vnoee;https://imgur.com/gDGpSXE
"It could also be the other way round though no? 

A few autobots quickly downvoting any comment attached to a specific user, then after a while the consensus forms and overrides the first few downvotes. 

I have actually seen that behaviour with my own posts on r/btc. ";1;0;False;midipoet;dtuhf1s;Cointext: Send and receive BCH onchain via SMS. This is a game changer.;7vnoee;https://imgur.com/gDGpSXE
[deleted];34;3;False;;dtu0i4g;Cointext: Send and receive BCH onchain via SMS. This is a game changer.;7vnoee;https://imgur.com/gDGpSXE
It was first proposed to use in Bitcoin in 2013, but Core refused to work on it.;5;0;False;Anenome5;dtud5ys;Cointext: Send and receive BCH onchain via SMS. This is a game changer.;7vnoee;https://imgur.com/gDGpSXE
Oh alright, just treat it like money. Thanks.;1;1;False;PM_UR_TITS_SILLYGIRL;dtu3e68;Cointext: Send and receive BCH onchain via SMS. This is a game changer.;7vnoee;https://imgur.com/gDGpSXE
The idea is that someone just goes through the process of switching an old phone number to a new device. You'll probably need basic information on the person like name, address, and last four digits of SSN. This process might vary by carrier. I don't recall receiving a notice when I did it for my personal phone number.;1;1;False;;dtu3c32;Cointext: Send and receive BCH onchain via SMS. This is a game changer.;7vnoee;https://imgur.com/gDGpSXE
"Check the links in the bot's comment. You can also randomly tip people like this u/tippr 0.0002018 BCH
";2;2;False;mtrycz;dtu275l;Cointext: Send and receive BCH onchain via SMS. This is a game changer.;7vnoee;https://imgur.com/gDGpSXE
"> countries where a smartphone is luxury.

Which countries are these? How large is their population? How likely are they to care about crypto? 

";-4;3;False;caveden;dtto9xp;Cointext: Send and receive BCH onchain via SMS. This is a game changer.;7vnoee;https://imgur.com/gDGpSXE
"All it takes is for this to start seeing any level of traction and every SMS gateway operator will have at least one rogue employee sniffing SMS traffic looking for gullible marks to steal from.
";3;0;False;cointastical;dtu5a8j;Cointext: Send and receive BCH onchain via SMS. This is a game changer.;7vnoee;https://imgur.com/gDGpSXE
Lol oh okay so if you don't have a cellular subscription you don't get texts? Yes you're right about that.;5;1;False;God_Emperor_of_Dune;dtu51it;Cointext: Send and receive BCH onchain via SMS. This is a game changer.;7vnoee;https://imgur.com/gDGpSXE
See comment below. You, of course, are a troll anyways who doesn't give a shit about BCH, so I'm sure you're just trolling.;-7;1;False;God_Emperor_of_Dune;dttz9q4;Cointext: Send and receive BCH onchain via SMS. This is a game changer.;7vnoee;https://imgur.com/gDGpSXE
If you want to use SMS for something, it should be for delivering signed transactions from payer to payee. ;3;0;False;chrisrico;dtucz3l;Cointext: Send and receive BCH onchain via SMS. This is a game changer.;7vnoee;https://imgur.com/gDGpSXE
Explain how it can't be spoofed? Is the wallet linked to an individual device, or to a phone number? How does the system deal with a cloned sim?;13;0;False;midipoet;dtu0dc4;Cointext: Send and receive BCH onchain via SMS. This is a game changer.;7vnoee;https://imgur.com/gDGpSXE
We just need to get them connected enough that they can authenticate to us who they are and what their situation is. That's all it'll take to bootstrap them very quickly. Imagine a serious authenticated post where we all have serious reason to believe it where someone's saying, seriously I'm in a poor country and I can't afford a smart phone and I need $10 so I can get a phone. We'd chip in and get that person a phone, no problem. The prices of phones are plummeting and our ability to collaborate to distribute them is zooming, they're going to cross so quickly.;3;1;False;mungojelly;dtue3w5;Cointext: Send and receive BCH onchain via SMS. This is a game changer.;7vnoee;https://imgur.com/gDGpSXE
okay;-5;0;False;iidxdistorteD;dttu3z3;Cointext: Send and receive BCH onchain via SMS. This is a game changer.;7vnoee;https://imgur.com/gDGpSXE
seriusly? there are no cheaper contracts? for x free SMS? i thought thats standard by now because noone is using them anymore..;3;1;False;crasheger;dttt7yn;Cointext: Send and receive BCH onchain via SMS. This is a game changer.;7vnoee;https://imgur.com/gDGpSXE
Either you did it wrong or this is a lie. It is not possible to tell whether an SMS is spoofed.;16;2;False;_jstanley;dttrtu3;Cointext: Send and receive BCH onchain via SMS. This is a game changer.;7vnoee;https://imgur.com/gDGpSXE
I never knew this bot could do that, I need to set that up later!;3;0;False;PitchforkAssistant;dttp8a1;Cointext: Send and receive BCH onchain via SMS. This is a game changer.;7vnoee;https://imgur.com/gDGpSXE
You're right. I don't think they're that far along ( could be wrong though ) but it's a start!;2;0;False;SharkLaserrrrr;dtu6wba;Cointext: Send and receive BCH onchain via SMS. This is a game changer.;7vnoee;https://imgur.com/gDGpSXE
[deleted];4;1;False;;dtu05kh;Cointext: Send and receive BCH onchain via SMS. This is a game changer.;7vnoee;https://imgur.com/gDGpSXE
"People keep saying that and while true you sound like a gumpy old person that refuses to see the bigger picture. 

I'm 100% BCH.";2;0;False;TyMyShoes;dtu67fr;Cointext: Send and receive BCH onchain via SMS. This is a game changer.;7vnoee;https://imgur.com/gDGpSXE
"That's the idea, yeah :)

With the difference that it's incredibly easy to transact over the internet, no accounts, no permissions.

Like u/tippr $1";1;3;False;mtrycz;dtuebk6;Cointext: Send and receive BCH onchain via SMS. This is a game changer.;7vnoee;https://imgur.com/gDGpSXE
agreed, WhatsApp would be huge too!;5;1;False;squarepush3r;dttpb9g;Cointext: Send and receive BCH onchain via SMS. This is a game changer.;7vnoee;https://imgur.com/gDGpSXE
they would have to have a phone that is on, or an app that lets them receive texts, if they shut off any ability to dl new apps it would be a no go ...;1;1;False;;dtu35h6;Cointext: Send and receive BCH onchain via SMS. This is a game changer.;7vnoee;https://imgur.com/gDGpSXE
[deleted];20;3;False;;dttndch;Cointext: Send and receive BCH onchain via SMS. This is a game changer.;7vnoee;https://imgur.com/gDGpSXE
Explain to the people that don’t know just how easily your phone can be hijacked... Like how it’s actually done and what to look out for on the device if they have already done so. ;3;2;False;MLHTampa;dtu2bxs;Cointext: Send and receive BCH onchain via SMS. This is a game changer.;7vnoee;https://imgur.com/gDGpSXE
"> average

does not mean anything my friend.. there are always individuals earning much much less even in 1st world...";4;0;False;crasheger;dttsyby;Cointext: Send and receive BCH onchain via SMS. This is a game changer.;7vnoee;https://imgur.com/gDGpSXE
"Is this how you speak to your coworkers? Accuse them of lying the instant something doesnt fit to your expectation?

You are not wrong. But....";8;1;False;mrtest001;dttul65;Cointext: Send and receive BCH onchain via SMS. This is a game changer.;7vnoee;https://imgur.com/gDGpSXE
"Okay. I spent my own money to buy 5 messages on this website: https://www.spoofmytextmessage.com/spoof-text-messages

I then inserted my own phone number as the spoofed number. I inserted the Cointext number as the recipient number. I had ""Send $.1 XXXXXXXXXX"" as the message, where XXXXXXXXXX is a phone number of another individual with me.

I never got a message that something had been sent, and the individual next to me didn't get a message either.";12;2;False;God_Emperor_of_Dune;dttz7v7;Cointext: Send and receive BCH onchain via SMS. This is a game changer.;7vnoee;https://imgur.com/gDGpSXE
Cell phones are not security devices. ;14;1;False;Zer000sum;dtu4w2i;Cointext: Send and receive BCH onchain via SMS. This is a game changer.;7vnoee;https://imgur.com/gDGpSXE
This is true but it's a bigger problem than crypto. People rely on cell phones for lots of things. Presidents of countries tweet on their cell phones and their tweets can move whole markets zillions of dollars.;6;1;False;mungojelly;dtu73l7;Cointext: Send and receive BCH onchain via SMS. This is a game changer.;7vnoee;https://imgur.com/gDGpSXE
With my carrier I did this entirely on line by logging into the carrier web site.;2;0;False;tl121;dtucj4c;Cointext: Send and receive BCH onchain via SMS. This is a game changer.;7vnoee;https://imgur.com/gDGpSXE
"You could start by explaining to us how you spoofed the number.

Given that 2 hours ago you didn't even know it was possible, I stand by what I said: either you did it wrong or it's a lie.";14;1;False;_jstanley;dtty048;Cointext: Send and receive BCH onchain via SMS. This is a game changer.;7vnoee;https://imgur.com/gDGpSXE
"So your have two simcards of the same number, with one on a cloned sim, and you sent the text from the cloned sim phone. 

Is this what you are saying?";-1;2;False;midipoet;dttw177;Cointext: Send and receive BCH onchain via SMS. This is a game changer.;7vnoee;https://imgur.com/gDGpSXE
"The probability that my coworkers are trying to scam people is much lower than the probability that some random dude on reddit is trying to scam people.

Especially when talking about cryptocurrency, and *especially* when making claims that are technical impossibilities.

I don't think there's much to be gained by being polite to these people.";3;1;False;_jstanley;dtu0anz;Cointext: Send and receive BCH onchain via SMS. This is a game changer.;7vnoee;https://imgur.com/gDGpSXE
The solution is simple. Don't give out your phone number. /s;2;0;False;Nephyst;dttxnfe;Cointext: Send and receive BCH onchain via SMS. This is a game changer.;7vnoee;https://imgur.com/gDGpSXE
u/TragicallyHopeful This could be easily prevented with a simple confirmation SMS to the phone number used as the sending one.;6;1;False;zhell_;dttpmf5;Cointext: Send and receive BCH onchain via SMS. This is a game changer.;7vnoee;https://imgur.com/gDGpSXE
They banned ads for ICOs because the majority of them were scams. I don't see how that would affect a WhatsApp bot at all. ;6;0;False;PhyllisWheatenhousen;dtu9hb1;Cointext: Send and receive BCH onchain via SMS. This is a game changer.;7vnoee;https://imgur.com/gDGpSXE
"> Every phone can natively receive SMS

Bullshit";2;1;False;;dtu3nw6;Cointext: Send and receive BCH onchain via SMS. This is a game changer.;7vnoee;https://imgur.com/gDGpSXE
"According to the largest list [here], the only countries with a yearly average income lower than $730 (or $2 daily) are the Central African Republic and perhaps Somalia. Hardly ""countless"".

$2 per day is the very definition of extreme poverty by the World Bank, if I'm not mistaken. Luckily, thanks to all progress brought by capitalism and globalization, only a small percentage of the World population still lives by such extreme standards. 

In the greatest majority of countries (poor countries!), smartphones are commonplace. Far from ""luxury"". And not that I don't want to help these other few places where smartphones might actually be hard to access, it's just that I really don't think it will happen before BCH is well used and has a large network effect outside of these places. What's the percentage of people living on these extreme low wages that is actually literate enough to use this app?

Investing time and effort on SMS today to me sounds like a waste of resources.";-6;3;False;caveden;dttrc17;Cointext: Send and receive BCH onchain via SMS. This is a game changer.;7vnoee;https://imgur.com/gDGpSXE
"You said yourself that 1/2 of them are smartphones, so they're definitely not a ""luxury"" as the other poster said. And you're talking about very poor places. So, why even bother about SMS at all?";-4;2;False;caveden;dttqoxj;Cointext: Send and receive BCH onchain via SMS. This is a game changer.;7vnoee;https://imgur.com/gDGpSXE
"Ideally you can sell goods or services for BCH. Otherwise you can exchange them for fiat, like you would exchange USD for EUR, on one of the major exchange sites, eg. Coinbase or localbitcoincash.

If you have a top end graphics card, you can mine some altcoins and exchange them for BCH (or whatever you prefer). If you're a content creator, you can post your content on a site like yours.com

";2;1;False;mtrycz;dtu38hj;Cointext: Send and receive BCH onchain via SMS. This is a game changer.;7vnoee;https://imgur.com/gDGpSXE
You can buy Bitcoin and the other major alt coins like Bitcoin Cash, Etherium or Lite coin from an exchange. Or you can sell goods/services online and receive coins as payment directly to your wallet. ;2;0;False;ryanisflying;dtu7eu7;Cointext: Send and receive BCH onchain via SMS. This is a game changer.;7vnoee;https://imgur.com/gDGpSXE
Ok that makes sense, thanks!;5;0;False;josiahromoser;dttttuk;Cointext: Send and receive BCH onchain via SMS. This is a game changer.;7vnoee;https://imgur.com/gDGpSXE
SMS can be spoofed and is sent in the clear. It's pretty much like  like writing a check, making a paper airplane, throwing it, and wandering why it's not secure.;4;0;False;Hohenheim_of_Shadow;dtuec97;Cointext: Send and receive BCH onchain via SMS. This is a game changer.;7vnoee;https://imgur.com/gDGpSXE
"Okay... I sent a text to the phone number in the screenshot while spoofing my own phone number. I send ""Send $0.1 XXXXXXXXXX"". Nothing happened.

Not sure how I can prove that to you, but I'm 90% sure I did it correctly.";16;2;False;God_Emperor_of_Dune;dttt37o;Cointext: Send and receive BCH onchain via SMS. This is a game changer.;7vnoee;https://imgur.com/gDGpSXE
No. It was two numbers.;2;1;False;God_Emperor_of_Dune;dttxyss;Cointext: Send and receive BCH onchain via SMS. This is a game changer.;7vnoee;https://imgur.com/gDGpSXE
"This would be a little annoying from a usability perspective though as compared to how it works now.

I am waiting for another confirmation on my payment to go through to buy some spoofs (they take BCH!), then I will test this and see what happens.";7;0;False;God_Emperor_of_Dune;dttq13r;Cointext: Send and receive BCH onchain via SMS. This is a game changer.;7vnoee;https://imgur.com/gDGpSXE
Interesting... I'll see what happens and report back.;9;1;False;God_Emperor_of_Dune;dttnkt5;Cointext: Send and receive BCH onchain via SMS. This is a game changer.;7vnoee;https://imgur.com/gDGpSXE
"What about adding a 2FA on the SMS from a pre-configured google authenticator that the user has set at the first registration?

Something like: ""Send $0.50 5448675309 436375"" -> [SEND] [AMOUNT] [NUMBER] [2FA]

Sure, google authenticator app isn't available on old phones...";3;0;False;HostFat;dttwdk2;Cointext: Send and receive BCH onchain via SMS. This is a game changer.;7vnoee;https://imgur.com/gDGpSXE
"One of my banks blocks sms-based authentication for a couple of days whenever I get a new SIM for the *same* mobile number. So there are SIM-coupled origin checks possible it seems...

I gather my bank does this to thwart social engineering tricks mentioned elsethread, but I surmise it would help against this SMS origin spoofing too.";2;0;False;Collaborationeur;dttxzo2;Cointext: Send and receive BCH onchain via SMS. This is a game changer.;7vnoee;https://imgur.com/gDGpSXE
Could you elaborate on that? I guess i dont know why it would or wouldnt be secure. Thank you. ;3;1;False;INeverMisspell;dtu82gp;Cointext: Send and receive BCH onchain via SMS. This is a game changer.;7vnoee;https://imgur.com/gDGpSXE
"Then work on something else.

This is anything but a waste of resources.";10;0;False;God_Emperor_of_Dune;dttrp41;Cointext: Send and receive BCH onchain via SMS. This is a game changer.;7vnoee;https://imgur.com/gDGpSXE
It is owned by Facebook, who just banned crypto... not so sure if this comes soon.;4;1;False;SeppDepp2;dttxh48;Cointext: Send and receive BCH onchain via SMS. This is a game changer.;7vnoee;https://imgur.com/gDGpSXE
Every phone can natively receive SMS. The phone can be off as well.;2;1;False;God_Emperor_of_Dune;dtu3ks2;Cointext: Send and receive BCH onchain via SMS. This is a game changer.;7vnoee;https://imgur.com/gDGpSXE
"These people are part of your/my/our community.

We can spare some time to play nice.  Huge difference if a known bad actor shows up and starting painting a story, then fair game.";0;0;False;Vincents_keyboard;dtu2g03;Cointext: Send and receive BCH onchain via SMS. This is a game changer.;7vnoee;https://imgur.com/gDGpSXE
There are countless countries where individuals make less than $2 a day. This is EXACTLY what these countries need.;15;1;False;God_Emperor_of_Dune;dttp3w1;Cointext: Send and receive BCH onchain via SMS. This is a game changer.;7vnoee;https://imgur.com/gDGpSXE
Homework :);3;0;False;btcnewsupdates;dttp3lx;Cointext: Send and receive BCH onchain via SMS. This is a game changer.;7vnoee;https://imgur.com/gDGpSXE
It was the only plan available that wouldn't cut internet after I used too many bytes, just slow it down.;1;0;False;TiagoTiagoT;dtu3tvq;Cointext: Send and receive BCH onchain via SMS. This is a game changer.;7vnoee;https://imgur.com/gDGpSXE
"u/PM_UR_TITS_SILLYGIRL, you've received `0.0002018 BCH ($0.18 USD)`!
***
[^^How to use](https://np.reddit.com/r/tippr/wiki/index) ^^| [^^What is Bitcoin Cash?](https://learnbitcoin.cash/) ^^| [^^Who accepts it?](https://acceptbitcoin.cash) ^^| ^^Powered ^^by ^^[Rocketr](https://rocketr.net) ^^| ^^r/tippr  
^(Bitcoin Cash is what Bitcoin should be. Ask about it on r/btc)";1;0;False;tippr;dtu27i2;Cointext: Send and receive BCH onchain via SMS. This is a game changer.;7vnoee;https://imgur.com/gDGpSXE
[deleted];1;2;False;;dtu2s9m;Cointext: Send and receive BCH onchain via SMS. This is a game changer.;7vnoee;https://imgur.com/gDGpSXE
