body;score;nb_replies;stickied;author;id;post_title;post_id;post_link
You forgot the part where Homer farted and out came Bitcoin Cash.;0;2;False;Zachincool;dtsp3xo;Explanation of BTC crash...;7vgj26;https://gfycat.com/ConcernedZestyGrayfox
Oh... BCH is not crashing then?;1;0;False;buyBitc0in;dttf6pc;Explanation of BTC crash...;7vgj26;https://gfycat.com/ConcernedZestyGrayfox
They fall later in the gif ;1;0;False;DiNovi;dtsu3r6;Explanation of BTC crash...;7vgj26;https://gfycat.com/ConcernedZestyGrayfox
hahaha this is gold.;74;2;False;XeNo-Sigma;dtt44qp;When you bought in December;7vky4d;https://v.redd.it/0gp95uf9tie01
[deleted];1;1;False;;dttt2mh;When you bought in December;7vky4d;https://v.redd.it/0gp95uf9tie01
Ten bucks a week.  It ain't much but it's something we can afford.;5;1;False;LostPinesYauponTea;dttn071;When you bought in December;7vky4d;https://v.redd.it/0gp95uf9tie01
Yeah. Ironically, now is the time to buy. When the community is silent.;14;3;False;nathanweisser;dtthrvt;When you bought in December;7vky4d;https://v.redd.it/0gp95uf9tie01
Wassa wassa wassa wassuuuuup!;13;1;False;Fnuller15;dttru88;When you bought in December;7vky4d;https://v.redd.it/0gp95uf9tie01
He cried because his mom died...;-1;2;False;Fantasticxbox;dttwbaz;When you bought in December;7vky4d;https://v.redd.it/0gp95uf9tie01
Yes!  Finally, someone understands me!;1;0;False;TokeyWakenbaker;dttq81p;When you bought in December;7vky4d;https://v.redd.it/0gp95uf9tie01
"Video linked by /u/Kain_niaK:

Title|Channel|Published|Duration|Likes|Total Views
:----------:|:----------:|:----------:|:----------:|:----------:|:----------:
[Changing 1 to 0 - Rick and Morty [season 3]](https://youtube.com/watch?v=noQsHiTJAXo)|Rick Sanchez|2017-04-02|0:01:17|84+ (98%)|10,970

> changing 1 to 0 - Rick and Morty season 3 episode 1

---

[^Info](https://np.reddit.com/r/youtubot/wiki/index) ^| [^/u/Kain_niaK ^can ^delete](https://np.reddit.com/message/compose/?to=_youtubot_&subject=delete\%20comment&message=dttce2u\%0A\%0AReason\%3A\%20\%2A\%2Aplease+help+us+improve\%2A\%2A) ^| ^v2.0.0";3;0;False;_youtubot_;dttce2u;When you bought in December;7vky4d;https://v.redd.it/0gp95uf9tie01
"But definitely not Bcash: ""Now take this one integer and change it. commit! new hard fork!""";-5;1;False;JezusBakersfield;dttkpmy;When you bought in December;7vky4d;https://v.redd.it/0gp95uf9tie01
"There was a specific verb you used there: ""scaling"". Bcash didn't address that, it delayed the inevitable. Bcash is a scam for non techies that will run into the same wall that BTC is actually addressing in production already through LN and Segwit. Bcash is literally BTC 6+ months ago with 1 integer changed.";-1;2;False;JezusBakersfield;dttm5tl;When you bought in December;7vky4d;https://v.redd.it/0gp95uf9tie01
If you mean that newer experimetnal technologies have appeared in the ecosystem then I'm sure there is a lot of experiments going on. But for me Bitcoin doesn't start and finish with the technological aspect... for me Bitcoin a genius consensus system leveraged on technology to maintain an equilibrium of incentives. I'm not interested in the change of the technology for the sake of it, but for evolving that system, respecting the spirit behind its inception, its incentives system, the proved POW mechanism, and make them work better without changing them fundamentally, which is the opposite of what Core was perpetrating with the old Bitcoin, poor old Bitcoin.;1;0;False;Itilvte;dttodhv;When you bought in December;7vky4d;https://v.redd.it/0gp95uf9tie01
Ok,my opinion now nothing really to back it up with, Bitcoin Core and Blockstream have squandered their 1st mover advantage by their intransigent and obdurate refusal to promptly address the scaling requirements and instead have proffered complexity and complexity to deal with an issue that should have been dealt with in a common sense manner. Their not so well hidden agendas have destroyed the speed and cost advantage and with it the value of Bitcoin Core. On August 1st 2017 Bitcoin Cash picked up Satoshi's vision and moved forward. Bitcoin Core is a failing experiment and as more people become aware of the limitations and compromises that the core solutions entail the wiser heads will be leaving quietly and making other arrangements. You can fool some of the people some of the time and Bitcoin Core has been counting on that for a while the rest of us who won't be fooled have already moved on. In my opinion, Bitcoin is irrelevant and this is soley because of the Core Devs actions over the last 4 year span. They have destroyed the essential utility of Bitcoin and perhaps that was what they were paid to do.;5;1;False;;dttjoyz;When you bought in December;7vky4d;https://v.redd.it/0gp95uf9tie01
I just logged in and bought some more because we are oversold. The closer we get to tax time the worse things will get I think but I am getting what I like now and will wait this out until next year because year over year gains matter not day over day.;2;0;False;;dttihd2;When you bought in December;7vky4d;https://v.redd.it/0gp95uf9tie01
"It's pretty ignorant to think that this is the end. speaking about no coin in specific, the leaders of block chain projects - real projects with goals, not shit coins - aren't as pressed about the ""price"" of a token or coin as the ignorant masses that bought these astoundingly unsustainable all time highs. Most people that got in for a quick buck or moon lambos got burned, the rest don't care because that's just how markets move.";2;0;False;Derpy_Toast;dttk9pk;When you bought in December;7vky4d;https://v.redd.it/0gp95uf9tie01
I guessed when I bought in on August 1 2017, I guessed when I bought Ethereum in 2016, I guessed when I bought Bitcoin in 2013, I don't know what else am I supposed to do? I guess that if I have a 3 year time line all of this will even out and I will be in more profits. Unless everything goes to zero I am pretty much in a NO LOSE situation. I bought yesterday and bought today, if the prices continue downward I am buying tomorrow. I am not smart enough to trade. I am smart enough however to buy a downturn and wait. More people should do that. If you can't you are investing money you shouldnt.;12;2;False;;dttjz6l;When you bought in December;7vky4d;https://v.redd.it/0gp95uf9tie01
Everyone was saying to buy everything.;23;1;False;e1-c;dtthppu;When you bought in December;7vky4d;https://v.redd.it/0gp95uf9tie01
....slap!!;3;0;False;crypt0_n1ght;dttn032;When you bought in December;7vky4d;https://v.redd.it/0gp95uf9tie01
Hey hey heeeeyyy;17;1;False;e1-c;dttn3yr;When you bought in December;7vky4d;https://v.redd.it/0gp95uf9tie01
[Are you gonna miss your mom?](https://youtu.be/US48w_j85LA);3;0;False;kaO_rosseforP;dttqv5b;When you bought in December;7vky4d;https://v.redd.it/0gp95uf9tie01
Not in terms of digital cash.;1;0;False;liquorstorevip;dttmu9y;When you bought in December;7vky4d;https://v.redd.it/0gp95uf9tie01
RemindMe! 1 year;1;1;False;JezusBakersfield;dttsjc6;When you bought in December;7vky4d;https://v.redd.it/0gp95uf9tie01
Was that so hard? It completely fixed all the congestion problems. Core chain is still crippled.;7;0;False;zombojoe;dttlmy8;When you bought in December;7vky4d;https://v.redd.it/0gp95uf9tie01
Really? The reporter seems to be off tone for that.;2;3;False;deepuv;dttyj06;When you bought in December;7vky4d;https://v.redd.it/0gp95uf9tie01
1 year from now we will both see then wont we? The declining dominance is a clue pointing in the right direction;2;1;False;;dttpr60;When you bought in December;7vky4d;https://v.redd.it/0gp95uf9tie01
Whaaaht;6;0;False;;dttw7ud;When you bought in December;7vky4d;https://v.redd.it/0gp95uf9tie01
lol the funny thing that disproves your theory and reveals your insecurity is that you're here shilling in r/Bitcoin;1;1;False;JezusBakersfield;dttoncm;When you bought in December;7vky4d;https://v.redd.it/0gp95uf9tie01
good for you!;1;0;False;nathanweisser;dtu3wzh;When you bought in December;7vky4d;https://v.redd.it/0gp95uf9tie01
yeah definitely let's not do that;1;0;False;nathanweisser;dtu3na0;When you bought in December;7vky4d;https://v.redd.it/0gp95uf9tie01
same :);7;0;False;nathanweisser;dttj0rf;When you bought in December;7vky4d;https://v.redd.it/0gp95uf9tie01
Thas a scam!;9;1;False;ItWorksEveryTime;dttvf83;When you bought in December;7vky4d;https://v.redd.it/0gp95uf9tie01
That was because she did not know about it. It was during his first day of school. She was asking if he missed his mom thinking she was home.;-1;0;False;Fantasticxbox;dtu2dsa;When you bought in December;7vky4d;https://v.redd.it/0gp95uf9tie01
His mom was right there next to them https://www.youtube.com/watch?v=jZYuXzcK3Q8;10;1;False;TheLeft_Created_ISIS;dtudh55;When you bought in December;7vky4d;https://v.redd.it/0gp95uf9tie01
https://www.youtube.com/watch?v=jZYuXzcK3Q8 She is alive;4;0;False;TheLeft_Created_ISIS;dtudghu;When you bought in December;7vky4d;https://v.redd.it/0gp95uf9tie01
"> Bcash didn't address that, it delayed the inevitable.

If you mean Bitcoin Cash, it does address the scaling theme in the way it was supposed to be since the beginning, the way it works, because there never was a scaling problem.  Bitcoin Cash devs are developing many interesting technologies for making sure of that there wont ever be a scaling problem at all (graphene, subchains, weakblocks, etc.).

Only there is a scaling problem for BTC, because Core made sure of that, by artificially crippling the system and spreading FUD regarding ""centralization concerns"", like if there were no bigger concerns in the centralization of the development by a malicious or incompetent dev team.

> A scam for non techies

That would be BTC, with its censored, non-transparent community where no technical discussions or any kind of criticism is allowed, with all the propaganda and the kool-aid people drink there like if it was milk and honey.

> BTC is actually addressing in production already through LN & Segwit

Bad pre-alpha hyper-complex technology that isn't intended as a scaling system and that wont work as advertised, with many problems of its own, mainly on routing and security, and that fundamentally changes the incentives system and the network topology that Bitcoin had to a much more vulnerable and centralized one.

> Bcash is literally BTC 6+ months ago with 1 integer changed.

If you mean Bitcoin Cash, you are literally lying.
";2;0;False;Itilvte;dttpt36;When you bought in December;7vky4d;https://v.redd.it/0gp95uf9tie01
''delaying the inevitable'' its funny you used that phrase because its something I have used to describe Bitcoin Cores ballistic arc development trajectory.  The upside is over for Bitcoin Core, all that remains now is to see where it lands.;1;1;False;;dttmnpe;When you bought in December;7vky4d;https://v.redd.it/0gp95uf9tie01
"Infinite growth is possible but human nature makes us look at timescales that are relevant to us. Slow growth might be sustainable but as an investor class crypto enthusiasts have been spoiled by multi digit gains. ADHD Investors want things quickly and if its not happening they get disappointed and move on.  $100k Bitcoin with $5000 transaction fees is useless. I think that Bitcoin is going to get the Coup De Grace from China when they Nationalise all Bitcoin Miners as a strategic asset and force miners to use their Hash Power to secure the Digital Yuan or Digital Renimbi.  This I think will happen
It makes too much sense not to. Cripple your rival and strengthen your own version. People invested in Bitcoin should take a longer view ";2;0;False;;dttu7vv;When you bought in December;7vky4d;https://v.redd.it/0gp95uf9tie01
52 x 10 = $520 per year its not an amount that you will miss one way or the other. If you keep doing that over a few years you will wind up going I should have put more in (LOL) strange but true. Crypto will make you look for ways to save to invest.;1;0;False;;dttn9li;When you bought in December;7vky4d;https://v.redd.it/0gp95uf9tie01
I’m buying now. ;2;1;False;covfefeobamanation;dttm57k;When you bought in December;7vky4d;https://v.redd.it/0gp95uf9tie01
Not TRX though lol;2;1;False;wtf--dude;dttu9gn;When you bought in December;7vky4d;https://v.redd.it/0gp95uf9tie01
I was expecting this so now I'm so happy :);11;1;False;e1-c;dttiiih;When you bought in December;7vky4d;https://v.redd.it/0gp95uf9tie01
Whatamagonnahdoo;9;1;False;;dttulvl;When you bought in December;7vky4d;https://v.redd.it/0gp95uf9tie01
Oh crap, I may have mixed up two stories;2;0;False;Fantasticxbox;dtuewkv;When you bought in December;7vky4d;https://v.redd.it/0gp95uf9tie01
So, essentially what you're saying is: ;2;1;False;MrTversted;dttptxd;When you bought in December;7vky4d;https://v.redd.it/0gp95uf9tie01
"[Source](https://www.youtube.com/watch?v=US48w_j85LA)

Reporter: are you gonna miss your mom?

Kid: *sheepish* No...

Kid: *cries*

";9;1;False;GhastlyParadox;dttqp82;When you bought in December;7vky4d;https://v.redd.it/0gp95uf9tie01
"You... You promise?

I bought in December ($800) and doubled down in early Jan. 

I just can't sink any more fun money. ";0;0;False;iPlowedYourMom;dttlb41;When you bought in December;7vky4d;https://v.redd.it/0gp95uf9tie01
"You have lost nothing if you don't sell, what's up with the drama? 

Or did you buy in December to sell Now? Seriously, the 600 Billion that left CC, will be back soon and guess what? They mostly enter back via Bitcoin. ";1;0;False;HowRealityWorks;dttjatg;When you bought in December;7vky4d;https://v.redd.it/0gp95uf9tie01
This meme applies to everything hahah;1;0;False;BTCMONSTER;dttjaca;When you bought in December;7vky4d;https://v.redd.it/0gp95uf9tie01
Well hodl is the last comfort for everyone keep these wallets tight.;1;0;False;Styletokill;dtthqfk;When you bought in December;7vky4d;https://v.redd.it/0gp95uf9tie01
😂😂😂;1;0;False;Lucasozim;dttfhzx;When you bought in December;7vky4d;https://v.redd.it/0gp95uf9tie01
I didn't buy in December but I feel the same and want to cry but then I hodl my tears and my btc...;1;0;False;carreddit;dttdpaz;When you bought in December;7vky4d;https://v.redd.it/0gp95uf9tie01
I’ll just HODL but this is appropriate ;3;0;False;throwawayfirstimer;dtt7877;When you bought in December;7vky4d;https://v.redd.it/0gp95uf9tie01
If you don`t need money tomorrow, there is no meaning to what is happening today in the market - And if you NEED money tomorrow - your money should not be in the market in the first place .;2;0;False;MaxDataIO;dttw9pa;When you bought in December;7vky4d;https://v.redd.it/0gp95uf9tie01
How 85% of crypto traders feel.;2;0;False;;dttt6li;When you bought in December;7vky4d;https://v.redd.it/0gp95uf9tie01
MeIRL;1;0;False;ayoitscunha;dttq8de;When you bought in December;7vky4d;https://v.redd.it/0gp95uf9tie01
I bought in December.  December 2012.  I continue to hodl - (but I kind of wish I had sodl last December);2;0;False;clea;dttpids;When you bought in December;7vky4d;https://v.redd.it/0gp95uf9tie01
I did but I’m hodling!;2;0;False;joghum;dttgsug;When you bought in December;7vky4d;https://v.redd.it/0gp95uf9tie01
This is me :( ;2;0;False;ItsSuperRob;dttg127;When you bought in December;7vky4d;https://v.redd.it/0gp95uf9tie01
things will get better;6;2;False;Tech2018;dttb4l4;When you bought in December;7vky4d;https://v.redd.it/0gp95uf9tie01
I'll buy when it hits $1000 again. ;8;0;False;SvenTropics;dttgmgp;When you bought in December;7vky4d;https://v.redd.it/0gp95uf9tie01
Poor kid, he just wanted some milk instead of hard questions. ;5;1;False;HowRealityWorks;dttcabe;When you bought in December;7vky4d;https://v.redd.it/0gp95uf9tie01
Tax time is coming and some people are still booking profits even in this market. For the rest of us this is a gut check,are you really committed to the technology? As long as you are not over invested and are still relatively liquid you can ignore this and move on to other things secure in the knowledge this will blow over and growth will continue at some point. Might be 2 years from now might be three months. No one can really say. I bought in and am glad I did.;25;4;False;;dttfuou;When you bought in December;7vky4d;https://v.redd.it/0gp95uf9tie01
It feels worse if you bought ltc in december and trx in january;24;3;False;e1-c;dttehx0;When you bought in December;7vky4d;https://v.redd.it/0gp95uf9tie01
"The worst thing about this crash; Whenever you think you bought at dip it goes even more down :DDD";21;0;False;Xactor92;dttknwj;When you bought in December;7vky4d;https://v.redd.it/0gp95uf9tie01
2013 was a long time ago. I'm a big boy now.;2;0;False;Bagatell_;dttiol9;When you bought in December;7vky4d;https://v.redd.it/0gp95uf9tie01
https://www.youtube.com/watch?v=noQsHiTJAXo;5;1;False;Kain_niaK;dttccwt;When you bought in December;7vky4d;https://v.redd.it/0gp95uf9tie01
"Investment Fund Moves to Capitalize on Ethereum Ecosystem

https://www.tokens24.com/news/cryptocurrency-news-investment-fund-moves-capitalize-ethereum-ecosystem/";1;0;False;karapeter;dttucqk;When you bought in December;7vky4d;https://v.redd.it/0gp95uf9tie01
Brilliant hahahah;1;0;False;mutantdna;dtu8pje;When you bought in December;7vky4d;https://v.redd.it/0gp95uf9tie01
Not for everybody, though. Some people aren't good speculators and this business will end bad for them. Such is life;4;0;False;LexGrom;dttmmlj;When you bought in December;7vky4d;https://v.redd.it/0gp95uf9tie01
Don't we all... ^don't ^we ^all...;6;0;False;jedimstr;dttgnm4;When you bought in December;7vky4d;https://v.redd.it/0gp95uf9tie01
With bitcoin, it’s pretty much “are you invested in the first mover?” Because the technology has been surpassed in most ways by other coins;0;4;False;cehmu;dttj879;When you bought in December;7vky4d;https://v.redd.it/0gp95uf9tie01
i like that outlook :) if you overinvested you clearly made a mistake or you better be damn sure in what you are doing..;2;1;False;crasheger;dtthsxh;When you bought in December;7vky4d;https://v.redd.it/0gp95uf9tie01
Let's be real, nobody bought in December for the technology. They bought due to FOMO and just want to get rich quick. ;4;1;False;cywinr;dtufaqd;When you bought in December;7vky4d;https://v.redd.it/0gp95uf9tie01
I mean you’re just guessing that growth will continue. ;12;2;False;;dttjqqv;When you bought in December;7vky4d;https://v.redd.it/0gp95uf9tie01
"Just Keep Calm and HODL BCH...  

https://www.amazon.com/dp/B079HBKJTW";1;0;False;;dtu0zh0;When you bought in December;7vky4d;https://v.redd.it/0gp95uf9tie01
BITCONEEEEEEEEEEEEEEE;21;2;False;LexGrom;dttmkmk;When you bought in December;7vky4d;https://v.redd.it/0gp95uf9tie01
You mean back WHEN EVERYONE WAS SAYING TO BUY TRX EVEN THOUGH IT DIDN'T HAVE A WORKING PRODUCT;13;1;False;nathanweisser;dtthjsz;When you bought in December;7vky4d;https://v.redd.it/0gp95uf9tie01
BTG? No wonder he's crying.;4;0;False;alpha_complex;dttvdw7;When you bought in December;7vky4d;https://v.redd.it/0gp95uf9tie01
Speculators without a strategy're getting punished. Nothing to see here;0;0;False;LexGrom;dttmg2h;When you bought in December;7vky4d;https://v.redd.it/0gp95uf9tie01
666 upvotes. Not gonna spoil that by voting!;1;0;False;bielie;dttqar2;When you bought in December;7vky4d;https://v.redd.it/0gp95uf9tie01
"$17,025.  As soon as Bitcoin gets back up there, I'm out!

Unless it goes higher... or lower.";0;1;False;TokeyWakenbaker;dttfr8p;When you bought in December;7vky4d;https://v.redd.it/0gp95uf9tie01
dont worry just HODL;0;1;False;XeNo-Sigma;dtt45lk;When you bought in December;7vky4d;https://v.redd.it/0gp95uf9tie01
Wonder if we'll be seeing a flood of lambos on the second hand market..;1;0;False;msartore8;dtugp13;When you bought in December;7vky4d;https://v.redd.it/0gp95uf9tie01
I would like to thank everyone who advised not to buy more than I can lose because it looks like I'm about to lose it all. Still HODLing because I can.  ;1;0;False;passwordgoeshere;dtuffhz;When you bought in December;7vky4d;https://v.redd.it/0gp95uf9tie01
"Anyone have the original source?

What the hell did she say to that kid? LOL";3;2;False;BTC_StKN;dttpu2u;When you bought in December;7vky4d;https://v.redd.it/0gp95uf9tie01
"I will be messaging you on [**2019-02-06 16:19:42 UTC**](http://www.wolframalpha.com/input/?i=2019-02-06 16:19:42 UTC To Local Time) to remind you of [**this link.**](https://www.reddit.com/r/btc/comments/7vky4d/when_you_bought_in_december/)

[**CLICK THIS LINK**](http://np.reddit.com/message/compose/?to=RemindMeBot&subject=Reminder&message=[https://www.reddit.com/r/btc/comments/7vky4d/when_you_bought_in_december/]%0A%0ARemindMe!  1 year) to send a PM to also be reminded and to reduce spam.

^(Parent commenter can ) [^(delete this message to hide from others.)](http://np.reddit.com/message/compose/?to=RemindMeBot&subject=Delete Comment&message=Delete! dttsjrm)

_____

|[^(FAQs)](http://np.reddit.com/r/RemindMeBot/comments/24duzp/remindmebot_info/)|[^(Custom)](http://np.reddit.com/message/compose/?to=RemindMeBot&subject=Reminder&message=[LINK INSIDE SQUARE BRACKETS else default to FAQs]%0A%0ANOTE: Don't forget to add the time options after the command.%0A%0ARemindMe!)|[^(Your Reminders)](http://np.reddit.com/message/compose/?to=RemindMeBot&subject=List Of Reminders&message=MyReminders!)|[^(Feedback)](http://np.reddit.com/message/compose/?to=RemindMeBotWrangler&subject=Feedback)|[^(Code)](https://github.com/SIlver--/remindmebot-reddit)|[^(Browser Extensions)](https://np.reddit.com/r/RemindMeBot/comments/4kldad/remindmebot_extensions/)
|-|-|-|-|-|-|";1;0;False;RemindMeBot;dttsjrm;When you bought in December;7vky4d;https://v.redd.it/0gp95uf9tie01
What was the name of the youtube channel? Are there anywhere I could find these videos so I could archive them? I have a video archive of videos like this, just for entertainment and historic purposes.;1;0;False;aggrohabbab;dtth902;Death of a Scamcoin: r/Bitconnect's front page screenshotted moments before they went private, showing panic, anger, and lots of ill-advised investment claims, several claiming to have lost over $100k;7qzpmw;https://imgur.com/a/TLimM
I'm not following these stats, LN is still in test phase, just some are using it already in mainnet, but now i had a little time to check the charts, and [this clearly shows](https://bitinfocharts.com/comparison/transactionfees-transactions-btc.html#1y) in the past year there was no exact correlation between the tx numbers and the fee, the fee's dropped even with constant usage and increased later, there have been over 350k tx's with the highest fee, and dropping usage didn't essentially lowered the fee's. It is partly true less usage will lower fees because of less race condition for confirmations, but a lot of other things will affect it too. For example if often used services overpay the tx, then it will cause high fees, and a lot of services doesn't let the users set the fee, because it is calculated automatically, and sometimes very badly. For example last year in the blockchain.info wallet the default tx fee was a few times more than what was needed, ok there is an option to set it by yourself, but a lot of people didn't know that (later they changed the all fee setting form). So in nutshell, the fees can drop by lower usage, and by other things too, it's not definitely a strict connection.;1;1;False;gecikopter;dtsngnn;As requested, a picture of a dinosaur holding Bitcoin, while mammals are poised to adapt for the future;7v6hhb;https://i.redd.it/72qgbct2x6e01.jpg
"Ok, I'd like some modifications which I'm not really well qualified to do myself, but would happily cut a deal to get done (either by myself or hiring someone else to do them):

1. Make the T-Rex hold a bunch of credit cards in a fold-out wallet, and maybe some fiat cash or gold bullion in the other claw

2. Make the meteors a green hue (may require altering the sky hue generally), remove the BS ring logo, put the Bitcoin Cash green tilted Bitcoin symbol in the middle and maybe a ring of text around the inside edge of the meteor saying 'low fees', 'reliable confirmations'.

3. Make the squirrels hodl orange BTC (let's face it, these particular ones aren't going to live long)

If someone made this, how much of a cut would you want out of future money made on it? Of course, if you could make such an 'alternate version' it would probably turn out way better :-)";0;0;False;ILoveBitcoinCash;dtt2cfi;As requested, a picture of a dinosaur holding Bitcoin, while mammals are poised to adapt for the future;7v6hhb;https://i.redd.it/72qgbct2x6e01.jpg
"if your opinion isn't based on observing facts then you're not giving an opinion about facts, you're just giving an opinion of what your own opinion is

i agree that you agree with the Bible";1;0;False;mungojelly;dtszixy;As requested, a picture of a dinosaur holding Bitcoin, while mammals are poised to adapt for the future;7v6hhb;https://i.redd.it/72qgbct2x6e01.jpg
Got a higher quality version? I'd like to put it on my wall :);1;0;False;asicshack;dtszynx;As requested, a picture of a dinosaur holding Bitcoin, while mammals are poised to adapt for the future;7v6hhb;https://i.redd.it/72qgbct2x6e01.jpg
"they keep them in museums, just like, in storage, mostly

there's plenty of places you could see actual dinosaur bones if you want

or you could get less exciting fossils from various time periods at very reasonable prices if you'd like to experience prehistory yourself

do you really not believe in dinosaurs? is this a meme? what's wrong?";1;1;False;mungojelly;dtsovsv;As requested, a picture of a dinosaur holding Bitcoin, while mammals are poised to adapt for the future;7v6hhb;https://i.redd.it/72qgbct2x6e01.jpg
