body;score;nb_replies;stickied;author;id;post_title;post_id;post_link
">How can every transaction possibly occur on-chain without you giving your private keys to Cointext?

It couldn't, you obviously need to give the private keys to Cointext. It's effectively an online wallet that can be controlled through sms.";8;0;False;rabbitlion;dttw0cv;Cointext: Send and receive BCH onchain via SMS. This is a game changer.;7vnoee;https://imgur.com/gDGpSXE
"They are releasing the technical details about keys and whatnot tomorrow. I don't know how they handle the keys, but you are right that there might be an added layer of trust there.

Regardless, the transactions are onchain.";8;2;False;God_Emperor_of_Dune;dttszxj;Cointext: Send and receive BCH onchain via SMS. This is a game changer.;7vnoee;https://imgur.com/gDGpSXE
Show me a phone that you can buy today that doesn't receive SMS. Also explain to me why the phone needs to be on.;7;1;False;God_Emperor_of_Dune;dtu4lks;Cointext: Send and receive BCH onchain via SMS. This is a game changer.;7vnoee;https://imgur.com/gDGpSXE
"I was in Africa three months ago.  Everybody has a phone.  1/2 of them are smartphones and the others are not.  ""Mobile money"" is for sale EVERYWHERE, even in tiny little villages where you wonder if there is even plumbing and electricity there will be more than one booth with a sign that says ""Buy mobile money here.""

Yes it is a BIG deal.  Yes they will care about crypto, especially when their mobile fiat money is losing value to hyperinflation.";13;1;False;WalterRothbard;dttpq09;Cointext: Send and receive BCH onchain via SMS. This is a game changer.;7vnoee;https://imgur.com/gDGpSXE
Google search MPESA. This old technology finally being adopted in the West. It works beautifully.;25;2;False;jcmach1;dttxgt2;Cointext: Send and receive BCH onchain via SMS. This is a game changer.;7vnoee;https://imgur.com/gDGpSXE
"> Edit: of course this gets down-voted by butthurt normies.

Currently at +98, so seems not. ";3;1;False;Anenome5;dtud3n5;Cointext: Send and receive BCH onchain via SMS. This is a game changer.;7vnoee;https://imgur.com/gDGpSXE
This is not a security focused wallet. Those who value maximum security have other options. It's still secure enough and useful on a bunch of levels.;25;0;False;Coinivore;dttyapv;Cointext: Send and receive BCH onchain via SMS. This is a game changer.;7vnoee;https://imgur.com/gDGpSXE
... but nobody uses SMS anymore :(;1;0;False;cruzae;dtttc8b;Cointext: Send and receive BCH onchain via SMS. This is a game changer.;7vnoee;https://imgur.com/gDGpSXE
Can you get your private keys thru SMS? (hopefuly in a password encrypted format and not plaintext);1;0;False;TiagoTiagoT;dttnls5;Cointext: Send and receive BCH onchain via SMS. This is a game changer.;7vnoee;https://imgur.com/gDGpSXE
look up byteball, been doing this since december;1;1;False;flwns;dtuajlq;Cointext: Send and receive BCH onchain via SMS. This is a game changer.;7vnoee;https://imgur.com/gDGpSXE
"You didn't test it. You didn't clone your SIM, and then send a text from a different phone. 

That is the attack vector. ";4;1;False;midipoet;dtu0ghz;Cointext: Send and receive BCH onchain via SMS. This is a game changer.;7vnoee;https://imgur.com/gDGpSXE
/u/cryptochecker;1;2;False;God_Emperor_of_Dune;dtucuh8;Cointext: Send and receive BCH onchain via SMS. This is a game changer.;7vnoee;https://imgur.com/gDGpSXE
Gay changerrrr ;-10;1;False;rockkth;dttxjln;Cointext: Send and receive BCH onchain via SMS. This is a game changer.;7vnoee;https://imgur.com/gDGpSXE
Doesn’t support iOS so idk how much of a “game changer” it really is yet ;-1;1;False;mmmbutteredbiscuits;dttxe2v;Cointext: Send and receive BCH onchain via SMS. This is a game changer.;7vnoee;https://imgur.com/gDGpSXE
"People lose their money. SMS isn't an appropriate communication channel for sending money.

Edit: of course this gets down-voted by butthurt normies. Two-factor auth has also been moving away from SMS because you can hijack a phone number by providing basic personal information to a phone rep.";227;13;False;;dttregi;Cointext: Send and receive BCH onchain via SMS. This is a game changer.;7vnoee;https://imgur.com/gDGpSXE
"I'll test it out. What do you mean by spoof my number?

So far I've found it just doesn't do anything if I send the number in a wrong format. For example:

""Send (544) 867-5309"" didn't work (I just didn't get a response), but ""Send 5448675309"" worked.";4;1;False;God_Emperor_of_Dune;dttn7k9;Cointext: Send and receive BCH onchain via SMS. This is a game changer.;7vnoee;https://imgur.com/gDGpSXE
"What I see here is some spectacular upvoting by Blockstream bots who work with you. Every positive Bitcoin Cash news is the same, a  negative comment gets top spot every time. And the cherry on the cake,  you complain about vote manipulation while you do that... endless projection, the same script every time.

The masters of deception, not good for anything else. Amazing.

So, who wants to put their savings in the hands of these people? No one. Can't wait to see the mania end.
";12;2;False;btcnewsupdates;dtu9gwz;Cointext: Send and receive BCH onchain via SMS. This is a game changer.;7vnoee;https://imgur.com/gDGpSXE
I believe the biggest motivator here is for tiny transactions, like cents. Any sort of attack would need to spoof thousands of numbers to be worth a mac flurry.;2;0;False;rdar1999;dtu3be8;Cointext: Send and receive BCH onchain via SMS. This is a game changer.;7vnoee;https://imgur.com/gDGpSXE
Obviously this is for small amounts.;1;0;False;knight222;dtubi9e;Cointext: Send and receive BCH onchain via SMS. This is a game changer.;7vnoee;https://imgur.com/gDGpSXE
"I've interacted with you countless times on this sub. You seem to prefer /r/Bitcoin.

I tested this. It isn't an attack vector.";5;1;False;God_Emperor_of_Dune;dtu0bie;Cointext: Send and receive BCH onchain via SMS. This is a game changer.;7vnoee;https://imgur.com/gDGpSXE
"Apart from the screen lock most people have on their phone. 

The attack vector I describe does not need screen access to the phone. ";3;1;False;midipoet;dtu2gso;Cointext: Send and receive BCH onchain via SMS. This is a game changer.;7vnoee;https://imgur.com/gDGpSXE
I just tested this out... It didn't work for what it's worth. So that's good news!;15;1;False;God_Emperor_of_Dune;dttrbue;Cointext: Send and receive BCH onchain via SMS. This is a game changer.;7vnoee;https://imgur.com/gDGpSXE
This one sounds similar to telcoin except it doesn't use it's own token/cryptocurrency.  How many of these similar companies do we need.  Its like having 50 floppy disk manufacturers all over again.;1;1;False;thekobun;dttt9vv;Cointext: Send and receive BCH onchain via SMS. This is a game changer.;7vnoee;https://imgur.com/gDGpSXE
"Of [u/GrateDeign](https://www.reddit.com/u/GrateDeign)'s last **5** posts and **139** comments, I found **2** posts and **64** comments in cryptocurrency-related subreddits. Average sentiment (in the interval -1 to +1, with -1 **most negative** and +1 **most positive**) and karma counts are shown for each subreddit:

Subreddit|No. of posts|Avg. post sentiment|Total post karma|No. of comments|Avg. comment sentiment|Total comment karma
:--|:--|:--|:--|:--|:--|:--
r/bitcoin_uncensored|0|0.0|0|3|0.0|3
r/Monero|0|0.0|0|3|0.05|3
r/Bitcoin|0|0.0|0|21|-0.03|16
r/btc|2|0.0|16|37|0.03|64

***

^(Bleep, bloop, I'm a bot trying to help inform cryptocurrency discussion on Reddit.) ^| [^About](https://www.reddit.com/user/cryptochecker/comments/7q3jum/faq_about_ucryptochecker/) ^| [^Feedback](https://www.reddit.com/message/compose?to=jamcowl&subject=cryptochecker%20bot) ";1;0;False;cryptochecker;dtucv4m;Cointext: Send and receive BCH onchain via SMS. This is a game changer.;7vnoee;https://imgur.com/gDGpSXE
I check out.;1;1;False;;dtud4na;Cointext: Send and receive BCH onchain via SMS. This is a game changer.;7vnoee;https://imgur.com/gDGpSXE
Watch out for text message spoofing. This needs some sort of number confirmation.;5;1;False;BigBlackHungGuy;dttrgn9;Cointext: Send and receive BCH onchain via SMS. This is a game changer.;7vnoee;https://imgur.com/gDGpSXE
This is awesome!!;5;0;False;karmacapacitor;dttqx9u;Cointext: Send and receive BCH onchain via SMS. This is a game changer.;7vnoee;https://imgur.com/gDGpSXE
"I guess they could add google authenticator style 2FA as additional security measure when sending/withdrawing money.

For example, to send you could append 6 digit 2FA code at the end of the message after recepient number...";2;1;False;9500;dttvuvi;Cointext: Send and receive BCH onchain via SMS. This is a game changer.;7vnoee;https://imgur.com/gDGpSXE
"I'm assuming this service offchain so I would be reluctant to deposit significant amounts but for micro payments between friends it would be a useful service. But yeah , wouldn't keep to much BCH in it. 
Could a service where you just send X amount of BCH to a address and then text the private key to the person work ? ";5;3;False;Fatter_than_your_mom;dttnehl;Cointext: Send and receive BCH onchain via SMS. This is a game changer.;7vnoee;https://imgur.com/gDGpSXE
Cointext faucet?;2;0;False;Volntyr;dtu4nzj;Cointext: Send and receive BCH onchain via SMS. This is a game changer.;7vnoee;https://imgur.com/gDGpSXE
I'm Barack Obama & I approve this news;2;0;False;chockablockchain;dtudnli;Cointext: Send and receive BCH onchain via SMS. This is a game changer.;7vnoee;https://imgur.com/gDGpSXE
"Nothing new about this - [coinapult](https://coinapult.com/) had this years ago!

Does anyone use SMS anymore?";2;1;False;bitcoind3;dtuia6o;Cointext: Send and receive BCH onchain via SMS. This is a game changer.;7vnoee;https://imgur.com/gDGpSXE
"This attack vector is no different than someone stealing your phone and texting ""Withdraw [amount] [address]"".

In fact, that is probably even easier than cloning a SIM.";2;1;False;God_Emperor_of_Dune;dtu1dnb;Cointext: Send and receive BCH onchain via SMS. This is a game changer.;7vnoee;https://imgur.com/gDGpSXE
Probably another way of scamming peoples.;4;0;False;Mahim09;dttyvod;Cointext: Send and receive BCH onchain via SMS. This is a game changer.;7vnoee;https://imgur.com/gDGpSXE
[removed];1;1;False;;dtufgdf;Cointext: Send and receive BCH onchain via SMS. This is a game changer.;7vnoee;https://imgur.com/gDGpSXE
https://www.facebook.com/permalink.php?story_fbid=193459107904384&id=186217378628557;1;0;False;Cryptouniforms;dtuh9sg;Cointext: Send and receive BCH onchain via SMS. This is a game changer.;7vnoee;https://imgur.com/gDGpSXE
"Yes, all they need is about five minutes (or less) with your phone. They just take out your SIM, place it in a cloner, clone it, put back the SIM,  job done. 

If you don't think that it is possible, as you have your phone on you at all times, then I guess you are safe to this attack vector. 

Of course, not everyone is as diligent as you, but I am sure you well know this. ";3;1;False;midipoet;dtu0wh3;Cointext: Send and receive BCH onchain via SMS. This is a game changer.;7vnoee;https://imgur.com/gDGpSXE
if someone was watching when you set your stupid pin, they can have 50 cheap clones of your phone. or if you used a common 4 digit number that someone could easily guess if they know you, they have a copy of your phone.;3;0;False;;dtu40fg;Cointext: Send and receive BCH onchain via SMS. This is a game changer.;7vnoee;https://imgur.com/gDGpSXE
Maybe he wanted me to comment on animal farm, I read that when I was a kid ...;1;0;False;;dtudo3y;Cointext: Send and receive BCH onchain via SMS. This is a game changer.;7vnoee;https://imgur.com/gDGpSXE
"Oh... The attack vector is that someone can steal my SIM card, clone it, and then use it?

Okay then.";2;2;False;God_Emperor_of_Dune;dtu0out;Cointext: Send and receive BCH onchain via SMS. This is a game changer.;7vnoee;https://imgur.com/gDGpSXE
"Can you explain exactly what you mean by ""on-chain""? 

This SMS service seems to work exactly like the Tippr bot - 

Tippr holds the keys to any funds I send or receive and I must request withdrawal. But we call Tippr bot ""off-chain"", although technically anything transacting on the blockchain and not on a secondary layer would be on-chain. ";8;1;False;josiahromoser;dttr2b8;Cointext: Send and receive BCH onchain via SMS. This is a game changer.;7vnoee;https://imgur.com/gDGpSXE
Is that possible elsewhere in the world? I was under the impression only the US had the system setup such that the phone companies were not responsible for defining who the message or phone call came from...;0;0;False;TiagoTiagoT;dtts1im;Cointext: Send and receive BCH onchain via SMS. This is a game changer.;7vnoee;https://imgur.com/gDGpSXE
I subscribed to Counter Markets which gave me an invite to the beta.;5;0;False;God_Emperor_of_Dune;dtty151;Cointext: Send and receive BCH onchain via SMS. This is a game changer.;7vnoee;https://imgur.com/gDGpSXE
"u/God_Emperor_of_Dune, your post was gilded in exchange for `0.00283077 BCH ($2.50 USD)`! Congratulations!
***
[^^How to use](https://np.reddit.com/r/tippr/wiki/index) ^^| [^^What is Bitcoin Cash?](https://learnbitcoin.cash/) ^^| [^^Who accepts it?](https://acceptbitcoin.cash) ^^| ^^Powered ^^by ^^[Rocketr](https://rocketr.net) ^^| ^^r/tippr  
^(Bitcoin Cash is what Bitcoin should be. Ask about it on r/btc)";6;1;False;tippr;dttmxf1;Cointext: Send and receive BCH onchain via SMS. This is a game changer.;7vnoee;https://imgur.com/gDGpSXE
"> Yes you're right about that.

You aren't going to tip me 2 scooby snax?";1;1;False;;dtucgl6;Cointext: Send and receive BCH onchain via SMS. This is a game changer.;7vnoee;https://imgur.com/gDGpSXE
"These are the guys working on it:

https://twitter.com/CounterMarkets";7;1;False;God_Emperor_of_Dune;dttpmb0;Cointext: Send and receive BCH onchain via SMS. This is a game changer.;7vnoee;https://imgur.com/gDGpSXE
where are you getting authenticator codes with a dumb phone...;1;0;False;mohrt;dtubomh;Cointext: Send and receive BCH onchain via SMS. This is a game changer.;7vnoee;https://imgur.com/gDGpSXE
I am not trolling, I was genuinely curious - as was the poster before, as to what would happen if your number was spoofed. If you find it easier to deny the attack vector exists and bracket me as a troll, continue on. ;12;1;False;midipoet;dtu077g;Cointext: Send and receive BCH onchain via SMS. This is a game changer.;7vnoee;https://imgur.com/gDGpSXE
Who has custody of the wallet?;15;1;False;HolyBits;dtttx4e;Cointext: Send and receive BCH onchain via SMS. This is a game changer.;7vnoee;https://imgur.com/gDGpSXE
"^(Hi, I'm a bot for linking direct images of albums with only 1 image)

**https://i.imgur.com/RHTimUH.png**

^^[Source](https://github.com/AUTplayed/imguralbumbot) ^^| ^^[Why?](https://github.com/AUTplayed/imguralbumbot/blob/master/README.md) ^^| ^^[Creator](https://np.reddit.com/user/AUTplayed/) ^^| ^^[ignoreme](https://np.reddit.com/message/compose/?to=imguralbumbot&subject=ignoreme&message=ignoreme) ^^| ^^[deletthis](https://np.reddit.com/message/compose/?to=imguralbumbot&subject=delet%20this&message=delet%20this%20dtufggy) ";1;0;False;imguralbumbot;dtufggy;Cointext: Send and receive BCH onchain via SMS. This is a game changer.;7vnoee;https://imgur.com/gDGpSXE
cool, huge for third world countries without steady net.;16;2;False;squarepush3r;dttp9r9;Cointext: Send and receive BCH onchain via SMS. This is a game changer.;7vnoee;https://imgur.com/gDGpSXE
Nothing wrong with 50 floppy disk manufacturers, as long as they all conform to one standard;2;0;False;746865626c617a;dtu4waf;Cointext: Send and receive BCH onchain via SMS. This is a game changer.;7vnoee;https://imgur.com/gDGpSXE
[deleted];1;1;False;;dtui7v6;Cointext: Send and receive BCH onchain via SMS. This is a game changer.;7vnoee;https://imgur.com/gDGpSXE
Not Bitcoin.;1;1;False;God_Emperor_of_Dune;dtuawq8;Cointext: Send and receive BCH onchain via SMS. This is a game changer.;7vnoee;https://imgur.com/gDGpSXE
What about the SS7 vulnerability and other security concerns with SMS? ;11;0;False;Jermuboy;dttxs9w;Cointext: Send and receive BCH onchain via SMS. This is a game changer.;7vnoee;https://imgur.com/gDGpSXE
"u/PM_UR_TITS_SILLYGIRL, you've received `0.00102986 BCH ($1 USD)`!
***
[^^How to use](https://np.reddit.com/r/tippr/wiki/index) ^^| [^^What is Bitcoin Cash?](https://learnbitcoin.cash/) ^^| [^^Who accepts it?](https://acceptbitcoin.cash) ^^| ^^Powered ^^by ^^[Rocketr](https://rocketr.net) ^^| ^^r/tippr  
^(Bitcoin Cash is what Bitcoin should be. Ask about it on r/btc)";1;0;False;tippr;dtuebsp;Cointext: Send and receive BCH onchain via SMS. This is a game changer.;7vnoee;https://imgur.com/gDGpSXE
"gild u/tippr

Edit: how to get an invite for this revolution that will enable the unbanked to bank themselves?";26;3;False;SharkLaserrrrr;dttmwxl;Cointext: Send and receive BCH onchain via SMS. This is a game changer.;7vnoee;https://imgur.com/gDGpSXE
that dood is married.;1;0;False;;dtu308h;Cointext: Send and receive BCH onchain via SMS. This is a game changer.;7vnoee;https://imgur.com/gDGpSXE
This approach definitely can work with small amounts. The amounts must be smaller than the cost of the attack. Anyways, upvoted. u/tippr 20 bits;15;3;False;slbbb;dtu1p3r;Cointext: Send and receive BCH onchain via SMS. This is a game changer.;7vnoee;https://imgur.com/gDGpSXE
Looks good, but needs a telegram/WhatsApp version, here in Europe SMS went away with the Nokia brick phones, most people use WhatsApp. I don't remember sending a SMS message in the last 7 years.;28;4;False;konrad-iturbe;dttnlh6;Cointext: Send and receive BCH onchain via SMS. This is a game changer.;7vnoee;https://imgur.com/gDGpSXE
Hi do you have a website/twitter that one can look at for more information?;4;1;False;btcnewsupdates;dttogdf;Cointext: Send and receive BCH onchain via SMS. This is a game changer.;7vnoee;https://imgur.com/gDGpSXE
I just tested that out. It didn't work for what it's worth.;7;0;False;God_Emperor_of_Dune;dttrnin;Cointext: Send and receive BCH onchain via SMS. This is a game changer.;7vnoee;https://imgur.com/gDGpSXE
You have to remember at that point both people know the private key, and could lead to fraud. ;2;0;False;DoomedKid;dttz48c;Cointext: Send and receive BCH onchain via SMS. This is a game changer.;7vnoee;https://imgur.com/gDGpSXE
"If you don't hold the private keys, you're not banking yourself. They need to study the possibility of SIM-card apps; there is not much in a way of GUI I think, just text menus provided by phone's OS, but they can run on pretty much any phone; the key thing I don't know, is whether they can write to the phone's storage to be able to save and backup private keys in case something happens to the SIM-card. I'm not sure you can install those without making a deal with the carrier though.";1;1;False;TiagoTiagoT;dtu6lg9;Cointext: Send and receive BCH onchain via SMS. This is a game changer.;7vnoee;https://imgur.com/gDGpSXE
u/tippr gild;3;2;False;mtrycz;dtu08kr;Cointext: Send and receive BCH onchain via SMS. This is a game changer.;7vnoee;https://imgur.com/gDGpSXE
This is their killer app! Hope it is secure enough.  Can we test it through?;5;1;False;SeppDepp2;dttx2gd;Cointext: Send and receive BCH onchain via SMS. This is a game changer.;7vnoee;https://imgur.com/gDGpSXE
Yep, it is. One of the biggest complains I heard is having to depend on a smartphone and risk of using one in public here. So this is definitely a game changer.;1;0;False;PopeJohnXXII;dtud8cl;Cointext: Send and receive BCH onchain via SMS. This is a game changer.;7vnoee;https://imgur.com/gDGpSXE
Could this work with a phone without internet?;3;1;False;PopeJohnXXII;dttuy7r;Cointext: Send and receive BCH onchain via SMS. This is a game changer.;7vnoee;https://imgur.com/gDGpSXE
"Not your keys not your wallet. Something something white paper. 

Something vision.

";25;2;False;robertangst88;dttyqwe;Cointext: Send and receive BCH onchain via SMS. This is a game changer.;7vnoee;https://imgur.com/gDGpSXE
That'll come soon enough, but this is a game changer for every third world country in the world.;31;3;False;God_Emperor_of_Dune;dttnvxj;Cointext: Send and receive BCH onchain via SMS. This is a game changer.;7vnoee;https://imgur.com/gDGpSXE
"The whole point of it is that you can use it with a dumphone. It's not for the EU mainly, but the countries where a smartphone is luxury.

If you own a smartphone, you can install any of the wallets. ";17;1;False;mtrycz;dtto35t;Cointext: Send and receive BCH onchain via SMS. This is a game changer.;7vnoee;https://imgur.com/gDGpSXE
"With my current mobile plan here in Brazil, if I send just a single SMS I have to pay almost double the monthly cost to the carrier; by sending a single SMS, I'm automaticaly buying a month's worth of SMS plan :/";1;1;False;TiagoTiagoT;dttrqty;Cointext: Send and receive BCH onchain via SMS. This is a game changer.;7vnoee;https://imgur.com/gDGpSXE
"Not only in Europe. I haven't been to a country where everyone doesn't use WhatsApp. I heard in the US it's not very popular. 

Anyways I don't think WhatsApp allows bots like this. Telegram does though. ";0;0;False;caveden;dttocvw;Cointext: Send and receive BCH onchain via SMS. This is a game changer.;7vnoee;https://imgur.com/gDGpSXE
Yes - just SMS.;5;0;False;God_Emperor_of_Dune;dttxzrc;Cointext: Send and receive BCH onchain via SMS. This is a game changer.;7vnoee;https://imgur.com/gDGpSXE
"u/God_Emperor_of_Dune, your post was gilded in exchange for `0.00279488 BCH ($2.50 USD)`! Congratulations!
***
[^^How to use](https://np.reddit.com/r/tippr/wiki/index) ^^| [^^What is Bitcoin Cash?](https://learnbitcoin.cash/) ^^| [^^Who accepts it?](https://acceptbitcoin.cash) ^^| ^^Powered ^^by ^^[Rocketr](https://rocketr.net) ^^| ^^r/tippr  
^(Bitcoin Cash is what Bitcoin should be. Ask about it on r/btc)";1;0;False;tippr;dtu0ap4;Cointext: Send and receive BCH onchain via SMS. This is a game changer.;7vnoee;https://imgur.com/gDGpSXE
[deleted];1;1;False;;dtu1lyw;Cointext: Send and receive BCH onchain via SMS. This is a game changer.;7vnoee;https://imgur.com/gDGpSXE
"When I tip you with tippr, the actual transaction isn't done onchain. Tippr keeps track of your balance, and whenever you withdraw it they send you that amount (with an onchain transaction).

With Cointext, every transaction occurs onchain.";4;2;False;God_Emperor_of_Dune;dttrjdd;Cointext: Send and receive BCH onchain via SMS. This is a game changer.;7vnoee;https://imgur.com/gDGpSXE
The service is onchain, but yes I'm not quite sure how the keys are handled. It sounds like they are releasing a whitepaper on the technical details tomorrow.;10;1;False;God_Emperor_of_Dune;dttnn1t;Cointext: Send and receive BCH onchain via SMS. This is a game changer.;7vnoee;https://imgur.com/gDGpSXE
Sending a private key would be more insecure, not to mention a lot more complicated. ;2;0;False;PhyllisWheatenhousen;dtua068;Cointext: Send and receive BCH onchain via SMS. This is a game changer.;7vnoee;https://imgur.com/gDGpSXE
"This is BCH's alternative to the LN. 

Edit: in case some don't realise /s.";5;1;False;midipoet;dttw3bg;Cointext: Send and receive BCH onchain via SMS. This is a game changer.;7vnoee;https://imgur.com/gDGpSXE
Thor is an investor;1;0;False;arminshirzad;dtt1tfg;Seems relevant today;7urbup;https://v.redd.it/j5wp0b9rysd01
*was using coinbase, no sell option in Canada..*;1;0;False;DestroyerOfIgnorance;dttmp2p;[PSA] If your Bitcoin are not ready-to-transact in a wallet whose keys you exclusively control, then you don't control your Bitcoin;7uzz9t;https://www.reddit.com/r/btc/comments/7uzz9t/psa_if_your_bitcoin_are_not_readytotransact_in_a/
