body;score;nb_replies;stickied;author;id;post_title;post_id;post_link
"Because ""good"" moderation takes A LOT of TIME and there for PEOPLE and therefore MONEY. (what are you retarded?)";0;3;False;StolenBitcoin;daf34uo;With the public spotlight on Reddit censorship, now would be the perfect time to let the rest of Reddit know about the censorship on /r/bitcoin;5eqvhs;https://www.reddit.com/r/btc/comments/5eqvhs/with_the_public_spotlight_on_reddit_censorship/
"I think my translator is malfunctioning, I can't believe you're that stupid. 
(Chinese miner to core devs)";3;0;False;zimmah;daeugso;With the public spotlight on Reddit censorship, now would be the perfect time to let the rest of Reddit know about the censorship on /r/bitcoin;5eqvhs;https://www.reddit.com/r/btc/comments/5eqvhs/with_the_public_spotlight_on_reddit_censorship/
EvilCoin FTW;3;0;False;FreeWifiInZombieland;dafjwxg;With the public spotlight on Reddit censorship, now would be the perfect time to let the rest of Reddit know about the censorship on /r/bitcoin;5eqvhs;https://www.reddit.com/r/btc/comments/5eqvhs/with_the_public_spotlight_on_reddit_censorship/
It is not a personal attack if it is the truth.;1;0;False;ShadowOfHarbringer;dafi6js;With the public spotlight on Reddit censorship, now would be the perfect time to let the rest of Reddit know about the censorship on /r/bitcoin;5eqvhs;https://www.reddit.com/r/btc/comments/5eqvhs/with_the_public_spotlight_on_reddit_censorship/
"So censorship isn't real because it's happening in a community?  

It's still censorship, just within the community. And again, censorship is the weapon of weak ideas.

There is ample evidence to shows bots commenting to support core and other things, it's easy to find why not look for it? ";4;0;False;highintensitycanada;dafjrqq;With the public spotlight on Reddit censorship, now would be the perfect time to let the rest of Reddit know about the censorship on /r/bitcoin;5eqvhs;https://www.reddit.com/r/btc/comments/5eqvhs/with_the_public_spotlight_on_reddit_censorship/
"> it's interesting that this forum takes the side of XT instead of theymos in this case

Because what you are saying is conjecture while your rhetoric is harsh and decisive. A common red flag.

The actual transaction history of Bitcoin shows that it grew steadily as opposed to hitting the maximum ASAP as your hypothesis suggests. It doesn't even correlate well with historical soft limits, which by itself would be evidence of some governance other than hard limit anyway.

So, no historical evidence, no definition of decentralization and not even any proposed metrics. Granted, XT lacked in these aspects as well, but at least they dared to begin doing some threat modeling.

Without being equipped with these, you would obviously have to resort to political battle, which you did. I'm sure there were some voting games involved at the time, but your bleak picture of unscrupulous adversaries is most certainly psychological projection.

I am pretty convinced that Bitcoin blockchain should remain as small as possible, but all in all I think your mentality is the biggest threat against ""decentralized and free"" Bitcoin at the moment. Certainly much more dangerous than big blocks.
";3;0;False;adoptator;daffh3l;With the public spotlight on Reddit censorship, now would be the perfect time to let the rest of Reddit know about the censorship on /r/bitcoin;5eqvhs;https://www.reddit.com/r/btc/comments/5eqvhs/with_the_public_spotlight_on_reddit_censorship/
"> including CSS manipulation of comment thread ordering

I should also point out that his argument in the very first line (stated prominently there, likely because it was admittedly one of the very few things that was a very bad idea IMO) is false. It represented reality for only a limited period of time, as a test, and was reversed after poor feedback & after mods realized it was a bad idea.

---

:: EDIT ::

Proof:

Link to example thread:
> https://np.reddit.com/r/Bitcoin/comments/5enjmt/bitcoin_has_proven_peter_schiff_wrong_bitcoin/dae7nix/

Link to removed example post (temporary for purpose of producing an example):
> https://np.reddit.com/r/Bitcoin/comments/5enjmt/bitcoin_has_proven_peter_schiff_wrong_bitcoin/daeb33z/

What the thread looks like when the post is removed:
> http://i.imgur.com/g1Jrezc.png

As you can see, when a mod removes a post, it produced a ""removed"" indication. (And when a user deletes his/her own post, then it produces a ""deleted"" indication.)";-1;1;False;eragmus;daemqbn;With the public spotlight on Reddit censorship, now would be the perfect time to let the rest of Reddit know about the censorship on /r/bitcoin;5eqvhs;https://www.reddit.com/r/btc/comments/5eqvhs/with_the_public_spotlight_on_reddit_censorship/
"The very same.

But, truth be told, as was also the case back then, I'm not so perturbed with being banned from the group he mods (since I think that's his right as a mod), as I am appalled at his hypocrisy with saying one thing & doing another (and worse, because he is hired by Roger Ver and lobbies for BU). This is especially appalling when, as you see, he is happy to use these accusations of ""censorship"" as a political football. His statements do not stem from a basis of principle, in the least.";3;0;False;eragmus;daemasa;With the public spotlight on Reddit censorship, now would be the perfect time to let the rest of Reddit know about the censorship on /r/bitcoin;5eqvhs;https://www.reddit.com/r/btc/comments/5eqvhs/with_the_public_spotlight_on_reddit_censorship/
"> The price reaction bit is hilariously silly. To say the price did anything for any reason is pure speculation. And if we take that point to its logical conclusion then the price rise was higher before blocks were full. So the price supports not full blocks more than full blocks.

This is probably better explained by bitcoin's wide media coverage and general bubbleness. There were only 2 weeks when the price was higher than it is today, and it is much less volatile today.

> Almost everyone here has more knowledge of the technicalities and history than the commenter at the censored sub, the moon kids dominate the comments there. We actually want to keep bitcoin as it was designed and not pervert it into another system with the same name.

Who on this forum is an actual developer? Please list them. From what I see there far more core developers and other developers on r/bitcoin.

> There is as much or more evidence that the sock puppets, bots, and vote manipulation is coming from the Pro Core camp.

I posted my evidence, where is your evidence?

Here is mine again in case you missed it. There's evidence of [sockpuppet usage](https://www.reddit.com/r/Bitcoin/comments/41ykkt/members_trying_to_destroy_bitcoin_on_this_thread/cz6ccka?context=3), [vote brigading](https://www.reddit.com/r/Bitcoin/comments/3v04pd/can_we_please_have_a_civil_discussion_about/cxjnz1d?context=1) and [automated vote bots](https://www.reddit.com/r/Bitcoin/comments/4biob5/research_into_instantaneous_vote_behavior_in/).

> The majority of knowledgeable users do not support core. Do you have any evidence for your opinion? Does it take into account effects of the censorship?

One more bit of evidence is how [the price dropped every time a hard fork looked more likely](https://i.imgur.com/EVPYLR8.jpg). That looks like the economic consensus was very scared of a hard fork and didn't support it.

From my point of view, you can't say the r/bitcoin moderators actions were censorship because at the click of a button people can go to r/btc and see the totally opposite viewpoint.";0;1;False;belcher_;dafdlyt;With the public spotlight on Reddit censorship, now would be the perfect time to let the rest of Reddit know about the censorship on /r/bitcoin;5eqvhs;https://www.reddit.com/r/btc/comments/5eqvhs/with_the_public_spotlight_on_reddit_censorship/
It's visible as was at the time I first saw this post.;-4;1;False;nullc;daeqd17;With the public spotlight on Reddit censorship, now would be the perfect time to let the rest of Reddit know about the censorship on /r/bitcoin;5eqvhs;https://www.reddit.com/r/btc/comments/5eqvhs/with_the_public_spotlight_on_reddit_censorship/
Why were you banned 40 times?;1;1;False;lurker1325;dafd2hx;With the public spotlight on Reddit censorship, now would be the perfect time to let the rest of Reddit know about the censorship on /r/bitcoin;5eqvhs;https://www.reddit.com/r/btc/comments/5eqvhs/with_the_public_spotlight_on_reddit_censorship/
This is the attitude that stops any progress from happening.;2;0;False;;daeqo9t;With the public spotlight on Reddit censorship, now would be the perfect time to let the rest of Reddit know about the censorship on /r/bitcoin;5eqvhs;https://www.reddit.com/r/btc/comments/5eqvhs/with_the_public_spotlight_on_reddit_censorship/
"Nah, we aren't on a crash course. We're on a path to things eventually getting so irredeemably divided that we finally have to settle this the old fashioned way: every miner, exchange, wallet, infrastructure company, and major service makes their position known (whereas now they hide it for fear of bad PR, when things get that divided they will announce it to everyone to avoid bad PR), then we split off amicably. The minority will change PoW, and investors will do their thing trading the two forks against each other to determine the price. Very likely both will survive, because by hypothesis we're talking about a scenario where there are truly irreconcilable differences and there are plenty of big pieces of infrastructure on both sides. Some will support both as well, of course. Then they go off and do their settlement layer and we most likely take the monetary network effects from them in the darkmarkets and elsewhere - they can try to take it back some day. Then we say, ""Have a nice day and we'll be back if we were wrong, as will you.""";6;0;False;Noosterdam;daeohh3;With the public spotlight on Reddit censorship, now would be the perfect time to let the rest of Reddit know about the censorship on /r/bitcoin;5eqvhs;https://www.reddit.com/r/btc/comments/5eqvhs/with_the_public_spotlight_on_reddit_censorship/
You might be overestimating the influence of that subreddit. Most Bitcoin these days are mined by the Chinese, who I doubt spend much time in English forums.;30;3;False;mickeybob;daejo4r;With the public spotlight on Reddit censorship, now would be the perfect time to let the rest of Reddit know about the censorship on /r/bitcoin;5eqvhs;https://www.reddit.com/r/btc/comments/5eqvhs/with_the_public_spotlight_on_reddit_censorship/
If  you haven't been paying attention segwit is not even 20% so they are not winning anything... ;16;3;False;ethMonkey;daekkkz;With the public spotlight on Reddit censorship, now would be the perfect time to let the rest of Reddit know about the censorship on /r/bitcoin;5eqvhs;https://www.reddit.com/r/btc/comments/5eqvhs/with_the_public_spotlight_on_reddit_censorship/
I'm clearly just quoting the OP, but nice try.;-10;1;False;eragmus;dael5ls;With the public spotlight on Reddit censorship, now would be the perfect time to let the rest of Reddit know about the censorship on /r/bitcoin;5eqvhs;https://www.reddit.com/r/btc/comments/5eqvhs/with_the_public_spotlight_on_reddit_censorship/
"Note that I am a supporter of r/bitcoin and only come here to keep up with the other side.

> isn't this performed by the sub's mods and not site admins?

Yep, the bitcoin enthusiasts who run r/bitcoin have defended their forum from trolls who from their point of view want to destroy bitcoin. The sub's mods take the view that [Well-kept gardens die by pacificm](http://lesswrong.com/lw/c1/wellkept_gardens_die_by_pacifism/) and have made an effort to keep out trolls and shills.

This is the thread that the head mod of r/bitcoin wrote to the community more than a year ago, see for yourself his reasoning: https://www.reddit.com/r/Bitcoin/comments/3h9cq4/its_time_for_a_break_about_the_recent_mess/

The bitcoin price reactived positively to this letter: https://pbs.twimg.com/media/CxqtUakUQAEmC0d.jpg

> why is masking the presence of deleted comments bad?

From the point of view of this forum, because it makes it harder for trolls to attack bitcoin :D

> what kind of comments get deleted that are destroying a $12bn industry?

There's evidence of [sockpuppet usage](https://www.reddit.com/r/Bitcoin/comments/41ykkt/members_trying_to_destroy_bitcoin_on_this_thread/cz6ccka?context=3), [vote brigading](https://www.reddit.com/r/Bitcoin/comments/3v04pd/can_we_please_have_a_civil_discussion_about/cxjnz1d?context=1) and [automated vote bots](https://www.reddit.com/r/Bitcoin/comments/4biob5/research_into_instantaneous_vote_behavior_in/) which is just a taster of the kind of things the big blockers have used against bitcoin.

> what do you mean by $12bn industry? Software developers working on Bitcoin?

They probably mean the market cap of bitcoin, calculated as value-per-bitcoin * number-of-bitcoins, which works out to just under $12bn. There's VC-investment and already-running business which were not included and would probably make true figure of the bitcoin economy size quite different.

The r/btc subreddit won't mention that through all possible metrics, they are the minority in the bitcoin space. The vast majority of the bitcoin economy either strongly supports the Bitcoin Core developers or is indifferent to forum moderation on a forum they don't even visit.";0;3;False;belcher_;daf42i7;With the public spotlight on Reddit censorship, now would be the perfect time to let the rest of Reddit know about the censorship on /r/bitcoin;5eqvhs;https://www.reddit.com/r/btc/comments/5eqvhs/with_the_public_spotlight_on_reddit_censorship/
"Bitcoin has been largely hijacked by a company called Blockstream whose mission requires that Bitcoin not be able to upgrade natively. Blockstream has accomplished this hijacking very simply by hiring many the key developers and repurposing them.  Blockstream's stated motive is to sell consulting services for ""sidechains"" which can be thought of as ways to work around Bitcoin's native limitations. (1)

The problem is that Bitcoin *can* natively upgrade, and many of us have been working to perform this upgrade. Several solutions have been built. However, Theymos and other associates of Blockstream controls all of the important news sources, and ruthlessly suppresses information and spreads disinformation to prevent upgrading.

Complicating matters is the fact that Blockstream's chief investors are actually many of the companies which stand to lose the most if a decentralized money should ever take off.

Maybe they see their investment as a hedge. Or maybe they are straight up paying for sabotage.

In the end, they have a profit motive to suppress Bitcoin and are acting on it using censorship, banning, and disinformation. That makes them malactors, and reddit is one of their chief weapons.

(1) the key limitation is what is called a block size limit. This was a temporary measure added years ago when Bitcoin was truly in its infancy to stop a specific type of attack that is no longer a particular threat due to the fact that it would be ~2000x more expensive today than it was when the limit was added. Blockstream has instead used this *temporary* limitation as a way to *permanently* limit the capacity of the network.";11;1;False;jessquit;daf8q5f;With the public spotlight on Reddit censorship, now would be the perfect time to let the rest of Reddit know about the censorship on /r/bitcoin;5eqvhs;https://www.reddit.com/r/btc/comments/5eqvhs/with_the_public_spotlight_on_reddit_censorship/
"1. Yes
2. It's dishonest if nothing else.
3. This is the heart of the controversy. Bitcoin has hit a limit to how far it can scale, but it's only there because of a technicality (the hardware and software can support more users, but for a single line of code preventing it). With consensus, this limit can be lifted quite quickly and easily. The comments being deleted are the ones promoting reaching that consensus - instead, the only comments allowed are ones promoting a complex, controversial workaround. A workaround which, I might add, would be good and useful alongside the simple one - they don't have to be mutually exclusive.
4. The market cap of bitcoin (the number of bitcoin out there multiplied by the price of each bitcoin) is $12bn.";17;1;False;CJYP;daf3vmv;With the public spotlight on Reddit censorship, now would be the perfect time to let the rest of Reddit know about the censorship on /r/bitcoin;5eqvhs;https://www.reddit.com/r/btc/comments/5eqvhs/with_the_public_spotlight_on_reddit_censorship/
I didn't know;3;0;False;Itsbarelyillegal;daf4kj0;With the public spotlight on Reddit censorship, now would be the perfect time to let the rest of Reddit know about the censorship on /r/bitcoin;5eqvhs;https://www.reddit.com/r/btc/comments/5eqvhs/with_the_public_spotlight_on_reddit_censorship/
How would they know if the discussion is contained here?;5;3;False;zimmah;daeufgo;With the public spotlight on Reddit censorship, now would be the perfect time to let the rest of Reddit know about the censorship on /r/bitcoin;5eqvhs;https://www.reddit.com/r/btc/comments/5eqvhs/with_the_public_spotlight_on_reddit_censorship/
It it had destroyed a $12b market cap, wouldn't the market cap be $0 now? Or at least less than $12b?;-3;1;False;cpgilliard78;daeu9e2;With the public spotlight on Reddit censorship, now would be the perfect time to let the rest of Reddit know about the censorship on /r/bitcoin;5eqvhs;https://www.reddit.com/r/btc/comments/5eqvhs/with_the_public_spotlight_on_reddit_censorship/
"While I agree with the spirit of this post I do see it as kind of pointless. What has happened here at redshit the last week clearly shows that it is time to move the discussion elsewhere. 

https://forum.bitcoin.com/ is one alternative but I am not sure if it is any better. It is a centralized solution which means that there is potential for trading one form of censorship for another. What we as a community should be looking for is a platform based on something like pump.io or a blockchain system somewhat like steam which can be used for discussion.

Reddit is now dead to me and it is unlikely that I will bother to post anything here beyond post where I point out that the best course of action is to abandon it. ";-1;0;False;jennywikstrom;daexbd9;With the public spotlight on Reddit censorship, now would be the perfect time to let the rest of Reddit know about the censorship on /r/bitcoin;5eqvhs;https://www.reddit.com/r/btc/comments/5eqvhs/with_the_public_spotlight_on_reddit_censorship/
When  you say public you mean about 20 or so people who think reddit Is important and didn't realise that anyone with access to the back end of the website can edit any ones comments whenever they feel like it.;0;0;False;Dwayne_dibbly;daf0x48;With the public spotlight on Reddit censorship, now would be the perfect time to let the rest of Reddit know about the censorship on /r/bitcoin;5eqvhs;https://www.reddit.com/r/btc/comments/5eqvhs/with_the_public_spotlight_on_reddit_censorship/
"Amusing that a hypocrite like u/BeijingBitcoins has the nerve to complain about censorship, when there is documented evidence that he is happy to ""censor"" if & when it serves his interest.";2;3;False;eragmus;daejy9x;With the public spotlight on Reddit censorship, now would be the perfect time to let the rest of Reddit know about the censorship on /r/bitcoin;5eqvhs;https://www.reddit.com/r/btc/comments/5eqvhs/with_the_public_spotlight_on_reddit_censorship/
[deleted];1;1;False;;daeynnz;With the public spotlight on Reddit censorship, now would be the perfect time to let the rest of Reddit know about the censorship on /r/bitcoin;5eqvhs;https://www.reddit.com/r/btc/comments/5eqvhs/with_the_public_spotlight_on_reddit_censorship/
Reddit is a sponsored, censored forum pushing a corporate agenda. They let anarchists moderate political forums they don't like. ;4;2;False;MakeRedditGreat555;daek142;With the public spotlight on Reddit censorship, now would be the perfect time to let the rest of Reddit know about the censorship on /r/bitcoin;5eqvhs;https://www.reddit.com/r/btc/comments/5eqvhs/with_the_public_spotlight_on_reddit_censorship/
Does it seem to anyone else that Millenials are trying their hand at a number of repressive concepts like censorship,  socialism, etc? Is it just because they haven't been around long enough to see how badly these things turn out? Or have they been brought up and educated by the schools to do this or something? ;5;1;False;Vibr8gKiwi;daf3fg2;With the public spotlight on Reddit censorship, now would be the perfect time to let the rest of Reddit know about the censorship on /r/bitcoin;5eqvhs;https://www.reddit.com/r/btc/comments/5eqvhs/with_the_public_spotlight_on_reddit_censorship/
Pizza anyone? ;2;0;False;heltok;daevqre;With the public spotlight on Reddit censorship, now would be the perfect time to let the rest of Reddit know about the censorship on /r/bitcoin;5eqvhs;https://www.reddit.com/r/btc/comments/5eqvhs/with_the_public_spotlight_on_reddit_censorship/
I've stopped spending so much time on reddit after i was banned for like the 40th time. Not worth my time. GG for BlockStream. They won. They'll keep Bitcoin down and there is nothing we can do about it. I've got my BU node waiting for bigger blocks. I'm sick and tired arguing with mindless sheep. Till we get bigger blocks, Long Live Our BlockCore Overlords;19;5;False;FreeWifiInZombieland;daeityb;With the public spotlight on Reddit censorship, now would be the perfect time to let the rest of Reddit know about the censorship on /r/bitcoin;5eqvhs;https://www.reddit.com/r/btc/comments/5eqvhs/with_the_public_spotlight_on_reddit_censorship/
"We need to leave Reddit.  That's going to be the final decision and is beyond obvious at this point.

These discussions are simply time wasters until that collective decision is made";5;1;False;ghtdak;daf2i64;With the public spotlight on Reddit censorship, now would be the perfect time to let the rest of Reddit know about the censorship on /r/bitcoin;5eqvhs;https://www.reddit.com/r/btc/comments/5eqvhs/with_the_public_spotlight_on_reddit_censorship/
">which has divided the community and is quite literally destroying a $12bn open source software industry.

Mission accomplished. ";7;0;False;;daeyjxe;With the public spotlight on Reddit censorship, now would be the perfect time to let the rest of Reddit know about the censorship on /r/bitcoin;5eqvhs;https://www.reddit.com/r/btc/comments/5eqvhs/with_the_public_spotlight_on_reddit_censorship/
"Just stumbled on this from /all and I'm genuinely curious:

1. isn't this performed by the sub's mods and not site admins?

2. why is masking the presence of deleted comments bad?   

3. what kind of comments get deleted that are destroying a $12bn industry?

4. what do you mean by $12bn industry? Software developers working on Bitcoin?
";22;3;False;Kaneshadow;daf1phj;With the public spotlight on Reddit censorship, now would be the perfect time to let the rest of Reddit know about the censorship on /r/bitcoin;5eqvhs;https://www.reddit.com/r/btc/comments/5eqvhs/with_the_public_spotlight_on_reddit_censorship/
"They're just kids who use ideas and words to suit themselves.

Take Mark Friedenbach. This is one of the guys like Greg etc that's always making the argument that only the heaviest *valid* chain is authoritative, with lots of emphasis on *valid*.

They promote this argument in order to defend the block size limit. See, only by running a full node can one ensure that the heaviest chain is ""valid."" So that means that we need to make sure that ""everyone"" can run a full node, else we won't be able to ensure the chain is ""valid"" against malicious miners.

Sounds great right?

Then they say, ""here's a great idea - it's called a soft fork! **It allows miners to change the protocol without your realizing it changed!**"". In other words, *soft forks shit all over your ability to validate.*

*facepalm*

Those guys are either good saboteurs or just plain idiots. I used to think they were idiots. But really, nobody's that dumb.";3;0;False;jessquit;daf9zmt;With the public spotlight on Reddit censorship, now would be the perfect time to let the rest of Reddit know about the censorship on /r/bitcoin;5eqvhs;https://www.reddit.com/r/btc/comments/5eqvhs/with_the_public_spotlight_on_reddit_censorship/
Sorry, I'm not following - which forums don't they like? And why is letting anarchists run those good for reddit? ;10;1;False;jeanduluoz;daelk2q;With the public spotlight on Reddit censorship, now would be the perfect time to let the rest of Reddit know about the censorship on /r/bitcoin;5eqvhs;https://www.reddit.com/r/btc/comments/5eqvhs/with_the_public_spotlight_on_reddit_censorship/
One tries to keep track of the bulk of the herd. The herd moves bit by bit until suddenly a huge mass moves.;2;0;False;EnayVovin;dafbbmc;With the public spotlight on Reddit censorship, now would be the perfect time to let the rest of Reddit know about the censorship on /r/bitcoin;5eqvhs;https://www.reddit.com/r/btc/comments/5eqvhs/with_the_public_spotlight_on_reddit_censorship/
"Segwit's total failure to activate will be the first of many wake-up calls and slaps in the face to Core.

They just wasted a full year, probably thousands of man-hours and tons of funds, all for naught.

The 2nd-to-last wake-up call will be when Core is forked away from. Then they can make CrippleCoin, with the ""best development team in cryptocurrency"", only to be given a final slap in the face: no one uses it.";21;1;False;thcymos;daevxdd;With the public spotlight on Reddit censorship, now would be the perfect time to let the rest of Reddit know about the censorship on /r/bitcoin;5eqvhs;https://www.reddit.com/r/btc/comments/5eqvhs/with_the_public_spotlight_on_reddit_censorship/
