body;score;nb_replies;stickied;author;id;post_title;post_id;post_link
[deleted];3;1;False;;daeq3kl;With the public spotlight on Reddit censorship, now would be the perfect time to let the rest of Reddit know about the censorship on /r/bitcoin;5eqvhs;https://www.reddit.com/r/btc/comments/5eqvhs/with_the_public_spotlight_on_reddit_censorship/
If you haven't been paying attention, getting neither Segwit nor a block size increase is the best news that Blockstream can give its fiat-banker investors.;2;0;False;jessquit;daf95p1;With the public spotlight on Reddit censorship, now would be the perfect time to let the rest of Reddit know about the censorship on /r/bitcoin;5eqvhs;https://www.reddit.com/r/btc/comments/5eqvhs/with_the_public_spotlight_on_reddit_censorship/
Depends what their game is.;3;1;False;singularity87;daf3mrs;With the public spotlight on Reddit censorship, now would be the perfect time to let the rest of Reddit know about the censorship on /r/bitcoin;5eqvhs;https://www.reddit.com/r/btc/comments/5eqvhs/with_the_public_spotlight_on_reddit_censorship/
Right? Theymos, Mark, Greg, etc like to talk an anarchist / libertarian talk while walking a completely authoritarian walk.;3;0;False;jessquit;daf9m93;With the public spotlight on Reddit censorship, now would be the perfect time to let the rest of Reddit know about the censorship on /r/bitcoin;5eqvhs;https://www.reddit.com/r/btc/comments/5eqvhs/with_the_public_spotlight_on_reddit_censorship/
Looks like it was a mistake, sorry. The post is now approved. Next time, feel free to message the mods.;-4;3;False;eragmus;daelyew;With the public spotlight on Reddit censorship, now would be the perfect time to let the rest of Reddit know about the censorship on /r/bitcoin;5eqvhs;https://www.reddit.com/r/btc/comments/5eqvhs/with_the_public_spotlight_on_reddit_censorship/
/u/belcher is the real troll here who can't seem to stay away from this sub due to his desperate need to spread the r/Bitcoin/N Korean party line and prevent the spread of the truth. He is a rabid supporter of censorship. ;7;1;False;H0dlr;daf7bf8;With the public spotlight on Reddit censorship, now would be the perfect time to let the rest of Reddit know about the censorship on /r/bitcoin;5eqvhs;https://www.reddit.com/r/btc/comments/5eqvhs/with_the_public_spotlight_on_reddit_censorship/
"Censorship is the weapon of weak ideas. We have all clearly seen the bitcoin mods banning people for expressing their polite and data backed opinion.

The price reaction bit is hilariously silly. To say the price did anything for any reason is pure speculation. And if we take that point to its logical conclusion then the price rise was higher before blocks were full. So the price supports not full blocks more than full blocks.


Almost everyone here has more knowledge of the technicalities and history than the commenter at the censored sub, the moon kids dominate the comments there. We actually want to keep bitcoin as it was designed and  not pervert it into another system with the same name.


There is as much or more evidence that the sock puppets, bots, and vote manipulation is coming from the Pro Core camp.


The majority of knowledgeable users do not support core. Do you have any evidence for your opinion? Does it take into account effects of the censorship?

#no facts, opinion only
";3;1;False;highintensitycanada;dafd0c1;With the public spotlight on Reddit censorship, now would be the perfect time to let the rest of Reddit know about the censorship on /r/bitcoin;5eqvhs;https://www.reddit.com/r/btc/comments/5eqvhs/with_the_public_spotlight_on_reddit_censorship/
"Which is I guess another thing to point out.

Maybe we should focus on how to make American mining competitive instead of bitching about how Chinese miners have all the cards. ";1;0;False;;daf20cb;With the public spotlight on Reddit censorship, now would be the perfect time to let the rest of Reddit know about the censorship on /r/bitcoin;5eqvhs;https://www.reddit.com/r/btc/comments/5eqvhs/with_the_public_spotlight_on_reddit_censorship/
r/bitcoin, they don't care so they let it be run by an asshole, u/theymos. This is not necessarily good for reddit but takes no extra effort so cost them nothing to just let it go. ;5;2;False;StolenBitcoin;daepj92;With the public spotlight on Reddit censorship, now would be the perfect time to let the rest of Reddit know about the censorship on /r/bitcoin;5eqvhs;https://www.reddit.com/r/btc/comments/5eqvhs/with_the_public_spotlight_on_reddit_censorship/
"There is no such thing as a decentralized well-kept garden inside a wall protected by trusted experts.

The very idea is utterly oxymoronic and those of us who pay attention to the words you use recognize them as words of attack against the very values of decentralized currency.";5;1;False;jessquit;daf8zr7;With the public spotlight on Reddit censorship, now would be the perfect time to let the rest of Reddit know about the censorship on /r/bitcoin;5eqvhs;https://www.reddit.com/r/btc/comments/5eqvhs/with_the_public_spotlight_on_reddit_censorship/
That sounds like a very rational concern;4;1;False;Kaneshadow;daf9ao9;With the public spotlight on Reddit censorship, now would be the perfect time to let the rest of Reddit know about the censorship on /r/bitcoin;5eqvhs;https://www.reddit.com/r/btc/comments/5eqvhs/with_the_public_spotlight_on_reddit_censorship/
"Interesting, thanks for the response.

TBH I find claiming the market cap of bitcoin as ""destroying a $12 billion industry"" a bit inaccurate.  That's not how ""industry"" works.  But that does sound like some intrigue, if that's why the comment doctoring is going on.  ";4;2;False;Kaneshadow;daf85py;With the public spotlight on Reddit censorship, now would be the perfect time to let the rest of Reddit know about the censorship on /r/bitcoin;5eqvhs;https://www.reddit.com/r/btc/comments/5eqvhs/with_the_public_spotlight_on_reddit_censorship/
Because the sub and its moderator have been reported several times to Reddit. It's not only been discussed here.;1;0;False;cajuntechie;dafcluy;With the public spotlight on Reddit censorship, now would be the perfect time to let the rest of Reddit know about the censorship on /r/bitcoin;5eqvhs;https://www.reddit.com/r/btc/comments/5eqvhs/with_the_public_spotlight_on_reddit_censorship/
"What is the status of the little /r/btc advert in the tip right corner? /r/Bitcoin's advertisment has been tremendously successful. I think we should follow up with this for /r/btc. 

Promote a welcoming environment to ALL bitcoiners, regardless of political views, and censorship free. A culture of tolerance and acceptance will always overwhelm one of propaganda and oppression. 

I would love to contribute to the ad campaign operations, i work at a programmatic mobile media advertising startup and feel right at home with the content. ";5;1;False;jeanduluoz;daf3hhv;With the public spotlight on Reddit censorship, now would be the perfect time to let the rest of Reddit know about the censorship on /r/bitcoin;5eqvhs;https://www.reddit.com/r/btc/comments/5eqvhs/with_the_public_spotlight_on_reddit_censorship/
[deleted];19;1;False;;daewb9j;With the public spotlight on Reddit censorship, now would be the perfect time to let the rest of Reddit know about the censorship on /r/bitcoin;5eqvhs;https://www.reddit.com/r/btc/comments/5eqvhs/with_the_public_spotlight_on_reddit_censorship/
People still find value in Bitcoin right now, otherwise there would be no full blocks. Bitcoin is Gold 2.0, and i dont have a problem paying some pennies to transact. Of course, I'd like the fee to be as low as possible, but it's not the number one priority in my view. The truth is, depending on your perspective and use case for it, Bitcoin is doing pretty damn well. ;2;1;False;;daexe97;With the public spotlight on Reddit censorship, now would be the perfect time to let the rest of Reddit know about the censorship on /r/bitcoin;5eqvhs;https://www.reddit.com/r/btc/comments/5eqvhs/with_the_public_spotlight_on_reddit_censorship/
Is that who banned you?;-2;2;False;;daem0h3;With the public spotlight on Reddit censorship, now would be the perfect time to let the rest of Reddit know about the censorship on /r/bitcoin;5eqvhs;https://www.reddit.com/r/btc/comments/5eqvhs/with_the_public_spotlight_on_reddit_censorship/
Asked for an 8mb imediat BlockSize and then follow Gavin's plan of BlockSize Increase.;3;0;False;FreeWifiInZombieland;dafk12v;With the public spotlight on Reddit censorship, now would be the perfect time to let the rest of Reddit know about the censorship on /r/bitcoin;5eqvhs;https://www.reddit.com/r/btc/comments/5eqvhs/with_the_public_spotlight_on_reddit_censorship/
"Are you admitting to censorship on /r/Bitcoin? 
";14;1;False;AnonymousRev;daeklid;With the public spotlight on Reddit censorship, now would be the perfect time to let the rest of Reddit know about the censorship on /r/bitcoin;5eqvhs;https://www.reddit.com/r/btc/comments/5eqvhs/with_the_public_spotlight_on_reddit_censorship/
"Can you tell me why this reply to /u/nullc defending myself from his accusations of being a zcash pumper was censored?

https://np.reddit.com/r/Bitcoin/comments/5epdd0/unexpected_chain_split_in_ethereum_have_to_roll/daedz1u/";22;2;False;SammieData;daelra4;With the public spotlight on Reddit censorship, now would be the perfect time to let the rest of Reddit know about the censorship on /r/bitcoin;5eqvhs;https://www.reddit.com/r/btc/comments/5eqvhs/with_the_public_spotlight_on_reddit_censorship/
Yes anyone can create thenewyorktimes69.co but that doesn't exactly place you on an even playing surface with the actual New York times.;3;0;False;jessquit;daf9enl;With the public spotlight on Reddit censorship, now would be the perfect time to let the rest of Reddit know about the censorship on /r/bitcoin;5eqvhs;https://www.reddit.com/r/btc/comments/5eqvhs/with_the_public_spotlight_on_reddit_censorship/
"And yet they depend on English dev teams. It would be cool if a Chinese dev team emerged. Then we could speak the same languages; C++, Java, Python. No bullshit.";17;2;False;viners;daellk3;With the public spotlight on Reddit censorship, now would be the perfect time to let the rest of Reddit know about the censorship on /r/bitcoin;5eqvhs;https://www.reddit.com/r/btc/comments/5eqvhs/with_the_public_spotlight_on_reddit_censorship/
not sure anyone will care. but during scaling bitcoin someone from Bitfury i think it was the CEO explained that 42% of bitmains customers are international (I imagine they have a friendly buisness relationship.. bitcoin is very small afterall). So most  bitcoin being mined in china is false, its more like half, if we are willing to use bitmains metrics.. they are one of if not the most succesful mining hardware manufacturer.;3;1;False;;daejs6k;With the public spotlight on Reddit censorship, now would be the perfect time to let the rest of Reddit know about the censorship on /r/bitcoin;5eqvhs;https://www.reddit.com/r/btc/comments/5eqvhs/with_the_public_spotlight_on_reddit_censorship/
