body;score;nb_replies;stickied;author;id;post_title;post_id;post_link
They know. They don't seem to care about individual subs having censorship.;41;2;False;cajuntechie;daenwo7;With the public spotlight on Reddit censorship, now would be the perfect time to let the rest of Reddit know about the censorship on /r/bitcoin;5eqvhs;https://www.reddit.com/r/btc/comments/5eqvhs/with_the_public_spotlight_on_reddit_censorship/
The idea is to remove the cancer *before* the patient dies.;2;0;False;jessquit;dafa2gk;With the public spotlight on Reddit censorship, now would be the perfect time to let the rest of Reddit know about the censorship on /r/bitcoin;5eqvhs;https://www.reddit.com/r/btc/comments/5eqvhs/with_the_public_spotlight_on_reddit_censorship/
"For any readers getting fooled here by wormtongue's proof, they shadow-delete the comments on r\/bitcoin now - that way comments are invisible to readers, while still appearing to the author unless the author logs out ([example of mod handywork](https://www.reddit.com/r/Bitcoin/comments/3i2hke/august_23_2015_block_size_and_hard_fork_dialog/cudfcaz/) - I see [this](https://i.imgur.com/F87fkYK.png)). Much better than needing CSS hacks.

Presumably it's done by both bot and by mods manually deleting comments they disagree with as ""spam"", but the specific methods of their deception no longer interest me.";13;1;False;sockpuppet2001;daeuaz2;With the public spotlight on Reddit censorship, now would be the perfect time to let the rest of Reddit know about the censorship on /r/bitcoin;5eqvhs;https://www.reddit.com/r/btc/comments/5eqvhs/with_the_public_spotlight_on_reddit_censorship/
I don't know if censorship to steer a narrative or lying about what your doing is worse.;12;0;False;AnonymousRev;daeldp5;With the public spotlight on Reddit censorship, now would be the perfect time to let the rest of Reddit know about the censorship on /r/bitcoin;5eqvhs;https://www.reddit.com/r/btc/comments/5eqvhs/with_the_public_spotlight_on_reddit_censorship/
"Not correct, I logged out and saw the blankness.

Anyway Greg I'll tell you that I've spent the last 12 months here upvoting your posts even though I completely disagree with the strangle-hold you have over Bitcoin, because I don't want to see them buried with downvotes as it's important to look at both sides of the conversation.";9;1;False;SammieData;daeseg8;With the public spotlight on Reddit censorship, now would be the perfect time to let the rest of Reddit know about the censorship on /r/bitcoin;5eqvhs;https://www.reddit.com/r/btc/comments/5eqvhs/with_the_public_spotlight_on_reddit_censorship/
Thanks, appreciate it. ;4;1;False;SammieData;daem3i7;With the public spotlight on Reddit censorship, now would be the perfect time to let the rest of Reddit know about the censorship on /r/bitcoin;5eqvhs;https://www.reddit.com/r/btc/comments/5eqvhs/with_the_public_spotlight_on_reddit_censorship/
Mistake my ass, you're a lying piece of shit and always have been;5;0;False;;daf219h;With the public spotlight on Reddit censorship, now would be the perfect time to let the rest of Reddit know about the censorship on /r/bitcoin;5eqvhs;https://www.reddit.com/r/btc/comments/5eqvhs/with_the_public_spotlight_on_reddit_censorship/
"Yes, a ""mistake"" ";10;1;False;jeanduluoz;daf07cm;With the public spotlight on Reddit censorship, now would be the perfect time to let the rest of Reddit know about the censorship on /r/bitcoin;5eqvhs;https://www.reddit.com/r/btc/comments/5eqvhs/with_the_public_spotlight_on_reddit_censorship/
"Both Special Agent Theymos and the Reddit admins have very close connections with the government.

So they're all best buds together.";2;0;False;thcymos;daew0b4;With the public spotlight on Reddit censorship, now would be the perfect time to let the rest of Reddit know about the censorship on /r/bitcoin;5eqvhs;https://www.reddit.com/r/btc/comments/5eqvhs/with_the_public_spotlight_on_reddit_censorship/
Calling theymos an anarchist is like calling Mao a free market capitalist. Couldn't be farther from the truth. Plus, I still have no idea how reddit benefits from bad moderation in r bitcoin ;7;1;False;jeanduluoz;daf09yy;With the public spotlight on Reddit censorship, now would be the perfect time to let the rest of Reddit know about the censorship on /r/bitcoin;5eqvhs;https://www.reddit.com/r/btc/comments/5eqvhs/with_the_public_spotlight_on_reddit_censorship/
"> So most  bitcoin being mined in china is false, its more like half, if we are willing to use bitmains metrics.

I think many people including myself don't believe those metrics for a moment. Why would bitmain tell the truth if in fact the Chinese percentage was much higher? 

The whole strategy of the cartel is basically a Sybil: make it appear that mining is decentralized, when really it isn't, because if people really knew how bad it was, there'd be a rush for the exits. ";0;0;False;jessquit;daf9apt;With the public spotlight on Reddit censorship, now would be the perfect time to let the rest of Reddit know about the censorship on /r/bitcoin;5eqvhs;https://www.reddit.com/r/btc/comments/5eqvhs/with_the_public_spotlight_on_reddit_censorship/
What kind of proof are you looking for?;1;1;False;highintensitycanada;dafdcn8;With the public spotlight on Reddit censorship, now would be the perfect time to let the rest of Reddit know about the censorship on /r/bitcoin;5eqvhs;https://www.reddit.com/r/btc/comments/5eqvhs/with_the_public_spotlight_on_reddit_censorship/
Wait I thought the future was english consensus ?;-2;0;False;btchip;daerqli;With the public spotlight on Reddit censorship, now would be the perfect time to let the rest of Reddit know about the censorship on /r/bitcoin;5eqvhs;https://www.reddit.com/r/btc/comments/5eqvhs/with_the_public_spotlight_on_reddit_censorship/
Exactly.;1;0;False;jessquit;daf96d7;With the public spotlight on Reddit censorship, now would be the perfect time to let the rest of Reddit know about the censorship on /r/bitcoin;5eqvhs;https://www.reddit.com/r/btc/comments/5eqvhs/with_the_public_spotlight_on_reddit_censorship/
">They just wasted a full year, probably thousands of man-hours and tons of funds, all for naught.

They are actually right on track.  The goal is to stall bitcoin so that AXA investments and friends can transition from dollars/yen/euros to world bank money.";4;1;False;theymoslover;daf96w5;With the public spotlight on Reddit censorship, now would be the perfect time to let the rest of Reddit know about the censorship on /r/bitcoin;5eqvhs;https://www.reddit.com/r/btc/comments/5eqvhs/with_the_public_spotlight_on_reddit_censorship/
Personal attacks again;2;2;False;belcher_;dafc672;With the public spotlight on Reddit censorship, now would be the perfect time to let the rest of Reddit know about the censorship on /r/bitcoin;5eqvhs;https://www.reddit.com/r/btc/comments/5eqvhs/with_the_public_spotlight_on_reddit_censorship/
"r/bitcoin doesn't claim to be decentralized, given that it's hosted on the reddit website. Bitcoin itself on the other hand tries to be.

Theymos was fighting against BitcoinXT, a contentious hard fork that had the policy of very large blocks and would have resulted in it becoming much harder to run a full node for most people. That would have been the death of a decentralized bitcoin, and it's interesting that this forum takes the side of XT instead of theymos in this case.";2;3;False;belcher_;dafbzv1;With the public spotlight on Reddit censorship, now would be the perfect time to let the rest of Reddit know about the censorship on /r/bitcoin;5eqvhs;https://www.reddit.com/r/btc/comments/5eqvhs/with_the_public_spotlight_on_reddit_censorship/
Yes, it is, and those of us who have been paying close attention believe it is more than just a concern, but a reality.;3;0;False;jessquit;dafa5u9;With the public spotlight on Reddit censorship, now would be the perfect time to let the rest of Reddit know about the censorship on /r/bitcoin;5eqvhs;https://www.reddit.com/r/btc/comments/5eqvhs/with_the_public_spotlight_on_reddit_censorship/
You're right, the wording might not be the best in that one sentence. But I'm not sure what better word to use. Bitcoin isn't an industry or a company. Maybe community would be a better word? Though $12bn community doesn't sound great.;1;1;False;CJYP;daf8x7q;With the public spotlight on Reddit censorship, now would be the perfect time to let the rest of Reddit know about the censorship on /r/bitcoin;5eqvhs;https://www.reddit.com/r/btc/comments/5eqvhs/with_the_public_spotlight_on_reddit_censorship/
"I'm no expert on determining valuations for entire industries, but ""$12 billion industry"" may not be quite as inaccurate as you might initially think.

As a complex system with many different components, bitcoin is many things, depending on which part of the system you care about: it's a protocol, a currency, and a computer network. (This is similar to the internet itself, with its communications protocol, email as a container for transferring information, and its network of servers.)

In many ways, bitcoin actually does resemble a traditional industry.

* There are large data centers, called mining farms, that in a sense provide a secure space in a global ledger in which transactions can be recorded. These are analogous to factories producing a good.

* There are teams of software engineers who create competing versions of software that can be used by the data centers. These are analogous to engineers who design production processes.

* There is a protocol that provides a unifying standard to allow for the interoperability of the different parts. This is analogous to guidelines that allow manufactured goods to be built from parts sourced from a variety of vendors.

* There is a network of computers that broadcast copies of the ledger around the world. These are analogous to the trucks, trains, planes, and ships that transport goods to consumers.

* There are independent organizations that create digital wallets, allowing consumers and businesses to access and store bitcoin. These might be analogous to stores, except that each person can have their own store (or they can use a traditional store).

* There are exchanges that make it easy to buy and sell units of the currency...

These analogies are probably imperfect, but it seems reasonable to consider bitcoin an industry. 

Determining how to value the industry is another matter, of course. The different companies that make the system work (exchanges, miners, custodial wallet providers, ...) each generate their own revenue streams, which might provide one way of valuing this industry. Assigning an actual value, however, requires a lot of speculation (companies' financial details aren't always available, and when making projections, we don't know if current trends will continue.)

Fortunately, there is a sophisticated market that works 24/7 to turn all of these speculations into a single aggregate value, namely, the bitcoin market itself. The price of a bitcoin encapsulates speculators' best guesses as to the value of the whole system. If no one finds bitcoin useful, the value will go to zero. If it is tremendously useful, the value will be very high, due largely to the fact that the supply of bitcoin is limited (roughly 16 million bitcoin have been produced so far, and the total number will never exceed 21 million). 

In this sense, the bitcoin market cap might actually be considered as a simple proxy for a more direct valuation scheme. In fact, a publicly traded company can be valued in much the same way: it's total value can be defined to be its market cap, which is the price per share multiplied by the number of outstanding shares. The bitcoin market cap provides a similar measure that in some sense accounts for the success of all bitcoin-related companies.

Note 1: I think the claim that r/bitcoin censorship is ""destroying a $12 billion industry"" may still be a little bit misleading. The censorship in r/bitcoin is blatant and damaging, so it is an important contributing factor to the current stalemate in the scaling debate, but it may not be the most important factor. As others have pointed out, the majority of the global hashpower (i.e. most of the mining) is in China right now, and other discussion forums are more popular there.

Note 2: Corrections or feedback on this analysis would be great!

Edit: wording, formatting";3;0;False;11251442132;dafj8bi;With the public spotlight on Reddit censorship, now would be the perfect time to let the rest of Reddit know about the censorship on /r/bitcoin;5eqvhs;https://www.reddit.com/r/btc/comments/5eqvhs/with_the_public_spotlight_on_reddit_censorship/
I'm working on /r/btc [campaigns.](https://www.reddit.com/comments/52xrdr/we_all_love_theymos_but_what_do_other_bitcoin/?ref=share&ref_source=link)  Would love help!;3;0;False;theymoslover;daf8y2v;With the public spotlight on Reddit censorship, now would be the perfect time to let the rest of Reddit know about the censorship on /r/bitcoin;5eqvhs;https://www.reddit.com/r/btc/comments/5eqvhs/with_the_public_spotlight_on_reddit_censorship/
post proof please;1;2;False;theymoslover;daf8vf5;With the public spotlight on Reddit censorship, now would be the perfect time to let the rest of Reddit know about the censorship on /r/bitcoin;5eqvhs;https://www.reddit.com/r/btc/comments/5eqvhs/with_the_public_spotlight_on_reddit_censorship/
Im with you. So why is this post getting up votes then?;1;1;False;cpgilliard78;daexo2m;With the public spotlight on Reddit censorship, now would be the perfect time to let the rest of Reddit know about the censorship on /r/bitcoin;5eqvhs;https://www.reddit.com/r/btc/comments/5eqvhs/with_the_public_spotlight_on_reddit_censorship/
And language barrier to filter out the techno-douchery. The finer points of neckbeard don't translate well.;9;1;False;Noosterdam;daeo5q4;With the public spotlight on Reddit censorship, now would be the perfect time to let the rest of Reddit know about the censorship on /r/bitcoin;5eqvhs;https://www.reddit.com/r/btc/comments/5eqvhs/with_the_public_spotlight_on_reddit_censorship/
"""Destroying the development community supporting a $12bn currency"" would have made more sense imo";1;0;False;Kaneshadow;daf9bs5;With the public spotlight on Reddit censorship, now would be the perfect time to let the rest of Reddit know about the censorship on /r/bitcoin;5eqvhs;https://www.reddit.com/r/btc/comments/5eqvhs/with_the_public_spotlight_on_reddit_censorship/
">Theymos was fighting against BitcoinXT, a contentious hard fork

Only contentious because a certain faction believes it's *necessary to limit growth.*

> that had the policy of very large blocks 

No, it had a policy of a higher *limit.*

Were the limit louder lifted today the typical block would be roughly 1.1 MB based on current adoption.

> and would have resulted in it becoming much harder to run a full node for most people

Patently false, a deliberate attempt to misinform.";5;1;False;jessquit;dafcnt1;With the public spotlight on Reddit censorship, now would be the perfect time to let the rest of Reddit know about the censorship on /r/bitcoin;5eqvhs;https://www.reddit.com/r/btc/comments/5eqvhs/with_the_public_spotlight_on_reddit_censorship/
"How can something be contentious if people don't know about it?  I remember everything about the release announcement and people we excited and liked the idea before the post and comments began to be removed.

I would say the community was fully in support of XT which makes it not contentious at all.";4;1;False;highintensitycanada;dafdbs5;With the public spotlight on Reddit censorship, now would be the perfect time to let the rest of Reddit know about the censorship on /r/bitcoin;5eqvhs;https://www.reddit.com/r/btc/comments/5eqvhs/with_the_public_spotlight_on_reddit_censorship/
"TBH, these glitches exist, but the asynchronity is usually limited to a few seconds. I have witnessed this myself.

It is, of course, not sufficient explanation for the bullshit going over in rBitcoin.";2;0;False;awemany;dafh3hk;With the public spotlight on Reddit censorship, now would be the perfect time to let the rest of Reddit know about the censorship on /r/bitcoin;5eqvhs;https://www.reddit.com/r/btc/comments/5eqvhs/with_the_public_spotlight_on_reddit_censorship/
Oh, sorry. ;2;0;False;StolenBitcoin;daf3jpv;With the public spotlight on Reddit censorship, now would be the perfect time to let the rest of Reddit know about the censorship on /r/bitcoin;5eqvhs;https://www.reddit.com/r/btc/comments/5eqvhs/with_the_public_spotlight_on_reddit_censorship/
"Really? Source for those comments please.

It is not possible that there are simply more people that disagree with you, or were before they were all banned and only uneducated were left.

Also, there were many more comments in support of xt, so that shows me the community supported it.

Again your price nonsense is nonsense, we see full blocks hurting price more";2;0;False;highintensitycanada;dafjnp5;With the public spotlight on Reddit censorship, now would be the perfect time to let the rest of Reddit know about the censorship on /r/bitcoin;5eqvhs;https://www.reddit.com/r/btc/comments/5eqvhs/with_the_public_spotlight_on_reddit_censorship/
Correlation does not equal causation. Someone can (and they have on this sub quite a few times) go through ViaBTC tweets, BU announcements, Peter R blog posts and point to positive upticks in the price. You can go through price movements and find correlations to support any argument pretty much. It's much more likely attributed to normal price fluctuations than any single event/tweet/blog post/whatever. ;4;1;False;zanetackett;dafinq8;With the public spotlight on Reddit censorship, now would be the perfect time to let the rest of Reddit know about the censorship on /r/bitcoin;5eqvhs;https://www.reddit.com/r/btc/comments/5eqvhs/with_the_public_spotlight_on_reddit_censorship/
Well it wouldn't be my *first* choice, but I'm all-for breaking up the development of our protocol into more than one viable group and would support it on that basis alone. The current group and its questionable leadership are proving to be unacceptable and need a check and balance on their attempt to dominate the discussion and agenda.;5;0;False;jessquit;dafg1zp;With the public spotlight on Reddit censorship, now would be the perfect time to let the rest of Reddit know about the censorship on /r/bitcoin;5eqvhs;https://www.reddit.com/r/btc/comments/5eqvhs/with_the_public_spotlight_on_reddit_censorship/
"r\/bitcoin mods are hiding the ""[removed]"" notice when they delete comments, they do this to prevent casual readers from realising the amount of dishonest fuckery going on in r\/bitcoin.

You were denying a method of doing this, I wanted to ensure that the focus of any reader stayed on the fact that ***you do it***. BeijingBitcoins merely stated the method you used to use instead of the method you currently use.

Reddit provides a shadow-deleting feature *for spam* (it's very clearly labelled) and that's what r/btc is using it for, it's not there for your petty power trips to censor other bitcoin enthusiasts so you can present a facade of party support. Stop name-squatting on ""Bitcoin"", you're a policed promotion sub for Blockstream Inc.";7;1;False;sockpuppet2001;daf55c3;With the public spotlight on Reddit censorship, now would be the perfect time to let the rest of Reddit know about the censorship on /r/bitcoin;5eqvhs;https://www.reddit.com/r/btc/comments/5eqvhs/with_the_public_spotlight_on_reddit_censorship/
">Reddit's databases aren't instantly consistent. Sometimes posts flicker in and out depending on what servers you hit... probably the case here.

>Thanks for helping with the comment visibility.

So it was just a glitch, eh Greg? 

https://youtu.be/z_KmNZNT5xw";5;1;False;todu;daezuey;With the public spotlight on Reddit censorship, now would be the perfect time to let the rest of Reddit know about the censorship on /r/bitcoin;5eqvhs;https://www.reddit.com/r/btc/comments/5eqvhs/with_the_public_spotlight_on_reddit_censorship/
"Yes, one of many, many, many, many, many ""mistakes"" great work u/eragums. Messaging mods at r/bitcoin anything but pro-CoreCoin BS, just gets the reply ""troll"", so plese fuck off now back to r/corecoin. ";9;0;False;StolenBitcoin;daf3g31;With the public spotlight on Reddit censorship, now would be the perfect time to let the rest of Reddit know about the censorship on /r/bitcoin;5eqvhs;https://www.reddit.com/r/btc/comments/5eqvhs/with_the_public_spotlight_on_reddit_censorship/
If they were constant with their rules I'm sure there would be less problems. ;2;0;False;highintensitycanada;dafjt6h;With the public spotlight on Reddit censorship, now would be the perfect time to let the rest of Reddit know about the censorship on /r/bitcoin;5eqvhs;https://www.reddit.com/r/btc/comments/5eqvhs/with_the_public_spotlight_on_reddit_censorship/
"No, good moderation simply requires that the moderators not be shills trying to push an agenda. A simple attitude adjustment is all that is needed, not a single extra calorie needs be spent.

In fact, better moderation would actually require less work, because to censor and misinform at the level of rbitcoin requires a lot of human interaction and constant tweaking of the custom code they wrote to break reddit.

Not to mention all the extra effort required to manage the fallout from splitting the community into two warring factions.";5;0;False;jessquit;daf9ipz;With the public spotlight on Reddit censorship, now would be the perfect time to let the rest of Reddit know about the censorship on /r/bitcoin;5eqvhs;https://www.reddit.com/r/btc/comments/5eqvhs/with_the_public_spotlight_on_reddit_censorship/
Yes, I am retarded. ;4;1;False;jeanduluoz;daf35g9;With the public spotlight on Reddit censorship, now would be the perfect time to let the rest of Reddit know about the censorship on /r/bitcoin;5eqvhs;https://www.reddit.com/r/btc/comments/5eqvhs/with_the_public_spotlight_on_reddit_censorship/
"I was there too, my memory of it is that I would make posts against BitcoinXT and they would be downvoted and hidden at the bottom of each thread. So to any casual observer it looked like everyone supported XT.

Another bit of evidence against is that [the price dropped every time a hard fork looked more likely](https://i.imgur.com/EVPYLR8.jpg)";1;3;False;belcher_;dafdfoj;With the public spotlight on Reddit censorship, now would be the perfect time to let the rest of Reddit know about the censorship on /r/bitcoin;5eqvhs;https://www.reddit.com/r/btc/comments/5eqvhs/with_the_public_spotlight_on_reddit_censorship/
Question for you then, would you like it if BitcoinXT became the dominant software used by the economic consensus?;1;1;False;belcher_;dafd2y2;With the public spotlight on Reddit censorship, now would be the perfect time to let the rest of Reddit know about the censorship on /r/bitcoin;5eqvhs;https://www.reddit.com/r/btc/comments/5eqvhs/with_the_public_spotlight_on_reddit_censorship/
"Hello u/sockpuppet2001.

There is nothing being posted here where I'm trying to ""fool"" anyone. It's a very clear contradiction of BeijingBitcoins' very first sentence accusing r/bitcoin of ""heavy censorship"", predicated on yet another lie (which now seems like a common modus operandi for BeijingBitcoins) of CSS being used to rearrange comments to hide removed/deleted comments.

^ This was false, as I have proved.

Do you want to deny this?

---

Now, as far as shadow-deleting of comments, this is the right of the mods of a subreddit. Otherwise, that option would not be provided by Reddit. For instance, death threats are often shadow-deleted, or manually deleted by mods.

Even r/btc does shadow-deleting, though. So again, in the interest of speaking fairly about ""r/bitcoin heavy censorship"", why not mention in the same breath that r/btc also engages in this?

Proof:

Link to example thread:
> https://www.reddit.com/r/btc/comments/5eqo8r/equity_analyst_spencer_bogarts_opinion_on_high/

Screenshot showing shadow-deleted comment on r/btc thread:
> http://i.imgur.com/hAUsFJw.png";1;1;False;eragmus;daf24n1;With the public spotlight on Reddit censorship, now would be the perfect time to let the rest of Reddit know about the censorship on /r/bitcoin;5eqvhs;https://www.reddit.com/r/btc/comments/5eqvhs/with_the_public_spotlight_on_reddit_censorship/
"Reddit's databases aren't instantly consistent. Sometimes posts flicker in and out depending on what servers you hit... probably the case here.

Thanks for helping with the comment visibility.";-3;1;False;nullc;daesi4s;With the public spotlight on Reddit censorship, now would be the perfect time to let the rest of Reddit know about the censorship on /r/bitcoin;5eqvhs;https://www.reddit.com/r/btc/comments/5eqvhs/with_the_public_spotlight_on_reddit_censorship/
*Stockholm Syndrome intensifies*;4;0;False;jessquit;daf9ngs;With the public spotlight on Reddit censorship, now would be the perfect time to let the rest of Reddit know about the censorship on /r/bitcoin;5eqvhs;https://www.reddit.com/r/btc/comments/5eqvhs/with_the_public_spotlight_on_reddit_censorship/
"Yes, a mistake. There's no reason I can imagine why a comment of that nature would be removed, unless it was based on a mistaken assumption that the comment was intended to pump ZEC. That's an easy mistake to make when reviewing many comments. Mods are not artificial intelligence agents possessing perfect analytical capabilities; mistakes are always possible, which is why I suggested the affected person message mods next time a problem is suspected.";1;1;False;eragmus;daf2ypc;With the public spotlight on Reddit censorship, now would be the perfect time to let the rest of Reddit know about the censorship on /r/bitcoin;5eqvhs;https://www.reddit.com/r/btc/comments/5eqvhs/with_the_public_spotlight_on_reddit_censorship/
