body;score;nb_replies;stickied;author;id;post_title;post_id;post_link
"There's nothing that should be done today. It's not that they will listen at some hysterical posts on this sub to decide when it's time to do ""something"". Upgrades will come, with plans and calm.";1;1;False;Giusis;dpr8ry6;And not a single post about high fees or slow transactions on r/bitcoin. I guess not important enough to be discussed...;7cmhz2;https://www.reddit.com/r/btc/comments/7cmhz2/and_not_a_single_post_about_high_fees_or_slow/
Bitcoin probably has 100 attack vectors. It is nothing more than accounting and basic prioritization that makes you realize that the core team cannot chase every attack vector. You are wrong about this thing lasting a year now. Just a few weeks ago the mempool was completely empty. It stays that way until it is attacked. ;1;1;False;johnnycoin;dprpaxg;And not a single post about high fees or slow transactions on r/bitcoin. I guess not important enough to be discussed...;7cmhz2;https://www.reddit.com/r/btc/comments/7cmhz2/and_not_a_single_post_about_high_fees_or_slow/
You got downvoted for speaking the truth (new DAA algorithm in a few hours).  It's amazing how much people are invested in suppressing either side, based on their financial position/holdings.  It's a shame the truth isn't priority #1.;2;0;False;bucket72;dprc1qt;And not a single post about high fees or slow transactions on r/bitcoin. I guess not important enough to be discussed...;7cmhz2;https://www.reddit.com/r/btc/comments/7cmhz2/and_not_a_single_post_about_high_fees_or_slow/
"LN will open its door in 18 months MINIMUM, and then adoption will take who knows how long. 

Imo, BTC can't survive that long as no1 crypto with 5$+ fees. Also, what stops BCH to implement LN (and even segwit) if technology proves to be any good as it is advertised.

But given the fact that they promised that ""Segwit will instantly double chain capacity"" and they didn't deliver anything near that 6 months from its activation makes you think why would you believe anything they say...";1;1;False;Rdzavi;dprvcvc;And not a single post about high fees or slow transactions on r/bitcoin. I guess not important enough to be discussed...;7cmhz2;https://www.reddit.com/r/btc/comments/7cmhz2/and_not_a_single_post_about_high_fees_or_slow/
And this slow blocks EDA issue will be fixed in 4 hours!;3;1;False;Devar0;dpr6ptl;And not a single post about high fees or slow transactions on r/bitcoin. I guess not important enough to be discussed...;7cmhz2;https://www.reddit.com/r/btc/comments/7cmhz2/and_not_a_single_post_about_high_fees_or_slow/
"https://www.reddit.com/r/btc/comments/7cothn/i_managed_to_get_a_post_about_btc_tx_fees_to_the/dprof7j/

Mods simply delete these kind of posts over there. :(

Fees are 15$ and transactions takes 2 days to clear, subredit should be on fire.";1;0;False;Rdzavi;dprw2qf;And not a single post about high fees or slow transactions on r/bitcoin. I guess not important enough to be discussed...;7cmhz2;https://www.reddit.com/r/btc/comments/7cmhz2/and_not_a_single_post_about_high_fees_or_slow/
"There's possibly some of those, but I know a lot of people who own old BTC who are happy to see 1000% gains and are hoping they just print free money by doing nothing at this point, and they are scared that it's going to go away.

It seems to me BTC grew in value because it had actual utility at one point, but now BTC seems to have completely changed paths.  Why would it continue to hold value at this point if it's nearly unusable?";1;1;False;bucket72;dpren2s;And not a single post about high fees or slow transactions on r/bitcoin. I guess not important enough to be discussed...;7cmhz2;https://www.reddit.com/r/btc/comments/7cmhz2/and_not_a_single_post_about_high_fees_or_slow/
"You'd have to go to the right reddit sub and ask the developers of the right coin. 
'
You do know that Bitcoin Cash is not the same as 'bcash', don't you? 

";1;0;False;7bitsOk;dprejdh;And not a single post about high fees or slow transactions on r/bitcoin. I guess not important enough to be discussed...;7cmhz2;https://www.reddit.com/r/btc/comments/7cmhz2/and_not_a_single_post_about_high_fees_or_slow/
"By using the **exact same infrastructure** and mining pools to secure a network of usable digital tokens.

It has everything bitcoin has except the network effect but it costs nothing to move.

If bitcoin scales, it will win. If it doesn't, it will be replaced.

Bitcoin doesn't get to continue to be the majority coin if it can't be used. That's not how reality works. Bitcoin Cash has an advantage over coins like litecoin because the majority of Bitcoin holders hold Cash as well, and every single miner can freely choose to migrate giving Bitcoin Cash the same security system already built for Bitcoin.

Imagine how much easier Facebook could steal MySpace's customers, if they just imported all the MySpace accounts into their system. That's the situation Bitcoin Cash is in.

If MySpace's servers (Bitcoin) don't work, merchants will move, people will move.";1;0;False;Not_Pictured;dprcyb9;And not a single post about high fees or slow transactions on r/bitcoin. I guess not important enough to be discussed...;7cmhz2;https://www.reddit.com/r/btc/comments/7cmhz2/and_not_a_single_post_about_high_fees_or_slow/
"Security layer for technologies like Counterparty and Omni that rely on Bitcoin's timestamping service feature to store references to independently maintained data.

That, and speculation.";2;1;False;chernobyl169;dpr8ya6;And not a single post about high fees or slow transactions on r/bitcoin. I guess not important enough to be discussed...;7cmhz2;https://www.reddit.com/r/btc/comments/7cmhz2/and_not_a_single_post_about_high_fees_or_slow/
"Well if you are buying into currency because it is a balloon that must pop sooner or later I wish you luck to get out while music still plays.

Crypto currency without utility is just a bubble as you said. No rules, no nothing, just investors hope for a greater fool down the line. ";1;1;False;Rdzavi;dprr02s;And not a single post about high fees or slow transactions on r/bitcoin. I guess not important enough to be discussed...;7cmhz2;https://www.reddit.com/r/btc/comments/7cmhz2/and_not_a_single_post_about_high_fees_or_slow/
"Lol, the point of BCH is the entire year of usability until the BTC scale properly, assuming that LN actually gets done instead of the ongoing ""It'll be done in 18 months"" we've been getting for the past few years.  ";2;0;False;apoliticalinactivist;dprm4pp;And not a single post about high fees or slow transactions on r/bitcoin. I guess not important enough to be discussed...;7cmhz2;https://www.reddit.com/r/btc/comments/7cmhz2/and_not_a_single_post_about_high_fees_or_slow/
In case you aren't trolling, my concern (after scaling) is that anything off chain is more easily subject to censorship.;4;2;False;DumberThanHeLooks;dprefwt;And not a single post about high fees or slow transactions on r/bitcoin. I guess not important enough to be discussed...;7cmhz2;https://www.reddit.com/r/btc/comments/7cmhz2/and_not_a_single_post_about_high_fees_or_slow/
"ICO scam? What are you talking about?

How will BTC ""scales properly""? Increase blocks to 2Mb or what?
I didn't get a memo for that one...";8;1;False;Rdzavi;dpr9b4k;And not a single post about high fees or slow transactions on r/bitcoin. I guess not important enough to be discussed...;7cmhz2;https://www.reddit.com/r/btc/comments/7cmhz2/and_not_a_single_post_about_high_fees_or_slow/
"> It's as if there's two distinct groups of users: one believes that fees are at record low and another that thinks fees are at a record high.

Maybe he's just using Bitcoin Cash.";2;0;False;Dunedune;dpr7cxy;And not a single post about high fees or slow transactions on r/bitcoin. I guess not important enough to be discussed...;7cmhz2;https://www.reddit.com/r/btc/comments/7cmhz2/and_not_a_single_post_about_high_fees_or_slow/
"1. send a transaction for 11 sat/B
2. accelerate it with your credit card
3. show everyone how fast BTC is
4. get paid for your great post by a well funded anonymous entity";6;0;False;keo604;dpr9lqb;And not a single post about high fees or slow transactions on r/bitcoin. I guess not important enough to be discussed...;7cmhz2;https://www.reddit.com/r/btc/comments/7cmhz2/and_not_a_single_post_about_high_fees_or_slow/
Next block conf is about at 900sat/byte right now. The delusion is strong.;12;1;False;TNoD;dpr18p8;And not a single post about high fees or slow transactions on r/bitcoin. I guess not important enough to be discussed...;7cmhz2;https://www.reddit.com/r/btc/comments/7cmhz2/and_not_a_single_post_about_high_fees_or_slow/
Exactly, all the rbitcoin talk of reaching $10,000 by end of 2017, it could've been that already if not for Cores bullshit developing. ;5;0;False;WonkDog;dpr6pps;And not a single post about high fees or slow transactions on r/bitcoin. I guess not important enough to be discussed...;7cmhz2;https://www.reddit.com/r/btc/comments/7cmhz2/and_not_a_single_post_about_high_fees_or_slow/
It's almost as if their business plan doesn't factor in new users and they are actually trying to cripple bitcoin.;11;1;False;shadowofashadow;dpr6oat;And not a single post about high fees or slow transactions on r/bitcoin. I guess not important enough to be discussed...;7cmhz2;https://www.reddit.com/r/btc/comments/7cmhz2/and_not_a_single_post_about_high_fees_or_slow/
"None of the core developers have had any foresight, Adam Back, Blockstream CEO, ignored bitcoin for years despite being mentioned in the white paper and being contacted by Satoshi before release of Bitcoin and only bought when it was at a 2013 high just beige the 2 year bear market. 

Greg Maxwell, Blockstream CTO, claimed he had proven that decentralisation was impossible in bitcoin and is now spouting decentralisation is the only way forward ignoring the fact Core is a centralised developer team. 

Samson Mow, Blockstream CSO, after releasing the Blockstream Satellite (useless) then posted a photo with the caption about some man being stranded in the Sahara and then using the satellite to buy some water with bitcoin from a local villager, forgetting the Sahara was literally the only place in the world the satellite didn't cover. 

These are just incompetent dickheads who have forced their way into power and have ruined the BTC chain. Now the real innovation is in BCH. ";30;1;False;WonkDog;dpr6nnx;And not a single post about high fees or slow transactions on r/bitcoin. I guess not important enough to be discussed...;7cmhz2;https://www.reddit.com/r/btc/comments/7cmhz2/and_not_a_single_post_about_high_fees_or_slow/
"The latest pile-on of hash-power was not triggered by the EDA: the price of BCH Quadrupled in the space of a few days.

This made it much more profitable to mine.
";1;0;False;phillipsjk;dprh4h9;And not a single post about high fees or slow transactions on r/bitcoin. I guess not important enough to be discussed...;7cmhz2;https://www.reddit.com/r/btc/comments/7cmhz2/and_not_a_single_post_about_high_fees_or_slow/
">Imo, BTC can't survive that long as no1 crypto with 5$+ fees. Also, what stops BCH to implement LN (and even segwit) if technology proves to be any good as it is advertised.

I'm not debating whether BTC or BCH is better or which one will win. They are both pretty shit at being a currency without LN or some other scaling solution. So I guess as it stands right now, the only reason that BTC/BCH have value is because of the brand recognition.

>But given the fact that they promised that ""Segwit will instantly double chain capacity"" and they didn't deliver anything near that 6 months from its activation makes you think why would you believe anything they say...

Isn't it because wallets haven't adopted Segwit yet? Segwit is up and running, but people are simply not using it yet. ";1;1;False;Chowdahhhh;dprvwnc;And not a single post about high fees or slow transactions on r/bitcoin. I guess not important enough to be discussed...;7cmhz2;https://www.reddit.com/r/btc/comments/7cmhz2/and_not_a_single_post_about_high_fees_or_slow/
"What do you mean ""BTC doesn't have to be immune to every conceivable attack"" ? o.O

How else bitcoin is going to become/remain good store of value?
Would you put money in something that is vulnerable to attacks?

About mempool - problem is that 'attack' lasts for a year now. It is not an attack, it is just that protocol is broken.";4;1;False;Rdzavi;dprak76;And not a single post about high fees or slow transactions on r/bitcoin. I guess not important enough to be discussed...;7cmhz2;https://www.reddit.com/r/btc/comments/7cmhz2/and_not_a_single_post_about_high_fees_or_slow/
"Your first argument is only relevant for the next 5 hours.

>the BCH network is struggling and people that want to transfer their Bitcoin Cash are waiting by 6 hours already

And your second argument is implying a 51% attack? That's a fucking joke.

>You also seems to ignore the importance of the hash rate related to the security of the transactions

If these are your best arguments, I think I'll stick with BCH.";2;1;False;leon_oswald;dpr5v5v;And not a single post about high fees or slow transactions on r/bitcoin. I guess not important enough to be discussed...;7cmhz2;https://www.reddit.com/r/btc/comments/7cmhz2/and_not_a_single_post_about_high_fees_or_slow/
"Well if they own old BTC, they own the equivalent amount of BCH, so I don't see what the problem is? BTCs value would migrate to BCH, and because BCH is usable as a currency, its value should go up higher than BTCs.

The only problem I see if they sold their BCH after the August 1st fork because they perceived it as free money and not as a free hedge. Well then they have no one else to blame but themselves I guess.";2;1;False;taipalag;dprh5kc;And not a single post about high fees or slow transactions on r/bitcoin. I guess not important enough to be discussed...;7cmhz2;https://www.reddit.com/r/btc/comments/7cmhz2/and_not_a_single_post_about_high_fees_or_slow/
Wow, a time-stamping service. How exciting.;0;1;False;analyst4933;dprd54g;And not a single post about high fees or slow transactions on r/bitcoin. I guess not important enough to be discussed...;7cmhz2;https://www.reddit.com/r/btc/comments/7cmhz2/and_not_a_single_post_about_high_fees_or_slow/
[deleted];1;1;False;;dprr526;And not a single post about high fees or slow transactions on r/bitcoin. I guess not important enough to be discussed...;7cmhz2;https://www.reddit.com/r/btc/comments/7cmhz2/and_not_a_single_post_about_high_fees_or_slow/
Im not trolling I have absolute faith that bitcoin devs will find a way to scale bitcoin. How can bitmaincash be the answer to censorship if its so easily manipulated by the crowd trying to shove it down peoples throats without proper consensus. If they really were the answer they wouldnt need that level manipulation. cheers for your rationality. ;1;0;False;saltyseasnek;dprg4kf;And not a single post about high fees or slow transactions on r/bitcoin. I guess not important enough to be discussed...;7cmhz2;https://www.reddit.com/r/btc/comments/7cmhz2/and_not_a_single_post_about_high_fees_or_slow/
Subject to censorship, how? (honest question);1;1;False;buyBitc0in;dprfxf9;And not a single post about high fees or slow transactions on r/bitcoin. I guess not important enough to be discussed...;7cmhz2;https://www.reddit.com/r/btc/comments/7cmhz2/and_not_a_single_post_about_high_fees_or_slow/
then you need to do your research.;-5;1;False;saltyseasnek;dpranhp;And not a single post about high fees or slow transactions on r/bitcoin. I guess not important enough to be discussed...;7cmhz2;https://www.reddit.com/r/btc/comments/7cmhz2/and_not_a_single_post_about_high_fees_or_slow/
"Sorry, but this is wrong:

Transactions > 260sat/byte seem to insta confirm right now

https://jochen-hoenicke.de/queue/#24h

Please, admittedly these fees are high, but spreading misinformation is no help for whichever side you are on.

*edit*: formating";6;1;False;huhn_m;dpr1hrh;And not a single post about high fees or slow transactions on r/bitcoin. I guess not important enough to be discussed...;7cmhz2;https://www.reddit.com/r/btc/comments/7cmhz2/and_not_a_single_post_about_high_fees_or_slow/
"""No new users until we're ready please! We just need another 18 months! Go use fiat or an altcoin!""";10;0;False;Meeseeks-Answers;dpr71vp;And not a single post about high fees or slow transactions on r/bitcoin. I guess not important enough to be discussed...;7cmhz2;https://www.reddit.com/r/btc/comments/7cmhz2/and_not_a_single_post_about_high_fees_or_slow/
"> to buy some water with bitcoin from a local villager

Surely not with Bitcoin.  That would be some expensive ass water.";5;2;False;cinnapear;dpr9m3q;And not a single post about high fees or slow transactions on r/bitcoin. I guess not important enough to be discussed...;7cmhz2;https://www.reddit.com/r/btc/comments/7cmhz2/and_not_a_single_post_about_high_fees_or_slow/
I am not chilling, I am just wondering how people can turn with the wind and then make stuff up to justify their actions. ;-1;1;False;Jlius3216;dpr9v2b;And not a single post about high fees or slow transactions on r/bitcoin. I guess not important enough to be discussed...;7cmhz2;https://www.reddit.com/r/btc/comments/7cmhz2/and_not_a_single_post_about_high_fees_or_slow/
"When you begin with a lie ""/r/btc"", how can you have honest discussion? ";-38;4;False;Jlius3216;dpr7rht;And not a single post about high fees or slow transactions on r/bitcoin. I guess not important enough to be discussed...;7cmhz2;https://www.reddit.com/r/btc/comments/7cmhz2/and_not_a_single_post_about_high_fees_or_slow/
"Proof that you don't understand what you're talking about.

Just because someone chose to pay $7 USD per KB (likely a typo), doesn't mean it's required. The proof is that there's only 4 transactions in the entire block you linked, and the total block size is 18.896 KB (0.24% of the maximum allowed). They could have paid a 0.70USD transaction fee per KB (you know, like the one in the exact same block you linked), and still had it confirmed.

So yea, fake news, try again.";3;1;False;madmockers;dpr7hmj;And not a single post about high fees or slow transactions on r/bitcoin. I guess not important enough to be discussed...;7cmhz2;https://www.reddit.com/r/btc/comments/7cmhz2/and_not_a_single_post_about_high_fees_or_slow/
"Well said. Too many people here self-importantly project their vision of what crypto ""should"" be used for. It's not for anyone to decide how others use their crypto.";3;0;False;powerfunk;dpr56ef;And not a single post about high fees or slow transactions on r/bitcoin. I guess not important enough to be discussed...;7cmhz2;https://www.reddit.com/r/btc/comments/7cmhz2/and_not_a_single_post_about_high_fees_or_slow/
">When the market (and the mass) will be ready to really use it as a ""coin"", it will adapt. Today is OK as it is.

What the fuck are you talking about? People did use Bitcoin as a coin for many years but since there is no scaling happening, the capacity didn't allow for it at some point. Do you know how many stores used to have Bitcoin but then removed it from their payment options because of fees and wait time? You have so little knowledge about Bitcoin that I really cannot take your opinions seriously.";1;1;False;Raineko;dpreh9s;And not a single post about high fees or slow transactions on r/bitcoin. I guess not important enough to be discussed...;7cmhz2;https://www.reddit.com/r/btc/comments/7cmhz2/and_not_a_single_post_about_high_fees_or_slow/
If the transaction queue of almost 200k isn't signalling that the market wants something, I donno what is;2;1;False;madmockers;dpr5n5c;And not a single post about high fees or slow transactions on r/bitcoin. I guess not important enough to be discussed...;7cmhz2;https://www.reddit.com/r/btc/comments/7cmhz2/and_not_a_single_post_about_high_fees_or_slow/
"The point is that blocks will be found every 10 min consistently on the BCH chain but with much greater capacity. As for BTC, nothing is being fixed and probably never will.

";1;1;False;knight222;dpr853n;And not a single post about high fees or slow transactions on r/bitcoin. I guess not important enough to be discussed...;7cmhz2;https://www.reddit.com/r/btc/comments/7cmhz2/and_not_a_single_post_about_high_fees_or_slow/
This is the biggest thing people like to point out, but what do you expect we can do about this? This is not a problem with BCH in itself. I'd love to hear your proposal for this.;1;1;False;-Seirei-;dpr3m1p;And not a single post about high fees or slow transactions on r/bitcoin. I guess not important enough to be discussed...;7cmhz2;https://www.reddit.com/r/btc/comments/7cmhz2/and_not_a_single_post_about_high_fees_or_slow/
Actually I didn't really deny that it is spammed. I'm looking at the mempool all the time but I can't see something suspicious there, what should I look out for? Also are you aware that less blocks than usual have been mined for Bitcion recently?;1;1;False;misfortunecat;dpraiig;And not a single post about high fees or slow transactions on r/bitcoin. I guess not important enough to be discussed...;7cmhz2;https://www.reddit.com/r/btc/comments/7cmhz2/and_not_a_single_post_about_high_fees_or_slow/
Occasionally, and never caused any issue. It's not that you need your Bitcoin to be transferred in 10 minutes or you'll die. People are used to use the banks, 2 hours for them is already something coming out from a Sci-Fi movie.;1;1;False;Giusis;dpr8pn0;And not a single post about high fees or slow transactions on r/bitcoin. I guess not important enough to be discussed...;7cmhz2;https://www.reddit.com/r/btc/comments/7cmhz2/and_not_a_single_post_about_high_fees_or_slow/
"The Bitcoin has a value today because it WILL be used to buy things, and the value continues to increase because it's a finished resource. Do you think the gold has a value because it can be ""used""?";0;1;False;Giusis;dprfl0m;And not a single post about high fees or slow transactions on r/bitcoin. I guess not important enough to be discussed...;7cmhz2;https://www.reddit.com/r/btc/comments/7cmhz2/and_not_a_single_post_about_high_fees_or_slow/
can't let blind people see again, miracles don't happen!;0;1;False;PotatoInMyVeins;dprc3k6;And not a single post about high fees or slow transactions on r/bitcoin. I guess not important enough to be discussed...;7cmhz2;https://www.reddit.com/r/btc/comments/7cmhz2/and_not_a_single_post_about_high_fees_or_slow/
"This is ridiculous. I know the name quite well as you can see from my other posts. I *shortened* it, maybe because I read it that way somewhere, I don't know. If you can not concentrate on the technical details and discuss those, than you should clearly try to get more mature before starting to join into these types of discussions. You are starting a fight over a shortened name that in itself bears no shaming or ill will towards the thing I discuss. Get over yourself.

I'm interested in technical discussion and the foundations of the coins, not some fancy name calling. 

This feels like kindergarten. ";0;1;False;huhn_m;dprngdf;And not a single post about high fees or slow transactions on r/bitcoin. I guess not important enough to be discussed...;7cmhz2;https://www.reddit.com/r/btc/comments/7cmhz2/and_not_a_single_post_about_high_fees_or_slow/
Does not sound like you are over it. Work on that. ;1;1;False;Jlius3216;dprheff;And not a single post about high fees or slow transactions on r/bitcoin. I guess not important enough to be discussed...;7cmhz2;https://www.reddit.com/r/btc/comments/7cmhz2/and_not_a_single_post_about_high_fees_or_slow/
And it certainly won't happen if transaction fees are 4 euros and wait times are 3 hours.;2;1;False;madmockers;dpra7xq;And not a single post about high fees or slow transactions on r/bitcoin. I guess not important enough to be discussed...;7cmhz2;https://www.reddit.com/r/btc/comments/7cmhz2/and_not_a_single_post_about_high_fees_or_slow/
All good if it's fine with you but it's not for a great chuck of people. BTC currently have 15 tps demand and only is processing 3. There is 12 tps being left in the dust making it a no go for these users. ;2;1;False;knight222;dpr9m0h;And not a single post about high fees or slow transactions on r/bitcoin. I guess not important enough to be discussed...;7cmhz2;https://www.reddit.com/r/btc/comments/7cmhz2/and_not_a_single_post_about_high_fees_or_slow/
"No, I'm not twisting words. Here's your original statement.

>[BTC] fees nor the slowness is an issue at the moment. On the other side the BCH network is struggling

You downplay fees and slowness of BTC which is a very real problem and go on to emphisize how the ""BCH network is struggling"".

You know that BTCs problems will persist and BCH will be fixing their shit in literally a couple hours. As for the 51% attack, considering you didn't take me up on my bet - I will assume that you don't think this is a real problem either. Nearly all your statements were completely disingenuous.";1;1;False;leon_oswald;dprai0s;And not a single post about high fees or slow transactions on r/bitcoin. I guess not important enough to be discussed...;7cmhz2;https://www.reddit.com/r/btc/comments/7cmhz2/and_not_a_single_post_about_high_fees_or_slow/
