body;score;nb_replies;stickied;author;id;post_title;post_id;post_link
"I think the bet really needs clarification with regards to possible other forks.

What for instance, if Core changes the difficulty or PoW just before or just after the SegWit2X fork?

Also, what does ""No HF No deal"" mean? Does a HF mean at least one block on the legacy chain?";1;0;False;tomtomtom7;dnpnxpq;I just bet 1,000 BTC (~$4M USD) that Segwit 2X coin will have more value than Segwit 1x coin.;73az4n;https://twitter.com/rogerkver/status/913870930815807488
Make sure you get an escrow from these snakes... ;1;0;False;Only1BallAnHalfaCocK;dnpkxch;I just bet 1,000 BTC (~$4M USD) that Segwit 2X coin will have more value than Segwit 1x coin.;73az4n;https://twitter.com/rogerkver/status/913870930815807488
"Maybe you could ask all the parties sign their BTC holdings and their receiving address in advance AND publish the message so that there will be no ""he didn't pay me"" propaganda?

And I wish you good luck!";1;0;False;torusJKL;dnpkqek;I just bet 1,000 BTC (~$4M USD) that Segwit 2X coin will have more value than Segwit 1x coin.;73az4n;https://twitter.com/rogerkver/status/913870930815807488
Wow. Taking candy from a baby. No odds? ;1;1;False;Pink-Fish;dnpki4h;I just bet 1,000 BTC (~$4M USD) that Segwit 2X coin will have more value than Segwit 1x coin.;73az4n;https://twitter.com/rogerkver/status/913870930815807488
Just make sure you use escrow. I wouldn't trust all those guys to deliver it they lose.;1;0;False;minorman;dnpj0p7;I just bet 1,000 BTC (~$4M USD) that Segwit 2X coin will have more value than Segwit 1x coin.;73az4n;https://twitter.com/rogerkver/status/913870930815807488
I'll help you Roger by selling all my segwit coins;1;0;False;Lloydie1;dnpgkux;I just bet 1,000 BTC (~$4M USD) that Segwit 2X coin will have more value than Segwit 1x coin.;73az4n;https://twitter.com/rogerkver/status/913870930815807488
"Can you please verify the method?  Here's my suggestion:

https://twitter.com/ecurrencyhodler/status/913898156470845441";1;0;False;ecurrencyhodler;dnpctwf;I just bet 1,000 BTC (~$4M USD) that Segwit 2X coin will have more value than Segwit 1x coin.;73az4n;https://twitter.com/rogerkver/status/913870930815807488
What kind of time frames are we talking about? One month since fork? One year? One day? ;3;0;False;danielzopola;dnpasky;I just bet 1,000 BTC (~$4M USD) that Segwit 2X coin will have more value than Segwit 1x coin.;73az4n;https://twitter.com/rogerkver/status/913870930815807488
"Well you have to decide a timeframe when both coin value will be measured.

Because i doubt market will stabilize before few weeks at least.";3;0;False;Ant-n;dnp3edv;I just bet 1,000 BTC (~$4M USD) that Segwit 2X coin will have more value than Segwit 1x coin.;73az4n;https://twitter.com/rogerkver/status/913870930815807488
"Seems like a very nice bet for you.

If you want it would be nice to get public confirmations (transactions, signed messages) of the trades.";3;0;False;jonas_h;dnp0lxu;I just bet 1,000 BTC (~$4M USD) that Segwit 2X coin will have more value than Segwit 1x coin.;73az4n;https://twitter.com/rogerkver/status/913870930815807488
What will segwit 2x mean for LTC? I know BTC with segwit has some proposed atomic swaps with LTC but I assume 2x does not. Would this potentially take down BTC and LTC?;2;0;False;digiorno;dnphjii;I just bet 1,000 BTC (~$4M USD) that Segwit 2X coin will have more value than Segwit 1x coin.;73az4n;https://twitter.com/rogerkver/status/913870930815807488
Will there be a smart contract for this?;2;0;False;DrunkenMantis27;dnpc49o;I just bet 1,000 BTC (~$4M USD) that Segwit 2X coin will have more value than Segwit 1x coin.;73az4n;https://twitter.com/rogerkver/status/913870930815807488
"if you lose the bet, you don't lose 1000 BTC but just the difference of BTC vs. B2X valuations. Hence your post title is ""inaccurate"", to say the least.

Not that we expect any different from you, though.

In fact it is not even a ""bet"" but more of a contract - a contract to exchange 1000 BTC for 1000 B2X.

Anyway, thanks for clarifying, once again, that you are standing on the side of the industry cartel and not on the side of the users who want a sustainably decentralized robust Bitcoin.";4;1;False;Amichateur;dnpo997;I just bet 1,000 BTC (~$4M USD) that Segwit 2X coin will have more value than Segwit 1x coin.;73az4n;https://twitter.com/rogerkver/status/913870930815807488
"Thanks for standing up to these guys. The posts over on r/bitcoin we’re talking about how no one has the balls to put their money where their mouth is. 
I look forward to celebrating with you from afar in November. ";4;0;False;Ludachris9000;dnpavsq;I just bet 1,000 BTC (~$4M USD) that Segwit 2X coin will have more value than Segwit 1x coin.;73az4n;https://twitter.com/rogerkver/status/913870930815807488
Do you not worry that the outcome is already determined and they know it?  If they have a large player in their corner committed to pumping 1x (*cough* Russia *cough*) then you are just walking into a rigged game.;2;0;False;Dabauhs;dnp5yjp;I just bet 1,000 BTC (~$4M USD) that Segwit 2X coin will have more value than Segwit 1x coin.;73az4n;https://twitter.com/rogerkver/status/913870930815807488
"It's not about money. It's about freedom, anti-censorship and anti-centralization. Segwit1x is closer to old banking than Satoshi's whitepaper espousing economic freedom from central authorities.

Roger is right to bet that people want economic freedom. It's common sense. Plus all of those other guys are idiots.";12;2;False;Annapurna317;dnozqab;I just bet 1,000 BTC (~$4M USD) that Segwit 2X coin will have more value than Segwit 1x coin.;73az4n;https://twitter.com/rogerkver/status/913870930815807488
Full respect /u/MemoryDealers are u open to expanding on this? I would like to add to the 1x side. I can try to organise with Charlie or one of the other 1x guys to be my escrow?;5;1;False;adz0007;dnp2cld;I just bet 1,000 BTC (~$4M USD) that Segwit 2X coin will have more value than Segwit 1x coin.;73az4n;https://twitter.com/rogerkver/status/913870930815807488
Take 'em down, Roger;7;0;False;SpiderImAlright;dnp5h0u;I just bet 1,000 BTC (~$4M USD) that Segwit 2X coin will have more value than Segwit 1x coin.;73az4n;https://twitter.com/rogerkver/status/913870930815807488
How long after the fork is the price referenced? Also, this sounds like the perfect case for smart contracts. ;3;0;False;;dnpbm1q;I just bet 1,000 BTC (~$4M USD) that Segwit 2X coin will have more value than Segwit 1x coin.;73az4n;https://twitter.com/rogerkver/status/913870930815807488
"Many talk but few will actually step into the ring. 

They need someone to call them out on their false bravado - how many loudmouths said they'd sell all any fork in order to tank the price?

";5;0;False;marcoski711;dnp4t45;I just bet 1,000 BTC (~$4M USD) that Segwit 2X coin will have more value than Segwit 1x coin.;73az4n;https://twitter.com/rogerkver/status/913870930815807488
NO2X CORPORATE TAKEOVER OF BITCOIN!! ANOTHER ATTACK ON THE HONEYBADGER!! ;1;0;False;rogerrabbit676;dnq0c67;I just bet 1,000 BTC (~$4M USD) that Segwit 2X coin will have more value than Segwit 1x coin.;73az4n;https://twitter.com/rogerkver/status/913870930815807488
Well if there's a split I'll simply hold both this time. ;1;0;False;New_Dawn;dnplcbj;I just bet 1,000 BTC (~$4M USD) that Segwit 2X coin will have more value than Segwit 1x coin.;73az4n;https://twitter.com/rogerkver/status/913870930815807488
Guys....important question.  Is this a bet it a swap?  Can we get this posted online somewhere the details?;1;0;False;Pink-Fish;dnpksoe;I just bet 1,000 BTC (~$4M USD) that Segwit 2X coin will have more value than Segwit 1x coin.;73az4n;https://twitter.com/rogerkver/status/913870930815807488
More value when? Immediately after the split? A month later?;3;0;False;kaczan3;dnpqfqy;I just bet 1,000 BTC (~$4M USD) that Segwit 2X coin will have more value than Segwit 1x coin.;73az4n;https://twitter.com/rogerkver/status/913870930815807488
Careful if you lose Roger, these people already don't want to pay for SegWit.;3;0;False;daftspunky;dnpcj7m;I just bet 1,000 BTC (~$4M USD) that Segwit 2X coin will have more value than Segwit 1x coin.;73az4n;https://twitter.com/rogerkver/status/913870930815807488
Wait are they actually being millions of dollars or is this a joke? Wow;5;0;False;;dnpekcz;I just bet 1,000 BTC (~$4M USD) that Segwit 2X coin will have more value than Segwit 1x coin.;73az4n;https://twitter.com/rogerkver/status/913870930815807488
"That's technically not a bet, it's a trade. 

Anyhow those guys are going to lose 1 million each.";17;2;False;backforwardlow;dnp1bcr;I just bet 1,000 BTC (~$4M USD) that Segwit 2X coin will have more value than Segwit 1x coin.;73az4n;https://twitter.com/rogerkver/status/913870930815807488
Charlie Lee is going to remove his tweets anyway!;11;0;False;thomask02;dnp4rio;I just bet 1,000 BTC (~$4M USD) that Segwit 2X coin will have more value than Segwit 1x coin.;73az4n;https://twitter.com/rogerkver/status/913870930815807488
Lol. You are going to regret that bet. Don't be stupid.;4;0;False;Luisbaldera;dnpqs09;I just bet 1,000 BTC (~$4M USD) that Segwit 2X coin will have more value than Segwit 1x coin.;73az4n;https://twitter.com/rogerkver/status/913870930815807488
Wow u lost 4 mil buddy.;4;0;False;christoff123;dnpqmyn;I just bet 1,000 BTC (~$4M USD) that Segwit 2X coin will have more value than Segwit 1x coin.;73az4n;https://twitter.com/rogerkver/status/913870930815807488
"Inb4 Charlie Lee was ""joking""";3;0;False;garoththorp;dnpj5r6;I just bet 1,000 BTC (~$4M USD) that Segwit 2X coin will have more value than Segwit 1x coin.;73az4n;https://twitter.com/rogerkver/status/913870930815807488
"That is such a good bet.

It wouldn't have even been fair if you gave them 10-1.

I wonder home many 1xer's will dump their 2x coins, like Erik had the conviction to do with Bitcoin Cash.";5;0;False;Leithm;dnp3xne;I just bet 1,000 BTC (~$4M USD) that Segwit 2X coin will have more value than Segwit 1x coin.;73az4n;https://twitter.com/rogerkver/status/913870930815807488
I tried to make a similar bet (at much lower stakes) with /u/smartfbrankings, but he and /u/bruce_fenton ghosted me after this post: https://www.reddit.com/r/Bitcoin/comments/6vansd/a_refusal_to_implement_replay_protection_on_the/dm0lvy7/?context=3;4;1;False;gotamd;dnp3w25;I just bet 1,000 BTC (~$4M USD) that Segwit 2X coin will have more value than Segwit 1x coin.;73az4n;https://twitter.com/rogerkver/status/913870930815807488
"All we can see on Twitter is that you agreed to to swap your BTC for Charlies's 2X coins after the HF in Nov.  
Nothing about any bet on value.
";24;3;False;kretchino;dnoywar;I just bet 1,000 BTC (~$4M USD) that Segwit 2X coin will have more value than Segwit 1x coin.;73az4n;https://twitter.com/rogerkver/status/913870930815807488
You're a friend of individual liberty, thanks for fighting the good fight!;11;0;False;StoicParty;dnp2gc6;I just bet 1,000 BTC (~$4M USD) that Segwit 2X coin will have more value than Segwit 1x coin.;73az4n;https://twitter.com/rogerkver/status/913870930815807488
What I love about Roger - he puts his money where his mouth is.  Unlike North Corea...;4;1;False;SpacePirateM;dnpnr3m;I just bet 1,000 BTC (~$4M USD) that Segwit 2X coin will have more value than Segwit 1x coin.;73az4n;https://twitter.com/rogerkver/status/913870930815807488
"Is there a way to do the same bet for us smaller guys? I am thinking of betting around a thousandth of what you bet, and I think there's a lot more of us willing to bet in that range.
";5;2;False;awemany;dnpeiax;I just bet 1,000 BTC (~$4M USD) that Segwit 2X coin will have more value than Segwit 1x coin.;73az4n;https://twitter.com/rogerkver/status/913870930815807488
I am a small player and I want to do this too (I have BTC now and want to trade my S1X for S2X coins)!  I want S2X coins!  Is it possible for someone to write a smart contract to do this for us?  To act as escrow?;4;0;False;chiwalfrm;dnpaeon;I just bet 1,000 BTC (~$4M USD) that Segwit 2X coin will have more value than Segwit 1x coin.;73az4n;https://twitter.com/rogerkver/status/913870930815807488
I going to make sure that you /u/MemoryDealers win that bet! I'm not going to hold Segwit 1x coin.;10;1;False;eatmybitcorn;dnp5rbs;I just bet 1,000 BTC (~$4M USD) that Segwit 2X coin will have more value than Segwit 1x coin.;73az4n;https://twitter.com/rogerkver/status/913870930815807488
Holy cow, now we're talking, money squarely in mouth. Bet Charlie's gettin' nervous.;9;2;False;Anen-o-me;dnp2hu1;I just bet 1,000 BTC (~$4M USD) that Segwit 2X coin will have more value than Segwit 1x coin.;73az4n;https://twitter.com/rogerkver/status/913870930815807488
this gon be gud;7;0;False;Tajaba;dnpb061;I just bet 1,000 BTC (~$4M USD) that Segwit 2X coin will have more value than Segwit 1x coin.;73az4n;https://twitter.com/rogerkver/status/913870930815807488
"What I find interesting is Roger's promoting of ""Bitcoin"" Cash has actually undermined the support of Segwit2x.

If we have 3 coins, Bitcoin Cash is the natural competitor to Segwit2x. If Segwit2x beats Core, Bitcoin Cash will also lose.";16;2;False;polsymtas;dnphbpq;I just bet 1,000 BTC (~$4M USD) that Segwit 2X coin will have more value than Segwit 1x coin.;73az4n;https://twitter.com/rogerkver/status/913870930815807488
"Way to make some easy cash.

How long do the participants wait before determining the winner?";8;1;False;BitcoinIsTehFuture;dnp5g3s;I just bet 1,000 BTC (~$4M USD) that Segwit 2X coin will have more value than Segwit 1x coin.;73az4n;https://twitter.com/rogerkver/status/913870930815807488
"Daily reminder that the only sane thing to do is hold BTC, BCH, and Segwit 2x.  Don't sell your free hedge.

No one can predict the future. Not Roger Ver, the retards at /r/bitcoin, the retards here, me, or you. ";23;2;False;;dnp42kn;I just bet 1,000 BTC (~$4M USD) that Segwit 2X coin will have more value than Segwit 1x coin.;73az4n;https://twitter.com/rogerkver/status/913870930815807488
"Tragedy of the Commons.
Act 1";4;0;False;stupid_seb;dnp33oj;I just bet 1,000 BTC (~$4M USD) that Segwit 2X coin will have more value than Segwit 1x coin.;73az4n;https://twitter.com/rogerkver/status/913870930815807488
How does he pay 1x coins if that chain just dies due to no miners???;1;0;False;livecatbounce;dnpl4vc;I just bet 1,000 BTC (~$4M USD) that Segwit 2X coin will have more value than Segwit 1x coin.;73az4n;https://twitter.com/rogerkver/status/913870930815807488
"What happens if the 1MB fork turns out to be Mircea Popescu's ""The Real Bitcoin"", which does not support segwit?

IMO, his camp has more to lose in a 2x fork.";2;1;False;phillipsjk;dnp55pk;I just bet 1,000 BTC (~$4M USD) that Segwit 2X coin will have more value than Segwit 1x coin.;73az4n;https://twitter.com/rogerkver/status/913870930815807488
[deleted];2;1;False;;dnp6bg1;I just bet 1,000 BTC (~$4M USD) that Segwit 2X coin will have more value than Segwit 1x coin.;73az4n;https://twitter.com/rogerkver/status/913870930815807488
[deleted];1;2;False;;dnp9plt;I just bet 1,000 BTC (~$4M USD) that Segwit 2X coin will have more value than Segwit 1x coin.;73az4n;https://twitter.com/rogerkver/status/913870930815807488
Shouldn't it be the other way around, he gives you SegWit2x coins if they are worth more?;1;0;False;curyous;dnp6b4z;I just bet 1,000 BTC (~$4M USD) that Segwit 2X coin will have more value than Segwit 1x coin.;73az4n;https://twitter.com/rogerkver/status/913870930815807488
another proof that you have serious mental disease problems;2;1;False;chek2fire;dnpb5nd;I just bet 1,000 BTC (~$4M USD) that Segwit 2X coin will have more value than Segwit 1x coin.;73az4n;https://twitter.com/rogerkver/status/913870930815807488
Holy sheeet! I'd tip you, but you already have enough money!;1;0;False;markasoftware;dnpen3u;I just bet 1,000 BTC (~$4M USD) that Segwit 2X coin will have more value than Segwit 1x coin.;73az4n;https://twitter.com/rogerkver/status/913870930815807488
AHAHA take them to the cleaners! I would have taken that bet too ;1;0;False;2dsxc;dnp5tql;I just bet 1,000 BTC (~$4M USD) that Segwit 2X coin will have more value than Segwit 1x coin.;73az4n;https://twitter.com/rogerkver/status/913870930815807488
"You should program that into a smart contract on the BCH chain

Oh wait you can’t ";2;1;False;priuspilot;dnpowuf;I just bet 1,000 BTC (~$4M USD) that Segwit 2X coin will have more value than Segwit 1x coin.;73az4n;https://twitter.com/rogerkver/status/913870930815807488
What happens if 1x coin has not enough hashrate and Core hardforks to alter PoW/difficulty? Only Original 1x (non PoW hardwork) coins required as payment?;2;0;False;PM_bitcoins;dnpk3dg;I just bet 1,000 BTC (~$4M USD) that Segwit 2X coin will have more value than Segwit 1x coin.;73az4n;https://twitter.com/rogerkver/status/913870930815807488
Good;2;0;False;tradecoininjp;dnp69bh;I just bet 1,000 BTC (~$4M USD) that Segwit 2X coin will have more value than Segwit 1x coin.;73az4n;https://twitter.com/rogerkver/status/913870930815807488
Good for you.;2;0;False;;dnp43q0;I just bet 1,000 BTC (~$4M USD) that Segwit 2X coin will have more value than Segwit 1x coin.;73az4n;https://twitter.com/rogerkver/status/913870930815807488
"I have seen multiple times that those BCore followers break promise/contract. They have no/little skin in Bitcoin.

Anyway, you only waste some time by replying those trolls.";4;0;False;webitcoiners;dnp9d6q;I just bet 1,000 BTC (~$4M USD) that Segwit 2X coin will have more value than Segwit 1x coin.;73az4n;https://twitter.com/rogerkver/status/913870930815807488
Awesome! Thank your for your kind contribution to Core developers funding.;3;1;False;ebliever;dnpg1pv;I just bet 1,000 BTC (~$4M USD) that Segwit 2X coin will have more value than Segwit 1x coin.;73az4n;https://twitter.com/rogerkver/status/913870930815807488
Other free coins I am going to dump right away..;3;0;False;ilpirata79;dnp8sca;I just bet 1,000 BTC (~$4M USD) that Segwit 2X coin will have more value than Segwit 1x coin.;73az4n;https://twitter.com/rogerkver/status/913870930815807488
Careful. Lee will back out like the lying scammer he is.;5;2;False;bitcoincashuser;dnp3q4f;I just bet 1,000 BTC (~$4M USD) that Segwit 2X coin will have more value than Segwit 1x coin.;73az4n;https://twitter.com/rogerkver/status/913870930815807488
I need to figure out a way to accumulate 1,000 bitcoin.;4;0;False;;dnpdnhj;I just bet 1,000 BTC (~$4M USD) that Segwit 2X coin will have more value than Segwit 1x coin.;73az4n;https://twitter.com/rogerkver/status/913870930815807488
You're crazy , in a good way but still crazy. Do you just love gambling or are that bullish? ;3;1;False;;dnp3y6g;I just bet 1,000 BTC (~$4M USD) that Segwit 2X coin will have more value than Segwit 1x coin.;73az4n;https://twitter.com/rogerkver/status/913870930815807488
"Two thoughts on this.

First, how is this set up technically? How do you avoid the scenario where one party sends first, then the other reneges? Is there a way to do it as an atomic swap or trade of some kind?

Second, how would other people get in on this kind of trade? I certainly don't have 1000 BTC lying around, but I do have a goodly amount I'd consider risking. Is this being set up as an open pool, or a private deal between ""name-brand"" players?";4;0;False;ClassicClassicist;dnp2t5b;I just bet 1,000 BTC (~$4M USD) that Segwit 2X coin will have more value than Segwit 1x coin.;73az4n;https://twitter.com/rogerkver/status/913870930815807488
What are the specific terms? For example, how will the value of 2x coin be determined - and when?;3;2;False;BobAlison;dnp2fx6;I just bet 1,000 BTC (~$4M USD) that Segwit 2X coin will have more value than Segwit 1x coin.;73az4n;https://twitter.com/rogerkver/status/913870930815807488
Prediction: at least one of those 4 will back out of the bet and not pay! Roger you should really get some kind of notary / 3rd party involved to hold the funds and distribute them to the winner;2;0;False;saddit42;dnpn86g;I just bet 1,000 BTC (~$4M USD) that Segwit 2X coin will have more value than Segwit 1x coin.;73az4n;https://twitter.com/rogerkver/status/913870930815807488
Have the community have a look at the conditions before agreeing. It would be very easy to sneak in some really bad terms.;2;0;False;dskloet;dnpirl0;I just bet 1,000 BTC (~$4M USD) that Segwit 2X coin will have more value than Segwit 1x coin.;73az4n;https://twitter.com/rogerkver/status/913870930815807488
Isnt sw2x coded to be 80% hashpower? And nobody pays if there is no fork? If that is the case... Seems like a good bet.;2;1;False;thoughtcourier;dnpifyg;I just bet 1,000 BTC (~$4M USD) that Segwit 2X coin will have more value than Segwit 1x coin.;73az4n;https://twitter.com/rogerkver/status/913870930815807488
How about small blockers merge 2X in a few weeks if they feel they'll lose the bet? Maybe that's why they took the bet (no risk).;2;1;False;bitdoggy;dnpesdj;I just bet 1,000 BTC (~$4M USD) that Segwit 2X coin will have more value than Segwit 1x coin.;73az4n;https://twitter.com/rogerkver/status/913870930815807488
What's the time line? Is it the day of the split or a certain amount of time later for the market to settle? ;2;1;False;PhyllisWheatenhousen;dnp6779;I just bet 1,000 BTC (~$4M USD) that Segwit 2X coin will have more value than Segwit 1x coin.;73az4n;https://twitter.com/rogerkver/status/913870930815807488
You are going to lose a lot of digital equity on this bet!  ;2;1;False;alwaysfallingoffrox;dnp3qol;I just bet 1,000 BTC (~$4M USD) that Segwit 2X coin will have more value than Segwit 1x coin.;73az4n;https://twitter.com/rogerkver/status/913870930815807488
RemindMe! 2 months;1;0;False;priuspilot;dnpow30;I just bet 1,000 BTC (~$4M USD) that Segwit 2X coin will have more value than Segwit 1x coin.;73az4n;https://twitter.com/rogerkver/status/913870930815807488
He was in the game quite early.;2;0;False;HolyBits;dnpj36b;I just bet 1,000 BTC (~$4M USD) that Segwit 2X coin will have more value than Segwit 1x coin.;73az4n;https://twitter.com/rogerkver/status/913870930815807488
Any way to ensure they pay up, or just going to be their word? Because if they end up losing (they will), I don't put it past them to renege.;22;3;False;lechango;dnp0ahq;I just bet 1,000 BTC (~$4M USD) that Segwit 2X coin will have more value than Segwit 1x coin.;73az4n;https://twitter.com/rogerkver/status/913870930815807488
"Lol, the ""general public"" doesn't even know what Bitcoin is, much less care about some little feud about it. I'd bet most people who hold Bitcoin don't even know about these hard-forks. They just look at the price and move on with their day.

These forks really don't effect anything. Nothing can stop progress. If BTC is strangled, people will move on to the next crypto making progress.";2;1;False;garbonzo607;dnpr8qf;I just bet 1,000 BTC (~$4M USD) that Segwit 2X coin will have more value than Segwit 1x coin.;73az4n;https://twitter.com/rogerkver/status/913870930815807488
It beats blowing it all in a day in a casino;1;0;False;D4rkr4in;dnpi2wq;I just bet 1,000 BTC (~$4M USD) that Segwit 2X coin will have more value than Segwit 1x coin.;73az4n;https://twitter.com/rogerkver/status/913870930815807488
I also share your future vision of only large banks being able to sell access to an astronomically large hosted big block blockchain. In fact, 2x is way to conservative, lets free everybody, 20000000000000000000000000000000x block weight, to the moon!;-4;1;False;basheron;dnp30wy;I just bet 1,000 BTC (~$4M USD) that Segwit 2X coin will have more value than Segwit 1x coin.;73az4n;https://twitter.com/rogerkver/status/913870930815807488
Jesus, you're totally brainwashed, aren't you?;-11;2;False;BTCrob;dnp1av5;I just bet 1,000 BTC (~$4M USD) that Segwit 2X coin will have more value than Segwit 1x coin.;73az4n;https://twitter.com/rogerkver/status/913870930815807488
[deleted];10;2;False;;dnp5ubj;I just bet 1,000 BTC (~$4M USD) that Segwit 2X coin will have more value than Segwit 1x coin.;73az4n;https://twitter.com/rogerkver/status/913870930815807488
"Peter Todd had the following to say on the SegWit2x mailing list today. Interpret it as you will:  

*""You can probably guess that many talented developers will fight against this attack.""* - Peter Todd, 30 September 2017.";3;1;False;paleh0rse;dnphuay;I just bet 1,000 BTC (~$4M USD) that Segwit 2X coin will have more value than Segwit 1x coin.;73az4n;https://twitter.com/rogerkver/status/913870930815807488
Don't underestimate the power of spv wallets. They'll automatically follow the majority hash rate;1;1;False;saddit42;dnpn7hi;I just bet 1,000 BTC (~$4M USD) that Segwit 2X coin will have more value than Segwit 1x coin.;73az4n;https://twitter.com/rogerkver/status/913870930815807488
Should one be worried about holding bitcoins in a Trezor at the time of the fork?;1;0;False;mdprutj;dnpk08n;I just bet 1,000 BTC (~$4M USD) that Segwit 2X coin will have more value than Segwit 1x coin.;73az4n;https://twitter.com/rogerkver/status/913870930815807488
That's not brave. That's a smart bet.;7;1;False;MobTwo;dnp0z2j;I just bet 1,000 BTC (~$4M USD) that Segwit 2X coin will have more value than Segwit 1x coin.;73az4n;https://twitter.com/rogerkver/status/913870930815807488
[deleted];3;2;False;;dnp2dn8;I just bet 1,000 BTC (~$4M USD) that Segwit 2X coin will have more value than Segwit 1x coin.;73az4n;https://twitter.com/rogerkver/status/913870930815807488
I think the BTC ticker will be with Segwit 2X per the NYA.;72;5;False;MemoryDealers;dnp036x;I just bet 1,000 BTC (~$4M USD) that Segwit 2X coin will have more value than Segwit 1x coin.;73az4n;https://twitter.com/rogerkver/status/913870930815807488
RemindMe! 1 month, how is Charlie Lee trying to weasel out of the bet with Roger. ;22;2;False;;dnp2nte;I just bet 1,000 BTC (~$4M USD) that Segwit 2X coin will have more value than Segwit 1x coin.;73az4n;https://twitter.com/rogerkver/status/913870930815807488
