body;score;nb_replies;stickied;author;id;post_title;post_id;post_link
"Same here. It would be great if there would be a sufficiently neutral party to bet with or trade futures. I actually tried submitting a bet (with a different focus but IMO extremely closely correlated outcome: s2x will be majority HP) on bitbet.us, but it didn't get approved yet and that site seems to be kind of abandoned.

I am finally tired of all this shit and willing to put the money where my mouth is. If S2X fails, crypto is dead for me anyways. And I don't think it will fail. This is going to be the make-or-break battle of Bitcoin.";7;1;False;awemany;dnpihjr;I just bet 1,000 BTC (~$4M USD) that Segwit 2X coin will have more value than Segwit 1x coin.;73az4n;https://twitter.com/rogerkver/status/913870930815807488
[deleted];1;1;False;;dnpk02h;I just bet 1,000 BTC (~$4M USD) that Segwit 2X coin will have more value than Segwit 1x coin.;73az4n;https://twitter.com/rogerkver/status/913870930815807488
"> You are referring to the most diverse group of developers building a cryptocurrency project in the world and which has been forked thousands of times. That's the opposite of centralization, and like it or not but your pet projects born of technical ignorance are part of that decentralization.

Rather: A self-selected circle of folks, dominated by a single, for-profit, *fiat*-funded company, who go with all kinds of underhanded tactics to - as it looks - destroy Bitcoin, with the help of an army of *useful idiots* ... 

I have not seen a faster ""evaporative cooling of belief systems"" than in the Core team.

Gavin, Jeff, Mike. You might have heard about them.

> You want the bitcoin brand to get rich as you freely admit. There's nothing wrong with getting rich, i can respect that. The issue is bitcoin brand has up to this point been used to evangelize the previously nonexistent network property of decentralization and anti censorship. I expect to continue using it to that end, fuck your profit. I'm not interested in helping you exploit people by lending you our name so you can seem to be more decentralized than you are.

You will be in for a rude awakening. That's all I can say here.";3;1;False;awemany;dnphkp9;I just bet 1,000 BTC (~$4M USD) that Segwit 2X coin will have more value than Segwit 1x coin.;73az4n;https://twitter.com/rogerkver/status/913870930815807488
Yes, the address your coins are at will be valid on both chains. Just have to be careful when you move the coins.;3;0;False;gebregl;dnp5wtm;I just bet 1,000 BTC (~$4M USD) that Segwit 2X coin will have more value than Segwit 1x coin.;73az4n;https://twitter.com/rogerkver/status/913870930815807488
Yes, hence me pointing it out. ViaBTC needed 2 confirms before withdrawing bch, HitBTC and a few others 10-20.;1;1;False;Inthewirelain;dnpnjjb;I just bet 1,000 BTC (~$4M USD) that Segwit 2X coin will have more value than Segwit 1x coin.;73az4n;https://twitter.com/rogerkver/status/913870930815807488
"""Jeff serves on the board of Coin Center, and the advisory board of BitFury, BitPay, Chain.com, Netki and WayPaver Labs. Jeff has delivered presentations on bitcoin and blockchain at TEDx, State of Digital Money, many bitcoin conferences, as well as private briefings to corporations, governments, central banks, and hedge funds""

Yep, this sounds pretty much decentralized, coming from the guy involved in Bitcoin Businesses. Not to mention the ""private briefings"" 

";1;0;False;Ce_ne;dnpipq0;I just bet 1,000 BTC (~$4M USD) that Segwit 2X coin will have more value than Segwit 1x coin.;73az4n;https://twitter.com/rogerkver/status/913870930815807488
"And if a PoW HF doesn't happen and there's just the 2x HF and the segwit no HF chain, which is the one changing again? Clearly 2x. I.E. bitcoin and a bitcoin fork.

If bitcoin PoW changes you have at least a stronger argument about the brand as it's fork vs fork.";1;1;False;MrRGnome;dnpisuo;I just bet 1,000 BTC (~$4M USD) that Segwit 2X coin will have more value than Segwit 1x coin.;73az4n;https://twitter.com/rogerkver/status/913870930815807488
"> How can you take over the name of something you've been using in the same way for half a decade? That's incoherent.

Exactly. Bitcoin will upgrade and keep its name. But Core will also try to pass their POW-forked shitcoin as Bitcoin. As you say, *that is incoherent* and I hope we agree that this is not how *decentralization* works :)

> I absolutely don't think smart money is entering 2x. I think 2x will have value potential if it succeeds as a business and is a gamble like any similar investment, and I think no matter what the decentralized network will have value.

Well then, I am willing to trade and give you some of my future shitcoins. Just looking for some sufficiently trustworthy platform to do so. ";2;1;False;awemany;dnpirg3;I just bet 1,000 BTC (~$4M USD) that Segwit 2X coin will have more value than Segwit 1x coin.;73az4n;https://twitter.com/rogerkver/status/913870930815807488
"How can you take over the name of something you've been using in the same way for half a decade? That's incoherent.

I absolutely don't think smart money is entering 2x. I think 2x will have value potential if it succeeds as a business and is a gamble like any similar investment, and I think no matter what the decentralized network will have value.

The 2x value proposition revolves around gaining users. If it does it will have value. If it doesn't it won't. Bitcoin will have value and use cases regardless.";1;1;False;MrRGnome;dnpiofv;I just bet 1,000 BTC (~$4M USD) that Segwit 2X coin will have more value than Segwit 1x coin.;73az4n;https://twitter.com/rogerkver/status/913870930815807488
"> You're so adversarial, as though me having bitcoin is stealing your profit from your fork.

Because you and the *nice folks* that align with you are trying to take over the name Bitcoin, by trying to rewrite history and essentially destroying the whole concept of decentralized cryptocurrency and this is, yes, *very much against my financial interest.*

But it is certainly nice to see that you see and admit where the smart money is going as well. And that money will gladly squash the attempt of you guys to take over the Bitcoin brand.";2;1;False;awemany;dnpin9a;I just bet 1,000 BTC (~$4M USD) that Segwit 2X coin will have more value than Segwit 1x coin.;73az4n;https://twitter.com/rogerkver/status/913870930815807488
">SegWit. Enough said.

I don't even know what you are trying to say with this that evaluates to a world where time talking in public meetings equates to dictatorial centralization.

>You can't be helped. Let's get over with this, lets make a futures market on Core shitcoins vs. Bitcoins and let the money speak.
>I am tired of all this shit.

I've already said there is value in the paypals of this world, I don't know why you've contrived this as an all or nothing value proposition in your mind. You're so adversarial, as though me having bitcoin is stealing your profit from your fork. Why can't you do your stupid shit happily while I point how misguided it is and stay with what I've got and both networks attempt to do different things? Fork me every week baby, I want that free money.";1;1;False;MrRGnome;dnpiiro;I just bet 1,000 BTC (~$4M USD) that Segwit 2X coin will have more value than Segwit 1x coin.;73az4n;https://twitter.com/rogerkver/status/913870930815807488
"> You have shown me no evidence of anything. All you've done is linked to a reddit thread asserting blockstream devs talk a lot in dev meetings.

Sigh. If you would have read the linked document, you would have seen that this is not an assertion but simply data compiled (that *you* can check as well) from public Bitcoin dev meeting info.

It is actually evidence. Stop making excuses.
 
>  In what world is that evidence to support any of your assertions, especially when faced with the contradicting evidence of actual development statistics?

SegWit. Enough said.

> I think you're lying to yourself as much as you are anyone else here. You've bought a lie and now you are stuck with it as a bias, your mental defenses formed around it as a protective wall shunning any evidence refuting your beliefs.

LOL. Yeah, certainly, you must be right here, smart guy you are /s


> Did you know that studies suggest the majority of people when presented with 3 independent sources of evidence refuting a previously held belief will still believe the misinformation? It's human nature to ignore the repo stats proving your assertions wrong. I don't blame you, but I'm not going to stop calling you out on it.

You can't be helped. Let's get over with this, lets make a futures market on Core shitcoins vs. Bitcoins and let the money speak.


I am tired of all this shit.";2;1;False;awemany;dnpif0v;I just bet 1,000 BTC (~$4M USD) that Segwit 2X coin will have more value than Segwit 1x coin.;73az4n;https://twitter.com/rogerkver/status/913870930815807488
"You have shown me no evidence of anything. All you've done is linked to a reddit thread asserting blockstream devs talk a lot in dev meetings. In what world is that evidence to support any of your assertions, especially when faced with the contradicting evidence of actual development statistics?

I think you're lying to yourself as much as you are anyone else here. You've bought a lie and now you are stuck with it as a bias, your mental defenses formed around it as a protective wall shunning any evidence refuting your beliefs.

Did you know that studies suggest the majority of people when presented with 3 independent sources of evidence refuting a previously held belief will still believe the misinformation? It's human nature to ignore the repo stats proving your assertions wrong. I don't blame you, but I'm not going to stop calling you out on it.";1;1;False;MrRGnome;dnpia61;I just bet 1,000 BTC (~$4M USD) that Segwit 2X coin will have more value than Segwit 1x coin.;73az4n;https://twitter.com/rogerkver/status/913870930815807488
"> Repo stats aren't dominated by blockstream and yes it does mean you're a liar for saying blockstream dominates development and is trying to destroy bitcoin, and assertions that bitcoin core development is centralized around a single company with dictatorial authority.

I have shown you the evidence and you still willingly ignore it. I can't help you then. But you actually don't want to be helped, though want to continue applauding Blockstream. For whatever reason.

If you want something else to ignore, just look at the big fundamental change that activated in August in Bitcoin. That has surely been implemented by some independent devs? LOL.

You know what? I can't wait for some site to aloow exchange of BTC futures for 1x Coreshitcoins and vice-versa. Let's get over with this. I'll do that, you do that and then we'll all be finally done with this shitshow.
";2;1;False;awemany;dnpi7mv;I just bet 1,000 BTC (~$4M USD) that Segwit 2X coin will have more value than Segwit 1x coin.;73az4n;https://twitter.com/rogerkver/status/913870930815807488
">Just because repo stats are not utterly dominated by Blockstream (they are still dominated), doesn't mean my point is wrong and it doesn't mean that I am a liar.

Repo stats aren't dominated by blockstream and yes it does mean you're a liar for saying blockstream dominates development and is trying to destroy bitcoin, and assertions that bitcoin core development is centralized around a single company with dictatorial authority.

Liar liar pants on fire.";1;1;False;MrRGnome;dnpi57z;I just bet 1,000 BTC (~$4M USD) that Segwit 2X coin will have more value than Segwit 1x coin.;73az4n;https://twitter.com/rogerkver/status/913870930815807488
"> and then point to who talked in some meetings to support that view. Meetings are not development. That's moving goal posts.

That is not moving goal posts. What the heck do you think these meetings are for? *Brewing virtual coffee?*

> If you want to have an argument about whether blockstream has the most talking time in meetings we can have that argument too, but that's not the claim you started with nor the claim I called a lie.

No, you took a quote of mine, ** added your own interpretation* of what it should mean (github repo stats, *which I didn't mention*) and then called me a liar for that because **your** favorable statistic isn't as clearly showing the undue influence Blockstream has on Bitcoin Core development. **That is *you* shifting the goal posts right there!**


> So can you support the quoted text or not? It should be as simple as pulling the contribution stats from the repo.

Just because *repo* stats are not utterly dominated by Blockstream (they are still dominated), doesn't mean my point is wrong and it doesn't mean that I am a liar.
";3;1;False;awemany;dnpi2xs;I just bet 1,000 BTC (~$4M USD) that Segwit 2X coin will have more value than Segwit 1x coin.;73az4n;https://twitter.com/rogerkver/status/913870930815807488
[deleted];2;1;False;;dnp4bhn;I just bet 1,000 BTC (~$4M USD) that Segwit 2X coin will have more value than Segwit 1x coin.;73az4n;https://twitter.com/rogerkver/status/913870930815807488
"You can't say development is:
> A self-selected circle of folks, dominated by a single, for-profit, fiat-funded company, who go with all kinds of underhanded tactics to - as it looks - destroy Bitcoin, with the help of an army of useful idiots .
 
and then point to who talked in some meetings to support that view. Meetings are not development. That's moving goal posts.

If you want to have an argument about whether blockstream has the most talking time in meetings we can have that argument too, but that's not the claim you started with nor the claim I called a lie.

So can you support the quoted text or not? It should be as simple as pulling the contribution stats from the repo.

Edit: In response to your additional comment, I'm giving you an example of the most obvious source which could support your statement and which will be used to refute any evidence you may present that conflicts with the repo statistics. You can find another source that supports your statement, but talk time in meetings is not a valid one.";1;1;False;MrRGnome;dnphzba;I just bet 1,000 BTC (~$4M USD) that Segwit 2X coin will have more value than Segwit 1x coin.;73az4n;https://twitter.com/rogerkver/status/913870930815807488
"> I know you are aware of where the github repo is since it was the basis of your last post, and I know you are aware these are not repo statistics.

I don't care whether they are current repo stats. *You* can't tell *me* the method I use to prove my point and you wrong - and **weekly developer meetings utterly dominated by Blockstream** do *indeed* prove my point.


> Caught in a lie.

Nope, though evidently responding to a troll here.";2;1;False;awemany;dnphwrv;I just bet 1,000 BTC (~$4M USD) that Segwit 2X coin will have more value than Segwit 1x coin.;73az4n;https://twitter.com/rogerkver/status/913870930815807488
"I know you are aware of where the github repo is since it was the basis of your last post, and I know you are aware these are not repo statistics.

Caught in a lie, trying to move the goal post.";1;2;False;MrRGnome;dnphv2k;I just bet 1,000 BTC (~$4M USD) that Segwit 2X coin will have more value than Segwit 1x coin.;73az4n;https://twitter.com/rogerkver/status/913870930815807488
"too lazy to look up the the person who deserves credit, I only recommended coulombs so we could look at the data objectively. 

and Yes the conclusion is those aligned with Blockstream dominate the bitcoin planning process. ";2;0;False;Adrian-X;dnq9kt8;I just bet 1,000 BTC (~$4M USD) that Segwit 2X coin will have more value than Segwit 1x coin.;73az4n;https://twitter.com/rogerkver/status/913870930815807488
Trezor is low volume compared to those exchanges too.;1;0;False;Inthewirelain;dnpr92s;I just bet 1,000 BTC (~$4M USD) that Segwit 2X coin will have more value than Segwit 1x coin.;73az4n;https://twitter.com/rogerkver/status/913870930815807488
"/u/MrRGnome :

> That's a lie. Cite repo stats and prove it. Don't parrot bullshit as fact.

Nope, it is not a lie.

Here, how about this: [~50% dominance in the weekly meetings.](https://www.reddit.com/r/btc/comments/6o2744/how_many_bitcoin_developers_are_employed_by/)

(Thanks to /u/Adrian-X for this)

You can't tell me that this is ""decentralized consensus of the community at large"" or other similar BS while keeping a straight face.

Unless *you* are the liar.";5;2;False;awemany;dnphudr;I just bet 1,000 BTC (~$4M USD) that Segwit 2X coin will have more value than Segwit 1x coin.;73az4n;https://twitter.com/rogerkver/status/913870930815807488
"I thought you were asking me to explain because you don’t understand Twitter. Now you’re saying you don’t need me to. 

Good day sir. ";1;0;False;locuester;dnpbykl;I just bet 1,000 BTC (~$4M USD) that Segwit 2X coin will have more value than Segwit 1x coin.;73az4n;https://twitter.com/rogerkver/status/913870930815807488
[deleted];1;1;False;;dnpoj33;I just bet 1,000 BTC (~$4M USD) that Segwit 2X coin will have more value than Segwit 1x coin.;73az4n;https://twitter.com/rogerkver/status/913870930815807488
"> Rather: A self-selected circle of folks, dominated by a single, for-profit, fiat-funded company, who go with all kinds of underhanded tactics to - as it looks - destroy Bitcoin, with the help of an army of useful idiots ...

That's a lie. Cite repo stats and prove it. Don't parrot bullshit as fact.";0;1;False;MrRGnome;dnphlvp;I just bet 1,000 BTC (~$4M USD) that Segwit 2X coin will have more value than Segwit 1x coin.;73az4n;https://twitter.com/rogerkver/status/913870930815807488
"<shakes head> 

A clarification where all parties clearly state what they believe the terms are.

What part of that do you not understand? I do not need you explaining anything to me, you're not a participant in the wager, now are you?";1;1;False;PilgramDouglas;dnpbvk2;I just bet 1,000 BTC (~$4M USD) that Segwit 2X coin will have more value than Segwit 1x coin.;73az4n;https://twitter.com/rogerkver/status/913870930815807488
"AXA invested $55 Million in blockstream 20 months ago.

[February 3, 2016 - Funding Round - Series A](https://www.crunchbase.com/funding-round/73434d84-d19b-96f7-f407-c964435002bb)

$50 million 10 months earlier:

[March 17, 2015 - Funding Round Venture](https://www.crunchbase.com/funding-round/66d2817a-5105-b29b-2edb-13cde0aea1a0)

They can easily drop $10 million if they thought it would hurt Bitcoin Cash adoption. Edit: by restricting hash-power, which follows price.

Not sure why you dispute full blocks causing fee spikes.

Edit: Adam Beck [seems to say](https://np.reddit.com/r/btc/comments/73dmpy/this_is_what_overwhelming_consensus_from_the/dnpqf3a/) Blockstream has access to 25,000 BTC (about $100  Million worth)";1;0;False;phillipsjk;dnpm8a7;I just bet 1,000 BTC (~$4M USD) that Segwit 2X coin will have more value than Segwit 1x coin.;73az4n;https://twitter.com/rogerkver/status/913870930815807488
"> Caught in a lie, *trying to move the goal post.*

As you edited your post to add the emphasized:

No I am also not moving goal posts: My point was that it is, as you quoted, ""Rather: A self-selected circle of folks, dominated by a single, for-profit, fiat-funded company, who go with all kinds of underhanded tactics to - as it looks - destroy Bitcoin, with the help of an army of useful idiots ..."".

And I have shown you evidence on this. 

**It is not my onus to use the method that *you* want me to prescribe using to show this - and it is more than ridiculous to accuse me as a liar for this.**";1;0;False;awemany;dnphzrr;I just bet 1,000 BTC (~$4M USD) that Segwit 2X coin will have more value than Segwit 1x coin.;73az4n;https://twitter.com/rogerkver/status/913870930815807488
"uhmm... you are aware that you're describing something that Ver would be committing also, right? Sometimes you don't need to put in print what you're thinking. ;-)";0;0;False;PilgramDouglas;dnp5qf7;I just bet 1,000 BTC (~$4M USD) that Segwit 2X coin will have more value than Segwit 1x coin.;73az4n;https://twitter.com/rogerkver/status/913870930815807488
lol, so using bitcoins reference client doesn't get me the name bitcoin - but forking bitcoin gets you the name bitcoin? I don't think so. I could give a fuck about your PR campaign for users and your desire for branding.;-1;1;False;MrRGnome;dnph75a;I just bet 1,000 BTC (~$4M USD) that Segwit 2X coin will have more value than Segwit 1x coin.;73az4n;https://twitter.com/rogerkver/status/913870930815807488
You are welcome!;1;0;False;LarsPensjo;dnpppvp;I just bet 1,000 BTC (~$4M USD) that Segwit 2X coin will have more value than Segwit 1x coin.;73az4n;https://twitter.com/rogerkver/status/913870930815807488
That's not true. I use a trezor and I had access to my BCH a few days after the split. They called it Bcash which upset a bunch of people but they supported it quickly.;2;1;False;cgcardona;dnp8144;I just bet 1,000 BTC (~$4M USD) that Segwit 2X coin will have more value than Segwit 1x coin.;73az4n;https://twitter.com/rogerkver/status/913870930815807488
[deleted];3;2;False;;dnp3s5h;I just bet 1,000 BTC (~$4M USD) that Segwit 2X coin will have more value than Segwit 1x coin.;73az4n;https://twitter.com/rogerkver/status/913870930815807488
The point is that such a hard-fork creates yet another alt. Poor old 1x will sit there alone, unloved and mined only by a couple of RPis in somebody's basement.;2;1;False;Richy_T;dnpfsxc;I just bet 1,000 BTC (~$4M USD) that Segwit 2X coin will have more value than Segwit 1x coin.;73az4n;https://twitter.com/rogerkver/status/913870930815807488
"As a member of the community and participant in this debate for the last 4 years, I believe it is you with the narrow focus. I have nothing against you wanting to create something that will reach more people, especially since I get a cut, I'm just not going to let you fuck with my decentralization in the process. Even if you create a paypal fork with more value than bitcoin, so long as I have decentralization I will be very happy to enjoy a platform with the most unique network property in the world.

The only real argument here is that you want to throw away the network I love in favor of the network you envision. That's where the line is, and there's not a lot you can do to stop people like me from supporting bitcoin as long as it is remotely decentralized.";0;1;False;MrRGnome;dnpgxu2;I just bet 1,000 BTC (~$4M USD) that Segwit 2X coin will have more value than Segwit 1x coin.;73az4n;https://twitter.com/rogerkver/status/913870930815807488
That's not how I read it. I doubt that is how each party is reading it. Because you and I don't agree on what is being said then the wording must be made more clear.;-3;1;False;PilgramDouglas;dnp3e3d;I just bet 1,000 BTC (~$4M USD) that Segwit 2X coin will have more value than Segwit 1x coin.;73az4n;https://twitter.com/rogerkver/status/913870930815807488
"~~Where's the ""if"" condition on the price in your summary?~~

NVM, you expressed it above in terms of winning/losing chain";0;1;False;LovelyDay;dnp4iad;I just bet 1,000 BTC (~$4M USD) that Segwit 2X coin will have more value than Segwit 1x coin.;73az4n;https://twitter.com/rogerkver/status/913870930815807488
http://www.investopedia.com/terms/o/opportunitycost.asp;1;1;False;LarsPensjo;dnpoai8;I just bet 1,000 BTC (~$4M USD) that Segwit 2X coin will have more value than Segwit 1x coin.;73az4n;https://twitter.com/rogerkver/status/913870930815807488
"> Hahaha good one.

Well then, define your Shitcoin without reference to a centralized authority.

Good luck. You know as well as I do that you will fail at that and at some point it will all lead back to the 'Core team', the 'github' or whatever instance you like to point to.

But none of those instances define Bitcoin. And none of those instances is *decentralized*, despite all the talk from your side on how oh-so-important 'muh full-node decentralization' is.";1;1;False;awemany;dnpipf9;I just bet 1,000 BTC (~$4M USD) that Segwit 2X coin will have more value than Segwit 1x coin.;73az4n;https://twitter.com/rogerkver/status/913870930815807488
"Well, for me it is a damn clear sign that if you are smart with your money, you do as Roger Ver does.

This is *the chance* to take the money from the brainwashed dumbasses.

I am looking for options to do this as well.

Given the history of behavior of the small blockers, there's a certain counterparty risk, however. Still, I think the odds are too good to pass for a 1:1 change of 1x-Core-Shitcoins for proper 2x BTC.";3;0;False;awemany;dnpfkqx;I just bet 1,000 BTC (~$4M USD) that Segwit 2X coin will have more value than Segwit 1x coin.;73az4n;https://twitter.com/rogerkver/status/913870930815807488
[deleted];6;3;False;;dnp4can;I just bet 1,000 BTC (~$4M USD) that Segwit 2X coin will have more value than Segwit 1x coin.;73az4n;https://twitter.com/rogerkver/status/913870930815807488
"The short answer is that after passing technical hurdles, the current problem is political. The Banks literally funded the core developement team so that they would retain a role in the system.


[The resolution of the Bitcoin experiment – Mike's blog](https://blog.plan99.net/the-resolution-of-the-bitcoin-experiment-dabb30201f7)";6;1;False;phillipsjk;dnphahx;I just bet 1,000 BTC (~$4M USD) that Segwit 2X coin will have more value than Segwit 1x coin.;73az4n;https://twitter.com/rogerkver/status/913870930815807488
"There's another problem for exchanges: The old coin might likely not even exist anymore.

A POW forked Core token, sure. But I am quite sure that will lead to lots of litigation, if you go and try to pass the POW-changed Core 1x shitcoin as BTC to your customers.";3;1;False;awemany;dnpf76p;I just bet 1,000 BTC (~$4M USD) that Segwit 2X coin will have more value than Segwit 1x coin.;73az4n;https://twitter.com/rogerkver/status/913870930815807488
