body;score;nb_replies;stickied;author;id;post_title;post_id;post_link
Complete with backdoor meetings. Should be second nature for Core.;1;1;False;BitcoinIsTehFuture;dnp5ksx;I just bet 1,000 BTC (~$4M USD) that Segwit 2X coin will have more value than Segwit 1x coin.;73az4n;https://twitter.com/rogerkver/status/913870930815807488
"> Right, but they will be divesting themselves of the asset they don't want by swapping coins 1-for-1.  

This is unknown right now, unless additional information has come to light that I do not know.

I am looking forward to reviewing the exact details of the bet and seeing who screwed themselves by not involving a lawyer/accounting/bookie to make the bet more favorable to them.

";-2;1;False;PilgramDouglas;dnp2ho3;I just bet 1,000 BTC (~$4M USD) that Segwit 2X coin will have more value than Segwit 1x coin.;73az4n;https://twitter.com/rogerkver/status/913870930815807488
">If you take this bet, and are on the winning side, you end up with 2000 BTCWIN coins - a portfolio worth $10m.
>If you take this bet, and are on the losing side, you end up with 2000 BTCLOS coins - a portfolio wirth $1m.

I'm not sure that is correct.  If you start with 1000 pre-fork you end up with 1000 BTCWIN and 1000 BTCLOS post-fork.

Therefore the winner will have 1000 BTCWIN coins and the loser will have 1000 BTCLOS coins.";-3;1;False;Deadbeat1000;dnp5rkc;I just bet 1,000 BTC (~$4M USD) that Segwit 2X coin will have more value than Segwit 1x coin.;73az4n;https://twitter.com/rogerkver/status/913870930815807488
"Indeed. I think the gloves will come off on the side of the miners, however.

Just look at the salt over on rBitcoin. This time, the miners mean it. Collectively. And I am pretty sure that the increasing screeching and frequency of attacks from Core will not make the miners less likely to turn the 1x Shitcoin into what it needs to be: Bitcoin Ash.";6;0;False;awemany;dnpfbyw;I just bet 1,000 BTC (~$4M USD) that Segwit 2X coin will have more value than Segwit 1x coin.;73az4n;https://twitter.com/rogerkver/status/913870930815807488
There is a cost of opportunity. One side will be worth less than the other, in which case you would get more profits from selling the share you don't believe in.;1;1;False;LarsPensjo;dnpnp9c;I just bet 1,000 BTC (~$4M USD) that Segwit 2X coin will have more value than Segwit 1x coin.;73az4n;https://twitter.com/rogerkver/status/913870930815807488
Rather: Roger wants more BTC, and the others want CSC. (Core ShitCoin);1;1;False;awemany;dnpiap8;I just bet 1,000 BTC (~$4M USD) that Segwit 2X coin will have more value than Segwit 1x coin.;73az4n;https://twitter.com/rogerkver/status/913870930815807488
Sure, but there's still got to be some sort of escrow. Say the fork comes, immediately one of the forks is trading for a fraction of the price of the other, you really think if there's no sort of escrow that the participants of the trade who have to give up the more valuable fork will actually do so?;1;1;False;lechango;dnpi14x;I just bet 1,000 BTC (~$4M USD) that Segwit 2X coin will have more value than Segwit 1x coin.;73az4n;https://twitter.com/rogerkver/status/913870930815807488
"> If they do renege, then they aren't worth listening to

If only people learned this lesson, but it seems they don't.

Example: politics.";15;0;False;LovelyDay;dnp5g84;I just bet 1,000 BTC (~$4M USD) that Segwit 2X coin will have more value than Segwit 1x coin.;73az4n;https://twitter.com/rogerkver/status/913870930815807488
and I nominate /u/timepad to host this very expensive and large blockchain!;-8;2;False;basheron;dnp3lcz;I just bet 1,000 BTC (~$4M USD) that Segwit 2X coin will have more value than Segwit 1x coin.;73az4n;https://twitter.com/rogerkver/status/913870930815807488
Yeah, brainwashed by Bilderberg group telling him what to fo through Blockstream dev boys. ;1;0;False;Pilzolli;dnp24tf;I just bet 1,000 BTC (~$4M USD) that Segwit 2X coin will have more value than Segwit 1x coin.;73az4n;https://twitter.com/rogerkver/status/913870930815807488
"> (Core ShitCoin)

Hahaha good one.";1;1;False;Yoghurt114;dnpijjy;I just bet 1,000 BTC (~$4M USD) that Segwit 2X coin will have more value than Segwit 1x coin.;73az4n;https://twitter.com/rogerkver/status/913870930815807488
[deleted];5;1;False;;dnp7kz9;I just bet 1,000 BTC (~$4M USD) that Segwit 2X coin will have more value than Segwit 1x coin.;73az4n;https://twitter.com/rogerkver/status/913870930815807488
LOL.;3;0;False;awemany;dnpf8rr;I just bet 1,000 BTC (~$4M USD) that Segwit 2X coin will have more value than Segwit 1x coin.;73az4n;https://twitter.com/rogerkver/status/913870930815807488
Yes. Yes we have.;3;1;False;paleh0rse;dnpuh51;I just bet 1,000 BTC (~$4M USD) that Segwit 2X coin will have more value than Segwit 1x coin.;73az4n;https://twitter.com/rogerkver/status/913870930815807488
"The only question is: How can us small guys get in there as well?

I rarely bet and am more the HODLer type. But I am absolutely willing to sell my Core 1x shittokens for proper 2x BTC.
";5;2;False;awemany;dnpf5md;I just bet 1,000 BTC (~$4M USD) that Segwit 2X coin will have more value than Segwit 1x coin.;73az4n;https://twitter.com/rogerkver/status/913870930815807488
[deleted];5;1;False;;dnp416a;I just bet 1,000 BTC (~$4M USD) that Segwit 2X coin will have more value than Segwit 1x coin.;73az4n;https://twitter.com/rogerkver/status/913870930815807488
Do you just reply to everything with the word trezor with a pile of bullshit?;0;0;False;onionland_star;dnpoua8;I just bet 1,000 BTC (~$4M USD) that Segwit 2X coin will have more value than Segwit 1x coin.;73az4n;https://twitter.com/rogerkver/status/913870930815807488
[deleted];1;1;False;;dnp5ro4;I just bet 1,000 BTC (~$4M USD) that Segwit 2X coin will have more value than Segwit 1x coin.;73az4n;https://twitter.com/rogerkver/status/913870930815807488
RemindMe! 6 weeks;1;0;False;mdprutj;dnpkt0g;I just bet 1,000 BTC (~$4M USD) that Segwit 2X coin will have more value than Segwit 1x coin.;73az4n;https://twitter.com/rogerkver/status/913870930815807488
Trezor is BIP39/44. We are fine. ;5;0;False;locuester;dnp7fr6;I just bet 1,000 BTC (~$4M USD) that Segwit 2X coin will have more value than Segwit 1x coin.;73az4n;https://twitter.com/rogerkver/status/913870930815807488
"I think it is rather: Core thinks they have a strong-enough stranglehold on the Bitcoin community and especially also the Bitcoin *brand* that they can basically do whatever they please and get their shittokens listed as BTC. Including an ""emergency POW fork"".

But I actually think enough smart money has read the whitepaper and understands it - to know that Bitcoin is not *Core*, but *decentralized*, and that the miners play the key role here.

And the Bitcoin world is bigger than /r/Bitcoin, BCT and the github.

I am willing to put money on the line here this time as well. (And I didn't do any trading of BTC:BCH).";6;1;False;awemany;dnpfu8j;I just bet 1,000 BTC (~$4M USD) that Segwit 2X coin will have more value than Segwit 1x coin.;73az4n;https://twitter.com/rogerkver/status/913870930815807488
I think most drama is still to come !;4;0;False;BA834024112;dnper2f;I just bet 1,000 BTC (~$4M USD) that Segwit 2X coin will have more value than Segwit 1x coin.;73az4n;https://twitter.com/rogerkver/status/913870930815807488
Come at me, gentlesirs!;0;0;False;kwanijml;dnp1ykm;I just bet 1,000 BTC (~$4M USD) that Segwit 2X coin will have more value than Segwit 1x coin.;73az4n;https://twitter.com/rogerkver/status/913870930815807488
It’s not up to users to “keep their coins” safe with segwit...;1;0;False;mdprutj;dnpivwd;I just bet 1,000 BTC (~$4M USD) that Segwit 2X coin will have more value than Segwit 1x coin.;73az4n;https://twitter.com/rogerkver/status/913870930815807488
[deleted];34;3;False;;dnp4lxq;I just bet 1,000 BTC (~$4M USD) that Segwit 2X coin will have more value than Segwit 1x coin.;73az4n;https://twitter.com/rogerkver/status/913870930815807488
I'm quite confident at least of 4 of them would.;1;0;False;Yoghurt114;dnpiabv;I just bet 1,000 BTC (~$4M USD) that Segwit 2X coin will have more value than Segwit 1x coin.;73az4n;https://twitter.com/rogerkver/status/913870930815807488
Isn't it interesting that the only people who feel the need to scare people into taking their side are small block supporters?;6;1;False;shadowofashadow;dnpblz1;I just bet 1,000 BTC (~$4M USD) that Segwit 2X coin will have more value than Segwit 1x coin.;73az4n;https://twitter.com/rogerkver/status/913870930815807488
"The Bitcoin Unlimited/nchains [Gigablocks](https://np.reddit.com/r/btc/comments/730r8x/nchaincom_gigablock_initiative/)  project is spending 1.5 Million over 5 years to test 1GB blocks.
";9;0;False;phillipsjk;dnp70p3;I just bet 1,000 BTC (~$4M USD) that Segwit 2X coin will have more value than Segwit 1x coin.;73az4n;https://twitter.com/rogerkver/status/913870930815807488
I am interested in this as well.;2;0;False;awemany;dnpf7tz;I just bet 1,000 BTC (~$4M USD) that Segwit 2X coin will have more value than Segwit 1x coin.;73az4n;https://twitter.com/rogerkver/status/913870930815807488
"I hope no one engages in those tactics and there's no proof Core/Blockstream devs participated in them before (sans smear campaigns).

Todd has said some questionable things though:

>Get in touch with me before you decide to offer a reward or anything for
actually making an attack happen... You have the support of a core dev
FWIW, I'm sure you can guess who. Warren of Litecoin says he believes
you as well, and asks you try the attack on a smaller alt-coin. :P
 
>Strategy would be good here, especially because the same attack(s) can
be used to take down the whole network too, but we more want to show how
SPV specifically is bad. Implementing a darknet to resist network-wide
attack is easily done, and it looks like doing peer prioritization will
help for those for whome darknets aren't a good option. Some testing of
the latter prior to an attack would be good.

Source: https://pastebin.com/4BcycXUu

Or his double spend attack on Coinbase:
https://www.reddit.com/r/btc/comments/40fi1x/peter_todd_successfully_carries_out_a_double/";5;0;False;uxgpf;dnpwg8t;I just bet 1,000 BTC (~$4M USD) that Segwit 2X coin will have more value than Segwit 1x coin.;73az4n;https://twitter.com/rogerkver/status/913870930815807488
"Keep your BTC on a wallet where you control the keys, split the coins when you get the opportunity (manage your personal risk here, make sure you're not the first person attempting to split)

As soon as both tickers get onto any exchange, you should be able to change 1 into the other with silly North Corea 1x shills swapping the other way.  

As an example, I swapped a bunch of my BTC into BCH on Kraken pretty early on (back when BCH was around $200).";3;0;False;SpacePirateM;dnpo4s9;I just bet 1,000 BTC (~$4M USD) that Segwit 2X coin will have more value than Segwit 1x coin.;73az4n;https://twitter.com/rogerkver/status/913870930815807488
"well if there's two chains after the fork yes, you'll hold both chains, but if one chain dies, those coins will be worthles.

for example, if bitcoin cash had died on arrival then you would still have had the bitcoin cash but they'd have been useless without a network and miners to grow the chain. ";7;1;False;texasrob;dnp481i;I just bet 1,000 BTC (~$4M USD) that Segwit 2X coin will have more value than Segwit 1x coin.;73az4n;https://twitter.com/rogerkver/status/913870930815807488
Trezor is amazing. Their wallet is rock solid and they did a great job w/ BCH IMO. They called it BCash which upset some people but their support of it has been great.;3;0;False;cgcardona;dnp8h0j;I just bet 1,000 BTC (~$4M USD) that Segwit 2X coin will have more value than Segwit 1x coin.;73az4n;https://twitter.com/rogerkver/status/913870930815807488
Can you explain what is wrong with Bitcoin today? ;4;1;False;Ce_ne;dnpgxph;I just bet 1,000 BTC (~$4M USD) that Segwit 2X coin will have more value than Segwit 1x coin.;73az4n;https://twitter.com/rogerkver/status/913870930815807488
You didn't answer the question I asked. Did the exchanges agree?;2;0;False;singularity87;dnpownn;I just bet 1,000 BTC (~$4M USD) that Segwit 2X coin will have more value than Segwit 1x coin.;73az4n;https://twitter.com/rogerkver/status/913870930815807488
There are no exchanges among signatories or they are powerless regarding BTC ticker. See Shapeshift's tweets - they will assign BTC to the winning chain (by MCap) after the fork (weeks?).;2;1;False;bitdoggy;dnpeoog;I just bet 1,000 BTC (~$4M USD) that Segwit 2X coin will have more value than Segwit 1x coin.;73az4n;https://twitter.com/rogerkver/status/913870930815807488
And the rest will fall in line, despite all the talk to the contrary. The beauty of Nakamoto consensus.;9;1;False;awemany;dnpencw;I just bet 1,000 BTC (~$4M USD) that Segwit 2X coin will have more value than Segwit 1x coin.;73az4n;https://twitter.com/rogerkver/status/913870930815807488
Cuntism is an illness, and blockstream core are all infected... ;0;0;False;Only1BallAnHalfaCocK;dnpktvi;I just bet 1,000 BTC (~$4M USD) that Segwit 2X coin will have more value than Segwit 1x coin.;73az4n;https://twitter.com/rogerkver/status/913870930815807488
"Oh I don't think it will.  It isn't going to be clear what's going to happen until at least a week after the fork.

Which really fucking sucks.  But oh well.";3;2;False;JustSomeBadAdvice;dnpgexa;I just bet 1,000 BTC (~$4M USD) that Segwit 2X coin will have more value than Segwit 1x coin.;73az4n;https://twitter.com/rogerkver/status/913870930815807488
[deleted];2;2;False;;dnp3tx8;I just bet 1,000 BTC (~$4M USD) that Segwit 2X coin will have more value than Segwit 1x coin.;73az4n;https://twitter.com/rogerkver/status/913870930815807488
[deleted];2;2;False;;dnp2sb8;I just bet 1,000 BTC (~$4M USD) that Segwit 2X coin will have more value than Segwit 1x coin.;73az4n;https://twitter.com/rogerkver/status/913870930815807488
Let's be clear. 1x *can't* implement replay protection. That creates a new alt, 1.5x, 1xb or something.;3;1;False;Richy_T;dnpa8bi;I just bet 1,000 BTC (~$4M USD) that Segwit 2X coin will have more value than Segwit 1x coin.;73az4n;https://twitter.com/rogerkver/status/913870930815807488
"Totally irrelevant, it's a voluntary trade. If you regret doing it after the fact doesn't mean you ""lost"".";1;1;False;Yoghurt114;dnpnz2t;I just bet 1,000 BTC (~$4M USD) that Segwit 2X coin will have more value than Segwit 1x coin.;73az4n;https://twitter.com/rogerkver/status/913870930815807488
The PoW hardfork is suicide, they dug their grave for 1x with that one.  They'd have more success going along with 2x at the last minute, then hard fork atomic swaps or lightning or something actually interesting.;4;0;False;trump_666_devil;dnp82fl;I just bet 1,000 BTC (~$4M USD) that Segwit 2X coin will have more value than Segwit 1x coin.;73az4n;https://twitter.com/rogerkver/status/913870930815807488
Whose 'they',  x2 has one fucking developer. ;0;1;False;Vaukins;dnpmrhx;I just bet 1,000 BTC (~$4M USD) that Segwit 2X coin will have more value than Segwit 1x coin.;73az4n;https://twitter.com/rogerkver/status/913870930815807488
Lightning has ALWAYS been “18 months from ready” since I’ve known of it. This goes back many years. ;37;0;False;locuester;dnp7jlh;I just bet 1,000 BTC (~$4M USD) that Segwit 2X coin will have more value than Segwit 1x coin.;73az4n;https://twitter.com/rogerkver/status/913870930815807488
"> Did it occur to you that the cost of attack increases with user base?

It does not. Number of non-full node users does not increase the cost of any known attack. It reduces the cost of many attacks, such as trust based attacks compromising the full nodes that large numbers of SPV users rely on. When one computer can be targeted to attack thousands of users, that's an increase in centralization and a degradation of the security of those users.

Again, a very basic technical misunderstanding being played off as subjective politics. This isn't philosophy where anything can be argued as a correct answer, it's network properties. Thankfully bitcoin will succeed whether you understand it, whether you fork it, and whether you politicize the environment. Bitcoin possesses the most unique network property in the world in decentralization and so long as it does it will have value.

Paypal has value too. Make a paypal. I wouldn't dare discourage it especially since I get a cut, but I'm not going to let you fuck up my bitcoin.";0;1;False;MrRGnome;dnpgm32;I just bet 1,000 BTC (~$4M USD) that Segwit 2X coin will have more value than Segwit 1x coin.;73az4n;https://twitter.com/rogerkver/status/913870930815807488
This is why I like bitcoin cash. It's already free of all this mess. Sure they (core trolls) can try and call red green until they're blue in the face (bcash) but you can't piss on my head and say it's raining.... I'm sure they'll try the same thing this time round.;2;0;False;LiamGaughan;dnpouap;I just bet 1,000 BTC (~$4M USD) that Segwit 2X coin will have more value than Segwit 1x coin.;73az4n;https://twitter.com/rogerkver/status/913870930815807488
"Exactly, but by the end of October it'll be patiently clear to everyone just how much support 2x has, which for some reason they're not believing right now, lol.

Cultism is a hell of a drug.";11;2;False;redlightsaber;dnpg8u5;I just bet 1,000 BTC (~$4M USD) that Segwit 2X coin will have more value than Segwit 1x coin.;73az4n;https://twitter.com/rogerkver/status/913870930815807488
2x has opt in replay protection. I guess HWs will provide a how to split guide which will start with sending 2x coins to new scheme.;1;0;False;matein30;dnpjdr2;I just bet 1,000 BTC (~$4M USD) that Segwit 2X coin will have more value than Segwit 1x coin.;73az4n;https://twitter.com/rogerkver/status/913870930815807488
"Don't think smart contracts would work. Weird things like POW changes may happen between now and then.
";5;1;False;phillipsjk;dnp6s86;I just bet 1,000 BTC (~$4M USD) that Segwit 2X coin will have more value than Segwit 1x coin.;73az4n;https://twitter.com/rogerkver/status/913870930815807488
There will be DDOS attacks, hacking attempts against SW2x supporting businesses and smear campaign on r/bitcoin and BCT. We've seen it before haven't we?;5;1;False;uxgpf;dnpjf5w;I just bet 1,000 BTC (~$4M USD) that Segwit 2X coin will have more value than Segwit 1x coin.;73az4n;https://twitter.com/rogerkver/status/913870930815807488
No, valid hash rate (read Core).;1;0;False;bitdoggy;dnpo7i9;I just bet 1,000 BTC (~$4M USD) that Segwit 2X coin will have more value than Segwit 1x coin.;73az4n;https://twitter.com/rogerkver/status/913870930815807488
"I agree that it's a smart bet.

With 90+% hashpower holding for months now, it is exceedingly likely that segwit2x is going to roll out without a hitch. The legacy chain will die, and Roger will double the bitcoins he bet. And, to make it an even better bet, the other side seems to be allowing everyone to get their bets back if there is no hardfork at all. I guess the people betting against Roger aren't just bad at economics, they're bad at gambling too.";19;1;False;timepad;dnp2sm7;I just bet 1,000 BTC (~$4M USD) that Segwit 2X coin will have more value than Segwit 1x coin.;73az4n;https://twitter.com/rogerkver/status/913870930815807488
"if you hold btc at the time of the fork you will then hold 1mb segwit coin and 2mb segwit coins after the fork, just like the bitcoin cash fork
but you need to possess the private keys so your trezor should be fine";3;1;False;texasrob;dnp3v9t;I just bet 1,000 BTC (~$4M USD) that Segwit 2X coin will have more value than Segwit 1x coin.;73az4n;https://twitter.com/rogerkver/status/913870930815807488
[deleted];7;4;False;;dnp5q1y;I just bet 1,000 BTC (~$4M USD) that Segwit 2X coin will have more value than Segwit 1x coin.;73az4n;https://twitter.com/rogerkver/status/913870930815807488
That's a little naive. Exchange customers will demand both coins. It will be easier for an exchange to add segwit2X as a new pair than to modify BTC for segwit 2x and create a new pair for bitcoin core.;1;0;False;BV5A6cx9NBZU78jDGG3t;dnphuz1;I just bet 1,000 BTC (~$4M USD) that Segwit 2X coin will have more value than Segwit 1x coin.;73az4n;https://twitter.com/rogerkver/status/913870930815807488
1x should be called Bcore;1;0;False;BlockchainMaster;dnq06wu;I just bet 1,000 BTC (~$4M USD) that Segwit 2X coin will have more value than Segwit 1x coin.;73az4n;https://twitter.com/rogerkver/status/913870930815807488
"Is it going to be like this:

- trading stops before the fork
- Segwit2x gets 95% hashrate
- trading starts with BTC as Segwit2x

?

Is this what Core is expecting:

- Announcement before the fork by non-NYA: Core keeps BTC ticker
- Core gets 15% hashrate after the fork (if less than that than emergency difficulty adjustment)
- BTC trades higher than S2X (if listed)
- Miners switch to the most profitable chain

?

";7;1;False;bitdoggy;dnpfbvc;I just bet 1,000 BTC (~$4M USD) that Segwit 2X coin will have more value than Segwit 1x coin.;73az4n;https://twitter.com/rogerkver/status/913870930815807488
Is that actually part of the agreement?  Which exchanges agreed to that? ;10;1;False;singularity87;dnp2eb4;I just bet 1,000 BTC (~$4M USD) that Segwit 2X coin will have more value than Segwit 1x coin.;73az4n;https://twitter.com/rogerkver/status/913870930815807488
I really hope you are right. We all may have to hodl on tight because it could be a bumpy ride. ;10;1;False;hitforhelp;dnp2815;I just bet 1,000 BTC (~$4M USD) that Segwit 2X coin will have more value than Segwit 1x coin.;73az4n;https://twitter.com/rogerkver/status/913870930815807488
"I will be messaging you on [**2017-10-29 23:28:33 UTC**](http://www.wolframalpha.com/input/?i=2017-10-29 23:28:33 UTC To Local Time) to remind you of [**this link.**](https://www.reddit.com/r/btc/comments/73az4n/i_just_bet_1000_btc_4m_usd_that_segwit_2x_coin/dnp2nte)

[**31 OTHERS CLICKED THIS LINK**](http://np.reddit.com/message/compose/?to=RemindMeBot&subject=Reminder&message=[https://www.reddit.com/r/btc/comments/73az4n/i_just_bet_1000_btc_4m_usd_that_segwit_2x_coin/dnp2nte]%0A%0ARemindMe!  1 month, how is Charlie Lee trying to weasel out of the bet with Roger. ) to send a PM to also be reminded and to reduce spam.

^(Parent commenter can ) [^(delete this message to hide from others.)](http://np.reddit.com/message/compose/?to=RemindMeBot&subject=Delete Comment&message=Delete! dnp2odg)

_____

|[^(FAQs)](http://np.reddit.com/r/RemindMeBot/comments/24duzp/remindmebot_info/)|[^(Custom)](http://np.reddit.com/message/compose/?to=RemindMeBot&subject=Reminder&message=[LINK INSIDE SQUARE BRACKETS else default to FAQs]%0A%0ANOTE: Don't forget to add the time options after the command.%0A%0ARemindMe!)|[^(Your Reminders)](http://np.reddit.com/message/compose/?to=RemindMeBot&subject=List Of Reminders&message=MyReminders!)|[^(Feedback)](http://np.reddit.com/message/compose/?to=RemindMeBotWrangler&subject=Feedback)|[^(Code)](https://github.com/SIlver--/remindmebot-reddit)|[^(Browser Extensions)](https://np.reddit.com/r/RemindMeBot/comments/4kldad/remindmebot_extensions/)
|-|-|-|-|-|-|";1;0;False;RemindMeBot;dnp2odg;I just bet 1,000 BTC (~$4M USD) that Segwit 2X coin will have more value than Segwit 1x coin.;73az4n;https://twitter.com/rogerkver/status/913870930815807488
"> ndMe! 1 month, how is Charlie Lee trying to weasel out of the bet with Roger.

FYI the fork isn't until November.";7;1;False;JustSomeBadAdvice;dnpcrne;I just bet 1,000 BTC (~$4M USD) that Segwit 2X coin will have more value than Segwit 1x coin.;73az4n;https://twitter.com/rogerkver/status/913870930815807488
so... ethereum???;1;0;False;slacknation;dnptua4;I just bet 1,000 BTC (~$4M USD) that Segwit 2X coin will have more value than Segwit 1x coin.;73az4n;https://twitter.com/rogerkver/status/913870930815807488
What short term future do you see for Ethereum? And do you think alt coins will primarily compete or complement? ;1;0;False;Kain_niaK;dnps0s0;I just bet 1,000 BTC (~$4M USD) that Segwit 2X coin will have more value than Segwit 1x coin.;73az4n;https://twitter.com/rogerkver/status/913870930815807488
"As long as community creates new forks from BTC and not from BCH or B2X or BTG, it is clear that BTC is considered the ""true"" Bitcoin.

Obviously, some people want to fork BTC into so many pieces until all of the fragments, individually, are negligible. This is how to destroy the network effect - quite devilish!

Thanks Roger in playing a leading role in destroying Bitcoin - you are doing JP Morgan and friends a great service!  ";1;0;False;Amichateur;dnpocqh;I just bet 1,000 BTC (~$4M USD) that Segwit 2X coin will have more value than Segwit 1x coin.;73az4n;https://twitter.com/rogerkver/status/913870930815807488
When you say altcoins, do you mean everything thats not BTC or is BCH included?;2;0;False;;dnp5xhh;I just bet 1,000 BTC (~$4M USD) that Segwit 2X coin will have more value than Segwit 1x coin.;73az4n;https://twitter.com/rogerkver/status/913870930815807488
[deleted];4;3;False;;dnp2cf7;I just bet 1,000 BTC (~$4M USD) that Segwit 2X coin will have more value than Segwit 1x coin.;73az4n;https://twitter.com/rogerkver/status/913870930815807488
