body;score;nb_replies;stickied;author;id;post_title;post_id;post_link
"> Not for long

Let's hope so";2;0;False;LexGrom;dpqoyhy;Bought my first bitcoin for $6 in 2011. Sold my last bitcoin for $6227 in 2017. Bitcoin has been taken over by people who do not share my values. Bitcoin Cash is the vision I signed up for in 2011. The possibility of financial freedom for everyone.;7cd0bp;https://twitter.com/ryanxcharles/status/929430451667767302
Tipping 1000 BTC can't be real, can it? Otherwise this is the most mind boggling thing ever, like casually handing out winning lottery tickets.;1;0;False;bolowbc;dpqr53g;Bought my first bitcoin for $6 in 2011. Sold my last bitcoin for $6227 in 2017. Bitcoin has been taken over by people who do not share my values. Bitcoin Cash is the vision I signed up for in 2011. The possibility of financial freedom for everyone.;7cd0bp;https://twitter.com/ryanxcharles/status/929430451667767302
You know that satoshi all the time thought fraud proofs for SPV clients would be way easier to implement, when he made this statement?;1;1;False;LongTermHodlerGuy;dpqdv7h;Bought my first bitcoin for $6 in 2011. Sold my last bitcoin for $6227 in 2017. Bitcoin has been taken over by people who do not share my values. Bitcoin Cash is the vision I signed up for in 2011. The possibility of financial freedom for everyone.;7cd0bp;https://twitter.com/ryanxcharles/status/929430451667767302
Silliness, we need real experts not these autistic idiot Core people with giant neckbeards, blue hair, no teeth, and can barely interact socially.  They are not the type of people to be in charge and make important decisions in a social economic system.  I have already outlined how these people like Adam Back [are not experts at all](https://www.reddit.com/r/btc/comments/66ymxs/adam_back_is_not_a_bitcoin_expert_if_he_were_then/), they are merely specialists, and not even good ones at that.  The only reason they got in their position was because they bullied and forced others out.  They are the scum of the Earth and justice will be served.  Never fuck with the Honey Badger.;2;1;False;cryptorebel;dpqhop0;Bought my first bitcoin for $6 in 2011. Sold my last bitcoin for $6227 in 2017. Bitcoin has been taken over by people who do not share my values. Bitcoin Cash is the vision I signed up for in 2011. The possibility of financial freedom for everyone.;7cd0bp;https://twitter.com/ryanxcharles/status/929430451667767302
[deleted];2;1;False;;dpqmby0;Bought my first bitcoin for $6 in 2011. Sold my last bitcoin for $6227 in 2017. Bitcoin has been taken over by people who do not share my values. Bitcoin Cash is the vision I signed up for in 2011. The possibility of financial freedom for everyone.;7cd0bp;https://twitter.com/ryanxcharles/status/929430451667767302
"Omg you r/btc guys are so retarded, need to stop reading here.  
If you are right, and your master economist Roger Ver is what is needed to safe bitcoin, then i don't want to live in this world lol.

";0;1;False;LongTermHodlerGuy;dpqhjjd;Bought my first bitcoin for $6 in 2011. Sold my last bitcoin for $6227 in 2017. Bitcoin has been taken over by people who do not share my values. Bitcoin Cash is the vision I signed up for in 2011. The possibility of financial freedom for everyone.;7cd0bp;https://twitter.com/ryanxcharles/status/929430451667767302
"Absolute majority of people inside and outside of crypto are lightly left-leaning. They think that open blockchains empower people as collective, that we will share, sing together and everyone will be more happy. 

Sorry, no! A little empowerment to a few individuals who know what they doing (I hope to become one), giant power transfer to corporations and private jurisdictions (which smart individuals will be voluntarily parts of), poverty and death to everyone outside (which can be hundreds of millions if not billions). World will change forever";1;1;False;LexGrom;dpqln6u;Bought my first bitcoin for $6 in 2011. Sold my last bitcoin for $6227 in 2017. Bitcoin has been taken over by people who do not share my values. Bitcoin Cash is the vision I signed up for in 2011. The possibility of financial freedom for everyone.;7cd0bp;https://twitter.com/ryanxcharles/status/929430451667767302
[deleted];3;1;False;;dpqia8j;Bought my first bitcoin for $6 in 2011. Sold my last bitcoin for $6227 in 2017. Bitcoin has been taken over by people who do not share my values. Bitcoin Cash is the vision I signed up for in 2011. The possibility of financial freedom for everyone.;7cd0bp;https://twitter.com/ryanxcharles/status/929430451667767302
">  Bitcoin Cash is a long way from taking over

Of course, I didn't expect that to happen overnight but I also think Bitcoin Core team have a long way to being able to scale, LN is years from being used daily.";1;0;False;Zyoman;dpqzsm1;Bought my first bitcoin for $6 in 2011. Sold my last bitcoin for $6227 in 2017. Bitcoin has been taken over by people who do not share my values. Bitcoin Cash is the vision I signed up for in 2011. The possibility of financial freedom for everyone.;7cd0bp;https://twitter.com/ryanxcharles/status/929430451667767302
We already have [SPV wallets like Electrum that work great](https://electrum.org/bcc.txt).  Those poor excuses for cypherpunks write code like politicians write laws.  The more complex, and kludgey, and the more commits, the prouder they are of their accomplishments.  Then the false cypherpunks hold up a bunch of commits on github and claim they are so great, same way as politicians claim they are so great for passing so many horrible laws.  Bitcoin works despite the damage these clueless specialist developers have done.  They have no clue about economics or how Bitcoin works generally, that is why they are coders, they have a specialist mind, similar to an idiot savant type of autist, and its no coincidence many of these devs fit that profile.  Bitcoin Cash is Bitcoin, and if you don't like the white paper and Satoshi's vision then enjoy your segshit coin.  Its not looking like its going to turn out well.  ;1;1;False;cryptorebel;dpqh8cf;Bought my first bitcoin for $6 in 2011. Sold my last bitcoin for $6227 in 2017. Bitcoin has been taken over by people who do not share my values. Bitcoin Cash is the vision I signed up for in 2011. The possibility of financial freedom for everyone.;7cd0bp;https://twitter.com/ryanxcharles/status/929430451667767302
"Price doesn't matter here per se cos there's fiat hyperinflation factor (even without crypto the current colossal debt pyramid wouldn't have a chance). Millions of dollars per bitcoin, maybe

How we detect tipping point? It's not like there's an analog to Bitcoin Segwit mempool in the world of fiat. It never happened before, I don't know, honestly. Draconian taxation laws and seizing of property like factories and fields in the 1st world may give us a hint";1;1;False;LexGrom;dpqj9tl;Bought my first bitcoin for $6 in 2011. Sold my last bitcoin for $6227 in 2017. Bitcoin has been taken over by people who do not share my values. Bitcoin Cash is the vision I signed up for in 2011. The possibility of financial freedom for everyone.;7cd0bp;https://twitter.com/ryanxcharles/status/929430451667767302
[deleted];2;1;False;;dpql7q1;Bought my first bitcoin for $6 in 2011. Sold my last bitcoin for $6227 in 2017. Bitcoin has been taken over by people who do not share my values. Bitcoin Cash is the vision I signed up for in 2011. The possibility of financial freedom for everyone.;7cd0bp;https://twitter.com/ryanxcharles/status/929430451667767302
"Ok if you seriously think CW might be satoshi and is more competent than the core developers go ahead and support a version that might ruin bitcoin.  
If fraud proofs are so easy why isn't he implementing them then as a proof of concept, you know like having things ready before you want others to change bitcoin, like uh... the core devs are doing?  
Look at all the improvements in the last bitcoin core versions, there is no one who can beat that innovation.   
Cypherpunks code, politicians talk.
";0;1;False;LongTermHodlerGuy;dpqgz63;Bought my first bitcoin for $6 in 2011. Sold my last bitcoin for $6227 in 2017. Bitcoin has been taken over by people who do not share my values. Bitcoin Cash is the vision I signed up for in 2011. The possibility of financial freedom for everyone.;7cd0bp;https://twitter.com/ryanxcharles/status/929430451667767302
haha thanks :);1;0;False;SirEDCaLot;dpq8720;Bought my first bitcoin for $6 in 2011. Sold my last bitcoin for $6227 in 2017. Bitcoin has been taken over by people who do not share my values. Bitcoin Cash is the vision I signed up for in 2011. The possibility of financial freedom for everyone.;7cd0bp;https://twitter.com/ryanxcharles/status/929430451667767302
No, could you please elaborate.  I think its very simple for SPV to work, all any user needs to do is query a number of nodes and compare them to get near certainty that they have the right history.;1;1;False;cryptorebel;dpqe0gy;Bought my first bitcoin for $6 in 2011. Sold my last bitcoin for $6227 in 2017. Bitcoin has been taken over by people who do not share my values. Bitcoin Cash is the vision I signed up for in 2011. The possibility of financial freedom for everyone.;7cd0bp;https://twitter.com/ryanxcharles/status/929430451667767302
It really boggles the mind;2;1;False;LexGrom;dpqidtn;Bought my first bitcoin for $6 in 2011. Sold my last bitcoin for $6227 in 2017. Bitcoin has been taken over by people who do not share my values. Bitcoin Cash is the vision I signed up for in 2011. The possibility of financial freedom for everyone.;7cd0bp;https://twitter.com/ryanxcharles/status/929430451667767302
Prepping doesn't really suit me. My best hope is something like territorially-closed community in USA for the storm and projects like [FreeSociety.com](http://FreeSociety.com). Without joking companies like Coinbase will make headquarters in such pockets and will have private armies;2;1;False;LexGrom;dpqjwxd;Bought my first bitcoin for $6 in 2011. Sold my last bitcoin for $6227 in 2017. Bitcoin has been taken over by people who do not share my values. Bitcoin Cash is the vision I signed up for in 2011. The possibility of financial freedom for everyone.;7cd0bp;https://twitter.com/ryanxcharles/status/929430451667767302
"If there are 10000 real nodes, and 20000 fake nodes on just 20 machines having 1000 IPs each, how do you find out what is real and what not?
Sure, just hardcode in some ""trusted"" nodes -> paypal 2.0 which no one wants.  
  
> Do you realize that there is no such thing as 100% security

That is exactly the engineering view bitcoin needs lol";1;1;False;LongTermHodlerGuy;dpqf8fh;Bought my first bitcoin for $6 in 2011. Sold my last bitcoin for $6227 in 2017. Bitcoin has been taken over by people who do not share my values. Bitcoin Cash is the vision I signed up for in 2011. The possibility of financial freedom for everyone.;7cd0bp;https://twitter.com/ryanxcharles/status/929430451667767302
[deleted];2;1;False;;dpqiz7z;Bought my first bitcoin for $6 in 2011. Sold my last bitcoin for $6227 in 2017. Bitcoin has been taken over by people who do not share my values. Bitcoin Cash is the vision I signed up for in 2011. The possibility of financial freedom for everyone.;7cd0bp;https://twitter.com/ryanxcharles/status/929430451667767302
"That would be easy to manipulate by just spawning 1000s of fake nodes giving fake history.  
I don't have the technical knowledge to explain this in detail, but IMHO i got a good understanding in an abstract way to tell that what would be needed to make SPV 100% fraud proof would be to make it a full node.  
Considering that, there is no secure SPV, anyone who claims otherwise always quoting satoshi, please explain or link to somewhere where it is explained how a perfect fraud proof SPV is possible to implement?  
Because if it is not, we are WAY more secure with LN or even doing most transactions offchain using trusted services like coinbase.  
Those who need the real bitcoin network will have to pay some fees for having the privilege.";1;1;False;LongTermHodlerGuy;dpqenx2;Bought my first bitcoin for $6 in 2011. Sold my last bitcoin for $6227 in 2017. Bitcoin has been taken over by people who do not share my values. Bitcoin Cash is the vision I signed up for in 2011. The possibility of financial freedom for everyone.;7cd0bp;https://twitter.com/ryanxcharles/status/929430451667767302
[deleted];2;1;False;;dpqjiol;Bought my first bitcoin for $6 in 2011. Sold my last bitcoin for $6227 in 2017. Bitcoin has been taken over by people who do not share my values. Bitcoin Cash is the vision I signed up for in 2011. The possibility of financial freedom for everyone.;7cd0bp;https://twitter.com/ryanxcharles/status/929430451667767302
"I dont think spinning up 1000s of fakes will be a good enough attack.  You can query enough nodes to figure out that they are fake.  What is your definition of ""secure SPV""? Do you realize that there is no such thing as 100% security, there is a spectrum that security exists on and you can never achieve 100%.  So if SPV can be 99.9999999999999999% reliable then that is pretty darn good.";1;1;False;cryptorebel;dpqeyj5;Bought my first bitcoin for $6 in 2011. Sold my last bitcoin for $6227 in 2017. Bitcoin has been taken over by people who do not share my values. Bitcoin Cash is the vision I signed up for in 2011. The possibility of financial freedom for everyone.;7cd0bp;https://twitter.com/ryanxcharles/status/929430451667767302
"Well I think [this article with Dr Craig Wright](https://coingeek.com/craig-wright-on-bitcoin-scalability/) does a great job of winning this argument.  He also addresses your point of fraud proofs:

> Now, the first thing we need to understand is that all encryption systems are probabilistic. Password systems and any modern information security system works on probabilistic information. The so-called experts who talk about the probabilistic system of bitcoin fail to comprehend that strong encryption is probabilistic.

> Fraud proofs and nowhere near as difficult as anyone thinks. They do not require some special cryptographic protocol. They are far simpler to implement than anyone seems to understand.

> The solution is incredibly simple. All you need to do is randomly select a series of nodes on the network and query whether the inclusion of your transaction has occurred on that node. Each query would be random. Using a simple Bayesian algorithm, we could use a failure model to analyse the likelihood of a double spend or other attack.” – Dr Craig Wright

Maybe he is Satoshi after all huh?

";1;1;False;cryptorebel;dpqg575;Bought my first bitcoin for $6 in 2011. Sold my last bitcoin for $6227 in 2017. Bitcoin has been taken over by people who do not share my values. Bitcoin Cash is the vision I signed up for in 2011. The possibility of financial freedom for everyone.;7cd0bp;https://twitter.com/ryanxcharles/status/929430451667767302
Ok, trying that one;1;0;False;PavelSokov;dprd267;Bought my first bitcoin for $6 in 2011. Sold my last bitcoin for $6227 in 2017. Bitcoin has been taken over by people who do not share my values. Bitcoin Cash is the vision I signed up for in 2011. The possibility of financial freedom for everyone.;7cd0bp;https://twitter.com/ryanxcharles/status/929430451667767302
"That being said, how about you BCH guys make the needed speed improvements on chain instead of complaining, then we talk?  
Oh i see, core is doing that already. So what is your value here?";1;0;False;LongTermHodlerGuy;dpqcupr;Bought my first bitcoin for $6 in 2011. Sold my last bitcoin for $6227 in 2017. Bitcoin has been taken over by people who do not share my values. Bitcoin Cash is the vision I signed up for in 2011. The possibility of financial freedom for everyone.;7cd0bp;https://twitter.com/ryanxcharles/status/929430451667767302
Why would you pay with btc at the store? You would have to pay taxes for your coffee. ;1;0;False;richyboycaldo;dpqa562;Bought my first bitcoin for $6 in 2011. Sold my last bitcoin for $6227 in 2017. Bitcoin has been taken over by people who do not share my values. Bitcoin Cash is the vision I signed up for in 2011. The possibility of financial freedom for everyone.;7cd0bp;https://twitter.com/ryanxcharles/status/929430451667767302
"Who says there will be more nodes with BCH? It is a risky and not even needed assumption. I will prefer sound money over a paypal 2.0 payment network that MAY be decentralized enough and MAY even work at all. Did you sync bitcoin lately on a high end hardware? I did, and i sure as hell don't want it to take 8x longer, or 50x longer as years go by.
If i can't sync a node, i can't run a node.";0;2;False;LongTermHodlerGuy;dpqcdmf;Bought my first bitcoin for $6 in 2011. Sold my last bitcoin for $6227 in 2017. Bitcoin has been taken over by people who do not share my values. Bitcoin Cash is the vision I signed up for in 2011. The possibility of financial freedom for everyone.;7cd0bp;https://twitter.com/ryanxcharles/status/929430451667767302
I made the mistake of trying to trade 20$ worth of bch for btc one time. I forgot about the 10$ fee. Lmao :(;1;0;False;tim11395;dpqil5y;Bought my first bitcoin for $6 in 2011. Sold my last bitcoin for $6227 in 2017. Bitcoin has been taken over by people who do not share my values. Bitcoin Cash is the vision I signed up for in 2011. The possibility of financial freedom for everyone.;7cd0bp;https://twitter.com/ryanxcharles/status/929430451667767302
You're welcome :);2;0;False;BeijingBitcoins;dpqc3nr;Bought my first bitcoin for $6 in 2011. Sold my last bitcoin for $6227 in 2017. Bitcoin has been taken over by people who do not share my values. Bitcoin Cash is the vision I signed up for in 2011. The possibility of financial freedom for everyone.;7cd0bp;https://twitter.com/ryanxcharles/status/929430451667767302
"Segwitcoin will be [centralized on LN](https://www.reddit.com/r/btc/comments/6jqrub/game_over_blockstream_mathematical_proof_that_the/).  Technology grows, over time and can accomodate.  If you have trouble running a node, then update your hardware, simple.  Satoshi Nakamoto the inventor of Bitcoin said [users do not need to run nodes](https://bitcointalk.org/index.php?topic=532.msg6306#msg6306):

> The current system where every user is a network node is not the intended configuration for large scale.  That would be like every Usenet user runs their own NNTP server.  The design supports letting users just be users.  The more burden it is to run a node, the fewer nodes there will be.  Those few nodes will be big server farms.  The rest will be client nodes that only do transactions and don't generate.

If you don't like Bitcoin's design you should have went and started an alt-coin instead of trying to change the original vision into segwit AXA/Bilderberg BlockStream coin.";1;1;False;cryptorebel;dpqdqxt;Bought my first bitcoin for $6 in 2011. Sold my last bitcoin for $6227 in 2017. Bitcoin has been taken over by people who do not share my values. Bitcoin Cash is the vision I signed up for in 2011. The possibility of financial freedom for everyone.;7cd0bp;https://twitter.com/ryanxcharles/status/929430451667767302
"It does not nullify asicboost at all....barely anyone uses segwit and miners don;t have to include segwit transactions.  Actually bigger blocks is the worst thing for asicboost by making collisions more rare.  So why is Jihan pushing blocksize increase if it hurts asicboost? Logic fail.";1;0;False;cryptorebel;dpqajpd;Bought my first bitcoin for $6 in 2011. Sold my last bitcoin for $6227 in 2017. Bitcoin has been taken over by people who do not share my values. Bitcoin Cash is the vision I signed up for in 2011. The possibility of financial freedom for everyone.;7cd0bp;https://twitter.com/ryanxcharles/status/929430451667767302
Hard decentralization? Sounds silly, what does that mean?  Decentralization exists on a spectrum, and has many facets to it.  By having more nodes all over the world and more users even if nodes are more expensive to run results in more decentralization and more censorship resistance.  Strangling blocksize forcing everyone to off-chain centralized solutions is not decentralization, sorry.;1;1;False;cryptorebel;dpqah8i;Bought my first bitcoin for $6 in 2011. Sold my last bitcoin for $6227 in 2017. Bitcoin has been taken over by people who do not share my values. Bitcoin Cash is the vision I signed up for in 2011. The possibility of financial freedom for everyone.;7cd0bp;https://twitter.com/ryanxcharles/status/929430451667767302
"In the long run, even BTC will have a large memory requirement. 

But BTC is broken *now*. BCH gives everyone time - years and years of time, probably - to come up with a way to scale that doesn't break the coin with shit like segwit.";1;0;False;cr0ft;dpqsr01;Bought my first bitcoin for $6 in 2011. Sold my last bitcoin for $6227 in 2017. Bitcoin has been taken over by people who do not share my values. Bitcoin Cash is the vision I signed up for in 2011. The possibility of financial freedom for everyone.;7cd0bp;https://twitter.com/ryanxcharles/status/929430451667767302
"Because Bitcoin does have plenty of stuff in the pipeline to speed up transactions. 

Far far more developers working on it, and those developers have lots of experience with these systems. 

If bitcoin is ever overthrown it will be a slow and steady slide, not the 'flippening' that people talk of. 
I'm not fussed which wins, I have money in both to hedge my bets, but Bitcoin Cash is a long way from taking over. ";2;1;False;JeremiahBoogle;dpqsebs;Bought my first bitcoin for $6 in 2011. Sold my last bitcoin for $6227 in 2017. Bitcoin has been taken over by people who do not share my values. Bitcoin Cash is the vision I signed up for in 2011. The possibility of financial freedom for everyone.;7cd0bp;https://twitter.com/ryanxcharles/status/929430451667767302
"Lol yeah let us have bitcoin planned by central bankers and nobel price winning economists, because they know so much about sound money and blockchains rofl /s!  
If it wasn't so serious you would be a funny troll.
";-1;1;False;LongTermHodlerGuy;dpqidxv;Bought my first bitcoin for $6 in 2011. Sold my last bitcoin for $6227 in 2017. Bitcoin has been taken over by people who do not share my values. Bitcoin Cash is the vision I signed up for in 2011. The possibility of financial freedom for everyone.;7cd0bp;https://twitter.com/ryanxcharles/status/929430451667767302
Nice strawman, this is what Maxwell and [Bilderberg/AXA funded BlockStream](https://www.reddit.com/r/btc/comments/47zfzt/blockstream_is_now_controlled_by_the_bilderberg/) want, a technocracy. But I bet you love Bilderberg and central bank scammers running you don't you? You love licking BlockStream boots.  Even AXA even has [planned technocratic smart cities](https://www.reddit.com/r/btc/comments/63i02v/new_video_by_axa_funders_of_blockstream_and_their/).  Enjoy tyranny, I will be seizing Liberty with my fellow Bitcoin Cash rebels.;2;0;False;cryptorebel;dpqiiul;Bought my first bitcoin for $6 in 2011. Sold my last bitcoin for $6227 in 2017. Bitcoin has been taken over by people who do not share my values. Bitcoin Cash is the vision I signed up for in 2011. The possibility of financial freedom for everyone.;7cd0bp;https://twitter.com/ryanxcharles/status/929430451667767302
Are you saying its more likely that there was a global conspiracy to get every single country on earth off the gold standard regardless of the benefits to that country, rather than that countries gradually switched over from the gold standard over the 20th century when it became apparent that being able to increase and decrease the money supply at will was more useful than being limited by however much gold you could get your hands on?;2;0;False;suninabox;dpq9dwb;Bought my first bitcoin for $6 in 2011. Sold my last bitcoin for $6227 in 2017. Bitcoin has been taken over by people who do not share my values. Bitcoin Cash is the vision I signed up for in 2011. The possibility of financial freedom for everyone.;7cd0bp;https://twitter.com/ryanxcharles/status/929430451667767302
"Yeah ChangeTip was great, as was bitcointip before it.  

I'm also very glad to see a tip bot back in operation, tips are one of the best ways of doing outreach!";1;0;False;SirEDCaLot;dpq89gk;Bought my first bitcoin for $6 in 2011. Sold my last bitcoin for $6227 in 2017. Bitcoin has been taken over by people who do not share my values. Bitcoin Cash is the vision I signed up for in 2011. The possibility of financial freedom for everyone.;7cd0bp;https://twitter.com/ryanxcharles/status/929430451667767302
