body;score;nb_replies;stickied;author;id;post_title;post_id;post_link
"> And if a PoW HF doesn't happen and there's just the 2x HF and the segwit no HF chain, which is the one changing again? Clearly 2x. I.E. bitcoin and a bitcoin fork.

I am willing to bet lots (from my POV) of money, *a significant fraction of my net worth* on 2x being BTC and 1x being Bitcoin Ash. As in, likely not even existing after the fork.

> If bitcoin PoW changes you have at least a stronger argument about the brand as it's fork vs fork.

Glad to see a speck of common sense here, however small it might be (I could now complain about fork vs. fork but I know how my argument there would be lost on you).";2;1;False;awemany;dnpix7y;I just bet 1,000 BTC (~$4M USD) that Segwit 2X coin will have more value than Segwit 1x coin.;73az4n;https://twitter.com/rogerkver/status/913870930815807488
"Roger would you mind elaborating why you're so bullish on Bitcoin Cash vs SegWit2x?

 After way more bitcoin miners, business and developers seem focus on SegWit2x. Furthermore, it's still unclear to me how many and how competent the developers behind Bitcoin Cash is. 
I've only really seen presentations and interviews of Amaury Séchet. 
How is the development funded? ";16;1;False;MrNobody22;dnpbjog;I just bet 1,000 BTC (~$4M USD) that Segwit 2X coin will have more value than Segwit 1x coin.;73az4n;https://twitter.com/rogerkver/status/913870930815807488
What happens to BCC if Segwit2x succeeds and relieves fee pressure significantly, at least in the short term?;16;2;False;chuckymcgee;dnp4y6m;I just bet 1,000 BTC (~$4M USD) that Segwit 2X coin will have more value than Segwit 1x coin.;73az4n;https://twitter.com/rogerkver/status/913870930815807488
I'm sure u trust /u/MemoryDealers perhaps he can setup a 2X escrow? And /u/coblee can do the same for core? ;4;1;False;adz0007;dnp69p0;I just bet 1,000 BTC (~$4M USD) that Segwit 2X coin will have more value than Segwit 1x coin.;73az4n;https://twitter.com/rogerkver/status/913870930815807488
"Says redditor for two months who has nothing but shit posts on r/btc. 

Some of us have been around Bitcoin more than a few years. It's probably the first time you've seen it so here is the whitepaper: https://bitcoin.com/bitcoin.pdf

First sentence:
>A purely peer-to-peer version of electronic cash would allow online
payments to be sent directly from one party to another without going through a financial institution. 

That's called economic freedom buddy. That's what Bitcoin is. Freedom from corporations like Blockstream, freedom from central planners like BitcoinCore and freedom from central government authorities. It's pretty simple.";7;0;False;Annapurna317;dnpbldl;I just bet 1,000 BTC (~$4M USD) that Segwit 2X coin will have more value than Segwit 1x coin.;73az4n;https://twitter.com/rogerkver/status/913870930815807488
I dare say it is you that is brainwashed. ;11;2;False;TankBlazer;dnp1r03;I just bet 1,000 BTC (~$4M USD) that Segwit 2X coin will have more value than Segwit 1x coin.;73az4n;https://twitter.com/rogerkver/status/913870930815807488
"> lets free everybody, 20000000000000000000000000000000x block weight

Sounds good to me. Remove the centrally planned block size limit entirely, and let the Nakamoto Consensus sort it out.

Hopefully Segwit2x is the first step in a series of block size limit increases that eventually lead to the entire removal of the limit.";7;1;False;timepad;dnp3bhy;I just bet 1,000 BTC (~$4M USD) that Segwit 2X coin will have more value than Segwit 1x coin.;73az4n;https://twitter.com/rogerkver/status/913870930815807488
The same as when the BCC fork occurred. You'll just have to be very careful on how you split your tokens, I think.;7;2;False;PilgramDouglas;dnp2jjh;I just bet 1,000 BTC (~$4M USD) that Segwit 2X coin will have more value than Segwit 1x coin.;73az4n;https://twitter.com/rogerkver/status/913870930815807488
Ideally 1x will be abandoned by everyone. But if 1x implements replay protection during their PoW hardfork, which is looking more and more likely, then the coins will split and be spendable on both chains.;18;2;False;Anen-o-me;dnp2kin;I just bet 1,000 BTC (~$4M USD) that Segwit 2X coin will have more value than Segwit 1x coin.;73az4n;https://twitter.com/rogerkver/status/913870930815807488
There are benefits to segwit that BCH doesn't have. ;1;0;False;BlockchainMaster;dnq0491;I just bet 1,000 BTC (~$4M USD) that Segwit 2X coin will have more value than Segwit 1x coin.;73az4n;https://twitter.com/rogerkver/status/913870930815807488
"Some people feel that way, others don't. There are reasonable arguments on both sides. The only sure thing is that popcorn sales are set to rise.

In fact, I think it might all be a plot by Orville Redenbacher";7;0;False;Richy_T;dnpaj2c;I just bet 1,000 BTC (~$4M USD) that Segwit 2X coin will have more value than Segwit 1x coin.;73az4n;https://twitter.com/rogerkver/status/913870930815807488
">Mrnobody22 would you mind elaborating why you're so bullish on Bitcoin vs fiat?
>
> After way more people, business and developers seem focus on fiat. Furthermore, it's still unclear to me how many and how competent the developers behind Bitcoin are.";7;0;False;jessquit;dnphns8;I just bet 1,000 BTC (~$4M USD) that Segwit 2X coin will have more value than Segwit 1x coin.;73az4n;https://twitter.com/rogerkver/status/913870930815807488
"That depends on the roadmap that is put forth for scaling the Segwit2x/BTC chain.

I'd guess if they don't move beyond a static blocksize limit, or put forth a schedule of planned increases or some conditions triggering those, then Bitcoin Cash presents a more ambitious on-chain ""space program"" which could be attractive to bigger players.

Let's remember - Lightning network is supposedly 18 months from being ready. That's a looooong time.";16;2;False;LovelyDay;dnp5e7p;I just bet 1,000 BTC (~$4M USD) that Segwit 2X coin will have more value than Segwit 1x coin.;73az4n;https://twitter.com/rogerkver/status/913870930815807488
"That is a good question and the truth is that a successful 2x keeps BCC on the back-burner. However, sooner or later, 2x is not enough and the fight is had all over again and it may turn out that the segwit part is a dead weight that does nobody any favors.

I'm a BCC fan but I think that 2x does have a fighting chance so I'm holding both for now. Segwit is a wart but not a death sentence.";20;0;False;Richy_T;dnpb9ww;I just bet 1,000 BTC (~$4M USD) that Segwit 2X coin will have more value than Segwit 1x coin.;73az4n;https://twitter.com/rogerkver/status/913870930815807488
"> Of course it is, but those economic incentives aren't ""put it in as many hands as possible to increase its value at the cost of the protocols unique technical attributes"", the economic incentives are the cost to attack the network and the nash equilibrium encouraging honest nodes Roger is perpetually trying to change in favor of usability and access to blockspace.

Did it occur to you that the cost of attack increases with user base?

A lot more than with full node count, mind you, *as users are incentivized to keep their coins safe!*

Also, there's not a single hint that node count will be lower with higher node load but also larger adoption rates.

> His actions are clearly motivated by greed.

You got that right. Mine are as well. And collectively, this is also why Bitcoin will succeed.";5;2;False;awemany;dnpg8uj;I just bet 1,000 BTC (~$4M USD) that Segwit 2X coin will have more value than Segwit 1x coin.;73az4n;https://twitter.com/rogerkver/status/913870930815807488
I think 2x means BTC will scale on chain as well, and massively so, eventually. 2x will be the ousting of Core. Before the advent of BCH on the stage, this was also the common understanding here. I guess BCH changed the dynamics for some (and I can't blame them).;4;0;False;awemany;dnpeejf;I just bet 1,000 BTC (~$4M USD) that Segwit 2X coin will have more value than Segwit 1x coin.;73az4n;https://twitter.com/rogerkver/status/913870930815807488
ah gotcha.  The details are sure to come out soon.  This is going to garner a lot of attention for sure.;2;0;False;kingp43x;dnpdg9a;I just bet 1,000 BTC (~$4M USD) that Segwit 2X coin will have more value than Segwit 1x coin.;73az4n;https://twitter.com/rogerkver/status/913870930815807488
I have 1000 BTC. You have 1000 BTC. 2000 BTC total. After the fork, I have 1000 BTC-A + 1000 BTC-B. You have the same. Total of 2000 BTC-A + 2000 BTC-B between us. I give you my 1000 BTC-B, you give me your 1000 BTC-A. I now have 2000 BTC-A. You now have 2000 BTC-B.;7;0;False;glurp_glurp_glurp;dnp86oy;I just bet 1,000 BTC (~$4M USD) that Segwit 2X coin will have more value than Segwit 1x coin.;73az4n;https://twitter.com/rogerkver/status/913870930815807488
"Thank you Tom\_26 for voting on FuckTokenBot.  

This bot wants to find the best and worst bots on Reddit. [You can view results here](https://goodbot-badbot.herokuapp.com/).  

 ***  

^^Even ^^if ^^I ^^don't ^^reply ^^to ^^your ^^comment, ^^I'm ^^still ^^listening ^^for ^^votes. ^^Check ^^the ^^webpage ^^to ^^see ^^if ^^your ^^vote ^^registered!";1;0;False;GoodBot_BadBot;dnp8hem;I just bet 1,000 BTC (~$4M USD) that Segwit 2X coin will have more value than Segwit 1x coin.;73az4n;https://twitter.com/rogerkver/status/913870930815807488
"It doesn't matter.

They are swapping 1x for 2x at a 1 to 1 ratio.

They are agreeing to this now before any other market price has been determined.

They will either kill their reputation or be stuck with that price and they will win or lose depending on how they are valued compared to each other.

So there is no need for an official winner, it's just each side showing confidence in their preferred chain
";13;0;False;FreeSpeechWarrior;dnp4bqc;I just bet 1,000 BTC (~$4M USD) that Segwit 2X coin will have more value than Segwit 1x coin.;73az4n;https://twitter.com/rogerkver/status/913870930815807488
notarized!;5;1;False;PilgramDouglas;dnp2lx8;I just bet 1,000 BTC (~$4M USD) that Segwit 2X coin will have more value than Segwit 1x coin.;73az4n;https://twitter.com/rogerkver/status/913870930815807488
Mining 1 block on the other chain to make sure there is a fork is cheaper than 1,000 BTC so this is a lot of incentive to cause a chain split.;3;0;False;dskloet;dnpg4nk;I just bet 1,000 BTC (~$4M USD) that Segwit 2X coin will have more value than Segwit 1x coin.;73az4n;https://twitter.com/rogerkver/status/913870930815807488
On the other hand, if it looks like their preferred chain is going to be abandoned: the have an incentive to claim that there is no fork (so they get to keep their coins).;1;0;False;phillipsjk;dnphl7c;I just bet 1,000 BTC (~$4M USD) that Segwit 2X coin will have more value than Segwit 1x coin.;73az4n;https://twitter.com/rogerkver/status/913870930815807488
"Right, but they will be divesting themselves of the asset they don't want by  swapping coins 1-for-1.  If their preferred chain ends up being worth much more than the other, they do much better than they could have done by exchanging the coins on the open market.  If their preferred chain ends up being worth much less, then they end up doing very badly.

That's the bet.

EDIT: To put figures to it.  Imagine that post fork the winning chain (lets call it BTCWIN) is worth $5,000 and the losign chain let's call it BTCLOS is worth $500.  So if you have 1000 coins pre-fork (and therefore 1000 of each post fork) then you have a portfolio woth $5.5m.

If you take this bet, and are on the winning side, you end up with 2000 BTCWIN coins - a portfolio worth $10m.

If you take this bet, and are on the losing side, you end up with 2000 BTCLOS coins - a portfolio wirth $1m.";23;3;False;roybadami;dnp1q6h;I just bet 1,000 BTC (~$4M USD) that Segwit 2X coin will have more value than Segwit 1x coin.;73az4n;https://twitter.com/rogerkver/status/913870930815807488
As long as he broadcasts the transaction he has done all he can.  If the network can't process it that is not his fault.  If they don't get their coins because the network is crap or attacked then it is their own fault.  Personally, I hope there is only one valid chain post the split - the 2x chain.   But ideally, the 1X chain would hold long enough for all these people to sell off their 2x and move entirely to 1x and then 1x dies with fire.  Really hope Jihan, Mcafee and others tear it down as harshly and ruthlessly as possible - if it was me, I would show absolutely no mercy to these turds - enough is enough - it would be worth spending millions in the short term to purge them because in the long term far more value will be created without them. They have tried to hijack the coin and they have no right to do so - absolutely none - what they have done is simply heinous. Problem with these miners is that they are too nice and soft and too patient - if they believe so strongly that 2x is the right way to go, then make it happen.  If people don't like it, fork off and change the POW. ;6;1;False;papabitcoin;dnpd5kk;I just bet 1,000 BTC (~$4M USD) that Segwit 2X coin will have more value than Segwit 1x coin.;73az4n;https://twitter.com/rogerkver/status/913870930815807488
How the fuck is yet another fork, with one developer going to beat bitcoin. You're all deluded. ;1;0;False;Vaukins;dnpjo34;I just bet 1,000 BTC (~$4M USD) that Segwit 2X coin will have more value than Segwit 1x coin.;73az4n;https://twitter.com/rogerkver/status/913870930815807488
You can't lose on this trade. It's a trade, not a bet. Roger doesn't want his BTC but he does want B2X, the others don't want B2X but they do want BTC. Win-win.;2;3;False;Yoghurt114;dnphy1z;I just bet 1,000 BTC (~$4M USD) that Segwit 2X coin will have more value than Segwit 1x coin.;73az4n;https://twitter.com/rogerkver/status/913870930815807488
I'd argue public figures' worth is their word. If they do renege, then they aren't worth listening to. Exciting!;16;1;False;ijustgotheretoo;dnp4x0f;I just bet 1,000 BTC (~$4M USD) that Segwit 2X coin will have more value than Segwit 1x coin.;73az4n;https://twitter.com/rogerkver/status/913870930815807488
"> the ""general public"" doesn't even know what Bitcoin is ... They just look at the price and move on with their day.

Which is fine, as long as there's only one price to look at. The problem arises when you tell them ""OK, now there are four Bitcoins ... which one do you wish to invest in?"".

Let's also not forget that we were all part of the general public before we got into Bitcoin.";3;0;False;cryptoboy4001;dnpridd;I just bet 1,000 BTC (~$4M USD) that Segwit 2X coin will have more value than Segwit 1x coin.;73az4n;https://twitter.com/rogerkver/status/913870930815807488
"Hmm.. so right out of the gate eh?  Wow that's pretty bold.  

I personally think the fork falls thru and doesn't happen.  There certainly is no shortage of drama in bitcoin eh?";4;1;False;kingp43x;dnpdwaw;I just bet 1,000 BTC (~$4M USD) that Segwit 2X coin will have more value than Segwit 1x coin.;73az4n;https://twitter.com/rogerkver/status/913870930815807488
"Well, that's pretty clear from my reading of the bet.

All parties put their BTC into escrow before the fork.  After the fork, the 2X coins from the escrow go to Roger and the Core/1X coins go the the other participants.";4;2;False;roybadami;dnp34lm;I just bet 1,000 BTC (~$4M USD) that Segwit 2X coin will have more value than Segwit 1x coin.;73az4n;https://twitter.com/rogerkver/status/913870930815807488
"> It does not. Number of non-full node users does not increase the cost of any known attack. It reduces the cost of many attacks, such as trust based attacks compromising the full nodes that large numbers of SPV users rely on.

And that is your problem right here: The world is bigger than just some diagram in your mind of full nodes and blocks and hashes in merkle trees and POW and SPV connections.

The world is full of *people*. And among this group are the attackers *as well as the defenders* of Bitcoin.

Whereas for you, 'the attackers' seem to be at most some abstract symbol below some summation sign in some simplified game theory that panders to your belief set by dropping the important bit through 'lets simplify our assumptions'.

Making you wholly blind to the much larger *ongoing*, year long attack *that Bitcoin is fighting off right now*.

> Again, a very basic technical misunderstanding.

Believe me, I understand the technology. But I am also able to see everything in a l*ittle bit broader* picture here.";2;1;False;awemany;dnpgtv3;I just bet 1,000 BTC (~$4M USD) that Segwit 2X coin will have more value than Segwit 1x coin.;73az4n;https://twitter.com/rogerkver/status/913870930815807488
"https://medium.com/byteball/making-p2p-great-again-episode-ii-bitcoin-exchange-d98adfbde2a5

Can BitShares do this too?";1;0;False;garbonzo607;dnpqkna;I just bet 1,000 BTC (~$4M USD) that Segwit 2X coin will have more value than Segwit 1x coin.;73az4n;https://twitter.com/rogerkver/status/913870930815807488
You’re looking for the OP’s link. Tell me what you’re having trouble understanding. ;1;1;False;locuester;dnpbqjh;I just bet 1,000 BTC (~$4M USD) that Segwit 2X coin will have more value than Segwit 1x coin.;73az4n;https://twitter.com/rogerkver/status/913870930815807488
"Most of the facts written there are not actual such as Blocks has been full and so on.
How can somebody manipulate the price? Are you serious? To manipulate the price you need to play with like at least 10M $ and against the world. No way. Don't just place some stupid facts. ";2;2;False;Ce_ne;dnpi8c3;I just bet 1,000 BTC (~$4M USD) that Segwit 2X coin will have more value than Segwit 1x coin.;73az4n;https://twitter.com/rogerkver/status/913870930815807488
[deleted];1;1;False;;dnpml6z;I just bet 1,000 BTC (~$4M USD) that Segwit 2X coin will have more value than Segwit 1x coin.;73az4n;https://twitter.com/rogerkver/status/913870930815807488
[deleted];1;1;False;;dnp5cpc;I just bet 1,000 BTC (~$4M USD) that Segwit 2X coin will have more value than Segwit 1x coin.;73az4n;https://twitter.com/rogerkver/status/913870930815807488
"You are referring to the most diverse group of developers building a cryptocurrency project in the world and which has been forked thousands of times. That's the opposite of centralization, and like it or not but your pet projects born of technical ignorance are part of that decentralization.

You want the bitcoin brand to get rich as you freely admit. There's nothing wrong with getting rich, i can respect that. The issue is bitcoin brand has up to this point been used to evangelize the previously nonexistent network property of decentralization and anti censorship. I expect to continue using it to that end, fuck your profit. I'm not interested in helping you exploit people by lending you our name so you can seem to be more decentralized than you are.";1;1;False;MrRGnome;dnphfg5;I just bet 1,000 BTC (~$4M USD) that Segwit 2X coin will have more value than Segwit 1x coin.;73az4n;https://twitter.com/rogerkver/status/913870930815807488
"<shakes head> 

> Why are you even here if you can’t understand the conversation on Twitter?

Because I'm HERE and not on twitter. 

> I can’t provide links that aren’t twitter. That’s where the conversation took place. 

So there is no way to provide a direct link to a twit that clarifies the terms of the bet? That is what I am looking for. A clarification where all parties clearly state what they believe the terms are.
";1;1;False;PilgramDouglas;dnpbo93;I just bet 1,000 BTC (~$4M USD) that Segwit 2X coin will have more value than Segwit 1x coin.;73az4n;https://twitter.com/rogerkver/status/913870930815807488
"Did you read the blog post by Mike Hearn? He laid it all out nearly 2 years ago.

As for the price, I suspect somebody is buying up enough BTC to keep the price stable/climbing slightly. No definite proof though (other than a lack of volatility relative to BCH).";3;1;False;phillipsjk;dnpi37h;I just bet 1,000 BTC (~$4M USD) that Segwit 2X coin will have more value than Segwit 1x coin.;73az4n;https://twitter.com/rogerkver/status/913870930815807488
"> I dont care how its called, there will only be one decentralized Bitcoin.

It will be called Bitcoin and have 2MB maximum base block weight.";1;0;False;awemany;dnpiz61;I just bet 1,000 BTC (~$4M USD) that Segwit 2X coin will have more value than Segwit 1x coin.;73az4n;https://twitter.com/rogerkver/status/913870930815807488
">  If S2X fails, crypto is dead for me anyways

> This is going to be the make-or-break battle of Bitcoin.

You know? I disagree here. When it was first announced, I wasn't at all sold on the idea of Bitcoin Cash, but as things have progressed I've increasingly realised it's the best insurance policy we could ever hope to have. If 2x fails, I'm pretty confident some big players will shift their weight towards it.

And crypto is far from dependent on bitcoin at this point. Ethereum has caught the business world's eye, and Monero will continue being a solid crypto with its feet well grounded on earth. And I said, BCC can more than sufficiently carry on with bitcoin's legacy for the needed uses of a public ledger.

";2;0;False;redlightsaber;dnpjlcx;I just bet 1,000 BTC (~$4M USD) that Segwit 2X coin will have more value than Segwit 1x coin.;73az4n;https://twitter.com/rogerkver/status/913870930815807488
ViaBTC, HitBTC and a few others had real trading in the first 1-3 days...;1;1;False;Inthewirelain;dnplpdn;I just bet 1,000 BTC (~$4M USD) that Segwit 2X coin will have more value than Segwit 1x coin.;73az4n;https://twitter.com/rogerkver/status/913870930815807488
As long as you are comfortable holding through the split and don’t need to sell in the short term you don’t need to worry about it or pick a side. You’ll own both coins in equal amounts.;2;1;False;how_now_dao;dnp4xq2;I just bet 1,000 BTC (~$4M USD) that Segwit 2X coin will have more value than Segwit 1x coin.;73az4n;https://twitter.com/rogerkver/status/913870930815807488
"> lol, so using bitcoins reference client doesn't get me the name bitcoin - but forking bitcoin gets you the name bitcoin? I don't think so. I could give a fuck about your PR campaign for users and your desire for branding.

LOL indeed. So Bitcoin is oh-so decentralized but has a *reference client* that just happens to be pointing to *your favorite, centralized github repo?*

**Read the damn whitepaper once more, man!**

Also: What do you want the Bitcoin brand for? The brand has value for me as it ensures a high coin price, *but as you don't seem to be interested in the greed aspect*, as you say above, and your variant of decentralization might even *work a lot better if you stay out of the limelight with you decentrocoin* you shouldn't and wouldn't mind, or would you?

:-)

EDIT: Fixed last sentence.";5;1;False;awemany;dnphbn5;I just bet 1,000 BTC (~$4M USD) that Segwit 2X coin will have more value than Segwit 1x coin.;73az4n;https://twitter.com/rogerkver/status/913870930815807488
"Why are you even here if you can’t understand the conversation on Twitter?

I can’t provide links that aren’t twitter. That’s where the conversation took place. ";3;1;False;locuester;dnpbcxa;I just bet 1,000 BTC (~$4M USD) that Segwit 2X coin will have more value than Segwit 1x coin.;73az4n;https://twitter.com/rogerkver/status/913870930815807488
yup, just sit back with your btc in your trezor and you'll be fine.;3;0;False;texasrob;dnp5zie;I just bet 1,000 BTC (~$4M USD) that Segwit 2X coin will have more value than Segwit 1x coin.;73az4n;https://twitter.com/rogerkver/status/913870930815807488
You won't lose either chain, there's a good chance one of them becomes worth nothing or next to nothing though. ;4;0;False;lechango;dnp6g6j;I just bet 1,000 BTC (~$4M USD) that Segwit 2X coin will have more value than Segwit 1x coin.;73az4n;https://twitter.com/rogerkver/status/913870930815807488
"You would get both coins like the bitcoin cash split.

To be extra safe just get your bitcoins on your trezor and do nothing else from now until after the split when there are blog posts and it's super clear for you how to move forward.

But yes to be clear the 100% safest way to deal w/ this split is to have your private keys on your personal trezor.";4;0;False;cgcardona;dnp8e86;I just bet 1,000 BTC (~$4M USD) that Segwit 2X coin will have more value than Segwit 1x coin.;73az4n;https://twitter.com/rogerkver/status/913870930815807488
"To be clear: for **all** BTC tokens to have a really low value, Bitcoin Cash will have taken over.

I strongly suspect that at least one BTC token will retain substantial value (for a time anyway). And that token will be Segwit 2x.
";7;0;False;phillipsjk;dnp5zv6;I just bet 1,000 BTC (~$4M USD) that Segwit 2X coin will have more value than Segwit 1x coin.;73az4n;https://twitter.com/rogerkver/status/913870930815807488
"Whatever. I need straightforward info on What is wrong with bitcoin?
I don't get it how come price moves up and still market prices Bitcoin most over 900 coins out there and yet, some people think something is wrong with Bitcoin. ";5;1;False;Ce_ne;dnphxw6;I just bet 1,000 BTC (~$4M USD) that Segwit 2X coin will have more value than Segwit 1x coin.;73az4n;https://twitter.com/rogerkver/status/913870930815807488
"I dont care how its called, there will only be one decentralized Bitcoin.

This sub just shills altcoins like Roger ;)";-1;1;False;eumartinez20;dnpito3;I just bet 1,000 BTC (~$4M USD) that Segwit 2X coin will have more value than Segwit 1x coin.;73az4n;https://twitter.com/rogerkver/status/913870930815807488
