body;score;nb_replies;stickied;author;id;post_title;post_id;post_link
Hence why reality will just catch up. Hard.;32;0;False;PsyRev_;dpqgub3;Back then I never would have imagined that fees would ever be allowed to rise above $0.20 - Vitalik Buterin on Bitcoin Fees;7ciwzu;https://twitter.com/VitalikButerin/status/929808874265341953
"We need to inform newcomers of the fact that Blockstream is bank funded and that r\bitcoin and bitcointalk are controlled media platforms. 

Please share this widely: https://www.reddit.com/r/CryptoCurrency/comments/7cdg79/each_side_accuses_the_other_of_being_centralized/";28;1;False;Lloydie1;dpqj15l;Back then I never would have imagined that fees would ever be allowed to rise above $0.20 - Vitalik Buterin on Bitcoin Fees;7ciwzu;https://twitter.com/VitalikButerin/status/929808874265341953
"If you've been in r/bitcoin since 2013 or earlier, you will see how r/bitcoin has changed overtime. The censorship became worse and worse. Instead of new ideas and open discussions, it was just all about price and how great bitcoin is. One can't even say the word Ethereum so people referred to it as ""the E word"". All posts AND comments were deleted unless it was something negative about Ethereum or any other alt. The sub just became a cheerleading sub. That was the nail in the coffin. I packed up and never looked back.";25;2;False;etherislife;dpqq47n;Back then I never would have imagined that fees would ever be allowed to rise above $0.20 - Vitalik Buterin on Bitcoin Fees;7ciwzu;https://twitter.com/VitalikButerin/status/929808874265341953
[deleted];-22;2;False;;dpqloq9;Back then I never would have imagined that fees would ever be allowed to rise above $0.20 - Vitalik Buterin on Bitcoin Fees;7ciwzu;https://twitter.com/VitalikButerin/status/929808874265341953
"You are confusing merchant adoption with merchant switching. There isn't nearly as much friction to changing to 100% api compatible but different node software than when trying to accept crypto for the first time.

And once bitpay or coinbase switches or add BCH support it will flow through automatically to all their merchants. Not nearly as hard as getting those merchants in the first place.";17;1;False;veroxii;dpqeeqc;Back then I never would have imagined that fees would ever be allowed to rise above $0.20 - Vitalik Buterin on Bitcoin Fees;7ciwzu;https://twitter.com/VitalikButerin/status/929808874265341953
Fuck Vitalik and Ethereum. That shit is as centralized as it gets, no better than Core/Blockstream. Vitalik engages in Theymos level censorship. Get your head out of your ass. ;-169;5;False;restorerofmorality;dpqk3fk;Back then I never would have imagined that fees would ever be allowed to rise above $0.20 - Vitalik Buterin on Bitcoin Fees;7ciwzu;https://twitter.com/VitalikButerin/status/929808874265341953
He is a clown supports censorship. ;-113;1;False;glauc0n;dpqharh;Back then I never would have imagined that fees would ever be allowed to rise above $0.20 - Vitalik Buterin on Bitcoin Fees;7ciwzu;https://twitter.com/VitalikButerin/status/929808874265341953
"This is BCH thread please do not mention BTC as to not to impede the evolution to a fluid economy 

Thanks, 
Management ";-68;1;False;teammysticCLE;dpqk7xr;Back then I never would have imagined that fees would ever be allowed to rise above $0.20 - Vitalik Buterin on Bitcoin Fees;7ciwzu;https://twitter.com/VitalikButerin/status/929808874265341953
I wouldn't have thought so ether.;30;1;False;fomosapien;dpqb97z;Back then I never would have imagined that fees would ever be allowed to rise above $0.20 - Vitalik Buterin on Bitcoin Fees;7ciwzu;https://twitter.com/VitalikButerin/status/929808874265341953
[deleted];5;1;False;;dpqn2ui;Back then I never would have imagined that fees would ever be allowed to rise above $0.20 - Vitalik Buterin on Bitcoin Fees;7ciwzu;https://twitter.com/VitalikButerin/status/929808874265341953
Not sure why the downvotes. Possibly because you mention game theory two too many times.;19;2;False;fomosapien;dpqbcgz;Back then I never would have imagined that fees would ever be allowed to rise above $0.20 - Vitalik Buterin on Bitcoin Fees;7ciwzu;https://twitter.com/VitalikButerin/status/929808874265341953
It’s so refreshing to come to a forum where people truly understand and accept what is coming. Thank you for speaking about it. ;15;1;False;BluBeast11;dpqfxmz;Back then I never would have imagined that fees would ever be allowed to rise above $0.20 - Vitalik Buterin on Bitcoin Fees;7ciwzu;https://twitter.com/VitalikButerin/status/929808874265341953
But fees on eth have gone above 0.20 usd, so his point is moot;-1;1;False;bitusher;dpr618m;Back then I never would have imagined that fees would ever be allowed to rise above $0.20 - Vitalik Buterin on Bitcoin Fees;7ciwzu;https://twitter.com/VitalikButerin/status/929808874265341953
Why doesn't this subreddit speak out about the scam that's known as CSW (which Vitalik has done)? It's sure nice to have double standards.;-19;4;False;Josephson247;dpqcr9c;Back then I never would have imagined that fees would ever be allowed to rise above $0.20 - Vitalik Buterin on Bitcoin Fees;7ciwzu;https://twitter.com/VitalikButerin/status/929808874265341953
Vitalik is a more and more a political clown. a pawn manipulated by people around him.;-5;0;False;Mordan;dpqze95;Back then I never would have imagined that fees would ever be allowed to rise above $0.20 - Vitalik Buterin on Bitcoin Fees;7ciwzu;https://twitter.com/VitalikButerin/status/929808874265341953
Dude is  so overrated.  I’d like to see him stop bitching about other coins and fix his own coin’s shitty transaction rate for once. ;-9;0;False;Impetusin;dpqskqj;Back then I never would have imagined that fees would ever be allowed to rise above $0.20 - Vitalik Buterin on Bitcoin Fees;7ciwzu;https://twitter.com/VitalikButerin/status/929808874265341953
"Or even 5 cents. The thing for the Cashening is, merchants and consumers (darknet, gamblers, VPN services, etc.) have to *run into problems doing the thing they need to do* in order for them to consider switching. The guy buying his weed needs to think, ""Man, is it really gonna take a $20 fee for this $200 order? Well I can try $5 and wait til tomorrow. And heck even $20 is fine I guess, could just order more at a time. Not like I have a choice, and maybe this is only temporary.""   That's four ways he can adjust and not be concerned enough to figure out what BCH is. Some vendors will probably now be thinking about how the fees are cutting into their bottom line, but maybe they are making enough anyway. Gamblers? OK, fees are a big problem on a platform like SatoshiDice, but on  centralized site where you fund all at once, a $20 one-time fee isn't that painful. At least not enough to switch. The site might consider switching, but they're making bank and so the inertia can be heavy. Everyday merchants? Maybe, but bootstrapping a network effect is hard, and almost no one can be using BTC to pay for things so they probably aren't feeling optimistic. 

We have to re-inspire all those services like VPNs and porn sites and marketplaces. The price rise helps BCH be taken seriously, but it must be followed by massive action on getting the economy going or it won't last. High fees on BTC killed so much; it won't just automatically come back just because fees are low on BCH. And fees can still go higher on BTC while people just deal with it in a lot of the commerce situations, since many are not that fee-sensitive. I think the point where it just becomes impossible is $50 fees.";24;1;False;ForkiusMaximus;dpqbnj4;Back then I never would have imagined that fees would ever be allowed to rise above $0.20 - Vitalik Buterin on Bitcoin Fees;7ciwzu;https://twitter.com/VitalikButerin/status/929808874265341953
When you begin to see someone like Vitalik speak on the condition of Bitcoin you know the truth has triumphed.;78;1;False;CPlusConcepts;dpq8cmi;Back then I never would have imagined that fees would ever be allowed to rise above $0.20 - Vitalik Buterin on Bitcoin Fees;7ciwzu;https://twitter.com/VitalikButerin/status/929808874265341953
"Vitalik is a professional and and a gentleman. He has always tried to be diplomatic and just busied himself with his own project. 

And yet even he can't hide how he feels about BTC devs anymore. ";135;3;False;aryonoco;dpq9sfe;Back then I never would have imagined that fees would ever be allowed to rise above $0.20 - Vitalik Buterin on Bitcoin Fees;7ciwzu;https://twitter.com/VitalikButerin/status/929808874265341953
I wouldn't have thought so either. But...here we are. ;31;1;False;bluethunder1985;dpq88ay;Back then I never would have imagined that fees would ever be allowed to rise above $0.20 - Vitalik Buterin on Bitcoin Fees;7ciwzu;https://twitter.com/VitalikButerin/status/929808874265341953
I moved some BCH today... paid half a cent fee.;14;1;False;kaczan3;dpqddqu;Back then I never would have imagined that fees would ever be allowed to rise above $0.20 - Vitalik Buterin on Bitcoin Fees;7ciwzu;https://twitter.com/VitalikButerin/status/929808874265341953
"Even smartest people don't look deep enough into game theory. I was absolutely sure that Bitcoin Cash will overtake the network since August 1st, but I didn't foresee that wealth transfer can occur that fast 

It's a very valuable lesson of game theory, the **exact same thing** is going to happen with fiat/crypto in coming years or a couple of decades max. Total calmness, some news, some actions, total panic (in the first time of history across the globe, everywhere), fires and wars. Prepare

Edit: Cyprus crisis and Bitcoin's price uprising back then was a smallest glimpse at things to come";38;4;False;LexGrom;dpqalgp;Back then I never would have imagined that fees would ever be allowed to rise above $0.20 - Vitalik Buterin on Bitcoin Fees;7ciwzu;https://twitter.com/VitalikButerin/status/929808874265341953
"> this willingness to compromise protocol immutability to achieve a desired outcome in a particular application (hmm, sound familiar?)

Can anyone enlighten me what he meant by this parenthetical, with regard to OP_RETURN?";11;4;False;sou-ght;dpq8b02;Back then I never would have imagined that fees would ever be allowed to rise above $0.20 - Vitalik Buterin on Bitcoin Fees;7ciwzu;https://twitter.com/VitalikButerin/status/929808874265341953
Today I wanted to donate to a site that only accepts BTC, and the fees scared me away from doing so.;10;2;False;;dpqi6ia;Back then I never would have imagined that fees would ever be allowed to rise above $0.20 - Vitalik Buterin on Bitcoin Fees;7ciwzu;https://twitter.com/VitalikButerin/status/929808874265341953
All of these top comments are trying to push bitcoin cash so hard. ;6;0;False;Jetemple;dpqqdbp;Back then I never would have imagined that fees would ever be allowed to rise above $0.20 - Vitalik Buterin on Bitcoin Fees;7ciwzu;https://twitter.com/VitalikButerin/status/929808874265341953
As someone who is a believer in Ethereum, holy shit you guys are pretty fucking level headed. Can someone explain why it’s actually pretty ok on this subreddit but over on /r/bitcoin they are incredibly defensive?;4;0;False;AMBsFather;dpr349c;Back then I never would have imagined that fees would ever be allowed to rise above $0.20 - Vitalik Buterin on Bitcoin Fees;7ciwzu;https://twitter.com/VitalikButerin/status/929808874265341953
"I've never received or sold BCH, could someone tell me how much BCH takes in fees.

";7;1;False;Nemya_Nation;dpqdyld;Back then I never would have imagined that fees would ever be allowed to rise above $0.20 - Vitalik Buterin on Bitcoin Fees;7ciwzu;https://twitter.com/VitalikButerin/status/929808874265341953
I had one of my comments removed from r/bitcoin today. This is not my original account, but I have been a contributor there for over 4 years. The mistake I made was describing $5-$10 fees as a failure.;2;0;False;RedSyringe;dpqylwi;Back then I never would have imagined that fees would ever be allowed to rise above $0.20 - Vitalik Buterin on Bitcoin Fees;7ciwzu;https://twitter.com/VitalikButerin/status/929808874265341953
Public blockchains without fees are a scam;2;0;False;;dpqzf8l;Back then I never would have imagined that fees would ever be allowed to rise above $0.20 - Vitalik Buterin on Bitcoin Fees;7ciwzu;https://twitter.com/VitalikButerin/status/929808874265341953
Brave, he could have kept his mouth shut and avoid a ton of criticism and attacks he is going to get.;2;0;False;void_magic;dpqj8pa;Back then I never would have imagined that fees would ever be allowed to rise above $0.20 - Vitalik Buterin on Bitcoin Fees;7ciwzu;https://twitter.com/VitalikButerin/status/929808874265341953
Vitalik says some good things but beware of attempts to lionize him, he's not in the camp.;1;0;False;satoshiscrazyuncle;dpqx6dl;Back then I never would have imagined that fees would ever be allowed to rise above $0.20 - Vitalik Buterin on Bitcoin Fees;7ciwzu;https://twitter.com/VitalikButerin/status/929808874265341953
This is so funny.  Don’t you think Vitalik has a reason to see the real Bitcoin fall.  Enough with this fake Bitcoin, Bitcoin Cash bull.  It’s already tanking.  You better hope you can sell your Bitcoin cash before it tanks too far.  Seems like this plan has tied things up.  Hopefully people didn’t buy in past $1000 because your in for a long ride down and if you can’t sell it, your stuck.;-4;1;False;WinthorpStrange;dpqnc9e;Back then I never would have imagined that fees would ever be allowed to rise above $0.20 - Vitalik Buterin on Bitcoin Fees;7ciwzu;https://twitter.com/VitalikButerin/status/929808874265341953
I wonder how much Vitalik has invested in Bitcoin?;0;0;False;myluxurybed;dpqoux0;Back then I never would have imagined that fees would ever be allowed to rise above $0.20 - Vitalik Buterin on Bitcoin Fees;7ciwzu;https://twitter.com/VitalikButerin/status/929808874265341953
Just imagine Eth's usecase built into Bitcoin proper.;10;1;False;chalbersma;dpqeryq;Back then I never would have imagined that fees would ever be allowed to rise above $0.20 - Vitalik Buterin on Bitcoin Fees;7ciwzu;https://twitter.com/VitalikButerin/status/929808874265341953
Can you please explain game theory to me in this context? I am unfamiliar with it. :/;4;1;False;RedSyringe;dpqyn82;Back then I never would have imagined that fees would ever be allowed to rise above $0.20 - Vitalik Buterin on Bitcoin Fees;7ciwzu;https://twitter.com/VitalikButerin/status/929808874265341953
Don't get it, what do you think is going to happen with fiat/crypto?;4;1;False;thomask02;dpqfvwq;Back then I never would have imagined that fees would ever be allowed to rise above $0.20 - Vitalik Buterin on Bitcoin Fees;7ciwzu;https://twitter.com/VitalikButerin/status/929808874265341953
There were lots of developers using OP_RETURN to build projects on top of the Bitcoin blockchain (e.g. colored coins). But the Core devs didn't like this, so they essentially rendered it useless by reducing it's size by 50%, driving tons of developers away (including Vitalik when he was starting his project);17;1;False;ExtendsPrimate;dpqawph;Back then I never would have imagined that fees would ever be allowed to rise above $0.20 - Vitalik Buterin on Bitcoin Fees;7ciwzu;https://twitter.com/VitalikButerin/status/929808874265341953
Exactly.  All technical discussion aside, if there are two sides to an argument and one side won't even let me hear the opposing viewpoint, I can be 99% sure that their side is wrong.  Because any decent argument should be able to withstand knowledge of its opposing viewpoint.;4;0;False;cinnapear;dprerzi;Back then I never would have imagined that fees would ever be allowed to rise above $0.20 - Vitalik Buterin on Bitcoin Fees;7ciwzu;https://twitter.com/VitalikButerin/status/929808874265341953
"Strange thing about fees is: They are socially unjust ... 10$ fee is nothing for a 10.000$ transaction, but a lot for a 100$ transaction, so it hits the poor. And in my view, it hits also the population of the poor countries (90%) on our earth. They could need bitcoin more than us, they fight against currencies with high inflation rates ... 
... I really don't think, that was the vision of satoshi.";4;0;False;meta96;dprkctz;Back then I never would have imagined that fees would ever be allowed to rise above $0.20 - Vitalik Buterin on Bitcoin Fees;7ciwzu;https://twitter.com/VitalikButerin/status/929808874265341953
"That is true, but it's still a jump that they have to go through several stages of awareness to reach, which may put a natural limit on the speed of the Cashening. At least it may not happen as fast as yesterday's meteoric rise suggested.

Linchpins like Bitpay and Coinbase are of course key for getting a whole bunch of people on board, but there may be a bit of a chicken or egg problem there, too. Are any of their merchants pushing for them to adopt BCH? At least one big headline use, like overstock.com / newegg.com or a major darknet market or popular domain registrar / VPN or a big gambling site may be necessary to have so that people can at least point to something to spend the ""magic internet tokens"" on.";5;1;False;ForkiusMaximus;dpqpxjc;Back then I never would have imagined that fees would ever be allowed to rise above $0.20 - Vitalik Buterin on Bitcoin Fees;7ciwzu;https://twitter.com/VitalikButerin/status/929808874265341953
No, they are less than a penny.;4;1;False;fishnbits;dprdhlv;Back then I never would have imagined that fees would ever be allowed to rise above $0.20 - Vitalik Buterin on Bitcoin Fees;7ciwzu;https://twitter.com/VitalikButerin/status/929808874265341953
Take a nap, let the adults in the room talk. ;66;2;False;;dpql8h7;Back then I never would have imagined that fees would ever be allowed to rise above $0.20 - Vitalik Buterin on Bitcoin Fees;7ciwzu;https://twitter.com/VitalikButerin/status/929808874265341953
Could you elaborate on that;9;1;False;alisj99;dpql6x6;Back then I never would have imagined that fees would ever be allowed to rise above $0.20 - Vitalik Buterin on Bitcoin Fees;7ciwzu;https://twitter.com/VitalikButerin/status/929808874265341953
Interesting, can you provide proof to back up your arguments?;1;0;False;konrad-iturbe;dpqszij;Back then I never would have imagined that fees would ever be allowed to rise above $0.20 - Vitalik Buterin on Bitcoin Fees;7ciwzu;https://twitter.com/VitalikButerin/status/929808874265341953
Gentlemen, save your energy. Ignore this fucktard. Don’t give him the reply he craves. Call him a fucktard and ignore everything he says. That’s how you deal w trolls. ;-3;0;False;btcnp;dpqol00;Back then I never would have imagined that fees would ever be allowed to rise above $0.20 - Vitalik Buterin on Bitcoin Fees;7ciwzu;https://twitter.com/VitalikButerin/status/929808874265341953
No, please stop punching your one nut.;-1;0;False;tazmanrising;dpqrtz2;Back then I never would have imagined that fees would ever be allowed to rise above $0.20 - Vitalik Buterin on Bitcoin Fees;7ciwzu;https://twitter.com/VitalikButerin/status/929808874265341953
[deleted];-18;2;False;;dpqpdzb;Back then I never would have imagined that fees would ever be allowed to rise above $0.20 - Vitalik Buterin on Bitcoin Fees;7ciwzu;https://twitter.com/VitalikButerin/status/929808874265341953
But, why sound like a retarded person? Why not Learn: satoshi.nakamotoinstitute.org and then have knowledge based on fact?;12;0;False;zcc0nonA;dpqmxck;Back then I never would have imagined that fees would ever be allowed to rise above $0.20 - Vitalik Buterin on Bitcoin Fees;7ciwzu;https://twitter.com/VitalikButerin/status/929808874265341953
But;2;0;False;threesixzero;dpql2oe;Back then I never would have imagined that fees would ever be allowed to rise above $0.20 - Vitalik Buterin on Bitcoin Fees;7ciwzu;https://twitter.com/VitalikButerin/status/929808874265341953
[deleted];3;1;False;;dpqtd6e;Back then I never would have imagined that fees would ever be allowed to rise above $0.20 - Vitalik Buterin on Bitcoin Fees;7ciwzu;https://twitter.com/VitalikButerin/status/929808874265341953
People don't want to believe that open blockchains will bring not only freedom, but also death. Absolutely refuse to believe;12;0;False;LexGrom;dpqbi1q;Back then I never would have imagined that fees would ever be allowed to rise above $0.20 - Vitalik Buterin on Bitcoin Fees;7ciwzu;https://twitter.com/VitalikButerin/status/929808874265341953
And it's misuse;9;1;False;BA834024112;dpqho92;Back then I never would have imagined that fees would ever be allowed to rise above $0.20 - Vitalik Buterin on Bitcoin Fees;7ciwzu;https://twitter.com/VitalikButerin/status/929808874265341953
Taboo topic. Fear of death is the greatest of all;10;1;False;LexGrom;dpqg1n8;Back then I never would have imagined that fees would ever be allowed to rise above $0.20 - Vitalik Buterin on Bitcoin Fees;7ciwzu;https://twitter.com/VitalikButerin/status/929808874265341953
Wealth transfer after tipping point, end of total taxation. Chaos, poverty and death. Think about it carefully;5;2;False;LexGrom;dpqg6ma;Back then I never would have imagined that fees would ever be allowed to rise above $0.20 - Vitalik Buterin on Bitcoin Fees;7ciwzu;https://twitter.com/VitalikButerin/status/929808874265341953
They are becoming comparable to JP Morgan and Fox News.  The level of censorship is astonishing.  There will be a few flips of price and hash power between BTC and BCH it looks like.  Problem for BTC is if BCH holds majority hash power and price get closing to flipping BCH > BTC there is no coming back for BTC.  BCH is chomping at the bit(coin) and once it succeeds it is game over.  The reasons BTC is failing will not be the same for BCH once it reigns.;6;0;False;laminatedjesus;dpr210g;Back then I never would have imagined that fees would ever be allowed to rise above $0.20 - Vitalik Buterin on Bitcoin Fees;7ciwzu;https://twitter.com/VitalikButerin/status/929808874265341953
Looking in the mirror again huh;9;0;False;speedyarrow415;dpqnd8p;Back then I never would have imagined that fees would ever be allowed to rise above $0.20 - Vitalik Buterin on Bitcoin Fees;7ciwzu;https://twitter.com/VitalikButerin/status/929808874265341953
quality contribution you've got there;9;0;False;zcc0nonA;dpqmyd1;Back then I never would have imagined that fees would ever be allowed to rise above $0.20 - Vitalik Buterin on Bitcoin Fees;7ciwzu;https://twitter.com/VitalikButerin/status/929808874265341953
Because I don't give a shit, and it doesn't affect me in the least;2;0;False;BA834024112;dpqhwip;Back then I never would have imagined that fees would ever be allowed to rise above $0.20 - Vitalik Buterin on Bitcoin Fees;7ciwzu;https://twitter.com/VitalikButerin/status/929808874265341953
"OP_RETURN is an opcode(Think of it as part of a computer language or machine language instruction on the operation it should perform)

This is a good explanation of [what happened](https://bitcoin.stackexchange.com/questions/29554/explanation-of-what-an-op-return-transaction-looks-like)";14;1;False;mcfrankline;dpq8sy6;Back then I never would have imagined that fees would ever be allowed to rise above $0.20 - Vitalik Buterin on Bitcoin Fees;7ciwzu;https://twitter.com/VitalikButerin/status/929808874265341953
OP Return empowered decentralized censorship resistant apps, but Core called this extra data storage “spam” and shut it down.  Txn’s could only contain one OP return op code.  Many nodes also would prune the data.;8;0;False;byrokowu;dpqc2wm;Back then I never would have imagined that fees would ever be allowed to rise above $0.20 - Vitalik Buterin on Bitcoin Fees;7ciwzu;https://twitter.com/VitalikButerin/status/929808874265341953
Newcomers should know about The DAO shitstorm. Ethereum is many things, but isn't sound money;-16;1;False;LexGrom;dpqattx;Back then I never would have imagined that fees would ever be allowed to rise above $0.20 - Vitalik Buterin on Bitcoin Fees;7ciwzu;https://twitter.com/VitalikButerin/status/929808874265341953
This kills the coin.;10;0;False;xcalibre;dpqkoq4;Back then I never would have imagined that fees would ever be allowed to rise above $0.20 - Vitalik Buterin on Bitcoin Fees;7ciwzu;https://twitter.com/VitalikButerin/status/929808874265341953
[deleted];2;1;False;;dpqv47f;Back then I never would have imagined that fees would ever be allowed to rise above $0.20 - Vitalik Buterin on Bitcoin Fees;7ciwzu;https://twitter.com/VitalikButerin/status/929808874265341953
0.001 usd mostly.;8;1;False;olitox420;dpqf19m;Back then I never would have imagined that fees would ever be allowed to rise above $0.20 - Vitalik Buterin on Bitcoin Fees;7ciwzu;https://twitter.com/VitalikButerin/status/929808874265341953
I can’t believe it went up to like 2200 or whatever ;1;0;False;brandonkiel;dpr7sq1;Back then I never would have imagined that fees would ever be allowed to rise above $0.20 - Vitalik Buterin on Bitcoin Fees;7ciwzu;https://twitter.com/VitalikButerin/status/929808874265341953
You're welcome to speak out about it yourself... I haven't heard of it.;5;0;False;hedgepigdaniel;dpqdsds;Back then I never would have imagined that fees would ever be allowed to rise above $0.20 - Vitalik Buterin on Bitcoin Fees;7ciwzu;https://twitter.com/VitalikButerin/status/929808874265341953
"People do talk about him negatively, all the time. Just look at this guy:

[link](https://www.reddit.com/user/Contrarian__/submitted/)

Notice how his top critical post was gilded twice in r-btc? Craig has many critics and supporters alike. The difference is here, you can actually discuss things.

edit: minor";3;0;False;;dpqkg7n;Back then I never would have imagined that fees would ever be allowed to rise above $0.20 - Vitalik Buterin on Bitcoin Fees;7ciwzu;https://twitter.com/VitalikButerin/status/929808874265341953
