body;score;nb_replies;stickied;author;id;post_title;post_id;post_link
Man if they lock in segwit2x and refuse to go through with the hf I would leave bitcoin so fast. Who wants to be in an asset so easily sabotaged by people's egos?;57;5;False;MeetMeInSwolehalla;dkkckb2;Miners right now.;6oty7x;http://i.gifntext.com/XONq3rINt7.gif
Exactly;5;0;False;Erumara;dkkvpq1;Miners right now.;6oty7x;http://i.gifntext.com/XONq3rINt7.gif
Some are, some aren't. the question is, are enough miners committed enough to push through a HF if push comes to shove? What we've seen from before makes me skeptical.;10;1;False;Richy_T;dkkosyz;Miners right now.;6oty7x;http://i.gifntext.com/XONq3rINt7.gif
Good bot;3;1;False;Dzuelu;dkkp8mu;Miners right now.;6oty7x;http://i.gifntext.com/XONq3rINt7.gif
"> PoW miners are not servants

Bitcoin buyers have money.
Miners provider service for that money.

Therefore It's clear who here is the servant.

A capricious servant that wanted to get more money out of it, with shady patents and ASICBOOST. But that is fnished now, thank God.
";1;1;False;metalzip;dkkfn0j;Miners right now.;6oty7x;http://i.gifntext.com/XONq3rINt7.gif
">> pow miners ARE servants
>
>PoW miners are not servants, they are the *superanus* of the Bitcoin network! If not even that is clear to you, what the heck are you doing here? 

indeed i don't even know what a *superanus* is. I am sorry if my presence here insults you - but I don't even understand what you want to tell me with your anwer. maybe it is my bad English.";2;1;False;Amichateur;dkkeg3a;Miners right now.;6oty7x;http://i.gifntext.com/XONq3rINt7.gif
[deleted];7;1;False;;dkkaxtc;Miners right now.;6oty7x;http://i.gifntext.com/XONq3rINt7.gif
I think the fact they exist is compromising enough.  The fact that they are patented is a direct threat to miner decentralization.  I don't know how one would prove if they are or are not being used, but that is a moot point when the goal is to have a trustless decentralized currency.  A patent on a edge within the context of the mining community is an antithesis.;2;0;False;tabzer123;dkko4m0;Miners right now.;6oty7x;http://i.gifntext.com/XONq3rINt7.gif
"How is it proof?

Maybe the argument was proving to go nowhere, and the resisting parties decided segwitx2 was a good way to save face.  (Isn't BitcoinABC going to be a non-segwit chain that Jihan is spearheading?)

Or maybe the community resolved its differences because nobody wants to see Jon eat his dick.";3;1;False;tabzer123;dkkd4u7;Miners right now.;6oty7x;http://i.gifntext.com/XONq3rINt7.gif
"> lays out.
> It is really unclear why the miners, in favor of 2x and not really wanting segwit that much, decided to go for segwit2x instead of just letting a uasf split happen and competing for main chain dominance, then implementing hard fork in reasonable time frame with buy in from both users and economic power houses. You can always hard fork.

Or it proves that miners realised SegWit was happening no matter what so activated anyway to avoid UASF humiliation and chain split.";2;0;False;johnhardy-seebitcoin;dkkdedk;Miners right now.;6oty7x;http://i.gifntext.com/XONq3rINt7.gif
But the ASICs themselves are also patented, no?;2;1;False;theantnest;dkkl59s;Miners right now.;6oty7x;http://i.gifntext.com/XONq3rINt7.gif
148 and 2x are compatible until maybe the hard fork in about 3 months, the hard fork might not happen (I dont think it will) or, less likely, core might release a compatible implementation;2;0;False;paid-shill-;dkklsd6;Miners right now.;6oty7x;http://i.gifntext.com/XONq3rINt7.gif
"Running Bitcoin ABC you will be on the Bitcoin cash chain.

You run Bitcoin segwit2x you will be on the segwit2x chain.

BTW I think it is a good idea to wait for the storm to pass before doing anything.

For the record compromise has been for close to two years to avoid lead to a currency split.

Now a split is unavoidable, but the only people responsible are core dev team, blockstream, to force Bitcoin into a very diferent thing.

Mainstream adoption has likely been delayed for years by this mess...";6;0;False;Ant-n;dkkl9b8;Miners right now.;6oty7x;http://i.gifntext.com/XONq3rINt7.gif
It costs more to store and validate the blockchain.;4;1;False;loveforyouandme;dkkwtrj;Miners right now.;6oty7x;http://i.gifntext.com/XONq3rINt7.gif
Which is exceedingly likely when they renege on the 2x part or as soon as they hit blockspace capacity and LNs aren't ready still. ;3;1;False;phro;dkkoifv;Miners right now.;6oty7x;http://i.gifntext.com/XONq3rINt7.gif
"If it was made by Core, or some other more competent developers, I would support it.

Otherwise, anyone can fork Bitcoin at any time. I cannot,  and won't do anything about it. ";-6;1;False;TightTightTightYea;dkkv7nb;Miners right now.;6oty7x;http://i.gifntext.com/XONq3rINt7.gif
No, you underestimate the betrayal and anger the majority EC miners will have if the minority SW miners defect back to core. Hell, you underestimate the anger big blockists and the major economic nodes will have. You have no clue what drives bitcoin. ;6;1;False;H0dl;dkkvrbg;Miners right now.;6oty7x;http://i.gifntext.com/XONq3rINt7.gif
Just following closely the debate, what's been said, and the actions. ;3;0;False;H0dl;dkkllyh;Miners right now.;6oty7x;http://i.gifntext.com/XONq3rINt7.gif
What's the downside to a block size increase?;4;2;False;StarCyst;dkkswd8;Miners right now.;6oty7x;http://i.gifntext.com/XONq3rINt7.gif
We have to change that belief that core are the only experts.  and we will.;13;1;False;jonald_fyookball;dkkjesx;Miners right now.;6oty7x;http://i.gifntext.com/XONq3rINt7.gif
My take on sw2x is that they're done listening to core;20;1;False;H0dl;dkkea33;Miners right now.;6oty7x;http://i.gifntext.com/XONq3rINt7.gif
"Thank you the\_zukk for voting on anti-gif-bot.  

This bot wants to find the best and worst bots on Reddit. [You can view results here](https://secure-dawn-77807.herokuapp.com/).";0;1;False;GoodBot_BadBot;dkkbb2m;Miners right now.;6oty7x;http://i.gifntext.com/XONq3rINt7.gif
"I would say that it's just a *theory* that remains unproven, not a *fact* that is ""not true.""

Asicboost very will could have played a big role in the resistance to SegWit, but we'll just never know one way or the other without something like a whistleblower or death-bed confession.";1;0;False;paleh0rse;dkkpxu0;Miners right now.;6oty7x;http://i.gifntext.com/XONq3rINt7.gif
"> pow miners ARE servants

PoW miners are not servants, they are the *superanus* of the Bitcoin network! If not even that is clear to you, what the heck are you doing here?";4;3;False;dcrninja;dkk9vca;Miners right now.;6oty7x;http://i.gifntext.com/XONq3rINt7.gif
"> pow miners ARE servants (except that they get paid for their service of course).

If you had meant an unpaid ""servant"", slave would have been the best word to use.

They are more specifically like security guards than anything else. They make difficult certain kinds of attacks.
";4;0;False;PlayerDeus;dkkezgm;Miners right now.;6oty7x;http://i.gifntext.com/XONq3rINt7.gif
Yes. The comment points out how baseless the asicboost accusations and smoke screens have been from the beginning. ;1;1;False;physalisx;dkklv8d;Miners right now.;6oty7x;http://i.gifntext.com/XONq3rINt7.gif
Yes. That's the point. 95% miner support for segwit2x proofs that ASICBOOST as reason miners didn't was segwit was a stupid PR stunt. Miners didn't want segwit because they realized segwit/Core means stagnation and central planning by bad central planners.;12;2;False;saddit42;dkkcuqj;Miners right now.;6oty7x;http://i.gifntext.com/XONq3rINt7.gif
"If you think Nakamoto consensus is about compromise you're doing it wrong. Everybody has their own vision for Bitcoin, they do their best to advocate their position, and consensus around it happens or it doesn't.

If you're upset about a lack of compromise, that's because you didn't win over enough people to your position.

If you still believe in your position, advocate it. If you believe you didn't win because a privately moderated community was censored towards an agenda, then Bitcoin is a failed experiment and you should hard fork or go to another project. But don't sit around complaining you've been cheated. If you can't handle the heat, get out of the kitchen.";10;1;False;johnhardy-seebitcoin;dkkdbdf;Miners right now.;6oty7x;http://i.gifntext.com/XONq3rINt7.gif
"You are the one that has no clue what drives Bitcoin.

Bitcoin is not miners, which are fiat whores because they dump for fiat and don't keep it in BTC.

Bitcoin is not exchanges, which are fiat whores because they dump fiat and don't keep it in BTC.

Bitcoin is not any of these clowns trying to hardfork into their subpar software.

All these corporations aren't Bitcoin.

Bitcoin is the holders, and the big, big 2009-2011 whales are ALL against a retarded rushed hardfork into JarzikCoin. You can bitch and moan all you want. If these idiots dare to hardfork, and you sell your legacy coins for JarzikCoins, enjoy lossing your BTC as billions worth are dumped into the fake Bitcoin forked chain. All you'll have is a shitty crashing altcoin.

You dumb fucks are going to get humiliated once again until you learn the lesson.";-8;1;False;BitcoinSlayer;dkkzghi;Miners right now.;6oty7x;http://i.gifntext.com/XONq3rINt7.gif
"Lol, this pedantic viewpoint from a typical small blocker, I'm sure. All the concepts you're going on about came from the big block camp. 

I got news for you, Satoshi's original vision is being played out before your very eyes, you just can't see it. Buckle up dude. ";2;1;False;H0dl;dkkdkm7;Miners right now.;6oty7x;http://i.gifntext.com/XONq3rINt7.gif
"basically, its a way to do the same thing (so you'd get the same as other miners mining), but at less energy cost (roughly 20% apparently).

in normal circumstances this would be called an 'upgrade' and would be rolled out en masse as more miners figure it out

and keep in mind Antpool are the only ones selling to the public, so this would have been beneficial to the masses, its just that the private (pool) miners wouldn't (eventually, if they didn't copy the technique) be able to compete with the public who were buying off antpool).

yet the narrative (from the usual culprits) has been ""asicboost bad, antpool evil, no asicboost, must be destroyed!""
";5;0;False;timetraveller57;dkkqonu;Miners right now.;6oty7x;http://i.gifntext.com/XONq3rINt7.gif
">It's a lot more ridiculous to assert that it's never been used.

No, if you claim that a high class actor in the bitcoin space is outright lying about what he's doing, while constantly personally attacking his character, you should maybe have even the slightest shred of proof. This ""coulda woulda"" stuff doesn't really count, you know? Just because you can make up a scenario where someone was evil, doesn't make any such accusation *not baseless*. 

And now that it's been basically proven that it was baseless, instead of taking a step back and looking at how fucking shitty you were behaving, you do what you're doing right now. ";1;1;False;physalisx;dkkoxqq;Miners right now.;6oty7x;http://i.gifntext.com/XONq3rINt7.gif
"Absolutely, and I didn't say it shouldn't be fixed. It definitely either should be fixed or be public domain so that everyone can use it (something which bitmain has offered in the past btw). It is basically being fixed now by segwit, so that doesn't really matter anymore. 

Anyway, this is about the accusations about segwit being hindered by miners *because of asicboost*, which were evidently not true. It is, and has always been, about wanting a blocksize increase / on-chain scaling. The miners were never dishonest about that, while the other side was busy slinging shit at them. ";1;1;False;physalisx;dkkpqj6;Miners right now.;6oty7x;http://i.gifntext.com/XONq3rINt7.gif
">Again you are wrong. One entity had more than 50% of the mining power for quite a long time in the not so distant past. And the miners **are** the souverains as per Satoshi Nakamoto's whitepaper. Seriously, learn the facts about Bitcoin and don't project your snowflake ideology into it. It is **not** a PoS coin. Just because you hold some satoshis it won't give you any say/vote. PoW miners decide. 

you misunderstood the whitepaper and satoshi.

if miners change the consens algorithm, even with > 50% hash power, and then only few pay any (fiat) money for their newly mined coins, then they can close their business.

**miners do a servive to those buying their coins**. that's their business. nothing more. all the rest is miner wishfull thinking or ideology, get real and wake up!";1;0;False;Amichateur;dkkjl7v;Miners right now.;6oty7x;http://i.gifntext.com/XONq3rINt7.gif
"Defensive way of claiming something is baseless.  Money, research, and an offensive effort went into securing it.  It's a lot more ridiculous to assert that it's never been used.  The only thing that remotely baseless is your attitude to what I have said.

ASICBOOST, being used, currently, or not, is a percieved threat regardless.  ";1;1;False;tabzer123;dkknl7h;Miners right now.;6oty7x;http://i.gifntext.com/XONq3rINt7.gif
">And who uses it? No one.

There is no way to know whether or not a miner is actually using **covert** Asicboost -- it still remains undetectable through external observation.

From a security perspective, the decision to patch such a vulnerability is made regardless of ""proof of exploit.""

If someone is using it, fine, it gets patched and the threat is neutralized.

If nobody is using it, fine, it still gets patched and the *potential* threat is neutralized.";2;1;False;paleh0rse;dkkor40;Miners right now.;6oty7x;http://i.gifntext.com/XONq3rINt7.gif
Oh.  Well, I never believed that was the claim.  I'm more familiar with the claim that asicboost preservation as being a motivation for Jihan to push BU.  My opinion is that a huge group stayed on old-core (neutral) as segwit-bloc vs Jihan groupies occurred.;1;0;False;tabzer123;dkke847;Miners right now.;6oty7x;http://i.gifntext.com/XONq3rINt7.gif
Well, not according to the software developer majority and user majority.;1;0;False;kattbilder;dkktfsp;Miners right now.;6oty7x;http://i.gifntext.com/XONq3rINt7.gif
"No, the price dumped over three years while the inflation in fact decreased due to the ""halving"" of the block rewards. I know for a fact that Chinese miners sold as little as possible and kept most coins during that time.
Also you have a very wrong view of what contributes to the supply on the exchanges. It is basically 100% old coins, which are traded over and over, **not** freshly mined coins. We had 24h volumes of 6,000 kBTC on the three largest Chinese exchanges before the PBoC ordered that exchanges must charge trading fees. I hope you understand these 6,000 kBTC were not mined within 24h and are not even distinct coins (far from it). It's the same set of maybe 10 kBTC coins sold/bought thousands of times a day.";1;0;False;dcrninja;dkkhoi9;Miners right now.;6oty7x;http://i.gifntext.com/XONq3rINt7.gif
Again you are wrong. One entity had more than 50% of the mining power for quite a long time in the not so distant past. And the miners **are** the souverains as per Satoshi Nakamoto's whitepaper. Seriously, learn the facts about Bitcoin and don't project your snowflake ideology into it. It is **not** a PoS coin. Just because you hold some satoshis it won't give you any say/vote. PoW miners decide.;1;1;False;dcrninja;dkkigza;Miners right now.;6oty7x;http://i.gifntext.com/XONq3rINt7.gif
"And who uses it? No one. 

The only perceived ""threat"" was under the baseless accusation that bitmain was lying when they said, as they always have, that they aren't using asicboost. ";2;2;False;physalisx;dkkm4um;Miners right now.;6oty7x;http://i.gifntext.com/XONq3rINt7.gif
I know. I just doubt that this is the reason for many miners to not adopt segwit. Miners are deeply invested in bitcoins long term success due to the value of their ASICs. I'd have done the same as the miners did. Regardless of ASICBOOST.;3;1;False;saddit42;dkke17g;Miners right now.;6oty7x;http://i.gifntext.com/XONq3rINt7.gif
"3 things that didn't need 'fixing'

and the game ain't over yet ;)";2;1;False;timetraveller57;dkkqezl;Miners right now.;6oty7x;http://i.gifntext.com/XONq3rINt7.gif
Yes let's just move on and be one bitcoin community again. Maybe one with 2 coins but a little competition might be what was needed.;3;0;False;saddit42;dkke348;Miners right now.;6oty7x;http://i.gifntext.com/XONq3rINt7.gif
">I'm in favour of a hard fork block size increase by the way.

Yay! ";1;0;False;H0dl;dkkh5in;Miners right now.;6oty7x;http://i.gifntext.com/XONq3rINt7.gif
I can smell the cheeto stains on his keyboard from miles away ;3;0;False;level_5_Metapod;dkkq2b7;Miners right now.;6oty7x;http://i.gifntext.com/XONq3rINt7.gif
"I think you forgot that for every sale, there must be a buyer too...

Miners are the ones mining, i.e. increasing the supply. Supply goes up, price goes down. Seems most plausible to me that miners were the ones doing most of the selling.";4;1;False;strugglingcomic;dkkh6sw;Miners right now.;6oty7x;http://i.gifntext.com/XONq3rINt7.gif
">Judging by your username, maybe **souverain** is the localized term you will understand. 

meme que je ne suis pas francais, i understand that.

certainly, if the miners were the ""souverain"" and one person had >50% of mining power, bitcoin's decentralization would be a thing of the past.

fortunately, the notion that miners are the ""souverain"" is not true. like in a democracy, the souverain is the people, so in bitcoin the souverain is the users/market.

At times, in a democracy an elected president or gov'mnt is equipped with temporary power, but he's not the souverain despite temporary power. If he plays havoc, he gets replaced by the souverain. analogy to bitcoin: if miners misuse their (hash/political) power, markets/users may change pow any time.  ";1;1;False;Amichateur;dkki3dd;Miners right now.;6oty7x;http://i.gifntext.com/XONq3rINt7.gif
Asicboost is a real thing and it is patented.;1;2;False;tabzer123;dkkdpvw;Miners right now.;6oty7x;http://i.gifntext.com/XONq3rINt7.gif
"I think we can all agree that it is a good thing covert ACISboost, the quadratic hashing problem and transaction malleability is fixed, let's move on!

I'm also happy about the block capacity increase, this sub should be especially glad about this fact! :)";2;2;False;kattbilder;dkkdw8w;Miners right now.;6oty7x;http://i.gifntext.com/XONq3rINt7.gif
"Claiming ownership of ""Satoshi's original vision"", jeez, the sort of pompous righteousness of religious fanatics.

I'm in favour of a hard fork block size increase by the way.";10;2;False;johnhardy-seebitcoin;dkkg8ne;Miners right now.;6oty7x;http://i.gifntext.com/XONq3rINt7.gif
"Storing 8MB blocks assuming they're full costs less that $180 for a hard drive that's not going to fill up in the next 30 years.

Those costs if you quantity them don't justify limiting access to the blockchain.

I wouldn't surprise me if people have paid more in fees because of full blocks that it costs to run a 6000 nodes for 8 years. (Assuming a shared home internet connection.) ";6;1;False;Adrian-X;dkkxn2p;Miners right now.;6oty7x;http://i.gifntext.com/XONq3rINt7.gif
I think what sw2x did was bring all the non committed miners off the fence with the compromise. Them plus Antpool and the other EC supporting miners will be enough to clear the 51% majority needed to do the HF part of sw2x even if the previous SW miners defect (which I don't think they will). ;6;1;False;H0dl;dkkviu2;Miners right now.;6oty7x;http://i.gifntext.com/XONq3rINt7.gif
"Thank you Dzuelu for voting on GoodBot\_BadBot.  

This bot wants to find the best and worst bots on Reddit. [You can view results here](https://secure-dawn-77807.herokuapp.com/).";0;0;False;GoodBot_BadBot;dkkp8qx;Miners right now.;6oty7x;http://i.gifntext.com/XONq3rINt7.gif
"Wrong. Bitcoin miners invested hundreds of millions of USD worth into mining over three years when Bitcoin price fell and fell and fell. They believed into Bitcoin and invested their own ressources to secure the network. The ""buyers"" however did not believe, since they mostly **sold** otherwise the damn price wouldn't have fallen since 2013/2014 until very recently. PoW miners are the only ones who are supposed to have a vote/say in Bitcoin. You don't like it, switch to another coin which isn't based on the Satoshi Nakamoto's PoW concept.";3;1;False;dcrninja;dkkgakv;Miners right now.;6oty7x;http://i.gifntext.com/XONq3rINt7.gif
Judging by your username, maybe **souverain** is the localized term you will understand.;-1;1;False;dcrninja;dkkh7o3;Miners right now.;6oty7x;http://i.gifntext.com/XONq3rINt7.gif
You realize that is a clear sign of autism right?;1;0;False;DrShibeHealer;dkkr0uh;Miners right now.;6oty7x;http://i.gifntext.com/XONq3rINt7.gif
Ok.. even now people believe this nonsense. Whatever, I'm happy that we can move on soon.;5;2;False;saddit42;dkkdmo9;Miners right now.;6oty7x;http://i.gifntext.com/XONq3rINt7.gif
"It has some side effects though that someone could argue are ugly. To leverage asicboost one would for example include transactions in a certain order (not sorted by fees anymore). But I think the main concern was that it is patented. 

But you got it right. It was alot of noice about nothing, a PR campaign to give core a reason for why noone wants to run their shitty code because segwit is also disabling asicboost.";2;1;False;saddit42;dkkkb15;Miners right now.;6oty7x;http://i.gifntext.com/XONq3rINt7.gif
">The only thing that can derail segwitx2 is if some miners go back on their HF promise.

The UASF'ers and r/Bitcoin desperately want to believe this is some huge victory for them. It's true that UASF pushed some panicking miners to go first by conceding to SWSF. Little do they seem to realize that it's because of sw2x that comes with the hammer in 3m. They won't know what hit them when it happens because of their denial. Bitcoin continues to need losers. ";3;0;False;H0dl;dkkd244;Miners right now.;6oty7x;http://i.gifntext.com/XONq3rINt7.gif
Dipshit;0;0;False;H0dl;dkkd3su;Miners right now.;6oty7x;http://i.gifntext.com/XONq3rINt7.gif
"Why don't you just name BitcoinCash as bitcoin instead? That would solve your problems ;)";0;0;False;Bitcoinium;dkk97qn;Miners right now.;6oty7x;http://i.gifntext.com/XONq3rINt7.gif
As a user, I do not feal obliged to go along with anything. I did not make any promises. And if you (as a merchant, exchange, other) want me to consider your transaction valid, you better do it on the unhardforked chain. I don't care if you _additionally_ make it done other place.;-4;3;False;optimists;dkkn81s;Miners right now.;6oty7x;http://i.gifntext.com/XONq3rINt7.gif
"pow miners ARE servants (except that they get paid for their service of course).

anything other would be an attack on the decentralised bitcoin paradigm.";9;3;False;Amichateur;dkk9n4p;Miners right now.;6oty7x;http://i.gifntext.com/XONq3rINt7.gif
Someone please explain the irony of this statement.  Isn't the perceived threat of ASICBOOST negated by either version of segwit?;1;2;False;tabzer123;dkkc4tj;Miners right now.;6oty7x;http://i.gifntext.com/XONq3rINt7.gif
"Can someone please explain to me what the deal with ASICBOOST is?

The holy grail of mining is to make the most efficient mining hardware, right? Isn't ASICBOOST just a clever way to get more efficiency in code, by exploiting a weakness in the Bitcoin algorithm?

Not trolling. Serious question.";4;1;False;theantnest;dkkj9w0;Miners right now.;6oty7x;http://i.gifntext.com/XONq3rINt7.gif
"It's also a matter of how many competing miners there are per mined token. If there is a 2:1 price disparity but 8:1 competitive disadvantage, there's really a disincentive to stay on the most competitive branch. Of course, that'll probably be programmatically  adjusted by the miners so they don't ""throw away"" their time.";2;1;False;noreallyimthepope;dkkwqb5;Miners right now.;6oty7x;http://i.gifntext.com/XONq3rINt7.gif
"If by most nodes you mean non-mining full nodes, that's a meaningless measure. For all we know they could be fake and not a real user. Data that is easy to Sybil is useless, so number of full nodes is useless and meaningless.

Now, the only non miming nodes that have some importance are those from businesses. Those have not changed because the btc1 client is still young and its intelligent to let others test it for them, while they have no need to change. In 3 months I bet you most will have the HF code running.

BlockStream can use all the money they want to keep creating more UASF nodes. They are meaningless.

The only thing that can derail segwitx2 is if some miners go back on their HF promise.";-2;1;False;lukmeg;dkk9dgi;Miners right now.;6oty7x;http://i.gifntext.com/XONq3rINt7.gif
It's amazing that after all this debate, users will not have a non-SegWit chain with increased block size to vote on with their money (one with hash power that is being taken seriously).;2;2;False;loveforyouandme;dkkdpu5;Miners right now.;6oty7x;http://i.gifntext.com/XONq3rINt7.gif
I really doubt that will happen;6;4;False;H0dl;dkkd5fl;Miners right now.;6oty7x;http://i.gifntext.com/XONq3rINt7.gif
"> That weak promise looks pretty feeble indeed, given that the vast majority of nodes still run Core and aren't likely to change in a mere 3 months.

It doesn't take 3 months to change your Bitcoin client, it takes minutes.";13;1;False;Ant-n;dkk8fbh;Miners right now.;6oty7x;http://i.gifntext.com/XONq3rINt7.gif
