body;score;nb_replies;stickied;author;id;post_title;post_id;post_link
They are removing these posts;68;2;False;deathye;dpqzcyt;And not a single post about high fees or slow transactions on r/bitcoin. I guess not important enough to be discussed...;7cmhz2;https://www.reddit.com/r/btc/comments/7cmhz2/and_not_a_single_post_about_high_fees_or_slow/
They've been working hard for years to get to this stage, why would they complain about it now?;46;1;False;Meeseeks-Answers;dpqzssy;And not a single post about high fees or slow transactions on r/bitcoin. I guess not important enough to be discussed...;7cmhz2;https://www.reddit.com/r/btc/comments/7cmhz2/and_not_a_single_post_about_high_fees_or_slow/
I heard bitcoin cash is an alt coin and liars are pumping it up. is that true?;8;1;False;saltyseasnek;dpr7v4h;And not a single post about high fees or slow transactions on r/bitcoin. I guess not important enough to be discussed...;7cmhz2;https://www.reddit.com/r/btc/comments/7cmhz2/and_not_a_single_post_about_high_fees_or_slow/
"There is now a stickied thread to discuss price.  Any posts about the price will be deleted now.

They don't care about fees.  The price bounced back up.  Crisis averted.  That's all they care about.";4;0;False;plazman30;dpr4fal;And not a single post about high fees or slow transactions on r/bitcoin. I guess not important enough to be discussed...;7cmhz2;https://www.reddit.com/r/btc/comments/7cmhz2/and_not_a_single_post_about_high_fees_or_slow/
They wouldn't know, they don't use Bitcoin, they just hold it. And those who do and question, end up here after getting banned.;4;0;False;gubatron;dpr4quo;And not a single post about high fees or slow transactions on r/bitcoin. I guess not important enough to be discussed...;7cmhz2;https://www.reddit.com/r/btc/comments/7cmhz2/and_not_a_single_post_about_high_fees_or_slow/
"I went all-in bitcoin when btg and segwit forks were announced im glad i did that because i made 100% but i was pissed as fuck when segwit2 was cancelled and i moved my BTC, payed 4$ in fees, it was considered a LOW fee and i waited more than 24 hours for the transaction to confirm. 

This is bullshit, fuck btc. I will never go back to bitcoin even if 1000 forks are happening. They should do something with these ridiculous fees";4;0;False;k0stil;dpraaqj;And not a single post about high fees or slow transactions on r/bitcoin. I guess not important enough to be discussed...;7cmhz2;https://www.reddit.com/r/btc/comments/7cmhz2/and_not_a_single_post_about_high_fees_or_slow/
Is there in existence a sub / community which is at least somewhat objective about bitcoin politics? I can't trust r/btc or r/bitcoin to be unbiased since the fork. The whole reason we're here is to rid ourselves of old world propaganda and power struggles.;1;1;False;DrMilsap;dpraoii;And not a single post about high fees or slow transactions on r/bitcoin. I guess not important enough to be discussed...;7cmhz2;https://www.reddit.com/r/btc/comments/7cmhz2/and_not_a_single_post_about_high_fees_or_slow/
There's no war in Ba Sing Se.;1;0;False;r2d2_21;dpr5yta;And not a single post about high fees or slow transactions on r/bitcoin. I guess not important enough to be discussed...;7cmhz2;https://www.reddit.com/r/btc/comments/7cmhz2/and_not_a_single_post_about_high_fees_or_slow/
There are posts, they are simply not on hot.;1;0;False;slbbb;dpr52cj;And not a single post about high fees or slow transactions on r/bitcoin. I guess not important enough to be discussed...;7cmhz2;https://www.reddit.com/r/btc/comments/7cmhz2/and_not_a_single_post_about_high_fees_or_slow/
"Sent an ETH transaction with 1 cent fee: confirmed < 30 seconds

Sent a Corecoin transaction with $1,60 fee: still waiting after > 3 hours

Oh ofcourse, I should have put a $5 fee and it *might* have been confirmed already.";1;1;False;TheJesbus;dpr499p;And not a single post about high fees or slow transactions on r/bitcoin. I guess not important enough to be discussed...;7cmhz2;https://www.reddit.com/r/btc/comments/7cmhz2/and_not_a_single_post_about_high_fees_or_slow/
"High Fees and Slow Transactions because of a coordinated Pump and Dump to shift hash power over to BCH.  Look at the BTC mempool over the last 20 hours since BCH difficulty has adjusted.

It's fair and totally reasonable to discuss and call out these effects, but at least be honest with what is causing it.

Edit: Am I seriously getting downvoted because you don't like facts? Please tell me where I am wrong. Let's at least have a discussion.  ";1;1;False;igiverealygoodadvice;dprc7fz;And not a single post about high fees or slow transactions on r/bitcoin. I guess not important enough to be discussed...;7cmhz2;https://www.reddit.com/r/btc/comments/7cmhz2/and_not_a_single_post_about_high_fees_or_slow/
It is not important because it is not important NOW. Paying $5 fees to move $100,000 is not hight. A wire transfer costs $35 and it takes about a day. ;1;1;False;richyboycaldo;dpr3m0t;And not a single post about high fees or slow transactions on r/bitcoin. I guess not important enough to be discussed...;7cmhz2;https://www.reddit.com/r/btc/comments/7cmhz2/and_not_a_single_post_about_high_fees_or_slow/
"nobody uses this coin thats why it has no fee like btc before it was popular
heres a nice image btw
https://i.imgur.com/tixnkTw.jpg";1;1;False;Svensis;dprx4ia;And not a single post about high fees or slow transactions on r/bitcoin. I guess not important enough to be discussed...;7cmhz2;https://www.reddit.com/r/btc/comments/7cmhz2/and_not_a_single_post_about_high_fees_or_slow/
Changing from hitech to a cult recycling its own incestive mind set, they'll be unable keeping pace and will stop growing. Very sad...  ;1;0;False;btc777;dprwcjd;And not a single post about high fees or slow transactions on r/bitcoin. I guess not important enough to be discussed...;7cmhz2;https://www.reddit.com/r/btc/comments/7cmhz2/and_not_a_single_post_about_high_fees_or_slow/
"The OP is exaggerating(see below). Fact is people know the tx situation is bad, but they feel that total loss of decentralization is unacceptable. 

*removed link...sorry for cross-posting. Just thought I would help *";1;1;False;raulbloodwurth;dpru5u6;And not a single post about high fees or slow transactions on r/bitcoin. I guess not important enough to be discussed...;7cmhz2;https://www.reddit.com/r/btc/comments/7cmhz2/and_not_a_single_post_about_high_fees_or_slow/
Where are the posts on r/btc about BCH blocks taking >2hrs to be mined currently?  Where are the posts about getting enough confirmations to get it to an exchange taking far too many hours to be considered a valid currency?  If it takes 2-3hrs to move BCH from wallet A to wallet B, why do people think its a good currency?  Where are those posts?;1;1;False;hard_in_the_paint;dpro1zx;And not a single post about high fees or slow transactions on r/bitcoin. I guess not important enough to be discussed...;7cmhz2;https://www.reddit.com/r/btc/comments/7cmhz2/and_not_a_single_post_about_high_fees_or_slow/
Oh that’s because btc sucks. Check out ethereum if you are into getting rich.;1;0;False;PoliteIntruder;dprmar5;And not a single post about high fees or slow transactions on r/bitcoin. I guess not important enough to be discussed...;7cmhz2;https://www.reddit.com/r/btc/comments/7cmhz2/and_not_a_single_post_about_high_fees_or_slow/
Geez I wonder, maybe you have the biggest mining pool in the world attacking core. God you people are stupid;1;0;False;Cameronasa4;dprkxd7;And not a single post about high fees or slow transactions on r/bitcoin. I guess not important enough to be discussed...;7cmhz2;https://www.reddit.com/r/btc/comments/7cmhz2/and_not_a_single_post_about_high_fees_or_slow/
If you sort by controversial there are a lot of them. :(;1;0;False;jonnnyMn;dprjbwt;And not a single post about high fees or slow transactions on r/bitcoin. I guess not important enough to be discussed...;7cmhz2;https://www.reddit.com/r/btc/comments/7cmhz2/and_not_a_single_post_about_high_fees_or_slow/
Serious question lets say core does this on purpose, why would they do this? What they would profit from this high fees? Theres something missing here;1;1;False;sharphabit;dprgn4q;And not a single post about high fees or slow transactions on r/bitcoin. I guess not important enough to be discussed...;7cmhz2;https://www.reddit.com/r/btc/comments/7cmhz2/and_not_a_single_post_about_high_fees_or_slow/
The cabal that owns the world's economy already owns core. That is now obvious to me. Whether they killed and replaced theymos, are controlling him thru threats, whether he joined them willingly, or whether they've owned it since day one...I don't know. They don't care about high fees and slow trans cause that's the world they already run. All that matters now to them is that BTC continues to take over the world;0;0;False;caughtholdingtheswag;dpr66su;And not a single post about high fees or slow transactions on r/bitcoin. I guess not important enough to be discussed...;7cmhz2;https://www.reddit.com/r/btc/comments/7cmhz2/and_not_a_single_post_about_high_fees_or_slow/
I spent some BTC (through BitPay) on Friday afternoon which I thought was before things got crazy so I assumed it went through, but it's still unconfirmed 3 days later...;2;0;False;erik__;dprbtpn;And not a single post about high fees or slow transactions on r/bitcoin. I guess not important enough to be discussed...;7cmhz2;https://www.reddit.com/r/btc/comments/7cmhz2/and_not_a_single_post_about_high_fees_or_slow/
Go to /r/BitcoinMarkets for a more balanced view;4;3;False;taipalag;dpr3f83;And not a single post about high fees or slow transactions on r/bitcoin. I guess not important enough to be discussed...;7cmhz2;https://www.reddit.com/r/btc/comments/7cmhz2/and_not_a_single_post_about_high_fees_or_slow/
Its getting boring discussing this over and over again. There are many altcoins with much cheaper fees than bcash and with similar levels of lack of merchant/user acceptance;3;2;False;bitusher;dpr5z9c;And not a single post about high fees or slow transactions on r/bitcoin. I guess not important enough to be discussed...;7cmhz2;https://www.reddit.com/r/btc/comments/7cmhz2/and_not_a_single_post_about_high_fees_or_slow/
"Not true, if you sort by ""controversial"" you can see threads being downvoted and later removed entirely. Though my wild guess that a few of them are people from r/btc simply trolling r/bitcoin, but others are genuinely get banned! Because why not, they give bad cred for bitcoin! /s

Edit: https://np.reddit.com/r/btc/comments/7cothn/i_managed_to_get_a_post_about_btc_tx_fees_to_the/ oh hah.

If one truly wants to upset balance, high fees should be all year round, then people will start asking right questions, everywhere.";4;0;False;TomFyuri;dpr8dit;And not a single post about high fees or slow transactions on r/bitcoin. I guess not important enough to be discussed...;7cmhz2;https://www.reddit.com/r/btc/comments/7cmhz2/and_not_a_single_post_about_high_fees_or_slow/
"BCH work on 0 confirmations as well. BCH can’t be double spend, and don’t have replace-by-fee bug included . Mind blowing, right? ;)

You just can’t re-spend it again until it is settled in next block however you are confident that transaction will happen.";1;0;False;Rdzavi;dprr5p0;And not a single post about high fees or slow transactions on r/bitcoin. I guess not important enough to be discussed...;7cmhz2;https://www.reddit.com/r/btc/comments/7cmhz2/and_not_a_single_post_about_high_fees_or_slow/
You are laying to yourself. If you are not banned from there yet go and try to create new post about high fees and slow transactions and see what happens.;1;1;False;Rdzavi;dprv3vr;And not a single post about high fees or slow transactions on r/bitcoin. I guess not important enough to be discussed...;7cmhz2;https://www.reddit.com/r/btc/comments/7cmhz2/and_not_a_single_post_about_high_fees_or_slow/
"That's surely worse then here where the comments that *explain* get voted into oblivion ...

I'm somehow really starting to dislike this sub. Name-calling and thin skinned people all over the place.";1;1;False;huhn_m;dprlxoo;And not a single post about high fees or slow transactions on r/bitcoin. I guess not important enough to be discussed...;7cmhz2;https://www.reddit.com/r/btc/comments/7cmhz2/and_not_a_single_post_about_high_fees_or_slow/
"> I posted about the Exodus of hash rate from BTC to Bitcoin cash......and the post was automatically removed and I got a warning from the mods......pitiful.

its this kind of stuff that has me considering jumping ship w my coins. ";1;1;False;redpillburner;dprz7jr;And not a single post about high fees or slow transactions on r/bitcoin. I guess not important enough to be discussed...;7cmhz2;https://www.reddit.com/r/btc/comments/7cmhz2/and_not_a_single_post_about_high_fees_or_slow/
This is the real reason BCH has 8MB Blocks. You need them when you haven't had a block in over an hour...;1;1;False;rain-is-wet;dpriryv;And not a single post about high fees or slow transactions on r/bitcoin. I guess not important enough to be discussed...;7cmhz2;https://www.reddit.com/r/btc/comments/7cmhz2/and_not_a_single_post_about_high_fees_or_slow/
Unless it's on the way from/to an exchange to buy/sell;1;2;False;Thorbinator;dpryi6e;And not a single post about high fees or slow transactions on r/bitcoin. I guess not important enough to be discussed...;7cmhz2;https://www.reddit.com/r/btc/comments/7cmhz2/and_not_a_single_post_about_high_fees_or_slow/
"true but these are manufactured arguments because the block size is completely adequate unless the mempool is spammed. So it is a bit disingenuous to insist we argue about something that only exists because of nefarious actors. I would be okay having a conversation on this subject if we started out by asking ""should we increase the block size to reduce the impact that spam attacks have on the network"", if you think we should increase the block size to reduce the impact of spam, won't spam just increase to whatever size you pick? The answer is yes, if you didn't increase it enough to appease the spam terrorists. ";1;0;False;johnnycoin;dprp7rt;And not a single post about high fees or slow transactions on r/bitcoin. I guess not important enough to be discussed...;7cmhz2;https://www.reddit.com/r/btc/comments/7cmhz2/and_not_a_single_post_about_high_fees_or_slow/
A price rise accompanied by a steep drop in marketshare, meaning BTC price could have been much higher.;3;1;False;__tman__;dpr5lu2;And not a single post about high fees or slow transactions on r/bitcoin. I guess not important enough to be discussed...;7cmhz2;https://www.reddit.com/r/btc/comments/7cmhz2/and_not_a_single_post_about_high_fees_or_slow/
Funny that they would not anticipate an increase in users and the subsequent complaints of slow confirmations and hight fees.;9;2;False;Meeseeks-Answers;dpr2w71;And not a single post about high fees or slow transactions on r/bitcoin. I guess not important enough to be discussed...;7cmhz2;https://www.reddit.com/r/btc/comments/7cmhz2/and_not_a_single_post_about_high_fees_or_slow/
"I wasn't literally FIFO in that sub, but close.

Didn't even get the project fully off the ground and pioneers were already being personally attacked at every opportunity.

Bitcoin was invented to protect yourself from robber barons. It's amazing to me that so many will jump right back into bed with them.

The concept of peer to peer cash is out of the bag. Don't be Blockstream's useful idiot, or do, whatever, it's not my money you are playing with.";7;0;False;Forlarren;dpra5ye;And not a single post about high fees or slow transactions on r/bitcoin. I guess not important enough to be discussed...;7cmhz2;https://www.reddit.com/r/btc/comments/7cmhz2/and_not_a_single_post_about_high_fees_or_slow/
It's ironic that their miscalculation is based on the fact that they were over-pessimistic about bitcoin. No, wait, it's poetic!;11;0;False;KoKansei;dpr4tsg;And not a single post about high fees or slow transactions on r/bitcoin. I guess not important enough to be discussed...;7cmhz2;https://www.reddit.com/r/btc/comments/7cmhz2/and_not_a_single_post_about_high_fees_or_slow/
"I still own both Bitcoin & Bitcoin Cash equally.  I support both.  Obviously ideally Bitcoin would solve scaling issue and then we'd lose our skism of the community.  

Examples of trolling?";1;0;False;Pink-Fish;dprhsm2;And not a single post about high fees or slow transactions on r/bitcoin. I guess not important enough to be discussed...;7cmhz2;https://www.reddit.com/r/btc/comments/7cmhz2/and_not_a_single_post_about_high_fees_or_slow/
Pretty sure everyone wears it with pride because everyone knows the sham going on in bitcoin...;13;1;False;jaybasin;dpr7pmd;And not a single post about high fees or slow transactions on r/bitcoin. I guess not important enough to be discussed...;7cmhz2;https://www.reddit.com/r/btc/comments/7cmhz2/and_not_a_single_post_about_high_fees_or_slow/
Look at the mem pool chart and tell me with a clear mind that the mem pool size is not a fake joke. It has happened so many times in the past three years that it is not worth talking about at this point. ;3;1;False;johnnycoin;dpr9ybm;And not a single post about high fees or slow transactions on r/bitcoin. I guess not important enough to be discussed...;7cmhz2;https://www.reddit.com/r/btc/comments/7cmhz2/and_not_a_single_post_about_high_fees_or_slow/
"Most of the people (especially newbies) go there because the name is ""Bitcoin"" 

Vast majority agree with low fees and faster confirmations but they're spoon fed this nonsense so they believe it.  ";3;0;False;Pink-Fish;dprhq4q;And not a single post about high fees or slow transactions on r/bitcoin. I guess not important enough to be discussed...;7cmhz2;https://www.reddit.com/r/btc/comments/7cmhz2/and_not_a_single_post_about_high_fees_or_slow/
IMHO the policy is only there so they can censor discussion.  The idea of banning discussion of competing technologies is idiotic.;6;0;False;djvs9999;dprf8ml;And not a single post about high fees or slow transactions on r/bitcoin. I guess not important enough to be discussed...;7cmhz2;https://www.reddit.com/r/btc/comments/7cmhz2/and_not_a_single_post_about_high_fees_or_slow/
I have been reading both channels, and let's be fair, this sub is by far the most annoying. Why even call this channel btc when it's bch? Do something constructive. ;-43;4;False;Jlius3216;dpr6rse;And not a single post about high fees or slow transactions on r/bitcoin. I guess not important enough to be discussed...;7cmhz2;https://www.reddit.com/r/btc/comments/7cmhz2/and_not_a_single_post_about_high_fees_or_slow/
"I'm not shilling anything, I have posted a fact.

You also seems to ignore the importance of the hash rate related to the security of the transactions and the small amount of hash rate remained owned by a single miner. But how do you care.. right? You have low fees and faster transactions, anything else is irrelevant.";1;2;False;Giusis;dpr1vn1;And not a single post about high fees or slow transactions on r/bitcoin. I guess not important enough to be discussed...;7cmhz2;https://www.reddit.com/r/btc/comments/7cmhz2/and_not_a_single_post_about_high_fees_or_slow/
So it is for the Bitcoin: the hashpower will remain on the BTC chain since it'll be more profitable from now on, due to the EDA no more exploitable.;1;1;False;Giusis;dpr82w0;And not a single post about high fees or slow transactions on r/bitcoin. I guess not important enough to be discussed...;7cmhz2;https://www.reddit.com/r/btc/comments/7cmhz2/and_not_a_single_post_about_high_fees_or_slow/
BTC doesn't have to be immune to every conceivable attack, doing so would be a waste of resources and would be akin to a dog chasing its tail. They should focus on their plans and execute. Mempool blow ups are temporary and always resolve themselves when the attackers run out of money or time. ;-2;1;False;johnnycoin;dpra0d5;And not a single post about high fees or slow transactions on r/bitcoin. I guess not important enough to be discussed...;7cmhz2;https://www.reddit.com/r/btc/comments/7cmhz2/and_not_a_single_post_about_high_fees_or_slow/
"I spend most of my reddit time over there and this problem annoys me too. Your comment clearly shows much of the community is reasonable, but the mods are not. 
Remember a lot of folks from /r/Bitcoin will say the same of censorship on this sub though. No one wants to talk about the criminal activity and self-interest of the BCH 'CEO's'. Each side has major issues which are doing real damage to the reputation of Bitcoin.";13;0;False;theMightyJoosh;dpri291;And not a single post about high fees or slow transactions on r/bitcoin. I guess not important enough to be discussed...;7cmhz2;https://www.reddit.com/r/btc/comments/7cmhz2/and_not_a_single_post_about_high_fees_or_slow/
"Been monitoring segwit usage during the weekend.

Even in the middle of one of the biggest backlog of Bitcoin history not more than 10% use..

";9;0;False;Ant-n;dpr29fd;And not a single post about high fees or slow transactions on r/bitcoin. I guess not important enough to be discussed...;7cmhz2;https://www.reddit.com/r/btc/comments/7cmhz2/and_not_a_single_post_about_high_fees_or_slow/
Dude, it cost me $17 dollars and over 18 hours to move $610 dollars of BTC over the weekend. That system is whack.;3;0;False;jake63vw;dpr8cb2;And not a single post about high fees or slow transactions on r/bitcoin. I guess not important enough to be discussed...;7cmhz2;https://www.reddit.com/r/btc/comments/7cmhz2/and_not_a_single_post_about_high_fees_or_slow/
My credit card gives me cash back for every tx I make, how will bcash compete with this...;0;2;False;bitusher;dpr7zu5;And not a single post about high fees or slow transactions on r/bitcoin. I guess not important enough to be discussed...;7cmhz2;https://www.reddit.com/r/btc/comments/7cmhz2/and_not_a_single_post_about_high_fees_or_slow/
Or paid trolls;3;1;False;taipalag;dpreb78;And not a single post about high fees or slow transactions on r/bitcoin. I guess not important enough to be discussed...;7cmhz2;https://www.reddit.com/r/btc/comments/7cmhz2/and_not_a_single_post_about_high_fees_or_slow/
What's BTC's use case?;1;3;False;analyst4933;dpr6xzf;And not a single post about high fees or slow transactions on r/bitcoin. I guess not important enough to be discussed...;7cmhz2;https://www.reddit.com/r/btc/comments/7cmhz2/and_not_a_single_post_about_high_fees_or_slow/
[deleted];0;1;False;;dpro1ek;And not a single post about high fees or slow transactions on r/bitcoin. I guess not important enough to be discussed...;7cmhz2;https://www.reddit.com/r/btc/comments/7cmhz2/and_not_a_single_post_about_high_fees_or_slow/
"What if story is exactly opposite? Because right now i see real moves from miners side. What if all this new  forks and BCH stuff is to actually to hold the centralized stacked mining power? 

Lets say Core had this bad plans, miners still could act then and besides community would know if their intents are real or not. 

Miners clog mempool, miners fork btc as an attack and you all think Core has bad intentions. That doesnt really look reasonable. 8 mb blocks mempool still can be clogged if same guys wants to do it, after all  fees will return them what could go wrong? But you see BTC mempool gets clogged whenever those “good” intention miners need it. If theres not something fishy what is happening with all this drama , then you guys are really very naive and living in a pink dream.";3;0;False;sharphabit;dprijid;And not a single post about high fees or slow transactions on r/bitcoin. I guess not important enough to be discussed...;7cmhz2;https://www.reddit.com/r/btc/comments/7cmhz2/and_not_a_single_post_about_high_fees_or_slow/
"There are posts on this topic, read for yourself if you have the time. 

Banning is bad. It is difficult for me to prove if this is true, unfortunately.";1;1;False;raulbloodwurth;dprvo03;And not a single post about high fees or slow transactions on r/bitcoin. I guess not important enough to be discussed...;7cmhz2;https://www.reddit.com/r/btc/comments/7cmhz2/and_not_a_single_post_about_high_fees_or_slow/
 so when bitcoin scales properly next year what will the point of bcash even be? Its very clear to me that bcash and the people leading the way for it are the exact type of people that created the need for bitcoin in the first place. Its an altcoin and its an ico scam and in the end I cant wait to see it fail and see those who push this crap eat their words.;-5;3;False;saltyseasnek;dpr8e6u;And not a single post about high fees or slow transactions on r/bitcoin. I guess not important enough to be discussed...;7cmhz2;https://www.reddit.com/r/btc/comments/7cmhz2/and_not_a_single_post_about_high_fees_or_slow/
"As of pumping, you can't pump coin to 20-30billions market cap. That is insane to even think about it.

I agree with your first points but not this. That is like chump change for some people";0;0;False;findyourinsanity;dpraj2k;And not a single post about high fees or slow transactions on r/bitcoin. I guess not important enough to be discussed...;7cmhz2;https://www.reddit.com/r/btc/comments/7cmhz2/and_not_a_single_post_about_high_fees_or_slow/
Completely agree with you. 100%.;4;0;False;richyboycaldo;dpr7ju6;And not a single post about high fees or slow transactions on r/bitcoin. I guess not important enough to be discussed...;7cmhz2;https://www.reddit.com/r/btc/comments/7cmhz2/and_not_a_single_post_about_high_fees_or_slow/
That is definitely an issue and is why I personally support larger blocks, but the original post was a bit misleading by omitting relevant recent information. ;1;0;False;igiverealygoodadvice;dprh68d;And not a single post about high fees or slow transactions on r/bitcoin. I guess not important enough to be discussed...;7cmhz2;https://www.reddit.com/r/btc/comments/7cmhz2/and_not_a_single_post_about_high_fees_or_slow/
