body;score;nb_replies;stickied;author;id;post_title;post_id;post_link
The image is still true. They just need to insert a middle panel for bitcoin segwit with a $6 fee and 2 hour confirmation time.;141;4;False;ytrottier;dlyzr56;On /r/bitcoin right now.;6vbrt6;http://i.imgur.com/CvbE7oH.png
WTF?  Your comment didn't promote any altcoin, sexually harass anyone, or troll.  That seems pretty unfair to me.  I've seen people post edited photos of Jihan Wu made to look like a devil in that sub and I don't think they were banned or had their posts removed.  It seems that the only rule that really matters is that you follow the arbitrary and unspoken whims of the mods.;12;1;False;gotamd;dlzbmo2;On /r/bitcoin right now.;6vbrt6;http://i.imgur.com/CvbE7oH.png
"Nice exaggeration. 
With the extra on chain capacity of Segwit, and a ton of transactions going off chain... It wont be anywhere near $50. 
I might only do a couple of transactions on the main-chain each year. ";-9;1;False;Vaukins;dlzh4t2;On /r/bitcoin right now.;6vbrt6;http://i.imgur.com/CvbE7oH.png
"Semantics. 
I've used it on testnet and it is sweet. Waiting for confirmations will seem archaic soon. 
You could argue that Bitcoin is an IOU... most of us value it in fiat. ";-6;1;False;Vaukins;dlzh179;On /r/bitcoin right now.;6vbrt6;http://i.imgur.com/CvbE7oH.png
[Yes.](https://bitcoin.org/bitcoin.pdf) Can you explain why you think Satoshi was wrong?;8;1;False;anthero;dlzj8ck;On /r/bitcoin right now.;6vbrt6;http://i.imgur.com/CvbE7oH.png
You can the 1MB limit is an artificial limit. BCC has an 8MB limit and can handle 50 blocks an hour as opposed to BTC's 6. ;8;1;False;Adrian-X;dlzjm8g;On /r/bitcoin right now.;6vbrt6;http://i.imgur.com/CvbE7oH.png
Full ack!!! ;4;0;False;Testwest78;dlzl5fy;On /r/bitcoin right now.;6vbrt6;http://i.imgur.com/CvbE7oH.png
I think my last ever fee before getting out was $18. ;1;0;False;taycer;dlz3bxs;On /r/bitcoin right now.;6vbrt6;http://i.imgur.com/CvbE7oH.png
"A year ago I paid a 5$ fee for fun and it go confirmed in 30 seconds!

Really!";4;0;False;uMCCCS;dlz3xw6;On /r/bitcoin right now.;6vbrt6;http://i.imgur.com/CvbE7oH.png
"Awston tipped 0.00075 BCC!

Read more about [Bitcoin Cash](https://bitcoincash.org)
_I am a bot. This was an automated reply._";3;1;False;CashTipper;dlz7tho;On /r/bitcoin right now.;6vbrt6;http://i.imgur.com/CvbE7oH.png
You're most welcome, and thanks for the tip (and taking the time to read) :);5;0;False;smeggletoot;dlz878n;On /r/bitcoin right now.;6vbrt6;http://i.imgur.com/CvbE7oH.png
"cgcardona tipped 0.00156 BCC!

Read more about [Bitcoin Cash](https://bitcoincash.org)
_I am a bot. This was an automated reply._";1;0;False;CashTipper;dlz661m;On /r/bitcoin right now.;6vbrt6;http://i.imgur.com/CvbE7oH.png
Won't fees eat up that tip?;2;1;False;aDreamySortofNobody;dlziyex;On /r/bitcoin right now.;6vbrt6;http://i.imgur.com/CvbE7oH.png
how do you set up cashtipper? ;2;1;False;kwko;dlzacz2;On /r/bitcoin right now.;6vbrt6;http://i.imgur.com/CvbE7oH.png
"You're all very welcome :)

And thanks for my first BCH tip! <3";10;1;False;smeggletoot;dlz66nv;On /r/bitcoin right now.;6vbrt6;http://i.imgur.com/CvbE7oH.png
And same to you :)  Thankyou for the kind words, they are appreciated! ;3;0;False;smeggletoot;dlzdo66;On /r/bitcoin right now.;6vbrt6;http://i.imgur.com/CvbE7oH.png
"That's because you are not adding anything positive to the discussion.  We created that image on r/bitcoin, you are not saying anything new they haven't heard before... or suggesting solutions, you're just distracting people from the actual work of creating those solutions by getting them worked up and angry.

The sooner yourself and others realise that both r/btc and r/bitcoin comprise members who are all on the same team (bitcoin), the better we can all work together to figure out how we get over the next wave of hurdles.

In short, the less mud (and fud!) we throw at each, the better off we will all be.";-8;5;False;smeggletoot;dlzdjs9;On /r/bitcoin right now.;6vbrt6;http://i.imgur.com/CvbE7oH.png
This guys stance isn't rare at all. It's a very small percent of crypto traders that are hyper-vocal across all media while the rest of us are interested in hard numbers and relevant news/events that affect our investment(s). Equal to politics on Facebook.;40;5;False;LusoBlue;dlzb0aj;On /r/bitcoin right now.;6vbrt6;http://i.imgur.com/CvbE7oH.png
"/r/Bitcoin is such a bunch of fuckers. I don't even nessacarily disagree with Segwit or whatever but they're censorship is trash even for the older members. 
";10;1;False;Vespco;dlzcf04;On /r/bitcoin right now.;6vbrt6;http://i.imgur.com/CvbE7oH.png
I can still see them. Am I shadow-banned?;3;3;False;Sovereign_Curtis;dlz1w15;On /r/bitcoin right now.;6vbrt6;http://i.imgur.com/CvbE7oH.png
"Nope, I got a **120 day ban** for ""trolling, sexual harassment, promoting altcoins""";14;2;False;Sovereign_Curtis;dlzavdw;On /r/bitcoin right now.;6vbrt6;http://i.imgur.com/CvbE7oH.png
After everyone gets banned for upgrading to Segwit2x... ;5;0;False;PoliticalDissidents;dlzfu5z;On /r/bitcoin right now.;6vbrt6;http://i.imgur.com/CvbE7oH.png
"""instant""

\**after you pay $50 to open a new channel, wait 2 hours for the required confirmations, and then use a centralized entity to do your transactions with, and as soon as you are done you pay that $50 again and wait another 2 hours to get your money out.";10;1;False;SomeoneOnThelnternet;dlzgbc9;On /r/bitcoin right now.;6vbrt6;http://i.imgur.com/CvbE7oH.png
"LN is not instant.  The instant part of LN is just trading IOU's between you and the hub that you receive a payment from.  What's not instant is that you can not claim the new funds, but to actually get paid you have to make a Bitcoin transaction and that has to be mined.  So there is no ""instant"" payment with LN.";9;1;False;tl121;dlzgrsq;On /r/bitcoin right now.;6vbrt6;http://i.imgur.com/CvbE7oH.png
"The ad or the thread which was deleted?

Btw the mods banned me for 120 days for my participation in that thread. ";21;0;False;Sovereign_Curtis;dlzbzw3;On /r/bitcoin right now.;6vbrt6;http://i.imgur.com/CvbE7oH.png
Can any of the downvoters here explain why they think this is wrong?;4;2;False;7x3x2;dlziasw;On /r/bitcoin right now.;6vbrt6;http://i.imgur.com/CvbE7oH.png
"in your opinion....

here is something you also can't have - people watching movies over the internet...ooops - now you can - what once was impossible becomes possible.  by the time bitcoin cash blocks are full to 8mb of traffic - it will be possible to host 16mb blocks or 32 mb.  And by then also, there will probably be lots of innovations that make even better scaling possible.

SET THE GOAL > THEN STRETCH TO FIND THE ENGINEERING SOLUTIONS

DO NOT LET THE GOAL BE SET BY THE ENGINEERING RESTRICTIONS.";27;1;False;papabitcoin;dlzi66g;On /r/bitcoin right now.;6vbrt6;http://i.imgur.com/CvbE7oH.png
">If only bitcoin legacy clear transactions as fast as their moderators remove posts

LOL";11;0;False;Adrian-X;dlzjim4;On /r/bitcoin right now.;6vbrt6;http://i.imgur.com/CvbE7oH.png
"> sexual harassment

Core developer Greg Maxwell AKA nullc [is the one guilty of sexual harrassment, telling people to suck his dick](https://www.reddit.com/r/btc/comments/4p1qk9/people_should_know_there_is_a_chance_of_loss_of/d4hqu7y/)";7;0;False;cryptorebel;dlzec3l;On /r/bitcoin right now.;6vbrt6;http://i.imgur.com/CvbE7oH.png
I meant all the good comments, they didn't literally delete them all. Sorry if I gave that impression.;9;0;False;DTanner;dlz2vqb;On /r/bitcoin right now.;6vbrt6;http://i.imgur.com/CvbE7oH.png
Not all comments, only the highest parent comment. ;5;1;False;TIP_ME_COINS;dlz2wt6;On /r/bitcoin right now.;6vbrt6;http://i.imgur.com/CvbE7oH.png
Can you link me? ;1;1;False;PoliticalDissidents;dlzfv0d;On /r/bitcoin right now.;6vbrt6;http://i.imgur.com/CvbE7oH.png
"""Fund the team"", you mean control it entirely by going after anyone who isn't them?

Seems hard to get the ""best developers"" if you put an authoritarian entity in control that won't let anyone contribute unless they approve.";8;0;False;Okymyo;dlzkpbj;On /r/bitcoin right now.;6vbrt6;http://i.imgur.com/CvbE7oH.png
"You posted a link to Satoshi's white paper (as if no one here hasn't already read that before). It also makes no mention of future scaling issues. 

The universe doesn't owe you a cheap blockchain.";3;1;False;vakeraj;dlzl6ty;On /r/bitcoin right now.;6vbrt6;http://i.imgur.com/CvbE7oH.png
"I want the best developers to be working on Bitcoin, I don't really care if Blockstream are one of the institutions which fund the team. 


";-4;1;False;Vaukins;dlzkhrs;On /r/bitcoin right now.;6vbrt6;http://i.imgur.com/CvbE7oH.png
I posted a mathematical proof that has never been refuted. Your turn.;8;1;False;anthero;dlzkkth;On /r/bitcoin right now.;6vbrt6;http://i.imgur.com/CvbE7oH.png
"And I got a 120 day ban for ""trolling, sexual harassment, promoting altcoins""";8;0;False;Sovereign_Curtis;dlzaw90;On /r/bitcoin right now.;6vbrt6;http://i.imgur.com/CvbE7oH.png
"Can already be seen. Even credit cards are better, at least you won't be sued for implementing payment methods that Blockstream doesn't approve of.

Why would anyone want to implement patented technology into Bitcoin is beyond me. I guess people really want to give Blockstream full control of Bitcoin development.";10;1;False;Okymyo;dlzk6px;On /r/bitcoin right now.;6vbrt6;http://i.imgur.com/CvbE7oH.png
"I'm not going to do your homework for you. These are basic facts for anyone who has spent even a modest amount of time studying how Blockchains work; evidently you haven't.";-9;1;False;vakeraj;dlzkiso;On /r/bitcoin right now.;6vbrt6;http://i.imgur.com/CvbE7oH.png
Your name looks familiar. Spore trader?;2;1;False;Sovereign_Curtis;dlzj8u4;On /r/bitcoin right now.;6vbrt6;http://i.imgur.com/CvbE7oH.png
Yes. It has been removed.;3;1;False;TIP_ME_COINS;dlz9ydg;On /r/bitcoin right now.;6vbrt6;http://i.imgur.com/CvbE7oH.png
We'll see;0;2;False;Vaukins;dlzjukk;On /r/bitcoin right now.;6vbrt6;http://i.imgur.com/CvbE7oH.png
"> Because Satoshi was last active almost 7 years ago

Not an argument

> and we know a **lot** more about blockchains and their limitations than back then.

Like?

> Bitcoin transactions externalize their cost onto every node, which are uncompensated in their role of guaranteeing the integrity of each block.

Citation needed

> Moreover, without a blocksize cap, larger miners will have a distinct advantage over smaller miners, because they can propagate and mine upon new blocks internally, before the rest of the network.

Are you considering p2p mining pools? - distributed solutions to hedge block difficulty. Also math plz";8;2;False;anthero;dlzkfkz;On /r/bitcoin right now.;6vbrt6;http://i.imgur.com/CvbE7oH.png
":/

<- Wipes away mud.  Gets up.  Goes back to work 

Have a lovely day x";9;0;False;smeggletoot;dlze968;On /r/bitcoin right now.;6vbrt6;http://i.imgur.com/CvbE7oH.png
Loud and clear on the last part...what is the ratio of BTC to BCH in your portfolio, if you don't mind me asking?;7;2;False;BlockchainBlitzkrieg;dlziohb;On /r/bitcoin right now.;6vbrt6;http://i.imgur.com/CvbE7oH.png
Fuck, someone get the /r/bitcoin mods some Alocane, they're gonna need some burn cream. ;14;0;False;w00ly;dlzdu67;On /r/bitcoin right now.;6vbrt6;http://i.imgur.com/CvbE7oH.png
Oh I meant the admin/moderators in that context, not the users. I agree. ;4;1;False;Vespco;dlzhi3u;On /r/bitcoin right now.;6vbrt6;http://i.imgur.com/CvbE7oH.png
[This](https://www.reddit.com/r/Bitcoin/comments/6val1d/a_5_fee_to_send_100_is_absolutely_ridiculous/dlyuvcc/) comment?;2;1;False;Sovereign_Curtis;dlz2xx7;On /r/bitcoin right now.;6vbrt6;http://i.imgur.com/CvbE7oH.png
"> 2013: uses bitcoin because it's decentralized, puts the user in charge of their own money, and has virtually no fees

> 2017: uses off-chain entities and trusts them with their money, off-chain entities have no accountability, and pays a shitload of fees

At least with credit cards you can sue the fuck out of them. Why would anyone bother using Bitcoin Classic? Introducing bitVISA, it's just like regular ol' VISA, but with higher fees, no accountability, and with much longer transaction times!";14;1;False;Okymyo;dlziwt7;On /r/bitcoin right now.;6vbrt6;http://i.imgur.com/CvbE7oH.png
"Doesn't LN require both parties to be online though to do a transaction?

";2;1;False;poorbrokebastard;dlzl2az;On /r/bitcoin right now.;6vbrt6;http://i.imgur.com/CvbE7oH.png
"Because Satoshi was last active almost 7 years ago and we know a **lot** more about blockchains and their limitations than back then.

Bitcoin transactions externalize their cost onto every node, which are uncompensated in their role of guaranteeing the integrity of each block. Moreover, without a blocksize cap, larger miners will have a distinct advantage over smaller miners, because they can propagate and mine upon new blocks internally, before the rest of the network.";1;1;False;vakeraj;dlzjxsj;On /r/bitcoin right now.;6vbrt6;http://i.imgur.com/CvbE7oH.png
Bitcoin Cash is very inexpensive to use. Fees can be fractions of a penny. So no it won't be eaten up by fees.;10;0;False;cgcardona;dlzj013;On /r/bitcoin right now.;6vbrt6;http://i.imgur.com/CvbE7oH.png
"It's currently down. https://www.reddit.com/r/btc/comments/6vcx4j/cashtipper_update_temporary_closure/

But when it's back if someone tips you you'll get a msg from it asking for a receive address. If you just tip someone you'll get a msg from the bot giving you a deposit address.";3;0;False;cgcardona;dlzako1;On /r/bitcoin right now.;6vbrt6;http://i.imgur.com/CvbE7oH.png
To the moon! :-D;5;0;False;cgcardona;dlz68tu;On /r/bitcoin right now.;6vbrt6;http://i.imgur.com/CvbE7oH.png
Fuck you;-8;2;False;greeneyedguru;dlzdzke;On /r/bitcoin right now.;6vbrt6;http://i.imgur.com/CvbE7oH.png
"My ban which was 120 days has been upgraded to permanent.

For not contributing you say? Seems a weak excuse to permaban someone.";13;1;False;Sovereign_Curtis;dlzj4ds;On /r/bitcoin right now.;6vbrt6;http://i.imgur.com/CvbE7oH.png
"""The sooner yourself and others realise that both r/btc and r/bitcoin comprise members who are all on the same team (bitcoin), the better we can all work together to figure out how we get over the next wave of hurdles.""

Yeah that's the thing though. We aren't on the same side. You guys  censor and manipulate the narrative by deleting comments and quotes from Satoshi, removing posts that don't fit the agenda and banning long time users from the forums, which goes against the nature of a decentralized open source project.  You push ""solutions"" that involve ruining on chain capacity in order to do the corporate L2 solutions. So fucked up. Anyway, no we aren't on the same side...";27;1;False;poorbrokebastard;dlzkz7x;On /r/bitcoin right now.;6vbrt6;http://i.imgur.com/CvbE7oH.png
"This is how I feel. Im making my money in crypto no matter what currency is dominant. so the infighting doesnt rattle me as much. 

One thing I do believe the non-BCH supporting crowd has wrong is that ""Bitcoin"" itself is NOT THE draw for fintech. Making ""bitcoin"" itself into a settlement layer, I have huge doubts about. I do forsee firms using blockchain technology and concepts, ""Bitcoin"" being the proof of concept. ";3;0;False;fastlifeblack;dlzcs4j;On /r/bitcoin right now.;6vbrt6;http://i.imgur.com/CvbE7oH.png
I sub to both, because I know there's FUD on both sides, so I try to see through the bullshit. Sometimes it's difficult, but in the end, all I want is for banks to go away.;24;2;False;j4_jjjj;dlzi49v;On /r/bitcoin right now.;6vbrt6;http://i.imgur.com/CvbE7oH.png
I don't think most are fuckers. I think most have been bullied into silence.;3;1;False;Sovereign_Curtis;dlzdk8u;On /r/bitcoin right now.;6vbrt6;http://i.imgur.com/CvbE7oH.png
"~~Just check my profile. I'm mobile right now.~~

here you go https://www.reddit.com/r/Bitcoin/comments/6val1d/a_5_fee_to_send_100_is_absolutely_ridiculous/";1;0;False;Sovereign_Curtis;dlzj9w8;On /r/bitcoin right now.;6vbrt6;http://i.imgur.com/CvbE7oH.png
I recently paid north of $13 and waited more than three hours.;8;2;False;pecuniology;dlz39k5;On /r/bitcoin right now.;6vbrt6;http://i.imgur.com/CvbE7oH.png
"He's focused on the evolving aspects of blockchain in general and I find that refreshing - so I commented as such. I scan r/btc a couple times a day. Most of what I see is speculators looking to make money. Hence ""rare"". *guy's ";4;0;False;GrilledSauryAndBeer;dlzenpt;On /r/bitcoin right now.;6vbrt6;http://i.imgur.com/CvbE7oH.png
I think your comment fucked some Core devs, hence the sexual harassment accusation. ;20;0;False;Barbarian_;dlzkqbz;On /r/bitcoin right now.;6vbrt6;http://i.imgur.com/CvbE7oH.png
More block space means lower fees. The number of nodes doesn't effect fees.;2;0;False;1s44c;dlz7e6m;On /r/bitcoin right now.;6vbrt6;http://i.imgur.com/CvbE7oH.png
No. More block space means lower fees.;5;0;False;1s44c;dlz7czf;On /r/bitcoin right now.;6vbrt6;http://i.imgur.com/CvbE7oH.png
"Not in any way.

More non-mining nodes have only one positive effect: support for a larger total number of SPV clients (as each SPV client causes a small CPU/memory/bandwidth cost to the full node(s) to which they connect).

Other than that the only important number of full nodes is 1: the one *you* run and trust (should you need the level of validation it provides).";7;0;False;christophe_biocca;dlz6064;On /r/bitcoin right now.;6vbrt6;http://i.imgur.com/CvbE7oH.png
"I'm banned now. 120 days for ""trolling, sexual harassment, promoting altcoins"" 

Scratch that, ban was just upgraded to permanent. Fuck those mods.";6;1;False;Sovereign_Curtis;dlzazr2;On /r/bitcoin right now.;6vbrt6;http://i.imgur.com/CvbE7oH.png
">  $6 fee and 2 hour confirmation time.


Way too generous. ";20;1;False;taycer;dlyzugv;On /r/bitcoin right now.;6vbrt6;http://i.imgur.com/CvbE7oH.png
"https://i.imgur.com/1vkgpw8.png

https://www.reddit.com/r/btc/comments/5h3bvz/western_union_vs_bitcoin_a_2013_throwback/";2;0;False;lowstrife;dlzd5xr;On /r/bitcoin right now.;6vbrt6;http://i.imgur.com/CvbE7oH.png
They locked, tagged, and deleted the thread. And censored all the comments.;27;1;False;DTanner;dlz0tu1;On /r/bitcoin right now.;6vbrt6;http://i.imgur.com/CvbE7oH.png
"Never use np.  I used ""np"" and still got banned by BashCo for ""brigading"": https://www.reddit.com/r/btc/comments/61umvx/just_got_permanently_banned_from_rbitcoin_for/";3;0;False;cryptorebel;dlzdwoh;On /r/bitcoin right now.;6vbrt6;http://i.imgur.com/CvbE7oH.png
Did you get any message from the mods regarding why it was removed?;5;1;False;gotamd;dlz83wo;On /r/bitcoin right now.;6vbrt6;http://i.imgur.com/CvbE7oH.png
"I'd edit this and use it anyway.

Don't let them spread more BS about this sub.";5;0;False;TIP_ME_COINS;dlz2ttd;On /r/bitcoin right now.;6vbrt6;http://i.imgur.com/CvbE7oH.png
"Me talking to noobs about bitcoin 3 years ago:  
Noob: Why/What is bitcoin?  
Me: Bitcoin is this awesome amazing revolutionary tech that allows you to send money in a few minutes to anyone in the world for pennies. On top of that is is completely trustless! Think PayPal but better. PayPal can't lock your account or make you lose your funds in any way!   
Noob: Wow that is incredible! Clearly this is something that current banking systems and other tech can't compete with!  
&nbsp;  
Me talking to noobs about bitcoin now:  
Noob: Why/What is bitcoin?  
Me: It's digital ""gold"" that uses technology to allow you to trade it without trust involved.  
Noob: How is that any different than real gold? Can't I just go to a gold buyer and sell my gold?  
Me: Well yeah..  
Noob: Why would would I even want this fake digital e-gold?  
Me: Well uhhh... theres a limited supply (or something) and uhh.. speculators like to push the price up!  
Noob: Sounds pointless and like gambling. I thought I heard bitcoin was some revolutinary tech that was supposed to change the world.  
Me: Yeah me too...  ";77;3;False;bigfartchili;dlz2hzk;On /r/bitcoin right now.;6vbrt6;http://i.imgur.com/CvbE7oH.png
"And I've been banned for 120 days for ""trolling, sexual harassment, promoting altcoins""";27;3;False;Sovereign_Curtis;dlzaxbt;On /r/bitcoin right now.;6vbrt6;http://i.imgur.com/CvbE7oH.png
Does more nodes mean lower frees?;1;5;False;;dlz5o2g;On /r/bitcoin right now.;6vbrt6;http://i.imgur.com/CvbE7oH.png
Aaaand that is a ban;1;0;False;of_mendez;dlzblgw;On /r/bitcoin right now.;6vbrt6;http://i.imgur.com/CvbE7oH.png
give it a year;2;1;False;of_mendez;dlzcy19;On /r/bitcoin right now.;6vbrt6;http://i.imgur.com/CvbE7oH.png
wow! How are these comments not hidden? The guy is not banned yet?;20;3;False;EnayVovin;dlyzjf3;On /r/bitcoin right now.;6vbrt6;http://i.imgur.com/CvbE7oH.png
It will be back once LN is up and running... with the word 'instant' added. ;-10;4;False;Vaukins;dlzbfe0;On /r/bitcoin right now.;6vbrt6;http://i.imgur.com/CvbE7oH.png
Ban has been upgraded to permanent. No reason given.;39;2;False;Sovereign_Curtis;dlzj57k;On /r/bitcoin right now.;6vbrt6;http://i.imgur.com/CvbE7oH.png
Those were the days we believed in something that wasn't real. You can't have a widely used blockchain that is decentralized **and** cheap.;-20;2;False;vakeraj;dlzegmp;On /r/bitcoin right now.;6vbrt6;http://i.imgur.com/CvbE7oH.png
If only bitcoin legacy clear transactions as fast as their moderators remove posts, the mempool would have been empty every minute.;67;2;False;MobTwo;dlzafy1;On /r/bitcoin right now.;6vbrt6;http://i.imgur.com/CvbE7oH.png
"Nevermind, it's been removed.

EDIT: /u/Sovereign_Curtis has also been banned for 120 days for his participation in that thread.  
EDIT2: His ban has been made permanent. ";95;2;False;TIP_ME_COINS;dlz1n65;On /r/bitcoin right now.;6vbrt6;http://i.imgur.com/CvbE7oH.png
"Those were good days..

Good to see them back :)

edit: annnnd its gone!";70;2;False;Timetraveller86;dlz0xrp;On /r/bitcoin right now.;6vbrt6;http://i.imgur.com/CvbE7oH.png
"Cool, we already have a promo poster for Lighting Network :D

p.s. Litecoin, Dogecoin, and around 500+ random shitcoins, also have almost-empty, used by no one, chain, so transactions are pennies or free. And yet, they are far behind on value.

BCash ""BCH"" will also go down, well bellow current all-time-low of 5%.

Especially now, as it enters the Osciallation of Death (the 6-hour rule will kill it, miners will gamble it to have super fast blocks with tons of cheap BCH, and then just wait for diff to go down - just do not mine for some time :D)";-3;2;False;metalzip;dlzgblr;On /r/bitcoin right now.;6vbrt6;http://i.imgur.com/CvbE7oH.png
No, it just means greater decentralization and it prevents censorship of transactions (as they can then be propagated through other nodes that don't censor a given transaction). ;2;0;False;PoliticalDissidents;dlzfzis;On /r/bitcoin right now.;6vbrt6;http://i.imgur.com/CvbE7oH.png
More block space means lower fees. The number of nodes doesn't effect fees.;1;0;False;1s44c;dlz7em3;On /r/bitcoin right now.;6vbrt6;http://i.imgur.com/CvbE7oH.png
They are still ten blocks .. ehm posts behind, give them time!;16;0;False;thedogchain;dlyzs5q;On /r/bitcoin right now.;6vbrt6;http://i.imgur.com/CvbE7oH.png
Well done and great creativity there. It is a pleasure to have someone like you in the bitcoin community. ;5;1;False;MobTwo;dlzajn2;On /r/bitcoin right now.;6vbrt6;http://i.imgur.com/CvbE7oH.png
You must be a Bitcoin baller now! ;1;0;False;AnalLeak;dlzjmk5;On /r/bitcoin right now.;6vbrt6;http://i.imgur.com/CvbE7oH.png
"I'm a bot, *bleep*, *bloop*. Someone has linked to this thread from another place on reddit:

- [/r/bestof] [Creator of Bitcoin-Western Union parody from two years ago returns to comment on the current state of Bitcoin and its WU-level fees](https://np.reddit.com/r/bestof/comments/6vdydm/creator_of_bitcoinwestern_union_parody_from_two/)

[](#footer)*^(If you follow any of the above links, please respect the rules of reddit and don't vote in the other threads.) ^\([Info](/r/TotesMessenger) ^/ ^[Contact](/message/compose?to=/r/TotesMessenger))*

[](#bot)";1;0;False;TotesMessenger;dlzhkjy;On /r/bitcoin right now.;6vbrt6;http://i.imgur.com/CvbE7oH.png
"Here's the thread. I'm not using NP because Bashco has already decided to lock and hide the thread, so we can't exactly be accused of brigading now, can we?...

https://www.reddit.com/r/Bitcoin/comments/6val1d/a_5_fee_to_send_100_is_absolutely_ridiculous/";27;3;False;Sovereign_Curtis;dlz1v57;On /r/bitcoin right now.;6vbrt6;http://i.imgur.com/CvbE7oH.png
Wish I could get notifications every time you post lol;2;1;False;WhatMixedFeelings;dlzdvhp;On /r/bitcoin right now.;6vbrt6;http://i.imgur.com/CvbE7oH.png
Can confirm. Was a regular since 2011.;11;2;False;seattlewebguy;dlz3tdf;On /r/bitcoin right now.;6vbrt6;http://i.imgur.com/CvbE7oH.png
"Interesting viewpoint. Thanks for the work you've been doing.


/u/CashTipper tip 0.50 USD";6;2;False;;dlz7pxa;On /r/bitcoin right now.;6vbrt6;http://i.imgur.com/CvbE7oH.png
"Awesome work! I've been showing people that graphic for a while. Thanks!

/u/CashTipper tip 1 USD";10;4;False;cgcardona;dlz64aq;On /r/bitcoin right now.;6vbrt6;http://i.imgur.com/CvbE7oH.png
FYI I got banned for my participation in that thread and that comment got deleted...;17;1;False;Sovereign_Curtis;dlzc1o1;On /r/bitcoin right now.;6vbrt6;http://i.imgur.com/CvbE7oH.png
