body;score;nb_replies;stickied;author;id;post_title;post_id;post_link
"Nowhere, and they even put up a bunch of myths about segwit https://blockstream.com/2017/07/31/segwit-myths-debunked.html

Myth 1, blockstream have patents... 

They literally come out and say they don't have them and people still don't believe it. ";2;3;False;Crully;dlyr2oy;Blockstream threatening legal action against segwit2x due to Segwit patents. All competing software now requires their consent. BCH is the only way forward.;6vadfi;https://www.reddit.com/r/btc/comments/6vadfi/blockstream_threatening_legal_action_against/
No where, OP lied.;11;2;False;14341;dlypt5l;Blockstream threatening legal action against segwit2x due to Segwit patents. All competing software now requires their consent. BCH is the only way forward.;6vadfi;https://www.reddit.com/r/btc/comments/6vadfi/blockstream_threatening_legal_action_against/
Blockstream doesn't have a patent on Segwit though, that's just FUD. Also many countries don't recognize software patents making them very ineffective. Notice how we're all off using x264 just fine despite being in violation of MPEG LA's patents?;8;0;False;PoliticalDissidents;dlzcw8b;Blockstream threatening legal action against segwit2x due to Segwit patents. All competing software now requires their consent. BCH is the only way forward.;6vadfi;https://www.reddit.com/r/btc/comments/6vadfi/blockstream_threatening_legal_action_against/
"You left out one vital part.

>**Based on Blockstreamâ€™s behavior in the Bitcoin community, I have become absolutely certain that Segwit contains patents** that Blockstream and/or their owners have planned to use offensively. **I base this not on having read the actual patents**, for they can be kept secret for quite some time; **I base this on observing Blockstreamâ€™s behavior**

And I'm the king is Siam, because I said so it must be true, right?

He's making a bold speculative claim. They don't actually own patents on Segwit this whole thread is  just FUD.";0;0;False;PoliticalDissidents;dlzdu3j;Blockstream threatening legal action against segwit2x due to Segwit patents. All competing software now requires their consent. BCH is the only way forward.;6vadfi;https://www.reddit.com/r/btc/comments/6vadfi/blockstream_threatening_legal_action_against/
"Gregory Maxwell:

Blockstream does not have any patents, patent applications, provisional patent applications, or anything similar, related to segwit. As is the case for other major protocol features, the Bitcoin developers worked carefully to not create patent complications. Segwit was a large-scale collaboration across the community, which included people who work for Blockstream among its many contributors.

Moreover, because the public disclosure of segwit was more than a year ago, we could not apply for patents now.

In the prior thread where this absurdity was alleged on Reddit I debunked it forcefully. Considering that Rick directly repeated the tortured misinterpretation of our patent pledge from that thread (a pledge which took an approach that was lauded by multiple online groups), I find it hard to believe that he missed these corrections, doubly so in that he provides an incomplete response to them as though he were anticipating a reply, when really heâ€™d already seen the rebuttal and should have known that there was nothing to these claims.

As an executive of Blockstream and one of the contributors to segwit, my straightforward public responses 1) that we do not, have not, will not, and can not apply for patents on segwit, 2) that if had we done so we would have been ethically obligated to disclose it, and 3) that even if we had done so our pledge would have made it available to everyone not engaging in patent aggression (just as the plain language of our pledge states): If others depended upon these responses, it would create a reliance which would preclude enforcement by Blockstream or our successors in interest even if the statements were somehow all untrueâ€“or so the lawyers tell me.

In short, Rick Falkvingeâ€™s allegations are entirely without merit and are supported by nothing more than pure speculation which had already been debunked.
";1;1;False;rain-is-wet;dlzj8nl;Blockstream threatening legal action against segwit2x due to Segwit patents. All competing software now requires their consent. BCH is the only way forward.;6vadfi;https://www.reddit.com/r/btc/comments/6vadfi/blockstream_threatening_legal_action_against/
This is why patents need to die.;1;0;False;NimbleCentipod;dlz42e7;Blockstream threatening legal action against segwit2x due to Segwit patents. All competing software now requires their consent. BCH is the only way forward.;6vadfi;https://www.reddit.com/r/btc/comments/6vadfi/blockstream_threatening_legal_action_against/
"That's been debunked, there are no segwit patents

https://blockstream.com/2017/07/31/segwit-myths-debunked.html

Myth 1: Blockstream has patents in SegWit.

No, we donâ€™t. We donâ€™t know of any patents anywhere that apply to SegWit. We have not applied for patents on SegWit, nor are we going to. If anyone (including us) was considering it, it would already be too late because the public disclosure of SegWit was more than a year ago.";-8;6;False;Crully;dlyr640;Blockstream threatening legal action against segwit2x due to Segwit patents. All competing software now requires their consent. BCH is the only way forward.;6vadfi;https://www.reddit.com/r/btc/comments/6vadfi/blockstream_threatening_legal_action_against/
He does not mention any patent. As far as i know they don't have any patent for Segwit, they have some patents but no Segwit. If the patent does exist please link to it.;3;2;False;;dlyyl4w;Blockstream threatening legal action against segwit2x due to Segwit patents. All competing software now requires their consent. BCH is the only way forward.;6vadfi;https://www.reddit.com/r/btc/comments/6vadfi/blockstream_threatening_legal_action_against/
"Why did you quote that whole thing from the link that's already in the original post?  That seems to just be speculation, without any actual evidence.  There isn't any information in that that's helpful for this discussion. 

There is an actual discussion about whether there are patents or not, but people are downvoting it, even though it seems to be the only actual fair discussion of the facts surrounding this... https://www.reddit.com/r/btc/comments/6vadfi/blockstream_threatening_legal_action_against/dlyr640/

It's interesting to see what the actual patents and facts are, not just some random opinion.  I thought r/BTC was supposed to be against censorship, but people seem to downvote anyone who even asks questions or brings up opposing opinions or facts.";13;3;False;thbt101;dlz0c9x;Blockstream threatening legal action against segwit2x due to Segwit patents. All competing software now requires their consent. BCH is the only way forward.;6vadfi;https://www.reddit.com/r/btc/comments/6vadfi/blockstream_threatening_legal_action_against/
"Yeah, but it's the patents on ASICboost we all need to be worried about! /s

Here's a funny thing. I had originally thought that switching to Segwit meant ASICboost would break and not work anymore, but it's only *covert* ASICboost that can't be done anymore. You can still use ASICboost on Segwit chain, but it now becomes public knowledge. In other words, if a miner is using ASICboost without licensing the technology from the patent holder, they will be easily caught red handed.

But what about Bitcoin Cash? Go ahead and infringe on the ASICboost patent all you want. You likely won't ever be caught. Because there's no way to know if a miner is using ASICboost unless you physically have access to their data center and can examine the ASIC hardware/software.";1;0;False;;dlz26lu;Blockstream threatening legal action against segwit2x due to Segwit patents. All competing software now requires their consent. BCH is the only way forward.;6vadfi;https://www.reddit.com/r/btc/comments/6vadfi/blockstream_threatening_legal_action_against/
"> Is this just FUD? Are there actual Segwit patents or not??

Mark from Blockstream here. We have absolutely no patents on segwit, and the window for filing patents expired some time ago. OP is bonkers and this is pure FUD.";1;1;False;maaku7;dlzb4xm;Blockstream threatening legal action against segwit2x due to Segwit patents. All competing software now requires their consent. BCH is the only way forward.;6vadfi;https://www.reddit.com/r/btc/comments/6vadfi/blockstream_threatening_legal_action_against/
Okay, let's say they have a patent for Segwit. Are they really allowed to fight against Segwit2X on that basis alone? If my understanding is correct, Segwit2X simply aims to combine Segwit and the 2X increase to Bitcoin's block size. The last time I checked, flat increase in Bitcoin's block size has absolutely nothing to do with Segwit itself. Am I wrong?;1;0;False;anothga;dlyz846;Blockstream threatening legal action against segwit2x due to Segwit patents. All competing software now requires their consent. BCH is the only way forward.;6vadfi;https://www.reddit.com/r/btc/comments/6vadfi/blockstream_threatening_legal_action_against/
I'd sue too if a custodian voluntarily breeches security of my assets by knowingly introducing replay vulnerability. I don't trust custodians with my coins but if i did and they did this, I'd sue ;1;0;False;CONTROLurKEYS;dlyyazb;Blockstream threatening legal action against segwit2x due to Segwit patents. All competing software now requires their consent. BCH is the only way forward.;6vadfi;https://www.reddit.com/r/btc/comments/6vadfi/blockstream_threatening_legal_action_against/
"This sounds scary, but I couldn't find any actual links to the actual patents that this article claims exist.

Is this just FUD?  Are there actual Segwit patents or not??";3;3;False;thbt101;dlyzz3t;Blockstream threatening legal action against segwit2x due to Segwit patents. All competing software now requires their consent. BCH is the only way forward.;6vadfi;https://www.reddit.com/r/btc/comments/6vadfi/blockstream_threatening_legal_action_against/
Make lambo not lombo;3;0;False;platypusmusic;dlyvsym;Blockstream threatening legal action against segwit2x due to Segwit patents. All competing software now requires their consent. BCH is the only way forward.;6vadfi;https://www.reddit.com/r/btc/comments/6vadfi/blockstream_threatening_legal_action_against/
Dump those fuckers and attack their network hard. There should be ZERO legacy Bitcoin fork with them in control. If they want to continue they should be forced onto their own shit little fork. ;8;1;False;Yheymos;dlyqfl1;Blockstream threatening legal action against segwit2x due to Segwit patents. All competing software now requires their consent. BCH is the only way forward.;6vadfi;https://www.reddit.com/r/btc/comments/6vadfi/blockstream_threatening_legal_action_against/
"I was just researching Blockstream and their granted patents and patent applications on the USPTO. Can anyone who knows more about software than me look at the patent applications by Gregory Maxwell and Adam Bach:

20160330034 A1
20160358165 A1

These have not yet been granted but the could claim priority on the basis of applications.

Also, interesting link I found in my research: http://patentsinthenews.blogspot.ie/2017/06/list-of-blockchain-related-us-patent.html";4;0;False;Dense_Body;dlzatl3;Blockstream threatening legal action against segwit2x due to Segwit patents. All competing software now requires their consent. BCH is the only way forward.;6vadfi;https://www.reddit.com/r/btc/comments/6vadfi/blockstream_threatening_legal_action_against/
"Since Block stream denies the existence of Segwit Patents, and nobody has come forward with Patent numbers: I don't think the implied legal action has anything to do with Patents.

Trademarks on the Bitcoin name may apply, but I don't think [anybody holds that either](http://www.newsbtc.com/2015/03/03/us-application-bitcoin-trademark-turned/)

They may have a Copyright claim, but the software is under a MIT license, while most of the BIPS are declared Public Domain.

They may try to convince some Government agency that fraud is involved. However, with the changes they are making to Bitcoin, that may back-fire.
";19;1;False;phillipsjk;dlyuv4i;Blockstream threatening legal action against segwit2x due to Segwit patents. All competing software now requires their consent. BCH is the only way forward.;6vadfi;https://www.reddit.com/r/btc/comments/6vadfi/blockstream_threatening_legal_action_against/
"Eric Lombrozo is not employed by Blockstream, but by Ciphrex.

He doesn't mention any patents, but thinks Segwit2x without replay protection is a Cyber attack.

His full email:
> To be clear, it isn't up to any of us. A good portion of the community
wants to keep the legacy chain. NYA signers are free to create a hard fork,
but not adding replay protection suggests intent to destroy the legacy
chain. As long as a lot of people still want the legacy chain, attempts to
destroy it will be treated as an attack on the property of all these
people. It constitutes a serious cyberattack and decisive action against
it, both technical and legal, has been prepared.

I do not agree with him, just want to provide correct information.

";6;1;False;Erik_Hedman;dlzak6a;Blockstream threatening legal action against segwit2x due to Segwit patents. All competing software now requires their consent. BCH is the only way forward.;6vadfi;https://www.reddit.com/r/btc/comments/6vadfi/blockstream_threatening_legal_action_against/
"Whatever the reality is, all this politicking can't be good for BTC. 

BCH on the other hand...";3;0;False;;dlz0v6f;Blockstream threatening legal action against segwit2x due to Segwit patents. All competing software now requires their consent. BCH is the only way forward.;6vadfi;https://www.reddit.com/r/btc/comments/6vadfi/blockstream_threatening_legal_action_against/
Can someone post the patent numbers so they can be verified [here?](http://patft.uspto.gov/netahtml/PTO/srchnum.htm) The he said she said debate of whether or not the patents exist is going in circles.;13;1;False;shitpersonality;dlyty75;Blockstream threatening legal action against segwit2x due to Segwit patents. All competing software now requires their consent. BCH is the only way forward.;6vadfi;https://www.reddit.com/r/btc/comments/6vadfi/blockstream_threatening_legal_action_against/
The thing is: they would have done this eventually even if we hadn't forked. They were always trying to own bitcoin.;9;0;False;BitcoinIsTehFuture;dlyxs5s;Blockstream threatening legal action against segwit2x due to Segwit patents. All competing software now requires their consent. BCH is the only way forward.;6vadfi;https://www.reddit.com/r/btc/comments/6vadfi/blockstream_threatening_legal_action_against/
"Have you guys ever seen a houseowner invite some friends into his house, only to end up having the friends kicked the houseowner out of his own house?

Well, that's what happened to Gavin Andresen, the original developer of bitcoin who worked with Satoshi. Gavin invited these core guys into the bitcoin development team only to be kicked out.

I'm sorry guys, but blockstream/core are unethical liars. I will stand with bitcoin cash. Let's make bitcoin great again!";15;0;False;MobTwo;dlyvs2f;Blockstream threatening legal action against segwit2x due to Segwit patents. All competing software now requires their consent. BCH is the only way forward.;6vadfi;https://www.reddit.com/r/btc/comments/6vadfi/blockstream_threatening_legal_action_against/
Where does it say patents?;46;4;False;erikd;dlyp3av;Blockstream threatening legal action against segwit2x due to Segwit patents. All competing software now requires their consent. BCH is the only way forward.;6vadfi;https://www.reddit.com/r/btc/comments/6vadfi/blockstream_threatening_legal_action_against/
"It all becomes clear:
https://falkvinge.net/2017/05/01/blockstream-patents-segwit-makes-pieces-fall-place/

>   I was a representative of Microsoft. I would meet with people from Nokia, Ericsson, AT&T, and many other corporate names youâ€™d recognize instantly, in small groups to negotiate standards going forward.

 >   One thing that was quite clear in these negotiations was that everybody was trying to get as much as possible of their own patent portfolio into the industry standard, while still trying to maintain a faÃ§ade of arguing purely on technical merits. Some were good at it. Some were not very good at it at all.

>    One of the dead-sure telltale signs of the latter was that somebody would argue that feature X should use mechanism Y (where they had undisclosed patent encumbrance) based on a technical argument that made no sense. When us technical experts in the room pointed out how the argument made no sense, they would repeat that feature X should absolutely use mechanism Y, but now based on a completely new rationale, which didnâ€™t make any sense either.

 >   The real reason they were pushing so hard for mechanism Y, of course, was that they had patents covering mechanism Y and wanted their patented technology to go into the industry standard, but they were unable to make a coherent argument that withstood technical scrutiny for why it was the preferable solution at hand, with or without such encumbrance.
";121;7;False;livecatbounce;dlyqgwh;Blockstream threatening legal action against segwit2x due to Segwit patents. All competing software now requires their consent. BCH is the only way forward.;6vadfi;https://www.reddit.com/r/btc/comments/6vadfi/blockstream_threatening_legal_action_against/
"My post from [9 months ago.](https://www.reddit.com/r/btc/comments/5cinxq/sergio_demian_lerner_on_twitter_funny/d9x1yce/)

> Well, there we have it folks, Blockstream is playing the Bitcoin community like a fucking fiddle right now, and all his cronies are playing along. FYI, these published patents were lodged 18 months ago!! That is if this is in line with the American patent system. So, soon after Blockstream was formed, they've been scrambling to lock down every single piece of intellectual property they can get their hands on, and since CORE has been employed since Blockstream was formed, that means EVERY SINGLE PIECE OF IP PRODUCED BY THEM BELONGS TO BLOCKSTREAM TOO, SegWit, Lightning, whatever else they have waiting in the wings. All theirs.
> 
> I believe a slow clap is in order.
> 
> THIS is why they've fought tooth and nail to prevent a blocksize increase, and if SegWit had been deployed in time, they'd have fucked the miners, and the entire community by being able to completely control, WHO, and HOW Seg Wit transactions can be used. Don't worry your pretty little heads people, there's almost certainly a SW patent already lodged. 
> 
> I fucking said it 3 months ago:
> 
> >[Yep, this is not a free market, this is a cornered market, or depending on your point of view, a natural monopoly. Big money pays to lock down the majority of Core developers with fat paycheques, spreads poisonous PR (compliments of Greg and Theymos) and threaten to take their ball and go home if the miners consider alternatives. Lets not forget their plans for a Defensive Patent portfolio, yeah, ""defensive"".
> 
> >Users/Merchants cannot force a change of software without the miners, and as long as the miners continue to be willing slaves to Blockstream, Bitcoin is going nowhere except where Blockstream wants it to go.
>  https://www.reddit.com/r/btc/comments/4vcicl/cnledger_andreas_the_market_decided_to_strongly/d5xetg1/
> 
> and here:
> 
> >The fact that they didn't have a single patent before setting up the pledge is proof enough to me that this was purely a defensive move based on the news of some other corporate planning to monetize Craig Wright's patents.
> 
> >It's still a good move to protect Bitcoin while at the same time protecting Blockstream.
> 
> >>[â€“]ferretinjapan [+72] 1 point 3 months ago 
> 
> >>I wouldn't be so sure. Patents take a long while to be approved so the fact that they don't have them in hand does little to assuage me, they could've filed dozens already for all we know and they're simply in the early stages of approval, and besides, you can be certain that when Blockstream gets sold (not if but when as BS is a startup, they're designed to be sold) those patents will pass from their control and any previous agreements will mean nothing.
> 
> >>If they got the patents and gave them to a non-profit I'd trust their motives, as doing so would serve exactly the same end and ensure the patents are not abused, not by them, or by anyone else, but I bet Greg will fight very, very hard to avoid that situation. He'll come up with all sorts of excuses, handwave it away, etc. . Those patents are a means of controlling people he currently can't herd according right now.

**I hope you people are fucking paying attention now.** I eagerly await to see what this ""decisive legal action"" will be. I have no doubt that they've been laying a nice little IP trail to fuck any and all miners that try to hardfork.
";77;4;False;ferretinjapan;dlyrdm5;Blockstream threatening legal action against segwit2x due to Segwit patents. All competing software now requires their consent. BCH is the only way forward.;6vadfi;https://www.reddit.com/r/btc/comments/6vadfi/blockstream_threatening_legal_action_against/
"Never let anyone forget:

> LOL. I suppose the same people who believed his prior fraud will also believe you can patent technology that has been public for five years?
Based on his prior writing we can expect these applications to be barely coherent technobabble. Anyone can open applications, in the US at least it costs fairly little. I'd be surprised if any of these issue, and especially surprised if they say anything remotely interesting.
Presumably this is just the next phase of the fraud monetization scheme. - /u/nullc

https://np.reddit.com/r/btc/comments/4ozflt/craig_satoshi_nakamoto_wright_tries_to_dominate/d4grvjf/";22;1;False;phro;dlysa8b;Blockstream threatening legal action against segwit2x due to Segwit patents. All competing software now requires their consent. BCH is the only way forward.;6vadfi;https://www.reddit.com/r/btc/comments/6vadfi/blockstream_threatening_legal_action_against/
IP is cancer in all forms.;8;1;False;trenescese;dlz1af0;Blockstream threatening legal action against segwit2x due to Segwit patents. All competing software now requires their consent. BCH is the only way forward.;6vadfi;https://www.reddit.com/r/btc/comments/6vadfi/blockstream_threatening_legal_action_against/
wow wow wow. This leaves the only true bitcoin as BCH. the only one truly decentralized and free. ;3;1;False;laughncow;dlz81y3;Blockstream threatening legal action against segwit2x due to Segwit patents. All competing software now requires their consent. BCH is the only way forward.;6vadfi;https://www.reddit.com/r/btc/comments/6vadfi/blockstream_threatening_legal_action_against/
Legal action against who? Decentralized, biatch. Bring it on. ;3;0;False;cryptoschwag;dlz88c9;Blockstream threatening legal action against segwit2x due to Segwit patents. All competing software now requires their consent. BCH is the only way forward.;6vadfi;https://www.reddit.com/r/btc/comments/6vadfi/blockstream_threatening_legal_action_against/
"Ahem, how are these patents kept secret?  I don't think it is possible. http://www.wipo.int/patents/en/faq_patents.html 

Anyway, the monsanto scenario seems to be on.";3;0;False;sigma02;dlzbra9;Blockstream threatening legal action against segwit2x due to Segwit patents. All competing software now requires their consent. BCH is the only way forward.;6vadfi;https://www.reddit.com/r/btc/comments/6vadfi/blockstream_threatening_legal_action_against/
So Blockstream is not threatening legal action. Why didn't you say so, could have saved me a few seconds.;4;0;False;ErdoganTalk;dlyrlnh;Blockstream threatening legal action against segwit2x due to Segwit patents. All competing software now requires their consent. BCH is the only way forward.;6vadfi;https://www.reddit.com/r/btc/comments/6vadfi/blockstream_threatening_legal_action_against/
"a bit like when the CEO cuckold of Blockstream threatened our saviour Jeff Garzik recently about legal repercussions and how he is going to be arrested 

I wouldn't put it past them to take legal action and protect their patents in SegShit";3;0;False;40422009973;dlyto6r;Blockstream threatening legal action against segwit2x due to Segwit patents. All competing software now requires their consent. BCH is the only way forward.;6vadfi;https://www.reddit.com/r/btc/comments/6vadfi/blockstream_threatening_legal_action_against/
