body;score;nb_replies;stickied;author;id;post_title;post_id;post_link
"I wish not to prove you wrong, but instead to disagree with your hidden premise that since many companies are patenting tech relative to the blockchain, it is ok to do so.

Expecially a company that is in so tightly with the Core devs.

For me, any piece of technology that is patented is directly unfit to be part of Bitcoin, but that is exactly Blockstream and Core roadmap.";1;1;False;mtrycz;dlzfykh;Blockstream threatening legal action against segwit2x due to Segwit patents. All competing software now requires their consent. BCH is the only way forward.;6vadfi;https://www.reddit.com/r/btc/comments/6vadfi/blockstream_threatening_legal_action_against/
To you. I thought you meant that this patent was covered Liquid (which I don't think it does). I apologise if I misunderstood.;1;0;False;putin_vor;dlzdmei;Blockstream threatening legal action against segwit2x due to Segwit patents. All competing software now requires their consent. BCH is the only way forward.;6vadfi;https://www.reddit.com/r/btc/comments/6vadfi/blockstream_threatening_legal_action_against/
"so why doesn't bitcoin or bitcoin cash have sidechains? why is it only after segwit can the LN be implemented? are you saying bitcoin cash can have the LN without a code update?

>Basically their (money making) business revolves around things that sit on top of bitcoin

yeah.. definitely why they want to keep the blocksize 1mb. maximize their profits.

> they may even look to have an implementation of LN to make money on,

https://blockstream.com/liquid/

>that doesn't stop the business side if blockstream making money in other areas, plenty of open source companies do that. 

how do people not see this as a corporate takeover or bitcoin.. considering they control bitcoin core, it's a huge conflict of interests and open source at this point only refers to free labor.";1;0;False;utu_;dlzklld;Blockstream threatening legal action against segwit2x due to Segwit patents. All competing software now requires their consent. BCH is the only way forward.;6vadfi;https://www.reddit.com/r/btc/comments/6vadfi/blockstream_threatening_legal_action_against/
">Liquid has never needed Segwit. Blockstream has never needed Segwit. Nobody at Blockstream has ever made any claim to the contrary.

I never said they did. See, if you interpret ""enable"" as ""need"", then by that logic you'd agree the Blockstream/Core shills have been claiming we need SegWit for scaling. 

Funny how ever sice the ""SegWit2X is inferior to Bitcoin Cash"" got top votes on /r/Bitcoin, the narrative from Blockstream/Core has changed.

Straight from the echo chamber /r/Bitcoin:

>https://np.reddit.com/r/Bitcoin/comments/63gasd/does_ln_need_segwit_andreas_antonopoulos_yes/

>**Does LN need SegWit? Andreas Antonopoulos: Yes, unless you implement it in a very inefficient and complicated way.**

>submitted 4 months ago by Smadis

Why are you people fighting your own story?

Edit, just found this:

>https://np.reddit.com/r/btc/comments/6udrsz/jeff_garzik_removed_from_bitcoin_github_repo_for/dluvm8d/

>andytoshi 1 point 2 days ago

>I am paid by Blockstream

LOL well that explains a lot.";3;0;False;X-88;dlz7mg1;Blockstream threatening legal action against segwit2x due to Segwit patents. All competing software now requires their consent. BCH is the only way forward.;6vadfi;https://www.reddit.com/r/btc/comments/6vadfi/blockstream_threatening_legal_action_against/
Where is in roadmap you spotted a patented technology? I'm tired arguing about patent with people who can't even show me which part of Core implementation is patented by Blockstream. ;5;1;False;14341;dlzg70k;Blockstream threatening legal action against segwit2x due to Segwit patents. All competing software now requires their consent. BCH is the only way forward.;6vadfi;https://www.reddit.com/r/btc/comments/6vadfi/blockstream_threatening_legal_action_against/
[deleted];3;1;False;;dlz0bsa;Blockstream threatening legal action against segwit2x due to Segwit patents. All competing software now requires their consent. BCH is the only way forward.;6vadfi;https://www.reddit.com/r/btc/comments/6vadfi/blockstream_threatening_legal_action_against/
">It is far from clear that bitcoin cash is a success. Once it has lived a year or two you might be proven correct.

Irrelevant, it proved hard fork can be done cleanly and quickly.

>But then very little infrastructure and services have actually switched over. A bitcoin upgrade hard fork isn't supposed to leave a fall back legacy chain. A split is by design less dangerous than a upgrade hard fork.

Again, irrelevant, that's just yet more bullshit from you when the issue here is you could simply change the block size from 1MB to 2MB.

We've had hard fork anyway, when Core screwed up the level db switch, hard forked the fix within a day, and that was an emergency with zero planning and heads up. Changing the block size from 1MB to 2MB is much simpler than that.

";2;1;False;X-88;dlza7ts;Blockstream threatening legal action against segwit2x due to Segwit patents. All competing software now requires their consent. BCH is the only way forward.;6vadfi;https://www.reddit.com/r/btc/comments/6vadfi/blockstream_threatening_legal_action_against/
"> I just love how you Blockstream/Core shills are so desperate, you idiots are now forced to change the script.

> For over a year you morons have been selling SegWit as the second coming, now the new story is ""well... we don't actually need it""

> ROFL fucking retards.

You are the one desperate with all aggressiveness.  You are being emotional instead of rational.

I'm not siding with Core or anyone, i am just honest. Factually Segwit is not patented and you and OP are spreading lies.

> Without Segwit There is No Lightning Network

LN is not a Sidechain and is not patented by anyone, not even by its inventor that has no relation to Core/Blockstream.";2;0;False;;dlz6wue;Blockstream threatening legal action against segwit2x due to Segwit patents. All competing software now requires their consent. BCH is the only way forward.;6vadfi;https://www.reddit.com/r/btc/comments/6vadfi/blockstream_threatening_legal_action_against/
"It is far from clear that bitcoin cash is a success. Once it has lived a year or two you might be proven correct. 

But then very little infrastructure and services have actually switched over. A bitcoin upgrade hard fork isn't supposed to leave a fall back legacy chain. A split is by design less dangerous than a upgrade hard fork.";2;1;False;Pretagonist;dlz9uhe;Blockstream threatening legal action against segwit2x due to Segwit patents. All competing software now requires their consent. BCH is the only way forward.;6vadfi;https://www.reddit.com/r/btc/comments/6vadfi/blockstream_threatening_legal_action_against/
"""sidecoin"" is not a word. It's called sidechain, because it is a blockchain. LN doesn't have a blockchain. What the two have in common is that transactions happen outside of the main chain, but that's about it. And (this was the point of my original reply), there's no relation between sidechains and segwit";3;0;False;pueblo_revolt;dlzk3oz;Blockstream threatening legal action against segwit2x due to Segwit patents. All competing software now requires their consent. BCH is the only way forward.;6vadfi;https://www.reddit.com/r/btc/comments/6vadfi/blockstream_threatening_legal_action_against/
Thanks, I'll read it soon. ðŸ‘;1;0;False;nimblecoin;dlz4j9m;Blockstream threatening legal action against segwit2x due to Segwit patents. All competing software now requires their consent. BCH is the only way forward.;6vadfi;https://www.reddit.com/r/btc/comments/6vadfi/blockstream_threatening_legal_action_against/
"*""when debate is lost, slander becomes the tool of the loser""*";1;0;False;putin_vor;dlz0ww4;Blockstream threatening legal action against segwit2x due to Segwit patents. All competing software now requires their consent. BCH is the only way forward.;6vadfi;https://www.reddit.com/r/btc/comments/6vadfi/blockstream_threatening_legal_action_against/
No, he's just one of many victims being lied about something he can't verify.;2;0;False;14341;dlz3x1o;Blockstream threatening legal action against segwit2x due to Segwit patents. All competing software now requires their consent. BCH is the only way forward.;6vadfi;https://www.reddit.com/r/btc/comments/6vadfi/blockstream_threatening_legal_action_against/
"Nowhere did I advocate violence. How the hell would you know if I wasn't believing that dumb fucks should die early from natural causes.
";1;1;False;X-88;dlz8pit;Blockstream threatening legal action against segwit2x due to Segwit patents. All competing software now requires their consent. BCH is the only way forward.;6vadfi;https://www.reddit.com/r/btc/comments/6vadfi/blockstream_threatening_legal_action_against/
">A hard fork is the very definition of changing the fundamentals. You actually break the chain. While the code to add blocksize isn't an issue the procedure is.

I guess there's different views on that. Monero for example does all its upgrades via hard forks and there never were any issues.

It only becomes an issue if there is some influential party that makes it controversial.

If Core had pushed a hard fork to increase blocksize limit in 2013 everyone in the Bitcoin economy + all the miners would have accepted it. It would have been a non-issue.

Now after censorship, smear campaigns and kicking out several veteran Bitcoin devs the community has become so polarized, that it's much harder to find consensus for hard forks. SegWit2x seems like a good attempt though. But even now it seem that Core does everything they can to disrupt it. (see recent threats by Eric and 180 turn of r/bitcoin moderation narrative after SegWit got locked in)";1;0;False;uxgpf;dlzd20g;Blockstream threatening legal action against segwit2x due to Segwit patents. All competing software now requires their consent. BCH is the only way forward.;6vadfi;https://www.reddit.com/r/btc/comments/6vadfi/blockstream_threatening_legal_action_against/
">Keep it simple applies to the process, not the code.

LOL did you post that with a straight face?

>There are only a handful of people that can write good cryptocurrency protocol code so it doesn't really matter at all if the code gets a tad complex.

Just how full of shit do you have to be to even post these crap.

>But forcing an entire infrastructure to upgrade at the same time is systematically complex and as such fails KISS massively.

Pfft, all you had to do is change one line, change a number from 1000000 to 2000000.

Instead you make it 100 times more complicated by modifying the way transactions are actually processed and stored on the blockchain.

You're what we call a bullshitter, the likes of you have been saying hardfork needs 6 to 9 months or some shit.

The quick fork of Bitcoin Cash busted your bullshit wide open.

Yet here you are, reading the same bullshit script.
";2;1;False;X-88;dlz9gw5;Blockstream threatening legal action against segwit2x due to Segwit patents. All competing software now requires their consent. BCH is the only way forward.;6vadfi;https://www.reddit.com/r/btc/comments/6vadfi/blockstream_threatening_legal_action_against/
The Lightning Network requires that transaction malleability is fixed. Segwit does that, but other approaches could as well.;0;0;False;sigma_noise;dlz9vbq;Blockstream threatening legal action against segwit2x due to Segwit patents. All competing software now requires their consent. BCH is the only way forward.;6vadfi;https://www.reddit.com/r/btc/comments/6vadfi/blockstream_threatening_legal_action_against/
">Lightening Node doesn't require Segwit.

I just love how you Blockstream/Core shills are so desperate, you idiots are now forced to change the script.

>https://hashing24-bitfury.com/without-segwit-no-lightning-network/

>**Without Segwit There is No Lightning Network**

>February 13, 2017

>**â€œThere are a lot of people working on layer 2 solutions that are waiting for Segwit,â€ says Bitfinex Chief Security Officer Phil Potter in a discussion between core developers, bitcoin ecosystem participants and Bitcoin enthusiast Roger Ver. â€œIf Segwit doesnâ€™t happen, think of the downstream projects. There are eight or nine different Lightning projects being sponsored out there, which will be completely hamstrung without this â€” sure, we have some ways to do payment channels without Segwit, but we donâ€™t have a trustless Lightning Network and the malleability fix is really helpful for that. Fixing malleability has been a holy grail for a long time.â€**

For over a year you morons have been selling SegWit as the second coming, now the new story is ""well... we don't actually need it""

LOL.

";7;0;False;X-88;dlz5049;Blockstream threatening legal action against segwit2x due to Segwit patents. All competing software now requires their consent. BCH is the only way forward.;6vadfi;https://www.reddit.com/r/btc/comments/6vadfi/blockstream_threatening_legal_action_against/
"LN is better described as a sidecoin.

The onchain coin are locked, creating the sidecoin, which is a token held by channel partners transacted between them whose value derives from the expectation of being able to convert it into the future back to an onchain coin.";1;1;False;jessquit;dlzj9q6;Blockstream threatening legal action against segwit2x due to Segwit patents. All competing software now requires their consent. BCH is the only way forward.;6vadfi;https://www.reddit.com/r/btc/comments/6vadfi/blockstream_threatening_legal_action_against/
[deleted];1;1;False;;dlz3o2r;Blockstream threatening legal action against segwit2x due to Segwit patents. All competing software now requires their consent. BCH is the only way forward.;6vadfi;https://www.reddit.com/r/btc/comments/6vadfi/blockstream_threatening_legal_action_against/
[removed];1;1;False;;dlz5pyf;Blockstream threatening legal action against segwit2x due to Segwit patents. All competing software now requires their consent. BCH is the only way forward.;6vadfi;https://www.reddit.com/r/btc/comments/6vadfi/blockstream_threatening_legal_action_against/
[removed];1;1;False;;dlz6ywy;Blockstream threatening legal action against segwit2x due to Segwit patents. All competing software now requires their consent. BCH is the only way forward.;6vadfi;https://www.reddit.com/r/btc/comments/6vadfi/blockstream_threatening_legal_action_against/
"> many customers

Nobody uses them outside of Blockstream's incest circle.

Don't forget that crap is what Samson Mow vouch for before he left (cough *fired*) BTCC:

>BTCC is very excited to be working with Blockstream to roll-out this innovative application of sidechain technology. Liquid is both a practical application of sidechains that allows us to provide nearly instantaneous global interexchange transfers for our users, as well as a major technical milestone that showcases the adaptability of Bitcoin.

>â€” Samson Mow, Chief Operating Officer, BTCC (formerly BTCChina)

If you don't know who Samson Mow is, look up Samson Mow Sahara Desert.";6;1;False;X-88;dlz4mxb;Blockstream threatening legal action against segwit2x due to Segwit patents. All competing software now requires their consent. BCH is the only way forward.;6vadfi;https://www.reddit.com/r/btc/comments/6vadfi/blockstream_threatening_legal_action_against/
">Segwit is conservative. Segwit is adding instead of tearing down and replacing. When you are dealing with a multi billion dollar project you tread very carefully unless you're a moron.

Bullshit, SegWit fails the keep-it-simple test, the ""conservative"" approach would be simply increase the blocksize to 2MB, with no SegWit, no LN, no bullshit. And give more time to people to develop side chain/layer 2 technology.

Not make big changes to the fundalmentals, unless you're a moron.
";4;1;False;X-88;dlz8l1w;Blockstream threatening legal action against segwit2x due to Segwit patents. All competing software now requires their consent. BCH is the only way forward.;6vadfi;https://www.reddit.com/r/btc/comments/6vadfi/blockstream_threatening_legal_action_against/
There's a reason Bitcoin Cash implemented replay protection. I think it's irresponsible not to, especially if the hard fork takes a moral high ground against Core.;1;1;False;nimblecoin;dlz1oku;Blockstream threatening legal action against segwit2x due to Segwit patents. All competing software now requires their consent. BCH is the only way forward.;6vadfi;https://www.reddit.com/r/btc/comments/6vadfi/blockstream_threatening_legal_action_against/
"so segwit isn't the code update that allows bitcoin to have sidechains?

and blockstream doesn't have a patent on to how peg the sidechain to bitcoin?";3;1;False;utu_;dlzjn5b;Blockstream threatening legal action against segwit2x due to Segwit patents. All competing software now requires their consent. BCH is the only way forward.;6vadfi;https://www.reddit.com/r/btc/comments/6vadfi/blockstream_threatening_legal_action_against/
You are pushing their agenda.;1;1;False;putin_vor;dlyzl6d;Blockstream threatening legal action against segwit2x due to Segwit patents. All competing software now requires their consent. BCH is the only way forward.;6vadfi;https://www.reddit.com/r/btc/comments/6vadfi/blockstream_threatening_legal_action_against/
"Well, their original paper from 2014 also stated

> License. This work is released into the public domain.

Would you still have an enforceable patent for the those things?
";2;0;False;nyaaaa;dlz9w9s;Blockstream threatening legal action against segwit2x due to Segwit patents. All competing software now requires their consent. BCH is the only way forward.;6vadfi;https://www.reddit.com/r/btc/comments/6vadfi/blockstream_threatening_legal_action_against/
"I don't see how that wall of text disproves my point. The patent has nothing to do with LN, it's all about methods of transferring money from the main chain to side chains. 

Which parts of the diagram do you think the patent covers?

https://4.bp.blogspot.com/-bqgiBTtfiXs/Vub00zFb-qI/AAAAAAAAlfo/r9dOEZTCZD8s-R8OYVYffCVUWSbM4J1fw/s1600/bitcoin1.png";2;1;False;putin_vor;dlyz4b5;Blockstream threatening legal action against segwit2x due to Segwit patents. All competing software now requires their consent. BCH is the only way forward.;6vadfi;https://www.reddit.com/r/btc/comments/6vadfi/blockstream_threatening_legal_action_against/
So LN is patented? Can you link to the patent?;1;1;False;rawb0t;dlzezpw;Blockstream threatening legal action against segwit2x due to Segwit patents. All competing software now requires their consent. BCH is the only way forward.;6vadfi;https://www.reddit.com/r/btc/comments/6vadfi/blockstream_threatening_legal_action_against/
"> assuming that you're actually not supporting Core

I think they're a mix of malicious and retarded, so no, definitely not. I can't stand how obnoxiously authoritarian they are. But I don't like to just dogpile them indiscriminately, and while their idea of legal action is retarded, I get their argument (which is: ""you're the one who wants to separate, so you should plug the vulnerability that your separation creates"").

>I don't fault them either, and I feel bad for them, but Bitcoin requires people to be sophisticated investors. They need to do their research.

That's fair enough.

> The thing you're not seeing, assuming that you're actually not supporting Core, is that replay protection is the thing that's absolutely essential to Core's survival. Without replay protection, their chain will be stuck at ~30k tx/day roughly it can handle, but with 300k tx/day outstanding to fit on-chain. Even if their miners(just Slush) change the code to only include replay-protected transactions in their blocks, they still won't be able to process anywhere near the volume demanded of the chain.

Be that as it may, it's still a vulnerability. Replaying transactions counts as a hack in my book. It's sort of like being on a pedestrian crossing and expecting the speeding car not to hit you, just because you are ""in the right."" Core should jump out of the way (implement replay protection) in order to save themselves, but I still think the issue of ""right"" is independent of that.

>Meanwhile, replay protection makes upgrading more difficult for every wallet and SPV client. As it stands now, Armory will be compatible with 2x, just change the node. SPV clients aren't affected by blocksize and won't be affected. Breaking those things just to help the Core chain have a marginal chance of survival isn't worth it. Core can add replay protection when they finally hardfork as they should have years ago.

This is a good point I hadn't considered. Bitcoin Cash did implement it though, with seemingly minimal side effects.

>Core can add replay protection when they finally hardfork as they should have years ago.

I agree that they should have hard forked / made an altcoin since their vision is far removed from what Bitcoin's concept is.

___

And btw. thanks for taking my criticism seriously and replying in good faith. It's almost impossible to talk sincerely nowadays. I guess the toxic atmosphere is bleeding in from all the shilling that's been going on and not knowing whether you're talking to a shill.";1;1;False;nimblecoin;dlzhn0o;Blockstream threatening legal action against segwit2x due to Segwit patents. All competing software now requires their consent. BCH is the only way forward.;6vadfi;https://www.reddit.com/r/btc/comments/6vadfi/blockstream_threatening_legal_action_against/
I'm sure someone dealing with SCO said something similar.;-1;0;False;;dlz3wzo;Blockstream threatening legal action against segwit2x due to Segwit patents. All competing software now requires their consent. BCH is the only way forward.;6vadfi;https://www.reddit.com/r/btc/comments/6vadfi/blockstream_threatening_legal_action_against/
Clean Water?;-2;0;False;kaenneth;dlz4lvr;Blockstream threatening legal action against segwit2x due to Segwit patents. All competing software now requires their consent. BCH is the only way forward.;6vadfi;https://www.reddit.com/r/btc/comments/6vadfi/blockstream_threatening_legal_action_against/
Still, the mere fact that they DO have patents on bitcoin is enough to say that there's something fishy going on.;1;1;False;mtrycz;dlza69l;Blockstream threatening legal action against segwit2x due to Segwit patents. All competing software now requires their consent. BCH is the only way forward.;6vadfi;https://www.reddit.com/r/btc/comments/6vadfi/blockstream_threatening_legal_action_against/
Are we sure they would not call it something else?  I agree with you, that in if we were dealing with a respectable company, that had not engaged in FUD and schmear tactics, we could expect them to not create shell companies and/or obfuscate the patent.  I do not feel that is the case we are dealing with.  Segwit stinks of ulterior motives.  Maybe there is none, but it is not so simple as saying there is none.  It would seem if there was none, it would not exist and Bitcoin could have grown 2 years ago without all the ugliness.;-2;1;False;jcrew77;dlyymmt;Blockstream threatening legal action against segwit2x due to Segwit patents. All competing software now requires their consent. BCH is the only way forward.;6vadfi;https://www.reddit.com/r/btc/comments/6vadfi/blockstream_threatening_legal_action_against/
"Liquid is a side-chain, whereas the patent is about the communication between the main chain and side-chains. 

It's like you're trying to equivocate Apache and HTTP, because Apache uses HTTP.";2;1;False;putin_vor;dlzd30c;Blockstream threatening legal action against segwit2x due to Segwit patents. All competing software now requires their consent. BCH is the only way forward.;6vadfi;https://www.reddit.com/r/btc/comments/6vadfi/blockstream_threatening_legal_action_against/
">Correct, those are different terms with different meanings, and to the best of my knowledge have never been conflated outside of this sub.

I just love how you Blockstream/Core shills are so desperate, you idiots are now forced to change the script.

>https://hashing24-bitfury.com/without-segwit-no-lightning-network/

>**Without Segwit There is No Lightning Network**

>February 13, 2017

>**â€œThere are a lot of people working on layer 2 solutions that are waiting for Segwit,â€ says Bitfinex Chief Security Officer Phil Potter in a discussion between core developers, bitcoin ecosystem participants and Bitcoin enthusiast Roger Ver. â€œIf Segwit doesnâ€™t happen, think of the downstream projects. There are eight or nine different Lightning projects being sponsored out there, which will be completely hamstrung without this â€” sure, we have some ways to do payment channels without Segwit, but we donâ€™t have a trustless Lightning Network and the malleability fix is really helpful for that. Fixing malleability has been a holy grail for a long time.â€**

For over a year you morons have been selling SegWit as the second coming, now the new story is ""well... we don't actually need it""

ROFL fucking retards.

";6;1;False;X-88;dlz5oxa;Blockstream threatening legal action against segwit2x due to Segwit patents. All competing software now requires their consent. BCH is the only way forward.;6vadfi;https://www.reddit.com/r/btc/comments/6vadfi/blockstream_threatening_legal_action_against/
[removed];6;2;False;;dlz2xlq;Blockstream threatening legal action against segwit2x due to Segwit patents. All competing software now requires their consent. BCH is the only way forward.;6vadfi;https://www.reddit.com/r/btc/comments/6vadfi/blockstream_threatening_legal_action_against/
