body;score;nb_replies;stickied;author;id;post_title;post_id;post_link
"Lightning Network may be the killer app that creates mass adoption on a global scale.

It is on a separate layer to the blockchain, which remains decentralised. The nodes, the miners all remain decentralised and don't even  know about the LN layer.

At worst it is a reasonable argument. Big blocks too. There are too many drama queens that ""want to be right in the end"".";4;1;False;Allways_Wrong;dly7lmh;On a reply I made in r/bitcoin that had over 350 upvotes, I was first somehow blocked from being able to reply on r/bitcoin and then actually banned when I edited my comment to state that I was blocked from replying.;6v3ee8;https://i.redd.it/lmllmq7et3hz.jpg
Trump has aids and my blocks are leaking through my blockstream core satellite receiver.  That's why I support Segwit 2x, it has protection from Jeff Sessions evil elf magic, and mike pence's Christian mystic spells, with +5 ranged damage with a 1d20 modifier for Constitution.;2;0;False;trump_666_devil;dlxzc20;On a reply I made in r/bitcoin that had over 350 upvotes, I was first somehow blocked from being able to reply on r/bitcoin and then actually banned when I edited my comment to state that I was blocked from replying.;6v3ee8;https://i.redd.it/lmllmq7et3hz.jpg
Ah, ok.;1;0;False;TiagoTiagoT;dly64lz;On a reply I made in r/bitcoin that had over 350 upvotes, I was first somehow blocked from being able to reply on r/bitcoin and then actually banned when I edited my comment to state that I was blocked from replying.;6v3ee8;https://i.redd.it/lmllmq7et3hz.jpg
"If it is possible to use legal systems to fight SegWit2x, then Bitcoin is in deep shit. The whole idea is to be trustless independent on a third party. It would no longer be decentralized.

It is of utmost importance that there is no such attack vector.";99;9;False;LarsPensjo;dlysqmv;Blockstream threatening legal action against segwit2x due to Segwit patents. All competing software now requires their consent. BCH is the only way forward.;6vadfi;https://www.reddit.com/r/btc/comments/6vadfi/blockstream_threatening_legal_action_against/
"And what does it matter whose hammer hammers all of the nails?

And what does it matter whose asic mines all of the blocks?

How does either scenario give anyone control?  Hint: It does not.  Only controlling the rules and economy of Bitcoin can one usurp control of it.  Asicboost will not give anyone that control.  If Segwit is patented, then not only does it play voodoo with Bitcoin economics and move the majority of transactions to a non-Bitcoin transaction type, it has the ability to eliminate competitors through legal tar pits.  One of these is a concern and it has not nothing to do with the hammers.";2;0;False;jcrew77;dlysph4;Blockstream threatening legal action against segwit2x due to Segwit patents. All competing software now requires their consent. BCH is the only way forward.;6vadfi;https://www.reddit.com/r/btc/comments/6vadfi/blockstream_threatening_legal_action_against/
I dislike blockstream and I dislike what this eric guy has to say but wtf...;3;1;False;segregatedwitness;dlzg6t0;Blockstream threatening legal action against segwit2x due to Segwit patents. All competing software now requires their consent. BCH is the only way forward.;6vadfi;https://www.reddit.com/r/btc/comments/6vadfi/blockstream_threatening_legal_action_against/
"Most people are noobs and don't understand any of this. They heard about this Bitcoin thing and ended up using Core. I empathize with them. That's all there is to my argument.

I dislike the Core team and think they are buffoons, but I can't fault their users, especially since they unknowingly receive censored information. If we are making a moral claim for the hard fork (and some people are doing just that, although you specifically are not), then this goes against that.

>It's classier to not demand things of others that you're not willing to do yourself.

I'm not demanding anything. I just think it's scummy and ironic not to think of the users, given the moral argument that is frequently made (that hinges on Bitcoin Core team being unethical). God, people on the Internet like you who are passive aggressive 24/7 make it really obnoxious to debate anything. The snark in your post does little for your image.";1;1;False;nimblecoin;dlzfr5y;Blockstream threatening legal action against segwit2x due to Segwit patents. All competing software now requires their consent. BCH is the only way forward.;6vadfi;https://www.reddit.com/r/btc/comments/6vadfi/blockstream_threatening_legal_action_against/
"2x is not yet the majority chain. It will take time for it to become the majority chain and it might not happen. Meanwhile, Legacy will be longer than 2x chain and its users should not get screwed.

The impetus is on the new chain to look out for the users.";0;1;False;nimblecoin;dlz0weu;Blockstream threatening legal action against segwit2x due to Segwit patents. All competing software now requires their consent. BCH is the only way forward.;6vadfi;https://www.reddit.com/r/btc/comments/6vadfi/blockstream_threatening_legal_action_against/
"how do sidechains have nothing to do with segwit?

so you're just choosing to play the semantics game, is that it?";3;1;False;utu_;dlzj349;Blockstream threatening legal action against segwit2x due to Segwit patents. All competing software now requires their consent. BCH is the only way forward.;6vadfi;https://www.reddit.com/r/btc/comments/6vadfi/blockstream_threatening_legal_action_against/
How does that negate the fact that you and Core/Blockstream are trying to inject patent-pending IP into the bitcoin blockchain?;1;1;False;putin_vor;dlyzis4;Blockstream threatening legal action against segwit2x due to Segwit patents. All competing software now requires their consent. BCH is the only way forward.;6vadfi;https://www.reddit.com/r/btc/comments/6vadfi/blockstream_threatening_legal_action_against/
">Irrelevant

Correct! These patents you listed have nothing to do with OP's post.";8;1;False;ecafyelims;dlz1vuo;Blockstream threatening legal action against segwit2x due to Segwit patents. All competing software now requires their consent. BCH is the only way forward.;6vadfi;https://www.reddit.com/r/btc/comments/6vadfi/blockstream_threatening_legal_action_against/
"Besides the fact that it is not.

Why would it matter? If patented code were to be included in bitcoin core by owners of those patents everyone would be free to use it.

> Permission is hereby granted, free of charge, to any person obtaining a copy of this software and associated documentation files (the ""Software""), to deal in the Software without restriction, including without limitation the rights to use, copy, modify, merge, publish, distribute, sublicense, and/or sell copies of the Software, and to permit persons to whom the Software is furnished to do so, subject to the following conditions:

> The above copyright notice and this permission notice shall be included in all copies or substantial portions of the Software.";3;1;False;nyaaaa;dlyzkpe;Blockstream threatening legal action against segwit2x due to Segwit patents. All competing software now requires their consent. BCH is the only way forward.;6vadfi;https://www.reddit.com/r/btc/comments/6vadfi/blockstream_threatening_legal_action_against/
does LN use pegged sidechains? i didnt think it did;5;1;False;rawb0t;dlyw4zw;Blockstream threatening legal action against segwit2x due to Segwit patents. All competing software now requires their consent. BCH is the only way forward.;6vadfi;https://www.reddit.com/r/btc/comments/6vadfi/blockstream_threatening_legal_action_against/
How about this: A company is now embedded into the bitcoin frame work. Companies aren't people. You can't trust their word because the same people won't always control the company.;-2;1;False;;dlz22m5;Blockstream threatening legal action against segwit2x due to Segwit patents. All competing software now requires their consent. BCH is the only way forward.;6vadfi;https://www.reddit.com/r/btc/comments/6vadfi/blockstream_threatening_legal_action_against/
"All the proof of nefarious motives most of us need is the threat of legal action. *Whether they sue over patents or some copyright issue or something else*, it's just against what a lot of us stand for. It doesn't matter if Blockstream has patents or not: **it's fucked that a core dev is threatening legal action (aka state sanctioned violence), and shows why they need to go.**


Threatening state sanctioned violence is quite unusual for someone who values the ideals of liberty, which is why a lot of us are here.

 Anyone who shouts, ""Do what I want or I'm gonna sue you"" is suspect, because a love of government intervention is why nobody got into crypto/bitcoin never. In crypto, if you don't like something, you don't threaten, you create a better product. If your product needs government protection to work properly, that's proof it's not good enough. ";14;3;False;exmatt;dlyzj9m;Blockstream threatening legal action against segwit2x due to Segwit patents. All competing software now requires their consent. BCH is the only way forward.;6vadfi;https://www.reddit.com/r/btc/comments/6vadfi/blockstream_threatening_legal_action_against/
"

Just how hard is it to do a search on ""Blockstream patent"".

https://patents.google.com/patent/US20160330034A1/en

Transferring ledger assets between blockchains via pegged sidechains

Publication number US20160330034A1

Application number US15150032

Inventor

Adam Back

Gregory MAXWELL

Current Assignee (The listed assignees may be inaccurate. Google has not performed a legal analysis and makes no representation or warranty as to the accuracy of the list.)

Blockstream Corp

Original Assignee

Blockstream Corp

Priority date (The priority date is an assumption and is not a legal conclusion. Google has not performed a legal analysis and makes no representation as to the accuracy of the date listed.)

2015-05-07

Filing date

2016-05-09

Publication date

2016-11-10

https://patents.google.com/patent/US20160358165A1/en

Cryptographically concealing amounts transacted on a ledger while preserving a network's ability to verify the transaction

Publication number US20160358165A1

Application number US15176833

Inventor

Gregory MAXWELL

Current Assignee (The listed assignees may be inaccurate. Google has not performed a legal analysis and makes no representation or warranty as to the accuracy of the list.)

Blockstream Corp

Original Assignee

Blockstream Corp

Priority date (The priority date is an assumption and is not a legal conclusion. Google has not performed a legal analysis and makes no representation as to the accuracy of the date listed.)

2015-06-08

Filing date

2016-06-08

Publication date

2016-12-08

";6;2;False;humboldt_wvo;dlz1eka;Blockstream threatening legal action against segwit2x due to Segwit patents. All competing software now requires their consent. BCH is the only way forward.;6vadfi;https://www.reddit.com/r/btc/comments/6vadfi/blockstream_threatening_legal_action_against/
How do we prove that they do not have Segwit Patents?  I think the reason so many people doubt it, is because it is a very nonsensical implementation that is very poor in all of its claimed, likely falsely claimed, goals.  The entire air around it is of subversion and ugliness.  Why, is it so stupid of not for some ulterior motives?  Proving there is no patent would eliminate one concern, but until it is dead, rightfully so, and Blockstream retired to an ugly part of Bitcoin's history, no one can ever be real comfortable with the status of things.  Growing pains, it may be, it is a period that I hope we learn from and collectively decide against the Blockstreams of now and the future.;8;1;False;jcrew77;dlyu1p0;Blockstream threatening legal action against segwit2x due to Segwit patents. All competing software now requires their consent. BCH is the only way forward.;6vadfi;https://www.reddit.com/r/btc/comments/6vadfi/blockstream_threatening_legal_action_against/
"Nice try, but no.

It has nothing to do with LN, all the claims in the patent are about transferring money from the main chain to side chains, which is before anything hits LN.

https://4.bp.blogspot.com/-bqgiBTtfiXs/Vub00zFb-qI/AAAAAAAAlfo/r9dOEZTCZD8s-R8OYVYffCVUWSbM4J1fw/s1600/bitcoin1.png";6;1;False;putin_vor;dlz227v;Blockstream threatening legal action against segwit2x due to Segwit patents. All competing software now requires their consent. BCH is the only way forward.;6vadfi;https://www.reddit.com/r/btc/comments/6vadfi/blockstream_threatening_legal_action_against/
"Reading the patent, it's very broad. All kinds of claims about transferring money from the main chain to a side chain. Isn't that what Segwit is for?

LN is the accepting layer, the patent doesn't cover it in any way.";5;1;False;putin_vor;dlywfx5;Blockstream threatening legal action against segwit2x due to Segwit patents. All competing software now requires their consent. BCH is the only way forward.;6vadfi;https://www.reddit.com/r/btc/comments/6vadfi/blockstream_threatening_legal_action_against/
">Segwit does not enable sidechains. Segwit has nothing to do with sidechains, and in fact our existing sidechains (Elements, Liquid) have still not been updated to even use segwit.

LOL so 'second layer is not side chain' is the new Blockstream/Core bullshit misdirection script now?
 
'side-chain', 'second layer', same shit, still not on the main layer.
";3;1;False;X-88;dlz3zpj;Blockstream threatening legal action against segwit2x due to Segwit patents. All competing software now requires their consent. BCH is the only way forward.;6vadfi;https://www.reddit.com/r/btc/comments/6vadfi/blockstream_threatening_legal_action_against/
"Segwit does several things on its own:

* it's a minor scaling without a hard fork
* it disrupts covert asicboost 
* it solves malleabillity (useful for several new projects like smart contracts, drivechains and LNs)
* it makes validation cheaper on hardware devices
* it adds a version string and respects it so that new features can be easier to soft fork in at a later time

I can understand if you are against segwit for some weird reason but please try to be factual at least.";2;1;False;Pretagonist;dlz6483;Blockstream threatening legal action against segwit2x due to Segwit patents. All competing software now requires their consent. BCH is the only way forward.;6vadfi;https://www.reddit.com/r/btc/comments/6vadfi/blockstream_threatening_legal_action_against/
"> 'second layer is not side chain' 

Correct, those are different terms with different meanings, and to the best of my knowledge have never been conflated outside of this sub.";6;1;False;andytoshi;dlz4meo;Blockstream threatening legal action against segwit2x due to Segwit patents. All competing software now requires their consent. BCH is the only way forward.;6vadfi;https://www.reddit.com/r/btc/comments/6vadfi/blockstream_threatening_legal_action_against/
[deleted];1;1;False;;dlz18ya;Blockstream threatening legal action against segwit2x due to Segwit patents. All competing software now requires their consent. BCH is the only way forward.;6vadfi;https://www.reddit.com/r/btc/comments/6vadfi/blockstream_threatening_legal_action_against/
"Lol, are you really asking that?  What does and apple have to do with the moon landing? Nothing.  Side chains are side chains, and segwit is segregated witness, segregated witness is not a side chain, and a side chain is not segregated witness.

A side chain could simply be a blockchain linked to another blockchain, it doesn't have to be bitcoin, and it's ""mined"" separately.  Segregated witness is the splitting out of signature data from transaction and storing it separately, they are not in any way comparable.";0;1;False;Crully;dlzjl9f;Blockstream threatening legal action against segwit2x due to Segwit patents. All competing software now requires their consent. BCH is the only way forward.;6vadfi;https://www.reddit.com/r/btc/comments/6vadfi/blockstream_threatening_legal_action_against/
[deleted];2;1;False;;dlyzjvy;Blockstream threatening legal action against segwit2x due to Segwit patents. All competing software now requires their consent. BCH is the only way forward.;6vadfi;https://www.reddit.com/r/btc/comments/6vadfi/blockstream_threatening_legal_action_against/
"The intersection of patents and copyleft licenses is not nearly so simple.

I wish it was.

Think of trademarks, patents, and copyright/copyleft as three very separate branches of legal rights.";2;1;False;Ranguvar;dlz9e9d;Blockstream threatening legal action against segwit2x due to Segwit patents. All competing software now requires their consent. BCH is the only way forward.;6vadfi;https://www.reddit.com/r/btc/comments/6vadfi/blockstream_threatening_legal_action_against/
"Segwit is for providing a core functionality for LN to work in the first place. Here is where ""pegged sidechains"" got magically transformed into off-chain transacting:

[0074]
Fortunately, by adopting some additional security assumptions at the expense of the low trust design objective, it is possible to do an initial deployment in a completely permissionless way. Instead of utilizing SPVs, pegged sidechains can be implemented externally by having a trusted federation of mutually distrusting functionaries evaluate the script and accept the script by signing for an ordinary multisignature script. That is, the functionaries act as a protocol adaptor by evaluating the same rules we would have wanted Bitcoin to evaluate, but cannot for lack of script enhancements. Using this we can achieve a â€œfederated peg.â€
[0075]
This approach is very similar to the approach of creating a multi-signature off-chain transaction system, but the required server-to-server consensus process is provided by simply observing the blockchains in question. The result is a deterministic, highly-auditable process which simplifies the selection and supervision of functionaries. Because of these similarities, many of the techniques used to improve security and confidence in off-chain payment systems can be employed for federated pegs. For example: functionaries can be geographically diverse, bonded via escrowed coins or expensive-to-create coercion-resistant pseudonymous identities, implemented on remote-attesting tamper-resistant hardware, and so on. For small-scale uses, owners of coins in the system can themselves act as the functionaries, thus avoiding third party trust.

";1;1;False;pnomarev;dlyyom6;Blockstream threatening legal action against segwit2x due to Segwit patents. All competing software now requires their consent. BCH is the only way forward.;6vadfi;https://www.reddit.com/r/btc/comments/6vadfi/blockstream_threatening_legal_action_against/
No they don't it's a separate patent entirely.;1;1;False;Crully;dlzdnnb;Blockstream threatening legal action against segwit2x due to Segwit patents. All competing software now requires their consent. BCH is the only way forward.;6vadfi;https://www.reddit.com/r/btc/comments/6vadfi/blockstream_threatening_legal_action_against/
What side chains have anything to do with it? Sidechains already exist and don't need Segwit. Post the Segwit patent or this is BS.;8;1;False;;dlz2rdt;Blockstream threatening legal action against segwit2x due to Segwit patents. All competing software now requires their consent. BCH is the only way forward.;6vadfi;https://www.reddit.com/r/btc/comments/6vadfi/blockstream_threatening_legal_action_against/
Fortunately I don't need to trust anybody, as long as their code is open-source and their solution is trustless. Bitcoin is about trustless.;3;1;False;14341;dlz2p5c;Blockstream threatening legal action against segwit2x due to Segwit patents. All competing software now requires their consent. BCH is the only way forward.;6vadfi;https://www.reddit.com/r/btc/comments/6vadfi/blockstream_threatening_legal_action_against/
But... but... but Adam Back is a cypherpunk! He would neeeeeeever turn to the dark side like that! It's against his cypherpunk code! People don't just change after 20 years when a lot of money is involved. Right, guys? Right?;3;0;False;;dlz2uaa;Blockstream threatening legal action against segwit2x due to Segwit patents. All competing software now requires their consent. BCH is the only way forward.;6vadfi;https://www.reddit.com/r/btc/comments/6vadfi/blockstream_threatening_legal_action_against/
"> ""If your product needs government protection to work properly, that's proof it's not good enough.""
Totally Agree";3;1;False;realsomospolvo;dlz2pke;Blockstream threatening legal action against segwit2x due to Segwit patents. All competing software now requires their consent. BCH is the only way forward.;6vadfi;https://www.reddit.com/r/btc/comments/6vadfi/blockstream_threatening_legal_action_against/
"> Just how hard is it to do a search on ""Blockstream patent"".

Just how hard is it to understand the words of the patent you posted?";4;0;False;tcrypt;dlz8q56;Blockstream threatening legal action against segwit2x due to Segwit patents. All competing software now requires their consent. BCH is the only way forward.;6vadfi;https://www.reddit.com/r/btc/comments/6vadfi/blockstream_threatening_legal_action_against/
"That is patent for their side chain Liquid. Second patent is about Confidental Transaction which is implemented on Liquid. This is not related to Segwit, LN or other side chains such as Rootstock at all. 

You know how to use Google but it seems you don't understand what is written you the result you googled.";13;1;False;14341;dlz3a4m;Blockstream threatening legal action against segwit2x due to Segwit patents. All competing software now requires their consent. BCH is the only way forward.;6vadfi;https://www.reddit.com/r/btc/comments/6vadfi/blockstream_threatening_legal_action_against/
"The patents would have to be applied for by now as we are past the 1 year deadline after publication, and the applications are public record.  The burden of proof is on those making the claims, do a search and show us the patent application, it's simple enough just search for ""segwit"".";10;1;False;insolace;dlyyapx;Blockstream threatening legal action against segwit2x due to Segwit patents. All competing software now requires their consent. BCH is the only way forward.;6vadfi;https://www.reddit.com/r/btc/comments/6vadfi/blockstream_threatening_legal_action_against/
You're right, it's not LN, its [Elements/Liquid](https://elementsproject.org/sidechains/liquid/), which is their tech they sell to people like exchanges.;1;1;False;Crully;dlzcoo2;Blockstream threatening legal action against segwit2x due to Segwit patents. All competing software now requires their consent. BCH is the only way forward.;6vadfi;https://www.reddit.com/r/btc/comments/6vadfi/blockstream_threatening_legal_action_against/
"> It doesn't matter if Blockstream has patents

But we are talking about 'Segwit patent' aren't we?";2;1;False;14341;dlyzne3;Blockstream threatening legal action against segwit2x due to Segwit patents. All competing software now requires their consent. BCH is the only way forward.;6vadfi;https://www.reddit.com/r/btc/comments/6vadfi/blockstream_threatening_legal_action_against/
"> but I can't fault their users, especially since they unknowingly receive censored information.

I don't fault them either, and I feel bad for them, but Bitcoin requires people to be sophisticated investors.  They need to do their research.

The thing you're not seeing, assuming that you're actually not supporting Core, is that replay protection is the thing that's absolutely essential to Core's survival.  Without replay protection, their chain will be stuck at ~30k tx/day roughly it can handle, but with 300k tx/day outstanding to fit on-chain.  Even if their miners(just Slush) change the code to only include replay-protected transactions in their blocks, they still won't be able to process anywhere near the volume demanded of the chain.

Meanwhile, replay protection makes upgrading more difficult for every wallet and SPV client.  As it stands now, Armory will be compatible with 2x, just change the node.  SPV clients aren't affected by blocksize and won't be affected.  Breaking those things just to help the Core chain have a marginal chance of survival isn't worth it.  Core can add replay protection when they finally hardfork as they should have years ago.";1;1;False;JustSomeBadAdvice;dlzgol5;Blockstream threatening legal action against segwit2x due to Segwit patents. All competing software now requires their consent. BCH is the only way forward.;6vadfi;https://www.reddit.com/r/btc/comments/6vadfi/blockstream_threatening_legal_action_against/
"And the patent doesn't say anything about just LN, but side chain, are you people born stupid or are you just paid to act like one.
";7;1;False;X-88;dlz2jz9;Blockstream threatening legal action against segwit2x due to Segwit patents. All competing software now requires their consent. BCH is the only way forward.;6vadfi;https://www.reddit.com/r/btc/comments/6vadfi/blockstream_threatening_legal_action_against/
Confidential transactions Adam back has been working on it for a while. He talks about it on the bitcoin knowledge podcast with trace meyer. ;8;0;False;BubblegumTitanium;dlzccp9;Blockstream threatening legal action against segwit2x due to Segwit patents. All competing software now requires their consent. BCH is the only way forward.;6vadfi;https://www.reddit.com/r/btc/comments/6vadfi/blockstream_threatening_legal_action_against/
