body;score;nb_replies;stickied;author;id;post_title;post_id;post_link
"> Specific code is the execution of an idea

Like Bitcoin ABC is an execution of Bitcoin as a set of ideas. Like Bitcoin XT proposal was initially

> and a Bitcoin Cash (bitcoin-abc) project that spawned off of the original

From a global perspective I see 1MB/Segwit/LN as spawn off. Something yet to be tested as scale. Bitcoin Cash is a preservance of the original: bigger blocks as demand grows, capacity ahead of volume

>  Bitcoin Cash is a descendant of Bitcoin

It's Bitcoin. Part of Bitcoin. One of two Bitcoins. Chain split is unresolved for now";1;1;False;LexGrom;dyjiso8;"Am I the only one that doesn't mind Bitcoin Cash being called ""Bitcoin Cash"" instead of just ""Bitcoin"" (for now)?";8h7l37;https://www.reddit.com/r/btc/comments/8h7l37/am_i_the_only_one_that_doesnt_mind_bitcoin_cash/
">  Linux implementations are referred to by their implementation. There is no one Linux implementation that’s just called “Linux”.

I was downvoted in this sub for making this very point the other day. Someone was insisting that Linux distros are Linux itself, because they make use of Linux (kernel) itself. They even went as far as to say that Ubuntu *is* the kernel.";2;0;False;IWasABitcoinNoobToo;dyink31;"Am I the only one that doesn't mind Bitcoin Cash being called ""Bitcoin Cash"" instead of just ""Bitcoin"" (for now)?";8h7l37;https://www.reddit.com/r/btc/comments/8h7l37/am_i_the_only_one_that_doesnt_mind_bitcoin_cash/
Claiming people are getting paid for upvotes / downvotes is one of the most annoying frequent comments I see in both subs. Like god forbid someone be on the other side of the debate, and for FREE!?!?;9;1;False;Ov3rKoalafied;dyim4bt;"Am I the only one that doesn't mind Bitcoin Cash being called ""Bitcoin Cash"" instead of just ""Bitcoin"" (for now)?";8h7l37;https://www.reddit.com/r/btc/comments/8h7l37/am_i_the_only_one_that_doesnt_mind_bitcoin_cash/
I kinda does. You say selling of off-brand Cola in Coca-Cola bottles is wrong, yet what's in there is allready not the Coca-Cola from the original receipe.;1;1;False;TheRealMotherOfOP;dyjc7z7;"Am I the only one that doesn't mind Bitcoin Cash being called ""Bitcoin Cash"" instead of just ""Bitcoin"" (for now)?";8h7l37;https://www.reddit.com/r/btc/comments/8h7l37/am_i_the_only_one_that_doesnt_mind_bitcoin_cash/
"Many of us disagree with your premise. The majority of the hashrate and market cap and txs are easy to measure mathematically. However measuring the amount of development and majority of people who ""spoke"" is not. I agree with btc people that saying bch is ""the real bitcoin"" is silly. On the flip side however trying to say that bch is not also bitcoin is silly. Bitcoin is not 1 thing anymore. That is hard for some people to accept. All of the forks of bitcoin including bitcoin pizza and bitcoin gold are bitcoin. Whether or not you think they are legitimate projects or scams however is opinion. I personally think BCH is the best implementation of what Satoshi originally envisioned. Which is why I choose to support it. But I do not deny that BTC is also the core devs team's opinion of the best progression of the bitcoin project. I can not speak for everyone, but I think the majority of people I know personally would be satisfied if people on the BTC side quit trying to deny that BCH is also bitcoin and lay off the ""bcash btrash chinese scam coin rhetoric!"". The scaling debate is over. We have 2 (good) methods of continuing the bitcoin experiment now. May the best fork prong win and leave the immature name calling behind us and accept we are both using different paths of bitcoin.";2;1;False;cheaplightning;dyiwnxk;"Am I the only one that doesn't mind Bitcoin Cash being called ""Bitcoin Cash"" instead of just ""Bitcoin"" (for now)?";8h7l37;https://www.reddit.com/r/btc/comments/8h7l37/am_i_the_only_one_that_doesnt_mind_bitcoin_cash/
"As I only care about the value of the coins rising I do not agree that naming it ""Core"" helps the cause. Roger is a great salesman and if he would be promoting his coin and saying that Bitcoin Cash is continuing the great experiment as proposed in the white paper no one would bother arguing. Let Bitcoin do its thing. Bitcoin would let Bitcoin Cash do its things. Just as it does ETH, LTC, Tron...you get it. The sooner it realizes it is an alt the sooner it can moon ";1;0;False;timmy12688;dyilkak;"Am I the only one that doesn't mind Bitcoin Cash being called ""Bitcoin Cash"" instead of just ""Bitcoin"" (for now)?";8h7l37;https://www.reddit.com/r/btc/comments/8h7l37/am_i_the_only_one_that_doesnt_mind_bitcoin_cash/
"It’s not called Bitcoin because the majority of the hashrate, market cap, development, and transactions aren’t happening on BCH, they’re on BTC. It’s that simple. The majority spoke, you’re apparently just not listening.  Trying to hijack the name of the main project is stupid. 

BCH is being mocked because its supporters are acting like rabid lunatics. BTC supporters deserve some of that ire as well, the stupid memes and crap-flinging aren’t doing anyone any good. 

The projects have gone their separate ways, stfu about the other one and focus on what you think is going to make your project successful. ";13;1;False;Username96957364;dyikov4;"Am I the only one that doesn't mind Bitcoin Cash being called ""Bitcoin Cash"" instead of just ""Bitcoin"" (for now)?";8h7l37;https://www.reddit.com/r/btc/comments/8h7l37/am_i_the_only_one_that_doesnt_mind_bitcoin_cash/
Yeah, must be vote manipulation. Can’t possibly be that anyone agrees with me. ;6;1;False;Username96957364;dyikf0g;"Am I the only one that doesn't mind Bitcoin Cash being called ""Bitcoin Cash"" instead of just ""Bitcoin"" (for now)?";8h7l37;https://www.reddit.com/r/btc/comments/8h7l37/am_i_the_only_one_that_doesnt_mind_bitcoin_cash/
I understood. I think you are stating opinions as fact to confuse new people coming here.;0;1;False;Big_Bubbler;dyjfxzx;"Am I the only one that doesn't mind Bitcoin Cash being called ""Bitcoin Cash"" instead of just ""Bitcoin"" (for now)?";8h7l37;https://www.reddit.com/r/btc/comments/8h7l37/am_i_the_only_one_that_doesnt_mind_bitcoin_cash/
"u/phro, you've received `0.00014492 BCH ($0.25 USD)`!
***
[^^How to use](https://np.reddit.com/r/tippr/wiki/index) ^^| [^^What is Bitcoin Cash?](https://learnbitcoin.cash/) ^^| [^^Who accepts it?](https://acceptbitcoin.cash) ^^| ^^r/tippr  
^(Bitcoin Cash is what Bitcoin should be. Ask about it on r/btc)";1;0;False;tippr;dyiyd53;"Am I the only one that doesn't mind Bitcoin Cash being called ""Bitcoin Cash"" instead of just ""Bitcoin"" (for now)?";8h7l37;https://www.reddit.com/r/btc/comments/8h7l37/am_i_the_only_one_that_doesnt_mind_bitcoin_cash/
Can you please expand on that?;1;0;False;fookingroovin;dyivabo;"Am I the only one that doesn't mind Bitcoin Cash being called ""Bitcoin Cash"" instead of just ""Bitcoin"" (for now)?";8h7l37;https://www.reddit.com/r/btc/comments/8h7l37/am_i_the_only_one_that_doesnt_mind_bitcoin_cash/
Segwit was code complete and waiting to be activated more than a year before Bitcoin cash forked...  ;7;1;False;vrtrasura;dyif0j8;"Am I the only one that doesn't mind Bitcoin Cash being called ""Bitcoin Cash"" instead of just ""Bitcoin"" (for now)?";8h7l37;https://www.reddit.com/r/btc/comments/8h7l37/am_i_the_only_one_that_doesnt_mind_bitcoin_cash/
What the hell are you talking about? Take off the tin-foil hat and stop sipping on the koolaid.;-3;1;False;chazley;dyifcrk;"Am I the only one that doesn't mind Bitcoin Cash being called ""Bitcoin Cash"" instead of just ""Bitcoin"" (for now)?";8h7l37;https://www.reddit.com/r/btc/comments/8h7l37/am_i_the_only_one_that_doesnt_mind_bitcoin_cash/
"there is no cover up the history with bitcoin or bitcoin cash, in fact go read at least one side of the argument at bitcoin.com.  

> Calling it Bitcoin does not make it the true Bitcoin (for either side of this debate). 

This is a technology naming, not theological - it is pretty cut and dry Bitcoin = BTC and Bitcoin Cash = BCH, its just a new flavor of bitcoin.  it can still be the better one.   because you may not like one sides tech decisions doesnt change the name

https://github.com/Bitcoin-ABC/bitcoin-abc

Bitcoin Cash is a descendant of Bitcoin.

>  Capturing the GitHub is also not a reliable determination of what's going on here.

i would agree github doesnt play back the entire history about bitcoin and bitcoin cash but even without that history the name is still what it is.  bitcoin cash will always be bitcoin cash, these are technology / software products and naming is pretty easy to determine.  unless the goal is to get the bitcoin project to turn over the name and if that happens sure, then bitcoin cash (and all its preferred changes) become bitcoins.  i just dont see that happening.";3;1;False;nooglide;dyjel2f;"Am I the only one that doesn't mind Bitcoin Cash being called ""Bitcoin Cash"" instead of just ""Bitcoin"" (for now)?";8h7l37;https://www.reddit.com/r/btc/comments/8h7l37/am_i_the_only_one_that_doesnt_mind_bitcoin_cash/
I'll take that as you agreement with the rest of my post.;1;1;False;slashfromgunsnroses;dyiyqou;"Am I the only one that doesn't mind Bitcoin Cash being called ""Bitcoin Cash"" instead of just ""Bitcoin"" (for now)?";8h7l37;https://www.reddit.com/r/btc/comments/8h7l37/am_i_the_only_one_that_doesnt_mind_bitcoin_cash/
Start with one before asking a counter for a counter argument.;2;0;False;cgminer;dyiz4zl;"Am I the only one that doesn't mind Bitcoin Cash being called ""Bitcoin Cash"" instead of just ""Bitcoin"" (for now)?";8h7l37;https://www.reddit.com/r/btc/comments/8h7l37/am_i_the_only_one_that_doesnt_mind_bitcoin_cash/
"Uh huh... And wheres the evidence of this ""massive effort""? As far as I can tell bitcoin just continued on as always, with bcash running alongside it, with its ""[bitcoin cash protocol](https://www.bitcoinabc.org/)""

> Bitcoin ABC is a full node implementation of the Bitcoin Cash protocol.

Hell, it wasnt untill the inevitable failure of 2x that the idiocy of this sub really kicked off.";1;1;False;slashfromgunsnroses;dyjapq5;"Am I the only one that doesn't mind Bitcoin Cash being called ""Bitcoin Cash"" instead of just ""Bitcoin"" (for now)?";8h7l37;https://www.reddit.com/r/btc/comments/8h7l37/am_i_the_only_one_that_doesnt_mind_bitcoin_cash/
The analogy was about which one is more deserving of the packaging. You missed the point entirely.;1;1;False;JayPeee;dyjelvn;"Am I the only one that doesn't mind Bitcoin Cash being called ""Bitcoin Cash"" instead of just ""Bitcoin"" (for now)?";8h7l37;https://www.reddit.com/r/btc/comments/8h7l37/am_i_the_only_one_that_doesnt_mind_bitcoin_cash/
Never said bitcoin pizza isn’t a fork, I said it isn’t Bitcoin. ;1;1;False;Username96957364;dyjpofa;"Am I the only one that doesn't mind Bitcoin Cash being called ""Bitcoin Cash"" instead of just ""Bitcoin"" (for now)?";8h7l37;https://www.reddit.com/r/btc/comments/8h7l37/am_i_the_only_one_that_doesnt_mind_bitcoin_cash/
"thats not from bitcoincash.org its directly from the github ""the official Bitcoin-ABC repository.""

im not sure what you define as 'broader Bitcoin', it pretty specifically states ""Bitcoin Cash is a descendant of Bitcoin.""

";2;1;False;nooglide;dyjjmkg;"Am I the only one that doesn't mind Bitcoin Cash being called ""Bitcoin Cash"" instead of just ""Bitcoin"" (for now)?";8h7l37;https://www.reddit.com/r/btc/comments/8h7l37/am_i_the_only_one_that_doesnt_mind_bitcoin_cash/
"**Isotopes of gold**

Gold (79Au) has one stable isotope, 197Au, and 18 radioisotopes, with 195Au being the most stable with a half-life of 186 days. Gold is currently considered the heaviest monoisotopic element (bismuth formerly held that distinction, but bismuth-209 has been found to be slightly radioactive).

***

^[ [^PM](https://www.reddit.com/message/compose?to=kittens_from_space) ^| [^Exclude ^me](https://reddit.com/message/compose?to=WikiTextBot&message=Excludeme&subject=Excludeme) ^| [^Exclude ^from ^subreddit](https://np.reddit.com/r/btc/about/banned) ^| [^FAQ ^/ ^Information](https://np.reddit.com/r/WikiTextBot/wiki/index) ^| [^Source](https://github.com/kittenswolf/WikiTextBot)   ^]
^Downvote ^to ^remove ^| ^v0.28";1;0;False;WikiTextBot;dyiiuxl;"Am I the only one that doesn't mind Bitcoin Cash being called ""Bitcoin Cash"" instead of just ""Bitcoin"" (for now)?";8h7l37;https://www.reddit.com/r/btc/comments/8h7l37/am_i_the_only_one_that_doesnt_mind_bitcoin_cash/
I was pointing out the hypocrisy ;1;1;False;timmy12688;dyij3kc;"Am I the only one that doesn't mind Bitcoin Cash being called ""Bitcoin Cash"" instead of just ""Bitcoin"" (for now)?";8h7l37;https://www.reddit.com/r/btc/comments/8h7l37/am_i_the_only_one_that_doesnt_mind_bitcoin_cash/
People have called pyrite gold in the past. What we call things is always a social construction.;1;1;False;Klutzkerfuffle;dyiiooa;"Am I the only one that doesn't mind Bitcoin Cash being called ""Bitcoin Cash"" instead of just ""Bitcoin"" (for now)?";8h7l37;https://www.reddit.com/r/btc/comments/8h7l37/am_i_the_only_one_that_doesnt_mind_bitcoin_cash/
talking about software changes vs naming, analogy doesnt fail because bitcoin cash is taking a different direction.  it *should* take a different direction in attempt to improve the product and it is still a fork of bitcoin, still making it 'bitcoin cash', but not 'bitcoin';1;1;False;nooglide;dyid11b;"Am I the only one that doesn't mind Bitcoin Cash being called ""Bitcoin Cash"" instead of just ""Bitcoin"" (for now)?";8h7l37;https://www.reddit.com/r/btc/comments/8h7l37/am_i_the_only_one_that_doesnt_mind_bitcoin_cash/
"Also for the record I have just as much Bitcoin Cash as I do Bitcoin so you saying ""your side"" is pretty stupid and the fact you think there are sides is sad. ";1;1;False;timmy12688;dyij5p3;"Am I the only one that doesn't mind Bitcoin Cash being called ""Bitcoin Cash"" instead of just ""Bitcoin"" (for now)?";8h7l37;https://www.reddit.com/r/btc/comments/8h7l37/am_i_the_only_one_that_doesnt_mind_bitcoin_cash/
Yes correct, which is why I said Coca-Cola has strayed away from it's original receipe, yet it's still Coca-Cola. That's where your analogy fails.;1;1;False;TheRealMotherOfOP;dyjeafb;"Am I the only one that doesn't mind Bitcoin Cash being called ""Bitcoin Cash"" instead of just ""Bitcoin"" (for now)?";8h7l37;https://www.reddit.com/r/btc/comments/8h7l37/am_i_the_only_one_that_doesnt_mind_bitcoin_cash/
"If it's a set of ideas then you could say that Litecoin, Dogecoin and a lot of other cryptos are also Bitcoin.

And I agree that bitcoin is a set of ideas.  Unfortunately it's now a ticker symbol (BTC) with a value and investors.

So, bitcoin, the idea is one thing.  Bitcoin the investment is something different.

The average core supporter thinks we're trying to hijack the name.  And there is a lot to give that idea.  Personally, I don't think we need to hijack the name.  If things keep going the way they are, BTC will wither and die, and be abandoned, and BCH will just inherit the name.";-1;2;False;plazman30;dyirb74;"Am I the only one that doesn't mind Bitcoin Cash being called ""Bitcoin Cash"" instead of just ""Bitcoin"" (for now)?";8h7l37;https://www.reddit.com/r/btc/comments/8h7l37/am_i_the_only_one_that_doesnt_mind_bitcoin_cash/
"Specific code is the execution of an idea - there is a 'bitcoin' project that executed on the idea originally:

https://github.com/bitcoin/bitcoin

and a Bitcoin Cash (bitcoin-abc) project that spawned off of the original

https://github.com/Bitcoin-ABC/bitcoin-abc

Directly from the Bitcoin Cash project page:

What is Bitcoin Cash?  Bitcoin Cash is a descendant of Bitcoin.


Bitcoin Cash still can be a better version of Bitcoin";0;1;False;nooglide;dyjdaq1;"Am I the only one that doesn't mind Bitcoin Cash being called ""Bitcoin Cash"" instead of just ""Bitcoin"" (for now)?";8h7l37;https://www.reddit.com/r/btc/comments/8h7l37/am_i_the_only_one_that_doesnt_mind_bitcoin_cash/
Litecoin used a lot of the bitcoin code. But it has its own original genesis block. So no, it was never on or a part of the bitcoin chain. Bitcoin pizza is a stupid bitcoin fork. But it is still a bitcoin fork none the less.;1;1;False;cheaplightning;dyj4cyo;"Am I the only one that doesn't mind Bitcoin Cash being called ""Bitcoin Cash"" instead of just ""Bitcoin"" (for now)?";8h7l37;https://www.reddit.com/r/btc/comments/8h7l37/am_i_the_only_one_that_doesnt_mind_bitcoin_cash/
"> these are not my words

In response I told u **mine**. bitcoincash.org is not an authority, just an information source

> They are not one in the same

Yep, it's true. BTC and BCH are not the same, but both are parts of broader Bitcoin";1;1;False;LexGrom;dyjj1gf;"Am I the only one that doesn't mind Bitcoin Cash being called ""Bitcoin Cash"" instead of just ""Bitcoin"" (for now)?";8h7l37;https://www.reddit.com/r/btc/comments/8h7l37/am_i_the_only_one_that_doesnt_mind_bitcoin_cash/
"That wasn't the point.  He outright mocks some very sensitive topics that this entire project forked as a result of.

So his contentment with BCH not being called Bitcoin should be viewed in that context.

AKA:   Not a surprise.";-6;1;False;BitttBurger;dyidho4;"Am I the only one that doesn't mind Bitcoin Cash being called ""Bitcoin Cash"" instead of just ""Bitcoin"" (for now)?";8h7l37;https://www.reddit.com/r/btc/comments/8h7l37/am_i_the_only_one_that_doesnt_mind_bitcoin_cash/
That doesn’t make the analogy invalid.;1;1;False;JayPeee;dyj93s9;"Am I the only one that doesn't mind Bitcoin Cash being called ""Bitcoin Cash"" instead of just ""Bitcoin"" (for now)?";8h7l37;https://www.reddit.com/r/btc/comments/8h7l37/am_i_the_only_one_that_doesnt_mind_bitcoin_cash/
You are dumb or doing it on purpose ? There is no core, get over it. It is Bitcoin and Bitcoin Cash. How hard is it for you to get it ?;-1;1;False;cgminer;dyiivvm;"Am I the only one that doesn't mind Bitcoin Cash being called ""Bitcoin Cash"" instead of just ""Bitcoin"" (for now)?";8h7l37;https://www.reddit.com/r/btc/comments/8h7l37/am_i_the_only_one_that_doesnt_mind_bitcoin_cash/
Straight Cash Homey;1;0;False;pregnantbitchthatUR;dyil350;"Am I the only one that doesn't mind Bitcoin Cash being called ""Bitcoin Cash"" instead of just ""Bitcoin"" (for now)?";8h7l37;https://www.reddit.com/r/btc/comments/8h7l37/am_i_the_only_one_that_doesnt_mind_bitcoin_cash/
Bitcoin Cash is Bitcoin (BCH) so they're both acceptable;-1;0;False;;dyiodi6;"Am I the only one that doesn't mind Bitcoin Cash being called ""Bitcoin Cash"" instead of just ""Bitcoin"" (for now)?";8h7l37;https://www.reddit.com/r/btc/comments/8h7l37/am_i_the_only_one_that_doesnt_mind_bitcoin_cash/
"Why would you call it just Bitcoin? Its Bitcoin Cash. It's even in the trading name, BCH.

I don't take sides in this petty feud but you can't just start calling it something that it is not.";4;0;False;-Abradolf_Lincler-;dyiqiu4;"Am I the only one that doesn't mind Bitcoin Cash being called ""Bitcoin Cash"" instead of just ""Bitcoin"" (for now)?";8h7l37;https://www.reddit.com/r/btc/comments/8h7l37/am_i_the_only_one_that_doesnt_mind_bitcoin_cash/
"BCore is BCore.
Bitcoin (Cash) is Bitcoin (Cash).

It's not that hard to understand.";-1;0;False;;dyiucfy;"Am I the only one that doesn't mind Bitcoin Cash being called ""Bitcoin Cash"" instead of just ""Bitcoin"" (for now)?";8h7l37;https://www.reddit.com/r/btc/comments/8h7l37/am_i_the_only_one_that_doesnt_mind_bitcoin_cash/
It is bitcoin brah.;-1;0;False;anonrektard;dyivi7w;"Am I the only one that doesn't mind Bitcoin Cash being called ""Bitcoin Cash"" instead of just ""Bitcoin"" (for now)?";8h7l37;https://www.reddit.com/r/btc/comments/8h7l37/am_i_the_only_one_that_doesnt_mind_bitcoin_cash/
"Honestly, Bitcoin Cash has actually started to sound much better. It's still Bitcoin but it emphasises its use case.

'bitcoin"" on its own wether we like it or not has now become synonymous with bt-fee and high fee coin";0;0;False;silverjustice;dyih7ma;"Am I the only one that doesn't mind Bitcoin Cash being called ""Bitcoin Cash"" instead of just ""Bitcoin"" (for now)?";8h7l37;https://www.reddit.com/r/btc/comments/8h7l37/am_i_the_only_one_that_doesnt_mind_bitcoin_cash/
It has two names.;0;0;False;Flamethrower22;dyitxk7;"Am I the only one that doesn't mind Bitcoin Cash being called ""Bitcoin Cash"" instead of just ""Bitcoin"" (for now)?";8h7l37;https://www.reddit.com/r/btc/comments/8h7l37/am_i_the_only_one_that_doesnt_mind_bitcoin_cash/
Would have been much more clever to simply name it “Real Bitcoin” ;0;0;False;remotelyfun;dyixx6g;"Am I the only one that doesn't mind Bitcoin Cash being called ""Bitcoin Cash"" instead of just ""Bitcoin"" (for now)?";8h7l37;https://www.reddit.com/r/btc/comments/8h7l37/am_i_the_only_one_that_doesnt_mind_bitcoin_cash/
"2 errors. 

Bitcoin is not called Bitcoin core.

It was not a split, it was a fork, bcash forked of the real and only Bitcoin ";5;2;False;bitking74;dyibvfv;"Am I the only one that doesn't mind Bitcoin Cash being called ""Bitcoin Cash"" instead of just ""Bitcoin"" (for now)?";8h7l37;https://www.reddit.com/r/btc/comments/8h7l37/am_i_the_only_one_that_doesnt_mind_bitcoin_cash/
This.;1;0;False;CryptoWithFries;dyj78l5;"Am I the only one that doesn't mind Bitcoin Cash being called ""Bitcoin Cash"" instead of just ""Bitcoin"" (for now)?";8h7l37;https://www.reddit.com/r/btc/comments/8h7l37/am_i_the_only_one_that_doesnt_mind_bitcoin_cash/
Of course since that is the proper name.;3;0;False;Blazedout419;dyiu837;"Am I the only one that doesn't mind Bitcoin Cash being called ""Bitcoin Cash"" instead of just ""Bitcoin"" (for now)?";8h7l37;https://www.reddit.com/r/btc/comments/8h7l37/am_i_the_only_one_that_doesnt_mind_bitcoin_cash/
One is censorship resistant and cheap to do your own validation, one isn't. Great job, you really get it!;0;0;False;;dyibfjh;"Am I the only one that doesn't mind Bitcoin Cash being called ""Bitcoin Cash"" instead of just ""Bitcoin"" (for now)?";8h7l37;https://www.reddit.com/r/btc/comments/8h7l37/am_i_the_only_one_that_doesnt_mind_bitcoin_cash/
I think it should remain Bitcoin Cash forever. No one coin should ever be called just *Bitcoin*  ever again, just as no one Linux distribution is called just *Linux.*;12;3;False;;dyibf2y;"Am I the only one that doesn't mind Bitcoin Cash being called ""Bitcoin Cash"" instead of just ""Bitcoin"" (for now)?";8h7l37;https://www.reddit.com/r/btc/comments/8h7l37/am_i_the_only_one_that_doesnt_mind_bitcoin_cash/
"Personally I view Bitcoin as an investment and I have Bitcoin Cash as my spending crypto, probably just because it has cash in the name pretty much.

I'd agree to leave it as is. ";2;0;False;AlphaSniper88;dyivyeo;"Am I the only one that doesn't mind Bitcoin Cash being called ""Bitcoin Cash"" instead of just ""Bitcoin"" (for now)?";8h7l37;https://www.reddit.com/r/btc/comments/8h7l37/am_i_the_only_one_that_doesnt_mind_bitcoin_cash/
"When core gets detrowned and BCH will have bigher market price and higher hashrate I also am in favor of never ever ever seperating bitcoin from cash.

If it aint' cash, it ain't Bitcoin! ";2;0;False;Kain_niaK;dyiqolh;"Am I the only one that doesn't mind Bitcoin Cash being called ""Bitcoin Cash"" instead of just ""Bitcoin"" (for now)?";8h7l37;https://www.reddit.com/r/btc/comments/8h7l37/am_i_the_only_one_that_doesnt_mind_bitcoin_cash/
[deleted];-1;1;False;;dyiiu6h;"Am I the only one that doesn't mind Bitcoin Cash being called ""Bitcoin Cash"" instead of just ""Bitcoin"" (for now)?";8h7l37;https://www.reddit.com/r/btc/comments/8h7l37/am_i_the_only_one_that_doesnt_mind_bitcoin_cash/
"I actually hope we choose to be bold and keep the Bitcoin Cash title for the protocol and set the precedent of *Bitcoin Newname* for future forks, not unlike the many shards of BTC this year. It should be shared, not constantly consolidated by some group or another. We need to kill the idea that ""longst chain has rights to the name"" because that is simply mis\-understood bullshit by people who don't understand what Satoshi wrote about that.

I say that mostly because if we go back to being *Bitcoin* we're going to have this whole fucking stupid problem happen again someday when BCH spawns an offshoot \(which anyone can do at any time for any reason\).

*Bitcoin* should be used the same way as *Linux*\*.\*

That aside, why erase Bitcoin Cash's illustrious, impossible journey by removing the Cash part of its history? Its a badge of honor to me, and frankly the first *Bitcoin* should have had a name like that from day 1. The mistake was calling the first live implementation the same name as the whitepaper. ";3;1;False;;dyibptd;"Am I the only one that doesn't mind Bitcoin Cash being called ""Bitcoin Cash"" instead of just ""Bitcoin"" (for now)?";8h7l37;https://www.reddit.com/r/btc/comments/8h7l37/am_i_the_only_one_that_doesnt_mind_bitcoin_cash/
"So to you, 1/5 criteria defines bitcoin, I’ll take the 4/5 that is Bitcoin Cash with 4 out of 5 checkmarks describing the real bitcoin.

Bitcoin Cash is 80% Bitcoin, Bitcoin Core is 20% Bitcoin. Deal with it. 

And the only reason BTC has that 1/5 criteria is because miners are greedy, the very thing that BTC is trying to kill, will end up killing BTC. 

Good luck! ";1;0;False;wisequote;dyj581x;"Am I the only one that doesn't mind Bitcoin Cash being called ""Bitcoin Cash"" instead of just ""Bitcoin"" (for now)?";8h7l37;https://www.reddit.com/r/btc/comments/8h7l37/am_i_the_only_one_that_doesnt_mind_bitcoin_cash/
