body;score;nb_replies;stickied;author;id;post_title;post_id;post_link
What my mind sees everytime: http://1.bp.blogspot.com/-NRDGfPU5_24/UsxklYgY1HI/AAAAAAAADAo/kc_3hoQ2G3Y/s1600/fiat+500.jpg;1;0;False;Honmeg;dyjoa5k;Let's End the War and focus on the TRUE ENEMY;8fth52;https://imgur.com/spE6usZ.png
He deleted it to censor the message. ;2;0;False;xithy;dyj6pwu;That was perfect. They're certainly not getting any smarter.;8da1w2;https://i.redd.it/lvb2mjsu0rs01.png
Just fuck off.;3;0;False;Taelon;dyitl3w;That was perfect. They're certainly not getting any smarter.;8da1w2;https://i.redd.it/lvb2mjsu0rs01.png
"BTC is just bitcoin

segwit refers to an enhancement to the bitcoin core software, core refers to the bitcoin software

";1;0;False;nooglide;dyicgp2;"Am I the only one that doesn't mind Bitcoin Cash being called ""Bitcoin Cash"" instead of just ""Bitcoin"" (for now)?";8h7l37;https://www.reddit.com/r/btc/comments/8h7l37/am_i_the_only_one_that_doesnt_mind_bitcoin_cash/
"Thx for correction. Bitcoin ABC is also not an authority. Bitcoin is flat

> im not sure what you define as 'broader Bitcoin'

Ideas, people, code, networks and infrastucture. I own coins on both chains, as many do. Big pools are mining both chains and ready to switch to either. Even in the midst of Bitcoin civil war, even with censorship at r/bitcoin, two subs share a lot especially against fiat world. Many businesses including giants like Coinbase and BitPay are using both Bitcoins";1;0;False;LexGrom;dyjjzf0;"Am I the only one that doesn't mind Bitcoin Cash being called ""Bitcoin Cash"" instead of just ""Bitcoin"" (for now)?";8h7l37;https://www.reddit.com/r/btc/comments/8h7l37/am_i_the_only_one_that_doesnt_mind_bitcoin_cash/
"How much did you pay for that vote bot you got there?   Just curious.  Or did you code it yourself.  Maybe fiverr?  ;)";-4;1;False;BitttBurger;dyie85u;"Am I the only one that doesn't mind Bitcoin Cash being called ""Bitcoin Cash"" instead of just ""Bitcoin"" (for now)?";8h7l37;https://www.reddit.com/r/btc/comments/8h7l37/am_i_the_only_one_that_doesnt_mind_bitcoin_cash/
Redditor /u/Klutzkerfuffle has low karma in this subreddit.;1;0;False;trolldetectr;dyiip2l;"Am I the only one that doesn't mind Bitcoin Cash being called ""Bitcoin Cash"" instead of just ""Bitcoin"" (for now)?";8h7l37;https://www.reddit.com/r/btc/comments/8h7l37/am_i_the_only_one_that_doesnt_mind_bitcoin_cash/
Lol I'm talking about exactly that. What's there not to get?;1;1;False;TheRealMotherOfOP;dyjj29w;"Am I the only one that doesn't mind Bitcoin Cash being called ""Bitcoin Cash"" instead of just ""Bitcoin"" (for now)?";8h7l37;https://www.reddit.com/r/btc/comments/8h7l37/am_i_the_only_one_that_doesnt_mind_bitcoin_cash/
"> I did not say there was a coverup of the history. 

you implied i was covering it up through some crafty wording, rhetoric as you put it

> As for the technical ""technology naming"", BCH will get the code-approved name ""Bitcoin"" after the BCH price rises above BTC and the accumulated proof of work tilts in Bitcoin Cash's favor. 

Do you really think that will happen?  This is an actual question, not rhetorical.  I just do not see that happening and why would it?  Then every time another new Bitcoin Cash comes along and overtakes it becomes the new Bitcoin?  Think about the implications.. no, I don't see it happening like that nor should it - it would be too confusing!

>  That will take a while. Most people know it is coming, eventually,

Who are most people?  What are you basing this on? 

> Fingers crossed we do not fall victim to a similar infiltration and capture of our development teams.

Whether you agree or disagree with the development teams decisions when working on project A or project B, Project A is still project A, even if B is better.  

Only my opinion that the naming discussion is really binary - even on https://bitcoincash.com/faq/ do they talk about Bitcoin Cash being a continuation of the Bitcoin project.  That has to be done to avoid confusion from A to B.  Bitcoin Cash can still be *the best bitcoin* but I don't see it being Bitcoin.";3;1;False;nooglide;dyjhet6;"Am I the only one that doesn't mind Bitcoin Cash being called ""Bitcoin Cash"" instead of just ""Bitcoin"" (for now)?";8h7l37;https://www.reddit.com/r/btc/comments/8h7l37/am_i_the_only_one_that_doesnt_mind_bitcoin_cash/
"> Bitcoin is a 'Core'

Ideas are the core of Bitcoin, not specific code

> Bitcoin ABC

Not an authority. Just the most popular software

Bitcoin Cash is Bitcoin. So is Bitcoin Core/BTC. Unified Bitcoin chain was split over scaling and the split is unresolved";1;1;False;LexGrom;dyio9lf;"Am I the only one that doesn't mind Bitcoin Cash being called ""Bitcoin Cash"" instead of just ""Bitcoin"" (for now)?";8h7l37;https://www.reddit.com/r/btc/comments/8h7l37/am_i_the_only_one_that_doesnt_mind_bitcoin_cash/
You’re acting as though a neutral third party is *less* reliable than a rabid shill. ;7;1;False;KingJulien;dyicve4;"Am I the only one that doesn't mind Bitcoin Cash being called ""Bitcoin Cash"" instead of just ""Bitcoin"" (for now)?";8h7l37;https://www.reddit.com/r/btc/comments/8h7l37/am_i_the_only_one_that_doesnt_mind_bitcoin_cash/
This annoys me as well. It takes no balls to be like 'ah yeah I don't care about either' because it's evident how much fake flak you get from brainwashed trolls for daring to even see the other point of view that bitcoin has been bent over a table and raped. It's exactly how they want this whole thing to go down. Passive apathy about the situation helps no one. Get angry. Take a stand and make some noise. ;1;0;False;LiamGaughan;dyj15hx;"Am I the only one that doesn't mind Bitcoin Cash being called ""Bitcoin Cash"" instead of just ""Bitcoin"" (for now)?";8h7l37;https://www.reddit.com/r/btc/comments/8h7l37/am_i_the_only_one_that_doesnt_mind_bitcoin_cash/
/u/tippr $0.25;2;1;False;bitmeister;dyiycw3;"Am I the only one that doesn't mind Bitcoin Cash being called ""Bitcoin Cash"" instead of just ""Bitcoin"" (for now)?";8h7l37;https://www.reddit.com/r/btc/comments/8h7l37/am_i_the_only_one_that_doesnt_mind_bitcoin_cash/
">Also glad we have a place to do so without getting banned.

That's why I'm here, I support both BTC and BCH but I wouldn't dare say that in there, my alt accounts are banned there allready.";1;0;False;TheRealMotherOfOP;dyjww4p;"Am I the only one that doesn't mind Bitcoin Cash being called ""Bitcoin Cash"" instead of just ""Bitcoin"" (for now)?";8h7l37;https://www.reddit.com/r/btc/comments/8h7l37/am_i_the_only_one_that_doesnt_mind_bitcoin_cash/
"The only reason that it was a soft fork instead of a hard fork is because they knew that it would make the ""true Bitcoin"" argument stronger for Bitcoin cash. ";2;2;False;RareJahans;dyiblbm;"Am I the only one that doesn't mind Bitcoin Cash being called ""Bitcoin Cash"" instead of just ""Bitcoin"" (for now)?";8h7l37;https://www.reddit.com/r/btc/comments/8h7l37/am_i_the_only_one_that_doesnt_mind_bitcoin_cash/
"So I read another of your comments (posted on the sub I have been banned from) saying that it would make sense to call BTC “Coca Cola regular” and call other versions by other names “Coca Cola lite” etc.  It seems that we do actually agree on this basic point, that it’s important to differentiate the different types of bitcoin, but that we got lost in the semantics of the analogy.

Anyways, glad to discuss opposing view in a civil manner. Also glad we have a place to do so without getting banned.  I’m sure you know this already, but you are probably going to be banned from the other sub for saying you support bch.";1;1;False;JayPeee;dyjryo4;"Am I the only one that doesn't mind Bitcoin Cash being called ""Bitcoin Cash"" instead of just ""Bitcoin"" (for now)?";8h7l37;https://www.reddit.com/r/btc/comments/8h7l37/am_i_the_only_one_that_doesnt_mind_bitcoin_cash/
"> This is FUD. 

OR it's more colloquial speech in regarding cores propaganda, and a minor misunderstanding, but flip your tables over it mate, also clarified my comment for you, mouth breather.";1;0;False;opaqueperson;dyiq26i;"Am I the only one that doesn't mind Bitcoin Cash being called ""Bitcoin Cash"" instead of just ""Bitcoin"" (for now)?";8h7l37;https://www.reddit.com/r/btc/comments/8h7l37/am_i_the_only_one_that_doesnt_mind_bitcoin_cash/
"Coke is owned by a central authority that decides what Coke is. Bitcoin has no central authority, only competing implementations. If one of those implementations decides to make a radical change while the original continues to still exist, it follows that the radically changed version should choose a new name.

Since there are two implementations currently competing for the same hashpower, there should be a way to differentiate them by name.  Bitcoin Cash is the name of the one that resembles the original vision, and Bitcoin Core is what the radically changed one is being called since it’s community hasn’t chosen a name on their own. When the competition is resolved, the winner can simply be called bitcoin and go on its way. Until that time, it is reasonable that people refer to them by names which differentiate the type of bitcoin they are referring to.

We’re talking in circles. It’s been fun, but I’m afraid we’re not going to see eye to eye on the issue.

Cheers.";1;0;False;JayPeee;dyjrk79;"Am I the only one that doesn't mind Bitcoin Cash being called ""Bitcoin Cash"" instead of just ""Bitcoin"" (for now)?";8h7l37;https://www.reddit.com/r/btc/comments/8h7l37/am_i_the_only_one_that_doesnt_mind_bitcoin_cash/
"I'm curious if you do use bitcoin to buy goods or services, or conduct business, on a day to day basis, which is the whole point of cash. Cash needs to flow. 

People who use bitcoin as cash on a daily basis may recall a time when their beloved BTC (formerly market dominating cryptocurrency) used to **consistently** have fast, cheap, and reliable transactions. 

That use case for bitcoin as cash is being fleshed out by development in the BCH ecosystem, now (not in 18 months+). It's mind-boggling that one would advocate for restricting growth and the blocksize limit while waiting around holding a bitcoin that's essentially unusable at peak user capacity with $25, $30, $50+ fees. For BCH I don't ever need to check mempool conditions to estimate ""normal"" or ""urgent"" fee levels. 

An invitation to economic participation by those making less than $2 a day will change the world. There are people and entities who either do not care for them (the poorest billions), or have vested interests that are not aligned with that vision.";2;0;False;peopleb4things;dyidcpd;"Am I the only one that doesn't mind Bitcoin Cash being called ""Bitcoin Cash"" instead of just ""Bitcoin"" (for now)?";8h7l37;https://www.reddit.com/r/btc/comments/8h7l37/am_i_the_only_one_that_doesnt_mind_bitcoin_cash/
"Your using rhetoric to cover up the truth of the situation. BTC Core development is also a descendant of the ""Bitcoin project"" even though it has strayed far from that project's goals. Calling it Bitcoin does not make it the true Bitcoin (for either side of this debate). Capturing the GitHub is also not a reliable determination of what's going on here.";3;1;False;Big_Bubbler;dyjbzpi;"Am I the only one that doesn't mind Bitcoin Cash being called ""Bitcoin Cash"" instead of just ""Bitcoin"" (for now)?";8h7l37;https://www.reddit.com/r/btc/comments/8h7l37/am_i_the_only_one_that_doesnt_mind_bitcoin_cash/
"No, both are not equally valid; you got a crippled impostor, and the other is Bitcoin Cash.";1;1;False;TiagoTiagoT;dyiw5iz;"Am I the only one that doesn't mind Bitcoin Cash being called ""Bitcoin Cash"" instead of just ""Bitcoin"" (for now)?";8h7l37;https://www.reddit.com/r/btc/comments/8h7l37/am_i_the_only_one_that_doesnt_mind_bitcoin_cash/
Come on, surely you have more persuasive arguments left...?;2;1;False;insanityzwolf;dyiuzkd;"Am I the only one that doesn't mind Bitcoin Cash being called ""Bitcoin Cash"" instead of just ""Bitcoin"" (for now)?";8h7l37;https://www.reddit.com/r/btc/comments/8h7l37/am_i_the_only_one_that_doesnt_mind_bitcoin_cash/
BCH is still P2P cash. Much closer to original formula than BTC. 🥤;0;1;False;JayPeee;dyj8ip9;"Am I the only one that doesn't mind Bitcoin Cash being called ""Bitcoin Cash"" instead of just ""Bitcoin"" (for now)?";8h7l37;https://www.reddit.com/r/btc/comments/8h7l37/am_i_the_only_one_that_doesnt_mind_bitcoin_cash/
A typical [gaslighting](https://en.wikipedia.org/wiki/Gaslighting) response. If it's so clearly NOT fact, it wouldn't take much to illustrate that. But this is clearly a trek too far, and about all the Core supporters can do is gaslight.;1;0;False;AcerbLogic;dyizva7;"Am I the only one that doesn't mind Bitcoin Cash being called ""Bitcoin Cash"" instead of just ""Bitcoin"" (for now)?";8h7l37;https://www.reddit.com/r/btc/comments/8h7l37/am_i_the_only_one_that_doesnt_mind_bitcoin_cash/
Removal of the alkaloid in Coka leaves isn't radical? You know its whole name has the origin because of that coca plant and its utility was originally not as a fizzy drink but as *medicine*? Yet you are fine in saying that it resembles it's original vision, but think it's wrong when Bitcoin changes. See the issue here now in your analogy?;1;2;False;TheRealMotherOfOP;dyjmvsk;"Am I the only one that doesn't mind Bitcoin Cash being called ""Bitcoin Cash"" instead of just ""Bitcoin"" (for now)?";8h7l37;https://www.reddit.com/r/btc/comments/8h7l37/am_i_the_only_one_that_doesnt_mind_bitcoin_cash/
[deleted];0;2;False;;dyihw0j;"Am I the only one that doesn't mind Bitcoin Cash being called ""Bitcoin Cash"" instead of just ""Bitcoin"" (for now)?";8h7l37;https://www.reddit.com/r/btc/comments/8h7l37/am_i_the_only_one_that_doesnt_mind_bitcoin_cash/
"Coke didn’t radically change into a different product that no longer resembles coke in the way that core devs have radically changed BTC into a product that no longer resembles bitcoin. I don’t get the point you’re trying to make.

Core created something that’s not P2P cash, so it hardly makes sense to call it bitcoin, because bitcoin is P2P electronic cash. Bitcoin is not just whatever core decides it is.";1;1;False;JayPeee;dyjk83i;"Am I the only one that doesn't mind Bitcoin Cash being called ""Bitcoin Cash"" instead of just ""Bitcoin"" (for now)?";8h7l37;https://www.reddit.com/r/btc/comments/8h7l37/am_i_the_only_one_that_doesnt_mind_bitcoin_cash/
And Bitcoin is a set of ideas. Two relevant open blockchains exist on that base;3;1;False;LexGrom;dyinh64;"Am I the only one that doesn't mind Bitcoin Cash being called ""Bitcoin Cash"" instead of just ""Bitcoin"" (for now)?";8h7l37;https://www.reddit.com/r/btc/comments/8h7l37/am_i_the_only_one_that_doesnt_mind_bitcoin_cash/
"> Calling BTC just Bitcoin is misleading noobs into thinking there is only one Bitcoin.

There is only one bitcoin, then there are additional forks / descendants of bitcoin like Bitcoin Cash

Bitcoin Cash *is* important!  Calling BTC bitcoin because that is what it is, just like Bitcoin Cash is BCH because that is what it is.

Directly from the Bitcoin Cash Github:

https://github.com/Bitcoin-ABC/bitcoin-abc

What is Bitcoin Cash?
Bitcoin Cash is a descendant of Bitcoin.";1;0;False;nooglide;dyjbm6q;"Am I the only one that doesn't mind Bitcoin Cash being called ""Bitcoin Cash"" instead of just ""Bitcoin"" (for now)?";8h7l37;https://www.reddit.com/r/btc/comments/8h7l37/am_i_the_only_one_that_doesnt_mind_bitcoin_cash/
I dont think you understood what I said. Bitcoin Core runs on the Bitcoin network, Bitcoin ABC runs on the Bitcoin Cash network. Terms like 'Core' and 'Cash' are ambiguous.;2;1;False;Trentw;dyjdgul;"Am I the only one that doesn't mind Bitcoin Cash being called ""Bitcoin Cash"" instead of just ""Bitcoin"" (for now)?";8h7l37;https://www.reddit.com/r/btc/comments/8h7l37/am_i_the_only_one_that_doesnt_mind_bitcoin_cash/
"I'm not arguing that BCH should be called just 'Bitcoin', but rather that BTC should be called Bitcoin Core or something like that to differentiate it from Bitcoin the architecture/idea, and from other chains that share both the architecture and the blockchain until recently.

Like it or not, BCH is already important enough that its existence should be acknowledged. Calling BTC just Bitcoin is misleading noobs into thinking there is only one Bitcoin.

It's different from Linux (kernel) and Linux distros, as cash forked away from core and the two went their separate ways. Cash does not depend on core in any way.";1;1;False;CharacterlessMeiosis;dyj3ams;"Am I the only one that doesn't mind Bitcoin Cash being called ""Bitcoin Cash"" instead of just ""Bitcoin"" (for now)?";8h7l37;https://www.reddit.com/r/btc/comments/8h7l37/am_i_the_only_one_that_doesnt_mind_bitcoin_cash/
Again, point being the original formala (or receipe in that analogy) doesn't matter since things change;1;1;False;TheRealMotherOfOP;dyj924e;"Am I the only one that doesn't mind Bitcoin Cash being called ""Bitcoin Cash"" instead of just ""Bitcoin"" (for now)?";8h7l37;https://www.reddit.com/r/btc/comments/8h7l37/am_i_the_only_one_that_doesnt_mind_bitcoin_cash/
There are a few exceptions (non trolls who believe the name thing). That helps sell the troll army narrative. That does not mean he is one of the Non-trolls just because he and most of them say he is not.;1;0;False;Big_Bubbler;dyj9lct;"Am I the only one that doesn't mind Bitcoin Cash being called ""Bitcoin Cash"" instead of just ""Bitcoin"" (for now)?";8h7l37;https://www.reddit.com/r/btc/comments/8h7l37/am_i_the_only_one_that_doesnt_mind_bitcoin_cash/
https://en.wikipedia.org/wiki/Isotopes_of_gold;1;1;False;Richy_T;dyiiur1;"Am I the only one that doesn't mind Bitcoin Cash being called ""Bitcoin Cash"" instead of just ""Bitcoin"" (for now)?";8h7l37;https://www.reddit.com/r/btc/comments/8h7l37/am_i_the_only_one_that_doesnt_mind_bitcoin_cash/
BCH is the original recipe. That’s the point.;1;1;False;JayPeee;dyjdx7h;"Am I the only one that doesn't mind Bitcoin Cash being called ""Bitcoin Cash"" instead of just ""Bitcoin"" (for now)?";8h7l37;https://www.reddit.com/r/btc/comments/8h7l37/am_i_the_only_one_that_doesnt_mind_bitcoin_cash/
"Is Litecoin also Bitcoin?  It was forked from Bitcoin some time ago. 

I disagree with your premise that any random stupid fork(bitcoin pizza, really?)is Bitcoin. Not sure we’ll ever see eye to eye on that. ";2;1;False;Username96957364;dyj0r0v;"Am I the only one that doesn't mind Bitcoin Cash being called ""Bitcoin Cash"" instead of just ""Bitcoin"" (for now)?";8h7l37;https://www.reddit.com/r/btc/comments/8h7l37/am_i_the_only_one_that_doesnt_mind_bitcoin_cash/
"Doesn't mean it's not true...

Voting patterns in specific threads are often wildly out of line with the norm on the sub.

This thread is precisely one of those cases.";1;1;False;fossiltooth;dyjkbe4;"Am I the only one that doesn't mind Bitcoin Cash being called ""Bitcoin Cash"" instead of just ""Bitcoin"" (for now)?";8h7l37;https://www.reddit.com/r/btc/comments/8h7l37/am_i_the_only_one_that_doesnt_mind_bitcoin_cash/
No, you are just unfamiliar with the history. https://medium.com/@octskyward/on-consensus-and-forks-c6a050c792e7;3;0;False;RareJahans;dyigv30;"Am I the only one that doesn't mind Bitcoin Cash being called ""Bitcoin Cash"" instead of just ""Bitcoin"" (for now)?";8h7l37;https://www.reddit.com/r/btc/comments/8h7l37/am_i_the_only_one_that_doesnt_mind_bitcoin_cash/
"> Bitcoin Cash is a descendant of Bitcoin

> It's Bitcoin. Part of Bitcoin. One of two Bitcoins. Chain split is unresolved for now

It is Bitcoin Cash, these are not my words, these are the words from the Bitcoin Cash page

https://github.com/Bitcoin-ABC/bitcoin-abc

What is Bitcoin Cash?  Bitcoin Cash is a descendant of Bitcoin.

They are not one in the same, it is a follow on of the project Bitcoin called Bitcoin Cash.  ";0;1;False;nooglide;dyjizco;"Am I the only one that doesn't mind Bitcoin Cash being called ""Bitcoin Cash"" instead of just ""Bitcoin"" (for now)?";8h7l37;https://www.reddit.com/r/btc/comments/8h7l37/am_i_the_only_one_that_doesnt_mind_bitcoin_cash/
"I did not say there was a coverup of the history. As for the technical ""technology naming"", BCH will get the code-approved name ""Bitcoin"" after the BCH price rises above BTC and the accumulated proof of work tilts in Bitcoin Cash's favor. That will take a while. Most people know it is coming, eventually, if BTC does not fix it's code soon (I'm thinking hardforked blocksize increase). Hopefully, Bitcoin Cash will always be Bitcoin. Fingers crossed we do not fall victim to a similar infiltration and capture of our development teams.";1;1;False;Big_Bubbler;dyjfty8;"Am I the only one that doesn't mind Bitcoin Cash being called ""Bitcoin Cash"" instead of just ""Bitcoin"" (for now)?";8h7l37;https://www.reddit.com/r/btc/comments/8h7l37/am_i_the_only_one_that_doesnt_mind_bitcoin_cash/
"How the fuck did you come to that conclusion? The fact that Core's version is an impostor and yet got ""users, exchanges, merchants etc"" to still call it ""bitcoin"" required massive efforts.

Bitcoin kept being what it has always been, and that is not bitcoin Core; bitcoin Core is something else, even though it managed to replace Bitcoin for a while and trick a huge number of people into ignoring that.";1;1;False;TiagoTiagoT;dyj0i1d;"Am I the only one that doesn't mind Bitcoin Cash being called ""Bitcoin Cash"" instead of just ""Bitcoin"" (for now)?";8h7l37;https://www.reddit.com/r/btc/comments/8h7l37/am_i_the_only_one_that_doesnt_mind_bitcoin_cash/
"You realize that /r/Bitcoin censoring does not make Bitcoin Cash better or worse. Anymore than the_Donald blatant censorship makes  /r/politics better. It is its own domain and Bitcoin Cash is doing fine on the BTC sub (which I still find hilariously ironic). I subbed here when it was made too. 

Manipulation? Or explaining in ways you don't agree. I could point out how this sub ""manipulates"" as well. Hell going back to the original comment! Adding ""Core"" which is 100% unneeded since literally everyone knows what you mean when you say Bitcoin. And those that don't are being obtuse to make ""their coin"" better. Bitcoin Diamond and Bitcoin Gold didn't need ""Core"" after Bitcoin. So why does Roger and Bitcoin Cash? And Bitcoin.com. Why not coinbase?? ";1;0;False;timmy12688;dyiks72;"Am I the only one that doesn't mind Bitcoin Cash being called ""Bitcoin Cash"" instead of just ""Bitcoin"" (for now)?";8h7l37;https://www.reddit.com/r/btc/comments/8h7l37/am_i_the_only_one_that_doesnt_mind_bitcoin_cash/
Yes and if it has been a hard fork, as all updates should be, then Bitcoin would have continued on and Bitcoin segwit would have been created. The fact that they have been using soft forks for years to implement changes that are good for blockstream projects and not the rest of the ecosystem. ;4;1;False;RareJahans;dyih9x4;"Am I the only one that doesn't mind Bitcoin Cash being called ""Bitcoin Cash"" instead of just ""Bitcoin"" (for now)?";8h7l37;https://www.reddit.com/r/btc/comments/8h7l37/am_i_the_only_one_that_doesnt_mind_bitcoin_cash/
"But I forgot about the point I was going to make. Sorry for the double post. I've seen multiple people see Core then get confused and stay away from Bitcoin Cash. It just has a general scammy feeling to it. And that is something we'd have to overcome. 

See this: 

https://tools.bitcoin.com/paper-wallet/

Tell me that doesn't come off as manipulation and scammy. If even says Bitcoin. Not ""Core"" ";1;0;False;timmy12688;dyiln5o;"Am I the only one that doesn't mind Bitcoin Cash being called ""Bitcoin Cash"" instead of just ""Bitcoin"" (for now)?";8h7l37;https://www.reddit.com/r/btc/comments/8h7l37/am_i_the_only_one_that_doesnt_mind_bitcoin_cash/
[deleted];1;2;False;;dyikpku;"Am I the only one that doesn't mind Bitcoin Cash being called ""Bitcoin Cash"" instead of just ""Bitcoin"" (for now)?";8h7l37;https://www.reddit.com/r/btc/comments/8h7l37/am_i_the_only_one_that_doesnt_mind_bitcoin_cash/
[deleted];1;1;False;;dyik4ex;"Am I the only one that doesn't mind Bitcoin Cash being called ""Bitcoin Cash"" instead of just ""Bitcoin"" (for now)?";8h7l37;https://www.reddit.com/r/btc/comments/8h7l37/am_i_the_only_one_that_doesnt_mind_bitcoin_cash/
"> If it's a set of ideas then you could say that Litecoin, Dogecoin and a lot of other cryptos are also Bitcoin

No. Just related. There was no idea of rebooting the ledger each time. Genesis block, **immutable history**, is another key part

> Personally, I don't think we need to hijack the name

Bitcoin is more than a name for BTC chain. That's it";1;0;False;LexGrom;dyisb1l;"Am I the only one that doesn't mind Bitcoin Cash being called ""Bitcoin Cash"" instead of just ""Bitcoin"" (for now)?";8h7l37;https://www.reddit.com/r/btc/comments/8h7l37/am_i_the_only_one_that_doesnt_mind_bitcoin_cash/
"> If it's a set of ideas then you could say that Litecoin, Dogecoin and a lot of other cryptos are also Bitcoin.

Not really, all of these examples have differences: worse PoW, different supply, different block time, different launch, different control, different genesis, one has a scammy launch (not sure about doge), non existent development. Otherwise, nice try.";0;0;False;rdar1999;dyivzvu;"Am I the only one that doesn't mind Bitcoin Cash being called ""Bitcoin Cash"" instead of just ""Bitcoin"" (for now)?";8h7l37;https://www.reddit.com/r/btc/comments/8h7l37/am_i_the_only_one_that_doesnt_mind_bitcoin_cash/
