body;score;nb_replies;stickied;author;id;post_title;post_id;post_link
So Coca-Cola isn't Coca-Cola because it doesn't have coca extract anymore as stated by it's original recipe? That's where the flaw in that analogy is, things change and develop that doesn't mean a new branding is required.;0;1;False;TheRealMotherOfOP;dyj589k;"Am I the only one that doesn't mind Bitcoin Cash being called ""Bitcoin Cash"" instead of just ""Bitcoin"" (for now)?";8h7l37;https://www.reddit.com/r/btc/comments/8h7l37/am_i_the_only_one_that_doesnt_mind_bitcoin_cash/
I often call them bcash and bcore just to piss everyone off equally. The whole Bitcoin community is so devisive and toxic and not the awesome one I remember working with back in the day that I think we need to do a lot of work to earn the Bitcoin name back. ;32;2;False;;dyievzs;"Am I the only one that doesn't mind Bitcoin Cash being called ""Bitcoin Cash"" instead of just ""Bitcoin"" (for now)?";8h7l37;https://www.reddit.com/r/btc/comments/8h7l37/am_i_the_only_one_that_doesnt_mind_bitcoin_cash/
"> changes to the protocol called Lightning Network...

This is something that gets repeated a lot but there are no changes to Bitcoin to work with Lightning network. This is FUD. The only change to Bitcoin has been the addition of SegWit which is still compatible with older constraints on blocks. That's not to say that SegWit wasn't a change, it was, but in a clever way that makes SegWit blocks look like and validate as older blocks did.

The fact of the matter is that there is absolutely zero code related to the Lightning network added to Bitcoin. Lightning doesn't depend on a specific cryptocurrency and it works just as well with Litecoin for instance. The only reason why SegWit is often described as required for Lightning Network is because SegWit also fixed transaction malleability. LN is still totally possible even without fixing transaction malleability, the problem is that an attacker can screw with your transactions in such a way as to lock up your funds until your channel expires and sends the coins back to you. Even without totally fixing transaction malleability Bitcoin Cash could still use Lightning network to transfer coins offchain.";1;1;False;MertsA;dyipyh6;"Am I the only one that doesn't mind Bitcoin Cash being called ""Bitcoin Cash"" instead of just ""Bitcoin"" (for now)?";8h7l37;https://www.reddit.com/r/btc/comments/8h7l37/am_i_the_only_one_that_doesnt_mind_bitcoin_cash/
"You may be the first to point out that 'this whole fucking stupid problem [could] happen again someday"" over the bitcoin (BCH) name - though not sure if you meant 'Bitcoin' or 'Bitcoin Cash'.

Point taken though.

The idea of ""rights to the name"" for open-source anonymously authored (code?) whose specifictions are an academically cited whitepaper. Don't suppose SN ever thought he had reason to be concerned about it. Maybe this really ought to go to trial to establish case law - someone has to arbitrate these things  - but jurisdiction is going to have to be argued to start with.

Also, it's going to attract a host of interested parties wanting to define exactly what is being contested here, not just who owns the name 'bitcoin', Is there a 'chain of custody' or 'provenance' for claiming to be the 'true' Bitcoin. Seems that it's a case of a 'Recipe' vs a 'Dish'.

>Warning, quoting CSW here.

>Is Gordon Ramsay's Beef Wellington the 'real' thing cause:
>
>⚪""He uses Shiitake mushrooms to replace the older form  of pate
>
> ⚪ It was magnificent""
 ";2;0;False;GoLookingGlass;dyiozmk;"Am I the only one that doesn't mind Bitcoin Cash being called ""Bitcoin Cash"" instead of just ""Bitcoin"" (for now)?";8h7l37;https://www.reddit.com/r/btc/comments/8h7l37/am_i_the_only_one_that_doesnt_mind_bitcoin_cash/
I prefer BCH, but find it incredibly childish and an absolute dickhead move by Ver to try and take over the Bitcoin name. We should embrace and market our differences instead of trying to trick newcomers into thinking we are core. Additionally, to just making us all not seem like total assholes, it would quell 99.9% of opposition to BCH. People don't hate us because we have bigger blocks, faster and cheaper transactions, they hate us because the way we have gone about antagonizing the market. ;7;1;False;CryptoBogan;dyicvmi;"Am I the only one that doesn't mind Bitcoin Cash being called ""Bitcoin Cash"" instead of just ""Bitcoin"" (for now)?";8h7l37;https://www.reddit.com/r/btc/comments/8h7l37/am_i_the_only_one_that_doesnt_mind_bitcoin_cash/
"Unfortunately, there has been a massive effort to make the uninformed masses call bitcoin Core ""bitcoin"", and it continues long after Core had destroyed the original Bitcoin.";3;1;False;TiagoTiagoT;dyiva7j;"Am I the only one that doesn't mind Bitcoin Cash being called ""Bitcoin Cash"" instead of just ""Bitcoin"" (for now)?";8h7l37;https://www.reddit.com/r/btc/comments/8h7l37/am_i_the_only_one_that_doesnt_mind_bitcoin_cash/
Surely you mean a **GNU**/Linux distribution!;1;0;False;TestUserDoNotReply;dyir3xd;"Am I the only one that doesn't mind Bitcoin Cash being called ""Bitcoin Cash"" instead of just ""Bitcoin"" (for now)?";8h7l37;https://www.reddit.com/r/btc/comments/8h7l37/am_i_the_only_one_that_doesnt_mind_bitcoin_cash/
Consensus will do what consensus does;0;0;False;supermassiveanus;dyidc6j;"Am I the only one that doesn't mind Bitcoin Cash being called ""Bitcoin Cash"" instead of just ""Bitcoin"" (for now)?";8h7l37;https://www.reddit.com/r/btc/comments/8h7l37/am_i_the_only_one_that_doesnt_mind_bitcoin_cash/
That's okay. we will pet you extra to bring you back around. ;1;0;False;Kain_niaK;dyiqpxy;"Am I the only one that doesn't mind Bitcoin Cash being called ""Bitcoin Cash"" instead of just ""Bitcoin"" (for now)?";8h7l37;https://www.reddit.com/r/btc/comments/8h7l37/am_i_the_only_one_that_doesnt_mind_bitcoin_cash/
Not at all. Marketing is essentially dressing something up, but stating that BCH is the cryptocurrency that is the closest to the [Bitcoin white paper](http://nakamotoinstitute.org/bitcoin), and that has been truest in following prescribed Nakamoto Consensus in practice *and* in intent is objectively fact.;1;1;False;AcerbLogic;dyiuovt;"Am I the only one that doesn't mind Bitcoin Cash being called ""Bitcoin Cash"" instead of just ""Bitcoin"" (for now)?";8h7l37;https://www.reddit.com/r/btc/comments/8h7l37/am_i_the_only_one_that_doesnt_mind_bitcoin_cash/
Redditor /u/bitking74 has low karma in this subreddit.;4;0;False;trolldetectr;dyibvum;"Am I the only one that doesn't mind Bitcoin Cash being called ""Bitcoin Cash"" instead of just ""Bitcoin"" (for now)?";8h7l37;https://www.reddit.com/r/btc/comments/8h7l37/am_i_the_only_one_that_doesnt_mind_bitcoin_cash/
"The original is no more; Core made sure of that. The closest thing to the original we got now is Bitcoin Cash";1;1;False;TiagoTiagoT;dyiv6ap;"Am I the only one that doesn't mind Bitcoin Cash being called ""Bitcoin Cash"" instead of just ""Bitcoin"" (for now)?";8h7l37;https://www.reddit.com/r/btc/comments/8h7l37/am_i_the_only_one_that_doesnt_mind_bitcoin_cash/
nah, never yield to the mob;2;0;False;;dyibh1d;"Am I the only one that doesn't mind Bitcoin Cash being called ""Bitcoin Cash"" instead of just ""Bitcoin"" (for now)?";8h7l37;https://www.reddit.com/r/btc/comments/8h7l37/am_i_the_only_one_that_doesnt_mind_bitcoin_cash/
So bitcoin cash was the original? Please, you're being intellectually dishonest.;5;0;False;ImInLoveWithMyBike;dyim8ts;"Am I the only one that doesn't mind Bitcoin Cash being called ""Bitcoin Cash"" instead of just ""Bitcoin"" (for now)?";8h7l37;https://www.reddit.com/r/btc/comments/8h7l37/am_i_the_only_one_that_doesnt_mind_bitcoin_cash/
So, your saying there is no longer any Bitcoin project. That's not true. BCH is still working on the Bitcoin project. Core hopes their project is Bitcoin again someday, but, that looks unlikely at this point.;1;1;False;Big_Bubbler;dyj9wo8;"Am I the only one that doesn't mind Bitcoin Cash being called ""Bitcoin Cash"" instead of just ""Bitcoin"" (for now)?";8h7l37;https://www.reddit.com/r/btc/comments/8h7l37/am_i_the_only_one_that_doesnt_mind_bitcoin_cash/
Good analogy ;2;0;False;--now--;dyitham;"Am I the only one that doesn't mind Bitcoin Cash being called ""Bitcoin Cash"" instead of just ""Bitcoin"" (for now)?";8h7l37;https://www.reddit.com/r/btc/comments/8h7l37/am_i_the_only_one_that_doesnt_mind_bitcoin_cash/
You a BCH;1;1;False;H0dl;dyil0ye;"coincall.io labels BCH a ""shitcoin""";8gpxhk;https://i.redd.it/nhbs5gwjumv01.png
glad you agree;1;1;False;H0dl;dyjoby3;"coincall.io labels BCH a ""shitcoin""";8gpxhk;https://i.redd.it/nhbs5gwjumv01.png
Wait, so you agree that BCH is stupid then, as you noted above?;1;1;False;gypsytoy;dyjose2;"coincall.io labels BCH a ""shitcoin""";8gpxhk;https://i.redd.it/nhbs5gwjumv01.png
Yeah, a total cuck too!;1;1;False;gypsytoy;dyiphqx;"coincall.io labels BCH a ""shitcoin""";8gpxhk;https://i.redd.it/nhbs5gwjumv01.png
A stupid BCH;1;1;False;H0dl;dyilu2f;"coincall.io labels BCH a ""shitcoin""";8gpxhk;https://i.redd.it/nhbs5gwjumv01.png
Yeah, I really am! I'm a total BCH, whatever that is...;1;1;False;gypsytoy;dyil2yr;"coincall.io labels BCH a ""shitcoin""";8gpxhk;https://i.redd.it/nhbs5gwjumv01.png
Yeah, totally!;1;1;False;gypsytoy;dyikk1t;"coincall.io labels BCH a ""shitcoin""";8gpxhk;https://i.redd.it/nhbs5gwjumv01.png
"Why would I feel any different? I didn't defend coinmarketcap.com there.

Personally, I like [livecoinwatch.com](https://www.livecoinwatch.com) because you can edit the layout and get more information. However it doesn't have [these charts](https://coinmarketcap.com/charts/).";0;0;False;265;dyicry5;"coincall.io labels BCH a ""shitcoin""";8gpxhk;https://i.redd.it/nhbs5gwjumv01.png
Says the person who name-calls in every single comment. ;1;1;False;gypsytoy;dyiixgr;"coincall.io labels BCH a ""shitcoin""";8gpxhk;https://i.redd.it/nhbs5gwjumv01.png
you should  grow up.  i'm dealing with a child.;1;1;False;H0dl;dyiirk9;"coincall.io labels BCH a ""shitcoin""";8gpxhk;https://i.redd.it/nhbs5gwjumv01.png
Broken record much? **I'm not short or long on BCH. Claiming that I'm experiencing losses is just a way for you to fantasize about some other reality and avoid the actual conversation** Grow up already.;1;1;False;gypsytoy;dyigrxy;"coincall.io labels BCH a ""shitcoin""";8gpxhk;https://i.redd.it/nhbs5gwjumv01.png
Sorry for your losses;1;1;False;H0dl;dyiglhr;"coincall.io labels BCH a ""shitcoin""";8gpxhk;https://i.redd.it/nhbs5gwjumv01.png
[deleted];2;1;False;;dyibejd;"coincall.io labels BCH a ""shitcoin""";8gpxhk;https://i.redd.it/nhbs5gwjumv01.png
i agree you're stupid;1;1;False;H0dl;dyjpgdu;"coincall.io labels BCH a ""shitcoin""";8gpxhk;https://i.redd.it/nhbs5gwjumv01.png
You stupid ;1;1;False;H0dl;dyike8g;"coincall.io labels BCH a ""shitcoin""";8gpxhk;https://i.redd.it/nhbs5gwjumv01.png
But you also said BCH was stupid. So I guess it's both?;1;0;False;gypsytoy;dyjrjs7;"coincall.io labels BCH a ""shitcoin""";8gpxhk;https://i.redd.it/nhbs5gwjumv01.png
"Does anyone have futures trading for the value of Bitcoin Cash original versus the hard fork?

";-1;0;False;akreider;dyiggai;Bitcoin Cash is upgrading on May 15 to 32MB max block limit;8el8n7;https://www.reddit.com/r/btc/comments/8el8n7/bitcoin_cash_is_upgrading_on_may_15_to_32mb_max/
What is the healthy limit for blocksize?  What happens if it gets too big?;1;0;False;morebeansplease;dyii5rl;Bitcoin Cash is upgrading on May 15 to 32MB max block limit;8el8n7;https://www.reddit.com/r/btc/comments/8el8n7/bitcoin_cash_is_upgrading_on_may_15_to_32mb_max/
There's no reason there can't be off chain solutions for BCH. Holding the network hostage to force them is ridiculous. Right now, on chain scaling is perfectly reasonable.;3;1;False;YOLOSwag_McFartnut;dyiccy1;Bitcoin Cash is upgrading on May 15 to 32MB max block limit;8el8n7;https://www.reddit.com/r/btc/comments/8el8n7/bitcoin_cash_is_upgrading_on_may_15_to_32mb_max/
but when the demand for TB drives rises, then the price will also rise, like with graphic cards;1;1;False;fromsarahwithlove;dyiyyiv;Bitcoin Cash is upgrading on May 15 to 32MB max block limit;8el8n7;https://www.reddit.com/r/btc/comments/8el8n7/bitcoin_cash_is_upgrading_on_may_15_to_32mb_max/
I ideal decentralizion that would be true, but in reality there are only 2000 people running full nodes for BCH and blockchains aren't that remanding yet for people to mass buy data drives. Compared to graphics card, each mining rig has several gpu's and only on drive.;1;0;False;TheRealMotherOfOP;dyj0iwa;Bitcoin Cash is upgrading on May 15 to 32MB max block limit;8el8n7;https://www.reddit.com/r/btc/comments/8el8n7/bitcoin_cash_is_upgrading_on_may_15_to_32mb_max/
"I would agree that on chain scaling is only viable up to a certain point. The more costly it is to run a node the less incentivized people are to run one.

Off chain solutions are the only ones that make sense to me, as storing each and every transaction on the blockchain is a really inefficient way to go at it.";1;0;False;ultimate55;dyid6nz;Bitcoin Cash is upgrading on May 15 to 32MB max block limit;8el8n7;https://www.reddit.com/r/btc/comments/8el8n7/bitcoin_cash_is_upgrading_on_may_15_to_32mb_max/
