body;score;nb_replies;stickied;author;id;post_title;post_id;post_link
preparing ground for real whales;1;0;False;Alex_BitGen;dzvd76j;This is governments trying to regulate bitcoin.;8n81h9;https://v.redd.it/ir2g5g3wgz011
"> but Fees are low.

They are low now because BSCore has finally convinced enough users/merchants/businesses/developers to abandon Bitcoin and caused transaction rates to regress to [2015 levels](https://blockchain.info/de/charts/n-transactions?timespan=all&daysAverageString=7). That's not ""success"".

> 50 percent loss in market is attributed to it not being the only game in town anymore

The collapse hasn't happened until Bitcoin became unusable, repeatedly, which drove users/merchants/businesses/developers off to elsewhere. Before that long predicted event, it was losing market share to the tune of around 5% per year. This isn't coincidence. The collapse has only happened in the 9th year of Bitcoins 9 year history. It stopped ""being the only game in town"" long ago and that hasn't lead to such a [drastic collapse](https://coinmarketcap.com/charts/#dominance-percentage).

>  If BCH was better, we'd see it take a greater lions share of this 50 percent. It does not.

BCH essentially started to rebuild, last august, what BSCore destroyed for the better part of half a decade. It actually takes time to undo the collossal damage that BSCore did to the entire cryptocurrency market space and regain the trust of those who gave up trying to work with cryptocurrencies and give it another shot. And thanks for that BSCore.

>  I can tell you're predominantly emotionally driven from your posts.

You're damn right I am emotionally driven. I've witnessed the destruction of all promise and everything that made Bitcoin great. Made it feel like the future. Looking at Bitcoin today feels like Tomorrowland (the movie) feels to the protagonist, a future that never was. That's simply utterly unacceptable. You can't look at that experience and remain emotionless. If you do, you simply don't care about cryptocurrencies whatsoever.

BSCore has run Bitcoin into the ground with reckless experiments, meddling and destroying everything that made Bitcoin to what it is today. You can't expect to suck and remain ""on top"" forever. The sins are going to catch up, they're in the process of catching up, and when it tips over, it'll be unbelievably ugly because a horde of brainwashed cult members will suddenly discover they've been in a cult and have been brainwashed. They're not going to be happy.";4;1;False;pyalot;dzvkn9n;This is governments trying to regulate bitcoin.;8n81h9;https://v.redd.it/ir2g5g3wgz011
Governments have a crucial role towards mass adoption. All coins will eventually be regulated. ;1;0;False;caratsio;dzvcef4;This is governments trying to regulate bitcoin.;8n81h9;https://v.redd.it/ir2g5g3wgz011
looks like he handles it \- water doesnt reach new ATH, just waving ;1;0;False;trrr33;dzvccap;This is governments trying to regulate bitcoin.;8n81h9;https://v.redd.it/ir2g5g3wgz011
yes, really like that ! haha;1;0;False;phabulu;dzv0k9l;This is governments trying to regulate bitcoin.;8n81h9;https://v.redd.it/ir2g5g3wgz011
The government literally owns crypto and controls it now. You all aren’t keeping up are you?;1;1;False;MadB0Lt;dzup1hd;This is governments trying to regulate bitcoin.;8n81h9;https://v.redd.it/ir2g5g3wgz011
Everyone should be aware of that;1;0;False;Fossacious;dzuza6c;This is governments trying to regulate bitcoin.;8n81h9;https://v.redd.it/ir2g5g3wgz011
/u/tippr $1;1;1;False;mohrt;dzvz69s;This is governments trying to regulate bitcoin.;8n81h9;https://v.redd.it/ir2g5g3wgz011
when you see your stolen meme idea trending on reddit... ;1;0;False;HappyMoneyMan;dzuupe1;This is governments trying to regulate bitcoin.;8n81h9;https://v.redd.it/ir2g5g3wgz011
 A futile task to be sure, but that rake still hit somebody. Better hope it’s not you when uncle Sam gets his belt out. ;1;0;False;mathcoffeecats;dzuu8cv;This is governments trying to regulate bitcoin.;8n81h9;https://v.redd.it/ir2g5g3wgz011
They can regulate exchanges and make a big impact. ;1;0;False;startup416;dzuo5ji;This is governments trying to regulate bitcoin.;8n81h9;https://v.redd.it/ir2g5g3wgz011
"u/pyalot, you've received `0.00100336 BCH ($1 USD)`!
***
[^^How to use](https://np.reddit.com/r/tippr/wiki/index) ^^| [^^What is Bitcoin Cash?](https://learnbitcoin.cash/) ^^| [^^Who accepts it?](https://acceptbitcoin.cash) ^^| ^^r/tippr  
^(Bitcoin Cash is what Bitcoin should be. Ask about it on r/btc)";1;0;False;tippr;dzvz72h;This is governments trying to regulate bitcoin.;8n81h9;https://v.redd.it/ir2g5g3wgz011
Bitcoin Cash*;1;0;False;hagenjustyn;dzumof6;This is governments trying to regulate bitcoin.;8n81h9;https://v.redd.it/ir2g5g3wgz011
😂😂😂;1;0;False;Lucasozim;dzula15;This is governments trying to regulate bitcoin.;8n81h9;https://v.redd.it/ir2g5g3wgz011
😆😆😆😆;1;0;False;asdhammu;dzuit9b;This is governments trying to regulate bitcoin.;8n81h9;https://v.redd.it/ir2g5g3wgz011
"Please remember not to upvote or downvote comments based on the user's karma value in any particular subreddit. Downvotes should only be used if the comment is something completely off-topic, and even if you disagree with the comment (or dislike the user who wrote it), please abide by [reddiquette](https://www.reddit.com/wiki/reddiquette) the best you possibly can.

Thanks for being an awesome redditor, and showing respect to the others on this site.";0;0;False;AntiEchoChamberBot;dzup1vk;This is governments trying to regulate bitcoin.;8n81h9;https://v.redd.it/ir2g5g3wgz011
And how, I ask, might they do that?;1;0;False;RudiMcflanagan;dzv3q1b;This is governments trying to regulate bitcoin.;8n81h9;https://v.redd.it/ir2g5g3wgz011
Nice meme. ;1;1;False;bana18;dzvtrvn;This is governments trying to regulate bitcoin.;8n81h9;https://v.redd.it/ir2g5g3wgz011
Redditor /u/bana18 account age is 0 days.;1;0;False;trolldetectr;dzvts9k;This is governments trying to regulate bitcoin.;8n81h9;https://v.redd.it/ir2g5g3wgz011
"Why would governments be anti-crypto?

Maybe because bank lobbyists tell them it's bad?";1;0;False;Tim_Brady12;dzuwu77;This is governments trying to regulate bitcoin.;8n81h9;https://v.redd.it/ir2g5g3wgz011
Redditor /u/MadB0Lt has low karma in this subreddit.;1;1;False;trolldetectr;dzup1pe;This is governments trying to regulate bitcoin.;8n81h9;https://v.redd.it/ir2g5g3wgz011
I get your point, but I liked r/bitcoin in the old days.;3;0;False;BitcoinCashKing;dzvdm67;This is governments trying to regulate bitcoin.;8n81h9;https://v.redd.it/ir2g5g3wgz011
Tbh the edm remix of him is in my top 3 favorite memes of all time ;7;0;False;Sparky2697;dzuksps;This is governments trying to regulate bitcoin.;8n81h9;https://v.redd.it/ir2g5g3wgz011
Your mistake is focus on the price. It's one of the least interesting aspects of Bitcoin;1;0;False;LexGrom;dzumlxm;This is governments trying to regulate bitcoin.;8n81h9;https://v.redd.it/ir2g5g3wgz011
"I remember realizing original bitcoin had problems when it took hours to make a transfer when I was wondering if I would ever see the money again.

You are for bitcoin cash?  Ethereum?";1;0;False;Tim_Brady12;dzuvy61;This is governments trying to regulate bitcoin.;8n81h9;https://v.redd.it/ir2g5g3wgz011
Don't listen to him. There are just two main camps who disagree on how bitcoin should run. That's it. Both sides could probably do things better than they're doing. Try not to get to caught up on the noise. ;0;2;False;thetjs1;dzut8hm;This is governments trying to regulate bitcoin.;8n81h9;https://v.redd.it/ir2g5g3wgz011
Of course government will try to stop it. It completely undermines the power of the financial institutions that control them. The will stop at nothing to protect that power. They don't give a fuck about tech advancement, and people will vote for them anyway. People only vote for whoever tells them how to vote the loudest, it's that simple.;0;0;False;RudiMcflanagan;dzv3ast;This is governments trying to regulate bitcoin.;8n81h9;https://v.redd.it/ir2g5g3wgz011
Makes one wonder.;3;0;False;peopleb4things;dzurnod;This is governments trying to regulate bitcoin.;8n81h9;https://v.redd.it/ir2g5g3wgz011
Power(control) and money are inextricably linked.;1;1;False;Tim_Brady12;dzuwjan;This is governments trying to regulate bitcoin.;8n81h9;https://v.redd.it/ir2g5g3wgz011
Downvoting these memes is like squeegeeing the ocean.;6;0;False;Elavid;dzv67aa;This is governments trying to regulate bitcoin.;8n81h9;https://v.redd.it/ir2g5g3wgz011
Happy to see them here. Showed r/btc is reaching adoption.;0;0;False;BitcoinCashKing;dzvdl79;This is governments trying to regulate bitcoin.;8n81h9;https://v.redd.it/ir2g5g3wgz011
"\> All they need to do is declare that using crypto is a taxable event.

This is already the case and bitcoin doesn't look dead to me. ";3;0;False;UnknownEssence;dzuizt4;This is governments trying to regulate bitcoin.;8n81h9;https://v.redd.it/ir2g5g3wgz011
"My apologies, I can't reply in detail. Heavy work schedule.

A few of your points have some weight but
Fees are low. Lighting network brings them to near zero on top of this. 
R&D is still very high
Local bitcoin volume is still high.

50 percent loss in market is attributed to it not being the only game in town anymore. If BCH was better, we'd see it take a greater lions share of this 50 percent. It does not. I believe in it, I own it but I sure as fuck don't think its better than btc currently. 

I like bch, and I see its benefits, but I chose to look at the crypto market as unbiasedly as possible.
I can tell you're predominantly emotionally driven from your posts. ";0;1;False;thetjs1;dzviolz;This is governments trying to regulate bitcoin.;8n81h9;https://v.redd.it/ir2g5g3wgz011
No one is going to commit severe international financial/cyber crimes that could get them locked up in Federal prison for decades just so they can use crypto.;1;0;False;RudiMcflanagan;dzv3ld7;This is governments trying to regulate bitcoin.;8n81h9;https://v.redd.it/ir2g5g3wgz011
The question at hand is whether the war on drugs was started as a mechanism for imprisoning people, or whether that's a side effect. The prison stuff is tiny compared to the rest.;1;0;False;pregnantbitchthatUR;dzv85ir;This is governments trying to regulate bitcoin.;8n81h9;https://v.redd.it/ir2g5g3wgz011
New folks. This opinion, agnosticism, is incorrect. Both sides could do things better, yes. This does not mean the goals of both sides are equally valid or relevant to improving Bitcoin as a p2p electronic cash system. ;2;0;False;---Mike----;dzvb09v;This is governments trying to regulate bitcoin.;8n81h9;https://v.redd.it/ir2g5g3wgz011
Crypto is just like water, you try to block it, it finds it way around and at the end you just have to allow it be.;1;0;False;Ibizugbe7;dzw3ogo;This is governments trying to regulate bitcoin.;8n81h9;https://v.redd.it/ir2g5g3wgz011
"Don't listen to me? Are you nuts? Can't you see the clear and irrefutable evidence of failure of Bitcoin under BSCores leadership?

- Periods of extreme unreliability, slowness and skyrocketing fees
- Loss of 50% of the cryptocurrency market share in one year (coinciding with the start of those long predicted unreliability periods)
- Merchant abandonment (you used to be able to pay Steam with Bitcoin to name just one example)
- Nearly 10 years after its introduction Bitcoin has **less** adoption, usability and market share than 5 years after its introduction
- Company abandonment (nobody is trying to build any kind of service on top of bitcoin anymore except LN)
- Continuous brain drain and abandonment of developers and researchers who helped build Bitcoin into what it was 5 years ago
- Totalitarian censorship, narrative control and smear campaigns by those ""entrusted"" to steward Bitcoins communication forums (how you can reconcile that with ""censorship resistant money"" is simply completely beyond me)
- Complete failure of BSCore to reach any kind of compromise (repeatedly) to keep the Bitcoin community together (failure of community stewardship)
- Running reckless experiments with Bitcoins economics in favor of a ""solution"" that's anything but

You don't have to be a genius to see that something is rotten in Bitcoin, rotten to the core. That it's very likely beyond any salvage at this point. Sure, you can call this ""a camp"", if by that you mean ""the camp of utter failure"", go ahead.";6;1;False;pyalot;dzvalw7;This is governments trying to regulate bitcoin.;8n81h9;https://v.redd.it/ir2g5g3wgz011
I am excited too as it is much easier to transfer funds all around the world via cryptos at very low rates. Are you excited too?;1;0;False;Zeldelima;dzvuwmg;I think we are witnessing the biggest transfer of wealth of our generation as everyday peeps can now invest in crypto assets without anyone's permission. Exciting times. 😉;8l8uyj;https://i.redd.it/94fco41zsdz01.jpg
