body;score;nb_replies;stickied;author;id;post_title;post_id;post_link
"I totally agree with you. And I think the whole crypto world would be better off if BTC and BCH quit bickering with eachother.

I think in the long run, BTC and BCH will be seen as successful projects that helped test out two different ideas for scaling.";3;0;False;CypressBreeze;dyidyfe;"Am I the only one that doesn't mind Bitcoin Cash being called ""Bitcoin Cash"" instead of just ""Bitcoin"" (for now)?";8h7l37;https://www.reddit.com/r/btc/comments/8h7l37/am_i_the_only_one_that_doesnt_mind_bitcoin_cash/
For me it's simple. Bitcoin Cash is Bitcoin Cash and Bitcoin is Bitcoin.;5;0;False;ReCrunch;dyijrlg;"Am I the only one that doesn't mind Bitcoin Cash being called ""Bitcoin Cash"" instead of just ""Bitcoin"" (for now)?";8h7l37;https://www.reddit.com/r/btc/comments/8h7l37/am_i_the_only_one_that_doesnt_mind_bitcoin_cash/
"Why does BCH always try to take stuff that wasn't theirs to begin with. You wanna steal the Bitcoin name, the piratebay.

Create your own shit. Damn";5;0;False;RandyNachoManCabbage;dyiix5y;"Am I the only one that doesn't mind Bitcoin Cash being called ""Bitcoin Cash"" instead of just ""Bitcoin"" (for now)?";8h7l37;https://www.reddit.com/r/btc/comments/8h7l37/am_i_the_only_one_that_doesnt_mind_bitcoin_cash/
So troll.;1;0;False;iammelea;dyj4q9l;"Am I the only one that doesn't mind Bitcoin Cash being called ""Bitcoin Cash"" instead of just ""Bitcoin"" (for now)?";8h7l37;https://www.reddit.com/r/btc/comments/8h7l37/am_i_the_only_one_that_doesnt_mind_bitcoin_cash/
why can't we just do both? segwit bigger blocks and lightning network, why split and fight;1;0;False;;dyiyirt;"Am I the only one that doesn't mind Bitcoin Cash being called ""Bitcoin Cash"" instead of just ""Bitcoin"" (for now)?";8h7l37;https://www.reddit.com/r/btc/comments/8h7l37/am_i_the_only_one_that_doesnt_mind_bitcoin_cash/
"There is no confusion, the name is bitcoin cash and the official website is bitcoincash.org.

I refer to both as BCH and BTC often, personally I think this whole discussion is misplaced because I never saw anyone marketing BCH as BTC. Calling BCH ""bitcoin"" is not wrong at all, because it is bitcoin, same for BTC.

I find helpful to distinguish ""bitcoin cash"" from ""bitcoin core"" (a core's project, ""bitcoin core"" ipso facto). 

While everybody is complaining about names, bitcoin.org is marketing BTC wrongfully, but you don't see a swarm of trolls posting it everywhere.

http://bitcoin.org  german, spanish, korean, japanese, chinese versions as examples:

""Geringe bis keine Transaktionskosten""

“Comisiones muy bajas o inexistentes”

""무료 또는 낮은 수수료""

""ゼロあるいは安価な 手数料""

""零或极低的 手续费""

""幾乎為零的 手續費""

All of them saying more or less ''*zero* to very low fees''=scamming people.

In english

""Low processing fees"" which is also false.";1;0;False;rdar1999;dyivnvg;"Am I the only one that doesn't mind Bitcoin Cash being called ""Bitcoin Cash"" instead of just ""Bitcoin"" (for now)?";8h7l37;https://www.reddit.com/r/btc/comments/8h7l37/am_i_the_only_one_that_doesnt_mind_bitcoin_cash/
"Bitcoin Cash respresents a return to the original Bitcoin design, as it ran for 8 years, and it uses the historical Bitcoin ledger (no investors were disenfranchised, sound money was preserved). This is the ""BCH is Bitcoin"" aspect that needs to be emphasized, not some metaphysical or semantic war. 

That said, keeping in mind that every new 10x surge in adoption and price comes almost entirely from NEW users, businesses and investors, there is probably a system bias among us oldtimers toward overestimating how important the name is. New people do care that it's a stable ledger with 9 years of history, but I think most care more that it is cheap, fast, secure, reliable and eminently useful in a wide array of situations.";2;0;False;ForkiusMaximus;dyj1zx7;"Am I the only one that doesn't mind Bitcoin Cash being called ""Bitcoin Cash"" instead of just ""Bitcoin"" (for now)?";8h7l37;https://www.reddit.com/r/btc/comments/8h7l37/am_i_the_only_one_that_doesnt_mind_bitcoin_cash/
I wish more people thought like you. Maybe a lot of us do? I think there is a vocal minority that think rather highly of themselves that are hellbent on taking over Bitcoin \(at least in name\). It has rubbed me the wrong way since the fork. Live and let live. Let them both succeed and prosper. Perhaps in the future there will be a need for both chains. If not, one will naturally die off. ;2;0;False;ben2d;dyiss63;"Am I the only one that doesn't mind Bitcoin Cash being called ""Bitcoin Cash"" instead of just ""Bitcoin"" (for now)?";8h7l37;https://www.reddit.com/r/btc/comments/8h7l37/am_i_the_only_one_that_doesnt_mind_bitcoin_cash/
well said;2;0;False;FaisalFEF;dyiu4es;"Am I the only one that doesn't mind Bitcoin Cash being called ""Bitcoin Cash"" instead of just ""Bitcoin"" (for now)?";8h7l37;https://www.reddit.com/r/btc/comments/8h7l37/am_i_the_only_one_that_doesnt_mind_bitcoin_cash/
Do you have a choice?;2;0;False;Kinggfx;dyio90w;"Am I the only one that doesn't mind Bitcoin Cash being called ""Bitcoin Cash"" instead of just ""Bitcoin"" (for now)?";8h7l37;https://www.reddit.com/r/btc/comments/8h7l37/am_i_the_only_one_that_doesnt_mind_bitcoin_cash/
"I also do not mind calling Bitcoin Cash ""bcash"". it's smooth and fast.";4;0;False;Hanspanzer;dyig1tg;"Am I the only one that doesn't mind Bitcoin Cash being called ""Bitcoin Cash"" instead of just ""Bitcoin"" (for now)?";8h7l37;https://www.reddit.com/r/btc/comments/8h7l37/am_i_the_only_one_that_doesnt_mind_bitcoin_cash/
"I think the people who care the most what it's called are from BTC.

Personally I don't care what other people think about my preferred naming scheme. ";1;0;False;;dyij9ps;"Am I the only one that doesn't mind Bitcoin Cash being called ""Bitcoin Cash"" instead of just ""Bitcoin"" (for now)?";8h7l37;https://www.reddit.com/r/btc/comments/8h7l37/am_i_the_only_one_that_doesnt_mind_bitcoin_cash/
Core and Cash software run on the same network. Try not to make things more confusing on purpose.;1;2;False;Big_Bubbler;dyj9g5i;"Am I the only one that doesn't mind Bitcoin Cash being called ""Bitcoin Cash"" instead of just ""Bitcoin"" (for now)?";8h7l37;https://www.reddit.com/r/btc/comments/8h7l37/am_i_the_only_one_that_doesnt_mind_bitcoin_cash/
I like it being called Bitcoin Cash, good reminder of what happened. Never forget.;1;0;False;ValiumMm;dyixkml;"Am I the only one that doesn't mind Bitcoin Cash being called ""Bitcoin Cash"" instead of just ""Bitcoin"" (for now)?";8h7l37;https://www.reddit.com/r/btc/comments/8h7l37/am_i_the_only_one_that_doesnt_mind_bitcoin_cash/
Fight the toxic dipshits who hijacked the project and ruined the brand every step of the way. Don't let the cult of core get away with their crimes. Fuck theymos and his thugs. Resist them now and forever. ;1;0;False;lightrider44;dyizoj4;"Am I the only one that doesn't mind Bitcoin Cash being called ""Bitcoin Cash"" instead of just ""Bitcoin"" (for now)?";8h7l37;https://www.reddit.com/r/btc/comments/8h7l37/am_i_the_only_one_that_doesnt_mind_bitcoin_cash/
This;2;0;False;;dyimoph;"Am I the only one that doesn't mind Bitcoin Cash being called ""Bitcoin Cash"" instead of just ""Bitcoin"" (for now)?";8h7l37;https://www.reddit.com/r/btc/comments/8h7l37/am_i_the_only_one_that_doesnt_mind_bitcoin_cash/
To me, Bitcoin is what Bitcoin was before the scaling debate. Bitcoin Core is what Blockstream made it after the split, and Bitcoin Cash is what the BCH teams made it after the split. I don't care if they keep those names, and even if BCH were to gain immensely compared to BTC, I'd likely still keep calling them Bitcoin Cash and Bitcoin Core.;1;0;False;Dekker3D;dyj0vlb;"Am I the only one that doesn't mind Bitcoin Cash being called ""Bitcoin Cash"" instead of just ""Bitcoin"" (for now)?";8h7l37;https://www.reddit.com/r/btc/comments/8h7l37/am_i_the_only_one_that_doesnt_mind_bitcoin_cash/
"Totally agree. Stop worrying about what is and isn't the ""real"" bitcoin and just grow Bitcoin Cash into a dominant force in the market.";2;0;False;minomes;dyio4ex;"Am I the only one that doesn't mind Bitcoin Cash being called ""Bitcoin Cash"" instead of just ""Bitcoin"" (for now)?";8h7l37;https://www.reddit.com/r/btc/comments/8h7l37/am_i_the_only_one_that_doesnt_mind_bitcoin_cash/
The vote brigading is strong in this thread.;1;0;False;fossiltooth;dyjk667;"Am I the only one that doesn't mind Bitcoin Cash being called ""Bitcoin Cash"" instead of just ""Bitcoin"" (for now)?";8h7l37;https://www.reddit.com/r/btc/comments/8h7l37/am_i_the_only_one_that_doesnt_mind_bitcoin_cash/
I agree with OP;2;0;False;ViperfishAU;dyimns8;"Am I the only one that doesn't mind Bitcoin Cash being called ""Bitcoin Cash"" instead of just ""Bitcoin"" (for now)?";8h7l37;https://www.reddit.com/r/btc/comments/8h7l37/am_i_the_only_one_that_doesnt_mind_bitcoin_cash/
calling it different names will not bring anything positive, it will just create confusion. Until one dies, bitcoin will be bitcoin and bitcoin cash will be bitcoin cash. Trying to present one as the other is not the right way to push adoption;2;0;False;sovuljaner;dyibetr;"Am I the only one that doesn't mind Bitcoin Cash being called ""Bitcoin Cash"" instead of just ""Bitcoin"" (for now)?";8h7l37;https://www.reddit.com/r/btc/comments/8h7l37/am_i_the_only_one_that_doesnt_mind_bitcoin_cash/
Personally i prefer the shortened name bcash. Rolls off the tounge easily.;1;0;False;macka598;dyiot69;"Am I the only one that doesn't mind Bitcoin Cash being called ""Bitcoin Cash"" instead of just ""Bitcoin"" (for now)?";8h7l37;https://www.reddit.com/r/btc/comments/8h7l37/am_i_the_only_one_that_doesnt_mind_bitcoin_cash/
Nope. I just refer to it as bcash...so much more easier to say and just rolls off the tongue.;0;0;False;HenryK81;dyiqy3e;"Am I the only one that doesn't mind Bitcoin Cash being called ""Bitcoin Cash"" instead of just ""Bitcoin"" (for now)?";8h7l37;https://www.reddit.com/r/btc/comments/8h7l37/am_i_the_only_one_that_doesnt_mind_bitcoin_cash/
">Am I the only one that doesn't mind Bitcoin Cash being called ""Bitcoin Cash"" instead of just ""Bitcoin"" (for now)?


No.  Its mostly you and every Bitcoin Core troll.  There are a few of them, though we're not sure how many actual individual humans.  If we look at the Bitcoin.com lawsuit, there were over 3k upvotes on one thread and another thread claiming ""600"" people were starting the lawsuit.  When reality took over and their vote-brigading took a back seat, it ended up being 31 people.  

By the way, nice job giving them something to upvote to further their anti-BCH hatred.   Your service is appreciated I'm sure.";1;0;False;BitttBurger;dyideco;"Am I the only one that doesn't mind Bitcoin Cash being called ""Bitcoin Cash"" instead of just ""Bitcoin"" (for now)?";8h7l37;https://www.reddit.com/r/btc/comments/8h7l37/am_i_the_only_one_that_doesnt_mind_bitcoin_cash/
"downvoted because of shilling propaganda and concern trolling

Bitcoin is Bitcoin Cash, deal with it";1;0;False;1Hyena;dyj7uoi;"Am I the only one that doesn't mind Bitcoin Cash being called ""Bitcoin Cash"" instead of just ""Bitcoin"" (for now)?";8h7l37;https://www.reddit.com/r/btc/comments/8h7l37/am_i_the_only_one_that_doesnt_mind_bitcoin_cash/
I call them Bitcoin Cash and bitcoin core just to differentiate.  Even though I know Bitcoin Cash is Bitcoin.;1;0;False;xmr4dwin;dyino0y;"Am I the only one that doesn't mind Bitcoin Cash being called ""Bitcoin Cash"" instead of just ""Bitcoin"" (for now)?";8h7l37;https://www.reddit.com/r/btc/comments/8h7l37/am_i_the_only_one_that_doesnt_mind_bitcoin_cash/
"I think it's best for the cryptocurrency industry as a whole if no currency calls itself ""Bitcoin"". 

In my opinion, it's more important that the other bitcoin be called something other than just ""bitcoin"". Call it ""Bitcoin Core"", or ""Bitcoin Legacy"" or ""Bcore"" or whatever, just as long as it's not just simply ""Bitcoin"". Calling BCH ""Bitcoin (BCH)"" adds just enough confusion that people will start calling the other Bitcoin something else.";1;0;False;freework;dyj4nnp;"Am I the only one that doesn't mind Bitcoin Cash being called ""Bitcoin Cash"" instead of just ""Bitcoin"" (for now)?";8h7l37;https://www.reddit.com/r/btc/comments/8h7l37/am_i_the_only_one_that_doesnt_mind_bitcoin_cash/
"You can call Coke Zero ""Coca-Cola"" as much as you want, but it will never be Coca-Cola. This sub is trying to gaslight the world into believing a lie, it's ridiculous.";8;1;False;ImInLoveWithMyBike;dyieki6;"Am I the only one that doesn't mind Bitcoin Cash being called ""Bitcoin Cash"" instead of just ""Bitcoin"" (for now)?";8h7l37;https://www.reddit.com/r/btc/comments/8h7l37/am_i_the_only_one_that_doesnt_mind_bitcoin_cash/
Couldn't agree more. From a technological standpoint I think BCH has the better hand. The fucking politics, name calling, namejacking and all the drama that comes with it is, in my opinion, detrimental to all of us. ;3;0;False;DevionNL;dyie08l;"Am I the only one that doesn't mind Bitcoin Cash being called ""Bitcoin Cash"" instead of just ""Bitcoin"" (for now)?";8h7l37;https://www.reddit.com/r/btc/comments/8h7l37/am_i_the_only_one_that_doesnt_mind_bitcoin_cash/
"No, someone altered the code and tricked the masses into calling their crippled altcoin ""bitcoin"", killing the original Bitcoin in the process; then right  before a particularly bad modification was about to go online, a group of various big players, miners, devs, businesses etc, decided that enough was enough, and revived the original Bitcoin, but unfortunately, they did not had the level of power over the flow of information to the masses to be able to instantly reclaim the ""Bitcoin"" name, the revived Bitcoin is what for the moment is more well known as Bitcoin Cash.";5;1;False;TiagoTiagoT;dyiuzzh;"Am I the only one that doesn't mind Bitcoin Cash being called ""Bitcoin Cash"" instead of just ""Bitcoin"" (for now)?";8h7l37;https://www.reddit.com/r/btc/comments/8h7l37/am_i_the_only_one_that_doesnt_mind_bitcoin_cash/
This sub is like a hydra mutating and warping with every passing week.;6;0;False;thinkscout;dyikep2;"Am I the only one that doesn't mind Bitcoin Cash being called ""Bitcoin Cash"" instead of just ""Bitcoin"" (for now)?";8h7l37;https://www.reddit.com/r/btc/comments/8h7l37/am_i_the_only_one_that_doesnt_mind_bitcoin_cash/
Bitcoin Core is the software, Bitcoin is the network. Why make things even more confusing? You already have a BCH forum on r/BTC, I dont think you need any more confussion. What mess have you guys got yourself into? [Bring the downvote];24;2;False;Trentw;dyipawa;"Am I the only one that doesn't mind Bitcoin Cash being called ""Bitcoin Cash"" instead of just ""Bitcoin"" (for now)?";8h7l37;https://www.reddit.com/r/btc/comments/8h7l37/am_i_the_only_one_that_doesnt_mind_bitcoin_cash/
"I'm one of those who post on both subs and don't particularly want to be banned from either. I don't have such concerns on twitter where I follow Bitcoin Cash and the controversies re SM. I'm more interested in finding those few people who have something worthwhile to say about whatever.

Not owning either coin (at the moment) just makes it easier to do so. The civil war will end eventually and most will get over it and move on. It was briefly fun to troll the obvious trolls but I got over that fast.

Went back and read the whitepaper (again) as I've also heard rumors that it needs to be 'upgraded' of all things as it doesn't reflect the 'upgrades' to Bitcoin! Surely that's more important that trying to 'steal' the name. Just not interested in going to war over it though it's a point worth  making to all newcomers- but rumors need to be substantiated. Choose the battles you can win. That's all";0;0;False;GoLookingGlass;dyid6n8;"Am I the only one that doesn't mind Bitcoin Cash being called ""Bitcoin Cash"" instead of just ""Bitcoin"" (for now)?";8h7l37;https://www.reddit.com/r/btc/comments/8h7l37/am_i_the_only_one_that_doesnt_mind_bitcoin_cash/
"It's about the whitepaper as much as it's about the code. Bitcoin Cash holds the whitepaper to be 'sacrosanct' and changing  it to reflect 'reality' may become a future battle in this war particularly over LN - but the war (chain split) more or less started with the insistence that Segwit was 'necessary' (for LN), also over scaling, hard vs soft forks and over the role of the miners and mining hardware. And that's just a brief overview of the controversies.

It's about interpreting the 'gospel' of SN (and even the  role of SN) which was always going to happen anyway just that nobody seems to have realized that before he left and he didn't exactly offer a lot of guidance either. Maybe he was too modest to realize that he would become something of an icon to many - but not to all - because his role and his anonymity has become a point of contention before anyone truly knows what and where this is all leading to.";3;0;False;GoLookingGlass;dyif4zx;"Am I the only one that doesn't mind Bitcoin Cash being called ""Bitcoin Cash"" instead of just ""Bitcoin"" (for now)?";8h7l37;https://www.reddit.com/r/btc/comments/8h7l37/am_i_the_only_one_that_doesnt_mind_bitcoin_cash/
*trying to kill the original Bitcoin in the process...;3;1;False;Big_Bubbler;dyj9qld;"Am I the only one that doesn't mind Bitcoin Cash being called ""Bitcoin Cash"" instead of just ""Bitcoin"" (for now)?";8h7l37;https://www.reddit.com/r/btc/comments/8h7l37/am_i_the_only_one_that_doesnt_mind_bitcoin_cash/
"Totally agree with you. 

One issue is the “Bitcoin Cash = Bitcoin” crowd seems to not have a strict definition of what “Bitcoin” is. Before, it was [Gavin’s definition](http://gavinandresen.ninja/a-definition-of-bitcoin) which basically says “the longest chain wins”. For a while that’s what Bitcoin XT etc was going for. After that since BCH is clearly not the longest chain there’s an evolved definition about the “original” protocol but that is a loose concept too as a lot of the transaction types we use these days came from forks after the original white paper. It’s hard to argue what a name means when there is no concise definition of said term.

Also, Bitcoin Cash came from a lack of consensus especially from miners. The fork initially clearly branded itself as “Bitcoin Cash”, even though it puts itself as closer to the original vision. This rebranding itself as “Bitcoin” un-ironically is actually making the coin lose credibility and reputation among the greater crypto crowd. It also adds unnecessary confusion in regular discussions. E.g. Ethereum Classic doesn’t say it is “Ethereum” without extra qualifications. Like it or not, it was Bitcoin Cash’s decision to fork and given it is still a minority hash chain I can’t really say “Bitcoin Cash is Bitcoin” with a straight face. I will say it’s my preferred protocol that fulfills what Bitcoin’s vision more though. 

And also, this naming debate just seems to detract from the more important issues.";13;0;False;y-c-c;dyigpk6;"Am I the only one that doesn't mind Bitcoin Cash being called ""Bitcoin Cash"" instead of just ""Bitcoin"" (for now)?";8h7l37;https://www.reddit.com/r/btc/comments/8h7l37/am_i_the_only_one_that_doesnt_mind_bitcoin_cash/
"every branch may (and should) fight to be the best branch of bitcoin, but there will only be one bitcoin.  i hope someday to use bitcoin.peopleb4things and it is the best bitcoin.  but it would still be the peopleb4things bitcoin, not just bitcoin.

you may not view them as products but by definition it is a product with advantages and disadvantages within branches. 
 a product that we the people, buy or mine to use, as electronic cash, within the peer to peer system.";1;1;False;nooglide;dyibryj;"Am I the only one that doesn't mind Bitcoin Cash being called ""Bitcoin Cash"" instead of just ""Bitcoin"" (for now)?";8h7l37;https://www.reddit.com/r/btc/comments/8h7l37/am_i_the_only_one_that_doesnt_mind_bitcoin_cash/
"since we are talking about the name and not the better technology - there is a bitcoin project, its here:

https://github.com/bitcoin/bitcoin

BCH working on a descendant of the bitcoin project, they even say it on their page ""Bitcoin Cash is a descendant of Bitcoin.""

https://github.com/Bitcoin-ABC/bitcoin-abc

";3;1;False;nooglide;dyjb58w;"Am I the only one that doesn't mind Bitcoin Cash being called ""Bitcoin Cash"" instead of just ""Bitcoin"" (for now)?";8h7l37;https://www.reddit.com/r/btc/comments/8h7l37/am_i_the_only_one_that_doesnt_mind_bitcoin_cash/
"Calling Bitcoin Cash ""Bitcoin"" is deceiving. I understand the history of BTC and BCH but for the sake of clarity of online discussions, people should call them with their appropriate name or ticker.

In time, if the BTC experiment fail and BCH prevail, then a discussion about renaming BCH to BTC would be relevant.";14;0;False;InstinctDT;dyihw1r;"Am I the only one that doesn't mind Bitcoin Cash being called ""Bitcoin Cash"" instead of just ""Bitcoin"" (for now)?";8h7l37;https://www.reddit.com/r/btc/comments/8h7l37/am_i_the_only_one_that_doesnt_mind_bitcoin_cash/
"Massive effort to keep on calling bitcoin bitcoin? Users, exchanges, merchants etc all just had to keep on using the clients and name as they always had, so theres no need for a ""massive effort"" for bitcoin to keep on being what it always has been. The bitcoin literally had to do nothing to keep the name as there is no confusion.  Outside of this crazy sub there is zero confusion as to what is bitcoin. The confusion only exists here, @bitcoin and on bitcoin.com.

Tricking people into thinking that there are now two bitcoins, and both are equally valid, and actually the ""new one"" is the ""realest"". Now theres a massive effort.";-1;1;False;slashfromgunsnroses;dyivxvx;"Am I the only one that doesn't mind Bitcoin Cash being called ""Bitcoin Cash"" instead of just ""Bitcoin"" (for now)?";8h7l37;https://www.reddit.com/r/btc/comments/8h7l37/am_i_the_only_one_that_doesnt_mind_bitcoin_cash/
"""objectively fact"" rofl.";3;1;False;youngrubin;dyiyvpr;"Am I the only one that doesn't mind Bitcoin Cash being called ""Bitcoin Cash"" instead of just ""Bitcoin"" (for now)?";8h7l37;https://www.reddit.com/r/btc/comments/8h7l37/am_i_the_only_one_that_doesnt_mind_bitcoin_cash/
"I'm simply not going to give up the name to those thieves. 

It continues the conflict? Good. They're still fighting and if your side gives up it's just a slaughter.";2;0;False;Thorbinator;dyiff7x;"Am I the only one that doesn't mind Bitcoin Cash being called ""Bitcoin Cash"" instead of just ""Bitcoin"" (for now)?";8h7l37;https://www.reddit.com/r/btc/comments/8h7l37/am_i_the_only_one_that_doesnt_mind_bitcoin_cash/
"Right. That's why there's Bitcoin and there's also Bitcoin Cash. Just as there was Bitcoin Gold before and no one needed ""Core"" added to tell the differences. ";1;0;False;timmy12688;dyie21l;"Am I the only one that doesn't mind Bitcoin Cash being called ""Bitcoin Cash"" instead of just ""Bitcoin"" (for now)?";8h7l37;https://www.reddit.com/r/btc/comments/8h7l37/am_i_the_only_one_that_doesnt_mind_bitcoin_cash/
"Funny how you say ""stooping to their level"" but insist on calling it Bitcoin ""Core""";1;1;False;timmy12688;dyidyce;"Am I the only one that doesn't mind Bitcoin Cash being called ""Bitcoin Cash"" instead of just ""Bitcoin"" (for now)?";8h7l37;https://www.reddit.com/r/btc/comments/8h7l37/am_i_the_only_one_that_doesnt_mind_bitcoin_cash/
"> ""bcash"" was started as a direct attack by trolls to rename the project from the first hour of the fork

Hold up, like it or not the term bcash was first suggested here in /r/btc at the same time as Bitcoin Cash. It's used as a derogatory basically ever since then but let's not get all revisionist here and claim that they actually came up with the term instead of just embracing it. I doubt anyone would even care anymore if bcash didn't turn into a meme to piss off Roger.

As far as bcash taking off organically is concerned, that's not a hypothetical, it was suggested since day one and basically everyone agreed that Bitcoin Cash was a better name. Either you recently created a new throwaway account, or more likely, you weren't here when this originally happened.

bcash wouldn't even be mentioned at this point if Roger hadn't acted like a literal 5 year old and thrown a tantrum about it.";2;0;False;MertsA;dyium18;"Am I the only one that doesn't mind Bitcoin Cash being called ""Bitcoin Cash"" instead of just ""Bitcoin"" (for now)?";8h7l37;https://www.reddit.com/r/btc/comments/8h7l37/am_i_the_only_one_that_doesnt_mind_bitcoin_cash/
"true.

this drama sucks.";9;0;False;SpacePip;dyighrj;"Am I the only one that doesn't mind Bitcoin Cash being called ""Bitcoin Cash"" instead of just ""Bitcoin"" (for now)?";8h7l37;https://www.reddit.com/r/btc/comments/8h7l37/am_i_the_only_one_that_doesnt_mind_bitcoin_cash/
Yes! Ive done that too. bcash and bcore, lol;4;0;False;pacman78;dyixf4f;"Am I the only one that doesn't mind Bitcoin Cash being called ""Bitcoin Cash"" instead of just ""Bitcoin"" (for now)?";8h7l37;https://www.reddit.com/r/btc/comments/8h7l37/am_i_the_only_one_that_doesnt_mind_bitcoin_cash/
"Please start the campaign over on r/bitcoin to make it a neutral ground without censorship with all new neutral mods, in return we will give up r/btc to become the Bitcoin core sanctioned censor zone and those that want to can move to a Bitcoin cash only sub. I am sure ""community consensus"" will be easy to reach over there. ";9;1;False;cheaplightning;dyiw6my;"Am I the only one that doesn't mind Bitcoin Cash being called ""Bitcoin Cash"" instead of just ""Bitcoin"" (for now)?";8h7l37;https://www.reddit.com/r/btc/comments/8h7l37/am_i_the_only_one_that_doesnt_mind_bitcoin_cash/
